title,media_name,source,abstract,article_url,comment_count,like_count,share_url,publish_time,tag
中非合作论坛|习近平会见塞拉利昂总统比奥,新华社,新华社,新华社北京9月4日电（记者邵艺博、丁静）9月4日上午，国家主席习近平在北京人民大会堂会见来华出席中非合作论坛北京峰会的塞拉利昂总统比奥。习近平指出，中非合作论坛由中非人民共商、共建、共享，不仅成为推进中非务实合作的有效机制，更成为南南合作的一面旗帜。,http://api.xinhua-news.com/newroute/newsdetail/101002024090470000556?dest=AUH6xeBVVL9qBHV1uy5G-DHCyIvNLh7ySyCiYXcDXgZU,82,688,http://toutiao.com/group/7410606010295992872/?app=news_article&is_hit_share_recommend=0,1725416174,
中非合作论坛|习近平同塞内加尔总统法耶会谈,新华社,新华社,9月4日上午，国家主席习近平在北京人民大会堂同来华出席中非合作论坛北京峰会并进行国事访问的塞内加尔总统法耶举行会谈。,http://api.xinhua-news.com/newroute/newsdetail/101002024090470001208?dest=AGC85YCAlCdoSHAi-YMyRfuDsr_rR0k2K1oOUxQIFpRQ,6,35,http://toutiao.com/group/7410638984696578586/?app=news_article&is_hit_share_recommend=0,1725423855,
后续：路虎女连倒三把仍被别 转折背后有何故事？详细视频对话曝光,周珊合,周珊合,"各位亲爱的朋友，你们好！欢迎来到""周珊合热评站""的文章，承蒙大家对珊合的支持，珊合衷心祝愿大家平安如意。你们的每一个点赞和评论都是珊合不断前进的动力！青岛路虎女事件最近青岛出了个挺热闹的事儿。有个开路虎的女司机，逆行还打人。现在被警察给拘留了，可不是像之前传的在家待着。",https://toutiao.com/group/7410241183013765672/,16,1,http://toutiao.com/a7410241183013765672/?app=news_article&is_hit_share_recommend=0,1725336622,
事大了！官方造假回应，上级通报打脸：情况属实，已启动问责程序,小微微说事965点赞,小微微说事965点赞,"上班时间集体""睡美人"",这届公务员有点懒上班时睡觉,下班不积极,这帮公职人员咋这么""困""!某地一群公务员上班时间集体躺平睡大觉,被曝光后还敢狡辩造假,结果被上级一纸通报啪啪打脸。说到这,小微不禁想问:公职人员的责任心都睡没了吗?这些公务员的行为实在让人无语。",https://toutiao.com/group/7410434765892911668/,58,99,http://toutiao.com/a7410434765892911668/?app=news_article&is_hit_share_recommend=0,1725376953,
爷爷奶奶全款给15岁孙子买下一套房，房产证上只写了孙子的名字，妈妈：全款付了，房产证上只有他的名字,后浪视频,后浪视频,爷爷奶奶全款给15岁孙子买下一套房，房产证上只写了孙子的名字，妈妈：全款付了，房产证上只有他的名字。在生活的长河中，总有一些温暖的故事令人动容。近日，一位妈妈发布的视频在网上引发了热烈讨论。视频中，这位妈妈满是欣喜地分享着自己 15 岁的孩子拥有了人生第一套房子的喜讯。,https://toutiao.com/group/7405903768111383040/,1863,1723,http://toutiao.com/a7405903768111383040/?app=news_article&is_hit_share_recommend=0,1724322195,
安徽美女道士胡小慧被捕，精通“胡媚术”，九名男徒弟揭露其罪行,与君説,与君説,在阅读此文之前，麻烦您点击一下“关注”，既方便您进行讨论和分享，又能给您带来不一样的参与感，感谢您的支持文、编辑|小娄自古以来，中国人对于道观、寺庙这类地方都是十分敬重的。然而，令人没想到的是，有人却将道观和里面的道士一起告上了法庭。,https://toutiao.com/group/7409941310439784970/,8,173,http://toutiao.com/a7409941310439784970/?app=news_article&is_hit_share_recommend=0,1725262374,
这场景武松看了都傻眼，网友：双方都不了解对方的实力,星沙时报,星沙时报,,https://toutiao.com/group/7392888338900615689/,1715,10274,https://m.toutiaoimg.cn/a7392888338900615689/?app=news_article&is_hit_share_recommend=0,1721290950,
若有战，召必回！百余名退役士兵在车站齐唱《歌唱祖国》,济南时报-新黄河,济南时报-新黄河,若有战，召必回！百余名退役士兵在车站齐唱《歌唱祖国》,https://cdnjdout.aikan.pdnews.cn/zhbj-20240903/gather/95931d50f3c745eb8c1676787408d70e_opt.mp4,426,763,https://m.toutiaoimg.cn/group/7410393797449744936/?app=news_article&is_hit_share_recommend=0,1725366757,
真是丧尽天良的事，恳请大家看完这段毛骨悚然的视频。,聪聪人生路,聪聪人生路,,https://toutiao.com/group/7410365114315964928/,0,9,https://m.toutiaoimg.cn/a7410365114315964928/?app=news_article&is_hit_share_recommend=0,1725360079,
种了25亩的小麦，卖了21万多，这个价格让人难以想象，你们相信吗,笑笑情感正能量,笑笑情感正能量,,https://toutiao.com/group/7410272834271838757/,3718,2685,https://m.toutiaoimg.cn/a7410272834271838757/?app=news_article&is_hit_share_recommend=0,1725338593,
