title,publish_time,like_count,comment_count,media_name,source,abstract,article_url,tag,is_yaowen,article_sub_type,has_video
甘肃白银一养殖户40多只羊失踪，怀疑有人雪夜到羊圈偷盗，警方正调查,2024-12-11 10:05,560,280,极目新闻,极目新闻,极目新闻记者 舒隆焕12月11日，甘肃白银市村民高先生向极目新闻反映，自家羊圈里的山羊丢了40多只，他怀疑有人趁10日凌晨下雪偷了羊，已报警。高先生家的羊群（视频截图）高先生今年30岁，家住白银市白银区强湾乡某村庄，在外务工多年后回乡创业，与父母一起养了数百只羊。,http://jms.ctdsb.net/jmythshare/#/index_share?cId=0&contentType=5&contentId=2326555,,0,0,False
遍地开花的俄罗斯商品馆，打着进口旗号卖国货？加盟总部称80%系进口，火腿列巴等产自东北,2024-12-11 00:32,1341,702,看看新闻,看看新闻,遍地开花的俄罗斯商品馆，打着进口旗号卖国货？加盟总部称80%系进口，火腿列巴等产自东北,http://mediaplay.kksmg.com/2024/12/11/h264_720p_600k_78163-smgnews-20241211065500-9000-960313-600k_mp4.mp4,,0,0,True
女友怀孕了，男友不装了，带她回豪宅！,2024-11-23 08:01,11960,945,乐视大综艺咖,乐视大综艺咖,,https://toutiao.com/group/7440353629540483593/,,0,0,True
河南警察3岁女儿被拐，苦寻全国23年无果，结果却发现女儿在对门,2024-11-05 07:43,3781,393,八号探秘人,八号探秘人,寻亲23年无果，丢失的女儿竟住在对门?但它却真实发生在河南洛阳的梁绍波身上。是意外走丢，还是人贩子所为，三岁的女儿怎会离奇失踪?,https://toutiao.com/group/7433697108120142345/,,0,0,False
悲剧！山东情侣凌晨跳河身亡，女孩个子很高，知情人透露：男的先跳，女孩紧随其后！,2024-12-11 13:47,267,176,经济资讯,经济资讯,在山东菏泽牡丹区，近日发生了一件令人痛心疾首的事情。有消息在网络上传播开来，说是在凌晨时分，有一男一女跳河身亡了。从那网传的视频截图里，能清楚地看到当时的场景。救援人员在河岸边上，正努力地把一名女子从河水里往外拉。那女子留着长长的头发，穿着黑色的背带裤，身材看起来颇为高挑。,https://toutiao.com/group/7447147411950076470/,,0,0,False
美国霸权是世界乱源，拜登卸任前把天下搞大乱，遍地烽火生民涂炭,2024-12-09 06:01,20178,929,邱毅台湾,邱毅台湾,,https://toutiao.com/group/7446288140483953152/,,0,0,True
弟弟光荣退伍，姐姐兴奋去车站接他，怎料一见弟弟瞬间哭了,2024-11-05 06:34,32717,3000,乐视天天剧好看,乐视天天剧好看,,https://toutiao.com/group/7433679820573934091/,,0,0,True
特朗普亮明立场，拒绝承诺协防台湾，两大信号直击中美未来风向？,2024-12-11 06:49,12769,135,邱震海,邱震海,,https://toutiao.com/group/7447042931304858148/,,0,0,True
包厢全是刚出狱的恶霸，结果一看到饭店主厨，立马怂了,2024-11-11 01:21,12674,354,乐视群星访谈秀,乐视群星访谈秀,,https://toutiao.com/group/7435825833048015400/,,0,0,True
陕西通报：不要买、不要吃！,2024-12-06 07:08,5398,1969,闽南网,闽南网,近期，陕西省市场监督管理局组织对淀粉及淀粉制品、炒货食品及坚果制品、蜂产品、糕点、食用油、油脂及其制品、乳制品、肉制品、方便食品、茶叶及相关制品、餐饮食品10大类食品1677批次样品进行了食品安全监督抽检，其中淀粉及淀粉制品、炒货食品及坚果制品、蜂产品、糕点4大类7批次样品不合格，检出超范围超限量使用食品添加剂、质量指标不达标、禁用兽药的问题。,https://toutiao.com/group/7445192096975307302/,,0,0,False
泽连斯基命令俄境内乌军死守，他提出停战方案，普京不同意？,2024-12-08 04:00,16385,267,邱毅台湾,邱毅台湾,,https://toutiao.com/group/7445206239379718708/,,0,0,True
早期经典港片，刘嘉玲真是太拼了，连刘青云都看傻眼了！,2024-11-29 08:22,1489,271,南瓜说异,南瓜说异,,https://toutiao.com/group/7442613621286240777/,,0,0,True
许家印，突传大消息！,2024-12-11 11:22,1701,556,上观新闻,上观新闻,恒大清盘人正在穷尽手段追索资产。12月11日，据港媒消息，恒大清盘人安迈（Alvarez & Marsal）已接管许家印名下持有私人飞机的离岸实体公司，并将飞机挂牌出售。该飞机的机龄14年，为空客A319型号，大小与商用客机相当，目前停泊在广州。,https://export.shobserver.com/toutiao/html/828430.html,,0,1,False
叙利亚变天，谁赢谁输？(上),2024-12-10 03:05,12952,584,静思有我,静思有我,,https://toutiao.com/group/7446614119396704809/,,0,0,True
炸肉丸子，到底用淀粉还是面粉，教你一招，外酥里软超好吃,2024-10-01 09:23,6332,475,家常的味道,家常的味道,,https://toutiao.com/group/7420735473208787492/,,0,0,True
天冷电动车充满电，一加油门就掉2格，不怪电池，真实原因告诉你,2024-11-26 05:02,1823,126,新能源战略家,新能源战略家,电动车使用方便、价格便宜，已经成为了不少朋友通勤代步的首选，但在使用过程中偶尔也有让人糟心的问题。像爆胎、刹车不灵敏这类问题可以通过门店维修来解决，但如果遇到电池出现异常情况，不仅问题难以排查，而且维修成本也不低。,https://toutiao.com/group/7441448742575702563/,,0,0,False
姑娘在山洞换衣服，小伙看周围没人，直接霸王硬上弓！,2024-12-05 05:33,728,130,南瓜午夜厅,南瓜午夜厅,,https://toutiao.com/group/7444796602683752971/,,0,0,True
明年起，满18岁男性必须兵役登记！否则影响上大学、找工作,2024-12-09 06:44,17912,15254,大河报,大河报,重要提醒！2025年兵役登记工作将于2025年1月1日开始已经进行过兵役登记，有参军意向的可直接参加网上应征报名。依法服兵役和进行兵役登记是每个适龄公民应尽的光荣义务和神圣责任。《中华人民共和国兵役法》明确国家实行兵役登记制度，每名男性青年在年满18周岁时都要履行兵役登记义务。,https://toutiao.com/group/7446299249363157558/,,0,0,False
冬天洗澡多久一次最好？这4个时候，劝你不要洗,2024-12-07 10:01,2108,280,环球网,环球网,来源：健康杭州 最近杭城的气温 一天天走低 忙活了一整天，洗个热乎乎的澡 再钻进暖暖的被窝，再舒服不过！ 然而不少人洗澡时 或多或少会犯些错 结果把本该舒服又养人的“养生澡”硬生生洗成了“伤身澡”冬天多久洗一次澡最好？洗澡频率主要取决于个体的需求和偏好。,https://3w.huanqiu.com/a/106d4f/4KYr5sh4XfC?agt=20,,0,0,False
给近三年最好10部年代剧排个名：《人世间》仅第6名，第1名没争议,2024-12-07 12:40,1399,305,皮皮电影,皮皮电影,不久前，《小巷人家》完结，虽然高开低走，但依然在水准之上，正午阳光出品，还是有质量保障的。《小巷人家》的热播，也再次唤起观众对年代剧这一类型的关注。年代剧是国剧中的一个重要分支，几乎每年都会出一两部精品，观众可以在年代剧中，感受到岁月流转。,https://toutiao.com/group/7444021041967415818/,,0,0,False
罕见！100年前，英国游客拍下的清朝乡村，和想象中完全不一样,2024-09-20 02:07,8801,769,万物知识局,万物知识局,泥泞的土路，衣不蔽体的老百姓，即便是达官显贵的家中也十分破败，而这些都是清王朝的历史痕迹，虽说那时候中国摄影技术并不发达，但也有许多外国游客来到这里，拍摄下了许多老照片，为我们留下了珍贵的历史资料，那清朝到底是怎样的面貌呢?,https://toutiao.com/group/7416287738871267855/,,0,0,False
近5年最热的十部剧，《狂飙》第9，《繁华》第6，第1名很难超越,2024-12-01 03:58,1023,392,电影烂番茄,电影烂番茄,今天，番叔就结合口碑，给大家盘点一下近五年，热度最高的十部电视剧。第十名:《都挺好》 猫眼热度 9775.8，播出时间2019年。,https://toutiao.com/group/7430845717314273831/,,0,0,False
海南富商张晖：花8亿建108米海上观音像，4年后死在水中死因成谜,2024-10-19 04:49,2702,451,八号探秘人,八号探秘人,在阅读此文之前，辛苦您点击一下“关注”，既方便您进行讨论和分享，又能给您带来不一样的参与感，感谢您的支持！编辑丨xk他是中国的一名富商，耗费8亿元完成了自己的梦想。可梦想落地成为现实的时候，他却在4年后莫名其妙的死去。他就是张晖，上个世纪末海南岛旅游业的龙头当家人。,https://toutiao.com/group/7427288913095492134/,,0,0,False
67岁执意生娃，如今却坐轮椅无法自理，5岁的天赐被迫独立学洗衣,2024-11-04 10:32,8788,2025,睿之悦,睿之悦,2019年，已经67岁的田新菊执意生下了自己的第三个孩子小天赐。那么，现如今5年的时间过去了，这“天赐”的礼物到底是福还是祸呢?,https://toutiao.com/group/7433367394946384435/,,0,0,False
吉林美女带俩娃，嫁给头婚小叔子，婆婆一手撮合，如今过得怎样了,2024-11-01 08:01,5488,1359,睿之悦,睿之悦,说出来可能很多人都不相信，吉林一位带着两个孩子的美女在婆婆的大力撮合下嫁给了自己的小叔子。2020年，这位女子的丈夫因为意外去世，留下了她们孤儿寡母悲痛欲绝。,https://toutiao.com/group/7432216069030363682/,,0,0,False
突发公告：209部集体下架！,2024-12-11 11:47,630,638,环球时报,环球时报,12月11日，抖音安全中心发布《抖音关于打击违规微短剧的公告》，详情如下：抖音致力于打造积极、开放、友善的社区环境，持续推进微短剧内容治理，并定期发布治理公告，鼓励和推广优质微短剧，持续对含有不良价值观导向、违反公序良俗、低俗“擦边”等违规内容的微短剧，以及相关违规账号进行治理。,https://toutiao.com/group/7447119121533125159/,,0,0,False
穷书生被岳父瞧不起，上秒刚解除婚约，下秒圣旨就到！,2024-11-14 12:31,3309,190,乐视典藏金曲汇,乐视典藏金曲汇,,https://toutiao.com/group/7437049712860987938/,,0,0,True
