title,publish_time,like_count,comment_count,media_name,source,abstract,article_url,tag,is_yaowen,article_sub_type,has_video
黎智英香港出庭抖内幕，美国介入，蔡英文参与，还有赵少康金小刀,2024-11-27 09:24,22033,1482,邱毅台湾,邱毅台湾,,https://toutiao.com/group/7441887559757595190/,,0,0,True
特务男扮女装混进村子，孩子兵顿时发现不对劲，这下精彩了,2024-10-28 06:09,6433,637,乐视群星访谈秀,乐视群星访谈秀,,https://toutiao.com/group/7430704630294413878/,,0,0,True
51年洪学智妻子寻女无果，到老乡家歇脚老乡惊呼：你要找得就是我,2024-09-22 01:07,15743,1001,品古观今,品古观今,前言1951年，阳曲县委大院突然来了7、8位解放军同志，其中一位女同志，就是洪学智的妻子张文。她此番前来，就是为了寻找多年前因战乱而寄养于民间的爱女。可昔日的小村落早已蜕变成另一番景象，这无异于是大海捞针。,https://toutiao.com/group/7417034363226915354/,,0,0,False
美国暗流涌动，特朗普对深层政府摊牌，拜登会否成“五日京兆”？,2024-11-21 22:01,30775,812,黎建南台湾,黎建南台湾,,https://toutiao.com/group/7439856002679177768/,,0,0,True
刚从中国返俄，苏-57飞行员传来新消息,2024-11-25 10:15,7004,237,环球时报新媒体,环球时报新媒体,刚从中国返俄，苏-57飞行员传来新消息,https://toutiao.com/group/7441158524530328127/,,0,0,True
警惕“先用后付”小心欠下账单～（央视频号：光华路资讯）,2024-11-27 12:44,5585,3167,央视频,央视频,,https://toutiao.com/group/7441939150552433179/,,0,0,True
海南富商张晖：花8亿建108米海上观音像，4年后死在水中死因成谜,2024-10-19 04:49,1797,260,八号探秘人,八号探秘人,在阅读此文之前，辛苦您点击一下“关注”，既方便您进行讨论和分享，又能给您带来不一样的参与感，感谢您的支持！编辑丨xk他是中国的一名富商，耗费8亿元完成了自己的梦想。可梦想落地成为现实的时候，他却在4年后莫名其妙的死去。他就是张晖，上个世纪末海南岛旅游业的龙头当家人。,https://toutiao.com/group/7427288913095492134/,,0,0,False
从“抛弃”到“香饽饽”，发展迅猛！我国可持续航空燃料产量潜力大,2024-11-24 07:01,1401,112,国际在线,国际在线,,https://crionline-media.cri.cn/cb5a6d96-d0c4-4fd0-a895-b6135667d84a/video/bffc92277d6b4ff5aff857474a3d4437.mp4,,0,0,True
北约对俄罗斯态度变了！普京称冲突正在演化，32个国家蠢蠢欲动,2024-11-27 06:20,4874,593,杜文龙,杜文龙,,https://toutiao.com/group/7441840147903021577/,,0,0,True
女友怀孕了，男友不装了，带她回豪宅！,2024-11-23 08:01,6825,610,乐视大综艺咖,乐视大综艺咖,,https://toutiao.com/group/7440353629540483593/,,0,0,True
弟弟光荣退伍，姐姐兴奋去车站接他，怎料一见弟弟瞬间哭了,2024-11-05 06:34,26896,2782,乐视天天剧好看,乐视天天剧好看,,https://toutiao.com/group/7433679820573934091/,,0,0,True
拜登挖坑摆烂，特朗普眼前困难重重荆棘满布，各国向中国靠拢避险,2024-11-22 08:15,27901,679,邱毅台湾,邱毅台湾,,https://toutiao.com/group/7440014294332211727/,,0,0,True
乌克兰蒙了，欧洲慌了，美国也冷静了,2024-11-26 10:42,10034,383,张元伟,张元伟,,https://toutiao.com/group/7441536551424623114/,,0,0,True
1米3袖珍美女嫁给1米48男孩，婚后丈夫奇迹长高，两人却不欢而散,2024-09-07 02:55,6366,330,睿之悦,睿之悦,杨萍和葛存苗的婚礼 文|睿之悦 编辑|睿之悦2019年，成都的民政局来了两个“10岁小孩”来登记，工作人员以为是玩闹。两个“小孩”拿出身份证让工作人员看，这才明白，原来是两个再也长不高的成年袖珍人情侣。,https://toutiao.com/group/7411713833267364386/,,0,0,False
母亲瘫痪、父亲疯了，当年那个744分的高考状元，7年后却成了这样,2024-09-08 00:54,11937,1800,八号探秘人,八号探秘人,母亲截肢瘫痪、父亲疯癫痴傻，可对于自己的亲人，他却做出了这样的评价。而今，7年已过，曾经那个让无数人动容的少年，现在如何?,https://toutiao.com/group/7411852147648496162/,,0,0,False
讣告！100岁叶嘉莹去世：17岁丧母，52岁丧女，94岁裸捐，她是中国最后一位“穿裙子的士”,2024-11-26 01:20,3820,656,读者,读者,从南开大学获悉，古典文学研究学者、南开大学讲席教授叶嘉莹，于2024年11月24日去世，享年100岁。她，是加拿大不列颠哥伦比亚大学终身教授，却在54岁写信给中国教育部，申请免费来华教学。来华任教后，她辗转全国多所高校讲授古诗词，不遗余力地传承中国古典文化。,https://toutiao.com/group/7441390504039793163/,,0,0,False
黑龙江勃利县东北虎进村（邻居完整剪辑版）,2024-11-21 15:19,677,183,小玛宝宝,小玛宝宝,,https://toutiao.com/group/7439752539572011574/,,0,0,True
大年三十吵架这段，堪称全剧亮点之一，实在太真实了,2024-11-21 08:08,9803,3067,南瓜大欧巴,南瓜大欧巴,,https://toutiao.com/group/7439641576105574949/,,0,0,True
老公生气躺好几天不下床，媳妇掀开被子气乐了，真是自作多情了,2024-11-24 11:06,2151,263,滕菲,滕菲,,https://toutiao.com/group/7440800681474130441/,,0,0,True
昨天还好好的！今天韶山毛主席故居怎么这样了？发生什么了？,2024-11-27 02:46,3320,119,黑老头说趣事,黑老头说趣事,昨天还好好的！今天韶山毛主席故居怎么这样了？发生什么了？,https://toutiao.com/group/7441783246236123711/,,0,0,True
吉林美女带俩娃，嫁给头婚小叔子，婆婆一手撮合，如今过得怎样了,2024-11-01 08:01,4879,1263,睿之悦,睿之悦,说出来可能很多人都不相信，吉林一位带着两个孩子的美女在婆婆的大力撮合下嫁给了自己的小叔子。2020年，这位女子的丈夫因为意外去世，留下了她们孤儿寡母悲痛欲绝。,https://toutiao.com/group/7432216069030363682/,,0,0,False
少爷没见过妻子就打算休妻，谁知一见妻子真面目，立马反悔,2024-10-22 10:17,6016,1229,乐视娱乐乐透社,乐视娱乐乐透社,,https://toutiao.com/group/7428541533252485669/,,0,0,True
被驱逐出中国的他，早就“翻车”了,2024-11-21 08:18,3181,141,环球人物杂志,环球人物杂志,他可能从没想过，有一天会以这样的形式离开。作者：陈佳莉55岁的大众汽车集团（中国）首席运营官约亨·森皮尔不光彩地离开了中国。10月下旬，因为血液中被检测出毒品，森皮尔在被拘留10日后驱逐出境。两年前，作为知名汽车品牌大众集团的在华高管，森皮尔带着光鲜履历和艰巨使命来到中国。,https://toutiao.com/group/7439643917601079849/,,0,0,False
美妇约见老情人，见面场景真是太逗了，这俩人绝配！,2024-10-27 16:25,4316,548,乐视明星的那点事,乐视明星的那点事,美妇约见老情人，见面场景真是太逗了，这俩人绝配！,https://toutiao.com/group/7428157095108674088/,,0,0,True
相爱37年零绯闻，丁勇岱对赵雪华一见钟情，如今却对儿子很失望,2024-11-09 21:43,2969,242,八号探秘人,八号探秘人,在阅读此文之前，辛苦您点击一下“关注”，既方便您进行讨论和分享，又能给您带来不一样的参与感，感谢您的支持！编辑丨xk1985年，丁勇岱转过楼梯拐角，撞到人生挚爱，这一下把他撞“开窍”了。那时他还不是《末路》里的白宝山。也不是《跨过鸭绿江》里的彭老总，更不是《人世间》里的周志刚。,https://toutiao.com/group/7435160230918406707/,,0,0,False
月薪过万 我为何还从胖东来离职？丨封面头条,2024-11-26 09:18,521,1447,封面新闻,封面新闻,近年来，胖东来是热搜榜单的“座上宾”，而当下胖东来关于涉足员工婚嫁彩礼收取、请客办酒的新闻引起了社会又一波的热议。生活在河南许昌的梁梦看着评论区和营销号，对胖东来或贬低或高唱的论调，心中都不再起波澜。,https://m.thecover.cn/news_details.html?from=web&eid=zF0xC09FFmqH90qSdq8Jkw==,,0,0,False
美国航母来了，绕着中国走的日韩以为能扬眉吐气，但结局出人意料,2024-11-27 01:43,2994,151,迷彩虎说,迷彩虎说,在整整六个月的航母空白期之后，美国终于把新的航母派遣到中国附近了。在这段时间里，日本和韩国那叫一个委屈啊，看见我国海军就只能躲得远远的，然后拍一张照片，就算是有所交代了。,https://toutiao.com/group/7441768643484877353/,,0,0,False
央视曝光：从里到外都是假的！,2024-11-25 01:05,2177,1005,直播日照,直播日照,冬季来临，羽绒服、羽绒被等羽绒制品成为市场上的香饽饽，但一部分“假羽绒制品”却在线上、线下市场肆意泛滥。,https://www.rzw.com.cn/redian/2024-11-25/9KpKioo3ULdxXYhU.html,,0,0,False
小伙洗完澡故意秀肌肉，富婆心跳加速被当场拿下，这下好看了,2024-10-26 16:20,10258,398,乐视情感讲堂,乐视情感讲堂,小伙洗完澡故意秀肌肉，富婆心跳加速被当场拿下，这下好看了,https://toutiao.com/group/7430011217881596426/,,0,0,True
