title,publish_time,like_count,comment_count,media_name,source,abstract,article_url,tag,is_yaowen,article_sub_type,has_video
国家主席习近平将发表二〇二五年新年贺词,2024-12-30 02:02,1020,687,新华网,新华网,新华社北京12月30日电 国家主席习近平将于31日晚7时通过中央广播电视总台和互联网，发表二〇二五年新年贺词。,http://my-h5news.app.xinhuanet.com/h5/article.html?articleId=607c307a50a6df04979bf15d1f3c7409,,0,0,False
老纪和珅这段对话，以前小时候听不懂，如今听完受益终身,2024-12-28 23:16,1202,425,乐视扒剧小妹儿,乐视扒剧小妹儿,,https://toutiao.com/group/7453420191947424293/,,0,0,True
80岁姑姑和83岁姑父相守一辈子，侄女探望二老，身体怎么样？,2024-11-04 23:30,990,129,兴凯湖莹莹,兴凯湖莹莹,,https://toutiao.com/group/7433570490595148298/,,0,0,True
说一说成飞的新飞机，网上传的越来越玄乎，究竟有多厉害？,2024-12-29 13:21,7198,986,陈虎点兵,陈虎点兵,,https://toutiao.com/group/7453823402932732435/,,0,0,True
马斯克76岁母亲在中国火了，自称几乎每个月都来，对中国赞不绝口,2024-12-28 11:42,13724,593,国际时事快递,国际时事快递,,https://toutiao.com/group/7453361562800095779/,,0,0,True
海南富商张晖：花8亿建108米海上观音像，4年后死在水中死因成谜,2024-10-19 04:49,4537,799,八号探秘人,八号探秘人,在阅读此文之前，辛苦您点击一下“关注”，既方便您进行讨论和分享，又能给您带来不一样的参与感，感谢您的支持！编辑丨xk他是中国的一名富商，耗费8亿元完成了自己的梦想。可梦想落地成为现实的时候，他却在4年后莫名其妙的死去。他就是张晖，上个世纪末海南岛旅游业的龙头当家人。,https://toutiao.com/group/7427288913095492134/,,0,0,False
零下20多度的内蒙古、早上我们捡完牛粪回屋吃牛肉喝奶茶、,2024-12-28 10:39,5015,619,河南姑娘远嫁在内蒙,河南姑娘远嫁在内蒙,,https://toutiao.com/group/7453410435526558218/,,0,0,True
伊朗紧急向中俄求援！已经遭以色列重创！对外政策出现三大失误,2024-12-28 09:08,1976,179,主持人雪莹,主持人雪莹,,https://toutiao.com/group/7453387052541805071/,,0,0,True
新婚33天卷走274万4套房，出逃后丈夫跨国追捕，如今下场大快人心,2024-12-20 22:06,4242,225,八号探秘人,八号探秘人,在阅读此文之前，辛苦您点击一下“关注”，既方便您进行讨论和分享，又能给您带来不一样的参与感，感谢您的支持！编辑丨QQ·B“色字头上一把刀！”深圳富豪结婚33天竟被卷走274万元和名下4套房产。不仅如此，他还被扣上了“接盘侠”的帽子，啥也没干喜当爹。,https://toutiao.com/group/7450399558821052982/,,0,0,False
探索上海廉价午餐，原来穷鬼爱吃的都是这些！,2024-10-07 00:27,1749,251,兴凯湖莹莹,兴凯湖莹莹,,https://toutiao.com/group/7422823927849681449/,,0,0,True
在单位：不说三话，不透三底，不帮三忙，不交三人,2024-12-26 13:42,1835,297,洞见,洞见,作家熊太行曾说，每个职场上的王者，身体里面都应该有三个灵魂：一个文臣，谨小慎微，考虑风险；一个武将，积极努力，谋求胜利；一个商人，精打细算，心中有数。要明白，在单位真正能冒尖的人不仅要能力出众，还要带点脑子。你可以不圆滑，但一定要知世故。,https://toutiao.com/group/7452714747801109001/,,0,0,False
清华才女李一诺：27岁博士毕业，4年生3娃，能替世界首富花钱,2024-12-18 05:51,7291,345,云莳一,云莳一,家庭是她第一个学校，妈妈是她第一任老师。李一诺27岁博士毕业进入美国麦肯锡公司，33岁成为公司全球董事合伙人，之后四年连生3娃。,https://toutiao.com/group/7449591069311779355/,,0,0,False
弟弟光荣退伍，姐姐兴奋去车站接他，怎料一见弟弟瞬间哭了,2024-11-05 06:34,43086,3404,乐视天天剧好看,乐视天天剧好看,,https://toutiao.com/group/7433679820573934091/,,0,0,True
中国第六代战机首飞成功！美国震惊,2024-12-28 09:27,10681,481,王丰台北,王丰台北,这两天，大陆网上流传著两个视频，也就是传闻很久的中国新型第六代战机的试飞画面。这两个视频引起了中外军迷的热烈讨论。第一时间有人看了这两个视频之后，认为这画面真假莫辨。不敢相信这真的就是中国第六代战机在作试飞。但是，一天之中居然在中国不同地点，有人同时发布两则视频，公开了两款不同的第六代战机试飞画面，这立马成为轰动世界的大新闻。当天稍晚，甚至连来自美国的外电都在议论这两个视频，美国西方也确认中国同时发布了两款第六代战机的试飞画面。美国也承认这是板上钉钉，证明中国的第六代战机已经横空出世，正式诞生了。(声明:本视频脚本文稿全部都是作者自己亲自撰写，视频中如有引述新闻信息素材时，作者都会在视频中口头说明来源。其它绝大多数素材内容均属作者本身之论述观点创意，特此声明),https://toutiao.com/group/7453391948548669962/,,0,0,True
2024，中国到底生了多少娃？“龙宝宝”预期落空，问题出在哪儿？,2024-12-29 11:05,952,1278,金融界,金融界,2024年，中国生了多少娃?虽然目前还没有准确的官方数字，但现实并不如预期那么乐观。近期联合国《世界人口展望 2024 版》的中方案预测，中国2024年出生人口预计为882万人。,http://m.jrj.com.cn/toutiao/2024/12/29/46920705.shtml,,0,0,False
未成年禁止观看！2024年全球爆片，尺度大到生理不适,2024-12-23 07:19,3462,116,禾芷解说,禾芷解说,深度解说电影《某种物质》,https://toutiao.com/group/7451503435595121191/,,0,0,True
经上级部门批准，2025央视春晚总导演、副总导演官宣,2024-12-29 04:10,2337,2047,海峡网,海峡网,央视新闻消息，中央广播电视总台《2025年春节联欢晚会》正在紧锣密鼓筹备中。经上级部门批准，12月29日，春晚主创团队官宣：总导演于蕾，副总导演赵大治、杨觐梦，及刘惠子、张异凡、宋飞、邓赟、毕波、张骥、顾志刚、张敏、郝婧、刘欣等共同组成主创团队，全力推进2025年春晚创作。,http://m.hxnews.com/dzbhz/news/kx/202412/29/jrtt_2186490.shtml,,0,0,False
刚刚，南部战区发布！,2024-12-29 07:01,1432,117,红星新闻,红星新闻,12月29日，中国人民解放军南部战区组织海空兵力位中国黄岩岛领海领空及周边区域开展战备警巡。12月以来，战区部队组织海空兵力持续加强中国黄岩岛领海周边海空域巡逻警戒，进一步强化有关海空域管控力度，坚决捍卫国家主权安全，坚决维护南海地区和平稳定。,https://toutiao.com/group/7453725057676853769/,,0,0,False
定了！全部开除！,2024-12-29 07:12,1088,764,全国党媒信息公共平台,全国党媒信息公共平台,在言论引发争论后，12月27日，该女主播发布道歉视频，其带货的服装店铺也表示，直播间涉事的主播、中控、运营人员均已被开除。,https://api-m.hubpd.com/transfer?nextUrl=https%3A%2F%2Fwww.hubpd.com%2Fhubpd%2Frss%2Ftoutiao%2Findex.html&contentId=5476377146885887354,,0,1,False
韩国失事客机原计划后续飞北京，有中国游客临时改签次日航班回国，表示“心情很复杂”,2024-12-29 13:32,596,262,极目新闻,极目新闻,极目新闻记者 陈洋洋当地时间12月29日，一架客机在韩国全罗南道的务安机场发生碰撞起火。据环球时报援引韩联社最新消息，韩国消防部门称，事故已致179人死亡。,http://jms.ctdsb.net/jmythshare/#/index_share?cId=0&contentType=5&contentId=2340276,,0,0,False
韩国客机机腹迫降，完整画面 #国际新闻,2024-12-29 06:55,8935,6802,最强80后,最强80后,,https://toutiao.com/group/7453723960828494390/,,0,0,True
湖南最长寿老人124岁高龄，长寿秘诀出世，让人大开眼界,2024-12-21 16:00,1637,156,乐视群星访谈秀,乐视群星访谈秀,,https://toutiao.com/group/7450730131821167140/,,0,0,True
广西49岁老汉娶19岁姑娘，结婚21年生下15个孩子，如今有何下场？,2024-10-20 08:32,9613,1203,艺述史,艺述史,她19岁出嫁，21年里总共生育了15个孩子，其中4个男孩子11个女孩子，家里热闹的像是开了一所学校一样。,https://toutiao.com/group/7427400319418384948/,,0,0,False
第6代战机，是怎样炼成的？(上),2024-12-29 14:51,5918,216,静思有我,静思有我,,https://toutiao.com/group/7453846576981606912/,,0,0,True
县长看不上乡长送的烟，给他退回来，乡长打开一看乐了,2024-11-13 08:16,10976,1827,乐视大综艺咖,乐视大综艺咖,,https://toutiao.com/group/7436672568578277925/,,0,0,True
疑似两款新战机同日试飞，都是六代战机吗？,2024-12-28 12:31,14968,1054,凤凰卫视,凤凰卫视,,https://toutiao.com/group/7453439302903530025/,,0,0,True
当得知女友怀孕了，男友不再装穷，直接带妻子回豪宅住,2024-12-17 03:23,3696,121,乐视经典热综回放,乐视经典热综回放,,https://toutiao.com/group/7449215721336209935/,,0,0,True
萝卜和鸡蛋这样做，比吃补药还补，顿顿吃都不会腻，又香又下饭,2024-10-30 12:28,70721,4322,小寒厨艺,小寒厨艺,萝卜和鸡蛋这样做，比吃补药还补，顿顿吃都不会腻，又香又下饭,https://toutiao.com/group/7431405463378919975/,,0,0,True
中美贸易战中，我们已不再被动！,2024-12-29 03:00,19861,190,卢克文工作室,卢克文工作室,,https://toutiao.com/group/7453398751932219941/,,0,0,True
益生菌真的那么神奇吗？有关益生菌的几个误区 你“踩雷”了吗？,2024-12-07 02:35,1917,109,央视频,央视频,,https://toutiao.com/group/7445492942887715365/,,0,0,True
95后AI“天才少女”刷屏！雷军千万年薪挖角！,2024-12-29 12:03,403,308,证券时报,证券时报,来源：证券时报国产大模型DeepSeek在全球火了，并带火了一个95后AI“天才少女”罗福莉。最近，中国头部量化私募公司幻方量化旗下专注于AI大模型研究开发的Deepseek（深度求索公司），宣布旗下的全新系列模型DeepSeek-V3首个版本上线并同步开源。,http://mp.weixin.qq.com/s?__biz=MjM5NDEzMzkzOA==&mid=2654682714&idx=2&sn=94550784cdf65cd195c77723c62e4f55&chksm=bc12a8eae8762f6c05c46facf8081ca76e0bcf37ba655865cdfc2683dd795a8b6a5aae8d2fd4#rd,,0,0,False
复旦教授梁永安给年轻人的演讲：如何理解当下的时代？,2024-12-27 06:15,671,101,今日头条,今日头条,,https://toutiao.com/group/7452971508609057321/,,0,0,True
吉林美女带俩娃，嫁给头婚小叔子，婆婆一手撮合，如今过得怎样了,2024-11-01 08:01,5967,1450,睿之悦,睿之悦,说出来可能很多人都不相信，吉林一位带着两个孩子的美女在婆婆的大力撮合下嫁给了自己的小叔子。2020年，这位女子的丈夫因为意外去世，留下了她们孤儿寡母悲痛欲绝。,https://toutiao.com/group/7432216069030363682/,,0,0,False
郭有才：当迷失方向忘记初心后，曾经飘得多高，如今摔得就多惨,2024-11-11 06:53,2168,912,八号探秘人,八号探秘人,在阅读此文之前，辛苦您点击一下“关注”，既方便您进行讨论和分享，又能给您带来不一样的参与感，感谢您的支持！编辑丨brt因为一首翻唱，他一夜之间成为了拥有千万粉丝的网红。但是“人红是非多”，不久他就因为版权等问题陷入了舆论风波。他的人气一落千丈，从万众瞩目变成了现在的无人问津。,https://toutiao.com/group/7435901170239078948/,,0,0,False
农业银行：将于2025年1月8日发放2024年半年度现金红利，共计派发约407.38亿元,2024-12-29 08:53,2405,506,每日经济新闻,每日经济新闻,每经AI快讯，农业银行公告，将于2025年1月8日发放2024年半年度现金红利。本次利润分配以本行349983033873股普通股为基数，每股派发现金红利人民币0.1164元（含税），共计派发现金红利约人民币407.,http://www.nbd.com.cn/rss/jinri_toutiao/articles/3703406.html,,0,0,False
近5年最热的十部剧，《狂飙》第9，《繁华》第6，第1名很难超越,2024-12-01 03:58,1774,638,电影烂番茄,电影烂番茄,今天，番叔就结合口碑，给大家盘点一下近五年，热度最高的十部电视剧。第十名:《都挺好》 猫眼热度 9775.8，播出时间2019年。,https://toutiao.com/group/7430845717314273831/,,0,0,False
河南警察3岁女儿被拐，苦寻全国23年无果，结果却发现女儿在对门,2024-11-05 07:43,5860,670,八号探秘人,八号探秘人,寻亲23年无果，丢失的女儿竟住在对门?但它却真实发生在河南洛阳的梁绍波身上。是意外走丢，还是人贩子所为，三岁的女儿怎会离奇失踪?,https://toutiao.com/group/7433697108120142345/,,0,0,False
中国新型飞行器，肉眼可见的领先，到底应该算是几代机？,2024-12-27 06:07,38535,2218,陈虎点兵,陈虎点兵,,https://toutiao.com/group/7452969355765088820/,,0,0,True
