title,publish_time,like_count,comment_count,media_name,source,abstract,article_url,tag,is_yaowen,article_sub_type,has_video
2025年纪检监察工作聚焦八个方面，一图速览→,2025-01-09 19:21,1176,173,环球网,环球网,2025年1月8日，二十届中央纪委四次全会公报全文公布。就做好2025年纪检监察工作，公报提出八个方面具体任务，并作出细化部署。,https://3w.huanqiu.com/a/24d596/4L0I0uiMXSf?agt=20,,0,0,False
12小时，灾区吃上四菜一汤，解放军再现超高效率，超美日百倍不止,2025-01-08 14:51,226,114,东方点兵,东方点兵,对于一个国家而言，军队的实际战斗力不只体现在战场上，更加体现在和平时期的救灾能力上，因为这充分体现出了一个国家在紧急情况下的后勤物资调动能力，以及与当地群众的协作能力，在战时条件下，就是妥妥的“加分项”。,https://toutiao.com/group/7457432916889584178/,,0,0,False
乌军155旅士兵大规模逃亡丑闻曝光后，乌克兰想动员海外侨民,2025-01-09 07:05,299,161,环球网,环球网,来源：环球时报 【环球时报特约记者 陈欣 柳玉鹏】据“今日俄罗斯”电视台8日报道，乌克兰民族团结部长切尔尼绍夫7日表示，乌政府将尝试让居住在国外的乌克兰人“自愿”回国。有分析称，该措施是为补充乌军逐渐枯竭的兵源。,https://3w.huanqiu.com/a/de583b/4Kzgvn6IUFl?agt=20,,0,0,False
男演员宣布退圈：胳膊拧不过大腿，我认输了！,2025-01-09 11:23,314,313,湖南日报,湖南日报,1月9日，李明德发文宣布退圈：从今天开始，不会再发任何有关剧组的事宜，交给法律，一切判罚结果我独自承担！另：我只想回归普通人的生活，做一个普普通通的，活着的人！靠自己的双手养活自己！不要再批判我了！我也需要生存，我已经不是“明星”了，我现在是北漂小李！望周知！！,http://mp.weixin.qq.com/s?__biz=MjM5MTE0OTQ2MQ==&mid=2655478082&idx=2&sn=8412a18d3b5e138babb874e592bd91b2,,0,0,False
中铁十四局擅自实施盾构穿越火车站股道群施工，被罚款8.4万元,2025-01-08 19:46,2618,1743,澎湃新闻,澎湃新闻,近日，武汉铁路监督管理局发布行政处罚公开信息，中铁十四局集团公司擅自在京广线铁路安全保护区内实施盾构穿越武昌火车站股道群施工，构成铁路交通重大事故隐患。,https://cloudvideo.thepaper.cn/video/5bb45f2497934af682b1fc51bd52589f/hd/20250108180731916d37e8e73-4c5c-46d2-9a0b-e866c33ad9c1-2492a1e2-df28-505e-d91d-c45e23b9f8f0.mp4,,0,0,True
“神秘大雾”，美国网民怀疑美军,2025-01-08 23:58,1764,834,环球时报,环球时报,据英国《每日邮报》6日报道，自2024年12月以来，美国多地出现“神秘大雾”，不少人自称接触后不久就发烧咳嗽。,https://toutiao.com/group/7457574103831151131/,,0,0,False
区委书记号召干部带头“买新衣、下馆子”，不妨以平常心看待,2025-01-08 23:21,198,330,极目新闻,极目新闻,极目新闻评论员 石平1月6日，在重庆市荣昌区经济工作会议上，区委书记高洪波号召干部买新衣、下馆子，带头消费、带动消费、带领消费。,http://jms.ctdsb.net/jmythshare/#/index_share?cId=0&contentType=5&contentId=2348313,,0,0,False
80岁老奶奶做红烧鱼从来不粘锅不破皮，原来技巧这么简单,2024-10-16 20:07,7528,429,家常的味道,家常的味道,,https://toutiao.com/group/7426343891651985974/,,0,0,True
中央三次强调！2025养老金上调方案，3000元以下的人，能多涨钱吗？,2025-01-07 19:32,2902,794,理谈生活,理谈生活,嗨，大家好，欢迎收看本期节目，今天咱们来关注一下养老金上调的有关讨论。养老金调整是退休老人每年都会关注的涨钱大事儿。,https://toutiao.com/group/7457133544449278514/,,0,0,False
山东姑娘远嫁一夫多妻的伊朗，丈夫给半斤黄金彩礼，如今过的咋样,2024-12-30 13:43,3289,410,秋墨文化,秋墨文化,相信每个人看到这个消息一定都很震惊，这个女孩为什么不想在我们国家好好待着，偏偏要嫁去伊朗离家这么远的地方，是不是在国外被骗了啊，但是通过小关的社交帐号上来看，她家里过的很和睦，很幸福，生活多姿多彩的，这究竟是怎么一回事呢？特别的缘分小关和伊朗丈夫萨拉赫相识于一场“特别”的缘分。,https://toutiao.com/group/7454068737830814245/,,0,0,False
清汤面好吃有诀窍，教你面馆30年不外传的秘诀，劲道爽滑汤鲜味美,2024-12-13 21:30,9136,1236,百变小厨坊,百变小厨坊,,https://toutiao.com/group/7447888258186347018/,,0,0,True
央视连发三文，关注春节解禁烟花爆竹燃放,2025-01-06 10:25,1056,738,醴陵发布,醴陵发布,近日，央视连发三文，关注多地春节解禁烟花爆竹燃放政策。记者注意到，此前，许多地方政策已经明确2025年春节可以有序、限时或在限定区域燃放烟花爆竹。央视的报道表示，解禁烟花爆竹燃放让“年味更浓了”。,https://toutiao.com/group/7456622188267979304/,,0,0,False
许昕回应维护樊振东，并再度质疑68岁前国乒世界冠军：这事很恶心,2025-01-07 19:15,906,116,海看快讯室,海看快讯室,近期，中国乒乓球界风波不断，马龙、樊振东、陈梦这几位奥运冠军先后退出世界排名，刘国梁也针对此事表态。而在赛场之外，奥运冠军许昕与68岁的前国乒世界冠军郭跃华之间，也生出了一些摩擦。在一场直播里，许昕回应完维护樊振东的相关话题后，把矛头指向了郭跃华在视频中的言论，直言此事令人作呕。,https://toutiao.com/group/7457130107409269288/,,0,0,False
这是张学良老婆赵四小姐真实样貌，并非演员饰演而是货真价实真品,2024-12-28 19:28,15016,1849,历史伟人,历史伟人,赵四小姐，原名赵一荻，她从十六岁开始她终生陪伴张学良，历经坎坷，赵一荻是富家大小姐，但是在张学良囚禁期间，她选择陪伴软禁中的张学良，后悔过吗?,https://toutiao.com/group/7453422736652698175/,,0,0,False
城乡居民养老金能涨多少｜请回答，2025,2025-01-04 10:13,1708,218,经济观察报,经济观察报,经济观察网 记者 田进 2024年底的中央经济工作会议提出，要适当提高退休人员基本养老金，提高城乡居民基础养老金。“适度提高”和“提高”的措辞差异意味着，2025年提高养老金的天平将更多向城乡居民基础养老金倾斜。城乡居民基础养老金能上涨多少？,https://toutiao.com/group/7455877439332352548/,,0,0,False
洛阳发现1000年前粮仓，打开后满满一窖粮食，专家将谷粒带回种植，发现一件不可思议的事,2025-01-06 19:39,3497,766,中外观察,中外观察,一座沉睡千年的古代粮仓，在洛阳大地上悄然苏醒。1971年，考古人员在洛阳城区发掘时，意外发现了一座规模宏大的隋唐时期粮仓遗址。当他们小心翼翼地揭开那厚重的木板时，眼前的景象让所有人惊叹不已：一座座完整的粮窑整齐排列，其中竟然还存有大量保存完好的粮食。,https://toutiao.com/group/7456761857731314213/,,0,0,False
太可惜！曝吴连生死因与饮酒过量有关，无儿女送终，临终照太心酸,2025-01-09 15:32,440,166,向楠娱记,向楠娱记,1月9日，老戏骨吴连生突发‬疾病去世‬，才‬62岁‬，随后‬亲属‬透露了‬他‬的死因‬，网友们‬一片‬惋惜‬。原来，吴连生去年12月从剧组离开，回老家哈尔滨调养身体，当时很多人纳闷他到底怎么了，还有好友询问他的身体状况，他只简单的说自己回家养养。可能他自己也没想到，会突发心梗。,https://toutiao.com/group/7457807900887532041/,,0,0,False
现在开发商无论想什么点子，房子就是卖不动，你醒悟明白了什么？,2024-11-24 11:02,1341,2064,曹哥说事,曹哥说事,房子越难卖，卖房的人越急得像热锅上的蚂蚁，他们想的点子是越层出不穷呀:30%的首付，降到20%，没人理，那降到15%，还是冰凉，零首付，还是无人问津，那怎么办呢?,https://toutiao.com/group/7440468029281993231/,,0,0,False
倪萍哽咽落泪：非常舍不得他！最新消息传来，四肢已基本瘫痪……,2025-01-03 11:01,3733,472,中国妇女报,中国妇女报,假如知晓生命已经进入倒计时你会选择如何度过？身患渐冻症的蔡磊给出了自己的答案：“与其等死，不如战斗！,http://mp.weixin.qq.com/s?__biz=MzA4NzAzNjYwNw==&mid=2652864675&idx=1&sn=585f6de1ad9738af6632d1b9c0f65481,,0,0,False
兄弟们我就说吧，燕冬萍不是一个人是一个群体,2025-01-08 11:46,1131,939,杨奡,杨奡,千万不能离，离了不得又要祸害另一个人，造孽，不能流入市场不离俺又心疼这男的，离了我又怕我兄弟又遇上这男的也可怜啊，你遇到这样的老婆真倒霉了，那个男人每个月给8000已经是他的全部了，除了他自己剩下的生活费如果这个群体要有个参考的话，估计怪兽都不够打毁灭吧，直接摧毁整个宇宙。,https://toutiao.com/group/7457369930392945171/,,0,0,False
小姐姐说：不明白买几万块黄金手镯有啥意思，工资就那么几千块钱,2024-12-12 09:34,108,128,水贝珠宝人盖子,水贝珠宝人盖子,今天在网上看到有一位小姐姐在网上发帖子问：“现在的女孩子一个月工资几千块，为啥都有个几万的金镯子？有的还甚至不只一个！真的不明白买这几万块的手镯意义何在？真搞不懂你们都是在哪里取钱买的？,https://toutiao.com/group/7447332238426948123/,,0,0,False
央视就解禁烟花爆竹发声后续!有地方合规烟花企业被取消经营资格,2025-01-06 12:52,272,281,文娱体说法,文娱体说法,2024年12月底，央视新闻曾在四天之内，针对烟花爆竹的解除燃放的问题三度发声，建议各个地方可以从原来的绝对禁止燃放烟花爆竹，改为更加符合实际情况的限时限范围的燃放政策，有不少的城市已经宣布今年可以燃放烟花爆竹，但也有不少的地方仍然比较“保守”，选择保持原来的禁止燃放的政策。,https://toutiao.com/group/7456248570392379941/,,0,0,False
厉害了！世界泳联官宣：全红婵再获殊荣，另创一项新纪录,2025-01-03 11:23,2613,203,大秦壁虎白话体育,大秦壁虎白话体育,聚焦体坛资讯，关注赛场内外。2024年已经过去。临近年底，按照以往惯例，各种颁奖典礼都会开启评选活动。2024年又是奥运年，所以那些在奥运赛场为国家争金夺银的运动员，自然是获奖的热门人选。,https://toutiao.com/group/7455523700926874122/,,0,0,False
A股：明日，1月10日，历史即将重演？,2025-01-09 15:05,1247,348,星火资本,星火资本,今日的A股市场很有意思，再一次走出了两极分化的行情，但是，不同的是，在分化上出现了转换，昨天，上证指数收涨，创业板指数下跌，而在今日的时候，反过来了，上证指数下跌，反而创业板指数和深成指意外收涨了。,https://toutiao.com/group/7457797049703072268/,,0,0,False
《乡村爱情17》开播在即，编剧分析“谢腾飞娶香秀”的可能性,2025-01-08 10:00,266,294,临看资讯界,临看资讯界,而谢腾飞在《乡村爱情 7》第 15 集被谢广坤领养时年仅 4 岁，到 2025 年，他也才 15 岁，尚未达到法定结婚年龄。,https://toutiao.com/group/7457358289232511522/,,0,0,False
女市长爱上小男友，俩人爱的轰轰烈烈，让女市长感到害怕,2024-12-18 16:13,3421,580,乐视经典热综回放,乐视经典热综回放,,https://toutiao.com/group/7449661362671714850/,,0,0,True
许家印，又有新消息！,2025-01-03 09:30,1421,1501,西安晚报,西安晚报,许家印和中国恒大再次被限制高消费。1月2日，天眼查最新信息显示，近日，因未按执行通知书指定的期间履行生效法律文书确定的给付义务，中国恒大集团及许家印被限制高消费，执行法院为广州市中级人民法院。,https://toutiao.com/group/7455495441854038568/,,0,0,False
最新！美联储预计降息75个基点,2025-01-09 09:44,307,203,世界闽南人,世界闽南人,当地时间1月8日，美联储公布联邦公开市场委员会（FOMC）2024年12月17日至18日的会议纪要。会议纪要显示，美联储决定将联邦基金利率目标区间下调25个基点，使其基准基金利率达到4.25%-4.5%的区间，这是美联储连续第三次降息，累计下调幅度已达到1个百分点。,https://toutiao.com/group/7457725602259272230/,,0,0,False
冬天，这菜使劲吃，一通便，二补钙，三强筋骨，当季营养不懂可惜,2024-12-26 22:01,1414,115,Lily美食谈,Lily美食谈,冬天，这菜使劲吃，一通便，二补钙，三强筋骨，当季营养不懂可惜。,https://toutiao.com/group/7452375673227706921/,,0,0,False
