title,publish_time,like_count,comment_count,media_name,source,abstract,article_url,tag,is_yaowen,article_sub_type,has_video
普京决定愿意同美国进行稀土合作，这是骗局还是背刺中国呢？,2025-02-26 03:36,14373,544,我就是心净,我就是心净,,https://toutiao.com/group/7475566633026355721/,,0,0,True
全球最快高铁正在开展多项试验验证,2025-02-22 01:13,3480,537,国际在线,国际在线,,https://crionline-media.cri.cn/cb5a6d96-d0c4-4fd0-a895-b6135667d84a/video/a1a4afed8a6449529f1bf463424ef4de.mp4,,0,0,True
一觉醒来，德国变天了,2025-02-24 08:00,12073,474,牛弹琴,牛弹琴,德国大选尘埃落定，最大输家和赢家分别是他们,https://toutiao.com/group/7474892409533628982/,,0,0,True
乌克兰到底有没有稀土？泽连斯基利用特朗普贪婪，巧妙布下老千局,2025-02-24 08:00,20336,891,邱毅台湾,邱毅台湾,,https://toutiao.com/group/7474825033962930723/,,0,0,True
“特朗普带领我们走向投降，而非伟大”,2025-02-20 08:31,12976,883,环球时报新媒体,环球时报新媒体,,https://toutiao.com/group/7473414555541029414/,,0,0,True
美俄“世纪大和解”，朝鲜嗅到一丝不祥信号，主动向中国靠拢,2025-02-21 09:20,15473,4115,第一军情,第一军情,近日，据新华社消息，中国驻朝鲜大使王亚军会见了朝鲜外务省副相朴明浩。值得注意的是，王亚军大使是在中国驻朝鲜大使馆接见的朴明浩，也就是说，是朝方主动上门找的中国。,https://toutiao.com/group/7473799663997436453/,,0,0,True
