title,publish_time,like_count,comment_count,media_name,source,abstract,article_url,tag,is_yaowen,article_sub_type,has_video
华为200万年薪都留不住他！天才少年彭志辉离职后，现状曝光,2025-01-16 09:28,1139,116,与君説,与君説,在阅读此文之前，麻烦您点击一下“关注”，既方便您进行讨论和分享，又能给您带来不一样的参与感，感谢您的支持文、编辑|小娄你敢相信吗？大厂华为200万年薪的工作，竟然也有人不屑一顾。入职华为两年后，彭志辉毅然决然选择离职。,https://toutiao.com/group/7460439446131884579/,,0,0,False
男子结婚去接亲的时候，竟然踹门你们觉得对吗?,2025-01-16 05:24,19606,5539,爱喝牛奶,爱喝牛奶,,https://toutiao.com/group/7460379773781475850/,,0,0,True
文笔大挑战！上联：秋雨无心敲落叶，求下联，高手速来秀文采呀！,2024-11-14 23:57,655,782,对月吟联,对月吟联,上联：秋雨无心敲落叶，求下联。秋雨无情打花伞，秋风有意送秋凉。秋水无痕共长天一色，秋月有影映孤舟一片。秋雨如烟润万物，秋声似歌醉诗情。秋光绚丽夺人目，秋波荡漾惹人怜。秋雨绵绵秋意浓，秋叶飘零秋更明。秋日灿烂秋云轻，秋风飒爽秋草黄。秋雨连绵秋雾迷，秋水共长天一色。,https://toutiao.com/group/7437287321315131919/,,0,0,False
公公竟然和儿媳偷情，哪料被妻子撞见，这下有戏看了！,2025-01-21 08:05,4134,415,南瓜午夜厅,南瓜午夜厅,,https://toutiao.com/group/7462273852651979274/,,0,0,True
妻子深夜加班，丈夫感觉不对劲偷偷跟踪，看到真相瞬间崩溃,2024-10-28 06:59,30811,592,金曲大荟萃,金曲大荟萃,妻子深夜加班，丈夫感觉不对劲偷偷跟踪，看到真相瞬间崩溃,https://toutiao.com/group/7430717509566726656/,,0,0,True
小子从小被猴养大，长大成半人半兽，身怀出神入化的武功,2024-11-22 03:36,1902,257,群星访谈秀,群星访谈秀,,https://toutiao.com/group/7439942541555794471/,,0,0,True
要说搞笑还得是四川妹子！一颦一笑中说透了整个社会的现状！,2025-01-07 03:20,13821,1400,蒸蒸日上,蒸蒸日上,,https://toutiao.com/group/7457007892957266484/,,0,0,True
老经典武打片，都是不需要替身的真功夫，实在精彩,2024-11-03 02:39,2406,375,经典热综回放,经典热综回放,,https://toutiao.com/group/7432877125813666314/,,0,0,True
