title,publish_time,like_count,comment_count,media_name,source,abstract,article_url,tag,is_yaowen,article_sub_type,has_video
学习进行时丨把更多的人团结在党的周围——习近平总书记关心推动人民政协工作的故事,2024-09-20 10:59,2095,174,新华网,新华网,人民政协是中国共产党把马克思列宁主义统一战线理论、政党理论、民主政治理论同中国实际相结合的伟大成果，是中国共产党领导各民主党派、无党派人士、人民团体和各族各界人士在政治制度上进行的伟大创造。,http://my-h5news.app.xinhuanet.com/h5/article.html?articleId=1eb4146052ae4c90b53613c9fbf4662c,,0,0,False
9月21日凌晨，北京天安门发生如此感人场面，令人眼含热泪,2024-09-20 23:06,2630,178,好邻居李亮,好邻居李亮,,https://toutiao.com/group/7416865499553727014/,,0,0,True
现场航拍！八月十八钱塘看涌潮“江面似山崩地裂、涌起千座雪峰”,2024-09-20 07:59,3261,239,海客新闻,海客新闻,现场航拍！八月十八钱塘看涌潮“江面似山崩地裂、涌起千座雪峰”,https://toutiao.com/group/7416631860521861667/,,0,0,True
董卿父亲董善祥：我这辈子最后悔的事，就是让宝贝女儿嫁给密春雷,2024-09-11 06:59,1347,147,稻述,稻述,提起央视主持，现在挑大梁的几乎就是撒贝宁、尼格买提、龙洋等人了，他们也都非常优秀，但常有人怀念起董卿还在的日子。,https://toutiao.com/group/7413267526601228852/,,0,0,False
魏启颖：女儿赵薇被封杀后，丈夫也去世，儿子离婚被分一半财产,2024-08-12 15:57,762,230,吃瓜崽崽,吃瓜崽崽,女儿被封杀，儿子感情突发变故，曾经风光无限的赵家荡然无存。她喜欢音乐，想当音乐老师，父母也大力支持，从不会横加干涉。,https://toutiao.com/group/7402251567493333519/,,0,0,False
以色列这一炸全搞砸了，中东地区迎来去美国化：中国成为最大赢家,2024-09-20 07:56,1671,557,深度工场,深度工场,以色列这一炸全搞砸了。以色列在黎巴嫩这一炸，在战术上来说，确实很成功，杀伤4500多名黎巴嫩真主党成员。,https://toutiao.com/group/7416630160327279158/,,0,0,False
港姐归来，小奎坐大奔热情迎接，爱人见面抱头痛哭 #相亲,2024-07-05 04:45,23493,4861,海哥量地球,海哥量地球,,https://toutiao.com/group/7388008203738415653/,,0,0,True
亲生儿子打母亲后续被警察带走,2024-09-20 08:12,1316,369,25小时H,25小时H,儿子问母亲要钱不给便施暴多亏蜀黎赶来将其制服,https://toutiao.com/group/7416635334714360383/,,0,0,True
上海台风来袭 ，27层楼房在晃 ，吓坏了#记录真实生活 #台风,2024-09-16 08:29,1341,210,兴凯湖莹莹,兴凯湖莹莹,,https://toutiao.com/group/7415155319245898276/,,0,0,True
男人和女人的需求差别这么大？,2024-07-12 11:00,27480,1987,周小鹏,周小鹏,男人和女人的需求差别这么大？,https://toutiao.com/group/7388885573953389092/,,0,0,True
为什么说从2025年开始，70岁以上的老人，可能面临“两大”问题？,2024-09-01 14:12,2116,268,水大叔,水大叔,据可靠数据了解，我国70岁以上的人口数量已经达到了2.5亿人次，占到全国总人口数量的18%。伴随着人口老龄化的出现，养老问题也成了重中之重，要知道养老不仅仅是家庭的责任，更是社会责任。,https://toutiao.com/group/7409677025897710106/,,0,0,False
通俗解释美联储降息是怎么回事？,2024-09-20 03:31,1163,146,卢克文工作室,卢克文工作室,最近全球各媒体，都在预测美联储即将在9月降息，搞得普通吃瓜群众一惊一乍的，只知道这好像是惊天动地的大事，但不知道对全世界到底有啥影响?,https://toutiao.com/group/7416560236535759372/,,0,0,False
"万万没想到,53岁“丁克”半辈子的康辉，一生遗憾竟然是一通电话",2024-08-21 22:14,20642,4423,峰哥正读,峰哥正读,在阅读此文之前，麻烦您点击一下“关注”，既方便您进行讨论和分享，又能给您带来不一样的参与感，感谢您的支持！文/编辑：蘑菇百善孝为先。但是到底怎么做才算是“孝”，康辉用了半辈子才明白。央视知名主持人康辉，事业顺遂，家庭幸福，在外人看来是一个人生赢家。,https://toutiao.com/group/7405504703687115273/,,0,0,False
恭喜中国女篮新领袖终于出现了！百发百中！统治力让对手深深绝望,2024-06-25 07:11,24642,1340,乐播体育,乐播体育,,https://toutiao.com/group/7384335028576059923/,,0,0,True
苹果手机突发！微信整个都废了？最新回应↗,2024-09-20 09:12,1089,1683,北青网,北青网,"昨天（9月19日）开始有用户在社交平台上反映📱自己的iPhone 14 Pro Max更新了苹果iOS18系统后点开微信公众号遭遇闪退问题""整个公众号都废了，怎么操作都闪退，目前已经尝试了多种方法""。",http://t.ynet.cn/h5/35849709.html,,0,0,False
苹果、华为同日开售，结果却是“冰火两重天”,2024-09-20 18:43,1310,2329,四川观察,四川观察,9月20日，iPhone16系列与华为Mate XT三折屏手机同时发售。iPhone16标准版和Plus再次出现破发情况，Pro和ProMax则“一货难求”；而华为Mate XT则出现线上抢购秒没的情况。,https://kscgc.scgchc.com/sctv/h5/v7/newsShare.html?id=1837169948101120002,,0,0,False
5座车拉6个人被判超员，车主1句话把交警问懵,2024-08-05 20:20,10775,2563,奇妙钢笔pA8JyP,奇妙钢笔pA8JyP,,https://toutiao.com/group/7399752843772559906/,,0,0,True
以色列这一炸，土耳其查，伊朗查，叙利亚查，中国制造将成大赢家,2024-09-20 17:58,2583,499,南国工场,南国工场,当地时间9月20日，以色列报纸《新消息报》报道，黎巴嫩全境连续两次，电子产品，传呼机，对讲机爆炸事件后，土耳其当局检查了土耳其安全部队使用的通讯设备的安全性。,https://toutiao.com/group/7416772674015298089/,,0,0,False
2013年，湖南26岁女孩嫁给71岁老头，婚后还生下一子，如今怎样了,2024-07-12 11:59,22361,2239,智史通鉴,智史通鉴,2013年4月17日，长沙宁乡县的民政局迎来了一对特殊的夫妻。一个71岁的老头和一个26岁的女孩，离远了看，甚至像爷爷和孙女。面对工作人员异样的眼光，女孩说：“我和他是真心相爱的！”这让人好奇，这对相差45岁的夫妻，他们之间到底有着怎样的爱情故事？,https://toutiao.com/group/7390696631223534120/,,0,0,False
中国🇨🇳人民的好总理,2024-09-03 15:46,152109,17535,话说,话说,这个老人一生只做一件事，那就是为了人民鞠躬尽瘁，死而后已,https://toutiao.com/group/7410443709928210955/,,0,0,True
全球约一半肝癌在中国，再次提醒：家中的4种食物，尽早撤下餐桌,2024-08-13 08:36,90389,3437,梁医学社梁怡璋医生,梁医学社梁怡璋医生,,https://toutiao.com/group/7402540119712629311/,,0,0,True
中秋节起源是什么， 古人过中秋都有哪些传统？  #古人如何过中秋,2024-09-16 10:00,917,150,书生talk,书生talk,,https://toutiao.com/group/7415123853027836451/,,0,0,True
姑娘远嫁山东十年未回家，带着孩子偷偷回娘家，到家眼前一幕哭了,2024-09-09 08:25,19316,8415,小乔家里的事,小乔家里的事,,https://toutiao.com/group/7412556561718968870/,,0,0,True
蛋仔派对：飞机规则怪谈？如果你误入诡异航班 ，请遵守以下规则,2024-07-04 08:36,3618,163,辉哥游戏解说,辉哥游戏解说,,https://toutiao.com/group/7387696668101050932/,,0,0,True
温铁军：形势非常严峻，战争随时可能爆发！〔上〕,2024-09-11 15:44,14977,1980,淡泊的海浪AAm,淡泊的海浪AAm,,https://toutiao.com/group/7413411885322371621/,,0,0,True
万万没想到,2024-08-22 01:11,3986,368,俊俏云朵u,俊俏云朵u,,https://toutiao.com/group/7405765312747930164/,,0,0,True
今天才知道！电动车“每天充”和“用完再充”，到底哪个更伤电池,2024-08-27 11:19,4167,913,鲸探所,鲸探所,“今天到底给车充不充电？”估计大多数人每天回家都会想这个问题，看着自己的电动车电量又多又少的，充不充电也是一件非常难以抉择的事情。那么，电动车到底应该怎样充电呢？是每天都充，还是用完之后再充呢？电动车充电不管是在城市还是农村，电动车其实都是人们出门最常见的交通工具。,https://toutiao.com/group/7407773012533117475/,,0,0,False
荷尔蒙旺盛的女人，一般有5个表现，看看您占了几个？,2024-08-12 03:18,16373,2152,梦里水乡,梦里水乡,,https://toutiao.com/group/7401916860519678499/,,0,0,True
老人说“坟有6不葬，一葬穷三年”，哪6不葬？葬了穷三年？,2024-08-28 09:01,10462,499,惠农圈,惠农圈,之前实行土葬，关于土葬的说法有很多，比如“坟有六不葬，一葬穷三年”。那时候，人们认为逝者葬在哪里，不能葬在哪里，会给后人带来福或灾。,https://toutiao.com/group/7408111961839256064/,,0,0,False
