title,publish_time,like_count,comment_count,media_name,source,abstract,article_url,tag,is_yaowen,article_sub_type,has_video
稳中求进每月看丨锚定新目标 发力拼开局——1月全国各地经济社会发展观察,2025-01-30 03:49,594,187,新华网,新华网,新华社北京1月30日电 题：锚定新目标 发力拼开局——1月全国各地经济社会发展观察新华社记者开年首月，各地相继召开的地方两会奏响全力以赴拼经济搞建设的“奋进曲”，文旅活动持续上新激活“年经济”，春运拉开大幕折射“流动中国”的新活力，一批批重大项目开工筑牢经济社会发展“硬支撑”。,http://my-h5news.app.xinhuanet.com/h5/article.html?articleId=b1dec5af4a4c67a53c6dc07120745f28,,0,0,False
邱震海：中国DeepSeek横空出世，动摇西方自信！,2025-01-28 15:17,5589,840,震海风云,震海风云,,https://toutiao.com/group/7464985478723306018/,,0,0,True
小沈阳夫妇把演唱会开到了北京春晚舞台！,2025-01-29 16:47,13590,2389,非凡蛋糕mu,非凡蛋糕mu,,https://toutiao.com/group/7465379968436994623/,,0,0,True
金星问李春平：和美国老太这13年里，有没有提出夫妻生活,2025-01-30 06:49,2806,820,娱乐乐透社,娱乐乐透社,,https://toutiao.com/group/7465596865845772827/,,0,0,True
美国媒体看到中国春晚机器人跳舞震惊发声了#口播短视频#国际热点,2025-01-29 20:30,13735,315,华姐在内蒙,华姐在内蒙,美国媒体看到中国春晚机器人跳舞震惊发声了#口播短视频#国际热点,https://toutiao.com/group/7465346608524296767/,,0,0,True
公公竟然和儿媳偷情，哪料被妻子撞见，这下有戏看了！,2025-01-21 08:05,9529,813,南瓜午夜厅,南瓜午夜厅,,https://toutiao.com/group/7462273852651979274/,,0,0,True
男人目睹了妻子的偷情，下一秒情夫和妻子就遭到了他的制裁！,2025-01-23 09:05,5886,471,橙子影视吖6,橙子影视吖6,,https://toutiao.com/group/7463034403476734527/,,0,0,True
