title,publish_time,like_count,comment_count,media_name,source,abstract,article_url,tag,is_yaowen,article_sub_type,has_video
一个独生子接母亲出院的过程被网友拍下，数百万人引发共鸣。,2025-02-22 12:52,28127,9017,龙象风,龙象风,,https://toutiao.com/group/7474225331756319232/,,0,0,True
网友自制哪吒三太子大战美国队长，笑到我腹肌抽筋,2025-02-20 00:20,10724,2205,星星爱音悦,星星爱音悦,,https://toutiao.com/group/7473289432448172581/,,0,0,True
突发！云南某景区发生雪崩，瞬间淹没人群。,2025-02-22 07:43,784,144,艾琦,艾琦,,https://toutiao.com/group/7474145800726037026/,,0,0,True
华裔美军女孩，谈对中国的感受,2025-02-22 13:11,1594,1303,自由水滴,自由水滴,,https://toutiao.com/group/7474230359383753250/,,0,0,True
有这样的老婆，你家祖坟都冒青烟了！,2025-02-04 03:11,80131,12912,乐观的冰淇淋I,乐观的冰淇淋I,,https://toutiao.com/group/7467226170908606976/,,0,0,True
震撼！十秒内连续弹射三架重型战斗机！,2025-01-18 23:48,16979,2281,辉哥杂谈。,辉哥杂谈。,,https://toutiao.com/group/7461406546325406218/,,0,0,True
海南部分旅居人群成逃难大军，对于这样的生活，大家怎么看？,2025-02-09 10:48,3470,719,采云飘飘,采云飘飘,,https://toutiao.com/group/7469369555660309055/,,0,0,True
蒙古终于想通了，60亿吨的超级煤矿，彻底向中国敞开了大门,2025-02-19 01:18,10848,1008,唐驳虎主笔,唐驳虎主笔,2025年2月14日，蒙古国总理奥云额尔登带队，在亚冬会闭幕式的哈尔滨签下协议，一条全长只有8公里的跨境铁路最终落槌。,https://toutiao.com/group/7472933328845292095/,,0,0,True
候鸟老人大量撤离，炒房客四折甩卖，房价一降再降却无人问津,2025-02-21 21:12,5885,1468,江湖论剧,江湖论剧,,https://toutiao.com/group/7473797623494640147/,,0,0,True
媳妇玩到半夜才回来，以为老公不在家，进门这操作把老公看懵了,2025-01-24 09:38,13093,3460,滕菲,滕菲,,https://toutiao.com/group/7463414214191743497/,,0,0,True
