title,publish_time,like_count,comment_count,media_name,source,abstract,article_url,tag,is_yaowen,article_sub_type,has_video
一见·生态环境保护督察，这个“牛鼻子”怎么牵,2025-04-04 12:58,529,129,人民日报,人民日报,起笔十年前，一项制度“咬住问题不放松，成为推动地方党委和政府及其相关部门落实生态环境保护责任的硬招实招”。从2015年开始试点到第三轮第三批完成督察反馈，中央生态环境保护督察制度从无到有、持续推进。一路走来，这项制度为何被习近平总书记评价为“建得好、用得好”？,https://www.peopleapp.com/column/30048709273-500006184488?utm_source=tth&promote=true,,0,1,False
有人买华为Mate 70 Pro+嘛？为什么感觉全世界就我一个人在用？,2025-02-17 06:01,165,811,小豪数码,小豪数码,影像从mate40pro转过来的，最大的感觉是按下拍照按钮后嗯成像速度快了，颜色不发白了，最关键的是可以拍实况照片了，拍照体验的提升还是挺大的，至于成像素质，我没有其他旗舰机，没法对比，不作评论了，我感觉我自己使用是够了。,https://toutiao.com/group/7472264084784710155/,,0,0,False
仅发行6年就退市了！价值1.56万！这样的100元请收好别花了~,2025-02-24 05:03,9316,725,巫凡读收藏,巫凡读收藏,大家都知道，我们现在用的100元纸币是第五套人民，但是第五套人民币中一共发行了三个版本，分别是99版、05版和15版的，目前在使用的是05版和15版，99版是大家公认的错版钞，且发行时间没多久就退市了。,https://toutiao.com/group/7474844512628507175/,,0,0,False
比恒大还惨！中国第二大民企轰然倒塌，负债7500亿，创始人被抓,2025-04-06 10:18,971,106,墨珑甲,墨珑甲,曾经是中国第二大民营企业，资产规模一度让人瞠目结舌，却在短短几年内从巅峰跌入谷底，背负7500亿的巨额债务，最后连创始人陈峰都被抓了。,https://toutiao.com/group/7490142252145984011/,,0,0,False
我家排骨从不炖着吃，淋2个鸡蛋，不加一滴水，上桌瞬间被扫光！,2025-03-04 12:34,5409,719,家味美食,家味美食,,https://toutiao.com/group/7477931824111419931/,,0,0,True
已经没办法跟美国好好说话了,2025-04-06 13:22,39757,1570,卢克文工作室,卢克文工作室,,https://toutiao.com/group/7490189841326703116/,,0,0,True
30年前的“计划生育宣传片”，为什么不让要孩子，看完就明白了,2025-03-30 10:00,1062,537,煊予影视,煊予影视,,https://toutiao.com/group/7487376689052402215/,,0,0,True
