title,publish_time,like_count,comment_count,media_name,source,abstract,article_url,tag,is_yaowen,article_sub_type,has_video
农村小情侣深夜约会，在屋内过着二人世界，兴奋坏了,2024-10-16 01:14,2964,323,乐视热播综艺精选,乐视热播综艺精选,农村小情侣深夜约会，在屋内过着二人世界，兴奋坏了,https://toutiao.com/group/7426173284741284364/,,0,0,True
中国国乒又火了！决胜时刻，领军人物疯狂逆转，上演最解气的一幕,2024-11-04 00:00,4741,533,乐播体育,乐播体育,,https://toutiao.com/group/7433056969079915020/,,0,0,True
11月5号上午，北京大街上看到的，这是干什么呢？,2024-11-05 02:06,1812,168,清风快乐游,清风快乐游,,https://toutiao.com/group/7433610775513694783/,,0,0,True
立案调查！刘晓庆前男友报警,2024-11-05 06:16,1983,1254,大象新闻,大象新闻,因人身安全受到威胁，网曝刘晓庆前男友报警 ，此前曝出刘晓庆与其恋爱期间录音：留着对你是光荣，戳穿对你是耻辱。,https://share.hntv.tv/news/0/1853658276747567105,,0,0,False
小伙洗完澡故意秀肌肉，富婆心跳加速被当场拿下，这下好看了,2024-10-26 16:20,5412,234,乐视情感讲堂,乐视情感讲堂,小伙洗完澡故意秀肌肉，富婆心跳加速被当场拿下，这下好看了,https://toutiao.com/group/7430011217881596426/,,0,0,True
美妇约见老情人，见面场景真是太逗了，这俩人绝配！,2024-10-27 16:25,2146,271,乐视明星的那点事,乐视明星的那点事,美妇约见老情人，见面场景真是太逗了，这俩人绝配！,https://toutiao.com/group/7428157095108674088/,,0,0,True
给近三年最好的10部年代剧排个名：《人世间》第6，第1名没有争议,2024-10-28 07:10,793,469,稻述,稻述,到了20世纪初，偶像剧成为人们的掌中宝，但要说现在什么剧最受欢迎，那一定是年代剧!其中《人世间》只能排第六，第一名人人都爱看，最后一名也比上不足比下有余。,https://toutiao.com/group/7430715494055264783/,,0,0,False
被拐男子认亲一年后，与家人彻底决裂！,2024-11-05 08:45,866,708,环球网,环球网,来源：宁波晚报 近日因寻亲走红的郁豹豹与家人决裂的消息引发关注，冲上热搜。据报道，2023年9月，被拐卖34年的郁豹豹寻亲成功。认亲不到半个月，郁豹豹与两个弟弟开始直播带货。不到两个月，三兄弟逐渐走向分崩离析。令他更无法接受的是，他与母亲也渐生隔阂。,https://3w.huanqiu.com/a/14459a/4K8FGmdmzMW?agt=20,,0,0,False
“姜萍事件”水落石出！一文带你看懂背后的真实逻辑,2024-11-04 15:09,4966,2789,楠哥有财气,楠哥有财气,,https://toutiao.com/group/7433441540602593802/,,0,0,True
又被全世界打脸，这是美国今年最耻辱的失败,2024-11-01 00:10,7638,1999,牛弹琴,牛弹琴,资料图又被全世界打脸，这是美国今年最耻辱的一次失败。之所以说“又”，很简单，以前每年都有过，结果也差不多。事实上，这也成了一年一次联合国大会，最后的保留曲目，全世界同声谴责美国，全世界一起看美国笑话。因为全世界投票，要求美国必须终止对古巴的经济、商业和金融封锁。,https://toutiao.com/group/7432095642685686291/,,0,0,False
吃播网红恩克半年吃110只羊，眼神呆滞脸黑成炭，网友求他别吃了,2024-11-04 08:22,453,408,与君説,与君説,在阅读此文之前，麻烦您点击一下“关注”，既方便您进行讨论和分享，又能给您带来不一样的参与感，感谢您的支持文、编辑|是否古人估计都没想到后世子孙通过吃饭就能赚得盆满钵满。短视频的迅速崛起给人们带来了很多生财之道，吃播就是其中一个。,https://toutiao.com/group/7433333039997977107/,,0,0,False
善恶终有报：疫情时对中国一毛不拔，却大方捐美国6亿，如今咋样,2024-09-29 05:50,978,127,睿之悦,睿之悦,可就是这样一位在中国土生土长起来的富豪，在疫情期间面对同胞的困境却一毛不拔，反而大方的捐助了6亿给美国。,https://toutiao.com/group/7419859345154015798/,,0,0,False
特务男扮女装混进村子，孩子兵顿时发现不对劲，这下精彩了,2024-10-28 06:09,2513,243,乐视群星访谈秀,乐视群星访谈秀,,https://toutiao.com/group/7430704630294413878/,,0,0,True
母亲瘫痪、父亲疯了，当年那个744分的高考状元，7年后却成了这样,2024-09-08 00:54,7472,1232,八号探秘人,八号探秘人,母亲截肢瘫痪、父亲疯癫痴傻，可对于自己的亲人，他却做出了这样的评价。而今，7年已过，曾经那个让无数人动容的少年，现在如何?,https://toutiao.com/group/7411852147648496162/,,0,0,False
吉林美女带俩娃，嫁给头婚小叔子，婆婆一手撮合，如今过得怎样了,2024-11-01 08:01,1839,562,睿之悦,睿之悦,说出来可能很多人都不相信，吉林一位带着两个孩子的美女在婆婆的大力撮合下嫁给了自己的小叔子。2020年，这位女子的丈夫因为意外去世，留下了她们孤儿寡母悲痛欲绝。,https://toutiao.com/group/7432216069030363682/,,0,0,False
15年前他在爱妻葬礼上哭到昏厥，发誓永不再娶，如今他做到了吗？,2024-08-24 02:17,18580,582,八号探秘人,八号探秘人,在阅读此文之前，辛苦您点击一下“关注”，既方便您进行讨论和分享，又能给您带来不一样的参与感，感谢您的支持！编辑丨xk纵观鱼龙混杂的娱乐圈，有人背叛，有人痴情。而果靖霖则是公认的好男儿，将一生都奉献给妻子。但妻子却仅仅陪他走了半生，没能战胜病魔，不幸离开人世。,https://toutiao.com/group/7406210316734710283/,,0,0,False
罕见！100年前，英国游客拍下的清朝乡村，和想象中完全不一样,2024-09-20 02:07,4769,537,万物知识局,万物知识局,泥泞的土路，衣不蔽体的老百姓，即便是达官显贵的家中也十分破败，而这些都是清王朝的历史痕迹，虽说那时候中国摄影技术并不发达，但也有许多外国游客来到这里，拍摄下了许多老照片，为我们留下了珍贵的历史资料，那清朝到底是怎样的面貌呢?,https://toutiao.com/group/7416287738871267855/,,0,0,False
中国绝版老香烟，见过5种以上都是爷爷辈的，老烟民们抽过几种？,2024-08-20 08:54,757,129,万物知识局,万物知识局,文/万物知识局本文陈述所有内容皆有可靠信息来源，赘述在文章结尾在中国的历史长河中，烟草的传奇故事已历经四百载春秋。从明朝嘉靖年间葡萄牙使者带来的烟草，到如今琳琅满目的香烟品牌，烟草不仅见证了时代的变迁，也承载了无数人的记忆与情感。,https://toutiao.com/group/7405119584723927578/,,0,0,False
全球最大企业横空出世！市值突破24万亿元，相当于18个阿里的总和,2024-11-02 07:44,497,155,藏剑游侠儿,藏剑游侠儿,在英伟达暴涨之前，全球市值最高的企业头衔一直都是苹果和微软在争夺，随着英伟达股价飙升，这一局面随之被打破。,https://toutiao.com/group/7432581557157724682/,,0,0,False
6年前那个诬告朱军性骚扰，让朱军丢掉工作的弦子，现在如何了？,2024-08-15 06:23,91482,19687,老牧说,老牧说,2018年7月底，一个看似平常的日子，但对于央视的主持人朱军来说，这却是噩梦的开始!如今距离这件事情已经过去了6年，这两位当事人又都是一种怎样的处境?,https://toutiao.com/group/7403242398388503092/,,0,0,False
一个雷佳音加一个张小斐就够搞笑了，再加一个岳云鹏，这段能笑死,2024-10-23 05:10,4659,343,颜小羽,颜小羽,,https://toutiao.com/group/7428834244249518604/,,0,0,True
她曾被前夫一巴掌扇到离婚！二婚嫁世界冠军，如今生活幸福滋润,2024-09-10 09:12,15346,268,豆莱说,豆莱说,“漂亮的让人挪不开眼”是圈内人对她的评价，和“山杏”不一样的是，李琳在现实生活中的感情很是幸运，遇到了导演王小列。,https://toutiao.com/group/7412930201929204236/,,0,0,False
写歌30年穷困潦倒，前妻失望选择离婚，谁料51岁靠一首歌一夜成名,2024-08-12 03:37,26230,4348,八号探秘人,八号探秘人,在阅读此文之前，辛苦您点击一下“关注”，既方便您进行讨论和分享，又能给您带来不一样的参与感，感谢您的支持！编辑：LY无数人都想要一个一夜成名的机会，但机会来了也不是每个人都能把握住的。他用了三十年的时间来准备迎接属于自己的机会。为了这个机会他放弃了一切，甚至包括家庭。,https://toutiao.com/group/7402090890367484428/,,0,0,False
张亚军同志突发疾病逝世,2024-11-05 06:56,568,165,闽南网,闽南网,中国共产党党员，清华大学教授，清华大学核能与新能源技术研究院副总工程师张亚军同志，于2024年11月3日8时59分，因突发急性心肌梗死、抢救无效，不幸逝世，享年62岁。,https://toutiao.com/group/7433685262821114419/,,0,0,False
