title,publish_time,like_count,comment_count,media_name,source,abstract,article_url,tag,is_yaowen,article_sub_type,has_video
哪一刻 硬控了你的2024？,2024-12-24 09:01,1006,507,央视新闻,央视新闻,哪个时刻，硬控你的2024？是热辣滚烫的浪潮来临，还是充满passion的圆梦奥运；是飞天浪漫的星光熠熠，还是每一步都算数的踏实底气。无论哪一刻，都凭实力硬控你的2024！,https://content-static.cctvnews.cctv.com/snow-book/index.html?item_id=1119859611919555747&source=50006&sub_source=50006_001,,0,0,False
中央定调2025年养老金上涨，计算公式，企退人员能涨7%以上吗？,2024-12-18 04:29,2847,407,社保当家,社保当家,中央定调2025年养老金上涨，计算公式，企业退休人员能涨7%以上吗？在2025年到来之际，养老金上涨的消息就早早地确定了，这无疑给广大退休人员吃上了定心丸。因为根据近期召开的中央经济工作会议，已经明确提出要适当提高退休人员的基本养老金待遇。,https://toutiao.com/group/7447756391172833827/,,0,0,False
包厢全是刚出狱的恶霸，结果一看到饭店主厨，立马怂了,2024-11-11 01:21,13701,375,乐视群星访谈秀,乐视群星访谈秀,,https://toutiao.com/group/7435825833048015400/,,0,0,True
给《我是刑警》演技最好10位演员排座次：于和伟第3，第1名没争议,2024-12-18 04:06,2123,388,皮皮电影,皮皮电影,《我是刑警》收官之际，网上的争议，却也多了不少。有人盛赞它是“近10年最硬核刑侦剧”，老派纪实的剧作风格，令人着迷。受其影响，很多观众开始追起了二十多年前的《中国刑侦1号案》《12·1枪杀大案》。有人评价它“高开低走”。,https://toutiao.com/group/7449562650628866595/,,0,0,False
萝卜和鸡蛋这样做，比吃补药还补，顿顿吃都不会腻，又香又下饭,2024-10-30 12:28,68232,4192,小寒厨艺,小寒厨艺,萝卜和鸡蛋这样做，比吃补药还补，顿顿吃都不会腻，又香又下饭,https://toutiao.com/group/7431405463378919975/,,0,0,True
全球最大电磁弹射无人机航母，两栖攻击舰 076即将下水,2024-12-22 09:48,26278,1208,杜文龙,杜文龙,,https://toutiao.com/group/7451170777983877632/,,0,0,True
财政部：2025年要提高城乡居民基础养老金,2024-12-24 04:17,4017,9295,央视新闻,央视新闻,12月23至24日，全国财政工作会议在北京召开。会议强调，2025年要重点做好六方面工作。一是支持扩大国内需求。适当提高退休人员基本养老金，提高城乡居民基础养老金，提高城乡居民医保财政补助标准，大力提振消费。,https://content-static.cctvnews.cctv.com/snow-book/index.html?item_id=4907883216418251291&source=50006&sub_source=50006_001,,0,1,False
美国一富豪被冷冻50年，原定2017年苏醒，解冻时工作人员紧急叫停,2024-11-27 22:40,4591,348,未央史默,未央史默,并且在商业投资方面詹姆斯也有极大的眼光，因此，詹姆斯的财富迅速累积，成为当时美国最顶级的富豪之一。詹姆斯原本以为自己的人生会一直顺遂下去，可在他72岁那一年，突然发生了变化。,https://toutiao.com/group/7441895514641941003/,,0,0,False
吹牛不打草稿，瞎话张口就来，那些忽悠人的“成功学大师”都有谁,2024-12-17 12:07,3245,645,姩姩有娱,姩姩有娱,出门在外，身份都是自己给的。有人敢说，有人敢信。明明自己过得一片狼藉，却与人大传“成功秘笈”。离谱的是有人对此深信不疑。为了能够获得“成功学秘籍”有人不惜砸锅卖铁，花费重金，也要求购成功秘籍。最终也落得个鸡飞蛋打，血本无归的下场。,https://toutiao.com/group/7449304775688127030/,,0,0,False
明年富得流油的4个生肖，尤其第三名，快来接财,2024-12-24 05:59,1142,416,清闲的花猫,清闲的花猫,,https://toutiao.com/group/7451854024107622951/,,0,0,True
河南警察3岁女儿被拐，苦寻全国23年无果，结果却发现女儿在对门,2024-11-05 07:43,5302,605,八号探秘人,八号探秘人,寻亲23年无果，丢失的女儿竟住在对门?但它却真实发生在河南洛阳的梁绍波身上。是意外走丢，还是人贩子所为，三岁的女儿怎会离奇失踪?,https://toutiao.com/group/7433697108120142345/,,0,0,False
清华才女李一诺：27岁博士毕业，4年生3娃，能替世界首富花钱,2024-12-18 05:51,4710,279,云莳一,云莳一,家庭是她第一个学校，妈妈是她第一任老师。李一诺27岁博士毕业进入美国麦肯锡公司，33岁成为公司全球董事合伙人，之后四年连生3娃。,https://toutiao.com/group/7449591069311779355/,,0,0,False
毛人凤下令带走死囚，哪料死囚的靠山露面了，毛人凤当场懵了,2024-11-25 03:05,13647,2415,南哥硬汉秀,南哥硬汉秀,,https://toutiao.com/group/7441047753771188799/,,0,0,True
通报！校长、班主任停职！对相关责任人启动调查问责！,2024-12-24 03:01,477,490,闽南网,闽南网,合江县成立由县教育体育局、县公安局、石龙镇人民政府等单位组成的联合调查组，开展调查处理。现将有关情况通报如下:经查，合江县石龙镇中学八年级学生陈某某、张某某、罗某、曾某某、刘某某对同学王某某实施了掌掴、灼伤的伤害行为。,https://toutiao.com/group/7451807956791853618/,,0,0,False
炸肉丸子，到底用淀粉还是面粉，教你一招，外酥里软超好吃,2024-10-01 09:23,7201,563,家常的味道,家常的味道,,https://toutiao.com/group/7420735473208787492/,,0,0,True
画家李壮平让女儿当人体模特，创30余幅画作，获奖无数却争议不断,2024-12-22 10:10,461,103,晓娱海棠,晓娱海棠,可作为画家的李壮平，竟然直接让自己的女儿当起了免费的“人体模特”。其实在艺术界，不少画家都会用自己的妻子当做模特。,https://toutiao.com/group/7451169406673109539/,,0,0,False
郭有才：当迷失方向忘记初心后，曾经飘得多高，如今摔得就多惨,2024-11-11 06:53,2032,859,八号探秘人,八号探秘人,在阅读此文之前，辛苦您点击一下“关注”，既方便您进行讨论和分享，又能给您带来不一样的参与感，感谢您的支持！编辑丨brt因为一首翻唱，他一夜之间成为了拥有千万粉丝的网红。但是“人红是非多”，不久他就因为版权等问题陷入了舆论风波。他的人气一落千丈，从万众瞩目变成了现在的无人问津。,https://toutiao.com/group/7435901170239078948/,,0,0,False
炖鸡肉不要焯水和直接下锅，教你一招，鸡肉鲜香滑嫩不腥不柴,2024-12-15 08:45,4602,226,家常的味道,家常的味道,炖鸡肉千万不要焯水和直接下锅，教你秒招，鸡肉鲜香滑嫩不腥不柴,https://toutiao.com/group/7448556944597451275/,,0,0,True
67岁执意生娃，如今却坐轮椅无法自理，5岁的天赐被迫独立学洗衣,2024-11-04 10:32,9809,2249,睿之悦,睿之悦,2019年，已经67岁的田新菊执意生下了自己的第三个孩子小天赐。那么，现如今5年的时间过去了，这“天赐”的礼物到底是福还是祸呢?,https://toutiao.com/group/7433367394946384435/,,0,0,False
小子从小被猴养大，长大成半人半兽，身怀出神入化的武功,2024-11-22 03:36,648,101,乐视群星访谈秀,乐视群星访谈秀,,https://toutiao.com/group/7439942541555794471/,,0,0,True
给24年最好的十部国产剧排名：《我是刑警》仅第10，第1名没争议,2024-12-19 09:05,1445,268,皮皮电影,皮皮电影,2024年接近尾声，回顾这一年的国产剧，我们可以发现一些变化：第一大变化，是央视的动作。从2020年起，或许是面临网剧精品化的冲击，央视也开始主动求变。最开始的动作，还只是瞄准开年大剧，比如2021年的《觉醒年代》、2022年的《人世间》。,https://toutiao.com/group/7449943522318238260/,,0,0,False
近5年最热的十部剧，《狂飙》第9，《繁华》第6，第1名很难超越,2024-12-01 03:58,1472,541,电影烂番茄,电影烂番茄,今天，番叔就结合口碑，给大家盘点一下近五年，热度最高的十部电视剧。第十名:《都挺好》 猫眼热度 9775.8，播出时间2019年。,https://toutiao.com/group/7430845717314273831/,,0,0,False
台著名网红钟明轩第一次来北京，与出租车司机的对话太好笑了！,2024-12-22 07:38,1504,922,小羊看世界,小羊看世界,,https://toutiao.com/group/7451137294944764426/,,0,0,True
男子从老婆手中里解救出小三后，牵着狗头也不回的离开了,2024-11-20 09:07,35956,12680,橙橙分享,橙橙分享,,https://toutiao.com/group/7439285557244461606/,,0,0,True
二少爷装疯卖傻，少奶奶派出丫鬟前去试探他，有好戏看了,2024-11-23 23:28,4175,756,乐享综艺剧场,乐享综艺剧场,,https://toutiao.com/group/7439971404629410342/,,0,0,True
天冷电动车充足电，加油门就掉2格电，告诉你原因并分享改善方法,2024-11-29 23:13,744,114,境心说车,境心说车,在寒冷的天气里很多朋友都反馈电池没有以前耐用了，明明电池已经充足电但上路行驶一加油门，电量表就会突然掉两格电，车辆续航里程也大幅下降。,https://toutiao.com/group/7442528079165096448/,,0,0,False
宋美龄106岁去世，贴身厨子回家后不久自尽，事后妻子透露出缘由,2024-10-28 09:22,14560,507,历史与江湖,历史与江湖,2003年10月，106岁的宋美龄在美国纽约去世，这位世纪老人虽然永远地闭上了双眼，但是却留下了一个长寿神话。,https://toutiao.com/group/7430753866158817855/,,0,0,False
海南富商张晖：花8亿建108米海上观音像，4年后死在水中死因成谜,2024-10-19 04:49,3869,655,八号探秘人,八号探秘人,在阅读此文之前，辛苦您点击一下“关注”，既方便您进行讨论和分享，又能给您带来不一样的参与感，感谢您的支持！编辑丨xk他是中国的一名富商，耗费8亿元完成了自己的梦想。可梦想落地成为现实的时候，他却在4年后莫名其妙的死去。他就是张晖，上个世纪末海南岛旅游业的龙头当家人。,https://toutiao.com/group/7427288913095492134/,,0,0,False
100年前，清朝罕见留影，王爷妻妾婀娜多姿，乞丐全身挂满垃圾,2024-10-14 09:58,2712,303,万物知识局,万物知识局,每一张老照片，都像是时间的低语，它们静静地躺在历史的相册中，却在不经意间将我们拉回到那个遥远而神秘的年代。,https://toutiao.com/group/7425457574731579919/,,0,0,False
香港九龙寨城老照片：曾是香港最邪恶肮脏之地，图9场景令人作呕,2024-11-21 11:32,2623,473,万物知识局,万物知识局,有这么一个地方，他虽然地处极度繁华的都市香港，但是却脏乱不堪，环境极度的恶劣，各种违法的交易都在这里进行，甚至黄赌毒，也在这里悄然滋生，这就是九龙城寨。,https://toutiao.com/group/7439657140518519296/,,0,0,False
女子被多人密谋灌醉强奸后投江自尽，生前在手机备忘录记下被胁迫经过，三男子获罪,2024-12-18 16:40,12419,9722,红星新闻,红星新闻,投河自尽前，黄某某于2023年7月4日在其手机内创建了备忘录，记录下了她被胁迫的经过，这也成为了公检法日后侦查、起诉和判决的重要物证。,https://cdsbrss.cdsb.com/toutiao_no_video.php?url=https%3A%2F%2Fstatic.cdsb.com%2Fmicropub%2FArticles%2F202412%2Fc6419feb940b5f2c2302f01847e73bb8.html,,0,0,False
俄罗斯的决心很大，俄乌冲突可能到了最危险的时刻,2024-12-20 11:34,9036,613,金灿荣教授,金灿荣教授,,https://toutiao.com/group/7450456114459574820/,,0,0,True
这才是顶级女特工，精通格斗和枪械，为查真相血战黑白两道,2024-12-14 16:00,778,138,乐视热播综艺精选,乐视热播综艺精选,,https://toutiao.com/group/7448093827979543067/,,0,0,True
马桶冲水无力没有吸力？一般都是这4个原因，大部分自己就能解决,2024-12-08 11:33,1364,136,阿兵电器维修,阿兵电器维修,马桶冲水无力没有吸力？很简单，一般都是这4个原因，大部分自己就能解决,https://toutiao.com/group/7446002675537150491/,,0,0,True
如何看待美国出台的《2024中国军力报告》？,2024-12-23 05:18,19530,1087,大刘说说,大刘说说,美国国防部最近出台了2024中国军力报告，今年我们来聊聊西方世界是如何看待中国的军力发展的,https://toutiao.com/group/7451472335464301096/,,0,0,True
15年保安徒手接跳楼女孩，女孩母亲：我女儿若有事，你一辈子负责,2024-10-07 09:28,741,296,睿之悦,睿之悦,文|睿之悦编辑|睿之悦“我的女儿要是有什么事情的话，你要负一辈子的责任！”2015年，一名保安在得知有人跳楼的时候，不顾自身的安危，徒手将跳楼的女孩给救了下来。可令人感到的心寒的是，被救女孩的家属不仅没有感谢这名保安，反而还对他恶语相向。那么，这究竟是怎么一回事呢？,https://toutiao.com/group/7422961323312431656/,,0,0,False
海一天，不靠当领导的父亲，46岁才走红，娶二婚妻子待继子如亲生,2024-12-19 06:54,1790,439,豆莱说,豆莱说,文：豆莱说编辑：豆莱说在娱乐圈中，不乏有很多星二代，他们一出生便含着金汤匙，什么不用做就已经到达了普通人努力一辈子都到达不了的罗马。但是海一天却是一个例外，他从不靠着家里的关系，凭借着自己的努力进入演艺圈，可是却一直籍籍无名，直到46岁才走红，可算是真正的大器晚成。,https://toutiao.com/group/7450010154218668553/,,0,0,False
丈母娘觉得女婿没本事，谁料去他单位一看，被女婿官威吓傻,2024-11-25 02:07,1342,303,南瓜最前线,南瓜最前线,,https://toutiao.com/group/7441032711340294696/,,0,0,True
