title,publish_time,like_count,comment_count,media_name,source,abstract,article_url,tag,is_yaowen,article_sub_type,has_video
反华大鹰派卢比奥担任国务卿，特朗普在为中美大博弈释放什么信号,2024-11-13 09:31,42753,5191,邱毅台湾,邱毅台湾,,https://toutiao.com/group/7436694080400949801/,,0,0,True
姑娘花500块租男友，却不知人家是身价过亿总裁，好运来了,2024-11-03 04:00,2606,401,乐视明星的那点事,乐视明星的那点事,,https://toutiao.com/group/7432588748926812682/,,0,0,True
拦车收费？交警不管！景区不管！政府看不见！九寨沟咋全是土匪？,2024-09-22 15:55,226780,44392,行哥嘚啵嘚,行哥嘚啵嘚,,https://toutiao.com/group/7417496641638400527/,,0,0,True
51年洪学智妻子寻女无果，到老乡家歇脚老乡惊呼：你要找得就是我,2024-09-22 01:07,14296,936,品古观今,品古观今,前言1951年，阳曲县委大院突然来了7、8位解放军同志，其中一位女同志，就是洪学智的妻子张文。她此番前来，就是为了寻找多年前因战乱而寄养于民间的爱女。可昔日的小村落早已蜕变成另一番景象，这无异于是大海捞针。,https://toutiao.com/group/7417034363226915354/,,0,0,False
医生发现：不容易得癌症的人，一般都有5个“特质”，你占几个？,2024-11-15 11:19,3928,396,39健康网,39健康网,“癌症是人类追求健康路上难以回避的挑战。”近年来，癌症似乎越来越频繁地出现在人们的视线中。无论患者还是健康人，都对“患癌概率”心存疑问：为何偏偏是自己中招？自己的患癌风险究竟有多大？一、人活一辈子，得癌症的几率有多大？,https://toutiao.com/group/7437417286899646976/,,0,0,False
拜登下台前，跟中国谈了什么？中美大局已定，中方还能做的两件事,2024-11-17 05:41,24017,2363,邱震海,邱震海,,https://toutiao.com/group/7438119196094890531/,,0,0,True
特朗普砸盘，马斯克：废除75%美国联邦机构，46个州宣布货币自立,2024-11-13 12:10,4063,955,BWC中文网,BWC中文网,特朗普砸盘，马斯克：废除75%美国联邦机构，46个州宣布货币自立,https://toutiao.com/group/7436731541847278120/,,0,0,True
上海老两口怒了：3套房还给我们！给儿子一家洗衣做饭，还被这么欺负？,2024-11-17 01:46,1346,475,北青网,北青网,为了安享晚年得到儿子的赡养上海两位年近九旬的老人不仅将3套动迁房产权份额赠与儿子一家还将40余万元养老钱交儿媳保管然而儿子不仅没有尽孝而且还因推倒母亲被判处刑事处罚老两口为此诉至法院要求撤销赠与11月14日，记者从上海市浦东新区人民法院（以下简称上海浦东法院）获悉，此前，该院审理,http://t.ynet.cn/h5/36066785.html,,0,0,False
包厢全是刚出狱的恶霸，结果一看到饭店主厨，立马怂了,2024-11-11 01:21,5994,138,乐视群星访谈秀,乐视群星访谈秀,,https://toutiao.com/group/7435825833048015400/,,0,0,True
手上一奇穴，让你肝血充足眼睛亮，现在揉效果最好,2024-10-21 07:30,89110,9430,梁医学社梁怡璋医生,梁医学社梁怡璋医生,,https://toutiao.com/group/7427920784783311396/,,0,0,True
3年前，宁夏7岁小女孩一笑走红，后拒百万签约，如今怎么样了？他们后悔了吗？,2024-09-19 07:25,11254,1556,睿之悦,睿之悦,2021年，视频镜头中出现的女孩儿用那一抹甜美的笑容，迅速引起了网友们的广泛关注。有媒体公司看到这一机遇，提出愿意用百万巨资与女孩儿签约，然而，女孩儿的父母却坚决拒绝了这一提议。,https://toutiao.com/group/7416250139544879679/,,0,0,False
俩人相亲互相看不上，哪料男方一报母亲身份，姑娘乐了,2024-11-08 01:50,8938,2109,乐视群星访谈秀,乐视群星访谈秀,,https://toutiao.com/group/7434719902990074395/,,0,0,True
校园持刀伤人事件，警方刚刚通报：致8死17伤！,2024-11-17 02:15,1536,2872,全国党媒信息公共平台,全国党媒信息公共平台,11月16日晚，江苏无锡市公安局发布警情通报:2024年11月16日18时30分许，宜兴无锡工艺职业技术学院发生一起持刀伤人案件，共造成8人死亡、17人受伤，犯罪嫌疑人被当场抓获。,https://api-m.hubpd.com/transfer?nextUrl=https%3A%2F%2Fwww.hubpd.com%2Fhubpd%2Frss%2Ftoutiao%2Findex.html&contentId=5476377146885787180,,0,1,False
超40只死亡！广州多区，报告疑中毒病例,2024-11-17 03:02,307,295,湖南日报,湖南日报,南都记者注意到，11月16日，广东省宠物行业协会通报，目前已确认有超过40只宠物狗因疑似中毒死亡，受影响地区包括广州市多个区，其中白云区、海珠区和番禺区报告的病例数量较多。,https://m.voc.com.cn/portal/news/show?id=21321642,,0,0,False
原来他才是毁掉刘翔真凶，因贪1200万被公审，让刘翔背负多年骂名,2024-08-29 09:58,14829,447,八号探秘人,八号探秘人,在田径场上创造的成绩，至今无人能够打破，甚至在国际上享有盛名。本该继续夺冠之路，却两次因伤退赛，遭到了全网辱骂。,https://toutiao.com/group/7408489498465616410/,,0,0,False
钾含量是香蕉的7倍！这种蔬菜抗炎、抗氧化、保护心血管健康,2024-09-03 12:05,9504,1582,奇妙的本草,奇妙的本草,刘大爷今年72岁，患有高血压多年，期间一直服药控制病情。开始时以为是血压没控制好导致的，但多次测量血压均处于稳定范围内。,https://toutiao.com/group/7410354585295913524/,,0,0,False
大老虎在总统套房潇洒，殊不知对面住着中央领导，有戏看！,2024-10-15 02:37,4875,205,乐视群星访谈秀,乐视群星访谈秀,大老虎在总统套房潇洒，殊不知对面住着中央领导，有戏看！,https://toutiao.com/group/7425826039802102284/,,0,0,True
特朗普赢却难就职？拜登怕追责，佩洛西怕牢饭，三大集团蠢蠢欲动,2024-11-14 22:04,36265,1549,黎建南台湾,黎建南台湾,,https://toutiao.com/group/7437259350143402515/,,0,0,True
44年前，内蒙一女军医被头公狼拦住，她跟着公狼走向草丛的深处,2024-11-12 08:30,2106,213,艺述史,艺述史,1978年一个夜晚，草原上夜幕低垂，寒风呼啸而过。内蒙古草原上一片静谧，一眼望去尽是苍茫夜色，连月亮都只有一个尖，四下少有人迹，甚至隐约能听到狼嚎。“别过去，危险！,https://toutiao.com/group/7436214474274554368/,,0,0,False
中国飞机卖爆了，自己都不够用了！其他国家有福了，霸权到头了,2024-11-16 23:00,680,132,国际新时讯,国际新时讯,中国飞机卖爆了，航展的第一天就卖出了130架飞机，很多网友表示，咱们自己的飞机都供不应求，那国外肯定是想买都买不到。但是其他国家也有福了，因为中国武器装备的出口，有助于增强其他国的国防能力，维护地区和平与稳定。,https://toutiao.com/group/7436680335134163468/,,0,0,False
她曾被前夫一巴掌扇到离婚！二婚嫁世界冠军，如今生活幸福滋润,2024-09-10 09:12,16723,294,豆莱说,豆莱说,“漂亮的让人挪不开眼”是圈内人对她的评价，和“山杏”不一样的是，李琳在现实生活中的感情很是幸运，遇到了导演王小列。,https://toutiao.com/group/7412930201929204236/,,0,0,False
母亲瘫痪、父亲疯了，当年那个744分的高考状元，7年后却成了这样,2024-09-08 00:54,9098,1441,八号探秘人,八号探秘人,母亲截肢瘫痪、父亲疯癫痴傻，可对于自己的亲人，他却做出了这样的评价。而今，7年已过，曾经那个让无数人动容的少年，现在如何?,https://toutiao.com/group/7411852147648496162/,,0,0,False
特朗普为什么不用蓬佩奥，而且面子里子都不给，老蓬犯了什么禁忌,2024-11-12 09:23,42475,1541,邱毅台湾,邱毅台湾,,https://toutiao.com/group/7436320981239235087/,,0,0,True
泽连斯基称，俄乌冲突将尽快结束，美国已完全实现目标,2024-11-17 10:13,1676,137,杜文龙,杜文龙,,https://toutiao.com/group/7438189310425170467/,,0,0,True
特朗普怎么结束俄乌战争和中东战争，泽连斯基纳塔亚胡命运大不同,2024-11-14 05:39,18896,576,邱毅台湾,邱毅台湾,,https://toutiao.com/group/7437005549285147187/,,0,0,True
宝宝出生时“几斤几两”，能暗示智商高低？医生：最佳标准在这里,2024-09-04 10:41,2020,482,39健康网,39健康网,琳琳是一位二胎宝妈，老大出生的时候只有5斤重，一家人都十分心疼他，平常照顾得十分尽心，现在看起来和同龄的小孩没什么区别。于是在去年，琳琳和丈夫一起商量要了二胎，可能是有经验，出生的时候有8斤重。,https://toutiao.com/group/7410732676779115048/,,0,0,False
喝点水，尿就多，这是提示肾好？还是肾虚呢？今天一次讲清楚,2024-11-04 03:20,1806,142,中医沈宏,中医沈宏,有的人，稍微喝点水尿就多，尤其是现在天冷的时候这种情况更加明显，那大部分人觉得尿频多尿，往往就是肾虚的表现，对此中医是怎么看的呢?,https://toutiao.com/group/7433251718583829026/,,0,0,False
"万万没想到,53岁“丁克”半辈子的康辉，一生遗憾竟然是一通电话",2024-08-21 22:14,29177,5509,峰哥正读,峰哥正读,在阅读此文之前，麻烦您点击一下“关注”，既方便您进行讨论和分享，又能给您带来不一样的参与感，感谢您的支持！文/编辑：蘑菇百善孝为先。但是到底怎么做才算是“孝”，康辉用了半辈子才明白。央视知名主持人康辉，事业顺遂，家庭幸福，在外人看来是一个人生赢家。,https://toutiao.com/group/7405504703687115273/,,0,0,False
给近三年最好的10部年代剧排个名：《人世间》第6，第1名没有争议,2024-10-28 07:10,1976,1091,稻述,稻述,到了20世纪初，偶像剧成为人们的掌中宝，但要说现在什么剧最受欢迎，那一定是年代剧!其中《人世间》只能排第六，第一名人人都爱看，最后一名也比上不足比下有余。,https://toutiao.com/group/7430715494055264783/,,0,0,False
全国哪里大米最好吃？经评比：这4种大米最出名，有你的家乡吗？,2024-09-30 00:00,4358,2069,云莳一,云莳一,"文|柯儿编辑|柯儿前言“找呀~找呀~找大米，找来找去找不到""你是否有过站在琳琅满目的大米前，不知道如何选的经历。而中国大米种类高达上千种，你又知道哪些最好吃吗?很多人肯定会说五常大米，但除此之外，还有4种大米最出名，看看会有你家乡的吗？",https://toutiao.com/group/7417744940429558313/,,0,0,False
女子帮朋友取快递，哪料突然窜出十多个便衣围捕，直接懵了,2024-10-31 05:46,22273,2040,乐视综艺咖,乐视综艺咖,,https://toutiao.com/group/7431812179310936614/,,0,0,True
经常吃酵母蒸的馒头，对身体有害吗？为了家人健康，不妨看一看,2024-09-02 09:36,4603,265,美食探索家,美食探索家,来源：美食探索家 馒头，古称“蛮头”，也有人习惯称之为“馍馍”，回家吃饭了，说的就是吃馒头，并不是大米饭，馒头是中国传统又古老的面食，主要食材为小麦粉，经过发酵而成，随着人们烹饪技术的提升，越来越多的面食，也被相继开发出来，包子、花卷、水饺、面条、大饼、糕点等，其中就属馒头的普及,https://3w.huanqiu.com/a/92b4ef/4JGubnnOoAL?agt=20,,0,0,False
军号一响，全军出击！,2024-09-19 08:01,30636,1884,中国军号,中国军号,,https://toutiao.com/group/7416261401477382668/,,0,0,True
男性如果此部位的毛发变白，说明寿命在逐渐减少，你了解吗？,2024-11-15 15:16,3766,818,阿鱼说养生,阿鱼说养生,,https://toutiao.com/group/7437525326458815016/,,0,0,True
越来越多人搬离两梯四户？过来人说出大实话，4个缺点无法忍受,2024-11-01 10:07,1093,378,室内设计师有料儿,室内设计师有料儿,要是我，就不会买两梯四户的房子。2梯4户的户型，不管是边户还是中间户，住起来都不舒服。市场上有一梯一户，一梯两户，两梯四户等房型，两梯四户的房子会便宜一点，所以很多人看到性价比高会选它。但是，从过来人的经验总结出，这种户型麻烦多，住起来不舒适，买了的都后悔了。,https://toutiao.com/group/7431873413393826344/,,0,0,False
送给所有知道我名字的人 想送一份祝愿给大家，所以唱了这首歌,2024-11-13 04:30,123655,20799,李子柒,李子柒,,https://toutiao.com/group/7436616916803781171/,,0,0,True
黄芪伤肾，黄芪泡水喝危害多？再次提醒：真正伤肾的是这3类中药,2024-10-29 07:34,29156,2367,梁医学社梁怡璋医生,梁医学社梁怡璋医生,,https://toutiao.com/group/7431097743307473408/,,0,0,True
小伙洗完澡故意秀肌肉，富婆心跳加速被当场拿下，这下好看了,2024-10-26 16:20,8395,333,乐视情感讲堂,乐视情感讲堂,小伙洗完澡故意秀肌肉，富婆心跳加速被当场拿下，这下好看了,https://toutiao.com/group/7430011217881596426/,,0,0,True
