title,publish_time,like_count,comment_count,media_name,source,abstract,article_url,tag,is_yaowen,article_sub_type,has_video
张紫妍：被迫陪睡31人近百次，遭道具虐待，29岁自杀留230页遗书,2024-07-24 02:37,13819,981,八号探秘人,八号探秘人,在阅读此文之前，辛苦您点击一下“关注”，既方便您进行讨论和分享，又能给您带来不一样的参与感，感谢您的支持！本文叙述皆有官方信源，为了读者有更好体验，放在了文章后缀！,https://toutiao.com/group/7394994383675736576/,,0,0,False
西方专家：中国发射东风31AG不可怕，可怕的是另一件事,2024-10-14 00:38,2111,172,大国纪录,大国纪录,今年国庆节前夕，中国人民解放军火箭军发射了一枚洲际弹道导弹，如同是在国际社会，尤其是美西方为主体的欧美国家，投下了一枚重磅炸弹。,https://toutiao.com/group/7425423279743058473/,,0,0,False
她是央视最惨主持人，男友被判死缓，丈夫诈骗入狱，47岁无人敢娶,2024-08-27 23:30,2249,209,闻书识焉,闻书识焉,她曾是央视的台柱子，和董卿、周涛并称为央视的三朵金花。回顾刘芳菲的前半生，最令人感到惋惜的，便是她的感情生活，47岁至今无人敢娶。,https://toutiao.com/group/7407743113688564258/,,0,0,False
3年前，宁夏7岁小女孩一笑走红，后拒百万签约，如今怎么样了？他们后悔了吗？,2024-09-19 07:25,2100,418,睿之悦,睿之悦,2021年，视频镜头中出现的女孩儿用那一抹甜美的笑容，迅速引起了网友们的广泛关注。有媒体公司看到这一机遇，提出愿意用百万巨资与女孩儿签约，然而，女孩儿的父母却坚决拒绝了这一提议。,https://toutiao.com/group/7416250139544879679/,,0,0,False
网红郭有才，泡沫散去之后，曾经飘的有多高，如今摔得就有多惨,2024-09-30 09:36,717,432,八号探秘人,八号探秘人,曾经那个卖烧烤的店小二，可能怎么都想不到，自己会成为一个千万粉丝的网红。郭有才在刚成为网红之后的期望也很有意思，那就是每天能赚到300元就行。可现实却是靠着直播广告分成，他的收入直接比期望值翻了上千倍。有人说他其貌不扬，但是平凡人逆袭的典范，还有的人说他长的像日本人。,https://toutiao.com/group/7419978325617082932/,,0,0,False
今天才知道！电动车“每天充”和“用完再充”，到底哪个更伤电池,2024-08-27 11:19,12336,2194,鲸探所,鲸探所,“今天到底给车充不充电？”估计大多数人每天回家都会想这个问题，看着自己的电动车电量又多又少的，充不充电也是一件非常难以抉择的事情。那么，电动车到底应该怎样充电呢？是每天都充，还是用完之后再充呢？电动车充电不管是在城市还是农村，电动车其实都是人们出门最常见的交通工具。,https://toutiao.com/group/7407773012533117475/,,0,0,False
13年9岁男孩扶人被讹，老太坚持是被撞的：说谎死全家！结果如何,2024-10-05 09:17,420,136,大象微视,大象微视,13年时，一个9岁男孩和他的两位同学，出于善意，想要前去扶起一位在地上的老太太。但男孩刚一碰到老太太，那位老太太就指控男孩和那两位同学为撞人者，并坚决否认是自己摔倒的事实，甚至扬言到“说谎死全家!”,https://toutiao.com/group/7422216162442625571/,,0,0,False
一巴掌的代价，公交车上大妈打晕患癌小伙，断送退休后的幸福生活,2024-10-14 09:53,944,510,客观听書,客观听書,公交车上老太太和小伙吵了起来，老太太更是当仁不让直接给了小伙一巴掌。这名小伙直接倒地，老大大根本就不会想到正是因为他的一巴掌，鲜活的生命就这样消失在他的手里。,https://toutiao.com/group/7425563455358468627/,,0,0,False
中日已谈妥，当着我高层的面，石破茂连做3项保证，信号极不寻常,2024-10-15 08:52,2658,652,议史纪,议史纪,,https://toutiao.com/group/7425922725736088103/,,0,0,True
军号一响，全军出击！,2024-09-19 08:01,19868,1280,中国军号,中国军号,,https://toutiao.com/group/7416261401477382668/,,0,0,True
给近三年最好的10部年代剧排个名：《人世间》第6，第1名没有争议,2024-09-06 08:08,3453,1268,皮皮电影,皮皮电影,时尚是个轮回，电视剧也是。在2020年之前的那些年，电视剧市场基本上都被偶像剧、都市剧霸占。曾经撑起国剧品质的《闯关东》《岁月》这类年代好剧，难见踪影。,https://toutiao.com/group/7411390030722712090/,,0,0,False
儿子爱上离过两次婚的女人，母亲反对，女方一亮相全场看呆,2024-10-16 00:57,1517,420,悠闲火车I,悠闲火车I,儿子爱上离过两次婚的女人，母亲反对，女方一亮相全场看呆,https://toutiao.com/group/7426171402459284009/,,0,0,True
失联30年姐妹刷短视频相认3年后决裂，姐姐：宁愿没认识过,2024-10-18 16:14,265,217,大象新闻,大象新闻,这家看似不起眼的小店，却曾是张丽与其通过网络重逢的双胞胎妹妹程珂珂情感纠葛的舞台，两人在此爆发了激烈的冲突，最终分道扬镳。,https://share.hntv.tv/news/0/1847289743601397762,,0,0,False
全球约一半肝癌在中国，再次提醒：家中的4种食物，尽早撤下餐桌,2024-08-13 08:36,103536,3558,梁医学社梁怡璋医生,梁医学社梁怡璋医生,,https://toutiao.com/group/7402540119712629311/,,0,0,True
老人说“坟有6不葬，一葬穷三年”，哪6不葬？葬了穷三年？,2024-08-28 09:01,16471,776,惠农圈,惠农圈,之前实行土葬，关于土葬的说法有很多，比如“坟有六不葬，一葬穷三年”。那时候，人们认为逝者葬在哪里，不能葬在哪里，会给后人带来福或灾。,https://toutiao.com/group/7408111961839256064/,,0,0,False
民间上坟传统：“上坟不带 5 果，家中不惹灾祸”，哪“5果”？,2024-08-08 10:30,14308,1555,惠农圈,惠农圈,在中国传统文化中，祭祀祖先一直是一项备受重视的活动，它承载着对先人的缅怀、敬意和感恩之情。在上坟的时候，人们会提前准备好供品，比如肉类、酒水，还有水果。其中关于水果的准备，也有着诸多的讲究和禁忌，比如“上坟不带 5 果，家中不惹灾祸”的说法。,https://toutiao.com/group/7400584207141192207/,,0,0,False
为国争光却遭郎平弃用！转身效力土耳其的王一梅，如今咋样了？,2024-08-31 13:19,941,144,豆莱说,豆莱说,光阴似箭，日月如梭，当初的少女早已退役，成为了排球场的幕后人，这么多年她都经历了什么，现在又怎么样了呢?,https://toutiao.com/group/7409287778514567718/,,0,0,False
因穷离婚33年后，刀郎的前妻“私奔”回来了，这泼天富贵她接不住,2024-08-24 08:18,1353,132,8卦娱,8卦娱,文|8卦娱本文陈述所有内容皆有可靠信息来源，赘述在文章中如果让你忘记曾经深爱的人，你需要多长时间？当那个曾经无情抛弃你的人，却在你踏上巅峰时候“回心转意”，你的心中又作何感想？《2002年的第一场雪》作为当年家喻户晓的一首歌曲，或许因为这首歌你认识了刀郎，但你认识罗林吗？,https://toutiao.com/group/7406616749610762787/,,0,0,False
黑龙江美女囚犯毕丽梅，被枪决后在殡仪馆苏醒，家属：放了她吧?,2024-08-25 14:32,1928,261,墨山看客,墨山看客,女死刑犯被枪决后在殡仪馆起死回生，当场把火化的工作人员吓得够呛，就连随行的警察都吓了一跳，壮着胆上前检查一番后，立马把离奇的情况上报。不一会儿法医赶到现场，证实了女犯人的确还活着，亲属闻声下跪，以死过一回为理由，恳求放了她。,https://toutiao.com/group/7407082388163002921/,,0,0,False
