title,publish_time,like_count,comment_count,media_name,source,abstract,article_url,tag,is_yaowen,article_sub_type,has_video
俩人相亲互相看不上，哪料男方一报母亲身份，姑娘乐了,2024-11-08 01:50,9161,2157,乐视群星访谈秀,乐视群星访谈秀,,https://toutiao.com/group/7434719902990074395/,,0,0,True
特朗普赢却难就职？拜登怕追责，佩洛西怕牢饭，三大集团蠢蠢欲动,2024-11-14 22:04,38374,1644,黎建南台湾,黎建南台湾,,https://toutiao.com/group/7437259350143402515/,,0,0,True
成交2800亿，售出1195架飞机，中国拿下大单，足够造46艘055大驱,2024-11-18 10:32,1847,350,东方点兵,东方点兵,本届珠海航展成交金额再创新高，达到了2800亿，以这个价格来计算的话已经足够再造46艘055大驱，进一步彰显了中国制造实力的同时，也展示了中国军工的蓬勃发展。01 本届珠海航展卖出1195架飞机本届珠海航展3款五代机同款亮相，达成了历史性一幕的同时，也让这次航展的成交额再创新高。,https://toutiao.com/group/7438561690305839657/,,0,0,False
马斯克用的“减重神药”国内正式上市！平均减重17%，但只适合这两类人群,2024-11-17 09:33,1305,545,每日经济新闻,每日经济新闻,每经编辑：黄胜11月17日，诺和诺德宣布，全球首个且目前唯一用于长期体重管理的GLP-1RA（胰高糖素样肽-1受体激动剂）周制剂诺和盈（用于长期体重管理的司美格鲁肽注射液）正式在中国上市。诺和盈有严格的使用指征。,http://www.nbd.com.cn/rss/jinri_toutiao/articles/3648235.html,,0,0,False
顾客试衣服8小时到凌晨2点买走15件，37岁女老板直呼害怕：开店6年头一次遇到，还要请我吃夜宵,2024-11-18 05:10,2709,1393,大河报,大河报,来源 | 潇湘晨报、晨视频记者 | 张沁近日，安徽淮南一女装店老板发布视频称，有位顾客试7个多小时的衣服，从下午6点至凌晨2点，最终买走15件，37岁店老板余女士表示，“第一次遇见这样的顾客，她就是越试越喜欢，我们一边聊天一边试，就没有看时间。,https://toutiao.com/group/7438481982369137178/,,0,0,False
珠海航展让美国人脊背发凉？新加坡讲出大实话，给了四个原因,2024-11-15 11:15,4225,150,迷彩虎说,迷彩虎说,珠海航展看得美国人脊背发凉，他们从中看到了自己最羡慕，也是最害怕的东西，新加坡媒体将这些东西总结成了四点。,https://toutiao.com/group/7437463076917477897/,,0,0,True
吕礼诗参观珠海航展，见中国强激动流下男儿泪，台独玻璃心又碎了,2024-11-16 04:45,30232,1228,邱毅台湾,邱毅台湾,,https://toutiao.com/group/7437733759829180969/,,0,0,True
包厢全是刚出狱的恶霸，结果一看到饭店主厨，立马怂了,2024-11-11 01:21,6425,144,乐视群星访谈秀,乐视群星访谈秀,,https://toutiao.com/group/7435825833048015400/,,0,0,True
超150万人出手，线下也排长队！网友：抢不到，根本抢不到,2024-11-18 09:19,264,510,潇湘晨报•晨视频,潇湘晨报•晨视频,今天上午，华为余承东发布微博，官宣华为Mate品牌盛典将于11月26日14:30举行，届时将发布华为Mate70系列产品。其微博机型小尾巴显示系列新机将带来“超大杯”HUAWEI Mate 70 Pro+。,http://api.chenshipin.com/wap/a/673b04e88420175ea458e836/90f456b81afce808c1fcfbd3f5761f65/1731921502/d9b0fa51d8857932edd3957c221504e4c4953579de9d8e622c0777c1f5ee66a3,,0,0,False
重磅！中央宣布，六大城市启动eVTOL试点！万亿低空经济市场即将起飞,2024-11-18 07:17,468,149,金融界,金融界,今日，中央空管委将在合肥、杭州、深圳、苏州、成都、重庆六大城市开展eVTOL试点，对600米以下空域授权地方政府管理。,http://m.jrj.com.cn/toutiao/2024/11/18/45393141.shtml,,0,0,False
普京大喜，乌军大溃逃！库皮扬斯克被攻陷，更多土地归俄,2024-11-18 02:53,2688,152,李艺鹏观点,李艺鹏观点,普京大喜，乌军大溃逃！库皮扬斯克被攻陷，更多土地归俄,https://toutiao.com/group/7438446964196246052/,,0,0,True
对比苏-57和歼-35A，为中国复兴不再受辱而落泪 ，也冷静检讨不足,2024-11-17 22:01,29099,1503,黎建南台湾,黎建南台湾,,https://toutiao.com/group/7438371662023623168/,,0,0,True
2999元批量打造小娇妻，性商训练营尺度大到，不打码没眼看,2024-11-17 12:34,585,257,毒sir财经,毒sir财经,今年7月份，一张“性商训练营”的海报冲进人们视野，它的出现，就像平静的水面，扔进了一颗炸弹，瞬间在社交媒体上，激起千层浪。,https://toutiao.com/group/7438225082427671074/,,0,0,False
令欧洲担心的并不是乌克兰会输，而是普京的一句话,2024-11-18 07:03,2164,116,票姚校尉,票姚校尉,令欧洲担心的并不是乌克兰会输，而是普京的一句话,https://toutiao.com/group/7438511569052369423/,,0,0,True
破解特朗普加征关税，中国有7招,2024-11-15 14:05,25535,1685,静思有我,静思有我,,https://toutiao.com/group/7437506977830044200/,,0,0,True
给近三年最好的10部年代剧排个名：《人世间》第6，第1名没有争议,2024-09-06 08:08,12471,3870,皮皮电影,皮皮电影,时尚是个轮回，电视剧也是。在2020年之前的那些年，电视剧市场基本上都被偶像剧、都市剧霸占。曾经撑起国剧品质的《闯关东》《岁月》这类年代好剧，难见踪影。,https://toutiao.com/group/7411390030722712090/,,0,0,False
2024珠海航展：新军备 新亮点 新杀器 ｜军情观察室,2024-11-15 08:04,4192,211,凤凰卫视,凤凰卫视,,https://toutiao.com/group/7437413939794674185/,,0,0,True
独家专访李子柒：归来依旧热爱,2024-11-13 05:53,14894,2371,新华网,新华网,,https://toutiao.com/group/7436638041902416394/,,0,0,True
山西一家长曝17岁儿子被8名学生持钉棍殴打：头脸脖子被扎成窟窿眼！校方回应,2024-11-18 02:18,1536,1565,红星新闻,红星新闻,11月17日，韩女士反映17岁儿子在山西孪生艺术培训学校被8个学生持钉棍殴打入院。韩女士告诉记者，儿子与一位同学发生口角，原本已经调解，但结果遭其同学舍友不满，便于晚上协商对孩子动手。施暴者使用的工具系一根带钉子的棍子，导致孩子的头上、脸上和脖子上被扎成窟窿眼。,https://toutiao.com/group/7438437348561404470/,,0,0,False
电磁步枪现身珠海，非常科幻！无弹药壳无火药，但火力十足,2024-11-18 01:26,1326,151,迷彩虎说,迷彩虎说,在珠海航展上一款看上去非常科幻的步枪现身了，没有弹壳，没有火药，但是威力十足，这款武器就是传说中的电磁步枪。,https://toutiao.com/group/7438424714501489186/,,0,0,True
首例5胞胎长大了，父亲已过劳去世 母亲直言：如能重来一个也不要,2024-08-31 03:06,2934,809,睿之悦,睿之悦,2002年，在北京的一家妇产医院中，一位来自河北的孕妇顺利生下了两男三女的五胞胎，创造了一个全国罕见的奇迹。,https://toutiao.com/group/7409098624111575603/,,0,0,False
无缝衔接6个男友，同居5婚导演，逼正宫退位，如今44岁风情依旧！,2024-10-10 21:57,658,227,八号探秘人,八号探秘人,2004年，随着《山花烂漫时》的热播，饰演张桂梅校长的宋佳再次回到人们视野。令人不可思议的是，她跟5婚导演张黎曾有一段跨越伦理的恋情。,https://toutiao.com/group/7424061311518130699/,,0,0,False
姑娘花500块租男友，却不知人家是身价过亿总裁，好运来了,2024-11-03 04:00,2696,406,乐视明星的那点事,乐视明星的那点事,,https://toutiao.com/group/7432588748926812682/,,0,0,True
曾被张艺谋力捧，火后与富豪卷款61亿逃亡国外，现在的她过得如何,2024-11-02 09:26,1408,146,八号探秘人,八号探秘人,她就是韩熙庭，就在人们以为中国影视圈又要多出一位重磅影后时，她却突然销声匿迹，与一位富豪携巨款逃亡去了国外。,https://toutiao.com/group/7432569178801898034/,,0,0,False
赵薇等被强执8488元 赵薇公司等被强执1.4万,2024-11-18 02:11,1017,2358,金融界,金融界,天眼查司法案件显示，近日，赵薇、西藏龙薇文化传媒有限公司、祥源文旅新增一则被执行人信息，执行标的8488元，执行法院为浙江省杭州市中级人民法院。,http://m.jrj.com.cn/toutiao/2024/11/18/45387337.shtml,,0,0,False
韩国真急了,2024-11-14 08:50,6264,461,牛弹琴,牛弹琴,韩国贴了一张图，专门给特朗普看的,https://toutiao.com/group/7437054816481706532/,,0,0,True
特务男扮女装混进村子，孩子兵顿时发现不对劲，这下精彩了,2024-10-28 06:09,4626,487,乐视群星访谈秀,乐视群星访谈秀,,https://toutiao.com/group/7430704630294413878/,,0,0,True
