title,publish_time,like_count,comment_count,media_name,source,abstract,article_url,tag,is_yaowen,article_sub_type,has_video
珠海航展现可疑男子，非法扫描解放军装备！3个细节暴露真实身份,2024-11-21 00:00,1115,104,迷彩虎说,迷彩虎说,珠海航展上出了一个非常嚣张的间谍，手持扫描仪在众目睽睽之下就对解放军的武器装备一顿扫描，到底是谁给了他勇气这么做的？,https://toutiao.com/group/7439292406937158163/,,0,0,True
11年狂赚200亿，骗了10万中国人后跑路的亿万富翁，下场如何呢？,2024-09-26 09:05,3037,930,八号探秘人,八号探秘人,盘继彪，一个狂妄自大的骗子，11年间骗走200亿，把十几万中国人坑得是血本无归家破人亡。不仅如此，他还在跑路之前，杀人诛心的在他们公司官网发布了一条“我们跑路了“的公告，嘲讽受害者。,https://toutiao.com/group/7418792738887729704/,,0,0,False
“最牛星二代”廖凡，出道24年从不拼爹，妻子是周星驰的黄金拍档,2024-11-20 05:35,1128,541,卿羽飞,卿羽飞,最近电视剧《宿敌》正在央视8台热播中，不知道大家有没有观看呢?这部电视剧的主演是廖凡和朱珠，这真的是让人意想不到的搭配，廖凡和朱珠也是非常的有CP感。,https://toutiao.com/group/7439209147201077812/,,0,0,False
母亲瘫痪、父亲疯了，当年那个744分的高考状元，7年后却成了这样,2024-09-08 00:54,9818,1558,八号探秘人,八号探秘人,母亲截肢瘫痪、父亲疯癫痴傻，可对于自己的亲人，他却做出了这样的评价。而今，7年已过，曾经那个让无数人动容的少年，现在如何?,https://toutiao.com/group/7411852147648496162/,,0,0,False
“凶手出狱在逝者家附近摆宴席”事件最新进展：双方均表示不愿将矛盾延续到下代,2024-11-21 03:52,639,777,潇湘晨报•晨视频,潇湘晨报•晨视频,“20年前杀害我父亲的主谋出狱，在距离我家10米远的位置，大宴18桌宾客，鞭炮喧天，红毯铺地，亲朋好友夹道欢迎。”近日，四川绵阳涪城区青义镇男子向先生在网络发布相关文字和视频后，引起关注。11月20日下午，向先生告诉红星新闻，20年前，他父亲被对方雇凶在家中杀害。,http://api.chenshipin.com/wap/a/673eac4884201712ae0fa7b0/90f456b81afce808c1fcfbd3f5761f65/1732160932/8a1356850d4aae9aed52607655454f928eab93bc4713c0f0c10845e0cac99582,,0,0,False
猪肉别总是炒着吃了，教你简单又好吃的做法，简直太香了,2024-09-11 09:11,13691,686,家常的味道,家常的味道,猪肉别总是炒着吃了，教你简单又好吃的做法，简直太香了,https://toutiao.com/group/7413310656981664283/,,0,0,True
日本展出最新型激光武器，不比不知道，一比吓一跳,2024-11-19 12:12,20931,1594,陈虎点兵,陈虎点兵,,https://toutiao.com/group/7438962223550857768/,,0,0,True
炒白菜千万不要直接下锅，难怪不好吃，教你技巧，鲜嫩入味不出水,2024-10-30 09:23,10255,561,家常的味道,家常的味道,,https://toutiao.com/group/7431496869400576550/,,0,0,True
逆袭人生，找老婆建别墅当上老板，小奎一家终得圆满#娟奎之恋,2024-08-31 05:27,17004,2847,海哥量地球,海哥量地球,,https://toutiao.com/group/7409170930649268771/,,0,0,True
中国百强县市名单揭晓,2024-11-21 02:20,955,737,大河网,大河网,《中国县域发展监测报告2024》发布，中国百强县市、中国百强区名单揭晓　　11月19日，竞争力智库、北京中新城市规划设计研究院等机构在北京发布《中国县域发展监测报告2024》(以下简称《报告》)，《报告》揭晓了“2024中国综合竞争力百强县市”(简称2024中国百强县市)、“20,https://toutiao.com/group/7439551534523875849/,,0,0,False
太突然！知名房地产公司董事长去世,2024-11-21 10:40,679,370,大皖新闻,大皖新闻,11月21日，昆明尊园房地产经纪有限公司（以下简称昆明尊园地产）官方账号发出一则讣告：尊园地产创始人、董事长李云波先生，因病去世。,http://www.ahwang.cn/toutiao/202411/2776900.html,,0,1,False
45名“港独”被判刑，美国威胁立即放人，真是笑话！,2024-11-21 06:43,2056,140,第一军情,第一军情,综合路透社、卫报等多家外媒11月20日报道，当地时间周二，中国香港地区高等法院针对47名在此前的“港毒”活动中被捕的“政治活动人士”作出正式判决。,https://toutiao.com/group/7439619443166020131/,,0,0,True
首例5胞胎长大了，父亲已过劳去世 母亲直言：如能重来一个也不要,2024-08-31 03:06,3050,834,睿之悦,睿之悦,2002年，在北京的一家妇产医院中，一位来自河北的孕妇顺利生下了两男三女的五胞胎，创造了一个全国罕见的奇迹。,https://toutiao.com/group/7409098624111575603/,,0,0,False
被姚明抱着上奥运的小英雄，曾发誓考上清华，16年后活成了这样,2024-11-07 08:07,2478,601,睿之悦,睿之悦,2008年，年仅9岁的林浩，在姚明的带领下走进了北京奥运会开幕式的舞台上，成为了万众瞩目的“焦点”。,https://toutiao.com/group/7434444094551687707/,,0,0,False
河南女子去世，山东丈夫将手机埋墓里，充1000元话费，每天打电话,2024-11-01 06:52,2843,2636,何止电影,何止电影,2014年11月17日，河南肿瘤医院的病房中举行着一场特殊的婚礼，主角是于海宁跟他的患有癌症的妻子范会香。在几个月前范会香确诊癌症，跟男友提出分手，于海宁不远万里来到了女友的城市，照顾患癌女友。得知女友时日无多，在病房中跟女友求婚，在病房中举办了婚礼，婚后一年，范会香去世。,https://toutiao.com/group/7432199981609534004/,,0,0,False
特朗普时代，中日合作机遇显现？俄乌对峙升级，明年有重大拐点,2024-11-20 10:52,11750,725,邱震海,邱震海,,https://toutiao.com/group/7439312593905025562/,,0,0,True
罕见！100年前，英国游客拍下的清朝乡村，和想象中完全不一样,2024-09-20 02:07,6994,672,万物知识局,万物知识局,泥泞的土路，衣不蔽体的老百姓，即便是达官显贵的家中也十分破败，而这些都是清王朝的历史痕迹，虽说那时候中国摄影技术并不发达，但也有许多外国游客来到这里，拍摄下了许多老照片，为我们留下了珍贵的历史资料，那清朝到底是怎样的面貌呢?,https://toutiao.com/group/7416287738871267855/,,0,0,False
农村姑娘进豪门被看不起，不料她竟然是个学霸，这下有好戏看了,2024-11-20 16:13,756,198,乐视情感讲堂,乐视情感讲堂,,https://toutiao.com/group/7439348230468403724/,,0,0,True
1米3袖珍美女嫁给1米48男孩，婚后丈夫奇迹长高，两人却不欢而散,2024-09-07 02:55,5539,270,睿之悦,睿之悦,杨萍和葛存苗的婚礼 文|睿之悦 编辑|睿之悦2019年，成都的民政局来了两个“10岁小孩”来登记，工作人员以为是玩闹。两个“小孩”拿出身份证让工作人员看，这才明白，原来是两个再也长不高的成年袖珍人情侣。,https://toutiao.com/group/7411713833267364386/,,0,0,False
原来他才是毁掉刘翔真凶，因贪1200万被公审，让刘翔背负多年骂名,2024-08-29 09:58,15124,458,八号探秘人,八号探秘人,在田径场上创造的成绩，至今无人能够打破，甚至在国际上享有盛名。本该继续夺冠之路，却两次因伤退赛，遭到了全网辱骂。,https://toutiao.com/group/7408489498465616410/,,0,0,False
特朗普准备开打中美贸易战，临阵换将金融大鳄出马，又是反华鹰派,2024-11-21 05:14,7891,122,邱毅台湾,邱毅台湾,,https://toutiao.com/group/7439596532728496675/,,0,0,True
67岁执意生娃，如今却坐轮椅无法自理，5岁的天赐被迫独立学洗衣,2024-11-04 10:32,4658,1156,睿之悦,睿之悦,2019年，已经67岁的田新菊执意生下了自己的第三个孩子小天赐。那么，现如今5年的时间过去了，这“天赐”的礼物到底是福还是祸呢?,https://toutiao.com/group/7433367394946384435/,,0,0,False
人均600万到欠400亿，毁掉“天下第一村”的不是别人，是他们自己,2024-11-05 07:00,932,260,艾弥儿,艾弥儿,这曾是一个让城里人都羡慕的农村社区，全村人均存款曾高达600万元，人人都住大别墅，出门都是小轿车，放眼全国，没有一个村子能够比得上它。,https://toutiao.com/group/7433621435349877282/,,0,0,False
24小时内，中国两次遭到抗议，美国不敢说的话，帕劳总统一句不落,2024-11-16 09:18,1383,240,千钧堂,千钧堂,,https://toutiao.com/group/7437804132901061171/,,0,0,True
包厢全是刚出狱的恶霸，结果一看到饭店主厨，立马怂了,2024-11-11 01:21,7256,153,乐视群星访谈秀,乐视群星访谈秀,,https://toutiao.com/group/7435825833048015400/,,0,0,True
美妇约见老情人，见面场景真是太逗了，这俩人绝配！,2024-10-27 16:25,3983,515,乐视明星的那点事,乐视明星的那点事,美妇约见老情人，见面场景真是太逗了，这俩人绝配！,https://toutiao.com/group/7428157095108674088/,,0,0,True
风水：梁朝伟给富婆看风水，这服务必须到位，这段太精彩了,2024-11-19 01:57,5086,828,南瓜钟意你,南瓜钟意你,风水：梁朝伟给富婆看风水，这服务必须到位，这段太精彩了,https://toutiao.com/group/7438803799575102003/,,0,0,True
妻子拿出一把吉他，让收废品的丈夫弹，丈夫深藏不露太惊艳,2024-11-19 07:42,35253,4318,今日国土杂志社,今日国土杂志社,,https://toutiao.com/group/7438892712218067508/,,0,0,True
中毒宠物狗仍在增加：犬主标注防毒地图，警方介入调查,2024-11-20 13:01,233,319,南方周末,南方周末,中毒死亡的宠物狗“乌冬”和“烧麦”。受访者供图两只心爱的宠物犬“乌冬”与“烧卖”疑似中毒死亡后，李珊觉得整个屋子都安静下来，“很恍惚”。她没想到，这样的事竟然发生在自己身上。该案成为较早被传播的广州宠物狗中毒事件。,http://www.infzm.com/content/282981,,0,0,False
印度人感叹：北约是人类史上最强军事联盟，为什么会害怕北京？,2024-11-18 09:35,22129,1100,瞩望云霄,瞩望云霄,印度人感叹：北约是人类史上最强军事联盟，为什么会害怕北京？,https://toutiao.com/group/7438550697852797503/,,0,0,True
