title,publish_time,like_count,comment_count,media_name,source,abstract,article_url,tag,is_yaowen,article_sub_type,has_video
时政微纪录丨习主席的拉美时间：里约G20峰会高光时刻,2024-11-21 01:16,786,491,央视新闻,央视新闻,当地时间11月17日至19日，习近平主席在巴西里约热内卢出席二十国集团领导人第十九次峰会，并举行多场双边会见。南半球初夏时节，一场“相聚”在巴西里约热内卢上演。二十国集团(G20)领导人在这座“非凡之城”，开启第十九次峰会时间。中国国家主席习近平的里约“G20时间”繁忙紧凑。,https://content-static.cctvnews.cctv.com/snow-book/index.html?item_id=15747397504702012222&source=50006&sub_source=50006_001,,0,0,False
今天才知道！电动车“每天充”和“用完再充”，到底哪个更伤电池,2024-08-27 11:19,15898,2385,鲸探所,鲸探所,“今天到底给车充不充电？”估计大多数人每天回家都会想这个问题，看着自己的电动车电量又多又少的，充不充电也是一件非常难以抉择的事情。那么，电动车到底应该怎样充电呢？是每天都充，还是用完之后再充呢？电动车充电不管是在城市还是农村，电动车其实都是人们出门最常见的交通工具。,https://toutiao.com/group/7407773012533117475/,,0,0,False
1米3袖珍美女嫁给1米48男孩，婚后丈夫奇迹长高，两人却不欢而散,2024-09-07 02:55,5498,269,睿之悦,睿之悦,杨萍和葛存苗的婚礼 文|睿之悦 编辑|睿之悦2019年，成都的民政局来了两个“10岁小孩”来登记，工作人员以为是玩闹。两个“小孩”拿出身份证让工作人员看，这才明白，原来是两个再也长不高的成年袖珍人情侣。,https://toutiao.com/group/7411713833267364386/,,0,0,False
罕见！100年前，英国游客拍下的清朝乡村，和想象中完全不一样,2024-09-20 02:07,6976,672,万物知识局,万物知识局,泥泞的土路，衣不蔽体的老百姓，即便是达官显贵的家中也十分破败，而这些都是清王朝的历史痕迹，虽说那时候中国摄影技术并不发达，但也有许多外国游客来到这里，拍摄下了许多老照片，为我们留下了珍贵的历史资料，那清朝到底是怎样的面貌呢?,https://toutiao.com/group/7416287738871267855/,,0,0,False
明年起，需做好资金“大水漫灌”的准备？房地产或将出现3个趋势,2024-11-21 06:09,402,142,议史纪,议史纪,近几年，我国房地产一直出现下行状态，房价的变化几乎是大多数人较为关心的事情，一方面是为了硬性需求，现在90后结婚主力军，房子还是硬通货。,https://toutiao.com/group/7439610056876638720/,,0,0,False
日本展出最新型激光武器，不比不知道，一比吓一跳,2024-11-19 12:12,20298,1569,陈虎点兵,陈虎点兵,,https://toutiao.com/group/7438962223550857768/,,0,0,True
包厢全是刚出狱的恶霸，结果一看到饭店主厨，立马怂了,2024-11-11 01:21,7177,153,乐视群星访谈秀,乐视群星访谈秀,,https://toutiao.com/group/7435825833048015400/,,0,0,True
炸萝卜丸子到底用面粉还是淀粉，教你正确做法，外焦里嫩，太香了,2024-10-26 09:25,10326,664,家常的味道,家常的味道,,https://toutiao.com/group/7430012978277122611/,,0,0,True
俩人相亲互相看不上，哪料男方一报母亲身份，姑娘乐了,2024-11-08 01:50,9610,2238,乐视群星访谈秀,乐视群星访谈秀,,https://toutiao.com/group/7434719902990074395/,,0,0,True
67岁执意生娃，如今却坐轮椅无法自理，5岁的天赐被迫独立学洗衣,2024-11-04 10:32,4606,1149,睿之悦,睿之悦,2019年，已经67岁的田新菊执意生下了自己的第三个孩子小天赐。那么，现如今5年的时间过去了，这“天赐”的礼物到底是福还是祸呢?,https://toutiao.com/group/7433367394946384435/,,0,0,False
3年前，宁夏7岁小女孩一笑走红，后拒百万签约，如今怎么样了？他们后悔了吗？,2024-09-19 07:25,12110,1669,睿之悦,睿之悦,2021年，视频镜头中出现的女孩儿用那一抹甜美的笑容，迅速引起了网友们的广泛关注。有媒体公司看到这一机遇，提出愿意用百万巨资与女孩儿签约，然而，女孩儿的父母却坚决拒绝了这一提议。,https://toutiao.com/group/7416250139544879679/,,0,0,False
甘肃一高三女生醉酒后被强奸致死？当地检察院：是有此案,2024-11-20 13:50,2144,1142,大皖新闻,大皖新闻,近日，有网友在短视频平台发布视频称，今年2月自己正在读高三的女儿，在晚自习期间被女同学带出去和社会上的男子喝酒，女儿被多名男子灌醉后，被其中的两名20岁左右的男子强奸致死。,http://www.ahwang.cn/toutiao/202411/2776330.html,,0,1,False
2024珠海航展：新军备 新亮点 新杀器 ｜军情观察室,2024-11-15 08:04,6753,368,凤凰卫视,凤凰卫视,,https://toutiao.com/group/7437413939794674185/,,0,0,True
特朗普时代，中日合作机遇显现？俄乌对峙升级，明年有重大拐点,2024-11-20 10:52,10994,209,邱震海,邱震海,,https://toutiao.com/group/7439312593905025562/,,0,0,True
母亲瘫痪、父亲疯了，当年那个744分的高考状元，7年后却成了这样,2024-09-08 00:54,9775,1553,八号探秘人,八号探秘人,母亲截肢瘫痪、父亲疯癫痴傻，可对于自己的亲人，他却做出了这样的评价。而今，7年已过，曾经那个让无数人动容的少年，现在如何?,https://toutiao.com/group/7411852147648496162/,,0,0,False
明确了，无牌电动二、三、四轮车上路处罚标准，不光罚款还扣车,2024-10-02 01:44,4261,2515,新能源战略家,新能源战略家,请您在阅读前，先点击上面的“关注”。感谢您的支持，我们将为您带来更多有价值的内容。目前电动车的管理趋于完善，很多地方都要求车辆必须上牌才能上路行驶，电动自行车这类非机动车要上绿牌、属于机动车的电动二三轮车要上蓝牌或黄牌、电动四轮车或者其他非标车型要上当地的临时号牌。,https://toutiao.com/group/7420987802646577690/,,0,0,False
中美一旦爆发战争，美国候任防长说出结果：20分钟就能分出胜负,2024-11-17 12:12,8571,1602,全荃,全荃,美国候任防长海格塞斯宣称，中美一旦开打，20分钟内就能分出胜。事关中美关系，美方大肆炒作所谓“中国威胁”，显然是别有用心。,https://toutiao.com/group/7438219748757832204/,,0,0,False
中国百强县市名单揭晓,2024-11-21 02:20,753,616,大河网,大河网,《中国县域发展监测报告2024》发布，中国百强县市、中国百强区名单揭晓　　11月19日，竞争力智库、北京中新城市规划设计研究院等机构在北京发布《中国县域发展监测报告2024》(以下简称《报告》)，《报告》揭晓了“2024中国综合竞争力百强县市”(简称2024中国百强县市)、“20,https://toutiao.com/group/7439551534523875849/,,0,0,False
金鸡奖这一夜，人情冷暖、江湖地位，在王骁身上体现得淋漓尽致,2024-11-18 05:16,556,141,稻述,稻述,11月16日晚，在电影界具有“奥斯卡”之称的金鸡奖在福建厦门盛大举行。但越往下看，越是应了那样一句话:“大型晚会就像是一个照妖镜!”,https://toutiao.com/group/7438478908384690740/,,0,0,False
国乒一日五败，福冈总决赛遭遇噩梦开局,2024-11-20 14:01,944,1302,澎湃新闻,澎湃新闻,11月20日，乒乓球WTT福冈总决赛中，中国乒乓球男队遭遇噩梦般的一天。先是在男双1/4决赛中，世界第一袁励岑/向鹏不敌新加坡组合冯耀恩/郭勇，随后林高远和梁靖崑双双经历一轮游，分别不敌斯洛文尼亚选手约奇克和张本智和。,https://m.thepaper.cn/newsDetail_forward_29405956?from=toutiao,,0,0,False
太美了！徐枫灿私服照片曝光，简直美的不可方物，网友：原地出道,2024-11-20 10:02,385,104,稻述,稻述,自从11月初再次亮相珠海航展后，女飞行员徐枫灿成为了无数人心中的梦中情人。虽身材高挑，样貌出众，笑容甜美，但这些，其实都是她最不值得一提的优点!,https://toutiao.com/group/7439290351493464628/,,0,0,False
农村姑娘进豪门被看不起，不料她竟然是个学霸，这下有好戏看了,2024-11-20 16:13,537,159,乐视情感讲堂,乐视情感讲堂,,https://toutiao.com/group/7439348230468403724/,,0,0,True
51年洪学智妻子寻女无果，到老乡家歇脚老乡惊呼：你要找得就是我,2024-09-22 01:07,14869,959,品古观今,品古观今,前言1951年，阳曲县委大院突然来了7、8位解放军同志，其中一位女同志，就是洪学智的妻子张文。她此番前来，就是为了寻找多年前因战乱而寄养于民间的爱女。可昔日的小村落早已蜕变成另一番景象，这无异于是大海捞针。,https://toutiao.com/group/7417034363226915354/,,0,0,False
河南女子去世，山东丈夫将手机埋墓里，充1000元话费，每天打电话,2024-11-01 06:52,2808,2613,何止电影,何止电影,2014年11月17日，河南肿瘤医院的病房中举行着一场特殊的婚礼，主角是于海宁跟他的患有癌症的妻子范会香。在几个月前范会香确诊癌症，跟男友提出分手，于海宁不远万里来到了女友的城市，照顾患癌女友。得知女友时日无多，在病房中跟女友求婚，在病房中举办了婚礼，婚后一年，范会香去世。,https://toutiao.com/group/7432199981609534004/,,0,0,False
被姚明抱着上奥运的小英雄，曾发誓考上清华，16年后活成了这样,2024-11-07 08:07,2469,595,睿之悦,睿之悦,2008年，年仅9岁的林浩，在姚明的带领下走进了北京奥运会开幕式的舞台上，成为了万众瞩目的“焦点”。,https://toutiao.com/group/7434444094551687707/,,0,0,False
姑娘花500块租男友，却不知人家是身价过亿总裁，好运来了,2024-11-03 04:00,2901,434,乐视明星的那点事,乐视明星的那点事,,https://toutiao.com/group/7432588748926812682/,,0,0,True
“最牛星二代”廖凡，出道24年从不拼爹，妻子是周星驰的黄金拍档,2024-11-20 05:35,1006,481,卿羽飞,卿羽飞,最近电视剧《宿敌》正在央视8台热播中，不知道大家有没有观看呢?这部电视剧的主演是廖凡和朱珠，这真的是让人意想不到的搭配，廖凡和朱珠也是非常的有CP感。,https://toutiao.com/group/7439209147201077812/,,0,0,False
给近三年最好的10部年代剧排个名：《人世间》第6，第1名没有争议,2024-10-28 07:10,2325,1274,稻述,稻述,到了20世纪初，偶像剧成为人们的掌中宝，但要说现在什么剧最受欢迎，那一定是年代剧!其中《人世间》只能排第六，第一名人人都爱看，最后一名也比上不足比下有余。,https://toutiao.com/group/7430715494055264783/,,0,0,False
逆袭人生，找老婆建别墅当上老板，小奎一家终得圆满#娟奎之恋,2024-08-31 05:27,17001,2847,海哥量地球,海哥量地球,,https://toutiao.com/group/7409170930649268771/,,0,0,True
特务男扮女装混进村子，孩子兵顿时发现不对劲，这下精彩了,2024-10-28 06:09,5045,524,乐视群星访谈秀,乐视群星访谈秀,,https://toutiao.com/group/7430704630294413878/,,0,0,True
印度人感叹：北约是人类史上最强军事联盟，为什么会害怕北京？,2024-11-18 09:35,21487,1084,瞩望云霄,瞩望云霄,印度人感叹：北约是人类史上最强军事联盟，为什么会害怕北京？,https://toutiao.com/group/7438550697852797503/,,0,0,True
炒白菜千万不要直接下锅，难怪不好吃，教你技巧，鲜嫩入味不出水,2024-10-30 09:23,10083,550,家常的味道,家常的味道,,https://toutiao.com/group/7431496869400576550/,,0,0,True
排骨里打入两个鸡蛋，不红烧不油炸，出锅瞬间变美食，太香了,2024-10-18 00:43,4670,272,家味美食,家味美食,,https://toutiao.com/group/7426909886904009225/,,0,0,True
15年前他在爱妻葬礼上哭到昏厥，发誓永不再娶，如今他做到了吗？,2024-08-24 02:17,21300,643,八号探秘人,八号探秘人,在阅读此文之前，辛苦您点击一下“关注”，既方便您进行讨论和分享，又能给您带来不一样的参与感，感谢您的支持！编辑丨xk纵观鱼龙混杂的娱乐圈，有人背叛，有人痴情。而果靖霖则是公认的好男儿，将一生都奉献给妻子。但妻子却仅仅陪他走了半生，没能战胜病魔，不幸离开人世。,https://toutiao.com/group/7406210316734710283/,,0,0,False
150亿美元！沙特来两年就想当大哥？中国军工真“榜一”很低调！,2024-11-18 06:35,3376,348,军武次位面,军武次位面,第十五届珠海航展上，中国军工表现出前所未有的强大，现场人头涌动的“中东土豪”，也是国际买家认可中国武器的标志。,https://toutiao.com/group/7438504060417770021/,,0,0,False
特朗普赢却难就职？拜登怕追责，佩洛西怕牢饭，三大集团蠢蠢欲动,2024-11-14 22:04,41897,1773,黎建南台湾,黎建南台湾,,https://toutiao.com/group/7437259350143402515/,,0,0,True
