title,publish_time,like_count,comment_count,media_name,source,abstract,article_url,tag,is_yaowen,article_sub_type,has_video
“一次拿不完，开三轮车来”，张扬的发钱活动背后：一座被刘强东改变的村庄,2025-01-08 09:16,1087,440,上观新闻,上观新闻,8日上午9点，宿迁市来龙镇光明村水泄不通，红色的旗子、展板、装饰布满了光明村党群服务中心的小广场。上千村民聚集在广场附近，排队等着领取刘强东派送的现金和年货。村里60周岁以上的老人每人能领一万元现金红包，家里老人多的能领上四五万。刘强东在校时的14位小学老师每人能拿到10万元。,https://export.shobserver.com/toutiao/html/840875.html,,0,1,False
拜登下台前搅动南海风云，美菲连手挑衅中国，中国不再忍强硬回击,2025-01-03 03:44,25369,1053,邱毅台湾,邱毅台湾,,https://toutiao.com/group/7455530031461171753/,,0,0,True
清华才女李一诺：27岁博士毕业，4年生3娃，能替世界首富花钱,2024-12-18 05:51,9243,429,云莳一,云莳一,家庭是她第一个学校，妈妈是她第一任老师。李一诺27岁博士毕业进入美国麦肯锡公司，33岁成为公司全球董事合伙人，之后四年连生3娃。,https://toutiao.com/group/7449591069311779355/,,0,0,False
日本专家：中国六代机惹人发笑，想吓唬敌人举手投降,2025-01-07 03:44,9006,4668,第一军情,第一军情,对于中国取得的国防成就，日本人的态度非常有意思，他们在表面上给予了假惺惺的赞扬，但背后却隐藏着怀疑和不安。,https://toutiao.com/group/7457013487617802787/,,0,0,False
土耳其刚要求交出稀土技术，中方宣布重大突破：这下看看谁求谁？,2025-01-09 09:36,1615,231,兵说,兵说,最近在国内发现全球第二大稀土矿的土耳其，可以说是彻底飘了，竟然公开要求中方交出稀土技术，否则的话就打道回府，不许中方和自己合作。,https://toutiao.com/group/7457846388248936970/,,0,0,False
河南警察3岁女儿被拐，苦寻全国23年无果，结果却发现女儿在对门,2024-11-05 07:43,6472,699,八号探秘人,八号探秘人,寻亲23年无果，丢失的女儿竟住在对门?但它却真实发生在河南洛阳的梁绍波身上。是意外走丢，还是人贩子所为，三岁的女儿怎会离奇失踪?,https://toutiao.com/group/7433697108120142345/,,0,0,False
布林肯前脚刚离开，韩国就展开第二波逮捕尹锡悦行动，胜算如何？,2025-01-08 07:08,14076,409,邱毅台湾,邱毅台湾,,https://toutiao.com/group/7457438209384677938/,,0,0,True
