title,publish_time,like_count,comment_count,media_name,source,abstract,article_url,tag,is_yaowen,article_sub_type,has_video
铁公鸡来相亲，一听不用买单拼命点菜，哪料姑娘做法更狠,2024-12-26 09:06,5123,1366,热播综艺精选,热播综艺精选,,https://toutiao.com/group/7452643056194421286/,,0,0,True
赖清德严重惹火特朗普，美国六大杀招齐出，台独金孙焦头烂额哭惨,2025-01-20 04:59,31542,1229,邱毅台湾,邱毅台湾,,https://toutiao.com/group/7461857666512454207/,,0,0,True
三哥放炮，一顿操作打偏了！网友：这配乐，绝了！打正了就怪了！,2025-01-11 04:14,50398,30858,迷彩洞察站,迷彩洞察站,,https://toutiao.com/group/7458296459483349519/,,0,0,True
国补后苹果手机跌破3000元，iPhone16价格成全球最低,2025-01-21 12:44,976,2284,红星新闻,红星新闻,今天话题#国补后iPhone16成苹果最香机##国补后苹果手机跌破3000#冲上微博热搜榜引发众多关注1月20日，手机国补正式上线。目前苹果手机部分主力机型大部分都能享受国家补贴，包括iPhone15、iPhone16等。,https://toutiao.com/group/7462348557824180790/,,0,0,False
大姐人在自己家，肾却不翼而飞，医生检查完片子后脸色大变,2025-01-16 01:36,4004,1038,娱乐乐透社,娱乐乐透社,,https://toutiao.com/group/7460321089265091111/,,0,0,True
2025年这个省部分人员的养老金增加10%？这是怎么回事？,2025-01-20 09:56,3515,181,胡观世事,胡观世事,,https://toutiao.com/group/7461934224669491731/,,0,0,True
特朗普在就职仪式上介绍儿子巴伦。网友：这时梅拉尼娅笑容最灿烂,2025-01-21 12:38,55785,5202,如来神掌,如来神掌,,https://toutiao.com/group/7462347207597883938/,,0,0,True
小女孩上部队找爸爸，少校阿姨主动搭讪，谁知看到女孩父亲傻眼了,2024-12-23 16:01,6951,1504,群星访谈秀,群星访谈秀,,https://toutiao.com/group/7451525814283960872/,,0,0,True
特朗普回归，复仇开始，拜登的“赦免令”能挡得住吗？,2025-01-21 10:43,10152,143,评论员杜平,评论员杜平,,https://toutiao.com/group/7462317487988671011/,,0,0,True
赵本山凭这一个小品，捧红了王小利，全程笑点不断,2025-01-04 20:46,4921,1081,娱快很简单,娱快很简单,,https://toutiao.com/group/7454123678406541824/,,0,0,True
小姨子和姐夫同时犯错，小姨子烂肚子里，还如此从容,2025-01-11 06:49,2523,127,南瓜午夜厅,南瓜午夜厅,,https://toutiao.com/group/7458540823127261722/,,0,0,True
