title,publish_time,like_count,comment_count,media_name,source,abstract,article_url,tag,is_yaowen,article_sub_type,has_video
她是央视最惨主持人，男友被判死缓，丈夫诈骗入狱，47岁无人敢娶,2024-08-27 23:30,2180,207,闻书识焉,闻书识焉,她曾是央视的台柱子，和董卿、周涛并称为央视的三朵金花。回顾刘芳菲的前半生，最令人感到惋惜的，便是她的感情生活，47岁至今无人敢娶。,https://toutiao.com/group/7407743113688564258/,,0,0,False
国乒5朵金花的家庭：王艺迪体二代，陈梦富二代，王曼昱父亲泪目,2024-08-04 02:03,2635,147,不似少溓游,不似少溓游,想要在国内靠乒乓球打出名堂，仅仅有天赋是完全不够的。因为在中国乒坛，万里挑一的天才遍地都是。以至于有不少人都选择放弃，甚至还有田志希这样为了能打乒乓球而选择归化韩国的球手。,https://toutiao.com/group/7398094722457289266/,,0,0,False
有人冒充我男朋友，算不算诈骗？遇到奇葩事你会怎么办？,2024-09-06 05:52,1650,217,兴凯湖莹莹,兴凯湖莹莹,,https://toutiao.com/group/7411404025502892554/,,0,0,True
男子与女子在河中嬉戏玩耍，突然连续将女子的头按入水中,2024-09-26 04:40,1160,158,经视看天下,经视看天下,,https://toutiao.com/group/7418807108637819444/,,0,0,True
今天才知道！电动车“每天充”和“用完再充”，到底哪个更伤电池,2024-08-27 11:19,8060,1642,鲸探所,鲸探所,“今天到底给车充不充电？”估计大多数人每天回家都会想这个问题，看着自己的电动车电量又多又少的，充不充电也是一件非常难以抉择的事情。那么，电动车到底应该怎样充电呢？是每天都充，还是用完之后再充呢？电动车充电不管是在城市还是农村，电动车其实都是人们出门最常见的交通工具。,https://toutiao.com/group/7407773012533117475/,,0,0,False
2013年，湖南26岁女孩嫁给71岁老头，婚后还生下一子，如今怎样了,2024-07-12 11:59,26452,2404,智史通鉴,智史通鉴,2013年4月17日，长沙宁乡县的民政局迎来了一对特殊的夫妻。一个71岁的老头和一个26岁的女孩，离远了看，甚至像爷爷和孙女。面对工作人员异样的眼光，女孩说：“我和他是真心相爱的！”这让人好奇，这对相差45岁的夫妻，他们之间到底有着怎样的爱情故事？,https://toutiao.com/group/7390696631223534120/,,0,0,False
牛市疯了：3天赚了一百万，高兴得太早，回头发现“卖飞了”,2024-10-03 13:00,3306,4273,凤凰网财经,凤凰网财经,编者按:30岁的孙默，在北京有一份稳定的工作，五年前，手里刚有一点积蓄，他就全部投入股市，没想到紧接着迎来了疫情。,https://toutiao.com/group/7421533420930482703/,,0,0,False
5座车拉6个人被判超员，车主1句话把交警问懵,2024-08-05 20:20,17055,3978,奇妙钢笔pA8JyP,奇妙钢笔pA8JyP,,https://toutiao.com/group/7399752843772559906/,,0,0,True
长相太美被导演收入房中，27年同居无名分，63岁因一件事幡然醒悟,2024-08-08 07:54,2513,109,8卦娱,8卦娱,写作不易，文中会有5s广告，观看后可免费阅读全文，精彩值得期待！文|8卦娱“以色侍人，能好几时？”谁能想到《康熙王朝》“后宫”的“是非”，竟从戏里“争斗”到戏外，女演员之间的较量，简直令人别开生面。那么她们之间到底有何恩怨？为什么说“容妃”戏如人生？,https://toutiao.com/group/7400667604068680233/,,0,0,False
"江西知名""90后""餐饮集团董事长凌晨去世！年仅35岁",2024-10-04 04:59,1313,707,极目新闻,极目新闻,10月3日，南昌百餐及赣乡野餐饮管理有限公司发布了一则《沉重公告》。讣告显示，百餐创始人兼赣乡野董事长魏昆先生于2024年9月30日凌晨因交通意外不幸去世，享年35岁。据江南君电话联系公告上的朱先生，他表示他是魏昆的合伙人，这件事是真的。,http://jms.ctdsb.net/jmythshare/#/index_share?cId=0&contentType=5&contentId=2270505,,0,0,False
无论炒什么肉，不要用盐和料酒腌制，大厨教我绝招，肉片滑嫩不腥,2024-07-11 08:24,82464,3432,家常的味道,家常的味道,无论炒什么肉，不要用盐和料酒腌制，大厨教我绝招，肉片滑嫩不腥,https://toutiao.com/group/7390291377185096204/,,0,0,True
黑龙江美女囚犯毕丽梅，被枪决后在殡仪馆苏醒，家属：放了她吧?,2024-08-25 14:32,1853,261,冯律讲法,冯律讲法,女死刑犯被枪决后在殡仪馆起死回生，当场把火化的工作人员吓得够呛，就连随行的警察都吓了一跳，壮着胆上前检查一番后，立马把离奇的情况上报。不一会儿法医赶到现场，证实了女犯人的确还活着，亲属闻声下跪，以死过一回为理由，恳求放了她。,https://toutiao.com/group/7407082388163002921/,,0,0,False
苹果手机中国最便宜，日本人愤怒了,2024-10-03 14:35,20617,1877,司马南,司马南,"一些媒体总喜欢吐槽iPhone如何创新不足、坑害消费者，不过日本媒体却指出苹果才是对中国消费者最厚道的，iPhone16在全球诸多国家的售价中，竟然在中国市场最便宜的，比日本、美国市场都要便宜不少。
#苹果手机#",https://toutiao.com/group/7421558007551263268/,,0,0,True
为什么冷冻的馒头超过三天就不能吃了？看完你就明白了,2024-09-29 09:10,4188,1637,身心驿站,身心驿站,,https://toutiao.com/group/7419990007072424484/,,0,0,True
联合国会对以色列动武吗?,2024-10-03 14:18,14927,745,司马南,司马南,"“这个小的政权不是一个国家。它是一个自称为‘神的选民’的、种族主义、民族至上主义殖民地。与你们不同，我们不相信‘选民’… 现在是你们结束对‘优秀种族’的支持的时候了。”伊朗马兰迪教授在天空新闻节目中说。
“神选民族”这个词儿很鲜亮， 自认为自己是神选的，倒也没啥，关键是这个神选的民族对异族肆意屠杀，超越了人类的底线。
#中方警告一场全面战争一触即发#",https://toutiao.com/group/7421553569192477196/,,0,0,True
张紫妍：被迫陪睡31人近百次，遭道具虐待，29岁自杀留230页遗书,2024-07-24 02:37,12926,904,八号探秘人,八号探秘人,在阅读此文之前，辛苦您点击一下“关注”，既方便您进行讨论和分享，又能给您带来不一样的参与感，感谢您的支持！本文叙述皆有官方信源，为了读者有更好体验，放在了文章后缀！,https://toutiao.com/group/7394994383675736576/,,0,0,False
拦车收费？交警不管！景区不管！政府看不见！九寨沟咋全是土匪？,2024-09-22 15:55,170677,34045,行哥嘚啵嘚,行哥嘚啵嘚,,https://toutiao.com/group/7417496641638400527/,,0,0,True
为什么1984年阅兵无法被超越？看到这样的劈枪和脚步就知道了,2024-07-14 05:28,20009,1757,悠闲入口,悠闲入口,,https://toutiao.com/group/7391359236577428007/,,0,0,True
世界机器人大会，许多观众伸手触摸扮演机器人的女模特,2024-09-05 09:32,373,200,经视看天下,经视看天下,,https://toutiao.com/group/7411089669858787855/,,0,0,True
他于9月30日凌晨因交通意外不幸去世，年仅35岁,2024-10-04 02:45,1025,498,大皖新闻,大皖新闻,10月3日，南昌百餐及赣乡野餐饮管理有限公司发布了一则《沉重公告》。讣告显示，百餐创始人兼赣乡野董事长魏昆先生于2024年9月30日凌晨因交通意外不幸去世，享年35岁。据江南君电话联系公告上的朱先生，他表示他是魏昆的合伙人，这件事是真的。,http://www.ahwang.cn/toutiao/202410/2753656.html,,0,1,False
美籍华人科学家吴瑛，在美国芝加哥家中服毒自杀，自杀原因曝光！,2024-09-04 05:28,1123,983,开心营业厅,开心营业厅,前言8月31日，香港《南华早报》报道：美籍华裔科学家吴瑛，在美国服用过量毒性药物，自杀身亡！她的离世，与美国政府对华人科学家的“迫害”有着直接的联系。美国为何频频针对华人科学家，难道说“科学无国界”真的成了一句笑话吗？,https://toutiao.com/group/7410619875699212826/,,0,0,False
全球约一半肝癌在中国，再次提醒：家中的4种食物，尽早撤下餐桌,2024-08-13 08:36,95266,3539,梁医学社梁怡璋医生,梁医学社梁怡璋医生,,https://toutiao.com/group/7402540119712629311/,,0,0,True
这是调戏还是搭讪？,2024-08-16 04:36,2825,150,潍坊市广播电视台,潍坊市广播电视台,,https://toutiao.com/group/7403591622725272100/,,0,0,True
她曾被前夫一巴掌扇到离婚！二婚嫁世界冠军，如今生活幸福滋润,2024-09-10 09:12,8420,153,豆莱说,豆莱说,“漂亮的让人挪不开眼”是圈内人对她的评价，和“山杏”不一样的是，李琳在现实生活中的感情很是幸运，遇到了导演王小列。,https://toutiao.com/group/7412930201929204236/,,0,0,False
男人和女人的需求差别这么大？,2024-07-12 11:00,29449,2108,周小鹏,周小鹏,男人和女人的需求差别这么大？,https://toutiao.com/group/7388885573953389092/,,0,0,True
善恶终有报！66岁“消失”了的陈宝国，可谓是娱乐圈的悲哀与损失,2024-09-27 06:29,1949,128,八号探秘人,八号探秘人,“我真的挺不喜欢听艺人这个词，前两年听得我一个劲儿地倒胃口”。当很多人挤破脑袋想要进娱乐圈当一名艺人的时候，他却说了这样一句话。,https://toutiao.com/group/7419206100681114153/,,0,0,False
中国🇨🇳人民的好总理,2024-09-03 15:46,202222,21458,话说,话说,这个老人一生只做一件事，那就是为了人民鞠躬尽瘁，死而后已,https://toutiao.com/group/7410443709928210955/,,0,0,True
#人性电影,2024-09-30 03:54,976,149,时光剪影,时光剪影,,http://toutiao.com/item/7420279600897098274/,,0,0,True
岳云鹏当众打趣潘长江，不料潘长江冲上台就是一脚，郭德纲都懵了,2024-07-27 01:31,2894,240,北方眼,北方眼,,https://toutiao.com/group/7396122121326068274/,,0,0,True
金毛丢失了一只狗崽子，主人拿出五只让它辨认，看到最后我笑哭了,2024-08-06 09:06,1675,112,小萌动物圈,小萌动物圈,金毛丢失了一只狗崽子，主人拿出五只让它辨认，看到最后我笑哭了,https://toutiao.com/group/7399950354642633250/,,0,0,True
新中国最壮观的一次阅兵，极大提振我国威军威，非常精彩不容错过,2024-07-16 02:09,17535,113,天天如意,天天如意,,https://toutiao.com/group/7392050119295631909/,,0,0,True
油桶上面有这“三个字”，基本上都是勾兑油，看完别再买错了！,2024-07-20 14:04,6772,319,昕昕局,昕昕局,人的生活离不开“柴米油盐”，可如今科技与狠活不断升级，吃什么油最安全成了最大的问题。油桶上面有这“三个字”，基本上都是勾兑油，看完别再买错了!,https://toutiao.com/group/7393594219501470247/,,0,0,False
