title,publish_time,like_count,comment_count,media_name,source,abstract,article_url,tag,is_yaowen,article_sub_type,has_video
给近三年最好的10部年代剧排个名：《人世间》第6，第1名没有争议,2024-09-06 08:08,1559,493,皮皮电影,皮皮电影,时尚是个轮回，电视剧也是。在2020年之前的那些年，电视剧市场基本上都被偶像剧、都市剧霸占。曾经撑起国剧品质的《闯关东》《岁月》这类年代好剧，难见踪影。,https://toutiao.com/group/7411390030722712090/,,0,0,False
一巴掌的代价，公交车上大妈打晕患癌小伙，断送退休后的幸福生活,2024-10-14 09:53,776,483,客观听書,客观听書,公交车上老太太和小伙吵了起来，老太太更是当仁不让直接给了小伙一巴掌。这名小伙直接倒地，老大大根本就不会想到正是因为他的一巴掌，鲜活的生命就这样消失在他的手里。,https://toutiao.com/group/7425563455358468627/,,0,0,False
15年前他在爱妻葬礼上哭到昏厥，发誓永不再娶，如今他做到了吗？,2024-08-24 02:17,12939,388,八号探秘人,八号探秘人,在阅读此文之前，辛苦您点击一下“关注”，既方便您进行讨论和分享，又能给您带来不一样的参与感，感谢您的支持！编辑丨xk纵观鱼龙混杂的娱乐圈，有人背叛，有人痴情。而果靖霖则是公认的好男儿，将一生都奉献给妻子。但妻子却仅仅陪他走了半生，没能战胜病魔，不幸离开人世。,https://toutiao.com/group/7406210316734710283/,,0,0,False
这场面，将军快hold不住了,2024-10-14 19:24,3947,122,最强80后,最强80后,,https://toutiao.com/group/7425714510897349147/,,0,0,True
见到中方高层后，石破茂不绕弯子，当下就和赖清德划清界限,2024-10-12 11:00,7058,1376,曹兴教授,曹兴教授,,https://toutiao.com/group/7424784120464540197/,,0,0,True
以色列这次太猖狂，坦克堵门要求中法印乌部队撤退：让开进攻道路,2024-10-14 08:03,5254,1638,通政司知事,通政司知事,以色列这次太猖狂，坦克堵门要求中法印乌部队撤退：让开进攻道路,https://toutiao.com/group/7425539014729400895/,,0,0,True
有人冒充我男朋友，算不算诈骗？遇到奇葩事你会怎么办？,2024-09-06 05:52,1693,224,兴凯湖莹莹,兴凯湖莹莹,,https://toutiao.com/group/7411404025502892554/,,0,0,True
联合国催缴会费，中国坚决不同意，让美国先补齐10.9亿美元,2024-10-14 11:22,10158,3006,艺品史鉴,艺品史鉴,联合国催缴会费，中国坚决不同意，让美国先补齐10.9亿美元,https://toutiao.com/group/7425590301282009654/,,0,0,True
写歌30年穷困潦倒，前妻失望选择离婚，谁料51岁靠一首歌一夜成名,2024-08-12 03:37,25846,4261,八号探秘人,八号探秘人,在阅读此文之前，辛苦您点击一下“关注”，既方便您进行讨论和分享，又能给您带来不一样的参与感，感谢您的支持！编辑：LY无数人都想要一个一夜成名的机会，但机会来了也不是每个人都能把握住的。他用了三十年的时间来准备迎接属于自己的机会。为了这个机会他放弃了一切，甚至包括家庭。,https://toutiao.com/group/7402090890367484428/,,0,0,False
