title,publish_time,like_count,comment_count,media_name,source,abstract,article_url,tag,is_yaowen,article_sub_type,has_video
独家完整版视频丨国家主席习近平发表二〇二五年新年贺词,2024-12-31 11:15,36640,22842,央视新闻,央视新闻,新年前夕，国家主席习近平通过中央广播电视总台和互联网，发表了二〇二五年新年贺词。全文如下：大家好！时间过得很快，新的一年即将到来，我在北京向大家致以美好的祝福！2024年，我们一起走过春夏秋冬，一道经历风雨彩虹，一个个瞬间定格在这不平凡的一年，令人感慨、难以忘怀。,https://content-static.cctvnews.cctv.com/snow-book/index.html?item_id=1506781951411024055&source=50006&sub_source=50006_001,,0,0,False
独家视频丨国家主席习近平向大家致以美好的祝福,2024-12-31 11:04,1920,1919,央视新闻,央视新闻,新年前夕，国家主席习近平通过中央广播电视总台和互联网，发表了二〇二五年新年贺词。习近平：大家好！时间过得很快，新的一年即将到来，我在北京向大家致以美好的祝福！©2024中央广播电视总台版权所有。未经许可，请勿转载使用。,https://content-static.cctvnews.cctv.com/snow-book/index.html?item_id=3058834507220543667&source=50006&sub_source=50006_001,,0,0,False
独家视频丨习近平：两岸同胞一家亲 谁也无法割断我们的血脉亲情,2024-12-31 11:12,945,1455,央视新闻,央视新闻,新年前夕，国家主席习近平通过中央广播电视总台和互联网，发表了二〇二五年新年贺词。习近平：两岸同胞一家亲，谁也无法割断我们的血脉亲情，谁也不能阻挡祖国统一的历史大势！©2024中央广播电视总台版权所有。未经许可，请勿转载使用。,https://content-static.cctvnews.cctv.com/snow-book/index.html?item_id=13327794526506738937&source=50006&sub_source=50006_001,,0,0,False
高安国夫妻被秘密收押，赖清德下狠手消灭统派，下一个会是谁？,2024-12-31 08:40,18509,3596,邱毅台湾,邱毅台湾,,https://toutiao.com/group/7454493107262849575/,,0,0,True
六代机双飞、四川舰三个第一，神雕无人预警机，中国军工震惊美国,2024-12-30 06:02,40813,2118,邱毅台湾,邱毅台湾,,https://toutiao.com/group/7454081205471085107/,,0,0,True
老纪和珅这段对话，以前小时候听不懂，如今听完受益终身,2024-12-28 23:16,4479,1324,乐视扒剧小妹儿,乐视扒剧小妹儿,,https://toutiao.com/group/7453420191947424293/,,0,0,True
湖南最长寿老人124岁高龄，长寿秘诀出世，让人大开眼界,2024-12-21 16:00,1828,173,乐视群星访谈秀,乐视群星访谈秀,,https://toutiao.com/group/7450730131821167140/,,0,0,True
广西49岁老汉娶19岁姑娘，结婚21年生下15个孩子，如今有何下场？,2024-10-20 08:32,9916,1228,艺述史,艺述史,她19岁出嫁，21年里总共生育了15个孩子，其中4个男孩子11个女孩子，家里热闹的像是开了一所学校一样。,https://toutiao.com/group/7427400319418384948/,,0,0,False
被央媒怒批，目不识丁，丢人现眼，这几位“文盲”明星凭什么走红,2024-12-30 10:52,2549,642,与君説,与君説,在阅读此文之前，麻烦您点击一下“关注”，既方便您进行讨论和分享，又能给您带来不一样的参与感，感谢您的支持文、编辑|小娄郭德纲曾说“可以没文凭，但不能没文化”。老郭的这句话在儿子郭麒麟身上体现得淋漓尽致。虽然郭麒麟初中就辍学了，但人家有思想有内涵，是个名副其实的“文化人”。,https://toutiao.com/group/7454151513221661234/,,0,0,False
新婚33天卷走274万4套房，出逃后丈夫跨国追捕，如今下场大快人心,2024-12-20 22:06,4518,233,八号探秘人,八号探秘人,在阅读此文之前，辛苦您点击一下“关注”，既方便您进行讨论和分享，又能给您带来不一样的参与感，感谢您的支持！编辑丨QQ·B“色字头上一把刀！”深圳富豪结婚33天竟被卷走274万元和名下4套房产。不仅如此，他还被扣上了“接盘侠”的帽子，啥也没干喜当爹。,https://toutiao.com/group/7450399558821052982/,,0,0,False
海南富商张晖：花8亿建108米海上观音像，4年后死在水中死因成谜,2024-10-19 04:49,4731,839,八号探秘人,八号探秘人,在阅读此文之前，辛苦您点击一下“关注”，既方便您进行讨论和分享，又能给您带来不一样的参与感，感谢您的支持！编辑丨xk他是中国的一名富商，耗费8亿元完成了自己的梦想。可梦想落地成为现实的时候，他却在4年后莫名其妙的死去。他就是张晖，上个世纪末海南岛旅游业的龙头当家人。,https://toutiao.com/group/7427288913095492134/,,0,0,False
欧洲会爆发世界大战吗？俄乌2025年能否止战？|凤凰《非常2024》,2024-12-30 07:54,2297,162,凤凰卫视,凤凰卫视,,https://toutiao.com/group/7454110252754010664/,,0,0,True
贪官酒桌上的权钱交易，语言天衣无缝，听懂三分都是人精！,2024-11-23 16:24,3704,446,乐视扒剧小妹儿,乐视扒剧小妹儿,,https://toutiao.com/group/7440378916130259496/,,0,0,True
煮米饭别总是加水了，难怪不好吃，教你酒店不外传的秘诀，非常香,2024-12-06 08:45,3642,789,明玥美食,明玥美食,,https://toutiao.com/group/7445217195929371190/,,0,0,True
小子相亲故意扮老，谁知道对方一见面就叫他大爷，这段太逗了,2024-12-24 08:17,2642,591,乐视热播综艺精选,乐视热播综艺精选,,https://toutiao.com/group/7451886130837848610/,,0,0,True
唐嫣胡歌合唱《再回首》，糖糖这眼神绝了，罗晋看了都吃醋,2024-12-27 06:12,1776,331,乐视天天剧好看,乐视天天剧好看,,https://toutiao.com/group/7452970574004879908/,,0,0,True
除了戴头盔！2025年1月起，电动车、三、四轮车上路迎来5个新要求,2024-12-30 01:33,934,158,新能源战略家,新能源战略家,请您在阅读前，先点击上面的“关注”。感谢您的支持，我们将为您带来更多有价值的内容。目前，很多地区都已经发布通告，明确从2025年1月开始，将实行新版电动车管理规定、开展电动车专项整治行动。,https://toutiao.com/group/7454011590065635840/,,0,0,False
明天是元旦，点开这首歌听听，2025 年一切都如愿！,2024-12-30 23:07,5082,917,大地春晖,大地春晖,明天是元旦，点开这首歌听听，2025 年一切都如愿！,https://toutiao.com/group/7453763957321368083/,,0,0,True
面粉这个做法绝了，比包子馅饼好吃，有菜有肉，1周可以吃好几次,2024-11-21 13:06,5776,681,小寒厨艺,小寒厨艺,面粉这个做法绝了，比包子馅饼好吃，有菜有肉，1周可以吃好几次,https://toutiao.com/group/7439718337031963171/,,0,0,True
千万别上当！美国著名智囊学者提醒美军：歼-36是中国式“圈套”,2024-12-31 07:24,5395,1941,高峰军事观察,高峰军事观察,虽然B-21还没有量产服役，但是一个流传出来的美军B-21战略打击中队的“臂章”，透露出美国空军的“野心”。,https://toutiao.com/group/7454461747441779200/,,0,0,False
57岁于文华现状，与丈夫住农村简陋房子，裙子拖地喂着狗生活幸福,2024-12-17 01:24,939,140,焰墨绘史,焰墨绘史,在阅读此文之前，麻烦您点击一下“关注”，既方便您进行讨论和分享，又能给您带来不一样的参与感，感谢您的支持。本文内容均引用权威资料结合个人观点进行撰写，文中已标注文献来源及截图，请知悉。提起于文华，想必当大家都不会陌生，当年的她凭借那首《纤夫的爱》，一夜间家喻户晓。,https://toutiao.com/group/7448948632033722889/,,0,0,False
包厢全是刚出狱的恶霸，结果一看到饭店主厨，立马怂了,2024-11-11 01:21,14354,390,乐视群星访谈秀,乐视群星访谈秀,,https://toutiao.com/group/7435825833048015400/,,0,0,True
我国楼市大局已定，未来全国45%的家庭，或将面临“5大挑战”,2024-12-15 11:45,694,103,苍暮颜,苍暮颜,前言:21世纪开始，中国房地产市场一路高歌猛进，繁荣的景象更是吸引了无数投资者和购房者，房价也是一路攀升，也成为了房地产经济增长的重要引擎。,https://toutiao.com/group/7448599203455975947/,,0,0,False
赖当局为何羁押高安国将军？解放军六代机及076舰震惊台湾,2024-12-30 22:01,27711,1656,黎建南台湾,黎建南台湾,,https://toutiao.com/group/7454328325800985126/,,0,0,True
乞丐上台唱歌引起评委质疑，一首歌唱完让观众起立鼓掌,2024-11-01 02:16,4373,712,乐视综艺咖,乐视综艺咖,,https://toutiao.com/group/7432129044134494771/,,0,0,True
炖鸡肉不要焯水和直接下锅，教你一招，鸡肉鲜香滑嫩不腥不柴,2024-12-15 08:45,6932,343,家常的味道,家常的味道,炖鸡肉千万不要焯水和直接下锅，教你秒招，鸡肉鲜香滑嫩不腥不柴,https://toutiao.com/group/7448556944597451275/,,0,0,True
央视跨年晚会阵容曝光，看完明星名单，厕所都不敢去上了,2024-12-31 09:19,2426,1509,闻书识焉,闻书识焉,其中最受关注的还是央视跨年晚会，昨日，央视也官宣了晚会第一批明星阵容和播出时间。看到演员阵容真的是百花齐放、星光熠熠，不是一般的豪华，中途厕所都不敢去了。,https://toutiao.com/group/7454493031660667411/,,0,0,False
北京86岁大妈北京大学毕业，一辈子没结婚，谈养老靠谁令人心酸,2024-12-27 14:09,39770,8038,北京大明,北京大明,,https://toutiao.com/group/7453093622239232531/,,0,0,True
萝卜和鸡蛋这样做，比吃补药还补，顿顿吃都不会腻，又香又下饭,2024-10-30 12:28,71266,4350,小寒厨艺,小寒厨艺,萝卜和鸡蛋这样做，比吃补药还补，顿顿吃都不会腻，又香又下饭,https://toutiao.com/group/7431405463378919975/,,0,0,True
13年9岁男孩扶老太被讹，老太发誓说谎死全家，儿媳却意外说漏嘴,2024-10-25 08:09,7364,1927,睿之悦,睿之悦,文|睿之悦编辑|睿之悦“就是这个娃撞了我，我虽然年纪大了，但我可不糊涂……”2013年，一位9岁的小学生江小云好心的将摔倒的蒋老太扶起，却反被讹100万。当时的蒋老太甚至还发毒誓，声称要是说谎的话就“死全家”。那么，这到底是怎么一回事呢？,https://toutiao.com/group/7429620647524450831/,,0,0,False
近5年最热的十部剧，《狂飙》第9，《繁华》第6，第1名很难超越,2024-12-01 03:58,1908,683,电影烂番茄,电影烂番茄,今天，番叔就结合口碑，给大家盘点一下近五年，热度最高的十部电视剧。第十名:《都挺好》 猫眼热度 9775.8，播出时间2019年。,https://toutiao.com/group/7430845717314273831/,,0,0,False
想吃零食别出去买，家里有苹果鸡蛋就能做，外酥里软比买的还好吃,2024-12-10 13:36,4249,338,小寒厨艺,小寒厨艺,想吃零食别出去买，家里有苹果鸡蛋就能做，外酥里软比买的还好吃,https://toutiao.com/group/7446704956704293402/,,0,0,True
到底是外公亲，还是爷爷亲？心理学家的答案很统一,2024-12-30 06:35,569,258,第一心理,第一心理,一位读者来信，提到最近自己遇到的一些家庭相关的琐事，并提出了自己的一些疑问。具体情况如下：这位读者是一个孩子的母亲，与丈夫结婚之后，一直在丈夫家所在城市生活，也受了公公婆婆不少接济，由于自己父母在另外的城市，有点距离但是不远，孩子出生之后也一直与爷爷奶奶接触更多。,https://toutiao.com/group/7454088472568857126/,,0,0,False
明天起，全体公民法定节假日增加2天！,2024-12-31 00:29,1525,479,闽南网,闽南网,根据2024年11月修订的《全国年节及纪念日放假办法》，自2025年1月1日起，全体公民放假的假日增加2天，即农历除夕、5月2日。增加后，春节放假4天（农历除夕、正月初一至初三），劳动节放假2天（5月1日、2日）。放假总天数从11天增加至13天。,https://toutiao.com/group/7454366142983913993/,,0,0,False
老人在家带孙女，儿媳从监控看到这画面泪目了,2024-12-31 02:41,3032,234,新派新闻,新派新闻,,https://toutiao.com/group/7454215156852064818/,,0,0,True
金价大跌！“接待不过来”，商户每天发走七八千件，网友：四五百再买,2024-12-31 07:34,362,189,潇湘晨报•晨视频,潇湘晨报•晨视频,近日，深圳水贝金价跌至622元每克的消息冲上热搜。随着国际金价大幅走低，近日，部分传统零售金店金价跌破800元/克关口，深圳水贝市场的金价则进一步跌至622元/克。金价下跌，叠加元旦、春节双节将近，黄金销售市场开始热闹起来。,http://api.chenshipin.com/wap/a/67739d528420170a551901a6/90f456b81afce808c1fcfbd3f5761f65/1735630290/9e06c602c01aecf0fb8650a5ee044f8684fe0ac548f292350f29650815b38150,,0,0,False
刘宁任河南省委书记，楼阳生因年龄原因不再担任,2024-12-31 03:24,1602,104,北京日报客户端,北京日报客户端,日前，中央对河南省委主要负责同志职务进行了调整。刘宁同志任河南省委委员、常委、书记，楼阳生同志不再担任河南省委书记、常委、委员职务。,https://rss2.bjd.com.cn/content/s6773616be4b06b0a5624ed95.html,,0,0,False
说一说成飞的新飞机，网上传的越来越玄乎，究竟有多厉害？,2024-12-29 13:21,11633,1375,陈虎点兵,陈虎点兵,,https://toutiao.com/group/7453823402932732435/,,0,0,True
牛肉价格为啥持续下降？,2024-12-29 16:26,3793,202,强老师儿,强老师儿,,https://toutiao.com/group/7453871032575721999/,,0,0,True
经典高清战争老电影,2024-11-18 05:05,11262,331,小微娱乐创作,小微娱乐创作,,https://toutiao.com/group/7438481167495463424/,,0,0,True
100年前，清朝罕见留影，王爷妻妾婀娜多姿，乞丐全身挂满垃圾,2024-10-14 09:58,2902,321,万物知识局,万物知识局,每一张老照片，都像是时间的低语，它们静静地躺在历史的相册中，却在不经意间将我们拉回到那个遥远而神秘的年代。,https://toutiao.com/group/7425457574731579919/,,0,0,False
