title,publish_time,like_count,comment_count,media_name,source,abstract,article_url,tag,is_yaowen,article_sub_type,has_video
有人冒充我男朋友，算不算诈骗？遇到奇葩事你会怎么办？,2024-09-06 05:52,1618,210,兴凯湖莹莹,兴凯湖莹莹,,https://toutiao.com/group/7411404025502892554/,,0,0,True
两个姑爷来农村 #农家院农家菜农家生活 #农村生活 鸡鱼招待,2024-08-07 09:04,6496,837,农民王小,农民王小,,https://toutiao.com/group/7400320946991301160/,,0,0,True
美论坛：一旦中国禁止美国加入中国空间站，美国是否有权将其击落,2024-09-10 10:48,321,346,书生talk,书生talk,自诩世界第一的美国哪里忍得了，甚至有网友在论坛网站发表问题，说中国不允许美国宇航员加入中国空间站的话，美国是不是应该把中国的空间站击落。,https://toutiao.com/group/7412962508984418828/,,0,0,False
历史逐渐解密，最终会看到真相。,2024-09-27 20:06,4716,353,热情的奶茶4kQmVE,热情的奶茶4kQmVE,,https://toutiao.com/group/7419416777634873891/,,0,0,True
5座车拉6个人被判超员，车主1句话把交警问懵,2024-08-05 20:20,14874,3569,奇妙钢笔pA8JyP,奇妙钢笔pA8JyP,,https://toutiao.com/group/7399752843772559906/,,0,0,True
布林肯当面告诉王毅外长，若中国继续“援俄”，美将对华发起制裁,2024-09-28 08:23,1232,186,贺文萍,贺文萍,,https://toutiao.com/group/7419606634801922570/,,0,0,True
上海消费有多贵？在外滩点了一个菜3碗米饭，结帐时以为听错了！,2024-09-14 06:50,7308,2925,户外探长,户外探长,,https://toutiao.com/group/7414387651802825228/,,0,0,True
她认干爹改国籍，曾叫嚣要击败女国乒，却在巴黎奥运会丢尽了脸,2024-08-26 14:00,489,301,吃瓜崽崽,吃瓜崽崽,她曾是中国国籍，却因认干爹入韩籍。十九岁的她被国人认为是乒坛叛徒，还曾叫嚣女国乒。如今却成为了韩国乒乓一姐。,https://toutiao.com/group/7407375792933044790/,,0,0,False
外面狂风暴雨，躲在屋里喝酒吃蟹，惬意,2024-09-22 00:57,1080,210,兴凯湖莹莹,兴凯湖莹莹,,https://toutiao.com/group/7417265382399935017/,,0,0,True
男子与女子在河中嬉戏玩耍，突然连续将女子的头按入水中,2024-09-26 04:40,480,120,经视看天下,经视看天下,,https://toutiao.com/group/7418807108637819444/,,0,0,True
"泽连斯基玩大了，""国破人亡""闯天祸玩崩了！与特朗普决裂",2024-09-28 03:30,3602,235,黄阿原,黄阿原,,https://toutiao.com/group/7419312477223813667/,,0,0,True
全球约一半肝癌在中国，再次提醒：家中的4种食物，尽早撤下餐桌,2024-08-13 08:36,93604,3512,梁医学社梁怡璋医生,梁医学社梁怡璋医生,,https://toutiao.com/group/7402540119712629311/,,0,0,True
拜登峰会发言后忘关麦克风，涉华言论被“直播”暴露战略意图,2024-09-24 10:38,5460,872,苏晓晖的世界,苏晓晖的世界,,https://toutiao.com/group/7418157144865931828/,,0,0,True
为国争光却遭郎平弃用！转身效力土耳其的王一梅，如今咋样了？,2024-08-31 13:19,918,131,豆莱说,豆莱说,光阴似箭，日月如梭，当初的少女早已退役，成为了排球场的幕后人，这么多年她都经历了什么，现在又怎么样了呢?,https://toutiao.com/group/7409287778514567718/,,0,0,False
认祖归宗？蒙古国的“阳谋”将至！计划 2025年恢复蒙文与内蒙接轨,2024-09-08 03:03,1262,222,智史通鉴,智史通鉴,大家都知道，在历史上，外蒙古和内蒙古曾是“一家人”。后来清朝时期，外蒙古就开始独立出去，到现在，他们不仅加入了联合国，还将传统的蒙古语抛弃了，用了新的西里尔新蒙古文。可是随着时间的流逝，蒙古国似乎有一个“阳谋”渐渐浮出水面：他们计划在2025年，恢复传统的回鹘蒙文的使用。,https://toutiao.com/group/7412094989640958502/,,0,0,False
中方惊慌失措？二十多架F22战机大象漫步，展示战略威慑,2024-09-27 15:21,1930,297,南友汇,南友汇,最近，来自美国国家利益杂志网站的消息，F22猛禽战机是美国空军的顶级战斗机。这两天，在阿拉斯加埃尔门多夫-理查森联合基地的极地部队演习中，进行了大象漫步演习，展示了其令人印象深刻的能力。,https://toutiao.com/group/7419343270469288483/,,0,0,False
携百万下嫁，小奎升级为奎总，港姐能不能兑现承诺 #相亲,2024-07-06 06:48,19546,2653,海哥量地球,海哥量地球,,https://toutiao.com/group/7388411139266183707/,,0,0,True
逆袭人生，找老婆建别墅当上老板，小奎一家终得圆满#娟奎之恋,2024-08-31 05:27,15437,2748,海哥量地球,海哥量地球,,https://toutiao.com/group/7409170930649268771/,,0,0,True
2013年，湖南26岁女孩嫁给71岁老头，婚后还生下一子，如今怎样了,2024-07-12 11:59,24675,2348,智史通鉴,智史通鉴,2013年4月17日，长沙宁乡县的民政局迎来了一对特殊的夫妻。一个71岁的老头和一个26岁的女孩，离远了看，甚至像爷爷和孙女。面对工作人员异样的眼光，女孩说：“我和他是真心相爱的！”这让人好奇，这对相差45岁的夫妻，他们之间到底有着怎样的爱情故事？,https://toutiao.com/group/7390696631223534120/,,0,0,False
4年骑行结束，1500天终于回到老家，感谢大家一路陪伴有缘江湖见,2024-09-07 03:50,72150,16848,刘伟元的旅行,刘伟元的旅行,4年骑行结束，1500天终于回到老家，感谢大家一路陪伴有缘江湖见！,https://toutiao.com/group/7411715839100977716/,,0,0,True
中日机械巨头对比：日本小松年营收270亿美元，徐工集团多少？,2024-09-23 15:10,1474,406,忠于法纪,忠于法纪,俗话说得好啊，没有金刚钻，就别揽这瓷器活。咱们中国号称“基建狂魔”，基建能力在全世界遥遥领先。好刀用好钢。要想基建能力好，那么推土机等工程机械的品质就不能差。在生产工程机械的全球机械巨头中，日本的小松和中国的徐工都是同行里面的佼佼者。但是两者放在一起比较的话，谁又能更胜一筹呢？,https://toutiao.com/group/7417853821282337320/,,0,0,False
写歌30年穷困潦倒，前妻失望选择离婚，谁料51岁靠一首歌一夜成名,2024-08-12 03:37,23216,3686,八号探秘人,八号探秘人,在阅读此文之前，辛苦您点击一下“关注”，既方便您进行讨论和分享，又能给您带来不一样的参与感，感谢您的支持！编辑：LY无数人都想要一个一夜成名的机会，但机会来了也不是每个人都能把握住的。他用了三十年的时间来准备迎接属于自己的机会。为了这个机会他放弃了一切，甚至包括家庭。,https://toutiao.com/group/7402090890367484428/,,0,0,False
我国历史上共有400多位皇帝，能被称为是千古一帝的，就只有这4位,2024-07-06 06:38,2438,641,兜兜历史迷,兜兜历史迷,我国历史上皇帝众多，虽然说这400多位皇帝中有重大贡献的不少，但能真正配得上“千古一帝”这四个字的，其实只有4位，别人跟他们比起来都多少差了那么一点。,https://toutiao.com/group/7388406323102171700/,,0,0,False
港姐归来，小奎坐大奔热情迎接，爱人见面抱头痛哭 #相亲,2024-07-05 04:45,23566,4867,海哥量地球,海哥量地球,,https://toutiao.com/group/7388008203738415653/,,0,0,True
这歌谁编的。太有才了，越听越上头,2024-09-01 09:12,53680,4263,阿抖-,阿抖-,,https://toutiao.com/group/7409599964278194724/,,0,0,True
