title,publish_time,like_count,comment_count,media_name,source,abstract,article_url,tag,is_yaowen,article_sub_type,has_video
公公竟然和儿媳偷情，哪料被妻子撞见，这下有戏看了！,2025-01-21 08:05,13113,1067,南瓜午夜厅,南瓜午夜厅,,https://toutiao.com/group/7462273852651979274/,,0,0,True
超百万鞭炮铺成红地毯，燃放场面极其震撼,2025-01-11 13:02,34800,39458,华丽影视16,华丽影视16,,https://toutiao.com/group/7458642341255971337/,,0,0,True
集市上10元一斤的散酒，是纯粮酒吗？听听内行人怎么说,2025-01-20 13:33,4941,1469,悦悦纪实,悦悦纪实,,https://toutiao.com/group/7461990229696643611/,,0,0,True
养老千万别选这种方式，现在我后悔不已。,2025-02-07 01:01,51968,4069,多才糯米yIl,多才糯米yIl,,https://toutiao.com/group/7468475855048606220/,,0,0,True
相声：张康贾旭明说《三国》，真是俩相声天才，不输德云社！,2025-01-29 21:08,12762,2318,爱情放映厅,爱情放映厅,,https://toutiao.com/group/7463035074229977600/,,0,0,True
大爷被抓进派出所，不料一报出身份，所长当场吓到了！,2025-01-18 19:31,4679,140,光影视界,光影视界,,https://toutiao.com/group/7460412459082334771/,,0,0,True
中国人模仿印度人，笑翻全网,2025-01-22 11:33,75743,4913,豫之家园,豫之家园,,https://toutiao.com/group/7462701480991916582/,,0,0,True
女大学生上课迟到，班主任罚她唱一首歌，不料一开口全班傻眼了,2025-01-18 05:04,3105,473,南瓜影视快车,南瓜影视快车,,https://toutiao.com/group/7461116920406835764/,,0,0,True
媳妇玩到半夜才回来，以为老公不在家，进门这操作把老公看懵了,2025-01-24 09:38,11801,3251,滕菲,滕菲,,https://toutiao.com/group/7463414214191743497/,,0,0,True
丈母娘看不起穷女婿，全家聚餐没给女婿留筷子，女儿做法漂亮！,2025-01-27 16:01,3606,985,群星访谈秀,群星访谈秀,,https://toutiao.com/group/7462286897130291724/,,0,0,True
苹果搭配红枣，作用真是太厉害了，帮助了很多人，实用,2025-01-03 09:20,2379,248,昕璇小厨娘,昕璇小厨娘,苹果搭配红枣，作用真是太厉害了，帮助了很多人，实用,https://toutiao.com/group/7453040622518141475/,,0,0,True
对越自卫反击战总攻震撼启幕：我军万炮齐发，场面太震撼,2025-01-18 01:39,81305,5112,热情海浪I,热情海浪I,,https://toutiao.com/group/7461063950201848372/,,0,0,True
