title,publish_time,like_count,comment_count,media_name,source,abstract,article_url,tag,is_yaowen,article_sub_type,has_video
学习新语｜中秋团圆时 浓浓家国情,2024-09-17 11:45,3342,1433,新华社,新华社,中秋月圆夜，天涯共此时。中秋寄托着人们对阖家团圆的美好期许，也承载着深厚的故乡情、家国情。让我们一起重温习近平总书记的温暖话语，感受这份浓厚的家国情怀。,https://toutiao.com/group/7415576277262041609/,,0,0,False
蛋仔派对：评论区随机挑战？用“那咋了”跟秀儿说话，粉丝真狠呀,2024-08-12 09:48,1204,238,游小浪Game,游小浪Game,,https://toutiao.com/group/7402187581716988456/,,0,0,True
今天才知道！电动车“每天充”和“用完再充”，到底哪个更伤电池,2024-08-27 11:19,3399,793,鲸探所,鲸探所,“今天到底给车充不充电？”估计大多数人每天回家都会想这个问题，看着自己的电动车电量又多又少的，充不充电也是一件非常难以抉择的事情。那么，电动车到底应该怎样充电呢？是每天都充，还是用完之后再充呢？电动车充电不管是在城市还是农村，电动车其实都是人们出门最常见的交通工具。,https://toutiao.com/group/7407773012533117475/,,0,0,False
患难见真情，9艘船装载武器运往俄罗斯，俄盟友出手，美英法急了,2024-09-14 23:13,3537,180,美洲话姐,美洲话姐,作为执掌俄罗斯长达20多年的强人，普京很清楚，决定俄乌冲突走向的因素有很多，战场上的胜败得失固然重要，但战场之外的较量，同样不能忽略。,https://toutiao.com/group/7414640590115897896/,,0,0,False
当你被盗号时，蛋仔的反应？太搞笑了！ #蛋仔派对世纪圆舞会,2024-06-27 08:45,4707,215,魔鬼鱼秀儿,魔鬼鱼秀儿,,https://toutiao.com/group/7385101460146487848/,,0,0,True
吃牛排时，为何旁边都放一个溏心蛋，不懂别随便吃，免得闹笑话,2024-07-13 06:05,2792,2619,云莳一,云莳一,阅读此文之前，麻烦您点击一下“关注”，既方便您进行讨论和分享，又能给您带来不一样的参与感，感谢您的支持。文|夏夜芦苇荡编辑|夏夜芦苇荡本文陈述所有内容皆有可靠信息来源赘述在文章结尾，但为提升文章可读性，细节可能存在润色，请理智阅读，仅供参考！,https://toutiao.com/group/7390663951204106787/,,0,0,False
蛋仔派对：秀儿耍酒疯，到处撒蛋币？可把我急坏了！,2024-07-07 01:34,1510,176,游小浪Game,游小浪Game,,https://toutiao.com/group/7388701183105303067/,,0,0,True
蛋仔派对：电梯规则怪谈？如果你被困诡异电梯 ，请遵守以下规则,2024-07-08 10:04,1397,119,辉哥游戏解说,辉哥游戏解说,,https://toutiao.com/group/7389203820254855695/,,0,0,True
千万粉丝竟全是人机！人机粉丝的几大特征，快来看看是你吗？,2024-08-30 11:37,2406,724,哇咔解说,哇咔解说,,https://toutiao.com/group/7408895330990686774/,,0,0,True
陈若琳把全红婵养得是真好啊,2024-08-07 03:21,2719,174,中工网,中工网,<p style='text-indent: 2em;'>原标题：陈若琳把全红婵养得是真好啊</p><p style='text-indent: 2em;'>昨晚，巴黎奥运会女子10米跳台跳水决赛，全红婵夺得金牌！赛后采访，她说，我不是你们所说的天才，都是练的，一遍一遍地练。教练陈若琳见证了全红婵的努力与刻苦。@陈若琳sunny@全红婵这对被称为“王炸”组合的师徒，在奥运赛场上都有过非常亮眼的表现。为帮全红婵突破发育关，陈若琳下了不少功夫。每天七八个小时的训练，恨不得将全红婵“拴在裤腰带上”严密看管。执教能力虽受过质疑，但她从不回避，而是找出问题，各个击破。她说：“我走过的弯路，不想让全红婵再走一遍。”中国队加油！（央视）</p>,http://db.workercn.cn/media/2024/08/07/64B10057EEF44DC3904C945F112F757A/preview.mp4,,0,0,True
普京开始报复了,2024-09-14 06:15,3651,113,牛弹琴,牛弹琴,俄罗斯开始报复，时间点很意味深长,https://toutiao.com/group/7414378632195342883/,,0,0,True
恭喜中国女篮新领袖终于出现了！百发百中！统治力让对手深深绝望,2024-06-25 07:11,24143,1299,乐播体育,乐播体育,,https://toutiao.com/group/7384335028576059923/,,0,0,True
魏启颖：女儿赵薇被封杀后，丈夫也去世，儿子离婚被分一半财产,2024-08-12 15:57,757,230,吃瓜崽崽,吃瓜崽崽,女儿被封杀，儿子感情突发变故，曾经风光无限的赵家荡然无存。她喜欢音乐，想当音乐老师，父母也大力支持，从不会横加干涉。,https://toutiao.com/group/7402251567493333519/,,0,0,False
全球约一半肝癌在中国，再次提醒：家中的4种食物，尽早撤下餐桌,2024-08-13 08:36,87356,3350,梁医学社梁怡璋医生,梁医学社梁怡璋医生,,https://toutiao.com/group/7402540119712629311/,,0,0,True
女孩15岁就能接客！性是生活也是工作，捷克为什么成了色情大国？,2024-09-13 09:10,1878,288,鲸探所,鲸探所,女孩15岁就到了合法性交年龄?18岁是成年，可15岁，仅仅只是一个初中生。很多人都以为，在韩国日本荷兰这些国家，色情产业应该是最“发达”的，可是捷克的色情产业，也并不是一个省油的灯。,https://toutiao.com/group/7414048497181164068/,,0,0,False
她认干爹改国籍，曾叫嚣要击败女国乒，却在巴黎奥运会丢尽了脸,2024-08-26 14:00,450,300,吃瓜崽崽,吃瓜崽崽,她曾是中国国籍，却因认干爹入韩籍。十九岁的她被国人认为是乒坛叛徒，还曾叫嚣女国乒。如今却成为了韩国乒乓一姐。,https://toutiao.com/group/7407375792933044790/,,0,0,False
河北密集调整县委书记,2024-09-17 10:55,336,125,新京报,新京报,近期，河北省多位县委书记调整。,https://m.bjnews.com.cn/detail/1726570136129493.html,,0,0,False
为国争光却遭郎平弃用！转身效力土耳其的王一梅，如今咋样了？,2024-08-31 13:19,846,112,豆莱说,豆莱说,光阴似箭，日月如梭，当初的少女早已退役，成为了排球场的幕后人，这么多年她都经历了什么，现在又怎么样了呢?,https://toutiao.com/group/7409287778514567718/,,0,0,False
张博宇：张丰毅吕丽萍的亲儿子，今却走上父母老路，成为离婚人士,2024-08-20 06:16,1417,206,稻述,稻述,文 | 招财小羊编辑 | 招财小羊“这是张丰毅的儿子？怎么看起来这么邋遢？”8月19日，李亚鹏的二婚妻子海哈金喜晒出了一条视频。没想到，却偏偏让张博宇成为了最大的话题人物！原来，那天海哈金喜现身北京参加了大学同学的婚礼。而在多个镜头之中，张博宇的身影忽隐忽现。,https://toutiao.com/group/7405097740415304230/,,0,0,False
为什么说从2025年开始，70岁以上的老人，可能面临“两大”问题？,2024-09-01 14:12,2048,263,水大叔,水大叔,据可靠数据了解，我国70岁以上的人口数量已经达到了2.5亿人次，占到全国总人口数量的18%。伴随着人口老龄化的出现，养老问题也成了重中之重，要知道养老不仅仅是家庭的责任，更是社会责任。,https://toutiao.com/group/7409677025897710106/,,0,0,False
没有人敢信他是个男的，直到他说话了，绝了,2024-08-20 05:20,3048,144,经视看天下,经视看天下,,https://toutiao.com/group/7405087362341470774/,,0,0,True
147票压过3票，欧洲通过涉台议案，不许两岸统一，蒋万安突然离岛,2024-09-13 09:45,3976,2617,凤凰卫视金亮,凤凰卫视金亮,美欧联合阻挡中国统一，蒋万安演讲提及“一个中华”，新加坡对台发出警告，岛内表明战争担忧，美方要颠覆战后秩序吗?,https://toutiao.com/group/7414061277322838564/,,0,0,False
网友：这小孩最起码吃了三个田震、一个许巍和一个刀郎！,2024-09-04 13:00,56811,5346,小石头和孩子们,小石头和孩子们,,https://toutiao.com/group/7410772059594981915/,,0,0,True
铿锵有力的发言,2024-09-08 05:00,51609,3536,七七爱剪辑,七七爱剪辑,,https://toutiao.com/group/7412132729489195535/,,0,0,True
任素汐：导演因为省钱找她唱主题曲，结果她要砸了所有歌手的饭碗,2024-08-29 01:22,27449,4623,被风吹过的夏天,被风吹过的夏天,,https://toutiao.com/group/7408365605805359670/,,0,0,True
2013年，湖南26岁女孩嫁给71岁老头，婚后还生下一子，如今怎样了,2024-07-12 11:59,20939,2176,智史通鉴,智史通鉴,2013年4月17日，长沙宁乡县的民政局迎来了一对特殊的夫妻。一个71岁的老头和一个26岁的女孩，离远了看，甚至像爷爷和孙女。面对工作人员异样的眼光，女孩说：“我和他是真心相爱的！”这让人好奇，这对相差45岁的夫妻，他们之间到底有着怎样的爱情故事？,https://toutiao.com/group/7390696631223534120/,,0,0,False
酒店退房时这“3样东西”如果不拿走，等于拱手送给保洁阿姨,2024-09-04 05:37,1771,564,东方琼芳,东方琼芳,,https://toutiao.com/group/7410657989348033062/,,0,0,True
60岁以后，一定要少去看望兄弟姐妹，过来人告诉你三个原因。,2024-09-09 11:11,1745,254,相会诵读,相会诵读,,https://toutiao.com/group/7412599502827160091/,,0,0,True
5座车拉6个人被判超员，车主1句话把交警问懵,2024-08-05 20:20,8699,1991,奇妙钢笔pA8JyP,奇妙钢笔pA8JyP,,https://toutiao.com/group/7399752843772559906/,,0,0,True
中国🇨🇳人民的好总理,2024-09-03 15:46,131849,15273,话说,话说,这个老人一生只做一件事，那就是为了人民鞠躬尽瘁，死而后已,https://toutiao.com/group/7410443709928210955/,,0,0,True
