title,publish_time,like_count,comment_count,media_name,source,abstract,article_url,tag,is_yaowen,article_sub_type,has_video
要么听话，要么挨打，美国给日本下最后通牒，石破茂感叹一句话,2024-10-22 05:09,1931,101,中国台湾王裕庆,中国台湾王裕庆,,https://toutiao.com/group/7428431819118215716/,,0,0,True
3年前，宁夏7岁小女孩一笑走红，后拒百万签约，如今怎么样了？他们后悔了吗？,2024-09-19 07:25,4576,768,睿之悦,睿之悦,2021年，视频镜头中出现的女孩儿用那一抹甜美的笑容，迅速引起了网友们的广泛关注。有媒体公司看到这一机遇，提出愿意用百万巨资与女孩儿签约，然而，女孩儿的父母却坚决拒绝了这一提议。,https://toutiao.com/group/7416250139544879679/,,0,0,False
给近三年最好的10部年代剧排个名：《人世间》第6，第1名没有争议,2024-09-06 08:08,7252,2463,皮皮电影,皮皮电影,时尚是个轮回，电视剧也是。在2020年之前的那些年，电视剧市场基本上都被偶像剧、都市剧霸占。曾经撑起国剧品质的《闯关东》《岁月》这类年代好剧，难见踪影。,https://toutiao.com/group/7411390030722712090/,,0,0,False
军号一响，全军出击！,2024-09-19 08:01,22838,1484,中国军号,中国军号,,https://toutiao.com/group/7416261401477382668/,,0,0,True
老人辱骂强拉孕妇要求让座？目击者称“全车厢人齐心协力保护孕妇”，南京地铁回应,2024-10-22 04:34,486,339,潇湘晨报,潇湘晨报,“肚子有小孩”，“别打人，别打人……”10月22日，有网友发布视频称，在南京地铁二号线上，一位老人将孕妇强行拉起，要求对方让座。此事引发关注。该网友发布的视频显示，一位身穿蓝色外套的女子被人拉拽起身，女子护住肚子称“肚子有小孩”、“你挤到我，我什么话都没讲”。,http://api.chenshipin.com/wap/a/671724e484201762bb5fdfc0/90f456b81afce808c1fcfbd3f5761f65/1729571481/8a303b030d5b653af0fc633ad40877f05be2fe468a804cb2286bb204872002dd,,0,0,False
金砖喀山峰会上，普京扳回一城？各国反应微妙，四大看点值得关注,2024-10-22 07:38,16257,620,邱震海,邱震海,,https://toutiao.com/group/7428501133200458240/,,0,0,True
东北雨姐又摊上大事了，背后吸血全红婵，涉及金额可能上亿,2024-10-22 10:19,395,152,八号探秘人,八号探秘人,东北雨姐最近的日子可谓是一天比一天难过，前一阵子刚因为红薯粉条事件受到处罚，紧接着就被相关部门盯上并开始对她全面调查。,https://toutiao.com/group/7428425247675679241/,,0,0,False
善恶终有报：疫情时对中国一毛不拔，却大方捐美国6亿，如今咋样,2024-09-29 05:50,804,116,睿之悦,睿之悦,可就是这样一位在中国土生土长起来的富豪，在疫情期间面对同胞的困境却一毛不拔，反而大方的捐助了6亿给美国。,https://toutiao.com/group/7419859345154015798/,,0,0,False
青岛中院悬赏最高990万元，征集西王集团董事长王勇等人财产线索,2024-10-23 00:20,322,222,澎湃新闻,澎湃新闻,山东省青岛市中级人民法院悬 赏 通 告（2024）鲁02执383号被执行人：西王国际贸易（青岛）有限公司，住所地：山东省青岛市市北区敦化路138号3801室。法定代表人：王伟，董事长兼经理。被执行人：西王集团有限公司，住所地：山东省邹平市西王工业园。法定代表人：王勇，董事长。,https://m.thepaper.cn/newsDetail_forward_29117849?from=toutiao,,0,0,False
外交部：中印双方已就边境有关问题达成解决方案,2024-10-22 07:31,12233,19108,环球网,环球网,【环球时报-环球网报道 记者 索炎琦】在10月22日举行的中国外交部例行记者会上，有外媒记者提问称：印度外交部长昨天表示，印度和中国已就在喜马拉雅地区有争议的边界巡逻达成协议。他称，这可以让中印脱离接触并解决始于2020年的冲突。我们能否向外交部确认是否达成了这样的协议？,https://toutiao.com/group/7428499246837432842/,,0,0,False
我国首个 自主可控！华为原生鸿蒙操作系统正式发布,2024-10-22 11:20,13436,11696,央视新闻,央视新闻,10月22日，我国首个国产移动操作系统——华为原生鸿蒙操作系统正式发布，这也是继苹果iOS和安卓系统后，全球第三大移动操作系统。据介绍，此前已经发布过的鸿蒙系统，由于系统底座仍使用了部分AOSP开放源代码，而不得不兼容部分安卓应用软件。,https://content-static.cctvnews.cctv.com/snow-book/index.html?item_id=11466430787627949687&source=50006&sub_source=50006_001,,0,1,False
原来她早已去世！被高晓松劈腿，遭汪峰抛弃，27岁在家里上吊自杀,2024-08-22 06:14,1096,614,吃瓜崽崽,吃瓜崽崽,第一次她被人“卖掉”，而第二次她只是别人感情的调味剂。27岁那年，她身着一袭红裙在自己曾经的婚房中上吊自杀。,https://toutiao.com/group/7405803977457009193/,,0,0,False
安徽美女道士胡小慧被捕：精通“胡媚术”，九名男徒弟揭露其罪行,2024-09-12 08:10,3732,426,艺述史,艺述史,在安徽一处偏僻山头上，有座神秘的道观，外表平平无奇，但里面却有着一位名气很高的美女道士。美女道士的名字叫做胡小慧，据说有着高深的法力，能帮人消灾解难。很多人慕名前来，交上丰厚的香火钱，在袅袅青烟里，试图从这个年轻道士身上获得一些生活的支撑。,https://toutiao.com/group/7413662261274739200/,,0,0,False
解放军艺术学院副院长梁玉师儿子大婚！毕福剑周炜黄宏梁宏达出席,2024-10-22 06:55,340,145,稻述,稻述,10月20日，北京一家有名的大酒店内张灯结彩，一对新人携手步入红毯，可谓是热闹非凡，不过可别小看这对新人，新郎可是解放军艺术学院副院长梁玉师的儿子。,https://toutiao.com/group/7428485413225972234/,,0,0,False
台湾准备打仗了？赖清德释放积极备战消息，还要从高中生补充兵员,2024-10-22 09:57,13199,767,邱毅台湾,邱毅台湾,,https://toutiao.com/group/7428537068390711858/,,0,0,True
如果马寅初没有提出人口论，没有实施计划生育，如今我国会怎样？,2024-10-10 00:09,1321,824,品古观今,品古观今,普查结果显示，我国总人口为141178万人，而第六次人口普查的结果显示，我国总人口为133972万人。,https://toutiao.com/group/7423249671805600306/,,0,0,False
男子在路边被黄鼠狼盯住，咬住他的鞋不松口,2024-10-14 06:46,8071,2027,山西广电文娱,山西广电文娱,,https://toutiao.com/group/7425519012454335003/,,0,0,True
有人冒充我男朋友，算不算诈骗？遇到奇葩事你会怎么办？,2024-09-06 05:52,1718,225,兴凯湖莹莹,兴凯湖莹莹,,https://toutiao.com/group/7411404025502892554/,,0,0,True
太恶劣！都是假的！,2024-10-22 12:55,452,394,人民日报,人民日报,近日，多条关于“外卖骑手带着患儿送外卖”的视频在社交平台广泛传播引起广泛关注10月20日外卖平台官方账号发布声明称经多方核实多个视频中的场景均为虚假摆拍声明中表示：“近日，多条‘身着外卖骑手服带患儿跑单’的短视频在社交平台广泛传播，引发公众的关注。,https://www.peopleapp.com/column/30047068240-500005853461?utm_source=头条号,,0,1,False
1976年周、朱、毛同一年逝世，临终前，三位伟人都交代了什么话？,2024-09-24 09:46,8501,379,呷谈历史,呷谈历史,1976年是最令人悲伤的一年，那一年三位伟人相继离世，还发生了唐山大地震。三位伟人在离世前都交代了一些事情，这些事情都和之后国家的发展有关系。,https://toutiao.com/group/7418141722196197900/,,0,0,False
老人辱骂强拉孕妇要求让座？目击者称“全车厢人保护孕妇”，南京地铁回应,2024-10-22 05:23,1024,1146,红星新闻,红星新闻,“肚子有小孩”，“别打人，别打人……”10月22日，有网友发布视频称，在南京地铁二号线上，一位老人将孕妇强行拉起，要求对方让座。此事引发关注。该网友发布的视频显示，一位身穿蓝色外套的女子被人拉拽起身，女子护住肚子称“肚子有小孩”、“你挤到我，我什么话都没讲”。,https://toutiao.com/group/7428465521903714855/,,0,0,False
吃了4年苦头后，印度同意结束中印军事对峙，对华做出3大承诺,2024-10-22 05:48,1145,106,第一军情,第一军情,据“路透社”报道，当地时间10月21日，印度外交部长苏杰生在新闻发布会上表示，中印两国就边境巡逻问题达成了协议，双方回到了2020年的初始状态，一线人员的脱离接触进程已经完成，结束了长达4年的军事对峙。,https://toutiao.com/group/7428428647435944499/,,0,0,False
20日晚上广东赢球后杜锋从疑似宏远老板娘手中接过一张卡片,2024-10-22 04:00,535,411,直播吧,直播吧,,https://news.zhibo8.com/nba/2024-10-22/67172190ab428native.htm,,0,0,False
