title,publish_time,like_count,comment_count,media_name,source,abstract,article_url,tag,is_yaowen,article_sub_type,has_video
为国争光却遭郎平弃用！转身效力土耳其的王一梅，如今咋样了？,2024-08-31 13:19,925,132,豆莱说,豆莱说,光阴似箭，日月如梭，当初的少女早已退役，成为了排球场的幕后人，这么多年她都经历了什么，现在又怎么样了呢?,https://toutiao.com/group/7409287778514567718/,,0,0,False
演员张瑜：离婚后单身30年，再见前夫仍感到心动，66岁没有子女,2024-07-24 10:51,15416,1114,八号探秘人,八号探秘人,在阅读此文之前，辛苦您点击一下“关注”，既方便您进行讨论和分享，又能给您带来不一样的参与感，感谢您的支持！写作不易，作者每天辛苦写稿，只是为了养家糊口，希望各位观众老爷可以多多理解。文中加入5秒广告解锁，观看5秒后便可免费阅读全文啦，感谢各位观众老爷的理解与支持！,https://toutiao.com/group/7395130917804720640/,,0,0,False
男子与女子在河中嬉戏玩耍，突然连续将女子的头按入水中,2024-09-26 04:40,827,145,经视看天下,经视看天下,,https://toutiao.com/group/7418807108637819444/,,0,0,True
老人说“坟有6不葬，一葬穷三年”，哪6不葬？葬了穷三年？,2024-08-28 09:01,12499,601,惠农圈,惠农圈,之前实行土葬，关于土葬的说法有很多，比如“坟有六不葬，一葬穷三年”。那时候，人们认为逝者葬在哪里，不能葬在哪里，会给后人带来福或灾。,https://toutiao.com/group/7408111961839256064/,,0,0,False
水表上放一根扎带，水表立马不转，很多人没见过，现场演示给你看,2024-09-28 14:13,455,257,我是水电工,我是水电工,水表上放一根扎带，水表立马不转，很多人没见过，现场演示给你看,https://toutiao.com/group/7419696997885542962/,,0,0,True
陈若琳把全红婵养得是真好啊,2024-08-07 03:21,2970,184,中工网,中工网,<p style='text-indent: 2em;'>原标题：陈若琳把全红婵养得是真好啊</p><p style='text-indent: 2em;'>昨晚，巴黎奥运会女子10米跳台跳水决赛，全红婵夺得金牌！赛后采访，她说，我不是你们所说的天才，都是练的，一遍一遍地练。教练陈若琳见证了全红婵的努力与刻苦。@陈若琳sunny@全红婵这对被称为“王炸”组合的师徒，在奥运赛场上都有过非常亮眼的表现。为帮全红婵突破发育关，陈若琳下了不少功夫。每天七八个小时的训练，恨不得将全红婵“拴在裤腰带上”严密看管。执教能力虽受过质疑，但她从不回避，而是找出问题，各个击破。她说：“我走过的弯路，不想让全红婵再走一遍。”中国队加油！（央视）</p>,http://db.workercn.cn/media/2024/08/07/64B10057EEF44DC3904C945F112F757A/preview.mp4,,0,0,True
为什么说从2025年开始，70岁以上的老人，可能面临“两大”问题？,2024-09-01 14:12,2218,279,水大叔,水大叔,据可靠数据了解，我国70岁以上的人口数量已经达到了2.5亿人次，占到全国总人口数量的18%。伴随着人口老龄化的出现，养老问题也成了重中之重，要知道养老不仅仅是家庭的责任，更是社会责任。,https://toutiao.com/group/7409677025897710106/,,0,0,False
库尔斯克地区被瓦格纳抓住的乌军女兵下场,2024-09-26 01:42,11506,1071,自由的帆船,自由的帆船,库尔斯克地区被瓦格纳抓住的乌军女兵下场,https://toutiao.com/group/7418761328606577187/,,0,0,True
黑龙江美女囚犯毕丽梅，被枪决后在殡仪馆苏醒，家属：放了她吧?,2024-08-25 14:32,1778,256,冯律讲法,冯律讲法,女死刑犯被枪决后在殡仪馆起死回生，当场把火化的工作人员吓得够呛，就连随行的警察都吓了一跳，壮着胆上前检查一番后，立马把离奇的情况上报。不一会儿法医赶到现场，证实了女犯人的确还活着，亲属闻声下跪，以死过一回为理由，恳求放了她。,https://toutiao.com/group/7407082388163002921/,,0,0,False
“利息都不要了”！多家银行大额存单掀起“转让潮”,2024-09-28 16:44,485,521,21世纪经济报道,21世纪经济报道,日前，私募管理人但斌在微博放出一张图，其中对话显示:“还有10几天，三个月定期利息就到期了。定期利息都不要了，入股市。”,http://mp.weixin.qq.com/s?__biz=MjI3Njc0NTk4MQ==&mid=2650411770&idx=2&sn=b607ec070ca93c3ea7937424f1fdf078,,0,0,False
最新消息：他也遭袭身亡,2024-09-28 15:35,537,620,济南时报-新黄河,济南时报-新黄河,央视记者当地时间9月28日获悉，伊朗伊斯兰革命卫队“圣城旅”副指挥官兼“圣城旅”黎巴嫩分支指挥官阿巴斯·尼尔福尚，在以色列对黎巴嫩首都贝鲁特的袭击中“与黎真主党领导人纳斯鲁拉一同遭袭身亡”。,http://www.hzfanews.com/detail.html?id=350814D07EEE544BE65E978E1795D8304B293EDDC4182782,,0,0,False
时隔27年找初恋，他若单身我愿嫁他，相见两人泪流满面,2024-08-02 04:56,26485,3951,彤儿说事,彤儿说事,,https://toutiao.com/group/7398401586776506906/,,0,0,True
原来他才是毁掉刘翔真凶，因贪1200万被公审，让刘翔背负多年骂名,2024-08-29 09:58,6053,147,八号探秘人,八号探秘人,在田径场上创造的成绩，至今无人能够打破，甚至在国际上享有盛名。本该继续夺冠之路，却两次因伤退赛，遭到了全网辱骂。,https://toutiao.com/group/7408489498465616410/,,0,0,False
上半年中美印新生人口：美国178万，印度1140万，中国让人意外,2024-09-23 12:16,1297,374,开心营业厅,开心营业厅,中美印是全球人口数量最多的三个国家，几乎占到了全球人口总数的近四成，不过，如今三个国家，却在生育率的问题上，遭遇了前所未有的挑战。,https://toutiao.com/group/7417736973647790628/,,0,0,False
美籍华人科学家吴瑛，在美国芝加哥家中服毒自杀，自杀原因曝光！,2024-09-04 05:28,1102,971,开心营业厅,开心营业厅,前言8月31日，香港《南华早报》报道：美籍华裔科学家吴瑛，在美国服用过量毒性药物，自杀身亡！她的离世，与美国政府对华人科学家的“迫害”有着直接的联系。美国为何频频针对华人科学家，难道说“科学无国界”真的成了一句笑话吗？,https://toutiao.com/group/7410619875699212826/,,0,0,False
40年前供销社卖过的20个生活用品，见过一半算你厉害，你认识几个,2024-07-23 08:56,7929,876,万物知识局,万物知识局,文/万物知识局本文陈述所有内容皆有可靠信息来源，赘述在文章结尾童年的岁月无论过多久都会因为某件事或某个物品而激发回忆，如今早已长大的我们时常还会想起过往，在看到某个熟悉的老物件时，回忆就如同潮涌般难以抑制，就仿佛再次将我们带回到那个熟悉的午后和熟悉的房间。,https://toutiao.com/group/7394736337166926346/,,0,0,False
军号一响，全军出击！,2024-09-19 08:01,15730,1017,中国军号,中国军号,,https://toutiao.com/group/7416261401477382668/,,0,0,True
她是央视最惨主持人，男友被判死缓，丈夫诈骗入狱，47岁无人敢娶,2024-08-27 23:30,2157,207,闻书识焉,闻书识焉,她曾是央视的台柱子，和董卿、周涛并称为央视的三朵金花。回顾刘芳菲的前半生，最令人感到惋惜的，便是她的感情生活，47岁至今无人敢娶。,https://toutiao.com/group/7407743113688564258/,,0,0,False
中国弹道导弹射进太平洋后，美日破防了，果然实力决定一切,2024-09-29 08:29,2760,271,迷彩虎说,迷彩虎说,最近我国进行了一次弹道导弹试射工作，导弹准确命中了太平洋公海预定位置。这件事情让美国和日本破防了，在他们的嘴里中国变成了维护世界和平的重要力量。,https://toutiao.com/group/7419979477440168457/,,0,0,True
2013年，湖南26岁女孩嫁给71岁老头，婚后还生下一子，如今怎样了,2024-07-12 11:59,24987,2356,智史通鉴,智史通鉴,2013年4月17日，长沙宁乡县的民政局迎来了一对特殊的夫妻。一个71岁的老头和一个26岁的女孩，离远了看，甚至像爷爷和孙女。面对工作人员异样的眼光，女孩说：“我和他是真心相爱的！”这让人好奇，这对相差45岁的夫妻，他们之间到底有着怎样的爱情故事？,https://toutiao.com/group/7390696631223534120/,,0,0,False
张紫妍：被迫陪睡31人近百次，遭道具虐待，29岁自杀留230页遗书,2024-07-24 02:37,12366,865,八号探秘人,八号探秘人,在阅读此文之前，辛苦您点击一下“关注”，既方便您进行讨论和分享，又能给您带来不一样的参与感，感谢您的支持！本文叙述皆有官方信源，为了读者有更好体验，放在了文章后缀！,https://toutiao.com/group/7394994383675736576/,,0,0,False
港姐归来，小奎坐大奔热情迎接，爱人见面抱头痛哭 #相亲,2024-07-05 04:45,23584,4864,海哥量地球,海哥量地球,,https://toutiao.com/group/7388008203738415653/,,0,0,True
山西一女大学生白嫖被拒恼羞成怒：当初有多嚣张，如今就有多慌张,2024-09-28 05:45,1616,828,鲸探所,鲸探所,很难想象，因为一包12.99元的红枣，一位大学生竟然能对客服辱骂一个小时。这样的事情，听起来似乎确实让人感觉有点难以置信，可它就这么水灵灵的发生了，而且还被曝光出来了。,https://toutiao.com/group/7419561787948941876/,,0,0,False
写歌30年穷困潦倒，前妻失望选择离婚，谁料51岁靠一首歌一夜成名,2024-08-12 03:37,23621,3770,八号探秘人,八号探秘人,在阅读此文之前，辛苦您点击一下“关注”，既方便您进行讨论和分享，又能给您带来不一样的参与感，感谢您的支持！编辑：LY无数人都想要一个一夜成名的机会，但机会来了也不是每个人都能把握住的。他用了三十年的时间来准备迎接属于自己的机会。为了这个机会他放弃了一切，甚至包括家庭。,https://toutiao.com/group/7402090890367484428/,,0,0,False
姑娘远嫁山东十年未回家，带着孩子偷偷回娘家，到家眼前一幕哭了,2024-09-09 08:25,25367,10814,小乔远嫁在北方,小乔远嫁在北方,,https://toutiao.com/group/7412556561718968870/,,0,0,True
中共中央批准开除党籍的5只老虎，一周之内全部被逮捕！,2024-09-29 08:07,3405,170,上观新闻,上观新闻,据最高人民检察院9月29日消息，黑龙江省政协原党组成员、副主席李海涛涉嫌受贿一案，由国家监察委员会调查终结，移送检察机关审查起诉。日前，最高人民检察院依法以涉嫌受贿罪对李海涛作出逮捕决定。该案正在进一步办理中。李海涛（资料图）2023年9月16日，李海涛被查。,https://export.shobserver.com/toutiao/html/802172.html,,0,1,False
洲际导弹试验内幕：美军妄想打捞导弹残骸，中美航母在莱特湾角力,2024-09-28 15:29,1704,234,南友汇,南友汇,日前军事专家秦蓁撰文公布了此次解放军洲际弹道导弹试射的内幕，首先就是解放军为了确保本次试验的圆满成功，防止美日及其他国家窥测导弹测试的机密信息，提前将辽宁号航母战斗群部署到了弹着点海域附近，同行的还有1艘“远望6号”航天观测船。,https://toutiao.com/group/7419716270628667919/,,0,0,False
