title,publish_time,like_count,comment_count,media_name,source,abstract,article_url,tag,is_yaowen,article_sub_type,has_video
"凤凰记者连线：尹锡悦拒绝提前下台,此次讲话口吻为何会变得强硬?",2024-12-12 02:54,812,119,凤凰卫视,凤凰卫视,,https://toutiao.com/group/7447353422221443611/,,0,0,True
弟弟光荣退伍，姐姐兴奋去车站接他，怎料一见弟弟瞬间哭了,2024-11-05 06:34,32865,3006,乐视天天剧好看,乐视天天剧好看,,https://toutiao.com/group/7433679820573934091/,,0,0,True
广西49岁老汉娶19岁姑娘，结婚21年生下15个孩子，如今有何下场？,2024-10-20 08:32,6957,842,艺述史,艺述史,她19岁出嫁，21年里总共生育了15个孩子，其中4个男孩子11个女孩子，家里热闹的像是开了一所学校一样。,https://toutiao.com/group/7427400319418384948/,,0,0,False
许家印，突传大消息！,2024-12-11 11:22,2226,688,上观新闻,上观新闻,恒大清盘人正在穷尽手段追索资产。12月11日，据港媒消息，恒大清盘人安迈（Alvarez & Marsal）已接管许家印名下持有私人飞机的离岸实体公司，并将飞机挂牌出售。该飞机的机龄14年，为空客A319型号，大小与商用客机相当，目前停泊在广州。,https://export.shobserver.com/toutiao/html/828430.html,,0,1,False
特朗普亮明立场，拒绝承诺协防台湾，两大信号直击中美未来风向？,2024-12-11 06:49,14276,172,邱震海,邱震海,,https://toutiao.com/group/7447042931304858148/,,0,0,True
将国债、指数基金纳入产品范围 个人养老金制度15日起在全国实施,2024-12-12 03:01,1617,2939,央视新闻,央视新闻,近日，人力资源社会保障部、财政部、国家税务总局、金融监管总局、中国证监会印发《关于全面实施个人养老金制度的通知》。《通知》明确，自2024年12月15日起，在中国境内参加城镇职工基本养老保险或者城乡居民基本养老保险的劳动者，均可以参加个人养老金制度。,https://content-static.cctvnews.cctv.com/snow-book/index.html?item_id=5912296199407504660&source=50006&sub_source=50006_001,,0,1,False
清华学生会主席发言，全程脱稿，谈笑自若，掌控全场，后生可畏,2024-12-11 09:39,2341,269,反贪盛局,反贪盛局,"清华大学（Tsinghua University），简称“清华”，位于北京市海淀区清华园， 由教育部与北京市重点共建，是国家教育部直属的全国重点大学，中央直管高校 ，国家首批“双一流”A类、“985工程”、“211工程”重点建设高校。 
学校入选2011计划、101计划、珠峰计划、强基计划、111计划、英才计划、卓越工程师教育培养计划，是九校联盟、松联盟、中国大学校长联谊会、亚洲大学联盟、全球大学校长论坛、环太平洋大学联盟、中俄综合性大学联盟成员，被誉为“红色工程师的摇篮”。
清华大学的前身为始建于1911年的清华学堂，1912年更名为清华学校。1928年更名为国立清华大学。",https://toutiao.com/group/7447086733356696102/,,0,0,True
河南警察3岁女儿被拐，苦寻全国23年无果，结果却发现女儿在对门,2024-11-05 07:43,3798,394,八号探秘人,八号探秘人,寻亲23年无果，丢失的女儿竟住在对门?但它却真实发生在河南洛阳的梁绍波身上。是意外走丢，还是人贩子所为，三岁的女儿怎会离奇失踪?,https://toutiao.com/group/7433697108120142345/,,0,0,False
57岁周立波现状：头发稀疏身体暴瘦，定居美国和富豪妻子低调生活,2024-12-09 23:01,649,308,峰哥正读,峰哥正读,前段时间，周立波在美国街头的一张照片引起了热议，只见他戴着黑框大眼镜，发际线后移，头发稀疏，撇着嘴，神色间是我们熟悉的桀骜不驯。,https://toutiao.com/group/7446308823331111461/,,0,0,False
15年保安徒手接跳楼女孩，女孩母亲：我女儿若有事，你一辈子负责,2024-10-07 09:28,559,237,睿之悦,睿之悦,文|睿之悦编辑|睿之悦“我的女儿要是有什么事情的话，你要负一辈子的责任！”2015年，一名保安在得知有人跳楼的时候，不顾自身的安危，徒手将跳楼的女孩给救了下来。可令人感到的心寒的是，被救女孩的家属不仅没有感谢这名保安，反而还对他恶语相向。那么，这究竟是怎么一回事呢？,https://toutiao.com/group/7422961323312431656/,,0,0,False
罕见！100年前，英国游客拍下的清朝乡村，和想象中完全不一样,2024-09-20 02:07,8819,770,万物知识局,万物知识局,泥泞的土路，衣不蔽体的老百姓，即便是达官显贵的家中也十分破败，而这些都是清王朝的历史痕迹，虽说那时候中国摄影技术并不发达，但也有许多外国游客来到这里，拍摄下了许多老照片，为我们留下了珍贵的历史资料，那清朝到底是怎样的面貌呢?,https://toutiao.com/group/7416287738871267855/,,0,0,False
甘肃白银一养殖户40多只羊失踪，怀疑有人雪夜到羊圈偷盗，警方正调查,2024-12-11 10:05,654,326,极目新闻,极目新闻,极目新闻记者 舒隆焕12月11日，甘肃白银市村民高先生向极目新闻反映，自家羊圈里的山羊丢了40多只，他怀疑有人趁10日凌晨下雪偷了羊，已报警。高先生家的羊群（视频截图）高先生今年30岁，家住白银市白银区强湾乡某村庄，在外务工多年后回乡创业，与父母一起养了数百只羊。,http://jms.ctdsb.net/jmythshare/#/index_share?cId=0&contentType=5&contentId=2326555,,0,0,False
女友怀孕了，男友不装了，带她回豪宅！,2024-11-23 08:01,12259,965,乐视大综艺咖,乐视大综艺咖,,https://toutiao.com/group/7440353629540483593/,,0,0,True
刘晓庆小38岁纠纷男主露正脸：每月工资1万，不是被包养,2024-12-11 13:03,287,229,九派新闻,九派新闻,此前，“刘晓庆前男友发律师函讨债”的话题备受关注。近日，男方古柯（网名）正式露面，讲述和刘晓庆之间的纠纷。12月2日，有网友曝刘晓庆前男友古柯（网名）发律师函讨债，称古柯与刘晓庆之间存在经济纠葛，望刘晓庆与古柯依据已经签过的协议进行和解，若7日内不予答复，将立即启动诉讼工作。,https://toutiao.com/group/7447138629849186866/,,0,0,False
跑道总长5公里！美媒：神秘飞机现身中国西北机场，极具战略价值,2024-12-05 09:30,2394,220,军武次位面,军武次位面,图像显示，在中国西北地区的一个偏远机场跑道末端，有一个奇怪的白色物体，旁边还散布着一些小型物体，疑似支援设备。,https://toutiao.com/group/7444822774259941923/,,0,0,False
中国5万吨航母即将下水，电磁弹射器比福建号长，可弹射歼35战机,2024-12-10 08:55,1296,126,第一军情,第一军情,近日，网上曝出了076最新照片，业内人士看后表示，雷达已经安装完毕，预示着下水在即。此前，美国智库发布报告称，中国正在建造的076两栖攻击舰，排水量至少有50000吨，是日本“出云”号的两倍，也比美军的“黄蜂”级两攻要大。,https://toutiao.com/group/7446702246705873444/,,0,0,False
67岁执意生娃，如今却坐轮椅无法自理，5岁的天赐被迫独立学洗衣,2024-11-04 10:32,8804,2029,睿之悦,睿之悦,2019年，已经67岁的田新菊执意生下了自己的第三个孩子小天赐。那么，现如今5年的时间过去了，这“天赐”的礼物到底是福还是祸呢?,https://toutiao.com/group/7433367394946384435/,,0,0,False
新生育时代：三个“二孩家庭”的上海样本,2024-12-08 11:02,844,346,看看新闻,看看新闻,新生育时代：三个“二孩家庭”的上海样本,http://mediaplay.kksmg.com/2024/12/08/h264_720p_600k_77882-DFTVHD-20241208175000-4800-958532-600k_mp4.mp4,,0,0,True
必须完成！明年起，满18岁男性须兵役登记，否则影响上大学、找工作,2024-12-09 06:44,17960,15314,大河报,大河报,重要提醒！2025年兵役登记工作将于2025年1月1日开始已经进行过兵役登记，有参军意向的可直接参加网上应征报名。依法服兵役和进行兵役登记是每个适龄公民应尽的光荣义务和神圣责任。《中华人民共和国兵役法》明确国家实行兵役登记制度，每名男性青年在年满18周岁时都要履行兵役登记义务。,https://toutiao.com/group/7446299249363157558/,,0,0,False
冬天洗澡多久一次最好？这4个时候，劝你不要洗,2024-12-07 10:01,2126,282,环球网,环球网,来源：健康杭州 最近杭城的气温 一天天走低 忙活了一整天，洗个热乎乎的澡 再钻进暖暖的被窝，再舒服不过！ 然而不少人洗澡时 或多或少会犯些错 结果把本该舒服又养人的“养生澡”硬生生洗成了“伤身澡”冬天多久洗一次澡最好？洗澡频率主要取决于个体的需求和偏好。,https://3w.huanqiu.com/a/106d4f/4KYr5sh4XfC?agt=20,,0,0,False
沙特大手笔，下调石油价格！中国能源布局见成效，美俄着急了！,2024-12-11 14:32,4797,301,国际时事快递,国际时事快递,,https://toutiao.com/group/7447087838035706418/,,0,0,True
遍地开花的俄罗斯商品馆，打着进口旗号卖国货？加盟总部称80%系进口，火腿列巴等产自东北,2024-12-11 00:32,1505,765,看看新闻,看看新闻,遍地开花的俄罗斯商品馆，打着进口旗号卖国货？加盟总部称80%系进口，火腿列巴等产自东北,http://mediaplay.kksmg.com/2024/12/11/h264_720p_600k_78163-smgnews-20241211065500-9000-960313-600k_mp4.mp4,,0,0,True
3年前，宁夏7岁小女孩一笑走红，后拒百万签约，如今怎么样了？他们后悔了吗？,2024-09-19 07:25,15335,2048,睿之悦,睿之悦,2021年，视频镜头中出现的女孩儿用那一抹甜美的笑容，迅速引起了网友们的广泛关注。有媒体公司看到这一机遇，提出愿意用百万巨资与女孩儿签约，然而，女孩儿的父母却坚决拒绝了这一提议。,https://toutiao.com/group/7416250139544879679/,,0,0,False
于和伟紧急辟谣：我在…我在…我在…,2024-12-11 11:36,881,455,新黄河,新黄河,近日，由于和伟、富大龙、丁勇岱等人出演的电视剧《我是刑警》最近开播。该剧成为爱奇艺首部热度破万的刑侦大剧，酷云实时收视峰值破3%，云合正片有效播放市占率超30%，同时段全频道电视剧收视率TOP1。同时该剧也收获了高口碑，微博开分9.1，豆瓣评分7.8。,http://www.hzfanews.com/detail.html?id=62791C3A3C2946DBF9086A6978A781AF88DCE5A283A91B04,,0,0,False
抖音公告！集体下架！,2024-12-11 14:26,794,433,津云,津云,据“抖音安全中心”微信公众号消息，抖音致力于打造积极、开放、友善的社区环境，持续推进微短剧内容治理，并定期发布治理公告，鼓励和推广优质微短剧，持续对含有不良价值观导向、违反公序良俗、低俗“擦边”等违规内容的微短剧，以及相关违规账号进行治理。11月，平台累计下架违规微短剧209部。,https://toutiao.com/group/7447160291265217051/,,0,0,False
海南富商张晖：花8亿建108米海上观音像，4年后死在水中死因成谜,2024-10-19 04:49,2709,455,八号探秘人,八号探秘人,在阅读此文之前，辛苦您点击一下“关注”，既方便您进行讨论和分享，又能给您带来不一样的参与感，感谢您的支持！编辑丨xk他是中国的一名富商，耗费8亿元完成了自己的梦想。可梦想落地成为现实的时候，他却在4年后莫名其妙的死去。他就是张晖，上个世纪末海南岛旅游业的龙头当家人。,https://toutiao.com/group/7427288913095492134/,,0,0,False
远嫁日本的女儿已失联16个月，湖南大妈身兼多职攒赴日路费：最后联系时提到被家暴,2024-12-11 13:46,1101,1233,潇湘晨报•晨视频,潇湘晨报•晨视频,从2023年8月到2024年12月，72岁的湖南华容县黄女士，已经有近16个月的时间没有看到自己的女儿了。微信不回消息，短视频账号没有评论和点赞，打电话也不接，就连以前有联系的中国好友也失去了消息，远嫁日本的女儿向晓芳，像是人间蒸发了一样。,http://api.chenshipin.com/wap/a/67598c3a8420170ca916aff4/90f456b81afce808c1fcfbd3f5761f65/1733924705/067b63f4f050e189d8daa0d0b9ad43c28a674583a33c2fcb9f935ccc218eddca,,0,0,False
