title,publish_time,like_count,comment_count,media_name,source,abstract,article_url,tag,is_yaowen,article_sub_type,has_video
【讲习所·美美与共】“这个世界完全容得下各国共同发展、共同进步”,2025-03-15 03:20,586,101,国际在线,国际在线,【本期导读】“在各国前途命运紧密相连的今天，不同文明包容共存、交流互鉴，在推动人类社会现代化进程、繁荣世界文明百花园中具有不可替代的作用。在此，我愿提出全球文明倡议。,https://news.cri.cn/toutiaopic/6fb9ffc5-57c0-d58a-d7cd-e6d738c12c31.html,,0,0,False
太黑了！315曝光这些，各大品牌集体翻车，网友：要钱又要命,2025-03-15 09:57,4326,510,司柠,司柠,又来了！每年315，各种问题层出不穷，只有你没见过的，没有他们做不出来的，特别是食品安全问题深受广大网友关注。先看看今年315目前曝光的店面：1.,https://toutiao.com/group/7481952621784252962/,,0,0,False
打通最后200米？武统全面加速，赖清德突破红线，投降都来不及?,2025-03-14 03:54,20023,6222,方清的视角,方清的视角,彻底不装了，赖清德公然将大陆定位为境外反对势力，已经突破了红线，关键时刻，解放军的登陆利器曝光，到时候台湾当局投降都来不及。,https://toutiao.com/group/7481507923127058980/,,0,0,False
突发！刚被曝光，集体停播！,2025-03-15 13:52,236,129,红星新闻,红星新闻,15日晚举办的央视“3·15”晚会，曝光了卫生巾、纸尿裤残次料被翻新“二次销售”的情况。根据报道，相关厂家“二等品”产品的来源涉及自由点、全棉时代、苏菲、好之、米菲、babycare、中亿孕婴等品牌。,https://toutiao.com/group/7482033726654824969/,,0,0,False
拿走李嘉诚巴拿马港口的贝莱德，才高兴了几天，却发现自己上当了,2025-03-14 01:41,2657,212,阿华今天说事,阿华今天说事,,https://toutiao.com/group/7481474325049049600/,,0,0,True
战斗机训练失事，飞行员成功跳伞,2025-03-15 11:02,6617,7455,人民海军,人民海军,记者从南部战区海军机关了解到，3月15日13时30分许，该部所属1架战斗机在进行训练时失事，坠毁于海南省临高县加来镇附近空地，飞行员成功跳伞，未造成地面附带损伤。南部战区海军正在组织力量进行事故善后处置，事故原因有待进一步调查核实。,https://toutiao.com/group/7481989884178186802/,,0,0,False
这是张学良老婆赵四小姐真实样貌，并非演员饰演而是货真价实真品,2024-12-28 11:28,33864,2747,历史伟人,历史伟人,赵四小姐，原名赵一荻，她从十六岁开始她终生陪伴张学良，历经坎坷，赵一荻是富家大小姐，但是在张学良囚禁期间，她选择陪伴软禁中的张学良，后悔过吗?,https://toutiao.com/group/7453422736652698175/,,0,0,False
