title,publish_time,like_count,comment_count,media_name,source,abstract,article_url,tag,is_yaowen,article_sub_type,has_video
时政微周刊丨总书记的一周（12月16日—12月22日）,2024-12-23 01:42,1245,650,央视新闻,央视新闻,©2024中央广播电视总台版权所有。未经许可，请勿转载使用。,https://content-static.cctvnews.cctv.com/snow-book/index.html?item_id=13720589341996406836&source=50006&sub_source=50006_001,,0,0,False
郜春海：低空经济的发展空间远超新能源，颠覆未来商业模式,2024-12-19 08:10,2932,646,凤凰网财经,凤凰网财经,,https://toutiao.com/group/7450032423821115914/,,0,0,True
温州多家私人影院“可触摸服务人员隐私部位”？记者暗访后报警！警方：已对三个场所行政立案,2024-12-17 08:00,15605,4117,大风新闻,大风新闻,挂着“私人影院”的招牌，线上招徕生意，线下如同幽灵，连地址都是虚假的，居然还设“暗室”对付查处。近日，有网民向大皖新闻反映，在浙江省温州市一些颇受年轻人青睐的私人影院，悄然滋生了一些涉黄服务。,https://toutiao.com/group/7449286844203713062/,,0,0,False
广西49岁老汉娶19岁姑娘，结婚21年生下15个孩子，如今有何下场？,2024-10-20 08:32,8640,1081,艺述史,艺述史,她19岁出嫁，21年里总共生育了15个孩子，其中4个男孩子11个女孩子，家里热闹的像是开了一所学校一样。,https://toutiao.com/group/7427400319418384948/,,0,0,False
县长看不上乡长送的烟，给他退回来，乡长打开一看乐了,2024-11-13 08:16,10162,1683,乐视大综艺咖,乐视大综艺咖,,https://toutiao.com/group/7436672568578277925/,,0,0,True
女子被多人密谋灌醉强奸后投江自尽，生前在手机备忘录记下被胁迫经过，三男子获罪,2024-12-18 16:40,12348,9759,红星新闻,红星新闻,投河自尽前，黄某某于2023年7月4日在其手机内创建了备忘录，记录下了她被胁迫的经过，这也成为了公检法日后侦查、起诉和判决的重要物证。,https://cdsbrss.cdsb.com/toutiao_no_video.php?url=https%3A%2F%2Fstatic.cdsb.com%2Fmicropub%2FArticles%2F202412%2Fc6419feb940b5f2c2302f01847e73bb8.html,,0,0,False
人间真实，北约赶在特朗普之前把乌克兰卖了,2024-12-21 07:13,2445,838,军情作家陈曦,军情作家陈曦,据报道，北约秘书长马克·吕特在保加利亚的公开讲话中，向外界透露了一个令人不太意外的事实:北约成员国没有义务与乌克兰签署双边安全协议。,https://toutiao.com/group/7450759482589250086/,,0,0,False
中央定调2025年养老金上涨，计算公式，企退人员能涨7%以上吗？,2024-12-18 04:29,2322,279,社保当家,社保当家,中央定调2025年养老金上涨，计算公式，企业退休人员能涨7%以上吗？在2025年到来之际，养老金上涨的消息就早早地确定了，这无疑给广大退休人员吃上了定心丸。因为根据近期召开的中央经济工作会议，已经明确提出要适当提高退休人员的基本养老金待遇。,https://toutiao.com/group/7447756391172833827/,,0,0,False
新婚33天卷走274万4套房，出逃后丈夫跨国追捕，如今下场大快人心,2024-12-20 22:06,2298,136,八号探秘人,八号探秘人,在阅读此文之前，辛苦您点击一下“关注”，既方便您进行讨论和分享，又能给您带来不一样的参与感，感谢您的支持！编辑丨QQ·B“色字头上一把刀！”深圳富豪结婚33天竟被卷走274万元和名下4套房产。不仅如此，他还被扣上了“接盘侠”的帽子，啥也没干喜当爹。,https://toutiao.com/group/7450399558821052982/,,0,0,False
杀疯了的「北京市服」，统一全国审美？,2024-11-25 00:30,3434,1288,凤凰WEEKLY,凤凰WEEKLY,文/馍王编辑/闫如意众所周知，凤凰编辑部位于北京市。众所又知，北京的冬天，有一种统一所有人穿搭审美的魔力。这个冬天，编辑部的穿搭呈现出了无限趋同。上班时，人均穿着一件柔软的摇粒绒内衬，蜷缩在工位上。下班点一到，用一件宽大冲锋衣把摇粒绒一锁，挺胸抬头，跟扇大铁门似的走出公司。,https://toutiao.com/group/7440858414693040678/,,0,0,False
今年冬至60年一遇，5大特殊，过年冷不冷就看冬至的表现！,2024-12-21 00:17,6259,939,惠农圈,惠农圈,冬至到啦，这可是冬季最大的一个节气，也是一个节日，在民间素有“冬至大如年”的说法。在古代社会，那些常年在外地工作的人，在冬至这一天会赶回家。,https://toutiao.com/group/7450652001870594614/,,0,0,False
益生菌真的那么神奇吗？有关益生菌的几个误区 你“踩雷”了吗？,2024-12-07 02:35,1751,102,央视频,央视频,,https://toutiao.com/group/7445492942887715365/,,0,0,True
32岁飞行员晋升机长失败当天失联,2024-12-21 23:40,1221,875,大象新闻,大象新闻,近日，网上一段疑似飞行员深夜在大桥上失联的事引发广泛关注。视频：飞行员深夜桥上失联，家人发布寻人启事网上一段8秒视频中有一男子的两张图片，其中一张穿着黑色上衣，显得阳光帅气，精神十足，另一张疑似其以前的照片。,https://share.hntv.tv/news/0/1870596225543892994,,0,0,False
四川：可4倍音速飞行 成都造“筋斗云”成功试飞,2024-12-20 10:52,3882,357,看看新闻,看看新闻,四川：可4倍音速飞行 成都造“筋斗云”成功试飞,http://mediaplay.kksmg.com/2024/12/20/h264_720p_600k_78546-DFTVHD-20241220175000-4800-967537-600k_mp4.mp4,,0,0,True
萝卜和鸡蛋这样做，比吃补药还补，顿顿吃都不会腻，又香又下饭,2024-10-30 12:28,67743,4160,小寒厨艺,小寒厨艺,萝卜和鸡蛋这样做，比吃补药还补，顿顿吃都不会腻，又香又下饭,https://toutiao.com/group/7431405463378919975/,,0,0,True
马光远：大城市才有机会的观点过时了 #财经大咖来了,2024-12-17 06:00,7164,520,光远看经济,光远看经济,,https://toutiao.com/group/7449256659496469027/,,0,0,True
100年前，清朝罕见留影，王爷妻妾婀娜多姿，乞丐全身挂满垃圾,2024-10-14 09:58,2696,300,万物知识局,万物知识局,每一张老照片，都像是时间的低语，它们静静地躺在历史的相册中，却在不经意间将我们拉回到那个遥远而神秘的年代。,https://toutiao.com/group/7425457574731579919/,,0,0,False
河南警察3岁女儿被拐，苦寻全国23年无果，结果却发现女儿在对门,2024-11-05 07:43,5213,599,八号探秘人,八号探秘人,寻亲23年无果，丢失的女儿竟住在对门?但它却真实发生在河南洛阳的梁绍波身上。是意外走丢，还是人贩子所为，三岁的女儿怎会离奇失踪?,https://toutiao.com/group/7433697108120142345/,,0,0,False
三人毁了一部剧！《我是刑警》这些“戏混子”，快收手吧,2024-12-20 03:17,355,395,青衫书生,青衫书生,《我是刑警》最近热播程度已经肉眼可见。可谓是收视率和口碑双在线。开播一集的时候就已经破百万收视率。可令人没想到的是，到后面大结局的时评分是越来越低。这也让大部分人对这部剧的编剧引起了怀疑....那问题来了，到底是剧本的烂、破案的随意..还是说和演员的演技挂钩？,https://toutiao.com/group/7450325520689922587/,,0,0,False
中国又躺枪了,2024-12-21 06:24,3877,126,牛弹琴,牛弹琴,特朗普对欧盟发飙，欧盟却有神操作,https://toutiao.com/group/7450747182111523380/,,0,0,True
俄罗斯的决心很大，俄乌冲突可能到了最危险的时刻,2024-12-20 11:34,8727,592,金灿荣教授,金灿荣教授,,https://toutiao.com/group/7450456114459574820/,,0,0,True
给《我是刑警》演技最好10位演员排座次：于和伟第3，第1名没争议,2024-12-18 04:06,1916,366,皮皮电影,皮皮电影,《我是刑警》收官之际，网上的争议，却也多了不少。有人盛赞它是“近10年最硬核刑侦剧”，老派纪实的剧作风格，令人着迷。受其影响，很多观众开始追起了二十多年前的《中国刑侦1号案》《12·1枪杀大案》。有人评价它“高开低走”。,https://toutiao.com/group/7449562650628866595/,,0,0,False
小伙去看病，没想女医生是自己前任，下秒对话太逗了,2024-12-08 07:38,4942,1114,南瓜说异,南瓜说异,,https://toutiao.com/group/7445939678059954740/,,0,0,True
清华才女李一诺：27岁博士毕业，4年生3娃，能替世界首富花钱,2024-12-18 05:51,4197,258,云莳一,云莳一,家庭是她第一个学校，妈妈是她第一任老师。李一诺27岁博士毕业进入美国麦肯锡公司，33岁成为公司全球董事合伙人，之后四年连生3娃。,https://toutiao.com/group/7449591069311779355/,,0,0,False
海南富商张晖：花8亿建108米海上观音像，4年后死在水中死因成谜,2024-10-19 04:49,3793,633,八号探秘人,八号探秘人,在阅读此文之前，辛苦您点击一下“关注”，既方便您进行讨论和分享，又能给您带来不一样的参与感，感谢您的支持！编辑丨xk他是中国的一名富商，耗费8亿元完成了自己的梦想。可梦想落地成为现实的时候，他却在4年后莫名其妙的死去。他就是张晖，上个世纪末海南岛旅游业的龙头当家人。,https://toutiao.com/group/7427288913095492134/,,0,0,False
包厢全是刚出狱的恶霸，结果一看到饭店主厨，立马怂了,2024-11-11 01:21,13547,369,乐视群星访谈秀,乐视群星访谈秀,,https://toutiao.com/group/7435825833048015400/,,0,0,True
冬季自驾游，零下四十度睡车里，半夜冻醒了，车里全部冻住了！,2024-12-13 11:02,14695,3141,旅行者小多,旅行者小多,,https://toutiao.com/group/7447850219347116544/,,0,0,True
马桶冲水无力没有吸力？一般都是这4个原因，大部分自己就能解决,2024-12-08 11:33,1328,133,阿兵电器维修,阿兵电器维修,马桶冲水无力没有吸力？很简单，一般都是这4个原因，大部分自己就能解决,https://toutiao.com/group/7446002675537150491/,,0,0,True
如何看待美国出台的《2024中国军力报告》？,2024-12-23 05:18,11905,768,大刘说说,大刘说说,美国国防部最近出台了2024中国军力报告，今年我们来聊聊西方世界是如何看待中国的军力发展的,https://toutiao.com/group/7451472335464301096/,,0,0,True
炖鸡肉不要焯水和直接下锅，教你一招，鸡肉鲜香滑嫩不腥不柴,2024-12-15 08:45,4163,209,家常的味道,家常的味道,炖鸡肉千万不要焯水和直接下锅，教你秒招，鸡肉鲜香滑嫩不腥不柴,https://toutiao.com/group/7448556944597451275/,,0,0,True
女儿着急去排练，一听是奢香夫人，玲花：这个我熟｜综艺,2024-12-19 16:00,22346,1350,PP宫斗放映厅,PP宫斗放映厅,,https://toutiao.com/group/7450045373738910223/,,0,0,True
67岁执意生娃，如今却坐轮椅无法自理，5岁的天赐被迫独立学洗衣,2024-11-04 10:32,9718,2215,睿之悦,睿之悦,2019年，已经67岁的田新菊执意生下了自己的第三个孩子小天赐。那么，现如今5年的时间过去了，这“天赐”的礼物到底是福还是祸呢?,https://toutiao.com/group/7433367394946384435/,,0,0,False
