title,publish_time,like_count,comment_count,media_name,source,abstract,article_url,tag,is_yaowen,article_sub_type,has_video
人民日报社论：强农固本，为推进中国式现代化提供基础支撑,2025-02-23 22:48,799,392,人民日报,人民日报,原标题：强农固本，为推进中国式现代化提供基础支撑（社论） 春为一岁首，农为百事先。新春伊始，部署做好“三农”工作，关涉全年，关系大局。中共中央、国务院公开发布《关于进一步深化农村改革 扎实推进乡村全面振兴的意见》。,https://www.peopleapp.com/column/30048332976-500006107896?utm_source=头条号&promote=true,,0,0,False
一个独生子接母亲出院的过程被网友拍下，数百万人引发共鸣。,2025-02-22 12:52,42316,12927,龙象风,龙象风,,https://toutiao.com/group/7474225331756319232/,,0,0,True
煮大虾时，牢记不要加水煮，海鲜老板教我一招，虾肉鲜嫩不腥不柴,2025-01-26 15:11,3003,215,有趣的苹果,有趣的苹果,,https://toutiao.com/group/7464241958916784655/,,0,0,True
媳妇玩到半夜才回来，以为老公不在家，进门这操作把老公看懵了,2025-01-24 09:38,13124,3467,滕菲,滕菲,,https://toutiao.com/group/7463414214191743497/,,0,0,True
央视曝光带货直播间欺诈套路！,2025-02-20 02:15,581,532,明禹思行录,明禹思行录,,https://toutiao.com/group/7473319243522621979/,,0,0,True
俄乌互不信任，美欧各怀鬼胎，中国会舍我其谁出兵维和停战吗？,2025-02-22 22:01,12082,680,黎建南台湾,黎建南台湾,,https://toutiao.com/group/7474366926311916041/,,0,0,True
57岁于文华现状，与丈夫住农村简陋房子，裙子拖地喂着狗生活幸福,2024-12-17 01:24,5459,410,焰墨绘史,焰墨绘史,在阅读此文之前，麻烦您点击一下“关注”，既方便您进行讨论和分享，又能给您带来不一样的参与感，感谢您的支持。本文内容均引用权威资料结合个人观点进行撰写，文中已标注文献来源及截图，请知悉。提起于文华，想必当大家都不会陌生，当年的她凭借那首《纤夫的爱》，一夜间家喻户晓。,https://toutiao.com/group/7448948632033722889/,,0,0,False
男子与女子坐地铁，人挤人的地铁里，男子却一堆人海中占了大便宜,2024-12-30 01:28,1260,110,经典热综回放,经典热综回放,,https://toutiao.com/group/7454010603036738067/,,0,0,True
一觉醒来，德国变天了,2025-02-23 23:40,1507,278,牛弹琴,牛弹琴,一觉醒来，尘埃落定，德国变天了。朔尔茨大叔，将不是德国总理了。选举政治，上上下下，也都在意料之中。只是2月23日的德国大选，朔尔茨领衔的社民党，却只拿到16%的选票，沦为最大的输家。,https://toutiao.com/group/7474760347635761679/,,0,0,False
