title,publish_time,like_count,comment_count,media_name,source,abstract,article_url,tag,is_yaowen,article_sub_type,has_video
沙利文的结局已定，他在离开白宫之前，说出了中美发生战争的结果,2024-12-16 02:48,14286,868,全荃,全荃,沙利文的结局已定，他在离开白宫之前，说出了中美发生战争的结果,https://toutiao.com/group/7448833372408775187/,,0,0,True
2024年中国的房价见底了吗？,2024-12-19 06:41,4298,194,温义飞的急救财经,温义飞的急救财经,,https://toutiao.com/group/7450009540067590692/,,0,0,True
冬季骑行西藏，害怕有狼借宿废弃小屋，还有柴火炉可以取暖做饭吃,2024-12-16 03:59,32361,4516,刘伟元的旅行,刘伟元的旅行,,https://toutiao.com/group/7448551716082942505/,,0,0,True
温州多家私人影院“可触摸服务人员隐私部位”？记者暗访后报警！警方：已对三个场所行政立案,2024-12-17 08:00,13366,3898,大风新闻,大风新闻,挂着“私人影院”的招牌，线上招徕生意，线下如同幽灵，连地址都是虚假的，居然还设“暗室”对付查处。近日，有网民向大皖新闻反映，在浙江省温州市一些颇受年轻人青睐的私人影院，悄然滋生了一些涉黄服务。,https://toutiao.com/group/7449286844203713062/,,0,0,False
给《我是刑警》演技最好的10位演员排座次：于和伟第3，第1没争议,2024-12-18 04:06,669,165,皮皮电影,皮皮电影,《我是刑警》收官之际，网上的争议，却也多了不少。有人盛赞它是“近10年最硬核刑侦剧”，老派纪实的剧作风格，令人着迷。受其影响，很多观众开始追起了二十多年前的《中国刑侦1号案》《12·1枪杀大案》。有人评价它“高开低走”。,https://toutiao.com/group/7449562650628866595/,,0,0,False
100年前，清朝罕见留影，王爷妻妾婀娜多姿，乞丐全身挂满垃圾,2024-10-14 09:58,2637,293,万物知识局,万物知识局,每一张老照片，都像是时间的低语，它们静静地躺在历史的相册中，却在不经意间将我们拉回到那个遥远而神秘的年代。,https://toutiao.com/group/7425457574731579919/,,0,0,False
美国遣返中国非法移民？他们跟中国已经没关系了，爱到哪到哪,2024-12-14 01:05,28673,5172,金灿荣教授,金灿荣教授,,https://toutiao.com/group/7447851020526289423/,,0,0,True
弟弟光荣退伍，姐姐兴奋去车站接他，怎料一见弟弟瞬间哭了,2024-11-05 06:34,39251,3249,乐视天天剧好看,乐视天天剧好看,,https://toutiao.com/group/7433679820573934091/,,0,0,True
中央定调2025年养老金上涨，计算公式，企退人员能涨7%以上吗？,2024-12-18 04:29,1227,149,社保当家,社保当家,中央定调2025年养老金上涨，计算公式，企业退休人员能涨7%以上吗？在2025年到来之际，养老金上涨的消息就早早地确定了，这无疑给广大退休人员吃上了定心丸。因为根据近期召开的中央经济工作会议，已经明确提出要适当提高退休人员的基本养老金待遇。,https://toutiao.com/group/7447756391172833827/,,0,0,False
重磅！国家已释放5个重磅信号，2025年中国将迎惊天动地的大机会,2024-12-17 13:20,4383,519,占豪,占豪,这一年，因战乱而死的人估计数十万，巴以冲突、俄乌战场，人可能瞬间就没了，当地老百姓生活也是真的苦，叙利亚以前还能吃免费大饼，现在连免费大饼也没了，巴勒斯坦早就没大饼吃了······说心里话，和纷乱的世界相比，不得不感叹和平真好!,https://toutiao.com/group/7449369382092718629/,,0,0,False
台湾又拍大尺度！ 太羞耻了，注定只能网盘见,2024-12-10 09:40,3653,186,禾芷解说,禾芷解说,深度解说台湾电影《亲爱的杀手》,https://toutiao.com/group/7446671812101931572/,,0,0,True
美国对华布局与韩国戒严巧合？尹锡悦被弹劾困兽犹斗，手握王牌,2024-12-15 22:01,32295,1318,黎建南台湾,黎建南台湾,,https://toutiao.com/group/7448762044733456908/,,0,0,True
香港九龙寨城老照片：曾是香港最邪恶肮脏之地，图9场景令人作呕,2024-11-21 11:32,2519,459,万物知识局,万物知识局,有这么一个地方，他虽然地处极度繁华的都市香港，但是却脏乱不堪，环境极度的恶劣，各种违法的交易都在这里进行，甚至黄赌毒，也在这里悄然滋生，这就是九龙城寨。,https://toutiao.com/group/7439657140518519296/,,0,0,False
曹德旺预言：2025年，没有买房的人，五年后是失败者还是幸运儿？,2024-12-16 05:57,5369,1844,议史纪,议史纪,其实早在多年前年，“玻璃大王”曹德旺就曾预言:“房地产将成为有钱人击鼓传花的游戏”，房子就是钢筋混凝土，是不会保值的?,https://toutiao.com/group/7448883228297003539/,,0,0,False
郜春海：低空经济的发展空间远超新能源，颠覆未来商业模式,2024-12-19 08:10,2924,643,凤凰网财经,凤凰网财经,,https://toutiao.com/group/7450032423821115914/,,0,0,True
小品：杨帆演小沈阳，撒贝宁演赵本山，台词功底太强了吧,2024-11-23 06:13,6472,124,PP宫斗放映厅,PP宫斗放映厅,,https://toutiao.com/group/7440353912709710386/,,0,0,True
冬季自驾游，零下四十度睡车里，半夜冻醒了，车里全部冻住了！,2024-12-13 11:02,13596,2893,旅行者小多,旅行者小多,,https://toutiao.com/group/7447850219347116544/,,0,0,True
炸肉丸子，到底用淀粉还是面粉，教你一招，外酥里软超好吃,2024-10-01 09:23,6935,541,家常的味道,家常的味道,,https://toutiao.com/group/7420735473208787492/,,0,0,True
女子被多人密谋灌醉强奸后投江自尽，生前在手机备忘录记下被胁迫经过，三男子获罪,2024-12-18 16:40,11357,9330,红星新闻,红星新闻,投河自尽前，黄某某于2023年7月4日在其手机内创建了备忘录，记录下了她被胁迫的经过，这也成为了公检法日后侦查、起诉和判决的重要物证。,https://cdsbrss.cdsb.com/toutiao_no_video.php?url=https%3A%2F%2Fstatic.cdsb.com%2Fmicropub%2FArticles%2F202412%2Fc6419feb940b5f2c2302f01847e73bb8.html,,0,0,False
中央定调！2025年养老金双增长，养老金领取条件有变，一类人不涨,2024-12-14 08:18,4686,388,思之想之,思之想之,2025年养老金调整最新消息来了，中央已经定调，2025年养老金将迎来双增长。另外提醒大家，2025年起养老金领取条件有变，一类人不参加2025年养老金调整，具体是什么呢？一起来了解。,https://toutiao.com/group/7448174128252682788/,,0,0,False
包厢全是刚出狱的恶霸，结果一看到饭店主厨，立马怂了,2024-11-11 01:21,13226,363,乐视群星访谈秀,乐视群星访谈秀,,https://toutiao.com/group/7435825833048015400/,,0,0,True
厨师长教你：“羊肉汤”汤质优美，营养丰富；不膻不腥，味道鲜美,2024-11-21 02:57,6136,709,美食作家王刚,美食作家王刚,厨师长教你：“羊肉汤”汤质优美，营养丰富；不膻不腥，味道鲜美,https://toutiao.com/group/7439561371424915994/,,0,0,True
女子买宝马车过了8年才想起提车，4S店回应,2024-12-20 11:01,256,161,金羊网,金羊网,近日，河南郑州彭女士向小莉帮忙爆料称，自己2016年交了5万元定金买宝马，最初4S店没有现车，后来可以提车时自己资金链断了，当时销售承诺可以随时来提车，但没想到后来自己竟也忘了这事儿。时隔8年，彭女士表示，自己想起来了，有钱了，想提车却被拒绝用之前的定金。,https://news.ycwb.com/2024-12/20/content_53133196.htm,,0,0,False
一汽集团将开启大规模人事调整：涉及30多位高管，一汽-大众、一汽解放人事大换防,2024-12-20 06:28,350,392,每日经济新闻,每日经济新闻,每经记者：段思瑶 每经编辑：董天意一汽集团将开启大规模人事调整。12月20日，一份关于一汽集团最新人事变动的名单流出，涉及一汽-大众、一汽解放、一汽奥迪等子公司30多位高管。,http://www.nbd.com.cn/rss/jinri_toutiao/articles/3693062.html,,0,0,False
“我用开水浇你的头，你还会有头发吗？”被判死刑的余华英反问杨妞花,2024-12-20 03:29,996,758,极目新闻,极目新闻,12月19日上午9时30分，备受关注的余华英拐卖儿童案在贵州省高级人民法院重审二审开庭。杨妞花作为被拐者之一到庭参加诉讼。19日下午，贵州省高级人民法院二审宣判，驳回余华英上诉，维持一审死刑判决。19日下午2时15分左右，杨妞花及其代理律师王文广从贵州省高级人民法院走出。,http://jms.ctdsb.net/jmythshare/#/index_share?cId=0&contentType=5&contentId=2334172,,0,0,False
银行存款新规解析:10万以上需注意！,2024-12-19 22:43,5762,383,向阳畅谈,向阳畅谈,,https://toutiao.com/group/7450257277681926696/,,0,0,True
帅哥看不上相亲女，撒谎没车没房没户口，姑娘的反应绝了,2024-11-18 05:47,4187,405,乐视天天剧好看,乐视天天剧好看,,https://toutiao.com/group/7438491946131128872/,,0,0,True
极越汽车公关负责人被开除，本人回应来了,2024-12-20 03:50,121,222,极目新闻,极目新闻,据第一财经，12月20日上午，极越汽车通过邮件发布“员工违纪行为通报”。,http://jms.ctdsb.net/jmythshare/#/index_share?cId=0&contentType=5&contentId=2334192,,0,0,False
