title,publish_time,like_count,comment_count,media_name,source,abstract,article_url,tag,is_yaowen,article_sub_type,has_video
习言道丨20天内两赴东北，习近平谈到几个关键词,2025-02-09 02:31,5299,4297,中国新闻网,中国新闻网,题:20天内两赴东北，习近平谈到几个关键词。今年春节前夕，习近平总书记曾赴辽宁看望慰问基层干部群众，20天内，总书记两次来到东北，足迹涵盖了东北三省。,http://ku.m.chinanews.com/wapapp/cns/gn/2025/02-09/10365600.shtml,,0,0,False
温暖万家灯火 守护团圆祥和——春节假期各方面保障盘点,2025-02-10 11:59,418,182,新华网,新华网,正月鼓点闹春忙，神州大地年味浓。交通出行人次超23亿、国内出游总花费6770亿元、全国揽投快递包裹超19亿件……刚刚过去的春节假期，一串串跃动的数字绘就一幅温暖祥和的新春画卷。这幅画卷的背后，凝聚着方方面面的守护与保障、坚守与付出。,http://my-h5news.app.xinhuanet.com/h5/article.html?articleId=13594e223f676f0a5777a0c32c4d898d,,0,0,False
移居中国13年的英国人🇬🇧当他回到伦敦时他震惊了…儿子想走,2025-01-13 03:37,42138,10443,Goujohnson,Goujohnson,移居中国13年的英国人🇬🇧当他回到伦敦时他震惊了…儿子想走,https://toutiao.com/group/7459238917565317644/,,0,0,True
《哪吒之魔童闹海》80亿票房各省贡献,2025-02-10 09:41,21633,7223,才思敏捷清泉,才思敏捷清泉,,https://toutiao.com/group/7469723124746781221/,,0,0,True
清汤面好吃有诀窍，教你面馆30年不外传的秘诀，劲道爽滑汤鲜味美,2024-12-13 13:30,13635,1754,百变小厨坊,百变小厨坊,,https://toutiao.com/group/7447888258186347018/,,0,0,True
很好看，熬夜也要看完。,2025-02-02 02:37,17661,804,我爱你中国,我爱你中国,,https://toutiao.com/group/7466645082817528370/,,0,0,True
穷小伙找富婆借钱买房子，富婆直接答应，却提出条件,2025-01-07 03:09,3400,637,南瓜热剧回放,南瓜热剧回放,,https://toutiao.com/group/7457005446646202916/,,0,0,True
小品 #笑到肚子疼,2025-01-11 15:15,3172,796,星星的物语,星星的物语,,http://toutiao.com/item/7458676558513881654/,,0,0,True
公公竟然和儿媳偷情，哪料被妻子撞见，这下有戏看了！,2025-01-21 08:05,12474,1020,南瓜午夜厅,南瓜午夜厅,,https://toutiao.com/group/7462273852651979274/,,0,0,True
小伙爱上单身母亲，等自己的母亲离开，两人赶紧抱在一起,2025-01-24 16:00,1994,507,群星访谈秀,群星访谈秀,,https://toutiao.com/group/7461081565724967434/,,0,0,True
贺岁喜剧片《唐探1900》,2025-01-30 22:55,1557,147,小马搬影,小马搬影,,https://toutiao.com/group/7465845806969553447/,,0,0,True
风光：妻子不把丈夫当人看，哪料丈夫提出离婚，妻子崩溃了！,2025-01-11 06:00,3661,558,谍战影视营,谍战影视营,,https://toutiao.com/group/7458377879160750601/,,0,0,True
