title,publish_time,like_count,comment_count,media_name,source,abstract,article_url,tag,is_yaowen,article_sub_type,has_video
时政微观察丨大湾区 大未来,2024-12-13 07:58,3957,1590,央视新闻,央视新闻,这片5.6万平方公里的土地，以不到全国0.6%的国土面积，创造出超全国1/10的经济总量，成为我国开放程度最高、经济活力最强的区域之一，也是经济发展质量最高、最具“含金量”的地区之一。,https://content-static.cctvnews.cctv.com/snow-book/index.html?item_id=5426506124861711677&source=50006&sub_source=50006_001,,0,0,False
学习时节｜2025年经济工作这项重点任务，总书记多次强调,2024-12-13 15:21,1569,757,金羊网,金羊网,中共中央总书记、国家主席、中央军委主席习近平出席会议并发表重要讲话。会议总结2024年经济工作，分析当前经济形势，部署2025年经济工作，提出9项重点任务。,https://news.ycwb.com/2024-12/13/content_53120207.htm,,0,0,False
三蹦子在国外杀疯了，成老外新宠！台媒点评，这是神秘的东方力量,2024-12-13 12:36,4732,595,国际时事快递,国际时事快递,,https://toutiao.com/group/7447822619909063177/,,0,0,True
中央定调！2025年养老金迎来新调整，退休新规实施，还有个好消息,2024-12-14 00:24,4090,406,思之想之,思之想之,2025年马上就要来了，这是一个充满变化的关键的年份，这是十四五规划的最后一年，很多政策将会兑现。2025年，除了养老金继续用来调整之外，退休新规也将会正式实施，还有一个好消息，具体是什么呢?,https://toutiao.com/group/7448052182332473867/,,0,0,False
冬季自驾游，零下四十度睡车里，半夜冻醒了，车里全部冻住了！,2024-12-13 11:02,8309,1762,旅行者小多,旅行者小多,,https://toutiao.com/group/7447850219347116544/,,0,0,True
李铁好友爆料相处往事，私下里不抽烟不喝酒，喜欢健身跑步,2024-12-14 07:58,220,107,与君説,与君説,在阅读此文之前，麻烦您点击一下“关注”，既方便您进行讨论和分享，又能给您带来不一样的参与感，感谢您的支持文、编辑|是否“我是非常后悔的，还是要踏踏实实，走正路”。12月13日，前任国足主教练李铁因为受贿等多种罪名，被判处了20年的有期徒刑。,https://toutiao.com/group/7448169948108554767/,,0,0,False
包菜炒粉条，切记不要焯水和直接下锅，教你一招，清脆爽口不出水,2024-11-11 11:50,9499,467,家常的味道,家常的味道,,https://toutiao.com/group/7435987746101690930/,,0,0,True
如日中天的特朗普要失望了？面对他的特殊邀请，中方不按套路出牌,2024-12-14 10:38,8321,235,田柳Talk,田柳Talk,,https://toutiao.com/group/7448214967976722955/,,0,0,True
《我是刑警》中的穿帮镜头，一个比一个搞笑，看看你都发现了哪些,2024-12-13 10:25,341,272,与君説,与君説,在阅读此文之前，麻烦您点击一下“关注”，既方便您进行讨论和分享，又能给您带来不一样的参与感，感谢您的支持文、编辑|小娄2024年年末的这几部剧里，若说口碑与热度兼备的，恐怕就只有于和伟主演的《我是刑警》了。,https://toutiao.com/group/7447837089364558336/,,0,0,False
我可以说在中国有很多无耻的人，这种人活在世上可以说是多余。,2024-12-14 05:47,481,167,远文分享,远文分享,,https://toutiao.com/group/7448140145675239962/,,0,0,True
台湾又拍大尺度！ 太羞耻了，注定只能网盘见,2024-12-10 09:40,3079,165,禾芷解说,禾芷解说,深度解说台湾电影《亲爱的杀手》,https://toutiao.com/group/7446671812101931572/,,0,0,True
80岁老奶奶做红烧鱼从来不粘锅不破皮，原来技巧这么简单,2024-10-16 12:07,5816,320,家常的味道,家常的味道,,https://toutiao.com/group/7426343891651985974/,,0,0,True
海南富商张晖：花8亿建108米海上观音像，4年后死在水中死因成谜,2024-10-19 04:49,2892,484,八号探秘人,八号探秘人,在阅读此文之前，辛苦您点击一下“关注”，既方便您进行讨论和分享，又能给您带来不一样的参与感，感谢您的支持！编辑丨xk他是中国的一名富商，耗费8亿元完成了自己的梦想。可梦想落地成为现实的时候，他却在4年后莫名其妙的死去。他就是张晖，上个世纪末海南岛旅游业的龙头当家人。,https://toutiao.com/group/7427288913095492134/,,0,0,False
美国遣返中国非法移民？他们跟中国已经没关系了，爱到哪到哪,2024-12-14 01:05,19207,3584,金灿荣教授,金灿荣教授,,https://toutiao.com/group/7447851020526289423/,,0,0,True
抖音公告！集体下架！,2024-12-11 14:26,1126,629,津云,津云,据“抖音安全中心”微信公众号消息，抖音致力于打造积极、开放、友善的社区环境，持续推进微短剧内容治理，并定期发布治理公告，鼓励和推广优质微短剧，持续对含有不良价值观导向、违反公序良俗、低俗“擦边”等违规内容的微短剧，以及相关违规账号进行治理。11月，平台累计下架违规微短剧209部。,https://toutiao.com/group/7447160291265217051/,,0,0,False
这是非洲的五菱汽车，是个人都能造车，百公里仅需三个馒头,2024-12-11 16:07,2580,358,百家纪实,百家纪实,,https://toutiao.com/group/7447140344900092442/,,0,0,True
男女约会车内录音曝光。,2024-12-13 23:23,588,195,海底VM,海底VM,,https://toutiao.com/group/7448041099127423522/,,0,0,True
女性身上这3个地方最脏，有女伴的男性不妨了解下，对双方都好？,2024-12-13 03:37,697,124,速闻捕手员,速闻捕手员,,https://toutiao.com/group/7447735524897096228/,,0,0,True
弟弟光荣退伍，姐姐兴奋去车站接他，怎料一见弟弟瞬间哭了,2024-11-05 06:34,34594,3071,乐视天天剧好看,乐视天天剧好看,,https://toutiao.com/group/7433679820573934091/,,0,0,True
74岁天后徐小凤露面，全场明星都看呆，成龙更是满眼不可思议,2024-12-10 00:23,29556,2391,番茄炒蛋,番茄炒蛋,,https://toutiao.com/group/7446371305135276580/,,0,0,True
帅哥看不上相亲女，撒谎没车没房没户口，姑娘的反应绝了,2024-11-18 05:47,2716,292,乐视天天剧好看,乐视天天剧好看,,https://toutiao.com/group/7438491946131128872/,,0,0,True
相爱37年零绯闻，丁勇岱对赵雪华一见钟情，如今却对儿子很失望,2024-11-09 21:43,3229,302,八号探秘人,八号探秘人,在阅读此文之前，辛苦您点击一下“关注”，既方便您进行讨论和分享，又能给您带来不一样的参与感，感谢您的支持！编辑丨xk1985年，丁勇岱转过楼梯拐角，撞到人生挚爱，这一下把他撞“开窍”了。那时他还不是《末路》里的白宝山。也不是《跨过鸭绿江》里的彭老总，更不是《人世间》里的周志刚。,https://toutiao.com/group/7435160230918406707/,,0,0,False
从华为Mate40Pro换Mate70新机，感觉有点后悔了？,2024-12-08 11:13,327,251,老王vlogA,老王vlogA,,https://toutiao.com/group/7445997643706302987/,,0,0,True
超甜！唐嫣、李现深情对唱《若月亮没来》，舞台效果好震撼！,2024-09-17 12:22,9573,1442,央视频,央视频,,https://toutiao.com/group/7415586271159910975/,,0,0,True
28岁女子独闯无人区，野狼跟随五天五夜，最终被狼和秃鹫分食,2024-11-26 09:56,903,326,美群畅谈,美群畅谈,,https://toutiao.com/group/7441524736540017192/,,0,0,True
100年前，清朝罕见留影，王爷妻妾婀娜多姿，乞丐全身挂满垃圾,2024-10-14 09:58,2479,275,万物知识局,万物知识局,每一张老照片，都像是时间的低语，它们静静地躺在历史的相册中，却在不经意间将我们拉回到那个遥远而神秘的年代。,https://toutiao.com/group/7425457574731579919/,,0,0,False
电动车或将被淘汰？新型两轮车大量投放，不用充电，续航120公里,2024-12-13 00:26,900,261,kk科普,kk科普,电动车或将被淘汰？新型两轮车大量投放，不用充电，续航120公里,https://toutiao.com/group/7447686389354725927/,,0,0,True
车晓谈前夫李兆会：世上除了我妈他最爱我，但他的爱令我无法承受,2024-09-21 06:26,2598,539,八号探秘人,八号探秘人,200辆迎亲车、500桌流水席，价值20万的黄金项链，没什么作品的她成了娱圈人人羡慕的对象。成龙做媒、嫁身价40亿山西最年轻首富，走上人生巅峰的她不料却迅速跌入谷底。,https://toutiao.com/group/7416978879144788530/,,0,0,False
男人为什么永远喜欢18岁女孩？终于有懂男人的电影了,2024-12-09 09:58,2272,336,越哥说电影,越哥说电影,,https://toutiao.com/group/7446349314937094695/,,0,0,True
罕见！100年前，英国游客拍下的清朝乡村，和想象中完全不一样,2024-09-20 02:07,9003,789,万物知识局,万物知识局,泥泞的土路，衣不蔽体的老百姓，即便是达官显贵的家中也十分破败，而这些都是清王朝的历史痕迹，虽说那时候中国摄影技术并不发达，但也有许多外国游客来到这里，拍摄下了许多老照片，为我们留下了珍贵的历史资料，那清朝到底是怎样的面貌呢?,https://toutiao.com/group/7416287738871267855/,,0,0,False
第10个拥核国家诞生，欧洲集体失声，美国束手无策，已成美军禁区,2024-12-12 07:42,2588,351,东方点兵,东方点兵,白俄罗斯正式官宣拥有核武器，抗衡北约威胁，第10个拥核国家诞生，欧洲集体失声，白俄罗斯已成美军禁区。,https://toutiao.com/group/7447426068287357477/,,0,0,False
因长得太漂亮被导演狂追，却因拒绝追求无戏可拍，今搭档胡歌走红,2024-11-18 07:15,1224,752,禾芷解说,禾芷解说,被导演狂追7次，只要有一次答应，就可以享受到无数的资源。但貌美如花的万茜，却为坚持原则，选择果断拒绝！从那之后，万茜就被这位导演“封资源”，两三年都没有接到一部好作品。20年后的万茜，事业却很成功，她靠着《浪姐》火遍全国，生活中嫁给圈外摄影师，有一个活泼可爱的女儿。,https://toutiao.com/group/7438514460141634088/,,0,0,False
河南警察3岁女儿被拐，苦寻全国23年无果，结果却发现女儿在对门,2024-11-05 07:43,4083,433,八号探秘人,八号探秘人,寻亲23年无果，丢失的女儿竟住在对门?但它却真实发生在河南洛阳的梁绍波身上。是意外走丢，还是人贩子所为，三岁的女儿怎会离奇失踪?,https://toutiao.com/group/7433697108120142345/,,0,0,False
香港九龙寨城老照片：曾是香港最邪恶肮脏之地，图9场景令人作呕,2024-11-21 11:32,2389,437,万物知识局,万物知识局,有这么一个地方，他虽然地处极度繁华的都市香港，但是却脏乱不堪，环境极度的恶劣，各种违法的交易都在这里进行，甚至黄赌毒，也在这里悄然滋生，这就是九龙城寨。,https://toutiao.com/group/7439657140518519296/,,0,0,False
