title,publish_time,like_count,comment_count,media_name,source,abstract,article_url,tag,is_yaowen,article_sub_type,has_video
公公竟然和儿媳偷情，哪料被妻子撞见，这下有戏看了！,2025-01-21 08:05,6650,637,南瓜午夜厅,南瓜午夜厅,,https://toutiao.com/group/7462273852651979274/,,0,0,True
刘雯:我是好人,2025-01-15 05:01,24317,2483,雪峰蔚来,雪峰蔚来,,https://toutiao.com/group/7460002721844806194/,,0,0,True
LG杯采访柯洁 ，有才有德 ，最谦虚的一面展现出来,2025-01-24 12:54,605,108,耗哥解说,耗哥解说,,https://toutiao.com/group/7463464460503253514/,,0,0,True
继母把2岁女儿带大，如今生母回国，不让继母参加女儿婚礼,2025-01-15 07:20,2867,2151,英雄影视汇,英雄影视汇,,https://toutiao.com/group/7460027004579037696/,,0,0,True
强烈要求在全国各地单位循环播放,2025-01-24 09:50,7584,1909,小天使,小天使,,https://toutiao.com/group/7463417093930680859/,,0,0,True
男人目睹了妻子的偷情，下一秒情夫和妻子就遭到了他的制裁！,2025-01-23 09:05,4046,356,橙子影视吖6,橙子影视吖6,,https://toutiao.com/group/7463034403476734527/,,0,0,True
赵本山凭这一个小品，捧红了王小利，全程笑点不断,2025-01-04 20:46,5858,1253,娱快很简单,娱快很简单,,https://toutiao.com/group/7454123678406541824/,,0,0,True
地铁一女子拿背包占座，乘务员沟通半天无果，邻座大妈突然出手！,2025-01-22 02:03,7215,3149,客家林胖哥,客家林胖哥,南京地铁上一女子把背包放到座位上，另外一个站点有乘客上车想座这个位置，结果背包的主人说“这是我放包的，你人不能站着吗”？女乘客就叫来了乘务员，可是乘务员沟通半天女子就是不愿意把背包放地上。最后，邻座的大妈实在看不下去，一把把女子的背包给抓起来丢地上，她一屁股坐过去，然后把她的位置让给这个乘客，大妈那个动作真的太帅了！！,https://toutiao.com/group/7462554677310210623/,,0,0,True
媳妇玩到半夜才回来，以为老公不在家，进门这操作把老公看懵了,2025-01-24 09:38,2099,721,滕菲,滕菲,,https://toutiao.com/group/7463414214191743497/,,0,0,True
出租车司机半路捡个姑娘，直接带回家，老婆一看反应笑翻了,2025-01-14 07:28,3629,212,南瓜钟意你,南瓜钟意你,,https://toutiao.com/group/7459669645180650024/,,0,0,True
