title,publish_time,like_count,comment_count,media_name,source,abstract,article_url,tag,is_yaowen,article_sub_type,has_video
谁支持了特朗普上台？原来美国教会及中产，打败了政治邪恶力量！,2024-11-12 22:06,11737,627,黎建南台湾,黎建南台湾,,https://toutiao.com/group/7436517585706811930/,,0,0,True
51年洪学智妻子寻女无果，到老乡家歇脚老乡惊呼：你要找得就是我,2024-09-22 01:07,13388,873,品古观今,品古观今,前言1951年，阳曲县委大院突然来了7、8位解放军同志，其中一位女同志，就是洪学智的妻子张文。她此番前来，就是为了寻找多年前因战乱而寄养于民间的爱女。可昔日的小村落早已蜕变成另一番景象，这无异于是大海捞针。,https://toutiao.com/group/7417034363226915354/,,0,0,False
今天才知道！电动车“每天充”和“用完再充”，到底哪个更伤电池,2024-08-27 11:19,15467,2364,鲸探所,鲸探所,“今天到底给车充不充电？”估计大多数人每天回家都会想这个问题，看着自己的电动车电量又多又少的，充不充电也是一件非常难以抉择的事情。那么，电动车到底应该怎样充电呢？是每天都充，还是用完之后再充呢？电动车充电不管是在城市还是农村，电动车其实都是人们出门最常见的交通工具。,https://toutiao.com/group/7407773012533117475/,,0,0,False
快消失的12个生活用品！40年前在供销社红极一时，你家还在用吗？,2024-09-29 07:58,5262,360,万物知识局,万物知识局,在这里，可以买到从油盐酱醋到衣物鞋帽，再到农具化肥等各种生活必需品，每一样物品都凝聚着时代的特色，见证了那个年代人们的生活状态，今天我们就来走进那些年能够在供销社里买到的生活用品，看看你们还记得哪些。,https://toutiao.com/group/7419937237548237322/,,0,0,False
山西五台山悬崖上的狐仙洞，发现住着2个千年狐仙，上去吓得腿软,2024-10-22 03:00,8288,800,山西凡凡,山西凡凡,,https://toutiao.com/group/7428429414959940106/,,0,0,True
内阁人选出炉，对华立场各异，两派博弈，将如何左右特朗普决策？,2024-11-12 09:49,20074,1218,邱震海,邱震海,,https://toutiao.com/group/7436327724950094373/,,0,0,True
包厢全是刚出狱的恶霸，结果一看到饭店主厨，立马怂了,2024-11-11 01:21,4029,115,乐视群星访谈秀,乐视群星访谈秀,,https://toutiao.com/group/7435825833048015400/,,0,0,True
炸萝卜丸子到底用面粉还是淀粉，教你正确做法，外焦里嫩，太香了,2024-10-26 09:25,6948,459,家常的味道,家常的味道,,https://toutiao.com/group/7430012978277122611/,,0,0,True
特朗普为啥说中国不会武统？,2024-11-09 14:00,23028,133,静思有我,静思有我,,https://toutiao.com/group/7435279079740047872/,,0,0,True
1米3袖珍美女嫁给1米48男孩，婚后丈夫奇迹长高，两人却不欢而散,2024-09-07 02:55,3981,221,睿之悦,睿之悦,杨萍和葛存苗的婚礼 文|睿之悦 编辑|睿之悦2019年，成都的民政局来了两个“10岁小孩”来登记，工作人员以为是玩闹。两个“小孩”拿出身份证让工作人员看，这才明白，原来是两个再也长不高的成年袖珍人情侣。,https://toutiao.com/group/7411713833267364386/,,0,0,False
特朗普杀回来了，第二次贸易战要来了，中国要做哪些准备？,2024-11-07 15:49,12783,2150,金灿荣教授,金灿荣教授,,https://toutiao.com/group/7434468272764650020/,,0,0,True
女儿花500块租男友，没想他是身价过亿的总裁，这下好运了,2024-10-18 09:42,7929,1478,乐视娱乐乐透社,乐视娱乐乐透社,,https://toutiao.com/group/7427048858267419190/,,0,0,True
忆往昔，泽连斯基被泼冷水，看今日，更加被动只能尽快休战,2024-11-07 10:20,31522,2343,宋忠平,宋忠平,忆往昔，泽连斯基被泼冷水，看今日，更加被动只能尽快休战,https://toutiao.com/group/7434480186654982656/,,0,0,True
炸萝卜丸子，放面粉和淀粉就错了，教你正确做法，焦香酥脆不吸油,2024-09-28 10:13,24133,1059,家常的味道,家常的味道,,https://toutiao.com/group/7419635124758643227/,,0,0,True
迈向世界最强海军！中国赶造第一艘核动力航母,2024-11-13 00:15,5012,244,王丰台北,王丰台北,世界上所有的海军强权，都有一段艰辛而漫长的建军备战历程，从西班牙无敌舰队，到荷兰帝国海军，再到英国帝国海军，乃至今天的美国海军，它们都经历了一段艰难的建军过程。西方的谚语说，只有含泪播种的人才可以含笑收获。我们要完成祖国统一大业，要完成民族伟大复兴，必须要有一套宏伟的方法论，而建军备战就是脚踏实地的方法论。(声明:本视频脚本文稿全部都是作者自己亲自撰写，视频中如有引述新闻信息素材时，作者都会在视频中口头说明来源。其它绝大多数素材内容均属作者本身之论述观点创意，特此声明),https://toutiao.com/group/7436550789524357670/,,0,0,True
男子在路边被黄鼠狼盯住，咬住他的鞋不松口,2024-10-14 06:46,19325,3870,山西广电文娱,山西广电文娱,,https://toutiao.com/group/7425519012454335003/,,0,0,True
中国国乒又火了！决胜时刻，领军人物疯狂逆转，上演最解气的一幕,2024-11-04 00:00,6423,734,乐播体育,乐播体育,,https://toutiao.com/group/7433056969079915020/,,0,0,True
地铁惊现神秘男子，行为诡异，女孩们见了都对其避而远之！,2024-11-08 07:34,979,113,乐视综艺咖,乐视综艺咖,,https://toutiao.com/group/7434808570073481737/,,0,0,True
给近三年最好的10部年代剧排个名：《人世间》第6，第1名没有争议,2024-09-06 08:08,11858,3727,皮皮电影,皮皮电影,时尚是个轮回，电视剧也是。在2020年之前的那些年，电视剧市场基本上都被偶像剧、都市剧霸占。曾经撑起国剧品质的《闯关东》《岁月》这类年代好剧，难见踪影。,https://toutiao.com/group/7411390030722712090/,,0,0,False
广西49岁老汉娶19岁姑娘，结婚21年生下15个孩子，如今有何下场？,2024-10-20 08:32,2065,284,艺述史,艺述史,她19岁出嫁，21年里总共生育了15个孩子，其中4个男孩子11个女孩子，家里热闹的像是开了一所学校一样。,https://toutiao.com/group/7427400319418384948/,,0,0,False
父亲：煤炭工50岁娶亲无望，谁知路边捡到个女人，洗干净太美了,2024-10-24 16:03,2277,141,乐视明星太秀了,乐视明星太秀了,父亲：煤炭工50岁娶亲无望，谁知路边捡到个女人，洗干净太美了,https://toutiao.com/group/7429265285783224867/,,0,0,True
俩人相亲互相看不上，哪料男方一报母亲身份，姑娘乐了,2024-11-08 01:50,7522,1844,乐视群星访谈秀,乐视群星访谈秀,,https://toutiao.com/group/7434719902990074395/,,0,0,True
雷探长探访欧洲淫窟立陶宛，采访路人多位美女。#立陶宛,2024-11-13 12:23,4659,529,冒险雷探长,冒险雷探长,,https://toutiao.com/group/7436738422735471130/,,0,0,True
著名专家预言：试管婴儿寿命仅40年，那首例试管婴儿如今怎样了？,2024-09-01 06:05,8471,446,睿之悦,睿之悦,文|睿之悦编辑|睿之悦“试管婴儿活不到40岁？”1988年3月10日，我国首例试管婴儿顺利诞生。在当时，试管婴儿的技术正处于起步阶段，因此，有人将其视为医学的奇迹，但也有人则预言试管婴儿活不过40岁。那么，36年的时间过去了，我国首例试管婴儿如今怎么样了呢？,https://toutiao.com/group/7409105262277853733/,,0,0,False
郭有才：当迷失方向忘记初心后，曾经飘得多高，如今摔得就多惨,2024-11-11 06:53,624,370,八号探秘人,八号探秘人,在阅读此文之前，辛苦您点击一下“关注”，既方便您进行讨论和分享，又能给您带来不一样的参与感，感谢您的支持！编辑丨brt因为一首翻唱，他一夜之间成为了拥有千万粉丝的网红。但是“人红是非多”，不久他就因为版权等问题陷入了舆论风波。他的人气一落千丈，从万众瞩目变成了现在的无人问津。,https://toutiao.com/group/7435901170239078948/,,0,0,False
首例5胞胎长大了，父亲已过劳去世 母亲直言：如能重来一个也不要,2024-08-31 03:06,2124,517,睿之悦,睿之悦,2002年，在北京的一家妇产医院中，一位来自河北的孕妇顺利生下了两男三女的五胞胎，创造了一个全国罕见的奇迹。,https://toutiao.com/group/7409098624111575603/,,0,0,False
好物分享｜炖牛肉时切记三放两不放，这样炖出来的牛肉才会汤鲜味美,2024-10-15 08:50,4043,141,家味美食,家味美食,,https://toutiao.com/group/7425922043991360037/,,0,0,True
怎样在家做的梅菜扣肉会更好吃，大厨教你诀窍，肥而不腻咸香软糯,2024-08-30 09:00,5972,622,天天相见厨房(阿见),天天相见厨房(阿见),,https://toutiao.com/group/7407836908509725219/,,0,0,True
特朗普在忙什么？他的新政府许多反华人士入列，中美关系会怎么走,2024-11-08 10:05,32159,1583,邱毅台湾,邱毅台湾,,https://toutiao.com/group/7434847402797990452/,,0,0,True
雕漆隐花，雕出紫气东来！,2024-11-12 08:29,92042,17673,李子柒,李子柒,"这个大漆视频迟到了四年
“漆”同“柒”
我给这幅雕漆隐花的漆器作品取名“紫气东来”
麒麟回首，万事不愁
也把这份祝愿送给看到视频的每一个你，很想你们！",https://toutiao.com/group/7436307196792537610/,,0,0,True
杨过大战蒙古高手，竟使出打狗棒法、九阴真经，黄蓉都懵了,2024-10-25 16:00,3887,383,乐视群星访谈秀,乐视群星访谈秀,杨过大战蒙古高手，竟使出打狗棒法、九阴真经，黄蓉都懵了,https://toutiao.com/group/7428528132879024691/,,0,0,True
小伙洗完澡故意秀肌肉，富婆心跳加速被当场拿下，这下好看了,2024-10-26 16:20,7489,296,乐视情感讲堂,乐视情感讲堂,小伙洗完澡故意秀肌肉，富婆心跳加速被当场拿下，这下好看了,https://toutiao.com/group/7430011217881596426/,,0,0,True
我国首次直播火箭发射失败，真实影像记录了全过程！,2024-11-13 02:10,661,155,元气清风Fx,元气清风Fx,,https://toutiao.com/group/7436492911702704674/,,0,0,True
服用他达拉非的患者会对身体造成伤害吗？切记“3要2不要”,2024-09-15 14:56,777,140,李药师谈健康,李药师谈健康,口服药物是治疗勃起功能障碍的主要方式之一，随着ED群体的逐年增长，造福全球男性的「伟哥」由此诞生。相比大家都很熟悉的西地那非，他达拉非这个后起之秀，也逐渐被大家所认可。,https://toutiao.com/group/7414883509208220201/,,0,0,False
拿柴房造了一个森林衣帽间,2024-11-12 08:59,77419,14195,李子柒,李子柒,"很多年以前就想有一个属于自己的衣帽间
我想要它是坐落在森林里的，周围有花海
还可以躺在衣帽间的沙发上看星星……",https://toutiao.com/group/7436314950995280395/,,0,0,True
送给所有知道我名字的人 想送一份祝愿给大家，所以唱了这首歌,2024-11-13 04:30,73505,12652,李子柒,李子柒,,https://toutiao.com/group/7436616916803781171/,,0,0,True
美妇约见老情人，见面场景真是太逗了，这俩人绝配！,2024-10-27 16:25,3027,378,乐视明星的那点事,乐视明星的那点事,美妇约见老情人，见面场景真是太逗了，这俩人绝配！,https://toutiao.com/group/7428157095108674088/,,0,0,True
总裁故意扮成保安，试探相亲姑娘，不料对方反应逗了,2024-11-01 09:44,2782,363,乐视热播综艺精选,乐视热播综艺精选,,https://toutiao.com/group/7431780632960696847/,,0,0,True
仇中先被除名！亲中成特哥密友！ 欢迎收看《谦言谦语》播出,2024-11-12 02:04,13546,581,赖岳谦官方,赖岳谦官方,,https://toutiao.com/group/7436207969793999423/,,0,0,True
“朱令案”最新进展：北京人民检察院已正式答复,2024-11-13 12:00,2289,1396,大皖新闻,大皖新闻,11月13日，据媒体消息，11月11日，朱令父母了收到北京市人民检察院的书面答复，结论是：经审查，未发现公安机关存在侦查违法情形。,http://www.ahwang.cn/toutiao/202411/2772666.html,,0,1,False
空仓而来、满载而归！沙特600万租300平展厅啥都不摆，进货来了？,2024-11-12 05:36,3227,596,军武次位面,军武次位面,第十五届珠海航展如约开幕，各国展商带着各自最新的军工装备、技术展示而来。他们租下了约300平米的展厅，租金高达数百万人民币，但展厅内却空无一物。,https://toutiao.com/group/7436255538167431714/,,0,0,False
樊振东、马龙、陈梦退出WTT福冈总决赛2024,2024-11-13 07:37,391,716,新京报,新京报,新京报讯 11月13日，世界乒乓球职业大联盟发布消息称，樊振东、马龙、陈梦退出WTT福冈总决赛2024。樊振东退赛，贝内迪克特·杜达递补；马龙退赛，安东·卡尔伯格递补；陈梦退赛，伯纳黛特·斯佐科斯递补。,https://m.bjnews.com.cn/detail/1731483236129765.html,,0,0,False
