title,publish_time,like_count,comment_count,media_name,source,abstract,article_url,tag,is_yaowen,article_sub_type,has_video
翟欣欣为了钱，竟然可以克服生理厌恶和苏某结婚，也真是个狠人,2025-01-22 09:22,5283,1442,乐见Talk,乐见Talk,索要千万逼死前夫的翟欣欣，认罪认罚！天理昭昭，报应不爽，迟到七年半的审判终于来了。本以为的一场婚姻纠纷，伴随着一封遗书解开了翟欣欣蛇蝎面目。,https://toutiao.com/group/7462559129823953442/,,0,0,False
女老师跳“凌波微步”，段誉看了要哭泣,2024-12-16 10:12,2998,407,表哥爱跳舞,表哥爱跳舞,,https://toutiao.com/group/7448950466706145792/,,0,0,True
韩国人回国后发现完全没了韩国人的优越感，对中国一无所知,2025-01-12 05:30,10219,2453,多才多艺未来可期b,多才多艺未来可期b,,https://toutiao.com/group/7458896824057823770/,,0,0,True
女性一天撸铁几次？,2025-01-31 18:01,1323,161,顺其自然,顺其自然,,https://toutiao.com/group/7466140975954428451/,,0,0,True
胡歌给三十年后的自己打电话，谁料刚一开口，唐嫣就憋不住狂笑,2024-12-19 21:22,2964,378,十一同学,十一同学,,https://toutiao.com/group/7450236569186894348/,,0,0,True
二少爷装疯卖傻，少奶奶派出丫鬟前去试探他，有好戏看了,2024-11-23 23:28,7132,1240,乐享综艺剧场,乐享综艺剧场,,https://toutiao.com/group/7439971404629410342/,,0,0,True
这么高的个子，不跳广场舞可惜了,2024-11-20 23:28,27847,3603,成武融媒,成武融媒,,https://toutiao.com/group/7439507575931929127/,,0,0,True
温岭613爆炸影像，20人死175人受伤，附近小区被夷为平地,2024-11-23 08:09,9361,1408,万物Explorer,万物Explorer,,https://toutiao.com/group/7440383926046196235/,,0,0,True
刚旅游完浙江温州和山东临沂，实话实说吧，城建水平不是一个级别,2024-11-09 14:30,555,566,城拍畅游世界,城拍畅游世界,,https://toutiao.com/group/7435287007577932327/,,0,0,True
