title,publish_time,like_count,comment_count,media_name,source,abstract,article_url,tag,is_yaowen,article_sub_type,has_video
幸福生活，像花儿一样绽放——习近平总书记在贵州和云南考察纪实,2025-03-22 00:15,5644,2600,新华网,新华网,列车在祖国大西南的群山峻岭间飞驰，这里有壮美的山川，有厚重的历史，有绚丽的文化，有欣欣向荣的发展。全国两会闭幕不到一周，习近平总书记即赴贵州和云南考察调研。5年前，“十三五”收官，考察云南，要求“全面建成小康社会，一个民族都不能少”。,http://my-h5news.app.xinhuanet.com/h5/article.html?articleId=67c078cc188a2986d767104ef8b7c93c,,0,0,False
315曝光5个瓜：小龙坎塌房，酸奶暴雷，12款酱油疑致癌，个个离谱,2025-03-20 06:57,421,282,鲸探所,鲸探所,一根藤上5个瓜，瓜瓜不一样!更离谱的是，虽说315已经过去了，可是却还有大瓜一个接着一个的被爆了出来。,https://toutiao.com/group/7483779034405601832/,,0,0,False
14年儿子坐马航失联，多年后父亲收到回信，坚信儿子去了平行世界,2025-02-20 02:38,12194,1176,谛听骨语,谛听骨语,MH370失联的第10年，马来西亚政府宣布在2024年12月20日重启寻找马航MH370的项目。如果后续进展顺利的话，马航MH370会在2025年的1月到4月期间重新展开全面地搜寻。凭空消失的客机，有希望被揭露的失踪真相，这一切都是让人充满了期待。,https://toutiao.com/group/7473322554179895817/,,0,0,False
不见棺材不落泪？官方喊话五次后，李嘉诚不再沉默，放出一组数据,2025-03-21 14:36,17135,5099,力波观察,力波观察,官方已经因为长江和记与贝莱德集团之间的港口交易向李嘉诚发出了5次喊话，面对各方的指责，李嘉诚终于不再沉默了。,https://toutiao.com/group/7484271563118789160/,,0,0,False
牺牲太大！美国59岁女宇航员被抬出舱，骨瘦如柴身体机能呈大变化,2025-03-22 02:53,1652,345,睿之悦,睿之悦,或许谁都没有想到，原本只是8天的行程，却硬生生的拖到9个多月才结束。而当59岁的女航天员威廉姆斯被抬着出舱的那一刻，让不少网友都大呼:这变化也太大了吧!,https://toutiao.com/group/7484459716408525363/,,0,0,False
315刚过，又有两大品牌暴雷，查出有致癌物质，看看你家里有吗？,2025-03-22 03:36,811,182,梦清州,梦清州,每年的315，都是备受关注的日子，因为都能从晚会中狠狠避雷。315之后，就又有两个很火的调味品被爆出了问题，给了消费者沉重一击。,https://toutiao.com/group/7484469574423921163/,,0,0,False
