title,publish_time,like_count,comment_count,media_name,source,abstract,article_url,tag,is_yaowen,article_sub_type,has_video
时习之丨“小民生”里的“大改革” 总书记始终牵挂,2024-11-03 12:57,1834,915,人民网,人民网,10月29日上午，省部级主要领导干部学习贯彻党的二十届三中全会精神专题研讨班在中央党校（国家行政学院）开班。,https://toutiao.com/group/7433036282756022838/,,0,0,False
炒白菜千万不要直接下锅，难怪不好吃，教你技巧，鲜嫩入味不出水,2024-10-30 09:23,4340,179,家常的味道,家常的味道,,https://toutiao.com/group/7431496869400576550/,,0,0,True
原来他才是毁掉刘翔真凶，因贪1200万被公审，让刘翔背负多年骂名,2024-08-29 09:58,13315,407,八号探秘人,八号探秘人,在田径场上创造的成绩，至今无人能够打破，甚至在国际上享有盛名。本该继续夺冠之路，却两次因伤退赛，遭到了全网辱骂。,https://toutiao.com/group/7408489498465616410/,,0,0,False
清华博士从8000米高空跳机自杀，父母拒绝收尸：就让他死在美国,2024-10-16 04:07,1921,375,艾弥儿,艾弥儿,在今年的5月份，美国警方在荒郊野外发现了一具男性尸体，经过DNA对比之后，发现这个男人就是曾经消失不见的华裔博士荣鑫。,https://toutiao.com/group/7426206901370634761/,,0,0,False
总裁故意扮成保安，试探相亲姑娘，不料对方反应逗了,2024-11-01 09:44,1532,212,乐视热播综艺精选,乐视热播综艺精选,,https://toutiao.com/group/7431780632960696847/,,0,0,True
土豆搭配洋葱，教你一个神仙吃法，一次3斤不够吃，太解馋了,2024-09-26 09:09,30015,1779,家常的味道,家常的味道,土豆搭配洋葱，教你一个神仙吃法，一次3斤不够吃，太解馋了,https://toutiao.com/group/7418876506660667904/,,0,0,True
善恶终有报：疫情时对中国一毛不拔，却大方捐美国6亿，如今咋样,2024-09-29 05:50,955,127,睿之悦,睿之悦,可就是这样一位在中国土生土长起来的富豪，在疫情期间面对同胞的困境却一毛不拔，反而大方的捐助了6亿给美国。,https://toutiao.com/group/7419859345154015798/,,0,0,False
罕见！100年前，英国游客拍下的清朝乡村，和想象中完全不一样,2024-09-20 02:07,4302,514,万物知识局,万物知识局,泥泞的土路，衣不蔽体的老百姓，即便是达官显贵的家中也十分破败，而这些都是清王朝的历史痕迹，虽说那时候中国摄影技术并不发达，但也有许多外国游客来到这里，拍摄下了许多老照片，为我们留下了珍贵的历史资料，那清朝到底是怎样的面貌呢?,https://toutiao.com/group/7416287738871267855/,,0,0,False
双航母编队演练现场画面，来了！,2024-10-31 07:56,9388,1353,人民日报,人民日报,,https://www.peopleapp.com/column/30047187445-500005881513?utm_source=头条号&promote=true,,0,1,True
首例5胞胎长大了，父亲已过劳去世 母亲直言：如能重来一个也不要,2024-08-31 03:06,1128,285,睿之悦,睿之悦,2002年，在北京的一家妇产医院中，一位来自河北的孕妇顺利生下了两男三女的五胞胎，创造了一个全国罕见的奇迹。,https://toutiao.com/group/7409098624111575603/,,0,0,False
美媒：中国又一艘新航母曝光，模样怪异，是干什么用的？,2024-11-02 08:26,2743,152,军武次位面,军武次位面,最近，位于中国广州的广船国际造船厂内，一艘神秘舰艇的突然现身引起了美国媒体的高度关注。这艘舰艇不仅拥有大型开放式飞行甲板，还具有轻型航空母舰或两栖攻击舰的典型特征，一时成为外媒争相报道的热点。,https://toutiao.com/group/7432224320463569427/,,0,0,True
给近三年最好的10部年代剧排个名：《人世间》第6，第1名没有争议,2024-09-06 08:08,10407,3396,皮皮电影,皮皮电影,时尚是个轮回，电视剧也是。在2020年之前的那些年，电视剧市场基本上都被偶像剧、都市剧霸占。曾经撑起国剧品质的《闯关东》《岁月》这类年代好剧，难见踪影。,https://toutiao.com/group/7411390030722712090/,,0,0,False
“两头婚”在国内悄然出现，“两头婚”逐渐增多？你能接受吗？,2024-10-16 09:01,723,685,读者,读者,你听说过“两头婚”吗？最近这几年，在年轻人中间流行起了一种新型婚姻形式——两头婚。对于他们而言，这种婚姻形式不仅仅是一种全新尝试，更是除了传统婚姻之外的一种完美选择。那么，这种新型的婚姻模式，真的代表了更理想的婚姻选择吗？,https://toutiao.com/group/7426187021527384615/,,0,0,False
军号一响，全军出击！,2024-09-19 08:01,28332,1777,中国军号,中国军号,,https://toutiao.com/group/7416261401477382668/,,0,0,True
老四收蟹网发财了，一下抓了十几斤兰花蟹，还有不少鱼等着卖,2024-09-20 08:21,3852,203,老四赶海,老四赶海,老四收蟹网发财了，一下抓了十几斤兰花蟹，还有不少鱼等着卖！,https://toutiao.com/group/7416575667582468649/,,0,0,True
现场直击哈里斯大选总结陈词，华盛顿7.5万人集会盛况空前！,2024-10-30 04:19,12714,3651,王冰汝,王冰汝,,https://toutiao.com/group/7431418524259582473/,,0,0,True
穷小子去富婆家里，富婆笑咧嘴把保姆支开，保姆心知肚明,2024-10-26 06:34,1613,201,乐视情感讲堂,乐视情感讲堂,穷小子去富婆家里，富婆笑咧嘴把保姆支开，保姆心知肚明,https://toutiao.com/group/7429969094939509311/,,0,0,True
以后想吃回锅肉你就像我这样做，肥而不腻，咸香适口，太解馋了,2024-08-06 11:19,38410,1378,家常的味道,家常的味道,,https://toutiao.com/group/7399984507362738742/,,0,0,True
骑行川藏中线，天黑来到小金县入住酒店，整个县城市狭窄又拥挤,2024-10-28 04:07,21501,2322,刘伟元的旅行,刘伟元的旅行,,https://toutiao.com/group/7430673434343899698/,,0,0,True
逆袭人生，找老婆建别墅当上老板，小奎一家终得圆满#娟奎之恋,2024-08-31 05:27,16739,2848,海哥量地球,海哥量地球,,https://toutiao.com/group/7409170930649268771/,,0,0,True
骑行川藏中线天黑被困峡谷中，废弃铁皮房生火做饭吃，挡风又安全,2024-11-01 04:00,24655,5196,刘伟元的旅行,刘伟元的旅行,,https://toutiao.com/group/7432044366060847650/,,0,0,True
女子被诱骗拘禁近5年遭强奸产女，男子因强奸罪获刑15年，曾称“把你搞来就为要个儿子”,2024-11-02 06:26,455,275,大风新闻,大风新闻,终于拿到判决书了。37岁的张玲期待着，自己能就此远离那场噩梦。在乡下的10年里，她每天都被农活包围，打油菜籽、喂鸡鸭、做饭、照顾6岁的儿子，生活平静庸常。只是偶尔，身体会不自觉地露出异样。,https://toutiao.com/group/7432563482551255579/,,0,0,False
又被全世界打脸，这是美国今年最耻辱的失败,2024-11-01 00:10,7111,1814,牛弹琴,牛弹琴,资料图又被全世界打脸，这是美国今年最耻辱的一次失败。之所以说“又”，很简单，以前每年都有过，结果也差不多。事实上，这也成了一年一次联合国大会，最后的保留曲目，全世界同声谴责美国，全世界一起看美国笑话。因为全世界投票，要求美国必须终止对古巴的经济、商业和金融封锁。,https://toutiao.com/group/7432095642685686291/,,0,0,False
杭州这个环卫大叔刷屏了！捡到2460000元，接下来的举动太赞了！,2024-11-02 03:01,615,246,极目新闻,极目新闻,11月1日晚，杭州环卫工拾到百万存单交还失主的故事，在很多萧山人朋友圈刷屏。246万元！什么概念？环卫大叔说了：“这算啥拾金不昧？捡到当然要还给人家的。”10月31日早上7点，萧山闻堰三洞闸街，68岁的环卫工人汪惠明正在三江名苑北门区域进行清洁工作，突然发现马路上丢着两张单据。,http://jms.ctdsb.net/jmythshare/#/index_share?cId=0&contentType=5&contentId=2294699,,0,0,False
姜萍事件，别让舆论牵住了我们的鼻子,2024-11-03 04:40,491,1606,红网,红网,□汪雨燕（安徽大学江淮学院）“在本届竞赛中，江苏省涟水中等专业学校教师王某某和其指导的学生入围决赛，引发社会关注。根据决赛阅卷结果，二人未获奖。,https://moment.rednet.cn/content/646855/95/14417771.html,,0,0,False
超甜！唐嫣、李现深情对唱《若月亮没来》，舞台效果好震撼！,2024-09-17 12:22,8750,1401,央视频,央视频,,https://toutiao.com/group/7415586271159910975/,,0,0,True
13年9岁男孩扶老太被讹，老太发誓说谎死全家，儿媳却意外说漏嘴,2024-10-25 08:09,601,127,睿之悦,睿之悦,文|睿之悦编辑|睿之悦“就是这个娃撞了我，我虽然年纪大了，但我可不糊涂……”2013年，一位9岁的小学生江小云好心的将摔倒的蒋老太扶起，却反被讹100万。当时的蒋老太甚至还发毒誓，声称要是说谎的话就“死全家”。那么，这到底是怎么一回事呢？,https://toutiao.com/group/7429620647524450831/,,0,0,False
善恶终有报！66岁“消失”了的陈宝国，可谓是娱乐圈的悲哀与损失,2024-09-27 06:29,2398,155,八号探秘人,八号探秘人,“我真的挺不喜欢听艺人这个词，前两年听得我一个劲儿地倒胃口”。当很多人挤破脑袋想要进娱乐圈当一名艺人的时候，他却说了这样一句话。,https://toutiao.com/group/7419206100681114153/,,0,0,False
小伙洗完澡故意秀肌肉，富婆心跳加速被当场拿下，这下好看了,2024-10-26 16:20,4685,203,乐视情感讲堂,乐视情感讲堂,小伙洗完澡故意秀肌肉，富婆心跳加速被当场拿下，这下好看了,https://toutiao.com/group/7430011217881596426/,,0,0,True
今年是暖冬还是冷冬？国家气候中心最新研判！,2024-11-03 06:48,321,128,上观新闻,上观新闻,据中央气象台消息，3日起至5日，新一股强冷空气开始影响我国，长江中下游以北地区气温将先后下降6～10℃，内蒙古中部、华北北部、东北地区南部等局地降温可达12℃；内蒙古中东部、华北、黄淮、东北地区中南部等地伴有4~6级大风，阵风7~9级，北部和东部海区将先后有7~8级大风，阵风9~,https://export.shobserver.com/toutiao/html/814362.html,,0,1,False
俄罗斯自驾游，凌晨两点好多飞机，真的太吓人了！,2024-08-08 23:45,28660,11498,旅行者小多,旅行者小多,,https://toutiao.com/group/7400919001422889481/,,0,0,True
美妇约见老情人，见面场景真是太逗了，这俩人绝配！,2024-10-27 16:25,1778,230,乐视明星的那点事,乐视明星的那点事,美妇约见老情人，见面场景真是太逗了，这俩人绝配！,https://toutiao.com/group/7428157095108674088/,,0,0,True
中国绝版老香烟，见过5种以上都是爷爷辈的，老烟民们抽过几种？,2024-08-20 08:54,724,126,万物知识局,万物知识局,文/万物知识局本文陈述所有内容皆有可靠信息来源，赘述在文章结尾在中国的历史长河中，烟草的传奇故事已历经四百载春秋。从明朝嘉靖年间葡萄牙使者带来的烟草，到如今琳琅满目的香烟品牌，烟草不仅见证了时代的变迁，也承载了无数人的记忆与情感。,https://toutiao.com/group/7405119584723927578/,,0,0,False
延长股市交易！周二起，增加30分钟！,2024-11-03 12:23,145,115,证券时报,证券时报,日本股市的交易时间，即将延长！自11月5日（周二）起，东京证券交易所的股票交易时间将延长30分钟，即从此前的5个小时延长到5.5个小时，这也是东京证券交易所自1954年以来，时隔70年再次延长交易时间。,http://mp.weixin.qq.com/s?__biz=MzAwODUyMjIzOQ==&mid=2651893821&idx=3&sn=18f0175d0b61f0293b50d8ce1a86cdc0&chksm=8113a1e51e3c1ab71374ebd74d7fc2a1cc6170800d35f4a7fda8dd289ddc496252937f85a4d1#rd,,0,0,False
山西五台山悬崖上的狐仙洞，发现住着2个千年狐仙，上去吓得腿软,2024-10-22 03:00,5823,597,山西凡凡,山西凡凡,,https://toutiao.com/group/7428429414959940106/,,0,0,True
"特朗普小算盘打得精，哈里斯善于赖账，这俩人谁是最大""黑天鹅""？",2024-11-02 14:35,9419,618,陈虎点兵,陈虎点兵,,https://toutiao.com/group/7432690528862339596/,,0,0,True
魏启颖：女儿赵薇被封杀后，丈夫也去世，儿子离婚被分一半财产,2024-08-12 15:57,786,234,九号探秘人,九号探秘人,女儿被封杀，儿子感情突发变故，曾经风光无限的赵家荡然无存。她喜欢音乐，想当音乐老师，父母也大力支持，从不会横加干涉。,https://toutiao.com/group/7402251567493333519/,,0,0,False
莫名其妙开了“先用后付”？“0元下单”先别急，这个问题要注意,2024-10-31 13:20,281,155,环球网,环球网,来源：中央广电总台中国之声 如今，多个电商平台都提供“先用后付”的支付模式，消费者网上购物时，无需付款即可下单，商品确认收货后再付款，并在一定还款周期内为消费者免息。“先用后付”看似增加了购物的便捷性，但不少消费者表示该功能开通容易关闭难。,https://3w.huanqiu.com/a/569e98/4K4G3CSLeTZ?agt=20,,0,0,False
农村公婆进城看孙子，儿媳不吵不闹一顿饭，公婆直接收拾走人,2024-10-27 09:43,1268,105,奋发有为暖阳sJ,奋发有为暖阳sJ,农村公婆进城看孙子，儿媳不吵不闹一顿饭，公婆直接收拾走人,https://toutiao.com/group/7430388837622219273/,,0,0,True
河南女子去世，山东丈夫将手机埋墓里，充1000元话费，每天打电话,2024-11-01 06:52,827,1134,何止电影,何止电影,2014年11月17日，河南肿瘤医院的病房中举行着一场特殊的婚礼，主角是于海宁跟他的患有癌症的妻子范会香。在几个月前范会香确诊癌症，跟男友提出分手，于海宁不远万里来到了女友的城市，照顾患癌女友。得知女友时日无多，在病房中跟女友求婚，在病房中举办了婚礼，婚后一年，范会香去世。,https://toutiao.com/group/7432199981609534004/,,0,0,False
