title,publish_time,like_count,comment_count,media_name,source,abstract,article_url,tag,is_yaowen,article_sub_type,has_video
具俊晔：我那早逝的亡妻，不仅给我留了2亿，还有每个月22万房贷,2025-03-08 23:15,392,121,真相探索者小福,真相探索者小福,这个戏剧性转折让娱乐版记者集体失眠，有人翻出三个月前具俊晔在《认识的哥哥》里的原话:“我爱的是她这个人，不是这些冰冷数字“，如今看来字字带刺。,https://toutiao.com/group/7479357121750958619/,,0,0,False
2025风口已经很明显了,2025-01-15 07:11,4616,721,王少涵,王少涵,,https://toutiao.com/group/7460036236393136694/,,0,0,False
有点炸裂！妇女们晒出公司发的节日礼物，网友：快给腮帮子笑裂了,2025-03-08 10:14,340,362,今日说说说13万点赞,今日说说说13万点赞,​今日说说说，分享当日“新鲜”事右上角点个关注大家一起“说说说”今天是3月8日妇女节，本来是指已婚妇女过的节日，但由于女人们都喜欢过节，于是它还有一些新的名字“女神节”“女王节”“富女节”等等。,https://toutiao.com/group/7479371062967304713/,,0,0,False
作品被下架，节目中两面三刀，这一次就算是尔冬升也“救”不了她,2025-03-07 20:50,316,134,八卦小Q,八卦小Q,在前段时间备受争议的《六姊妹》当中，很多人都沉浸在整个时代背景之下，但是也有人看到了不足。在剧中家中有六个姐妹，辣目洋子作为最小的一个出现，她的亮相却没想到竟遭到了大家的吐槽和抨击。,https://toutiao.com/group/7478740018186502710/,,0,0,False
一个独生子接母亲出院的过程被网友拍下，数百万人引发共鸣。,2025-02-23 02:38,34484,8447,响叮当,响叮当,,https://toutiao.com/group/7474438309831016987/,,0,0,True
这是张学良老婆赵四小姐真实样貌，并非演员饰演而是货真价实真品,2024-12-28 11:28,32686,2696,历史伟人,历史伟人,赵四小姐，原名赵一荻，她从十六岁开始她终生陪伴张学良，历经坎坷，赵一荻是富家大小姐，但是在张学良囚禁期间，她选择陪伴软禁中的张学良，后悔过吗?,https://toutiao.com/group/7453422736652698175/,,0,0,False
海南最适合养老的不是三亚，也不是万宁，而是这个不靠海的小城,2025-02-06 06:38,758,221,博学的豆浆lh,博学的豆浆lh,提到海南，大家首先会想到的就是三亚。那片海，温暖的阳光，清新的空气，让三亚成为了国内外游客向往的度假天堂。,https://toutiao.com/group/7468190157372506662/,,0,0,False
小伙子霸气，这种渣女就不能惯。这才是一个男人该有的样子。,2025-03-04 11:15,5817,4016,吗喽不易,吗喽不易,,https://toutiao.com/group/7477911445989196329/,,0,0,True
被记者围堵引怒赞的霍启刚，彻底颠覆了大众对豪门二代的固有认知,2025-03-07 06:09,3173,176,先锋谷影视娱评,先锋谷影视娱评,在两会的热闹舞台上，有一位 “神秘嘉宾”。本以为豪门二代的生活无非是豪车豪宅、纸醉金迷。可霍启刚却用一番话，彻底打破了大众对豪门的“刻板印象”。,https://toutiao.com/group/7478928771727360527/,,0,0,False
中俄为何要站在一起，李显龙一语道破，我们还会遇到美国霸权,2025-03-04 16:52,37362,1670,孙绪闻,孙绪闻,中俄为何要站在一起，李显龙一语道破，我们还会遇到美国霸权,https://toutiao.com/group/7477998067472482828/,,0,0,True
