title,publish_time,like_count,comment_count,media_name,source,abstract,article_url,tag,is_yaowen,article_sub_type,has_video
跳的像窜天猴似的课间操是神兽们的快乐源泉！,2025-02-26 03:32,20753,4754,聚宝盆,聚宝盆,,https://toutiao.com/group/7475565467503968768/,,0,0,True
央视曝光4种致癌日用品，越便宜致癌物越多，很多人还被蒙在鼓里,2025-02-17 05:35,9439,1182,39健康网,39健康网,,https://toutiao.com/group/7472257525203616319/,,0,0,True
乌克兰到底有没有稀土？泽连斯基利用特朗普贪婪，巧妙布下老千局,2025-02-24 08:00,21312,924,邱毅台湾,邱毅台湾,,https://toutiao.com/group/7474825033962930723/,,0,0,True
中国作协副主席评《哪吒2》：低俗艺术，污染神话！张艺谋被牵连,2025-02-27 13:08,549,881,小水往前飞,小水往前飞,当我们自己的文化作品正在走向世界巅峰时候，有人眼红了，还是我们自己的人。近日，中国作家协会副主席阎晶明发文谈《哪吒2》的观后感。,https://toutiao.com/group/7476070418471502388/,,0,0,False
中国斜爆震发动机突破，16马赫时速2万公里，一小时飞遍全球,2025-02-27 10:45,7511,842,杜文龙,杜文龙,,https://toutiao.com/group/7476048237850264103/,,0,0,True
33岁单身女护士公园邂逅58岁已婚教授，怀孕后对方两帆布口袋装400万了断，她再次索要600万被判三缓五,2025-02-27 02:49,6952,5662,大风新闻,大风新闻,她与他女儿年龄相仿，两人原本仅仅是同在一个城市生活而已，然而一天晚上公园散步的邂逅，却引发了后续的感情纠葛和一桩刑案。,https://toutiao.com/group/7475921711276261939/,,0,0,False
美俄会谈后，俄乌前线战事为何反而加剧？ #俄罗斯 #库尔斯克,2025-02-24 06:47,5033,137,李莉观察,李莉观察,,https://toutiao.com/group/7474873795396764179/,,0,0,True
央视官宣：歼-35将是全球最强舰载机！福建舰有望在年内服役？,2025-02-27 05:46,2909,267,军武次位面,军武次位面,2025年，关于中国航空母舰与舰载机的好消息纷至沓来。近日央视通过《小央视频》正式宣布歼-35A将成为全球最强舰载战斗机后，福建号航空母舰也在持续推进海试阶段，目前第七次海试已经在即，预计将在2025年内正式服役，届时将为中国海军的战斗力提升注入强劲动力。而歼-35的登舰，无疑是福建舰进阶“最强舰载打击力量”的关键一步。,https://toutiao.com/group/7475971196429959714/,,0,0,True
