title,publish_time,like_count,comment_count,media_name,source,abstract,article_url,tag,is_yaowen,article_sub_type,has_video
公公竟然和儿媳偷情，哪料被妻子撞见，这下有戏看了！,2025-01-21 08:05,7645,700,南瓜午夜厅,南瓜午夜厅,,https://toutiao.com/group/7462273852651979274/,,0,0,True
男人目睹了妻子的偷情，下一秒情夫和妻子就遭到了他的制裁！,2025-01-23 09:05,4516,382,橙子影视吖6,橙子影视吖6,,https://toutiao.com/group/7463034403476734527/,,0,0,True
媳妇玩到半夜才回来，以为老公不在家，进门这操作把老公看懵了,2025-01-24 09:38,3252,1055,滕菲,滕菲,,https://toutiao.com/group/7463414214191743497/,,0,0,True
宋小宝撞上闫学晶，俩唱二人转的真人精！笑点疯狂往外抖,2025-01-06 03:43,3733,524,PP影视圈剧院,PP影视圈剧院,,https://toutiao.com/group/7456641563670676018/,,0,0,True
老虎罕见捕猎镜头，比大片还震撼！……,2025-01-24 05:44,2904,696,你若不离不弃！我必生死相依！,你若不离不弃！我必生死相依！,,https://toutiao.com/group/7463353764549526016/,,0,0,True
