title,publish_time,like_count,comment_count,media_name,source,abstract,article_url,tag,is_yaowen,article_sub_type,has_video
壹视界·任仲平文章解读｜党的作风关系人心向背,2025-03-30 01:26,2699,1396,人民日报,人民日报,‍‍‍‌‍‍‌作风问题的核心是党同人民群众的关系问题。习近平总书记强调：“党的作风正，人民的心气顺，党和人民就能同甘共苦。”党的作风关系人心向背。执政党如果不注重作风建设，听任不正之风侵蚀党的肌体，就有失去民心、丧失政权的危险。一颗苹果，照鉴党的优良作风，映照为民造福的初心。,https://www.peopleapp.com/column/30048657611-500006172874?utm_source=tth&promote=true,,0,1,False
习言道丨这场高规格会见，习近平强调三个“最”,2025-03-29 02:26,992,114,中国新闻网,中国新闻网,题:这场高规格会见，习近平强调三个“最”中国国家主席习近平在此会见了40余位外资企业全球董事长、首席执行官和商协会代表。,http://ku.m.chinanews.com/wapapp/cns/gn/2025/03-29/10390932.shtml,,0,0,False
中国队成绩一落千丈，引发热议！昔日夺金项目竟失去参赛资格,2025-03-29 04:49,715,194,罗掌柜体育,罗掌柜体育,日前，有关中国花样滑冰队在世锦赛仅1人拿到奥运参赛资格的惨淡结果，引发网友关注。在美国举行的2025国际滑联花样滑冰世锦赛中，中国军团遭遇前所未有的打击。冰舞项目，任俊霏和邢珈宁以56.05分排名第31，无缘自由舞比赛。女单赛场，代表中国队出战的安香怡同样发挥欠佳，惨遭淘汰。,https://toutiao.com/group/7487088443898692136/,,0,0,False
内蒙重大越野事故：现场3死惨烈，事故原因曝光，目击者披露更多,2025-03-30 06:37,516,533,小水看人间,小水看人间,事发经过:3月24日下午，一辆改装过的福特猛禽越野车，载着四个越野爱好者，一脚油门冲上沙丘顶端，结果连人带车直接“飞”进500米深的沙坑。,https://toutiao.com/group/7487437183377359410/,,0,0,False
中美双方都已亮剑，周末发生了三件大事，李嘉诚究竟还在等什么？,2025-03-30 12:06,1569,594,观象知远,观象知远,3月29日是周六，但港澳办再次转发了大公报的文章，里面提到不能“揣着明白装糊涂，想要蒙混过关”，而且“希望能掂量出这一信息的分量，尽快停止交易，否则后果严重”。,https://toutiao.com/group/7487570791995916852/,,0,0,False
最新失联女学生后续！和男友同居，其已被警方带走，家属透露更多,2025-03-26 07:31,726,213,苍暮颜,苍暮颜,近期，青岛姑娘刘摩西失踪的事儿，闹得可是沸沸扬扬，真是见了鬼了，一个大活人怎么说消失就消失了，这事搁谁心里都不得劲儿。,https://toutiao.com/group/7486013488087712296/,,0,0,False
