title,publish_time,like_count,comment_count,media_name,source,abstract,article_url,tag,is_yaowen,article_sub_type,has_video
1米3袖珍美女嫁给1米48男孩，婚后丈夫奇迹长高，两人却不欢而散,2024-09-07 02:55,5238,291,睿之悦,睿之悦,杨萍和葛存苗的婚礼 文|睿之悦 编辑|睿之悦2019年，成都的民政局来了两个“10岁小孩”来登记，工作人员以为是玩闹。两个“小孩”拿出身份证让工作人员看，这才明白，原来是两个再也长不高的成年袖珍人情侣。,https://toutiao.com/group/7411713833267364386/,,0,0,False
成交2800亿，售出1195架飞机，中国拿下大单，足够造46艘055大驱,2024-11-18 10:32,4019,738,东方点兵,东方点兵,本届珠海航展成交金额再创新高，达到了2800亿，以这个价格来计算的话已经足够再造46艘055大驱，进一步彰显了中国制造实力的同时，也展示了中国军工的蓬勃发展。01 本届珠海航展卖出1195架飞机本届珠海航展3款五代机同款亮相，达成了历史性一幕的同时，也让这次航展的成交额再创新高。,https://toutiao.com/group/7438561690305839657/,,0,0,False
包厢全是刚出狱的恶霸，结果一看到饭店主厨，立马怂了,2024-11-11 01:21,6703,148,乐视群星访谈秀,乐视群星访谈秀,,https://toutiao.com/group/7435825833048015400/,,0,0,True
著名专家预言：试管婴儿寿命仅40年，那首例试管婴儿如今怎样了？,2024-09-01 06:05,10239,493,睿之悦,睿之悦,文|睿之悦编辑|睿之悦“试管婴儿活不到40岁？”1988年3月10日，我国首例试管婴儿顺利诞生。在当时，试管婴儿的技术正处于起步阶段，因此，有人将其视为医学的奇迹，但也有人则预言试管婴儿活不过40岁。那么，36年的时间过去了，我国首例试管婴儿如今怎么样了呢？,https://toutiao.com/group/7409105262277853733/,,0,0,False
【崔哥天天侃11/191】美国小伙看升旗，江苏老哥送军大衣,2024-11-19 01:22,9709,351,北美崔哥,北美崔哥,,https://toutiao.com/group/7438794691488776744/,,0,0,True
谁支持了特朗普上台？原来美国教会及中产，打败了政治邪恶力量！,2024-11-12 22:06,20003,944,黎建南台湾,黎建南台湾,,https://toutiao.com/group/7436517585706811930/,,0,0,True
67岁执意生娃，如今却坐轮椅无法自理，5岁的天赐被迫独立学洗衣,2024-11-04 10:32,4218,1045,睿之悦,睿之悦,2019年，已经67岁的田新菊执意生下了自己的第三个孩子小天赐。那么，现如今5年的时间过去了，这“天赐”的礼物到底是福还是祸呢?,https://toutiao.com/group/7433367394946384435/,,0,0,False
2024珠海航展：新军备 新亮点 新杀器 ｜军情观察室,2024-11-15 08:04,5436,273,凤凰卫视,凤凰卫视,,https://toutiao.com/group/7437413939794674185/,,0,0,True
拜登挑衅普京！美政权移交生变数！ 欢迎收看《谦言谦语》播出,2024-11-19 02:03,6145,109,赖岳谦官方,赖岳谦官方,,https://toutiao.com/group/7438805272979571236/,,0,0,True
破解特朗普加征关税，中国有7招,2024-11-15 14:05,26771,1742,静思有我,静思有我,,https://toutiao.com/group/7437506977830044200/,,0,0,True
拜登突然对俄下死手，批准乌克兰轰炸俄罗斯？特朗普儿子表态了,2024-11-19 06:06,4220,305,历史有点冷,历史有点冷,拜登突然对俄下死手，批准乌克兰轰炸俄罗斯？特朗普儿子表态了,https://toutiao.com/group/7438867958148891162/,,0,0,True
印度试射首枚高超音速导弹，戴着“歪帽”飞行，这到底是个啥？,2024-11-19 07:15,3407,629,杜文龙,杜文龙,,https://toutiao.com/group/7438885631647351336/,,0,0,True
母亲瘫痪、父亲疯了，当年那个744分的高考状元，7年后却成了这样,2024-09-08 00:54,9446,1502,八号探秘人,八号探秘人,母亲截肢瘫痪、父亲疯癫痴傻，可对于自己的亲人，他却做出了这样的评价。而今，7年已过，曾经那个让无数人动容的少年，现在如何?,https://toutiao.com/group/7411852147648496162/,,0,0,False
给近三年最好的10部年代剧排个名：《人世间》第6，第1名没有争议,2024-09-06 08:08,12615,3900,皮皮电影,皮皮电影,时尚是个轮回，电视剧也是。在2020年之前的那些年，电视剧市场基本上都被偶像剧、都市剧霸占。曾经撑起国剧品质的《闯关东》《岁月》这类年代好剧，难见踪影。,https://toutiao.com/group/7411390030722712090/,,0,0,False
"万万没想到,53岁“丁克”半辈子的康辉，一生遗憾竟然是一通电话",2024-08-21 22:14,29263,5519,峰哥正读,峰哥正读,在阅读此文之前，麻烦您点击一下“关注”，既方便您进行讨论和分享，又能给您带来不一样的参与感，感谢您的支持！文/编辑：蘑菇百善孝为先。但是到底怎么做才算是“孝”，康辉用了半辈子才明白。央视知名主持人康辉，事业顺遂，家庭幸福，在外人看来是一个人生赢家。,https://toutiao.com/group/7405504703687115273/,,0,0,False
十个化疗九个死？医生坦言：4种癌症无需化疗，或起到反作用…,2024-09-04 13:17,5414,509,39健康网,39健康网,李梅爸爸已经走了一个月了，可李梅还是不能原谅自己。李梅爸爸此前确诊了肺癌，医生的建议是接受化疗。临床上，很多病人拒绝化疗，认为化疗只会让癌症扩散，这是真的吗?,https://toutiao.com/group/7410743786244801039/,,0,0,False
人均600万到欠400亿，毁掉“天下第一村”的不是别人，是他们自己,2024-11-05 07:00,880,246,艾弥儿,艾弥儿,这曾是一个让城里人都羡慕的农村社区，全村人均存款曾高达600万元，人人都住大别墅，出门都是小轿车，放眼全国，没有一个村子能够比得上它。,https://toutiao.com/group/7433621435349877282/,,0,0,False
今天才知道！电动车“每天充”和“用完再充”，到底哪个更伤电池,2024-08-27 11:19,15827,2382,鲸探所,鲸探所,“今天到底给车充不充电？”估计大多数人每天回家都会想这个问题，看着自己的电动车电量又多又少的，充不充电也是一件非常难以抉择的事情。那么，电动车到底应该怎样充电呢？是每天都充，还是用完之后再充呢？电动车充电不管是在城市还是农村，电动车其实都是人们出门最常见的交通工具。,https://toutiao.com/group/7407773012533117475/,,0,0,False
康师傅新品上线被群嘲 网友炸了,2024-11-19 00:11,325,163,看看新闻,看看新闻,康师傅新品上线被群嘲 网友炸了,http://mediaplay.kksmg.com/2024/11/19/h264_720p_600k_77161-smgnews-20241119065500-9000-944490-600k_mp4.mp4,,0,0,True
风水：梁朝伟给富婆看风水，这服务必须到位，这段太精彩了,2024-11-19 01:57,2789,462,南瓜钟意你,南瓜钟意你,风水：梁朝伟给富婆看风水，这服务必须到位，这段太精彩了,https://toutiao.com/group/7438803799575102003/,,0,0,True
果然，特朗普开始发威了,2024-11-17 23:00,19905,2683,高志凯频道,高志凯频道,对于关键职位的最新提名，充分体现了对于特朗普来说，忠诚压倒一切。作为近年来权力最大的美国总统，特朗普的破坏力才刚刚开始,https://toutiao.com/group/7437717535526486555/,,0,0,True
阿里走了，陌陌走了，望京中产也在卖房离开,2024-11-19 09:10,508,282,36氪,36氪,近日，市场传闻在望京驻扎了10年的老住户陌陌科技也将从望京搬离。从今年8月份开始，陌陌在酒仙桥的新办公楼就已经开始装修，目前已经施工3个月，距离搬新家也不远了。,https://36kr.com/p/3043086140836488,,0,0,False
吕礼诗参观珠海航展，见中国强激动流下男儿泪，台独玻璃心又碎了,2024-11-16 04:45,33434,1341,邱毅台湾,邱毅台湾,,https://toutiao.com/group/7437733759829180969/,,0,0,True
德国总理朔尔茨和普京通电话，泽连斯基怒了，马斯克随即补上一刀,2024-11-18 06:10,21478,707,邱毅台湾,邱毅台湾,,https://toutiao.com/group/7438497761214857739/,,0,0,True
特朗普赢却难就职？拜登怕追责，佩洛西怕牢饭，三大集团蠢蠢欲动,2024-11-14 22:04,39751,1705,黎建南台湾,黎建南台湾,,https://toutiao.com/group/7437259350143402515/,,0,0,True
沦落到掏不出1.4万元？富婆赵薇传来最新消息，被申请强制执行，因30亿“蛇吞象”并购被监管层重罚，仍有400余起证券虚假陈述纠纷案件待处理,2024-11-19 06:59,5068,1539,金融界,金融界,金融界11月19日消息 在娱乐圈和A股名利场消息已久富婆赵薇传来最新消息，如今沦落到掏不出1.4万元?,http://m.jrj.com.cn/toutiao/2024/11/19/45442376.shtml,,0,0,False
