title,publish_time,like_count,comment_count,media_name,source,abstract,article_url,tag,is_yaowen,article_sub_type,has_video
董卿父亲董善祥：我这辈子最后悔的事，就是让宝贝女儿嫁给密春雷,2024-09-11 06:59,1480,158,稻述,稻述,提起央视主持，现在挑大梁的几乎就是撒贝宁、尼格买提、龙洋等人了，他们也都非常优秀，但常有人怀念起董卿还在的日子。,https://toutiao.com/group/7413267526601228852/,,0,0,False
火箭军向太平洋海域成功发射1发洲际弹道导弹,2024-09-25 02:03,22087,14750,新华社,新华社,新华社北京9月25日电 9月25日8时44分，中国人民解放军火箭军向太平洋相关公海海域，成功发射1发携载训练模拟弹头的洲际弹道导弹，准确落入预定海域。此次导弹发射，是火箭军年度军事训练例行性安排，有效检验武器装备性能和部队训练水平，达到了预期目的。中方提前向有关国家作了通报。,http://api.xinhua-news.com/newroute/newsdetail/101002024092470006109?dest=ALNtfVaYjPRzFanDTCE30lXEcrpMmexkEBAZEa466CGY,,0,0,False
伊朗总统美国行 积极拓展外交空间 释放哪些关键信息?吕宁思解析,2024-09-25 06:32,2404,480,凤凰卫视,凤凰卫视,,https://toutiao.com/group/7418464780265980442/,,0,0,True
正义正能量,2024-09-25 01:45,2010,194,清闲的海洋8,清闲的海洋8,,https://toutiao.com/group/7418390823366033930/,,0,0,True
为什么1984年阅兵无法被超越？看到这样的劈枪和脚步就知道了,2024-07-14 05:28,15009,1326,悠闲入口,悠闲入口,,https://toutiao.com/group/7391359236577428007/,,0,0,True
全球最富揭晓：美国首富造火箭，印度首富搞能源，中国首富在干嘛,2024-08-02 07:38,2986,4734,智史通鉴,智史通鉴,2024年4月3日，新一轮的福布斯排行榜出炉，法国奢侈品品牌LV的总裁荣登榜首。同时，马斯克也凭借第二的名次也又一次为了美国的首富。众所周知，马斯克的特斯拉公司最近几年发展势头极好，spaceX公司造火箭的工作也进行的如火如荼。,https://toutiao.com/group/7398431880397324839/,,0,0,False
4年骑行结束，1500天终于回到老家，感谢大家一路陪伴有缘江湖见,2024-09-07 03:50,70942,16740,刘伟元的旅行,刘伟元的旅行,4年骑行结束，1500天终于回到老家，感谢大家一路陪伴有缘江湖见！,https://toutiao.com/group/7411715839100977716/,,0,0,True
姑娘远嫁山东十年未回家，带着孩子偷偷回娘家，到家眼前一幕哭了,2024-09-09 08:25,22777,9855,小乔家里的事,小乔家里的事,,https://toutiao.com/group/7412556561718968870/,,0,0,True
2013年，湖南26岁女孩嫁给71岁老头，婚后还生下一子，如今怎样了,2024-07-12 11:59,23808,2325,智史通鉴,智史通鉴,2013年4月17日，长沙宁乡县的民政局迎来了一对特殊的夫妻。一个71岁的老头和一个26岁的女孩，离远了看，甚至像爷爷和孙女。面对工作人员异样的眼光，女孩说：“我和他是真心相爱的！”这让人好奇，这对相差45岁的夫妻，他们之间到底有着怎样的爱情故事？,https://toutiao.com/group/7390696631223534120/,,0,0,False
如今回头看恒大，许家印是赢了还是输了？！,2024-07-29 11:03,39732,22775,缤纷海燕YrEkWp,缤纷海燕YrEkWp,,https://toutiao.com/group/7397011739571421708/,,0,0,True
又出大瓜？73岁“风流妖精”刘晓庆，如今已经走上另一条道路,2024-09-21 05:32,1749,236,冯律讲法,冯律讲法,近日，四火姐姐在直播间中透露了一件事，即“身边有位老师，70多岁了，还在谈恋爱，有八个男朋友，所有人都认识她。”,https://toutiao.com/group/7416939451584102939/,,0,0,False
万万没想到，35岁杨颖兜兜转转干回“老本行”，活成内娱最大笑话,2024-09-20 08:32,226,116,忠于法纪,忠于法纪,杨颖曾经是内娱资本的宠儿，在和黄晓明结婚之后风头甚至一度力压内娱一众当红的85后小花。不过在和黄晓明离婚之后那是一步一个台阶地在走下坡路，如今更是被网友吐槽重回嫩模时期。,https://toutiao.com/group/7416637115372405258/,,0,0,False
"万万没想到,53岁“丁克”半辈子的康辉，一生遗憾竟然是一通电话",2024-08-21 22:14,22260,4612,峰哥正读,峰哥正读,在阅读此文之前，麻烦您点击一下“关注”，既方便您进行讨论和分享，又能给您带来不一样的参与感，感谢您的支持！文/编辑：蘑菇百善孝为先。但是到底怎么做才算是“孝”，康辉用了半辈子才明白。央视知名主持人康辉，事业顺遂，家庭幸福，在外人看来是一个人生赢家。,https://toutiao.com/group/7405504703687115273/,,0,0,False
曹德旺说：我不会逃跑，但要给政府提个醒 #曹德旺 #福耀科技大学,2024-06-28 06:51,25931,3506,正直鲸鱼LxhXfoC,正直鲸鱼LxhXfoC,,https://toutiao.com/group/7385443277144588834/,,0,0,True
终于抓到了！李娜在韩国被捕将引渡回中国：感谢FBI感谢韩国,2024-09-24 14:31,1368,213,秋水天长,秋水天长,跨国追捕大戏，李娜终落网！近日，一起备受关注的跨国犯罪案件有了新进展。据中国警方和韩国警方联合通报，涉嫌在中国境内实施绑架并导致受害者死亡的犯罪嫌疑人“李娜”，已在韩国首尔落网，并将被引渡回中国接受法律制裁。,https://toutiao.com/group/7418217083386774056/,,0,0,False
射程1.2万公里！时隔44年，中国向太平洋发射洲际导弹，有何用意,2024-09-25 05:50,1180,593,军武次位面,军武次位面,9月25日，根据中国国防部官方消息，解放军火箭军向太平洋发射了一枚洲际弹道导弹。此次试射中，导弹准确落入预定海域，极大彰显了中国在全球战略威慑能力上的进步。,https://toutiao.com/group/7418447391994692111/,,0,0,False
5座车拉6个人被判超员，车主1句话把交警问懵,2024-08-05 20:20,12945,3070,奇妙钢笔pA8JyP,奇妙钢笔pA8JyP,,https://toutiao.com/group/7399752843772559906/,,0,0,True
她是央视最惨主持人，男友被判死缓，丈夫诈骗入狱，47岁无人敢娶,2024-08-27 23:30,2128,207,闻书识焉,闻书识焉,她曾是央视的台柱子，和董卿、周涛并称为央视的三朵金花。回顾刘芳菲的前半生，最令人感到惋惜的，便是她的感情生活，47岁至今无人敢娶。,https://toutiao.com/group/7407743113688564258/,,0,0,False
中国🇨🇳人民的好总理,2024-09-03 15:46,178247,19533,话说,话说,这个老人一生只做一件事，那就是为了人民鞠躬尽瘁，死而后已,https://toutiao.com/group/7410443709928210955/,,0,0,True
上半年中美印新生人口：美国178万，印度1140万，中国让人意外,2024-09-23 12:16,1127,331,开心营业厅,开心营业厅,中美印是全球人口数量最多的三个国家，几乎占到了全球人口总数的近四成，不过，如今三个国家，却在生育率的问题上，遭遇了前所未有的挑战。,https://toutiao.com/group/7417736973647790628/,,0,0,False
演员张瑜：离婚后单身30年，再见前夫仍感到心动，66岁没有子女,2024-07-24 10:51,14327,1063,八号探秘人,八号探秘人,在阅读此文之前，辛苦您点击一下“关注”，既方便您进行讨论和分享，又能给您带来不一样的参与感，感谢您的支持！写作不易，作者每天辛苦写稿，只是为了养家糊口，希望各位观众老爷可以多多理解。文中加入5秒广告解锁，观看5秒后便可免费阅读全文啦，感谢各位观众老爷的理解与支持！,https://toutiao.com/group/7395130917804720640/,,0,0,False
“骗购”中国坦克，用完就退货，想求买中国无人机，中国只卖不租,2024-09-24 22:42,701,144,开心营业厅,开心营业厅,自古以来诚信都是一个很重要的东西，不管是国家交往还是做生意，没有人愿意和一个不守信的人打交道。然而2009年，秘鲁为了在阅兵仪式上展示军事实力，“骗购”中国坦克撑场面，用完以后却以技术问题为由退货。,https://toutiao.com/group/7418121417771762215/,,0,0,False
表面是艺人，实际是富家千金的5位女星，无人敢惹更别说潜规则了,2024-08-28 02:06,7019,542,八号探秘人,八号探秘人,在德云班主郭德纲的作品中，有过这么一句话。虽说此言尤为刺耳，但话糙理不糙。当今娱乐圈，很多女星为出人头地，自愿或被迫做出违反道德底线之事。,https://toutiao.com/group/7407984985224872459/,,0,0,False
母亲瘫痪、父亲疯了，当年那个744分的高考状元，7年后却成了这样,2024-09-08 00:54,2239,350,八号探秘人,八号探秘人,母亲截肢瘫痪、父亲疯癫痴傻，可对于自己的亲人，他却做出了这样的评价。而今，7年已过，曾经那个让无数人动容的少年，现在如何?,https://toutiao.com/group/7411852147648496162/,,0,0,False
无论炒什么肉，不要用盐和料酒腌制，大厨教我绝招，肉片滑嫩不腥,2024-07-11 08:24,78594,3212,家常的味道,家常的味道,无论炒什么肉，不要用盐和料酒腌制，大厨教我绝招，肉片滑嫩不腥,https://toutiao.com/group/7390291377185096204/,,0,0,True
为什么说从2025年开始，70岁以上的老人，可能面临“两大”问题？,2024-09-01 14:12,2180,276,水大叔,水大叔,据可靠数据了解，我国70岁以上的人口数量已经达到了2.5亿人次，占到全国总人口数量的18%。伴随着人口老龄化的出现，养老问题也成了重中之重，要知道养老不仅仅是家庭的责任，更是社会责任。,https://toutiao.com/group/7409677025897710106/,,0,0,False
张紫妍：被迫陪睡31人近百次，遭道具虐待，29岁自杀留230页遗书,2024-07-24 02:37,11966,815,八号探秘人,八号探秘人,在阅读此文之前，辛苦您点击一下“关注”，既方便您进行讨论和分享，又能给您带来不一样的参与感，感谢您的支持！本文叙述皆有官方信源，为了读者有更好体验，放在了文章后缀！,https://toutiao.com/group/7394994383675736576/,,0,0,False
秋葵的神仙吃法，比吃补药还补，做法简单，鲜香滑嫩又多汁，真香,2024-07-29 12:39,39083,3377,一画美食,一画美食,,https://toutiao.com/group/7397036492566856244/,,0,0,True
今天才知道！电动车“每天充”和“用完再充”，到底哪个更伤电池,2024-08-27 11:19,5885,1242,鲸探所,鲸探所,“今天到底给车充不充电？”估计大多数人每天回家都会想这个问题，看着自己的电动车电量又多又少的，充不充电也是一件非常难以抉择的事情。那么，电动车到底应该怎样充电呢？是每天都充，还是用完之后再充呢？电动车充电不管是在城市还是农村，电动车其实都是人们出门最常见的交通工具。,https://toutiao.com/group/7407773012533117475/,,0,0,False
民间上坟传统：“上坟不带 5 果，家中不惹灾祸”，哪“5果”？,2024-08-08 10:30,8955,1114,惠农圈,惠农圈,在中国传统文化中，祭祀祖先一直是一项备受重视的活动，它承载着对先人的缅怀、敬意和感恩之情。在上坟的时候，人们会提前准备好供品，比如肉类、酒水，还有水果。其中关于水果的准备，也有着诸多的讲究和禁忌，比如“上坟不带 5 果，家中不惹灾祸”的说法。,https://toutiao.com/group/7400584207141192207/,,0,0,False
没有人敢信他是个男的，直到他说话了，绝了,2024-08-20 05:20,4141,225,经视看天下,经视看天下,,https://toutiao.com/group/7405087362341470774/,,0,0,True
全球约一半肝癌在中国，再次提醒：家中的4种食物，尽早撤下餐桌,2024-08-13 08:36,92633,3492,梁医学社梁怡璋医生,梁医学社梁怡璋医生,,https://toutiao.com/group/7402540119712629311/,,0,0,True
写歌30年穷困潦倒，前妻失望选择离婚，谁料51岁靠一首歌一夜成名,2024-08-12 03:37,22631,3582,八号探秘人,八号探秘人,在阅读此文之前，辛苦您点击一下“关注”，既方便您进行讨论和分享，又能给您带来不一样的参与感，感谢您的支持！编辑：LY无数人都想要一个一夜成名的机会，但机会来了也不是每个人都能把握住的。他用了三十年的时间来准备迎接属于自己的机会。为了这个机会他放弃了一切，甚至包括家庭。,https://toutiao.com/group/7402090890367484428/,,0,0,False
中国空军副司令员透露：我新型战机将公开露面！,2024-09-25 07:11,825,386,看看新闻,看看新闻,9月25日上午，第十五届中国国际航空航天博览会新闻发布会在北京召开。中国空军副司令员俞庆江介绍本届航展空军参展亮点。俞庆江介绍，此次武器装备展示，在往届航展基础上，继续增加空地装备展示数量和飞行展示课目。,https://m.kankanews.com/detail/1W2v51aW8wA?utm_source=jinritoutiao,,0,0,False
