title,publish_time,like_count,comment_count,media_name,source,abstract,article_url,tag,is_yaowen,article_sub_type,has_video
人民日报评论员：深入领会对经济工作的规律性认识,2024-12-15 23:08,493,262,人民日报,人民日报,在日前举行的中央经济工作会议上，习近平总书记总结提炼我们党对经济工作的规律性认识，指出必须统筹好有效市场和有为政府、总供给和总需求、培育新动能和更新旧动能、做优增量和盘活存量、提升质量和做大总量这五对重要关系，为以高质量发展全面推进中国式现代化提供了科学指引。,https://www.peopleapp.com/column/30047711427-500005994668?utm_source=头条号&promote=true,,0,0,False
51年洪学智妻子寻女无果，到老乡家歇脚老乡惊呼：你要找得就是我,2024-09-22 01:07,16886,1042,品古观今,品古观今,前言1951年，阳曲县委大院突然来了7、8位解放军同志，其中一位女同志，就是洪学智的妻子张文。她此番前来，就是为了寻找多年前因战乱而寄养于民间的爱女。可昔日的小村落早已蜕变成另一番景象，这无异于是大海捞针。,https://toutiao.com/group/7417034363226915354/,,0,0,False
这绝对是我吃过最好吃的蒜蓉蒸鸡做法,2024-11-11 12:49,3641,298,天天相见厨房(阿见),天天相见厨房(阿见),,https://toutiao.com/group/7436003114588570123/,,0,0,True
姑娘在山洞换衣服，小伙看周围没人，直接霸王硬上弓！,2024-12-05 05:33,1019,218,南瓜午夜厅,南瓜午夜厅,,https://toutiao.com/group/7444796602683752971/,,0,0,True
明确了！2025年养老金实现双增长，三类人可以多涨，两类人不涨,2024-12-15 05:23,1003,271,社保当家,社保当家,明确了！2025年养老金实现双增长，三类人可以多涨，两类人不涨在2025年到来之前，关于养老金上涨的消息就已经明确，中央经济工作会议给退休人员送上了一个大大的惊喜。2025年，养老金将继续实现双增长，不过有三类人可以多涨，两类人不涨，一起来看看。,https://toutiao.com/group/7448496604800762394/,,0,0,False
弟弟光荣退伍，姐姐兴奋去车站接他，怎料一见弟弟瞬间哭了,2024-11-05 06:34,35477,3097,乐视天天剧好看,乐视天天剧好看,,https://toutiao.com/group/7433679820573934091/,,0,0,True
67岁执意生娃，如今却坐轮椅无法自理，5岁的天赐被迫独立学洗衣,2024-11-04 10:32,9116,2080,睿之悦,睿之悦,2019年，已经67岁的田新菊执意生下了自己的第三个孩子小天赐。那么，现如今5年的时间过去了，这“天赐”的礼物到底是福还是祸呢?,https://toutiao.com/group/7433367394946384435/,,0,0,False
抖音公告！集体下架！,2024-12-11 14:26,1166,646,津云,津云,据“抖音安全中心”微信公众号消息，抖音致力于打造积极、开放、友善的社区环境，持续推进微短剧内容治理，并定期发布治理公告，鼓励和推广优质微短剧，持续对含有不良价值观导向、违反公序良俗、低俗“擦边”等违规内容的微短剧，以及相关违规账号进行治理。11月，平台累计下架违规微短剧209部。,https://toutiao.com/group/7447160291265217051/,,0,0,False
韩国又创造了历史,2024-12-09 23:25,11198,2980,牛弹琴,牛弹琴,不得不说，韩国又创造了历史。12月9日，韩国高级公职人员犯罪调查处方面表示，禁止总统尹锡悦出境。什么意思？堂堂一国总统，居然不能出国了。出国访问就不用说了，哪怕有重大国际会议，尹锡悦总统，你也不能出去。为什么？怕他跑了。真是让人哭笑不得。这还没有完。,https://toutiao.com/group/7446553692741894710/,,0,0,False
3年前，宁夏7岁小女孩一笑走红，后拒百万签约，如今怎么样了？他们后悔了吗？,2024-09-19 07:25,15740,2088,睿之悦,睿之悦,2021年，视频镜头中出现的女孩儿用那一抹甜美的笑容，迅速引起了网友们的广泛关注。有媒体公司看到这一机遇，提出愿意用百万巨资与女孩儿签约，然而，女孩儿的父母却坚决拒绝了这一提议。,https://toutiao.com/group/7416250139544879679/,,0,0,False
知名网红品牌起诉“打假人”王海，一审判了：王海道歉赔钱，双方删视频！法院：王海未经官方检查认定，擅自在网上对相关产品进行评价……,2024-12-15 09:53,352,609,每日经济新闻,每日经济新闻,"每经记者：吴泽鹏 每经编辑：段炼,杨夏12月14日晚间，网红品牌“彩虹星球”在其微信公众号“彩虹星球合作社”发布文章，称收到西安市雁塔区人民法院的一审民事判决书【（2023）陕0113民初23588号】。",http://www.nbd.com.cn/rss/jinri_toutiao/articles/3686475.html,,0,0,False
个人养老金制度推行将带来哪些影响？一文解读,2024-12-13 03:32,1742,746,国际在线,国际在线,,https://crionline-media.cri.cn/cb5a6d96-d0c4-4fd0-a895-b6135667d84a/video/40d1574ab9094c2c91da2c53e8db16ca.mp4,,0,0,True
冬季自驾游，零下四十度睡车里，半夜冻醒了，车里全部冻住了！,2024-12-13 11:02,10772,2285,旅行者小多,旅行者小多,,https://toutiao.com/group/7447850219347116544/,,0,0,True
帅哥看不上相亲女，撒谎没车没房没户口，姑娘的反应绝了,2024-11-18 05:47,3193,338,乐视天天剧好看,乐视天天剧好看,,https://toutiao.com/group/7438491946131128872/,,0,0,True
美妇约见老情人，见面场景真是太逗了，这俩人绝配！,2024-10-27 16:25,4941,621,乐视明星的那点事,乐视明星的那点事,美妇约见老情人，见面场景真是太逗了，这俩人绝配！,https://toutiao.com/group/7428157095108674088/,,0,0,True
炸肉丸子，到底用淀粉还是面粉，教你一招，外酥里软超好吃,2024-10-01 09:23,6570,502,家常的味道,家常的味道,,https://toutiao.com/group/7420735473208787492/,,0,0,True
河北邢台一村民家中柴火灶被燃气公司贴封条？回应：存在安全隐患,2024-12-15 07:05,1502,4150,环球时报,环球时报,12月15日，有网友发布视频称，在河北邢台市新河县，一村民家中的柴火灶被燃气公司贴上了封条，引发关注。12月15日，涉事的新河县中裕燃气有限公司工作人员回应称，因为该用户家中同一个房间内存在燃气灶和柴火灶，存在安全隐患，故贴上封条要求用户整改，做法符合行业规范。,https://toutiao.com/group/7448512221732241956/,,0,0,False
香港九龙寨城老照片：曾是香港最邪恶肮脏之地，图9场景令人作呕,2024-11-21 11:32,2429,445,万物知识局,万物知识局,有这么一个地方，他虽然地处极度繁华的都市香港，但是却脏乱不堪，环境极度的恶劣，各种违法的交易都在这里进行，甚至黄赌毒，也在这里悄然滋生，这就是九龙城寨。,https://toutiao.com/group/7439657140518519296/,,0,0,False
富二代当兵却逃跑回家，班长去他家抓人，一进家门瞬间惊了,2024-10-26 02:59,13418,1128,乐视天天剧好看,乐视天天剧好看,,https://toutiao.com/group/7429913203359875636/,,0,0,True
“万人迷”陈好：30岁嫁给二婚刘海峰，婚后连生3胎如今幸福不己,2024-11-06 02:52,1366,190,八号探秘人,八号探秘人,在阅读此文之前，辛苦您点击一下“关注”，既方便您进行讨论和分享，又能给您带来不一样的参与感，感谢您的支持！编辑丨brt她因出演《粉红女郎》一炮而红，被人们称为“万人迷”。谁也没想到，事业正处在巅峰期的她却嫁给了一个二婚男人，还生了三个孩子。,https://toutiao.com/group/7433959360264454691/,,0,0,False
《我是刑警》中的穿帮镜头，一个比一个搞笑，看看你都发现了哪些,2024-12-13 10:25,549,393,与君説,与君説,在阅读此文之前，麻烦您点击一下“关注”，既方便您进行讨论和分享，又能给您带来不一样的参与感，感谢您的支持文、编辑|小娄2024年年末的这几部剧里，若说口碑与热度兼备的，恐怕就只有于和伟主演的《我是刑警》了。,https://toutiao.com/group/7447837089364558336/,,0,0,False
河南警察3岁女儿被拐，苦寻全国23年无果，结果却发现女儿在对门,2024-11-05 07:43,4267,478,八号探秘人,八号探秘人,寻亲23年无果，丢失的女儿竟住在对门?但它却真实发生在河南洛阳的梁绍波身上。是意外走丢，还是人贩子所为，三岁的女儿怎会离奇失踪?,https://toutiao.com/group/7433697108120142345/,,0,0,False
15年保安徒手接跳楼女孩，女孩母亲：我女儿若有事，你一辈子负责,2024-10-07 09:28,666,272,睿之悦,睿之悦,文|睿之悦编辑|睿之悦“我的女儿要是有什么事情的话，你要负一辈子的责任！”2015年，一名保安在得知有人跳楼的时候，不顾自身的安危，徒手将跳楼的女孩给救了下来。可令人感到的心寒的是，被救女孩的家属不仅没有感谢这名保安，反而还对他恶语相向。那么，这究竟是怎么一回事呢？,https://toutiao.com/group/7422961323312431656/,,0,0,False
