title,publish_time,like_count,comment_count,media_name,source,abstract,article_url,tag,is_yaowen,article_sub_type,has_video
一习话·温暖聆听丨“中国”铭刻在每个华夏儿女心中,2025-01-01 10:58,473,218,央广网,央广网,“‘中国’二字镌刻在‘何尊’底部，更铭刻在每个华夏儿女心中。”新年前夕，习近平主席在二〇二五年新年贺词中这样深刻阐释中华文明的力量。,https://www.cnr.cn/newscenter/local/dftj/20250101/t20250101_527028163.shtml,,0,0,False
多国面临成本压力，媒体分析谁是输家，欧洲告别“俄罗斯天然气时代”,2025-01-01 22:38,784,1447,环球网,环球网,据俄罗斯塔斯社1月1日报道，俄罗斯天然气工业股份公司当天发表声明称，因与乌克兰方面签署的有关俄天然气经乌输送协议到期，自莫斯科时间1日早8时起终止过境乌向欧洲输送天然气。,https://3w.huanqiu.com/a/de583b/4KtyKYVHPYD?agt=20,,0,0,False
从美国的经验来看，中国未来房价的结局,2024-12-18 11:18,8465,2003,资本论,资本论,你如果在两年前问我，房价会不会继续跌，我大概率会告诉你还会继续跌。现在聊到中国房价未来走势的时候，很多人都会提到两个案例，一个是日本案例，另一个则是美国案例。,https://toutiao.com/group/7449709577114894886/,,0,0,False
火了！梅花5角谁还有，现在值多少了,2024-12-30 15:02,543,171,小董谈话,小董谈话,火了！梅花5角谁还有，现在值多少了,https://toutiao.com/group/7454220451733045775/,,0,0,True
这是张学良老婆赵四小姐真实样貌，并非演员饰演而是货真价实真品,2024-12-28 11:28,7447,1207,历史伟人,历史伟人,赵四小姐，原名赵一荻，她从十六岁开始她终生陪伴张学良，历经坎坷，赵一荻是富家大小姐，但是在张学良囚禁期间，她选择陪伴软禁中的张学良，后悔过吗?,https://toutiao.com/group/7453422736652698175/,,0,0,False
为什么美国突然刮起反印度的风潮？咖喱三哥得罪谁了？,2025-01-02 03:27,13619,1831,我就是心净,我就是心净,,https://toutiao.com/group/7455154658563064357/,,0,0,True
真小人，拜登,2025-01-01 23:00,12330,2031,高志凯频道,高志凯频道,违背诺言，赦免自己有罪的儿子；搞冷战，给世界留下一堆的战争；为私利，给特朗普挖下无数的坑... 我们如何评价拜登的政治遗产呢？,https://toutiao.com/group/7454839921505731124/,,0,0,True
“六星街里还传来巴扬琴声吗……”狼戈、张英席合唱《苹果香》,2024-12-31 14:55,2567,366,央视频,央视频,,https://toutiao.com/group/7454589818538820115/,,0,0,True
厨师长教你：“葱爆羊肉”羊肉滑嫩、鲜香不膻,2024-12-27 07:34,3010,553,美食作家王刚,美食作家王刚,厨师长教你：“葱爆羊肉”羊肉滑嫩、鲜香不膻,https://toutiao.com/group/7452991735665263139/,,0,0,True
俄媒：中国这架奇怪飞机与“第六代战机”无关！它根本不是战斗机,2024-12-28 07:19,10465,5526,高峰军事观察,高峰军事观察,世界军事网站被铺天盖地的“银杏叶”战机消息霸屏了，仅凭几条视频和视频截图，网络上对“中国六代机”的讨论已经热火朝天。问题是，这种先入为主给“银杏叶”飞机冠名“六代机”很可能会伤了某些传统军事航空装备大国的自尊。要知道，数十年来西方在军事航空装备技术领域一直是遥遥领先的。,https://toutiao.com/group/7453345649979851264/,,0,0,False
2025 俄乌战争会结束，美将全力对付中国？ 举国体制成就时代之力,2025-01-01 22:01,15652,797,黎建南台湾,黎建南台湾,,https://toutiao.com/group/7455070492601352731/,,0,0,True
中央大老虎逃跑，海陆空三军出动，中央下令必拿下,2024-11-19 03:17,33566,665,乐视视频秀,乐视视频秀,中央大老虎逃跑，海陆空三军出动，中央下令必拿下,https://toutiao.com/group/7438824299877630479/,,0,0,True
经典高清战争老电影,2024-11-18 05:05,11564,335,小微娱乐创作,小微娱乐创作,,https://toutiao.com/group/7438481167495463424/,,0,0,True
广西49岁老汉娶19岁姑娘，结婚21年生下15个孩子，如今有何下场？,2024-10-20 08:32,10173,1245,艺述史,艺述史,她19岁出嫁，21年里总共生育了15个孩子，其中4个男孩子11个女孩子，家里热闹的像是开了一所学校一样。,https://toutiao.com/group/7427400319418384948/,,0,0,False
弟弟光荣退伍，姐姐兴奋去车站接他，怎料一见弟弟瞬间哭了,2024-11-05 06:34,44016,3449,乐视天天剧好看,乐视天天剧好看,,https://toutiao.com/group/7433679820573934091/,,0,0,True
被央媒怒批，目不识丁，丢人现眼，这几位“文盲”明星凭什么走红,2024-12-30 10:52,4110,1073,与君説,与君説,在阅读此文之前，麻烦您点击一下“关注”，既方便您进行讨论和分享，又能给您带来不一样的参与感，感谢您的支持文、编辑|小娄郭德纲曾说“可以没文凭，但不能没文化”。老郭的这句话在儿子郭麒麟身上体现得淋漓尽致。虽然郭麒麟初中就辍学了，但人家有思想有内涵，是个名副其实的“文化人”。,https://toutiao.com/group/7454151513221661234/,,0,0,False
中日，一出好戏即将上演,2025-01-01 23:38,2893,3125,牛弹琴,牛弹琴,年终上演精彩大戏，新年不排除更有一出好戏。反正，从积极的角度看，中日关系，正处于近20年来最好时期。之所以能说最好，是因为之前实在是太糟。三个值得关注的动向。第一个动向，日本首相石破茂的表态。日前在接受电视访谈时，石破茂说：“日本首相访问中国是极为重要的事。,https://toutiao.com/group/7455091815717388850/,,0,0,False
我国楼市大局已定，未来全国45%的家庭，或将面临“5大挑战”,2024-12-15 11:45,701,104,苍暮颜,苍暮颜,前言:21世纪开始，中国房地产市场一路高歌猛进，繁荣的景象更是吸引了无数投资者和购房者，房价也是一路攀升，也成为了房地产经济增长的重要引擎。,https://toutiao.com/group/7448599203455975947/,,0,0,False
俄罗斯重大宣布：断供！,2025-01-01 20:47,1671,670,第一财经,第一财经,据新华社，俄罗斯天然气工业股份公司1月1日发表声明说，因过境协议到期，自莫斯科时间1月1日早8时起终止过境乌克兰向欧洲输送天然气。同日，乌克兰能源部在社交媒体“电报”发文说，基辅时间1月1日早7时，出于国家安全利益考虑，乌克兰停止了俄罗斯天然气过境输送服务。,http://mp.weixin.qq.com/s?__biz=MTU1OTI4NDM4MQ==&mid=2652266081&idx=2&sn=bdec4c572617c3415b633457e3d4bd9a,,0,0,False
独家｜部分中国航司航班绕开俄罗斯南部空域,2025-01-02 07:28,1435,435,财新网,财新网,文｜财新 邹晓桐 路尘中国航司往返西欧、北欧的航线目前仍照常穿越俄罗斯中北部地区资料图：中国国航飞机。图：视觉中国【财新网】部分中国航司航班已开始绕开俄罗斯南部空域，该空域正是2024年12月25日阿塞拜疆航空J28243航班疑似被俄罗斯防空部队击落的地区。,https://toutiao.com/group/7455213905250484772/,,0,0,False
二少爷装疯卖傻，少奶奶派出丫鬟前去试探他，有好戏看了,2024-11-23 23:28,5066,887,乐享综艺剧场,乐享综艺剧场,,https://toutiao.com/group/7439971404629410342/,,0,0,True
宋美龄106岁去世，贴身厨子回家后不久自尽，事后妻子透露出缘由,2024-10-28 09:22,15838,566,历史与江湖,历史与江湖,2003年10月，106岁的宋美龄在美国纽约去世，这位世纪老人虽然永远地闭上了双眼，但是却留下了一个长寿神话。,https://toutiao.com/group/7430753866158817855/,,0,0,False
六代机双飞、四川舰三个第一，神雕无人预警机，中国军工震惊美国,2024-12-30 06:02,44773,2288,邱毅台湾,邱毅台湾,,https://toutiao.com/group/7454081205471085107/,,0,0,True
炖鸡肉不要焯水和直接下锅，教你一招，鸡肉鲜香滑嫩不腥不柴,2024-12-15 08:45,7272,360,家常的味道,家常的味道,炖鸡肉千万不要焯水和直接下锅，教你秒招，鸡肉鲜香滑嫩不腥不柴,https://toutiao.com/group/7448556944597451275/,,0,0,True
天安门广场2025年元旦升国旗仪式 完整版视频来了,2025-01-01 00:04,13281,933,小央视频,小央视频,,https://toutiao.com/group/7454731275513889321/,,0,0,True
好消息！元旦后，四川将上调城乡居民养老金，从2024年7月补发,2025-01-02 00:13,318,203,社保解读,社保解读,根据四川省人力资源和社会保障厅 四川省财政厅发布的《关于2024年提高城乡居民基本养老保险基础养老金最低标准的通知》，四川省将在元旦后开始上调全省城乡居民基础养老金最低标准，并从2024年7月份起补发上涨金额。,https://toutiao.com/group/7454575735815094784/,,0,0,False
村妇带女儿进城找丈夫，不料撞见他和富家女在结婚，这下好看了,2024-10-15 16:05,2387,345,乐视最爱综艺说,乐视最爱综艺说,村妇带女儿进城找丈夫，不料撞见他和富家女在结婚，这下好看了,https://toutiao.com/group/7425843988181025314/,,0,0,True
河南警察3岁女儿被拐，苦寻全国23年无果，结果却发现女儿在对门,2024-11-05 07:43,6103,636,八号探秘人,八号探秘人,寻亲23年无果，丢失的女儿竟住在对门?但它却真实发生在河南洛阳的梁绍波身上。是意外走丢，还是人贩子所为，三岁的女儿怎会离奇失踪?,https://toutiao.com/group/7433697108120142345/,,0,0,False
孙颖莎钱天一“擦边球争议”，孙颖莎原音曝光，诚恳请裁判看回放,2025-01-01 10:38,1059,651,旺旺小仙,旺旺小仙,,https://toutiao.com/group/7454894606304412195/,,0,0,True
妻子深夜加班，丈夫感觉不对劲偷偷跟踪，看到真相瞬间崩溃,2024-10-28 06:59,22415,442,乐视金曲大荟萃,乐视金曲大荟萃,妻子深夜加班，丈夫感觉不对劲偷偷跟踪，看到真相瞬间崩溃,https://toutiao.com/group/7430717509566726656/,,0,0,True
春晚小品：冯巩见老友，为了面子雇人装媳妇，怎料媳妇来多了,2025-01-01 05:18,1683,316,相声小品社,相声小品社,,https://toutiao.com/group/7454812129913209378/,,0,0,True
厨师长教你葱爆肉的做法，步骤详细，葱香浓郁肉片滑嫩下酒又下饭,2024-12-17 08:43,3437,221,阿彬纪实,阿彬纪实,,https://toutiao.com/group/7449298669800522274/,,0,0,True
