title,publish_time,like_count,comment_count,media_name,source,abstract,article_url,tag,is_yaowen,article_sub_type,has_video
淘汰王楚钦！丹麦选手林德庆祝：我赢了世界第一！在他的主场！,2024-10-01 15:48,1207,2694,直播吧,直播吧,直播吧10月01日讯 WTT中国大满贯2024男单1/16决赛，王楚钦1-3爆冷不敌丹麦选手林德。赛后，赛事方晒出了林德录制的庆祝视频。林德在视频中说：“我刚刚击败了世界第一，在他的主场中国，这真是我一生中最重要的时刻。感谢所有支持我的人，我会继续战斗希望赢得更多比赛。,https://news.zhibo8.com/other/2024-10-01/66fc17b8f1f2fnative.htm,,0,0,False
细看国庆招待会，拜请注意两个细节,2024-10-01 12:39,17286,1311,司马南,司马南,"今天国庆
我专门做了一期节目
《百年前的中国梦》。

当民族命运跌入谷底深渊的时候，
国人对未来的向往，
连细节都那么逼真，
读着前辈的文章
泪水不觉溢满了眼眶，
哽咽得说不出话来。
我不得不停止录制，
让自己的心情稍微平复一下。
#伟大的祖国繁荣昌盛# #祖国成立75周年#",https://toutiao.com/group/7420785879449109055/,,0,0,True
东风41恐惧症在欧美蔓延：外媒坚定认为，先进导弹绝非东风31AG,2024-10-01 14:26,2912,777,南友汇,南友汇,日前以英国《金融时报》，美国《华盛顿时报》为首的欧美国家媒体撰文称，解放军本次试射的洲际导弹绝非是东风31AG，而是解放军现役更先进的东风41洲际导弹。,https://toutiao.com/group/7420812639297520163/,,0,0,False
10月2日上午，天安门毛主席纪念堂竟然发生如此感人场面，哭了,2024-10-02 01:25,2735,158,好邻居李亮,好邻居李亮,,https://toutiao.com/group/7420983448451580450/,,0,0,True
文章：出轨是我的错，今生最对不起三个女人，与马伊琍仍然是家人,2024-07-14 11:00,1548,191,八号探秘人,八号探秘人,本文叙述皆有官方信源，为了读者有更好体验，放在了文章后缀!“这个世界上没人比我更爱马伊琍。”如今再看这句话，只觉得好笑又嘲讽。,https://toutiao.com/group/7391289394180850212/,,0,0,False
伊朗200枚导弹夜袭以色列，下一步有何最新行动？凤凰记者连线,2024-10-02 01:59,3818,447,凤凰卫视,凤凰卫视,,https://toutiao.com/group/7420992156107538979/,,0,0,True
国乒5朵金花的家庭：王艺迪体二代，陈梦富二代，王曼昱父亲泪目,2024-08-04 02:03,2242,133,不似少溓游,不似少溓游,想要在国内靠乒乓球打出名堂，仅仅有天赋是完全不够的。因为在中国乒坛，万里挑一的天才遍地都是。以至于有不少人都选择放弃，甚至还有田志希这样为了能打乒乓球而选择归化韩国的球手。,https://toutiao.com/group/7398094722457289266/,,0,0,False
开国上将家中去世，死后无一人吊唁，儿子：没想到死后却进了医院,2024-08-08 09:29,18505,118,品古观今,品古观今,1980年7月25日，与许世友并称“山东双雄”的开国上将王建安告别了他波澜壮阔的一生，在家中悄然去世。,https://toutiao.com/group/7400697093196628480/,,0,0,False
上半年中美印新生人口：美国178万，印度1140万，中国让人意外,2024-09-25 23:00,632,298,赫薰辞,赫薰辞,据今年上半年世界人口统计，美国新生人口为178万，印度更是达到了1140万，相比之下，我国的新生人口的数据却令人意想不到。,https://toutiao.com/group/7418390293643084329/,,0,0,False
男子与女子在河中嬉戏玩耍，突然连续将女子的头按入水中,2024-09-26 04:40,1047,155,经视看天下,经视看天下,,https://toutiao.com/group/7418807108637819444/,,0,0,True
网红郭有才，泡沫散去之后，曾经飘的有多高，如今摔得就有多惨,2024-09-30 09:36,670,428,八号探秘人,八号探秘人,曾经那个卖烧烤的店小二，可能怎么都想不到，自己会成为一个千万粉丝的网红。郭有才在刚成为网红之后的期望也很有意思，那就是每天能赚到300元就行。可现实却是靠着直播广告分成，他的收入直接比期望值翻了上千倍。有人说他其貌不扬，但是平凡人逆袭的典范，还有的人说他长的像日本人。,https://toutiao.com/group/7419978325617082932/,,0,0,False
农民为什么领不到退休钱，专家终于给出了答案，一起了解一下,2024-07-11 07:42,9507,763,石安爱聊生活,石安爱聊生活,,https://toutiao.com/group/7390280393888367156/,,0,0,True
原来他才是毁掉刘翔真凶，因贪1200万被公审，让刘翔背负多年骂名,2024-08-29 09:58,7146,174,八号探秘人,八号探秘人,在田径场上创造的成绩，至今无人能够打破，甚至在国际上享有盛名。本该继续夺冠之路，却两次因伤退赛，遭到了全网辱骂。,https://toutiao.com/group/7408489498465616410/,,0,0,False
毁了王治郅，逼姚明退役，他凭一己之力让中国篮球倒退了二十年!,2024-08-07 19:45,1046,391,吃瓜崽崽,吃瓜崽崽,在阅读此文之前，辛苦您点击一下“关注”，既方便您进行讨论和分享，又能给您带来不一样的参与感，感谢您的支持！本文叙述皆有官方信源，为了给读者更好体验，放在了文章后缀！文 锦青一个人有可能影响中国的篮球事业发展吗？真的可能，至少信兰成做到了。,https://toutiao.com/group/7400359671892148788/,,0,0,False
陈佩斯 冯巩同台说相声！堪称卧龙与凤雏的经典对决，笑点咔咔整,2024-08-29 11:07,11162,1469,欢乐小品匠,欢乐小品匠,陈佩斯 冯巩同台说相声！堪称卧龙与凤雏的经典对决，笑点咔咔整,https://toutiao.com/group/7408516437741928960/,,0,0,True
她是央视最惨主持人，男友被判死缓，丈夫诈骗入狱，47岁无人敢娶,2024-08-27 23:30,2172,207,闻书识焉,闻书识焉,她曾是央视的台柱子，和董卿、周涛并称为央视的三朵金花。回顾刘芳菲的前半生，最令人感到惋惜的，便是她的感情生活，47岁至今无人敢娶。,https://toutiao.com/group/7407743113688564258/,,0,0,False
2013年，湖南26岁女孩嫁给71岁老头，婚后还生下一子，如今怎样了,2024-07-12 11:59,25813,2390,智史通鉴,智史通鉴,2013年4月17日，长沙宁乡县的民政局迎来了一对特殊的夫妻。一个71岁的老头和一个26岁的女孩，离远了看，甚至像爷爷和孙女。面对工作人员异样的眼光，女孩说：“我和他是真心相爱的！”这让人好奇，这对相差45岁的夫妻，他们之间到底有着怎样的爱情故事？,https://toutiao.com/group/7390696631223534120/,,0,0,False
一万多架无人机庆祝中华人民共和国75周年，非常震撼，科技感满满,2024-09-29 01:14,24008,2454,小燕子285165166,小燕子285165166,,https://toutiao.com/group/7419867146898899483/,,0,0,True
几个月没见媳妇，刚回来就拽住媳妇又搂又抱，真是小别胜新婚啊！,2024-07-19 03:27,7806,691,瑞涵妈妈,瑞涵妈妈,,https://toutiao.com/group/7393183385576505890/,,0,0,True
广东湛江迈合村，听全红婵妈妈讲女儿的成长史，让人激动万分！,2024-07-31 09:54,3235,278,旅行观察记,旅行观察记,,https://toutiao.com/group/7397736240998515252/,,0,0,True
我哥哥，和朋友一起前往新疆种地后，离奇失踪32年，生死未卜,2024-07-07 22:06,7446,4173,真实人物采访,真实人物采访,#头条寻人##寻人路上的故事##失踪##回家#这是我们讲述的第4291位真人故事我是杨琼英，今年56岁，这是我找哥哥的第四个年头。32年前，我哥哥杨文斌在其好友代志福的多次劝说下，和他一同前往新疆种地，从此便和家人失去了联系。,https://toutiao.com/group/7388842950048875049/,,0,0,False
认祖归宗？蒙古国的“阳谋”将至！计划 2025年恢复蒙文与内蒙接轨,2024-09-08 03:03,1302,223,智史通鉴,智史通鉴,大家都知道，在历史上，外蒙古和内蒙古曾是“一家人”。后来清朝时期，外蒙古就开始独立出去，到现在，他们不仅加入了联合国，还将传统的蒙古语抛弃了，用了新的西里尔新蒙古文。可是随着时间的流逝，蒙古国似乎有一个“阳谋”渐渐浮出水面：他们计划在2025年，恢复传统的回鹘蒙文的使用。,https://toutiao.com/group/7412094989640958502/,,0,0,False
正处级干部退休每月拿多少退休金？看到金额后把我给惊讶到了！,2024-08-20 16:40,934,349,懂甄选,懂甄选,正处级干部退休每月拿多少退休金？看到金额后把我给惊讶到了！,https://toutiao.com/group/7405262491325825572/,,0,0,True
写歌30年穷困潦倒，前妻失望选择离婚，谁料51岁靠一首歌一夜成名,2024-08-12 03:37,24022,3819,八号探秘人,八号探秘人,在阅读此文之前，辛苦您点击一下“关注”，既方便您进行讨论和分享，又能给您带来不一样的参与感，感谢您的支持！编辑：LY无数人都想要一个一夜成名的机会，但机会来了也不是每个人都能把握住的。他用了三十年的时间来准备迎接属于自己的机会。为了这个机会他放弃了一切，甚至包括家庭。,https://toutiao.com/group/7402090890367484428/,,0,0,False
在两性关系中，女性最多能接受多少岁的男人，3位女人说出心里话,2024-07-25 23:38,27462,8580,玲儿说说,玲儿说说,,https://toutiao.com/group/7395721886363025920/,,0,0,True
一位平凡而又伟大的母亲，带着两个孩子在暴雨中佝偻着卖菜……,2024-08-10 10:20,83901,12326,阿豪与小花,阿豪与小花,她的坚强与淳朴深深的打动了我………,https://toutiao.com/group/7401453750096757259/,,0,0,True
如今回头看恒大，许家印是赢了还是输了？！,2024-07-29 11:03,40575,23032,缤纷海燕YrEkWp,缤纷海燕YrEkWp,,https://toutiao.com/group/7397011739571421708/,,0,0,True
中国🇨🇳人民的好总理,2024-09-03 15:46,198161,21137,话说,话说,这个老人一生只做一件事，那就是为了人民鞠躬尽瘁，死而后已,https://toutiao.com/group/7410443709928210955/,,0,0,True
美籍华人科学家吴瑛，在美国芝加哥家中服毒自杀，自杀原因曝光！,2024-09-04 05:28,1114,979,开心营业厅,开心营业厅,前言8月31日，香港《南华早报》报道：美籍华裔科学家吴瑛，在美国服用过量毒性药物，自杀身亡！她的离世，与美国政府对华人科学家的“迫害”有着直接的联系。美国为何频频针对华人科学家，难道说“科学无国界”真的成了一句笑话吗？,https://toutiao.com/group/7410619875699212826/,,0,0,False
安徽美女道士胡小慧被捕：精通“胡媚术”，九名男徒弟揭露其罪行,2024-09-12 08:10,3422,407,艺述史,艺述史,在安徽一处偏僻山头上，有座神秘的道观，外表平平无奇，但里面却有着一位名气很高的美女道士。美女道士的名字叫做胡小慧，据说有着高深的法力，能帮人消灾解难。很多人慕名前来，交上丰厚的香火钱，在袅袅青烟里，试图从这个年轻道士身上获得一些生活的支撑。,https://toutiao.com/group/7413662261274739200/,,0,0,False
善恶终有报！66岁“消失”了的陈宝国，可谓是娱乐圈的悲哀与损失,2024-09-27 06:29,1786,121,八号探秘人,八号探秘人,“我真的挺不喜欢听艺人这个词，前两年听得我一个劲儿地倒胃口”。当很多人挤破脑袋想要进娱乐圈当一名艺人的时候，他却说了这样一句话。,https://toutiao.com/group/7419206100681114153/,,0,0,False
为啥有人跑农村收“废手机”。收回来干些什么？看完你就明白了,2024-07-18 13:17,19746,493,阿丽观世界,阿丽观世界,,https://toutiao.com/group/7392964301276840459/,,0,0,True
荒岛求生之路,2024-07-06 07:18,24338,603,廖氏如神,廖氏如神,,https://toutiao.com/group/7388418781485203983/,,0,0,True
这就是中国排面！国庆升旗仪式上，国旗护卫队步步铿锵,2024-09-30 23:03,5909,526,北京日报客户端,北京日报客户端,,https://rss2.bjd.com.cn/content/s66fb2c1be4b01a5d71c96c58.html,,0,0,True
