title,publish_time,like_count,comment_count,media_name,source,abstract,article_url,tag,is_yaowen,article_sub_type,has_video
海南部分旅居人群成逃难大军，对于这样的生活，大家怎么看？,2025-02-09 10:48,4301,866,采云飘飘,采云飘飘,,https://toutiao.com/group/7469369555660309055/,,0,0,True
美俄越走越近，普京想拉中国“军费减半”，中方直接回了一句话,2025-02-27 02:18,3358,210,王峰talk,王峰talk,美俄越走越近，普京想拉中国“军费减半”，中方直接回了一句话,https://toutiao.com/group/7475917605908316712/,,0,0,True
上春晚没红，演了65部戏没红，如今42岁演《六姊妹》成人生赢家,2025-02-25 16:12,830,213,伶人王中王,伶人王中王,这位 42 岁的实力派演员，凭借在热播剧《六姊妹》中对何家文这一角色的精彩演绎，成功走进了更多观众的视野，实现了事业与生活的双丰收，成为令人瞩目的人生赢家。,https://toutiao.com/group/7475322237743841827/,,0,0,False
一妻二夫的女人太难了,2024-12-20 21:38,12371,158,杨杨娱乐,杨杨娱乐,,https://toutiao.com/group/7450611568212967988/,,0,0,True
坚持每隔两天炖一次，晚上沾床就睡，早上起来精气神十足,2025-02-27 03:31,2363,251,陈皮美食日志,陈皮美食日志,大家好，这里是陈皮的厨房，关注我持续为你输出美食配方。不管你是主动熬夜还是被动熬夜，都请试试这碗莲子百合猪心汤，安神养心，由内润到外。,https://toutiao.com/group/7475929963872190985/,,0,0,False
春天，这菜使劲吃！一养肝、二护眼、三排毒、四通便，鲜嫩营养高,2025-02-26 11:49,1803,259,秀厨娘,秀厨娘,春风拂过田野，沉睡一冬的泥土里冒出了星星点点的嫩芽。这种带着淡淡清香的野菜，是春天给我们的第一份健康好食材。,https://toutiao.com/group/7475671861737570816/,,0,0,False
李幼斌的一番话，戳穿哪吒2百亿票房 明星集体沉默的真相,2025-02-22 12:51,2129,832,努力的彦叔,努力的彦叔,李幼斌的一番话，戳穿哪吒2百亿票房 明星集体沉默的真相,https://toutiao.com/group/7474225113614074403/,,0,0,True
春天，这菜使劲吃，一通便、二护眼、三祛湿热，蒸一蒸太鲜美啦！,2025-02-25 07:11,3754,335,爱玉门,爱玉门,开春2月，气温变暖的同时，还伴随着春雨，湿寒的气候很适合春季野菜的生长，春天也是吃野菜的时令季节，在这绚烂多彩的季节里，有一种野菜悄然上市，它不仅味道鲜美，更是集多重健康益处于一身——这便是面条菜。,https://toutiao.com/group/7475251013516100159/,,0,0,False
