title,publish_time,like_count,comment_count,media_name,source,abstract,article_url,tag,is_yaowen,article_sub_type,has_video
锚定现代化 改革再深化丨我国自然保护地体系建设进入全面提速新阶段,2024-12-06 11:47,1145,500,央视新闻,央视新闻,习近平总书记指出，要加快建设以国家公园为主体、以自然保护区为基础、以各类自然公园为补充的自然保护地体系，把有代表性的自然生态系统和珍稀物种栖息地保护起来。党的二十届三中全会提出，全面推进以国家公园为主体的自然保护地体系建设。,https://content-static.cctvnews.cctv.com/snow-book/index.html?item_id=6196528199507335114&source=50006&sub_source=50006_001,,0,0,False
新乱世佳人：美妇求县长帮忙，县长却打起她的主意,2024-12-06 06:25,1464,202,乐视娱乐乐翻车,乐视娱乐乐翻车,,https://toutiao.com/group/7445181070040891931/,,0,0,True
大学生4年间艾滋病感染12397例，60%存在这一行为,2024-12-03 10:16,5110,4307,凤凰网,凤凰网,据相关数据，2020年至2023年，新报告青年学生病例分别为:2977人、3677人、2733人、3010人，四年间共报告12397人。,https://toutiao.com/group/7444127197663396364/,,0,0,False
杀疯了的「北京市服」，统一全国审美？,2024-11-25 00:30,2878,1178,凤凰WEEKLY,凤凰WEEKLY,文/馍王编辑/闫如意众所周知，凤凰编辑部位于北京市。众所又知，北京的冬天，有一种统一所有人穿搭审美的魔力。这个冬天，编辑部的穿搭呈现出了无限趋同。上班时，人均穿着一件柔软的摇粒绒内衬，蜷缩在工位上。下班点一到，用一件宽大冲锋衣把摇粒绒一锁，挺胸抬头，跟扇大铁门似的走出公司。,https://toutiao.com/group/7440858414693040678/,,0,0,False
包厢全是刚出狱的恶霸，结果一看到饭店主厨，立马怂了,2024-11-11 01:21,11718,313,乐视群星访谈秀,乐视群星访谈秀,,https://toutiao.com/group/7435825833048015400/,,0,0,True
美媒评中国最新出口管制：中国开创先例，禁止他国向美国出售商品,2024-12-06 13:48,17205,10613,观察者网,观察者网,【文/观察者网 齐倩】12月3日，中国商务部发布公告，宣布严控对美出口镓、锗、锑、超硬材料、石墨等相关两用物项。外媒普遍将此视作对美国出口管制行为的迅速反制，同时注意到了公告中的一句表述：“任何国家和地区的组织和个人违反相关规定，将依法追究责任。,https://www.guancha.cn/internation/2024_12_06_757979.shtml,,0,0,False
央视曝光！#制假售假“一条龙”！,2024-11-24 12:16,4817,1859,央视财经,央视财经,,https://toutiao.com/group/7440818726712115762/,,0,0,True
“中企遭大规模拒签，前所未有”,2024-12-02 09:13,10319,3115,环球时报新媒体,环球时报新媒体,“中企遭大规模拒签，前所未有”,https://toutiao.com/group/7443740275974865423/,,0,0,True
最多1天卖4000斤！男子靠这在杭州买房：以前想都不敢想！有人一口气买走1200斤,2024-12-07 07:42,1357,392,环球网,环球网,来源：杭州日报 12月的杭城，年味日渐浓郁。每年此时，杭州菜场里会突然冒出几个人气鼎旺的灌香肠摊，吸引四面八方的老客前来下单，风风火火忙上两三个月。于赛华就是其中一人，人称“香肠哥”。小学没毕业的他做了23年香肠成了非遗传承专家，还在杭州买了房：“以前在杭州买房想都不敢想。,https://3w.huanqiu.com/a/1bb1a4/4KYm3peCxq8?agt=20,,0,0,False
温州警察巡逻首次启用球形机器人，无人智能装备呈现四面开花状态,2024-12-07 09:09,2051,139,杜文龙,杜文龙,,https://toutiao.com/group/7445594454347973135/,,0,0,True
琼瑶与江苏：她的母亲是武进人，大姨更是江苏名人,2024-12-04 14:41,1668,525,扬子晚报,扬子晚报,在华语文学的天空中，琼瑶的名字如同一颗璀璨的星辰，照亮了一代又一代人的情感世界。然而，当这颗星辰悄然陨落，我们不禁感叹岁月的无情与生命的脆弱。琼瑶的离世，不仅让文学界失去了一位巨匠，也让她的血脉故乡江苏，失去了一位与这片土地情深意长的文化使者。,https://wap.yzwb.net/wap/news/4184552.html,,0,0,False
江苏盐城一村干部公示“6岁入伍”？最新消息,2024-12-07 03:13,750,928,红星新闻,红星新闻,12月6日，有网传消息称江苏盐城市滨海县某村副书记公示信息中，出现干部朱某某简历显示1993年出生，1999年入伍的情况。该消息后经部分媒体报道后引发关注，大量网友质疑该干部任选存在问题。,https://toutiao.com/group/7445502500272390690/,,0,0,False
太猛了！这个国产手机终于成了全球第一，在国内居然无人知晓,2024-12-03 02:58,1260,236,毒sir财经,毒sir财经,中国一家手机厂商，被美国《时代》周刊列为2024年“全球100大最具影响力企业”。但在中国却没有任何市场份额，中国人在国内根本买不到。,https://toutiao.com/group/7443806715725840937/,,0,0,False
痛心！北京一居民家今晨突发火灾，致1死4伤，“凶手”又是它,2024-12-07 10:16,819,788,环球网,环球网,12月7日凌晨4时许，北京一居民家中发生火灾，致1死4伤。初步调查认定，火灾系室内的电动自行车锂电池内部故障起火所致。消防部门提示居民，电动自行车或电池不“进楼入户”，应在室外指定场所安全停放、充电。,https://toutiao.com/group/7445611413688566298/,,0,0,False
广西49岁老汉娶19岁姑娘，结婚21年生下15个孩子，如今有何下场？,2024-10-20 08:32,6164,736,艺述史,艺述史,她19岁出嫁，21年里总共生育了15个孩子，其中4个男孩子11个女孩子，家里热闹的像是开了一所学校一样。,https://toutiao.com/group/7427400319418384948/,,0,0,False
复旦高材生一句祝贺中国台北队拿世界冠军，竟让台独玻璃心碎满地,2024-12-06 04:00,11078,324,邱毅台湾,邱毅台湾,,https://toutiao.com/group/7444838630555189801/,,0,0,True
河南警察3岁女儿被拐，苦寻全国23年无果，结果却发现女儿在对门,2024-11-05 07:43,3142,331,八号探秘人,八号探秘人,寻亲23年无果，丢失的女儿竟住在对门?但它却真实发生在河南洛阳的梁绍波身上。是意外走丢，还是人贩子所为，三岁的女儿怎会离奇失踪?,https://toutiao.com/group/7433697108120142345/,,0,0,False
中新联合演习出现新装备，“爬墙机器人”亮相，智能装备开始井喷,2024-12-07 08:44,3614,152,杜文龙,杜文龙,,https://toutiao.com/group/7445587974818890291/,,0,0,True
3年前，宁夏7岁小女孩一笑走红，后拒百万签约，如今怎么样了？他们后悔了吗？,2024-09-19 07:25,14872,1986,睿之悦,睿之悦,2021年，视频镜头中出现的女孩儿用那一抹甜美的笑容，迅速引起了网友们的广泛关注。有媒体公司看到这一机遇，提出愿意用百万巨资与女孩儿签约，然而，女孩儿的父母却坚决拒绝了这一提议。,https://toutiao.com/group/7416250139544879679/,,0,0,False
尹锡悦疯了 李在明赢了 美国火大了,2024-12-05 08:12,13206,1113,台灣中天主播盧秀芳,台灣中天主播盧秀芳,尹锡悦疯了 李在明赢了 美国火大了,https://toutiao.com/group/7444837777838965289/,,0,0,True
罕见！100年前，英国游客拍下的清朝乡村，和想象中完全不一样,2024-09-20 02:07,8478,747,万物知识局,万物知识局,泥泞的土路，衣不蔽体的老百姓，即便是达官显贵的家中也十分破败，而这些都是清王朝的历史痕迹，虽说那时候中国摄影技术并不发达，但也有许多外国游客来到这里，拍摄下了许多老照片，为我们留下了珍贵的历史资料，那清朝到底是怎样的面貌呢?,https://toutiao.com/group/7416287738871267855/,,0,0,False
多地中小学校长，接连被查,2024-12-07 02:13,2778,2886,环球网,环球网,来源：中国新闻网 从湖北通报11名中小学校领导，到多地中小学校长接连被查……近期，教育系统反腐受到关注，多地出手整治基础教育领域不正之风和腐败问题，一批“蝇贪”“蚁贪”被揪出。,https://3w.huanqiu.com/a/a4d1ef/4KYaQeL51iL?agt=20,,0,0,False
女子穿便装出门，乘网约车到达目的地后 女子亮证执法,2024-11-13 05:33,1315,363,新派新闻,新派新闻,,https://toutiao.com/group/7436632843294114314/,,0,0,True
超标290倍！紫燕百味鸡被曝光，网友：天塌了！,2024-12-07 00:00,2620,2862,大河报,大河报,11月29日，测评博主@老爸评测-魏老爸 发布了对紫燕百味鸡等卤味的检测报告，引发广泛关注。据老爸测评，因太多网友反映吃卤味拉肚子，于是他从多家卤味品牌官方旗舰店购入了卤味样品进行检测。,https://news.dahebao.cn/dahe/appcommunity/2121822?newsId=2121822,,0,0,False
美国权力即将交接之际，台湾两个举动不寻常，释放什么危险信号？,2024-12-02 09:57,13308,132,邱震海,邱震海,,https://toutiao.com/group/7443751437550486057/,,0,0,True
大放水时代来了！央行放大招，2025年宽松货币政策凶猛来袭,2024-12-06 09:20,337,107,议史纪,议史纪,就在前不久，央行为2025年央行政策定基调，明年大概率会迎来大放水时代!大家都知道，今年以来，央行和各大国行已经将存款利率不断下调了三次，同时房贷利率在上半年虽然下调，但是大家应该都发现了，各地的房贷利率又开始上涨。,https://toutiao.com/group/7445225052930327077/,,0,0,False
平板加个轮子，凭什么卖4000？,2024-12-02 14:06,498,244,中国新闻周刊,中国新闻周刊,名字乍一听摸不着头脑，但看一眼就能明白它究竟是个什么:看似平平无奇一块大屏幕，不比大电视，但又大过一般的平板电脑，关键是无线“一身轻”，靠着一个可移动支架，走到哪儿就可以推到哪儿。,https://toutiao.com/group/7443815019826905635/,,0,0,False
女友怀孕了，男友不装了，带她回豪宅！,2024-11-23 08:01,9653,776,乐视大综艺咖,乐视大综艺咖,,https://toutiao.com/group/7440353629540483593/,,0,0,True
工信部给燃油车吃了一颗“定心丸”，淘汰燃油车的声音终于安静了,2024-12-04 09:16,1270,701,议史纪,议史纪,随着新能源汽车的发展越来越强大，燃油车的热度似乎被影响了。您现在的车是新能源，还是燃油车呢?也正是因为新能源的崛起，大家关于燃油车看法也逐渐有了争议。,https://toutiao.com/group/7444481609710977570/,,0,0,False
弟弟光荣退伍，姐姐兴奋去车站接他，怎料一见弟弟瞬间哭了,2024-11-05 06:34,30584,2919,乐视天天剧好看,乐视天天剧好看,,https://toutiao.com/group/7433679820573934091/,,0,0,True
逼退美国航母战斗群，055被严重高估了吗？真相曝光后令人心酸,2024-11-28 01:55,2377,177,迷彩虎说,迷彩虎说,毕竟只是一艘驱逐舰而已，就算是之前055曾经有过单舰吓退美国航母战斗群的记录，也有人认为仅仅是在和平时期，美国不想和中国爆发热战，所以选择退却，如果在实战情况下他们肯定能击沉055。,https://toutiao.com/group/7441771958783492619/,,0,0,False
5位劣迹艺人复出失败，评论区翻车、演出被取消，全部遭到抵制,2024-11-26 12:25,1106,169,豆莱说,豆莱说,文：豆莱说编辑：豆莱说娱乐圈里潜藏着诸多诱惑与陷阱，明星们表面上享受着聚光灯和掌声，但是稍微一不注意，行差踏错，就会失去原有的关注和地位。而近年来，有明星偷税漏税，私德有亏或者更严重的违法犯罪行为的消息也是层出不穷，引来的结果自然也是星途毁于一旦，遭遇封杀。,https://toutiao.com/group/7441541113179111936/,,0,0,False
大兴机场被北漂睡成“洗浴中心”，撕开当下社会最体面的一幕,2024-12-02 12:50,1480,299,毒sir财经,毒sir财经,＃大兴机场被北漂睡成了“0元洗浴中心”的词条，迅速冲上热搜，引来广大网友热议。许多人有过，兜里窘迫，又想找个地方过夜的经历。,https://toutiao.com/group/7443795695737373196/,,0,0,False
