title,publish_time,like_count,comment_count,media_name,source,abstract,article_url,tag,is_yaowen,article_sub_type,has_video
34岁雌雄同体的女性，具备男女两性器官，她该如何生存下去？,2024-10-17 03:32,5019,239,大象微视,大象微视,这个词在我们生活中并不常见，简而言之，双性人就是既拥有男性的生殖器官，也具备女性的特征的人。1989年，王梓淇出生在山西太原的一个家庭，她的家里经营着一家小生意，虽然谈不上富裕，但足够让一家人过得舒心自在。,https://toutiao.com/group/7426578550418948618/,,0,0,False
小子相亲故意扮老，谁知道对方一见面就叫他大爷，这段太逗了,2024-12-24 08:17,3937,892,乐视热播综艺精选,乐视热播综艺精选,,https://toutiao.com/group/7451886130837848610/,,0,0,True
老纪和珅这段对话，以前小时候听不懂，如今听完受益终身,2024-12-28 23:16,6345,1826,乐视扒剧小妹儿,乐视扒剧小妹儿,,https://toutiao.com/group/7453420191947424293/,,0,0,True
煮速冻饺子，切记别用开水和冷水煮，教你方法，出锅和现包的一样,2025-01-04 11:48,1280,269,百变小厨坊,百变小厨坊,,https://toutiao.com/group/7456025845027570203/,,0,0,True
特朗普掌权前夕，三国争相抛出橄榄枝，三大战线将有何变局？,2025-01-06 09:16,11360,304,邱震海,邱震海,,https://toutiao.com/group/7456728906624664102/,,0,0,True
到底是外公亲，还是爷爷亲？心理学家的答案很统一,2024-12-30 06:35,1369,678,第一心理,第一心理,一位读者来信，提到最近自己遇到的一些家庭相关的琐事，并提出了自己的一些疑问。具体情况如下：这位读者是一个孩子的母亲，与丈夫结婚之后，一直在丈夫家所在城市生活，也受了公公婆婆不少接济，由于自己父母在另外的城市，有点距离但是不远，孩子出生之后也一直与爷爷奶奶接触更多。,https://toutiao.com/group/7454088472568857126/,,0,0,False
炸鱼块，到底用淀粉还是面粉，今天分享一个又香又脆的做法,2025-01-02 09:26,8096,508,家常的味道,家常的味道,,https://toutiao.com/group/7455247105683096076/,,0,0,True
小女孩上部队找爸爸，少校阿姨主动搭讪，谁知看到女孩父亲傻眼了,2024-12-23 16:01,3819,888,乐视群星访谈秀,乐视群星访谈秀,,https://toutiao.com/group/7451525814283960872/,,0,0,True
抗美援朝的将军亮相，全体明星自发起立，这幕太感人,2025-01-03 07:32,12062,1377,乐视天天剧好看,乐视天天剧好看,,https://toutiao.com/group/7455587633452843572/,,0,0,True
多地预警！甲流势头正猛，5种可口服的抗流感药，一定要了解,2025-01-06 10:04,1466,125,奇妙的本草,奇妙的本草,一到冬季，就意味着进入流感高峰期。最近不少人都中招了，出现头晕、咳嗽、流鼻涕、发热等症状，根据中国疾控中心发布的最新数据显示，目前多地的流感病毒阳性率在不断地上升，而且我99%以上都是甲流。一、甲流、普通感冒、新冠，有何不同？,https://toutiao.com/group/7456740373067563570/,,0,0,False
我国哪里的面粉无添加？经对比，有这行字就是零添加，可以放心买,2025-01-02 10:44,3161,1265,鲸探所,鲸探所,面粉是我们日常生活中离不开的一种主食，在我国人们的餐桌上是有着非常重要的地位的。可以说，基本上家家户户都是需要用到面粉的，已经快到年下了，许多人也开始往家里置备年货了，而面粉，也是最重要的年货之一。,https://toutiao.com/group/7455263523673834024/,,0,0,False
卡特去逝，拜登宣布降半旗，特朗普火大，他真能使美国再次伟大？,2025-01-06 06:44,11777,293,邱毅台湾,邱毅台湾,,https://toutiao.com/group/7456689683951518271/,,0,0,True
房子旁边住着有120条“狗母蛇”，很多人都没见过，拍给大家看看,2024-11-05 12:27,8156,2795,乡村小故事小妹,乡村小故事小妹,房子旁边住着有120条“狗母蛇”，很多人都没见过，拍给大家看看,https://toutiao.com/group/7433770965259354650/,,0,0,True
西藏6.8级地震多支部队出发赶赴震区救援 西部战区出动无人机勘察,2025-01-07 03:57,3315,493,海客新闻,海客新闻,西藏6.8级地震多支部队出发赶赴震区救援 西部战区出动无人机赴震中勘察,https://toutiao.com/group/7457017406326653478/,,0,0,True
夜里翻来覆去睡不着，原来几根芹菜根就搞定，做法简单，省钱实用,2024-12-25 11:02,11034,1308,百变小厨坊,百变小厨坊,夜里翻来覆去睡不着，原来几根芹菜根就搞定，做法简单，省钱实用,https://toutiao.com/group/7452303315842368052/,,0,0,True
太突然！他于凌晨5时去世，年仅19岁,2025-01-07 00:10,2871,440,闽南网,闽南网,“学校要放寒假了，弟弟买了1月9日的票，打算回家过年，没想到突发疾病就走了，我们连最后一面都没见着。弟弟走得匆忙，但他是个很热心善良的人，肯定非常乐意帮助别人。”,https://toutiao.com/group/7456958303093015067/,,0,0,False
更多“润”美非法移民可能被遣返，中国政府该不该接收？,2025-01-04 09:56,9078,1506,金灿荣教授,金灿荣教授,,https://toutiao.com/group/7455641538823979529/,,0,0,True
98岁老郎中教我苹果养生新吃法，每天坚持这样吃，睡眠好，身体棒,2024-12-31 11:43,12316,1215,百变小厨坊,百变小厨坊,98岁老郎中教我苹果养生新吃法，每天坚持这样吃，睡眠好，身体棒,https://toutiao.com/group/7454540163725656628/,,0,0,True
广西49岁老汉娶19岁姑娘，结婚21年生下15个孩子，如今有何下场？,2024-10-20 08:32,10687,1291,艺述史,艺述史,她19岁出嫁，21年里总共生育了15个孩子，其中4个男孩子11个女孩子，家里热闹的像是开了一所学校一样。,https://toutiao.com/group/7427400319418384948/,,0,0,False
清华才女李一诺：27岁博士毕业，4年生3娃，能替世界首富花钱,2024-12-18 05:51,8865,411,云莳一,云莳一,家庭是她第一个学校，妈妈是她第一任老师。李一诺27岁博士毕业进入美国麦肯锡公司，33岁成为公司全球董事合伙人，之后四年连生3娃。,https://toutiao.com/group/7449591069311779355/,,0,0,False
美国日本闹翻！日本起诉美国，拜登提醒预防日本,2025-01-06 10:24,5839,201,诚阅ChengYue,诚阅ChengYue,美国日本闹翻！日本起诉美国，拜登提醒预防日本,https://toutiao.com/group/7456746105466339874/,,0,0,True
印度女主播：歼36和076是“光鲜新玩具”，能否生存都是问题,2025-01-02 09:28,4491,1136,第一军情,第一军情,日前，在印度知名度非常高的美女主持人帕尔基-夏尔马在电视节目中，“锐评”了中国先进武器的“井喷”式亮相。夏尔马质疑中国六代机也好，新型两栖攻击舰也好，都是没经过实战考验的“纸老虎”，虽然看起来光鲜亮丽，但真打起来很可能露馅。,https://toutiao.com/group/7455247647847219749/,,0,0,True
“六星街里还传来巴扬琴声吗……”狼戈、张英席合唱《苹果香》,2024-12-31 14:55,3444,184,央视频,央视频,,https://toutiao.com/group/7454589818538820115/,,0,0,True
歼36首飞一周后，美军司令打破沉默：这是9·11以来最紧张时刻,2025-01-02 05:43,33392,121,阿尔法军事,阿尔法军事,歼36首飞一周后，美国印太司令部司令塞缪尔·帕帕罗作为“对华一线”最高指挥官发表了声明，他首先用两句话给整个声明定了调：一是中美要和平共处不要新冷战；二是美国无意与华进行军备竞赛。,https://toutiao.com/group/7455189778258985506/,,0,0,True
高安国被押前留下英雄壮语，赖清德恶贯满盈，何时方能恶有恶报？,2025-01-05 04:00,25779,2686,邱毅台湾,邱毅台湾,,https://toutiao.com/group/7455975347708920383/,,0,0,True
县长看不上乡长送的烟，给他退回来，乡长打开一看乐了,2024-11-13 08:16,12436,2035,乐视大综艺咖,乐视大综艺咖,,https://toutiao.com/group/7436672568578277925/,,0,0,True
今年会举行阅兵仪式吗？我大胆作个猜测,2025-01-03 09:11,14929,1698,金灿荣教授,金灿荣教授,,https://toutiao.com/group/7455614288229728803/,,0,0,True
平均3天造一枚核弹，近日美国公开了中国核弹头生产速度！,2025-01-06 10:09,4355,1342,军武次位面,军武次位面,前段时间，美国国防部发布的《2024中国军力报告》中提到，“中国的核弹头数量正在快速增长，从去年500枚增长到今年的600枚，并且预计2030年数量将达到1000枚。,https://toutiao.com/group/7456742462263001610/,,0,0,False
新婚33天卷走274万4套房，出逃后丈夫跨国追捕，如今下场大快人心,2024-12-20 22:06,5490,270,八号探秘人,八号探秘人,在阅读此文之前，辛苦您点击一下“关注”，既方便您进行讨论和分享，又能给您带来不一样的参与感，感谢您的支持！编辑丨QQ·B“色字头上一把刀！”深圳富豪结婚33天竟被卷走274万元和名下4套房产。不仅如此，他还被扣上了“接盘侠”的帽子，啥也没干喜当爹。,https://toutiao.com/group/7450399558821052982/,,0,0,False
厨师长教你：“家常肘子”口感耙糯 软烂入味 肥而不腻,2025-01-02 09:00,2064,267,美食作家王刚,美食作家王刚,厨师长教你：“家常肘子”口感耙糯 软烂入味 肥而不腻,https://toutiao.com/group/7455138904249893416/,,0,0,True
厨师长教你：“葱爆羊肉”羊肉滑嫩、鲜香不膻,2024-12-27 07:34,3975,723,美食作家王刚,美食作家王刚,厨师长教你：“葱爆羊肉”羊肉滑嫩、鲜香不膻,https://toutiao.com/group/7452991735665263139/,,0,0,True
什么是奶头乐理论？同学把女老师气的脸红脖子粗,2025-01-05 10:14,3774,236,七兜酱妹子,七兜酱妹子,,https://toutiao.com/group/7456372666564346403/,,0,0,True
这是张学良老婆赵四小姐真实样貌，并非演员饰演而是货真价实真品,2024-12-28 11:28,13008,1708,历史伟人,历史伟人,赵四小姐，原名赵一荻，她从十六岁开始她终生陪伴张学良，历经坎坷，赵一荻是富家大小姐，但是在张学良囚禁期间，她选择陪伴软禁中的张学良，后悔过吗?,https://toutiao.com/group/7453422736652698175/,,0,0,False
40年前供销社卖过的13个生活用品，见过一半算你厉害，你认识几个,2024-11-13 14:16,7190,883,亲爱的海燕,亲爱的海燕,供销社的记忆，当年在供销社买什么都凭票，布票、粮票、油票、肉票，肥皂票，火柴票，烟票（最值钱），糖票，油票，自行车、手表、缝纫机、电视机票……样样皆需。粮棉油，是生活必需品，实行票证按计划供应，是为了保证公平分配，1、标准叫法叫“顶针”，我们皖北这边方言叫顶琅子。,https://toutiao.com/group/7436751444398834176/,,0,0,False
只发行了660枚的麦穗五角，一枚46200元！千万别花掉了,2024-11-20 13:06,17033,5496,小hua聊收藏,小hua聊收藏,五角硬币大家并不陌生，市面上常见的有荷花五角，在这之前的梅花五角已经很少见了。细数钱币发行以来，发行过长城五角，梅花五角，金、白荷花五角，那么对比起来哪个更值钱呢。,https://toutiao.com/group/7439293128831484453/,,0,0,False
中央大老虎逃跑，海陆空三军出动，中央下令必拿下,2024-11-19 03:17,38050,741,乐视视频秀,乐视视频秀,中央大老虎逃跑，海陆空三军出动，中央下令必拿下,https://toutiao.com/group/7438824299877630479/,,0,0,True
他的资历比朱德还老，授勋时却错失元帅，毛主席特批享受元帅待遇,2024-12-12 10:24,3691,147,品古观今,品古观今,在我军革命史上，有一位将军的资历比朱德还老，连毛主席都说:“共产党能对国民党将领说话的人不多，他就是其一。”可这样的人却在大授衔时，错失了元帅，后来经过毛主席的一番关心，才得以享受与元帅的同等待遇。,https://toutiao.com/group/7447468654758871592/,,0,0,False
海南富商张晖：花8亿建108米海上观音像，4年后死在水中死因成谜,2024-10-19 04:49,5225,919,八号探秘人,八号探秘人,在阅读此文之前，辛苦您点击一下“关注”，既方便您进行讨论和分享，又能给您带来不一样的参与感，感谢您的支持！编辑丨xk他是中国的一名富商，耗费8亿元完成了自己的梦想。可梦想落地成为现实的时候，他却在4年后莫名其妙的死去。他就是张晖，上个世纪末海南岛旅游业的龙头当家人。,https://toutiao.com/group/7427288913095492134/,,0,0,False
充电时，先插手机还是充电器？方法错误手机坏得快,2025-01-02 01:19,2059,167,人民日报,人民日报,手机电量还剩多少，对现代社会的许多人而言，都是一个“性命攸关”的问题。人们对手机充电的强烈需求，也让市面上催生出了许多噱头：无线充电，二倍速充电，以及能连着用一周的高能充电宝。乱花渐欲迷人眼，但到底什么才是手机充电的正确姿势呢？手机一定要满充满放吗？,https://www.peopleapp.com/column/30047895447-500006027199?utm_source=头条号&promote=true,,0,1,False
57岁于文华现状，与丈夫住农村简陋房子，裙子拖地喂着狗生活幸福,2024-12-17 01:24,1334,221,焰墨绘史,焰墨绘史,在阅读此文之前，麻烦您点击一下“关注”，既方便您进行讨论和分享，又能给您带来不一样的参与感，感谢您的支持。本文内容均引用权威资料结合个人观点进行撰写，文中已标注文献来源及截图，请知悉。提起于文华，想必当大家都不会陌生，当年的她凭借那首《纤夫的爱》，一夜间家喻户晓。,https://toutiao.com/group/7448948632033722889/,,0,0,False
河南警察3岁女儿被拐，苦寻全国23年无果，结果却发现女儿在对门,2024-11-05 07:43,6338,681,八号探秘人,八号探秘人,寻亲23年无果，丢失的女儿竟住在对门?但它却真实发生在河南洛阳的梁绍波身上。是意外走丢，还是人贩子所为，三岁的女儿怎会离奇失踪?,https://toutiao.com/group/7433697108120142345/,,0,0,False
团长壮的像头牛，新婚夜却耕了一晚上的地，下属秒懂！,2024-11-25 03:42,1530,559,乐视最爱综艺说,乐视最爱综艺说,,https://toutiao.com/group/7441057170428264970/,,0,0,True
拜登下台前搅动南海风云，美菲连手挑衅中国，中国不再忍强硬回击,2025-01-03 03:44,23081,984,邱毅台湾,邱毅台湾,,https://toutiao.com/group/7455530031461171753/,,0,0,True
