title,publish_time,like_count,comment_count,media_name,source,abstract,article_url,tag,is_yaowen,article_sub_type,has_video
包厢全是刚出狱的恶霸，结果一看到饭店主厨，立马怂了,2024-11-11 01:21,13910,379,乐视群星访谈秀,乐视群星访谈秀,,https://toutiao.com/group/7435825833048015400/,,0,0,True
全球最大电磁弹射无人机航母，两栖攻击舰 076即将下水,2024-12-22 09:48,29082,1296,杜文龙,杜文龙,,https://toutiao.com/group/7451170777983877632/,,0,0,True
国家定调，2025年养老金将迎连续第21年上涨，四类人能涨300元？,2024-12-19 00:04,690,196,社保当家,社保当家,国家定调，2025年养老金将实现连续第21年上涨，四类人能涨300元？2025年养老金已经确定将继续上涨，中央经济工作会议已经拍板，明年将迎来连续第21年养老金的上涨，属实不容易，这笔背后还是我们国家持续健康的经济发展，为退休人员的养老金连年上调提供了强有力的支撑。,https://toutiao.com/group/7449739143988527655/,,0,0,False
天冷电动车充满电，一加油门就掉2格，不怪电池，真实原因告诉你,2024-11-26 05:02,2038,166,新能源战略家,新能源战略家,电动车使用方便、价格便宜，已经成为了不少朋友通勤代步的首选，但在使用过程中偶尔也有让人糟心的问题。像爆胎、刹车不灵敏这类问题可以通过门店维修来解决，但如果遇到电池出现异常情况，不仅问题难以排查，而且维修成本也不低。,https://toutiao.com/group/7441448742575702563/,,0,0,False
海一天，不靠当领导的父亲，46岁才走红，娶二婚妻子待继子如亲生,2024-12-19 06:54,1969,489,豆莱说,豆莱说,文：豆莱说编辑：豆莱说在娱乐圈中，不乏有很多星二代，他们一出生便含着金汤匙，什么不用做就已经到达了普通人努力一辈子都到达不了的罗马。但是海一天却是一个例外，他从不靠着家里的关系，凭借着自己的努力进入演艺圈，可是却一直籍籍无名，直到46岁才走红，可算是真正的大器晚成。,https://toutiao.com/group/7450010154218668553/,,0,0,False
给24年最好的十部国产剧排名：《我是刑警》仅第10，第1名没争议,2024-12-19 09:05,1595,308,皮皮电影,皮皮电影,2024年接近尾声，回顾这一年的国产剧，我们可以发现一些变化：第一大变化，是央视的动作。从2020年起，或许是面临网剧精品化的冲击，央视也开始主动求变。最开始的动作，还只是瞄准开年大剧，比如2021年的《觉醒年代》、2022年的《人世间》。,https://toutiao.com/group/7449943522318238260/,,0,0,False
特警摩托车教官表演绝技，全场吓得不敢大喘气，太惊险了！,2024-12-19 12:05,3558,901,PP张家长李家短剧院,PP张家长李家短剧院,,https://toutiao.com/group/7450090193866752566/,,0,0,True
小品：杨帆演小沈阳，撒贝宁演赵本山，台词功底太强了吧,2024-11-23 06:13,6704,138,PP宫斗放映厅,PP宫斗放映厅,,https://toutiao.com/group/7440353912709710386/,,0,0,True
俄罗斯的决心很大，俄乌冲突可能到了最危险的时刻,2024-12-20 11:34,9268,624,金灿荣教授,金灿荣教授,,https://toutiao.com/group/7450456114459574820/,,0,0,True
CBA排名一夜大乱，广东辽宁回原点，北京跌出四强，上海高歌猛进,2024-12-24 15:09,481,108,涓姐享聊,涓姐享聊,CBA常规赛烽火连天，第21轮战罢，积分榜上风云再起，各路豪强你追我赶，上演了一出出精彩绝伦的好戏。广东宏远坐镇主场，迎来了宁波富邦的挑战，这场比赛对新援贝兹利来说，可是个亮相的大好机会。赛前，球迷们都瞪大眼睛，等着看这位新星的表现。,https://toutiao.com/group/7451994364324135458/,,0,0,False
毛人凤下令带走死囚，哪料死囚的靠山露面了，毛人凤当场懵了,2024-11-25 03:05,14123,2522,南哥硬汉秀,南哥硬汉秀,,https://toutiao.com/group/7441047753771188799/,,0,0,True
67岁执意生娃，如今却坐轮椅无法自理，5岁的天赐被迫独立学洗衣,2024-11-04 10:32,9909,2290,睿之悦,睿之悦,2019年，已经67岁的田新菊执意生下了自己的第三个孩子小天赐。那么，现如今5年的时间过去了，这“天赐”的礼物到底是福还是祸呢?,https://toutiao.com/group/7433367394946384435/,,0,0,False
郭有才：当迷失方向忘记初心后，曾经飘得多高，如今摔得就多惨,2024-11-11 06:53,2055,861,八号探秘人,八号探秘人,在阅读此文之前，辛苦您点击一下“关注”，既方便您进行讨论和分享，又能给您带来不一样的参与感，感谢您的支持！编辑丨brt因为一首翻唱，他一夜之间成为了拥有千万粉丝的网红。但是“人红是非多”，不久他就因为版权等问题陷入了舆论风波。他的人气一落千丈，从万众瞩目变成了现在的无人问津。,https://toutiao.com/group/7435901170239078948/,,0,0,False
接班人有望：普京提拔27岁战斗英雄进政府高层，军功爵制复活了？,2024-12-19 08:50,3460,137,军武次位面,军武次位面,最近，俄罗斯执政党，也就是普京和梅德韦杰夫所在的党派俄罗斯统一党召开了第22届全国代表大会，会议期间完成了一些重要中央委员的任免。,https://toutiao.com/group/7449980789560705570/,,0,0,False
宋美龄106岁去世，贴身厨子回家后不久自尽，事后妻子透露出缘由,2024-10-28 09:22,14685,511,历史与江湖,历史与江湖,2003年10月，106岁的宋美龄在美国纽约去世，这位世纪老人虽然永远地闭上了双眼，但是却留下了一个长寿神话。,https://toutiao.com/group/7430753866158817855/,,0,0,False
如何看待美国出台的《2024中国军力报告》？,2024-12-23 05:18,23307,1249,大刘说说,大刘说说,美国国防部最近出台了2024中国军力报告，今年我们来聊聊西方世界是如何看待中国的军力发展的,https://toutiao.com/group/7451472335464301096/,,0,0,True
才发现，原来保存小葱这么简单，放1年都不坏，依然和新鲜一样,2024-12-16 14:40,955,216,明玥美食,明玥美食,,https://toutiao.com/group/7449019538600886795/,,0,0,True
炖鸡肉不要焯水和直接下锅，教你一招，鸡肉鲜香滑嫩不腥不柴,2024-12-15 08:45,4892,237,家常的味道,家常的味道,炖鸡肉千万不要焯水和直接下锅，教你秒招，鸡肉鲜香滑嫩不腥不柴,https://toutiao.com/group/7448556944597451275/,,0,0,True
人口减少对房地产的影响有多大？,2024-12-19 06:36,16793,3593,温义飞的急救财经,温义飞的急救财经,,https://toutiao.com/group/7450008090864255503/,,0,0,True
弟弟光荣退伍，姐姐兴奋去车站接他，怎料一见弟弟瞬间哭了,2024-11-05 06:34,41793,3354,乐视天天剧好看,乐视天天剧好看,,https://toutiao.com/group/7433679820573934091/,,0,0,True
江苏盐城一农民卖羊肉获利180元被市监局开出10万元罚单,2024-12-25 08:05,5888,14029,环球网,环球网,来源：法治日报 法治日报全媒体记者 丁国锋12月24日下午三点，江苏盐城一农民卖1只羊获利180元被大丰区市场监管局罚款10万元的行政诉讼案件，在盐城中院17法庭二审公开开庭。,https://3w.huanqiu.com/a/702f81/4Knj49bX4pr?agt=143,,0,0,False
新婚33天卷走274万4套房，出逃后丈夫跨国追捕，如今下场大快人心,2024-12-20 22:06,3346,189,八号探秘人,八号探秘人,在阅读此文之前，辛苦您点击一下“关注”，既方便您进行讨论和分享，又能给您带来不一样的参与感，感谢您的支持！编辑丨QQ·B“色字头上一把刀！”深圳富豪结婚33天竟被卷走274万元和名下4套房产。不仅如此，他还被扣上了“接盘侠”的帽子，啥也没干喜当爹。,https://toutiao.com/group/7450399558821052982/,,0,0,False
特朗普放出一张图，全世界倒吸一口凉气,2024-12-24 23:36,7160,4659,牛弹琴,鸣金网,特朗普放出一张图，全世界倒吸一口凉气。一张特朗普网购的图。这张图，先是他的儿子埃里克·特朗普贴出来。图右边，特朗普在认真看手机；图左边，手机上显示的是一张购物单，菜篮里有三项货物。第一项，加拿大。第二项，格陵兰岛。第三项，巴拿马运河。标题是：我们回来了。,https://toutiao.com/group/7452121977394971162/,,0,0,False
益生菌真的那么神奇吗？有关益生菌的几个误区 你“踩雷”了吗？,2024-12-07 02:35,1813,106,央视频,央视频,,https://toutiao.com/group/7445492942887715365/,,0,0,True
马光远：大城市才有机会的观点过时了 #财经大咖来了,2024-12-17 06:00,7419,550,光远看经济,光远看经济,,https://toutiao.com/group/7449256659496469027/,,0,0,True
笑得肚子疼夫妻搞笑对话，一个我都对付不了，还想三妻四妾,2024-12-20 23:56,6392,223,悠悠情感正能量,悠悠情感正能量,,https://toutiao.com/group/7450647187001705011/,,0,0,True
“喝酒三巨头”：一年全没，有的去世当天喝4瓶白酒，都不满36岁,2024-11-05 10:32,2926,1651,睿之悦,睿之悦,他们的每一次出现都离不开酒，也曾是很多人眼中的“酒中豪杰”。但“小酌怡情，大饮伤身”，这三位博主以生命为代价，再一次给大家带来了警醒。,https://toutiao.com/group/7433739040179520038/,,0,0,False
海南富商张晖：花8亿建108米海上观音像，4年后死在水中死因成谜,2024-10-19 04:49,3965,668,八号探秘人,八号探秘人,在阅读此文之前，辛苦您点击一下“关注”，既方便您进行讨论和分享，又能给您带来不一样的参与感，感谢您的支持！编辑丨xk他是中国的一名富商，耗费8亿元完成了自己的梦想。可梦想落地成为现实的时候，他却在4年后莫名其妙的死去。他就是张晖，上个世纪末海南岛旅游业的龙头当家人。,https://toutiao.com/group/7427288913095492134/,,0,0,False
问政山东态度最嚣张的领导,2024-12-23 04:54,739,239,优雅山雀,优雅山雀,,https://toutiao.com/group/7451466182034457100/,,0,0,True
第十四届全国人民代表大会常务委员会代表资格审查委员会关于个别代表的代表资格的报告,2024-12-25 12:35,13676,2273,环球网,环球网,全国人民代表大会常务委员会:由黑龙江省选出的第十四届全国人民代表大会代表，黑龙江省卫生健康委员会原党组书记魏新刚，因涉嫌严重违纪违法，2024年10月31日，黑龙江省第十四届人大常委会第十八次会议决定罢免魏新刚的第十四届全国人民代表大会代表职务。,https://toutiao.com/group/7452326851843785266/,,0,0,False
男子从老婆手中里解救出小三后，牵着狗头也不回的离开了,2024-11-20 09:07,36450,12806,橙橙分享,橙橙分享,,https://toutiao.com/group/7439285557244461606/,,0,0,True
朝鲜军人在库尔斯克死战，多人拒不投降，拉响手榴弹炸死自己,2024-12-23 03:51,11137,3239,国力说,国力说,,https://toutiao.com/group/7451449878200189440/,,0,0,True
新《射雕》黄蓉一上线，观众坐不住了，这颜值欧阳克能一见钟情？,2024-12-24 09:35,409,945,云梦说娱,云梦说娱,离过年还有一段时间呢，现在春节档的电影就开始神仙打架了，其实，今年的春节档，我们能看见很多老熟人啊！首先就是陪伴了观众很久的“唐探系列”，不过，之前只到唐探3，现在直接出来了一个《唐探1900》，直接穿越回了民国时。,https://toutiao.com/group/7451882093758251520/,,0,0,False
印度终于想明白了！,2024-12-19 15:23,6093,115,胡锡进,胡锡进,中方特别代表、中共中央政治局委员、中央外办主任王毅同印方特别代表、国家安全顾问多瓦尔根据两国领导人喀山会晤重要共识，本着积极和建设性态度，就中印边界问题进行实质性讨论并达成6点共识。,https://toutiao.com/group/7450143589876630067/,,0,0,False
王小玮一个人弹奏西游记片头曲《云宫迅音》双排键充当整个乐团,2024-11-27 23:55,154575,23893,荔枝纪实,荔枝纪实,,https://toutiao.com/group/7442111924944241192/,,0,0,True
县长看不上乡长送的烟，给他退回来，乡长打开一看乐了,2024-11-13 08:16,10563,1755,乐视大综艺咖,乐视大综艺咖,,https://toutiao.com/group/7436672568578277925/,,0,0,True
河南警察3岁女儿被拐，苦寻全国23年无果，结果却发现女儿在对门,2024-11-05 07:43,5468,622,八号探秘人,八号探秘人,寻亲23年无果，丢失的女儿竟住在对门?但它却真实发生在河南洛阳的梁绍波身上。是意外走丢，还是人贩子所为，三岁的女儿怎会离奇失踪?,https://toutiao.com/group/7433697108120142345/,,0,0,False
中国突然曝光超级武器，关键时刻终于给了美国狠狠一刀！,2024-12-24 22:00,7263,365,占豪,占豪,为啥这种高超音武器只有中国有呢？大国对抗到了关键时刻靠的是什么？,https://toutiao.com/group/7451895133989503488/,,0,0,True
"明道带王鸥见家长，王鸥脸红不敢进，明道忽悠,直接叫爸妈丨相爱",2024-12-24 03:21,2077,450,乐视天天剧好看,乐视天天剧好看,,https://toutiao.com/group/7451811744126599695/,,0,0,True
