title,publish_time,like_count,comment_count,media_name,source,abstract,article_url,tag,is_yaowen,article_sub_type,has_video
表面是艺人，实际是富家千金的5位女星，无人敢惹更别说潜规则了,2024-08-28 02:06,8834,685,八号探秘人,八号探秘人,在德云班主郭德纲的作品中，有过这么一句话。虽说此言尤为刺耳，但话糙理不糙。当今娱乐圈，很多女星为出人头地，自愿或被迫做出违反道德底线之事。,https://toutiao.com/group/7407984985224872459/,,0,0,False
2013年，湖南26岁女孩嫁给71岁老头，婚后还生下一子，如今怎样了,2024-07-12 11:59,26238,2401,智史通鉴,智史通鉴,2013年4月17日，长沙宁乡县的民政局迎来了一对特殊的夫妻。一个71岁的老头和一个26岁的女孩，离远了看，甚至像爷爷和孙女。面对工作人员异样的眼光，女孩说：“我和他是真心相爱的！”这让人好奇，这对相差45岁的夫妻，他们之间到底有着怎样的爱情故事？,https://toutiao.com/group/7390696631223534120/,,0,0,False
东风41恐惧症在欧美蔓延：外媒坚定认为，先进导弹绝非东风31AG,2024-10-01 14:26,4073,728,南友汇,南友汇,日前以英国《金融时报》，美国《华盛顿时报》为首的欧美国家媒体撰文称，解放军本次试射的洲际导弹绝非是东风31AG，而是解放军现役更先进的东风41洲际导弹。,https://toutiao.com/group/7420812639297520163/,,0,0,False
为啥有人跑农村收“废手机”。收回来干些什么？看完你就明白了,2024-07-18 13:17,20307,509,阿丽观世界,阿丽观世界,,https://toutiao.com/group/7392964301276840459/,,0,0,True
5座车拉6个人被判超员，车主1句话把交警问懵,2024-08-05 20:20,16777,3935,奇妙钢笔pA8JyP,奇妙钢笔pA8JyP,,https://toutiao.com/group/7399752843772559906/,,0,0,True
广东一女子不愿上班常年坐街边，因长得好看被路人投喂：又懒又馋,2024-08-01 22:26,525,318,南方,南方,有时候，我们会遇到那些让人啧啧称奇的故事，不禁让人感慨不已。今天，我们要讨论的故事，发生在广东，以一位名叫小芳的女子为主角。,https://toutiao.com/group/7397063491162538546/,,0,0,False
高速堵车，女司机尿急怎么办？这方法简单粗暴不尴尬，赶快收藏,2024-09-07 22:00,2321,177,小蓓聊车,小蓓聊车,,https://toutiao.com/group/7411813713566499380/,,0,0,True
万万没想到，35岁杨颖兜兜转转干回“老本行”，活成内娱最大笑话,2024-09-16 02:41,242,163,八号探秘人,八号探秘人,“一失足成千古恨”，这句话用在她的身上，显得格外贴切。当别人35岁还在想办法红的时候，她就已经经历了从“嫩模”到“顶流”再到“嫩模”的轮回。,https://toutiao.com/group/7414910623407931923/,,0,0,False
实拍奥运冠军全红婵，在广东湛江的老家，爸妈朴实低调！,2024-07-27 01:33,5431,379,旅行观察记,旅行观察记,,https://toutiao.com/group/7396122678333014580/,,0,0,True
长相太美被导演收入房中，27年同居无名分，63岁因一件事幡然醒悟,2024-08-08 07:54,2439,103,8卦娱,8卦娱,写作不易，文中会有5s广告，观看后可免费阅读全文，精彩值得期待！文|8卦娱“以色侍人，能好几时？”谁能想到《康熙王朝》“后宫”的“是非”，竟从戏里“争斗”到戏外，女演员之间的较量，简直令人别开生面。那么她们之间到底有何恩怨？为什么说“容妃”戏如人生？,https://toutiao.com/group/7400667604068680233/,,0,0,False
国乒5朵金花的家庭：王艺迪体二代，陈梦富二代，王曼昱父亲泪目,2024-08-04 02:03,2463,142,不似少溓游,不似少溓游,想要在国内靠乒乓球打出名堂，仅仅有天赋是完全不够的。因为在中国乒坛，万里挑一的天才遍地都是。以至于有不少人都选择放弃，甚至还有田志希这样为了能打乒乓球而选择归化韩国的球手。,https://toutiao.com/group/7398094722457289266/,,0,0,False
今天才知道！电动车“每天充”和“用完再充”，到底哪个更伤电池,2024-08-27 11:19,7872,1613,鲸探所,鲸探所,“今天到底给车充不充电？”估计大多数人每天回家都会想这个问题，看着自己的电动车电量又多又少的，充不充电也是一件非常难以抉择的事情。那么，电动车到底应该怎样充电呢？是每天都充，还是用完之后再充呢？电动车充电不管是在城市还是农村，电动车其实都是人们出门最常见的交通工具。,https://toutiao.com/group/7407773012533117475/,,0,0,False
一群小小丑，还都是驯兽师？小丑和哑女要崩溃了 #蛋仔派对,2024-08-29 06:24,4463,571,魔鬼鱼秀儿,魔鬼鱼秀儿,,https://toutiao.com/group/7408443574675341862/,,0,0,True
男子与女子在河中嬉戏玩耍，突然连续将女子的头按入水中,2024-09-26 04:40,1131,157,经视看天下,经视看天下,,https://toutiao.com/group/7418807108637819444/,,0,0,True
蛋仔派对：蛋仔雕像被勾走？快拦住蛋贩子！ #蛋仔派对,2024-07-18 10:04,3186,254,游小浪Game,游小浪Game,,https://toutiao.com/group/7392914631112524329/,,0,0,True
要求中国人向世界道歉，被央视开除的阿丘，如今现状太解气,2024-08-19 11:36,1513,387,峰哥正读,峰哥正读,2020年，疫情最严重的时候，这样的一段话悄然出现在了微博上面。一位央视主持人，在这万分艰难的时刻，竟然帮助国外“抹黑”自己的祖国。,https://toutiao.com/group/7404772252874457650/,,0,0,False
梁靖崑再战西蒙高茨，没想到决胜局出现戏剧性一幕，全场都笑疯了,2024-09-10 23:57,2508,279,呼呼体坛,呼呼体坛,,https://toutiao.com/group/7413034555562525210/,,0,0,True
古力娜扎的“坎坷情史”：连续被爆亲密照，男友一个比一个渣,2024-07-23 09:08,2254,543,八号探秘人,八号探秘人,在阅读此文之前，辛苦您点击一下“关注”，既方便您进行讨论和分享，又能给您带来不一样的参与感，感谢您的支持！本文叙述皆有官方信源，为了读者有更好体验，放在了文章后缀！写作不易，文中会有5s广告，观看后点击右上角关闭即可免费阅读全文编辑丨xk入圈十几年，人前清纯，人后疯狂。,https://toutiao.com/group/7394708525111181858/,,0,0,False
初中毕业去当流水线女工，五年后却成为世界冠军，22岁成人生赢家,2024-08-02 10:46,6359,1217,豆莱说,豆莱说,文：豆莱说编辑：豆莱说支持作者，写作不易，文中会有5s广告，观看后可免费阅读全文父母曾设想过子女的千百种可能，只是对于一个走上中专之路的孩子，无非也是毕业，打工，进工厂，养家糊口。,https://toutiao.com/group/7398489613888766475/,,0,0,False
挑战在地铁逃生中只用“金色卓越P90”赚取550万的物资撤离,2024-09-11 08:59,1331,1966,小梦哥,小梦哥,,https://toutiao.com/group/7413307460821189139/,,0,0,True
重大突破！首试成功,2024-09-30 11:08,4835,471,环球时报新媒体,环球时报新媒体,9月26日，随着一声长笛响起，一列万吨级无人驾驶重载列车从国家能源集团朔黄铁路黄骅南站出发，行驶了两个半小时后，顺利到达黄（骅）大（家洼）线东营西站，精准停靠在指定位置。,https://toutiao.com/group/7420391543959192073/,,0,0,True
男人和女人的需求差别这么大？,2024-07-12 11:00,29315,2089,周小鹏,周小鹏,男人和女人的需求差别这么大？,https://toutiao.com/group/7388885573953389092/,,0,0,True
盘点那些采访爆笑瞬间，一个敢问一个敢答，小姐姐都太豪横了,2024-07-11 08:37,45667,2685,开心呱呱笑,开心呱呱笑,盘点那些采访爆笑瞬间，一个敢问一个敢答，小姐姐都太豪横了,https://toutiao.com/group/7390294511139684879/,,0,0,True
公鸡强行霸占了狗窝，小狗狗回家的第一反应，把主人笑得肚子疼！,2024-07-09 14:51,8481,392,维E爱动物,维E爱动物,公鸡强行霸占了狗窝，小狗狗回家的第一反应，把主人笑得肚子疼！,https://toutiao.com/group/7389648897754268170/,,0,0,True
朱镕基晚年视频，回顾当年朱镕基访美，当面给克林顿甩脸色,2024-10-02 17:36,2679,135,老邓谈史,老邓谈史,,https://toutiao.com/group/7421233653143601664/,,0,0,True
一位平凡而又伟大的母亲，带着两个孩子在暴雨中佝偻着卖菜……,2024-08-10 10:20,85196,12575,阿豪与小花,阿豪与小花,她的坚强与淳朴深深的打动了我………,https://toutiao.com/group/7401453750096757259/,,0,0,True
中国游客赴日搭乘日本高铁：竟感到震撼，没成想有这么巨大的差距,2024-08-25 01:07,1383,1139,太森趣旅行,太森趣旅行,,https://toutiao.com/group/7406877537709588992/,,0,0,True
为什么1984年阅兵无法被超越？看到这样的劈枪和脚步就知道了,2024-07-14 05:28,19638,1724,悠闲入口,悠闲入口,,https://toutiao.com/group/7391359236577428007/,,0,0,True
乌克兰媳妇远嫁中国农村，到地方后傻眼了：你们管这叫农村？,2024-08-29 09:19,11940,1556,乌克兰媳妇让娜,乌克兰媳妇让娜,乌克兰媳妇远嫁中国农村，到地方后傻眼了：你们管这叫农村？,https://toutiao.com/group/7408433469161734682/,,0,0,True
写歌30年穷困潦倒，前妻失望选择离婚，谁料51岁靠一首歌一夜成名,2024-08-12 03:37,24354,3867,八号探秘人,八号探秘人,在阅读此文之前，辛苦您点击一下“关注”，既方便您进行讨论和分享，又能给您带来不一样的参与感，感谢您的支持！编辑：LY无数人都想要一个一夜成名的机会，但机会来了也不是每个人都能把握住的。他用了三十年的时间来准备迎接属于自己的机会。为了这个机会他放弃了一切，甚至包括家庭。,https://toutiao.com/group/7402090890367484428/,,0,0,False
为什么大量日本学校建立在中国，原来国家的用意是咱所体会不到的,2024-08-27 22:00,18334,22079,随风起随风落,随风起随风落,为什么大量日本学校建立在中国，原来国家的用意是咱所体会不到的,https://toutiao.com/group/7407695128791351820/,,0,0,True
