title,publish_time,like_count,comment_count,media_name,source,abstract,article_url,tag,is_yaowen,article_sub_type,has_video
“始终把人民放在心上”——习近平总书记春节前夕赴辽宁看望慰问基层干部群众纪实,2025-01-25 23:03,532,299,人民日报,人民日报,腊月二十三，北方小年。一早，习近平总书记乘坐火车一路北上，出山海关，进入辽宁。车窗外天地辽阔。沉淀了红色革命史、辉煌建设史、澎湃改革史的黑土地，来到了新时代东北振兴的新一程，在年轮中编织着希望的锦绣。旧岁的尾声也是新年的序曲，总书记深入人民群众中间。,https://www.peopleapp.com/column/30048111909-500006067876?utm_source=头条号&promote=true,,0,1,False
男人目睹了妻子的偷情，下一秒情夫和妻子就遭到了他的制裁！,2025-01-23 09:05,4456,382,橙子影视吖6,橙子影视吖6,,https://toutiao.com/group/7463034403476734527/,,0,0,True
网友：我老婆昨晚1:37分偷偷出去，早上5:28悄悄回来。,2025-01-21 09:27,3413,2440,观察小羊,观察小羊,网友：我老婆昨晚1:37分偷偷出去，早上5:28悄悄回来。你们说4个小时能去做什么事？,https://toutiao.com/group/7462297825670365731/,,0,0,True
公公竟然和儿媳偷情，哪料被妻子撞见，这下有戏看了！,2025-01-21 08:05,7547,690,南瓜午夜厅,南瓜午夜厅,,https://toutiao.com/group/7462273852651979274/,,0,0,True
来不及：小姨子找姐夫要说法，没想姐夫衣冠禽兽，小姨子都不放过,2025-01-22 18:37,2205,154,乐视激斗影院,乐视激斗影院,,https://toutiao.com/group/7462625291735695923/,,0,0,True
贾玲2025年贺岁片来袭 热辣滚烫后又一力作,2025-01-24 13:40,1188,587,风生水起的源,风生水起的源,,https://toutiao.com/group/7463476417540489763/,,0,0,True
家庭内耗多可怕，变态行为#,2025-01-25 09:17,3439,4628,自若见闻a,自若见闻a,,https://toutiao.com/group/7463779687441908274/,,0,0,True
美团低头认错了，看来没有解决不了的问题！,2025-01-23 11:12,381,398,燕子说说说,燕子说说说,,https://toutiao.com/group/7463066944669827620/,,0,0,True
尼姑终于被小伙打动，如了他愿还了俗，和小伙要甜蜜了,2025-01-12 19:46,1590,451,热剧汇,热剧汇,,https://toutiao.com/group/7458561171075891763/,,0,0,True
出租车司机半路捡个姑娘，直接带回家，老婆一看反应笑翻了,2025-01-14 07:28,4421,252,南瓜钟意你,南瓜钟意你,,https://toutiao.com/group/7459669645180650024/,,0,0,True
