title,publish_time,like_count,comment_count,media_name,source,abstract,article_url,tag,is_yaowen,article_sub_type,has_video
普京回应朝军援俄，释放危险信号，金砖性质恐生变，中国怎么办？,2024-10-25 09:56,20652,2769,邱震海,邱震海,,https://toutiao.com/group/7429649981084828194/,,0,0,True
河南男子昆仑山死亡谷回来后精神失常，临终前说：里面的不是人,2024-10-21 09:58,424,126,微趣史,微趣史,在中国的古代神话中，这里是仙境，是传说中的西王母居住之地。一个河南男子自昆仑山归来后就精神失常，时常自言自语，临终时更是不断重复一句话:里面的不是人。,https://toutiao.com/group/7428165778752520715/,,0,0,False
罕见！100年前，英国游客拍下的清朝乡村，和想象中完全不一样,2024-09-20 02:07,3031,407,万物知识局,万物知识局,泥泞的土路，衣不蔽体的老百姓，即便是达官显贵的家中也十分破败，而这些都是清王朝的历史痕迹，虽说那时候中国摄影技术并不发达，但也有许多外国游客来到这里，拍摄下了许多老照片，为我们留下了珍贵的历史资料，那清朝到底是怎样的面貌呢?,https://toutiao.com/group/7416287738871267855/,,0,0,False
阿斯麦向美国承诺：只要解放军攻台，立刻远程瘫痪台积电光刻机,2024-10-25 14:34,2271,961,司马南,司马南,偶然看到一则信息，阿斯麦公司向美国作出保证，如果中国人民解放军攻打台湾地区，他们便立刻远程瘫痪台积电的光刻机。,https://toutiao.com/group/7429718340911858195/,,0,0,False
余华英，还是死刑！著名法学教授废死派小心脏气炸了,2024-10-25 05:37,4510,1118,司马南,司马南,根据《中华人民共和国刑法》第四十八条的规定，死刑只适用于罪行极其严重的犯罪分子，且除非必须立即执行，否则通常会判处死刑缓期两年执行。,https://toutiao.com/group/7429582470950961727/,,0,0,False
炸萝卜丸子，放面粉和淀粉就错了，教你正确做法，焦香酥脆不吸油,2024-09-28 10:13,16045,597,家常的味道,家常的味道,,https://toutiao.com/group/7419635124758643227/,,0,0,True
今天才知道！电动车“每天充”和“用完再充”，到底哪个更伤电池,2024-08-27 11:19,13433,2264,鲸探所,鲸探所,“今天到底给车充不充电？”估计大多数人每天回家都会想这个问题，看着自己的电动车电量又多又少的，充不充电也是一件非常难以抉择的事情。那么，电动车到底应该怎样充电呢？是每天都充，还是用完之后再充呢？电动车充电不管是在城市还是农村，电动车其实都是人们出门最常见的交通工具。,https://toutiao.com/group/7407773012533117475/,,0,0,False
女儿花500块租男友，没想他是身价过亿的总裁，这下好运了,2024-10-18 09:42,4305,774,乐视娱乐乐透社,乐视娱乐乐透社,,https://toutiao.com/group/7427048858267419190/,,0,0,True
1976年周、朱、毛同一年逝世，临终前，三位伟人都交代了什么话？,2024-09-24 09:46,10638,459,呷谈历史,呷谈历史,1976年是最令人悲伤的一年，那一年三位伟人相继离世，还发生了唐山大地震。三位伟人在离世前都交代了一些事情，这些事情都和之后国家的发展有关系。,https://toutiao.com/group/7418141722196197900/,,0,0,False
民间上坟传统：“上坟不带 5 果，家中不惹灾祸”，哪“5果”？,2024-08-08 10:30,16280,1636,惠农圈,惠农圈,在中国传统文化中，祭祀祖先一直是一项备受重视的活动，它承载着对先人的缅怀、敬意和感恩之情。在上坟的时候，人们会提前准备好供品，比如肉类、酒水，还有水果。其中关于水果的准备，也有着诸多的讲究和禁忌，比如“上坟不带 5 果，家中不惹灾祸”的说法。,https://toutiao.com/group/7400584207141192207/,,0,0,False
小伙送美女回家，怎料俩人感情突然升温，下秒不得了,2024-10-18 16:30,2391,173,乐视独爱真人秀,乐视独爱真人秀,,https://toutiao.com/group/7426997752761942567/,,0,0,True
俗话说：钱不借二、酒不喝三、路不走四！古人的忠告有什么道理？,2024-08-15 00:00,9910,889,致远书香,致远书香,有句话说：“有人的地方，就有江湖。”人在江湖，往往身不由己。关于这方面，其实先辈们早就在生活的点滴中总结出了很多经验和智慧，比如有句话就这么说，讲“钱不借二，酒不喝三，路不走四。”这些劝诫背后，就是人情练达。,https://toutiao.com/group/7403030502673744434/,,0,0,True
土豆搭配洋葱，教你一个神仙吃法，一次3斤不够吃，太解馋了,2024-09-26 09:09,26011,1573,家常的味道,家常的味道,土豆搭配洋葱，教你一个神仙吃法，一次3斤不够吃，太解馋了,https://toutiao.com/group/7418876506660667904/,,0,0,True
给近三年最好的10部年代剧排个名：《人世间》第6，第1名没有争议,2024-09-06 08:08,8257,2761,皮皮电影,皮皮电影,时尚是个轮回，电视剧也是。在2020年之前的那些年，电视剧市场基本上都被偶像剧、都市剧霸占。曾经撑起国剧品质的《闯关东》《岁月》这类年代好剧，难见踪影。,https://toutiao.com/group/7411390030722712090/,,0,0,False
夫妻俩刚领完证异地两个月，终于见面 监控下两人好甜蜜,2024-09-29 04:25,3454,341,直播日照,直播日照,,https://toutiao.com/group/7419916383196021288/,,0,0,True
农村小情侣深夜约会，在屋内过着二人世界，兴奋坏了,2024-10-16 01:14,1359,145,乐视热播综艺精选,乐视热播综艺精选,农村小情侣深夜约会，在屋内过着二人世界，兴奋坏了,https://toutiao.com/group/7426173284741284364/,,0,0,True
怎样在家做的梅菜扣肉会更好吃，大厨教你诀窍，肥而不腻咸香软糯,2024-08-30 09:00,5197,549,天天相见厨房(阿见),天天相见厨房(阿见),,https://toutiao.com/group/7407836908509725219/,,0,0,True
把三个女儿弄去坐牢后，蓝翔校长再送原配入狱，这次被“反杀”了,2024-10-25 00:51,1037,365,客观听書,客观听書,荣兰翔作为蓝翔学校的校长，本应该是人生赢家，却没想到和妻子已经到了反目成仇的地步。她举报丈夫曾经存在巨额的偷税漏税行为，并且长年家暴，甚至在外还有私生子，这则消息一经公布瞬间引发了不小的轰动。,https://toutiao.com/group/7429243688062124563/,,0,0,False
首例5胞胎长大了，父亲已过劳去世 母亲直言：如能重来一个也不要,2024-08-31 03:06,770,185,睿之悦,睿之悦,2002年，在北京的一家妇产医院中，一位来自河北的孕妇顺利生下了两男三女的五胞胎，创造了一个全国罕见的奇迹。,https://toutiao.com/group/7409098624111575603/,,0,0,False
除了戴头盔，12月起，电动车、摩托车、三轮车上路有4个新标准,2024-10-24 07:21,1949,293,新能源战略家,新能源战略家,请您在阅读前，先点击上面的“关注”。感谢您的支持，我们将为您带来更多有价值的内容。随着10月接近尾声， 整个电动车行业也进入今年最后的发展阶段。但事实上，每到年底，全国各地针对电动车市场的整治和检查强度都会迎来直接的提升。,https://toutiao.com/group/7429238621447701004/,,0,0,False
15年前他在爱妻葬礼上哭到昏厥，发誓永不再娶，如今他做到了吗？,2024-08-24 02:17,17033,541,八号探秘人,八号探秘人,在阅读此文之前，辛苦您点击一下“关注”，既方便您进行讨论和分享，又能给您带来不一样的参与感，感谢您的支持！编辑丨xk纵观鱼龙混杂的娱乐圈，有人背叛，有人痴情。而果靖霖则是公认的好男儿，将一生都奉献给妻子。但妻子却仅仅陪他走了半生，没能战胜病魔，不幸离开人世。,https://toutiao.com/group/7406210316734710283/,,0,0,False
3年前，宁夏7岁小女孩一笑走红，后拒百万签约，如今怎么样了？他们后悔了吗？,2024-09-19 07:25,5644,910,睿之悦,睿之悦,2021年，视频镜头中出现的女孩儿用那一抹甜美的笑容，迅速引起了网友们的广泛关注。有媒体公司看到这一机遇，提出愿意用百万巨资与女孩儿签约，然而，女孩儿的父母却坚决拒绝了这一提议。,https://toutiao.com/group/7416250139544879679/,,0,0,False
甘肃副省长赵金云突然被查，官网职务还未撤下,2024-10-25 08:14,2962,4609,大风新闻,大风新闻,25日，据中央纪委国家监委网站消息，甘肃省政府副省长赵金云涉嫌严重职务违法，目前正接受国家监委监察调查。,https://toutiao.com/group/7429623398143181349/,,0,0,False
写歌30年穷困潦倒，前妻失望选择离婚，谁料51岁靠一首歌一夜成名,2024-08-12 03:37,26172,4327,八号探秘人,八号探秘人,在阅读此文之前，辛苦您点击一下“关注”，既方便您进行讨论和分享，又能给您带来不一样的参与感，感谢您的支持！编辑：LY无数人都想要一个一夜成名的机会，但机会来了也不是每个人都能把握住的。他用了三十年的时间来准备迎接属于自己的机会。为了这个机会他放弃了一切，甚至包括家庭。,https://toutiao.com/group/7402090890367484428/,,0,0,False
