title,publish_time,like_count,comment_count,media_name,source,abstract,article_url,tag,is_yaowen,article_sub_type,has_video
学习进行时丨追则能达，持则可圆——习近平主席新年贺词传递信心和力量,2025-01-01 12:59,2706,1189,新华网,新华网,【学习进行时】新年前夕，国家主席习近平发表了二〇二五年新年贺词。“梦虽遥，追则能达;愿虽艰，持则可圆。”,http://my-h5news.app.xinhuanet.com/h5/article.html?articleId=a5d0beb0509d4b1ab33949d36a251f74,,0,0,False
放假调休办法更新、“取消公摊”......2025年1月1日起这些新规开始施行！,2024-12-31 16:31,1610,445,中国发布,中国发布,中国网1月1日讯 延迟退休正式实施，春节、劳动节各增加一天假期，医保药品增加……2025年开年之际，将迎来这些新规——延迟法定退休年龄 逐步提高领取基本养老金最低缴费年限《国务院关于渐进式延迟法定退休年龄的办法》于2025年1月1日起施行。,https://toutiao.com/group/7454582345501278757/,,0,0,False
这是我看过最霸气的李连杰，绝对没有之一，经典看不厌,2024-12-31 13:06,1420,357,南哥硬汉秀,南哥硬汉秀,,https://toutiao.com/group/7454561563307934244/,,0,0,True
刚刚中国又出大招了！美国彻底没主意了（下）,2025-01-02 10:00,5182,273,占豪,占豪,美国的军事主要靠什么立国？为啥美国朝野和媒体都哑巴了？,https://toutiao.com/group/7455158632557052456/,,0,0,True
解冻虾，一定不能用水泡，海边人教我方法，2分钟解冻和鲜活一般,2025-01-02 11:24,2392,630,百变小厨坊,百变小厨坊,解冻虾，一定不能用水泡，海边人教我方法，2分钟解冻和鲜活一般,https://toutiao.com/group/7455277445516624419/,,0,0,True
98岁老郎中教我苹果养生新吃法，每天坚持这样吃，睡眠好，身体棒,2024-12-31 11:43,9499,940,百变小厨坊,百变小厨坊,98岁老郎中教我苹果养生新吃法，每天坚持这样吃，睡眠好，身体棒,https://toutiao.com/group/7454540163725656628/,,0,0,True
清汤面好吃有诀窍，教你面馆30年不外传的秘诀，劲道爽滑汤鲜味美,2024-12-13 13:30,7269,981,百变小厨坊,百变小厨坊,,https://toutiao.com/group/7447888258186347018/,,0,0,True
被央媒怒批，目不识丁，丢人现眼，这几位“文盲”明星凭什么走红,2024-12-30 10:52,4372,1163,与君説,与君説,在阅读此文之前，麻烦您点击一下“关注”，既方便您进行讨论和分享，又能给您带来不一样的参与感，感谢您的支持文、编辑|小娄郭德纲曾说“可以没文凭，但不能没文化”。老郭的这句话在儿子郭麒麟身上体现得淋漓尽致。虽然郭麒麟初中就辍学了，但人家有思想有内涵，是个名副其实的“文化人”。,https://toutiao.com/group/7454151513221661234/,,0,0,False
新婚33天卷走274万4套房，出逃后丈夫跨国追捕，如今下场大快人心,2024-12-20 22:06,5012,264,八号探秘人,八号探秘人,在阅读此文之前，辛苦您点击一下“关注”，既方便您进行讨论和分享，又能给您带来不一样的参与感，感谢您的支持！编辑丨QQ·B“色字头上一把刀！”深圳富豪结婚33天竟被卷走274万元和名下4套房产。不仅如此，他还被扣上了“接盘侠”的帽子，啥也没干喜当爹。,https://toutiao.com/group/7450399558821052982/,,0,0,False
女市长爱上小男友，俩人爱的轰轰烈烈，让女市长感到害怕,2024-12-18 08:13,2104,358,乐视经典热综回放,乐视经典热综回放,,https://toutiao.com/group/7449661362671714850/,,0,0,True
天安门广场2025年元旦升国旗仪式 完整版视频来了,2025-01-01 00:04,13894,1073,小央视频,小央视频,,https://toutiao.com/group/7454731275513889321/,,0,0,True
这是张学良老婆赵四小姐真实样貌，并非演员饰演而是货真价实真品,2024-12-28 11:28,9487,1415,历史伟人,历史伟人,赵四小姐，原名赵一荻，她从十六岁开始她终生陪伴张学良，历经坎坷，赵一荻是富家大小姐，但是在张学良囚禁期间，她选择陪伴软禁中的张学良，后悔过吗?,https://toutiao.com/group/7453422736652698175/,,0,0,False
许家印，突传消息！,2025-01-03 06:41,201,295,海峡网,海峡网,1月2日，天眼查最新信息显示，近日，因未按执行通知书指定的期间履行生效法律文书确定的给付义务，中国恒大集团及许家印被限制高消费，执行法院为广州市中级人民法院。,https://toutiao.com/group/7455575328442810891/,,0,0,False
这场发布会信息量大！国家发改委：对个人消费者购买手机、平板、智能手表手环给予补贴,2025-01-03 03:24,1147,240,每日经济新闻,每日经济新闻,每经编辑：杜宇据央视新闻，今天（1月3日）上午，国务院新闻办公室举行“中国经济高质量发展成效”系列新闻发布会，国家发展改革委有关负责人表示，2025年，要加力扩围实施“两新”政策，更大力度支持“两重”项目。图片来源：中国网有关负责人表示，2025年，将更大力度支持“两重”项目。,http://www.nbd.com.cn/rss/jinri_toutiao/articles/3709153.html,,0,0,False
真小人，拜登,2025-01-01 23:00,22377,3316,高志凯频道,高志凯频道,违背诺言，赦免自己有罪的儿子；搞冷战，给世界留下一堆的战争；为私利，给特朗普挖下无数的坑... 我们如何评价拜登的政治遗产呢？,https://toutiao.com/group/7454839921505731124/,,0,0,True
厨师长教你葱爆肉的做法，步骤详细，葱香浓郁肉片滑嫩下酒又下饭,2024-12-17 08:43,3610,235,阿彬纪实,阿彬纪实,,https://toutiao.com/group/7449298669800522274/,,0,0,True
厨师长教你：“葱爆羊肉”羊肉滑嫩、鲜香不膻,2024-12-27 07:34,3280,603,美食作家王刚,美食作家王刚,厨师长教你：“葱爆羊肉”羊肉滑嫩、鲜香不膻,https://toutiao.com/group/7452991735665263139/,,0,0,True
福建最长寿老人今日出殡，膝下子孙100多人，村干部：老人100多岁还能生活自理,2025-01-03 02:54,4443,1778,九派新闻,九派新闻,福建最年长的老人林蛇母于1月1日凌晨在家中去世。林蛇母生于1902年6月18日，福建漳州龙海区海澄镇溪北村人，享年123岁。1月2日，九派新闻联系上溪北村村民委员会一位村干部。他说，他曾多次去林蛇母老人家中看望慰问。,http://feed.huiwen.co/rssv2/toutiaohao_article_ttjpnews_9fc19a1f956448fb9826b9fcb4695509/item/IL1D0KXAMW5XFC1.html,,0,0,False
刘强东1月8日又要给老家村民发钱了，60岁以上每人10000元，村民：已经接到通知,2025-01-03 02:49,1117,539,极目新闻,极目新闻,极目新闻记者 余渊近日，有消息称，2025年春节京东集团董事会主席刘强东将再次给老家江苏宿迁光明村村民发现金，1月3日，光明村一位村民告诉极目新闻记者，前几天他们已经接到了村委会的通知，60岁以上老人会发一万元钱，具体的发放时间是1月8日。,http://jms.ctdsb.net/jmythshare/#/index_share?cId=0&contentType=5&contentId=2343406,,0,0,False
今年会举行阅兵仪式吗？我大胆作个猜测,2025-01-03 09:11,7721,902,金灿荣教授,金灿荣教授,,https://toutiao.com/group/7455614288229728803/,,0,0,True
厨师长教你：“家常肘子”口感耙糯 软烂入味 肥而不腻,2025-01-02 09:00,1468,207,美食作家王刚,美食作家王刚,厨师长教你：“家常肘子”口感耙糯 软烂入味 肥而不腻,https://toutiao.com/group/7455138904249893416/,,0,0,True
再现久违声音！蔡磊借助AI完成了一场演讲,2024-12-31 01:12,13490,1757,央视新闻,央视新闻,“我坚信，我们终有战胜渐冻症的那一天。”在《AI奇妙夜》晚会现场，渐冻人蔡磊借助AI完成了一场演讲，重获新“声”！,https://toutiao.com/group/7454377687977722422/,,0,0,True
距张扣扣案已经六年了，张扣扣的部队班长，曾去探望过他的老父亲,2025-01-02 07:53,2081,109,孔甲丙,孔甲丙,转眼间，距离轰动社会一时的张扣扣春节杀人案已经过去六年了，在这六年中，网民们渐渐淡忘了案件的来龙去脉，遗忘了当事人们的恩怨情仇。,https://toutiao.com/group/7455222100240925218/,,0,0,False
相爱37年零绯闻，丁勇岱对赵雪华一见钟情，如今却对儿子很失望,2024-11-09 21:43,3381,303,八号探秘人,八号探秘人,在阅读此文之前，辛苦您点击一下“关注”，既方便您进行讨论和分享，又能给您带来不一样的参与感，感谢您的支持！编辑丨xk1985年，丁勇岱转过楼梯拐角，撞到人生挚爱，这一下把他撞“开窍”了。那时他还不是《末路》里的白宝山。也不是《跨过鸭绿江》里的彭老总，更不是《人世间》里的周志刚。,https://toutiao.com/group/7435160230918406707/,,0,0,False
多地宣布解禁烟花爆竹，央视发声“别一刀切”，网友欢呼年味回归,2025-01-02 11:11,1101,2094,峰哥正读,峰哥正读,全国范围内的烟花爆竹禁止令开始于2015年，在2018年达到了高峰。也就说，在过去的近10年的时间里，我们都未能在过年的时候畅快地玩过烟花了。,https://toutiao.com/group/7455138905734529570/,,0,0,False
美妇约见老情人，见面场景真是太逗了，这俩人绝配！,2024-10-27 16:25,5175,637,乐视明星的那点事,乐视明星的那点事,美妇约见老情人，见面场景真是太逗了，这俩人绝配！,https://toutiao.com/group/7428157095108674088/,,0,0,True
河南警察3岁女儿被拐，苦寻全国23年无果，结果却发现女儿在对门,2024-11-05 07:43,6162,656,八号探秘人,八号探秘人,寻亲23年无果，丢失的女儿竟住在对门?但它却真实发生在河南洛阳的梁绍波身上。是意外走丢，还是人贩子所为，三岁的女儿怎会离奇失踪?,https://toutiao.com/group/7433697108120142345/,,0,0,False
韩国又一次创造了历史,2024-12-28 04:21,4470,187,牛弹琴,牛弹琴,韩国又创造了历史，更精彩的还在后面,https://toutiao.com/group/7453313008731685411/,,0,0,True
