title,publish_time,like_count,comment_count,media_name,source,abstract,article_url,tag,is_yaowen,article_sub_type,has_video
哪一刻 硬控了你的2024？,2024-12-24 09:01,1840,915,央视新闻,央视新闻,哪个时刻，硬控你的2024？是热辣滚烫的浪潮来临，还是充满passion的圆梦奥运；是飞天浪漫的星光熠熠，还是每一步都算数的踏实底气。无论哪一刻，都凭实力硬控你的2024！,https://content-static.cctvnews.cctv.com/snow-book/index.html?item_id=1119859611919555747&source=50006&sub_source=50006_001,,0,0,False
小品：杨帆演小沈阳，撒贝宁演赵本山，台词功底太强了吧,2024-11-23 06:13,6663,135,PP宫斗放映厅,PP宫斗放映厅,,https://toutiao.com/group/7440353912709710386/,,0,0,True
中央定调2025年养老金上涨，计算公式，企退人员能涨7%以上吗？,2024-12-18 04:29,2910,421,社保当家,社保当家,中央定调2025年养老金上涨，计算公式，企业退休人员能涨7%以上吗？在2025年到来之际，养老金上涨的消息就早早地确定了，这无疑给广大退休人员吃上了定心丸。因为根据近期召开的中央经济工作会议，已经明确提出要适当提高退休人员的基本养老金待遇。,https://toutiao.com/group/7447756391172833827/,,0,0,False
新婚33天卷走274万4套房，出逃后丈夫跨国追捕，如今下场大快人心,2024-12-20 22:06,2992,177,八号探秘人,八号探秘人,在阅读此文之前，辛苦您点击一下“关注”，既方便您进行讨论和分享，又能给您带来不一样的参与感，感谢您的支持！编辑丨QQ·B“色字头上一把刀！”深圳富豪结婚33天竟被卷走274万元和名下4套房产。不仅如此，他还被扣上了“接盘侠”的帽子，啥也没干喜当爹。,https://toutiao.com/group/7450399558821052982/,,0,0,False
如何看待美国出台的《2024中国军力报告》？,2024-12-23 05:18,20159,1109,大刘说说,大刘说说,美国国防部最近出台了2024中国军力报告，今年我们来聊聊西方世界是如何看待中国的军力发展的,https://toutiao.com/group/7451472335464301096/,,0,0,True
想吃零食别出去买，家里有苹果鸡蛋就能做，外酥里软比买的还好吃,2024-12-10 13:36,3622,281,小寒厨艺,小寒厨艺,想吃零食别出去买，家里有苹果鸡蛋就能做，外酥里软比买的还好吃,https://toutiao.com/group/7446704956704293402/,,0,0,True
经济下行，家庭存款“6个”等级曝光，快来看看你在哪一层？,2024-11-22 15:08,1064,109,水大叔,水大叔,众所周知，当前经济情况并不是很好，以至于很多人都发出了埋怨，觉得现在的钱越来越难赚，生活压力更是巨大。,https://toutiao.com/group/7440112237383074345/,,0,0,False
小伙去看病，没想女医生是自己前任，下秒对话太逗了,2024-12-08 07:38,5275,1181,南瓜说异,南瓜说异,,https://toutiao.com/group/7445939678059954740/,,0,0,True
全球最大电磁弹射无人机航母，两栖攻击舰 076即将下水,2024-12-22 09:48,26644,1216,杜文龙,杜文龙,,https://toutiao.com/group/7451170777983877632/,,0,0,True
萝卜和鸡蛋这样做，比吃补药还补，顿顿吃都不会腻，又香又下饭,2024-10-30 12:28,68273,4193,小寒厨艺,小寒厨艺,萝卜和鸡蛋这样做，比吃补药还补，顿顿吃都不会腻，又香又下饭,https://toutiao.com/group/7431405463378919975/,,0,0,True
县长看不上乡长送的烟，给他退回来，乡长打开一看乐了,2024-11-13 08:16,10383,1722,乐视大综艺咖,乐视大综艺咖,,https://toutiao.com/group/7436672568578277925/,,0,0,True
给《我是刑警》演技最好10位演员排座次：于和伟第3，第1名没争议,2024-12-18 04:06,2157,392,皮皮电影,皮皮电影,《我是刑警》收官之际，网上的争议，却也多了不少。有人盛赞它是“近10年最硬核刑侦剧”，老派纪实的剧作风格，令人着迷。受其影响，很多观众开始追起了二十多年前的《中国刑侦1号案》《12·1枪杀大案》。有人评价它“高开低走”。,https://toutiao.com/group/7449562650628866595/,,0,0,False
河南警察3岁女儿被拐，苦寻全国23年无果，结果却发现女儿在对门,2024-11-05 07:43,5322,605,八号探秘人,八号探秘人,寻亲23年无果，丢失的女儿竟住在对门?但它却真实发生在河南洛阳的梁绍波身上。是意外走丢，还是人贩子所为，三岁的女儿怎会离奇失踪?,https://toutiao.com/group/7433697108120142345/,,0,0,False
财政部：2025年要提高城乡居民基础养老金,2024-12-24 04:17,4269,9808,央视新闻,央视新闻,12月23至24日，全国财政工作会议在北京召开。会议强调，2025年要重点做好六方面工作。一是支持扩大国内需求。适当提高退休人员基本养老金，提高城乡居民基础养老金，提高城乡居民医保财政补助标准，大力提振消费。,https://content-static.cctvnews.cctv.com/snow-book/index.html?item_id=4907883216418251291&source=50006&sub_source=50006_001,,0,1,False
面粉这个做法绝了，比包子馅饼好吃，有菜有肉，1周可以吃好几次,2024-11-21 13:06,4748,564,小寒厨艺,小寒厨艺,面粉这个做法绝了，比包子馅饼好吃，有菜有肉，1周可以吃好几次,https://toutiao.com/group/7439718337031963171/,,0,0,True
广西49岁老汉娶19岁姑娘，结婚21年生下15个孩子，如今有何下场？,2024-10-20 08:32,8739,1098,艺述史,艺述史,她19岁出嫁，21年里总共生育了15个孩子，其中4个男孩子11个女孩子，家里热闹的像是开了一所学校一样。,https://toutiao.com/group/7427400319418384948/,,0,0,False
毛人凤下令带走死囚，哪料死囚的靠山露面了，毛人凤当场懵了,2024-11-25 03:05,13724,2433,南哥硬汉秀,南哥硬汉秀,,https://toutiao.com/group/7441047753771188799/,,0,0,True
11年狂赚200亿，骗了10万中国人后跑路的亿万富翁，下场如何呢？,2024-09-26 09:05,5108,1557,八号探秘人,八号探秘人,盘继彪，一个狂妄自大的骗子，11年间骗走200亿，把十几万中国人坑得是血本无归家破人亡。不仅如此，他还在跑路之前，杀人诛心的在他们公司官网发布了一条“我们跑路了“的公告，嘲讽受害者。,https://toutiao.com/group/7418792738887729704/,,0,0,False
包厢全是刚出狱的恶霸，结果一看到饭店主厨，立马怂了,2024-11-11 01:21,13759,377,乐视群星访谈秀,乐视群星访谈秀,,https://toutiao.com/group/7435825833048015400/,,0,0,True
中国又躺枪了,2024-12-21 06:24,4456,134,牛弹琴,牛弹琴,特朗普对欧盟发飙，欧盟却有神操作,https://toutiao.com/group/7450747182111523380/,,0,0,True
全球最大电磁弹射无人机航母即将下水，三项第一中国创造,2024-12-22 09:54,5066,429,杜文龙,杜文龙,据崇明海事局包括相关消息明确，我们全球最大的两栖攻击舰076要下水了，而且从目前大家发布的消息和关注的点去看，第一是排水量5万吨，与美国目前的“美国”号大致持平，而且略有超出，如果从排水量去分析，它已经超出了美国目前最大的两栖作战舰艇，所以从排水量看，那“准航母”、“小航母”包括这些符号都可以贴上标签，非常明确。,https://toutiao.com/group/7451172319415829018/,,0,0,False
接班人有望：普京提拔27岁战斗英雄进政府高层，军功爵制复活了？,2024-12-19 08:50,3169,119,军武次位面,军武次位面,最近，俄罗斯执政党，也就是普京和梅德韦杰夫所在的党派俄罗斯统一党召开了第22届全国代表大会，会议期间完成了一些重要中央委员的任免。,https://toutiao.com/group/7449980789560705570/,,0,0,False
炖鸡肉不要焯水和直接下锅，教你一招，鸡肉鲜香滑嫩不腥不柴,2024-12-15 08:45,4625,227,家常的味道,家常的味道,炖鸡肉千万不要焯水和直接下锅，教你秒招，鸡肉鲜香滑嫩不腥不柴,https://toutiao.com/group/7448556944597451275/,,0,0,True
才发现，原来保存小葱这么简单，放1年都不坏，依然和新鲜一样,2024-12-16 14:40,895,206,明玥美食,明玥美食,,https://toutiao.com/group/7449019538600886795/,,0,0,True
俄罗斯的决心很大，俄乌冲突可能到了最危险的时刻,2024-12-20 11:34,9062,614,金灿荣教授,金灿荣教授,,https://toutiao.com/group/7450456114459574820/,,0,0,True
海一天，不靠当领导的父亲，46岁才走红，娶二婚妻子待继子如亲生,2024-12-19 06:54,1808,443,豆莱说,豆莱说,文：豆莱说编辑：豆莱说在娱乐圈中，不乏有很多星二代，他们一出生便含着金汤匙，什么不用做就已经到达了普通人努力一辈子都到达不了的罗马。但是海一天却是一个例外，他从不靠着家里的关系，凭借着自己的努力进入演艺圈，可是却一直籍籍无名，直到46岁才走红，可算是真正的大器晚成。,https://toutiao.com/group/7450010154218668553/,,0,0,False
彻底凉凉，全部封号！你可能还点过赞,2024-12-22 13:35,806,433,直播日照,直播日照,外卖员送餐时被提各种无理要求被各种刁难看到这样的短视频很多人都会关注也会同情外卖员的遭遇但是这样的内容都是真的吗？“外卖员受刁难”？三个月发数十条视频播放超千万一个账号叫“众包仔小王”，不到三个月的时间共发布了71个作品，总获点赞39万余次，总播放量超千万，转发量超10万。,https://www.rzw.com.cn/redian/2024-12-22/0Hh1oeGhnnLJmna8.html,,0,0,False
海南富商张晖：花8亿建108米海上观音像，4年后死在水中死因成谜,2024-10-19 04:49,3882,657,八号探秘人,八号探秘人,在阅读此文之前，辛苦您点击一下“关注”，既方便您进行讨论和分享，又能给您带来不一样的参与感，感谢您的支持！编辑丨xk他是中国的一名富商，耗费8亿元完成了自己的梦想。可梦想落地成为现实的时候，他却在4年后莫名其妙的死去。他就是张晖，上个世纪末海南岛旅游业的龙头当家人。,https://toutiao.com/group/7427288913095492134/,,0,0,False
清华才女李一诺：27岁博士毕业，4年生3娃，能替世界首富花钱,2024-12-18 05:51,4736,279,云莳一,云莳一,家庭是她第一个学校，妈妈是她第一任老师。李一诺27岁博士毕业进入美国麦肯锡公司，33岁成为公司全球董事合伙人，之后四年连生3娃。,https://toutiao.com/group/7449591069311779355/,,0,0,False
丈母娘觉得女婿没本事，谁料去他单位一看，被女婿官威吓傻,2024-11-25 02:07,1359,305,南瓜最前线,南瓜最前线,,https://toutiao.com/group/7441032711340294696/,,0,0,True
郭有才：当迷失方向忘记初心后，曾经飘得多高，如今摔得就多惨,2024-11-11 06:53,2033,859,八号探秘人,八号探秘人,在阅读此文之前，辛苦您点击一下“关注”，既方便您进行讨论和分享，又能给您带来不一样的参与感，感谢您的支持！编辑丨brt因为一首翻唱，他一夜之间成为了拥有千万粉丝的网红。但是“人红是非多”，不久他就因为版权等问题陷入了舆论风波。他的人气一落千丈，从万众瞩目变成了现在的无人问津。,https://toutiao.com/group/7435901170239078948/,,0,0,False
炸肉丸子，到底用淀粉还是面粉，教你一招，外酥里软超好吃,2024-10-01 09:23,7207,565,家常的味道,家常的味道,,https://toutiao.com/group/7420735473208787492/,,0,0,True
画家李壮平让女儿当人体模特，创30余幅画作，获奖无数却争议不断,2024-12-22 10:10,475,105,晓娱海棠,晓娱海棠,可作为画家的李壮平，竟然直接让自己的女儿当起了免费的“人体模特”。其实在艺术界，不少画家都会用自己的妻子当做模特。,https://toutiao.com/group/7451169406673109539/,,0,0,False
骑行川西顺利翻越雪山，天黑找到废弃小屋过夜，生火炒个拿手菜吃,2024-11-29 04:00,33036,6412,刘伟元的旅行,刘伟元的旅行,,https://toutiao.com/group/7442383622130106914/,,0,0,True
马桶冲水无力没有吸力？一般都是这4个原因，大部分自己就能解决,2024-12-08 11:33,1369,136,阿兵电器维修,阿兵电器维修,马桶冲水无力没有吸力？很简单，一般都是这4个原因，大部分自己就能解决,https://toutiao.com/group/7446002675537150491/,,0,0,True
