title,publish_time,like_count,comment_count,media_name,source,abstract,article_url,tag,is_yaowen,article_sub_type,has_video
王志文找江珊复婚，看两人对话简直太享受，不愧是老戏骨啊,2024-11-30 19:30,6907,751,娱快很简单,娱快很简单,,https://toutiao.com/group/7441487197062201893/,,0,0,True
震惊！中国巨星在法国电视节目中公开辱华！！！,2025-02-05 16:53,3413,527,优雅糯米onO,优雅糯米onO,,https://toutiao.com/group/7467979094177759795/,,0,0,True
中共中央国务院，关于养老问题指示,2025-02-06 03:40,2926,527,梅姐畅谈,梅姐畅谈,,https://toutiao.com/group/7468145623473160756/,,0,0,True
范伟相声《五几年》内容比卖拐还精彩？可不能错过，太搞笑了,2025-01-26 02:23,5948,422,月色说,月色说,,https://toutiao.com/group/7464043921111286310/,,0,0,True
文科无用？全球文科倒闭潮来了，我对文科生说点掏心窝子的话,2025-02-05 10:00,7282,1021,金灿荣教授,金灿荣教授,,https://toutiao.com/group/7467810868287062554/,,0,0,True
华为200万年薪都留不住他！天才少年彭志辉离职后，现状曝光,2025-01-16 09:28,6198,892,与君説,与君説,在阅读此文之前，麻烦您点击一下“关注”，既方便您进行讨论和分享，又能给您带来不一样的参与感，感谢您的支持文、编辑|小娄你敢相信吗？大厂华为200万年薪的工作，竟然也有人不屑一顾。入职华为两年后，彭志辉毅然决然选择离职。,https://toutiao.com/group/7460439446131884579/,,0,0,False
年轻小伙出轨60岁老太，妻子当场崩溃…,2025-02-04 23:50,2192,584,温暖剧情,温暖剧情,,https://toutiao.com/group/7467715297085112886/,,0,0,True
民间小调：三个儿媳妇水淹不正经老公公2,2025-02-05 00:24,1227,102,Hello苏洛柠,Hello苏洛柠,,https://toutiao.com/group/7467724174300856859/,,0,0,True
特朗普新任命国务次卿说，美国可同意中国大陆接管台湾做利益交换,2025-02-06 04:32,15415,947,邱毅台湾,邱毅台湾,,https://toutiao.com/group/7468159107111977507/,,0,0,True
婆婆瞧不起农村儿媳，如今一看孙女乐坏了，赶紧接回豪宅,2025-01-28 16:00,2832,684,PP科幻物语剧院,PP科幻物语剧院,,https://toutiao.com/group/7462680837016781350/,,0,0,True
公公竟然和儿媳偷情，哪料被妻子撞见，这下有戏看了！,2025-01-21 08:05,11628,960,南瓜午夜厅,南瓜午夜厅,,https://toutiao.com/group/7462273852651979274/,,0,0,True
