title,publish_time,like_count,comment_count,media_name,source,abstract,article_url,tag,is_yaowen,article_sub_type,has_video
机场偶遇素颜的杨幂，发顶稀疏瘪嘴凹脸，治好了我们的容貌焦虑 ​​,2025-04-07 15:26,293,205,君子兰姐,君子兰姐,,https://toutiao.com/group/7490592126166663734/,,0,0,False
中国第一大车企即将诞生，规模将超过比亚迪,2025-04-07 09:41,704,619,日新社之夜行少年,日新社之夜行少年,以 2024 年为例，长安汽车总销量达 268.3 万辆，东风汽车集团总销量为 248 万辆，一汽集团总销量 320 万辆，三家之和超过 800 万辆。,https://toutiao.com/group/7490503964111258139/,,0,0,False
CCTV13新闻，刚刚，中国政府发表严正立场！,2025-04-09 08:03,559,101,一念永恒,一念永恒,,https://toutiao.com/group/7491220870791283241/,,0,0,True
中共中央、国务院印发重磅规划！,2025-04-09 02:19,3067,388,人民论坛网,人民论坛网,中共中央、国务院近日印发《加快建设农业强国规划》，亮出了当前和未来一个时期加快建设农业强国的路线图和施工图。,https://toutiao.com/group/7491131974501925411/,,0,0,False
实事求是，吴燕妮这身材没话说，好过90%的人，就是性格太高调了,2025-04-09 02:03,289,264,娱乐的天空,娱乐的天空,,https://toutiao.com/group/7491127580993634828/,,0,0,False
张召忠：美国就算一动不动，中国20年也追不上，中美差距那么大？,2025-04-01 07:18,8744,877,风云史迹,风云史迹,就连张召忠教授，在谈及中美军事实力时，也曾表示:“如果美国躺在原地不动的话，那么中国可能再需要20年的时间才能够追赶上美国。”,https://toutiao.com/group/7488240234958733824/,,0,0,False
