title,publish_time,like_count,comment_count,media_name,source,abstract,article_url,tag,is_yaowen,article_sub_type,has_video
67岁执意生娃，如今却坐轮椅无法自理，5岁的天赐被迫独立学洗衣,2024-11-04 10:32,1713,536,睿之悦,睿之悦,2019年，已经67岁的田新菊执意生下了自己的第三个孩子小天赐。那么，现如今5年的时间过去了，这“天赐”的礼物到底是福还是祸呢?,https://toutiao.com/group/7433367394946384435/,,0,0,False
善恶终有报：疫情时对中国一毛不拔，却大方捐美国6亿，如今咋样,2024-09-29 05:50,994,129,睿之悦,睿之悦,可就是这样一位在中国土生土长起来的富豪，在疫情期间面对同胞的困境却一毛不拔，反而大方的捐助了6亿给美国。,https://toutiao.com/group/7419859345154015798/,,0,0,False
特朗普的新孤立主义启动，泽连斯基、尹锡悦、赖清德都瑟瑟发抖了,2024-11-07 06:48,55791,2572,邱毅台湾,邱毅台湾,,https://toutiao.com/group/7434425551684633100/,,0,0,True
致39人遇难 独家视频还原江西新余特别重大火灾事故经过,2024-11-08 01:32,5183,4388,央视新闻,央视新闻,夺命大火多由当事人无视安全、各防控环节失守导致。今年1月发生在江西新余佳乐苑临街店铺的火灾事故造成39人死亡，9人受伤。记者跟随国务院事故调查组在调查过程中独家获取了事发现场的视频，通过影像分析还原了这起重特大火灾事故发生的经过。,https://content-static.cctvnews.cctv.com/snow-book/index.html?item_id=16465285911340557735&source=50006&sub_source=50006_001,,0,1,False
他于7日在北京逝世，享年73岁,2024-11-08 04:35,3494,189,大皖新闻,大皖新闻,澎湃新闻记者从中国农业科学院农业信息研究所方面获悉，著名养猪专家、农牧企业家、社会活动家，正大集团农牧企业(中国)副董事长、国家生物饲料工程中心首席战略官、中国猪业高层交流论坛荣誉会长姚民仆，因病医治无效，于2024年11月7日在北京逝世，享年73岁。,http://www.ahwang.cn/toutiao/202411/2770144.html,,0,1,False
特朗普赢了，对中国是好还是坏？(上),2024-11-07 14:53,30120,1674,静思有我,静思有我,,https://toutiao.com/group/7434550628703011391/,,0,0,True
1米3袖珍美女嫁给1米48男孩，婚后丈夫奇迹长高，两人却不欢而散,2024-09-07 02:55,3038,172,睿之悦,睿之悦,杨萍和葛存苗的婚礼 文|睿之悦 编辑|睿之悦2019年，成都的民政局来了两个“10岁小孩”来登记，工作人员以为是玩闹。两个“小孩”拿出身份证让工作人员看，这才明白，原来是两个再也长不高的成年袖珍人情侣。,https://toutiao.com/group/7411713833267364386/,,0,0,False
吃播网红恩克半年吃110只羊，眼神呆滞脸黑成炭，网友求他别吃了,2024-11-04 08:22,683,512,与君説,与君説,在阅读此文之前，麻烦您点击一下“关注”，既方便您进行讨论和分享，又能给您带来不一样的参与感，感谢您的支持文、编辑|是否古人估计都没想到后世子孙通过吃饭就能赚得盆满钵满。短视频的迅速崛起给人们带来了很多生财之道，吃播就是其中一个。,https://toutiao.com/group/7433333039997977107/,,0,0,False
15年前他在爱妻葬礼上哭到昏厥，发誓永不再娶，如今他做到了吗？,2024-08-24 02:17,18822,584,八号探秘人,八号探秘人,在阅读此文之前，辛苦您点击一下“关注”，既方便您进行讨论和分享，又能给您带来不一样的参与感，感谢您的支持！编辑丨xk纵观鱼龙混杂的娱乐圈，有人背叛，有人痴情。而果靖霖则是公认的好男儿，将一生都奉献给妻子。但妻子却仅仅陪他走了半生，没能战胜病魔，不幸离开人世。,https://toutiao.com/group/7406210316734710283/,,0,0,False
罕见！100年前，英国游客拍下的清朝乡村，和想象中完全不一样,2024-09-20 02:07,5128,556,万物知识局,万物知识局,泥泞的土路，衣不蔽体的老百姓，即便是达官显贵的家中也十分破败，而这些都是清王朝的历史痕迹，虽说那时候中国摄影技术并不发达，但也有许多外国游客来到这里，拍摄下了许多老照片，为我们留下了珍贵的历史资料，那清朝到底是怎样的面貌呢?,https://toutiao.com/group/7416287738871267855/,,0,0,False
被拐男子认亲一年后，与家人彻底决裂！,2024-11-05 08:45,2096,1273,环球网,环球网,来源：宁波晚报 近日因寻亲走红的郁豹豹与家人决裂的消息引发关注，冲上热搜。据报道，2023年9月，被拐卖34年的郁豹豹寻亲成功。认亲不到半个月，郁豹豹与两个弟弟开始直播带货。不到两个月，三兄弟逐渐走向分崩离析。令他更无法接受的是，他与母亲也渐生隔阂。,https://3w.huanqiu.com/a/14459a/4K8FGmdmzMW?agt=20,,0,0,False
"万万没想到,53岁“丁克”半辈子的康辉，一生遗憾竟然是一通电话",2024-08-21 22:14,28760,5489,峰哥正读,峰哥正读,在阅读此文之前，麻烦您点击一下“关注”，既方便您进行讨论和分享，又能给您带来不一样的参与感，感谢您的支持！文/编辑：蘑菇百善孝为先。但是到底怎么做才算是“孝”，康辉用了半辈子才明白。央视知名主持人康辉，事业顺遂，家庭幸福，在外人看来是一个人生赢家。,https://toutiao.com/group/7405504703687115273/,,0,0,False
3年前，宁夏7岁小女孩一笑走红，后拒百万签约，如今怎么样了？他们后悔了吗？,2024-09-19 07:25,8526,1231,睿之悦,睿之悦,2021年，视频镜头中出现的女孩儿用那一抹甜美的笑容，迅速引起了网友们的广泛关注。有媒体公司看到这一机遇，提出愿意用百万巨资与女孩儿签约，然而，女孩儿的父母却坚决拒绝了这一提议。,https://toutiao.com/group/7416250139544879679/,,0,0,False
刀郎刘德华与凤飞飞，他们的歌让台湾人真的想回家了！,2024-11-05 22:05,62136,5747,黎建南台湾,黎建南台湾,,https://toutiao.com/group/7433919847295091210/,,0,0,True
特朗普在忙什么？他的新政府许多反华人士入列，中美关系会怎么走,2024-11-08 10:05,11526,677,邱毅台湾,邱毅台湾,,https://toutiao.com/group/7434847402797990452/,,0,0,True
农村啃老现象抬头：富有富啃、穷有穷啃，婚前婚后都啃,2024-11-04 02:05,1944,2724,人民日报,人民日报,半月谈记者调查发现，在部分农村地区，中青年人出现啃老现象。有的打工数年，仍须家里老人贴补；有的为了结婚成家，婚前婚后都让老人“大力支持”；有的婚后子女管不了，还靠老人给抚养费。在乡村全面振兴、城乡不断融合的背景下，农村啃老现象亟须引起重视。,https://www.peopleapp.com/column/30047226123-500005889515?utm_source=头条号&promote=true,,0,1,False
5岁男童被生母及男友殴打致死，伤痕累累面部毁容！孩子姥姥：希望严判女儿,2024-11-08 01:15,433,451,大皖新闻,大皖新闻,5岁儿子被伤害致死已经半年多，对郑光来说，这是压力尤其大的一段时间。因为过度伤心，他整夜睡不着觉，主动要求夜班岗位，就为了能在工作后倒头就睡。他总是暗中告诉自己，要坚持住替孩子讨回公道。近日，威海文登区检方已对“5岁男童被打致死案”提起公诉。,http://www.ahwang.cn/toutiao/202411/2769943.html,,0,1,False
炸萝卜丸子，放面粉和淀粉就错了，教你正确做法，焦香酥脆不吸油,2024-09-28 10:13,22124,940,家常的味道,家常的味道,,https://toutiao.com/group/7419635124758643227/,,0,0,True
美国是一个伪装成国家的公司，老特坏了“道上”的规矩,2024-11-05 15:25,7521,177,金灿荣教授,金灿荣教授,,https://toutiao.com/group/7433708408525718027/,,0,0,True
2024年度最佳华语猛片！绝对真实事件改编，怒斩12项大奖！,2024-10-19 07:09,2726,172,宇哥侃故事,宇哥侃故事,,https://toutiao.com/group/7427380436173357620/,,0,0,True
张继科乒乓球馆开业，没有队友捧场，1个人红墙下拍照,2024-11-05 05:22,884,658,卿羽飞,卿羽飞,阅读文章前辛苦您点下“关注”，方便讨论和分享，为了回馈您的支持，我将每日更新优质内容。文 | 卿羽飞编辑 | 卿羽飞前言乒乓球作为我们国家的国球热度一直非常的高，但是运动员的精力和体力都是有限的，到了一定年龄运动员们都会面临退役。,https://toutiao.com/group/7433650885945623090/,,0,0,False
首例5胞胎长大了，父亲已过劳去世 母亲直言：如能重来一个也不要,2024-08-31 03:06,1724,461,睿之悦,睿之悦,2002年，在北京的一家妇产医院中，一位来自河北的孕妇顺利生下了两男三女的五胞胎，创造了一个全国罕见的奇迹。,https://toutiao.com/group/7409098624111575603/,,0,0,False
“喝酒三巨头”：一年全没，有的去世当天喝4瓶白酒，都不满36岁,2024-11-05 10:32,638,472,睿之悦,睿之悦,他们的每一次出现都离不开酒，也曾是很多人眼中的“酒中豪杰”。但“小酌怡情，大饮伤身”，这三位博主以生命为代价，再一次给大家带来了警醒。,https://toutiao.com/group/7433739040179520038/,,0,0,False
一觉醒来，这个国家惊天巨变,2024-11-05 23:37,4596,363,牛弹琴,牛弹琴,一觉醒来，以色列惊天巨变。很简单，11月5日，世界目光关注美国大选；但在以色列，政坛大地震，总理内塔尼亚胡炒了国防部长加兰特的鱿鱼。要知道，在以色列，总理是第一号实权人物，但国防部长就是第二号实权人物。更别忘了，现在的以色列，还正处于多场战争之中；而且，不排除伊朗会很快发动报复。,https://toutiao.com/group/7433942298620969483/,,0,0,False
特朗普击败哈里斯，最大的输家是谁,2024-11-06 13:56,7807,832,火星方阵,火星方阵,无论谁入主白宫，乌克兰都输了。俄罗斯总统普京打的是消耗战，泽连斯基政府目前的战略是不可持续的。但是，特朗普重返白宫后，乌克兰输得更快更惨。,https://toutiao.com/group/7434164834310849059/,,0,0,True
特朗普隐忍整整4年，上台掌权第一件事，先拿死敌开刀立威？,2024-11-07 03:32,16100,1818,庆彬有理,庆彬有理,特朗普重返白宫，在论功行赏之余，或许还有一件事情要做，那就是对自己的政敌展开全面清算。过去4年，民主党、共和党的建制派，乃至于主流媒体对特朗普在各个领域的围堵，一度让他疲于奔命，甚至还被定下了重罪。,https://toutiao.com/group/7434375201880310324/,,0,0,True
中国16吨无人轰炸机亮相，可携上百巡飞弹，美上将吹牛由中国实现,2024-11-07 15:03,3021,605,东方点兵,东方点兵,国产新型无人轰炸机亮相珠海，打击能力堪称无人机最强，可携带导弹+无人机群，美上将吹嘘概念由中国实现。,https://toutiao.com/group/7434550986519347749/,,0,0,False
