title,publish_time,like_count,comment_count,media_name,source,abstract,article_url,tag,is_yaowen,article_sub_type,has_video
【讲习所·中国与世界】“在风雨洗礼中成长 在历经考验中壮大”,2025-01-17 15:14,961,1472,国际在线,国际在线,2024年是中国实现“十四五”规划目标任务的关键一年，面对世界变乱交织、全球经济低迷等复杂发展形势，这份沉甸甸的“成绩单”令人鼓舞。正如习近平主席所强调的，“我们从来都是在风雨洗礼中成长、在历经考验中壮大，大家要充满信心。”,https://news.cri.cn/toutiaopic/33258194-85fb-c7f7-439b-bd9a784360cf.html,,0,0,False
大姐人在自己家，肾却不翼而飞，医生检查完片子后脸色大变,2025-01-16 01:36,2235,541,娱乐乐透社,娱乐乐透社,,https://toutiao.com/group/7460321089265091111/,,0,0,True
女子带两娃摆摊后续！前老公跳河，二婚被赶出门，今有好消息传来,2025-01-17 02:40,4092,840,那一片雪花啊,那一片雪花啊,2025年伊始，重庆一位带两娃摆摊的28岁女子火了!近日，一位博主走在重庆夜晚的街头，风很凉，不由得让人裹紧了衣服，可接下来博主却看到了令他感到疑惑的一幕!,https://toutiao.com/group/7460655797899379241/,,0,0,False
无视西藏却号召给美国捐款？一场山火，让“崇洋媚外”的他现了形,2025-01-18 01:08,470,215,8卦娱,8卦娱,文|8卦娱本文所有内容皆有官方可靠信息来源，具体资料赘述在文章内部或结尾“Please contribute to the reconstruction of theschool.,https://toutiao.com/group/7461055689570402857/,,0,0,False
排水量12万吨！水泥航母扩建完成：004型航母将是全球最大航母？,2025-01-16 08:20,2929,341,军武次位面,军武次位面,【军武次位面】作者：天狼近年来，中国航母事业步入快车道。从辽宁舰到山东舰，再到福建舰，我国在航母设计与建造上突飞猛进。尤其是“福建舰”首次采用的电磁弹射系统，标志着我国航母技术已经迈向了世界一流水平。,https://toutiao.com/group/7460389225578430986/,,0,0,False
刀郎的歌让日本观察到中国国魂！日开始不“轻”中，开始“轻”美,2025-01-17 22:01,25670,1255,黎建南台湾,黎建南台湾,,https://toutiao.com/group/7461007862559408675/,,0,0,True
上海七旬老人意外离世，留下430万元遗产和一套房无人继承……,2025-01-18 10:07,306,598,极目新闻,极目新闻,七旬老人在家中意外离世，留下430万元的遗产以及一套位于市区的两居室房屋无人继承，在法院判决将部分遗产分给已履行较多扶养义务的堂弟夫妇后，民政部门作为“遗产管理人”，申请认定财产无主。,http://jms.ctdsb.net/jmythshare/#/index_share?cId=0&contentType=5&contentId=2355408,,0,0,False
1月起，部分农民养老金率先上调，居民基础养老金调整地区一览,2025-01-17 23:44,1484,681,思之想之,思之想之,2025年春节将至，养老金是有很多好消息的。国家已经确定2025年退休人员基本养老金和城乡居民基础养老金双双增长，而在春节前，部分农民的养老金已经率先上调，一些地区已经率先提高了居民基础养老金标准，都有哪些地区上调了基础养老金呢？上调了多少钱呢？,https://toutiao.com/group/7460870275706520118/,,0,0,False
​2025年央视春晚第三次联排，36位大咖亮相，全是老熟人，今年稳了,2025-01-18 03:50,1567,812,闻书识焉,闻书识焉,1月18日，央视春晚开始了第三次联排。众多大咖明星亮相，从现场发出的路透来看，全是老熟人。看到这些人，感觉今年的春晚算是稳了。,https://toutiao.com/group/7461091398754845247/,,0,0,False
98岁老郎中教我苹果养生新吃法，每天坚持这样吃，睡眠好，身体棒,2024-12-31 11:43,17459,1761,百变小厨坊,百变小厨坊,98岁老郎中教我苹果养生新吃法，每天坚持这样吃，睡眠好，身体棒,https://toutiao.com/group/7454540163725656628/,,0,0,True
尹锡悦关押在拘留所，还有翻盘机会吗？金建希悠闲遛狗，为什么？,2025-01-17 11:44,10863,335,邱毅台湾,邱毅台湾,,https://toutiao.com/group/7460848869161566772/,,0,0,True
洛杉矶大火对比喀则地震，老天给中美两国应战能力做了实战比较！,2025-01-16 22:01,16615,259,黎建南台湾,黎建南台湾,,https://toutiao.com/group/7460636770216968754/,,0,0,True
