title,publish_time,like_count,comment_count,media_name,source,abstract,article_url,tag,is_yaowen,article_sub_type,has_video
以后想吃回锅肉你就像我这样做，肥而不腻，咸香适口，太解馋了,2024-08-06 11:19,31877,1178,家常的味道,家常的味道,,https://toutiao.com/group/7399984507362738742/,,0,0,True
一巴掌的代价，公交车上大妈打晕患癌小伙，断送退休后的幸福生活,2024-10-14 09:53,965,524,客观听書,客观听書,公交车上老太太和小伙吵了起来，老太太更是当仁不让直接给了小伙一巴掌。这名小伙直接倒地，老大大根本就不会想到正是因为他的一巴掌，鲜活的生命就这样消失在他的手里。,https://toutiao.com/group/7425563455358468627/,,0,0,False
古力娜扎的“坎坷情史”：连续被爆亲密照，男友一个比一个渣,2024-07-23 09:08,2855,757,八号探秘人,八号探秘人,在阅读此文之前，辛苦您点击一下“关注”，既方便您进行讨论和分享，又能给您带来不一样的参与感，感谢您的支持！本文叙述皆有官方信源，为了读者有更好体验，放在了文章后缀！写作不易，文中会有5s广告，观看后点击右上角关闭即可免费阅读全文编辑丨xk入圈十几年，人前清纯，人后疯狂。,https://toutiao.com/group/7394708525111181858/,,0,0,False
西方专家：中国发射东风31AG不可怕，可怕的是另一件事,2024-10-14 00:38,2612,226,大国纪录,大国纪录,今年国庆节前夕，中国人民解放军火箭军发射了一枚洲际弹道导弹，如同是在国际社会，尤其是美西方为主体的欧美国家，投下了一枚重磅炸弹。,https://toutiao.com/group/7425423279743058473/,,0,0,False
半岛局势紧张的肇事者是谁？不是韩国更不是朝鲜，得利者浮出水面,2024-10-18 05:56,10587,817,陈虎点兵,陈虎点兵,,https://toutiao.com/group/7426990598878167567/,,0,0,True
好大的官威！高铁乘务员影响“领导”休息，被警告后不停低头道歉,2024-10-13 16:31,26835,7398,行哥嘚啵嘚,行哥嘚啵嘚,,https://toutiao.com/group/7425298780917858831/,,0,0,True
失散30年双胞胎姐妹合作创业3年后决裂，姐姐：如果再给我一次机会，我选择不认识她,2024-10-19 02:57,619,522,潇湘晨报,潇湘晨报,9月12日下午1时，在登封市嵩阳路上，张丽经营的餐吧还未开始营业，六个月前庆祝开业时摆放的花篮依旧伫立在门口，见证着过往的繁华与今日的宁静。这家看似不起眼的小店，却曾是张丽与其通过网络重逢的双胞胎妹妹程珂珂情感纠葛的舞台，两人在此爆发了激烈的冲突，最终分道扬镳。,http://api.chenshipin.com/wap/a/67131dce842017019d37a6b2/90f456b81afce808c1fcfbd3f5761f65/1729306659/ec68832585b0fdbf907af4a7d73fa9747cf92c8ea541aed751e7400ddd8890db,,0,0,False
安徽美女道士胡小慧被捕：精通“胡媚术”，九名男徒弟揭露其罪行,2024-09-12 08:10,3722,426,艺述史,艺述史,在安徽一处偏僻山头上，有座神秘的道观，外表平平无奇，但里面却有着一位名气很高的美女道士。美女道士的名字叫做胡小慧，据说有着高深的法力，能帮人消灾解难。很多人慕名前来，交上丰厚的香火钱，在袅袅青烟里，试图从这个年轻道士身上获得一些生活的支撑。,https://toutiao.com/group/7413662261274739200/,,0,0,False
给近三年最好的10部年代剧排个名：《人世间》第6，第1名没有争议,2024-09-06 08:08,4183,1515,皮皮电影,皮皮电影,时尚是个轮回，电视剧也是。在2020年之前的那些年，电视剧市场基本上都被偶像剧、都市剧霸占。曾经撑起国剧品质的《闯关东》《岁月》这类年代好剧，难见踪影。,https://toutiao.com/group/7411390030722712090/,,0,0,False
4年骑行结束，1500天终于回到老家，感谢大家一路陪伴有缘江湖见,2024-09-07 03:50,74332,16759,刘伟元的旅行,刘伟元的旅行,4年骑行结束，1500天终于回到老家，感谢大家一路陪伴有缘江湖见！,https://toutiao.com/group/7411715839100977716/,,0,0,True
美国正式通知中国，再次包机遣返中方非法移民，我方迅速表态,2024-10-19 03:03,282,327,议史纪,议史纪,这一现象对于经历过美国繁荣景象的老一辈儿来说十分常见，而步入新纪元后，由于中国国力的不断提升，无论是在经济、政治还是军事方面都有了与美国掰手腕的实力，这使得国人的民族自豪感、国家自信心直线上升。,https://toutiao.com/group/7427315454085055016/,,0,0,False
报复来了！辛瓦尔死后不到48小时，内塔尼亚胡住所遭袭差点被斩首,2024-10-19 09:51,968,417,兵说,兵说,报复来了！谁也没想到，中东抵抗势力对以色列的报复会来得这么快，这么狠，辛瓦尔死后才不到48小时的时间，以色列总理内塔尼亚胡的住所便遭受无人机的猛烈袭击，掉以轻心的以军根本来不及全部拦截，内塔尼亚胡住所遭袭差点被斩首。此次袭击到底是怎么一回事？,https://toutiao.com/group/7427420910364049956/,,0,0,False
越闹越大！一家三口被撞身亡，官方下场 家属发声，肇事者家境曝光,2024-10-16 06:31,1584,1032,赫薰辞,赫薰辞,在阅读此文之前，麻烦您点击一下“关注”，感谢大家的支持哦。文|濑名泉编辑|濑名泉前言原本幸福快乐的一家三口，却因为廖某某的一时情绪失控而丢了性命。三人全部死亡，不满2岁的孙子甚至直接就被撞碎了，现场一片狼藉。如今一家三口都已经入土为安，三棺并列，死者的母亲在葬礼上崩溃大哭。,https://toutiao.com/group/7425893474094023220/,,0,0,False
13年9岁男孩扶人被讹，老太坚持是被撞的：说谎死全家！结果如何,2024-10-05 09:17,483,146,大象微视,大象微视,13年时，一个9岁男孩和他的两位同学，出于善意，想要前去扶起一位在地上的老太太。但男孩刚一碰到老太太，那位老太太就指控男孩和那两位同学为撞人者，并坚决否认是自己摔倒的事实，甚至扬言到“说谎死全家!”,https://toutiao.com/group/7422216162442625571/,,0,0,False
河南出大事儿了，跟我没关系啊,2024-10-17 13:29,17931,967,司马南,司马南,"这才是大事儿，中国文化史上的大事儿，不是有人说中国文明5000年是瞎扯吗？不是有人不好好瞧病，戴着口罩，嘴也不闲着：“中国别觉得自己牛哄哄的，什么五千年文明啦，这都是瞎扯！”不是有人用上下嘴唇儿翻飞研究历史，咬着后槽牙说中国的文明史最多只有3700年吗？（他还有零有整）不是有人把中国的文化史嫁接在西方历史的裤管上，说我们的历史只是西方史之下一部分，说我们的祖先不过是些毛毛虫吗？
#河南王庄遗址发现距今约5000年大墓#",https://toutiao.com/group/7426736148065550899/,,0,0,True
万万没想到，35岁杨颖兜兜转转干回“老本行”，活成内娱最大笑话,2024-09-06 07:55,534,137,读万卷书的张飞,读万卷书的张飞,文l张飞编辑l张飞曾经你看不起别人；如今谁又瞧得上你？在节目中丝毫不考虑他人状态，一味地只追求自己的镜头。甚至还在采访中公然表示“自己早就应该把所有奖拿了个遍了”。更关键的是丝毫没有任何“报恩”之心。所以如今曾经所有的“嚣张”“高高在上”遭到反噬，只能说现在谁还“愿意”认识她！,https://toutiao.com/group/7411434661014012456/,,0,0,False
保镖出大事故！抓紧回非洲，现场一看惨不忍睹，真是捡回一条命啊,2024-10-19 09:05,10199,578,非洲小五,非洲小五,,https://toutiao.com/group/7427410271914459658/,,0,0,True
中国著名导弹专家咋了？肖龙旭突然被撤职…,2024-10-13 10:28,6986,1633,司马南,司马南,这是我在中国工程院官网上看到的，大名鼎鼎的肖龙旭是我国著名的军工专家，于2002年获得清华大学博士学位，2019年当选中国工程院院士，速度之快令人惊叹。,https://toutiao.com/group/7425203675784397322/,,0,0,False
贪污上亿、侵吞善款，韩红被实名举报，4年了，有人给她道歉吗？,2024-10-19 07:24,2385,228,昕昕局,昕昕局,2020年初，新冠疫情肆虐，武汉告急，全国上下万众一心，与时间赛跑，与病魔较量，就在这场没有硝烟的战争中，一个熟悉的身影出现在抗疫一线，她带着物资，带着希望，奔赴在最危险的地方，她就是韩红。,https://toutiao.com/group/7427383862491120179/,,0,0,False
有人冒充我男朋友，算不算诈骗？遇到奇葩事你会怎么办？,2024-09-06 05:52,1705,225,兴凯湖莹莹,兴凯湖莹莹,,https://toutiao.com/group/7411404025502892554/,,0,0,True
年度最佳戛纳R级片！全屏裸露尺度拉满，借肉体剥削说透女性困境,2024-10-17 10:11,1876,124,毒舌电影,毒舌电影,“真他*的疯了！”这句话，印在了海报上。也是大多数人看完这部片的感受。豆瓣评分，超越96%的同类片。但你要慎重，这是部恐怖片：不少网友说，这是今年，乃至这辈子看过最炸裂的恐怖片。早在今年的戛纳电影节，Sir就经受了这部片的“血腥洗礼”，直接中午没吃下东西。,https://toutiao.com/group/7426679215765897779/,,0,0,False
3年前，宁夏7岁小女孩一笑走红，后拒百万签约，如今怎么样了？他们后悔了吗？,2024-09-19 07:25,2446,474,睿之悦,睿之悦,2021年，视频镜头中出现的女孩儿用那一抹甜美的笑容，迅速引起了网友们的广泛关注。有媒体公司看到这一机遇，提出愿意用百万巨资与女孩儿签约，然而，女孩儿的父母却坚决拒绝了这一提议。,https://toutiao.com/group/7416250139544879679/,,0,0,False
萌娃：这位小宝宝，麻烦你再跳一次，原谅我没有笑够！,2024-10-17 06:46,4190,323,顶级钢琴OX,顶级钢琴OX,,https://toutiao.com/group/7426632318837588534/,,0,0,True
她曾被前夫一巴掌扇到离婚！二婚嫁世界冠军，如今生活幸福滋润,2024-09-10 09:12,12794,235,豆莱说,豆莱说,“漂亮的让人挪不开眼”是圈内人对她的评价，和“山杏”不一样的是，李琳在现实生活中的感情很是幸运，遇到了导演王小列。,https://toutiao.com/group/7412930201929204236/,,0,0,False
她是央视最惨主持人，男友被判死缓，丈夫诈骗入狱，47岁无人敢娶,2024-08-27 23:30,2250,209,闻书识焉,闻书识焉,她曾是央视的台柱子，和董卿、周涛并称为央视的三朵金花。回顾刘芳菲的前半生，最令人感到惋惜的，便是她的感情生活，47岁至今无人敢娶。,https://toutiao.com/group/7407743113688564258/,,0,0,False
猪肉别总是炒着吃了，教你简单又好吃的做法，简直太香了,2024-09-11 09:11,9187,474,家常的味道,家常的味道,猪肉别总是炒着吃了，教你简单又好吃的做法，简直太香了,https://toutiao.com/group/7413310656981664283/,,0,0,True
今天才知道！电动车“每天充”和“用完再充”，到底哪个更伤电池,2024-08-27 11:19,12390,2195,鲸探所,鲸探所,“今天到底给车充不充电？”估计大多数人每天回家都会想这个问题，看着自己的电动车电量又多又少的，充不充电也是一件非常难以抉择的事情。那么，电动车到底应该怎样充电呢？是每天都充，还是用完之后再充呢？电动车充电不管是在城市还是农村，电动车其实都是人们出门最常见的交通工具。,https://toutiao.com/group/7407773012533117475/,,0,0,False
老人说“坟有6不葬，一葬穷三年”，哪6不葬？葬了穷三年？,2024-08-28 09:01,16537,777,惠农圈,惠农圈,之前实行土葬，关于土葬的说法有很多，比如“坟有六不葬，一葬穷三年”。那时候，人们认为逝者葬在哪里，不能葬在哪里，会给后人带来福或灾。,https://toutiao.com/group/7408111961839256064/,,0,0,False
性能力强的男性有什么特征？能不能一眼识别出来？医生来告诉你！,2024-10-12 09:50,1238,160,番茄健康,番茄健康,这句话从最初的鼓励与加油之意，慢慢演变成了男性对性能力的重视，这也直接反映出性能力在男性朋友心里的重视程度之高。,https://toutiao.com/group/7424792723569492507/,,0,0,False
炸肉丸子，到底用淀粉还是面粉，教你一招，外酥里软超好吃,2024-10-01 09:23,2233,129,家常的味道,家常的味道,,https://toutiao.com/group/7420735473208787492/,,0,0,True
上山采蜜误闯蛇窝，20几条毒性不一，姑娘当场吓尿，头发竖起来了,2024-07-24 02:13,1833,236,兴凯湖莹莹,兴凯湖莹莹,,https://toutiao.com/group/7395019818291692032/,,0,0,True
民间上坟传统：“上坟不带 5 果，家中不惹灾祸”，哪“5果”？,2024-08-08 10:30,14448,1561,惠农圈,惠农圈,在中国传统文化中，祭祀祖先一直是一项备受重视的活动，它承载着对先人的缅怀、敬意和感恩之情。在上坟的时候，人们会提前准备好供品，比如肉类、酒水，还有水果。其中关于水果的准备，也有着诸多的讲究和禁忌，比如“上坟不带 5 果，家中不惹灾祸”的说法。,https://toutiao.com/group/7400584207141192207/,,0,0,False
炸萝卜丸子，放面粉和淀粉就错了，教你正确做法，焦香酥脆不吸油,2024-09-28 10:13,10734,363,家常的味道,家常的味道,,https://toutiao.com/group/7419635124758643227/,,0,0,True
怎样在家做的梅菜扣肉会更好吃，大厨教你诀窍，肥而不腻咸香软糯,2024-08-30 09:00,4832,516,天天相见厨房(阿见),天天相见厨房(阿见),,https://toutiao.com/group/7407836908509725219/,,0,0,True
要求中国人向世界道歉，被央视开除的阿丘，如今现状太解气,2024-08-19 11:36,1566,397,峰哥正读,峰哥正读,2020年，疫情最严重的时候，这样的一段话悄然出现在了微博上面。一位央视主持人，在这万分艰难的时刻，竟然帮助国外“抹黑”自己的祖国。,https://toutiao.com/group/7404772252874457650/,,0,0,False
"这才是""红烧排骨""简单又好吃的家常做法，颜色红亮，软烂脱骨",2024-08-16 02:59,17435,1212,家常的味道,家常的味道,,https://toutiao.com/group/7403566591668453914/,,0,0,True
巴西收到逮捕令，普京产生一种不祥预感，决定不出席G20峰会,2024-10-19 07:08,1172,115,第一军情,第一军情,10月19日据多家媒体报道，由于俄乌冲突的缘故，普京产生了一种不祥预感，犹豫了几天，担心自己前往巴西里约热内卢，会对G20峰会造成“破坏”，所以决定不出席。,https://toutiao.com/group/7427367896987025972/,,0,0,False
土豆搭配洋葱，教你一个神仙吃法，一次3斤不够吃，太解馋了,2024-09-26 09:09,22690,1405,家常的味道,家常的味道,土豆搭配洋葱，教你一个神仙吃法，一次3斤不够吃，太解馋了,https://toutiao.com/group/7418876506660667904/,,0,0,True
全球约一半肝癌在中国，再次提醒：家中的4种食物，尽早撤下餐桌,2024-08-13 08:36,103658,3559,梁医学社梁怡璋医生,梁医学社梁怡璋医生,,https://toutiao.com/group/7402540119712629311/,,0,0,True
朝鲜正式为俄罗斯参战，中国已避无可避？,2024-10-19 10:06,4927,106,票姚校尉,票姚校尉,朝鲜正式为俄罗斯参战，中国已避无可避？,https://toutiao.com/group/7427425931146461696/,,0,0,True
我的房子不对劲！深不可测的恐惧 第五章，逃离伍德伯里,2024-10-05 23:00,2903,391,鲤鱼Ace,鲤鱼Ace,溯源之惧 第五章，逃离伍德伯里,https://toutiao.com/group/7422325180422160930/,,0,0,True
这一次，被批“不男不女”的毕凌，把父亲毕福剑的体面撕的稀碎,2024-08-31 05:00,690,194,卿羽飞,卿羽飞,曾经的《星光大道》是多少人童年时最喜欢看的综艺节目，捧红了非常多的草根艺人，让他们能够实现自己的梦想。,https://toutiao.com/group/7409154770201559591/,,0,0,False
"金正恩""万人雄师""挺普京？泽连斯基""狗急跳墙""走头无路！",2024-10-18 03:30,3420,188,黄阿原,黄阿原,,https://toutiao.com/group/7426699727690793523/,,0,0,True
没人敢说的真相，今天我来说吧，实在是看不下去了~#只讲实话,2024-09-25 01:26,2889,447,远见卓识微风WkKKl,远见卓识微风WkKKl,,https://toutiao.com/group/7418385971881705984/,,0,0,True
