title,publish_time,like_count,comment_count,media_name,source,abstract,article_url,tag,is_yaowen,article_sub_type,has_video
男人目睹了妻子的偷情，下一秒情夫和妻子就遭到了他的制裁！,2025-01-23 09:05,5183,425,橙子影视吖6,橙子影视吖6,,https://toutiao.com/group/7463034403476734527/,,0,0,True
蔡正元谈为什么DeepSeek让英伟达跌超12%,2025-01-27 16:28,9642,608,海峡纪,海峡纪,蔡正元谈为什么DeepSeek让英伟达跌超12%,https://toutiao.com/group/7464632754425987599/,,0,0,True
外国人怀疑东北虎的凶猛，让比特犬去干老虎，镜头拍下惨烈过程,2025-01-27 09:36,1022,143,森林中的故事会,森林中的故事会,,https://toutiao.com/group/7463027975139721737/,,0,0,True
中国真正的少林武僧出山了，暴揍世界级泰拳王，武僧一龙都比不了,2025-01-26 02:53,648,160,好奇菌子,好奇菌子,中国真正的少林武僧出山了，暴揍世界级泰拳王，武僧一龙都比不了,https://toutiao.com/group/7463862497720779316/,,0,0,True
大伯这一行人从老家得亏是撤离得及时,2025-01-27 00:02,4723,286,我是珊姐吖,我是珊姐吖,,https://toutiao.com/group/7464379010890334759/,,0,0,True
公公竟然和儿媳偷情，哪料被妻子撞见，这下有戏看了！,2025-01-21 08:05,8772,765,南瓜午夜厅,南瓜午夜厅,,https://toutiao.com/group/7462273852651979274/,,0,0,True
男子相亲角受辱反击，一句“你存款有我零头多？”引爆全场！,2025-01-27 11:11,2981,624,大海之滨,大海之滨,,https://toutiao.com/group/7464551222448636467/,,0,0,True
上门讨薪违法。民警呵斥法盲妇女：家是人的最后一道防线,2025-01-23 03:15,16797,26346,小红纪实,小红纪实,,https://toutiao.com/group/7462944062039966218/,,0,0,True
相亲看上了媒人了这可怎么办,2025-01-25 02:43,2603,620,啊围娱乐,啊围娱乐,,https://toutiao.com/group/7463677842300158516/,,0,0,True
大哥在生气和窝囊之间选择了窝囊的生气😅😅,2025-01-27 15:41,2193,284,雏雏纪实,雏雏纪实,,https://toutiao.com/group/7464620585071559209/,,0,0,True
河南47岁高中女教师被捕，班上同学道出内幕，令人愤怒,2025-01-27 10:56,4098,154,天天好运,天天好运,,https://toutiao.com/group/7464547371826610738/,,0,0,True
冯巩再次突破自己巅峰，新小品红的一塌糊涂，看完不笑算你狠!,2025-01-16 02:10,859,146,扒剧小妹儿,扒剧小妹儿,,https://toutiao.com/group/7460329787261813286/,,0,0,True
