title,publish_time,like_count,comment_count,media_name,source,abstract,article_url,tag,is_yaowen,article_sub_type,has_video
有人冒充我男朋友，算不算诈骗？遇到奇葩事你会怎么办？,2024-09-06 05:52,1691,224,兴凯湖莹莹,兴凯湖莹莹,,https://toutiao.com/group/7411404025502892554/,,0,0,True
今天才知道！电动车“每天充”和“用完再充”，到底哪个更伤电池,2024-08-27 11:19,10507,1973,鲸探所,鲸探所,“今天到底给车充不充电？”估计大多数人每天回家都会想这个问题，看着自己的电动车电量又多又少的，充不充电也是一件非常难以抉择的事情。那么，电动车到底应该怎样充电呢？是每天都充，还是用完之后再充呢？电动车充电不管是在城市还是农村，电动车其实都是人们出门最常见的交通工具。,https://toutiao.com/group/7407773012533117475/,,0,0,False
安徽美女道士胡小慧被捕：精通“胡媚术”，九名男徒弟揭露其罪行,2024-09-12 08:10,3698,429,艺述史,艺述史,在安徽一处偏僻山头上，有座神秘的道观，外表平平无奇，但里面却有着一位名气很高的美女道士。美女道士的名字叫做胡小慧，据说有着高深的法力，能帮人消灾解难。很多人慕名前来，交上丰厚的香火钱，在袅袅青烟里，试图从这个年轻道士身上获得一些生活的支撑。,https://toutiao.com/group/7413662261274739200/,,0,0,False
"万万没想到,53岁“丁克”半辈子的康辉，一生遗憾竟然是一通电话",2024-08-21 22:14,26867,5296,峰哥正读,峰哥正读,在阅读此文之前，麻烦您点击一下“关注”，既方便您进行讨论和分享，又能给您带来不一样的参与感，感谢您的支持！文/编辑：蘑菇百善孝为先。但是到底怎么做才算是“孝”，康辉用了半辈子才明白。央视知名主持人康辉，事业顺遂，家庭幸福，在外人看来是一个人生赢家。,https://toutiao.com/group/7405504703687115273/,,0,0,False
张本智和太败人品，夺冠后嚣张，对王皓握拳大吼，国乒不该惯着他,2024-10-14 00:30,374,172,兴体视频,兴体视频,,https://toutiao.com/group/7425422236628025897/,,0,0,True
网红郭有才，泡沫散去之后，曾经飘的有多高，如今摔得就有多惨,2024-09-30 09:36,710,431,八号探秘人,八号探秘人,曾经那个卖烧烤的店小二，可能怎么都想不到，自己会成为一个千万粉丝的网红。郭有才在刚成为网红之后的期望也很有意思，那就是每天能赚到300元就行。可现实却是靠着直播广告分成，他的收入直接比期望值翻了上千倍。有人说他其貌不扬，但是平凡人逆袭的典范，还有的人说他长的像日本人。,https://toutiao.com/group/7419978325617082932/,,0,0,False
女孩15岁就能接客！性是生活也是工作，捷克为什么成了色情大国？,2024-09-13 09:10,2113,325,鲸探所,鲸探所,女孩15岁就到了合法性交年龄?18岁是成年，可15岁，仅仅只是一个初中生。很多人都以为，在韩国日本荷兰这些国家，色情产业应该是最“发达”的，可是捷克的色情产业，也并不是一个省油的灯。,https://toutiao.com/group/7414048497181164068/,,0,0,False
上山采蜜误闯蛇窝，20几条毒性不一，姑娘当场吓尿，头发竖起来了,2024-07-24 02:13,1830,233,兴凯湖莹莹,兴凯湖莹莹,,https://toutiao.com/group/7395019818291692032/,,0,0,True
写歌30年穷困潦倒，前妻失望选择离婚，谁料51岁靠一首歌一夜成名,2024-08-12 03:37,25763,4232,八号探秘人,八号探秘人,在阅读此文之前，辛苦您点击一下“关注”，既方便您进行讨论和分享，又能给您带来不一样的参与感，感谢您的支持！编辑：LY无数人都想要一个一夜成名的机会，但机会来了也不是每个人都能把握住的。他用了三十年的时间来准备迎接属于自己的机会。为了这个机会他放弃了一切，甚至包括家庭。,https://toutiao.com/group/7402090890367484428/,,0,0,False
她是央视最惨主持人，男友被判死缓，丈夫诈骗入狱，47岁无人敢娶,2024-08-27 23:30,2209,208,闻书识焉,闻书识焉,她曾是央视的台柱子，和董卿、周涛并称为央视的三朵金花。回顾刘芳菲的前半生，最令人感到惋惜的，便是她的感情生活，47岁至今无人敢娶。,https://toutiao.com/group/7407743113688564258/,,0,0,False
俄罗斯年轻人现状，街头采访最喜欢哪个国家，回答出乎所有人预料,2024-10-13 12:26,13671,7417,遨游四海一看世界,遨游四海一看世界,,https://toutiao.com/group/7425235571229852196/,,0,0,True
难怪工作那么多年，没遇到哈工大的学生,2024-10-12 12:29,838,187,可乐姜茶,可乐姜茶,,https://toutiao.com/group/7424865359213101583/,,0,0,True
土豆搭配洋葱，教你一个神仙吃法，一次3斤不够吃，太解馋了,2024-09-26 09:09,16239,1013,家常的味道,家常的味道,土豆搭配洋葱，教你一个神仙吃法，一次3斤不够吃，太解馋了,https://toutiao.com/group/7418876506660667904/,,0,0,True
13年，小学生扶人被讹百万，老人赌誓“骗人全家死绝”，后来呢？,2024-10-09 10:29,595,401,何止电影,何止电影,不是老人变坏了，而是坏人变老了！这位七旬老太演技直逼某些流量演员，在央视的镜头下，她居然还能泰然自若的撒起谎来。明明是自导自演的一场摔跤戏码，在被拆穿后却依旧坚定自信。今天就让我们走进这一起震惊全国的“摔跤案”。故事的主人公是年仅九岁的小学生江小云。,https://toutiao.com/group/7423721025525662208/,,0,0,False
明明演技拉垮，却被吹成“老戏骨”，这9位演员终于现出原型了？,2024-10-11 11:47,454,211,品古观今,品古观今,这8位演员究竟是“戏骨”还是“戏混子”，有的甚至还越演越回去了?《与凤行》宣璐托孤这一段，看她哭的觉得天都塌了，结果镜头一转到曾黎，突然感觉好像也没出什么大事。,https://toutiao.com/group/7422607550501208612/,,0,0,False
"""请祖国和人民放心！"" 已在掩体度过10余天 我赴黎维和官兵报平安",2024-10-13 09:31,27133,4672,海客新闻,海客新闻,,https://toutiao.com/group/7425190591098520076/,,0,0,True
中国著名导弹专家咋了？肖龙旭突然被撤职…,2024-10-13 10:28,3255,858,司马南,司马南,这是我在中国工程院官网上看到的，大名鼎鼎的肖龙旭是我国著名的军工专家，于2002年获得清华大学博士学位，2019年当选中国工程院院士，速度之快令人惊叹。,https://toutiao.com/group/7425203675784397322/,,0,0,False
民间上坟传统：“上坟不带 5 果，家中不惹灾祸”，哪“5果”？,2024-08-08 10:30,12168,1454,惠农圈,惠农圈,在中国传统文化中，祭祀祖先一直是一项备受重视的活动，它承载着对先人的缅怀、敬意和感恩之情。在上坟的时候，人们会提前准备好供品，比如肉类、酒水，还有水果。其中关于水果的准备，也有着诸多的讲究和禁忌，比如“上坟不带 5 果，家中不惹灾祸”的说法。,https://toutiao.com/group/7400584207141192207/,,0,0,False
全球约一半肝癌在中国，再次提醒：家中的4种食物，尽早撤下餐桌,2024-08-13 08:36,99977,3643,梁医学社梁怡璋医生,梁医学社梁怡璋医生,,https://toutiao.com/group/7402540119712629311/,,0,0,True
为国争光却遭郎平弃用！转身效力土耳其的王一梅，如今咋样了？,2024-08-31 13:19,938,144,豆莱说,豆莱说,光阴似箭，日月如梭，当初的少女早已退役，成为了排球场的幕后人，这么多年她都经历了什么，现在又怎么样了呢?,https://toutiao.com/group/7409287778514567718/,,0,0,False
