title,publish_time,like_count,comment_count,media_name,source,abstract,article_url,tag,is_yaowen,article_sub_type,has_video
全球最富揭晓：美国首富造火箭，印度首富搞能源，中国首富在干嘛,2024-08-02 07:38,3193,4968,智史通鉴,智史通鉴,2024年4月3日，新一轮的福布斯排行榜出炉，法国奢侈品品牌LV的总裁荣登榜首。同时，马斯克也凭借第二的名次也又一次为了美国的首富。众所周知，马斯克的特斯拉公司最近几年发展势头极好，spaceX公司造火箭的工作也进行的如火如荼。,https://toutiao.com/group/7398431880397324839/,,0,0,False
中国火箭军，时隔44年，再次进行洲际导弹试射，战略意义重大！,2024-09-25 13:43,4389,348,大野猫BigWildCat,大野猫BigWildCat,,https://toutiao.com/group/7418575872200573503/,,0,0,True
最后时限将至，中美没谈妥，人民日报敲响钟声,2024-09-25 08:33,2708,135,通政司知事,通政司知事,最后时限将至，中美没谈妥，人民日报敲响钟声,https://toutiao.com/group/7418496005676466728/,,0,0,True
"万万没想到,53岁“丁克”半辈子的康辉，一生遗憾竟然是一通电话",2024-08-21 22:14,22349,4620,峰哥正读,峰哥正读,在阅读此文之前，麻烦您点击一下“关注”，既方便您进行讨论和分享，又能给您带来不一样的参与感，感谢您的支持！文/编辑：蘑菇百善孝为先。但是到底怎么做才算是“孝”，康辉用了半辈子才明白。央视知名主持人康辉，事业顺遂，家庭幸福，在外人看来是一个人生赢家。,https://toutiao.com/group/7405504703687115273/,,0,0,False
格力24年老大地位被结束，击败它的是国内最大空调集团，日收10亿,2024-09-25 07:16,325,402,云舟史策,云舟史策,随着时代的发展，空调已经成为人们日常生活中不可缺少的家电产品了，家家户户或多或少都安装有空调，而在我国各大空调品牌中，格力的崛起不知打败了多少曾霸占中国市场的外企品牌。,https://toutiao.com/group/7418470355376898586/,,0,0,False
5座车拉6个人被判超员，车主1句话把交警问懵,2024-08-05 20:20,13103,3109,奇妙钢笔pA8JyP,奇妙钢笔pA8JyP,,https://toutiao.com/group/7399752843772559906/,,0,0,True
中方宣布冻结美在华资产，不到24小时，美参议院老毛病又犯了,2024-09-25 07:27,3977,251,利刃,利刃,,https://toutiao.com/group/7418479148370395700/,,0,0,True
写歌30年穷困潦倒，前妻失望选择离婚，谁料51岁靠一首歌一夜成名,2024-08-12 03:37,22707,3600,八号探秘人,八号探秘人,在阅读此文之前，辛苦您点击一下“关注”，既方便您进行讨论和分享，又能给您带来不一样的参与感，感谢您的支持！编辑：LY无数人都想要一个一夜成名的机会，但机会来了也不是每个人都能把握住的。他用了三十年的时间来准备迎接属于自己的机会。为了这个机会他放弃了一切，甚至包括家庭。,https://toutiao.com/group/7402090890367484428/,,0,0,False
美籍华人科学家吴瑛，在美国芝加哥家中服毒自杀，自杀原因曝光！,2024-09-04 05:28,962,815,开心营业厅,开心营业厅,前言8月31日，香港《南华早报》报道：美籍华裔科学家吴瑛，在美国服用过量毒性药物，自杀身亡！她的离世，与美国政府对华人科学家的“迫害”有着直接的联系。美国为何频频针对华人科学家，难道说“科学无国界”真的成了一句笑话吗？,https://toutiao.com/group/7410619875699212826/,,0,0,False
曹德旺说：我不会逃跑，但要给政府提个醒 #曹德旺 #福耀科技大学,2024-06-28 06:51,25963,3506,正直鲸鱼LxhXfoC,正直鲸鱼LxhXfoC,,https://toutiao.com/group/7385443277144588834/,,0,0,True
她是央视最惨主持人，男友被判死缓，丈夫诈骗入狱，47岁无人敢娶,2024-08-27 23:30,2133,207,闻书识焉,闻书识焉,她曾是央视的台柱子，和董卿、周涛并称为央视的三朵金花。回顾刘芳菲的前半生，最令人感到惋惜的，便是她的感情生活，47岁至今无人敢娶。,https://toutiao.com/group/7407743113688564258/,,0,0,False
中国🇨🇳人民的好总理,2024-09-03 15:46,180951,19765,话说,话说,这个老人一生只做一件事，那就是为了人民鞠躬尽瘁，死而后已,https://toutiao.com/group/7410443709928210955/,,0,0,True
"是道德的沦丧,还是人性的泯灭,请大家观看以下视频",2024-09-25 09:39,707,105,智慧辰星7,智慧辰星7,,https://toutiao.com/group/7418513063826948660/,,0,0,True
民间上坟传统：“上坟不带 5 果，家中不惹灾祸”，哪“5果”？,2024-08-08 10:30,8988,1117,惠农圈,惠农圈,在中国传统文化中，祭祀祖先一直是一项备受重视的活动，它承载着对先人的缅怀、敬意和感恩之情。在上坟的时候，人们会提前准备好供品，比如肉类、酒水，还有水果。其中关于水果的准备，也有着诸多的讲究和禁忌，比如“上坟不带 5 果，家中不惹灾祸”的说法。,https://toutiao.com/group/7400584207141192207/,,0,0,False
调解：母老虎丈母娘上场开始哭，女婿一句话噎死她！专家：漂亮,2024-09-23 11:32,5594,2738,把我逗笑了,把我逗笑了,,https://toutiao.com/group/7416972180941963828/,,0,0,True
温铁军：形势非常严峻，战争随时可能爆发！〔上〕,2024-09-11 15:44,17260,2270,淡泊的海浪AAm,淡泊的海浪AAm,,https://toutiao.com/group/7413411885322371621/,,0,0,True
我婆婆灵活就业缴费15年，第一次领退休金，她看到金额却哭起来了,2024-07-24 09:56,343,160,元贞短视频,元贞短视频,,https://toutiao.com/group/7395109282246558208/,,0,0,True
40年前供销社卖过的20个生活用品，见过一半算你厉害，你认识几个,2024-07-23 08:56,7518,869,万物知识局,万物知识局,文/万物知识局本文陈述所有内容皆有可靠信息来源，赘述在文章结尾童年的岁月无论过多久都会因为某件事或某个物品而激发回忆，如今早已长大的我们时常还会想起过往，在看到某个熟悉的老物件时，回忆就如同潮涌般难以抑制，就仿佛再次将我们带回到那个熟悉的午后和熟悉的房间。,https://toutiao.com/group/7394736337166926346/,,0,0,False
姑娘远嫁山东十年未回家，带着孩子偷偷回娘家，到家眼前一幕哭了,2024-09-09 08:25,23103,10033,小乔家里的事,小乔家里的事,,https://toutiao.com/group/7412556561718968870/,,0,0,True
上半年中美印新生人口：美国178万，印度1140万，中国让人意外,2024-09-23 12:16,1256,371,开心营业厅,开心营业厅,中美印是全球人口数量最多的三个国家，几乎占到了全球人口总数的近四成，不过，如今三个国家，却在生育率的问题上，遭遇了前所未有的挑战。,https://toutiao.com/group/7417736973647790628/,,0,0,False
"台媒热议""接管台湾准备""，一省两制政军权属规范，完成统一！",2024-09-25 22:00,3561,270,黄阿原,黄阿原,,https://toutiao.com/group/7418568686446838306/,,0,0,True
无论炒什么肉，不要用盐和料酒腌制，大厨教我绝招，肉片滑嫩不腥,2024-07-11 08:24,78738,3220,家常的味道,家常的味道,无论炒什么肉，不要用盐和料酒腌制，大厨教我绝招，肉片滑嫩不腥,https://toutiao.com/group/7390291377185096204/,,0,0,True
今天才知道！电动车“每天充”和“用完再充”，到底哪个更伤电池,2024-08-27 11:19,6043,1267,鲸探所,鲸探所,“今天到底给车充不充电？”估计大多数人每天回家都会想这个问题，看着自己的电动车电量又多又少的，充不充电也是一件非常难以抉择的事情。那么，电动车到底应该怎样充电呢？是每天都充，还是用完之后再充呢？电动车充电不管是在城市还是农村，电动车其实都是人们出门最常见的交通工具。,https://toutiao.com/group/7407773012533117475/,,0,0,False
路虎女逆行打人事件迎来了大结局。,2024-09-25 03:16,1018,537,好学孔雀rPVeP,好学孔雀rPVeP,,https://toutiao.com/group/7418414323933905408/,,0,0,True
靳东上台领奖，一看到颁奖的是谁，直接单膝下跪！丨国剧盛典,2024-09-02 09:37,13581,1330,机智的喜鹊yO,机智的喜鹊yO,,https://toutiao.com/group/7409977496797610511/,,0,0,True
表面是艺人，实际是富家千金的5位女星，无人敢惹更别说潜规则了,2024-08-28 02:06,7097,542,八号探秘人,八号探秘人,在德云班主郭德纲的作品中，有过这么一句话。虽说此言尤为刺耳，但话糙理不糙。当今娱乐圈，很多女星为出人头地，自愿或被迫做出违反道德底线之事。,https://toutiao.com/group/7407984985224872459/,,0,0,False
男人和女人的需求差别这么大？,2024-07-12 11:00,28241,2010,周小鹏,周小鹏,男人和女人的需求差别这么大？,https://toutiao.com/group/7388885573953389092/,,0,0,True
王楚钦最疯狂一球！百看不厌，被国际乒联评为最刺激的比赛之一,2024-09-10 01:04,5564,431,乐播体育,乐播体育,,https://toutiao.com/group/7412813945642746418/,,0,0,True
为国争光却遭郎平弃用！转身效力土耳其的王一梅，如今咋样了？,2024-08-31 13:19,906,128,豆莱说,豆莱说,光阴似箭，日月如梭，当初的少女早已退役，成为了排球场的幕后人，这么多年她都经历了什么，现在又怎么样了呢?,https://toutiao.com/group/7409287778514567718/,,0,0,False
小品：这小品真是经典中的经典，本山大叔咋说都不对，慌乱的可爱,2024-09-04 07:47,6558,1200,把我逗笑了,把我逗笑了,,https://toutiao.com/group/7408254973588275749/,,0,0,True
小伙路上偶遇骑行的媳妇，本想质问一番，原来自己是小丑,2024-09-13 05:41,7204,1951,山西广电文娱,山西广电文娱,,https://toutiao.com/group/7413998825330704911/,,0,0,True
宝宝一再挑衅，猫咪起身，看看周围没人注意，立马开打！,2024-09-10 05:27,17755,2691,魔法麻酱atty9,魔法麻酱atty9,,https://toutiao.com/group/7412881948340650496/,,0,0,True
11_用巨大的假蟒蛇恶搞路人-简直是太刺激了-,2024-08-05 00:17,10193,1492,外向辰星谈科普,外向辰星谈科普,,https://toutiao.com/group/7398353020251013644/,,0,0,True
祁厅开门，警车后退，厅长这个步伐不是体制内的一辈子也学不会,2024-08-02 14:34,9577,2670,Jerry,Jerry,,https://toutiao.com/group/7398550434186527268/,,0,0,True
突然被曝有毒！不少人破防：最近天天在用！深圳市监局紧急提醒,2024-09-24 05:00,616,290,极目新闻,极目新闻,近日，一则网友爆料引起了不少人的讨论，该网友提到，一些色彩鲜亮的餐具如果与食物直接接触，可能会对健康产生不利影响。不少网友表示破防，塌房都塌到碗上了？家里还有老人孩子，长期使用岂不是一种潜在隐患？一起来关注。自家的陶瓷碗盘还能用吗？实际上，丢弃陶瓷餐具的情况并非个例。,http://jms.ctdsb.net/jmythshare/#/index_share?cId=0&contentType=5&contentId=2262639,,0,0,False
央视曝光的“夺命锅”，炒的菜引起金属中毒，为何还有很多人买？,2024-07-23 11:31,6418,3009,老猫爱听故事,老猫爱听故事,,https://toutiao.com/group/7394703528704344611/,,0,0,True
《西海情歌》，网友：年轻时候写歌没个轻重，这会儿知道难唱了吧,2024-09-11 09:39,18225,4271,潮流音轨,潮流音轨,刀郎《西海情歌》，网友神评：年轻时候写歌没个轻重，这会儿知道难唱了吧！,https://toutiao.com/group/7413317803245044236/,,0,0,True
万万没想到,2024-08-22 01:11,4337,391,俊俏云朵u,俊俏云朵u,,https://toutiao.com/group/7405765312747930164/,,0,0,True
泰国空姐中文播报，这口音笑死人，挺上头啊,2024-09-23 05:31,10482,2182,奋发有为晚风Wj9PdC,奋发有为晚风Wj9PdC,,https://toutiao.com/group/7411686103767319052/,,0,0,True
初中毕业去当流水线女工，五年后却成为世界冠军，22岁成人生赢家,2024-08-02 10:46,6354,1219,豆莱说,豆莱说,文：豆莱说编辑：豆莱说支持作者，写作不易，文中会有5s广告，观看后可免费阅读全文父母曾设想过子女的千百种可能，只是对于一个走上中专之路的孩子，无非也是毕业，打工，进工厂，养家糊口。,https://toutiao.com/group/7398489613888766475/,,0,0,False
相声：最喜欢听陈佩斯胡说八道，这把朱时茂给气得！,2024-08-01 03:57,11647,1394,活泼水滴hAjq2,活泼水滴hAjq2,相声：最喜欢听陈佩斯胡说八道，这把朱时茂给气得！,https://toutiao.com/group/7398015299330507273/,,0,0,True
她认干爹改国籍，曾叫嚣要击败女国乒，却在巴黎奥运会丢尽了脸,2024-08-26 14:00,488,301,吃瓜崽崽,吃瓜崽崽,她曾是中国国籍，却因认干爹入韩籍。十九岁的她被国人认为是乒坛叛徒，还曾叫嚣女国乒。如今却成为了韩国乒乓一姐。,https://toutiao.com/group/7407375792933044790/,,0,0,False
人睡觉的时候为什么不能脚朝西头朝东？专家告诉你其中真相,2024-07-15 22:30,1217,1290,严哥爱讲事,严哥爱讲事,,https://toutiao.com/group/7391871358127243828/,,0,0,True
又出大瓜？73岁“风流妖精”刘晓庆，如今已经走上另一条道路,2024-09-21 05:32,1751,236,冯律讲法,冯律讲法,近日，四火姐姐在直播间中透露了一件事，即“身边有位老师，70多岁了，还在谈恋爱，有八个男朋友，所有人都认识她。”,https://toutiao.com/group/7416939451584102939/,,0,0,False
一晚输1亿后，他放弃267亿家产去寺庙当和尚：除了钱，我一无所有,2024-07-06 14:26,5503,1094,智史通鉴,智史通鉴,2003年的香港，一条新闻让人们震惊：富豪何宝生在赌场一夜就输掉了一个亿！可当事人一点不心疼，因为相比他的万亿身家，这一个亿只是毛毛雨罢了。我们也觉得，这样的有钱人，还会有什么烦恼呢？,https://toutiao.com/group/7388519952107520527/,,0,0,False
2岁半女童失联43天，邻村悬崖底油葵地里找到遗体，家属怀疑孩子遇害希望严惩凶手,2024-09-25 03:07,347,297,大风新闻,大风新闻,9月24日，山西运城芮城县西陌镇马夭村董家庄2岁半女童的亲属张女士向华商报大风新闻记者证实，9月23日，侄女失踪第43天，孩子的遗体在邻村一处悬崖底下油葵地里被找到。目前，家属正考虑做尸检查明具体死因，芮城警方正加紧侦办。,https://toutiao.com/group/7418410529175978546/,,0,0,False
4年骑行结束，1500天终于回到老家，感谢大家一路陪伴有缘江湖见,2024-09-07 03:50,71111,16750,刘伟元的旅行,刘伟元的旅行,4年骑行结束，1500天终于回到老家，感谢大家一路陪伴有缘江湖见！,https://toutiao.com/group/7411715839100977716/,,0,0,True
陈若琳把全红婵养得是真好啊,2024-08-07 03:21,2905,182,中工网,中工网,<p style='text-indent: 2em;'>原标题：陈若琳把全红婵养得是真好啊</p><p style='text-indent: 2em;'>昨晚，巴黎奥运会女子10米跳台跳水决赛，全红婵夺得金牌！赛后采访，她说，我不是你们所说的天才，都是练的，一遍一遍地练。教练陈若琳见证了全红婵的努力与刻苦。@陈若琳sunny@全红婵这对被称为“王炸”组合的师徒，在奥运赛场上都有过非常亮眼的表现。为帮全红婵突破发育关，陈若琳下了不少功夫。每天七八个小时的训练，恨不得将全红婵“拴在裤腰带上”严密看管。执教能力虽受过质疑，但她从不回避，而是找出问题，各个击破。她说：“我走过的弯路，不想让全红婵再走一遍。”中国队加油！（央视）</p>,http://db.workercn.cn/media/2024/08/07/64B10057EEF44DC3904C945F112F757A/preview.mp4,,0,0,True
