title,publish_time,like_count,comment_count,media_name,source,abstract,article_url,tag,is_yaowen,article_sub_type,has_video
学习知行·中国式现代化丨山河万里乘风起,2024-10-05 12:21,2126,918,人民网,人民网,历史长河波澜壮阔一代又一代人接续奋斗创造了今天的中国75年岁月中国足迹不断拓展镌刻下一个又一个中国高度、中国深度绘写“美丽中国”我们要一往无前、顽强拼搏让明天的中国更美好,https://toutiao.com/group/7422265431589437993/,,0,0,False
男人和女人的需求差别这么大？,2024-07-12 11:00,29576,2113,周小鹏,周小鹏,男人和女人的需求差别这么大？,https://toutiao.com/group/7388885573953389092/,,0,0,True
今天才知道！电动车“每天充”和“用完再充”，到底哪个更伤电池,2024-08-27 11:19,8319,1690,鲸探所,鲸探所,“今天到底给车充不充电？”估计大多数人每天回家都会想这个问题，看着自己的电动车电量又多又少的，充不充电也是一件非常难以抉择的事情。那么，电动车到底应该怎样充电呢？是每天都充，还是用完之后再充呢？电动车充电不管是在城市还是农村，电动车其实都是人们出门最常见的交通工具。,https://toutiao.com/group/7407773012533117475/,,0,0,False
男子与女子在河中嬉戏玩耍，突然连续将女子的头按入水中,2024-09-26 04:40,1203,165,经视看天下,经视看天下,,https://toutiao.com/group/7418807108637819444/,,0,0,True
为国争光却遭郎平弃用！转身效力土耳其的王一梅，如今咋样了？,2024-08-31 13:19,933,139,豆莱说,豆莱说,光阴似箭，日月如梭，当初的少女早已退役，成为了排球场的幕后人，这么多年她都经历了什么，现在又怎么样了呢?,https://toutiao.com/group/7409287778514567718/,,0,0,False
2013年，湖南26岁女孩嫁给71岁老头，婚后还生下一子，如今怎样了,2024-07-12 11:59,26778,2419,智史通鉴,智史通鉴,2013年4月17日，长沙宁乡县的民政局迎来了一对特殊的夫妻。一个71岁的老头和一个26岁的女孩，离远了看，甚至像爷爷和孙女。面对工作人员异样的眼光，女孩说：“我和他是真心相爱的！”这让人好奇，这对相差45岁的夫妻，他们之间到底有着怎样的爱情故事？,https://toutiao.com/group/7390696631223534120/,,0,0,False
她曾被前夫一巴掌扇到离婚！二婚嫁世界冠军，如今生活幸福滋润,2024-09-10 09:12,8816,169,豆莱说,豆莱说,“漂亮的让人挪不开眼”是圈内人对她的评价，和“山杏”不一样的是，李琳在现实生活中的感情很是幸运，遇到了导演王小列。,https://toutiao.com/group/7412930201929204236/,,0,0,False
有人跟踪我？浪哥，救命啊！ #蛋仔派对逃出惊魂夜 #蛋仔电影节,2024-08-07 09:45,1604,101,魔鬼鱼秀儿,魔鬼鱼秀儿,,https://toutiao.com/group/7400331364136682019/,,0,0,True
她是央视最惨主持人，男友被判死缓，丈夫诈骗入狱，47岁无人敢娶,2024-08-27 23:30,2186,207,闻书识焉,闻书识焉,她曾是央视的台柱子，和董卿、周涛并称为央视的三朵金花。回顾刘芳菲的前半生，最令人感到惋惜的，便是她的感情生活，47岁至今无人敢娶。,https://toutiao.com/group/7407743113688564258/,,0,0,False
#人性电影,2024-09-30 03:54,1073,162,时光剪影,时光剪影,,http://toutiao.com/item/7420279600897098274/,,0,0,True
他和6个老婆共处一室，每人每月7万零花钱，71岁又娶了20岁小娇妻,2024-10-03 03:25,1042,145,八号探秘人,八号探秘人,如果不是雷洪的这番操作，或许大家永远都不知道，现实中竟然真的有人和韦小宝一样，坐享三妻四妾之福，拥有七个老婆。,https://toutiao.com/group/7420736326078628392/,,0,0,False
国乒5朵金花的家庭：王艺迪体二代，陈梦富二代，王曼昱父亲泪目,2024-08-04 02:03,2921,157,不似少溓游,不似少溓游,想要在国内靠乒乓球打出名堂，仅仅有天赋是完全不够的。因为在中国乒坛，万里挑一的天才遍地都是。以至于有不少人都选择放弃，甚至还有田志希这样为了能打乒乓球而选择归化韩国的球手。,https://toutiao.com/group/7398094722457289266/,,0,0,False
有人冒充我男朋友，算不算诈骗？遇到奇葩事你会怎么办？,2024-09-06 05:52,1658,218,兴凯湖莹莹,兴凯湖莹莹,,https://toutiao.com/group/7411404025502892554/,,0,0,True
女儿美国读高中花掉110万，单亲妈妈发起募捐：求捐200万读大学！,2024-07-25 10:10,925,1836,笑史云烟,笑史云烟,都说寒门出贵子，这话其实不假，就像单亲妈妈郑女士辛苦拉扯长大的女儿小杰，在努力下直接考上了美国加州大学。,https://toutiao.com/group/7395473835161616936/,,0,0,False
军队很恼火，中国花300亿美元买的俄罗斯武器，如今全部退居二线,2024-07-10 08:41,2288,217,藏剑游侠儿,藏剑游侠儿,因头条改版，增加了广告解锁功能，当广告打开，静等5秒钟后，就可以伸出发财的小手，点击右上角的关闭按钮，感谢观众老爷理解，在此拜谢各位观众老爷了------上世纪八九十年代，中国与俄罗斯达成军事合作，俄罗斯因为苏联解体急需发展经济，中国迫切需要武器发展国防力量。,https://toutiao.com/group/7389919360342704676/,,0,0,False
“骗购”中国坦克，用完就退货，想求买中国无人机，中国只卖不租,2024-09-24 22:42,1270,229,开心营业厅,开心营业厅,自古以来诚信都是一个很重要的东西，不管是国家交往还是做生意，没有人愿意和一个不守信的人打交道。然而2009年，秘鲁为了在阅兵仪式上展示军事实力，“骗购”中国坦克撑场面，用完以后却以技术问题为由退货。,https://toutiao.com/group/7418121417771762215/,,0,0,False
牛市疯了：3天赚了一百万，高兴得太早，回头发现“卖飞了”,2024-10-03 13:00,4150,5496,凤凰网财经,凤凰网财经,编者按:30岁的孙默，在北京有一份稳定的工作，五年前，手里刚有一点积蓄，他就全部投入股市，没想到紧接着迎来了疫情。,https://toutiao.com/group/7421533420930482703/,,0,0,False
5座车拉6个人被判超员，车主1句话把交警问懵,2024-08-05 20:20,17494,4071,奇妙钢笔pA8JyP,奇妙钢笔pA8JyP,,https://toutiao.com/group/7399752843772559906/,,0,0,True
国庆高铁上，这两个年轻人被“曝光”！,2024-10-04 03:56,1280,154,中央政法委长安剑,中央政法委长安剑,10月1日南昌开往宁波的一列高铁上两个年轻人蜷缩在车厢的角落异常显眼原来，二人分别是来自浙江省宁波市公安局江北分局庄桥派出所的民警何韬阳和新警周子怡9月18日二人所在的专案组接到命令正在办理的一起新型毒品案发现了重大线索二人顾不上中秋假期立即动身前往犯罪嫌疑人所在地在嫌疑人可能出,https://toutiao.com/group/7421764025815417396/,,0,0,False
写歌30年穷困潦倒，前妻失望选择离婚，谁料51岁靠一首歌一夜成名,2024-08-12 03:37,24772,3966,八号探秘人,八号探秘人,在阅读此文之前，辛苦您点击一下“关注”，既方便您进行讨论和分享，又能给您带来不一样的参与感，感谢您的支持！编辑：LY无数人都想要一个一夜成名的机会，但机会来了也不是每个人都能把握住的。他用了三十年的时间来准备迎接属于自己的机会。为了这个机会他放弃了一切，甚至包括家庭。,https://toutiao.com/group/7402090890367484428/,,0,0,False
中国明明有东风-41，为何用东风31AG展示核反击实力？美国能看懂,2024-09-29 08:12,36462,1629,瞩望云霄,瞩望云霄,在中国从海南岛向太平洋发射洲际导弹事件上中，从央媒公开的画面来看，火箭军选择了东风-31AG而非更先进的东风-41。,https://toutiao.com/group/7419974996040090175/,,0,0,True
突发！美英发动空袭,2024-10-05 01:32,368,317,红星新闻,红星新闻,据美国中央司令部10月4日公布的消息，也门萨那时间10月4日17时左右，美国中央司令部部队对也门胡塞武装控制区的15个胡塞武装目标进行了袭击。,https://toutiao.com/group/7422098191929098791/,,0,0,False
万万没想到，35岁杨颖兜兜转转干回“老本行”，活成内娱最大笑话,2024-09-16 02:41,246,168,八号探秘人,八号探秘人,“一失足成千古恨”，这句话用在她的身上，显得格外贴切。当别人35岁还在想办法红的时候，她就已经经历了从“嫩模”到“顶流”再到“嫩模”的轮回。,https://toutiao.com/group/7414910623407931923/,,0,0,False
看了以前的央视采访，才知道现在的采访，表演成分有多高,2024-09-25 05:59,9846,1117,博学百灵鸟,博学百灵鸟,,https://toutiao.com/group/7418456429486408207/,,0,0,True
广东一女子不愿上班常年坐街边，因长得好看被路人投喂：又懒又馋,2024-08-01 22:26,529,325,南方,南方,有时候，我们会遇到那些让人啧啧称奇的故事，不禁让人感慨不已。今天，我们要讨论的故事，发生在广东，以一位名叫小芳的女子为主角。,https://toutiao.com/group/7397063491162538546/,,0,0,False
表面是艺人，实际是富家千金的5位女星，无人敢惹更别说潜规则了,2024-08-28 02:06,9215,715,八号探秘人,八号探秘人,在德云班主郭德纲的作品中，有过这么一句话。虽说此言尤为刺耳，但话糙理不糙。当今娱乐圈，很多女星为出人头地，自愿或被迫做出违反道德底线之事。,https://toutiao.com/group/7407984985224872459/,,0,0,False
中美一旦开战，中国的底牌能撑得住吗？,2024-09-28 12:41,1926,228,悠闲钢笔PTaHkVr,悠闲钢笔PTaHkVr,,https://toutiao.com/group/7419673169469899291/,,0,0,True
