title,publish_time,like_count,comment_count,media_name,source,abstract,article_url,tag,is_yaowen,article_sub_type,has_video
俄罗斯陷入绝望，只剩最后一条路了！,2025-03-05 02:34,699,197,芝士世角,芝士世角,,https://toutiao.com/group/7477999023085847052/,,0,0,True
局面已经越来越不对劲，中国小县城的工资开始崩溃了!,2025-03-05 00:30,5337,1021,挽风,挽风,,https://toutiao.com/group/7477945173566095926/,,0,0,True
老外花5万美元买的宇树机器人，带着去吃饭，现场老外都惊呆了！,2025-02-10 04:58,5914,835,有趣的小鱼儿,有趣的小鱼儿,,https://toutiao.com/group/7469434698880664091/,,0,0,True
惊爆！小伙买鱼付款后说鱼不用杀，商户闻听鱼不卖了，,2025-03-02 04:07,5133,4670,帝国重汽,帝国重汽,,https://toutiao.com/group/7476961373608542759/,,0,0,True
这个菜是“降脂霸”，隔三岔五吃一点，帮你清理血管，身体更健康,2025-01-13 10:41,2485,222,爱玉门,爱玉门,荠菜鸡蛋饼!荠菜窝窝头!荠菜香菇鸡蛋汤!,https://toutiao.com/group/7457740354180203047/,,0,0,False
吃饭“8分饱”是错的？医生提醒：65岁后吃饭尽量做到这4点,2025-03-03 23:33,3497,120,老k谈健康,老k谈健康,,https://toutiao.com/group/7477493545096528418/,,0,0,True
乌克兰首都基辅现状，拍摄于2025年3月3日，看看街上还有多少男人,2025-03-03 01:01,16260,6966,王哥说事,王哥说事,,https://toutiao.com/group/7477381859442229801/,,0,0,True
今明两年打算买房的老百姓，要牢记7字真言：买旧、买大、不买三,2024-12-12 10:31,5939,553,消费快报,消费快报,然而，市场上的房源种类繁多，质量参差不齐，这给购房者带来了不小的挑战。在这样的背景下，“买旧、买大、不买三”的购房建议逐渐受到人们的重视。,https://toutiao.com/group/7447470862556611108/,,0,0,False
