title,publish_time,like_count,comment_count,media_name,source,abstract,article_url,tag,is_yaowen,article_sub_type,has_video
少女吃完肯德基把骨头从垃圾桶捡回来，做一顿鸡架泡饭，香迷糊了,2024-07-16 00:00,883,299,兴凯湖莹莹,兴凯湖莹莹,,https://toutiao.com/group/7391891049913778740/,,0,0,True
9月21日凌晨，北京天安门发生如此感人场面，令人眼含热泪,2024-09-20 23:06,3546,232,好邻居李亮,好邻居李亮,,https://toutiao.com/group/7416865499553727014/,,0,0,True
2013年，湖南26岁女孩嫁给71岁老头，婚后还生下一子，如今怎样了,2024-07-12 11:59,22451,2240,智史通鉴,智史通鉴,2013年4月17日，长沙宁乡县的民政局迎来了一对特殊的夫妻。一个71岁的老头和一个26岁的女孩，离远了看，甚至像爷爷和孙女。面对工作人员异样的眼光，女孩说：“我和他是真心相爱的！”这让人好奇，这对相差45岁的夫妻，他们之间到底有着怎样的爱情故事？,https://toutiao.com/group/7390696631223534120/,,0,0,False
逆袭人生，找老婆建别墅当上老板，小奎一家终得圆满#娟奎之恋,2024-08-31 05:27,15046,2706,海哥量地球,海哥量地球,,https://toutiao.com/group/7409170930649268771/,,0,0,True
陈若琳把全红婵养得是真好啊,2024-08-07 03:21,2796,180,中工网,中工网,<p style='text-indent: 2em;'>原标题：陈若琳把全红婵养得是真好啊</p><p style='text-indent: 2em;'>昨晚，巴黎奥运会女子10米跳台跳水决赛，全红婵夺得金牌！赛后采访，她说，我不是你们所说的天才，都是练的，一遍一遍地练。教练陈若琳见证了全红婵的努力与刻苦。@陈若琳sunny@全红婵这对被称为“王炸”组合的师徒，在奥运赛场上都有过非常亮眼的表现。为帮全红婵突破发育关，陈若琳下了不少功夫。每天七八个小时的训练，恨不得将全红婵“拴在裤腰带上”严密看管。执教能力虽受过质疑，但她从不回避，而是找出问题，各个击破。她说：“我走过的弯路，不想让全红婵再走一遍。”中国队加油！（央视）</p>,http://db.workercn.cn/media/2024/08/07/64B10057EEF44DC3904C945F112F757A/preview.mp4,,0,0,True
6万中国军人一夜神秘消失,2024-09-16 04:48,2346,101,坦荡的风声,坦荡的风声,,https://toutiao.com/group/7415098419808567835/,,0,0,True
罕见！100年前，英国游客拍下的清朝乡村，和想象中完全不一样,2024-09-20 02:07,1169,142,万物知识局,万物知识局,泥泞的土路，衣不蔽体的老百姓，即便是达官显贵的家中也十分破败，而这些都是清王朝的历史痕迹，虽说那时候中国摄影技术并不发达，但也有许多外国游客来到这里，拍摄下了许多老照片，为我们留下了珍贵的历史资料，那清朝到底是怎样的面貌呢?,https://toutiao.com/group/7416287738871267855/,,0,0,False
4年骑行结束，1500天终于回到老家，感谢大家一路陪伴有缘江湖见,2024-09-07 03:50,68818,16444,刘伟元的旅行,刘伟元的旅行,4年骑行结束，1500天终于回到老家，感谢大家一路陪伴有缘江湖见！,https://toutiao.com/group/7411715839100977716/,,0,0,True
她是央视最惨主持人，男友被判死缓，丈夫诈骗入狱，47岁无人敢娶,2024-08-27 23:30,2072,206,闻书识焉,闻书识焉,她曾是央视的台柱子，和董卿、周涛并称为央视的三朵金花。回顾刘芳菲的前半生，最令人感到惋惜的，便是她的感情生活，47岁至今无人敢娶。,https://toutiao.com/group/7407743113688564258/,,0,0,False
以色列这一炸全搞砸了，中东地区迎来去美国化：中国成为最大赢家,2024-09-20 07:56,2331,730,深度工场,深度工场,以色列这一炸全搞砸了。以色列在黎巴嫩这一炸，在战术上来说，确实很成功，杀伤4500多名黎巴嫩真主党成员。,https://toutiao.com/group/7416630160327279158/,,0,0,False
姑娘远嫁山东十年未回家，带着孩子偷偷回娘家，到家眼前一幕哭了,2024-09-09 08:25,19547,8499,小乔家里的事,小乔家里的事,,https://toutiao.com/group/7412556561718968870/,,0,0,True
"万万没想到,53岁“丁克”半辈子的康辉，一生遗憾竟然是一通电话",2024-08-21 22:14,20723,4442,峰哥正读,峰哥正读,在阅读此文之前，麻烦您点击一下“关注”，既方便您进行讨论和分享，又能给您带来不一样的参与感，感谢您的支持！文/编辑：蘑菇百善孝为先。但是到底怎么做才算是“孝”，康辉用了半辈子才明白。央视知名主持人康辉，事业顺遂，家庭幸福，在外人看来是一个人生赢家。,https://toutiao.com/group/7405504703687115273/,,0,0,False
反超华为、阿里！中国第一大民企诞生，营收破1万亿，员工超60万,2024-09-18 08:47,1400,857,云舟史策,云舟史策,刘强东白手起家的神话迎来新纪录！2024年财富世界500强企业中，京东一举成为中国第一大民间企业。而排在京东前面的15家中国公司，全是传统的能源，工程国企和银行。唯一的高科技企业鸿海精密，则是台湾省的富士康母公司。其中阿里巴巴排名全世界第70名，恒力集团排名81，华为排名103。,https://toutiao.com/group/7415861358157120037/,,0,0,False
港姐归来，小奎坐大奔热情迎接，爱人见面抱头痛哭 #相亲,2024-07-05 04:45,23493,4861,海哥量地球,海哥量地球,,https://toutiao.com/group/7388008203738415653/,,0,0,True
普京签令，梅德韦杰夫获新职,2024-09-21 04:14,2662,1529,上观新闻,上观新闻,据《俄罗斯商业咨询日报》网站9月21日报道，俄罗斯联邦安全会议副主席德米特里·梅德韦杰夫被任命为俄罗斯武装力量征募委员会主席。普京总统签署了关于成立该委员会的命令。命令称：“成立这一跨部门委员会是为了执行安全会议在组织防御和军事建设领域承担的任务。,https://export.shobserver.com/toutiao/html/799009.html,,0,1,False
49. 父亲刚去世女儿就把父亲棺材抬到银行取,2024-09-13 05:53,2900,144,风月里的阳光,风月里的阳光,,https://toutiao.com/group/7414001732943872531/,,0,0,True
董卿父亲董善祥：我这辈子最后悔的事，就是让宝贝女儿嫁给密春雷,2024-09-11 06:59,1361,149,稻述,稻述,提起央视主持，现在挑大梁的几乎就是撒贝宁、尼格买提、龙洋等人了，他们也都非常优秀，但常有人怀念起董卿还在的日子。,https://toutiao.com/group/7413267526601228852/,,0,0,False
恭喜中国女篮新领袖终于出现了！百发百中！统治力让对手深深绝望,2024-06-25 07:11,24663,1344,乐播体育,乐播体育,,https://toutiao.com/group/7384335028576059923/,,0,0,True
军号一响，全军出击！,2024-09-19 08:01,9499,596,中国军号,中国军号,,https://toutiao.com/group/7416261401477382668/,,0,0,True
男人和女人的需求差别这么大？,2024-07-12 11:00,27529,1988,周小鹏,周小鹏,男人和女人的需求差别这么大？,https://toutiao.com/group/7388885573953389092/,,0,0,True
为什么说从2025年开始，70岁以上的老人，可能面临“两大”问题？,2024-09-01 14:12,2121,269,水大叔,水大叔,据可靠数据了解，我国70岁以上的人口数量已经达到了2.5亿人次，占到全国总人口数量的18%。伴随着人口老龄化的出现，养老问题也成了重中之重，要知道养老不仅仅是家庭的责任，更是社会责任。,https://toutiao.com/group/7409677025897710106/,,0,0,False
假如地铁逃生反着玩，金龙烂大街被嫌弃 #和平精英地铁逃生,2024-09-03 10:35,1763,156,天成说游,天成说游,,https://toutiao.com/group/7410363542279881267/,,0,0,True
张紫妍：被迫陪睡31人近百次，遭道具虐待，29岁自杀留230页遗书,2024-07-24 02:37,11633,789,八号探秘人,八号探秘人,在阅读此文之前，辛苦您点击一下“关注”，既方便您进行讨论和分享，又能给您带来不一样的参与感，感谢您的支持！本文叙述皆有官方信源，为了读者有更好体验，放在了文章后缀！,https://toutiao.com/group/7394994383675736576/,,0,0,False
