title,publish_time,like_count,comment_count,media_name,source,abstract,article_url,tag,is_yaowen,article_sub_type,has_video
独家完整版视频丨国家主席习近平发表二〇二五年新年贺词,2024-12-31 11:15,43215,25524,央视新闻,央视新闻,新年前夕，国家主席习近平通过中央广播电视总台和互联网，发表了二〇二五年新年贺词。全文如下：大家好！时间过得很快，新的一年即将到来，我在北京向大家致以美好的祝福！2024年，我们一起走过春夏秋冬，一道经历风雨彩虹，一个个瞬间定格在这不平凡的一年，令人感慨、难以忘怀。,https://content-static.cctvnews.cctv.com/snow-book/index.html?item_id=1506781951411024055&source=50006&sub_source=50006_001,,0,0,False
独家视频丨国家主席习近平向大家致以美好的祝福,2024-12-31 11:04,2647,2308,央视新闻,央视新闻,新年前夕，国家主席习近平通过中央广播电视总台和互联网，发表了二〇二五年新年贺词。习近平：大家好！时间过得很快，新的一年即将到来，我在北京向大家致以美好的祝福！©2024中央广播电视总台版权所有。未经许可，请勿转载使用。,https://content-static.cctvnews.cctv.com/snow-book/index.html?item_id=3058834507220543667&source=50006&sub_source=50006_001,,0,0,False
独家视频丨习近平：两岸同胞一家亲 谁也无法割断我们的血脉亲情,2024-12-31 11:12,1280,1625,央视新闻,央视新闻,新年前夕，国家主席习近平通过中央广播电视总台和互联网，发表了二〇二五年新年贺词。习近平：两岸同胞一家亲，谁也无法割断我们的血脉亲情，谁也不能阻挡祖国统一的历史大势！©2024中央广播电视总台版权所有。未经许可，请勿转载使用。,https://content-static.cctvnews.cctv.com/snow-book/index.html?item_id=13327794526506738937&source=50006&sub_source=50006_001,,0,0,False
贪官酒桌上的权钱交易，语言天衣无缝，听懂三分都是人精！,2024-11-23 16:24,3708,450,乐视扒剧小妹儿,乐视扒剧小妹儿,,https://toutiao.com/group/7440378916130259496/,,0,0,True
六代机双飞、四川舰三个第一，神雕无人预警机，中国军工震惊美国,2024-12-30 06:02,41126,2115,邱毅台湾,邱毅台湾,,https://toutiao.com/group/7454081205471085107/,,0,0,True
厨师长教你：“葱爆羊肉”羊肉滑嫩、鲜香不膻,2024-12-27 07:34,2725,500,美食作家王刚,美食作家王刚,厨师长教你：“葱爆羊肉”羊肉滑嫩、鲜香不膻,https://toutiao.com/group/7452991735665263139/,,0,0,True
老纪和珅这段对话，以前小时候听不懂，如今听完受益终身,2024-12-28 23:16,4507,1335,乐视扒剧小妹儿,乐视扒剧小妹儿,,https://toutiao.com/group/7453420191947424293/,,0,0,True
央视跨年晚会阵容曝光，看完明星名单，厕所都不敢去上了,2024-12-31 09:19,3205,1901,闻书识焉,闻书识焉,其中最受关注的还是央视跨年晚会，昨日，央视也官宣了晚会第一批明星阵容和播出时间。看到演员阵容真的是百花齐放、星光熠熠，不是一般的豪华，中途厕所都不敢去了。,https://toutiao.com/group/7454493031660667411/,,0,0,False
湖南最长寿老人124岁高龄，长寿秘诀出世，让人大开眼界,2024-12-21 16:00,1841,173,乐视群星访谈秀,乐视群星访谈秀,,https://toutiao.com/group/7450730131821167140/,,0,0,True
山西高院再审“紫藤巷命案”：新证据发现第三人DNA,2024-12-31 10:00,880,416,大河报,大河报,这起凶案发生在临汾市翼城县，2003年，县计生局干部马朝晖在家中遇害，事发后，死者妻子、县报记者、县公安局技术科技术员被认定为案件嫌疑人。,https://news.dahebao.cn/dahe/appcommunity/2133501?newsId=2133501,,0,0,False
被央媒怒批，目不识丁，丢人现眼，这几位“文盲”明星凭什么走红,2024-12-30 10:52,2833,699,与君説,与君説,在阅读此文之前，麻烦您点击一下“关注”，既方便您进行讨论和分享，又能给您带来不一样的参与感，感谢您的支持文、编辑|小娄郭德纲曾说“可以没文凭，但不能没文化”。老郭的这句话在儿子郭麒麟身上体现得淋漓尽致。虽然郭麒麟初中就辍学了，但人家有思想有内涵，是个名副其实的“文化人”。,https://toutiao.com/group/7454151513221661234/,,0,0,False
赖当局为何羁押高安国将军？解放军六代机及076舰震惊台湾,2024-12-30 22:01,28936,1696,黎建南台湾,黎建南台湾,,https://toutiao.com/group/7454328325800985126/,,0,0,True
再现久违声音！蔡磊借助AI完成了一场演讲,2024-12-31 01:12,9413,1333,央视新闻,央视新闻,“我坚信，我们终有战胜渐冻症的那一天。”在《AI奇妙夜》晚会现场，渐冻人蔡磊借助AI完成了一场演讲，重获新“声”！,https://toutiao.com/group/7454377687977722422/,,0,0,True
萝卜和鸡蛋这样做，比吃补药还补，顿顿吃都不会腻，又香又下饭,2024-10-30 12:28,71325,4352,小寒厨艺,小寒厨艺,萝卜和鸡蛋这样做，比吃补药还补，顿顿吃都不会腻，又香又下饭,https://toutiao.com/group/7431405463378919975/,,0,0,True
新婚33天卷走274万4套房，出逃后丈夫跨国追捕，如今下场大快人心,2024-12-20 22:06,4541,235,八号探秘人,八号探秘人,在阅读此文之前，辛苦您点击一下“关注”，既方便您进行讨论和分享，又能给您带来不一样的参与感，感谢您的支持！编辑丨QQ·B“色字头上一把刀！”深圳富豪结婚33天竟被卷走274万元和名下4套房产。不仅如此，他还被扣上了“接盘侠”的帽子，啥也没干喜当爹。,https://toutiao.com/group/7450399558821052982/,,0,0,False
高安国夫妻被秘密收押，赖清德下狠手消灭统派，下一个会是谁？,2024-12-31 08:40,20375,3848,邱毅台湾,邱毅台湾,,https://toutiao.com/group/7454493107262849575/,,0,0,True
零下35度睡到帐篷里，半夜被热醒了，真的太热了,2024-12-30 11:22,3767,689,旅行者小多,旅行者小多,,https://toutiao.com/group/7454163664929554971/,,0,0,True
欧洲会爆发世界大战吗？俄乌2025年能否止战？|凤凰《非常2024》,2024-12-30 07:54,2367,165,凤凰卫视,凤凰卫视,,https://toutiao.com/group/7454110252754010664/,,0,0,True
中国第八道硬菜上桌，美国绝对消化不良！（上）,2024-12-30 22:00,4465,172,占豪,占豪,面对中国科技大爆发，美国怎么办？现在临时再加大力度投入能行吗？,https://toutiao.com/group/7454120162862563840/,,0,0,True
中美贸易战中，我们已不再被动！,2024-12-29 03:00,26739,291,卢克文工作室,卢克文工作室,,https://toutiao.com/group/7453398751932219941/,,0,0,True
老人在家带孙女，儿媳从监控看到这画面泪目了,2024-12-31 02:41,3306,253,新派新闻,新派新闻,,https://toutiao.com/group/7454215156852064818/,,0,0,True
唐嫣胡歌合唱《再回首》，糖糖这眼神绝了，罗晋看了都吃醋,2024-12-27 06:12,1880,357,乐视天天剧好看,乐视天天剧好看,,https://toutiao.com/group/7452970574004879908/,,0,0,True
第6代战机，是怎样炼成的？(上),2024-12-29 14:51,13011,427,静思有我,静思有我,,https://toutiao.com/group/7453846576981606912/,,0,0,True
四川女生在澳洲农场打工的真实生活：早上4点摘草莓，时薪29澳元,2024-12-28 04:26,1747,552,鲸探所,鲸探所,网上有一位博主分享了自己在澳洲农场打工的真实生活，每天早上四点起床摘草莓，一个小时29澳元，一天只需要工作6个小时左右。,https://toutiao.com/group/7453312348158231081/,,0,0,False
宋小宝演五阿哥，小燕子一出场，台下的赵本山都乐了：这真埋汰人,2024-12-30 10:47,2381,395,相声小品社,相声小品社,,https://toutiao.com/group/7454154698954637824/,,0,0,True
海南富商张晖：花8亿建108米海上观音像，4年后死在水中死因成谜,2024-10-19 04:49,4747,839,八号探秘人,八号探秘人,在阅读此文之前，辛苦您点击一下“关注”，既方便您进行讨论和分享，又能给您带来不一样的参与感，感谢您的支持！编辑丨xk他是中国的一名富商，耗费8亿元完成了自己的梦想。可梦想落地成为现实的时候，他却在4年后莫名其妙的死去。他就是张晖，上个世纪末海南岛旅游业的龙头当家人。,https://toutiao.com/group/7427288913095492134/,,0,0,False
痛悼！凌晨2时40分，他走了,2024-12-30 23:27,1354,235,红星新闻,红星新闻,12月29日，中国航天科技集团有限公司第四研究院发布讣告称，中国共产党优秀党员、忠诚的共产主义战士，中国科学院院士、我国固体火箭技术领域的杰出专家，原航天工业部第四研究院院长邢球痕同志，因病医治无效，于2024年12月29日凌晨2时40分在西安逝世，享年95岁。,https://toutiao.com/group/7454349822183752211/,,0,0,False
57岁于文华现状，与丈夫住农村简陋房子，裙子拖地喂着狗生活幸福,2024-12-17 01:24,955,143,焰墨绘史,焰墨绘史,在阅读此文之前，麻烦您点击一下“关注”，既方便您进行讨论和分享，又能给您带来不一样的参与感，感谢您的支持。本文内容均引用权威资料结合个人观点进行撰写，文中已标注文献来源及截图，请知悉。提起于文华，想必当大家都不会陌生，当年的她凭借那首《纤夫的爱》，一夜间家喻户晓。,https://toutiao.com/group/7448948632033722889/,,0,0,False
投票结果出炉，第二个乌诞生，泽连斯基想要的，欧盟拒绝的很干脆,2024-12-31 10:35,1928,110,金亮,金亮,格鲁吉亚投票结果正式出炉，第二个乌克兰已经诞生。泽连斯基想要加入西方世界，但这次欧盟拒绝的很干脆。俗话说得好，一山容不得二虎，可格鲁吉亚却同时存在两位“总统”。近期，格鲁吉亚总统选举正式落下帷幕，当选总统米哈伊尔·卡韦拉什维利在议会宣誓就职，成为了格鲁吉亚的新一任总统。,https://toutiao.com/group/7454522210419393064/,,0,0,False
俄媒：中国这架奇怪飞机与“第六代战机”无关！它根本不是战斗机,2024-12-28 07:19,10239,5373,高峰军事观察,高峰军事观察,世界军事网站被铺天盖地的“银杏叶”战机消息霸屏了，仅凭几条视频和视频截图，网络上对“中国六代机”的讨论已经热火朝天。问题是，这种先入为主给“银杏叶”飞机冠名“六代机”很可能会伤了某些传统军事航空装备大国的自尊。要知道，数十年来西方在军事航空装备技术领域一直是遥遥领先的。,https://toutiao.com/group/7453345649979851264/,,0,0,False
中学男老师搂抱女学生后续：已停职，小孩3岁，视频3点细节被扒出,2024-12-31 02:34,477,196,8卦娱,8卦娱,文|8卦娱本文所有内容皆有官方可靠信息来源，具体资料赘述在文章内部或结尾“古之学者必有师。师者，所以传道受业解惑也”在大概1300年前，韩愈就提出了这样的话，作为老师最应该做的就是把毕生所学教给学生们，但总有一些恶魔打着以老师的名义，做着让人无法接受的糗事。,https://toutiao.com/group/7454397136449618432/,,0,0,False
