title,publish_time,like_count,comment_count,media_name,source,abstract,article_url,tag,is_yaowen,article_sub_type,has_video
谁支持了特朗普上台？原来美国教会及中产，打败了政治邪恶力量！,2024-11-12 22:06,6212,155,黎建南台湾,黎建南台湾,,https://toutiao.com/group/7436517585706811930/,,0,0,True
1米3袖珍美女嫁给1米48男孩，婚后丈夫奇迹长高，两人却不欢而散,2024-09-07 02:55,3882,212,睿之悦,睿之悦,杨萍和葛存苗的婚礼 文|睿之悦 编辑|睿之悦2019年，成都的民政局来了两个“10岁小孩”来登记，工作人员以为是玩闹。两个“小孩”拿出身份证让工作人员看，这才明白，原来是两个再也长不高的成年袖珍人情侣。,https://toutiao.com/group/7411713833267364386/,,0,0,False
特朗普杀回来了，第二次贸易战要来了，中国要做哪些准备？,2024-11-07 15:49,12496,2113,金灿荣教授,金灿荣教授,,https://toutiao.com/group/7434468272764650020/,,0,0,True
特朗普击败哈里斯，最大的输家是谁,2024-11-06 13:56,8532,889,火星方阵,火星方阵,无论谁入主白宫，乌克兰都输了。俄罗斯总统普京打的是消耗战，泽连斯基政府目前的战略是不可持续的。但是，特朗普重返白宫后，乌克兰输得更快更惨。,https://toutiao.com/group/7434164834310849059/,,0,0,True
原来他才是毁掉刘翔真凶，因贪1200万被公审，让刘翔背负多年骂名,2024-08-29 09:58,14225,430,八号探秘人,八号探秘人,在田径场上创造的成绩，至今无人能够打破，甚至在国际上享有盛名。本该继续夺冠之路，却两次因伤退赛，遭到了全网辱骂。,https://toutiao.com/group/7408489498465616410/,,0,0,False
忆往昔，泽连斯基被泼冷水，看今日，更加被动只能尽快休战,2024-11-07 10:20,30806,2292,宋忠平,宋忠平,忆往昔，泽连斯基被泼冷水，看今日，更加被动只能尽快休战,https://toutiao.com/group/7434480186654982656/,,0,0,True
特朗普胜选，赖清德慌了，开始肃清岛内统派，第一招是解散统促党,2024-11-09 08:00,21188,1034,邱毅台湾,邱毅台湾,,https://toutiao.com/group/7434872892791521811/,,0,0,True
富婆给儿子买房，怎料看中售楼女孩，要把她介绍给儿子,2024-10-25 06:56,4721,550,乐视娱乐乐透社,乐视娱乐乐透社,,https://toutiao.com/group/7429603554647605798/,,0,0,True
拦车收费？交警不管！景区不管！政府看不见！九寨沟咋全是土匪？,2024-09-22 15:55,224530,44379,行哥嘚啵嘚,行哥嘚啵嘚,,https://toutiao.com/group/7417496641638400527/,,0,0,True
特朗普为什么不用蓬佩奥，而且面子里子都不给，老蓬犯了什么禁忌,2024-11-12 09:23,27125,1113,邱毅台湾,邱毅台湾,,https://toutiao.com/group/7436320981239235087/,,0,0,True
6年前那个诬告朱军性骚扰，让朱军丢掉工作的弦子，现在如何了？,2024-08-15 06:23,94490,20109,老牧说,老牧说,2018年7月底，一个看似平常的日子，但对于央视的主持人朱军来说，这却是噩梦的开始!如今距离这件事情已经过去了6年，这两位当事人又都是一种怎样的处境?,https://toutiao.com/group/7403242398388503092/,,0,0,False
罕见！100年前，英国游客拍下的清朝乡村，和想象中完全不一样,2024-09-20 02:07,5926,613,万物知识局,万物知识局,泥泞的土路，衣不蔽体的老百姓，即便是达官显贵的家中也十分破败，而这些都是清王朝的历史痕迹，虽说那时候中国摄影技术并不发达，但也有许多外国游客来到这里，拍摄下了许多老照片，为我们留下了珍贵的历史资料，那清朝到底是怎样的面貌呢?,https://toutiao.com/group/7416287738871267855/,,0,0,False
“90后”男子强奸16岁继女，获刑三年二个月,2024-11-12 04:35,2179,3136,大皖新闻,大皖新闻,大皖新闻讯 本该尽到照顾、保护之责，但却动了非分之想，武汉一继父在与继女单独相处期间，强行与其发生性关系，后投案。近日，湖北省武汉市东西湖区人民法院公开该案一审刑事判决书，被告人何某某因犯强奸罪，获刑三年二个月。被告人何某某，1991年出生，重庆市人。,http://www.ahwang.cn/toutiao/202411/2771795.html,,0,1,False
史上最惨双十一！为何消费者都不捧场？只因真的不便宜,2024-11-12 11:00,1035,1331,照理说事,照理说事,昨天是双 11，可是有多少人记得昨天是双 11？又有多少人在昨天剁手购物了？16 年了，双 11 从万民狂欢，怎么变得近乎于销声匿迹了呢？尤其是今年的双 11，它不搞大型晚会了，没有大屏直播销售数据了，甚至连热搜都没上几次。,https://toutiao.com/group/7436345532957753871/,,0,0,False
李玟墓地被曝杂草丛生 粉丝要求恢复原貌,2024-11-13 00:54,222,367,大象新闻,大象新闻,11月11日，李玟位于武汉石门峰纪念公园的墓地被曝杂草丛生、鲜花凌乱不堪的场景，让众多粉丝心痛不已，纷纷站出来为她鸣不平，要求恢复原貌。李玟的墓地坐落在武汉石门峰纪念公园的一处山清水秀之地，这里原本是她家人精心挑选的安息之所。,https://share.hntv.tv/news/0/1856493260006088706,,0,0,False
中央军委原委员、原国务委员兼国防部部长梁光烈逝世,2024-11-12 09:23,6007,1888,北京日报客户端,北京日报客户端,中国共产党的优秀党员，久经考验的忠诚的共产主义战士，我国国防建设和军队军事工作的杰出领导人，中央军委原委员、原国务委员兼国防部部长梁光烈同志，因病于2024年11月12日2时43分在北京逝世，享年84岁。,https://rss2.bjd.com.cn/content/s67331e17e4b0e1ace8a8435e.html,,0,0,False
难怪影视剧中只有上半身，原来镜头外的下半身，个个都惨不忍睹,2024-09-18 05:51,3130,662,沐泠泱,沐泠泱,“原来我们被影视剧“糊弄”了这么多年！”相信很多人在观看影视剧时，难免会被荧幕中各种“花里胡哨”的武功，以及一些沐浴场景所吸引。然而大家不知道的是，其实这不过是导演的“障眼法”罢了，镜头外的下半身，完全可以用“惨不忍睹”来形容。,https://toutiao.com/group/7415829800700396068/,,0,0,False
特朗普战胜哈里斯重新上台，对中国是好是坏？,2024-11-06 08:28,27677,7670,第一军情,第一军情,据央视新闻11月6日最新报道，特朗普成功战胜哈里斯，赢得了2024年美国总统大选，和很多人想象的“战事焦灼”不同，本次美国大选却呈现出一边倒的态势，特朗普兵不血刃，在多个摇摆州成功“翻红”，战胜了民主党候选人哈里斯，再次问鼎美国总统的宝座。那么，既然美国未来四年的“掌门人”已经敲定，对中国又将有什么深远影响，或者用更贴地气的话：对中国是好是坏呢？,https://toutiao.com/group/7434080229624119844/,,0,0,True
今天才知道！电动车“每天充”和“用完再充”，到底哪个更伤电池,2024-08-27 11:19,15419,2365,鲸探所,鲸探所,“今天到底给车充不充电？”估计大多数人每天回家都会想这个问题，看着自己的电动车电量又多又少的，充不充电也是一件非常难以抉择的事情。那么，电动车到底应该怎样充电呢？是每天都充，还是用完之后再充呢？电动车充电不管是在城市还是农村，电动车其实都是人们出门最常见的交通工具。,https://toutiao.com/group/7407773012533117475/,,0,0,False
俩人相亲互相看不上，哪料男方一报母亲身份，姑娘乐了,2024-11-08 01:50,7367,1819,乐视群星访谈秀,乐视群星访谈秀,,https://toutiao.com/group/7434719902990074395/,,0,0,True
山西五台山悬崖上的狐仙洞，发现住着2个千年狐仙，上去吓得腿软,2024-10-22 03:00,8077,777,山西凡凡,山西凡凡,,https://toutiao.com/group/7428429414959940106/,,0,0,True
给近三年最好的10部年代剧排个名：《人世间》第6，第1名没有争议,2024-09-06 08:08,11784,3717,皮皮电影,皮皮电影,时尚是个轮回，电视剧也是。在2020年之前的那些年，电视剧市场基本上都被偶像剧、都市剧霸占。曾经撑起国剧品质的《闯关东》《岁月》这类年代好剧，难见踪影。,https://toutiao.com/group/7411390030722712090/,,0,0,False
3年前，宁夏7岁小女孩一笑走红，后拒百万签约，如今怎么样了？他们后悔了吗？,2024-09-19 07:25,9834,1385,睿之悦,睿之悦,2021年，视频镜头中出现的女孩儿用那一抹甜美的笑容，迅速引起了网友们的广泛关注。有媒体公司看到这一机遇，提出愿意用百万巨资与女孩儿签约，然而，女孩儿的父母却坚决拒绝了这一提议。,https://toutiao.com/group/7416250139544879679/,,0,0,False
公休日增加两天，调休原则优化！明年怎么放假，一图读懂,2024-11-12 10:43,1335,1300,北京日报客户端,北京日报客户端,来源：北京日报客户端记者：白歌,https://rss2.bjd.com.cn/content/s673330fde4b0a29cf60e9356.html,,0,0,False
炸萝卜丸子到底用面粉还是淀粉，教你正确做法，外焦里嫩，太香了,2024-10-26 09:25,6655,443,家常的味道,家常的味道,,https://toutiao.com/group/7430012978277122611/,,0,0,True
楼市新政、限购放开，一个月来效果如何？,2024-11-10 07:00,1209,937,凤凰卫视,凤凰卫视,,https://toutiao.com/group/7435510471803568651/,,0,0,True
51年洪学智妻子寻女无果，到老乡家歇脚老乡惊呼：你要找得就是我,2024-09-22 01:07,13316,872,品古观今,品古观今,前言1951年，阳曲县委大院突然来了7、8位解放军同志，其中一位女同志，就是洪学智的妻子张文。她此番前来，就是为了寻找多年前因战乱而寄养于民间的爱女。可昔日的小村落早已蜕变成另一番景象，这无异于是大海捞针。,https://toutiao.com/group/7417034363226915354/,,0,0,False
爸妈中，谁的基因决定孩子的智商和长相，专家回答很统一，太准了,2024-08-31 12:04,900,247,5分钟快读,5分钟快读,阅读此文前，诚邀您点击一下“关注”按钮，方便以后持续为您推送此类文章，同时也便于您进行讨论与分享，您的支持是我们坚持创作的动力~在生活中，许多人都相信：“男生随妈妈，女生随爸爸”这一说法。长久以来，许多人对这一说法深信不疑。但随着科学的普及，越来越多的人也对此产生了怀疑。,https://toutiao.com/group/7409241548929499660/,,0,0,False
奶奶的黄金手镯戴了50年，还说是清代几百年前的？鉴宝结果如何,2024-08-16 05:52,26884,9990,小闫打铁镯,小闫打铁镯,奶奶的黄金手镯戴了50年，还说是清代几百年前的？鉴宝结果如何,https://toutiao.com/group/7403611154913690121/,,0,0,True
"万万没想到,53岁“丁克”半辈子的康辉，一生遗憾竟然是一通电话",2024-08-21 22:14,28932,5499,峰哥正读,峰哥正读,在阅读此文之前，麻烦您点击一下“关注”，既方便您进行讨论和分享，又能给您带来不一样的参与感，感谢您的支持！文/编辑：蘑菇百善孝为先。但是到底怎么做才算是“孝”，康辉用了半辈子才明白。央视知名主持人康辉，事业顺遂，家庭幸福，在外人看来是一个人生赢家。,https://toutiao.com/group/7405504703687115273/,,0,0,False
特朗普的和平方案，是俄乌战争的终结者，还是催化剂？ #特朗普,2024-11-09 15:55,14272,947,卢克文工作室,卢克文工作室,,https://toutiao.com/group/7435308876305531418/,,0,0,True
“插混”和“增程”车谁更省钱？内行人：使用5年后，差距很明显,2024-09-09 12:01,673,472,科技熊,科技熊,每当谈起新能源汽车，大家总是绕不开“插混”和“增程”这两个话题。这两种车型在新能源汽车市场上可是风头无两，但很多小伙伴在选择时总是纠结不已：到底哪种更省钱呢？别急，今天我就来给大家好好分析分析，保证让你看完之后心里明镜似的！咱们先来聊聊插混车。,https://toutiao.com/group/7412609757992714790/,,0,0,False
锵锵：马未都聊嫖娼的话题，听起来太有意思了，看完会涨知识的,2024-11-04 10:07,3176,555,乐视综艺咖,乐视综艺咖,,https://toutiao.com/group/7433360748253807144/,,0,0,True
小伙洗完澡故意秀肌肉，富婆心跳加速被当场拿下，这下好看了,2024-10-26 16:20,7394,291,乐视情感讲堂,乐视情感讲堂,小伙洗完澡故意秀肌肉，富婆心跳加速被当场拿下，这下好看了,https://toutiao.com/group/7430011217881596426/,,0,0,True
广西49岁老汉娶19岁姑娘，结婚21年生下15个孩子，如今有何下场？,2024-10-20 08:32,1886,263,艺述史,艺述史,她19岁出嫁，21年里总共生育了15个孩子，其中4个男孩子11个女孩子，家里热闹的像是开了一所学校一样。,https://toutiao.com/group/7427400319418384948/,,0,0,False
珠海航展 “机器狼”首次公开亮相！“铁翼飞旋”带你一探究竟,2024-11-09 02:27,49813,6261,央视频,央视频,,https://toutiao.com/group/7435100516647502336/,,0,0,True
15年前他在爱妻葬礼上哭到昏厥，发誓永不再娶，如今他做到了吗？,2024-08-24 02:17,19476,604,八号探秘人,八号探秘人,在阅读此文之前，辛苦您点击一下“关注”，既方便您进行讨论和分享，又能给您带来不一样的参与感，感谢您的支持！编辑丨xk纵观鱼龙混杂的娱乐圈，有人背叛，有人痴情。而果靖霖则是公认的好男儿，将一生都奉献给妻子。但妻子却仅仅陪他走了半生，没能战胜病魔，不幸离开人世。,https://toutiao.com/group/7406210316734710283/,,0,0,False
男子在路边被黄鼠狼盯住，咬住他的鞋不松口,2024-10-14 06:46,19148,3834,山西广电文娱,山西广电文娱,,https://toutiao.com/group/7425519012454335003/,,0,0,True
相爱37年零绯闻，丁勇岱对赵雪华一见钟情，如今却对儿子很失望,2024-11-09 21:43,1653,125,八号探秘人,八号探秘人,在阅读此文之前，辛苦您点击一下“关注”，既方便您进行讨论和分享，又能给您带来不一样的参与感，感谢您的支持！编辑丨xk1985年，丁勇岱转过楼梯拐角，撞到人生挚爱，这一下把他撞“开窍”了。那时他还不是《末路》里的白宝山。也不是《跨过鸭绿江》里的彭老总，更不是《人世间》里的周志刚。,https://toutiao.com/group/7435160230918406707/,,0,0,False
慢了3秒多！歼-20的拿手绝活竟然输了，俄罗斯还是有两把刷子的,2024-11-12 08:16,1923,975,利刃,利刃,本届珠海航展上的一个重头戏，就是歼-20、歼-35A以及苏-57三款五代机同台亮相，这也是俄罗斯苏-57第一次到中国进行飞行表演。,https://toutiao.com/group/7436303370455138855/,,0,0,False
