title,publish_time,like_count,comment_count,media_name,source,abstract,article_url,tag,is_yaowen,article_sub_type,has_video
把强国建设、民族复兴伟业不断推向前进 习主席新年贺词引发热烈反响,2025-01-04 12:02,266,469,央视新闻,央视新闻,习近平主席发表的二〇二五年新年贺词，汇聚起亿万人民奋进中国式现代化新征程的磅礴力量。大家表示，要坚定信心、满怀希望，脚踏实地、真抓实干，把强国建设、民族复兴伟业不断推向前进。,https://content-static.cctvnews.cctv.com/snow-book/index.html?item_id=8449423022691257472&source=50006&sub_source=50006_001,,0,0,False
石破茂亲中吗？,2025-01-03 13:55,9572,486,静思有我,静思有我,,https://toutiao.com/group/7455642885552079395/,,0,0,True
贪官酒桌上的权钱交易，语言天衣无缝，听懂三分都是人精！,2024-11-23 16:24,4127,492,乐视扒剧小妹儿,乐视扒剧小妹儿,,https://toutiao.com/group/7440378916130259496/,,0,0,True
原来火腿肠铝环下藏着个“小机关”，轻轻一拉，完整剥开，太棒了,2024-12-30 12:48,4557,2830,百变小厨坊,百变小厨坊,原来火腿肠铝环下藏着个“小机关”，轻轻一拉，完整剥开，太棒了,https://toutiao.com/group/7454186052081680911/,,0,0,True
弹性退休细则公布！65后、70后、75后退休节点有变化，如何选择？,2025-01-02 00:07,1593,338,社保当家,社保当家,人社部等部门在1月1日正式发布了《实施弹性退休制度暂行办法》，明确了如何办理弹性退休手续，对养老金领取有何影响等事项，及时了解下。,https://toutiao.com/group/7454882770310119987/,,0,0,False
到底是外公亲，还是爷爷亲？心理学家的答案很统一,2024-12-30 06:35,1079,547,第一心理,第一心理,一位读者来信，提到最近自己遇到的一些家庭相关的琐事，并提出了自己的一些疑问。具体情况如下：这位读者是一个孩子的母亲，与丈夫结婚之后，一直在丈夫家所在城市生活，也受了公公婆婆不少接济，由于自己父母在另外的城市，有点距离但是不远，孩子出生之后也一直与爷爷奶奶接触更多。,https://toutiao.com/group/7454088472568857126/,,0,0,False
我国哪里的面粉无添加？经对比，有这行字就是零添加，可以放心买,2025-01-02 10:44,2516,1077,鲸探所,鲸探所,面粉是我们日常生活中离不开的一种主食，在我国人们的餐桌上是有着非常重要的地位的。可以说，基本上家家户户都是需要用到面粉的，已经快到年下了，许多人也开始往家里置备年货了，而面粉，也是最重要的年货之一。,https://toutiao.com/group/7455263523673834024/,,0,0,False
小子相亲故意扮老，谁知道对方一见面就叫他大爷，这段太逗了,2024-12-24 08:17,3694,849,乐视热播综艺精选,乐视热播综艺精选,,https://toutiao.com/group/7451886130837848610/,,0,0,True
三条腿的陈赓介绍对象这段，据说笑趴整个导演组，太搞笑了,2025-01-02 06:45,2224,464,南哥硬汉秀,南哥硬汉秀,,https://toutiao.com/group/7455192536127275539/,,0,0,True
罕见！一个月内官方三次明确上调养老金，2025养老金调整有惊喜？,2025-01-04 02:56,5357,2956,思之想之,思之想之,在一个月内，官方至少三次明确上调2025年养老金，这个频率是前所未有的，这传递了什么信号呢?思之想之发现，从2024年12月12日开始至今，在一个月内的时间里，官方至少三次明确提出上调2025年养老金。,https://toutiao.com/group/7455850117002691135/,,0,0,False
牛肉价格为啥持续下降？,2024-12-29 16:26,7848,288,强老师儿,强老师儿,,https://toutiao.com/group/7453871032575721999/,,0,0,True
34岁雌雄同体的女性，具备男女两性器官，她该如何生存下去？,2024-10-17 03:32,4593,219,大象微视,大象微视,这个词在我们生活中并不常见，简而言之，双性人就是既拥有男性的生殖器官，也具备女性的特征的人。1989年，王梓淇出生在山西太原的一个家庭，她的家里经营着一家小生意，虽然谈不上富裕，但足够让一家人过得舒心自在。,https://toutiao.com/group/7426578550418948618/,,0,0,False
我家米醋从来不外面买，教你在家做，无添加剂，好吃又卫生,2024-10-31 11:36,6287,827,百变小厨坊,百变小厨坊,,https://toutiao.com/group/7431902258318541324/,,0,0,True
清华简彻底解密三星堆！三星堆居然与上古巫族和墨家息息相关,2025-01-03 10:36,6969,585,seeker大师兄,seeker大师兄,,https://toutiao.com/group/7455636143020474906/,,0,0,True
炸鱼块，到底用淀粉还是面粉，今天分享一个又香又脆的做法,2025-01-02 09:26,6531,411,家常的味道,家常的味道,,https://toutiao.com/group/7455247105683096076/,,0,0,True
乞丐上台唱歌引起评委质疑，一首歌唱完让观众起立鼓掌,2024-11-01 02:16,4910,791,乐视综艺咖,乐视综艺咖,,https://toutiao.com/group/7432129044134494771/,,0,0,True
印度女主播：歼36和076是“光鲜新玩具”，能否生存都是问题,2025-01-02 09:28,3830,990,第一军情,第一军情,日前，在印度知名度非常高的美女主持人帕尔基-夏尔马在电视节目中，“锐评”了中国先进武器的“井喷”式亮相。夏尔马质疑中国六代机也好，新型两栖攻击舰也好，都是没经过实战考验的“纸老虎”，虽然看起来光鲜亮丽，但真打起来很可能露馅。,https://toutiao.com/group/7455247647847219749/,,0,0,True
拜登下台前搅动南海风云，美菲连手挑衅中国，中国不再忍强硬回击,2025-01-03 03:44,20560,909,邱毅台湾,邱毅台湾,,https://toutiao.com/group/7455530031461171753/,,0,0,True
夜里翻来覆去睡不着，原来几根芹菜根就搞定，做法简单，省钱实用,2024-12-25 11:02,10133,1197,百变小厨坊,百变小厨坊,夜里翻来覆去睡不着，原来几根芹菜根就搞定，做法简单，省钱实用,https://toutiao.com/group/7452303315842368052/,,0,0,True
老纪和珅这段对话，以前小时候听不懂，如今听完受益终身,2024-12-28 23:16,5943,1733,乐视扒剧小妹儿,乐视扒剧小妹儿,,https://toutiao.com/group/7453420191947424293/,,0,0,True
叙利亚前总统被谁下毒？俄如何打阿萨德这张牌，不只有交人不交人,2025-01-04 09:00,8909,2047,吕宁思,吕宁思,,https://toutiao.com/group/7455982500683186697/,,0,0,True
吹牛不打草稿，瞎话张口就来，那些忽悠人的“成功学大师”都有谁,2024-12-17 12:07,6110,1201,姩姩有娱,姩姩有娱,出门在外，身份都是自己给的。有人敢说，有人敢信。明明自己过得一片狼藉，却与人大传“成功秘笈”。离谱的是有人对此深信不疑。为了能够获得“成功学秘籍”有人不惜砸锅卖铁，花费重金，也要求购成功秘籍。最终也落得个鸡飞蛋打，血本无归的下场。,https://toutiao.com/group/7449304775688127030/,,0,0,False
今年会举行阅兵仪式吗？我大胆作个猜测,2025-01-03 09:11,13617,1566,金灿荣教授,金灿荣教授,,https://toutiao.com/group/7455614288229728803/,,0,0,True
萝卜和鸡蛋这样做，比吃补药还补，顿顿吃都不会腻，又香又下饭,2024-10-30 12:28,72851,4421,小寒厨艺,小寒厨艺,萝卜和鸡蛋这样做，比吃补药还补，顿顿吃都不会腻，又香又下饭,https://toutiao.com/group/7431405463378919975/,,0,0,True
长期使用等于自杀？海飞丝等20种洗发水被伪科学测评抹黑 洗发水荧光反应不等于有荧光剂,2025-01-03 00:12,1838,538,看看新闻,看看新闻,长期使用等于自杀？海飞丝等20种洗发水被伪科学测评抹黑 洗发水荧光反应不等于有荧光剂,http://mediaplay.kksmg.com/2025/01/03/h264_720p_600k_79529-smgnews-20250103065500-9000-977372-600k_mp4.mp4,,0,0,True
98岁老郎中教我苹果养生新吃法，每天坚持这样吃，睡眠好，身体棒,2024-12-31 11:43,11077,1085,百变小厨坊,百变小厨坊,98岁老郎中教我苹果养生新吃法，每天坚持这样吃，睡眠好，身体棒,https://toutiao.com/group/7454540163725656628/,,0,0,True
打赢我就当你女朋友，特种兵高兴坏了，结果被揍成狗,2024-12-29 16:00,996,169,乐视群星访谈秀,乐视群星访谈秀,,https://toutiao.com/group/7453344587742970383/,,0,0,True
抗美援朝的将军亮相，全体明星自发起立，这幕太感人,2025-01-03 07:32,10553,1259,乐视天天剧好看,乐视天天剧好看,,https://toutiao.com/group/7455587633452843572/,,0,0,True
六代机的先进，好像都没说到位（下）,2024-12-31 13:58,22770,706,静思有我,静思有我,,https://toutiao.com/group/7454575132569240099/,,0,0,True
他的资历比朱德还老，授勋时却错失元帅，毛主席特批享受元帅待遇,2024-12-12 10:24,3322,133,品古观今,品古观今,在我军革命史上，有一位将军的资历比朱德还老，连毛主席都说:“共产党能对国民党将领说话的人不多，他就是其一。”可这样的人却在大授衔时，错失了元帅，后来经过毛主席的一番关心，才得以享受与元帅的同等待遇。,https://toutiao.com/group/7447468654758871592/,,0,0,False
2025年1月起，6种电动车上路不禁、不罚、不查、不扣，放心骑！,2024-12-31 01:29,844,101,新能源战略家,新能源战略家,请您在阅读前，先点击上面的“关注”。感谢您的支持，我们将为您带来更多有价值的内容。最近一段时间，各地频繁对电动车、三轮车、四轮车掀起专项整治行动。对于车主来说，在用车方面也有些受限。担心自己驾驶的电动车不符合要求，上路被交警拦车、罚款。,https://toutiao.com/group/7454381935507374626/,,0,0,False
我国楼市大局已定，未来全国45%的家庭，或将面临“5大挑战”,2024-12-15 11:45,711,108,苍暮颜,苍暮颜,前言:21世纪开始，中国房地产市场一路高歌猛进，繁荣的景象更是吸引了无数投资者和购房者，房价也是一路攀升，也成为了房地产经济增长的重要引擎。,https://toutiao.com/group/7448599203455975947/,,0,0,False
广场舞《红红火火2025年》家庭和睦，幸福大团圆，欢乐笑开颜,2024-12-20 23:56,1346,199,华美舞动广场舞,华美舞动广场舞,华美舞动广场舞《红红火火2025年》喜庆舞背面演示，学跳更轻松更方便,https://toutiao.com/group/7450647160829248034/,,0,0,True
离婚净身出户4年！39岁的前男篮国手孙悦，今已判若两人？,2024-10-29 02:40,3034,176,京城徐福晋,京城徐福晋,2009年，站在NBA总冠军领奖台上的孙悦，或许从未想过，人生的滑铁卢会来得如此之快。彼时，他是中国篮球的骄傲，是闪耀的明星，是手握“王炸”的天之骄子。其实，命运早就定了，荣耀背后藏着不少波折，暗示着未来生活不会一帆风顺。,https://toutiao.com/group/7431017867774902803/,,0,0,False
一大早，西藏特大发现轰动全球，一块石碑竟改写中国历史。,2024-12-22 12:04,6356,779,yuxiL,yuxiL,一大早，西藏特大发现轰动全球，一块石碑竟改写中国历史,https://toutiao.com/group/7451198947801956873/,,0,0,True
从美国的经验来看，中国未来房价的结局,2024-12-18 11:18,8733,2064,资本论,资本论,你如果在两年前问我，房价会不会继续跌，我大概率会告诉你还会继续跌。现在聊到中国房价未来走势的时候，很多人都会提到两个案例，一个是日本案例，另一个则是美国案例。,https://toutiao.com/group/7449709577114894886/,,0,0,False
大陆就统一时间表表态，20万台胞已办身份证？台当局称严查,2025-01-03 11:03,3208,368,第一军情,第一军情,台湾问题是中国核心利益中的核心，已困扰了我们整整75年，成为每一个中国人心中的痛。日前，大陆著名学者在一篇文章表示，未来四年时间，大陆不会制定统一台湾的时间表。,https://toutiao.com/group/7455640102287557156/,,0,0,False
综艺：真是神童一个，算术自学成才，6岁就能对战北大高材生,2024-11-16 20:44,20866,2603,乐视综艺咖,乐视综艺咖,,https://toutiao.com/group/7437795240771060258/,,0,0,True
13对“央视主持人”夫妻对比,2024-12-30 05:30,734,252,文化传媒婆,文化传媒婆,,https://toutiao.com/group/7454072846235566601/,,0,0,False
山楂干泡水很多人都泡错了，难怪没用，今天教你正确做法，真管用,2024-11-02 11:46,7792,292,百变小厨坊,百变小厨坊,,https://toutiao.com/group/7432646945211941402/,,0,0,True
腐竹用清水和开水泡是大错，酒店大厨教我1招，快速柔软还不夹生,2024-11-06 11:49,6250,143,百变小厨坊,百变小厨坊,腐竹用清水和开水泡是大错，酒店大厨教我1招，快速柔软还不夹生,https://toutiao.com/group/7434132052506575394/,,0,0,True
