title,publish_time,like_count,comment_count,media_name,source,abstract,article_url,tag,is_yaowen,article_sub_type,has_video
珠海航展让美国人脊背发凉？新加坡讲出大实话，给了四个原因,2024-11-15 11:15,4618,172,迷彩虎说,迷彩虎说,珠海航展看得美国人脊背发凉，他们从中看到了自己最羡慕，也是最害怕的东西，新加坡媒体将这些东西总结成了四点。,https://toutiao.com/group/7437463076917477897/,,0,0,True
1米3袖珍美女嫁给1米48男孩，婚后丈夫奇迹长高，两人却不欢而散,2024-09-07 02:55,5097,286,睿之悦,睿之悦,杨萍和葛存苗的婚礼 文|睿之悦 编辑|睿之悦2019年，成都的民政局来了两个“10岁小孩”来登记，工作人员以为是玩闹。两个“小孩”拿出身份证让工作人员看，这才明白，原来是两个再也长不高的成年袖珍人情侣。,https://toutiao.com/group/7411713833267364386/,,0,0,False
罕见！100年前，英国游客拍下的清朝乡村，和想象中完全不一样,2024-09-20 02:07,6696,660,万物知识局,万物知识局,泥泞的土路，衣不蔽体的老百姓，即便是达官显贵的家中也十分破败，而这些都是清王朝的历史痕迹，虽说那时候中国摄影技术并不发达，但也有许多外国游客来到这里，拍摄下了许多老照片，为我们留下了珍贵的历史资料，那清朝到底是怎样的面貌呢?,https://toutiao.com/group/7416287738871267855/,,0,0,False
给近三年最好的10部年代剧排个名：《人世间》第6，第1名没有争议,2024-09-06 08:08,12508,3883,皮皮电影,皮皮电影,时尚是个轮回，电视剧也是。在2020年之前的那些年，电视剧市场基本上都被偶像剧、都市剧霸占。曾经撑起国剧品质的《闯关东》《岁月》这类年代好剧，难见踪影。,https://toutiao.com/group/7411390030722712090/,,0,0,False
无缝衔接6个男友，同居5婚导演，逼正宫退位，如今44岁风情依旧！,2024-10-10 21:57,844,294,八号探秘人,八号探秘人,2004年，随着《山花烂漫时》的热播，饰演张桂梅校长的宋佳再次回到人们视野。令人不可思议的是，她跟5婚导演张黎曾有一段跨越伦理的恋情。,https://toutiao.com/group/7424061311518130699/,,0,0,False
2024珠海航展：新军备 新亮点 新杀器 ｜军情观察室,2024-11-15 08:04,4573,225,凤凰卫视,凤凰卫视,,https://toutiao.com/group/7437413939794674185/,,0,0,True
特朗普赢却难就职？拜登怕追责，佩洛西怕牢饭，三大集团蠢蠢欲动,2024-11-14 22:04,38764,1661,黎建南台湾,黎建南台湾,,https://toutiao.com/group/7437259350143402515/,,0,0,True
德国总理朔尔茨和普京通电话，泽连斯基怒了，马斯克随即补上一刀,2024-11-18 06:10,17064,578,邱毅台湾,邱毅台湾,,https://toutiao.com/group/7438497761214857739/,,0,0,True
果然，特朗普开始发威了,2024-11-17 23:00,18288,2516,高志凯频道,高志凯频道,对于关键职位的最新提名，充分体现了对于特朗普来说，忠诚压倒一切。作为近年来权力最大的美国总统，特朗普的破坏力才刚刚开始,https://toutiao.com/group/7437717535526486555/,,0,0,True
3年前，宁夏7岁小女孩一笑走红，后拒百万签约，如今怎么样了？他们后悔了吗？,2024-09-19 07:25,11569,1589,睿之悦,睿之悦,2021年，视频镜头中出现的女孩儿用那一抹甜美的笑容，迅速引起了网友们的广泛关注。有媒体公司看到这一机遇，提出愿意用百万巨资与女孩儿签约，然而，女孩儿的父母却坚决拒绝了这一提议。,https://toutiao.com/group/7416250139544879679/,,0,0,False
包厢全是刚出狱的恶霸，结果一看到饭店主厨，立马怂了,2024-11-11 01:21,6457,145,乐视群星访谈秀,乐视群星访谈秀,,https://toutiao.com/group/7435825833048015400/,,0,0,True
养殖虾都是吃抗生素、激素长大的？到底能不能吃？告诉你真相,2024-10-10 10:02,1040,249,奇妙的本草,奇妙的本草,菜市场里，几位阿姨一起围着在一处海鲜档口处讨论！“现在的虾真是大个儿，还这么便宜！不买上几斤感觉都亏了！”李阿姨高兴地说。王阿姨却连连摇头：“可别太高兴，我听说这些大都是养殖虾，吃了不少激素和抗生素呢，吃了对身体不好。”“真的吗？”李阿姨惊讶地问。,https://toutiao.com/group/7424084752157950516/,,0,0,False
郭有才：当迷失方向忘记初心后，曾经飘得多高，如今摔得就多惨,2024-11-11 06:53,972,515,八号探秘人,八号探秘人,在阅读此文之前，辛苦您点击一下“关注”，既方便您进行讨论和分享，又能给您带来不一样的参与感，感谢您的支持！编辑丨brt因为一首翻唱，他一夜之间成为了拥有千万粉丝的网红。但是“人红是非多”，不久他就因为版权等问题陷入了舆论风波。他的人气一落千丈，从万众瞩目变成了现在的无人问津。,https://toutiao.com/group/7435901170239078948/,,0,0,False
服用他达拉非的患者会对身体造成伤害吗？切记“3要2不要”,2024-09-15 14:56,839,153,李药师谈健康,李药师谈健康,口服药物是治疗勃起功能障碍的主要方式之一，随着ED群体的逐年增长，造福全球男性的「伟哥」由此诞生。相比大家都很熟悉的西地那非，他达拉非这个后起之秀，也逐渐被大家所认可。,https://toutiao.com/group/7414883509208220201/,,0,0,False
67岁执意生娃，如今却坐轮椅无法自理，5岁的天赐被迫独立学洗衣,2024-11-04 10:32,4000,996,睿之悦,睿之悦,2019年，已经67岁的田新菊执意生下了自己的第三个孩子小天赐。那么，现如今5年的时间过去了，这“天赐”的礼物到底是福还是祸呢?,https://toutiao.com/group/7433367394946384435/,,0,0,False
美妇约见老情人，见面场景真是太逗了，这俩人绝配！,2024-10-27 16:25,3676,474,乐视明星的那点事,乐视明星的那点事,美妇约见老情人，见面场景真是太逗了，这俩人绝配！,https://toutiao.com/group/7428157095108674088/,,0,0,True
顾客试衣服8小时到凌晨2点买走15件，37岁女老板直呼害怕：开店6年头一次遇到，还要请我吃夜宵,2024-11-18 05:10,3239,1616,大河报,大河报,来源 | 潇湘晨报、晨视频记者 | 张沁近日，安徽淮南一女装店老板发布视频称，有位顾客试7个多小时的衣服，从下午6点至凌晨2点，最终买走15件，37岁店老板余女士表示，“第一次遇见这样的顾客，她就是越试越喜欢，我们一边聊天一边试，就没有看时间。,https://toutiao.com/group/7438481982369137178/,,0,0,False
虎口脱险老人谈邻居被老虎咬伤：老虎就在地头，老大了！,2024-11-18 07:02,627,722,红星新闻,红星新闻,11月18日，我们视频实地对话黑龙江七台河市勃利县与老虎隔门相遇的村民。长太村村民张先生描述，一早起来听到“呼呼呼”的虎啸声，隔壁有养牛的邻居被咬伤。当时张先生出门想看看情况，结果老虎冲着他跑过来，把铁栅栏门都撞弯了。,https://toutiao.com/group/7438510799309636096/,,0,0,False
中美一旦爆发战争，美国候任防长说出结果：20分钟就能分出胜负,2024-11-17 12:12,7037,1369,全荃,全荃,美国候任防长海格塞斯宣称，中美一旦开打，20分钟内就能分出胜。事关中美关系，美方大肆炒作所谓“中国威胁”，显然是别有用心。,https://toutiao.com/group/7438219748757832204/,,0,0,False
破解特朗普加征关税，中国有7招,2024-11-15 14:05,25980,1704,静思有我,静思有我,,https://toutiao.com/group/7437506977830044200/,,0,0,True
炸萝卜丸子到底用面粉还是淀粉，教你正确做法，外焦里嫩，太香了,2024-10-26 09:25,9335,606,家常的味道,家常的味道,,https://toutiao.com/group/7430012978277122611/,,0,0,True
湖北八兄弟凿山为屋，整座大山被掏空，看看里面的卧室是什么样的,2024-11-18 12:08,2015,313,清闲的溪流MgirQsd,清闲的溪流MgirQsd,19. 湖北八兄弟凿山为屋，整座大山被掏空，看看里面的卧室是什么样的,https://toutiao.com/group/7438120290065842715/,,0,0,True
对比苏-57和歼-35A，为中国复兴不再受辱而落泪 ，也冷静检讨不足,2024-11-17 22:01,31706,1619,黎建南台湾,黎建南台湾,,https://toutiao.com/group/7438371662023623168/,,0,0,True
总裁故意扮成保安，试探相亲姑娘，不料对方反应逗了,2024-11-01 09:44,3392,455,乐视热播综艺精选,乐视热播综艺精选,,https://toutiao.com/group/7431780632960696847/,,0,0,True
新能源汽车将彻底被消灭？电车的前景如何？专家一语道破,2024-11-18 02:55,375,156,量子教育新商学,量子教育新商学,新能源汽车将彻底被消灭？电车的前景如何？专家一语道破,https://toutiao.com/group/7438447674698760719/,,0,0,True
51年洪学智妻子寻女无果，到老乡家歇脚老乡惊呼：你要找得就是我,2024-09-22 01:07,14535,947,品古观今,品古观今,前言1951年，阳曲县委大院突然来了7、8位解放军同志，其中一位女同志，就是洪学智的妻子张文。她此番前来，就是为了寻找多年前因战乱而寄养于民间的爱女。可昔日的小村落早已蜕变成另一番景象，这无异于是大海捞针。,https://toutiao.com/group/7417034363226915354/,,0,0,False
今天才知道！电动车“每天充”和“用完再充”，到底哪个更伤电池,2024-08-27 11:19,15796,2380,鲸探所,鲸探所,“今天到底给车充不充电？”估计大多数人每天回家都会想这个问题，看着自己的电动车电量又多又少的，充不充电也是一件非常难以抉择的事情。那么，电动车到底应该怎样充电呢？是每天都充，还是用完之后再充呢？电动车充电不管是在城市还是农村，电动车其实都是人们出门最常见的交通工具。,https://toutiao.com/group/7407773012533117475/,,0,0,False
著名专家预言：试管婴儿寿命仅40年，那首例试管婴儿如今怎样了？,2024-09-01 06:05,10100,489,睿之悦,睿之悦,文|睿之悦编辑|睿之悦“试管婴儿活不到40岁？”1988年3月10日，我国首例试管婴儿顺利诞生。在当时，试管婴儿的技术正处于起步阶段，因此，有人将其视为医学的奇迹，但也有人则预言试管婴儿活不过40岁。那么，36年的时间过去了，我国首例试管婴儿如今怎么样了呢？,https://toutiao.com/group/7409105262277853733/,,0,0,False
女儿花500块租男友，没想他是身价过亿的总裁，这下好运了,2024-10-18 09:42,8120,1520,乐视娱乐乐透社,乐视娱乐乐透社,,https://toutiao.com/group/7427048858267419190/,,0,0,True
黄芪伤肾，黄芪泡水喝危害多？再次提醒：真正伤肾的是这3类中药,2024-10-29 07:34,29822,2440,梁医学社梁怡璋医生,梁医学社梁怡璋医生,,https://toutiao.com/group/7431097743307473408/,,0,0,True
俩人相亲互相看不上，哪料男方一报母亲身份，姑娘乐了,2024-11-08 01:50,9209,2164,乐视群星访谈秀,乐视群星访谈秀,,https://toutiao.com/group/7434719902990074395/,,0,0,True
宝宝出生时“几斤几两”，能暗示智商高低？医生：最佳标准在这里,2024-09-04 10:41,2105,491,39健康网,39健康网,琳琳是一位二胎宝妈，老大出生的时候只有5斤重，一家人都十分心疼他，平常照顾得十分尽心，现在看起来和同龄的小孩没什么区别。于是在去年，琳琳和丈夫一起商量要了二胎，可能是有经验，出生的时候有8斤重。,https://toutiao.com/group/7410732676779115048/,,0,0,False
吕礼诗参观珠海航展，见中国强激动流下男儿泪，台独玻璃心又碎了,2024-11-16 04:45,31470,1265,邱毅台湾,邱毅台湾,,https://toutiao.com/group/7437733759829180969/,,0,0,True
印度“飞饼”高超导弹发射，印媒自吹：可封锁中国海上生命线,2024-11-18 05:45,1109,212,第一军情,第一军情,据“印度快报”报道，当地时间11 月 16 日，印度国防研究与发展组织（DRDO）于在奥里萨邦外海的阿卜杜勒-卡拉姆岛（位于孟加拉湾附近），试射了一枚自研远程高超音速导弹，一时之间，各种消息铺天盖地，纷纷“赞叹”新德里取得“巨大进步”，跻身“精英行列”。,https://toutiao.com/group/7438491250409341474/,,0,0,True
拜登铤而走险，特朗普上台前引发三战？共和党锦衣卫vs民主党反扑,2024-11-18 12:57,10262,200,终南剑客,终南剑客,本期话题，特朗普的锦衣卫，民主党的反扑，美国的东厂西厂。,https://toutiao.com/group/7438602592822755903/,,0,0,True
成交2800亿，售出1195架飞机，中国拿下大单，足够造46艘055大驱,2024-11-18 10:32,2977,549,东方点兵,东方点兵,本届珠海航展成交金额再创新高，达到了2800亿，以这个价格来计算的话已经足够再造46艘055大驱，进一步彰显了中国制造实力的同时，也展示了中国军工的蓬勃发展。01 本届珠海航展卖出1195架飞机本届珠海航展3款五代机同款亮相，达成了历史性一幕的同时，也让这次航展的成交额再创新高。,https://toutiao.com/group/7438561690305839657/,,0,0,False
