title,publish_time,like_count,comment_count,media_name,source,abstract,article_url,tag,is_yaowen,article_sub_type,has_video
公公竟然和儿媳偷情，哪料被妻子撞见，这下有戏看了！,2025-01-21 08:05,7963,719,南瓜午夜厅,南瓜午夜厅,,https://toutiao.com/group/7462273852651979274/,,0,0,True
走失女童重要线索：游客照片中出现可疑身影 搜救者发现一条路,2025-01-25 03:21,936,102,老刘拉呱,老刘拉呱,,https://toutiao.com/group/7463682228036305435/,,0,0,True
女房东爱上24岁男租客，这样的话也说得出口，涂磊神助攻,2025-01-18 02:53,4598,222,金曲大荟萃,金曲大荟萃,女房东爱上24岁男租客，这样的话也说得出口，涂磊神助攻,https://toutiao.com/group/7461083095078044195/,,0,0,True
女子结婚4年不知丈夫真实背景，节目组立即调查有惊人发现,2025-01-25 16:51,875,372,闲鱼搞笑,闲鱼搞笑,,https://toutiao.com/group/7463896647798391307/,,0,0,True
小鲜肉对大姐展开猛烈攻势，大姐终于抛开世俗，爱上他了！,2025-01-03 16:27,559,107,超级明星咖,超级明星咖,,https://toutiao.com/group/7454750963602113074/,,0,0,True
三个女婿两个富一个穷，岳父骂穷女婿没出息，有好戏看了,2025-01-23 16:47,1652,357,家庭那点儿事,家庭那点儿事,,https://toutiao.com/group/7463106813945217551/,,0,0,True
赵本山凭这一个小品，捧红了王小利，全程笑点不断,2025-01-04 20:46,6255,1334,娱快很简单,娱快很简单,,https://toutiao.com/group/7454123678406541824/,,0,0,True
办三婚喜酒：邻居终于受不了一次次给彩礼钱，在现场骂了起来,2025-01-25 06:09,4915,2117,乎乎,乎乎,,https://toutiao.com/group/7463731384029446710/,,0,0,True
老虎罕见捕猎镜头，比大片还震撼！……,2025-01-24 05:44,3320,768,你若不离不弃！我必生死相依！,你若不离不弃！我必生死相依！,,https://toutiao.com/group/7463353764549526016/,,0,0,True
监控下的一幕，大黄狗在外溜达，不料下一秒就一命呜呼了,2025-01-25 08:08,10258,317,侃剧机动队,侃剧机动队,,https://toutiao.com/group/7463761703168246306/,,0,0,True
