title,publish_time,like_count,comment_count,media_name,source,abstract,article_url,tag,is_yaowen,article_sub_type,has_video
习近平结束出席亚太经合组织第三十一次领导人非正式会议、二十国集团领导人第十九次峰会并对秘鲁、巴西国事访问回到北京,2024-11-23 01:29,4395,2615,新华网,新华网,11月23日上午，国家主席习近平结束出席亚太经合组织第三十一次领导人非正式会议、二十国集团领导人第十九次峰会并对秘鲁、巴西的国事访问后乘专机回到北京。,http://my-h5news.app.xinhuanet.com/h5/article.html?articleId=81230594ed09ba97882b78aeefc64fd0,,0,0,False
习言道｜中巴元首会谈，习近平提到球王贝利名言,2024-11-23 04:04,738,293,上观新闻,上观新闻,中新网11月21日电 题：中巴元首会谈，习近平提到球王贝利名言巴西首都巴西利亚，习近平主席此次拉美之行的第三站。当地时间11月20日，巴西总统卢拉为习近平举行最高礼遇的隆重欢迎仪式，随后中巴元首举行会谈。其间，几个细节凸显出中巴之间特殊情谊。,https://export.shobserver.com/toutiao/html/822066.html,,0,0,False
被姚明抱着上奥运的小英雄，曾发誓考上清华，16年后活成了这样,2024-11-07 08:07,2612,620,睿之悦,睿之悦,2008年，年仅9岁的林浩，在姚明的带领下走进了北京奥运会开幕式的舞台上，成为了万众瞩目的“焦点”。,https://toutiao.com/group/7434444094551687707/,,0,0,False
男子实名举报县委副书记婚内出轨自己老婆，聊天截图被曝光,2024-11-22 14:45,996,296,大皖新闻,大皖新闻,11月19日，湖南长沙的程先生在社交平台，手持身份证实名举报海南省陵水黎族自治县县委副书记兼政法委书记肖某，破坏其家庭，长期与其爱人保持不正当关系。并晒出多张妻子和肖某的露骨聊天截图，聊天内容十分暧昧。,http://www.ahwang.cn/toutiao/202411/2777644.html,,0,1,False
24小时内，中国两次遭到抗议，美国不敢说的话，帕劳总统一句不落,2024-11-16 09:18,2420,1395,千钧堂,千钧堂,,https://toutiao.com/group/7437804132901061171/,,0,0,True
恩波格斗俱乐部发布声明！恩波已被限制高消费,2024-11-22 08:55,245,238,潇湘晨报•晨视频,潇湘晨报•晨视频,近日，恩波格斗俱乐部向警方报案称，王宝强及其公司涉嫌诈骗，引发关注。随后，王宝强工作室发布微博，“白纸黑字签订的分文不差，承诺过的帮助也从未食言。无愧于心，也绝不负信任，我们静待法律结果。”针对王宝强工作室的回应，恩波格斗俱乐部今日发布声明回复。,http://api.chenshipin.com/wap/a/674046398420177eb7559498/90f456b81afce808c1fcfbd3f5761f65/1732265596/c657e4ad16981cd6655368fb532133b8ac1d6bee4143eecfb10e8352b2a0c643,,0,0,False
山西一女教师出轨学生，聊天记录曝光后被停职,2024-11-22 09:25,1622,3931,大皖新闻,大皖新闻,大皖新闻讯11月22日，有山西长治市沁源县的网民发布了一段视频，声称当地一职业中学女老师出轨一男学生，双方的聊天记录被曝光，引发广泛关注。,http://www.ahwang.cn/toutiao/202411/2777479.html,,0,1,False
男子投诉环保问题被打断肋骨，经过区、镇干部协调和解后获赔300万元，一年后被判寻衅滋事追缴违法所得,2024-11-22 14:04,10863,6575,大风新闻,大风新闻,持续向上级投诉山东重山集团有限公司环保问题多年的王长征，在2021年6月23日与重山集团保安人员的冲突中被打致局部脑损伤、头部及全身多处软组织损伤、颈部损伤、多根肋骨骨折。,https://toutiao.com/group/7440095550873027106/,,0,0,False
浙大一贫困生晒国内外多地旅游照引热议 该生家乡民政局回应：贫困证明没问题,2024-11-22 09:44,396,1058,封面新闻,封面新闻,封面新闻记者 陈彦霏近日，浙江大学一贫困生，在朋友圈晒出国内外多地旅游的照片，引发网友关注和热议。,https://m.thecover.cn/news_details.html?from=web&eid=x4D1hlFuojSH90qSdq8Jkw==,,0,0,False
特朗普时代，中日合作机遇显现？俄乌对峙升级，明年有重大拐点,2024-11-20 10:52,14242,905,邱震海,邱震海,,https://toutiao.com/group/7439312593905025562/,,0,0,True
首例5胞胎长大了，父亲已过劳去世 母亲直言：如能重来一个也不要,2024-08-31 03:06,3114,846,睿之悦,睿之悦,2002年，在北京的一家妇产医院中，一位来自河北的孕妇顺利生下了两男三女的五胞胎，创造了一个全国罕见的奇迹。,https://toutiao.com/group/7409098624111575603/,,0,0,False
罕见！100年前，英国游客拍下的清朝乡村，和想象中完全不一样,2024-09-20 02:07,7176,673,万物知识局,万物知识局,泥泞的土路，衣不蔽体的老百姓，即便是达官显贵的家中也十分破败，而这些都是清王朝的历史痕迹，虽说那时候中国摄影技术并不发达，但也有许多外国游客来到这里，拍摄下了许多老照片，为我们留下了珍贵的历史资料，那清朝到底是怎样的面貌呢?,https://toutiao.com/group/7416287738871267855/,,0,0,False
特务男扮女装混进村子，孩子兵顿时发现不对劲，这下精彩了,2024-10-28 06:09,5275,547,乐视群星访谈秀,乐视群星访谈秀,,https://toutiao.com/group/7430704630294413878/,,0,0,True
拜登挖坑摆烂，特朗普眼前困难重重荆棘满布，各国向中国靠拢避险,2024-11-22 08:15,14359,186,邱毅台湾,邱毅台湾,,https://toutiao.com/group/7440014294332211727/,,0,0,True
俄军一发中导，炸出西方软肋？美专家提醒：中国的导弹更快更强大,2024-11-22 10:05,3558,163,东方点兵,东方点兵,俄军一枚中导突破西方防空体系，面对俄军导弹突防打击形同虚设，美专家无奈提醒，中国的导弹更快更强大。美媒《军事观察》发文表示，俄军使用的中程高超音速导弹，只是俄方说法，这款“榛子”导弹按照西方的定义就是洲际弹道导弹标准，俄军首次使用洲际弹道导弹介入实战，这个警告信号简直是再也明显不过。,https://toutiao.com/group/7440040751284765247/,,0,0,False
农村姑娘进豪门被看不起，不料她竟然是个学霸，这下有好戏看了,2024-11-20 16:13,1427,409,乐视情感讲堂,乐视情感讲堂,,https://toutiao.com/group/7439348230468403724/,,0,0,True
“最牛星二代”廖凡，出道24年从不拼爹，妻子是周星驰的黄金拍档,2024-11-20 05:35,1745,890,卿羽飞,卿羽飞,最近电视剧《宿敌》正在央视8台热播中，不知道大家有没有观看呢?这部电视剧的主演是廖凡和朱珠，这真的是让人意想不到的搭配，廖凡和朱珠也是非常的有CP感。,https://toutiao.com/group/7439209147201077812/,,0,0,False
太美了！徐枫灿私服照片曝光，简直美的不可方物，网友：原地出道,2024-11-20 10:02,779,211,稻述,稻述,自从11月初再次亮相珠海航展后，女飞行员徐枫灿成为了无数人心中的梦中情人。虽身材高挑，样貌出众，笑容甜美，但这些，其实都是她最不值得一提的优点!,https://toutiao.com/group/7439290351493464628/,,0,0,False
风水：梁朝伟给富婆看风水，这服务必须到位，这段太精彩了,2024-11-19 01:57,5664,917,南瓜钟意你,南瓜钟意你,风水：梁朝伟给富婆看风水，这服务必须到位，这段太精彩了,https://toutiao.com/group/7438803799575102003/,,0,0,True
未来三年：稳住，你就赢了,2024-08-31 13:38,4234,633,洞见,洞见,财经博主@曹多鱼说过一个扎心的现象:这两年有上进心的人，都负债累累了。“大环境不明朗的情况下，你就像陷进了泥坑里。,https://toutiao.com/group/7409296614000427571/,,0,0,False
日本展出最新型激光武器，不比不知道，一比吓一跳,2024-11-19 12:12,22902,1665,陈虎点兵,陈虎点兵,,https://toutiao.com/group/7438962223550857768/,,0,0,True
美国暗流涌动，特朗普对深层政府摊牌，拜登会否成“五日京兆”？,2024-11-21 22:01,18524,477,黎建南台湾,黎建南台湾,,https://toutiao.com/group/7439856002679177768/,,0,0,True
特朗普准备开打中美贸易战，临阵换将金融大鳄出马，又是反华鹰派,2024-11-21 05:14,13371,498,邱毅台湾,邱毅台湾,,https://toutiao.com/group/7439596532728496675/,,0,0,True
俄版东风26首战告捷，10马赫砸穿防空，乌惊慌失措，西方集体失声,2024-11-22 03:51,1671,312,东方点兵,东方点兵,俄军首次动用“洲际弹道导弹”，人类历史上第一次参加实战，10马赫划破乌克兰夜空，6发分导式弹头砸穿破防乌军防空体系，西方集体失声，乌方惊慌失措。,https://toutiao.com/group/7439941646604583443/,,0,0,False
一根香蕉拍出520万美元，买家是中国的孙宇晨：拍下后我要吃掉,2024-11-21 10:04,1321,1810,潇湘晨报•晨视频,潇湘晨报•晨视频,（《喜剧演员》，2019）意大利艺术家卡特兰用胶带把一根香蕉黏在墙上，创作三幅名为《喜剧演员》的艺术品。20日晚间，其中一幅在纽约苏富比拍卖会以520万美元（折合人民币约3764万元）拍出，引发热议。,http://api.chenshipin.com/wap/a/673f01928420174cef02f626/90f456b81afce808c1fcfbd3f5761f65/1732183392/bca20422c40236a87b75bd3b873530669296a491a4c2dc0824ac5eb6f3bfcd2b,,0,0,False
俩人相亲互相看不上，哪料男方一报母亲身份，姑娘乐了,2024-11-08 01:50,9894,2256,乐视群星访谈秀,乐视群星访谈秀,,https://toutiao.com/group/7434719902990074395/,,0,0,True
1米3袖珍美女嫁给1米48男孩，婚后丈夫奇迹长高，两人却不欢而散,2024-09-07 02:55,5721,283,睿之悦,睿之悦,杨萍和葛存苗的婚礼 文|睿之悦 编辑|睿之悦2019年，成都的民政局来了两个“10岁小孩”来登记，工作人员以为是玩闹。两个“小孩”拿出身份证让工作人员看，这才明白，原来是两个再也长不高的成年袖珍人情侣。,https://toutiao.com/group/7411713833267364386/,,0,0,False
原来他才是毁掉刘翔真凶，因贪1200万被公审，让刘翔背负多年骂名,2024-08-29 09:58,15233,463,八号探秘人,八号探秘人,在田径场上创造的成绩，至今无人能够打破，甚至在国际上享有盛名。本该继续夺冠之路，却两次因伤退赛，遭到了全网辱骂。,https://toutiao.com/group/7408489498465616410/,,0,0,False
河南女子去世，山东丈夫将手机埋墓里，充1000元话费，每天打电话,2024-11-01 06:52,3007,2773,何止电影,何止电影,2014年11月17日，河南肿瘤医院的病房中举行着一场特殊的婚礼，主角是于海宁跟他的患有癌症的妻子范会香。在几个月前范会香确诊癌症，跟男友提出分手，于海宁不远万里来到了女友的城市，照顾患癌女友。得知女友时日无多，在病房中跟女友求婚，在病房中举办了婚礼，婚后一年，范会香去世。,https://toutiao.com/group/7432199981609534004/,,0,0,False
极为罕见！大连渔民吃海螺时，竟然吃出……,2024-11-22 13:37,668,287,环球网,环球网,来源：半岛晨报 老渔民在船上吃海螺时，一口咬下去，牙差点被硌坏，原来海螺里竟然藏了一颗直径5毫米左右的珠子，“我打了20多年鱼，从没听说谁在海螺里发现过珠子。”专家表示，海螺珠极为罕见，目前无法人工培植。,https://3w.huanqiu.com/a/b4164a/4KMWnsnQCQS?agt=20,,0,0,False
许家印，再传新消息！,2024-11-20 03:43,787,376,中国经济网,中国经济网,近日，广州市南沙区人民法院向中国恒大集团及许家印发出限制消费令。因中国恒大集团未按执行通知书指定的期间履行生效法律文书确定的给付义务，对中国恒大集团采取限制消费措施，限制中国恒大集团及其主要负责人许家印不得实施所列出的高消费及非生活和工作必需的消费行为。,https://toutiao.com/group/7439201648771154467/,,0,0,False
