title,publish_time,like_count,comment_count,media_name,source,abstract,article_url,tag,is_yaowen,article_sub_type,has_video
一习话·温暖聆听丨总书记牵挂的头等大事,2025-01-30 08:01,1070,909,央广网,央广网,“家事国事天下事，让人民过上幸福生活是头等大事”“千家万户都好，国家才能好，民族才能好”……老人的就医养老、孩子的抚养教育、年轻人的成长成才，亿万百姓的日常生活“是家事也是国事”，始终是习近平总书记最深切的牵挂。新春佳节，一起温暖聆听！,https://www.cnr.cn/newscenter/local/dftj/20250130/t20250130_527057568.shtml,,0,0,False
什么是人间极品，这才是人间最美姑娘！,2025-01-30 01:02,8468,2431,余笙随伈,余笙随伈,,https://toutiao.com/group/7465507288162370100/,,0,0,True
越南民众围观中国放烟花过大年 河边密密麻麻全是人！越南人慕了,2025-01-29 05:01,62662,8734,熟悉的陌生人,熟悉的陌生人,,https://toutiao.com/group/7465197989557862953/,,0,0,True
起猛了！全网都在模仿春晚跳舞机器人，最后一个直接笑不活了！,2025-01-29 15:25,11338,1614,振振有词儿,振振有词儿,,https://toutiao.com/group/7465358826066231808/,,0,0,True
胡歌给三十年后的自己打电话，谁料刚一开口，唐嫣就憋不住狂笑,2024-12-19 21:22,2845,363,十一同学,十一同学,,https://toutiao.com/group/7450236569186894348/,,0,0,True
团长娶漂亮媳妇，新婚夜耕了一晚上地，战友都傻眼了.,2024-11-04 08:42,4386,1449,素手执白扇,素手执白扇,,https://toutiao.com/group/7433341652430914074/,,0,0,True
父女相处宛如情侣，被指责后变本加厉，真无知还是为流量,2025-01-29 13:24,1165,594,清爽鲸鱼z39,清爽鲸鱼z39,,https://toutiao.com/group/7465327513431065103/,,0,0,True
倪萍心脏要做搭桥，让儿子给凑100万，儿子：要搭个立交桥,2025-01-22 16:26,8323,162,PP千里江湖剧院,PP千里江湖剧院,,https://toutiao.com/group/7461941091638493723/,,0,0,True
