title,publish_time,like_count,comment_count,media_name,source,abstract,article_url,tag,is_yaowen,article_sub_type,has_video
防沙治沙，习近平总书记的深切牵挂,2024-12-03 03:20,672,651,人民日报,人民日报,‍‍‍‌‍‍‌2023年6月，习近平总书记强调，要全力打好河西走廊—塔克拉玛干沙漠边缘阻击战。2024年11月，塔克拉玛干沙漠边缘阻击战空白区锁边“合龙”。无数平凡的治沙人，在塔克拉玛干沙漠边缘，构筑起一道完整的绿色屏障。,https://www.peopleapp.com/column/30047567514-500005968237?utm_source=头条号&promote=true,,0,0,False
只因讽刺医院被春晚毙掉！赵本山这小品堪称封神之作，笑点咔咔整,2024-12-03 03:48,6887,611,小品官方账号,小品官方账号,只因讽刺医院被春晚毙掉！赵本山这小品堪称封神之作，笑点咔咔整,https://toutiao.com/group/7444027595127816743/,,0,0,True
48岁妇女跳完广场舞竟不见！侦察员看监控，简直傻眼了,2024-11-29 01:05,13000,547,PP剧窥百家剧院,PP剧窥百家剧院,,https://toutiao.com/group/7442500822799221274/,,0,0,True
银行存款 “一夜大改”！12月1日开始，5万以上存款家庭要注意了,2024-12-03 09:29,1875,131,陈浩谈事情,陈浩谈事情,银行存款 “一夜大改”！12月1日开始，5万以上存款家庭要注意了,https://toutiao.com/group/7444048289316241929/,,0,0,True
萝卜和鸡蛋这样做，比吃补药还补，顿顿吃都不会腻，又香又下饭,2024-10-30 12:28,56683,3507,小寒厨艺,小寒厨艺,萝卜和鸡蛋这样做，比吃补药还补，顿顿吃都不会腻，又香又下饭,https://toutiao.com/group/7431405463378919975/,,0,0,True
“龙生九子，子子不同”，你知道九子的母亲都是谁吗？,2024-11-21 14:07,3415,748,短剧推荐官,短剧推荐官,睚眦承了狼凶狠的特性，自带杀气，据说青龙偃月刀的吞口，就是用的睚眦的形象。蒲牢嗓门大但胆子小，常年生活海边，最害怕鲸鱼，见到鲸鱼就会大喊大叫。,https://toutiao.com/group/7439733779897385507/,,0,0,False
香港九龙寨城老照片：曾是香港最邪恶肮脏之地，图9场景令人作呕,2024-11-21 11:32,2008,393,万物知识局,万物知识局,有这么一个地方，他虽然地处极度繁华的都市香港，但是却脏乱不堪，环境极度的恶劣，各种违法的交易都在这里进行，甚至黄赌毒，也在这里悄然滋生，这就是九龙城寨。,https://toutiao.com/group/7439657140518519296/,,0,0,False
“中企遭大规模拒签，前所未有”,2024-12-02 09:13,8194,2504,环球时报新媒体,环球时报新媒体,“中企遭大规模拒签，前所未有”,https://toutiao.com/group/7443740275974865423/,,0,0,True
大学生4年间艾滋病感染12397例，60%存在这一行为,2024-12-03 10:16,2603,1412,凤凰网,凤凰网,据相关数据，2020年至2023年，新报告青年学生病例分别为:2977人、3677人、2733人、3010人，四年间共报告12397人。,https://toutiao.com/group/7444127197663396364/,,0,0,False
罕见！100年前，英国游客拍下的清朝乡村，和想象中完全不一样,2024-09-20 02:07,8273,735,万物知识局,万物知识局,泥泞的土路，衣不蔽体的老百姓，即便是达官显贵的家中也十分破败，而这些都是清王朝的历史痕迹，虽说那时候中国摄影技术并不发达，但也有许多外国游客来到这里，拍摄下了许多老照片，为我们留下了珍贵的历史资料，那清朝到底是怎样的面貌呢?,https://toutiao.com/group/7416287738871267855/,,0,0,False
昆明一老板凌晨发地址要求女员工前往，女方拒绝后11分钟被辞退，双方回应,2024-12-03 07:47,993,966,潇湘晨报•晨视频,潇湘晨报•晨视频,12月2日，云南昆明的温女士在社交平台发文称，她在昆明一家饭店就职期间，老板林先生曾凌晨给她发送地址，她拒绝前往被辞退。温女士认为遭遇了潜规则。12月3日，当事人林先生向极目新闻记者否认了这一说法，他表示辞退温女士是因为其在试用期内不胜任工作，而潜规则一说则是子虚乌有。,http://api.chenshipin.com/wap/a/674eb11d84201766ce34e698/90f456b81afce808c1fcfbd3f5761f65/1733211915/086259965befa7ce0010d63b7d055da8fc3d9f805401cb23c031afede2426c9d,,0,0,False
老人疑因嫖娼死亡 社区回应：已确认死亡，老人尸体已被家属抬走,2024-11-27 10:09,2036,954,海峡网,海峡网,近日，网传湖南张家界一名老人疑因嫖娼死亡，引发了大量网友的关注和热议。当地社区回应:已确认死亡，老人尸体已被家属抬走。,http://m.hxnews.com/dzbhz/news/kx/202411/27/jrtt_2182946.shtml,,0,0,False
疑王思聪新女友身份曝光！三周前才满20岁，大量个人私密照曝光,2024-12-02 09:32,121,207,8卦娱,8卦娱,近几日，王思聪再度登上了热搜，不过这一次这位富二代是在日本某家相机店被拍到的，而且让不少人感到惊讶的是，这次站在王思聪身边的女人。,https://toutiao.com/group/7443742142553473563/,,0,0,False
江西夫妻生8孩后双双离世，哥嫂接手拒绝外人领养，咬牙带10娃,2024-11-07 06:09,1697,251,客观听書,客观听書,然而，江西一对夫妻在生了8个孩子之后意外离世，留下一个烂摊子。哥嫂也有2个孩子，却主动站出来帮忙养着，而且拒绝他人领养，让人感动之余难免心生猜忌，毕竟加起来可是10个孩子。,https://toutiao.com/group/7434410975119409716/,,0,0,False
女子称上司凌晨发定位让“来找我”，拒绝后被告知“不用来了”；上司称被冤枉要报警，辞退系其工作多次失误,2024-12-03 14:25,194,340,极目新闻,极目新闻,女网友发帖称遭遇职场“潜规则”一事，引发网友关注。华商报大风新闻记者采访到涉事者，双方各执一词。11月28日，一云南IP网友发文称，上司在员工聚餐后“潜规则”员工被拒，无故辞退员工，其他股东把她踢出工作群，呼吁大家避雷该店铺。,http://jms.ctdsb.net/jmythshare/#/index_share?cId=0&contentType=5&contentId=2319977,,0,0,False
选择联中抗美，石破茂真是亲华首相，在重要场合明确表态,2024-12-03 06:47,1787,236,军情作家陈曦,军情作家陈曦,据报道，日本首相石破茂在临时国会开幕式上，介绍了他之前与中方高层接触的情况，并阐明了自己的对华立场。,https://toutiao.com/group/7444073508466704923/,,0,0,False
男子刷视频发现妻子与他人举办婚礼！背后的秘密更惊人,2024-12-03 00:21,1096,1066,极目新闻,极目新闻,一次偶然的机会，与妻子长期分居两地的阿强（化名）在刷视频时看到小自己11岁的娇妻阿芳（化名）正与他人举办婚礼，而随着阿强的进一步调查，更让他难以接受的事实接踵而至：自己养育了7年的女儿也不是亲生的，妻子口中为他所生的“儿子”更是凭空捏造……气愤、羞恼之余，淮安男子阿强选择拿起法律,http://jms.ctdsb.net/jmythshare/#/index_share?cId=0&contentType=5&contentId=2319202,,0,0,False
东莞一男子转账被限额怒问银行“钱到底是谁的”，中国银行回应,2024-12-03 15:40,725,1629,金羊网,金羊网,近日，一名男子转账遇限额，与中国银行工作人员发生争执。其间，男子情绪激动，怒问：“这（卡）里面的钱到底是谁的？”引发关注。12月3日，记者采访了解到，此事发生于广东东莞一中国银行网点，银行因担心客户遭诈骗，对客户的转账做了限额，在工作人员核实情况后，帮客户进行了处理。,https://news.ycwb.com/2024-12/03/content_53098975.htm,,0,0,False
霉菌超标近6倍！广告语家喻户晓，董事长直播道歉，数度哽咽...,2024-12-03 08:04,135,430,潇湘晨报•晨视频,潇湘晨报•晨视频,旗下1批次小小面包霉菌超标近6倍引发广泛关注后，12月3日，豪士创始人、董事长叶跃辉在直播时为此事道歉，并且数度哽咽。叶跃辉表示，“现在我们好多次出现不好的时候，我们团队一定要根据事实，面对问题，想尽办法来改进，要对得起我们的消费者，目前有这样的情况发生，也是我对不起大家。,http://api.chenshipin.com/wap/a/674eba4e842017444b11afba/90f456b81afce808c1fcfbd3f5761f65/1733212891/2c9801d10d22e780cb314e66713a6ec1302ecb4887f8531ca8f5da7e250043d7,,0,0,False
昆明一饭店老板凌晨发地址要求女收银员前往，女方拒绝后11分钟被辞退，双方回应,2024-12-03 07:10,2617,3517,红星新闻,红星新闻,12月2日，云南昆明的温女士在社交平台发文称，她在昆明一家饭店就职期间，老板林先生曾凌晨给她发送地址，她拒绝前往被辞退。温女士认为遭遇了潜规则。12月3日，当事人林先生向极目新闻记者否认了这一说法，他表示辞退温女士是因为其在试用期内不胜任工作，而潜规则一说则是子虚乌有。,https://toutiao.com/group/7444079495910343220/,,0,0,False
复旦大学女生去台湾交流，看看面对台湾记者的刁难如何回应！爽,2024-12-03 11:20,3451,381,沉着小鱼AA,沉着小鱼AA,,https://toutiao.com/group/7444144068135518760/,,0,0,True
告白：19岁大一姑娘爱上自己哥哥，哥哥亮相后，评委都被帅呆了,2024-11-14 05:15,21914,3991,经典影视大联欢,经典影视大联欢,,https://toutiao.com/group/7436999258307297803/,,0,0,True
包厢全是刚出狱的恶霸，结果一看到饭店主厨，立马怂了,2024-11-11 01:21,10584,260,乐视群星访谈秀,乐视群星访谈秀,,https://toutiao.com/group/7435825833048015400/,,0,0,True
朔尔茨致电普京遭冷遇，贝尔伯克访华难改颓势，德国彻底坐不住了,2024-12-03 06:54,24022,1096,邱震海,邱震海,,https://toutiao.com/group/7444075394451374592/,,0,0,True
中北大学推出巡飞枪，枪身弹药创新设计，后坐力小射击精度更高,2024-11-28 09:54,21927,1426,杜文龙,杜文龙,,https://toutiao.com/group/7442266246671761932/,,0,0,True
警惕“先用后付”小心欠下账单～（央视频号：光华路资讯）,2024-11-27 12:44,17464,4922,央视频,央视频,,https://toutiao.com/group/7441939150552433179/,,0,0,True
外交态度逆转，立陶宛与中方对峙的内幕是？ #立陶宛,2024-12-03 09:02,13759,1167,卢克文工作室,卢克文工作室,,https://toutiao.com/group/7444108279917052425/,,0,0,True
赖清德过境夏威夷，病急乱投医，找上佩洛西通电话，惹怒特朗普,2024-12-03 09:30,12236,172,邱毅台湾,邱毅台湾,,https://toutiao.com/group/7444115695816442395/,,0,0,True
母亲瘫痪、父亲疯了，当年那个744分的高考状元，7年后却成了这样,2024-09-08 00:54,13767,1950,八号探秘人,八号探秘人,母亲截肢瘫痪、父亲疯癫痴傻，可对于自己的亲人，他却做出了这样的评价。而今，7年已过，曾经那个让无数人动容的少年，现在如何?,https://toutiao.com/group/7411852147648496162/,,0,0,False
韩国一夜变天，10个关键问题,2024-12-03 23:14,4907,1090,牛弹琴,牛弹琴,万万没想到，韩国一夜变天，总统尹锡悦掀桌子了。12月3日深夜，他突然宣布，韩国紧急戒严。有朋友问：戒严是什么概念？那是涉及到国本的大事。是要动刀动枪，抓人杀人的。要知道，韩国上次戒严，还是40多年前了。随后，韩国军队上街，首尔市民抗议，世界各国震惊。,https://toutiao.com/group/7444325422541619748/,,0,0,False
广西49岁老汉娶19岁姑娘，结婚21年生下15个孩子，如今有何下场？,2024-10-20 08:32,5536,679,艺述史,艺述史,她19岁出嫁，21年里总共生育了15个孩子，其中4个男孩子11个女孩子，家里热闹的像是开了一所学校一样。,https://toutiao.com/group/7427400319418384948/,,0,0,False
未来5年没大年三十，都是月亮惹的祸！2262年有两个春节放假怎么安排？,2024-12-03 05:12,855,424,极目新闻,极目新闻,2025年1月29日将迎来农历新年蛇年，但2025年没有大年三十，大年二十九过后就是大年初一。据悉，从2025年开始直到2029年，连续五年的除夕都是“大年二十九”。,http://jms.ctdsb.net/jmythshare/#/index_share?cId=0&contentType=5&contentId=2319456,,0,0,False
1米3袖珍美女嫁给1米48男孩，婚后丈夫奇迹长高，两人却不欢而散,2024-09-07 02:55,7196,394,睿之悦,睿之悦,杨萍和葛存苗的婚礼 文|睿之悦 编辑|睿之悦2019年，成都的民政局来了两个“10岁小孩”来登记，工作人员以为是玩闹。两个“小孩”拿出身份证让工作人员看，这才明白，原来是两个再也长不高的成年袖珍人情侣。,https://toutiao.com/group/7411713833267364386/,,0,0,False
女友怀孕了，男友不装了，带她回豪宅！,2024-11-23 08:01,8263,693,乐视大综艺咖,乐视大综艺咖,,https://toutiao.com/group/7440353629540483593/,,0,0,True
弟弟光荣退伍，姐姐兴奋去车站接他，怎料一见弟弟瞬间哭了,2024-11-05 06:34,29458,2874,乐视天天剧好看,乐视天天剧好看,,https://toutiao.com/group/7433679820573934091/,,0,0,True
