title,publish_time,like_count,comment_count,media_name,source,abstract,article_url,tag,is_yaowen,article_sub_type,has_video
今天才知道！电动车“充满不拔”和“没充满拔”，到底哪个更伤车,2024-09-18 07:05,4389,439,鲸探所,鲸探所,电动车对于人们出行来说，是一个非常重要，而且必不可少的交通工具。有的人家中可能不只有一辆电动车，可能家里每个人出行都要备上一辆。,https://toutiao.com/group/7415873367415063080/,,0,0,False
包厢全是刚出狱的恶霸，结果一看到饭店主厨，立马怂了,2024-11-11 01:21,10382,251,乐视群星访谈秀,乐视群星访谈秀,,https://toutiao.com/group/7435825833048015400/,,0,0,True
1米3袖珍美女嫁给1米48男孩，婚后丈夫奇迹长高，两人却不欢而散,2024-09-07 02:55,7032,386,睿之悦,睿之悦,杨萍和葛存苗的婚礼 文|睿之悦 编辑|睿之悦2019年，成都的民政局来了两个“10岁小孩”来登记，工作人员以为是玩闹。两个“小孩”拿出身份证让工作人员看，这才明白，原来是两个再也长不高的成年袖珍人情侣。,https://toutiao.com/group/7411713833267364386/,,0,0,False
郭有才：当迷失方向忘记初心后，曾经飘得多高，如今摔得就多惨,2024-11-11 06:53,1403,675,八号探秘人,八号探秘人,在阅读此文之前，辛苦您点击一下“关注”，既方便您进行讨论和分享，又能给您带来不一样的参与感，感谢您的支持！编辑丨brt因为一首翻唱，他一夜之间成为了拥有千万粉丝的网红。但是“人红是非多”，不久他就因为版权等问题陷入了舆论风波。他的人气一落千丈，从万众瞩目变成了现在的无人问津。,https://toutiao.com/group/7435901170239078948/,,0,0,False
美妇约见老情人，见面场景真是太逗了，这俩人绝配！,2024-10-27 16:25,4497,565,乐视明星的那点事,乐视明星的那点事,美妇约见老情人，见面场景真是太逗了，这俩人绝配！,https://toutiao.com/group/7428157095108674088/,,0,0,True
赖清德未能“过境”美本土，遭朱立伦罕见抨击，暴露国民党真面目,2024-12-02 10:25,12184,165,邱震海,邱震海,,https://toutiao.com/group/7443758625438302755/,,0,0,True
黎智英香港出庭抖内幕，美国介入，蔡英文参与，还有赵少康金小刀,2024-11-27 09:24,38007,2335,邱毅台湾,邱毅台湾,,https://toutiao.com/group/7441887559757595190/,,0,0,True
海南富商张晖：花8亿建108米海上观音像，4年后死在水中死因成谜,2024-10-19 04:49,2079,275,八号探秘人,八号探秘人,在阅读此文之前，辛苦您点击一下“关注”，既方便您进行讨论和分享，又能给您带来不一样的参与感，感谢您的支持！编辑丨xk他是中国的一名富商，耗费8亿元完成了自己的梦想。可梦想落地成为现实的时候，他却在4年后莫名其妙的死去。他就是张晖，上个世纪末海南岛旅游业的龙头当家人。,https://toutiao.com/group/7427288913095492134/,,0,0,False
近5年最热的十部剧，《狂飙》第9，《繁华》第6，第1名很难超越,2024-12-01 03:58,276,123,电影烂番茄,电影烂番茄,今天，番叔就结合口碑，给大家盘点一下近五年，热度最高的十部电视剧。第十名:《都挺好》 猫眼热度 9775.8，播出时间2019年。,https://toutiao.com/group/7430845717314273831/,,0,0,False
炸肉丸子，到底用淀粉还是面粉，教你一招，外酥里软超好吃,2024-10-01 09:23,5718,408,家常的味道,家常的味道,,https://toutiao.com/group/7420735473208787492/,,0,0,True
67岁执意生娃，如今却坐轮椅无法自理，5岁的天赐被迫独立学洗衣,2024-11-04 10:32,7713,1807,睿之悦,睿之悦,2019年，已经67岁的田新菊执意生下了自己的第三个孩子小天赐。那么，现如今5年的时间过去了，这“天赐”的礼物到底是福还是祸呢?,https://toutiao.com/group/7433367394946384435/,,0,0,False
好物分享｜炖牛肉时切记三放两不放，这样炖出来的牛肉才会汤鲜味美,2024-10-15 08:50,5587,227,家味美食,家味美食,,https://toutiao.com/group/7425922043991360037/,,0,0,True
马龙访台，台湾人热烈欢迎，台独焦虑不安视为大敌使出妖魔化老招,2024-11-29 09:56,24509,1032,邱毅台湾,邱毅台湾,,https://toutiao.com/group/7442637867307762230/,,0,0,True
女友怀孕了，男友不装了，带她回豪宅！,2024-11-23 08:01,8094,682,乐视大综艺咖,乐视大综艺咖,,https://toutiao.com/group/7440353629540483593/,,0,0,True
张小斐主持金鸡奖，与央视主持人蓝羽同框，肉眼可见的紧张！,2024-12-02 16:12,515,104,PP宫斗放映厅,PP宫斗放映厅,,https://toutiao.com/group/7443740096940999203/,,0,0,True
自从学会这个西红柿鸡蛋汤，做一辈子厨师的老丈人都对我刮目相看,2024-09-05 12:01,4864,458,一画美食,一画美食,,https://toutiao.com/group/7411128073514385983/,,0,0,True
这绝对是我吃过最好吃的蒜蓉蒸鸡做法,2024-11-11 12:49,2916,233,天天相见厨房(阿见),天天相见厨房(阿见),,https://toutiao.com/group/7436003114588570123/,,0,0,True
“中企遭大规模拒签，前所未有”,2024-12-02 09:13,6242,1984,环球时报新媒体,环球时报新媒体,“中企遭大规模拒签，前所未有”,https://toutiao.com/group/7443740275974865423/,,0,0,True
乌克兰蒙了，欧洲慌了，美国也冷静了,2024-11-26 10:42,15379,504,张元伟,张元伟,,https://toutiao.com/group/7441536551424623114/,,0,0,True
定居中国的美国教授潘维廉：中国远远领先，每次出国都感觉回到20年前,2024-12-02 13:43,2705,430,北京日报客户端,北京日报客户端,2023年，潘维廉在新疆。 采访对象供图“我唯一的遗憾是——没有更早来中国。尽管我亲眼目睹了中国的变化，但也很难相信中国的变化如此迅速和全面。”今年是厦门大学美国教授潘维廉举家到厦门定居的第36年，加上70年代在海峡对岸的台湾省工作两年，潘维廉人生的大部分时光都在中国度过。,https://rss2.bjd.com.cn/content/s674db7ace4b00bb8087b0d95.html,,0,0,False
湖北29名建筑工赴港，3万月薪，亲历者：电话被“打爆”，同事素质高、专业性强,2024-12-02 06:33,1988,937,九派新闻,九派新闻,“拿到工资就放下了担忧！香港对打工人的福利待遇和人文关怀，让人印象深刻。”近日，29名湖北宜昌的建筑工人在香港月薪3万多港币一事引发关注。九派新闻了解到，他们所在的广盛集团和香港方面在2018年就开始接触，彼时共同在宜昌投资装配式建筑生产基地。,http://feed.huiwen.co/rssv2/toutiaohao_article_ttjpnews_9fc19a1f956448fb9826b9fcb4695509/item/IL213N3PGXCVGAD.html,,0,0,False
著名京剧演员童祥苓逝世，曾在现代京剧《智取威虎山》中饰演杨子荣,2024-12-02 12:09,361,237,澎湃新闻,澎湃新闻,澎湃新闻记者从相关部门获悉，著名京剧演员童祥苓先生，因病医治无效，于2024年12月2日下午在上海逝世，享年89岁。童祥苓最为人所熟知的，当属在现代京剧《智取威虎山》中饰演杨子荣一角。在这部戏里，童祥苓将杨子荣的英勇无畏、机智果敢演绎得淋漓尽致。,https://m.thepaper.cn/newsDetail_forward_29521959?from=toutiao,,0,0,False
突然关闭？退货率暴涨，有商家怒了：“比快递费还贵”！有人薅“运费险”8个月骗取100多万元，律师：5万元以上构成犯罪,2024-12-02 17:03,511,547,每日经济新闻,每日经济新闻,公开资料显示，这一险种已出现了10余年，彼时，为解决电子商务发展中退货邮费的消费痛点，电商平台与保险公司共同推出了这一产品。,http://www.nbd.com.cn/rss/jinri_toutiao/articles/3669501.html,,0,0,False
组委会回应6岁女孩跑完42公里全马：其父不顾裁判多次阻拦让女儿违规蹭跑，已处罚,2024-12-02 09:35,1040,1763,九派新闻,九派新闻,近日，在江西上饶婺源县举办的一场马拉松赛事中，一位父亲因体力不支放弃比赛，6岁女孩独自跑完42公里全马，引发关注。有网友质疑该女孩违规参赛，“6岁的小孩怎么能报名全马？,http://feed.huiwen.co/rssv2/toutiaohao_article_ttjpnews_9fc19a1f956448fb9826b9fcb4695509/item/IL213SPK9S5UOVC.html,,0,0,False
