title,publish_time,like_count,comment_count,media_name,source,abstract,article_url,tag,is_yaowen,article_sub_type,has_video
新能源车会淘汰燃油车吗？,2024-12-12 10:09,3790,958,韩秀云讲经济,韩秀云讲经济,,https://toutiao.com/group/7447465366185312820/,,0,0,True
我认识王金平40年，他以最大公约数化解两岸僵局，带领台湾统一,2024-12-12 22:01,14229,2143,黎建南台湾,黎建南台湾,,https://toutiao.com/group/7447648788832846387/,,0,0,True
特朗普就职典礼邀请中方，不按常理出牌！接不接招？,2024-12-13 04:00,2539,640,蒋晓峰Terry,蒋晓峰Terry,,https://toutiao.com/group/7447741482288546338/,,0,0,True
河南警察3岁女儿被拐，苦寻全国23年无果，结果却发现女儿在对门,2024-11-05 07:43,3943,413,八号探秘人,八号探秘人,寻亲23年无果，丢失的女儿竟住在对门?但它却真实发生在河南洛阳的梁绍波身上。是意外走丢，还是人贩子所为，三岁的女儿怎会离奇失踪?,https://toutiao.com/group/7433697108120142345/,,0,0,False
女友怀孕了，男友不装了，带她回豪宅！,2024-11-23 08:01,13477,1046,乐视大综艺咖,乐视大综艺咖,,https://toutiao.com/group/7440353629540483593/,,0,0,True
广西49岁老汉娶19岁姑娘，结婚21年生下15个孩子，如今有何下场？,2024-10-20 08:32,7229,877,艺述史,艺述史,她19岁出嫁，21年里总共生育了15个孩子，其中4个男孩子11个女孩子，家里热闹的像是开了一所学校一样。,https://toutiao.com/group/7427400319418384948/,,0,0,False
被百度发现70亿元“烂账窟窿”？独家还原董事会内幕：“极越的崩盘，早已注定”,2024-12-13 04:49,670,480,21世纪经济报道,21世纪经济报道,有媒体报道称，百度2024年10月曾派财务团队进入极越尽调，为后续30亿投资做准备， 但百度人士称极越一摊烂帐，“有高达70亿财务窟窿，决定不再继续投入。”,http://mp.weixin.qq.com/s?__biz=MjI3Njc0NTk4MQ==&mid=2650431917&idx=1&sn=48f56b7d7ec742e61fea217622386639,,0,0,False
县长看不上乡长送的烟，给他退回来，乡长打开一看乐了,2024-11-13 08:16,8130,1388,乐视大综艺咖,乐视大综艺咖,,https://toutiao.com/group/7436672568578277925/,,0,0,True
小品：杨帆演小沈阳，撒贝宁演赵本山，台词功底太强了吧,2024-11-23 06:13,5547,108,PP宫斗放映厅,PP宫斗放映厅,,https://toutiao.com/group/7440353912709710386/,,0,0,True
江阴、张家港、靖江城市组团陷入困境，说明了什么,2024-09-19 02:49,782,257,上观新闻,上观新闻,城市群、都市圈及多城市组团是一体化和同城化的重要空间形态。长三角一体化发展过程中各地纷纷提出相邻城市谋求联合，建设多城市组团的规划。但并非所有组团发展都如预期，江苏的澄张靖组团在本世纪初跨界园区建设中曾引领潮流，而在长三角区域一体化进程加速之时却一反常态陷入困境，值得回溯反思。,https://export.shobserver.com/toutiao/html/798090.html,,0,1,False
老婆出差回来，看到小保姆的穿着，瞬间不淡定了,2024-11-28 07:23,2776,618,南瓜午夜厅,南瓜午夜厅,,https://toutiao.com/group/7442227512324653608/,,0,0,True
“催买房”无效后，国家将动真格？明年开始房地产将呈现3大变化,2024-12-13 08:57,404,146,历史有点冷,历史有点冷,房价跌了，买房的人却减少了。中国如今的房地产市场，似乎陷入了一个怪圈，而国家又再次出手，到了明年，房地产将会迎来三个新变化。,https://toutiao.com/group/7447815841121206835/,,0,0,False
泽连斯基命令俄境内乌军死守，他提出停战方案，普京不同意？,2024-12-08 04:00,18272,288,邱毅台湾,邱毅台湾,,https://toutiao.com/group/7445206239379718708/,,0,0,True
炸肉丸子，到底用淀粉还是面粉，教你一招，外酥里软超好吃,2024-10-01 09:23,6457,486,家常的味道,家常的味道,,https://toutiao.com/group/7420735473208787492/,,0,0,True
冬天洗澡多久一次最好？这4个时候，劝你不要洗,2024-12-07 10:01,2319,297,环球网,环球网,来源：健康杭州 最近杭城的气温 一天天走低 忙活了一整天，洗个热乎乎的澡 再钻进暖暖的被窝，再舒服不过！ 然而不少人洗澡时 或多或少会犯些错 结果把本该舒服又养人的“养生澡”硬生生洗成了“伤身澡”冬天多久洗一次澡最好？洗澡频率主要取决于个体的需求和偏好。,https://3w.huanqiu.com/a/106d4f/4KYr5sh4XfC?agt=20,,0,0,False
天冷电动车充满电，一加油门就掉2格，不怪电池，真实原因告诉你,2024-11-26 05:02,1847,129,新能源战略家,新能源战略家,电动车使用方便、价格便宜，已经成为了不少朋友通勤代步的首选，但在使用过程中偶尔也有让人糟心的问题。像爆胎、刹车不灵敏这类问题可以通过门店维修来解决，但如果遇到电池出现异常情况，不仅问题难以排查，而且维修成本也不低。,https://toutiao.com/group/7441448742575702563/,,0,0,False
大蒜威胁国家安全？美国歧视变本加厉，不给中国发展提供任何助力,2024-12-13 06:23,3657,795,杜文龙,杜文龙,,https://toutiao.com/group/7447778326313173544/,,0,0,True
中美角力，美国三个航母战斗群和中国九十余艘战舰在西太平洋布阵,2024-12-13 07:45,20370,1179,邱毅台湾,邱毅台湾,,https://toutiao.com/group/7447799357446816307/,,0,0,True
67岁执意生娃，如今却坐轮椅无法自理，5岁的天赐被迫独立学洗衣,2024-11-04 10:32,8916,2047,睿之悦,睿之悦,2019年，已经67岁的田新菊执意生下了自己的第三个孩子小天赐。那么，现如今5年的时间过去了，这“天赐”的礼物到底是福还是祸呢?,https://toutiao.com/group/7433367394946384435/,,0,0,False
罕见！100年前，英国游客拍下的清朝乡村，和想象中完全不一样,2024-09-20 02:07,8931,780,万物知识局,万物知识局,泥泞的土路，衣不蔽体的老百姓，即便是达官显贵的家中也十分破败，而这些都是清王朝的历史痕迹，虽说那时候中国摄影技术并不发达，但也有许多外国游客来到这里，拍摄下了许多老照片，为我们留下了珍贵的历史资料，那清朝到底是怎样的面貌呢?,https://toutiao.com/group/7416287738871267855/,,0,0,False
3年前，宁夏7岁小女孩一笑走红，后拒百万签约，如今怎么样了？他们后悔了吗？,2024-09-19 07:25,15522,2071,睿之悦,睿之悦,2021年，视频镜头中出现的女孩儿用那一抹甜美的笑容，迅速引起了网友们的广泛关注。有媒体公司看到这一机遇，提出愿意用百万巨资与女孩儿签约，然而，女孩儿的父母却坚决拒绝了这一提议。,https://toutiao.com/group/7416250139544879679/,,0,0,False
第10个拥核国家诞生，欧洲集体失声，美国束手无策，已成美军禁区,2024-12-12 07:42,2097,279,东方点兵,东方点兵,白俄罗斯正式官宣拥有核武器，抗衡北约威胁，第10个拥核国家诞生，欧洲集体失声，白俄罗斯已成美军禁区。,https://toutiao.com/group/7447426068287357477/,,0,0,False
大批油田失守，美国赌赢了？叙王牌部队回归，阿萨德有望东山再起,2024-12-13 07:48,1306,153,金亮,金亮,叙利亚北部风云再起，美国盟友的防线开始崩溃，油田恐将失守，关键时刻，叙王牌部队回归，阿萨德有望东山再起吗？,https://toutiao.com/group/7447800048236151348/,,0,0,False
弟弟光荣退伍，姐姐兴奋去车站接他，怎料一见弟弟瞬间哭了,2024-11-05 06:34,33867,3045,乐视天天剧好看,乐视天天剧好看,,https://toutiao.com/group/7433679820573934091/,,0,0,True
