title,publish_time,like_count,comment_count,media_name,source,abstract,article_url,tag,is_yaowen,article_sub_type,has_video
一习话丨保持定力增强信心  总书记鼓励民企“做强做优做大”,2025-02-21 11:44,616,302,央广网,央广网,2月17日，习近平总书记出席民营企业座谈会并发表重要讲话。这是时隔六年，党中央再次专门召开民营企业座谈会。从2018年总书记在座谈会上指出“三个没有变”，到此次座谈会重申“两个毫不动摇”，党中央鼓励、支持、引导非公有制经济发展的鲜明表态一以贯之。,https://www.cnr.cn/newscenter/local/dftj/20250221/t20250221_527078160.shtml,,0,0,False
经济政策一线微观察｜“两新”政策加力扩围 激活经济新动能,2025-02-20 14:12,820,340,新华网,新华网,今年1月，国家发展改革委和财政部发布关于2025年加力扩围实施大规模设备更新和消费品以旧换新政策的通知，要求“加力推进设备更新”“扩围支持消费品以旧换新”。春节过后，各地持续加力实施“两新”政策，不断激发消费新活力。记者走进商场、企业，探访“两新”政策对经济社会发展带来的新动能。,http://my-h5news.app.xinhuanet.com/h5/article.html?articleId=85b751575a8b0ff95f8a0c81d4ccf105,,0,0,False
华为手机耗电快，电池不耐用，肯定是打开了这个开关,2025-02-20 23:49,923,232,洋哥自媒体,洋哥自媒体,#手机使用方法#干货分享#知识分享#手机电池,https://toutiao.com/group/7473652522721329704/,,0,0,True
你不要侮辱我，这是太乙第一次动了杀心了#哪吒2,2025-02-21 00:40,4348,419,小川影视生活,小川影视生活,,https://toutiao.com/group/7473665708656689718/,,0,0,True
突发：加拿大多伦多客机坠毁，正巧被另一客机乘客拍下全过程,2025-02-18 23:46,31113,3145,优雅叶子Dp,优雅叶子Dp,,https://toutiao.com/group/7472909712212689444/,,0,0,True
海南部分旅居人群成逃难大军，对于这样的生活，大家怎么看？,2025-02-09 10:48,3294,674,采云飘飘,采云飘飘,,https://toutiao.com/group/7469369555660309055/,,0,0,True
男子晒年夜饭，曾经的一家六口，如今只剩他一人,2025-02-20 09:29,37283,10908,情感夜话（收徒）,情感夜话（收徒）,,https://toutiao.com/group/7473430993790222885/,,0,0,True
哪吒之魔童闹海2爆笑番外，重塑肉身一波三折,2025-01-17 04:36,36567,6847,成林影视,成林影视,哪吒2 哪吒之魔童闹海2爆笑番外，重塑肉身一波三折,https://toutiao.com/group/7460738418935415350/,,0,0,True
中俄分歧摆上台面，俄方不想被骗第二次，王毅外长的话切中痛点,2025-02-19 06:54,34843,7450,墨读春秋,墨读春秋,,https://toutiao.com/group/7473019963385676297/,,0,0,True
常年裸露半身，以伺候丈夫为荣！纳米比亚最原始部落，辛巴族,2025-02-18 09:10,9203,313,万物有光,万物有光,,https://toutiao.com/group/7472622133936456233/,,0,0,True
生理课上，老师讲男孩生殖器官。生动形象。超负责!,2024-12-26 10:56,6813,321,小鱼分享,小鱼分享,,https://toutiao.com/group/7452672815855862313/,,0,0,True
