title,publish_time,like_count,comment_count,media_name,source,abstract,article_url,tag,is_yaowen,article_sub_type,has_video
时政快讯丨习近平：中国将担任亚太经合组织2026年东道主,2024-11-16 15:35,614,276,央视新闻,央视新闻,当地时间11月16日，习近平主席在亚太经合组织第三十一次领导人非正式会议上宣布，中国将担任亚太经合组织2026年东道主，期待同各方一道深化亚太合作，造福亚太人民。,https://content-static.cctvnews.cctv.com/snow-book/index.html?item_id=14477388201335894596&source=50006&sub_source=50006_001,,0,0,False
江苏无锡一学院发生持刀伤人事件 致8死17伤,2024-11-16 15:30,8368,22425,央视新闻,央视新闻,11月16日18时30分左右，无锡工艺职业技术学院发生一起持刀伤人案件，共造成8人死亡、17人受伤，犯罪嫌疑人被当场抓获。警方发布警情通报：（总台记者 李筱 黄成）©2024中央广播电视总台版权所有。未经许可，请勿转载使用。,https://content-static.cctvnews.cctv.com/snow-book/index.html?item_id=2073230601850871874&source=50006&sub_source=50006_001,,1,1,False
如果房价再跌25%，后果不堪设想！,2024-11-16 04:28,16677,2797,汤山老王,汤山老王,,https://toutiao.com/group/7437729384905867813/,,0,0,True
1米3袖珍美女嫁给1米48男孩，婚后丈夫奇迹长高，两人却不欢而散,2024-09-07 02:55,4630,252,睿之悦,睿之悦,杨萍和葛存苗的婚礼 文|睿之悦 编辑|睿之悦2019年，成都的民政局来了两个“10岁小孩”来登记，工作人员以为是玩闹。两个“小孩”拿出身份证让工作人员看，这才明白，原来是两个再也长不高的成年袖珍人情侣。,https://toutiao.com/group/7411713833267364386/,,0,0,False
一婚娶央视主持人，二婚娶演员，三婚娶小30岁美女，64岁才当爸爸,2024-10-31 22:12,836,122,峰哥正读,峰哥正读,在阅读此文之前，麻烦您点击一下“关注”，既方便您进行讨论和分享，又能给您带来不一样的参与感，感谢您的支持！文/编辑：木头一说到尤小刚，相信很多读者压根就没听说过这号人物。虽毕业于北电，可尤小刚却不是做演员的，而是奔着导演去的。,https://toutiao.com/group/7431842866890113570/,,0,0,False
包厢全是刚出狱的恶霸，结果一看到饭店主厨，立马怂了,2024-11-11 01:21,5715,132,乐视群星访谈秀,乐视群星访谈秀,,https://toutiao.com/group/7435825833048015400/,,0,0,True
从“中国巨星”到“查无此人”，走上没有回头路的赵薇，后悔了吗,2024-11-04 10:58,367,158,晓娱海棠,晓娱海棠,一夜爆红，家喻户晓，风光无量，这些词都曾是赵薇的标签。凭借《还珠格格》一夜爆红的她，成为了大家心中的“国民偶像”。可这手好牌却活生生的被她“打了个稀烂”！“亲日辱华、操纵股市、殴打孕妇”这些毫无道德底线的事情都被赵薇一一揽入怀中，然而面对大家的谴责，赵薇竟丝毫不知悔改！,https://toutiao.com/group/7433349577568174602/,,0,0,False
破解特朗普加征关税，中国有7招,2024-11-15 14:05,18970,1280,静思有我,静思有我,,https://toutiao.com/group/7437506977830044200/,,0,0,True
谁支持了特朗普上台？原来美国教会及中产，打败了政治邪恶力量！,2024-11-12 22:06,18055,864,黎建南台湾,黎建南台湾,,https://toutiao.com/group/7436517585706811930/,,0,0,True
12万亿的化债一落地，猪又要飞上天了！年底之前1大行业急剧上涨,2024-11-15 03:39,3567,487,量子教育新商学,量子教育新商学,,https://toutiao.com/group/7437345740701860390/,,0,0,True
手上一奇穴，让你肝血充足眼睛亮，现在揉效果最好,2024-10-21 07:30,87889,9235,梁医学社梁怡璋医生,梁医学社梁怡璋医生,,https://toutiao.com/group/7427920784783311396/,,0,0,True
拦车收费？交警不管！景区不管！政府看不见！九寨沟咋全是土匪？,2024-09-22 15:55,226405,44394,行哥嘚啵嘚,行哥嘚啵嘚,,https://toutiao.com/group/7417496641638400527/,,0,0,True
医生发现：不容易得癌症的人，一般都有5个“特质”，你占几个？,2024-11-15 11:19,3254,351,39健康网,39健康网,“癌症是人类追求健康路上难以回避的挑战。”近年来，癌症似乎越来越频繁地出现在人们的视线中。无论患者还是健康人，都对“患癌概率”心存疑问：为何偏偏是自己中招？自己的患癌风险究竟有多大？一、人活一辈子，得癌症的几率有多大？,https://toutiao.com/group/7437417286899646976/,,0,0,False
特朗普砸盘，马斯克：废除75%美国联邦机构，46个州宣布货币自立,2024-11-13 12:10,3867,927,BWC中文网,BWC中文网,特朗普砸盘，马斯克：废除75%美国联邦机构，46个州宣布货币自立,https://toutiao.com/group/7436731541847278120/,,0,0,True
“特朗普+马斯克”时代，大胆预测之三！3件事看他们能否改变美国,2024-11-15 13:16,14694,1257,终南剑客,终南剑客,本期话题，3个事，巧、怪、讽刺，来看“特朗普+马斯克组合”，能不能改变美国？,https://toutiao.com/group/7437494442094756392/,,0,0,True
太空开箱视频来了！神十九航天员乘组开始“拆快递”,2024-11-16 05:45,3273,213,海客新闻,海客新闻,11月16日早上，神舟十九号航天员乘组在地面配合下打开天舟八号舱门，开始太空“拆快递”。8时26分，航天员蔡旭哲打开天舟八号舱门，进入天舟八号货运飞船。神舟十九号航天员乘组将按计划继续开展货物转运等工作。,https://toutiao.com/group/7437749126202130996/,,0,0,True
“虎鲸”首次公开亮相！宋晓军：载荷达500吨，在全球凤毛麟角,2024-11-13 04:34,14111,647,海峡新干线,海峡新干线,“虎鲸”首次公开亮相！宋晓军：载荷达500吨，在全球凤毛麟角,https://toutiao.com/group/7436617670335660607/,,0,0,True
特朗普赢却难就职？拜登怕追责，佩洛西怕牢饭，三大集团蠢蠢欲动,2024-11-14 22:04,33030,1431,黎建南台湾,黎建南台湾,,https://toutiao.com/group/7437259350143402515/,,0,0,True
男学生扮女装进女澡堂，被女同学发现揪出：跟你当同学真丢脸！,2024-11-16 03:48,3866,1856,今日国土杂志社,今日国土杂志社,,https://toutiao.com/group/7437718931358122505/,,0,0,True
红房子：这段堪称最精彩，范伟和李小璐演技炸裂，百看不厌！,2024-11-11 02:36,1062,115,南瓜热剧回放,南瓜热剧回放,红房子：这段堪称最精彩，范伟和李小璐演技炸裂，百看不厌！,https://toutiao.com/group/7435845105006674458/,,0,0,True
女友叶珂退网5天后，黄晓明哽咽鞠躬道歉：内心很难过，我现在非常需要大家的支持，一定会处理好私事,2024-11-16 02:32,772,1493,九派新闻,九派新闻,11月10日，黄晓明女友叶珂就近期争议发文道歉并宣布退网。15日，黄晓明哽咽鞠躬道歉。黄晓明表示很感谢大家的支持：“最近让很多人担心了，也怕耽误了电影，所以内心非常忐忑。能在这个时候买电影票支持我的朋友们，亲朋好友以及行业的朋友，我非常感谢你们，因为这个时候非常需要你们的支持。,https://toutiao.com/group/7437694162291081766/,,0,0,False
首例5胞胎长大了，父亲已过劳去世 母亲直言：如能重来一个也不要,2024-08-31 03:06,2761,755,睿之悦,睿之悦,2002年，在北京的一家妇产医院中，一位来自河北的孕妇顺利生下了两男三女的五胞胎，创造了一个全国罕见的奇迹。,https://toutiao.com/group/7409098624111575603/,,0,0,False
母亲瘫痪、父亲疯了，当年那个744分的高考状元，7年后却成了这样,2024-09-08 00:54,8973,1417,八号探秘人,八号探秘人,母亲截肢瘫痪、父亲疯癫痴傻，可对于自己的亲人，他却做出了这样的评价。而今，7年已过，曾经那个让无数人动容的少年，现在如何?,https://toutiao.com/group/7411852147648496162/,,0,0,False
"万万没想到,53岁“丁克”半辈子的康辉，一生遗憾竟然是一通电话",2024-08-21 22:14,29121,5504,峰哥正读,峰哥正读,在阅读此文之前，麻烦您点击一下“关注”，既方便您进行讨论和分享，又能给您带来不一样的参与感，感谢您的支持！文/编辑：蘑菇百善孝为先。但是到底怎么做才算是“孝”，康辉用了半辈子才明白。央视知名主持人康辉，事业顺遂，家庭幸福，在外人看来是一个人生赢家。,https://toutiao.com/group/7405504703687115273/,,0,0,False
罕见！100年前，英国游客拍下的清朝乡村，和想象中完全不一样,2024-09-20 02:07,6413,643,万物知识局,万物知识局,泥泞的土路，衣不蔽体的老百姓，即便是达官显贵的家中也十分破败，而这些都是清王朝的历史痕迹，虽说那时候中国摄影技术并不发达，但也有许多外国游客来到这里，拍摄下了许多老照片，为我们留下了珍贵的历史资料，那清朝到底是怎样的面貌呢?,https://toutiao.com/group/7416287738871267855/,,0,0,False
特朗普2.0时代即将开启，中方如何应对？掌握“三气”是关键,2024-11-16 04:48,7677,571,邱震海,邱震海,,https://toutiao.com/group/7437734368304431616/,,0,0,True
原来他才是毁掉刘翔真凶，因贪1200万被公审，让刘翔背负多年骂名,2024-08-29 09:58,14688,443,八号探秘人,八号探秘人,在田径场上创造的成绩，至今无人能够打破，甚至在国际上享有盛名。本该继续夺冠之路，却两次因伤退赛，遭到了全网辱骂。,https://toutiao.com/group/7408489498465616410/,,0,0,False
15年前他在爱妻葬礼上哭到昏厥，发誓永不再娶，如今他做到了吗？,2024-08-24 02:17,20437,620,八号探秘人,八号探秘人,在阅读此文之前，辛苦您点击一下“关注”，既方便您进行讨论和分享，又能给您带来不一样的参与感，感谢您的支持！编辑丨xk纵观鱼龙混杂的娱乐圈，有人背叛，有人痴情。而果靖霖则是公认的好男儿，将一生都奉献给妻子。但妻子却仅仅陪他走了半生，没能战胜病魔，不幸离开人世。,https://toutiao.com/group/7406210316734710283/,,0,0,False
太原一小区安装玻璃工人作业时连同吊装机从33楼坠落？多方回应,2024-11-16 05:19,294,224,极目新闻,极目新闻,11月15日，多名网友反映，山西太原一小区发生一起事故，一名工人作业时不慎从33楼坠落。视频显示，有一名伤者躺地，现场来了多辆警车。视频发布者表示，事发11月15日，这名工人在吊装作业安装玻璃时，连同吊装机器从33楼坠落。,http://jms.ctdsb.net/jmythshare/#/index_share?cId=0&contentType=5&contentId=2305683,,0,0,False
2024年最新：糖尿病的诊断标准变了！绝大多数人还不知道,2024-11-15 23:00,1699,231,糖尿病之友,糖尿病之友,糖尿病诊断标准有了新变化！昨天（11月14日）是世界糖尿病日，也是中华医学会糖尿病学分会第二十六次学术会议（CDS2024）召开的日子，在这次会议上，带来了一个最新消息！,https://toutiao.com/group/7437501113017909797/,,0,0,False
中国“机器狼”投入战场有多令敌人绝望？当初好言相劝不听，美国有些人现在该后悔了,2024-11-15 09:48,1216,419,海峡新干线,海峡新干线,据央视军事近期报道，在第15届中国航展上，不仅能看到多型战机炫舞蓝天，还有各种无人装备现场展示绝活。,https://toutiao.com/group/7437440101698830863/,,0,0,False
重返衡阳枪杀案现场：被害者中枪后走百余米打电话求救，警方正对枪支溯源,2024-11-16 04:26,2782,1361,极目新闻,极目新闻,极目新闻记者 沈外因为一次最平常不过的下水捞鱼，27岁的王正（化名）被打猎者的子弹击中身亡（极目新闻报道链接）。生前，他已经在湖南衡阳衡南县宝盖镇当了多年的木匠，给当地装修房屋的家庭打木柜、做吊顶。,http://jms.ctdsb.net/jmythshare/#/index_share?cId=0&contentType=5&contentId=2305652,,0,0,False
51年洪学智妻子寻女无果，到老乡家歇脚老乡惊呼：你要找得就是我,2024-09-22 01:07,14075,917,品古观今,品古观今,前言1951年，阳曲县委大院突然来了7、8位解放军同志，其中一位女同志，就是洪学智的妻子张文。她此番前来，就是为了寻找多年前因战乱而寄养于民间的爱女。可昔日的小村落早已蜕变成另一番景象，这无异于是大海捞针。,https://toutiao.com/group/7417034363226915354/,,0,0,False
著名专家预言：试管婴儿寿命仅40年，那首例试管婴儿如今怎样了？,2024-09-01 06:05,9485,464,睿之悦,睿之悦,文|睿之悦编辑|睿之悦“试管婴儿活不到40岁？”1988年3月10日，我国首例试管婴儿顺利诞生。在当时，试管婴儿的技术正处于起步阶段，因此，有人将其视为医学的奇迹，但也有人则预言试管婴儿活不过40岁。那么，36年的时间过去了，我国首例试管婴儿如今怎么样了呢？,https://toutiao.com/group/7409105262277853733/,,0,0,False
韩国真急了,2024-11-14 08:50,5147,385,牛弹琴,牛弹琴,韩国贴了一张图，专门给特朗普看的,https://toutiao.com/group/7437054816481706532/,,0,0,True
广西49岁老汉娶19岁姑娘，结婚21年生下15个孩子，如今有何下场？,2024-10-20 08:32,2959,422,艺述史,艺述史,她19岁出嫁，21年里总共生育了15个孩子，其中4个男孩子11个女孩子，家里热闹的像是开了一所学校一样。,https://toutiao.com/group/7427400319418384948/,,0,0,False
“全家都崩溃了”！花重金请来的月嫂，上岗第10天就被发现……,2024-11-14 10:10,2972,1123,环球网,环球网,来源：新闻晨报 为照顾新生的宝宝，祝女士提前在天鹅到家平台预约了一名月嫂黄阿姨。黄阿姨不仅曾经是一名医师，而且还会“开乳”和产后康复。10月8日，祝女士的宝宝降生后，黄阿姨就带着自己的行李，在他们的“城市经理”陪同下上岗了。,https://3w.huanqiu.com/a/a7835f/4KFkEYL1QL8?agt=20,,0,0,False
