title,publish_time,like_count,comment_count,media_name,source,abstract,article_url,tag,is_yaowen,article_sub_type,has_video
包厢全是刚出狱的恶霸，结果一看到饭店主厨，立马怂了,2024-11-11 01:21,11026,285,乐视群星访谈秀,乐视群星访谈秀,,https://toutiao.com/group/7435825833048015400/,,0,0,True
赖清德过境夏威夷，病急乱投医，找上佩洛西通电话，惹怒特朗普,2024-12-03 09:30,14921,214,邱毅台湾,邱毅台湾,,https://toutiao.com/group/7444115695816442395/,,0,0,True
1米3袖珍美女嫁给1米48男孩，婚后丈夫奇迹长高，两人却不欢而散,2024-09-07 02:55,7402,406,睿之悦,睿之悦,杨萍和葛存苗的婚礼 文|睿之悦 编辑|睿之悦2019年，成都的民政局来了两个“10岁小孩”来登记，工作人员以为是玩闹。两个“小孩”拿出身份证让工作人员看，这才明白，原来是两个再也长不高的成年袖珍人情侣。,https://toutiao.com/group/7411713833267364386/,,0,0,False
女友怀孕了，男友不装了，带她回豪宅！,2024-11-23 08:01,8568,712,乐视大综艺咖,乐视大综艺咖,,https://toutiao.com/group/7440353629540483593/,,0,0,True
尹锡悦众叛亲离成韩国公敌，他会被弹劾下台吗？谁可能取而代之？,2024-12-05 06:34,8781,257,邱毅台湾,邱毅台湾,,https://toutiao.com/group/7444812537344590348/,,0,0,True
母亲瘫痪、父亲疯了，当年那个744分的高考状元，7年后却成了这样,2024-09-08 00:54,14118,1984,八号探秘人,八号探秘人,母亲截肢瘫痪、父亲疯癫痴傻，可对于自己的亲人，他却做出了这样的评价。而今，7年已过，曾经那个让无数人动容的少年，现在如何?,https://toutiao.com/group/7411852147648496162/,,0,0,False
美国权力即将交接之际，台湾两个举动不寻常，释放什么危险信号？,2024-12-02 09:57,12415,123,邱震海,邱震海,,https://toutiao.com/group/7443751437550486057/,,0,0,True
未来5年没大年三十，都是月亮惹的祸！2262年有两个春节放假怎么安排？,2024-12-03 05:12,1161,573,极目新闻,极目新闻,2025年1月29日将迎来农历新年蛇年，但2025年没有大年三十，大年二十九过后就是大年初一。据悉，从2025年开始直到2029年，连续五年的除夕都是“大年二十九”。,http://jms.ctdsb.net/jmythshare/#/index_share?cId=0&contentType=5&contentId=2319456,,0,0,False
羽绒服“暴雷”，普通人买羽绒服，看不懂水洗标上这3个词，容易吃大亏！,2024-11-30 09:21,744,367,环球网,环球网,来源：科普中国 近日，有关羽绒服的话题频繁上热搜。有服装行业人士说，90%的鸭绒从去年的35万涨到今年的59万一吨；90%的鹅绒从去年的70万涨到今年的125万一吨。成本的暴涨，导致某些厂家用50%的鸭绒冒充90%的鹅绒，甚至拿废丝掺在鹅绒里。我们普通消费者，要怎么选购羽绒服呢？,https://3w.huanqiu.com/a/3084ce/4KT1XWDBsfa?agt=20,,0,0,False
韩国政坛巨变：6小时戒严成闹剧，尹锡悦政治生涯倒计时？,2024-12-04 05:42,12144,205,邱震海,邱震海,,https://toutiao.com/group/7444427835889943055/,,0,0,True
大学生4年间艾滋病感染12397例，60%存在这一行为,2024-12-03 10:16,4835,4161,凤凰网,凤凰网,据相关数据，2020年至2023年，新报告青年学生病例分别为:2977人、3677人、2733人、3010人，四年间共报告12397人。,https://toutiao.com/group/7444127197663396364/,,0,0,False
三舰岛平直甲板，中国试验“奇特航母”，或改变未来海战格局,2024-11-29 08:39,11084,414,杜文龙,杜文龙,,https://toutiao.com/group/7442618152862614068/,,0,0,True
马龙访台，台湾人热烈欢迎，台独焦虑不安视为大敌使出妖魔化老招,2024-11-29 09:56,26001,1073,邱毅台湾,邱毅台湾,,https://toutiao.com/group/7442637867307762230/,,0,0,True
广西49岁老汉娶19岁姑娘，结婚21年生下15个孩子，如今有何下场？,2024-10-20 08:32,5870,707,艺述史,艺述史,她19岁出嫁，21年里总共生育了15个孩子，其中4个男孩子11个女孩子，家里热闹的像是开了一所学校一样。,https://toutiao.com/group/7427400319418384948/,,0,0,False
天冷电动车充满电，一加油门就掉2格，不怪电池，真实原因告诉你,2024-11-26 05:02,1573,102,新能源战略家,新能源战略家,电动车使用方便、价格便宜，已经成为了不少朋友通勤代步的首选，但在使用过程中偶尔也有让人糟心的问题。像爆胎、刹车不灵敏这类问题可以通过门店维修来解决，但如果遇到电池出现异常情况，不仅问题难以排查，而且维修成本也不低。,https://toutiao.com/group/7441448742575702563/,,0,0,False
弟弟光荣退伍，姐姐兴奋去车站接他，怎料一见弟弟瞬间哭了,2024-11-05 06:34,29947,2892,乐视天天剧好看,乐视天天剧好看,,https://toutiao.com/group/7433679820573934091/,,0,0,True
罕见！100年前，英国游客拍下的清朝乡村，和想象中完全不一样,2024-09-20 02:07,8373,737,万物知识局,万物知识局,泥泞的土路，衣不蔽体的老百姓，即便是达官显贵的家中也十分破败，而这些都是清王朝的历史痕迹，虽说那时候中国摄影技术并不发达，但也有许多外国游客来到这里，拍摄下了许多老照片，为我们留下了珍贵的历史资料，那清朝到底是怎样的面貌呢?,https://toutiao.com/group/7416287738871267855/,,0,0,False
河南警察3岁女儿被拐，苦寻全国23年无果，结果却发现女儿在对门,2024-11-05 07:43,2728,258,八号探秘人,八号探秘人,寻亲23年无果，丢失的女儿竟住在对门?但它却真实发生在河南洛阳的梁绍波身上。是意外走丢，还是人贩子所为，三岁的女儿怎会离奇失踪?,https://toutiao.com/group/7433697108120142345/,,0,0,False
杀疯了的「北京市服」，统一全国审美？,2024-11-25 00:30,2587,1090,凤凰WEEKLY,凤凰WEEKLY,文/馍王编辑/闫如意众所周知，凤凰编辑部位于北京市。众所又知，北京的冬天，有一种统一所有人穿搭审美的魔力。这个冬天，编辑部的穿搭呈现出了无限趋同。上班时，人均穿着一件柔软的摇粒绒内衬，蜷缩在工位上。下班点一到，用一件宽大冲锋衣把摇粒绒一锁，挺胸抬头，跟扇大铁门似的走出公司。,https://toutiao.com/group/7440858414693040678/,,0,0,False
尹锡悦下台四大原因曝光，后悔也完蛋了（上）,2024-12-04 10:07,4861,242,占豪,占豪,韩国夜里国家变天了，很多早上起来都还不明就里，事在天还没亮的时候就解决了！结果是啥？,https://toutiao.com/group/7444496200104935987/,,0,0,True
中国台北，非常精确的称呼了！,2024-12-05 01:43,685,140,新民晚报,新民晚报,未来的两岸交流，特别是文化、体育界的交流，大可以多一些，更多一些！文 | 海上客应马英九基金会邀请，七所大陆大学共40名师生，于11月27日起访问台湾地区。这九天八夜的访问还未全部完成，然而总体上来说，已经能够看出，两岸交流沟通，在青年方面，有了不少向好进展！,https://toutiao.com/group/7444734150399115785/,,0,0,False
韩国事变第二天，又有新情况,2024-12-05 02:37,4559,326,牛弹琴,牛弹琴,事变第二天，尹锡悦闭门不出，形势正在起变化,https://toutiao.com/group/7444749861411127808/,,0,0,True
琼瑶与江苏：她的母亲是武进人，大姨更是江苏名人,2024-12-04 14:41,1078,421,扬子晚报,扬子晚报,在华语文学的天空中，琼瑶的名字如同一颗璀璨的星辰，照亮了一代又一代人的情感世界。然而，当这颗星辰悄然陨落，我们不禁感叹岁月的无情与生命的脆弱。琼瑶的离世，不仅让文学界失去了一位巨匠，也让她的血脉故乡江苏，失去了一位与这片土地情深意长的文化使者。,https://wap.yzwb.net/wap/news/4184552.html,,0,0,False
3年前，宁夏7岁小女孩一笑走红，后拒百万签约，如今怎么样了？他们后悔了吗？,2024-09-19 07:25,14728,1966,睿之悦,睿之悦,2021年，视频镜头中出现的女孩儿用那一抹甜美的笑容，迅速引起了网友们的广泛关注。有媒体公司看到这一机遇，提出愿意用百万巨资与女孩儿签约，然而，女孩儿的父母却坚决拒绝了这一提议。,https://toutiao.com/group/7416250139544879679/,,0,0,False
67岁执意生娃，如今却坐轮椅无法自理，5岁的天赐被迫独立学洗衣,2024-11-04 10:32,8096,1867,睿之悦,睿之悦,2019年，已经67岁的田新菊执意生下了自己的第三个孩子小天赐。那么，现如今5年的时间过去了，这“天赐”的礼物到底是福还是祸呢?,https://toutiao.com/group/7433367394946384435/,,0,0,False
