title,publish_time,like_count,comment_count,media_name,source,abstract,article_url,tag,is_yaowen,article_sub_type,has_video
总书记关心的“土特产” 连着乡村振兴的大事业,2024-12-26 12:30,4103,2040,人民网,人民网,中央农村工作会议12月17日至18日在北京召开。会议分析了当前“三农”工作面临的形势和挑战，部署2025年“三农”工作。会议强调，要推动乡村产业提质增效，做好“土特产”文章，培育新产业新业态，完善联农带农机制，促进农民增收。产业振兴是乡村振兴的重中之重。,https://toutiao.com/group/7452695904189989391/,,0,0,False
新玩法 新体验 各地冰雪游“花式出新”,2024-12-25 11:43,434,171,央视新闻,央视新闻,冬季出游，激情冰雪。无论是在雪道上体验速度与激情，还是在银装素裹的世界里欣赏冰雕雪塑，这个冬季，不断升温的冰雪旅游市场为游客带来了新玩法和新体验。,https://content-static.cctvnews.cctv.com/snow-book/index.html?item_id=6259011790299416548&source=50006&sub_source=50006_001,,0,0,False
台湾又拍大尺度！ 太羞耻了，注定只能网盘见,2024-12-10 09:40,3919,199,禾芷解说,禾芷解说,深度解说台湾电影《亲爱的杀手》,https://toutiao.com/group/7446671812101931572/,,0,0,True
益生菌真的那么神奇吗？有关益生菌的几个误区 你“踩雷”了吗？,2024-12-07 02:35,1850,107,央视频,央视频,,https://toutiao.com/group/7445492942887715365/,,0,0,True
未来四年大陆不会有统一台湾时间表？随时可解放台湾，何需时间表,2024-12-26 05:50,12270,215,邱毅台湾,邱毅台湾,,https://toutiao.com/group/7452593764326965800/,,0,0,True
萝卜和鸡蛋这样做，比吃补药还补，顿顿吃都不会腻，又香又下饭,2024-10-30 12:28,69382,4247,小寒厨艺,小寒厨艺,萝卜和鸡蛋这样做，比吃补药还补，顿顿吃都不会腻，又香又下饭,https://toutiao.com/group/7431405463378919975/,,0,0,True
【崔哥天天侃12/26】川普和克林顿同岁，谁看着更老态龙钟,2024-12-26 01:27,10114,505,北美崔哥,北美崔哥,,https://toutiao.com/group/7452526020566975014/,,0,0,True
谢霆锋带全家远赴日本过圣诞！儿子罕见露面，继父和母亲十分恩爱,2024-12-26 06:16,1133,301,卿羽飞,卿羽飞,如果说近些年以来，内地歌坛最能吸引人目光的人事物，王菲应该会是其中之一。在多年之前，也与窦唯有着一段婚姻。,https://toutiao.com/group/7452594144658178575/,,0,0,False
被千万人吐槽的“蠢设计”，得知正确用法后，蠢得原来是我自己！,2024-12-11 03:04,469,154,睿之悦,睿之悦,文|睿之悦编辑|睿之悦“难以拆开的米面袋子”，“五孔插座往往只能插一个……”在生活中，总有一些物品的使用在无形之中给很多人带来了麻烦。但其实这些物品不是不好用，而是我们没能够找到它们正确的使用方法。那么，这些物品都是什么呢？而它们的正确用法又是怎样的呢？,https://toutiao.com/group/7446982751296832000/,,0,0,False
湖南最长寿老人124岁高龄，长寿秘诀出世，让人大开眼界,2024-12-21 16:00,1195,122,乐视群星访谈秀,乐视群星访谈秀,,https://toutiao.com/group/7450730131821167140/,,0,0,True
东方卫视记者现场报道沪苏湖高铁首发车驶出,2024-12-26 05:02,1193,150,看看新闻,看看新闻,今天（12月26日）上午9点45分，沪苏湖高铁从湖州东站发出，标志着这条“包邮区”的“新天路”正式开通运营。首发仪式为何选在湖州东站？现场有哪些精彩活动？东方卫视记者常颖在湖州东站首发仪式现场，亲身感受并为观众带来了最新的现场情况。请戳视频，看“轨道上的长三角”再添新动脉！,https://videocloud-tp.kksmg.com/pub/2024/12/26/abb87e4f-c342-11ef-9987-e381e28b6b61_9d7a2f32-13e7-36e2-92eb-37255b9c49f4.mp4,,0,0,True
全球最大电磁弹射无人机航母即将下水，三项第一中国创造,2024-12-22 09:54,5486,440,杜文龙,杜文龙,据崇明海事局包括相关消息明确，我们全球最大的两栖攻击舰076要下水了，而且从目前大家发布的消息和关注的点去看，第一是排水量5万吨，与美国目前的“美国”号大致持平，而且略有超出，如果从排水量去分析，它已经超出了美国目前最大的两栖作战舰艇，所以从排水量看，那“准航母”、“小航母”包括这些符号都可以贴上标签，非常明确。,https://toutiao.com/group/7451172319415829018/,,0,0,False
韩国人涌向上海？,2024-12-25 14:15,559,238,中国新闻周刊,中国新闻周刊,“现在外滩一半以上都是韩国人，前段时间去了一趟新天地，周围全是讲韩语的。”某社交平台博主“香草芝士拿铁”告诉中国新闻周刊，现在上海的一些热门旅游景点如外滩、田子坊、新天地、豫园等地，韩国游客的数量显著增加。特别是在田子坊和新天地，几乎每走两步就能听到韩语声。上海外滩。,https://toutiao.com/group/7452352714274570804/,,0,0,False
郜春海：低空经济的发展空间远超新能源，颠覆未来商业模式,2024-12-19 08:10,2929,645,凤凰网财经,凤凰网财经,,https://toutiao.com/group/7450032423821115914/,,0,0,True
新婚33天卷走274万4套房，出逃后丈夫跨国追捕，如今下场大快人心,2024-12-20 22:06,3714,205,八号探秘人,八号探秘人,在阅读此文之前，辛苦您点击一下“关注”，既方便您进行讨论和分享，又能给您带来不一样的参与感，感谢您的支持！编辑丨QQ·B“色字头上一把刀！”深圳富豪结婚33天竟被卷走274万元和名下4套房产。不仅如此，他还被扣上了“接盘侠”的帽子，啥也没干喜当爹。,https://toutiao.com/group/7450399558821052982/,,0,0,False
香港九龙寨城老照片：曾是香港最邪恶肮脏之地，图9场景令人作呕,2024-11-21 11:32,2671,479,万物知识局,万物知识局,有这么一个地方，他虽然地处极度繁华的都市香港，但是却脏乱不堪，环境极度的恶劣，各种违法的交易都在这里进行，甚至黄赌毒，也在这里悄然滋生，这就是九龙城寨。,https://toutiao.com/group/7439657140518519296/,,0,0,False
弟弟光荣退伍，姐姐兴奋去车站接他，怎料一见弟弟瞬间哭了,2024-11-05 06:34,42336,3369,乐视天天剧好看,乐视天天剧好看,,https://toutiao.com/group/7433679820573934091/,,0,0,True
两名中将涉严重违纪违法被罢全国人大代表,2024-12-26 09:09,7003,11523,财新网,财新网,【财新网】再有解放军将领因涉嫌严重违纪违法，被罢免全国人大代表职务，包括陆军原副司令员尤海涛，南部战区原副司令员、战区海军司令员李鹏程，两人都是中将。,https://toutiao.com/group/7452643015639826980/,,0,0,False
四百万外国人，正在涌入上海,2024-12-25 14:20,1157,761,华尔街见闻,华尔街见闻,"“周五下班去中国！”这句近期很火的话来自我们相邻的韩国。是的，继今年一句""City不City""让大家见识到一大群异国面孔回流向上海之后，如今韩国也来了。",http://mp.weixin.qq.com/s?__biz=MjM5NzAwMzU0MA==&mid=2247617804&idx=1&sn=22f9336dfdc7b9005bad1100d36aced0,,0,0,False
山东舰在台岛东部遭电子干扰，055火速启动电子战，歼15挂弹升空,2024-12-26 03:29,4406,142,第一军情,第一军情,近日，央视《国防军事》报道了一则振奋人心的消息，山东舰航母编队在台岛东部海域航行时，突然遭到了强烈的电子干扰，我海军舰队立马进入战备状态，并命令“带刀护卫”055延安舰前出，迅速查明敌情。,https://toutiao.com/group/7452555812868604450/,,0,0,False
阿富汗“卖枪”犹如卖白菜 ，外国人竟能随便买？喷子威力太大了,2024-12-26 10:00,4390,413,耀阳环游记,耀阳环游记,,https://toutiao.com/group/7452374019187147315/,,0,0,True
贪官酒桌上的权钱交易，语言天衣无缝，听懂三分都是人精！,2024-11-23 16:24,2831,377,乐视扒剧小妹儿,乐视扒剧小妹儿,,https://toutiao.com/group/7440378916130259496/,,0,0,True
四川：可4倍音速飞行 成都造“筋斗云”成功试飞,2024-12-20 10:52,4978,458,看看新闻,看看新闻,四川：可4倍音速飞行 成都造“筋斗云”成功试飞,http://mediaplay.kksmg.com/2024/12/20/h264_720p_600k_78546-DFTVHD-20241220175000-4800-967537-600k_mp4.mp4,,0,0,True
马光远：大城市才有机会的观点过时了 #财经大咖来了,2024-12-17 06:00,7444,558,光远看经济,光远看经济,,https://toutiao.com/group/7449256659496469027/,,0,0,True
全球最大电磁弹射无人机航母，两栖攻击舰 076即将下水,2024-12-22 09:48,31021,1379,杜文龙,杜文龙,,https://toutiao.com/group/7451170777983877632/,,0,0,True
清华才女李一诺：27岁博士毕业，4年生3娃，能替世界首富花钱,2024-12-18 05:51,5817,299,云莳一,云莳一,家庭是她第一个学校，妈妈是她第一任老师。李一诺27岁博士毕业进入美国麦肯锡公司，33岁成为公司全球董事合伙人，之后四年连生3娃。,https://toutiao.com/group/7449591069311779355/,,0,0,False
67岁执意生娃，如今却坐轮椅无法自理，5岁的天赐被迫独立学洗衣,2024-11-04 10:32,10068,2343,睿之悦,睿之悦,2019年，已经67岁的田新菊执意生下了自己的第三个孩子小天赐。那么，现如今5年的时间过去了，这“天赐”的礼物到底是福还是祸呢?,https://toutiao.com/group/7433367394946384435/,,0,0,False
曾美慧孜：穿越逆境抵达繁星，每个人的故事都是一部史诗,2024-12-25 02:49,2697,263,澎湃新闻,澎湃新闻,作为演员，曾美慧孜珍惜每个表演的机会，那是“在不同的时间和空间中雕刻时光”。每一次启程，都是重拾自己。当第一道曙光划破黑暗，我们如何重新启程？,https://cloudvideo.thepaper.cn/video/f7d084fa8442481d8171472a1de2768e/hd/1735093377000_nyiZkY_1735093517840.mp4,,0,0,True
今年冬至60年一遇，5大特殊，过年冷不冷就看冬至的表现！,2024-12-21 00:17,6400,961,惠农圈,惠农圈,冬至到啦，这可是冬季最大的一个节气，也是一个节日，在民间素有“冬至大如年”的说法。在古代社会，那些常年在外地工作的人，在冬至这一天会赶回家。,https://toutiao.com/group/7450652001870594614/,,0,0,False
"明道带王鸥见家长，王鸥脸红不敢进，明道忽悠,直接叫爸妈丨相爱",2024-12-24 03:21,3005,642,乐视天天剧好看,乐视天天剧好看,,https://toutiao.com/group/7451811744126599695/,,0,0,True
