title,publish_time,like_count,comment_count,media_name,source,abstract,article_url,tag,is_yaowen,article_sub_type,has_video
还没买返乡车票的同学看过来！超全干货轻松“拿捏”小小火车票,2025-01-06 04:31,924,355,央视新闻,央视新闻,日前，全国各大高校陆续开始放寒假，不少学生旅客即将踏上返乡的旅程。学生火车票怎么买？学生放寒假前往的目的地不是之前父母居住地，是否也能享受学生票优惠呢？一起来看购票攻略。🚆异地团聚学生票优惠区间怎么改？在厦门上学的李艳晗，父母在福州，但是今年寒假要和父母到成都一起过年。,https://content-static.cctvnews.cctv.com/snow-book/index.html?item_id=12999590325100209302&source=50006&sub_source=50006_001,,0,0,False
清华才女李一诺：27岁博士毕业，4年生3娃，能替世界首富花钱,2024-12-18 05:51,8812,408,云莳一,云莳一,家庭是她第一个学校，妈妈是她第一任老师。李一诺27岁博士毕业进入美国麦肯锡公司，33岁成为公司全球董事合伙人，之后四年连生3娃。,https://toutiao.com/group/7449591069311779355/,,0,0,False
萝卜和鸡蛋这样做，比吃补药还补，顿顿吃都不会腻，又香又下饭,2024-10-30 12:28,73355,4450,小寒厨艺,小寒厨艺,萝卜和鸡蛋这样做，比吃补药还补，顿顿吃都不会腻，又香又下饭,https://toutiao.com/group/7431405463378919975/,,0,0,True
什么是奶头乐理论？同学把女老师气的脸红脖子粗,2025-01-05 10:14,3519,225,七兜酱妹子,七兜酱妹子,,https://toutiao.com/group/7456372666564346403/,,0,0,True
美国日本闹翻！日本起诉美国，拜登提醒预防日本,2025-01-06 10:28,5264,165,诚阅ChengYue,诚阅ChengYue,,https://toutiao.com/group/7456747481817154082/,,0,0,True
印度女主播：歼36和076是“光鲜新玩具”，能否生存都是问题,2025-01-02 09:28,4417,1114,第一军情,第一军情,日前，在印度知名度非常高的美女主持人帕尔基-夏尔马在电视节目中，“锐评”了中国先进武器的“井喷”式亮相。夏尔马质疑中国六代机也好，新型两栖攻击舰也好，都是没经过实战考验的“纸老虎”，虽然看起来光鲜亮丽，但真打起来很可能露馅。,https://toutiao.com/group/7455247647847219749/,,0,0,True
98岁老郎中教我苹果养生新吃法，每天坚持这样吃，睡眠好，身体棒,2024-12-31 11:43,12236,1211,百变小厨坊,百变小厨坊,98岁老郎中教我苹果养生新吃法，每天坚持这样吃，睡眠好，身体棒,https://toutiao.com/group/7454540163725656628/,,0,0,True
新婚33天卷走274万4套房，出逃后丈夫跨国追捕，如今下场大快人心,2024-12-20 22:06,5436,269,八号探秘人,八号探秘人,在阅读此文之前，辛苦您点击一下“关注”，既方便您进行讨论和分享，又能给您带来不一样的参与感，感谢您的支持！编辑丨QQ·B“色字头上一把刀！”深圳富豪结婚33天竟被卷走274万元和名下4套房产。不仅如此，他还被扣上了“接盘侠”的帽子，啥也没干喜当爹。,https://toutiao.com/group/7450399558821052982/,,0,0,False
充电时，先插手机还是充电器？方法错误手机坏得快,2025-01-02 01:19,2026,163,人民日报,人民日报,手机电量还剩多少，对现代社会的许多人而言，都是一个“性命攸关”的问题。人们对手机充电的强烈需求，也让市面上催生出了许多噱头：无线充电，二倍速充电，以及能连着用一周的高能充电宝。乱花渐欲迷人眼，但到底什么才是手机充电的正确姿势呢？手机一定要满充满放吗？,https://www.peopleapp.com/column/30047895447-500006027199?utm_source=头条号&promote=true,,0,1,False
小女孩上部队找爸爸，少校阿姨主动搭讪，谁知看到女孩父亲傻眼了,2024-12-23 16:01,3738,870,乐视群星访谈秀,乐视群星访谈秀,,https://toutiao.com/group/7451525814283960872/,,0,0,True
拜登下台前搅动南海风云，美菲连手挑衅中国，中国不再忍强硬回击,2025-01-03 03:44,22883,976,邱毅台湾,邱毅台湾,,https://toutiao.com/group/7455530031461171753/,,0,0,True
尹锡悦绝境反击，韩军方出动，美态度很关键，朴槿惠文在寅选边站,2025-01-06 08:30,2278,416,美洲话姐,美洲话姐,只有想到不到的，没有做不到的。随着时间推移，“韩国调查机构逮捕尹锡悦”事件，可以说是越来越出人意料了。就目前看，已成为众矢之的、遭受众叛亲离的尹锡悦，并没有倒下，反而迎来了一线生机。按照这个趋势，尹锡悦不但有可能“全身而退”，甚至还有可能东山再起。,https://toutiao.com/group/7456716725942452751/,,0,0,False
“六星街里还传来巴扬琴声吗……”狼戈、张英席合唱《苹果香》,2024-12-31 14:55,3424,180,央视频,央视频,,https://toutiao.com/group/7454589818538820115/,,0,0,True
男人怀疑自己有病，女友亲自上阵，一晚上给治好了,2025-01-04 02:03,2036,667,南瓜热剧回放,南瓜热剧回放,,https://toutiao.com/group/7455875274023666186/,,0,0,True
演员星星被曝在泰缅边境失联，演员徐大久称其“已进入园区头发都剃了，确认在妙瓦底”！我驻清迈总领事馆回应,2025-01-06 04:25,1611,2021,极目新闻,极目新闻,1月6日，微博话题演员星星（王星）在泰缅边境失联冲上热搜第一，引发网友关注。据多家媒体报道，微博账号“失眠爹地”5日深夜发文，自称“嘉嘉”，其男友“星星”是一名演员，日前赴泰国拍戏，在北京时间1月3日中午于泰缅边境失联，距离最后一次发消息已经超过60个小时。,http://jms.ctdsb.net/jmythshare/#/index_share?cId=0&contentType=5&contentId=2345618,,0,0,False
小子从小被猴养大，长大成半人半兽，身怀出神入化的武功,2024-11-22 03:36,1385,207,乐视群星访谈秀,乐视群星访谈秀,,https://toutiao.com/group/7439942541555794471/,,0,0,True
团长壮的像头牛，新婚夜却耕了一晚上的地，下属秒懂！,2024-11-25 03:42,1488,550,乐视最爱综艺说,乐视最爱综艺说,,https://toutiao.com/group/7441057170428264970/,,0,0,True
厨师长教你：“家常肘子”口感耙糯 软烂入味 肥而不腻,2025-01-02 09:00,2045,265,美食作家王刚,美食作家王刚,厨师长教你：“家常肘子”口感耙糯 软烂入味 肥而不腻,https://toutiao.com/group/7455138904249893416/,,0,0,True
广西49岁老汉娶19岁姑娘，结婚21年生下15个孩子，如今有何下场？,2024-10-20 08:32,10661,1288,艺述史,艺述史,她19岁出嫁，21年里总共生育了15个孩子，其中4个男孩子11个女孩子，家里热闹的像是开了一所学校一样。,https://toutiao.com/group/7427400319418384948/,,0,0,False
厨师长教你：“葱爆羊肉”羊肉滑嫩、鲜香不膻,2024-12-27 07:34,3944,722,美食作家王刚,美食作家王刚,厨师长教你：“葱爆羊肉”羊肉滑嫩、鲜香不膻,https://toutiao.com/group/7452991735665263139/,,0,0,True
他的资历比朱德还老，授勋时却错失元帅，毛主席特批享受元帅待遇,2024-12-12 10:24,3653,146,品古观今,品古观今,在我军革命史上，有一位将军的资历比朱德还老，连毛主席都说:“共产党能对国民党将领说话的人不多，他就是其一。”可这样的人却在大授衔时，错失了元帅，后来经过毛主席的一番关心，才得以享受与元帅的同等待遇。,https://toutiao.com/group/7447468654758871592/,,0,0,False
甲流来袭，出现症状别硬扛，要早用药,2025-01-06 01:41,590,232,闪电新闻,闪电新闻,近期流感高发，据中国疾控中心最新数据，目前流感病毒阳性率持续上升，其中99%以上为甲流。甲型流感，简称“甲流”，是由甲型流感病毒引起的急性呼吸道传染病。流感病毒分为甲、乙、丙、丁4型，其中甲型流感传染性最强、最容易发生变异，几乎每次流感大流行都是由甲型流感病毒引起。,https://sdxw.iqilu.com/w/article/YS0yMS0xNjE2MDkzMQ.html,,0,0,False
卡特去逝，拜登宣布降半旗，特朗普火大，他真能使美国再次伟大？,2025-01-06 06:44,10461,264,邱毅台湾,邱毅台湾,,https://toutiao.com/group/7456689683951518271/,,0,0,True
34岁雌雄同体的女性，具备男女两性器官，她该如何生存下去？,2024-10-17 03:32,4966,239,大象微视,大象微视,这个词在我们生活中并不常见，简而言之，双性人就是既拥有男性的生殖器官，也具备女性的特征的人。1989年，王梓淇出生在山西太原的一个家庭，她的家里经营着一家小生意，虽然谈不上富裕，但足够让一家人过得舒心自在。,https://toutiao.com/group/7426578550418948618/,,0,0,False
我国哪里的面粉无添加？经对比，有这行字就是零添加，可以放心买,2025-01-02 10:44,3103,1252,鲸探所,鲸探所,面粉是我们日常生活中离不开的一种主食，在我国人们的餐桌上是有着非常重要的地位的。可以说，基本上家家户户都是需要用到面粉的，已经快到年下了，许多人也开始往家里置备年货了，而面粉，也是最重要的年货之一。,https://toutiao.com/group/7455263523673834024/,,0,0,False
高安国被押前留下英雄壮语，赖清德恶贯满盈，何时方能恶有恶报？,2025-01-05 04:00,25016,2635,邱毅台湾,邱毅台湾,,https://toutiao.com/group/7455975347708920383/,,0,0,True
老纪和珅这段对话，以前小时候听不懂，如今听完受益终身,2024-12-28 23:16,6289,1817,乐视扒剧小妹儿,乐视扒剧小妹儿,,https://toutiao.com/group/7453420191947424293/,,0,0,True
明明是个退休老师，却唱起了《洪湖水浪打浪》，绝了,2024-12-27 06:53,7569,452,乐视天天剧好看,乐视天天剧好看,,https://toutiao.com/group/7452979076374987290/,,0,0,True
小子相亲故意扮老，谁知道对方一见面就叫他大爷，这段太逗了,2024-12-24 08:17,3912,887,乐视热播综艺精选,乐视热播综艺精选,,https://toutiao.com/group/7451886130837848610/,,0,0,True
煮速冻饺子，切记别用开水和冷水煮，教你方法，出锅和现包的一样,2025-01-04 11:48,1113,243,百变小厨坊,百变小厨坊,,https://toutiao.com/group/7456025845027570203/,,0,0,True
房子旁边住着有120条“狗母蛇”，很多人都没见过，拍给大家看看,2024-11-05 12:27,8129,2784,乡村小故事小妹,乡村小故事小妹,房子旁边住着有120条“狗母蛇”，很多人都没见过，拍给大家看看,https://toutiao.com/group/7433770965259354650/,,0,0,True
原来火腿肠铝环下藏着个“小机关”，轻轻一拉，完整剥开，太棒了,2024-12-30 12:48,5156,3154,百变小厨坊,百变小厨坊,原来火腿肠铝环下藏着个“小机关”，轻轻一拉，完整剥开，太棒了,https://toutiao.com/group/7454186052081680911/,,0,0,True
“喝酒三巨头”：一年全没，有的去世当天喝4瓶白酒，都不满36岁,2024-11-05 10:32,3229,1721,睿之悦,睿之悦,他们的每一次出现都离不开酒，也曾是很多人眼中的“酒中豪杰”。但“小酌怡情，大饮伤身”，这三位博主以生命为代价，再一次给大家带来了警醒。,https://toutiao.com/group/7433739040179520038/,,0,0,False
北大韦神近照曝光！穿千元名牌喝3元农夫，小孩打招呼被吓到失神,2025-01-03 03:42,841,335,青衫书生,青衫书生,最近，有网友在北大学校偶遇伟神在餐厅吃饭的一幕。果然伟神吃饭永远都是一个姿势，低身下俯、埋头苦吃。桌上摆放的还是那几个老套餐，3块钱一瓶的超大矿泉水、出场率极高的馒头...,https://toutiao.com/group/7455526847976096267/,,0,0,False
陕西女子专门为老人洗澡，500洗一次，她洗的不是肉体，是尊严,2024-11-08 10:34,3412,408,睿之悦,睿之悦,2020年，刚刚接触到“助浴师”这个行业不久的聂积燕，突然接到一个特殊的订单:需要给一位即将去世的老人洗澡。相信很多人对于这份工作都是无法理解，甚至是无法接受的。,https://toutiao.com/group/7434853028672389682/,,0,0,False
六代机的先进，好像都没说到位（下）,2024-12-31 13:58,24455,754,静思有我,静思有我,,https://toutiao.com/group/7454575132569240099/,,0,0,True
货车碰撞出殡人群致20死19伤，事故整改评估报告发布,2025-01-06 03:29,1987,810,上观新闻,上观新闻,江西省应急管理厅2025年1月3日发布《江西南昌“1·8”重大道路交通事故整改和防范措施落实情况评估报告》（下称《整改评估报告》）。该报告公布了当地主要整改措施和工作成效，其中包括安全生产专项整治、道路交通安全专项整治、强化企业监管、加大治超力度等、规范殡葬活动、强化宣传教育等。,https://export.shobserver.com/toutiao/html/839831.html,,0,1,False
今年会举行阅兵仪式吗？我大胆作个猜测,2025-01-03 09:11,14798,1688,金灿荣教授,金灿荣教授,,https://toutiao.com/group/7455614288229728803/,,0,0,True
抗美援朝的将军亮相，全体明星自发起立，这幕太感人,2025-01-03 07:32,11909,1358,乐视天天剧好看,乐视天天剧好看,,https://toutiao.com/group/7455587633452843572/,,0,0,True
石破茂亲中吗？,2025-01-03 13:55,11693,588,静思有我,静思有我,,https://toutiao.com/group/7455642885552079395/,,0,0,True
煮小米粥时，切记不要直接用水煮！掌握这3个小技巧，香浓又黏稠,2024-11-07 05:49,1828,271,明玥美食,明玥美食,,https://toutiao.com/group/7434410529231208998/,,0,0,True
退伍军人来应聘保安，一见女老板愣住了，竟是当年战友,2024-12-28 01:49,4568,136,乐视扒剧小妹儿,乐视扒剧小妹儿,,https://toutiao.com/group/7453273869261767203/,,0,0,True
炸鱼块，到底用淀粉还是面粉，今天分享一个又香又脆的做法,2025-01-02 09:26,7997,499,家常的味道,家常的味道,,https://toutiao.com/group/7455247105683096076/,,0,0,True
河南警察3岁女儿被拐，苦寻全国23年无果，结果却发现女儿在对门,2024-11-05 07:43,6326,679,八号探秘人,八号探秘人,寻亲23年无果，丢失的女儿竟住在对门?但它却真实发生在河南洛阳的梁绍波身上。是意外走丢，还是人贩子所为，三岁的女儿怎会离奇失踪?,https://toutiao.com/group/7433697108120142345/,,0,0,False
我国楼市大局已定，未来全国45%的家庭，或将面临“5大挑战”,2024-12-15 11:45,711,108,苍暮颜,苍暮颜,前言:21世纪开始，中国房地产市场一路高歌猛进，繁荣的景象更是吸引了无数投资者和购房者，房价也是一路攀升，也成为了房地产经济增长的重要引擎。,https://toutiao.com/group/7448599203455975947/,,0,0,False
夜里翻来覆去睡不着，原来几根芹菜根就搞定，做法简单，省钱实用,2024-12-25 11:02,10969,1298,百变小厨坊,百变小厨坊,夜里翻来覆去睡不着，原来几根芹菜根就搞定，做法简单，省钱实用,https://toutiao.com/group/7452303315842368052/,,0,0,True
女友怀孕了，男友不装了，带她回豪宅！,2024-11-23 08:01,18124,1309,乐视大综艺咖,乐视大综艺咖,,https://toutiao.com/group/7440353629540483593/,,0,0,True
德国女外长的尴尬让世界看呆了,2025-01-06 18:13,1088,389,胡锡进,胡锡进,德国女外长贝尔伯克被叙利亚实际控制者艾哈迈德·沙拉拒绝握手的一幕传遍世界，这是她本人的尴尬、也让德国挺没面子。如果说是女性拒绝同男性握手，被拒者还有较大诙谐自嘲的空间。,https://toutiao.com/group/7456866324845707813/,,0,0,False
