title,publish_time,like_count,comment_count,media_name,source,abstract,article_url,tag,is_yaowen,article_sub_type,has_video
郜春海：低空经济的发展空间远超新能源，颠覆未来商业模式,2024-12-19 08:10,2930,646,凤凰网财经,凤凰网财经,,https://toutiao.com/group/7450032423821115914/,,0,0,True
县长看不上乡长送的烟，给他退回来，乡长打开一看乐了,2024-11-13 08:16,10567,1756,乐视大综艺咖,乐视大综艺咖,,https://toutiao.com/group/7436672568578277925/,,0,0,True
新婚33天卷走274万4套房，出逃后丈夫跨国追捕，如今下场大快人心,2024-12-20 22:06,3374,189,八号探秘人,八号探秘人,在阅读此文之前，辛苦您点击一下“关注”，既方便您进行讨论和分享，又能给您带来不一样的参与感，感谢您的支持！编辑丨QQ·B“色字头上一把刀！”深圳富豪结婚33天竟被卷走274万元和名下4套房产。不仅如此，他还被扣上了“接盘侠”的帽子，啥也没干喜当爹。,https://toutiao.com/group/7450399558821052982/,,0,0,False
益生菌真的那么神奇吗？有关益生菌的几个误区 你“踩雷”了吗？,2024-12-07 02:35,1812,106,央视频,央视频,,https://toutiao.com/group/7445492942887715365/,,0,0,True
曝2025央视春晚彩排路透！看了到场明星，网友哭了：不该来的来了,2024-12-25 07:35,211,299,8卦娱,8卦娱,文|8卦娱本文所有内容皆有官方可靠信息来源，具体资料赘述在文章内部或结尾2024年即将过去，央视春节联欢晚会，这个伴随了我们半个多世纪的节目，也迎来了准备时刻。这两日，我国公布了决定在除了北京之外，还有重庆、武汉、拉萨和无锡4个分会场，举天同庆。,https://toutiao.com/group/7452249575810761254/,,0,0,False
上海：首座人形机器人工厂实现商用量产,2024-12-23 11:02,2433,453,看看新闻,看看新闻,上海：首座人形机器人工厂实现商用量产,http://mediaplay.kksmg.com/2024/12/23/h264_720p_600k_78886-DFTVHD-20241223175000-4800-969188-600k_mp4.mp4,,0,0,True
特朗普放出一张图，全世界倒吸一口凉气,2024-12-24 23:36,7427,4752,牛弹琴,牛弹琴,特朗普放出一张图，全世界倒吸一口凉气。一张特朗普网购的图。这张图，先是他的儿子埃里克·特朗普贴出来。图右边，特朗普在认真看手机；图左边，手机上显示的是一张购物单，菜篮里有三项货物。第一项，加拿大。第二项，格陵兰岛。第三项，巴拿马运河。标题是：我们回来了。,https://toutiao.com/group/7452121977394971162/,,0,0,False
涉嫌严重违纪违法，8名全国人大代表资格被终止,2024-12-25 13:44,13398,21982,北京日报客户端,北京日报客户端,第十四届全国人民代表大会常务委员会代表资格审查委员会关于个别代表的代表资格的报告（2024年12月25日第十四届全国人民代表大会常务委员会第十三次会议通过）全国人民代表大会常务委员会：由黑龙江省选出的第十四届全国人民代表大会代表，黑龙江省卫生健康委员会原党组书记魏新刚，因涉嫌严重,https://rss2.bjd.com.cn/content/s676c0c02e4b000299badde47.html,,0,0,False
中国突然曝光超级武器，关键时刻终于给了美国狠狠一刀！,2024-12-24 22:00,7654,377,占豪,占豪,为啥这种高超音武器只有中国有呢？大国对抗到了关键时刻靠的是什么？,https://toutiao.com/group/7451895133989503488/,,0,0,True
给24年最好的十部国产剧排名：《我是刑警》仅第10，第1名没争议,2024-12-19 09:05,1630,312,皮皮电影,皮皮电影,2024年接近尾声，回顾这一年的国产剧，我们可以发现一些变化：第一大变化，是央视的动作。从2020年起，或许是面临网剧精品化的冲击，央视也开始主动求变。最开始的动作，还只是瞄准开年大剧，比如2021年的《觉醒年代》、2022年的《人世间》。,https://toutiao.com/group/7449943522318238260/,,0,0,False
萝卜和鸡蛋这样做，比吃补药还补，顿顿吃都不会腻，又香又下饭,2024-10-30 12:28,68780,4215,小寒厨艺,小寒厨艺,萝卜和鸡蛋这样做，比吃补药还补，顿顿吃都不会腻，又香又下饭,https://toutiao.com/group/7431405463378919975/,,0,0,True
大跳水！跌幅超4成！多家品牌集体降价,2024-12-25 00:47,656,960,21世纪经济报道,21世纪经济报道,作 者丨巩兆恩编 辑丨张铭心 江佩佩2024年即将收官，车市全年销量排位赛进入倒计时。12月，一轮新的价格波动来袭，打破了秋季降价潮的平稳过渡，自主品牌价格直降、0息方案、权益加码；合资品牌限时“一口价”、购车礼包附加……年末冲量，车市价格血拼迎来“抄底”时刻。,http://mp.weixin.qq.com/s?__biz=MjI3Njc0NTk4MQ==&mid=2650435091&idx=1&sn=e7333f0af8f9de3483f2018a015ee0ab,,0,0,False
刚刚，表决通过！2026年1月1日起施行,2024-12-25 02:22,1317,314,红星新闻,红星新闻,十四届全国人大常委会第十三次会议12月25日表决通过了增值税法，自2026年1月1日起施行。增值税是我国第一大税种，随着增值税法制定出台，我国现行18个税种中已有14个税种制定了法律，涵盖了绝大部分的税收收入，落实税收法定原则取得重大进展。,https://toutiao.com/group/7452168866412692002/,,0,0,False
人口减少对房地产的影响有多大？,2024-12-19 06:36,16805,3593,温义飞的急救财经,温义飞的急救财经,,https://toutiao.com/group/7450008090864255503/,,0,0,True
马光远：大城市才有机会的观点过时了 #财经大咖来了,2024-12-17 06:00,7420,553,光远看经济,光远看经济,,https://toutiao.com/group/7449256659496469027/,,0,0,True
广西49岁老汉娶19岁姑娘，结婚21年生下15个孩子，如今有何下场？,2024-10-20 08:32,8823,1111,艺述史,艺述史,她19岁出嫁，21年里总共生育了15个孩子，其中4个男孩子11个女孩子，家里热闹的像是开了一所学校一样。,https://toutiao.com/group/7427400319418384948/,,0,0,False
如何看待美国出台的《2024中国军力报告》？,2024-12-23 05:18,23715,1267,大刘说说,大刘说说,美国国防部最近出台了2024中国军力报告，今年我们来聊聊西方世界是如何看待中国的军力发展的,https://toutiao.com/group/7451472335464301096/,,0,0,True
新华社体育部评出2024年中国十佳运动员,2024-12-25 07:07,1661,256,新华网,新华网,新华社北京12月25日电 新华社体育部评出2024年中国十佳运动员如下（按首字笔画排序）：1、马龙（男，36岁，乒乓球）在巴黎奥运会乒乓球男子团体决赛中，国乒男队队长马龙率队3:0战胜瑞典队夺冠，同时个人收获第六枚奥运金牌，成为获得奥运金牌最多的中国选手。,http://my-h5news.app.xinhuanet.com/h5/article.html?articleId=761c87599e1f564cce5b14aea3c2cfbf,,0,0,False
有“关系”花钱就能进国企？考试 面试 培训等全是假的，揭秘骗局,2024-11-05 12:37,1397,161,央视频,央视频,,https://toutiao.com/group/7433773383285735962/,,0,0,True
四川：可4倍音速飞行 成都造“筋斗云”成功试飞,2024-12-20 10:52,4149,377,看看新闻,看看新闻,四川：可4倍音速飞行 成都造“筋斗云”成功试飞,http://mediaplay.kksmg.com/2024/12/20/h264_720p_600k_78546-DFTVHD-20241220175000-4800-967537-600k_mp4.mp4,,0,0,True
郜春海：马斯克具有超强的解构能力,2024-12-19 08:11,2520,569,凤凰网财经,凤凰网财经,,https://toutiao.com/group/7450032592033841675/,,0,0,True
江苏盐城一农民卖羊肉获利180元被市监局开出10万元罚单,2024-12-25 08:05,7179,15209,环球网,环球网,来源：法治日报 法治日报全媒体记者 丁国锋12月24日下午三点，江苏盐城一农民卖1只羊获利180元被大丰区市场监管局罚款10万元的行政诉讼案件，在盐城中院17法庭二审公开开庭。,https://3w.huanqiu.com/a/702f81/4Knj49bX4pr?agt=143,,0,0,False
美政府大翻修  马斯克大爆冲,2024-12-24 11:30,4243,170,郭正亮台湾,郭正亮台湾,大家好，我是郭正亮，你可以叫我亮哥。我来今日头条开帐号，这是我的唯一官方号《郭正亮台湾》，欢迎你时常造访与亮哥谈天说地！,https://toutiao.com/group/7451939242701226507/,,0,0,True
村妇带女儿进城找丈夫，不料撞见他和富家女在结婚，这下好看了,2024-10-15 16:05,944,146,乐视最爱综艺说,乐视最爱综艺说,村妇带女儿进城找丈夫，不料撞见他和富家女在结婚，这下好看了,https://toutiao.com/group/7425843988181025314/,,0,0,True
海南富商张晖：花8亿建108米海上观音像，4年后死在水中死因成谜,2024-10-19 04:49,3972,669,八号探秘人,八号探秘人,在阅读此文之前，辛苦您点击一下“关注”，既方便您进行讨论和分享，又能给您带来不一样的参与感，感谢您的支持！编辑丨xk他是中国的一名富商，耗费8亿元完成了自己的梦想。可梦想落地成为现实的时候，他却在4年后莫名其妙的死去。他就是张晖，上个世纪末海南岛旅游业的龙头当家人。,https://toutiao.com/group/7427288913095492134/,,0,0,False
67岁执意生娃，如今却坐轮椅无法自理，5岁的天赐被迫独立学洗衣,2024-11-04 10:32,9922,2291,睿之悦,睿之悦,2019年，已经67岁的田新菊执意生下了自己的第三个孩子小天赐。那么，现如今5年的时间过去了，这“天赐”的礼物到底是福还是祸呢?,https://toutiao.com/group/7433367394946384435/,,0,0,False
全球最大电磁弹射无人机航母，两栖攻击舰 076即将下水,2024-12-22 09:48,29374,1308,杜文龙,杜文龙,,https://toutiao.com/group/7451170777983877632/,,0,0,True
"明道带王鸥见家长，王鸥脸红不敢进，明道忽悠,直接叫爸妈丨相爱",2024-12-24 03:21,2256,472,乐视天天剧好看,乐视天天剧好看,,https://toutiao.com/group/7451811744126599695/,,0,0,True
特朗普上任在即，拜登彻底不装了？对华连出重拳，中方如何破局？,2024-12-19 06:42,13345,854,邱震海,邱震海,,https://toutiao.com/group/7450009602017460751/,,0,0,True
贪官酒桌上的权钱交易，语言天衣无缝，听懂三分都是人精！,2024-11-23 16:24,1981,273,乐视扒剧小妹儿,乐视扒剧小妹儿,,https://toutiao.com/group/7440378916130259496/,,0,0,True
印度终于想明白了！,2024-12-19 15:23,6124,115,胡锡进,胡锡进,中方特别代表、中共中央政治局委员、中央外办主任王毅同印方特别代表、国家安全顾问多瓦尔根据两国领导人喀山会晤重要共识，本着积极和建设性态度，就中印边界问题进行实质性讨论并达成6点共识。,https://toutiao.com/group/7450143589876630067/,,0,0,False
宋美龄106岁去世，贴身厨子回家后不久自尽，事后妻子透露出缘由,2024-10-28 09:22,14706,512,历史与江湖,历史与江湖,2003年10月，106岁的宋美龄在美国纽约去世，这位世纪老人虽然永远地闭上了双眼，但是却留下了一个长寿神话。,https://toutiao.com/group/7430753866158817855/,,0,0,False
