title,publish_time,like_count,comment_count,media_name,source,abstract,article_url,tag,is_yaowen,article_sub_type,has_video
要么听话，要么挨打，美国给日本下最后通牒，石破茂感叹一句话,2024-10-22 05:09,2727,148,中国台湾王裕庆,中国台湾王裕庆,,https://toutiao.com/group/7428431819118215716/,,0,0,True
15年前他在爱妻葬礼上哭到昏厥，发誓永不再娶，如今他做到了吗？,2024-08-24 02:17,16621,530,八号探秘人,八号探秘人,在阅读此文之前，辛苦您点击一下“关注”，既方便您进行讨论和分享，又能给您带来不一样的参与感，感谢您的支持！编辑丨xk纵观鱼龙混杂的娱乐圈，有人背叛，有人痴情。而果靖霖则是公认的好男儿，将一生都奉献给妻子。但妻子却仅仅陪他走了半生，没能战胜病魔，不幸离开人世。,https://toutiao.com/group/7406210316734710283/,,0,0,False
3年前，宁夏7岁小女孩一笑走红，后拒百万签约，如今怎么样了？他们后悔了吗？,2024-09-19 07:25,5103,834,睿之悦,睿之悦,2021年，视频镜头中出现的女孩儿用那一抹甜美的笑容，迅速引起了网友们的广泛关注。有媒体公司看到这一机遇，提出愿意用百万巨资与女孩儿签约，然而，女孩儿的父母却坚决拒绝了这一提议。,https://toutiao.com/group/7416250139544879679/,,0,0,False
韩国白菜涨到天价，民众坚决拒绝中国白菜，饿死也要坚守政治正确,2024-10-23 07:19,397,101,客观听書,客观听書,白菜真是个神奇的东西，在中国象征着“便宜货”，到韩国却成了“奢侈品”!面对如此高昂的价格，韩国民众却坚决拒绝中国白菜，甚至引起骂声一片。,https://toutiao.com/group/7428859965059678720/,,0,0,False
"轮到美被""垄断""了！""芯片之父""弃美回国，中国或摆脱美国芯片垄断",2024-09-26 09:43,4451,555,何止电影,何止电影,1997年，芯片科研人员邓中翰，在美国硅谷创建半导体公司，不到三年时间，市场价值超1.5亿美元。在加州大学130多年的历史上，他是第一个在同一时间，获得三个学位的人，并且是在短短4年内，主修完全部课程。,https://toutiao.com/group/7418882995802653203/,,0,0,False
青岛中院悬赏最高990万元，征集西王集团董事长王勇等人财产线索,2024-10-23 00:20,1672,1003,澎湃新闻,澎湃新闻,山东省青岛市中级人民法院悬 赏 通 告（2024）鲁02执383号被执行人：西王国际贸易（青岛）有限公司，住所地：山东省青岛市市北区敦化路138号3801室。法定代表人：王伟，董事长兼经理。被执行人：西王集团有限公司，住所地：山东省邹平市西王工业园。法定代表人：王勇，董事长。,https://m.thepaper.cn/newsDetail_forward_29117849?from=toutiao,,0,0,False
给近三年最好的10部年代剧排个名：《人世间》第6，第1名没有争议,2024-09-06 08:08,7654,2602,皮皮电影,皮皮电影,时尚是个轮回，电视剧也是。在2020年之前的那些年，电视剧市场基本上都被偶像剧、都市剧霸占。曾经撑起国剧品质的《闯关东》《岁月》这类年代好剧，难见踪影。,https://toutiao.com/group/7411390030722712090/,,0,0,False
华为研发中心3万多名研发人员一年内搬迁！所在乡镇两室一厅租金从2000多元/月涨到4000多元/月,2024-10-23 00:41,809,553,大河报,大河报,10月14日，华为全球最大研发中心正式迎来首批进驻员工，3万多名研发人员将在一年内从浦东分批搬迁到青浦练秋湖。,https://toutiao.com/group/7428763190089105961/,,0,0,False
猪肉别总是炒着吃了，教你简单又好吃的做法，简直太香了,2024-09-11 09:11,9820,496,家常的味道,家常的味道,猪肉别总是炒着吃了，教你简单又好吃的做法，简直太香了,https://toutiao.com/group/7413310656981664283/,,0,0,True
以色列杀红眼了？“送礼”6颗航弹给中国维和部队 敬酒不吃吃罚酒,2024-10-23 09:11,2573,689,九州品史,九州品史,,https://toutiao.com/group/7426917186809102900/,,0,0,True
写歌30年穷困潦倒，前妻失望选择离婚，谁料51岁靠一首歌一夜成名,2024-08-12 03:37,26149,4330,八号探秘人,八号探秘人,在阅读此文之前，辛苦您点击一下“关注”，既方便您进行讨论和分享，又能给您带来不一样的参与感，感谢您的支持！编辑：LY无数人都想要一个一夜成名的机会，但机会来了也不是每个人都能把握住的。他用了三十年的时间来准备迎接属于自己的机会。为了这个机会他放弃了一切，甚至包括家庭。,https://toutiao.com/group/7402090890367484428/,,0,0,False
善恶终有报：疫情时对中国一毛不拔，却大方捐美国6亿，如今咋样,2024-09-29 05:50,838,116,睿之悦,睿之悦,可就是这样一位在中国土生土长起来的富豪，在疫情期间面对同胞的困境却一毛不拔，反而大方的捐助了6亿给美国。,https://toutiao.com/group/7419859345154015798/,,0,0,False
在两性关系中，女性最多能接受多少岁的男人，3位女人说出心里话,2024-07-25 23:38,28489,8701,玲儿说说,玲儿说说,,https://toutiao.com/group/7395721886363025920/,,0,0,True
全球约一半肝癌在中国，再次提醒：家中的4种食物，尽早撤下餐桌,2024-08-13 08:36,104926,3557,梁医学社梁怡璋医生,梁医学社梁怡璋医生,,https://toutiao.com/group/7402540119712629311/,,0,0,True
土豆搭配洋葱，教你一个神仙吃法，一次3斤不够吃，太解馋了,2024-09-26 09:09,24829,1514,家常的味道,家常的味道,土豆搭配洋葱，教你一个神仙吃法，一次3斤不够吃，太解馋了,https://toutiao.com/group/7418876506660667904/,,0,0,True
今天才知道！电动车“每天充”和“用完再充”，到底哪个更伤电池,2024-08-27 11:19,13041,2250,鲸探所,鲸探所,“今天到底给车充不充电？”估计大多数人每天回家都会想这个问题，看着自己的电动车电量又多又少的，充不充电也是一件非常难以抉择的事情。那么，电动车到底应该怎样充电呢？是每天都充，还是用完之后再充呢？电动车充电不管是在城市还是农村，电动车其实都是人们出门最常见的交通工具。,https://toutiao.com/group/7407773012533117475/,,0,0,False
爸妈中，谁的基因决定孩子的智商和长相，专家回答很统一，太准了,2024-08-31 12:04,562,154,5分钟快读,5分钟快读,阅读此文前，诚邀您点击一下“关注”按钮，方便以后持续为您推送此类文章，同时也便于您进行讨论与分享，您的支持是我们坚持创作的动力~在生活中，许多人都相信：“男生随妈妈，女生随爸爸”这一说法。长久以来，许多人对这一说法深信不疑。但随着科学的普及，越来越多的人也对此产生了怀疑。,https://toutiao.com/group/7409241548929499660/,,0,0,False
炸萝卜丸子，放面粉和淀粉就错了，教你正确做法，焦香酥脆不吸油,2024-09-28 10:13,14232,501,家常的味道,家常的味道,,https://toutiao.com/group/7419635124758643227/,,0,0,True
民间上坟传统：“上坟不带 5 果，家中不惹灾祸”，哪“5果”？,2024-08-08 10:30,15685,1607,惠农圈,惠农圈,在中国传统文化中，祭祀祖先一直是一项备受重视的活动，它承载着对先人的缅怀、敬意和感恩之情。在上坟的时候，人们会提前准备好供品，比如肉类、酒水，还有水果。其中关于水果的准备，也有着诸多的讲究和禁忌，比如“上坟不带 5 果，家中不惹灾祸”的说法。,https://toutiao.com/group/7400584207141192207/,,0,0,False
央视展示东风-26竖起，20辆导弹发射车，韩国挑事北约敢来吗？,2024-10-21 04:15,27487,685,陈虎点兵,陈虎点兵,,https://toutiao.com/group/7428077887284052495/,,0,0,True
特朗普入主白宫，恐怕要成真,2024-10-23 09:02,6226,493,司马南,司马南,"距离2024年美国大选还有两周时间。
特朗普和哈里斯到底谁能赢得大选？
其实市场已经给出了答案。
特朗普赢得大选，马斯克起到了至关重要的作用 。
以上当然为一家所言，哈里斯绝不承认这个结果。     
有人认为，义乌的旗帜即可以说明一切。
也有人认为，没到大选最后一刻，一切皆有可能。不排除民主党再次使特朗普物理消失。",https://toutiao.com/group/7428893987861987851/,,0,0,True
安徽美女道士胡小慧被捕：精通“胡媚术”，九名男徒弟揭露其罪行,2024-09-12 08:10,3733,426,艺述史,艺述史,在安徽一处偏僻山头上，有座神秘的道观，外表平平无奇，但里面却有着一位名气很高的美女道士。美女道士的名字叫做胡小慧，据说有着高深的法力，能帮人消灾解难。很多人慕名前来，交上丰厚的香火钱，在袅袅青烟里，试图从这个年轻道士身上获得一些生活的支撑。,https://toutiao.com/group/7413662261274739200/,,0,0,False
华为三折叠缺点很多，我终于买到了,2024-10-22 09:04,18153,1314,司马南,司马南,,https://toutiao.com/group/7428523223447011890/,,0,0,True
朝鲜半岛（上）：是谁搅乱了朝鲜与韩国局势？,2024-10-19 10:37,21916,178,卢克文工作室,卢克文工作室,,https://toutiao.com/group/7427434136895226408/,,0,0,True
养殖虾都是吃抗生素、激素长大的？到底能不能吃？告诉你真相,2024-10-14 10:32,1536,271,奇妙的本草,奇妙的本草,,https://toutiao.com/group/7425577390057488959/,,0,0,True
她是央视最惨主持人，男友被判死缓，丈夫诈骗入狱，47岁无人敢娶,2024-08-27 23:30,2262,210,闻书识焉,闻书识焉,她曾是央视的台柱子，和董卿、周涛并称为央视的三朵金花。回顾刘芳菲的前半生，最令人感到惋惜的，便是她的感情生活，47岁至今无人敢娶。,https://toutiao.com/group/7407743113688564258/,,0,0,False
1976年周、朱、毛同一年逝世，临终前，三位伟人都交代了什么话？,2024-09-24 09:46,9265,403,呷谈历史,呷谈历史,1976年是最令人悲伤的一年，那一年三位伟人相继离世，还发生了唐山大地震。三位伟人在离世前都交代了一些事情，这些事情都和之后国家的发展有关系。,https://toutiao.com/group/7418141722196197900/,,0,0,False
大老虎在总统套房潇洒，殊不知对面住着中央领导，有戏看！,2024-10-15 02:37,3062,137,乐视群星访谈秀,乐视群星访谈秀,大老虎在总统套房潇洒，殊不知对面住着中央领导，有戏看！,https://toutiao.com/group/7425826039802102284/,,0,0,True
中国首例5胞胎现状曝光：父亲过劳去世，如今22年过去，母亲竟然直言后悔……,2024-08-19 08:57,4551,1316,读者,读者,在我看来，这个故事更为让人动容的地方，是爱和责任。缴宝存殚精竭虑、省吃俭用，只为一家人撑起一片天;王翠英将5个孩子全都带在自己身边，教他们识字，教他们做人，教他们团结友爱。,https://toutiao.com/group/7404674971840086540/,,0,0,False
