title,publish_time,like_count,comment_count,media_name,source,abstract,article_url,tag,is_yaowen,article_sub_type,has_video
中国接到挑战书，32国对华施压，人民币付款陷困境，中俄贸易质变,2024-10-03 07:06,5219,117,大白话瞰世界,大白话瞰世界,北约新秘书长刚上台就迫不及待对华发出挑战书，不允许中国支持俄罗斯。当前，人民币付款交易陷入困境，中俄经贸合作已经发生新的改变。北约对华施压的目的是什么？中俄合作又将发生怎样的变化？,https://toutiao.com/group/7421442204532474406/,,0,0,True
全球约一半肝癌在中国，再次提醒：家中的4种食物，尽早撤下餐桌,2024-08-13 08:36,95267,3539,梁医学社梁怡璋医生,梁医学社梁怡璋医生,,https://toutiao.com/group/7402540119712629311/,,0,0,True
为什么冷冻的馒头超过三天就不能吃了？看完你就明白了,2024-09-29 09:10,4192,1640,身心驿站,身心驿站,,https://toutiao.com/group/7419990007072424484/,,0,0,True
有人冒充我男朋友，算不算诈骗？遇到奇葩事你会怎么办？,2024-09-06 05:52,1650,217,兴凯湖莹莹,兴凯湖莹莹,,https://toutiao.com/group/7411404025502892554/,,0,0,True
黑龙江美女囚犯毕丽梅，被枪决后在殡仪馆苏醒，家属：放了她吧?,2024-08-25 14:32,1853,261,冯律讲法,冯律讲法,女死刑犯被枪决后在殡仪馆起死回生，当场把火化的工作人员吓得够呛，就连随行的警察都吓了一跳，壮着胆上前检查一番后，立马把离奇的情况上报。不一会儿法医赶到现场，证实了女犯人的确还活着，亲属闻声下跪，以死过一回为理由，恳求放了她。,https://toutiao.com/group/7407082388163002921/,,0,0,False
穷人是如何把下一代教育成穷二代的？真实纪录片，揭露残酷真相！,2024-10-03 23:40,6622,1951,晓星谈记录,晓星谈记录,,https://toutiao.com/group/7421668306286805539/,,0,0,True
燃油车再起价格战，“一口价”时代来了？,2024-09-29 08:56,422,603,都市快报橙柿互动,都市快报橙柿互动,橙柿互动 记者 张景嵩今年8月，新能源汽车的渗透率达到了53.7%，连续两个月突破50%。随着国内新能源汽车的渗透率越来越高，燃油车的处境也越来越困难，特别是合资车企的处境。当下不少合资车企在燃油车新车发布会上开启了“一口价”模式。,https://toutiao.com/group/7419986252797903398/,,0,0,False
牛市疯了：3天赚了一百万，高兴得太早，回头发现“卖飞了”,2024-10-03 13:00,3335,4293,凤凰网财经,凤凰网财经,编者按:30岁的孙默，在北京有一份稳定的工作，五年前，手里刚有一点积蓄，他就全部投入股市，没想到紧接着迎来了疫情。,https://toutiao.com/group/7421533420930482703/,,0,0,False
董老师智慧正能量传递,2024-09-23 01:42,18093,6037,顶级小鱼IRQui,顶级小鱼IRQui,,https://toutiao.com/group/7417647975624606217/,,0,0,True
盘点那些采访爆笑瞬间，一个敢问一个敢答，小姐姐都太豪横了,2024-07-11 08:37,45802,2692,开心呱呱笑,开心呱呱笑,盘点那些采访爆笑瞬间，一个敢问一个敢答，小姐姐都太豪横了,https://toutiao.com/group/7390294511139684879/,,0,0,True
苹果手机中国最便宜，日本人愤怒了,2024-10-03 14:35,20762,1885,司马南,司马南,"一些媒体总喜欢吐槽iPhone如何创新不足、坑害消费者，不过日本媒体却指出苹果才是对中国消费者最厚道的，iPhone16在全球诸多国家的售价中，竟然在中国市场最便宜的，比日本、美国市场都要便宜不少。
#苹果手机#",https://toutiao.com/group/7421558007551263268/,,0,0,True
11种中国绝版的老香烟，见过5种以上的，差不多是“爷爷”辈人了,2024-09-30 06:22,144,108,万物知识局,万物知识局,香烟是一种非常神奇的产物，它既能让烟民缓解心中紧张的情绪，也能在特定的时候成为老烟民们心中一种情绪的释放，在很多人焦虑的时候，总会想抽一口，缓解压力。,https://toutiao.com/group/7420275305845113354/,,0,0,False
妻子这么漂亮 丈夫依然不老实 那就后果自负,2024-07-07 04:34,11406,393,鱼儿电影,鱼儿电影,,https://toutiao.com/group/7388747768665211418/,,0,0,True
女人不满足会有这三个信号，丈夫不能不懂，你知道几个？,2024-08-10 01:56,2825,194,莎莎,莎莎,,https://toutiao.com/group/7401323872249479680/,,0,0,True
美国预警伊朗袭击以色列，二三十架F-35被摧毁？这个可能性有多大,2024-10-03 08:37,11719,536,陈虎点兵,陈虎点兵,,https://toutiao.com/group/7421465700525179429/,,0,0,True
伊朗和以色列继续开打，谁最终扛不住？,2024-10-03 21:56,1515,123,秦安战略,秦安战略,中东态势极为严峻，本来伊朗新总统跑到美国去，说要合作，想通过妥协免除制裁。结果事与愿违，以色列看到伊朗解除报复威胁，直接斩首真主党领袖，团灭高层，希望这次把伊朗震醒了。伊朗也明确要派兵到黎巴嫩，说不能黎巴嫩孤军作战，哈梅内伊在家召集紧急会议，伊朗外长：当前中东一切皆可能发生，另外，网传内塔尼亚胡受袭身亡。,https://toutiao.com/group/7421545185206600226/,,0,0,True
#人性电影,2024-09-30 03:54,977,150,时光剪影,时光剪影,,http://toutiao.com/item/7420279600897098274/,,0,0,True
联合国会对以色列动武吗?,2024-10-03 14:18,14995,749,司马南,司马南,"“这个小的政权不是一个国家。它是一个自称为‘神的选民’的、种族主义、民族至上主义殖民地。与你们不同，我们不相信‘选民’… 现在是你们结束对‘优秀种族’的支持的时候了。”伊朗马兰迪教授在天空新闻节目中说。
“神选民族”这个词儿很鲜亮， 自认为自己是神选的，倒也没啥，关键是这个神选的民族对异族肆意屠杀，超越了人类的底线。
#中方警告一场全面战争一触即发#",https://toutiao.com/group/7421553569192477196/,,0,0,True
张紫妍：被迫陪睡31人近百次，遭道具虐待，29岁自杀留230页遗书,2024-07-24 02:37,12926,904,八号探秘人,八号探秘人,在阅读此文之前，辛苦您点击一下“关注”，既方便您进行讨论和分享，又能给您带来不一样的参与感，感谢您的支持！本文叙述皆有官方信源，为了读者有更好体验，放在了文章后缀！,https://toutiao.com/group/7394994383675736576/,,0,0,False
富庶小国崩溃有多快？三年变地狱：全国断电缺粮，连吃饭都成问题,2024-08-04 04:14,4065,533,鲸探所,鲸探所,凭借着富裕的石油，中东国家也过上了坐在金钱堆里的生活，“头顶一块布，中东我最富”更是很多国家对于中东国家的“印象”。然而在满是石油和金钱的中东地区，却有一个例外:黎巴嫩。,https://toutiao.com/group/7398766345946399273/,,0,0,False
美籍华人科学家吴瑛，在美国芝加哥家中服毒自杀，自杀原因曝光！,2024-09-04 05:28,1123,983,开心营业厅,开心营业厅,前言8月31日，香港《南华早报》报道：美籍华裔科学家吴瑛，在美国服用过量毒性药物，自杀身亡！她的离世，与美国政府对华人科学家的“迫害”有着直接的联系。美国为何频频针对华人科学家，难道说“科学无国界”真的成了一句笑话吗？,https://toutiao.com/group/7410619875699212826/,,0,0,False
东风41恐惧症在欧美蔓延：外媒坚定认为，先进导弹绝非东风31AG,2024-10-01 14:26,4449,790,南友汇,南友汇,日前以英国《金融时报》，美国《华盛顿时报》为首的欧美国家媒体撰文称，解放军本次试射的洲际导弹绝非是东风31AG，而是解放军现役更先进的东风41洲际导弹。,https://toutiao.com/group/7420812639297520163/,,0,0,False
善恶终有报！66岁“消失”了的陈宝国，可谓是娱乐圈的悲哀与损失,2024-09-27 06:29,1951,128,八号探秘人,八号探秘人,“我真的挺不喜欢听艺人这个词，前两年听得我一个劲儿地倒胃口”。当很多人挤破脑袋想要进娱乐圈当一名艺人的时候，他却说了这样一句话。,https://toutiao.com/group/7419206100681114153/,,0,0,False
他于9月30日凌晨因交通意外不幸去世，年仅35岁,2024-10-04 02:45,1028,495,大皖新闻,大皖新闻,10月3日，南昌百餐及赣乡野餐饮管理有限公司发布了一则《沉重公告》。讣告显示，百餐创始人兼赣乡野董事长魏昆先生于2024年9月30日凌晨因交通意外不幸去世，享年35岁。据江南君电话联系公告上的朱先生，他表示他是魏昆的合伙人，这件事是真的。,http://www.ahwang.cn/toutiao/202410/2753656.html,,0,1,False
联合国安理会紧急声明！,2024-10-04 01:57,740,291,红星新闻,红星新闻,当地时间10月3日，联合国安理会轮值主席瑞士代表安理会成员发表声明，称全力支持联合国秘书长古特雷斯的工作。声明强调，所有会员国都需要与秘书长建立富有成效的关系，并避免采取任何破坏秘书长工作及其办公室工作的行动。,https://toutiao.com/group/7421733555690095115/,,0,0,False
军队很恼火，中国花300亿美元买的俄罗斯武器，如今全部退居二线,2024-07-10 08:41,2080,215,藏剑游侠儿,藏剑游侠儿,因头条改版，增加了广告解锁功能，当广告打开，静等5秒钟后，就可以伸出发财的小手，点击右上角的关闭按钮，感谢观众老爷理解，在此拜谢各位观众老爷了------上世纪八九十年代，中国与俄罗斯达成军事合作，俄罗斯因为苏联解体急需发展经济，中国迫切需要武器发展国防力量。,https://toutiao.com/group/7389919360342704676/,,0,0,False
富婆深夜独自回家 看到两个男人在敲自己家门 下秒做法太机智了,2024-08-09 10:20,11435,954,车界前说,车界前说,,https://toutiao.com/group/7401082708190822963/,,0,0,True
世界机器人大会，许多观众伸手触摸扮演机器人的女模特,2024-09-05 09:32,395,206,经视看天下,经视看天下,,https://toutiao.com/group/7411089669858787855/,,0,0,True
英国前首相约翰逊再爆猛料：内塔尼亚胡借用他厕所后，马桶里发现了窃听器,2024-10-04 08:02,380,145,极目新闻,极目新闻,据环球时报援引《每日电讯报》10月3日报道，英国前首相鲍里斯·约翰逊在即将出版的回忆录里爆料：以色列总理本雅明・内塔尼亚胡在2017年访问时任外交大臣的约翰逊的办公室时，可能在其厕所里安装了窃听装置。,http://jms.ctdsb.net/jmythshare/#/index_share?cId=0&contentType=5&contentId=2270620,,0,0,False
国乒5朵金花的家庭：王艺迪体二代，陈梦富二代，王曼昱父亲泪目,2024-08-04 02:03,2644,147,不似少溓游,不似少溓游,想要在国内靠乒乓球打出名堂，仅仅有天赋是完全不够的。因为在中国乒坛，万里挑一的天才遍地都是。以至于有不少人都选择放弃，甚至还有田志希这样为了能打乒乓球而选择归化韩国的球手。,https://toutiao.com/group/7398094722457289266/,,0,0,False
2013年，湖南26岁女孩嫁给71岁老头，婚后还生下一子，如今怎样了,2024-07-12 11:59,26465,2404,智史通鉴,智史通鉴,2013年4月17日，长沙宁乡县的民政局迎来了一对特殊的夫妻。一个71岁的老头和一个26岁的女孩，离远了看，甚至像爷爷和孙女。面对工作人员异样的眼光，女孩说：“我和他是真心相爱的！”这让人好奇，这对相差45岁的夫妻，他们之间到底有着怎样的爱情故事？,https://toutiao.com/group/7390696631223534120/,,0,0,False
男子与女子在河中嬉戏玩耍，突然连续将女子的头按入水中,2024-09-26 04:40,1162,158,经视看天下,经视看天下,,https://toutiao.com/group/7418807108637819444/,,0,0,True
她曾被前夫一巴掌扇到离婚！二婚嫁世界冠军，如今生活幸福滋润,2024-09-10 09:12,8430,153,豆莱说,豆莱说,“漂亮的让人挪不开眼”是圈内人对她的评价，和“山杏”不一样的是，李琳在现实生活中的感情很是幸运，遇到了导演王小列。,https://toutiao.com/group/7412930201929204236/,,0,0,False
今天才知道！电动车“每天充”和“用完再充”，到底哪个更伤电池,2024-08-27 11:19,8067,1644,鲸探所,鲸探所,“今天到底给车充不充电？”估计大多数人每天回家都会想这个问题，看着自己的电动车电量又多又少的，充不充电也是一件非常难以抉择的事情。那么，电动车到底应该怎样充电呢？是每天都充，还是用完之后再充呢？电动车充电不管是在城市还是农村，电动车其实都是人们出门最常见的交通工具。,https://toutiao.com/group/7407773012533117475/,,0,0,False
孙颖莎又火了！1比9落后，万万没想到，世界第一创造最神奇的一幕,2024-09-14 08:00,19161,2312,体育A梦,体育A梦,究竟是什么样的对手，能让世界排名第一的孙颖莎打的如此艰难，又是什么样的高手，能把孙颖莎打出1:9落后的惊天比分，到底又是什么样的大心脏，能让孙颖莎从1:9落后 直接到12:10的超绝逆转，这是一场把所有国人吓得捂起眼睛的比赛，到底有多轰动世界，今天就让我们来一探究竟，一起重温这场史无前例的逆袭之战！,https://toutiao.com/group/7414105969241621026/,,0,0,True
这是调戏还是搭讪？,2024-08-16 04:36,2830,152,潍坊市广播电视台,潍坊市广播电视台,,https://toutiao.com/group/7403591622725272100/,,0,0,True
