title,publish_time,like_count,comment_count,media_name,source,abstract,article_url,tag,is_yaowen,article_sub_type,has_video
这就是旺三代的媳妇，祖上积德啊，才能娶到这么好的媳妇👍,2025-01-27 10:33,18130,1594,趣知达人,趣知达人,,https://toutiao.com/group/7464541223764705842/,,0,0,True
上门讨薪违法。民警呵斥法盲妇女：家是人的最后一道防线,2025-01-23 03:15,15743,24952,小红纪实,小红纪实,,https://toutiao.com/group/7462944062039966218/,,0,0,True
蔡正元谈为什么DeepSeek让英伟达跌超12%,2025-01-27 16:28,6562,447,海峡纪,海峡纪,蔡正元谈为什么DeepSeek让英伟达跌超12%,https://toutiao.com/group/7464632754425987599/,,0,0,True
公公竟然和儿媳偷情，哪料被妻子撞见，这下有戏看了！,2025-01-21 08:05,8732,764,南瓜午夜厅,南瓜午夜厅,,https://toutiao.com/group/7462273852651979274/,,0,0,True
河南春晚又杀疯了！一晚诞生6大名场面，网友：这才叫文化自信,2025-01-27 09:10,12630,1158,小甜聊音乐,小甜聊音乐,河南春晚又杀疯了！一晚诞生6大名场面，网友：这才叫文化自信,https://toutiao.com/group/7464496619287757349/,,0,0,True
中国男子实拍大火后的洛杉矶，他说说出了国人的心声。,2025-01-22 02:24,17872,1851,及时行乐,及时行乐,,https://toutiao.com/group/7462462511921693211/,,0,0,True
来不及：小姨子找姐夫要说法，没想姐夫衣冠禽兽，小姨子都不放过,2025-01-22 18:37,2427,158,乐视激斗影院,乐视激斗影院,,https://toutiao.com/group/7462625291735695923/,,0,0,True
小姑子30岁不嫁人，天天就喜欢和哥哥腻在一起，嫂子忍无可忍爆发,2025-01-23 02:38,4302,959,影视随意看,影视随意看,,https://toutiao.com/group/7462934734751007284/,,0,0,True
美国大规模遣返非法移民，甚至直接去家里抓人 #美国遣返,2025-01-27 08:05,5991,2124,九哥畅聊,九哥畅聊,,https://toutiao.com/group/7464502862115045939/,,0,0,True
