title,publish_time,like_count,comment_count,media_name,source,abstract,article_url,tag,is_yaowen,article_sub_type,has_video
一见·这座港为何称为“新时代亚拉陆海新通道”,2024-11-15 04:44,848,1098,人民日报,人民日报,“从钱凯到上海，我们正在见证的，不仅是共建‘一带一路’倡议在秘鲁的生根开花，也是一条新时代亚拉陆海新通道的诞生。”,https://www.peopleapp.com/column/30047365316-500005918340?utm_source=头条号&promote=true,,0,0,False
特朗普要硬杠深层政府搞颠覆改革，美盟友另找老大，中国机会来了,2024-11-15 06:54,8903,647,邱毅台湾,邱毅台湾,,https://toutiao.com/group/7437395978044310031/,,0,0,True
地铁惊现神秘男子，行为诡异，女孩们见了都对其避而远之！,2024-11-08 07:34,1127,126,乐视综艺咖,乐视综艺咖,,https://toutiao.com/group/7434808570073481737/,,0,0,True
1米3袖珍美女嫁给1米48男孩，婚后丈夫奇迹长高，两人却不欢而散,2024-09-07 02:55,4399,240,睿之悦,睿之悦,杨萍和葛存苗的婚礼 文|睿之悦 编辑|睿之悦2019年，成都的民政局来了两个“10岁小孩”来登记，工作人员以为是玩闹。两个“小孩”拿出身份证让工作人员看，这才明白，原来是两个再也长不高的成年袖珍人情侣。,https://toutiao.com/group/7411713833267364386/,,0,0,False
特朗普怎么结束俄乌战争和中东战争，泽连斯基纳塔亚胡命运大不同,2024-11-14 05:39,13029,446,邱毅台湾,邱毅台湾,,https://toutiao.com/group/7437005549285147187/,,0,0,True
两次交火让朝军开眼界，朝鲜1万大军存在缺陷：1个月还无法打大仗,2024-11-09 08:10,13931,4929,深度工场,深度工场,朝鲜军队混编在俄军第810海兵旅，在库尔斯克州苏贾地区，连续打了两次战斗，可以说开了眼界。朝鲜军队1万大军已经抵达俄罗斯大约1个月，这批朝鲜军队全都是特种兵，至少训练了四年，五年的老兵。,https://toutiao.com/group/7435186488997855807/,,0,0,False
罕见！100年前，英国游客拍下的清朝乡村，和想象中完全不一样,2024-09-20 02:07,6225,632,万物知识局,万物知识局,泥泞的土路，衣不蔽体的老百姓，即便是达官显贵的家中也十分破败，而这些都是清王朝的历史痕迹，虽说那时候中国摄影技术并不发达，但也有许多外国游客来到这里，拍摄下了许多老照片，为我们留下了珍贵的历史资料，那清朝到底是怎样的面貌呢?,https://toutiao.com/group/7416287738871267855/,,0,0,False
12万亿的化债一落地，猪又要飞上天了！年底之前1大行业急剧上涨,2024-11-15 03:39,1495,176,量子教育新商学,量子教育新商学,,https://toutiao.com/group/7437345740701860390/,,0,0,True
【崔哥天天侃11/15】亮肌肉和牙齿，豺狼就不敢欺负你,2024-11-14 21:59,11978,634,北美崔哥,北美崔哥,,https://toutiao.com/group/7437257885295313446/,,0,0,True
俩人相亲互相看不上，哪料男方一报母亲身份，姑娘乐了,2024-11-08 01:50,8167,1946,乐视群星访谈秀,乐视群星访谈秀,,https://toutiao.com/group/7434719902990074395/,,0,0,True
著名专家预言：试管婴儿寿命仅40年，那首例试管婴儿如今怎样了？,2024-09-01 06:05,9073,439,睿之悦,睿之悦,文|睿之悦编辑|睿之悦“试管婴儿活不到40岁？”1988年3月10日，我国首例试管婴儿顺利诞生。在当时，试管婴儿的技术正处于起步阶段，因此，有人将其视为医学的奇迹，但也有人则预言试管婴儿活不过40岁。那么，36年的时间过去了，我国首例试管婴儿如今怎么样了呢？,https://toutiao.com/group/7409105262277853733/,,0,0,False
拦车收费？交警不管！景区不管！政府看不见！九寨沟咋全是土匪？,2024-09-22 15:55,225951,44395,行哥嘚啵嘚,行哥嘚啵嘚,,https://toutiao.com/group/7417496641638400527/,,0,0,True
小马科斯彻底摊牌，将配合国际刑事法院逮捕，杜特尔特回了两个字,2024-11-14 10:29,6528,830,历史有点冷,历史有点冷,小马科斯彻底摊牌，将配合国际刑事法院逮捕，杜特尔特回了两个字,https://toutiao.com/group/7437080210178048531/,,0,0,True
昨天下午4点58分，北京天安门震撼降下国旗，场面令人激动落泪,2024-11-15 00:05,2655,152,好邻居李亮,好邻居李亮,昨天下午4点58分，北京天安门震撼降下国旗，场面令人激动落泪,https://toutiao.com/group/7437290389452620340/,,0,0,True
特朗普为啥说中国不会武统？,2024-11-09 14:00,24992,152,静思有我,静思有我,,https://toutiao.com/group/7435279079740047872/,,0,0,True
快消失的12个生活用品！40年前在供销社红极一时，你家还在用吗？,2024-09-29 07:58,5517,363,万物知识局,万物知识局,在这里，可以买到从油盐酱醋到衣物鞋帽，再到农具化肥等各种生活必需品，每一样物品都凝聚着时代的特色，见证了那个年代人们的生活状态，今天我们就来走进那些年能够在供销社里买到的生活用品，看看你们还记得哪些。,https://toutiao.com/group/7419937237548237322/,,0,0,False
中国小伙跟着意大利农民抓野鸡，收获真不小，野鸡真够肥的！,2024-11-14 06:00,7961,747,意大利西蒙记,意大利西蒙记,中国小伙跟着意大利农民抓野鸡，收获真不小，野鸡真够肥的,https://toutiao.com/group/7437010758686212619/,,0,0,True
包厢全是刚出狱的恶霸，结果一看到饭店主厨，立马怂了,2024-11-11 01:21,5249,129,乐视群星访谈秀,乐视群星访谈秀,,https://toutiao.com/group/7435825833048015400/,,0,0,True
特务男扮女装混进村子，孩子兵顿时发现不对劲，这下精彩了,2024-10-28 06:09,4064,402,乐视群星访谈秀,乐视群星访谈秀,,https://toutiao.com/group/7430704630294413878/,,0,0,True
为什么东北地区得半身不遂的人这么多？调查发现：主要原因有三点,2024-08-19 03:53,4819,1102,39健康网,39健康网,李大爷今天在外面跑完步回来，全身都被汗浸透了，想着先洗个澡，结果没过15分钟，就听到浴室传来一声闷响，家人赶紧上前查看，发现大爷已经倒地昏迷，于是赶紧叫了救护车。,https://toutiao.com/group/7404689072582558223/,,0,0,False
拿下订单就开吹？俄媒：苏-57比中国歼-35更强！两款战机谁更强？,2024-11-15 08:02,759,705,军武次位面,军武次位面,在2024珠海航展上，俄罗斯的苏-57E作为主角之一，进行了多场高难度的飞行表演，如落叶飘、眼镜蛇机动等，优秀的机动性确实吸引了不少参观者的眼球。,https://toutiao.com/group/7437402763559977487/,,0,0,False
韩国真急了,2024-11-14 08:50,4154,335,牛弹琴,牛弹琴,韩国贴了一张图，专门给特朗普看的,https://toutiao.com/group/7437054816481706532/,,0,0,True
特朗普颠覆美国  挑战全球,2024-11-13 11:30,9436,608,郭正亮台湾,郭正亮台湾,大家好，我是郭正亮，你可以叫我亮哥。我来今日头条开帐号，这是我的唯一官方号《郭正亮台湾》，欢迎你时常造访与亮哥谈天说地！,https://toutiao.com/group/7436688972212634139/,,0,0,True
15年前他在爱妻葬礼上哭到昏厥，发誓永不再娶，如今他做到了吗？,2024-08-24 02:17,20103,611,八号探秘人,八号探秘人,在阅读此文之前，辛苦您点击一下“关注”，既方便您进行讨论和分享，又能给您带来不一样的参与感，感谢您的支持！编辑丨xk纵观鱼龙混杂的娱乐圈，有人背叛，有人痴情。而果靖霖则是公认的好男儿，将一生都奉献给妻子。但妻子却仅仅陪他走了半生，没能战胜病魔，不幸离开人世。,https://toutiao.com/group/7406210316734710283/,,0,0,False
反华大鹰派卢比奥担任国务卿，特朗普在为中美大博弈释放什么信号,2024-11-13 09:31,38677,4828,邱毅台湾,邱毅台湾,,https://toutiao.com/group/7436694080400949801/,,0,0,True
军号一响，全军出击！,2024-09-19 08:01,30243,1871,中国军号,中国军号,,https://toutiao.com/group/7416261401477382668/,,0,0,True
十个化疗九个死？医生坦言：4种癌症无需化疗，或起到反作用…,2024-09-04 13:17,4378,405,39健康网,39健康网,李梅爸爸已经走了一个月了，可李梅还是不能原谅自己。李梅爸爸此前确诊了肺癌，医生的建议是接受化疗。临床上，很多病人拒绝化疗，认为化疗只会让癌症扩散，这是真的吗?,https://toutiao.com/group/7410743786244801039/,,0,0,False
广西49岁老汉娶19岁姑娘，结婚21年生下15个孩子，如今有何下场？,2024-10-20 08:32,2686,381,艺述史,艺述史,她19岁出嫁，21年里总共生育了15个孩子，其中4个男孩子11个女孩子，家里热闹的像是开了一所学校一样。,https://toutiao.com/group/7427400319418384948/,,0,0,False
原来他才是毁掉刘翔真凶，因贪1200万被公审，让刘翔背负多年骂名,2024-08-29 09:58,14530,439,八号探秘人,八号探秘人,在田径场上创造的成绩，至今无人能够打破，甚至在国际上享有盛名。本该继续夺冠之路，却两次因伤退赛，遭到了全网辱骂。,https://toutiao.com/group/7408489498465616410/,,0,0,False
51年洪学智妻子寻女无果，到老乡家歇脚老乡惊呼：你要找得就是我,2024-09-22 01:07,13753,895,品古观今,品古观今,前言1951年，阳曲县委大院突然来了7、8位解放军同志，其中一位女同志，就是洪学智的妻子张文。她此番前来，就是为了寻找多年前因战乱而寄养于民间的爱女。可昔日的小村落早已蜕变成另一番景象，这无异于是大海捞针。,https://toutiao.com/group/7417034363226915354/,,0,0,False
姑娘花500块租男友，却不知人家是身价过亿总裁，好运来了,2024-11-03 04:00,2114,315,乐视明星的那点事,乐视明星的那点事,,https://toutiao.com/group/7432588748926812682/,,0,0,True
河南女子去世，山东丈夫将手机埋墓里，充1000元话费，每天打电话,2024-11-01 06:52,2216,2206,何止电影,何止电影,2014年11月17日，河南肿瘤医院的病房中举行着一场特殊的婚礼，主角是于海宁跟他的患有癌症的妻子范会香。在几个月前范会香确诊癌症，跟男友提出分手，于海宁不远万里来到了女友的城市，照顾患癌女友。得知女友时日无多，在病房中跟女友求婚，在病房中举办了婚礼，婚后一年，范会香去世。,https://toutiao.com/group/7432199981609534004/,,0,0,False
内阁人选出炉，对华立场各异，两派博弈，将如何左右特朗普决策？,2024-11-12 09:49,25100,1504,邱震海,邱震海,,https://toutiao.com/group/7436327724950094373/,,0,0,True
炸萝卜丸子到底用面粉还是淀粉，教你正确做法，外焦里嫩，太香了,2024-10-26 09:25,7834,514,家常的味道,家常的味道,,https://toutiao.com/group/7430012978277122611/,,0,0,True
相爱37年零绯闻，丁勇岱对赵雪华一见钟情，如今却对儿子很失望,2024-11-09 21:43,2116,152,八号探秘人,八号探秘人,在阅读此文之前，辛苦您点击一下“关注”，既方便您进行讨论和分享，又能给您带来不一样的参与感，感谢您的支持！编辑丨xk1985年，丁勇岱转过楼梯拐角，撞到人生挚爱，这一下把他撞“开窍”了。那时他还不是《末路》里的白宝山。也不是《跨过鸭绿江》里的彭老总，更不是《人世间》里的周志刚。,https://toutiao.com/group/7435160230918406707/,,0,0,False
大老虎在总统套房潇洒，殊不知对面住着中央领导，有戏看！,2024-10-15 02:37,4799,205,乐视群星访谈秀,乐视群星访谈秀,大老虎在总统套房潇洒，殊不知对面住着中央领导，有戏看！,https://toutiao.com/group/7425826039802102284/,,0,0,True
特朗普为什么不用蓬佩奥，而且面子里子都不给，老蓬犯了什么禁忌,2024-11-12 09:23,39826,1489,邱毅台湾,邱毅台湾,,https://toutiao.com/group/7436320981239235087/,,0,0,True
今天才知道！电动车“每天充”和“用完再充”，到底哪个更伤电池,2024-08-27 11:19,15608,2377,鲸探所,鲸探所,“今天到底给车充不充电？”估计大多数人每天回家都会想这个问题，看着自己的电动车电量又多又少的，充不充电也是一件非常难以抉择的事情。那么，电动车到底应该怎样充电呢？是每天都充，还是用完之后再充呢？电动车充电不管是在城市还是农村，电动车其实都是人们出门最常见的交通工具。,https://toutiao.com/group/7407773012533117475/,,0,0,False
特朗普赢却难就职？拜登怕追责，佩洛西怕牢饭，三大集团蠢蠢欲动,2024-11-14 22:04,23592,1090,黎建南台湾,黎建南台湾,,https://toutiao.com/group/7437259350143402515/,,0,0,True
44年前，内蒙一女军医被头公狼拦住，她跟着公狼走向草丛的深处,2024-11-12 08:30,1640,180,艺述史,艺述史,1978年一个夜晚，草原上夜幕低垂，寒风呼啸而过。内蒙古草原上一片静谧，一眼望去尽是苍茫夜色，连月亮都只有一个尖，四下少有人迹，甚至隐约能听到狼嚎。“别过去，危险！,https://toutiao.com/group/7436214474274554368/,,0,0,False
吃晚饭时，长期喝点白酒的人，身体会怎样呢？医生告诉您答案,2024-09-03 12:25,1131,271,39健康网,39健康网,刘大爷辛苦了大半辈子，想着终于到了颐养天年的时候。每天吃晚饭的时候他都爱喝点白酒，有时候馋了还会多喝两杯，嘴里还念叨着喝酒对促进睡眠有好处。尤其是前段时间看到一篇文章称，少量饮酒还能活血化瘀，甚至促进心血管健康，刘大爷就喝得更放心了。,https://toutiao.com/group/7410360147459015203/,,0,0,False
被姚明抱着上奥运的小英雄，曾发誓考上清华，16年后活成了这样,2024-11-07 08:07,1888,496,睿之悦,睿之悦,2008年，年仅9岁的林浩，在姚明的带领下走进了北京奥运会开幕式的舞台上，成为了万众瞩目的“焦点”。,https://toutiao.com/group/7434444094551687707/,,0,0,False
送给所有知道我名字的人 想送一份祝愿给大家，所以唱了这首歌,2024-11-13 04:30,110568,18824,李子柒,李子柒,,https://toutiao.com/group/7436616916803781171/,,0,0,True
春晚：赵四这演技让赵本山都笑场了，台下也笑的人仰马翻！经典！,2024-11-04 08:35,1891,337,乐视综艺咖,乐视综艺咖,,https://toutiao.com/group/7433340063349015051/,,0,0,True
山西五台山悬崖上的狐仙洞，发现住着2个千年狐仙，上去吓得腿软,2024-10-22 03:00,8898,846,山西凡凡,山西凡凡,,https://toutiao.com/group/7428429414959940106/,,0,0,True
郭有才：当迷失方向忘记初心后，曾经飘得多高，如今摔得就多惨,2024-11-11 06:53,774,428,八号探秘人,八号探秘人,在阅读此文之前，辛苦您点击一下“关注”，既方便您进行讨论和分享，又能给您带来不一样的参与感，感谢您的支持！编辑丨brt因为一首翻唱，他一夜之间成为了拥有千万粉丝的网红。但是“人红是非多”，不久他就因为版权等问题陷入了舆论风波。他的人气一落千丈，从万众瞩目变成了现在的无人问津。,https://toutiao.com/group/7435901170239078948/,,0,0,False
67岁执意生娃，如今却坐轮椅无法自理，5岁的天赐被迫独立学洗衣,2024-11-04 10:32,3334,835,睿之悦,睿之悦,2019年，已经67岁的田新菊执意生下了自己的第三个孩子小天赐。那么，现如今5年的时间过去了，这“天赐”的礼物到底是福还是祸呢?,https://toutiao.com/group/7433367394946384435/,,0,0,False
为什么网上的药，比实体药店便宜？是不是假药？现在就告诉你真相,2024-11-10 10:00,393,184,泌尿外科李医生,泌尿外科李医生,小李生活中是一个非常节俭的人，平时生病都是硬扛过去的。但是这一次，小李发现自己的咳嗽比较严重，不得已需要买一些消炎药吃。,https://toutiao.com/group/7435586137348899364/,,0,0,False
给近三年最好的10部年代剧排个名：《人世间》第6，第1名没有争议,2024-10-28 07:10,1471,860,稻述,稻述,到了20世纪初，偶像剧成为人们的掌中宝，但要说现在什么剧最受欢迎，那一定是年代剧!其中《人世间》只能排第六，第一名人人都爱看，最后一名也比上不足比下有余。,https://toutiao.com/group/7430715494055264783/,,0,0,False
小伙洗完澡故意秀肌肉，富婆心跳加速被当场拿下，这下好看了,2024-10-26 16:20,7912,312,乐视情感讲堂,乐视情感讲堂,小伙洗完澡故意秀肌肉，富婆心跳加速被当场拿下，这下好看了,https://toutiao.com/group/7430011217881596426/,,0,0,True
