title,publish_time,like_count,comment_count,media_name,source,abstract,article_url,tag,is_yaowen,article_sub_type,has_video
太过瘾了！王曼昱VS张本美和号称史上最精彩一球56秒精彩瞬间,2025-03-13 02:16,10455,1202,甜甜分享,甜甜分享,,https://toutiao.com/group/7481112260929143346/,,0,0,True
出租车司机半路捡个姑娘，直接带回家，老婆一看反应笑翻了,2025-01-14 07:28,13749,641,南瓜钟意你,南瓜钟意你,,https://toutiao.com/group/7459669645180650024/,,0,0,True
央视曝光4种致癌日用品，越便宜致癌物越多，很多人还被蒙在鼓里,2025-02-17 05:35,19626,2291,39健康网,39健康网,,https://toutiao.com/group/7472257525203616319/,,0,0,True
对不起 郑钦文，我又进决赛了！ 横扫你的斯瓦泰克 被我2-1双杀出局,2025-03-15 01:26,635,551,抹茶小星,抹茶小星,WTA1000印第安维尔斯站女单半决赛，米拉-安德列娃 以 7-6、1-6、6-3 击败卫冕冠军斯瓦泰克!,https://toutiao.com/group/7481683448638358066/,,0,0,False
拿走李嘉诚巴拿马港口的贝莱德，才高兴了几天，却发现自己上当了,2025-03-14 01:41,1389,110,阿华今天说事,阿华今天说事,,https://toutiao.com/group/7481474325049049600/,,0,0,True
