title,publish_time,like_count,comment_count,media_name,source,abstract,article_url,tag,is_yaowen,article_sub_type,has_video
习言道｜重磅座谈会，习近平强调“不能变，不会变”,2025-02-18 03:46,999,1133,中国新闻网,中国新闻网,题:重磅座谈会，习近平强调“不能变，不会变”“党和国家对民营经济发展的基本方针政策，已经纳入中国特色社会主义制度体系，将一以贯之坚持和落实，不能变，也不会变。”,http://ku.m.chinanews.com/wapapp/cns/gn/2025/02-18/10370313.shtml,,0,0,False
老虎进院子！站的最高的竟然是最危险的,2025-02-16 16:15,53421,6357,事实听风者,事实听风者,,https://toutiao.com/group/7472051200083591720/,,0,0,True
性感尤物！古力娜扎大胆秀性感身材！比基尼泳衣真不错,2025-01-29 08:28,3460,143,微笑小鱼K,微笑小鱼K,,https://toutiao.com/group/7465251211092984374/,,0,0,True
突发、上海松江车墩电商物流仓库着火！,2025-02-16 23:29,1147,503,亲切咖啡i,亲切咖啡i,,https://toutiao.com/group/7472163047797293594/,,0,0,True
媳妇玩到半夜才回来，以为老公不在家，进门这操作把老公看懵了,2025-01-24 09:38,11968,3289,滕菲,滕菲,,https://toutiao.com/group/7463414214191743497/,,0,0,True
丈母娘看不起穷女婿，全家聚餐没给女婿留筷子，女儿做法漂亮！,2025-01-27 16:01,3674,1000,群星访谈秀,群星访谈秀,,https://toutiao.com/group/7462286897130291724/,,0,0,True
三个女婿早就习惯了，所以车都没下，估计连火都没熄！,2025-02-10 23:46,5198,820,优美小红花情感正能量,优美小红花情感正能量,,https://toutiao.com/group/7469940786830950964/,,0,0,True
不说长相，主要就喜欢你这富婆口音😂#逗比夫妻日常 #搞笑,2025-01-21 12:31,40087,4333,趣知达人,趣知达人,,https://toutiao.com/group/7462345190456574501/,,0,0,True
这就是旺三代的媳妇，祖上积德啊，才能娶到这么好的媳妇👍,2025-01-27 10:33,62009,5005,趣知达人,趣知达人,,https://toutiao.com/group/7464541223764705842/,,0,0,True
出租车司机半路捡个姑娘，直接带回家，老婆一看反应笑翻了,2025-01-14 07:28,11758,599,南瓜钟意你,南瓜钟意你,,https://toutiao.com/group/7459669645180650024/,,0,0,True
桥面能在9分钟内上升27米，武汉首座升降式开启桥年内通车,2025-02-17 09:59,792,280,天天向上,天天向上,,https://toutiao.com/group/7472325396479836713/,,0,0,True
