title,publish_time,like_count,comment_count,media_name,source,abstract,article_url,tag,is_yaowen,article_sub_type,has_video
这篇文章，透露了改革的几个重要信号,2024-11-01 23:22,3442,1672,人民日报,人民日报,在党的二十届三中全会百天之后，10月29日，省部级主要领导干部学习贯彻党的二十届三中全会精神专题研讨班开班式上，习近平总书记一段“摸着石头过河”的论述发人深思。,https://www.peopleapp.com/column/30047208842-500005885517?utm_source=头条号&promote=true,,0,0,False
主动出击！耿爽：先来说一说美国,2024-11-01 03:20,5081,145,央视频,央视频,,https://toutiao.com/group/7432145456568664639/,,0,0,True
51年洪学智妻子寻女无果，到老乡家歇脚老乡惊呼：你要找得就是我,2024-09-22 01:07,11144,774,品古观今,品古观今,前言1951年，阳曲县委大院突然来了7、8位解放军同志，其中一位女同志，就是洪学智的妻子张文。她此番前来，就是为了寻找多年前因战乱而寄养于民间的爱女。可昔日的小村落早已蜕变成另一番景象，这无异于是大海捞针。,https://toutiao.com/group/7417034363226915354/,,0,0,False
民间上坟传统：“上坟不带 5 果，家中不惹灾祸”，哪“5果”？,2024-08-08 10:30,19084,1831,惠农圈,惠农圈,在中国传统文化中，祭祀祖先一直是一项备受重视的活动，它承载着对先人的缅怀、敬意和感恩之情。在上坟的时候，人们会提前准备好供品，比如肉类、酒水，还有水果。其中关于水果的准备，也有着诸多的讲究和禁忌，比如“上坟不带 5 果，家中不惹灾祸”的说法。,https://toutiao.com/group/7400584207141192207/,,0,0,False
给近三年最好的10部年代剧排个名：《人世间》第6，第1名没有争议,2024-10-28 07:10,470,268,稻述,稻述,到了20世纪初，偶像剧成为人们的掌中宝，但要说现在什么剧最受欢迎，那一定是年代剧!其中《人世间》只能排第六，第一名人人都爱看，最后一名也比上不足比下有余。,https://toutiao.com/group/7430715494055264783/,,0,0,False
又被全世界打脸，这是美国今年最耻辱的失败,2024-11-01 00:10,6350,1636,牛弹琴,牛弹琴,资料图又被全世界打脸，这是美国今年最耻辱的一次失败。之所以说“又”，很简单，以前每年都有过，结果也差不多。事实上，这也成了一年一次联合国大会，最后的保留曲目，全世界同声谴责美国，全世界一起看美国笑话。因为全世界投票，要求美国必须终止对古巴的经济、商业和金融封锁。,https://toutiao.com/group/7432095642685686291/,,0,0,False
王健林，突发！,2024-11-01 12:45,1491,749,极目新闻,极目新闻,【导读】王健林继续出售境外资产中国基金报记者 泰勒王健林1.,http://jms.ctdsb.net/jmythshare/#/index_share?cId=0&contentType=5&contentId=2294507,,0,0,False
大变脸！国际乒联公布最新世界排名，陈梦跌至第4，男单杀出黑马,2024-10-29 02:23,1753,1301,女排集中营,女排集中营,#头条创作游园会#众所周知，自从进入洛杉矶奥运周期后，中国乒乓球队就一直处于高度紧张的作战模式。短短2个多月的时间里，国乒众将便参加了4项大赛，所取得的成绩也只能算是中规中矩。特别是刚刚结束的蒙彼利埃冠军赛，以及此前的乒乓球亚锦赛，国乒的表现都没有达到预期。,https://toutiao.com/group/7430844065266090506/,,0,0,False
突发讣告！他于10月31日因病逝世，享年66岁,2024-11-02 01:40,2136,109,大皖新闻,大皖新闻,据浙江海洋大学外国语学院等方面发布的讣告，浙江海洋大学外国语学院原院长刘法公教授于2024年10月31日因病逝世，享年66岁。浙江海洋大学外国语学院方面表示，刘法公教授是外语界的杰出学者和教育家，一生致力于外语教育和学术研究，为外语学科的建设和发展做出了不可磨灭的贡献。,http://www.ahwang.cn/toutiao/202411/2767143.html,,0,1,False
2005年高秀敏家中猝死，13年后情人揭露真相：撒谎把命搭进去了,2024-10-10 07:03,960,247,笑史云烟,笑史云烟,高秀敏这个名字大家并不陌生，毕竟她在喜剧界也是有着一定地位的，可谁又能想到，05年的时候，高秀敏竟因心脏病猝然离世，直到次日，才被发现。,https://toutiao.com/group/7424036109652345363/,,0,0,False
今天才知道！电动车“每天充”和“用完再充”，到底哪个更伤电池,2024-08-27 11:19,14506,2296,鲸探所,鲸探所,“今天到底给车充不充电？”估计大多数人每天回家都会想这个问题，看着自己的电动车电量又多又少的，充不充电也是一件非常难以抉择的事情。那么，电动车到底应该怎样充电呢？是每天都充，还是用完之后再充呢？电动车充电不管是在城市还是农村，电动车其实都是人们出门最常见的交通工具。,https://toutiao.com/group/7407773012533117475/,,0,0,False
善恶终有报：疫情时对中国一毛不拔，却大方捐美国6亿，如今咋样,2024-09-29 05:50,942,127,睿之悦,睿之悦,可就是这样一位在中国土生土长起来的富豪，在疫情期间面对同胞的困境却一毛不拔，反而大方的捐助了6亿给美国。,https://toutiao.com/group/7419859345154015798/,,0,0,False
被转向的人生：湖南一女子被拘禁近5年遭强奸产女，囚禁者获刑15年,2024-11-02 04:23,1231,750,济南时报-新黄河,济南时报-新黄河,终于拿到判决书了。37岁的张玲期待着，自己能就此远离那场噩梦。在乡下的10年里，她每天都被农活包围，打油菜籽、喂鸡鸭、做饭、照顾6岁的儿子，生活平静庸常。只是偶尔，身体会不自觉地露出异样。,https://api.jinantimes.com.cn/h5/content.html?catid=20&id=4989155,,0,0,False
中国绝版老香烟，见过5种以上都是爷爷辈的，老烟民们抽过几种？,2024-08-20 08:54,680,123,万物知识局,万物知识局,文/万物知识局本文陈述所有内容皆有可靠信息来源，赘述在文章结尾在中国的历史长河中，烟草的传奇故事已历经四百载春秋。从明朝嘉靖年间葡萄牙使者带来的烟草，到如今琳琅满目的香烟品牌，烟草不仅见证了时代的变迁，也承载了无数人的记忆与情感。,https://toutiao.com/group/7405119584723927578/,,0,0,False
全球约一半肝癌在中国，再次提醒：家中的4种食物，尽早撤下餐桌,2024-08-13 08:36,107430,3626,梁医学社梁怡璋医生,梁医学社梁怡璋医生,,https://toutiao.com/group/7402540119712629311/,,0,0,True
“催买房”无效后，国家动真格？2025年起，房地产或出现两个趋势,2024-11-01 09:32,625,485,云舟史策,云舟史策,曾经的房地产行业，是人人向往的，同时也代表着巨大的财富与成功，当年每个售楼处生意红火的场景好似还在眼前。,https://toutiao.com/group/7432235257815958054/,,0,0,False
黑河开往哈尔滨的K7034列车发生脱轨事故,2024-11-01 16:37,1328,803,澎湃新闻,澎湃新闻,11月1日，网传黑河开往哈尔滨的K7034列车发生脱轨事故。据该列车一名乘客介绍，事故发生时间大约在晚上10点左右，现场没有看到有人员受伤。,https://m.thepaper.cn/newsDetail_forward_29220236?from=toutiao,,0,0,False
罕见！100年前，英国游客拍下的清朝乡村，和想象中完全不一样,2024-09-20 02:07,4010,492,万物知识局,万物知识局,泥泞的土路，衣不蔽体的老百姓，即便是达官显贵的家中也十分破败，而这些都是清王朝的历史痕迹，虽说那时候中国摄影技术并不发达，但也有许多外国游客来到这里，拍摄下了许多老照片，为我们留下了珍贵的历史资料，那清朝到底是怎样的面貌呢?,https://toutiao.com/group/7416287738871267855/,,0,0,False
河南女子去世，山东丈夫将手机埋墓里，充1000元话费，每天打电话,2024-11-01 06:52,494,890,何止电影,何止电影,2014年11月17日，河南肿瘤医院的病房中举行着一场特殊的婚礼，主角是于海宁跟他的患有癌症的妻子范会香。在几个月前范会香确诊癌症，跟男友提出分手，于海宁不远万里来到了女友的城市，照顾患癌女友。得知女友时日无多，在病房中跟女友求婚，在病房中举办了婚礼，婚后一年，范会香去世。,https://toutiao.com/group/7432199981609534004/,,0,0,False
15年前他在爱妻葬礼上哭到昏厥，发誓永不再娶，如今他做到了吗？,2024-08-24 02:17,18258,571,八号探秘人,八号探秘人,在阅读此文之前，辛苦您点击一下“关注”，既方便您进行讨论和分享，又能给您带来不一样的参与感，感谢您的支持！编辑丨xk纵观鱼龙混杂的娱乐圈，有人背叛，有人痴情。而果靖霖则是公认的好男儿，将一生都奉献给妻子。但妻子却仅仅陪他走了半生，没能战胜病魔，不幸离开人世。,https://toutiao.com/group/7406210316734710283/,,0,0,False
"万万没想到,53岁“丁克”半辈子的康辉，一生遗憾竟然是一通电话",2024-08-21 22:14,28586,5482,峰哥正读,峰哥正读,在阅读此文之前，麻烦您点击一下“关注”，既方便您进行讨论和分享，又能给您带来不一样的参与感，感谢您的支持！文/编辑：蘑菇百善孝为先。但是到底怎么做才算是“孝”，康辉用了半辈子才明白。央视知名主持人康辉，事业顺遂，家庭幸福，在外人看来是一个人生赢家。,https://toutiao.com/group/7405504703687115273/,,0,0,False
军号一响，全军出击！,2024-09-19 08:01,27778,1750,中国军号,中国军号,,https://toutiao.com/group/7416261401477382668/,,0,0,True
美妇约见老情人，见面场景真是太逗了，这俩人绝配！,2024-10-27 16:25,1576,199,乐视明星的那点事,乐视明星的那点事,美妇约见老情人，见面场景真是太逗了，这俩人绝配！,https://toutiao.com/group/7428157095108674088/,,0,0,True
布林肯的结局已定，他在交权之前，留下了几句关于中国的忠告,2024-11-01 06:16,7643,142,庆彬有理,庆彬有理,随着拜登4年任期所剩无几，布林肯的国务卿生涯也即将走到尽头。不过，尽管自己结局已定，但布林肯在交权之前，依然想着给自己的继任者，留下几句关于中国的忠告。,https://toutiao.com/group/7432190912496665088/,,0,0,True
穷小子去富婆家里，富婆笑咧嘴把保姆支开，保姆心知肚明,2024-10-26 06:34,1466,184,乐视情感讲堂,乐视情感讲堂,穷小子去富婆家里，富婆笑咧嘴把保姆支开，保姆心知肚明,https://toutiao.com/group/7429969094939509311/,,0,0,True
首例5胞胎长大了，父亲已过劳去世 母亲直言：如能重来一个也不要,2024-08-31 03:06,892,204,睿之悦,睿之悦,2002年，在北京的一家妇产医院中，一位来自河北的孕妇顺利生下了两男三女的五胞胎，创造了一个全国罕见的奇迹。,https://toutiao.com/group/7409098624111575603/,,0,0,False
特务男扮女装混进村子，孩子兵顿时发现不对劲，这下精彩了,2024-10-28 06:09,1606,166,乐视群星访谈秀,乐视群星访谈秀,,https://toutiao.com/group/7430704630294413878/,,0,0,True
南京大屠杀再添新证！“几乎未出现过”的照片曝光,2024-11-01 01:14,524,270,济南时报-新黄河,济南时报-新黄河,记者近日注意到，日本都留文科大学名誉教授笠原十九司在2024年第三期《日本侵华南京大屠杀研究》上发表论文《史料发掘：南京大屠杀的现场与照片——基于一个日军炮兵的阵中日记和回想录》。论文由侵华日军南京大屠杀遇难同胞纪念馆馆员芦鹏翻译。,http://www.hzfanews.com/detail.html?id=D000180BE98B7E131040E0F72AE3D11B1C9DA52732C4A474,,0,0,False
小伙洗完澡故意秀肌肉，富婆心跳加速被当场拿下，这下好看了,2024-10-26 16:20,4168,186,乐视情感讲堂,乐视情感讲堂,小伙洗完澡故意秀肌肉，富婆心跳加速被当场拿下，这下好看了,https://toutiao.com/group/7430011217881596426/,,0,0,True
