title,publish_time,like_count,comment_count,media_name,source,abstract,article_url,tag,is_yaowen,article_sub_type,has_video
视频丨和马英九切磋球技 龙队的“球友圈”上新了,2024-11-29 10:40,1706,312,央视新闻,央视新闻,应马英九基金会邀请，由北京大学、清华大学等7所高校共40名师生组成的大陆高校师生访问团11月27日抵达台湾，开始为期9天8夜的交流参访行程。11月29日下午，大陆高校师生访问团到台湾文化大学参访。,https://content-static.cctvnews.cctv.com/snow-book/index.html?item_id=7257241550702925942&source=50006&sub_source=50006_001,,0,1,False
这才是经典动作猛片，甄子丹对决安志杰，拳拳到肉生猛刺激！,2024-11-27 15:07,932,139,小云混剪,小云混剪,,https://toutiao.com/group/7441975936330924559/,,0,0,True
羽绒服敢卖199赌的就是你不懂？电商人揭露直播间的销售内幕,2024-11-29 01:01,358,534,金羊网,金羊网,近日，广州某女装电商负责人在接受采访时，揭露直播间羽绒服内幕，其称，羽绒服的“水”是很深的，在网上卖的羽绒服价格199元，甚至159元，而现在羽绒的市场行情是60多万元一吨，羽绒服的生产成本都要300-400元，花199元是不可能买到90%白鸭绒的羽绒服。,https://news.ycwb.com/2024-11/29/content_53088789.htm,,0,0,False
杨议再爆砸纲猛料：郭德纲“扒灰”儿徒女友，称郭德纲“郭扒灰”,2024-11-29 03:42,565,190,通闻视讯,通闻视讯,在相声这片充满传统韵味与现代喧嚣的江湖里，故事从来就不缺，而杨议与郭德纲之间掀起的层层波澜，恰似一场疾风骤雨，搅得湖面久久难以平静，把行业里那些隐匿在舞台背后的人情冷暖、是非恩怨，一股脑儿地抖落出来，暴露在大众灼灼目光之下，引得众人纷纷侧目，竞相探寻其中究竟。,https://toutiao.com/group/7442541008108044815/,,0,0,False
日本品牌优衣库创始人 柳井正明确表示不用新疆棉 中国门店数量甚至超过日本 目前其官方账号已开评论精选,2024-11-29 09:16,255,739,全国党媒信息公共平台,全国党媒信息公共平台,来源：【闪电新闻】11月29日（发布时间），日本品牌优衣库(UNIQLO)创始人柳井正在接受媒体采访时明确表示，优衣库不使用中国新疆地区的棉花。尽管中国是优衣库的重要市场，门店数量甚至超过了日本。目前，优衣库官方账号已开启评论精选。,https://api-m.hubpd.com/transfer?nextUrl=https%3A%2F%2Fwww.hubpd.com%2Fhubpd%2Frss%2Ftoutiao%2Findex.html&contentId=5188146770734120884,,0,1,False
黑龙江勃利县东北虎进村（邻居完整剪辑版）,2024-11-21 15:19,735,206,小玛宝宝,小玛宝宝,,https://toutiao.com/group/7439752539572011574/,,0,0,True
唐湘龙：没想到马龙是这个样子！,2024-11-29 03:08,835,120,依赖观察室,依赖观察室,,https://toutiao.com/group/7442532754396283432/,,0,0,True
网传一天几万人的大衣哥村庄，来到一看，傻眼了,2024-11-29 00:00,1149,411,一人行走的远方,一人行走的远方,网传一天几万人的大衣哥村庄，来到一看，傻眼了,https://toutiao.com/group/7438060069956092443/,,0,0,True
1米3袖珍美女嫁给1米48男孩，婚后丈夫奇迹长高，两人却不欢而散,2024-09-07 02:55,6553,348,睿之悦,睿之悦,杨萍和葛存苗的婚礼 文|睿之悦 编辑|睿之悦2019年，成都的民政局来了两个“10岁小孩”来登记，工作人员以为是玩闹。两个“小孩”拿出身份证让工作人员看，这才明白，原来是两个再也长不高的成年袖珍人情侣。,https://toutiao.com/group/7411713833267364386/,,0,0,False
母亲瘫痪、父亲疯了，当年那个744分的高考状元，7年后却成了这样,2024-09-08 00:54,12536,1845,八号探秘人,八号探秘人,母亲截肢瘫痪、父亲疯癫痴傻，可对于自己的亲人，他却做出了这样的评价。而今，7年已过，曾经那个让无数人动容的少年，现在如何?,https://toutiao.com/group/7411852147648496162/,,0,0,False
弟弟光荣退伍，姐姐兴奋去车站接他，怎料一见弟弟瞬间哭了,2024-11-05 06:34,27842,2813,乐视天天剧好看,乐视天天剧好看,,https://toutiao.com/group/7433679820573934091/,,0,0,True
罕见！100年前，英国游客拍下的清朝乡村，和想象中完全不一样,2024-09-20 02:07,7956,723,万物知识局,万物知识局,泥泞的土路，衣不蔽体的老百姓，即便是达官显贵的家中也十分破败，而这些都是清王朝的历史痕迹，虽说那时候中国摄影技术并不发达，但也有许多外国游客来到这里，拍摄下了许多老照片，为我们留下了珍贵的历史资料，那清朝到底是怎样的面貌呢?,https://toutiao.com/group/7416287738871267855/,,0,0,False
丫头回东北捡水稻一天能赚六七百，比大城市捡垃圾强多啦！,2024-10-16 22:53,1502,238,兴凯湖莹莹,兴凯湖莹莹,,https://toutiao.com/group/7426510446334575119/,,0,0,True
河南警察3岁女儿被拐，苦寻全国23年无果，结果却发现女儿在对门,2024-11-05 07:43,1876,159,八号探秘人,八号探秘人,寻亲23年无果，丢失的女儿竟住在对门?但它却真实发生在河南洛阳的梁绍波身上。是意外走丢，还是人贩子所为，三岁的女儿怎会离奇失踪?,https://toutiao.com/group/7433697108120142345/,,0,0,False
3年前，宁夏7岁小女孩一笑走红，后拒百万签约，如今怎么样了？他们后悔了吗？,2024-09-19 07:25,14055,1902,睿之悦,睿之悦,2021年，视频镜头中出现的女孩儿用那一抹甜美的笑容，迅速引起了网友们的广泛关注。有媒体公司看到这一机遇，提出愿意用百万巨资与女孩儿签约，然而，女孩儿的父母却坚决拒绝了这一提议。,https://toutiao.com/group/7416250139544879679/,,0,0,False
女友怀孕了，男友不装了，带她回豪宅！,2024-11-23 08:01,7471,641,乐视大综艺咖,乐视大综艺咖,,https://toutiao.com/group/7440353629540483593/,,0,0,True
在上海，三元成本能吃到什么面？这钱花的值吗？#抖音美食推荐官,2024-09-13 08:53,884,106,兴凯湖莹莹,兴凯湖莹莹,,https://toutiao.com/group/7414048068313547303/,,0,0,True
1985年，一场误判让中国付出上万亿的代价，一代巨星抱憾而终,2024-09-19 06:30,7572,1283,艾弥儿,艾弥儿,声明：真实人物故事，文末附权威资料来源“自产飞机被叫停，随后更是亏损上万亿。”建国之后，我国各行各业都在飞速发展，包括航空事业。1985年，已经成功研制出运-10客机的马凤山，正满怀期待地等着国家拿出资金，将这种客机进行量产。可随之而来的消息，让他感觉天都塌了——必须停产。,https://toutiao.com/group/7416190075974844965/,,0,0,False
中国机器狗和美国机器狗差距到底有多大？真相让人捧腹大笑#军事,2024-11-17 09:35,3869,188,李子说天下,李子说天下,,https://toutiao.com/group/7438179458483225097/,,0,0,True
香港九龙寨城老照片：曾是香港最邪恶肮脏之地，图9场景令人作呕,2024-11-21 11:32,1705,351,万物知识局,万物知识局,有这么一个地方，他虽然地处极度繁华的都市香港，但是却脏乱不堪，环境极度的恶劣，各种违法的交易都在这里进行，甚至黄赌毒，也在这里悄然滋生，这就是九龙城寨。,https://toutiao.com/group/7439657140518519296/,,0,0,False
刚从中国返俄，苏-57飞行员传来新消息,2024-11-25 10:15,7739,251,环球时报新媒体,环球时报新媒体,刚从中国返俄，苏-57飞行员传来新消息,https://toutiao.com/group/7441158524530328127/,,0,0,True
讣告！100岁叶嘉莹去世：17岁丧母，52岁丧女，94岁裸捐，她是中国最后一位“穿裙子的士”,2024-11-26 01:20,4344,743,读者,读者,从南开大学获悉，古典文学研究学者、南开大学讲席教授叶嘉莹，于2024年11月24日去世，享年100岁。她，是加拿大不列颠哥伦比亚大学终身教授，却在54岁写信给中国教育部，申请免费来华教学。来华任教后，她辗转全国多所高校讲授古诗词，不遗余力地传承中国古典文化。,https://toutiao.com/group/7441390504039793163/,,0,0,False
网传西安一企业负责人深夜在微信群对员工“爆粗口”，其回应称是因所有人“已读不回”,2024-11-29 11:32,547,1445,红星新闻,红星新闻,“他*的收到了不知道回应吗？”“你们一个一个在这给我装什么”“搞不明白就早上去人事报到”......近日，有网友在社交平台发布一张某企业负责人与员工在微信群内的聊天截图引发广泛关注。,https://toutiao.com/group/7442662481408918016/,,0,0,False
央视曝光：从里到外都是假的！,2024-11-25 01:05,2279,1032,直播日照,直播日照,冬季来临，羽绒服、羽绒被等羽绒制品成为市场上的香饽饽，但一部分“假羽绒制品”却在线上、线下市场肆意泛滥。,https://www.rzw.com.cn/redian/2024-11-25/9KpKioo3ULdxXYhU.html,,0,0,False
马龙在台湾被包围!,2024-11-28 11:47,3813,244,吴东昇台湾蓝绿红,吴东昇台湾蓝绿红,,https://toutiao.com/group/7442295423428985363/,,0,0,True
警惕“先用后付”小心欠下账单～（央视频号：光华路资讯）,2024-11-27 12:44,15147,4942,央视频,央视频,,https://toutiao.com/group/7441939150552433179/,,0,0,True
致敬我们的朱总理,2024-10-04 04:52,25823,2310,王家大小姐0527,王家大小姐0527,,https://toutiao.com/group/7421778759713292840/,,0,0,True
涉嫌非法开设赌场 山西“前首富”张新明兄弟三人被警方调查,2024-11-29 12:19,3250,981,经济观察报,经济观察报,经济观察网 记者 李微敖 2024年11月初，风云一时的山西前“首富”张新明，及其兄长张新跃、弟弟张星亮，亦包括配偶、司机等人，被警方带走调查，羁押在山西晋城、长治等地。张新明此番涉嫌的罪名为非法开设赌场罪，并与澳门赌场老板“洗米华”案相关。,https://toutiao.com/group/7442673849512509964/,,0,0,False
67岁执意生娃，如今却坐轮椅无法自理，5岁的天赐被迫独立学洗衣,2024-11-04 10:32,6816,1583,睿之悦,睿之悦,2019年，已经67岁的田新菊执意生下了自己的第三个孩子小天赐。那么，现如今5年的时间过去了，这“天赐”的礼物到底是福还是祸呢?,https://toutiao.com/group/7433367394946384435/,,0,0,False
马龙访台，台湾人热烈欢迎，台独焦虑不安视为大敌使出妖魔化老招,2024-11-29 09:56,14015,335,邱毅台湾,邱毅台湾,,https://toutiao.com/group/7442637867307762230/,,0,0,True
乌克兰蒙了，欧洲慌了，美国也冷静了,2024-11-26 10:42,12961,451,张元伟,张元伟,,https://toutiao.com/group/7441536551424623114/,,0,0,True
平顶山冷藏货车内8人死亡事故调查报告公布：牛肉包装箱内干冰升华，致人窒息,2024-11-29 06:36,214,105,澎湃新闻,澎湃新闻,近日，平顶山市应急管理局在其官网公布《平顶山高新技术产业开发区轻型厢式冷藏货车“6·15”较大窒息事故调查报告》。11月29日，应急管理部微信公众号对事故调查报告内容进行了推送。,https://m.thepaper.cn/newsDetail_forward_29495744?from=toutiao,,0,0,False
51年洪学智妻子寻女无果，到老乡家歇脚老乡惊呼：你要找得就是我,2024-09-22 01:07,15904,1007,品古观今,品古观今,前言1951年，阳曲县委大院突然来了7、8位解放军同志，其中一位女同志，就是洪学智的妻子张文。她此番前来，就是为了寻找多年前因战乱而寄养于民间的爱女。可昔日的小村落早已蜕变成另一番景象，这无异于是大海捞针。,https://toutiao.com/group/7417034363226915354/,,0,0,False
新骗局来了！不需要转账、也不用输密码，骗子就能轻松转走你的钱,2024-11-22 10:49,2054,216,鲸探所,鲸探所,你以为的诈骗，是需要你输入密码、转账的那种。可实际上的诈骗，却已经发展到不需要任何转账和密码的这种程度了。,https://toutiao.com/group/7440050588496200243/,,0,0,False
张纪中有5个孩子，最大的女儿47岁比继母还大4岁！最小的刚出生,2024-11-12 03:20,357,169,昕昕局,昕昕局,本文陈述所有内容皆有可靠信息来源，赘述在文章结尾。如今73岁的张纪中有5个孩子，最大的女儿47岁，最小的孩子前一段时间刚出生!—≺ 从演员到制片人 ≻—,https://toutiao.com/group/7436224491883168297/,,0,0,False
15年保安徒手接跳楼女孩，女孩母亲：我女儿若有事，你一辈子负责,2024-10-07 09:28,257,101,睿之悦,睿之悦,文|睿之悦编辑|睿之悦“我的女儿要是有什么事情的话，你要负一辈子的责任！”2015年，一名保安在得知有人跳楼的时候，不顾自身的安危，徒手将跳楼的女孩给救了下来。可令人感到的心寒的是，被救女孩的家属不仅没有感谢这名保安，反而还对他恶语相向。那么，这究竟是怎么一回事呢？,https://toutiao.com/group/7422961323312431656/,,0,0,False
美妇约见老情人，见面场景真是太逗了，这俩人绝配！,2024-10-27 16:25,4365,553,乐视明星的那点事,乐视明星的那点事,美妇约见老情人，见面场景真是太逗了，这俩人绝配！,https://toutiao.com/group/7428157095108674088/,,0,0,True
