title,publish_time,like_count,comment_count,media_name,source,abstract,article_url,tag,is_yaowen,article_sub_type,has_video
中国小伙向阿拉伯女孩表白，女孩：我不希望你以后娶4个老婆,2024-10-18 03:16,23278,4047,今日国土杂志社,今日国土杂志社,,https://toutiao.com/group/7426949356139315746/,,0,0,True
给近三年最好的10部年代剧排个名：《人世间》第6，第1名没有争议,2024-09-06 08:08,6111,2103,皮皮电影,皮皮电影,时尚是个轮回，电视剧也是。在2020年之前的那些年，电视剧市场基本上都被偶像剧、都市剧霸占。曾经撑起国剧品质的《闯关东》《岁月》这类年代好剧，难见踪影。,https://toutiao.com/group/7411390030722712090/,,0,0,False
3年前，宁夏7岁小女孩一笑走红，后拒百万签约，如今怎么样了？他们后悔了吗？,2024-09-19 07:25,3691,649,睿之悦,睿之悦,2021年，视频镜头中出现的女孩儿用那一抹甜美的笑容，迅速引起了网友们的广泛关注。有媒体公司看到这一机遇，提出愿意用百万巨资与女孩儿签约，然而，女孩儿的父母却坚决拒绝了这一提议。,https://toutiao.com/group/7416250139544879679/,,0,0,False
拦车收费？交警不管！景区不管！政府看不见！九寨沟咋全是土匪？,2024-09-22 15:55,205349,40543,行哥嘚啵嘚,行哥嘚啵嘚,,https://toutiao.com/group/7417496641638400527/,,0,0,True
有人冒充我男朋友，算不算诈骗？遇到奇葩事你会怎么办？,2024-09-06 05:52,1715,225,兴凯湖莹莹,兴凯湖莹莹,,https://toutiao.com/group/7411404025502892554/,,0,0,True
万万没想到，35岁杨颖兜兜转转干回“老本行”，活成内娱最大笑话,2024-09-06 07:55,535,137,读万卷书的张飞,读万卷书的张飞,文l张飞编辑l张飞曾经你看不起别人；如今谁又瞧得上你？在节目中丝毫不考虑他人状态，一味地只追求自己的镜头。甚至还在采访中公然表示“自己早就应该把所有奖拿了个遍了”。更关键的是丝毫没有任何“报恩”之心。所以如今曾经所有的“嚣张”“高高在上”遭到反噬，只能说现在谁还“愿意”认识她！,https://toutiao.com/group/7411434661014012456/,,0,0,False
网红郭有才，泡沫散去之后，曾经飘的有多高，如今摔得就有多惨,2024-09-30 09:36,774,487,八号探秘人,八号探秘人,曾经那个卖烧烤的店小二，可能怎么都想不到，自己会成为一个千万粉丝的网红。郭有才在刚成为网红之后的期望也很有意思，那就是每天能赚到300元就行。可现实却是靠着直播广告分成，他的收入直接比期望值翻了上千倍。有人说他其貌不扬，但是平凡人逆袭的典范，还有的人说他长的像日本人。,https://toutiao.com/group/7419978325617082932/,,0,0,False
一巴掌的代价，公交车上大妈打晕患癌小伙，断送退休后的幸福生活,2024-10-14 09:53,1128,574,客观听書,客观听書,公交车上老太太和小伙吵了起来，老太太更是当仁不让直接给了小伙一巴掌。这名小伙直接倒地，老大大根本就不会想到正是因为他的一巴掌，鲜活的生命就这样消失在他的手里。,https://toutiao.com/group/7425563455358468627/,,0,0,False
"万万没想到,53岁“丁克”半辈子的康辉，一生遗憾竟然是一通电话",2024-08-21 22:14,28086,5424,峰哥正读,峰哥正读,在阅读此文之前，麻烦您点击一下“关注”，既方便您进行讨论和分享，又能给您带来不一样的参与感，感谢您的支持！文/编辑：蘑菇百善孝为先。但是到底怎么做才算是“孝”，康辉用了半辈子才明白。央视知名主持人康辉，事业顺遂，家庭幸福，在外人看来是一个人生赢家。,https://toutiao.com/group/7405504703687115273/,,0,0,False
写歌30年穷困潦倒，前妻失望选择离婚，谁料51岁靠一首歌一夜成名,2024-08-12 03:37,26115,4331,八号探秘人,八号探秘人,在阅读此文之前，辛苦您点击一下“关注”，既方便您进行讨论和分享，又能给您带来不一样的参与感，感谢您的支持！编辑：LY无数人都想要一个一夜成名的机会，但机会来了也不是每个人都能把握住的。他用了三十年的时间来准备迎接属于自己的机会。为了这个机会他放弃了一切，甚至包括家庭。,https://toutiao.com/group/7402090890367484428/,,0,0,False
茅台女员工“工作照”遭曝光！网友：这样做出来酒，白给我都不喝,2024-10-16 06:24,450,1025,昕昕局,昕昕局,本文陈述所有内容皆有可靠信息来源，赘述在文章结尾文 | 成倚贤●—≺ 前 言 ≻—●如果请人吃饭桌上放着茅台酒，那必然是十分有面子，大家都知道茅台酒的“含金量”，可茅台女员工的“工作照”被曝光后，却让人下不去嘴了？,https://toutiao.com/group/7426239801449251343/,,0,0,False
这一次，被批“不男不女”的毕凌，把父亲毕福剑的体面撕的稀碎,2024-08-31 05:00,698,197,卿羽飞,卿羽飞,曾经的《星光大道》是多少人童年时最喜欢看的综艺节目，捧红了非常多的草根艺人，让他们能够实现自己的梦想。,https://toutiao.com/group/7409154770201559591/,,0,0,False
她是央视最惨主持人，男友被判死缓，丈夫诈骗入狱，47岁无人敢娶,2024-08-27 23:30,2256,209,闻书识焉,闻书识焉,她曾是央视的台柱子，和董卿、周涛并称为央视的三朵金花。回顾刘芳菲的前半生，最令人感到惋惜的，便是她的感情生活，47岁至今无人敢娶。,https://toutiao.com/group/7407743113688564258/,,0,0,False
贪污上亿、侵吞善款，韩红被实名举报，4年了，有人给她道歉吗？,2024-10-19 07:24,2694,245,昕昕局,昕昕局,2020年初，新冠疫情肆虐，武汉告急，全国上下万众一心，与时间赛跑，与病魔较量，就在这场没有硝烟的战争中，一个熟悉的身影出现在抗疫一线，她带着物资，带着希望，奔赴在最危险的地方，她就是韩红。,https://toutiao.com/group/7427383862491120179/,,0,0,False
张紫妍：被迫陪睡31人近百次，遭道具虐待，29岁自杀留230页遗书,2024-07-24 02:37,13844,981,八号探秘人,八号探秘人,在阅读此文之前，辛苦您点击一下“关注”，既方便您进行讨论和分享，又能给您带来不一样的参与感，感谢您的支持！本文叙述皆有官方信源，为了读者有更好体验，放在了文章后缀！,https://toutiao.com/group/7394994383675736576/,,0,0,False
以后想吃回锅肉你就像我这样做，肥而不腻，咸香适口，太解馋了,2024-08-06 11:19,32495,1198,家常的味道,家常的味道,,https://toutiao.com/group/7399984507362738742/,,0,0,True
炸萝卜丸子，放面粉和淀粉就错了，教你正确做法，焦香酥脆不吸油,2024-09-28 10:13,12018,413,家常的味道,家常的味道,,https://toutiao.com/group/7419635124758643227/,,0,0,True
今天才知道！电动车“每天充”和“用完再充”，到底哪个更伤电池,2024-08-27 11:19,12650,2209,鲸探所,鲸探所,“今天到底给车充不充电？”估计大多数人每天回家都会想这个问题，看着自己的电动车电量又多又少的，充不充电也是一件非常难以抉择的事情。那么，电动车到底应该怎样充电呢？是每天都充，还是用完之后再充呢？电动车充电不管是在城市还是农村，电动车其实都是人们出门最常见的交通工具。,https://toutiao.com/group/7407773012533117475/,,0,0,False
安徽美女道士胡小慧被捕：精通“胡媚术”，九名男徒弟揭露其罪行,2024-09-12 08:10,3725,426,艺述史,艺述史,在安徽一处偏僻山头上，有座神秘的道观，外表平平无奇，但里面却有着一位名气很高的美女道士。美女道士的名字叫做胡小慧，据说有着高深的法力，能帮人消灾解难。很多人慕名前来，交上丰厚的香火钱，在袅袅青烟里，试图从这个年轻道士身上获得一些生活的支撑。,https://toutiao.com/group/7413662261274739200/,,0,0,False
炸肉丸子，到底用淀粉还是面粉，教你一招，外酥里软超好吃,2024-10-01 09:23,2509,145,家常的味道,家常的味道,,https://toutiao.com/group/7420735473208787492/,,0,0,True
猪肉别总是炒着吃了，教你简单又好吃的做法，简直太香了,2024-09-11 09:11,9402,483,家常的味道,家常的味道,猪肉别总是炒着吃了，教你简单又好吃的做法，简直太香了,https://toutiao.com/group/7413310656981664283/,,0,0,True
半岛局势紧张的肇事者是谁？不是韩国更不是朝鲜，得利者浮出水面,2024-10-18 05:56,12989,962,陈虎点兵,陈虎点兵,,https://toutiao.com/group/7426990598878167567/,,0,0,True
袖珍村医携手妻子守护整个村庄 肖九林,2024-08-19 01:40,2830,145,红星新闻,红星新闻,,https://toutiao.com/group/7404659400322843175/,,0,0,True
秋葵的神仙吃法，比吃补药还补，做法简单，鲜香滑嫩又多汁，真香,2024-07-29 12:39,42937,3672,一画美食,一画美食,,https://toutiao.com/group/7397036492566856244/,,0,0,True
"金正恩""万人雄师""挺普京？泽连斯基""狗急跳墙""走头无路！",2024-10-18 03:30,4191,214,黄阿原,黄阿原,,https://toutiao.com/group/7426699727690793523/,,0,0,True
拉尼娜又要来了！又又又是一年“最冷冬天”？,2024-10-21 02:40,246,154,大象新闻,大象新闻,2024 年 6 月，厄尔尼诺（El Niño Phenomenon）才刚刚退出舞台，9月，世界气象组织（WMO）就表示拉尼娜（La Niña）已经蓄势待发，准备在秋季“返场”了。,https://share.hntv.tv/news/0/1848177056801193986,,0,0,False
我的房子不对劲！深不可测的恐惧 第五章，逃离伍德伯里,2024-10-05 23:00,3020,434,鲤鱼Ace,鲤鱼Ace,溯源之惧 第五章，逃离伍德伯里,https://toutiao.com/group/7422325180422160930/,,0,0,True
发售仅一个月，iphone16全系巨幅降价！网友：你不买我不买，月底还能降800,2024-10-21 01:03,180,291,极目新闻,极目新闻,10月20日，苹果旗下刚刚发布一个月左右的iphone16系列机型价格也出现了很大的波动。当前，在Apple Store官方旗舰店，iPhone16基础版价格降至5499元，不仅基础机型，iPhone 16 系列的 Plus、Pro 及Pro Max 版本同样迎来价格下探。,http://jms.ctdsb.net/jmythshare/#/index_share?cId=0&contentType=5&contentId=2283764,,0,0,False
