title,publish_time,like_count,comment_count,media_name,source,abstract,article_url,tag,is_yaowen,article_sub_type,has_video
三峡“钉子户”张秉爱：全村搬迁就她不走，苦守20年结局让人唏嘘,2024-07-25 02:36,2535,430,智史通鉴,智史通鉴,“我不会搬走的！生是这里的人，死是这里的鬼！”说这话的是我国修建三峡工程时唯一的“钉子户”张秉爱，工作人员已经来劝说多次了，可她就是不肯搬走。张秉爱也不是为了钱，她只是对这片土地爱得深沉。,https://toutiao.com/group/7395384052218167818/,,0,0,False
她曾被前夫一巴掌扇到离婚！二婚嫁世界冠军，如今生活幸福滋润,2024-09-10 09:12,9638,188,豆莱说,豆莱说,“漂亮的让人挪不开眼”是圈内人对她的评价，和“山杏”不一样的是，李琳在现实生活中的感情很是幸运，遇到了导演王小列。,https://toutiao.com/group/7412930201929204236/,,0,0,False
2013年，湖南26岁女孩嫁给71岁老头，婚后还生下一子，如今怎样了,2024-07-12 11:59,27628,2465,智史通鉴,智史通鉴,2013年4月17日，长沙宁乡县的民政局迎来了一对特殊的夫妻。一个71岁的老头和一个26岁的女孩，离远了看，甚至像爷爷和孙女。面对工作人员异样的眼光，女孩说：“我和他是真心相爱的！”这让人好奇，这对相差45岁的夫妻，他们之间到底有着怎样的爱情故事？,https://toutiao.com/group/7390696631223534120/,,0,0,False
中国🇨🇳人民的好总理,2024-09-03 15:46,204404,21641,话说,话说,这个老人一生只做一件事，那就是为了人民鞠躬尽瘁，死而后已,https://toutiao.com/group/7410443709928210955/,,0,0,True
今天才知道！电动车“每天充”和“用完再充”，到底哪个更伤电池,2024-08-27 11:19,9026,1799,鲸探所,鲸探所,“今天到底给车充不充电？”估计大多数人每天回家都会想这个问题，看着自己的电动车电量又多又少的，充不充电也是一件非常难以抉择的事情。那么，电动车到底应该怎样充电呢？是每天都充，还是用完之后再充呢？电动车充电不管是在城市还是农村，电动车其实都是人们出门最常见的交通工具。,https://toutiao.com/group/7407773012533117475/,,0,0,False
为国争光却遭郎平弃用！转身效力土耳其的王一梅，如今咋样了？,2024-08-31 13:19,937,142,豆莱说,豆莱说,光阴似箭，日月如梭，当初的少女早已退役，成为了排球场的幕后人，这么多年她都经历了什么，现在又怎么样了呢?,https://toutiao.com/group/7409287778514567718/,,0,0,False
他和6个老婆共处一室，每人每月7万零花钱，71岁又娶了20岁小娇妻,2024-10-05 09:31,347,118,书生talk,书生talk,在我国建国之后，对于婚姻制度就是一夫一妻制度，至今也没有改变，在这么多年之内，也有专家建议取消一夫一妻的制度，以此来增加生育率，但是这样的提议也是遭到了众多人的反对，所以也没有执行。,https://toutiao.com/group/7422221676558959104/,,0,0,False
#人性电影,2024-09-30 03:54,1316,192,时光剪影,时光剪影,,http://toutiao.com/item/7420279600897098274/,,0,0,True
奉陪到底，解放军报发出统一强音，台上将发现，大陆在等锁岛时机,2024-10-06 10:00,1738,217,强武堂,强武堂,最近，台海军“司令”唐华的一番话，直接引起了岛内热议，他说解放军已掌控台海，正以“蟒蛇战术”困住台湾，只要等到一个时机，便可随时进行全岛封锁。,https://toutiao.com/group/7422599740354789929/,,0,0,False
好物分享｜有个会做饭的老公，在家也能实现盐菜面自由，太香了！,2024-10-07 22:30,276,332,农村四哥,农村四哥,有个会做饭的老公，在家也能实现盐菜面自由，太香了！喜欢干盐菜的朋友可以下单哟！,https://toutiao.com/group/7423024988594111027/,,0,0,True
5年前站在美国军舰上，用中文警告我国海军的华人女兵，现在如何,2024-10-06 09:06,1567,206,陈志华观天下,陈志华观天下,2019年，华裔女兵郑浩儿站在一艘美国军舰上，用一口标准的中文喊话威胁中国海军:“我们只是正常巡视，再往前一步，我们不介意发动战争!”,https://toutiao.com/group/7422585983588024883/,,0,0,False
善恶终有报！疫情时对中国一毛不拔，却大方捐美国6亿，现状如何,2024-10-06 06:09,869,181,昕昕局,昕昕局,SOHO中国的董事长潘石屹和其夫人张欣，在2014年向哈佛大学捐赠了1500万美元，这还不算什么，潘石屹的基金会甚至还计划要捐赠1亿美元!,https://toutiao.com/group/7422540167589708288/,,0,0,False
已致超220人死亡！数百人失联…噩耗不断，重创美政府,2024-10-07 11:46,1589,203,司马南,司马南,有人说，不就是死了二百多人——死了二百多人，那是媒体报道出来的，除此之外还有几百人失踪，到现在找不着。,https://toutiao.com/group/7422995893500019251/,,0,0,False
看一下外国电视台节目里中国军队的样子,2024-10-07 08:11,2228,382,西瓜群众176,西瓜群众176,,https://toutiao.com/group/7422943404075516443/,,0,0,True
紧跟美国，新西兰军舰刚闯台海，求锤得锤？外媒：支援舰突发沉没,2024-10-06 01:40,1143,166,烽火前站,烽火前站,新西兰海军的规模非常小，仅有10艘左右的军舰，除了安扎克级导弹护卫舰之外，就是一些后勤舰船，不过新西兰却敢于在台岛问题上公然发起挑衅。,https://toutiao.com/group/7422465354448568851/,,0,0,False
如今回头看恒大，许家印是赢了还是输了？！,2024-07-29 11:03,41173,23173,缤纷海燕YrEkWp,缤纷海燕YrEkWp,,https://toutiao.com/group/7397011739571421708/,,0,0,True
5座车拉6个人被判超员，车主1句话把交警问懵,2024-08-05 20:20,18310,4202,奇妙钢笔pA8JyP,奇妙钢笔pA8JyP,,https://toutiao.com/group/7399752843772559906/,,0,0,True
张召忠：美国就算一动不动，中国20年也追不上，中美差距那么大？,2024-10-07 00:00,1394,111,议史纪,议史纪,,https://toutiao.com/group/7420355538816336435/,,0,0,True
万万没想到，35岁杨颖兜兜转转干回“老本行”，活成内娱最大笑话,2024-09-06 07:55,535,137,读万卷书的张飞,读万卷书的张飞,文l张飞编辑l张飞曾经你看不起别人；如今谁又瞧得上你？在节目中丝毫不考虑他人状态，一味地只追求自己的镜头。甚至还在采访中公然表示“自己早就应该把所有奖拿了个遍了”。更关键的是丝毫没有任何“报恩”之心。所以如今曾经所有的“嚣张”“高高在上”遭到反噬，只能说现在谁还“愿意”认识她！,https://toutiao.com/group/7411434661014012456/,,0,0,False
写歌30年穷困潦倒，前妻失望选择离婚，谁料51岁靠一首歌一夜成名,2024-08-12 03:37,25022,4016,八号探秘人,八号探秘人,在阅读此文之前，辛苦您点击一下“关注”，既方便您进行讨论和分享，又能给您带来不一样的参与感，感谢您的支持！编辑：LY无数人都想要一个一夜成名的机会，但机会来了也不是每个人都能把握住的。他用了三十年的时间来准备迎接属于自己的机会。为了这个机会他放弃了一切，甚至包括家庭。,https://toutiao.com/group/7402090890367484428/,,0,0,False
没有物质的爱情，男人算什么,2024-10-07 11:02,498,135,麦田里的新希望,麦田里的新希望,,http://toutiao.com/item/7422987593752511011/,,0,0,True
女子穿衣前卫被外卖员“男凝”吐槽：他一直盯着我的胸看,2024-10-01 15:02,2198,4074,济报鲁中,济报鲁中,,https://toutiao.com/group/7420822893241565696/,,0,0,True
中央再出大招，新一轮拆迁来了，城市更新走向3.0新时代！,2024-10-07 01:16,764,155,老猫看现象,老猫看现象,,https://toutiao.com/group/7422836562721538600/,,0,0,True
表面是艺人，实际是富家千金的5位女星，无人敢惹更别说潜规则了,2024-08-28 02:06,9969,783,八号探秘人,八号探秘人,在德云班主郭德纲的作品中，有过这么一句话。虽说此言尤为刺耳，但话糙理不糙。当今娱乐圈，很多女星为出人头地，自愿或被迫做出违反道德底线之事。,https://toutiao.com/group/7407984985224872459/,,0,0,False
"万万没想到,53岁“丁克”半辈子的康辉，一生遗憾竟然是一通电话",2024-08-21 22:14,25463,5065,峰哥正读,峰哥正读,在阅读此文之前，麻烦您点击一下“关注”，既方便您进行讨论和分享，又能给您带来不一样的参与感，感谢您的支持！文/编辑：蘑菇百善孝为先。但是到底怎么做才算是“孝”，康辉用了半辈子才明白。央视知名主持人康辉，事业顺遂，家庭幸福，在外人看来是一个人生赢家。,https://toutiao.com/group/7405504703687115273/,,0,0,False
国庆返程高速公路惊现大量图钉，多车轮胎被扎！官方回应,2024-10-07 08:01,379,239,上观新闻,上观新闻,10月6日，有网友在网上发布视频称：多辆汽车轮胎在沪渝高速公路重庆忠州服务区附近扎满图钉，不知是什么原因。10月7日上午，记者从重庆高速交警及忠县政府获悉，扎满轮胎的图钉系货车不小心掉落，非人为因素。目前掉落的图钉已被清理干净，警方正在寻找肇事车辆。,https://export.shobserver.com/toutiao/html/804433.html,,0,1,False
东风41恐惧症在欧美蔓延：外媒坚定认为，先进导弹绝非东风31AG,2024-10-01 14:26,4929,880,南友汇,南友汇,日前以英国《金融时报》，美国《华盛顿时报》为首的欧美国家媒体撰文称，解放军本次试射的洲际导弹绝非是东风31AG，而是解放军现役更先进的东风41洲际导弹。,https://toutiao.com/group/7420812639297520163/,,0,0,False
在两性关系中，女性最多能接受多少岁的男人，3位女人说出心里话,2024-07-25 23:38,27686,8628,玲儿说说,玲儿说说,,https://toutiao.com/group/7395721886363025920/,,0,0,True
"中美台海""必有一战""？大陆统一台湾胸有成竹，美军必遭歼灭！",2024-10-06 22:00,3518,172,黄阿原,黄阿原,,https://toutiao.com/group/7422618545030169151/,,0,0,True
她是央视最惨主持人，男友被判死缓，丈夫诈骗入狱，47岁无人敢娶,2024-08-27 23:30,2187,207,闻书识焉,闻书识焉,她曾是央视的台柱子，和董卿、周涛并称为央视的三朵金花。回顾刘芳菲的前半生，最令人感到惋惜的，便是她的感情生活，47岁至今无人敢娶。,https://toutiao.com/group/7407743113688564258/,,0,0,False
初中毕业去当流水线女工，五年后却成为世界冠军，22岁成人生赢家,2024-08-02 10:46,6359,1217,豆莱说,豆莱说,文：豆莱说编辑：豆莱说支持作者，写作不易，文中会有5s广告，观看后可免费阅读全文父母曾设想过子女的千百种可能，只是对于一个走上中专之路的孩子，无非也是毕业，打工，进工厂，养家糊口。,https://toutiao.com/group/7398489613888766475/,,0,0,False
男子与女子在河中嬉戏玩耍，突然连续将女子的头按入水中,2024-09-26 04:40,1312,168,经视看天下,经视看天下,,https://toutiao.com/group/7418807108637819444/,,0,0,True
这是调戏还是搭讪？,2024-08-16 04:36,3262,180,潍坊市广播电视台,潍坊市广播电视台,,https://toutiao.com/group/7403591622725272100/,,0,0,True
"韩国举行近十年来最大规模阅兵,韩国网友惊呼:这是亚洲最强的阅兵",2024-10-07 09:54,992,947,兔兔侠妈妈,兔兔侠妈妈,,https://toutiao.com/group/7422970058483171903/,,0,0,True
