title,publish_time,like_count,comment_count,media_name,source,abstract,article_url,tag,is_yaowen,article_sub_type,has_video
特朗普怎么结束俄乌战争和中东战争，泽连斯基纳塔亚胡命运大不同,2024-11-14 05:39,14323,475,邱毅台湾,邱毅台湾,,https://toutiao.com/group/7437005549285147187/,,0,0,True
包厢全是刚出狱的恶霸，结果一看到饭店主厨，立马怂了,2024-11-11 01:21,5392,129,乐视群星访谈秀,乐视群星访谈秀,,https://toutiao.com/group/7435825833048015400/,,0,0,True
1米3袖珍美女嫁给1米48男孩，婚后丈夫奇迹长高，两人却不欢而散,2024-09-07 02:55,4457,243,睿之悦,睿之悦,杨萍和葛存苗的婚礼 文|睿之悦 编辑|睿之悦2019年，成都的民政局来了两个“10岁小孩”来登记，工作人员以为是玩闹。两个“小孩”拿出身份证让工作人员看，这才明白，原来是两个再也长不高的成年袖珍人情侣。,https://toutiao.com/group/7411713833267364386/,,0,0,False
今天才知道！电动车“每天充”和“用完再充”，到底哪个更伤电池,2024-08-27 11:19,15625,2377,鲸探所,鲸探所,“今天到底给车充不充电？”估计大多数人每天回家都会想这个问题，看着自己的电动车电量又多又少的，充不充电也是一件非常难以抉择的事情。那么，电动车到底应该怎样充电呢？是每天都充，还是用完之后再充呢？电动车充电不管是在城市还是农村，电动车其实都是人们出门最常见的交通工具。,https://toutiao.com/group/7407773012533117475/,,0,0,False
51年洪学智妻子寻女无果，到老乡家歇脚老乡惊呼：你要找得就是我,2024-09-22 01:07,13832,895,品古观今,品古观今,前言1951年，阳曲县委大院突然来了7、8位解放军同志，其中一位女同志，就是洪学智的妻子张文。她此番前来，就是为了寻找多年前因战乱而寄养于民间的爱女。可昔日的小村落早已蜕变成另一番景象，这无异于是大海捞针。,https://toutiao.com/group/7417034363226915354/,,0,0,False
特朗普赢却难就职？拜登怕追责，佩洛西怕牢饭，三大集团蠢蠢欲动,2024-11-14 22:04,27867,1248,黎建南台湾,黎建南台湾,,https://toutiao.com/group/7437259350143402515/,,0,0,True
女儿花500块租男友，没想他是身价过亿的总裁，这下好运了,2024-10-18 09:42,8009,1488,乐视娱乐乐透社,乐视娱乐乐透社,,https://toutiao.com/group/7427048858267419190/,,0,0,True
送给所有知道我名字的人 想送一份祝愿给大家，所以唱了这首歌,2024-11-13 04:30,113506,19211,李子柒,李子柒,,https://toutiao.com/group/7436616916803781171/,,0,0,True
12万亿的化债一落地，猪又要飞上天了！年底之前1大行业急剧上涨,2024-11-15 03:39,2579,342,量子教育新商学,量子教育新商学,,https://toutiao.com/group/7437345740701860390/,,0,0,True
为什么过了70岁的老年人，更需要同居生活？看完你就明白了,2024-09-26 08:22,6614,111,身心驿站,身心驿站,,https://toutiao.com/group/7418864306399216179/,,0,0,True
炸萝卜丸子到底用面粉还是淀粉，教你正确做法，外焦里嫩，太香了,2024-10-26 09:25,7971,521,家常的味道,家常的味道,,https://toutiao.com/group/7430012978277122611/,,0,0,True
小伙洗完澡故意秀肌肉，富婆心跳加速被当场拿下，这下好看了,2024-10-26 16:20,8037,316,乐视情感讲堂,乐视情感讲堂,小伙洗完澡故意秀肌肉，富婆心跳加速被当场拿下，这下好看了,https://toutiao.com/group/7430011217881596426/,,0,0,True
罕见！100年前，英国游客拍下的清朝乡村，和想象中完全不一样,2024-09-20 02:07,6287,633,万物知识局,万物知识局,泥泞的土路，衣不蔽体的老百姓，即便是达官显贵的家中也十分破败，而这些都是清王朝的历史痕迹，虽说那时候中国摄影技术并不发达，但也有许多外国游客来到这里，拍摄下了许多老照片，为我们留下了珍贵的历史资料，那清朝到底是怎样的面貌呢?,https://toutiao.com/group/7416287738871267855/,,0,0,False
医生发现：不容易得癌症的人，一般都有5个“特质”，你占几个？,2024-11-15 11:19,1523,178,39健康网,39健康网,“癌症是人类追求健康路上难以回避的挑战。”近年来，癌症似乎越来越频繁地出现在人们的视线中。无论患者还是健康人，都对“患癌概率”心存疑问：为何偏偏是自己中招？自己的患癌风险究竟有多大？一、人活一辈子，得癌症的几率有多大？,https://toutiao.com/group/7437417286899646976/,,0,0,False
破解特朗普加征关税，中国有7招,2024-11-15 14:05,7349,160,静思有我,静思有我,,https://toutiao.com/group/7437506977830044200/,,0,0,True
著名专家预言：试管婴儿寿命仅40年，那首例试管婴儿如今怎样了？,2024-09-01 06:05,9203,453,睿之悦,睿之悦,文|睿之悦编辑|睿之悦“试管婴儿活不到40岁？”1988年3月10日，我国首例试管婴儿顺利诞生。在当时，试管婴儿的技术正处于起步阶段，因此，有人将其视为医学的奇迹，但也有人则预言试管婴儿活不过40岁。那么，36年的时间过去了，我国首例试管婴儿如今怎么样了呢？,https://toutiao.com/group/7409105262277853733/,,0,0,False
24小时结束俄乌冲突有了新方案，特朗普“和平方案”能落地吗?,2024-11-10 12:00,7643,196,杜文龙,杜文龙,,https://toutiao.com/group/7435619187864797705/,,0,0,True
俩人相亲互相看不上，哪料男方一报母亲身份，姑娘乐了,2024-11-08 01:50,8267,1965,乐视群星访谈秀,乐视群星访谈秀,,https://toutiao.com/group/7434719902990074395/,,0,0,True
化痰特别厉害的一味药，对咽喉也特别好，学会运用能治很多病,2024-08-18 08:37,54052,4884,梁医学社梁怡璋医生,梁医学社梁怡璋医生,,https://toutiao.com/group/7404395746549563916/,,0,0,True
宝宝出生时“几斤几两”，能暗示智商高低？医生：最佳标准在这里,2024-09-04 10:41,1949,473,39健康网,39健康网,琳琳是一位二胎宝妈，老大出生的时候只有5斤重，一家人都十分心疼他，平常照顾得十分尽心，现在看起来和同龄的小孩没什么区别。于是在去年，琳琳和丈夫一起商量要了二胎，可能是有经验，出生的时候有8斤重。,https://toutiao.com/group/7410732676779115048/,,0,0,False
100年前，清朝罕见留影，王爷妻妾婀娜多姿，乞丐全身挂满垃圾,2024-10-14 09:58,1481,175,万物知识局,万物知识局,每一张老照片，都像是时间的低语，它们静静地躺在历史的相册中，却在不经意间将我们拉回到那个遥远而神秘的年代。,https://toutiao.com/group/7425457574731579919/,,0,0,False
为什么东北地区得半身不遂的人这么多？调查发现：主要原因有三点,2024-08-19 03:53,4857,1102,39健康网,39健康网,李大爷今天在外面跑完步回来，全身都被汗浸透了，想着先洗个澡，结果没过15分钟，就听到浴室传来一声闷响，家人赶紧上前查看，发现大爷已经倒地昏迷，于是赶紧叫了救护车。,https://toutiao.com/group/7404689072582558223/,,0,0,False
给近三年最好的10部年代剧排个名：《人世间》第6，第1名没有争议,2024-09-06 08:08,12083,3778,皮皮电影,皮皮电影,时尚是个轮回，电视剧也是。在2020年之前的那些年，电视剧市场基本上都被偶像剧、都市剧霸占。曾经撑起国剧品质的《闯关东》《岁月》这类年代好剧，难见踪影。,https://toutiao.com/group/7411390030722712090/,,0,0,False
广西49岁老汉娶19岁姑娘，结婚21年生下15个孩子，如今有何下场？,2024-10-20 08:32,2782,397,艺述史,艺述史,她19岁出嫁，21年里总共生育了15个孩子，其中4个男孩子11个女孩子，家里热闹的像是开了一所学校一样。,https://toutiao.com/group/7427400319418384948/,,0,0,False
绍伊古在中国很悠闲，泽连斯基却发现情况不妙,2024-11-15 07:37,4031,113,票姚校尉,票姚校尉,绍伊古在中国很悠闲，泽连斯基却发现情况不妙,https://toutiao.com/group/7437406930001199666/,,0,0,True
内阁人选出炉，对华立场各异，两派博弈，将如何左右特朗普决策？,2024-11-12 09:49,25449,1527,邱震海,邱震海,,https://toutiao.com/group/7436327724950094373/,,0,0,True
手上一奇穴，让你肝血充足眼睛亮，现在揉效果最好,2024-10-21 07:30,86749,9058,梁医学社梁怡璋医生,梁医学社梁怡璋医生,,https://toutiao.com/group/7427920784783311396/,,0,0,True
快消失的12个生活用品！40年前在供销社红极一时，你家还在用吗？,2024-09-29 07:58,5558,363,万物知识局,万物知识局,在这里，可以买到从油盐酱醋到衣物鞋帽，再到农具化肥等各种生活必需品，每一样物品都凝聚着时代的特色，见证了那个年代人们的生活状态，今天我们就来走进那些年能够在供销社里买到的生活用品，看看你们还记得哪些。,https://toutiao.com/group/7419937237548237322/,,0,0,False
“特朗普+马斯克”时代，大胆预测之三！3件事看他们能否改变美国,2024-11-15 13:16,9041,770,终南剑客,终南剑客,本期话题，3个事，巧、怪、讽刺，来看“特朗普+马斯克组合”，能不能改变美国？,https://toutiao.com/group/7437494442094756392/,,0,0,True
