title,publish_time,like_count,comment_count,media_name,source,abstract,article_url,tag,is_yaowen,article_sub_type,has_video
独家完整版视频丨国家主席习近平发表二〇二五年新年贺词,2024-12-31 11:15,31684,20269,央视新闻,央视新闻,新年前夕，国家主席习近平通过中央广播电视总台和互联网，发表了二〇二五年新年贺词。全文如下：大家好！时间过得很快，新的一年即将到来，我在北京向大家致以美好的祝福！2024年，我们一起走过春夏秋冬，一道经历风雨彩虹，一个个瞬间定格在这不平凡的一年，令人感慨、难以忘怀。,https://content-static.cctvnews.cctv.com/snow-book/index.html?item_id=1506781951411024055&source=50006&sub_source=50006_001,,0,0,False
独家视频丨国家主席习近平向大家致以美好的祝福,2024-12-31 11:04,1443,1560,央视新闻,央视新闻,新年前夕，国家主席习近平通过中央广播电视总台和互联网，发表了二〇二五年新年贺词。习近平：大家好！时间过得很快，新的一年即将到来，我在北京向大家致以美好的祝福！©2024中央广播电视总台版权所有。未经许可，请勿转载使用。,https://content-static.cctvnews.cctv.com/snow-book/index.html?item_id=3058834507220543667&source=50006&sub_source=50006_001,,0,0,False
独家视频丨习近平：两岸同胞一家亲 谁也无法割断我们的血脉亲情,2024-12-31 11:12,722,1196,央视新闻,央视新闻,新年前夕，国家主席习近平通过中央广播电视总台和互联网，发表了二〇二五年新年贺词。习近平：两岸同胞一家亲，谁也无法割断我们的血脉亲情，谁也不能阻挡祖国统一的历史大势！©2024中央广播电视总台版权所有。未经许可，请勿转载使用。,https://content-static.cctvnews.cctv.com/snow-book/index.html?item_id=13327794526506738937&source=50006&sub_source=50006_001,,0,0,False
六代机双飞、四川舰三个第一，神雕无人预警机，中国军工震惊美国,2024-12-30 06:02,40366,2103,邱毅台湾,邱毅台湾,,https://toutiao.com/group/7454081205471085107/,,0,0,True
代理总统也遭弹劾！一个月内换三任总统，韩国民主还有救吗？,2024-12-28 06:35,12200,106,邱震海,邱震海,,https://toutiao.com/group/7453347580572631592/,,0,0,True
老人在家带孙女，儿媳从监控看到这画面泪目了,2024-12-31 02:41,2737,222,新派新闻,新派新闻,,https://toutiao.com/group/7454215156852064818/,,0,0,True
厨师长教你：“葱爆羊肉”羊肉滑嫩、鲜香不膻,2024-12-27 07:34,2690,489,美食作家王刚,美食作家王刚,厨师长教你：“葱爆羊肉”羊肉滑嫩、鲜香不膻,https://toutiao.com/group/7452991735665263139/,,0,0,True
四川女生在澳洲农场打工的真实生活：早上4点摘草莓，时薪29澳元,2024-12-28 04:26,1641,539,鲸探所,鲸探所,网上有一位博主分享了自己在澳洲农场打工的真实生活，每天早上四点起床摘草莓，一个小时29澳元，一天只需要工作6个小时左右。,https://toutiao.com/group/7453312348158231081/,,0,0,False
第6代战机，是怎样炼成的？(上),2024-12-29 14:51,12707,417,静思有我,静思有我,,https://toutiao.com/group/7453846576981606912/,,0,0,True
韩国又一次创造了历史,2024-12-28 04:21,3873,153,牛弹琴,牛弹琴,韩国又创造了历史，更精彩的还在后面,https://toutiao.com/group/7453313008731685411/,,0,0,True
新婚33天卷走274万4套房，出逃后丈夫跨国追捕，如今下场大快人心,2024-12-20 22:06,4506,233,八号探秘人,八号探秘人,在阅读此文之前，辛苦您点击一下“关注”，既方便您进行讨论和分享，又能给您带来不一样的参与感，感谢您的支持！编辑丨QQ·B“色字头上一把刀！”深圳富豪结婚33天竟被卷走274万元和名下4套房产。不仅如此，他还被扣上了“接盘侠”的帽子，啥也没干喜当爹。,https://toutiao.com/group/7450399558821052982/,,0,0,False
被央媒怒批，目不识丁，丢人现眼，这几位“文盲”明星凭什么走红,2024-12-30 10:52,2393,613,与君説,与君説,在阅读此文之前，麻烦您点击一下“关注”，既方便您进行讨论和分享，又能给您带来不一样的参与感，感谢您的支持文、编辑|小娄郭德纲曾说“可以没文凭，但不能没文化”。老郭的这句话在儿子郭麒麟身上体现得淋漓尽致。虽然郭麒麟初中就辍学了，但人家有思想有内涵，是个名副其实的“文化人”。,https://toutiao.com/group/7454151513221661234/,,0,0,False
再现久违声音！蔡磊借助AI完成了一场演讲,2024-12-31 01:12,8348,1210,央视新闻,央视新闻,“我坚信，我们终有战胜渐冻症的那一天。”在《AI奇妙夜》晚会现场，渐冻人蔡磊借助AI完成了一场演讲，重获新“声”！,https://toutiao.com/group/7454377687977722422/,,0,0,True
零下35度睡到帐篷里，半夜被热醒了，真的太热了,2024-12-30 11:22,3507,673,旅行者小多,旅行者小多,,https://toutiao.com/group/7454163664929554971/,,0,0,True
说一说成飞的新飞机，网上传的越来越玄乎，究竟有多厉害？,2024-12-29 13:21,11591,1369,陈虎点兵,陈虎点兵,,https://toutiao.com/group/7453823402932732435/,,0,0,True
海南富商张晖：花8亿建108米海上观音像，4年后死在水中死因成谜,2024-10-19 04:49,4718,839,八号探秘人,八号探秘人,在阅读此文之前，辛苦您点击一下“关注”，既方便您进行讨论和分享，又能给您带来不一样的参与感，感谢您的支持！编辑丨xk他是中国的一名富商，耗费8亿元完成了自己的梦想。可梦想落地成为现实的时候，他却在4年后莫名其妙的死去。他就是张晖，上个世纪末海南岛旅游业的龙头当家人。,https://toutiao.com/group/7427288913095492134/,,0,0,False
中国第八道硬菜上桌，美国绝对消化不良！（上）,2024-12-30 22:00,4168,162,占豪,占豪,面对中国科技大爆发，美国怎么办？现在临时再加大力度投入能行吗？,https://toutiao.com/group/7454120162862563840/,,0,0,True
央视跨年晚会阵容曝光，看完明星名单，厕所都不敢去上了,2024-12-31 09:19,1863,1204,闻书识焉,闻书识焉,其中最受关注的还是央视跨年晚会，昨日，央视也官宣了晚会第一批明星阵容和播出时间。看到演员阵容真的是百花齐放、星光熠熠，不是一般的豪华，中途厕所都不敢去了。,https://toutiao.com/group/7454493031660667411/,,0,0,False
中国乒乓球协会回应马龙、樊振东、陈梦退出世界排名,2024-12-31 08:15,1197,1313,环球网,环球网,12月31日，根据国际乒联最新一期世界排名，马龙、樊振东和陈梦正式退出世界排名。在国际赛场上，马龙、樊振东和陈梦三名运动员屡创佳绩，为祖国和人民赢得荣誉，为中国体育事业的发展作出了巨大贡献。,https://toutiao.com/group/7454486584491098661/,,0,0,False
老纪和珅这段对话，以前小时候听不懂，如今听完受益终身,2024-12-28 23:16,4435,1320,乐视扒剧小妹儿,乐视扒剧小妹儿,,https://toutiao.com/group/7453420191947424293/,,0,0,True
广西49岁老汉娶19岁姑娘，结婚21年生下15个孩子，如今有何下场？,2024-10-20 08:32,9910,1228,艺述史,艺述史,她19岁出嫁，21年里总共生育了15个孩子，其中4个男孩子11个女孩子，家里热闹的像是开了一所学校一样。,https://toutiao.com/group/7427400319418384948/,,0,0,False
美妇约见老情人，见面场景真是太逗了，这俩人绝配！,2024-10-27 16:25,5118,631,乐视明星的那点事,乐视明星的那点事,美妇约见老情人，见面场景真是太逗了，这俩人绝配！,https://toutiao.com/group/7428157095108674088/,,0,0,True
成都市武侯区人民法院：关于被告人贺某阳故意伤害、虐待刑事附带民事诉讼案的说明,2024-12-27 09:43,736,1896,环球网,环球网,,https://toutiao.com/group/7453024640584139274/,,0,0,False
经典高清战争老电影,2024-11-18 05:05,11246,331,小微娱乐创作,小微娱乐创作,,https://toutiao.com/group/7438481167495463424/,,0,0,True
中国已经下水第8艘航母？美媒宣称：14年下水8艘航母，速度创纪录,2024-12-30 09:28,2155,475,东方点兵,东方点兵,076官宣正式下水，美媒宣称，这是中国海军“下水”的第8艘航母，14年接连下水8艘航母，速度史无前例。,https://toutiao.com/group/7454133080303976999/,,0,0,False
明天起，你的房贷又降多少？,2024-12-31 01:41,336,295,海报新闻,海报新闻,“明天我的(商业)房贷利率就要降60个基点，降到2.72%，比公积金利率还低。”近日，家住天津的唐先生告诉中新经纬。明天起，重定价日为1月1日的存量房贷将迎来利率下调，有的调整幅度达60个基点。你的房贷利率降多少?,http://hb.dzwww.com/p/p0PhYtX8vGf.html,,0,0,False
A股震荡跨年，三大股指集体飘绿！机构：跨年行情未完待续，明年初市场或将延续震荡上行趋势,2024-12-31 05:55,148,612,每日经济新闻,每日经济新闻,12月31日，2024年最后一个交易日，三大股指延续调整态势，盘面上上证指数、A500指数跌近1％，个股层面闻泰科技涨停，光环新网、海澜之家涨逾5%，中航西飞、太阳纸业、惠泰医疗、中国神华等股跟涨。整体看，煤炭、消费等高股息板块表现活跃。,http://www.nbd.com.cn/rss/jinri_toutiao/articles/3706090.html,,0,0,False
煮米饭别总是加水了，难怪不好吃，教你酒店不外传的秘诀，非常香,2024-12-06 08:45,3636,783,明玥美食,明玥美食,,https://toutiao.com/group/7445217195929371190/,,0,0,True
燃气灶点着火松手就灭？很简单，大部分都是这几个原因,2024-11-24 11:58,2453,175,阿兵电器维修,阿兵电器维修,燃气灶打着火一松手就灭是怎么回事？原因很简单，大部分都是这几个问题，看完你就知道了,https://toutiao.com/group/7440814032556130870/,,0,0,True
【空气炸锅烤红薯】直接烤是大错！教你一招，红薯香甜软糯流蜜汁,2024-12-25 14:05,1019,416,明玥美食,明玥美食,【空气炸锅烤红薯】直接烤是大错！教你一招，红薯香甜软糯流蜜汁，比买的好吃,https://toutiao.com/group/7452350435098919443/,,0,0,True
贾玲铁了心跟老汉过日子，老汉却嫌贾玲长太丑，这段笑到喷,2024-12-24 03:23,1738,150,乐视最爱综艺说,乐视最爱综艺说,,https://toutiao.com/group/7451813444795236915/,,0,0,True
明天是元旦，点开这首歌听听，2025 年一切都如愿！,2024-12-30 23:07,4982,899,大地春晖,大地春晖,明天是元旦，点开这首歌听听，2025 年一切都如愿！,https://toutiao.com/group/7453763957321368083/,,0,0,True
小子相亲故意扮老，谁知道对方一见面就叫他大爷，这段太逗了,2024-12-24 08:17,2631,586,乐视热播综艺精选,乐视热播综艺精选,,https://toutiao.com/group/7451886130837848610/,,0,0,True
河南警察3岁女儿被拐，苦寻全国23年无果，结果却发现女儿在对门,2024-11-05 07:43,5943,609,八号探秘人,八号探秘人,寻亲23年无果，丢失的女儿竟住在对门?但它却真实发生在河南洛阳的梁绍波身上。是意外走丢，还是人贩子所为，三岁的女儿怎会离奇失踪?,https://toutiao.com/group/7433697108120142345/,,0,0,False
马桶冲水无力没有吸力？一般都是这4个原因，大部分自己就能解决,2024-12-08 11:33,1674,170,阿兵电器维修,阿兵电器维修,马桶冲水无力没有吸力？很简单，一般都是这4个原因，大部分自己就能解决,https://toutiao.com/group/7446002675537150491/,,0,0,True
小品：过了20多年，这小品仍旧是经典！百看不厌啊,2024-12-03 06:44,3258,715,PP谍战集中营剧院,PP谍战集中营剧院,小品：过了20多年，这小品仍旧是经典！百看不厌啊,https://toutiao.com/group/7444072753042293275/,,0,0,True
80岁老奶奶做红烧鱼从来不粘锅不破皮，原来技巧这么简单,2024-10-16 12:07,6700,375,家常的味道,家常的味道,,https://toutiao.com/group/7426343891651985974/,,0,0,True
明天起，全体公民法定节假日增加2天！,2024-12-31 00:29,1457,462,闽南网,闽南网,根据2024年11月修订的《全国年节及纪念日放假办法》，自2025年1月1日起，全体公民放假的假日增加2天，即农历除夕、5月2日。增加后，春节放假4天（农历除夕、正月初一至初三），劳动节放假2天（5月1日、2日）。放假总天数从11天增加至13天。,https://toutiao.com/group/7454366142983913993/,,0,0,False
近5年最热的十部剧，《狂飙》第9，《繁华》第6，第1名很难超越,2024-12-01 03:58,1900,680,电影烂番茄,电影烂番茄,今天，番叔就结合口碑，给大家盘点一下近五年，热度最高的十部电视剧。第十名:《都挺好》 猫眼热度 9775.8，播出时间2019年。,https://toutiao.com/group/7430845717314273831/,,0,0,False
饭店里的炒饼为啥那么好吃，其实做法很简单，1分钟教会你,2024-12-17 08:13,3561,192,家常的味道,家常的味道,,https://toutiao.com/group/7449291052302729762/,,0,0,True
