title,publish_time,like_count,comment_count,media_name,source,abstract,article_url,tag,is_yaowen,article_sub_type,has_video
1米3袖珍美女嫁给1米48男孩，婚后丈夫奇迹长高，两人却不欢而散,2024-09-07 02:55,2616,150,睿之悦,睿之悦,杨萍和葛存苗的婚礼 文|睿之悦 编辑|睿之悦2019年，成都的民政局来了两个“10岁小孩”来登记，工作人员以为是玩闹。两个“小孩”拿出身份证让工作人员看，这才明白，原来是两个再也长不高的成年袖珍人情侣。,https://toutiao.com/group/7411713833267364386/,,0,0,False
善恶终有报：疫情时对中国一毛不拔，却大方捐美国6亿，如今咋样,2024-09-29 05:50,976,127,睿之悦,睿之悦,可就是这样一位在中国土生土长起来的富豪，在疫情期间面对同胞的困境却一毛不拔，反而大方的捐助了6亿给美国。,https://toutiao.com/group/7419859345154015798/,,0,0,False
罕见！100年前，英国游客拍下的清朝乡村，和想象中完全不一样,2024-09-20 02:07,4733,535,万物知识局,万物知识局,泥泞的土路，衣不蔽体的老百姓，即便是达官显贵的家中也十分破败，而这些都是清王朝的历史痕迹，虽说那时候中国摄影技术并不发达，但也有许多外国游客来到这里，拍摄下了许多老照片，为我们留下了珍贵的历史资料，那清朝到底是怎样的面貌呢?,https://toutiao.com/group/7416287738871267855/,,0,0,False
今天才知道！电动车“每天充”和“用完再充”，到底哪个更伤电池,2024-08-27 11:19,14828,2318,鲸探所,鲸探所,“今天到底给车充不充电？”估计大多数人每天回家都会想这个问题，看着自己的电动车电量又多又少的，充不充电也是一件非常难以抉择的事情。那么，电动车到底应该怎样充电呢？是每天都充，还是用完之后再充呢？电动车充电不管是在城市还是农村，电动车其实都是人们出门最常见的交通工具。,https://toutiao.com/group/7407773012533117475/,,0,0,False
给近三年最好的10部年代剧排个名：《人世间》第6，第1名没有争议,2024-09-06 08:08,10809,3471,皮皮电影,皮皮电影,时尚是个轮回，电视剧也是。在2020年之前的那些年，电视剧市场基本上都被偶像剧、都市剧霸占。曾经撑起国剧品质的《闯关东》《岁月》这类年代好剧，难见踪影。,https://toutiao.com/group/7411390030722712090/,,0,0,False
被拐男子认亲一年后，与家人彻底决裂！,2024-11-05 08:45,490,244,环球网,环球网,来源：宁波晚报 近日因寻亲走红的郁豹豹与家人决裂的消息引发关注，冲上热搜。据报道，2023年9月，被拐卖34年的郁豹豹寻亲成功。认亲不到半个月，郁豹豹与两个弟弟开始直播带货。不到两个月，三兄弟逐渐走向分崩离析。令他更无法接受的是，他与母亲也渐生隔阂。,https://3w.huanqiu.com/a/14459a/4K8FGmdmzMW?agt=20,,0,0,False
大选倒计时，7802万人已投票！49%比48%，特朗普在最关键“摇摆州”领先！防弹玻璃、铁丝网、钢板门、狙击手，美国多州加强安保,2024-11-05 00:03,1517,860,每日经济新闻,每日经济新闻,当地时间11月5日，美国大选将迎来投票日。根据美国佛罗里达大学选举实验室的数据，截至当地时间11月4日早上，全美已有超过7802万名选民就2024年总统大选进行了提前投票。,http://www.nbd.com.cn/rss/jinri_toutiao/articles/3631778.html,,0,0,False
别想回来！中国不是“捡破烂”的，日本混不下去，也休想回国捞金,2024-11-05 02:41,1754,144,八号探秘人,八号探秘人,“加入日本国籍，是我做过最正确的事，很荣幸成为日本人，为日本效力。”怎敢想，这番刺激国人神经的言辞，竟是出自一位日本国籍的东北人口中。,https://toutiao.com/group/7433591095541465626/,,0,0,False
中国国乒又火了！决胜时刻，领军人物疯狂逆转，上演最解气的一幕,2024-11-04 00:00,4560,521,乐播体育,乐播体育,,https://toutiao.com/group/7433056969079915020/,,0,0,True
他和6个老婆共处一室，每人每月7万零花钱，71岁又娶了20岁小娇妻,2024-10-03 03:25,1351,176,八号探秘人,八号探秘人,如果不是雷洪的这番操作，或许大家永远都不知道，现实中竟然真的有人和韦小宝一样，坐享三妻四妾之福，拥有七个老婆。,https://toutiao.com/group/7420736326078628392/,,0,0,False
今天凌晨，他们官宣离婚！网友：老粉真的天塌了,2024-11-05 04:32,1458,1779,环球网,环球网,今天凌晨，@影视飓风MediaStorm发文:“希望能给关注我们的朋友同步一个信息，我与小鱼@踢踢小鱼w 在前段时间选择结束婚姻关系，回归至朋友身份。,https://3w.huanqiu.com/a/b6960a/4K86kPRi1Js?agt=20,,0,0,False
530斤的大猪，8个人差点按不住，农村四哥刨猪汤安排上，气氛拉满,2024-11-05 22:30,383,200,农村四哥,农村四哥,530斤的大猪，8个人差点按不住，农村四哥刨猪汤安排上，气氛一下就来了,https://toutiao.com/group/7433778401791443475/,,0,0,True
首例5胞胎长大了，父亲已过劳去世 母亲直言：如能重来一个也不要,2024-08-31 03:06,1557,433,睿之悦,睿之悦,2002年，在北京的一家妇产医院中，一位来自河北的孕妇顺利生下了两男三女的五胞胎，创造了一个全国罕见的奇迹。,https://toutiao.com/group/7409098624111575603/,,0,0,False
特务男扮女装混进村子，孩子兵顿时发现不对劲，这下精彩了,2024-10-28 06:09,2493,241,乐视群星访谈秀,乐视群星访谈秀,,https://toutiao.com/group/7430704630294413878/,,0,0,True
11月5号上午，北京大街上看到的，这是干什么呢？,2024-11-05 02:06,1761,163,清风快乐游,清风快乐游,,https://toutiao.com/group/7433610775513694783/,,0,0,True
"万万没想到,53岁“丁克”半辈子的康辉，一生遗憾竟然是一通电话",2024-08-21 22:14,28675,5491,峰哥正读,峰哥正读,在阅读此文之前，麻烦您点击一下“关注”，既方便您进行讨论和分享，又能给您带来不一样的参与感，感谢您的支持！文/编辑：蘑菇百善孝为先。但是到底怎么做才算是“孝”，康辉用了半辈子才明白。央视知名主持人康辉，事业顺遂，家庭幸福，在外人看来是一个人生赢家。,https://toutiao.com/group/7405504703687115273/,,0,0,False
上海地铁一老人强势要求女孩让座，女孩表示身体不适，邻座男生：人家不想让就可以不让,2024-11-05 06:12,456,619,潇湘晨报•晨视频,潇湘晨报•晨视频,11月4日15时许，上海地铁9号线上，一名老人因强迫女孩让座双方发生争执。视频中，女孩表示“你一直欺负我一个女孩子干嘛”，老人则反驳“你不是小孩子你是大人了”。女孩：你欺负个小孩子干嘛了？老人：什么小孩子你是大人了。,http://api.chenshipin.com/wap/a/6729b45384201721a41dd322/90f456b81afce808c1fcfbd3f5761f65/1730787024/0bd05d1e5fecb1e3afee29ea0eb3d88ef4cadbb8530352ca62d414f233875174,,0,0,False
中国绝版老香烟，见过5种以上都是爷爷辈的，老烟民们抽过几种？,2024-08-20 08:54,753,129,万物知识局,万物知识局,文/万物知识局本文陈述所有内容皆有可靠信息来源，赘述在文章结尾在中国的历史长河中，烟草的传奇故事已历经四百载春秋。从明朝嘉靖年间葡萄牙使者带来的烟草，到如今琳琅满目的香烟品牌，烟草不仅见证了时代的变迁，也承载了无数人的记忆与情感。,https://toutiao.com/group/7405119584723927578/,,0,0,False
写歌30年穷困潦倒，前妻失望选择离婚，谁料51岁靠一首歌一夜成名,2024-08-12 03:37,26228,4348,八号探秘人,八号探秘人,在阅读此文之前，辛苦您点击一下“关注”，既方便您进行讨论和分享，又能给您带来不一样的参与感，感谢您的支持！编辑：LY无数人都想要一个一夜成名的机会，但机会来了也不是每个人都能把握住的。他用了三十年的时间来准备迎接属于自己的机会。为了这个机会他放弃了一切，甚至包括家庭。,https://toutiao.com/group/7402090890367484428/,,0,0,False
2架苏57来华，美专家直接嘲笑：俄上门丢人，和歼20一比差得太远,2024-11-05 08:20,328,187,东方点兵,东方点兵,俄罗斯两架苏57隐形战机来华参展，美专家发文嘲讽:上门丢人，比不过歼20，暴露太多尴尬信息。01.2架苏57来华，美专家阴阳怪气。,https://toutiao.com/group/7433704284820161065/,,0,0,False
立案调查！刘晓庆前男友报警,2024-11-05 06:16,1797,1104,大象新闻,大象新闻,因人身安全受到威胁，网曝刘晓庆前男友报警 ，此前曝出刘晓庆与其恋爱期间录音：留着对你是光荣，戳穿对你是耻辱。,https://share.hntv.tv/news/0/1853658276747567105,,0,0,False
河南尉氏县一女子一丝不挂走在大街上！目击者：看到的人很多，不知道什么原因,2024-11-05 10:26,893,355,江西都市现场,江西都市现场,5日下午1点40分，都市现场记者联系上了其中一位目击者宋先生，他告诉记者，3日中午12点左右，他在自家店里看到了这一幕，“我店在北街，我当时在店门口说话，一转头就看到了，没有人围观。好几条街，看到的人很多啊，她就是一丝不挂走在大街上，我们都不知道是什么原因。”,https://toutiao.com/group/7433716857066914354/,,0,0,False
小伙洗完澡故意秀肌肉，富婆心跳加速被当场拿下，这下好看了,2024-10-26 16:20,5354,231,乐视情感讲堂,乐视情感讲堂,小伙洗完澡故意秀肌肉，富婆心跳加速被当场拿下，这下好看了,https://toutiao.com/group/7430011217881596426/,,0,0,True
她曾被前夫一巴掌扇到离婚！二婚嫁世界冠军，如今生活幸福滋润,2024-09-10 09:12,15330,268,豆莱说,豆莱说,“漂亮的让人挪不开眼”是圈内人对她的评价，和“山杏”不一样的是，李琳在现实生活中的感情很是幸运，遇到了导演王小列。,https://toutiao.com/group/7412930201929204236/,,0,0,False
军号一响，全军出击！,2024-09-19 08:01,28846,1791,中国军号,中国军号,,https://toutiao.com/group/7416261401477382668/,,0,0,True
吃播网红恩克半年吃110只羊，眼神呆滞脸黑成炭，网友求他别吃了,2024-11-04 08:22,433,395,与君説,与君説,在阅读此文之前，麻烦您点击一下“关注”，既方便您进行讨论和分享，又能给您带来不一样的参与感，感谢您的支持文、编辑|是否古人估计都没想到后世子孙通过吃饭就能赚得盆满钵满。短视频的迅速崛起给人们带来了很多生财之道，吃播就是其中一个。,https://toutiao.com/group/7433333039997977107/,,0,0,False
母亲瘫痪、父亲疯了，当年那个744分的高考状元，7年后却成了这样,2024-09-08 00:54,7446,1227,八号探秘人,八号探秘人,母亲截肢瘫痪、父亲疯癫痴傻，可对于自己的亲人，他却做出了这样的评价。而今，7年已过，曾经那个让无数人动容的少年，现在如何?,https://toutiao.com/group/7411852147648496162/,,0,0,False
牺牲太大！神十八平安返航，3名航天员出舱却被抬着走、脸部浮肿,2024-11-05 07:08,552,101,鲸探所,鲸探所,11月4日凌晨，我们的宇航员又又又顺利出差归来了！看到返回舱落地的那一瞬间，估计很多人那不争气的眼泪就掉下来了。虽说现在去太空出差已经是非常频繁的一件事情了，但是看到宇航员出舱的状态时，还是不得不感叹一句，他们真的牺牲太大了。,https://toutiao.com/group/7433685318290686501/,,0,0,False
67岁执意生娃，如今却坐轮椅无法自理，5岁的天赐被迫独立学洗衣,2024-11-04 10:32,736,278,睿之悦,睿之悦,2019年，已经67岁的田新菊执意生下了自己的第三个孩子小天赐。那么，现如今5年的时间过去了，这“天赐”的礼物到底是福还是祸呢?,https://toutiao.com/group/7433367394946384435/,,0,0,False
又被全世界打脸，这是美国今年最耻辱的失败,2024-11-01 00:10,7590,1981,牛弹琴,牛弹琴,资料图又被全世界打脸，这是美国今年最耻辱的一次失败。之所以说“又”，很简单，以前每年都有过，结果也差不多。事实上，这也成了一年一次联合国大会，最后的保留曲目，全世界同声谴责美国，全世界一起看美国笑话。因为全世界投票，要求美国必须终止对古巴的经济、商业和金融封锁。,https://toutiao.com/group/7432095642685686291/,,0,0,False
