title,publish_time,like_count,comment_count,media_name,source,abstract,article_url,tag,is_yaowen,article_sub_type,has_video
四部门联合发布《人工智能生成合成内容标识办法》,2025-03-14 10:54,1461,179,光明网,光明网,近日，国家互联网信息办公室、工业和信息化部、公安部、国家广播电视总局联合发布《人工智能生成合成内容标识办法》，自2025年9月1日起施行。,https://m.gmw.cn/toutiao/2025-03/14/content_37907505.htm,,0,1,False
两会上，甄子丹发言如雷霆炸响引热议，难怪两会从不邀请流量明星,2025-03-10 06:36,5482,506,洲洲影视娱评,洲洲影视娱评,在光影交错的《叶问》中，甄子丹身着简约长衫。这位荧幕硬汉又摇身一变，以文化艺术界代表的身份。眼含热泪，用一番肺腑之言，再次震撼众人。,https://toutiao.com/group/7480054953755574819/,,0,0,False
CBA爆大冷，劲旅翻车，最新积分排名：七队被淘汰，广东让出前四,2025-03-14 14:10,556,132,库兹体育,库兹体育,北京时间3月14日CBA常规赛第40轮，新疆绝杀拒绝爆冷，重回前四;北京大获全胜，广东完败让出前四，劲旅浙江爆大冷不敌南京，下面就看看比赛简述。,https://toutiao.com/group/7481623946136142377/,,0,0,False
中俄伊北京会晤联合声明，来了！,2025-03-14 06:00,10660,4381,玉渊谭天,玉渊谭天,中华人民共和国、俄罗斯联邦与伊朗伊斯兰共和国北京会晤联合声明。2025年3月14日，中俄伊北京会晤成功举行。,https://toutiao.com/group/7481540866319614515/,,0,0,False
金秀贤之恶：他们只敢坑害穷人家的女儿,2025-03-14 05:26,950,326,Vista看天下,Vista看天下,金赛纶这种穷女孩相反，她们是肥肉入了虎狼窝，谁见了都想吃一口。金赛纶，女，2000年出生，2001年出道，2025年去世。,https://toutiao.com/group/7481531837018276390/,,0,0,False
“万恶的旧社会”，其实是这个样子！不要被电视剧骗了,2025-03-11 03:54,2454,884,摄影圣典,摄影圣典,通常来说，“旧社会”是指49年之前的社会，尤其是指晚清民国时期的中国。由于那个年代战乱不断，迷信盛行，贫穷饥饿很普遍，文盲率很高，生产力水平较低，所以“旧社会”整体上是比较落后的。,https://toutiao.com/group/7480394462271865379/,,0,0,False
