title,publish_time,like_count,comment_count,media_name,source,abstract,article_url,tag,is_yaowen,article_sub_type,has_video
联播观察｜强震来袭 生命至上,2025-01-10 22:59,887,334,国际在线,国际在线,“现在抗震救灾工作处在关键阶段，不能有丝毫松懈。”1月9日，习近平总书记主持召开中共中央政治局常务委员会会议，研究部署西藏定日抗震救灾工作。,https://news.cri.cn/toutiaopic/15d5fadb-371c-7f60-5d79-a684d15d916e.html,,0,0,False
习言道｜一支党和人民完全可以信赖的有坚强战斗力的队伍,2025-01-09 23:43,989,503,中国新闻网,中国新闻网,我国人民警察是一支党和人民完全可以信赖的有坚强战斗力的队伍，致敬人民警察！,https://www.chinanews.com.cn/gn/shipin/cns/2025/01-10/news1010231.shtml,,0,0,False
老纪和珅这段对话，以前小时候听不懂，如今听完受益终身,2024-12-28 23:16,7072,2018,乐视扒剧小妹儿,乐视扒剧小妹儿,,https://toutiao.com/group/7453420191947424293/,,0,0,True
尹锡悦的三个靠山没了，三道防线破了，第二次逮捕，他是在劫难逃,2025-01-11 05:29,8930,204,邱毅台湾,邱毅台湾,,https://toutiao.com/group/7458525776640475667/,,0,0,True
他的资历比朱德还老，授勋时却错失元帅，毛主席特批享受元帅待遇,2024-12-12 10:24,4300,157,品古观今,品古观今,在我军革命史上，有一位将军的资历比朱德还老，连毛主席都说:“共产党能对国民党将领说话的人不多，他就是其一。”可这样的人却在大授衔时，错失了元帅，后来经过毛主席的一番关心，才得以享受与元帅的同等待遇。,https://toutiao.com/group/7447468654758871592/,,0,0,False
海南富商张晖：花8亿建108米海上观音像，4年后死在水中死因成谜,2024-10-19 04:49,5496,957,八号探秘人,八号探秘人,在阅读此文之前，辛苦您点击一下“关注”，既方便您进行讨论和分享，又能给您带来不一样的参与感，感谢您的支持！编辑丨xk他是中国的一名富商，耗费8亿元完成了自己的梦想。可梦想落地成为现实的时候，他却在4年后莫名其妙的死去。他就是张晖，上个世纪末海南岛旅游业的龙头当家人。,https://toutiao.com/group/7427288913095492134/,,0,0,False
境外“电诈”亲历者讲述：长得没姿色的女子，最终的归宿是公海,2025-01-10 07:23,6154,2582,鲸探所,鲸探所,当时电影《孤注一掷》上映的时候，里面有很多场景让人感觉非常残酷，可实际上，这部电影的导演表示，能拍出来的电影尺度已经是非常克制的了，很多都是点到为止，真实情况比这还要黑暗、残酷百倍千倍。,https://toutiao.com/group/7458180288431899151/,,0,0,False
34岁雌雄同体的女性，具备男女两性器官，她该如何生存下去？,2024-10-17 03:32,6412,260,大象微视,大象微视,这个词在我们生活中并不常见，简而言之，双性人就是既拥有男性的生殖器官，也具备女性的特征的人。1989年，王梓淇出生在山西太原的一个家庭，她的家里经营着一家小生意，虽然谈不上富裕，但足够让一家人过得舒心自在。,https://toutiao.com/group/7426578550418948618/,,0,0,False
充电时，先插手机还是充电器？方法错误手机坏得快,2025-01-02 01:19,2712,189,人民日报,人民日报,手机电量还剩多少，对现代社会的许多人而言，都是一个“性命攸关”的问题。人们对手机充电的强烈需求，也让市面上催生出了许多噱头：无线充电，二倍速充电，以及能连着用一周的高能充电宝。乱花渐欲迷人眼，但到底什么才是手机充电的正确姿势呢？手机一定要满充满放吗？,https://www.peopleapp.com/column/30047895447-500006027199?utm_source=头条号&promote=true,,0,1,False
布林肯前脚刚离开，韩国就展开第二波逮捕尹锡悦行动，胜算如何？,2025-01-08 07:08,16103,444,邱毅台湾,邱毅台湾,,https://toutiao.com/group/7457438209384677938/,,0,0,True
平均3天造一枚核弹，近日美国公开了中国核弹头生产速度！,2025-01-06 10:09,6887,2058,军武次位面,军武次位面,前段时间，美国国防部发布的《2024中国军力报告》中提到，“中国的核弹头数量正在快速增长，从去年500枚增长到今年的600枚，并且预计2030年数量将达到1000枚。,https://toutiao.com/group/7456742462263001610/,,0,0,False
