title,publish_time,like_count,comment_count,media_name,source,abstract,article_url,tag,is_yaowen,article_sub_type,has_video
小伙洗完澡故意秀肌肉，富婆心跳加速被当场拿下，这下好看了,2024-10-26 16:20,3708,169,乐视情感讲堂,乐视情感讲堂,小伙洗完澡故意秀肌肉，富婆心跳加速被当场拿下，这下好看了,https://toutiao.com/group/7430011217881596426/,,0,0,True
善恶终有报：疫情时对中国一毛不拔，却大方捐美国6亿，如今咋样,2024-09-29 05:50,938,127,睿之悦,睿之悦,可就是这样一位在中国土生土长起来的富豪，在疫情期间面对同胞的困境却一毛不拔，反而大方的捐助了6亿给美国。,https://toutiao.com/group/7419859345154015798/,,0,0,False
罕见！100年前，英国游客拍下的清朝乡村，和想象中完全不一样,2024-09-20 02:07,3827,480,万物知识局,万物知识局,泥泞的土路，衣不蔽体的老百姓，即便是达官显贵的家中也十分破败，而这些都是清王朝的历史痕迹，虽说那时候中国摄影技术并不发达，但也有许多外国游客来到这里，拍摄下了许多老照片，为我们留下了珍贵的历史资料，那清朝到底是怎样的面貌呢?,https://toutiao.com/group/7416287738871267855/,,0,0,False
3年前，宁夏7岁小女孩一笑走红，后拒百万签约，如今怎么样了？他们后悔了吗？,2024-09-19 07:25,6925,1071,睿之悦,睿之悦,2021年，视频镜头中出现的女孩儿用那一抹甜美的笑容，迅速引起了网友们的广泛关注。有媒体公司看到这一机遇，提出愿意用百万巨资与女孩儿签约，然而，女孩儿的父母却坚决拒绝了这一提议。,https://toutiao.com/group/7416250139544879679/,,0,0,False
给近三年最好的10部年代剧排个名：《人世间》第6，第1名没有争议,2024-09-06 08:08,9813,3246,皮皮电影,皮皮电影,时尚是个轮回，电视剧也是。在2020年之前的那些年，电视剧市场基本上都被偶像剧、都市剧霸占。曾经撑起国剧品质的《闯关东》《岁月》这类年代好剧，难见踪影。,https://toutiao.com/group/7411390030722712090/,,0,0,False
中国绝版老香烟，见过5种以上都是爷爷辈的，老烟民们抽过几种？,2024-08-20 08:54,656,122,万物知识局,万物知识局,文/万物知识局本文陈述所有内容皆有可靠信息来源，赘述在文章结尾在中国的历史长河中，烟草的传奇故事已历经四百载春秋。从明朝嘉靖年间葡萄牙使者带来的烟草，到如今琳琅满目的香烟品牌，烟草不仅见证了时代的变迁，也承载了无数人的记忆与情感。,https://toutiao.com/group/7405119584723927578/,,0,0,False
河南新乡通报  “辉县市一男子投资千万建厂遭遇办证难”：情况基本属实，开展现场核查,2024-10-31 23:32,3103,7709,环球网,环球网,来源：新乡日报 新乡市市场监督管理局情况通报2024年10月31日，媒体报道“辉县市一男子投资千万建厂遭遇办证难，状告市监局胜诉后仍未拿到证”后，新乡市市场监管局立即组成工作专班开展调查处置工作。,https://3w.huanqiu.com/a/17e74a/4K4caNoNprT?agt=20,,0,0,False
池塘抽完水惊现一台三轮车，凑前一看惊了，车里竟还有人,2024-10-31 05:35,4386,411,乐视综艺咖,乐视综艺咖,,https://toutiao.com/group/7431809267708985895/,,0,0,True
南京大屠杀再添新证！“几乎未出现过”的照片曝光,2024-11-01 01:14,478,264,济南时报-新黄河,济南时报-新黄河,记者近日注意到，日本都留文科大学名誉教授笠原十九司在2024年第三期《日本侵华南京大屠杀研究》上发表论文《史料发掘：南京大屠杀的现场与照片——基于一个日军炮兵的阵中日记和回想录》。论文由侵华日军南京大屠杀遇难同胞纪念馆馆员芦鹏翻译。,http://www.hzfanews.com/detail.html?id=D000180BE98B7E131040E0F72AE3D11B1C9DA52732C4A474,,0,0,False
把三个女儿弄去坐牢后，蓝翔校长再送原配入狱，这次被“反杀”了,2024-10-25 00:51,1300,452,客观听書,客观听書,荣兰翔作为蓝翔学校的校长，本应该是人生赢家，却没想到和妻子已经到了反目成仇的地步。她举报丈夫曾经存在巨额的偷税漏税行为，并且长年家暴，甚至在外还有私生子，这则消息一经公布瞬间引发了不小的轰动。,https://toutiao.com/group/7429243688062124563/,,0,0,False
民间上坟传统：“上坟不带 5 果，家中不惹灾祸”，哪“5果”？,2024-08-08 10:30,18970,1820,惠农圈,惠农圈,在中国传统文化中，祭祀祖先一直是一项备受重视的活动，它承载着对先人的缅怀、敬意和感恩之情。在上坟的时候，人们会提前准备好供品，比如肉类、酒水，还有水果。其中关于水果的准备，也有着诸多的讲究和禁忌，比如“上坟不带 5 果，家中不惹灾祸”的说法。,https://toutiao.com/group/7400584207141192207/,,0,0,False
人贩子余华英的眼神有多恐怖？被抓前一天穿粉外套，戴金项链逛街,2024-10-28 11:55,641,268,鲸探所,鲸探所,“她当时一定在想，当年怎么没有弄死我。”10月25日，余华英拐卖儿童发回重审案一审宣判：余华英以拐卖儿童罪被判处死刑，剥夺政治权利终身，并且没收个人全部财产。当这个宣判出来之后，杨妞花的眼泪就流了出来，这个结果，她等的实在是太久了。,https://toutiao.com/group/7430789956693541387/,,0,0,False
5年前站在美国军舰上，用中文警告我国海军的华人女兵，现在如何,2024-10-08 09:57,701,144,睿之悦,睿之悦,2019年，身为华裔女兵的郑浩儿站在一艘美国军舰上，用着一口标准的中文喊话中国海军。事件一出便令无数国人都感到十分的愤慨，很多人也将她和“卖国贼”联系在一起。,https://toutiao.com/group/7423340415275581952/,,0,0,False
郎平咋整成这样了？从铁榔头到整容狂魔，医美失败的她令人唏嘘！,2024-10-26 10:44,298,196,不似少溓游,不似少溓游,中国女排的实力，在世界范围内都有目共睹。多年以来她们取得过无数傲人的成绩，凝结出了激励着几代人的女排精神。,https://toutiao.com/group/7430023446429581843/,,0,0,False
51年洪学智妻子寻女无果，到老乡家歇脚老乡惊呼：你要找得就是我,2024-09-22 01:07,10886,768,品古观今,品古观今,前言1951年，阳曲县委大院突然来了7、8位解放军同志，其中一位女同志，就是洪学智的妻子张文。她此番前来，就是为了寻找多年前因战乱而寄养于民间的爱女。可昔日的小村落早已蜕变成另一番景象，这无异于是大海捞针。,https://toutiao.com/group/7417034363226915354/,,0,0,False
今天才知道！电动车“每天充”和“用完再充”，到底哪个更伤电池,2024-08-27 11:19,14444,2288,鲸探所,鲸探所,“今天到底给车充不充电？”估计大多数人每天回家都会想这个问题，看着自己的电动车电量又多又少的，充不充电也是一件非常难以抉择的事情。那么，电动车到底应该怎样充电呢？是每天都充，还是用完之后再充呢？电动车充电不管是在城市还是农村，电动车其实都是人们出门最常见的交通工具。,https://toutiao.com/group/7407773012533117475/,,0,0,False
1米3袖珍美女嫁给1米48男孩，婚后丈夫奇迹长高，两人却不欢而散,2024-09-07 02:55,1819,111,睿之悦,睿之悦,杨萍和葛存苗的婚礼 文|睿之悦 编辑|睿之悦2019年，成都的民政局来了两个“10岁小孩”来登记，工作人员以为是玩闹。两个“小孩”拿出身份证让工作人员看，这才明白，原来是两个再也长不高的成年袖珍人情侣。,https://toutiao.com/group/7411713833267364386/,,0,0,False
贪污上亿、侵吞善款，韩红被实名举报，4年了，有人给她道歉吗？,2024-10-19 07:24,2999,285,昕昕局,昕昕局,2020年初，新冠疫情肆虐，武汉告急，全国上下万众一心，与时间赛跑，与病魔较量，就在这场没有硝烟的战争中，一个熟悉的身影出现在抗疫一线，她带着物资，带着希望，奔赴在最危险的地方，她就是韩红。,https://toutiao.com/group/7427383862491120179/,,0,0,False
有人冒充我男朋友，算不算诈骗？遇到奇葩事你会怎么办？,2024-09-06 05:52,1764,226,兴凯湖莹莹,兴凯湖莹莹,,https://toutiao.com/group/7411404025502892554/,,0,0,True
写歌30年穷困潦倒，前妻失望选择离婚，谁料51岁靠一首歌一夜成名,2024-08-12 03:37,26215,4343,八号探秘人,八号探秘人,在阅读此文之前，辛苦您点击一下“关注”，既方便您进行讨论和分享，又能给您带来不一样的参与感，感谢您的支持！编辑：LY无数人都想要一个一夜成名的机会，但机会来了也不是每个人都能把握住的。他用了三十年的时间来准备迎接属于自己的机会。为了这个机会他放弃了一切，甚至包括家庭。,https://toutiao.com/group/7402090890367484428/,,0,0,False
