title,publish_time,like_count,comment_count,media_name,source,abstract,article_url,tag,is_yaowen,article_sub_type,has_video
俩人相亲互相看不上，哪料男方一报母亲身份，姑娘乐了,2024-11-08 01:50,9911,2259,乐视群星访谈秀,乐视群星访谈秀,,https://toutiao.com/group/7434719902990074395/,,0,0,True
被姚明抱着上奥运的小英雄，曾发誓考上清华，16年后活成了这样,2024-11-07 08:07,2630,623,睿之悦,睿之悦,2008年，年仅9岁的林浩，在姚明的带领下走进了北京奥运会开幕式的舞台上，成为了万众瞩目的“焦点”。,https://toutiao.com/group/7434444094551687707/,,0,0,False
拜登挖坑摆烂，特朗普眼前困难重重荆棘满布，各国向中国靠拢避险,2024-11-22 08:15,15625,195,邱毅台湾,邱毅台湾,,https://toutiao.com/group/7440014294332211727/,,0,0,True
俩月换了4家医院？！患者单次住院天数限制“潜规则”调查,2024-11-21 23:42,605,845,上观新闻,上观新闻,近两个月，北京居民陈西奔波于4家医院之间，只为给父亲办理住院、出院手续。 陈西的父亲年过七旬，此前患有糖尿病、帕金森等疾病，今年又确诊了阿尔茨海默病，处于卧床半失能状态。,https://export.shobserver.com/toutiao/html/821654.html,,0,1,False
男子投诉环保问题被打断肋骨，经过区、镇干部协调和解后获赔300万元，一年后被判寻衅滋事追缴违法所得,2024-11-22 14:04,11805,7125,大风新闻,大风新闻,持续向上级投诉山东重山集团有限公司环保问题多年的王长征，在2021年6月23日与重山集团保安人员的冲突中被打致局部脑损伤、头部及全身多处软组织损伤、颈部损伤、多根肋骨骨折。,https://toutiao.com/group/7440095550873027106/,,0,0,False
男子实名举报县委副书记婚内出轨自己老婆，聊天截图被曝光,2024-11-22 14:45,1183,361,大皖新闻,大皖新闻,11月19日，湖南长沙的程先生在社交平台，手持身份证实名举报海南省陵水黎族自治县县委副书记兼政法委书记肖某，破坏其家庭，长期与其爱人保持不正当关系。并晒出多张妻子和肖某的露骨聊天截图，聊天内容十分暧昧。,http://www.ahwang.cn/toutiao/202411/2777644.html,,0,1,False
我见过最令人讨厌的说话方式：习惯性反问,2024-11-08 13:29,4009,2214,洞见,洞见,微博上曾有一个讨论：说话时，最令人反感的语气是什么？毫无悬念排在第一的是，反问语气。心理学上也说，反问是攻击性最强，最容易伤害、得罪人的语气。为什么反问语气如此伤人呢？因为它通常包含着两层意思：否定+贬低。一句带有情绪的反问，言下之意是：你不仅错了，还很无知和愚蠢。,https://toutiao.com/group/7434898736435823138/,,0,0,False
浙大一贫困生晒国内外多地旅游照引热议 该生家乡民政局回应：贫困证明没问题,2024-11-22 09:44,430,1104,封面新闻,封面新闻,封面新闻记者 陈彦霏近日，浙江大学一贫困生，在朋友圈晒出国内外多地旅游的照片，引发网友关注和热议。,https://m.thecover.cn/news_details.html?from=web&eid=x4D1hlFuojSH90qSdq8Jkw==,,0,0,False
弟弟光荣退伍，姐姐兴奋去车站接他，怎料一见弟弟瞬间哭了,2024-11-05 06:34,23286,2610,乐视天天剧好看,乐视天天剧好看,,https://toutiao.com/group/7433679820573934091/,,0,0,True
特务男扮女装混进村子，孩子兵顿时发现不对劲，这下精彩了,2024-10-28 06:09,5309,548,乐视群星访谈秀,乐视群星访谈秀,,https://toutiao.com/group/7430704630294413878/,,0,0,True
特朗普时代，中日合作机遇显现？俄乌对峙升级，明年有重大拐点,2024-11-20 10:52,14386,916,邱震海,邱震海,,https://toutiao.com/group/7439312593905025562/,,0,0,True
炒白菜千万不要直接下锅，难怪不好吃，教你技巧，鲜嫩入味不出水,2024-10-30 09:23,10916,605,家常的味道,家常的味道,,https://toutiao.com/group/7431496869400576550/,,0,0,True
太美了！徐枫灿私服照片曝光，简直美的不可方物，网友：原地出道,2024-11-20 10:02,815,216,稻述,稻述,自从11月初再次亮相珠海航展后，女飞行员徐枫灿成为了无数人心中的梦中情人。虽身材高挑，样貌出众，笑容甜美，但这些，其实都是她最不值得一提的优点!,https://toutiao.com/group/7439290351493464628/,,0,0,False
“读研被亲姑姑在家庭群教育”上热搜：手伸太长的亲戚，有多招人烦？,2024-11-21 09:14,892,1987,读者,读者,前两天看到个热搜：读研被亲姑姑在家庭群里教育了。帖主在美国留学，目前是大四的本科生，正在努力申请读研，却遭到了亲姑姑的坚决反对。从群里的聊天记录来看，姑姑反对的理由是，帖主出国留学读本科已经花费太多，按惯例本科毕业就不该再跟父母要钱，现在还要继续读研，无异于啃老。,https://toutiao.com/group/7439646564940890663/,,0,0,False
极为罕见！大连渔民吃海螺时，竟然吃出……,2024-11-22 13:37,835,311,环球网,环球网,来源：半岛晨报 老渔民在船上吃海螺时，一口咬下去，牙差点被硌坏，原来海螺里竟然藏了一颗直径5毫米左右的珠子，“我打了20多年鱼，从没听说谁在海螺里发现过珠子。”专家表示，海螺珠极为罕见，目前无法人工培植。,https://3w.huanqiu.com/a/b4164a/4KMWnsnQCQS?agt=20,,0,0,False
原来他才是毁掉刘翔真凶，因贪1200万被公审，让刘翔背负多年骂名,2024-08-29 09:58,15241,463,八号探秘人,八号探秘人,在田径场上创造的成绩，至今无人能够打破，甚至在国际上享有盛名。本该继续夺冠之路，却两次因伤退赛，遭到了全网辱骂。,https://toutiao.com/group/7408489498465616410/,,0,0,False
67岁执意生娃，如今却坐轮椅无法自理，5岁的天赐被迫独立学洗衣,2024-11-04 10:32,5060,1253,睿之悦,睿之悦,2019年，已经67岁的田新菊执意生下了自己的第三个孩子小天赐。那么，现如今5年的时间过去了，这“天赐”的礼物到底是福还是祸呢?,https://toutiao.com/group/7433367394946384435/,,0,0,False
包厢全是刚出狱的恶霸，结果一看到饭店主厨，立马怂了,2024-11-11 01:21,7585,160,乐视群星访谈秀,乐视群星访谈秀,,https://toutiao.com/group/7435825833048015400/,,0,0,True
罕见！100年前，英国游客拍下的清朝乡村，和想象中完全不一样,2024-09-20 02:07,7196,674,万物知识局,万物知识局,泥泞的土路，衣不蔽体的老百姓，即便是达官显贵的家中也十分破败，而这些都是清王朝的历史痕迹，虽说那时候中国摄影技术并不发达，但也有许多外国游客来到这里，拍摄下了许多老照片，为我们留下了珍贵的历史资料，那清朝到底是怎样的面貌呢?,https://toutiao.com/group/7416287738871267855/,,0,0,False
53岁百万粉丝网红“湘妹子”因胃癌去世，确诊不到2年，家属发文：我没有妈妈了，感谢帮助过的所有人,2024-11-23 04:48,392,315,九派新闻,九派新闻,据四川观察报道，11月22日，百万粉丝抗癌网红“努力坚强的湘妹子-阿妹”因胃癌去世，确诊不到两年瘦成皮包骨。22日，其家属发文称，“各位叔叔阿姨们，从今天开始我没有妈妈了！（她）于今天下午过世，在此感谢一直以来支持和帮助过我妈妈的叔叔阿姨哥哥姐姐们！,https://toutiao.com/group/7440326713525289506/,,0,0,False
风水：梁朝伟给富婆看风水，这服务必须到位，这段太精彩了,2024-11-19 01:57,5710,928,南瓜钟意你,南瓜钟意你,风水：梁朝伟给富婆看风水，这服务必须到位，这段太精彩了,https://toutiao.com/group/7438803799575102003/,,0,0,True
河南女子去世，山东丈夫将手机埋墓里，充1000元话费，每天打电话,2024-11-01 06:52,3015,2785,何止电影,何止电影,2014年11月17日，河南肿瘤医院的病房中举行着一场特殊的婚礼，主角是于海宁跟他的患有癌症的妻子范会香。在几个月前范会香确诊癌症，跟男友提出分手，于海宁不远万里来到了女友的城市，照顾患癌女友。得知女友时日无多，在病房中跟女友求婚，在病房中举办了婚礼，婚后一年，范会香去世。,https://toutiao.com/group/7432199981609534004/,,0,0,False
59岁央视主持张越现状：鼻孔外翻身形暴瘦，与土狗为伴，不敢认,2024-11-22 05:22,1895,589,何止电影,何止电影,胖了一辈子的央视主持人张越，现在却身形消瘦，与一条小土狗为伴，过着孤独的生活！59岁的她，怎么把自己的人生过成这样了？张越曾是央视台里最有才华的女主持人，也是央视台里公认的“最胖女主持”，但她却凭借着自己的实力，一步步地登上各大栏目，成为大家喜爱的央视女主持。,https://toutiao.com/group/7439969658100400680/,,0,0,False
