title,publish_time,like_count,comment_count,media_name,source,abstract,article_url,tag,is_yaowen,article_sub_type,has_video
时政微纪录丨共和国·丰碑,2024-09-30 08:54,1247,167,央视新闻,央视新闻,庆祝中华人民共和国75周年华诞系列活动 紧密相连大国典礼 再谱新篇9月30日烈士纪念日向人民英雄敬献花篮仪式隆重举行最美的鲜花 最深的思念 最高的敬意献给为国牺牲的英雄烈士献给共和国的精神脊梁系列微纪录片第二集《共和国·丰碑》丰碑铸国魂向人民英雄致敬相关阅读第一集：时政微纪录丨共,https://content-static.cctvnews.cctv.com/snow-book/index.html?item_id=8069784926666472854&source=50006&sub_source=50006_001,,0,0,False
全球约一半肝癌在中国，再次提醒：家中的4种食物，尽早撤下餐桌,2024-08-13 08:36,94233,3527,梁医学社梁怡璋医生,梁医学社梁怡璋医生,,https://toutiao.com/group/7402540119712629311/,,0,0,True
网红郭有才，泡沫散去之后，曾经飘的有多高，如今摔得就有多惨,2024-09-30 09:36,350,189,八号探秘人,八号探秘人,曾经那个卖烧烤的店小二，可能怎么都想不到，自己会成为一个千万粉丝的网红。郭有才在刚成为网红之后的期望也很有意思，那就是每天能赚到300元就行。可现实却是靠着直播广告分成，他的收入直接比期望值翻了上千倍。有人说他其貌不扬，但是平凡人逆袭的典范，还有的人说他长的像日本人。,https://toutiao.com/group/7419978325617082932/,,0,0,False
2013年，湖南26岁女孩嫁给71岁老头，婚后还生下一子，如今怎样了,2024-07-12 11:59,25362,2365,智史通鉴,智史通鉴,2013年4月17日，长沙宁乡县的民政局迎来了一对特殊的夫妻。一个71岁的老头和一个26岁的女孩，离远了看，甚至像爷爷和孙女。面对工作人员异样的眼光，女孩说：“我和他是真心相爱的！”这让人好奇，这对相差45岁的夫妻，他们之间到底有着怎样的爱情故事？,https://toutiao.com/group/7390696631223534120/,,0,0,False
中国国乒又火了！决胜时刻，领军人物疯狂逆转，上演最解气的一幕,2024-09-29 06:49,3441,343,乐播体育,乐播体育,,https://toutiao.com/group/7419953587779797515/,,0,0,True
男子与女子在河中嬉戏玩耍，突然连续将女子的头按入水中,2024-09-26 04:40,935,151,经视看天下,经视看天下,,https://toutiao.com/group/7418807108637819444/,,0,0,True
文章：出轨是我的错，今生最对不起三个女人，与马伊琍仍然是家人,2024-07-14 11:00,1407,154,八号探秘人,八号探秘人,本文叙述皆有官方信源，为了读者有更好体验，放在了文章后缀!“这个世界上没人比我更爱马伊琍。”如今再看这句话，只觉得好笑又嘲讽。,https://toutiao.com/group/7391289394180850212/,,0,0,False
姑娘远嫁山东十年未回家，带着孩子偷偷回娘家，到家眼前一幕哭了,2024-09-09 08:25,25827,10937,小乔远嫁在北方,小乔远嫁在北方,,https://toutiao.com/group/7412556561718968870/,,0,0,True
人活多久，看吃饭就知道？寿命长的人，吃饭一般有这4个特征！,2024-09-23 11:03,1369,180,第一国学,第一国学,人活多久，看吃饭就知道？寿命长的人，吃饭一般有这4个特征！,https://toutiao.com/group/7417792528012804648/,,0,0,True
有人冒充我男朋友，算不算诈骗？遇到奇葩事你会怎么办？,2024-09-06 05:52,1638,215,兴凯湖莹莹,兴凯湖莹莹,,https://toutiao.com/group/7411404025502892554/,,0,0,True
在两性关系中，女性最多能接受多少岁的男人，3位女人说出心里话,2024-07-25 23:38,27387,8569,玲儿说说,玲儿说说,,https://toutiao.com/group/7395721886363025920/,,0,0,True
"万万没想到,53岁“丁克”半辈子的康辉，一生遗憾竟然是一通电话",2024-08-21 22:14,23291,4704,峰哥正读,峰哥正读,在阅读此文之前，麻烦您点击一下“关注”，既方便您进行讨论和分享，又能给您带来不一样的参与感，感谢您的支持！文/编辑：蘑菇百善孝为先。但是到底怎么做才算是“孝”，康辉用了半辈子才明白。央视知名主持人康辉，事业顺遂，家庭幸福，在外人看来是一个人生赢家。,https://toutiao.com/group/7405504703687115273/,,0,0,False
表面是艺人，实际是富家千金的5位女星，无人敢惹更别说潜规则了,2024-08-28 02:06,8159,658,八号探秘人,八号探秘人,在德云班主郭德纲的作品中，有过这么一句话。虽说此言尤为刺耳，但话糙理不糙。当今娱乐圈，很多女星为出人头地，自愿或被迫做出违反道德底线之事。,https://toutiao.com/group/7407984985224872459/,,0,0,False
女房东来收租，钱没收到还把自己搭进去，小伙太牛了.,2024-09-25 07:33,2446,427,智者安斯蒂斯1I2r,智者安斯蒂斯1I2r,女房东来收租，钱没收到还把自己搭进去，小伙太牛了.,https://toutiao.com/group/7418480468489667107/,,0,0,True
5座车拉6个人被判超员，车主1句话把交警问懵,2024-08-05 20:20,15634,3725,奇妙钢笔pA8JyP,奇妙钢笔pA8JyP,,https://toutiao.com/group/7399752843772559906/,,0,0,True
炖排骨时，切记不要焯水和直接下锅，教你一招，鲜嫩多汁不腥不柴,2024-07-05 23:47,25211,1692,阿尔瓦美食,阿尔瓦美食,,https://toutiao.com/group/7386593382446924288/,,0,0,True
外媒惊叹：买疯了，中国用一颗价值几亿的洲际导弹向外资发出邀约,2024-09-30 02:24,1913,125,8卦娱,8卦娱,北京时间9月25日，我国火箭军向太平洋海域成功发射了一枚洲际弹道导弹，射程达12000公里，引发了世界的巨大轰动。,https://toutiao.com/group/7420255564011192832/,,0,0,False
今天才知道！电动车“每天充”和“用完再充”，到底哪个更伤电池,2024-08-27 11:19,7191,1497,鲸探所,鲸探所,“今天到底给车充不充电？”估计大多数人每天回家都会想这个问题，看着自己的电动车电量又多又少的，充不充电也是一件非常难以抉择的事情。那么，电动车到底应该怎样充电呢？是每天都充，还是用完之后再充呢？电动车充电不管是在城市还是农村，电动车其实都是人们出门最常见的交通工具。,https://toutiao.com/group/7407773012533117475/,,0,0,False
毁了王治郅，逼姚明退役，他凭一己之力让中国篮球倒退了二十年!,2024-08-07 19:45,810,308,吃瓜崽崽,吃瓜崽崽,在阅读此文之前，辛苦您点击一下“关注”，既方便您进行讨论和分享，又能给您带来不一样的参与感，感谢您的支持！本文叙述皆有官方信源，为了给读者更好体验，放在了文章后缀！文 锦青一个人有可能影响中国的篮球事业发展吗？真的可能，至少信兰成做到了。,https://toutiao.com/group/7400359671892148788/,,0,0,False
美国这把“考”砸了！中国试射洲际弹道导弹，美侦察机却跑错方向,2024-09-28 12:55,1622,221,书房点兵,书房点兵,在我们这次东风-31AG洲际弹道导弹的全射程验证试射过程中，有一个比较反常的现象，那就是一向消息灵通的美军，虽然派出了专门进行弹道导弹侦察的RC-135S“眼镜蛇球”的战略侦察机，但是它所处的位置却是在东海附近徘徊，从琉球起飞以后，美军这架侦察机在东海附近进行了长时间的巡弋。,https://toutiao.com/group/7419676574180246050/,,0,0,False
为国争光却遭郎平弃用！转身效力土耳其的王一梅，如今咋样了？,2024-08-31 13:19,931,135,豆莱说,豆莱说,光阴似箭，日月如梭，当初的少女早已退役，成为了排球场的幕后人，这么多年她都经历了什么，现在又怎么样了呢?,https://toutiao.com/group/7409287778514567718/,,0,0,False
