title,publish_time,like_count,comment_count,media_name,source,abstract,article_url,tag,is_yaowen,article_sub_type,has_video
联播观察｜强震来袭 生命至上,2025-01-10 22:59,1938,699,国际在线,国际在线,“现在抗震救灾工作处在关键阶段，不能有丝毫松懈。”1月9日，习近平总书记主持召开中共中央政治局常务委员会会议，研究部署西藏定日抗震救灾工作。,https://news.cri.cn/toutiaopic/15d5fadb-371c-7f60-5d79-a684d15d916e.html,,0,0,False
习言道｜一支党和人民完全可以信赖的有坚强战斗力的队伍,2025-01-09 23:43,1279,687,中国新闻网,中国新闻网,我国人民警察是一支党和人民完全可以信赖的有坚强战斗力的队伍，致敬人民警察！,https://www.chinanews.com.cn/gn/shipin/cns/2025/01-10/news1010231.shtml,,0,0,False
把8斤黄鳝放在水池里养，一年后放干水看长多大了，是赔还是赚？,2024-11-20 16:24,14048,3313,幺妹儿,幺妹儿,,https://toutiao.com/group/7439398131826950691/,,0,0,True
尹锡悦的三个靠山没了，三道防线破了，第二次逮捕，他是在劫难逃,2025-01-11 05:29,10911,253,邱毅台湾,邱毅台湾,,https://toutiao.com/group/7458525776640475667/,,0,0,True
女子接到可疑电话全程录音:一句话让对方“破防” 把骗子气到大叫,2025-01-09 13:48,4257,777,海客新闻,海客新闻,女子接到可疑电话全程录音：一句话让对方“破防” 把骗子气到大叫,https://toutiao.com/group/7457911574020325900/,,0,0,True
夫妇因征地纠纷被羁押600多天后检方撤诉 获国家赔偿80多万难到位；山东胶州相关部门：财政状况致未及时支付,2025-01-09 08:00,1944,1324,大风新闻,大风新闻,“财政啥时候才能挤出这笔赔偿款？我在维权中曾经受过伤，身体也不好，还等着钱治病呢！”孙女士焦急地说。在当地检察院和法院均已做出刑事赔偿决定数月之后，山东省胶州市的黄先生、孙女士夫妇二人却未能拿到赔偿款。,https://toutiao.com/group/7457818567929512475/,,0,0,False
饺子皮别一个一个手擀了，教你只用一个塑料瓶，1分钟能做60个,2024-11-03 11:19,15457,1854,日常菜谱,日常菜谱,,https://toutiao.com/group/7400831741503472178/,,0,0,True
河北牛肉变价太吓人，看1月11日大集多少钱一斤？大吃一惊,2025-01-11 03:59,476,108,高级香瓜5,高级香瓜5,,https://toutiao.com/group/7458502523096138252/,,0,0,True
查封资产逾十亿的河北迁安企业家涉黑案已一审宣判,2025-01-11 08:43,322,138,第一财经,第一财经,近日，河北省石家庄市鹿泉区人民法院对广受关注的杨立国等20人涉黑案进行一审宣判。,https://m.yicai.com/news/102437580.html,,0,0,False
吉林美女带俩娃，嫁给头婚小叔子，婆婆一手撮合，如今过得怎样了,2024-11-01 08:01,6270,1505,睿之悦,睿之悦,说出来可能很多人都不相信，吉林一位带着两个孩子的美女在婆婆的大力撮合下嫁给了自己的小叔子。2020年，这位女子的丈夫因为意外去世，留下了她们孤儿寡母悲痛欲绝。,https://toutiao.com/group/7432216069030363682/,,0,0,False
