title,publish_time,like_count,comment_count,media_name,source,abstract,article_url,tag,is_yaowen,article_sub_type,has_video
特朗普时代，中日合作机遇显现？俄乌对峙升级，明年有重大拐点,2024-11-20 10:52,8833,150,邱震海,邱震海,,https://toutiao.com/group/7439312593905025562/,,0,0,True
国乒一日五败，福冈总决赛遭遇噩梦开局,2024-11-20 14:01,626,1006,澎湃新闻,澎湃新闻,11月20日，乒乓球WTT福冈总决赛中，中国乒乓球男队遭遇噩梦般的一天。先是在男双1/4决赛中，世界第一袁励岑/向鹏不敌新加坡组合冯耀恩/郭勇，随后林高远和梁靖崑双双经历一轮游，分别不敌斯洛文尼亚选手约奇克和张本智和。,https://m.thepaper.cn/newsDetail_forward_29405956?from=toutiao,,0,0,False
黑龙江发布人虎冲突防范公告：从事采菜等弯腰劳作时，脑后可以戴个假面具，正面与虎遭遇不要转身快跑,2024-11-20 08:23,759,1606,大河报,大河报,11月18日，黑龙江省七台河市勃利县一名村民被被老虎咬伤，这是当地有县志记载以来首次发现东北虎的踪迹，引起社会广泛关注。,https://toutiao.com/group/7439273808328819211/,,0,0,False
警方辟谣“成都街头一醉酒男欺负卖花母子”，记者调查还原现场：男子花一百元买花，本意是教育孩子孝顺母亲,2024-11-19 16:05,365,468,红星新闻,红星新闻,“成都街头一醉酒男欺负卖花母子，小男子汉想反抗被紧紧抱住……”近日，一段在成都兰桂坊的视频被网友拍下，画面中，一名黑衣男子正拉着一名疑似醉酒的白衣男子，白衣男子不停地把手上的物品丢到地下踩踏。一旁还坐着一位卖花女子，她怀中的小男孩不停呼喊。,https://cdsbrss.cdsb.com/toutiao_no_video.php?url=https%3A%2F%2Fstatic.cdsb.com%2Fmicropub%2FArticles%2F202411%2Fd8c94d795b6d8ba00ccb1d517f15fe8a.html,,0,0,False
美妇约见老情人，见面场景真是太逗了，这俩人绝配！,2024-10-27 16:25,3916,510,乐视明星的那点事,乐视明星的那点事,美妇约见老情人，见面场景真是太逗了，这俩人绝配！,https://toutiao.com/group/7428157095108674088/,,0,0,True
日本展出最新型激光武器，不比不知道，一比吓一跳,2024-11-19 12:12,18996,1493,陈虎点兵,陈虎点兵,,https://toutiao.com/group/7438962223550857768/,,0,0,True
甘肃一高三女生醉酒后被强奸致死？当地检察院：是有此案,2024-11-20 13:50,941,726,大皖新闻,大皖新闻,近日，有网友在短视频平台发布视频称，今年2月自己正在读高三的女儿，在晚自习期间被女同学带出去和社会上的男子喝酒，女儿被多名男子灌醉后，被其中的两名20岁左右的男子强奸致死。,http://www.ahwang.cn/toutiao/202411/2776330.html,,0,1,False
罕见！100年前，英国游客拍下的清朝乡村，和想象中完全不一样,2024-09-20 02:07,6931,669,万物知识局,万物知识局,泥泞的土路，衣不蔽体的老百姓，即便是达官显贵的家中也十分破败，而这些都是清王朝的历史痕迹，虽说那时候中国摄影技术并不发达，但也有许多外国游客来到这里，拍摄下了许多老照片，为我们留下了珍贵的历史资料，那清朝到底是怎样的面貌呢?,https://toutiao.com/group/7416287738871267855/,,0,0,False
贵州一男子失踪十八年：在山西流浪时被好心人发现报警，自称在砖厂干活多年,2024-11-20 07:23,963,790,极目新闻,极目新闻,极目新闻记者 邓波赵啟超失踪了十八年。女儿赵秋梅只记得父亲2006年说要出去打工挣钱买摩托车，但此后就消失不见，家人多方寻找，均无果。2024年11月15日，一家人接到了来自山西长治的电话，称在山西省长治市长子县发现了流浪的赵啟超。,http://jms.ctdsb.net/jmythshare/#/index_share?cId=0&contentType=5&contentId=2308962,,0,0,False
痛心！她走了，年仅29岁，挣扎写下“不甘心”！这种病被称作“沉默的杀手”…,2024-11-20 08:26,638,110,新黄河,新黄河,11月20日，据四川观察报道，19日，29岁抗癌博主“一只羊吖”因肾癌去世，从确诊到离世不到两年，生命最后时刻，挣扎写下“不甘心”。,http://www.hzfanews.com/detail.html?id=4BD0B6E795A67EC3E66B1027285C474A456C088403FFFC25,,0,0,False
俩人相亲互相看不上，哪料男方一报母亲身份，姑娘乐了,2024-11-08 01:50,9556,2232,乐视群星访谈秀,乐视群星访谈秀,,https://toutiao.com/group/7434719902990074395/,,0,0,True
51年洪学智妻子寻女无果，到老乡家歇脚老乡惊呼：你要找得就是我,2024-09-22 01:07,14813,954,品古观今,品古观今,前言1951年，阳曲县委大院突然来了7、8位解放军同志，其中一位女同志，就是洪学智的妻子张文。她此番前来，就是为了寻找多年前因战乱而寄养于民间的爱女。可昔日的小村落早已蜕变成另一番景象，这无异于是大海捞针。,https://toutiao.com/group/7417034363226915354/,,0,0,False
母亲瘫痪、父亲疯了，当年那个744分的高考状元，7年后却成了这样,2024-09-08 00:54,9690,1542,八号探秘人,八号探秘人,母亲截肢瘫痪、父亲疯癫痴傻，可对于自己的亲人，他却做出了这样的评价。而今，7年已过，曾经那个让无数人动容的少年，现在如何?,https://toutiao.com/group/7411852147648496162/,,0,0,False
中方发声：各方应保持冷静克制,2024-11-20 11:13,1710,2758,北京日报客户端,北京日报客户端,11月20日，外交部发言人林剑主持例行记者会。俄新社记者提问，俄罗斯总统普京19日签署总统令，批准新版《俄罗斯联邦核威慑国家基本政策》。文件指出，俄罗斯视核武器为一种威慑手段，使用核武器是极端情况下被迫采取的措施。,https://rss2.bjd.com.cn/content/s673dc334e4b00bb8087a8aba.html,,0,0,False
首例5胞胎长大了，父亲已过劳去世 母亲直言：如能重来一个也不要,2024-08-31 03:06,3026,827,睿之悦,睿之悦,2002年，在北京的一家妇产医院中，一位来自河北的孕妇顺利生下了两男三女的五胞胎，创造了一个全国罕见的奇迹。,https://toutiao.com/group/7409098624111575603/,,0,0,False
男子为骗保开车撞树当场身亡，现场没有刹车痕迹，报案人是死者表兄弟，却跟警方说是去买茶叶路上发现事故,2024-11-19 03:10,422,478,大河报,大河报,一起蹊跷的事故中，交警发现现场疑点重重，于是他们顺藤摸瓜，居然牵出了一起骗保案。2024年2月12日晚，河南桐柏县公安局110指挥中心接到了一起交通事故的报警。,https://toutiao.com/group/7438821406575526454/,,0,0,False
1米3袖珍美女嫁给1米48男孩，婚后丈夫奇迹长高，两人却不欢而散,2024-09-07 02:55,5431,269,睿之悦,睿之悦,杨萍和葛存苗的婚礼 文|睿之悦 编辑|睿之悦2019年，成都的民政局来了两个“10岁小孩”来登记，工作人员以为是玩闹。两个“小孩”拿出身份证让工作人员看，这才明白，原来是两个再也长不高的成年袖珍人情侣。,https://toutiao.com/group/7411713833267364386/,,0,0,False
原来他才是毁掉刘翔真凶，因贪1200万被公审，让刘翔背负多年骂名,2024-08-29 09:58,15080,456,八号探秘人,八号探秘人,在田径场上创造的成绩，至今无人能够打破，甚至在国际上享有盛名。本该继续夺冠之路，却两次因伤退赛，遭到了全网辱骂。,https://toutiao.com/group/7408489498465616410/,,0,0,False
中美一旦爆发战争，美国候任防长说出结果：20分钟就能分出胜负,2024-11-17 12:12,8368,1566,全荃,全荃,美国候任防长海格塞斯宣称，中美一旦开打，20分钟内就能分出胜。事关中美关系，美方大肆炒作所谓“中国威胁”，显然是别有用心。,https://toutiao.com/group/7438219748757832204/,,0,0,False
两警察私带警用装备跨省抓人索财 企业家跳车逃跑并报警,2024-11-20 13:23,3441,1956,大河报,大河报,11月20日，浙江省人民检察院召开新闻发布会，通报今年以来全省“检察护企”专项行动开展工作情况，并发布一批典型案例。记者在会上注意到一起趋利性执法司法的典型案例：杨某某、占某某滥用职权案。,https://toutiao.com/group/7439351283363889703/,,0,0,False
多国紧急宣布：关闭大使馆,2024-11-20 11:02,2746,253,环球时报,环球时报,意大利、希腊等多国驻乌克兰大使馆因袭击风险关闭11月20日，意大利、希腊和西班牙三国驻乌克兰大使馆宣布，因面临袭击风险，使馆于当天关闭。此外，20日美国驻乌克兰基辅大使馆也表示，大使馆收到11月20日可能发生重大空袭的信息。,https://toutiao.com/group/7439314802176000523/,,0,0,False
许家印，再传新消息！,2024-11-20 03:43,354,205,中国经济网,中国经济网,近日，广州市南沙区人民法院向中国恒大集团及许家印发出限制消费令。因中国恒大集团未按执行通知书指定的期间履行生效法律文书确定的给付义务，对中国恒大集团采取限制消费措施，限制中国恒大集团及其主要负责人许家印不得实施所列出的高消费及非生活和工作必需的消费行为。,https://toutiao.com/group/7439201648771154467/,,0,0,False
【崔哥天天侃11/20】拜登离任不忘给川普下套，人老了还这么坏啊,2024-11-20 04:50,12993,478,北美崔哥,北美崔哥,,https://toutiao.com/group/7439219430984253952/,,0,0,True
“世纪大爆仓”主角、Archegos创始人比尔·黄被判18年监禁,2024-11-20 23:46,168,135,界面快讯,界面快讯,当地时间11月20日，Archegos Capital Management创始人比尔·黄（Bill Hwang）在美国纽约被判18年监禁。美国曼哈顿联邦检察官日前表示，比尔·黄实施市场操纵计划令其360亿美元的公司倒闭，并使其贷款机构损失逾100亿美元。,https://www.jiemian.com/article/12014219.html,,0,0,False
于东来宣布：明年起胖东来人结婚不允许要彩礼或付彩礼，酒席不能超5桌，未来胖东来人不许靠父母买房买车,2024-11-20 11:04,2068,2747,极目新闻,极目新闻,11月20日，胖东来创始人于东来在个人社交平台发文称：从明年起，为了推动美好生活、引导社会文明生活……胖东来人结婚不允许要彩礼或付彩礼！婚礼不能铺张浪费，婚礼酒席只能邀清亲朋酒席不能超过五桌！如果做不到的、公司从制度建设上制定将取消一切福利！未来的胖东来人是不允许靠父母买房买车！,http://jms.ctdsb.net/jmythshare/#/index_share?cId=0&contentType=5&contentId=2309133,,0,0,False
珠海航展结束后，美军印太司令改口：与中国作战不能只靠无人机,2024-11-20 08:49,8160,123,邵永灵,邵永灵,,https://toutiao.com/group/7439280947075219968/,,0,0,True
看看这个震撼心灵的视频，是个人就希望俄乌战争能停,2024-11-20 05:53,3947,1188,孙绪闻,孙绪闻,在2022年俄乌战争开打几个月的时候，还能看到迎接阵亡军人回家的队伍中，男女老少都有，但是到了今年9月份，迎接阵亡军人回家的，基本上看不到男人，都是失去丈夫的女人，以及失去儿子的老人和失去父母的儿童。这说明什么？说明乌克兰的男人基本上都死光了，或者是在奔向死亡的路上。看到这个片段，我的心情久久不能平静，这就是战争带来的苦难。,https://toutiao.com/group/7439235590043730466/,,0,0,True
67岁执意生娃，如今却坐轮椅无法自理，5岁的天赐被迫独立学洗衣,2024-11-04 10:32,4512,1131,睿之悦,睿之悦,2019年，已经67岁的田新菊执意生下了自己的第三个孩子小天赐。那么，现如今5年的时间过去了，这“天赐”的礼物到底是福还是祸呢?,https://toutiao.com/group/7433367394946384435/,,0,0,False
