title,publish_time,like_count,comment_count,media_name,source,abstract,article_url,tag,is_yaowen,article_sub_type,has_video
中央八项规定：党在新时代的徙木立信之举,2025-03-23 23:34,1774,906,人民日报,人民日报,“制定实施中央八项规定，是我们党在新时代的徙木立信之举，必须常抓不懈、久久为功，十年不够就二十年，二十年不够就三十年，直至真正化风成俗，以优良党风引领社风民风。”,https://www.peopleapp.com/column/30048593561-500006161920?utm_source=tth&promote=true,,0,1,False
这是张学良老婆赵四小姐真实样貌，并非演员饰演而是货真价实真品,2024-12-28 11:28,35953,2821,历史伟人,历史伟人,赵四小姐，原名赵一荻，她从十六岁开始她终生陪伴张学良，历经坎坷，赵一荻是富家大小姐，但是在张学良囚禁期间，她选择陪伴软禁中的张学良，后悔过吗?,https://toutiao.com/group/7453422736652698175/,,0,0,False
福耀科技大学公布了：首届招100人以内，年学费5460元！大四到境外名校学习一年，与剑桥、牛津、斯坦福等合作,2025-03-23 10:33,2847,1689,每日经济新闻,每日经济新闻,据《福州晚报》3月22日消息，今年该校计划招收100名以内学生，学费每年5460元，采取本硕博贯通培养模式，本科阶段将获得双学位。,http://www.nbd.com.cn/rss/jinri_toutiao/articles/3801145.html,,0,0,False
睡完首富睡总统:从厂妹到顶级名媛，靠男人捞到268亿，她凭啥？,2025-03-19 07:15,2056,848,历史有点冷,历史有点冷,当邓文迪和马斯克的母亲、特朗普的女儿一起共进午餐的照片发出来时，大家才猛然惊醒，这个“用不光彩身份上位”的女人，已经跻身全球顶级圈层。不仅如此，连雷军的妻子都对邓文迪热情款待，向她介绍小米汽车。,https://toutiao.com/group/7483403787860705807/,,0,0,False
印度一口气签1040架大单，并对照中国提要求，把空客CEO都整笑了,2025-03-23 03:58,1199,311,快嘴老付,快嘴老付,然而，比订单本身更令人关注的是，印度在交易中提出了一个大胆的要求——希望空客效仿中国，在印度建立本土总装线。,https://toutiao.com/group/7484567336100397619/,,0,0,False
缺人！缺人！缺人！实习生都能月入过万！这一行业缺口或超400万人……,2025-03-23 01:05,733,132,光明网,光明网,近日，上海市人社局等部门举办了首场面向高校毕业生的大型招聘会，现场提供超过2万个招聘岗位，多家人工智能领域的民营企业表现活跃，吸引了大量高校毕业生的目光。,https://m.gmw.cn/toutiao/2025-03/23/content_1303998241.htm,,0,1,False
