title,publish_time,like_count,comment_count,media_name,source,abstract,article_url,tag,is_yaowen,article_sub_type,has_video
包厢全是刚出狱的恶霸，结果一看到饭店主厨，立马怂了,2024-11-11 01:21,7648,160,乐视群星访谈秀,乐视群星访谈秀,,https://toutiao.com/group/7435825833048015400/,,0,0,True
1米3袖珍美女嫁给1米48男孩，婚后丈夫奇迹长高，两人却不欢而散,2024-09-07 02:55,5754,285,睿之悦,睿之悦,杨萍和葛存苗的婚礼 文|睿之悦 编辑|睿之悦2019年，成都的民政局来了两个“10岁小孩”来登记，工作人员以为是玩闹。两个“小孩”拿出身份证让工作人员看，这才明白，原来是两个再也长不高的成年袖珍人情侣。,https://toutiao.com/group/7411713833267364386/,,0,0,False
今天才知道！电动车“每天充”和“用完再充”，到底哪个更伤电池,2024-08-27 11:19,15996,2396,鲸探所,鲸探所,“今天到底给车充不充电？”估计大多数人每天回家都会想这个问题，看着自己的电动车电量又多又少的，充不充电也是一件非常难以抉择的事情。那么，电动车到底应该怎样充电呢？是每天都充，还是用完之后再充呢？电动车充电不管是在城市还是农村，电动车其实都是人们出门最常见的交通工具。,https://toutiao.com/group/7407773012533117475/,,0,0,False
“最牛星二代”廖凡，出道24年从不拼爹，妻子是周星驰的黄金拍档,2024-11-20 05:35,1779,906,卿羽飞,卿羽飞,最近电视剧《宿敌》正在央视8台热播中，不知道大家有没有观看呢?这部电视剧的主演是廖凡和朱珠，这真的是让人意想不到的搭配，廖凡和朱珠也是非常的有CP感。,https://toutiao.com/group/7439209147201077812/,,0,0,False
明年退休人员养老金会迎来21连涨吗？涨幅还会是3%吗？一起了解下,2024-11-21 15:11,356,176,暖心财经说,暖心财经说,2025年即将到来了，退休老人的养老金还会迎来21连涨吗?从2005年开始，企业退休人员的养老金就每年进行调整，到2025年即将是21年。,https://toutiao.com/group/7439745424468034048/,,0,0,False
俄罗斯一枚导弹震撼全球，必将打掉美西方信心，将改写战争历史,2024-11-23 07:02,2373,207,罗富强观察室,罗富强观察室,这是人类历史上射程达到6000公里的导弹首次投入实战。关键是，这不是老旧技术的导弹，而是无法拦截的俄罗斯最新型高超音速弹道导弹。,https://toutiao.com/group/7440366661741314614/,,0,0,True
“榛树”导弹落地6秒钟，从这几个点可以看出，俄罗斯下了大功夫,2024-11-23 09:11,3942,259,杜文龙,杜文龙,,https://toutiao.com/group/7440399745962476041/,,0,0,True
特朗普时代，中日合作机遇显现？俄乌对峙升级，明年有重大拐点,2024-11-20 10:52,14580,925,邱震海,邱震海,,https://toutiao.com/group/7439312593905025562/,,0,0,True
炸萝卜丸子到底用面粉还是淀粉，教你正确做法，外焦里嫩，太香了,2024-10-26 09:25,11040,719,家常的味道,家常的味道,,https://toutiao.com/group/7430012978277122611/,,0,0,True
俩人相亲互相看不上，哪料男方一报母亲身份，姑娘乐了,2024-11-08 01:50,9948,2261,乐视群星访谈秀,乐视群星访谈秀,,https://toutiao.com/group/7434719902990074395/,,0,0,True
"""榛树""导弹实战测试，射程覆盖欧洲全境，究竟把哪国""吓尿""了？",2024-11-23 08:21,4314,206,陈虎点兵,陈虎点兵,,https://toutiao.com/group/7440387000760271386/,,0,0,True
男子投诉环保问题被打断肋骨，经过区、镇干部协调和解后获赔300万元，一年后被判寻衅滋事追缴违法所得,2024-11-22 14:04,12749,7562,大风新闻,大风新闻,持续向上级投诉山东重山集团有限公司环保问题多年的王长征，在2021年6月23日与重山集团保安人员的冲突中被打致局部脑损伤、头部及全身多处软组织损伤、颈部损伤、多根肋骨骨折。,https://toutiao.com/group/7440095550873027106/,,0,0,False
拜登挖坑摆烂，特朗普眼前困难重重荆棘满布，各国向中国靠拢避险,2024-11-22 08:15,17133,206,邱毅台湾,邱毅台湾,,https://toutiao.com/group/7440014294332211727/,,0,0,True
男子实名举报县委副书记婚内出轨自己老婆，晒出暧昧聊天截图，海南当地多方回应,2024-11-23 06:10,312,176,极目新闻,极目新闻,11月19日，湖南长沙的程先生在社交平台，手持身份证实名举报海南省陵水黎族自治县委副书记兼政法委书记肖某，破坏其家庭，长期与其爱人保持不正当关系。并晒出多张妻子和肖某的露骨聊天截图，聊天内容十分暧昧。程先生称，肖某除了生活作风问题违纪之外，还有受贿，甚至洗钱等更严重的违法问题。,http://jms.ctdsb.net/jmythshare/#/index_share?cId=0&contentType=5&contentId=2311719,,0,0,False
养殖虾都是吃抗生素、激素长大的？到底能不能吃？告诉你真相,2024-11-20 12:11,742,154,39健康网,39健康网,这虾，我们还能安心享用吗?其实说到虾，市面上我们见到的，大多都是养殖的，市场占比超过80%。2023年我国农业部曾统计，当年水产品总产量7100万吨，而养殖类占到5812万吨，类别涵盖鱼虾蟹、贝壳、藻等各种水产品，占比达到82%。,https://toutiao.com/group/7439238682625835520/,,0,0,False
宋美龄106岁去世，贴身厨子回家后不久自尽，事后妻子透露出缘由,2024-10-28 09:22,9343,294,历史与江湖,历史与江湖,2003年10月，106岁的宋美龄在美国纽约去世，这位世纪老人虽然永远地闭上了双眼，但是却留下了一个长寿神话。,https://toutiao.com/group/7430753866158817855/,,0,0,False
农村姑娘进豪门被看不起，不料她竟然是个学霸，这下有好戏看了,2024-11-20 16:13,1520,426,乐视情感讲堂,乐视情感讲堂,,https://toutiao.com/group/7439348230468403724/,,0,0,True
67岁执意生娃，如今却坐轮椅无法自理，5岁的天赐被迫独立学洗衣,2024-11-04 10:32,5092,1256,睿之悦,睿之悦,2019年，已经67岁的田新菊执意生下了自己的第三个孩子小天赐。那么，现如今5年的时间过去了，这“天赐”的礼物到底是福还是祸呢?,https://toutiao.com/group/7433367394946384435/,,0,0,False
炒白菜千万不要直接下锅，难怪不好吃，教你技巧，鲜嫩入味不出水,2024-10-30 09:23,11000,605,家常的味道,家常的味道,,https://toutiao.com/group/7431496869400576550/,,0,0,True
海南富商张晖：花8亿建108米海上观音像，4年后死在水中死因成谜,2024-10-19 04:49,1557,239,八号探秘人,八号探秘人,在阅读此文之前，辛苦您点击一下“关注”，既方便您进行讨论和分享，又能给您带来不一样的参与感，感谢您的支持！编辑丨xk他是中国的一名富商，耗费8亿元完成了自己的梦想。可梦想落地成为现实的时候，他却在4年后莫名其妙的死去。他就是张晖，上个世纪末海南岛旅游业的龙头当家人。,https://toutiao.com/group/7427288913095492134/,,0,0,False
车晓谈前夫李兆会：世上除了我妈他最爱我，但他的爱令我无法承受,2024-09-21 06:26,1732,363,八号探秘人,八号探秘人,200辆迎亲车、500桌流水席，价值20万的黄金项链，没什么作品的她成了娱圈人人羡慕的对象。成龙做媒、嫁身价40亿山西最年轻首富，走上人生巅峰的她不料却迅速跌入谷底。,https://toutiao.com/group/7416978879144788530/,,0,0,False
老人说“坟有6不葬，一葬穷三年”，哪6不葬？葬了穷三年？,2024-08-28 09:01,19180,835,惠农圈,惠农圈,之前实行土葬，关于土葬的说法有很多，比如“坟有六不葬，一葬穷三年”。那时候，人们认为逝者葬在哪里，不能葬在哪里，会给后人带来福或灾。,https://toutiao.com/group/7408111961839256064/,,0,0,False
原来他才是毁掉刘翔真凶，因贪1200万被公审，让刘翔背负多年骂名,2024-08-29 09:58,15257,463,八号探秘人,八号探秘人,在田径场上创造的成绩，至今无人能够打破，甚至在国际上享有盛名。本该继续夺冠之路，却两次因伤退赛，遭到了全网辱骂。,https://toutiao.com/group/7408489498465616410/,,0,0,False
51年洪学智妻子寻女无果，到老乡家歇脚老乡惊呼：你要找得就是我,2024-09-22 01:07,15145,973,品古观今,品古观今,前言1951年，阳曲县委大院突然来了7、8位解放军同志，其中一位女同志，就是洪学智的妻子张文。她此番前来，就是为了寻找多年前因战乱而寄养于民间的爱女。可昔日的小村落早已蜕变成另一番景象，这无异于是大海捞针。,https://toutiao.com/group/7417034363226915354/,,0,0,False
给近三年最好的10部年代剧排个名：《人世间》第6，第1名没有争议,2024-09-06 08:08,12915,3969,皮皮电影,皮皮电影,时尚是个轮回，电视剧也是。在2020年之前的那些年，电视剧市场基本上都被偶像剧、都市剧霸占。曾经撑起国剧品质的《闯关东》《岁月》这类年代好剧，难见踪影。,https://toutiao.com/group/7411390030722712090/,,0,0,False
河南女子去世，山东丈夫将手机埋墓里，充1000元话费，每天打电话,2024-11-01 06:52,3040,2799,何止电影,何止电影,2014年11月17日，河南肿瘤医院的病房中举行着一场特殊的婚礼，主角是于海宁跟他的患有癌症的妻子范会香。在几个月前范会香确诊癌症，跟男友提出分手，于海宁不远万里来到了女友的城市，照顾患癌女友。得知女友时日无多，在病房中跟女友求婚，在病房中举办了婚礼，婚后一年，范会香去世。,https://toutiao.com/group/7432199981609534004/,,0,0,False
日本梅毒成灾，“不是为了传给客人，谁得了花柳病还去上班呢？”,2024-09-15 08:02,3724,803,易霄寒,易霄寒,日本东京都的梅毒感染人数持续飙升，今年已查出超2400例，与去年基本持平，创下历史新高。东京都公共卫生局官员表示，梅毒症状少，很多人在不知情的情况下就传播了病毒。,https://toutiao.com/group/7414755178596811316/,,0,0,False
为何刘亦菲单身至今？不是没人想娶，看完这些照片你就明白了！,2024-11-08 09:54,316,107,吃瓜崽崽,吃瓜崽崽,文丨冒泡提到刘亦菲，很多人会想到她清纯如仙的气质和不食人间烟火的形象。从《仙剑奇侠传》中的赵灵儿到《神雕侠侣》里的小龙女，她以优雅脱俗的气质和不俗的演技，让观众对她着迷。然而，这位众人心中的“神仙姐姐”即使出道多年依然保持单身。这么美的刘亦菲，究竟是什么原因让她至今无人敢娶？,https://toutiao.com/group/7434843859995099667/,,0,0,False
富二代当兵却逃跑回家，班长去他家抓人，一进家门瞬间惊了,2024-10-26 02:59,11067,967,乐视天天剧好看,乐视天天剧好看,,https://toutiao.com/group/7429913203359875636/,,0,0,True
12月起执行！电动车、三轮车上路迎“4禁4查”新规，违者罚款扣车,2024-11-20 00:57,414,112,新能源战略家,新能源战略家,请您在阅读前，先点击上面的“关注”。感谢您的支持，我们将为您带来更多有价值的内容。由于今年关于电动车的各项要求都有变动，因此不少地区都在开展电动车安全隐患全链条整治行动，进一步规范了电动车的上路要求，同时明确了电动车不规范上路的行为。,https://toutiao.com/group/7439159045057823284/,,0,0,False
6年前，因批评“鸿茅药酒”，被跨省抓捕的医学硕士，现状如何？,2024-09-10 07:05,8638,4814,八号探秘人,八号探秘人,在电视机作为传播主流的时代，鸿茅药酒凭借这句广告语，火遍大江南北。但就在2017年，一篇文章《中国神酒“鸿茅药酒”，来自天堂的毒药》中。,https://toutiao.com/group/7412891004535144970/,,0,0,False
母亲瘫痪、父亲疯了，当年那个744分的高考状元，7年后却成了这样,2024-09-08 00:54,10374,1613,八号探秘人,八号探秘人,母亲截肢瘫痪、父亲疯癫痴傻，可对于自己的亲人，他却做出了这样的评价。而今，7年已过，曾经那个让无数人动容的少年，现在如何?,https://toutiao.com/group/7411852147648496162/,,0,0,False
首例5胞胎长大了，父亲已过劳去世 母亲直言：如能重来一个也不要,2024-08-31 03:06,3121,847,睿之悦,睿之悦,2002年，在北京的一家妇产医院中，一位来自河北的孕妇顺利生下了两男三女的五胞胎，创造了一个全国罕见的奇迹。,https://toutiao.com/group/7409098624111575603/,,0,0,False
罕见！100年前，英国游客拍下的清朝乡村，和想象中完全不一样,2024-09-20 02:07,7230,674,万物知识局,万物知识局,泥泞的土路，衣不蔽体的老百姓，即便是达官显贵的家中也十分破败，而这些都是清王朝的历史痕迹，虽说那时候中国摄影技术并不发达，但也有许多外国游客来到这里，拍摄下了许多老照片，为我们留下了珍贵的历史资料，那清朝到底是怎样的面貌呢?,https://toutiao.com/group/7416287738871267855/,,0,0,False
最新！乌克兰公布细节：导弹携带36枚分弹头，末段速度超11倍音速！俄方：“榛树”可打击欧洲全境，普京：有必要批量生产,2024-11-23 00:43,3129,1666,每日经济新闻,每日经济新闻,据央视新闻11月22日报道，俄罗斯总统普京当地时间11月21日晚发表讲话称，当天俄军对乌克兰军工企业进行了联合打击。攻击中俄军测试了没有搭载核弹头、代号“榛树”的新型中程高超音速导弹。该导弹能够以10马赫的速度打击目标，目前没有反导系统可以拦截这种类型的导弹。,http://www.nbd.com.cn/rss/jinri_toutiao/articles/3657271.html,,0,0,False
黑龙江七台河当地24小时不间断追踪咬人老虎踪迹,2024-11-23 01:14,869,256,澎湃新闻,澎湃新闻,11月18日，黑龙江七台河。一名村民手被老虎咬伤，已经送往医疗机构接受治疗。目前，当地已经成立排查队伍，对老虎24小时不间断开展排查追踪。,https://cloudvideo.thepaper.cn/video/30305036c2f94c76bc61a07edd986b57/hd/20241122214800682cf6db150-fa00-4324-b793-ba0199ea1ae3-14f9ac27-a74c-833c-5d7e-4d1cbe5cf9a6.mp4,,0,0,True
弟弟光荣退伍，姐姐兴奋去车站接他，怎料一见弟弟瞬间哭了,2024-11-05 06:34,23589,2620,乐视天天剧好看,乐视天天剧好看,,https://toutiao.com/group/7433679820573934091/,,0,0,True
旺仔牛奶疑喝出老鼠？当事人：厂商已取走一半异物去做检测，旺旺高管：没有汤姆更没有杰瑞,2024-11-23 02:12,147,496,极目新闻,极目新闻,据南方都市报报道，11月20日，有网友发布视频显示，一人正在用刀砍开旺仔牛奶的罐体，露出罐底“一团不规则的黑色异物”，并配文“孩子打开喝了一口说味道很怪，倒掉打开后真的恶心”。评论区有网友根据图片猜测“异物为老鼠”，相关消息持续引发热议。,http://jms.ctdsb.net/jmythshare/#/index_share?cId=0&contentType=5&contentId=2311577,,0,0,False
张狂！张本智和逆转林诗栋后摇头晃脑庆祝，随后趴倒在地上,2024-11-23 10:08,346,392,直播吧,直播吧,,https://news.zhibo8.com/other/2024-11-23/6741a8eaa4ba1native.htm,,0,0,False
她曾被前夫一巴掌扇到离婚！二婚嫁世界冠军，如今生活幸福滋润,2024-09-10 09:12,17367,300,豆莱说,豆莱说,“漂亮的让人挪不开眼”是圈内人对她的评价，和“山杏”不一样的是，李琳在现实生活中的感情很是幸运，遇到了导演王小列。,https://toutiao.com/group/7412930201929204236/,,0,0,False
特务男扮女装混进村子，孩子兵顿时发现不对劲，这下精彩了,2024-10-28 06:09,5363,555,乐视群星访谈秀,乐视群星访谈秀,,https://toutiao.com/group/7430704630294413878/,,0,0,True
浙大一贫困生晒国内外多地旅游照引热议 该生家乡民政局回应：贫困证明没问题,2024-11-22 09:44,444,1146,封面新闻,封面新闻,封面新闻记者 陈彦霏近日，浙江大学一贫困生，在朋友圈晒出国内外多地旅游的照片，引发网友关注和热议。,https://m.thecover.cn/news_details.html?from=web&eid=x4D1hlFuojSH90qSdq8Jkw==,,0,0,False
