title,publish_time,like_count,comment_count,media_name,source,abstract,article_url,tag,is_yaowen,article_sub_type,has_video
跟着总书记的考察足迹｜瞰武汉,2024-11-06 10:06,714,306,新华网,新华网,江汉壮阔，百湖多姿四方贯通，九省通衢浩浩长江水，巍巍黄鹤楼见证武汉的千年荣光这里大江腾涌，重义崇礼显英雄这里弦歌不辍，雅意诚心迎知音这里是武汉编导：刘思远记者：饶饶、熊琦、潘志伟、方亚东新华社音视频部制作,http://my-h5news.app.xinhuanet.com/h5/article.html?articleId=f271b26dcbb491483e61d803d7f4d457,,0,0,False
特朗普战胜哈里斯重新上台，对中国是好是坏？,2024-11-06 08:28,16525,5075,第一军情,第一军情,据央视新闻11月6日最新报道，特朗普成功战胜哈里斯，赢得了2024年美国总统大选，和很多人想象的“战事焦灼”不同，本次美国大选却呈现出一边倒的态势，特朗普兵不血刃，在多个摇摆州成功“翻红”，战胜了民主党候选人哈里斯，再次问鼎美国总统的宝座。那么，既然美国未来四年的“掌门人”已经敲定，对中国又将有什么深远影响，或者用更贴地气的话：对中国是好是坏呢？,https://toutiao.com/group/7434080229624119844/,,0,0,True
被余华英拐卖的17个孩子，和那些停在原地的家庭,2024-11-06 01:16,243,130,是个人物,是个人物,那些寻子的父母们留在原地，等了很久很久。人贩子余华英已经被判死刑。被拐的孩子们都找回来了。重逢只是生活真正的起点，如何认亲、理解亲人、适应回归的亲情，如何安顿好思念、怨恨、错位的理解，同等重要，而这也远比想象的更艰难。,https://toutiao.com/group/7433967896675549707/,,0,0,False
特朗普胜选，中方回应,2024-11-06 07:53,3336,1573,北京日报客户端,北京日报客户端,11月6日，外交部发言人毛宁主持例行记者会。西班牙《阿贝赛报》记者提问，特朗普的胜利似乎已成定局，中方是否会向他致贺？“美国大选结果出台之后，正式宣布之后，我想我们会按惯例处理有关事宜。”毛宁说。毛宁 资料图。,https://rss2.bjd.com.cn/content/s672b1f9de4b0e1ace8a7fe92.html,,0,0,False
11月6日下午5点06分，北京天安门震撼降下国旗，场面令人激动落泪,2024-11-06 09:23,2221,249,好邻居李亮,好邻居李亮,11月6日下午5点06分，北京天安门震撼降下国旗，场面令人激动落泪,https://toutiao.com/group/7434094422620373538/,,0,0,True
特务男扮女装混进村子，孩子兵顿时发现不对劲，这下精彩了,2024-10-28 06:09,2585,255,乐视群星访谈秀,乐视群星访谈秀,,https://toutiao.com/group/7430704630294413878/,,0,0,True
善恶终有报：疫情时对中国一毛不拔，却大方捐美国6亿，如今咋样,2024-09-29 05:50,985,128,睿之悦,睿之悦,可就是这样一位在中国土生土长起来的富豪，在疫情期间面对同胞的困境却一毛不拔，反而大方的捐助了6亿给美国。,https://toutiao.com/group/7419859345154015798/,,0,0,False
安徽美女道士胡小慧被捕：精通“胡媚术”，九名男徒弟揭露其罪行,2024-09-12 08:10,3790,428,艺述史,艺述史,在安徽一处偏僻山头上，有座神秘的道观，外表平平无奇，但里面却有着一位名气很高的美女道士。美女道士的名字叫做胡小慧，据说有着高深的法力，能帮人消灾解难。很多人慕名前来，交上丰厚的香火钱，在袅袅青烟里，试图从这个年轻道士身上获得一些生活的支撑。,https://toutiao.com/group/7413662261274739200/,,0,0,False
罕见！100年前，英国游客拍下的清朝乡村，和想象中完全不一样,2024-09-20 02:07,4823,538,万物知识局,万物知识局,泥泞的土路，衣不蔽体的老百姓，即便是达官显贵的家中也十分破败，而这些都是清王朝的历史痕迹，虽说那时候中国摄影技术并不发达，但也有许多外国游客来到这里，拍摄下了许多老照片，为我们留下了珍贵的历史资料，那清朝到底是怎样的面貌呢?,https://toutiao.com/group/7416287738871267855/,,0,0,False
写歌30年穷困潦倒，前妻失望选择离婚，谁料51岁靠一首歌一夜成名,2024-08-12 03:37,26230,4348,八号探秘人,八号探秘人,在阅读此文之前，辛苦您点击一下“关注”，既方便您进行讨论和分享，又能给您带来不一样的参与感，感谢您的支持！编辑：LY无数人都想要一个一夜成名的机会，但机会来了也不是每个人都能把握住的。他用了三十年的时间来准备迎接属于自己的机会。为了这个机会他放弃了一切，甚至包括家庭。,https://toutiao.com/group/7402090890367484428/,,0,0,False
中国绝版老香烟，见过5种以上都是爷爷辈的，老烟民们抽过几种？,2024-08-20 08:54,761,130,万物知识局,万物知识局,文/万物知识局本文陈述所有内容皆有可靠信息来源，赘述在文章结尾在中国的历史长河中，烟草的传奇故事已历经四百载春秋。从明朝嘉靖年间葡萄牙使者带来的烟草，到如今琳琅满目的香烟品牌，烟草不仅见证了时代的变迁，也承载了无数人的记忆与情感。,https://toutiao.com/group/7405119584723927578/,,0,0,False
特朗普胜选好过哈里斯，“台独”心惊被卖钱？副总统万斯更加激进,2024-11-06 11:26,10700,184,黎建南台湾,黎建南台湾,,https://toutiao.com/group/7434126202526401024/,,0,0,True
中国国乒又火了！决胜时刻，领军人物疯狂逆转，上演最解气的一幕,2024-11-04 00:00,5050,562,乐播体育,乐播体育,,https://toutiao.com/group/7433056969079915020/,,0,0,True
11月5号上午，北京大街上看到的，这是干什么呢？,2024-11-05 02:06,1973,178,清风快乐游,清风快乐游,,https://toutiao.com/group/7433610775513694783/,,0,0,True
15年前他在爱妻葬礼上哭到昏厥，发誓永不再娶，如今他做到了吗？,2024-08-24 02:17,18617,583,八号探秘人,八号探秘人,在阅读此文之前，辛苦您点击一下“关注”，既方便您进行讨论和分享，又能给您带来不一样的参与感，感谢您的支持！编辑丨xk纵观鱼龙混杂的娱乐圈，有人背叛，有人痴情。而果靖霖则是公认的好男儿，将一生都奉献给妻子。但妻子却仅仅陪他走了半生，没能战胜病魔，不幸离开人世。,https://toutiao.com/group/7406210316734710283/,,0,0,False
小伙洗完澡故意秀肌肉，富婆心跳加速被当场拿下，这下好看了,2024-10-26 16:20,5543,239,乐视情感讲堂,乐视情感讲堂,小伙洗完澡故意秀肌肉，富婆心跳加速被当场拿下，这下好看了,https://toutiao.com/group/7430011217881596426/,,0,0,True
大选前夕特朗普再次立下承诺，若其上台，必将拆散中俄两国关系！,2024-11-05 09:04,7781,2082,评论员何亮亮,评论员何亮亮,,https://toutiao.com/group/7433718590399840805/,,0,0,True
被拐男子认亲一年后，与家人彻底决裂！,2024-11-05 08:45,1213,883,环球网,环球网,来源：宁波晚报 近日因寻亲走红的郁豹豹与家人决裂的消息引发关注，冲上热搜。据报道，2023年9月，被拐卖34年的郁豹豹寻亲成功。认亲不到半个月，郁豹豹与两个弟弟开始直播带货。不到两个月，三兄弟逐渐走向分崩离析。令他更无法接受的是，他与母亲也渐生隔阂。,https://3w.huanqiu.com/a/14459a/4K8FGmdmzMW?agt=20,,0,0,False
瑞士卷当事人称非常后悔并抱歉,2024-11-05 15:59,308,788,大象新闻,大象新闻,不久前，一位全职宝妈博主在社交平台上发布了一条视频，记录了她和丈夫的一次争吵。,https://share.hntv.tv/news/0/1853809139332677634,,0,0,False
特朗普还没上任，内阁名单萝卜开会，“反华”政客闻见味都来了,2024-11-06 09:29,4979,4046,邵永灵,邵永灵,随着特朗普宣布胜选，轰轰烈烈的美国大选就此尘埃落地，接下来只要特朗普平稳度过这两个月，等到明年1月举行总统交接仪式后就是大权在握、论功行赏的时刻。,https://toutiao.com/group/7434095603572933120/,,0,0,False
又被全世界打脸，这是美国今年最耻辱的失败,2024-11-01 00:10,7767,2046,牛弹琴,牛弹琴,资料图又被全世界打脸，这是美国今年最耻辱的一次失败。之所以说“又”，很简单，以前每年都有过，结果也差不多。事实上，这也成了一年一次联合国大会，最后的保留曲目，全世界同声谴责美国，全世界一起看美国笑话。因为全世界投票，要求美国必须终止对古巴的经济、商业和金融封锁。,https://toutiao.com/group/7432095642685686291/,,0,0,False
