title,publish_time,like_count,comment_count,media_name,source,abstract,article_url,tag,is_yaowen,article_sub_type,has_video
一见·总书记黔滇之行，一条主线贯穿其中,2025-03-21 03:59,2841,1215,人民日报,人民日报,“谋划好‘十四五’时期少数民族和民族地区发展”，这是5年多前习近平总书记在全国民族团结进步表彰大会上提出的明确要求。,https://www.peopleapp.com/column/30048574173-500006156868?utm_source=tth&promote=true,,0,1,False
安庆医院拔牙后续！拔牙医生信息曝光，系主任医生，研究生导师,2025-03-20 06:52,2526,2363,正能量星辰,正能量星辰,吴女士因为智齿疼痛，就来到安庆医院拔牙，给她拔牙的医生可不简单，头衔看起来就是很牛的那种，他不仅是医院主任医生、口腔医学博士，还是位副教授，硕士研究生导师，并在口腔颌面部种植牙、肿瘤、创伤、皮瓣修复及牵张成骨、正颌外科等领域有一定的研究，代表作品为《临床博士谈误诊误治》。,https://toutiao.com/group/7483034708839563826/,,0,0,False
李思：生父李连杰把我和妈妈抛弃，如果可以的话我不想是他的女儿,2025-03-19 21:18,1433,319,通山报道,通山报道,上世纪 80 年代，李连杰与黄秋燕相识，那时的他们青春年少，同在武术的世界里挥洒汗水，彼此之间有着深厚的同门情谊。,https://toutiao.com/group/7483029646720942633/,,0,0,False
中方亲口证实，解放军开始反制，战区司令发声促统，7国不许收台,2025-03-18 05:59,14908,7048,徐量,徐量,7国集团不许收台又做了什么?近来，岛内赖清德当局以及美西方外部势力在涉台问题上的挑衅动作接连不断。而在这之前，美国及其盟友还不断地派遣军机军舰擅闯台湾海峡，以此来向赖当局及岛内“台独”势力释放严重错误信号。,https://toutiao.com/group/7483024499546407433/,,0,0,False
卧底记者，再揭惊天内幕！,2025-03-14 23:53,1051,297,坤家的ak猫咪,坤家的ak猫咪,“到手刀”，听起来像是武侠小说里的招式，但在二手奢侈品交易江湖里，它却是令卖家们闻风丧胆的神秘法门。,https://toutiao.com/group/7481432634162299419/,,0,0,False
失联湖大女生遗体找到！校方通报疑死因曝光，同学说出更多内情！,2025-03-21 07:41,712,220,香樟树下的约定,香樟树下的约定,失联湖大女生遗体找到！校方通报疑死因曝光，同学说内情恐不简单,https://toutiao.com/group/7484164608933020171/,,0,0,True
