title,publish_time,like_count,comment_count,media_name,source,abstract,article_url,tag,is_yaowen,article_sub_type,has_video
一见·从40年前的这篇文章，感悟总书记的思与行,2024-12-07 05:06,2055,1099,人民日报,人民日报,40年前的今天，1984年12月7日，时任河北正定县委书记的习近平同志首次在人民日报发表署名文章，标题是《中青年干部要“尊老”》。‍‍‍‌‍‍‌光阴流转，身体力行。从正定一路走来，习近平同志的尊老情贯穿始终。,https://www.peopleapp.com/column/30047620961-500005978205?utm_source=头条号&promote=true,,0,0,False
交10年保费取钱还要等60年 买保险如何不被套路？,2024-12-05 04:42,249,106,看看新闻,看看新闻,交10年保费取钱还要等60年 买保险如何不被套路？,http://mediaplay.kksmg.com/2024/12/05/h264_720p_600k_77929-DFTVHD-20241205115500-3900-956397-600k_mp4.mp4,,0,0,True
天冷要多吃白萝卜，教你一个简单又好吃的做法，营养美味老少皆宜,2024-12-02 08:08,4582,138,家常的味道,家常的味道,,https://toutiao.com/group/7443723428206477839/,,0,0,True
炸萝卜丸子到底用面粉还是淀粉，教你正确做法，外焦里嫩，太香了,2024-10-26 09:25,14193,941,家常的味道,家常的味道,,https://toutiao.com/group/7430012978277122611/,,0,0,True
包厢全是刚出狱的恶霸，结果一看到饭店主厨，立马怂了,2024-11-11 01:21,11760,315,乐视群星访谈秀,乐视群星访谈秀,,https://toutiao.com/group/7435825833048015400/,,0,0,True
女友怀孕了，男友不装了，带她回豪宅！,2024-11-23 08:01,9735,786,乐视大综艺咖,乐视大综艺咖,,https://toutiao.com/group/7440353629540483593/,,0,0,True
罕见！100年前，英国游客拍下的清朝乡村，和想象中完全不一样,2024-09-20 02:07,8511,748,万物知识局,万物知识局,泥泞的土路，衣不蔽体的老百姓，即便是达官显贵的家中也十分破败，而这些都是清王朝的历史痕迹，虽说那时候中国摄影技术并不发达，但也有许多外国游客来到这里，拍摄下了许多老照片，为我们留下了珍贵的历史资料，那清朝到底是怎样的面貌呢?,https://toutiao.com/group/7416287738871267855/,,0,0,False
天冷电动车充满电，一加油门就掉2格，不怪电池，真实原因告诉你,2024-11-26 05:02,1688,109,新能源战略家,新能源战略家,电动车使用方便、价格便宜，已经成为了不少朋友通勤代步的首选，但在使用过程中偶尔也有让人糟心的问题。像爆胎、刹车不灵敏这类问题可以通过门店维修来解决，但如果遇到电池出现异常情况，不仅问题难以排查，而且维修成本也不低。,https://toutiao.com/group/7441448742575702563/,,0,0,False
明年养老金或迎来第21连涨，涨幅与哪些因素相关？哪些人能多涨？,2024-12-02 14:37,617,173,暖心财经说,暖心财经说,还不到一个月的时间，即将迎来2025年了。全国目前有1.4亿多离退休人员，这些人员都将在2025年的养老金调整中获益。退休养老金的涨幅与哪些因素相关呢？是否有了能够多涨？一起了解一下。退休养老金的涨幅与哪些因素相关？,https://toutiao.com/group/7443819173911872015/,,0,0,False
弟弟光荣退伍，姐姐兴奋去车站接他，怎料一见弟弟瞬间哭了,2024-11-05 06:34,30664,2923,乐视天天剧好看,乐视天天剧好看,,https://toutiao.com/group/7433679820573934091/,,0,0,True
河南警察3岁女儿被拐，苦寻全国23年无果，结果却发现女儿在对门,2024-11-05 07:43,3207,335,八号探秘人,八号探秘人,寻亲23年无果，丢失的女儿竟住在对门?但它却真实发生在河南洛阳的梁绍波身上。是意外走丢，还是人贩子所为，三岁的女儿怎会离奇失踪?,https://toutiao.com/group/7433697108120142345/,,0,0,False
冬天洗澡多久一次最好？这4个时候，劝你不要洗,2024-12-07 10:01,943,126,环球网,环球网,来源：健康杭州 最近杭城的气温 一天天走低 忙活了一整天，洗个热乎乎的澡 再钻进暖暖的被窝，再舒服不过！ 然而不少人洗澡时 或多或少会犯些错 结果把本该舒服又养人的“养生澡”硬生生洗成了“伤身澡”冬天多久洗一次澡最好？洗澡频率主要取决于个体的需求和偏好。,https://3w.huanqiu.com/a/106d4f/4KYr5sh4XfC?agt=20,,0,0,False
琼瑶与江苏：她的母亲是武进人，大姨更是江苏名人,2024-12-04 14:41,1695,531,扬子晚报,扬子晚报,在华语文学的天空中，琼瑶的名字如同一颗璀璨的星辰，照亮了一代又一代人的情感世界。然而，当这颗星辰悄然陨落，我们不禁感叹岁月的无情与生命的脆弱。琼瑶的离世，不仅让文学界失去了一位巨匠，也让她的血脉故乡江苏，失去了一位与这片土地情深意长的文化使者。,https://wap.yzwb.net/wap/news/4184552.html,,0,0,False
最多1天卖4000斤！男子靠这在杭州买房：以前想都不敢想！有人一口气买走1200斤,2024-12-07 07:42,2169,598,环球网,环球网,来源：杭州日报 12月的杭城，年味日渐浓郁。每年此时，杭州菜场里会突然冒出几个人气鼎旺的灌香肠摊，吸引四面八方的老客前来下单，风风火火忙上两三个月。于赛华就是其中一人，人称“香肠哥”。小学没毕业的他做了23年香肠成了非遗传承专家，还在杭州买了房：“以前在杭州买房想都不敢想。,https://3w.huanqiu.com/a/1bb1a4/4KYm3peCxq8?agt=20,,0,0,False
尹锡悦疯了 李在明赢了 美国火大了,2024-12-05 08:12,13580,1125,台灣中天主播盧秀芳,台灣中天主播盧秀芳,尹锡悦疯了 李在明赢了 美国火大了,https://toutiao.com/group/7444837777838965289/,,0,0,True
央视曝光！#制假售假“一条龙”！,2024-11-24 12:16,4860,1880,央视财经,央视财经,,https://toutiao.com/group/7440818726712115762/,,0,0,True
美落井下石！尹锡悦没救了！！ 欢迎收看《谦言谦语》播出,2024-12-06 02:00,10939,244,赖岳谦官方,赖岳谦官方,,https://toutiao.com/group/7445112782787183114/,,0,0,True
“中企遭大规模拒签，前所未有”,2024-12-02 09:13,10644,3200,环球时报新媒体,环球时报新媒体,“中企遭大规模拒签，前所未有”,https://toutiao.com/group/7443740275974865423/,,0,0,True
工信部给燃油车吃了一颗“定心丸”，淘汰燃油车的声音终于安静了,2024-12-04 09:16,1381,743,议史纪,议史纪,随着新能源汽车的发展越来越强大，燃油车的热度似乎被影响了。您现在的车是新能源，还是燃油车呢?也正是因为新能源的崛起，大家关于燃油车看法也逐渐有了争议。,https://toutiao.com/group/7444481609710977570/,,0,0,False
美媒评中国最新出口管制：中国开创先例，禁止他国向美国出售商品,2024-12-06 13:48,18799,11674,观察者网,观察者网,【文/观察者网 齐倩】12月3日，中国商务部发布公告，宣布严控对美出口镓、锗、锑、超硬材料、石墨等相关两用物项。外媒普遍将此视作对美国出口管制行为的迅速反制，同时注意到了公告中的一句表述：“任何国家和地区的组织和个人违反相关规定，将依法追究责任。,https://www.guancha.cn/internation/2024_12_06_757979.shtml,,0,0,False
美国权力即将交接之际，台湾两个举动不寻常，释放什么危险信号？,2024-12-02 09:57,13433,133,邱震海,邱震海,,https://toutiao.com/group/7443751437550486057/,,0,0,True
广西49岁老汉娶19岁姑娘，结婚21年生下15个孩子，如今有何下场？,2024-10-20 08:32,6196,741,艺述史,艺述史,她19岁出嫁，21年里总共生育了15个孩子，其中4个男孩子11个女孩子，家里热闹的像是开了一所学校一样。,https://toutiao.com/group/7427400319418384948/,,0,0,False
中国车企全军覆没？全球汽车可靠性排行出炉,2024-12-06 07:12,1728,1748,中关村在线,中关村在线,日前，美国《消费者报告》发布了最新的汽车可靠性排行榜单。榜单揭示了当前汽车市场中混合动力汽车与燃油车相较于电动汽车依然具有更高的可靠性。不过上榜名单中没有中国品牌，这不得不让人怀疑这份榜单的客观性。,https://m.zol.com.cn/article/9250307.html?tuiguangid=toutiao,,0,0,False
大学生4年间艾滋病感染12397例，60%存在这一行为,2024-12-03 10:16,5134,4308,凤凰网,凤凰网,据相关数据，2020年至2023年，新报告青年学生病例分别为:2977人、3677人、2733人、3010人，四年间共报告12397人。,https://toutiao.com/group/7444127197663396364/,,0,0,False
杀疯了的「北京市服」，统一全国审美？,2024-11-25 00:30,2905,1187,凤凰WEEKLY,凤凰WEEKLY,文/馍王编辑/闫如意众所周知，凤凰编辑部位于北京市。众所又知，北京的冬天，有一种统一所有人穿搭审美的魔力。这个冬天，编辑部的穿搭呈现出了无限趋同。上班时，人均穿着一件柔软的摇粒绒内衬，蜷缩在工位上。下班点一到，用一件宽大冲锋衣把摇粒绒一锁，挺胸抬头，跟扇大铁门似的走出公司。,https://toutiao.com/group/7440858414693040678/,,0,0,False
陕西通报：不要买、不要吃！,2024-12-06 07:08,3819,1535,闽南网,闽南网,近期，陕西省市场监督管理局组织对淀粉及淀粉制品、炒货食品及坚果制品、蜂产品、糕点、食用油、油脂及其制品、乳制品、肉制品、方便食品、茶叶及相关制品、餐饮食品10大类食品1677批次样品进行了食品安全监督抽检，其中淀粉及淀粉制品、炒货食品及坚果制品、蜂产品、糕点4大类7批次样品不合格，检出超范围超限量使用食品添加剂、质量指标不达标、禁用兽药的问题。,https://toutiao.com/group/7445192096975307302/,,0,0,False
句句不提统一，句句不离祖国！#宋思瑶采访,2024-12-07 10:07,1822,117,维唔得闲,维唔得闲,,https://toutiao.com/group/7445609598112760329/,,0,0,True
山东荣成冷链仓库火灾事故失联9人全部找到，均无生命体征,2024-12-08 01:10,1364,1890,界面快讯,界面快讯,荣成市应急管理局发布情况通报：截至12月8日5时许，经过持续救援，荣成市蓝润集团在建的齐东海通冷链仓库火灾事故失联9人全部找到，均无生命体征。现场搜救结束。目前事故原因调查、善后处置等工作仍在进行中。,https://toutiao.com/group/7445841850927235603/,,0,0,False
真没想到！这四类人不属于公务员，甚至连编制都没有,2024-10-26 03:31,1328,113,青衫书生,青衫书生,本以为这些是正式编制工作！“宇宙的尽头是考公”，这句网络流行语，道出了当下年轻人对“铁饭碗”的渴望。公务员是多少人梦寐以求的工作，甚至也可以说相当于一个养老工作。然而，在现实生活中，人们对公务员身份的认知，却存在着不少误区。,https://toutiao.com/group/7429913474316239423/,,0,0,False
32步广场舞《活在世上就要快乐》苦了累了听一听，放松心情,2024-11-04 00:05,692,149,华美舞动广场舞,华美舞动广场舞,华美舞动广场舞《活在世上就要快乐》网络热歌，32步背面演示，学跳更轻松更方便,https://toutiao.com/group/7433204407086350898/,,0,0,True
13年9岁男孩扶老太被讹，老太发誓说谎死全家，儿媳却意外说漏嘴,2024-10-25 08:09,4473,1258,睿之悦,睿之悦,文|睿之悦编辑|睿之悦“就是这个娃撞了我，我虽然年纪大了，但我可不糊涂……”2013年，一位9岁的小学生江小云好心的将摔倒的蒋老太扶起，却反被讹100万。当时的蒋老太甚至还发毒誓，声称要是说谎的话就“死全家”。那么，这到底是怎么一回事呢？,https://toutiao.com/group/7429620647524450831/,,0,0,False
67岁执意生娃，如今却坐轮椅无法自理，5岁的天赐被迫独立学洗衣,2024-11-04 10:32,8346,1931,睿之悦,睿之悦,2019年，已经67岁的田新菊执意生下了自己的第三个孩子小天赐。那么，现如今5年的时间过去了，这“天赐”的礼物到底是福还是祸呢?,https://toutiao.com/group/7433367394946384435/,,0,0,False
一婚娶央视主持人，二婚娶演员，三婚娶小30岁美女，64岁终当爸爸,2024-11-04 01:56,1877,213,昕昕局,昕昕局,三段婚姻，三个女人，不同的年龄，不同的性格，交织成了一部充满爱恨纠葛的人生大戏。尤小刚的成功并非偶然，他的身上带着一股不服输的韧劲，仿佛生来就要与命运抗争，出生于富裕家庭的他，因为时代原因家道中落，被迫中断学业，成为下乡插队大军中的一员。,https://toutiao.com/group/7433236228893393449/,,0,0,False
