title,publish_time,like_count,comment_count,media_name,source,abstract,article_url,tag,is_yaowen,article_sub_type,has_video
王哥给美女一千块，手立马不老实，美女秒懂！,2025-02-22 06:21,1866,115,南瓜说异,南瓜说异,,https://toutiao.com/group/7474123790134297139/,,0,0,True
突发：加拿大多伦多客机坠毁，正巧被另一客机乘客拍下全过程,2025-02-18 23:46,32238,3236,优雅叶子Dp,优雅叶子Dp,,https://toutiao.com/group/7472909712212689444/,,0,0,True
震撼！十秒内连续弹射三架重型战斗机！,2025-01-18 23:48,16941,2280,辉哥杂谈。,辉哥杂谈。,,https://toutiao.com/group/7461406546325406218/,,0,0,True
海南部分旅居人群成逃难大军，对于这样的生活，大家怎么看？,2025-02-09 10:48,3425,705,采云飘飘,采云飘飘,,https://toutiao.com/group/7469369555660309055/,,0,0,True
93岁老人犯强奸罪被判15年，看守所拒绝收押？官方回应来了！,2025-02-17 15:59,2150,258,笑看人生,笑看人生,,https://toutiao.com/group/7472418202992116250/,,0,0,True
江苏春晚：不怪小沈阳老笑场，程野这打扮也太恶心人了！憋住别吐,2025-02-10 08:38,8230,473,乐视新综艺,乐视新综艺,,https://toutiao.com/group/7469706947747447311/,,0,0,True
根本念不完！特朗普连列数十项“离谱”开支：台下笑声不断,2025-02-21 06:14,6100,2379,海峡导报大财经,海峡导报大财经,根本念不完！特朗普连列数十项“离谱”开支：台下笑声不断,https://toutiao.com/group/7473751912450490916/,,0,0,True
惊爆！美女直播间高唱《英雄赞歌》，燃爆全场，唱响时代强音！,2025-01-23 01:52,63589,14556,清心畅谈,清心畅谈,,https://toutiao.com/group/7462922882546188835/,,0,0,True
公公竟然和儿媳偷情，哪料被妻子撞见，这下有戏看了！,2025-01-21 08:05,13516,1085,南瓜午夜厅,南瓜午夜厅,,https://toutiao.com/group/7462273852651979274/,,0,0,True
笑得肚子疼幽默搞笑段子，神医看病，这才是搞笑界的天花板！,2024-12-03 11:15,12390,1558,暖心向阳,暖心向阳,,https://toutiao.com/group/7444142624979550729/,,0,0,True
