title,publish_time,like_count,comment_count,media_name,source,abstract,article_url,tag,is_yaowen,article_sub_type,has_video
正月还没过完，已有三位明星被抓，第二位最可恨,2025-02-23 03:20,704,193,卯是卯,卯是卯,猥亵儿童，到酒后砸车、直播造谣，桩桩件件都触碰法律红线，这背后究竟是名利诱惑下的迷失，还是法律意识的淡薄?,https://toutiao.com/group/7474445813838512640/,,0,0,False
罪域：中央最大老虎被查，没人敢抓捕，书记：后台再硬我亲自去抓,2025-01-14 06:17,22602,777,谍战影视营,谍战影视营,,https://toutiao.com/group/7459651246346043919/,,0,0,True
完整解读：泽连斯基和特朗普大吵，没吃饭就被赶出白宫,2025-03-01 03:23,19527,4818,第一军情,第一军情,据央视3月1日消息，当地时间周五，乌克兰总统泽连斯基抵达美国白宫，在大名鼎鼎的“椭圆办公室”和美国总统特朗普、副总统万斯进行了激烈的公开会谈，最终没有达成任何协议，矿产协议也没签署，安全保障也没承诺，美国方面十分不满，连国宴都没有招待，就把泽连斯基为首的乌克兰代表团轰出了白宫。,https://toutiao.com/group/7476676425131639331/,,0,0,True
当你混到独来独往，没有电话，没有聚会，说明你活成了这三种人,2025-01-02 14:07,3613,1158,静品岁月,静品岁月,人到中年，越来越不喜欢热闹。当你混到独来独往，没有电话，没有聚会，说明你活成了以下3种类型的人!叔本华在《人生的智慧》里有这样一段话:“在这个世界上，真正可供我们选择的路只有两种，要么享受孤独，要么沦入世俗。凡是人群扎堆聚集，主要话题无外乎三个，拐弯抹角炫耀自己，添油加醋贬低别人，相互窥探，搬弄是非。”,https://toutiao.com/group/7455311294829216290/,,0,0,False
一口气看完荒野求生惊悚片《迪卡娅》 #影视解说 #好剧推荐,2025-01-26 10:02,19831,393,静静说事情,静静说事情,,https://toutiao.com/group/7461255082709926410/,,0,0,True
人间：丈夫突然提出分房睡，妻子偷偷装监控，发现惊人的一幕,2024-12-14 08:55,14081,141,经典影视大联欢,经典影视大联欢,,https://toutiao.com/group/7448188651097293349/,,0,0,True
女子怀孕5个月，每天听到肚子里有哭声，检查后医生大骂丈夫渣男,2025-02-21 10:46,2445,169,暖心,暖心,,https://toutiao.com/group/7473821864612905483/,,0,0,True
