title,publish_time,like_count,comment_count,media_name,source,abstract,article_url,tag,is_yaowen,article_sub_type,has_video
微视频《中国步伐》,2024-09-29 14:10,1992,818,新华网,新华网,75年步履铿锵，75年风雨兼程，75年山河巨变。“没有任何力量能够阻挡中国人民和中华民族的前进步伐。,http://my-h5news.app.xinhuanet.com/h5/article.html?articleId=eaac27857c17908cc0f93e9cd69238d3,,0,0,False
5座车拉6个人被判超员，车主1句话把交警问懵,2024-08-05 20:20,15968,3786,奇妙钢笔pA8JyP,奇妙钢笔pA8JyP,,https://toutiao.com/group/7399752843772559906/,,0,0,True
中国一枚导弹打醒美国，这话说得太气人！（上）,2024-09-29 09:00,6143,210,占豪,占豪,,https://toutiao.com/group/7419987341437043200/,,0,0,True
为国争光却遭郎平弃用！转身效力土耳其的王一梅，如今咋样了？,2024-08-31 13:19,932,135,豆莱说,豆莱说,光阴似箭，日月如梭，当初的少女早已退役，成为了排球场的幕后人，这么多年她都经历了什么，现在又怎么样了呢?,https://toutiao.com/group/7409287778514567718/,,0,0,False
男子与女子在河中嬉戏玩耍，突然连续将女子的头按入水中,2024-09-26 04:40,987,155,经视看天下,经视看天下,,https://toutiao.com/group/7418807108637819444/,,0,0,True
2013年，湖南26岁女孩嫁给71岁老头，婚后还生下一子，如今怎样了,2024-07-12 11:59,25609,2383,智史通鉴,智史通鉴,2013年4月17日，长沙宁乡县的民政局迎来了一对特殊的夫妻。一个71岁的老头和一个26岁的女孩，离远了看，甚至像爷爷和孙女。面对工作人员异样的眼光，女孩说：“我和他是真心相爱的！”这让人好奇，这对相差45岁的夫妻，他们之间到底有着怎样的爱情故事？,https://toutiao.com/group/7390696631223534120/,,0,0,False
这就是中国排面！国庆升旗仪式上，国旗护卫队步步铿锵,2024-09-30 23:03,5478,496,北京日报客户端,北京日报客户端,,https://rss2.bjd.com.cn/content/s66fb2c1be4b01a5d71c96c58.html,,0,0,True
男子把女子约出来吃烧烤 男方吃完人却不见了 女子蹲地上没钱结账,2024-07-22 08:01,21010,5394,临沂综合广播,临沂综合广播,,https://toutiao.com/group/7394367323999568418/,,0,0,True
完整版!天安门广场升旗仪式：护旗方队步伐铿锵 民众齐挥国旗庆祝,2024-09-30 22:28,6140,750,海客新闻,海客新闻,完整版！天安门广场升旗仪式：护旗方队步伐铿锵 民众齐挥国旗庆祝,https://toutiao.com/group/7420566751568233012/,,0,0,True
妻子与陌生男人吃饭，丈夫在外站了20分钟，进来惊呆众人,2024-08-23 08:36,47341,7917,沈视早报,沈视早报,,https://toutiao.com/group/7406251098776109603/,,0,0,True
10月1日，国庆天安门广场升国旗完整视频#有亿种骄傲叫我爱你中国,2024-10-01 00:11,9906,1300,央广网,央广网,,https://toutiao.com/group/7420593175296737832/,,0,0,True
中国国乒又火了！决胜时刻，领军人物疯狂逆转，上演最解气的一幕,2024-09-29 06:49,4419,424,乐播体育,乐播体育,,https://toutiao.com/group/7419953587779797515/,,0,0,True
她是央视最惨主持人，男友被判死缓，丈夫诈骗入狱，47岁无人敢娶,2024-08-27 23:30,2168,207,闻书识焉,闻书识焉,她曾是央视的台柱子，和董卿、周涛并称为央视的三朵金花。回顾刘芳菲的前半生，最令人感到惋惜的，便是她的感情生活，47岁至今无人敢娶。,https://toutiao.com/group/7407743113688564258/,,0,0,False
黑龙江美女囚犯毕丽梅，被枪决后在殡仪馆苏醒，家属：放了她吧?,2024-08-25 14:32,1817,260,冯律讲法,冯律讲法,女死刑犯被枪决后在殡仪馆起死回生，当场把火化的工作人员吓得够呛，就连随行的警察都吓了一跳，壮着胆上前检查一番后，立马把离奇的情况上报。不一会儿法医赶到现场，证实了女犯人的确还活着，亲属闻声下跪，以死过一回为理由，恳求放了她。,https://toutiao.com/group/7407082388163002921/,,0,0,False
吃牛排时，为何旁边都放一个溏心蛋，不懂别随便吃，免得闹笑话,2024-07-13 06:05,2841,2648,云莳一,云莳一,阅读此文之前，麻烦您点击一下“关注”，既方便您进行讨论和分享，又能给您带来不一样的参与感，感谢您的支持。文|夏夜芦苇荡编辑|夏夜芦苇荡本文陈述所有内容皆有可靠信息来源赘述在文章结尾，但为提升文章可读性，细节可能存在润色，请理智阅读，仅供参考！,https://toutiao.com/group/7390663951204106787/,,0,0,False
富庶小国崩溃有多快？三年变地狱：全国断电缺粮，连吃饭都成问题,2024-08-04 04:14,2387,249,鲸探所,鲸探所,凭借着富裕的石油，中东国家也过上了坐在金钱堆里的生活，“头顶一块布，中东我最富”更是很多国家对于中东国家的“印象”。然而在满是石油和金钱的中东地区，却有一个例外:黎巴嫩。,https://toutiao.com/group/7398766345946399273/,,0,0,False
美国“标准-3”系统大获成功，能克制中国洲际导弹，这是真的？,2024-09-25 07:00,7304,716,瞩望云霄,瞩望云霄,美国“标准-3”系统大获成功，能克制中国洲际导弹，这是真的？,https://toutiao.com/group/7418389715939754532/,,0,0,True
中国休假第一天，美联储给了世界重重一击,2024-10-01 05:32,1028,554,金融界,金融界,保持高度警惕是明智之举，一个小小的冲击就可能迅速改变局势。中国股市收盘后，全球市场迎来变数。· 经济:我们的经济总体上是强劲的，当前没有任何迹象表明经济更有可能陷入衰退。,http://m.jrj.com.cn/toutiao/2024/10/1/43697065.shtml,,0,0,False
港姐归来，小奎坐大奔热情迎接，爱人见面抱头痛哭 #相亲,2024-07-05 04:45,23630,4867,海哥量地球,海哥量地球,,https://toutiao.com/group/7388008203738415653/,,0,0,True
航天功勋吴美蓉院士突然死亡，死因曝光，三年前的遭遇令人心痛,2024-08-03 13:02,2210,263,笑史云烟,笑史云烟,就在全国人民都将注意力放在巴黎奥运会上时候，国内突然传来一纸讣告，宣布了一个女科研工作者致敬的离世。,https://toutiao.com/group/7398895345454416403/,,0,0,False
这一次，45岁面临百亿赔偿的东北雨姐，给网红圈好好上了一课,2024-09-29 05:40,543,362,卿羽飞,卿羽飞,经常看抖音的朋友应该对东北雨姐非常的熟悉，她以独特的东北农村额生活方式在一众短视频中脱颖而出。但是最近东北雨姐可摊上事了，无数的消费者在向雨姐讨要赔偿，甚至雨姐还陷入到了打人的风波当中。,https://toutiao.com/group/7419929476304011813/,,0,0,False
毁了王治郅，逼姚明退役，他凭一己之力让中国篮球倒退了二十年!,2024-08-07 19:45,1043,390,吃瓜崽崽,吃瓜崽崽,在阅读此文之前，辛苦您点击一下“关注”，既方便您进行讨论和分享，又能给您带来不一样的参与感，感谢您的支持！本文叙述皆有官方信源，为了给读者更好体验，放在了文章后缀！文 锦青一个人有可能影响中国的篮球事业发展吗？真的可能，至少信兰成做到了。,https://toutiao.com/group/7400359671892148788/,,0,0,False
霍尊母子演唱会合唱《祈祷》,2024-09-08 08:14,44461,1518,爱生活爱音乐,爱生活爱音乐,,https://toutiao.com/group/7412182773852537381/,,0,0,True
