title,publish_time,like_count,comment_count,media_name,source,abstract,article_url,tag,is_yaowen,article_sub_type,has_video
有这样的老婆，你家祖坟都冒青烟了！,2025-02-04 03:11,48961,8754,乐观的冰淇淋I,乐观的冰淇淋I,,https://toutiao.com/group/7467226170908606976/,,0,0,True
身高171的金晨换上体操服！1米1的腿瞬间成焦点，一字马惊艳全场,2025-01-16 00:18,4536,842,青涩星空sn,青涩星空sn,,https://toutiao.com/group/7460300720655319586/,,0,0,True
原配抓小三，男子从妻子手中解救小三头也不回的就走啦！！,2024-11-27 01:42,52157,9168,甜甜分享,甜甜分享,,https://toutiao.com/group/7441768400278028851/,,0,0,True
罪域：中央最大老虎被查，没人敢抓捕，书记：后台再硬我亲自去抓,2025-01-14 06:17,16907,642,乐视谍战影视营,乐视谍战影视营,,https://toutiao.com/group/7459651246346043919/,,0,0,True
春晚：赵本山快让刘能、丫蛋下台吧！观众都快笑岔气，太经典了！,2025-02-05 07:29,713,144,PP情感鸳鸯锅剧院,PP情感鸳鸯锅剧院,,https://toutiao.com/group/7467833699913040419/,,0,0,True
女老师跳“凌波微步”，段誉看了要哭泣,2024-12-16 10:12,3125,421,表哥爱跳舞,表哥爱跳舞,,https://toutiao.com/group/7448950466706145792/,,0,0,True
这么高的个子，不跳广场舞可惜了,2024-11-20 23:28,27966,3610,成武融媒,成武融媒,,https://toutiao.com/group/7439507575931929127/,,0,0,True
女婿拜年被瞧不起后续：连夜住酒店，岳父道歉，男子放话再不来了,2025-02-02 12:25,6106,4969,猪猪的生活记,猪猪的生活记,女婿拜年被瞧不起后续：连夜住酒店，岳父道歉，男子放话再不来了。都说丈母娘看女婿，越看越顺眼，也成了半个儿子，可是谁也想不到2025年的春节，山东一位女婿竟然被自己丈母娘赶出来了，具体是为什么呢？,https://toutiao.com/group/7466793878310355475/,,0,0,False
金星问李春平：和美国老太这13年里，有没有提出夫妻生活,2025-02-03 16:00,1413,524,PP街坊放映厅,PP街坊放映厅,,https://toutiao.com/group/7461158328631149082/,,0,0,True
老婆卖淫、老公放风，城中村滋生“夫妻档”团伙，警方出击拔毒瘤,2025-02-03 03:52,4528,1651,观剧傻白甜,观剧傻白甜,,https://toutiao.com/group/7467035747732701736/,,0,0,True
