title,publish_time,like_count,comment_count,media_name,source,abstract,article_url,tag,is_yaowen,article_sub_type,has_video
联播+｜部署反腐攻坚战 总书记要求风腐同查同治,2025-01-07 11:20,910,642,国际在线,国际在线,1月6日，习近平总书记在中国共产党第二十届中央纪律检查委员会第四次全体会议上发表重要讲话，指出要深入推进风腐同查同治，并强调坚持正风肃纪反腐相贯通，以“同查”严惩风腐交织问题，以“同治”铲除风腐共性根源。,https://news.cri.cn/toutiaopic/8b387f8b-22a4-734c-cfe9-a59f6cb621b6.html,,0,0,False
新婚33天卷走274万4套房，出逃后丈夫跨国追捕，如今下场大快人心,2024-12-20 22:06,5590,274,八号探秘人,八号探秘人,在阅读此文之前，辛苦您点击一下“关注”，既方便您进行讨论和分享，又能给您带来不一样的参与感，感谢您的支持！编辑丨QQ·B“色字头上一把刀！”深圳富豪结婚33天竟被卷走274万元和名下4套房产。不仅如此，他还被扣上了“接盘侠”的帽子，啥也没干喜当爹。,https://toutiao.com/group/7450399558821052982/,,0,0,False
铁公鸡来相亲，一听不用买单拼命点菜，哪料姑娘做法更狠,2024-12-26 09:06,1776,544,乐视热播综艺精选,乐视热播综艺精选,,https://toutiao.com/group/7452643056194421286/,,0,0,True
房子旁边住着有120条“狗母蛇”，很多人都没见过，拍给大家看看,2024-11-05 12:27,8207,2822,乡村小故事小妹,乡村小故事小妹,房子旁边住着有120条“狗母蛇”，很多人都没见过，拍给大家看看,https://toutiao.com/group/7433770965259354650/,,0,0,True
清汤面好吃有诀窍，教你面馆30年不外传的秘诀，劲道爽滑汤鲜味美,2024-12-13 13:30,8688,1159,百变小厨坊,百变小厨坊,,https://toutiao.com/group/7447888258186347018/,,0,0,True
抗美援朝的将军亮相，全体明星自发起立，这幕太感人,2025-01-03 07:32,12362,1412,乐视天天剧好看,乐视天天剧好看,,https://toutiao.com/group/7455587633452843572/,,0,0,True
老纪和珅这段对话，以前小时候听不懂，如今听完受益终身,2024-12-28 23:16,6485,1857,乐视扒剧小妹儿,乐视扒剧小妹儿,,https://toutiao.com/group/7453420191947424293/,,0,0,True
罕见！一个月内官方三次明确上调养老金，2025养老金调整有惊喜？,2025-01-04 02:56,6889,3724,思之想之,思之想之,在一个月内，官方至少三次明确上调2025年养老金，这个频率是前所未有的，这传递了什么信号呢?思之想之发现，从2024年12月12日开始至今，在一个月内的时间里，官方至少三次明确提出上调2025年养老金。,https://toutiao.com/group/7455850117002691135/,,0,0,False
中国核动力航母就要来了！,2025-01-06 23:47,6786,258,王丰台北,王丰台北,2024年与2025年交界的这两个星期，对我们中国人而言真的是惊喜连连。视频先是惊爆了两架第六代战机横空出世，紧接著视频又披露了轰20的雄姿。接下来，还会有什么更麻辣的新闻引爆出来呢？就好像吃麻辣锅，不够麻辣就不过瘾，接下来据说就是核动力航母该出场了。所谓好戏在后头，总不能一下就演完了，好戏要连台，好戏要紧锣密鼓，但也不能餐餐都吃麻辣锅，吃麻辣锅的中间总要有一点水果甜点，再接著吃麻辣锅才回味无穷。没错，今天讲核动力航母。(声明:本视频系本人自己拍摄原创制作，脚本文稿全部都是作者自己亲自撰写，脚本素材如有引述新闻信息素材时，作者都会在视频中口头说明来源。特此声明),https://toutiao.com/group/7456953349444502027/,,0,0,True
“六星街里还传来巴扬琴声吗……”狼戈、张英席合唱《苹果香》,2024-12-31 14:55,3492,190,央视频,央视频,,https://toutiao.com/group/7454589818538820115/,,0,0,True
小女孩上部队找爸爸，少校阿姨主动搭讪，谁知看到女孩父亲傻眼了,2024-12-23 16:01,3915,908,乐视群星访谈秀,乐视群星访谈秀,,https://toutiao.com/group/7451525814283960872/,,0,0,True
98岁老郎中教我苹果养生新吃法，每天坚持这样吃，睡眠好，身体棒,2024-12-31 11:43,12607,1246,百变小厨坊,百变小厨坊,98岁老郎中教我苹果养生新吃法，每天坚持这样吃，睡眠好，身体棒,https://toutiao.com/group/7454540163725656628/,,0,0,True
中国第4艘航母，被卫星发现蛛丝马迹，直接十万吨级核动力？,2025-01-07 02:11,1391,556,蒋福伟,蒋福伟,卫星发现新航母的“蛛丝马迹”，中国下一艘航母或直接十万吨级核动力?近日，有西方军事专家援引商业卫星照片称，中国航母楼的外形出现了肉眼可见的变化。,https://toutiao.com/group/7456990223185035816/,,0,0,False
直击救援现场：武警部队驰援西藏灾区 多名受困群众被从废墟救出,2025-01-07 07:01,7785,875,海客新闻,海客新闻,直击救援现场：武警部队驰援西藏灾区 多名受困群众被从废墟救出,https://toutiao.com/group/7457064708265263657/,,0,0,True
炸鱼块，到底用淀粉还是面粉，今天分享一个又香又脆的做法,2025-01-02 09:26,8535,540,家常的味道,家常的味道,,https://toutiao.com/group/7455247105683096076/,,0,0,True
张颂文方终于回应了，剧组发布声明，回应姜尘录音，反转了？,2025-01-07 03:14,282,202,藏剑游侠儿,藏剑游侠儿,张颂文事件随着女演员姜尘在直播中爆料前任家暴、收取学费、强迫发生关系、跟前任是老乡、养过猴子等细节，引起了吃瓜网友的好奇心，开始深扒这人的身份。,https://toutiao.com/group/7457004712824177167/,,0,0,False
21时58分，杜梅不幸去世，年仅30岁！,2025-01-06 23:41,1499,334,极目新闻,极目新闻,据中国青年网2025年1月6日报道，3日21时58分，同济大学上海国际知识产权学院2021级博士生杜梅因病不幸逝世，年仅30岁。,http://jms.ctdsb.net/jmythshare/#/index_share?cId=0&contentType=5&contentId=2346423,,0,0,False
西红柿去皮不要再用开水烫了，只需一个筷子，10秒一个，简单快速,2025-01-06 10:57,1000,274,百变小厨坊,百变小厨坊,西红柿去皮不要再用开水烫了，只需一个筷子，10秒一个，简单快速,https://toutiao.com/group/7456754882683339279/,,0,0,True
丈母娘比女婿大不了两岁，女婿一口一个妈地叫，丈母娘：别叫我妈,2025-01-02 16:00,736,157,乐视群星访谈秀,乐视群星访谈秀,,https://toutiao.com/group/7455197819499069988/,,0,0,True
山楂干泡水很多人都泡错了，难怪没用，今天教你正确做法，真管用,2024-11-02 11:46,8058,304,百变小厨坊,百变小厨坊,,https://toutiao.com/group/7432646945211941402/,,0,0,True
养出92个世界冠军的李永波，卸任后却跑到国外种榴莲，如今怎样了,2025-01-05 04:11,466,108,八号探秘人,八号探秘人,退役成为教练后，李永波更是执教出92个世界冠军，创造了国羽的历史。不仅拒绝了体坛的高薪返聘，而且还跑到国外种榴莲去了。,https://toutiao.com/group/7455979333979570724/,,0,0,False
官方通报上午9点办事大厅空岗：确实存在，已对相关工作人员给予行政记过处分,2025-01-07 09:35,265,158,九派新闻,九派新闻,官方通报上午9点办事大厅空岗：确实存在，已对相关工作人员给予行政记过处分,https://feedrec-video.oos-hbwh.ctyunapi.cn/72063d67043446989ff42c394173a0c21736242448074.mp4?c=toutiaohao_svideo_toutiaojpsp_53dc6a72c9134736a3fa04ecc8f73756,,0,0,True
现场视频！运-20抵达西藏日喀则定日机场,2025-01-07 10:32,3906,155,国际在线,国际在线,,https://crionline-media.cri.cn/cb5a6d96-d0c4-4fd0-a895-b6135667d84a/video/4d0f0e26f79d4321b03dd4755f8df89f.mp4,,0,0,True
日本专家：中国六代机惹人发笑，想吓唬敌人举手投降,2025-01-07 03:44,5409,2693,第一军情,第一军情,对于中国取得的国防成就，日本人的态度非常有意思，他们在表面上给予了假惺惺的赞扬，但背后却隐藏着怀疑和不安。,https://toutiao.com/group/7457013487617802787/,,0,0,False
中日，一出好戏即将上演,2025-01-01 23:38,7968,7223,牛弹琴,牛弹琴,年终上演精彩大戏，新年不排除更有一出好戏。反正，从积极的角度看，中日关系，正处于近20年来最好时期。之所以能说最好，是因为之前实在是太糟。三个值得关注的动向。第一个动向，日本首相石破茂的表态。日前在接受电视访谈时，石破茂说：“日本首相访问中国是极为重要的事。,https://toutiao.com/group/7455091815717388850/,,0,0,False
父母来看女儿，把合租小伙当成女婿，让两人睡一屋,2025-01-04 07:13,1771,536,乐视天天剧好看,乐视天天剧好看,,https://toutiao.com/group/7455953838555415076/,,0,0,True
厨师长教你：“葱爆羊肉”羊肉滑嫩、鲜香不膻,2024-12-27 07:34,4062,738,美食作家王刚,美食作家王刚,厨师长教你：“葱爆羊肉”羊肉滑嫩、鲜香不膻,https://toutiao.com/group/7452991735665263139/,,0,0,True
13年9岁男孩扶老太被讹，老太发誓说谎死全家，儿媳却意外说漏嘴,2024-10-25 08:09,8238,2269,睿之悦,睿之悦,文|睿之悦编辑|睿之悦“就是这个娃撞了我，我虽然年纪大了，但我可不糊涂……”2013年，一位9岁的小学生江小云好心的将摔倒的蒋老太扶起，却反被讹100万。当时的蒋老太甚至还发毒誓，声称要是说谎的话就“死全家”。那么，这到底是怎么一回事呢？,https://toutiao.com/group/7429620647524450831/,,0,0,False
河南警察3岁女儿被拐，苦寻全国23年无果，结果却发现女儿在对门,2024-11-05 07:43,6367,684,八号探秘人,八号探秘人,寻亲23年无果，丢失的女儿竟住在对门?但它却真实发生在河南洛阳的梁绍波身上。是意外走丢，还是人贩子所为，三岁的女儿怎会离奇失踪?,https://toutiao.com/group/7433697108120142345/,,0,0,False
原来火腿肠铝环下藏着个“小机关”，轻轻一拉，完整剥开，太棒了,2024-12-30 12:48,5399,3313,百变小厨坊,百变小厨坊,原来火腿肠铝环下藏着个“小机关”，轻轻一拉，完整剥开，太棒了,https://toutiao.com/group/7454186052081680911/,,0,0,True
拜登下台前搅动南海风云，美菲连手挑衅中国，中国不再忍强硬回击,2025-01-03 03:44,23684,1007,邱毅台湾,邱毅台湾,,https://toutiao.com/group/7455530031461171753/,,0,0,True
煮速冻饺子，切记别用开水和冷水煮，教你方法，出锅和现包的一样,2025-01-04 11:48,1659,334,百变小厨坊,百变小厨坊,,https://toutiao.com/group/7456025845027570203/,,0,0,True
赵本山买鸡这段，据说导演组都笑趴了，真是老戏骨,2025-01-06 15:43,1967,327,山丘,山丘,,https://toutiao.com/group/7456827104982811170/,,0,0,True
厨师长教你葱爆肉的做法，步骤详细，葱香浓郁肉片滑嫩下酒又下饭,2024-12-17 08:43,4071,260,阿彬纪实,阿彬纪实,,https://toutiao.com/group/7449298669800522274/,,0,0,True
沈春阳笑死个人，满口胡说八道，小沈阳气得说不出话,2024-12-28 16:52,5036,792,乐视影视圈,乐视影视圈,,https://toutiao.com/group/7453290317240861199/,,0,0,True
广西49岁老汉娶19岁姑娘，结婚21年生下15个孩子，如今有何下场？,2024-10-20 08:32,10747,1293,艺述史,艺述史,她19岁出嫁，21年里总共生育了15个孩子，其中4个男孩子11个女孩子，家里热闹的像是开了一所学校一样。,https://toutiao.com/group/7427400319418384948/,,0,0,False
清华才女李一诺：27岁博士毕业，4年生3娃，能替世界首富花钱,2024-12-18 05:51,8935,413,云莳一,云莳一,家庭是她第一个学校，妈妈是她第一任老师。李一诺27岁博士毕业进入美国麦肯锡公司，33岁成为公司全球董事合伙人，之后四年连生3娃。,https://toutiao.com/group/7449591069311779355/,,0,0,False
