title,publish_time,like_count,comment_count,media_name,source,abstract,article_url,tag,is_yaowen,article_sub_type,has_video
美军战机到底被谁打下来的？这次真的出大事了（上）,2024-12-26 10:00,2044,121,占豪,占豪,这美军不是全球最牛的海军吗？怎么就把自己的战机都击落了？事实到底应该是怎样的呢？,https://toutiao.com/group/7452265675122278912/,,0,0,True
新婚33天卷走274万4套房，出逃后丈夫跨国追捕，如今下场大快人心,2024-12-20 22:06,3832,212,八号探秘人,八号探秘人,在阅读此文之前，辛苦您点击一下“关注”，既方便您进行讨论和分享，又能给您带来不一样的参与感，感谢您的支持！编辑丨QQ·B“色字头上一把刀！”深圳富豪结婚33天竟被卷走274万元和名下4套房产。不仅如此，他还被扣上了“接盘侠”的帽子，啥也没干喜当爹。,https://toutiao.com/group/7450399558821052982/,,0,0,False
微信悄然更新，把人情世故狠狠拿捏了,2024-12-21 12:23,321,302,IT之家,IT之家,家友们，小编失策了，在 12 月 16 日那天，微信推送了安卓平台 8.0.55 正式版更新。很是罕见，在微信更新这件事上，iOS 遥遥落后于安卓了。,https://toutiao.com/group/7450839690036412965/,,0,0,False
相爱37年零绯闻，丁勇岱对赵雪华一见钟情，如今却对儿子很失望,2024-11-09 21:43,3331,296,八号探秘人,八号探秘人,在阅读此文之前，辛苦您点击一下“关注”，既方便您进行讨论和分享，又能给您带来不一样的参与感，感谢您的支持！编辑丨xk1985年，丁勇岱转过楼梯拐角，撞到人生挚爱，这一下把他撞“开窍”了。那时他还不是《末路》里的白宝山。也不是《跨过鸭绿江》里的彭老总，更不是《人世间》里的周志刚。,https://toutiao.com/group/7435160230918406707/,,0,0,False
樊振东：无力承受不参赛就罚款的新规，选择退出世界排名不会退役,2024-12-27 03:15,5169,5020,直播吧,直播吧,直播吧12月27日讯 樊振东发布微博，宣布退出世界排名的决定，同时表示自己不会退役。本周国际乒联最新世界排名中，樊振东排名第六，8个有效积分中有5个被赋0。,https://news.zhibo8.com/other/2024-12-27/676e1af5338dfnative.htm,,0,0,False
"我采访了100个剩女后发现，没 ""接触"" 过男人的女人，都有一个共性",2024-12-26 06:43,1251,199,第一心理,第一心理,随着社会越来越开放包容，越来越多的女性有了不婚的选择权。为了了解“剩女”这一群体，我采访了100位不同工作、不同地区的独身女性。“剩女”一词无疑带着贬义和偏见，更是我们传统婚恋观“男大当婚，女大当嫁”的体现。,https://toutiao.com/group/7452606714530120218/,,0,0,False
帅哥看不上相亲女，撒谎没车没房没户口，姑娘的反应绝了,2024-11-18 05:47,5139,484,乐视天天剧好看,乐视天天剧好看,,https://toutiao.com/group/7438491946131128872/,,0,0,True
弟弟光荣退伍，姐姐兴奋去车站接他，怎料一见弟弟瞬间哭了,2024-11-05 06:34,42565,3385,乐视天天剧好看,乐视天天剧好看,,https://toutiao.com/group/7433679820573934091/,,0,0,True
两款新战机同时亮相，美国人“天塌了”：震惊、质疑、令人沮丧,2024-12-27 02:59,12926,1607,第一军情,第一军情,12月26日，大量的社交媒体发布视频和图片，显示一架从未见过的新式飞行器在西南上空亮相，这架飞机采用钻石式三角机翼、无尾设计和扁平化设计，还配备了三台航空发动机，造型奇特让伴飞的双座版歼-20S战机都黯然失色。紧接着，数千公里之外的东北，一架体型稍小、采用“兰姆达”式后掠翼和无尾设计的飞行器首次公开亮相，由沈飞的歼-16担任“追逐机”。,https://toutiao.com/group/7452920971226251813/,,0,0,True
浙江男子爬山发现太平天国时期兵营遗迹 文保中心：有开间和偏房,2024-12-26 10:53,2808,447,新京报,新京报,,https://m.bjnews.com.cn/detail/1735210358129394.html,,0,0,True
又退一个！陈梦：身体无法负荷每一次高强度赛事 退出WTT世界排名,2024-12-27 06:12,1518,2690,直播吧,直播吧,奥运结束后，前期一直高强度的身体训练以及精神紧绷，在那一刻堆积到了顶点，我需要一段时间来调整自己的身体状态以及根据身体因素对自己接下来职业生涯进行新的规划，但近期WTT最新出台的退赛罚款新规定，因身体目前还无法负荷每一次高强度赛事，出于对国际组织的尊重，已于周一签署文件，最终做出退出世界排名的选择。,https://news.zhibo8.com/other/2024-12-27/676e447b6490enative.htm,,0,0,False
未来四年大陆不会有统一台湾时间表？随时可解放台湾，何需时间表,2024-12-26 05:50,17090,1607,邱毅台湾,邱毅台湾,,https://toutiao.com/group/7452593764326965800/,,0,0,True
湖南最长寿老人124岁高龄，长寿秘诀出世，让人大开眼界,2024-12-21 16:00,1286,129,乐视群星访谈秀,乐视群星访谈秀,,https://toutiao.com/group/7450730131821167140/,,0,0,True
益生菌真的那么神奇吗？有关益生菌的几个误区 你“踩雷”了吗？,2024-12-07 02:35,1867,107,央视频,央视频,,https://toutiao.com/group/7445492942887715365/,,0,0,True
萝卜和鸡蛋这样做，比吃补药还补，顿顿吃都不会腻，又香又下饭,2024-10-30 12:28,69642,4257,小寒厨艺,小寒厨艺,萝卜和鸡蛋这样做，比吃补药还补，顿顿吃都不会腻，又香又下饭,https://toutiao.com/group/7431405463378919975/,,0,0,True
广西49岁老汉娶19岁姑娘，结婚21年生下15个孩子，如今有何下场？,2024-10-20 08:32,9050,1140,艺述史,艺述史,她19岁出嫁，21年里总共生育了15个孩子，其中4个男孩子11个女孩子，家里热闹的像是开了一所学校一样。,https://toutiao.com/group/7427400319418384948/,,0,0,False
海南富商张晖：花8亿建108米海上观音像，4年后死在水中死因成谜,2024-10-19 04:49,4142,702,八号探秘人,八号探秘人,在阅读此文之前，辛苦您点击一下“关注”，既方便您进行讨论和分享，又能给您带来不一样的参与感，感谢您的支持！编辑丨xk他是中国的一名富商，耗费8亿元完成了自己的梦想。可梦想落地成为现实的时候，他却在4年后莫名其妙的死去。他就是张晖，上个世纪末海南岛旅游业的龙头当家人。,https://toutiao.com/group/7427288913095492134/,,0,0,False
100年前，清朝罕见留影，王爷妻妾婀娜多姿，乞丐全身挂满垃圾,2024-10-14 09:58,2761,309,万物知识局,万物知识局,每一张老照片，都像是时间的低语，它们静静地躺在历史的相册中，却在不经意间将我们拉回到那个遥远而神秘的年代。,https://toutiao.com/group/7425457574731579919/,,0,0,False
阿富汗“卖枪”犹如卖白菜 ，外国人竟能随便买？喷子威力太大了,2024-12-26 10:00,7529,863,耀阳环游记,耀阳环游记,,https://toutiao.com/group/7452374019187147315/,,0,0,True
独家视频丨满载排水量4万余吨！海军四川舰来了 舷号“51”,2024-12-27 02:16,6771,10196,央视新闻,央视新闻,12月27日上午，由我国自主研制建造的076两栖攻击舰首舰下水命名仪式在上海沪东中华造船厂举行。“起来，不愿做奴隶的人们……”10时许，下水命名仪式开始，伴随着雄壮的中华人民共和国国歌，五星红旗冉冉升起。,https://content-static.cctvnews.cctv.com/snow-book/index.html?item_id=9366448341997835807&source=50006&sub_source=50006_001,,0,1,False
雍正王朝：建议不要吃饭看，堪称全剧最有深度的一段，经典看不厌,2024-11-15 01:24,4790,472,乐视追剧小狮妹,乐视追剧小狮妹,,https://toutiao.com/group/7437032562265489932/,,0,0,True
男子仗着自己是银行高管，自己家房子漏水要砸别人家墙,2024-12-26 10:00,2667,682,随心所欲的打工仔,随心所欲的打工仔,,https://toutiao.com/group/7452599108012868123/,,0,0,True
比亚迪巴西工厂施工方员工集体声明：护照没被扣，工资正常发，福利保障都有！李云飞也有最新回应,2024-12-26 12:54,482,1428,每日经济新闻,每日经济新闻,近日，有媒体报道称，比亚迪巴西工厂建设工地被当地官方检查并叫停。12月26日，对此消息，比亚迪巴西工厂的建设外包施工方之一金匠集团巴西分公司表示，近期遭到巴西当地劳工部门频繁密集检查。,http://www.nbd.com.cn/rss/jinri_toutiao/articles/3700785.html,,0,0,False
中国又躺枪了,2024-12-21 06:24,5387,158,牛弹琴,牛弹琴,特朗普对欧盟发飙，欧盟却有神操作,https://toutiao.com/group/7450747182111523380/,,0,0,True
四川：可4倍音速飞行 成都造“筋斗云”成功试飞,2024-12-20 10:52,7768,894,看看新闻,看看新闻,四川：可4倍音速飞行 成都造“筋斗云”成功试飞,http://mediaplay.kksmg.com/2024/12/20/h264_720p_600k_78546-DFTVHD-20241220175000-4800-967537-600k_mp4.mp4,,0,0,True
美妇约见老情人，见面场景真是太逗了，这俩人绝配！,2024-10-27 16:25,5068,635,乐视明星的那点事,乐视明星的那点事,美妇约见老情人，见面场景真是太逗了，这俩人绝配！,https://toutiao.com/group/7428157095108674088/,,0,0,True
