title,publish_time,like_count,comment_count,media_name,source,abstract,article_url,tag,is_yaowen,article_sub_type,has_video
董卿父亲董善祥：我这辈子最后悔的事，就是让宝贝女儿嫁给密春雷,2024-09-11 06:59,1482,158,稻述,稻述,提起央视主持，现在挑大梁的几乎就是撒贝宁、尼格买提、龙洋等人了，他们也都非常优秀，但常有人怀念起董卿还在的日子。,https://toutiao.com/group/7413267526601228852/,,0,0,False
上半年中美印新生人口：美国178万，印度1140万，中国让人意外,2024-09-23 12:16,1180,342,开心营业厅,开心营业厅,中美印是全球人口数量最多的三个国家，几乎占到了全球人口总数的近四成，不过，如今三个国家，却在生育率的问题上，遭遇了前所未有的挑战。,https://toutiao.com/group/7417736973647790628/,,0,0,False
美女和光棍相亲，一个敢问一个敢说，对话过程笑趴了,2024-07-19 09:25,8154,513,谷哥喜剧,谷哥喜剧,,https://toutiao.com/group/7393275619791864354/,,0,0,True
为国争光却遭郎平弃用！转身效力土耳其的王一梅，如今咋样了？,2024-08-31 13:19,905,128,豆莱说,豆莱说,光阴似箭，日月如梭，当初的少女早已退役，成为了排球场的幕后人，这么多年她都经历了什么，现在又怎么样了呢?,https://toutiao.com/group/7409287778514567718/,,0,0,False
罕见！100年前，英国游客拍下的清朝乡村，和想象中完全不一样,2024-09-20 02:07,2367,313,万物知识局,万物知识局,泥泞的土路，衣不蔽体的老百姓，即便是达官显贵的家中也十分破败，而这些都是清王朝的历史痕迹，虽说那时候中国摄影技术并不发达，但也有许多外国游客来到这里，拍摄下了许多老照片，为我们留下了珍贵的历史资料，那清朝到底是怎样的面貌呢?,https://toutiao.com/group/7416287738871267855/,,0,0,False
无论炒什么肉，不要用盐和料酒腌制，大厨教我绝招，肉片滑嫩不腥,2024-07-11 08:24,78633,3215,家常的味道,家常的味道,无论炒什么肉，不要用盐和料酒腌制，大厨教我绝招，肉片滑嫩不腥,https://toutiao.com/group/7390291377185096204/,,0,0,True
今天才知道！电动车“每天充”和“用完再充”，到底哪个更伤电池,2024-08-27 11:19,5918,1247,鲸探所,鲸探所,“今天到底给车充不充电？”估计大多数人每天回家都会想这个问题，看着自己的电动车电量又多又少的，充不充电也是一件非常难以抉择的事情。那么，电动车到底应该怎样充电呢？是每天都充，还是用完之后再充呢？电动车充电不管是在城市还是农村，电动车其实都是人们出门最常见的交通工具。,https://toutiao.com/group/7407773012533117475/,,0,0,False
小伙路上偶遇骑行的媳妇，本想质问一番，原来自己是小丑,2024-09-13 05:41,6877,1837,山西广电文娱,山西广电文娱,,https://toutiao.com/group/7413998825330704911/,,0,0,True
秋葵的神仙吃法，比吃补药还补，鲜香滑嫩又多汁，太香了,2024-08-07 08:58,19593,977,家常的味道,家常的味道,,https://toutiao.com/group/7400319304052245003/,,0,0,True
泰国空姐中文播报，这口音笑死人，挺上头啊,2024-09-23 05:31,10261,2132,奋发有为晚风Wj9PdC,奋发有为晚风Wj9PdC,,https://toutiao.com/group/7411686103767319052/,,0,0,True
她认干爹改国籍，曾叫嚣要击败女国乒，却在巴黎奥运会丢尽了脸,2024-08-26 14:00,486,301,吃瓜崽崽,吃瓜崽崽,她曾是中国国籍，却因认干爹入韩籍。十九岁的她被国人认为是乒坛叛徒，还曾叫嚣女国乒。如今却成为了韩国乒乓一姐。,https://toutiao.com/group/7407375792933044790/,,0,0,False
4年骑行结束，1500天终于回到老家，感谢大家一路陪伴有缘江湖见,2024-09-07 03:50,71033,16745,刘伟元的旅行,刘伟元的旅行,4年骑行结束，1500天终于回到老家，感谢大家一路陪伴有缘江湖见！,https://toutiao.com/group/7411715839100977716/,,0,0,True
“骗购”中国坦克，用完就退货，想求买中国无人机，中国只卖不租,2024-09-24 22:42,763,155,开心营业厅,开心营业厅,自古以来诚信都是一个很重要的东西，不管是国家交往还是做生意，没有人愿意和一个不守信的人打交道。然而2009年，秘鲁为了在阅兵仪式上展示军事实力，“骗购”中国坦克撑场面，用完以后却以技术问题为由退货。,https://toutiao.com/group/7418121417771762215/,,0,0,False
2岁半女童失联43天，邻村悬崖底油葵地里找到遗体，家属怀疑孩子遇害希望严惩凶手,2024-09-25 03:07,326,273,大风新闻,大风新闻,9月24日，山西运城芮城县西陌镇马夭村董家庄2岁半女童的亲属张女士向华商报大风新闻记者证实，9月23日，侄女失踪第43天，孩子的遗体在邻村一处悬崖底下油葵地里被找到。目前，家属正考虑做尸检查明具体死因，芮城警方正加紧侦办。,https://toutiao.com/group/7418410529175978546/,,0,0,False
2013年，湖南26岁女孩嫁给71岁老头，婚后还生下一子，如今怎样了,2024-07-12 11:59,23830,2325,智史通鉴,智史通鉴,2013年4月17日，长沙宁乡县的民政局迎来了一对特殊的夫妻。一个71岁的老头和一个26岁的女孩，离远了看，甚至像爷爷和孙女。面对工作人员异样的眼光，女孩说：“我和他是真心相爱的！”这让人好奇，这对相差45岁的夫妻，他们之间到底有着怎样的爱情故事？,https://toutiao.com/group/7390696631223534120/,,0,0,False
公鸡强行霸占了狗窝，小狗狗回家的第一反应，把主人笑得肚子疼！,2024-07-09 14:51,7842,360,维E爱动物,维E爱动物,公鸡强行霸占了狗窝，小狗狗回家的第一反应，把主人笑得肚子疼！,https://toutiao.com/group/7389648897754268170/,,0,0,True
周继红中国奥运跳水第一金，看完你就明白，为什么全红婵百年难遇,2024-09-03 08:49,4929,2201,波波体育,波波体育,,https://toutiao.com/group/7410336254924948020/,,0,0,True
日本人在中国建立这么多学校，到底是谁给他们的权利？答案来了！,2024-08-30 05:23,40551,19933,东说西说,东说西说,,https://toutiao.com/group/7408798754536423971/,,0,0,True
