title,publish_time,like_count,comment_count,media_name,source,abstract,article_url,tag,is_yaowen,article_sub_type,has_video
习言道｜改革是人民群众自己的事业,2025-01-16 01:06,1358,752,中国新闻网,中国新闻网,1月16日出版的《求是》杂志发表中共中央总书记、国家主席、中央军委主席习近平的重要文章《进一步全面深化改革中的几个重大理论和实践问题》。,http://ku.m.chinanews.com/wapapp/cns/gn/2025/01-16/10354208.shtml,,0,0,False
飙升17%！拼命发钱催生后，第一个出生率暴涨的城市出现了,2025-01-16 06:59,1604,1718,智谷趋势,智谷趋势,作者 | 岚烟 暴雨发钱催生后，第一个出生率暴涨的城市，出现了。开年，微信公众号“天门发布”发出喜讯，该市出台鼓励生育政策后，2024年出生人口同比增加1050人、增幅17%，出生人口8年来第一次实现“由降转增”。17%的增幅，震惊全国。不少人还“一脸问号”：天门在哪？为什么？,https://toutiao.com/group/7460403956720599588/,,0,0,False
这是张学良老婆赵四小姐真实样貌，并非演员饰演而是货真价实真品,2024-12-28 11:28,19049,2063,历史伟人,历史伟人,赵四小姐，原名赵一荻，她从十六岁开始她终生陪伴张学良，历经坎坷，赵一荻是富家大小姐，但是在张学良囚禁期间，她选择陪伴软禁中的张学良，后悔过吗?,https://toutiao.com/group/7453422736652698175/,,0,0,False
今年过年将迎来60年不遇大雪，是真的吗？,2025-01-16 00:58,464,150,大宝观世界,大宝观世界,,https://toutiao.com/group/7460311161607668265/,,0,0,True
洛杉矶大火死亡人数持续攀升，今又传两大坏消息，民众越发崩溃！,2025-01-16 03:50,1379,112,端庄优雅溪水Y,端庄优雅溪水Y,,https://toutiao.com/group/7460174186498048512/,,0,0,True
