title,publish_time,like_count,comment_count,media_name,source,abstract,article_url,tag,is_yaowen,article_sub_type,has_video
"银行取钱：说出了全国人的心声, 必须给这位女士点赞👍👍👍",2025-03-31 04:35,81502,10520,简单的生活,简单的生活,,https://toutiao.com/group/7487827665840275978/,,0,0,True
突发！马斯克宣布辞职,2025-04-01 01:29,4273,2250,闽南网,闽南网,在接受福克斯新闻采访时，马斯克表示，他有信心在离职前完成削减1万亿美元联邦赤字的目标。并强调政府效率低下、存在大量浪费和欺诈，有信心在不影响关键服务的情况下减少15%的支出。,https://toutiao.com/group/7488150469601952294/,,0,0,False
让张学良痴迷一生的赵一荻有多美？16岁时在香山留影，美若天仙！,2025-02-07 02:48,1622,127,万物知识局,万物知识局,在民国时期，多才多艺的美女非常多，诗词歌赋、建筑测绘都精通的林徽因，儿童文学的启蒙，陪伴一代又一代孩子成长的冰心，戏剧艺术大师的陆小曼，每一个优秀的女性都是我们的榜样。,https://toutiao.com/group/7468131666553438756/,,0,0,False
最后48小时，美国突然发声，港口交易案定性，李嘉诚开始找后路,2025-03-31 12:50,9840,3747,力波观察,力波观察,距离李嘉诚港口交易案的签署时间只剩48小时，美方也不装了，公开将该事件“定性”。虽然在港媒、两任港首、港澳办五连质问，以及中国外交部的表态后，长和实业高层宣称会在本周暂缓和贝莱德集团签署协议，但这不能排除李嘉诚故布迷阵，降低国际社会的关注力度之后，来一场“明修栈道暗度陈仓”的把戏，到时候生米煮成熟饭，中方想要插手都晚了。,https://toutiao.com/group/7487954724122149412/,,0,0,False
普京到底干了什么，惹得特朗普火冒三丈，对俄罗斯从未如此失态,2025-03-31 06:47,7078,659,唐驳虎主笔,唐驳虎主笔,普京到底干了什么，能让特朗普火冒三丈到这种地步。在此之前，他从未对俄罗斯如此般失态。,https://toutiao.com/group/7487861707529011752/,,0,0,True
"太意外！大量泰国游客涌入中国，打着旅游的""幌子""，实则另有目的",2025-03-31 09:19,9123,1597,不写散文诗,不写散文诗,‍‌​‌‌​‌​‍‌​​​‌‌​​‍‌​​​‌​‌​‍‌​​‌​​‌​‍‌​‌​‌​‌‌‍‌​‌‌​​‌​‍‌‌​​‌‌​‌‍自从免签政策开始以来，大量的外国人涌入中国。其中光泰国游客就多达30万人次，然而他们的行为让人匪夷所思。,https://toutiao.com/group/7487893046495806006/,,0,0,False
辽宁舰山东舰福建舰呼叫81192：甲板已清空 可以降落 请立即返航!,2025-03-31 23:24,29527,4167,海客军事,海客军事,辽宁舰山东舰福建舰呼叫81192：甲板已清空，可以降落，请立即返航！,https://toutiao.com/group/7488118452041875987/,,0,0,True
