title,publish_time,like_count,comment_count,media_name,source,abstract,article_url,tag,is_yaowen,article_sub_type,has_video
习言道｜重磅座谈会，习近平强调“不能变，不会变”,2025-02-18 03:46,1411,1343,中国新闻网,中国新闻网,题:重磅座谈会，习近平强调“不能变，不会变”“党和国家对民营经济发展的基本方针政策，已经纳入中国特色社会主义制度体系，将一以贯之坚持和落实，不能变，也不会变。”,http://ku.m.chinanews.com/wapapp/cns/gn/2025/02-18/10370313.shtml,,0,0,False
老虎进院子！站的最高的竟然是最危险的,2025-02-16 16:15,53968,6428,事实听风者,事实听风者,,https://toutiao.com/group/7472051200083591720/,,0,0,True
丈母娘看不起穷女婿，全家聚餐没给女婿留筷子，女儿做法漂亮！,2025-01-27 16:01,3676,1001,群星访谈秀,群星访谈秀,,https://toutiao.com/group/7462286897130291724/,,0,0,True
不是做梦！国足U20巴萨式连续11脚传递，惊艳全场！打进完美进球,2025-02-15 15:24,4934,1351,1w体育课,1w体育课,,https://toutiao.com/group/7471666792251834895/,,0,0,True
李阳讲哪吒胡说八道台词混乱，胡编乱造,2025-02-18 05:17,8164,6477,叁金,叁金,,https://toutiao.com/group/7472623899801420339/,,0,0,True
文化入侵太可怕，哈哈哈……,2025-01-21 08:25,53304,2367,安逸生活家v2,安逸生活家v2,,https://toutiao.com/group/7462281692057846313/,,0,0,True
哪吒之魔童闹海2爆笑番外，重塑肉身一波三折,2025-01-17 04:36,33141,6607,成林影视,成林影视,哪吒2 哪吒之魔童闹海2爆笑番外，重塑肉身一波三折,https://toutiao.com/group/7460738418935415350/,,0,0,True
五兄弟挑战给老婆打电话说我爱你，谁的老婆回应谁买单😂,2025-02-18 07:55,6062,1124,不发脾气只发财,不发脾气只发财,,https://toutiao.com/group/7472664453134189090/,,0,0,True
媳妇玩到半夜才回来，以为老公不在家，进门这操作把老公看懵了,2025-01-24 09:38,11981,3289,滕菲,滕菲,,https://toutiao.com/group/7463414214191743497/,,0,0,True
移居中国13年的英国人🇬🇧当他回到伦敦时他震惊了…儿子想走,2025-01-13 03:37,43667,10770,Goujohnson,Goujohnson,移居中国13年的英国人🇬🇧当他回到伦敦时他震惊了…儿子想走,https://toutiao.com/group/7459238917565317644/,,0,0,True
父母都已不在，男子还未成家，一个人回家过年，鞭炮也不能少。,2025-02-13 10:15,30411,4715,乐天派叶子,乐天派叶子,,https://toutiao.com/group/7470845080074502667/,,0,0,True
