title,publish_time,like_count,comment_count,media_name,source,abstract,article_url,tag,is_yaowen,article_sub_type,has_video
航天功勋吴美蓉院士突然死亡，死因曝光，三年前的遭遇令人心痛,2024-08-03 13:02,2611,296,笑史云烟,笑史云烟,就在全国人民都将注意力放在巴黎奥运会上时候，国内突然传来一纸讣告，宣布了一个女科研工作者致敬的离世。,https://toutiao.com/group/7398895345454416403/,,0,0,False
印度外长：不同意石破茂提议,2024-10-02 07:45,934,511,济南时报-新黄河,济南时报-新黄河,据路透社10月1日报道，印度外交部长苏杰生1日表示，印度不同意日本新首相石破茂提出的建立“亚洲版北约”的愿景。 报道称，苏杰生在华盛顿卡内基国际和平研究院的一场活动中说，与日本不同，印度从来没有成为另一个国家的条约盟友。,http://www.hzfanews.com/detail.html?id=FB4470AEA6650D7DCDB0DF1866433C8ABE58A0CADF33335C,,0,0,False
富庶小国崩溃有多快？三年变地狱：全国断电缺粮，连吃饭都成问题,2024-08-04 04:14,3093,364,鲸探所,鲸探所,凭借着富裕的石油，中东国家也过上了坐在金钱堆里的生活，“头顶一块布，中东我最富”更是很多国家对于中东国家的“印象”。然而在满是石油和金钱的中东地区，却有一个例外:黎巴嫩。,https://toutiao.com/group/7398766345946399273/,,0,0,False
10月2日上午，天安门毛主席纪念堂竟然发生如此感人场面，哭了,2024-10-02 01:25,4446,190,好邻居李亮,好邻居李亮,,https://toutiao.com/group/7420983448451580450/,,0,0,True
5座车拉6个人被判超员，车主1句话把交警问懵,2024-08-05 20:20,16323,3853,奇妙钢笔pA8JyP,奇妙钢笔pA8JyP,,https://toutiao.com/group/7399752843772559906/,,0,0,True
东风41恐惧症在欧美蔓延：外媒坚定认为，先进导弹绝非东风31AG,2024-10-01 14:26,3223,750,南友汇,南友汇,日前以英国《金融时报》，美国《华盛顿时报》为首的欧美国家媒体撰文称，解放军本次试射的洲际导弹绝非是东风31AG，而是解放军现役更先进的东风41洲际导弹。,https://toutiao.com/group/7420812639297520163/,,0,0,False
罕见！100年前，英国游客拍下的清朝乡村，和想象中完全不一样,2024-09-20 02:07,2623,359,万物知识局,万物知识局,泥泞的土路，衣不蔽体的老百姓，即便是达官显贵的家中也十分破败，而这些都是清王朝的历史痕迹，虽说那时候中国摄影技术并不发达，但也有许多外国游客来到这里，拍摄下了许多老照片，为我们留下了珍贵的历史资料，那清朝到底是怎样的面貌呢?,https://toutiao.com/group/7416287738871267855/,,0,0,False
美籍华人科学家吴瑛，在美国芝加哥家中服毒自杀，自杀原因曝光！,2024-09-04 05:28,1115,979,开心营业厅,开心营业厅,前言8月31日，香港《南华早报》报道：美籍华裔科学家吴瑛，在美国服用过量毒性药物，自杀身亡！她的离世，与美国政府对华人科学家的“迫害”有着直接的联系。美国为何频频针对华人科学家，难道说“科学无国界”真的成了一句笑话吗？,https://toutiao.com/group/7410619875699212826/,,0,0,False
认祖归宗？蒙古国的“阳谋”将至！计划 2025年恢复蒙文与内蒙接轨,2024-09-08 03:03,1304,223,智史通鉴,智史通鉴,大家都知道，在历史上，外蒙古和内蒙古曾是“一家人”。后来清朝时期，外蒙古就开始独立出去，到现在，他们不仅加入了联合国，还将传统的蒙古语抛弃了，用了新的西里尔新蒙古文。可是随着时间的流逝，蒙古国似乎有一个“阳谋”渐渐浮出水面：他们计划在2025年，恢复传统的回鹘蒙文的使用。,https://toutiao.com/group/7412094989640958502/,,0,0,False
为国争光却遭郎平弃用！转身效力土耳其的王一梅，如今咋样了？,2024-08-31 13:19,932,135,豆莱说,豆莱说,光阴似箭，日月如梭，当初的少女早已退役，成为了排球场的幕后人，这么多年她都经历了什么，现在又怎么样了呢?,https://toutiao.com/group/7409287778514567718/,,0,0,False
伊朗对以色列发动大规模导弹袭击，马克龙发声,2024-10-02 02:28,1468,1740,环球网,环球网,来源：环球网 【环球网报道】据法新社、英国《卫报》等媒体报道，根据爱丽舍宫的一份声明，法国总统马克龙当地时间周三（10月2日）“以最强烈措辞”谴责伊朗对以色列的袭击，并补充称，法国已“动员”其在中东的军事资源予以应对。,https://3w.huanqiu.com/a/c36dc8/4JfpCikDaxA?agt=20,,0,0,False
初中毕业去当流水线女工，五年后却成为世界冠军，22岁成人生赢家,2024-08-02 10:46,6358,1217,豆莱说,豆莱说,文：豆莱说编辑：豆莱说支持作者，写作不易，文中会有5s广告，观看后可免费阅读全文父母曾设想过子女的千百种可能，只是对于一个走上中专之路的孩子，无非也是毕业，打工，进工厂，养家糊口。,https://toutiao.com/group/7398489613888766475/,,0,0,False
男子与女子在河中嬉戏玩耍，突然连续将女子的头按入水中,2024-09-26 04:40,1063,156,经视看天下,经视看天下,,https://toutiao.com/group/7418807108637819444/,,0,0,True
这就是中国排面！国庆升旗仪式上，国旗护卫队步步铿锵,2024-09-30 23:03,5991,534,北京日报客户端,北京日报客户端,,https://rss2.bjd.com.cn/content/s66fb2c1be4b01a5d71c96c58.html,,0,0,True
中国国乒又火了！决胜时刻，领军人物疯狂逆转，上演最解气的一幕,2024-09-29 06:49,4885,485,乐播体育,乐播体育,,https://toutiao.com/group/7419953587779797515/,,0,0,True
密子君不花钱吃三斤蛙！再加7斤蛙！就为打包满锅花椒辣椒！,2024-07-10 11:00,4249,257,密子君,密子君,吃美蛙火锅就为这口满锅辣椒花椒！打包回去吃两顿！不花钱吃三斤蛙！,https://toutiao.com/group/7389887442734318134/,,0,0,True
他的名字太特殊，2006年被要求改名：你不改，全国姓名系统都要改,2024-09-27 09:12,429,464,猫爷的渔场,猫爷的渔场,阅读此文前，诚邀您点击一下“关注”按钮，方便以后持续为您推送此类文章，同时也便于您进行讨论与分享，您的支持是我们坚持创作的动力~声明:本文内容均引用权威资料结合个人观点进行撰写，文末已标注文献来源及截图，请知悉。,https://toutiao.com/group/7419247917082395199/,,0,0,False
红米k70至尊版入手之后才是噩梦的开始！,2024-08-22 10:17,642,425,软糖不吃苦,软糖不吃苦,,https://toutiao.com/group/7405905971123487286/,,0,0,True
我哥哥，和朋友一起前往新疆种地后，离奇失踪32年，生死未卜,2024-07-07 22:06,7658,4260,真实人物采访,真实人物采访,#头条寻人##寻人路上的故事##失踪##回家#这是我们讲述的第4291位真人故事我是杨琼英，今年56岁，这是我找哥哥的第四个年头。32年前，我哥哥杨文斌在其好友代志福的多次劝说下，和他一同前往新疆种地，从此便和家人失去了联系。,https://toutiao.com/group/7388842950048875049/,,0,0,False
写歌30年穷困潦倒，前妻失望选择离婚，谁料51岁靠一首歌一夜成名,2024-08-12 03:37,24106,3830,八号探秘人,八号探秘人,在阅读此文之前，辛苦您点击一下“关注”，既方便您进行讨论和分享，又能给您带来不一样的参与感，感谢您的支持！编辑：LY无数人都想要一个一夜成名的机会，但机会来了也不是每个人都能把握住的。他用了三十年的时间来准备迎接属于自己的机会。为了这个机会他放弃了一切，甚至包括家庭。,https://toutiao.com/group/7402090890367484428/,,0,0,False
毁了王治郅，逼姚明退役，他凭一己之力让中国篮球倒退了二十年!,2024-08-07 19:45,1047,391,吃瓜崽崽,吃瓜崽崽,在阅读此文之前，辛苦您点击一下“关注”，既方便您进行讨论和分享，又能给您带来不一样的参与感，感谢您的支持！本文叙述皆有官方信源，为了给读者更好体验，放在了文章后缀！文 锦青一个人有可能影响中国的篮球事业发展吗？真的可能，至少信兰成做到了。,https://toutiao.com/group/7400359671892148788/,,0,0,False
小品：宋小宝跳楼砸刘能身上，他啥事没有，人家住俩月院！,2024-09-12 10:18,6193,846,开心不断,开心不断,,https://toutiao.com/group/7411293286888899098/,,0,0,True
网红郭有才，泡沫散去之后，曾经飘的有多高，如今摔得就有多惨,2024-09-30 09:36,677,428,八号探秘人,八号探秘人,曾经那个卖烧烤的店小二，可能怎么都想不到，自己会成为一个千万粉丝的网红。郭有才在刚成为网红之后的期望也很有意思，那就是每天能赚到300元就行。可现实却是靠着直播广告分成，他的收入直接比期望值翻了上千倍。有人说他其貌不扬，但是平凡人逆袭的典范，还有的人说他长的像日本人。,https://toutiao.com/group/7419978325617082932/,,0,0,False
文章：出轨是我的错，今生最对不起三个女人，与马伊琍仍然是家人,2024-07-14 11:00,1550,191,八号探秘人,八号探秘人,本文叙述皆有官方信源，为了读者有更好体验，放在了文章后缀!“这个世界上没人比我更爱马伊琍。”如今再看这句话，只觉得好笑又嘲讽。,https://toutiao.com/group/7391289394180850212/,,0,0,False
如今回头看恒大，许家印是赢了还是输了？！,2024-07-29 11:03,40633,23044,缤纷海燕YrEkWp,缤纷海燕YrEkWp,,https://toutiao.com/group/7397011739571421708/,,0,0,True
小品：这小品真是经典中的经典，本山大叔咋说都不对，慌乱的可爱,2024-09-04 07:47,6572,1200,把我逗笑了,把我逗笑了,,https://toutiao.com/group/7408254973588275749/,,0,0,True
她是央视最惨主持人，男友被判死缓，丈夫诈骗入狱，47岁无人敢娶,2024-08-27 23:30,2173,207,闻书识焉,闻书识焉,她曾是央视的台柱子，和董卿、周涛并称为央视的三朵金花。回顾刘芳菲的前半生，最令人感到惋惜的，便是她的感情生活，47岁至今无人敢娶。,https://toutiao.com/group/7407743113688564258/,,0,0,False
