title,publish_time,like_count,comment_count,media_name,source,abstract,article_url,tag,is_yaowen,article_sub_type,has_video
为国争光却遭郎平弃用！转身效力土耳其的王一梅，如今咋样了？,2024-08-31 13:19,942,144,豆莱说,豆莱说,光阴似箭，日月如梭，当初的少女早已退役，成为了排球场的幕后人，这么多年她都经历了什么，现在又怎么样了呢?,https://toutiao.com/group/7409287778514567718/,,0,0,False
中国这一招太棒了，一箭三雕美国有苦难言！（下）,2024-10-19 10:00,9845,358,占豪,占豪,美国就是再怎么不高兴也没用，因为美国自己不敢对中国单挑，那还能怎样？,https://toutiao.com/group/7427040546037695016/,,0,0,True
全球约一半肝癌在中国，再次提醒：家中的4种食物，尽早撤下餐桌,2024-08-13 08:36,105458,3569,梁医学社梁怡璋医生,梁医学社梁怡璋医生,,https://toutiao.com/group/7402540119712629311/,,0,0,True
土豆搭配洋葱，教你一个神仙吃法，一次3斤不够吃，太解馋了,2024-09-26 09:09,25722,1557,家常的味道,家常的味道,土豆搭配洋葱，教你一个神仙吃法，一次3斤不够吃，太解馋了,https://toutiao.com/group/7418876506660667904/,,0,0,True
中美印世界500强城市，上榜数量断崖：美56，印13，中国令人意外,2024-10-24 09:57,2050,115,泌尿外科李医生,泌尿外科李医生,声明：本文内容均是根据权威资料结合个人观点撰写的原创内容，在今日头条全网首发72小时，感谢各位看官点击支持原创，文末已标注文献来源及截图，请知悉。在全球经济格局中，存在一种非常明显的“老中青”交替现象。,https://toutiao.com/group/7429278092809536035/,,0,0,False
侵吞善款、贪污上亿，韩红遭实名举报，4年了，她还在等一声道歉,2024-10-22 01:38,1315,234,周律鸣法,周律鸣法,但就是这样一个为爱发声、为公益忙碌的韩红，却在2020年突然遭到实名举报，指控她贪污善款，金额高达3亿元!,https://toutiao.com/group/7428406314000220707/,,0,0,False
炸萝卜丸子，放面粉和淀粉就错了，教你正确做法，焦香酥脆不吸油,2024-09-28 10:13,15743,586,家常的味道,家常的味道,,https://toutiao.com/group/7419635124758643227/,,0,0,True
善恶终有报：疫情时对中国一毛不拔，却大方捐美国6亿，如今咋样,2024-09-29 05:50,875,117,睿之悦,睿之悦,可就是这样一位在中国土生土长起来的富豪，在疫情期间面对同胞的困境却一毛不拔，反而大方的捐助了6亿给美国。,https://toutiao.com/group/7419859345154015798/,,0,0,False
民间上坟传统：“上坟不带 5 果，家中不惹灾祸”，哪“5果”？,2024-08-08 10:30,16116,1627,惠农圈,惠农圈,在中国传统文化中，祭祀祖先一直是一项备受重视的活动，它承载着对先人的缅怀、敬意和感恩之情。在上坟的时候，人们会提前准备好供品，比如肉类、酒水，还有水果。其中关于水果的准备，也有着诸多的讲究和禁忌，比如“上坟不带 5 果，家中不惹灾祸”的说法。,https://toutiao.com/group/7400584207141192207/,,0,0,False
15年前他在爱妻葬礼上哭到昏厥，发誓永不再娶，如今他做到了吗？,2024-08-24 02:17,16940,538,八号探秘人,八号探秘人,在阅读此文之前，辛苦您点击一下“关注”，既方便您进行讨论和分享，又能给您带来不一样的参与感，感谢您的支持！编辑丨xk纵观鱼龙混杂的娱乐圈，有人背叛，有人痴情。而果靖霖则是公认的好男儿，将一生都奉献给妻子。但妻子却仅仅陪他走了半生，没能战胜病魔，不幸离开人世。,https://toutiao.com/group/7406210316734710283/,,0,0,False
台海形势已经大变，打响“第一枪”的人，可能让大家都意想不到？,2024-10-24 06:44,1991,119,蒋福伟,蒋福伟,台海形势出现了深刻变化，在台海打响“第一枪”的人，可能让大家都意想不到。中国大陆海警持续加强在台海周边的执法巡航力量，岛内媒体担忧称大陆很可能会通过此举封锁台岛。,https://toutiao.com/group/7429229108334297600/,,0,0,False
离婚3年后，37岁赵丽颖深夜发文，高调宣布喜讯，终于等到这一天,2024-10-25 08:38,918,192,云莳一,云莳一,不知不觉中，今年37岁的赵丽颖已经离婚3年了，一向低调的她，却在2024年10月21日，按捺不住内心的激动，深夜发文高调宣布喜讯。,https://toutiao.com/group/7429557982087709203/,,0,0,False
罕见！100年前，英国游客拍下的清朝乡村，和想象中完全不一样,2024-09-20 02:07,2976,402,万物知识局,万物知识局,泥泞的土路，衣不蔽体的老百姓，即便是达官显贵的家中也十分破败，而这些都是清王朝的历史痕迹，虽说那时候中国摄影技术并不发达，但也有许多外国游客来到这里，拍摄下了许多老照片，为我们留下了珍贵的历史资料，那清朝到底是怎样的面貌呢?,https://toutiao.com/group/7416287738871267855/,,0,0,False
猪肉别总是炒着吃了，教你简单又好吃的做法，简直太香了,2024-09-11 09:11,10032,502,家常的味道,家常的味道,猪肉别总是炒着吃了，教你简单又好吃的做法，简直太香了,https://toutiao.com/group/7413310656981664283/,,0,0,True
小伙送美女回家，怎料俩人感情突然升温，下秒不得了,2024-10-18 16:30,2053,140,乐视独爱真人秀,乐视独爱真人秀,,https://toutiao.com/group/7426997752761942567/,,0,0,True
安徽美女道士胡小慧被捕：精通“胡媚术”，九名男徒弟揭露其罪行,2024-09-12 08:10,3738,427,艺述史,艺述史,在安徽一处偏僻山头上，有座神秘的道观，外表平平无奇，但里面却有着一位名气很高的美女道士。美女道士的名字叫做胡小慧，据说有着高深的法力，能帮人消灾解难。很多人慕名前来，交上丰厚的香火钱，在袅袅青烟里，试图从这个年轻道士身上获得一些生活的支撑。,https://toutiao.com/group/7413662261274739200/,,0,0,False
给近三年最好的10部年代剧排个名：《人世间》第6，第1名没有争议,2024-09-06 08:08,8150,2736,皮皮电影,皮皮电影,时尚是个轮回，电视剧也是。在2020年之前的那些年，电视剧市场基本上都被偶像剧、都市剧霸占。曾经撑起国剧品质的《闯关东》《岁月》这类年代好剧，难见踪影。,https://toutiao.com/group/7411390030722712090/,,0,0,False
农村小情侣深夜约会，在屋内过着二人世界，兴奋坏了,2024-10-16 01:14,1198,128,乐视热播综艺精选,乐视热播综艺精选,农村小情侣深夜约会，在屋内过着二人世界，兴奋坏了,https://toutiao.com/group/7426173284741284364/,,0,0,True
"万万没想到,53岁“丁克”半辈子的康辉，一生遗憾竟然是一通电话",2024-08-21 22:14,28285,5448,峰哥正读,峰哥正读,在阅读此文之前，麻烦您点击一下“关注”，既方便您进行讨论和分享，又能给您带来不一样的参与感，感谢您的支持！文/编辑：蘑菇百善孝为先。但是到底怎么做才算是“孝”，康辉用了半辈子才明白。央视知名主持人康辉，事业顺遂，家庭幸福，在外人看来是一个人生赢家。,https://toutiao.com/group/7405504703687115273/,,0,0,False
除了戴头盔，12月起，电动车、摩托车、三轮车上路有4个新标准,2024-10-24 07:21,1595,247,新能源战略家,新能源战略家,请您在阅读前，先点击上面的“关注”。感谢您的支持，我们将为您带来更多有价值的内容。随着10月接近尾声， 整个电动车行业也进入今年最后的发展阶段。但事实上，每到年底，全国各地针对电动车市场的整治和检查强度都会迎来直接的提升。,https://toutiao.com/group/7429238621447701004/,,0,0,False
余华英死刑当庭上诉，杨妞花发声：没想到会上诉，第一次见她垂头丧气，全程低头双手发抖，但没有道歉,2024-10-25 03:24,893,1270,九派新闻,九派新闻,10月25日，贵州省贵阳市中级人民法院对余华英拐卖儿童案做出重审一审宣判，对被告人余华英以拐卖儿童罪判处死刑，剥夺政治权利终身，并处没收个人全部财产。余华英当庭表示上诉。现场画面显示，余华英听到死刑判决一直低头。杨妞花称，没想到余华英还会提起上诉，听到判决结果眼泪出来了。,https://toutiao.com/group/7429547523763503654/,,0,0,False
惨烈！山东陶汉林、郭凯、于德豪3人犯满离场 全队33次犯规,2024-10-24 14:32,302,168,直播吧,直播吧,直播吧10月24日讯 CBA常规赛，山东加时121-118力克深圳。此役山东赢得也非常惨烈，全队合计出现33次犯规，陶汉林、郭凯、于德豪均6犯离场。,https://news.zhibo8.com/nba/2024-10-24/671a5a432314fnative.htm,,0,0,False
有人跟踪我？浪哥，救命啊！ #蛋仔派对逃出惊魂夜 #蛋仔电影节,2024-08-07 09:45,1673,104,魔鬼鱼秀儿,魔鬼鱼秀儿,,https://toutiao.com/group/7400331364136682019/,,0,0,True
他和6个老婆共处一室，每人每月7万零花钱，71岁又娶了20岁小娇妻,2024-10-03 03:25,1318,173,八号探秘人,八号探秘人,如果不是雷洪的这番操作，或许大家永远都不知道，现实中竟然真的有人和韦小宝一样，坐享三妻四妾之福，拥有七个老婆。,https://toutiao.com/group/7420736326078628392/,,0,0,False
死刑！余华英拐卖儿童发回重审案一审宣判,2024-10-25 03:13,5034,8643,央视新闻,央视新闻,10月25日，贵州省贵阳市中级人民法院对贵州省高级人民法院发回重审的被告人余华英犯拐卖儿童罪一案一审公开宣判：被告人余华英犯拐卖儿童罪，判处死刑，剥夺政治权利终身，并处没收个人全部财产。该案发回重审后，公诉机关贵阳市人民检察院追加起诉被告人余华英拐卖李某等6名儿童的犯罪事实。,https://content-static.cctvnews.cctv.com/snow-book/index.html?item_id=10446964899531637587&source=50006&sub_source=50006_001,,0,1,False
我的房子不对劲！深不可测的恐惧 第五章，逃离伍德伯里,2024-10-05 23:00,3190,388,鲤鱼Ace,鲤鱼Ace,溯源之惧 第五章，逃离伍德伯里,https://toutiao.com/group/7422325180422160930/,,0,0,True
贪污上亿、侵吞善款，韩红被实名举报，4年了，有人给她道歉吗？,2024-10-19 07:24,2858,268,昕昕局,昕昕局,2020年初，新冠疫情肆虐，武汉告急，全国上下万众一心，与时间赛跑，与病魔较量，就在这场没有硝烟的战争中，一个熟悉的身影出现在抗疫一线，她带着物资，带着希望，奔赴在最危险的地方，她就是韩红。,https://toutiao.com/group/7427383862491120179/,,0,0,False
