title,publish_time,like_count,comment_count,media_name,source,abstract,article_url,tag,is_yaowen,article_sub_type,has_video
央视展示东风-26竖起，20辆导弹发射车，韩国挑事北约敢来吗？,2024-10-21 04:15,22838,614,陈虎点兵,陈虎点兵,,https://toutiao.com/group/7428077887284052495/,,0,0,True
军号一响，全军出击！,2024-09-19 08:01,22512,1457,中国军号,中国军号,,https://toutiao.com/group/7416261401477382668/,,0,0,True
老人辱骂强拉孕妇要求让座？目击者称“全车厢人齐心协力保护孕妇”，南京地铁回应,2024-10-22 04:34,409,296,潇湘晨报,潇湘晨报,“肚子有小孩”，“别打人，别打人……”10月22日，有网友发布视频称，在南京地铁二号线上，一位老人将孕妇强行拉起，要求对方让座。此事引发关注。该网友发布的视频显示，一位身穿蓝色外套的女子被人拉拽起身，女子护住肚子称“肚子有小孩”、“你挤到我，我什么话都没讲”。,http://api.chenshipin.com/wap/a/671724e484201762bb5fdfc0/90f456b81afce808c1fcfbd3f5761f65/1729571481/8a303b030d5b653af0fc633ad40877f05be2fe468a804cb2286bb204872002dd,,0,0,False
猪肉别总是炒着吃了，教你简单又好吃的做法，简直太香了,2024-09-11 09:11,9628,489,家常的味道,家常的味道,猪肉别总是炒着吃了，教你简单又好吃的做法，简直太香了,https://toutiao.com/group/7413310656981664283/,,0,0,True
台湾准备打仗了？赖清德释放积极备战消息，还要从高中生补充兵员,2024-10-22 09:57,8017,518,邱毅台湾,邱毅台湾,,https://toutiao.com/group/7428537068390711858/,,0,0,True
初中毕业去当流水线女工，五年后却成为世界冠军，22岁成人生赢家,2024-08-02 10:46,6357,1216,豆莱说,豆莱说,文：豆莱说编辑：豆莱说支持作者，写作不易，文中会有5s广告，观看后可免费阅读全文父母曾设想过子女的千百种可能，只是对于一个走上中专之路的孩子，无非也是毕业，打工，进工厂，养家糊口。,https://toutiao.com/group/7398489613888766475/,,0,0,False
外交部：中印双方已就边境有关问题达成解决方案,2024-10-22 07:31,10923,16761,环球网,环球网,【环球时报-环球网报道 记者 索炎琦】在10月22日举行的中国外交部例行记者会上，有外媒记者提问称：印度外交部长昨天表示，印度和中国已就在喜马拉雅地区有争议的边界巡逻达成协议。他称，这可以让中印脱离接触并解决始于2020年的冲突。我们能否向外交部确认是否达成了这样的协议？,https://toutiao.com/group/7428499246837432842/,,0,0,False
给近三年最好的10部年代剧排个名：《人世间》第6，第1名没有争议,2024-09-06 08:08,7106,2406,皮皮电影,皮皮电影,时尚是个轮回，电视剧也是。在2020年之前的那些年，电视剧市场基本上都被偶像剧、都市剧霸占。曾经撑起国剧品质的《闯关东》《岁月》这类年代好剧，难见踪影。,https://toutiao.com/group/7411390030722712090/,,0,0,False
55岁乒乓奥运冠军乔红近况：邓亚萍队友，50岁结婚，已老到认不出,2024-08-02 10:57,3679,691,豆莱说,豆莱说,写作不易，希望各位观众老爷理解，每天作者写作超过12小时，收益只有50多块，文中加入5秒广告解锁，就是能为了多几块收益，观看后可免费阅读全文。文：豆莱说编辑：豆莱说乒乓是我国之骄傲，而我国优秀的乒乓球员更是数不胜数。,https://toutiao.com/group/7398484272216130087/,,0,0,False
茅台女员工“工作照”遭曝光！网友：这样做出来酒，白给我都不喝,2024-10-16 06:24,582,1191,昕昕局,昕昕局,本文陈述所有内容皆有可靠信息来源，赘述在文章结尾文 | 成倚贤●—≺ 前 言 ≻—●如果请人吃饭桌上放着茅台酒，那必然是十分有面子，大家都知道茅台酒的“含金量”，可茅台女员工的“工作照”被曝光后，却让人下不去嘴了？,https://toutiao.com/group/7426239801449251343/,,0,0,False
3年前，宁夏7岁小女孩一笑走红，后拒百万签约，如今怎么样了？他们后悔了吗？,2024-09-19 07:25,4372,732,睿之悦,睿之悦,2021年，视频镜头中出现的女孩儿用那一抹甜美的笑容，迅速引起了网友们的广泛关注。有媒体公司看到这一机遇，提出愿意用百万巨资与女孩儿签约，然而，女孩儿的父母却坚决拒绝了这一提议。,https://toutiao.com/group/7416250139544879679/,,0,0,False
善恶终有报：疫情时对中国一毛不拔，却大方捐美国6亿，如今咋样,2024-09-29 05:50,790,116,睿之悦,睿之悦,可就是这样一位在中国土生土长起来的富豪，在疫情期间面对同胞的困境却一毛不拔，反而大方的捐助了6亿给美国。,https://toutiao.com/group/7419859345154015798/,,0,0,False
1976年周、朱、毛同一年逝世，临终前，三位伟人都交代了什么话？,2024-09-24 09:46,8226,368,呷谈历史,呷谈历史,1976年是最令人悲伤的一年，那一年三位伟人相继离世，还发生了唐山大地震。三位伟人在离世前都交代了一些事情，这些事情都和之后国家的发展有关系。,https://toutiao.com/group/7418141722196197900/,,0,0,False
民间上坟传统：“上坟不带 5 果，家中不惹灾祸”，哪“5果”？,2024-08-08 10:30,15338,1595,惠农圈,惠农圈,在中国传统文化中，祭祀祖先一直是一项备受重视的活动，它承载着对先人的缅怀、敬意和感恩之情。在上坟的时候，人们会提前准备好供品，比如肉类、酒水，还有水果。其中关于水果的准备，也有着诸多的讲究和禁忌，比如“上坟不带 5 果，家中不惹灾祸”的说法。,https://toutiao.com/group/7400584207141192207/,,0,0,False
以后想吃回锅肉你就像我这样做，肥而不腻，咸香适口，太解馋了,2024-08-06 11:19,33193,1227,家常的味道,家常的味道,,https://toutiao.com/group/7399984507362738742/,,0,0,True
半岛局势紧张的肇事者是谁？不是韩国更不是朝鲜，得利者浮出水面,2024-10-18 05:56,13869,999,陈虎点兵,陈虎点兵,,https://toutiao.com/group/7426990598878167567/,,0,0,True
今天才知道！电动车“每天充”和“用完再充”，到底哪个更伤电池,2024-08-27 11:19,12859,2222,鲸探所,鲸探所,“今天到底给车充不充电？”估计大多数人每天回家都会想这个问题，看着自己的电动车电量又多又少的，充不充电也是一件非常难以抉择的事情。那么，电动车到底应该怎样充电呢？是每天都充，还是用完之后再充呢？电动车充电不管是在城市还是农村，电动车其实都是人们出门最常见的交通工具。,https://toutiao.com/group/7407773012533117475/,,0,0,False
母亲瘫痪、父亲疯了，当年那个744分的高考状元，7年后却成了这样,2024-09-08 00:54,6452,1088,八号探秘人,八号探秘人,母亲截肢瘫痪、父亲疯癫痴傻，可对于自己的亲人，他却做出了这样的评价。而今，7年已过，曾经那个让无数人动容的少年，现在如何?,https://toutiao.com/group/7411852147648496162/,,0,0,False
朝鲜半岛突然紧张，韩朝火力对峙，背后美俄角力，战争会出现吗？,2024-10-17 07:32,31816,1473,邱毅台湾,邱毅台湾,,https://toutiao.com/group/7426644171232674316/,,0,0,True
半岛要是打起来，烈度必然会超过俄乌战争,2024-10-17 07:05,5992,1238,票姚校尉,票姚校尉,半岛要是打起来，烈度必然会超过俄乌战争,https://toutiao.com/group/7426637233556062774/,,0,0,True
重磅！华为纯血鸿蒙正式发布，连接设备超10亿台！余承东：用一年多时间走过了国外操作系统十几年走过的路,2024-10-22 12:23,604,180,每日经济新闻,每日经济新闻,每经编辑：张锦河10月22日晚，在原生鸿蒙之夜暨华为全场景新品发布会上，我国首个国产移动操作系统——华为原生鸿蒙操作系统(HarmonyOS NEXT，又称“纯血鸿蒙”)正式发布，这也是继苹果iOS和安卓系统后，全球第三大移动操作系统。,http://www.nbd.com.cn/rss/jinri_toutiao/articles/3600833.html,,0,0,False
