title,publish_time,like_count,comment_count,media_name,source,abstract,article_url,tag,is_yaowen,article_sub_type,has_video
壹视界·任仲平文章解读丨自觉遵规守纪、大胆干事创业,2025-04-01 12:40,1194,581,人民日报,人民日报,‍‍‍‌‍‍‌不正之风和腐败问题互为表里、同根同源。习近平总书记强调：“要把正风肃纪反腐贯通起来，引导广大党员、干部自觉遵规守纪、大胆干事创业。”党员“破法”，无不始于“破纪”。由风及腐、风腐交织正是不少违纪违法案件的共同点。,https://www.peopleapp.com/column/30048682180-500006177826?utm_source=tth&promote=true,,0,1,False
确认坠毁！有人员遇难,2025-04-03 01:44,1288,131,红星新闻,红星新闻,俄罗斯国防部2日通报说，一架图-22M3轰炸机当天在俄中部伊尔库茨克地区坠毁，机组4人弹射逃生，其中1名飞行员丧生。,https://toutiao.com/group/7488896641748042281/,,0,0,False
他们仨又聚一块了！网友：内娱最干净的三个女孩组成了最强铁三角,2025-04-03 04:09,480,178,时予言,时予言,时间倒回2015年的横店影视城，宋茜蹲在《美丽的秘密》剧组角落里啃台词本，张佳宁提着两杯奶茶径直坐到了她身边。,https://toutiao.com/group/7488932681829351947/,,0,0,False
这就是张学良年轻时真实的样貌，都看看吧！这可不是演员饰演的,2025-01-23 02:01,1883,326,历史伟人,历史伟人,1901年6月，就在张学良出生之时，为了躲避金寿山的偷袭，张作霖带着自己的妻子打开了一条缺口，使得家人安全逃出，就在逃跑的途中，张学良降生在大马车上。,https://toutiao.com/group/7462925035645338164/,,0,0,False
全卖光了！贵州母子三人清仓套现42亿，却把麻烦留给了8.8万股民,2025-01-28 04:52,9991,4177,客观听書,客观听書,可贵州百灵却显得非常另类，或许是贵州百灵企业并不缺钱，所以人家只是把企业挂在股市上给人看，尤其是在调查过该公司所有权的时候，姜伟和母亲以及弟弟，三个人完全掌控着这家企业，别人丝毫没有插手的份。,https://toutiao.com/group/7463750698644046351/,,0,0,False
被央媒怒批，目不识丁、德不配位，这几位“文盲”明星凭什么走红,2025-04-02 06:58,904,224,小娱儿,小娱儿,长得人模人样，一张嘴就是“文化沙漠”，他们脑袋空空，四肢发达。镜头前随便“演戏”，就拿着天价片酬，连央媒都忍不住怒批他们。,https://toutiao.com/group/7488580569991856674/,,0,0,False
