title,publish_time,like_count,comment_count,media_name,source,abstract,article_url,tag,is_yaowen,article_sub_type,has_video
布林肯前脚刚离开，韩国就展开第二波逮捕尹锡悦行动，胜算如何？,2025-01-08 07:08,15011,422,邱毅台湾,邱毅台湾,,https://toutiao.com/group/7457438209384677938/,,0,0,True
34岁雌雄同体的女性，具备男女两性器官，她该如何生存下去？,2024-10-17 03:32,6011,247,大象微视,大象微视,这个词在我们生活中并不常见，简而言之，双性人就是既拥有男性的生殖器官，也具备女性的特征的人。1989年，王梓淇出生在山西太原的一个家庭，她的家里经营着一家小生意，虽然谈不上富裕，但足够让一家人过得舒心自在。,https://toutiao.com/group/7426578550418948618/,,0,0,False
小子相亲故意扮老，谁知道对方一见面就叫他大爷，这段太逗了,2024-12-24 08:17,4207,938,乐视热播综艺精选,乐视热播综艺精选,,https://toutiao.com/group/7451886130837848610/,,0,0,True
13年9岁男孩扶老太被讹，老太发誓说谎死全家，儿媳却意外说漏嘴,2024-10-25 08:09,8641,2466,睿之悦,睿之悦,文|睿之悦编辑|睿之悦“就是这个娃撞了我，我虽然年纪大了，但我可不糊涂……”2013年，一位9岁的小学生江小云好心的将摔倒的蒋老太扶起，却反被讹100万。当时的蒋老太甚至还发毒誓，声称要是说谎的话就“死全家”。那么，这到底是怎么一回事呢？,https://toutiao.com/group/7429620647524450831/,,0,0,False
国务院任免国家工作人员，单忠德任国家航天局局长,2025-01-10 03:35,2200,341,界面快讯,界面快讯,国务院任免国家工作人员。,https://toutiao.com/group/7458125314263106111/,,0,0,False
铁公鸡来相亲，一听不用买单拼命点菜，哪料姑娘做法更狠,2024-12-26 09:06,3364,941,乐视热播综艺精选,乐视热播综艺精选,,https://toutiao.com/group/7452643056194421286/,,0,0,True
湖南最长寿老人124岁高龄，长寿秘诀出世，让人大开眼界,2024-12-21 16:00,2421,226,乐视群星访谈秀,乐视群星访谈秀,,https://toutiao.com/group/7450730131821167140/,,0,0,True
