title,publish_time,like_count,comment_count,media_name,source,abstract,article_url,tag,is_yaowen,article_sub_type,has_video
小伙洗完澡故意秀肌肉，富婆心跳加速被当场拿下，这下好看了,2024-10-26 16:20,2624,141,乐视情感讲堂,乐视情感讲堂,小伙洗完澡故意秀肌肉，富婆心跳加速被当场拿下，这下好看了,https://toutiao.com/group/7430011217881596426/,,0,0,True
今天才知道！电动车“每天充”和“用完再充”，到底哪个更伤电池,2024-08-27 11:19,14238,2277,鲸探所,鲸探所,“今天到底给车充不充电？”估计大多数人每天回家都会想这个问题，看着自己的电动车电量又多又少的，充不充电也是一件非常难以抉择的事情。那么，电动车到底应该怎样充电呢？是每天都充，还是用完之后再充呢？电动车充电不管是在城市还是农村，电动车其实都是人们出门最常见的交通工具。,https://toutiao.com/group/7407773012533117475/,,0,0,False
安徽美女道士胡小慧被捕：精通“胡媚术”，九名男徒弟揭露其罪行,2024-09-12 08:10,3750,427,艺述史,艺述史,在安徽一处偏僻山头上，有座神秘的道观，外表平平无奇，但里面却有着一位名气很高的美女道士。美女道士的名字叫做胡小慧，据说有着高深的法力，能帮人消灾解难。很多人慕名前来，交上丰厚的香火钱，在袅袅青烟里，试图从这个年轻道士身上获得一些生活的支撑。,https://toutiao.com/group/7413662261274739200/,,0,0,False
快消失的12个生活用品！40年前在供销社红极一时，你家还在用吗？,2024-09-29 07:58,3350,288,万物知识局,万物知识局,在这里，可以买到从油盐酱醋到衣物鞋帽，再到农具化肥等各种生活必需品，每一样物品都凝聚着时代的特色，见证了那个年代人们的生活状态，今天我们就来走进那些年能够在供销社里买到的生活用品，看看你们还记得哪些。,https://toutiao.com/group/7419937237548237322/,,0,0,False
农村小情侣深夜约会，在屋内过着二人世界，兴奋坏了,2024-10-16 01:14,2061,218,乐视热播综艺精选,乐视热播综艺精选,农村小情侣深夜约会，在屋内过着二人世界，兴奋坏了,https://toutiao.com/group/7426173284741284364/,,0,0,True
土豆搭配洋葱，教你一个神仙吃法，一次3斤不够吃，太解馋了,2024-09-26 09:09,28058,1680,家常的味道,家常的味道,土豆搭配洋葱，教你一个神仙吃法，一次3斤不够吃，太解馋了,https://toutiao.com/group/7418876506660667904/,,0,0,True
美大选前夕，朝鲜援俄部队开拔，隐忧之下，中方能否把握关键期？,2024-10-29 10:27,9280,197,邱震海,邱震海,,https://toutiao.com/group/7431142342071714313/,,0,0,True
男子在路边被黄鼠狼盯住，咬住他的鞋不松口,2024-10-14 06:46,14060,3128,山西广电文娱,山西广电文娱,,https://toutiao.com/group/7425519012454335003/,,0,0,True
全球约一半肝癌在中国，再次提醒：家中的4种食物，尽早撤下餐桌,2024-08-13 08:36,106879,3609,梁医学社梁怡璋医生,梁医学社梁怡璋医生,,https://toutiao.com/group/7402540119712629311/,,0,0,True
2040年人类将终结癌症？｜凤凰大健康,2024-10-28 12:30,972,157,凤凰卫视,凤凰卫视,,https://toutiao.com/group/7430739139886055987/,,0,0,True
小伙送美女回家，怎料俩人感情突然升温，下秒不得了,2024-10-18 16:30,4030,312,乐视独爱真人秀,乐视独爱真人秀,,https://toutiao.com/group/7426997752761942567/,,0,0,True
猪肉别总是炒着吃了，教你简单又好吃的做法，简直太香了,2024-09-11 09:11,10608,528,家常的味道,家常的味道,猪肉别总是炒着吃了，教你简单又好吃的做法，简直太香了,https://toutiao.com/group/7413310656981664283/,,0,0,True
为女航天员点赞！90后女航天员王浩泽发言,2024-10-29 02:56,13324,1395,中国网资讯,中国网资讯,为女航天员点赞！90后女航天员王浩泽发言,https://toutiao.com/group/7431026163878265394/,,0,0,True
山西五台山悬崖上的狐仙洞，发现住着2个千年狐仙，上去吓得腿软,2024-10-22 03:00,4756,504,山西凡凡,山西凡凡,,https://toutiao.com/group/7428429414959940106/,,0,0,True
一机四型，沈飞“鹘鹰”正式更名，中国第二款隐身战斗机正式亮相,2024-10-28 01:03,2890,704,科大烽火,科大烽火,近期，随着一份名为“第十五届中国航展参展航空器清单”图像资料的曝光，当即在社交媒体上引发了广泛关注。,https://toutiao.com/group/7430623273517318697/,,0,0,False
她是央视最惨主持人，男友被判死缓，丈夫诈骗入狱，47岁无人敢娶,2024-08-27 23:30,2268,210,闻书识焉,闻书识焉,她曾是央视的台柱子，和董卿、周涛并称为央视的三朵金花。回顾刘芳菲的前半生，最令人感到惋惜的，便是她的感情生活，47岁至今无人敢娶。,https://toutiao.com/group/7407743113688564258/,,0,0,False
以后想吃回锅肉你就像我这样做，肥而不腻，咸香适口，太解馋了,2024-08-06 11:19,36219,1317,家常的味道,家常的味道,,https://toutiao.com/group/7399984507362738742/,,0,0,True
以色列，真正的麻烦来了,2024-10-28 23:20,1588,348,牛弹琴,牛弹琴,以色列，真正的麻烦来了。绝对不会是国际的压力。压力再大，有美国老大哥护着，以色列浑不在乎。也不会是伊朗人的报复。伊朗保持着克制，而且，在军事打击力上，与以色列还有差距。而是战场上不断传来的坏消息，以色列正在付出沉重代价。,https://toutiao.com/group/7430968627941163556/,,0,0,False
神十九乘组两位“90后”新人航天员入选，王浩泽系中国第3位女航天员、首位女航天飞行工程师,2024-10-29 00:47,3685,740,九派新闻,九派新闻,据央视新闻消息，10月29日，神十九载人飞行任务公布：飞行乘组由航天员蔡旭哲、宋令东、王浩泽组成，蔡旭哲担任指令长。神十九乘组有两位“90后”新人航天员：宋令东和王浩泽，都是首次执行飞行任务。,https://toutiao.com/group/7430991291720352308/,,0,0,False
挣扎了几个月，泽连斯基认命改口：怎么跟俄罗斯谈，全听中国安排,2024-10-28 08:46,927,131,阿尔法军事,阿尔法军事,挣扎了好几个月，即便内心有万分的不情愿，泽连斯基还是决定，与俄罗斯的和平方案该怎么谈，还是得听中方的安排。,https://toutiao.com/group/7430744495617999360/,,0,0,False
神舟十九号丨王浩泽同志简历,2024-10-29 02:35,6034,1452,新华网,新华网,新华社酒泉10月29日电王浩泽同志简历王浩泽，女，满族，籍贯河北滦平，硕士学位。1990年3月出生，2021年1月入伍，2009年12月加入中国共产党，现为中国人民解放军航天员大队四级航天员，陆军中校军衔。曾任中国航天科技集团有限公司高级工程师。,http://my-h5news.app.xinhuanet.com/h5/article.html?articleId=ca5af32613714a67900f927fe97740d2,,0,0,False
统一临近，中美即将摊牌？继工厂内迁后，东风26突然大举增产,2024-10-29 08:30,2226,329,利刃,利刃,这一情况让西方大吃一惊，随即调取了2023年至今的卫星照片，发现该地起码生产了72辆东风-26导弹车，其数量几乎可以装备3个导弹旅，按照每个导弹车2辆备弹车计算，那就是整整216枚东风-26导弹，这还是一个地区一年的“产量”。,https://toutiao.com/group/7431111644132000294/,,0,0,False
善恶终有报：疫情时对中国一毛不拔，却大方捐美国6亿，如今咋样,2024-09-29 05:50,927,126,睿之悦,睿之悦,可就是这样一位在中国土生土长起来的富豪，在疫情期间面对同胞的困境却一毛不拔，反而大方的捐助了6亿给美国。,https://toutiao.com/group/7419859345154015798/,,0,0,False
罕见！100年前，英国游客拍下的清朝乡村，和想象中完全不一样,2024-09-20 02:07,3455,443,万物知识局,万物知识局,泥泞的土路，衣不蔽体的老百姓，即便是达官显贵的家中也十分破败，而这些都是清王朝的历史痕迹，虽说那时候中国摄影技术并不发达，但也有许多外国游客来到这里，拍摄下了许多老照片，为我们留下了珍贵的历史资料，那清朝到底是怎样的面貌呢?,https://toutiao.com/group/7416287738871267855/,,0,0,False
骑行川藏中线，天黑来到小金县入住酒店，整个县城市狭窄又拥挤,2024-10-28 04:07,17645,2143,刘伟元的旅行,刘伟元的旅行,,https://toutiao.com/group/7430673434343899698/,,0,0,True
有人冒充我男朋友，算不算诈骗？遇到奇葩事你会怎么办？,2024-09-06 05:52,1751,226,兴凯湖莹莹,兴凯湖莹莹,,https://toutiao.com/group/7411404025502892554/,,0,0,True
她是第一位博士级歌唱家，12次荣登春晚，丈夫的身份更是深藏不露,2024-08-10 11:05,15700,458,豆莱说,豆莱说,文：豆莱说编辑：豆莱说支持作者，写作不易，文中会有5s广告，观看后可免费阅读全文在当下华语乐坛中，有很多的出色的歌唱家，雷佳就是其中一位。因为她不仅是我国首个荣获了博士学位的歌唱家，更是出道20年就12次登上了春晚舞台的歌唱家。而且，她丈夫的身份也是不容小觑。,https://toutiao.com/group/7401461240674943542/,,0,0,False
给近三年最好的10部年代剧排个名：《人世间》第6，第1名没有争议,2024-09-06 08:08,9276,3086,皮皮电影,皮皮电影,时尚是个轮回，电视剧也是。在2020年之前的那些年，电视剧市场基本上都被偶像剧、都市剧霸占。曾经撑起国剧品质的《闯关东》《岁月》这类年代好剧，难见踪影。,https://toutiao.com/group/7411390030722712090/,,0,0,False
关于开展2024年中国福利彩票双色球游戏派奖活动的公告,2024-10-27 05:18,645,517,齐鲁壹点,齐鲁壹点,为回馈广大购彩者对中国福利彩票的关心和支持，中国福利彩票发行管理中心决定开展2024年双色球游戏派奖活动。,http://m.ql1d.com/new/general/24994880,,0,0,False
中国手机新三巨头诞生!华为升至第二 第一太稳了,2024-10-28 03:40,1705,1512,华商网,华商网,10月28日消息，据Counterpoint Research最新研报，2024年Q3中国智能手机销量同比增长2.3%，连续四个季度实现同比正增，市场有望实现五年来首次年增长。这也进一步确认了2024年市场回暖趋势，全年有望实现同比低个位数增长，提升了行业信心。,https://digi.hsw.cn/system/2024/1028/171909.shtml,,0,0,False
大变脸！国际乒联公布最新世界排名，陈梦跌至第4，男单杀出黑马,2024-10-29 02:23,1206,767,女排集中营,女排集中营,#头条创作游园会#众所周知，自从进入洛杉矶奥运周期后，中国乒乓球队就一直处于高度紧张的作战模式。短短2个多月的时间里，国乒众将便参加了4项大赛，所取得的成绩也只能算是中规中矩。特别是刚刚结束的蒙彼利埃冠军赛，以及此前的乒乓球亚锦赛，国乒的表现都没有达到预期。,https://toutiao.com/group/7430844065266090506/,,0,0,False
初中毕业去当流水线女工，五年后却成为世界冠军，22岁成人生赢家,2024-08-02 10:46,6378,1221,豆莱说,豆莱说,文：豆莱说编辑：豆莱说支持作者，写作不易，文中会有5s广告，观看后可免费阅读全文父母曾设想过子女的千百种可能，只是对于一个走上中专之路的孩子，无非也是毕业，打工，进工厂，养家糊口。,https://toutiao.com/group/7398489613888766475/,,0,0,False
妻子偷偷见相好，怎料丈夫就跟在身后，下秒让她没脸！,2024-10-19 17:17,1997,204,乐视娱乐乐透社,乐视娱乐乐透社,,https://toutiao.com/group/7427397818463027749/,,0,0,True
杨妞花声音嘶哑念判决书：第一次看到余华英双手发抖,2024-10-25 03:49,5241,632,海客新闻,海客新闻,杨妞花声音嘶哑念判决书：第一次看到余华英双手发抖 她心里面是害怕的,https://toutiao.com/group/7429555385935069732/,,0,0,True
