title,publish_time,like_count,comment_count,media_name,source,abstract,article_url,tag,is_yaowen,article_sub_type,has_video
学习进行时丨花灯长廊 情深意长,2025-02-12 13:51,340,157,新华网,新华网,策划：万方 王子晖 张芮绮 刘淼设计：杨宽AIGC：樊珊珊、邓豪俣、初林、赵薇、程媛媛、王晔,http://my-h5news.app.xinhuanet.com/h5/article.html?articleId=1dd3d01ced03e4e1f09e673968237b3e,,0,0,False
穷小伙找富婆借钱买房子，富婆直接答应，却提出条件,2025-01-07 03:09,3588,668,南瓜热剧回放,南瓜热剧回放,,https://toutiao.com/group/7457005446646202916/,,0,0,True
华为200万年薪都留不住他！天才少年彭志辉离职后，现状曝光,2025-01-16 09:28,7284,1013,与君説,与君説,在阅读此文之前，麻烦您点击一下“关注”，既方便您进行讨论和分享，又能给您带来不一样的参与感，感谢您的支持文、编辑|小娄你敢相信吗？大厂华为200万年薪的工作，竟然也有人不屑一顾。入职华为两年后，彭志辉毅然决然选择离职。,https://toutiao.com/group/7460439446131884579/,,0,0,False
收留前女友第一天，她说以后她嫁人彩礼给我,2025-02-12 10:36,1020,144,竹影,竹影,,https://toutiao.com/group/7470479525130879507/,,0,0,True
公公竟然和儿媳偷情，哪料被妻子撞见，这下有戏看了！,2025-01-21 08:05,12609,1030,南瓜午夜厅,南瓜午夜厅,,https://toutiao.com/group/7462273852651979274/,,0,0,True
女子回村遇儿时要娶自己的男生，上前打招呼被嫌弃，下一幕更扎心,2024-12-28 01:40,2141,337,黄石融媒发布,黄石融媒发布,,https://toutiao.com/group/7453271656836891162/,,0,0,True
谢广坤回应为什么不给女儿车和房,2025-02-11 15:48,2682,525,小熊软糖宝,小熊软糖宝,,https://toutiao.com/group/7470188740934238757/,,0,0,True
第一次见到裸体雕像实在忍不住了,2025-02-03 15:09,16883,2166,鹏哥畅聊,鹏哥畅聊,,https://toutiao.com/group/7467210010603389481/,,0,0,True
媳妇玩到半夜才回来，以为老公不在家，进门这操作把老公看懵了,2025-01-24 09:38,11152,3116,滕菲,滕菲,,https://toutiao.com/group/7463414214191743497/,,0,0,True
丈母娘看不起穷女婿，全家聚餐没给女婿留筷子，女儿做法漂亮！,2025-01-27 16:01,2925,749,群星访谈秀,群星访谈秀,,https://toutiao.com/group/7462286897130291724/,,0,0,True
大姐开导文丽，当天晚上佟志就得逞了，第二天扶腰上班,2025-02-10 16:00,1407,104,宝宝排排坐剧院,宝宝排排坐剧院,,https://toutiao.com/group/7469712688159916580/,,0,0,True
女子晒一整盒金饰，网友：金店都得从这里进货！,2025-02-12 12:30,1683,650,大白爱说话,大白爱说话,,https://toutiao.com/group/7470458134201434676/,,0,0,True
