title,publish_time,like_count,comment_count,media_name,source,abstract,article_url,tag,is_yaowen,article_sub_type,has_video
习近平的民生之问｜“食品原料从哪里进来的？”,2025-03-15 01:45,3224,1706,中国新闻网,中国新闻网,在了解到食品原料从农田到餐桌都是安全有保障的情况后，总书记说道:“食品安全是最重要的，群众要吃得放心，这是我最关心的。”,http://ku.m.chinanews.com/wapapp/cns/gn/2025/03-15/10383519.shtml,,0,0,False
中国联通、中国移动、中国电信，集体回应,2025-03-16 10:52,476,352,澎湃新闻,澎湃新闻,@中国联通、@中国移动、@中国电信。@中国移动 3月16日通报，对新华社有关通信电话营销的报道，公司高度重视，根据工业和信息化部2025年信息通信行业行风建设和纠风工作会议的部署要求，已第一时间开展针对性自查。,http://mp.weixin.qq.com/s?__biz=MjM5MzI5NTU3MQ==&mid=2652429768&idx=1&sn=9c8d397d7153ecdcd6e8e4ad05af293b,,0,0,False
中国再曝新大驱！美媒酸了：这次连PPT都追不上了？,2025-03-15 12:26,2041,437,过往云烟,过往云烟,“下饺子”这个词，放在中国海军身上，真是一点都不夸张。就在美国还在为“伯克III”驱逐舰的龟速建造头疼时，中国网友又扒出一篇论文，曝光了下一代“通用驱逐舰”的蓝图——长165米、排水量近万吨，火力直逼055大驱！网友调侃：“这是要逼得美国连PPT都画不出来了？,https://toutiao.com/group/7482006782551589413/,,0,0,False
今年“3·15”晚会曝光的这些“脏东西”，很多人都买过！,2025-03-15 15:06,785,340,人民日报健康客户端,人民日报健康客户端,3·15晚会曝光了泡了保水剂的增重虾仁、根本不灭菌消毒的一次性内裤、用残次废料翻新的卫生巾/纸尿裤…,https://toutiao.com/group/7482047885849412096/,,0,0,False
原始社会没人性，女人就如同男人的玩物，毫无文明可言,2025-02-27 16:01,9588,159,群星访谈秀,群星访谈秀,,https://toutiao.com/group/7474798582516761125/,,0,0,True
海牙法院庭审全球直播，杜特尔特置死地而反击，双刃剑会刺向谁？,2025-03-15 07:26,26039,1453,瞩望云霄,瞩望云霄,,https://toutiao.com/group/7481934280315109915/,,0,0,True
拿走李嘉诚巴拿马港口的贝莱德，才高兴了几天，却发现自己上当了,2025-03-14 01:41,4857,349,阿华今天说事,阿华今天说事,,https://toutiao.com/group/7481474325049049600/,,0,0,True
