title,publish_time,like_count,comment_count,media_name,source,abstract,article_url,tag,is_yaowen,article_sub_type,has_video
拜登下台前搅动南海风云，美菲连手挑衅中国，中国不再忍强硬回击,2025-01-03 03:44,7122,177,邱毅台湾,邱毅台湾,,https://toutiao.com/group/7455530031461171753/,,0,0,True
小子相亲故意扮老，谁知道对方一见面就叫他大爷，这段太逗了,2024-12-24 08:17,3063,683,乐视热播综艺精选,乐视热播综艺精选,,https://toutiao.com/group/7451886130837848610/,,0,0,True
来马赛受到盛情款待，发现瑟琳娜态度坚定，这婚姻观真让人吃惊！,2024-12-03 01:00,18114,2072,非洲小五,非洲小五,,https://toutiao.com/group/7443984069504959030/,,0,0,True
解冻虾，一定不能用水泡，海边人教我方法，2分钟解冻和鲜活一般,2025-01-02 11:24,1560,429,百变小厨坊,百变小厨坊,解冻虾，一定不能用水泡，海边人教我方法，2分钟解冻和鲜活一般,https://toutiao.com/group/7455277445516624419/,,0,0,True
福建最长寿老人今日出殡，膝下子孙100多人，村干部：老人100多岁还能生活自理,2025-01-03 02:54,2376,1190,九派新闻,九派新闻,福建最年长的老人林蛇母于1月1日凌晨在家中去世。林蛇母生于1902年6月18日，福建漳州龙海区海澄镇溪北村人，享年123岁。1月2日，九派新闻联系上溪北村村民委员会一位村干部。他说，他曾多次去林蛇母老人家中看望慰问。,http://feed.huiwen.co/rssv2/toutiaohao_article_ttjpnews_9fc19a1f956448fb9826b9fcb4695509/item/IL1D0KXAMW5XFC1.html,,0,0,False
98岁老郎中教我苹果养生新吃法，每天坚持这样吃，睡眠好，身体棒,2024-12-31 11:43,8905,888,百变小厨坊,百变小厨坊,98岁老郎中教我苹果养生新吃法，每天坚持这样吃，睡眠好，身体棒,https://toutiao.com/group/7454540163725656628/,,0,0,True
34岁雌雄同体的女性，具备男女两性器官，她该如何生存下去？,2024-10-17 03:32,4045,190,大象微视,大象微视,这个词在我们生活中并不常见，简而言之，双性人就是既拥有男性的生殖器官，也具备女性的特征的人。1989年，王梓淇出生在山西太原的一个家庭，她的家里经营着一家小生意，虽然谈不上富裕，但足够让一家人过得舒心自在。,https://toutiao.com/group/7426578550418948618/,,0,0,False
老纪和珅这段对话，以前小时候听不懂，如今听完受益终身,2024-12-28 23:16,5345,1568,乐视扒剧小妹儿,乐视扒剧小妹儿,,https://toutiao.com/group/7453420191947424293/,,0,0,True
煮米饭别总是加水了，难怪不好吃，教你酒店不外传的秘诀，非常香,2024-12-06 08:45,4160,866,明玥美食,明玥美食,,https://toutiao.com/group/7445217195929371190/,,0,0,True
当年狠砸34亿建成的鸟巢，16年来利用率有多少？赔了还是赚了？,2024-12-31 02:48,602,116,毒sir财经,毒sir财经,2024年巴黎奥运会，被嘲“史上最穷酸的一届盛会”。反观2008年北京奥运会，那惊艳全世界的“鸟巢”至今让人难以忘怀。它整整斥资35.96亿元，相对于2018年韩国只花费8亿元场馆，那简直天差地别。它是如今建筑的旷世巨作，更是当代中国人的骄傲。,https://toutiao.com/group/7454089053261300278/,,0,0,False
小女孩上部队找爸爸，少校阿姨主动搭讪，谁知看到女孩父亲傻眼了,2024-12-23 16:01,2426,574,乐视群星访谈秀,乐视群星访谈秀,,https://toutiao.com/group/7451525814283960872/,,0,0,True
弹性退休细则公布！65后、70后、75后退休节点有变化，如何选择？,2025-01-02 00:07,1320,281,社保当家,社保当家,人社部等部门在1月1日正式发布了《实施弹性退休制度暂行办法》，明确了如何办理弹性退休手续，对养老金领取有何影响等事项，及时了解下。,https://toutiao.com/group/7454882770310119987/,,0,0,False
到底是外公亲，还是爷爷亲？心理学家的答案很统一,2024-12-30 06:35,894,431,第一心理,第一心理,一位读者来信，提到最近自己遇到的一些家庭相关的琐事，并提出了自己的一些疑问。具体情况如下：这位读者是一个孩子的母亲，与丈夫结婚之后，一直在丈夫家所在城市生活，也受了公公婆婆不少接济，由于自己父母在另外的城市，有点距离但是不远，孩子出生之后也一直与爷爷奶奶接触更多。,https://toutiao.com/group/7454088472568857126/,,0,0,False
五年老员工工资降到两千，辞职走人，下秒老板后悔晚了,2024-12-25 08:36,5949,1774,南瓜热剧回放,南瓜热剧回放,,https://toutiao.com/group/7452234729299902976/,,0,0,True
综艺：真是神童一个，算术自学成才，6岁就能对战北大高材生,2024-11-16 20:44,17467,2159,乐视综艺咖,乐视综艺咖,,https://toutiao.com/group/7437795240771060258/,,0,0,True
充电时，先插手机还是充电器？方法错误手机坏得快,2025-01-02 01:19,1472,114,人民日报,人民日报,手机电量还剩多少，对现代社会的许多人而言，都是一个“性命攸关”的问题。人们对手机充电的强烈需求，也让市面上催生出了许多噱头：无线充电，二倍速充电，以及能连着用一周的高能充电宝。乱花渐欲迷人眼，但到底什么才是手机充电的正确姿势呢？手机一定要满充满放吗？,https://www.peopleapp.com/column/30047895447-500006027199?utm_source=头条号&promote=true,,0,1,False
萝卜和鸡蛋这样做，比吃补药还补，顿顿吃都不会腻，又香又下饭,2024-10-30 12:28,72177,4387,小寒厨艺,小寒厨艺,萝卜和鸡蛋这样做，比吃补药还补，顿顿吃都不会腻，又香又下饭,https://toutiao.com/group/7431405463378919975/,,0,0,True
乞丐上台唱歌引起评委质疑，一首歌唱完让观众起立鼓掌,2024-11-01 02:16,4698,767,乐视综艺咖,乐视综艺咖,,https://toutiao.com/group/7432129044134494771/,,0,0,True
100年前，清朝罕见留影，王爷妻妾婀娜多姿，乞丐全身挂满垃圾,2024-10-14 09:58,2951,327,万物知识局,万物知识局,每一张老照片，都像是时间的低语，它们静静地躺在历史的相册中，却在不经意间将我们拉回到那个遥远而神秘的年代。,https://toutiao.com/group/7425457574731579919/,,0,0,False
2025 俄乌战争会结束，美将全力对付中国？ 举国体制成就时代之力,2025-01-01 22:01,29591,1355,黎建南台湾,黎建南台湾,,https://toutiao.com/group/7455070492601352731/,,0,0,True
除了戴头盔！2025年1月起，电动车、三、四轮车上路迎来5个新要求,2024-12-30 01:33,1897,315,新能源战略家,新能源战略家,请您在阅读前，先点击上面的“关注”。感谢您的支持，我们将为您带来更多有价值的内容。目前，很多地区都已经发布通告，明确从2025年1月开始，将实行新版电动车管理规定、开展电动车专项整治行动。,https://toutiao.com/group/7454011590065635840/,,0,0,False
贪官酒桌上的权钱交易，语言天衣无缝，听懂三分都是人精！,2024-11-23 16:24,3946,475,乐视扒剧小妹儿,乐视扒剧小妹儿,,https://toutiao.com/group/7440378916130259496/,,0,0,True
夜里翻来覆去睡不着，原来几根芹菜根就搞定，做法简单，省钱实用,2024-12-25 11:02,8594,1015,百变小厨坊,百变小厨坊,夜里翻来覆去睡不着，原来几根芹菜根就搞定，做法简单，省钱实用,https://toutiao.com/group/7452303315842368052/,,0,0,True
欧洲会爆发世界大战吗？俄乌2025年能否止战？|凤凰《非常2024》,2024-12-30 07:54,2962,199,凤凰卫视,凤凰卫视,,https://toutiao.com/group/7454110252754010664/,,0,0,True
经典高清战争老电影,2024-11-18 05:05,11746,342,小微娱乐创作,小微娱乐创作,,https://toutiao.com/group/7438481167495463424/,,0,0,True
原来火腿肠铝环下藏着个“小机关”，轻轻一拉，完整剥开，太棒了,2024-12-30 12:48,3222,2002,百变小厨坊,百变小厨坊,原来火腿肠铝环下藏着个“小机关”，轻轻一拉，完整剥开，太棒了,https://toutiao.com/group/7454186052081680911/,,0,0,True
距张扣扣案已经六年了，张扣扣的部队班长，曾去探望过他的老父亲,2025-01-02 07:53,1898,101,孔甲丙,孔甲丙,转眼间，距离轰动社会一时的张扣扣春节杀人案已经过去六年了，在这六年中，网民们渐渐淡忘了案件的来龙去脉，遗忘了当事人们的恩怨情仇。,https://toutiao.com/group/7455222100240925218/,,0,0,False
海南富商张晖：花8亿建108米海上观音像，4年后死在水中死因成谜,2024-10-19 04:49,4936,875,八号探秘人,八号探秘人,在阅读此文之前，辛苦您点击一下“关注”，既方便您进行讨论和分享，又能给您带来不一样的参与感，感谢您的支持！编辑丨xk他是中国的一名富商，耗费8亿元完成了自己的梦想。可梦想落地成为现实的时候，他却在4年后莫名其妙的死去。他就是张晖，上个世纪末海南岛旅游业的龙头当家人。,https://toutiao.com/group/7427288913095492134/,,0,0,False
河南警察3岁女儿被拐，苦寻全国23年无果，结果却发现女儿在对门,2024-11-05 07:43,6152,652,八号探秘人,八号探秘人,寻亲23年无果，丢失的女儿竟住在对门?但它却真实发生在河南洛阳的梁绍波身上。是意外走丢，还是人贩子所为，三岁的女儿怎会离奇失踪?,https://toutiao.com/group/7433697108120142345/,,0,0,False
“喝酒三巨头”：一年全没，有的去世当天喝4瓶白酒，都不满36岁,2024-11-05 10:32,3191,1712,睿之悦,睿之悦,他们的每一次出现都离不开酒，也曾是很多人眼中的“酒中豪杰”。但“小酌怡情，大饮伤身”，这三位博主以生命为代价，再一次给大家带来了警醒。,https://toutiao.com/group/7433739040179520038/,,0,0,False
刚刚中国又出大招了！美国彻底没主意了（下）,2025-01-02 10:00,4393,246,占豪,占豪,美国的军事主要靠什么立国？为啥美国朝野和媒体都哑巴了？,https://toutiao.com/group/7455158632557052456/,,0,0,True
男子从老婆手中里解救出小三后，牵着狗头也不回的离开了,2024-11-20 09:07,40543,14015,橙橙分享,橙橙分享,,https://toutiao.com/group/7439285557244461606/,,0,0,True
我国楼市大局已定，未来全国45%的家庭，或将面临“5大挑战”,2024-12-15 11:45,711,108,苍暮颜,苍暮颜,前言:21世纪开始，中国房地产市场一路高歌猛进，繁荣的景象更是吸引了无数投资者和购房者，房价也是一路攀升，也成为了房地产经济增长的重要引擎。,https://toutiao.com/group/7448599203455975947/,,0,0,False
女市长爱上小男友，俩人爱的轰轰烈烈，让女市长感到害怕,2024-12-18 08:13,1947,339,乐视经典热综回放,乐视经典热综回放,,https://toutiao.com/group/7449661362671714850/,,0,0,True
暂停执行逮捕令 韩国公调处与总统警卫处对峙超5小时后离开,2025-01-03 04:43,2380,189,央视新闻,央视新闻,当地时间1月3日，韩国高级公职人员犯罪调查处（公调处）和警方在与总统警卫处对峙约5个半小时后，决定暂时停止执行对被停职总统尹锡悦的逮捕令。,https://content-static.cctvnews.cctv.com/snow-book/index.html?item_id=841894420241410363&source=50006&sub_source=50006_001,,0,1,False
你发现没？那些父母有退休金的家庭，往往逃不出这“五大定律”,2025-01-02 14:09,1360,160,水大叔,水大叔,可现在的老人就不一样了，很多老人都有退休金光，每个月领取的退休金就足以支撑生活需求，若仔细观察的话就会发现，那些父母有退休金的家庭，往往会呈现出一些明显规律，可千万别小看这些规律，它可是家庭幸福的关键所在。,https://toutiao.com/group/7455315568817472052/,,0,0,False
刘强东又给老家发现金，60岁以上老人发1万！村民：以后不发也非常感恩,2025-01-02 13:09,2670,881,北青网,北青网,1月1日，刘强东老家江苏宿迁光明村村民透露，已接到通知，2025年春节刘强东将再次给光明村村民发现金，“每家有几千元礼品，60岁以上老人有一万元”，具体发放时间已确定在8号，目前村主任在挨家挨户通知宣传。,http://t.ynet.cn/h5/36233582.html,,0,0,False
妻子深夜加班，丈夫感觉不对劲偷偷跟踪，看到真相瞬间崩溃,2024-10-28 06:59,23094,456,乐视金曲大荟萃,乐视金曲大荟萃,妻子深夜加班，丈夫感觉不对劲偷偷跟踪，看到真相瞬间崩溃,https://toutiao.com/group/7430717509566726656/,,0,0,True
好消息！元旦后，四川将上调城乡居民养老金，从2024年7月补发,2025-01-02 00:13,824,545,社保解读,社保解读,根据四川省人力资源和社会保障厅 四川省财政厅发布的《关于2024年提高城乡居民基本养老保险基础养老金最低标准的通知》，四川省将在元旦后开始上调全省城乡居民基础养老金最低标准，并从2024年7月份起补发上涨金额。,https://toutiao.com/group/7454575735815094784/,,0,0,False
清汤面好吃有诀窍，教你面馆30年不外传的秘诀，劲道爽滑汤鲜味美,2024-12-13 13:30,7113,962,百变小厨坊,百变小厨坊,,https://toutiao.com/group/7447888258186347018/,,0,0,True
贾玲铁了心跟老汉过日子，老汉却嫌贾玲长太丑，这段笑到喷,2024-12-24 03:23,1866,157,乐视最爱综艺说,乐视最爱综艺说,,https://toutiao.com/group/7451813444795236915/,,0,0,True
山楂干泡水很多人都泡错了，难怪没用，今天教你正确做法，真管用,2024-11-02 11:46,7564,283,百变小厨坊,百变小厨坊,,https://toutiao.com/group/7432646945211941402/,,0,0,True
80岁老奶奶做红烧鱼从来不粘锅不破皮，原来技巧这么简单,2024-10-16 12:07,6945,394,家常的味道,家常的味道,,https://toutiao.com/group/7426343891651985974/,,0,0,True
天安门广场2025年元旦升国旗仪式 完整版视频来了,2025-01-01 00:04,13732,1060,小央视频,小央视频,,https://toutiao.com/group/7454731275513889321/,,0,0,True
炖鸡肉不要焯水和直接下锅，教你一招，鸡肉鲜香滑嫩不腥不柴,2024-12-15 08:45,7645,372,家常的味道,家常的味道,炖鸡肉千万不要焯水和直接下锅，教你秒招，鸡肉鲜香滑嫩不腥不柴,https://toutiao.com/group/7448556944597451275/,,0,0,True
他的资历比朱德还老，授勋时却错失元帅，毛主席特批享受元帅待遇,2024-12-12 10:24,2862,120,品古观今,品古观今,在我军革命史上，有一位将军的资历比朱德还老，连毛主席都说:“共产党能对国民党将领说话的人不多，他就是其一。”可这样的人却在大授衔时，错失了元帅，后来经过毛主席的一番关心，才得以享受与元帅的同等待遇。,https://toutiao.com/group/7447468654758871592/,,0,0,False
近5年最热的十部剧，《狂飙》第9，《繁华》第6，第1名很难超越,2024-12-01 03:58,2056,723,电影烂番茄,电影烂番茄,今天，番叔就结合口碑，给大家盘点一下近五年，热度最高的十部电视剧。第十名:《都挺好》 猫眼热度 9775.8，播出时间2019年。,https://toutiao.com/group/7430845717314273831/,,0,0,False
炸鱼块，到底用淀粉还是面粉，今天分享一个又香又脆的做法,2025-01-02 09:26,3359,226,家常的味道,家常的味道,,https://toutiao.com/group/7455247105683096076/,,0,0,True
57岁于文华现状，与丈夫住农村简陋房子，裙子拖地喂着狗生活幸福,2024-12-17 01:24,1181,200,焰墨绘史,焰墨绘史,在阅读此文之前，麻烦您点击一下“关注”，既方便您进行讨论和分享，又能给您带来不一样的参与感，感谢您的支持。本文内容均引用权威资料结合个人观点进行撰写，文中已标注文献来源及截图，请知悉。提起于文华，想必当大家都不会陌生，当年的她凭借那首《纤夫的爱》，一夜间家喻户晓。,https://toutiao.com/group/7448948632033722889/,,0,0,False
