title,publish_time,like_count,comment_count,media_name,source,abstract,article_url,tag,is_yaowen,article_sub_type,has_video
翟欣欣为了钱，竟然可以克服生理厌恶和苏某结婚，也真是个狠人,2025-01-22 09:22,5264,1439,乐见Talk,乐见Talk,索要千万逼死前夫的翟欣欣，认罪认罚！天理昭昭，报应不爽，迟到七年半的审判终于来了。本以为的一场婚姻纠纷，伴随着一封遗书解开了翟欣欣蛇蝎面目。,https://toutiao.com/group/7462559129823953442/,,0,0,False
小沈阳夫妇把演唱会开到了北京春晚舞台！,2025-01-29 16:47,14914,2647,非凡蛋糕mu,非凡蛋糕mu,,https://toutiao.com/group/7465379968436994623/,,0,0,True
美国连续第三天坠机事件！刚刚费城发生坠机！,2025-02-01 05:00,30070,4893,快乐的清风,快乐的清风,,https://toutiao.com/group/7466310853948736052/,,0,0,True
女老师跳“凌波微步”，段誉看了要哭泣,2024-12-16 10:12,2996,407,表哥爱跳舞,表哥爱跳舞,,https://toutiao.com/group/7448950466706145792/,,0,0,True
这就是旺三代的媳妇，祖上积德啊，才能娶到这么好的媳妇👍,2025-01-27 10:33,45381,3716,趣知达人,趣知达人,,https://toutiao.com/group/7464541223764705842/,,0,0,True
公公竟然和儿媳偷情，哪料被妻子撞见，这下有戏看了！,2025-01-21 08:05,10470,889,南瓜午夜厅,南瓜午夜厅,,https://toutiao.com/group/7462273852651979274/,,0,0,True
