title,publish_time,like_count,comment_count,media_name,source,abstract,article_url,tag,is_yaowen,article_sub_type,has_video
一见·从一本书，读懂一张蓝图绘到底,2024-10-17 14:08,997,438,人民日报,人民日报,40多年后，进一步全面深化改革大潮正起，这里已经发生了当年难以想象的巨大变化。自由贸易试验区建设成果展上，一本上世纪八十年代出版的书——《1985年—2000年厦门经济社会发展战略》于历史纵深处给出答案。,https://www.peopleapp.com/column/30047004626-500005842061?utm_source=头条号,,0,0,False
以后想吃回锅肉你就像我这样做，肥而不腻，咸香适口，太解馋了,2024-08-06 11:19,31516,1161,家常的味道,家常的味道,,https://toutiao.com/group/7399984507362738742/,,0,0,True
给近三年最好的10部年代剧排个名：《人世间》第6，第1名没有争议,2024-09-06 08:08,2455,858,皮皮电影,皮皮电影,时尚是个轮回，电视剧也是。在2020年之前的那些年，电视剧市场基本上都被偶像剧、都市剧霸占。曾经撑起国剧品质的《闯关东》《岁月》这类年代好剧，难见踪影。,https://toutiao.com/group/7411390030722712090/,,0,0,False
一巴掌的代价，公交车上大妈打晕患癌小伙，断送退休后的幸福生活,2024-10-14 09:53,908,499,客观听書,客观听書,公交车上老太太和小伙吵了起来，老太太更是当仁不让直接给了小伙一巴掌。这名小伙直接倒地，老大大根本就不会想到正是因为他的一巴掌，鲜活的生命就这样消失在他的手里。,https://toutiao.com/group/7425563455358468627/,,0,0,False
认祖归宗？蒙古国的“阳谋”将至！计划 2025年恢复蒙文与内蒙接轨,2024-09-08 03:03,1352,233,智史通鉴,智史通鉴,大家都知道，在历史上，外蒙古和内蒙古曾是“一家人”。后来清朝时期，外蒙古就开始独立出去，到现在，他们不仅加入了联合国，还将传统的蒙古语抛弃了，用了新的西里尔新蒙古文。可是随着时间的流逝，蒙古国似乎有一个“阳谋”渐渐浮出水面：他们计划在2025年，恢复传统的回鹘蒙文的使用。,https://toutiao.com/group/7412094989640958502/,,0,0,False
军号一响，全军出击！,2024-09-19 08:01,19354,1256,中国军号,中国军号,,https://toutiao.com/group/7416261401477382668/,,0,0,True
男子真的是正人君子，简直不敢相信是真的！,2024-10-10 12:50,1084,171,夕阳下的小李,夕阳下的小李,,http://toutiao.com/item/7424128558282310156/,,0,0,True
全红婵的伯乐陈华明，欺骗全红婵，如今蝉宝每每想起都愤愤不平。#陈华明 #郭艺 #全红婵 #人物故事,2024-10-07 22:48,3989,265,足球狂迷,足球狂迷,,http://toutiao.com/item/7423169444735615528/,,0,0,True
中国著名导弹专家咋了？肖龙旭突然被撤职…,2024-10-13 10:28,6112,1463,司马南,司马南,这是我在中国工程院官网上看到的，大名鼎鼎的肖龙旭是我国著名的军工专家，于2002年获得清华大学博士学位，2019年当选中国工程院院士，速度之快令人惊叹。,https://toutiao.com/group/7425203675784397322/,,0,0,False
全球约一半肝癌在中国，再次提醒：家中的4种食物，尽早撤下餐桌,2024-08-13 08:36,103393,3556,梁医学社梁怡璋医生,梁医学社梁怡璋医生,,https://toutiao.com/group/7402540119712629311/,,0,0,True
清华博士从8000米高空跳机自杀，父母拒绝收尸：就让他死在美国,2024-10-17 10:12,703,130,睿之悦,睿之悦,这样一位本该前程似锦的人才，却选择了从8000米的高空跳机结束自己的生命。而更加让人没有想到的是，在得知消息后的父母竟拒绝为他收尸，甚至还直言:就让他死在美国!,https://toutiao.com/group/7426683840964231707/,,0,0,False
朝鲜半岛突然紧张，韩朝火力对峙，背后美俄角力，战争会出现吗？,2024-10-17 07:32,22032,1078,邱毅台湾,邱毅台湾,,https://toutiao.com/group/7426644171232674316/,,0,0,True
万万没想到，35岁杨颖兜兜转转干回“老本行”，活成内娱最大笑话,2024-09-06 07:55,534,137,读万卷书的张飞,读万卷书的张飞,文l张飞编辑l张飞曾经你看不起别人；如今谁又瞧得上你？在节目中丝毫不考虑他人状态，一味地只追求自己的镜头。甚至还在采访中公然表示“自己早就应该把所有奖拿了个遍了”。更关键的是丝毫没有任何“报恩”之心。所以如今曾经所有的“嚣张”“高高在上”遭到反噬，只能说现在谁还“愿意”认识她！,https://toutiao.com/group/7411434661014012456/,,0,0,False
她是央视最惨主持人，男友被判死缓，丈夫诈骗入狱，47岁无人敢娶,2024-08-27 23:30,2249,209,闻书识焉,闻书识焉,她曾是央视的台柱子，和董卿、周涛并称为央视的三朵金花。回顾刘芳菲的前半生，最令人感到惋惜的，便是她的感情生活，47岁至今无人敢娶。,https://toutiao.com/group/7407743113688564258/,,0,0,False
有人冒充我男朋友，算不算诈骗？遇到奇葩事你会怎么办？,2024-09-06 05:52,1701,225,兴凯湖莹莹,兴凯湖莹莹,,https://toutiao.com/group/7411404025502892554/,,0,0,True
"万万没想到,53岁“丁克”半辈子的康辉，一生遗憾竟然是一通电话",2024-08-21 22:14,27919,5396,峰哥正读,峰哥正读,在阅读此文之前，麻烦您点击一下“关注”，既方便您进行讨论和分享，又能给您带来不一样的参与感，感谢您的支持！文/编辑：蘑菇百善孝为先。但是到底怎么做才算是“孝”，康辉用了半辈子才明白。央视知名主持人康辉，事业顺遂，家庭幸福，在外人看来是一个人生赢家。,https://toutiao.com/group/7405504703687115273/,,0,0,False
城中村卖淫现象横生，按量批发，40元一次，100元三次，不敢相信,2024-10-13 11:15,1991,104,言先生,言先生,#老百姓关心的话题#民生#农村生活,https://toutiao.com/group/7425217383775601163/,,0,0,True
美国正式通知中国，再次包机遣返中方非法移民，我方迅速表态,2024-10-18 03:30,2579,188,马克观天下,马克观天下,10月16日，美国国土安全部长马约卡斯对外发布公告称，继6月份包机遣返中国非法移民后，近期再次通知中国方面，继续用大型包机的方式，遣返了第二批非法移民。,https://toutiao.com/group/7425469697711260199/,,0,0,False
写歌30年穷困潦倒，前妻失望选择离婚，谁料51岁靠一首歌一夜成名,2024-08-12 03:37,26070,4329,八号探秘人,八号探秘人,在阅读此文之前，辛苦您点击一下“关注”，既方便您进行讨论和分享，又能给您带来不一样的参与感，感谢您的支持！编辑：LY无数人都想要一个一夜成名的机会，但机会来了也不是每个人都能把握住的。他用了三十年的时间来准备迎接属于自己的机会。为了这个机会他放弃了一切，甚至包括家庭。,https://toutiao.com/group/7402090890367484428/,,0,0,False
