title,publish_time,like_count,comment_count,media_name,source,abstract,article_url,tag,is_yaowen,article_sub_type,has_video
机器人首次登台，竟公然向评委喷水，笑坏郭德纲,2025-02-11 09:00,4402,883,大城小爱剧场剧院,大城小爱剧场剧院,,https://toutiao.com/group/7470083368625996288/,,0,0,True
14年儿子坐马航失联，多年后父亲收到回信，坚信儿子去了平行世界,2025-02-20 02:38,8113,765,谛听骨语,谛听骨语,MH370失联的第10年，马来西亚政府宣布在2024年12月20日重启寻找马航MH370的项目。如果后续进展顺利的话，马航MH370会在2025年的1月到4月期间重新展开全面地搜寻。凭空消失的客机，有希望被揭露的失踪真相，这一切都是让人充满了期待。,https://toutiao.com/group/7473322554179895817/,,0,0,False
东北一大哥拉滴滴碰到前任，聊天过程比看春晚还精彩,2025-02-14 09:28,56796,4587,半眠学姐,半眠学姐,,https://toutiao.com/group/7471204168842396211/,,0,0,True
这位母亲的善良感动了千万网友，传递正能量。,2025-02-08 00:41,367518,32220,祥哥,祥哥,,https://toutiao.com/group/7468841777064182312/,,0,0,True
女生在动物园摸了老虎后不洗手 带回家让猫咪闻 猫咪的反应亮了！,2025-03-07 01:26,2075,215,社会资讯播放坊,社会资讯播放坊,,https://toutiao.com/group/7478872650106946099/,,0,0,True
移居中国13年的英国人🇬🇧当他回到伦敦时他震惊了…儿子想走,2025-01-13 03:37,46230,11245,Goujohnson,Goujohnson,移居中国13年的英国人🇬🇧当他回到伦敦时他震惊了…儿子想走,https://toutiao.com/group/7459238917565317644/,,0,0,True
中俄为何要站在一起，李显龙一语道破，我们还会遇到美国霸权,2025-03-04 16:52,35378,1573,孙绪闻,孙绪闻,中俄为何要站在一起，李显龙一语道破，我们还会遇到美国霸权,https://toutiao.com/group/7477998067472482828/,,0,0,True
一个独生子接母亲出院的过程被网友拍下，数百万人引发共鸣。,2025-02-23 02:38,34064,8365,响叮当,响叮当,,https://toutiao.com/group/7474438309831016987/,,0,0,True
大兴机场被北漂睡成“洗浴中心”，撕开当下社会最体面的一幕,2025-02-09 06:57,820,148,在雨中绽放,在雨中绽放,大兴机场，作为中国现代化的象征，原本是一座飞速连接世界的雄伟建筑，却悄然变成了一个极不寻常的“睡觉地”。,https://toutiao.com/group/7469299821824721417/,,0,0,False
