title,publish_time,like_count,comment_count,media_name,source,abstract,article_url,tag,is_yaowen,article_sub_type,has_video
汇集人类共同发展的最大公约数——高质量共建“一带一路”走深走实,2024-11-30 22:50,4686,2157,人民日报,人民日报,习近平总书记强调:“中方致力于推进高质量共建‘一带一路’，同各参与方共同打造陆海联动和协同发展的互联互通网络。”,https://www.peopleapp.com/column/30047546075-500005964004?utm_source=头条号&promote=true,,0,0,False
中国是真伟大，这种事只有我们能办到了！（上）,2024-11-30 22:00,5086,377,占豪,占豪,啥是给沙漠“锁边合龙”？就这些成绩，哪个国家能做到？,https://toutiao.com/group/7442630441128952371/,,0,0,True
罕见！100年前，英国游客拍下的清朝乡村，和想象中完全不一样,2024-09-20 02:07,8057,725,万物知识局,万物知识局,泥泞的土路，衣不蔽体的老百姓，即便是达官显贵的家中也十分破败，而这些都是清王朝的历史痕迹，虽说那时候中国摄影技术并不发达，但也有许多外国游客来到这里，拍摄下了许多老照片，为我们留下了珍贵的历史资料，那清朝到底是怎样的面貌呢?,https://toutiao.com/group/7416287738871267855/,,0,0,False
包厢全是刚出狱的恶霸，结果一看到饭店主厨，立马怂了,2024-11-11 01:21,9887,226,乐视群星访谈秀,乐视群星访谈秀,,https://toutiao.com/group/7435825833048015400/,,0,0,True
吉林美女带俩娃，嫁给头婚小叔子，婆婆一手撮合，如今过得怎样了,2024-11-01 08:01,5133,1308,睿之悦,睿之悦,说出来可能很多人都不相信，吉林一位带着两个孩子的美女在婆婆的大力撮合下嫁给了自己的小叔子。2020年，这位女子的丈夫因为意外去世，留下了她们孤儿寡母悲痛欲绝。,https://toutiao.com/group/7432216069030363682/,,0,0,False
母亲瘫痪、父亲疯了，当年那个744分的高考状元，7年后却成了这样,2024-09-08 00:54,13098,1896,八号探秘人,八号探秘人,母亲截肢瘫痪、父亲疯癫痴傻，可对于自己的亲人，他却做出了这样的评价。而今，7年已过，曾经那个让无数人动容的少年，现在如何?,https://toutiao.com/group/7411852147648496162/,,0,0,False
小品：拜见岳父闹出大笑话，这小品不上春晚，真是可惜啊！,2024-11-02 01:55,7350,911,小品官方账号,小品官方账号,小品：拜见岳父闹出大笑话，这小品不上春晚，真是可惜啊！,https://toutiao.com/group/7432494673777656332/,,0,0,True
刚从中国返俄，苏-57飞行员传来新消息,2024-11-25 10:15,8142,262,环球时报新媒体,环球时报新媒体,刚从中国返俄，苏-57飞行员传来新消息,https://toutiao.com/group/7441158524530328127/,,0,0,True
深夜3分钟3人报警，其中一个从美国打来，指向同一个地址！,2024-12-01 05:13,771,204,北青网,北青网,“我人摔倒在地上，炉子上还烧着东西，你们快点来开门，火要烧了。”11月26日晚上10点多，浙江杭州上城警方接到报警，报警人是位老奶奶。一会儿，有人报警，“有个老奶奶一个人住的，摔了一跤，现在爬不起来，我现在赶过去，急死了。”报警人是位大姐。,http://t.ynet.cn/h5/36122759.html,,0,0,False
解放后，花甲之年的余则成回来寻找翠萍,2024-11-30 22:10,1414,323,云端微影,云端微影,,http://toutiao.com/item/7443198254994424358/,,0,0,True
女教师因丈夫被开除，不料她丈夫竟是将军，校长要完了,2024-11-27 08:32,3855,585,南瓜说异,南瓜说异,,https://toutiao.com/group/7441874251113562636/,,0,0,True
乌克兰蒙了，欧洲慌了，美国也冷静了,2024-11-26 10:42,14421,488,张元伟,张元伟,,https://toutiao.com/group/7441536551424623114/,,0,0,True
福彩双色球“井喷”20注一等奖、12注一等奖特别奖！一等奖单注奖金高达600万,2024-12-01 14:30,330,169,大皖新闻,大皖新闻,大皖新闻讯 中国福利彩票“双色球”第2024138期中奖号码：红色球：21、2、28、7、27、11，蓝色球：2，共开出20注一等奖和12注一等奖特别奖。,http://www.ahwang.cn/toutiao/202412/2781089.html,,0,1,False
红房子：这段堪称最精彩，范伟和李小璐演技炸裂，百看不厌！,2024-11-11 02:36,1749,193,南瓜热剧回放,南瓜热剧回放,红房子：这段堪称最精彩，范伟和李小璐演技炸裂，百看不厌！,https://toutiao.com/group/7435845105006674458/,,0,0,True
1米3袖珍美女嫁给1米48男孩，婚后丈夫奇迹长高，两人却不欢而散,2024-09-07 02:55,6786,366,睿之悦,睿之悦,杨萍和葛存苗的婚礼 文|睿之悦 编辑|睿之悦2019年，成都的民政局来了两个“10岁小孩”来登记，工作人员以为是玩闹。两个“小孩”拿出身份证让工作人员看，这才明白，原来是两个再也长不高的成年袖珍人情侣。,https://toutiao.com/group/7411713833267364386/,,0,0,False
特务男扮女装混进村子，孩子兵顿时发现不对劲，这下精彩了,2024-10-28 06:09,7400,682,乐视群星访谈秀,乐视群星访谈秀,,https://toutiao.com/group/7430704630294413878/,,0,0,True
泽连斯基开出停火条件，俄方回应了,2024-11-30 23:18,2714,4742,齐鲁壹点,齐鲁壹点,据乌克兰国际文传电讯社29日晚报道，乌总统泽连斯基当天接受英国媒体采访时表示，在乌克兰政府控制的领土被纳入北约保护的前提下，他愿意停止热战。,http://m.ql1d.com/new/general/25204820,,0,0,False
太突然！知名装修公司宣布：资金链断链，全面停工！有人刚交了定金就出事了,2024-12-01 10:43,387,446,每日经济新闻,每日经济新闻,据界面新闻报道，11月28日，重庆俏业家装饰发布公示函称，公司资金链断链原因导致所有工程已全面停工，无法再继续履行合同内容，为不影响各位业主（包含未进场和已进场业主）的后续装修事宜，现做以下公示：一、业主可找项目经理及俏业家工程部负责人三方协商确认已完工价值 （工人工费和已到现场,http://www.nbd.com.cn/rss/jinri_toutiao/articles/3667254.html,,0,0,False
快消失的12个生活用品！40年前在供销社红极一时，你家还在用吗？,2024-09-29 07:58,6147,413,万物知识局,万物知识局,在这里，可以买到从油盐酱醋到衣物鞋帽，再到农具化肥等各种生活必需品，每一样物品都凝聚着时代的特色，见证了那个年代人们的生活状态，今天我们就来走进那些年能够在供销社里买到的生活用品，看看你们还记得哪些。,https://toutiao.com/group/7419937237548237322/,,0,0,False
郭有才：当迷失方向忘记初心后，曾经飘得多高，如今摔得就多惨,2024-11-11 06:53,1358,657,八号探秘人,八号探秘人,在阅读此文之前，辛苦您点击一下“关注”，既方便您进行讨论和分享，又能给您带来不一样的参与感，感谢您的支持！编辑丨brt因为一首翻唱，他一夜之间成为了拥有千万粉丝的网红。但是“人红是非多”，不久他就因为版权等问题陷入了舆论风波。他的人气一落千丈，从万众瞩目变成了现在的无人问津。,https://toutiao.com/group/7435901170239078948/,,0,0,False
11年狂赚200亿，骗了10万中国人后跑路的亿万富翁，下场如何呢？,2024-09-26 09:05,3899,1201,八号探秘人,八号探秘人,盘继彪，一个狂妄自大的骗子，11年间骗走200亿，把十几万中国人坑得是血本无归家破人亡。不仅如此，他还在跑路之前，杀人诛心的在他们公司官网发布了一条“我们跑路了“的公告，嘲讽受害者。,https://toutiao.com/group/7418792738887729704/,,0,0,False
新骗局来了！不需要转账、也不用输密码，骗子就能轻松转走你的钱,2024-11-22 10:49,2465,264,鲸探所,鲸探所,你以为的诈骗，是需要你输入密码、转账的那种。可实际上的诈骗，却已经发展到不需要任何转账和密码的这种程度了。,https://toutiao.com/group/7440050588496200243/,,0,0,False
