title,publish_time,like_count,comment_count,media_name,source,abstract,article_url,tag,is_yaowen,article_sub_type,has_video
67岁执意生娃，如今却坐轮椅无法自理，5岁的天赐被迫独立学洗衣,2024-11-04 10:32,8542,1965,睿之悦,睿之悦,2019年，已经67岁的田新菊执意生下了自己的第三个孩子小天赐。那么，现如今5年的时间过去了，这“天赐”的礼物到底是福还是祸呢?,https://toutiao.com/group/7433367394946384435/,,0,0,False
罕见！100年前，英国游客拍下的清朝乡村，和想象中完全不一样,2024-09-20 02:07,8605,756,万物知识局,万物知识局,泥泞的土路，衣不蔽体的老百姓，即便是达官显贵的家中也十分破败，而这些都是清王朝的历史痕迹，虽说那时候中国摄影技术并不发达，但也有许多外国游客来到这里，拍摄下了许多老照片，为我们留下了珍贵的历史资料，那清朝到底是怎样的面貌呢?,https://toutiao.com/group/7416287738871267855/,,0,0,False
郭有才：当迷失方向忘记初心后，曾经飘得多高，如今摔得就多惨,2024-11-11 06:53,1606,748,八号探秘人,八号探秘人,在阅读此文之前，辛苦您点击一下“关注”，既方便您进行讨论和分享，又能给您带来不一样的参与感，感谢您的支持！编辑丨brt因为一首翻唱，他一夜之间成为了拥有千万粉丝的网红。但是“人红是非多”，不久他就因为版权等问题陷入了舆论风波。他的人气一落千丈，从万众瞩目变成了现在的无人问津。,https://toutiao.com/group/7435901170239078948/,,0,0,False
富二代当兵却逃跑回家，班长去他家抓人，一进家门瞬间惊了,2024-10-26 02:59,12783,1100,乐视天天剧好看,乐视天天剧好看,,https://toutiao.com/group/7429913203359875636/,,0,0,True
冬天洗澡多久一次最好？这4个时候，劝你不要洗,2024-12-07 10:01,1708,229,环球网,环球网,来源：健康杭州 最近杭城的气温 一天天走低 忙活了一整天，洗个热乎乎的澡 再钻进暖暖的被窝，再舒服不过！ 然而不少人洗澡时 或多或少会犯些错 结果把本该舒服又养人的“养生澡”硬生生洗成了“伤身澡”冬天多久洗一次澡最好？洗澡频率主要取决于个体的需求和偏好。,https://3w.huanqiu.com/a/106d4f/4KYr5sh4XfC?agt=20,,0,0,False
广西49岁老汉娶19岁姑娘，结婚21年生下15个孩子，如今有何下场？,2024-10-20 08:32,6385,773,艺述史,艺述史,她19岁出嫁，21年里总共生育了15个孩子，其中4个男孩子11个女孩子，家里热闹的像是开了一所学校一样。,https://toutiao.com/group/7427400319418384948/,,0,0,False
横店13万群演现状：美女泛滥，懒汉遍地，降薪后他们该何去何从？,2024-12-09 04:29,892,401,毒sir财经,毒sir财经,最近，13万横店群演，经历了降薪之痛。横店演员公会发布通知，群演的时薪由原本的15元降至13.5元。由于工作时长在10-18个小时，降薪后的群演，一天的收入也就在135-243元之间。因为人多戏少，加上横店演员公会还要抽取群演工资的10%，大多群演每月到手的工资，也才一两千块。,https://toutiao.com/group/7446025714630935052/,,0,0,False
新生育时代：三个“二孩家庭”的上海样本,2024-12-08 11:02,565,232,看看新闻,看看新闻,新生育时代：三个“二孩家庭”的上海样本,http://mediaplay.kksmg.com/2024/12/08/h264_720p_600k_77882-DFTVHD-20241208175000-4800-958532-600k_mp4.mp4,,0,0,True
赏金1000万的大头目，摇身一变成叙利亚新总统？但他得听三国的话,2024-12-09 09:41,1688,104,第一军情,第一军情,美国官员正在讨论取消“沙姆解放组织”（HTS）大头目乔拉尼通缉令的可能性。要知道，自2013年起，乔拉尼就被美国认定为“恐怖分子”，他所领导的组织也被当时的特朗普政府禁止，并悬赏1000万美金通缉乔拉尼。,https://toutiao.com/group/7446345040852419107/,,0,0,True
央视曝光！#制假售假“一条龙”！,2024-11-24 12:16,5176,1975,央视财经,央视财经,,https://toutiao.com/group/7440818726712115762/,,0,0,True
跑道总长5公里！美媒：神秘飞机现身中国西北机场，极具战略价值,2024-12-05 09:30,1514,149,军武次位面,军武次位面,图像显示，在中国西北地区的一个偏远机场跑道末端，有一个奇怪的白色物体，旁边还散布着一些小型物体，疑似支援设备。,https://toutiao.com/group/7444822774259941923/,,0,0,False
央行定于12月16日起陆续发行2025年贺岁纪念币和纪念钞,2024-12-09 01:11,364,146,界面快讯,界面快讯,中国人民银行定于2024年12月16日起陆续发行2025年贺岁纪念币和纪念钞，其中双色铜合金纪念币1枚，纪念钞1张，金质纪念币1枚，银质纪念币1枚，均为中华人民共和国法定货币。一、双色铜合金纪念币和纪念钞（一）双色铜合金纪念币和纪念钞图案。1.正面图案。,https://m.jiemian.com/article/12091944_ttkx.html,,0,0,False
重磅会议落地！中国资产集体爆发、恒生科指收盘大涨4.3%、富时A50、人民币、3倍做多富时中国ETF直线拉升,2024-12-09 08:24,2098,3415,金融界,金融界,重磅会议落地！中共中央政治局12月9日召开会议，会议指出提出实施实施更加积极的财政政策和适度宽松的货币政策，稳住楼市股市，要大力提振消费、提高投资效益。值得注意的是，中国将实施“适度宽松”的货币政策，这是2011年以来首次改变货币政策立场。,https://m.jrj.com.cn/toutiaoyc/2024/12/9/46164989.shtml,,0,0,False
明年起，满18岁男性必须兵役登记！否则影响上大学、找工作,2024-12-09 06:44,9998,11945,大河报,大河报,重要提醒！2025年兵役登记工作将于2025年1月1日开始已经进行过兵役登记，有参军意向的可直接参加网上应征报名。依法服兵役和进行兵役登记是每个适龄公民应尽的光荣义务和神圣责任。《中华人民共和国兵役法》明确国家实行兵役登记制度，每名男性青年在年满18周岁时都要履行兵役登记义务。,https://toutiao.com/group/7446299249363157558/,,0,0,False
炸萝卜丸子到底用面粉还是淀粉，教你正确做法，外焦里嫩，太香了,2024-10-26 09:25,14486,967,家常的味道,家常的味道,,https://toutiao.com/group/7430012978277122611/,,0,0,True
包厢全是刚出狱的恶霸，结果一看到饭店主厨，立马怂了,2024-11-11 01:21,12271,335,乐视群星访谈秀,乐视群星访谈秀,,https://toutiao.com/group/7435825833048015400/,,0,0,True
天冷电动车充满电，一加油门就掉2格，不怪电池，真实原因告诉你,2024-11-26 05:02,1751,119,新能源战略家,新能源战略家,电动车使用方便、价格便宜，已经成为了不少朋友通勤代步的首选，但在使用过程中偶尔也有让人糟心的问题。像爆胎、刹车不灵敏这类问题可以通过门店维修来解决，但如果遇到电池出现异常情况，不仅问题难以排查，而且维修成本也不低。,https://toutiao.com/group/7441448742575702563/,,0,0,False
3年前，宁夏7岁小女孩一笑走红，后拒百万签约，如今怎么样了？他们后悔了吗？,2024-09-19 07:25,14993,1998,睿之悦,睿之悦,2021年，视频镜头中出现的女孩儿用那一抹甜美的笑容，迅速引起了网友们的广泛关注。有媒体公司看到这一机遇，提出愿意用百万巨资与女孩儿签约，然而，女孩儿的父母却坚决拒绝了这一提议。,https://toutiao.com/group/7416250139544879679/,,0,0,False
河南警察3岁女儿被拐，苦寻全国23年无果，结果却发现女儿在对门,2024-11-05 07:43,3492,357,八号探秘人,八号探秘人,寻亲23年无果，丢失的女儿竟住在对门?但它却真实发生在河南洛阳的梁绍波身上。是意外走丢，还是人贩子所为，三岁的女儿怎会离奇失踪?,https://toutiao.com/group/7433697108120142345/,,0,0,False
海南富商张晖：花8亿建108米海上观音像，4年后死在水中死因成谜,2024-10-19 04:49,2442,347,八号探秘人,八号探秘人,在阅读此文之前，辛苦您点击一下“关注”，既方便您进行讨论和分享，又能给您带来不一样的参与感，感谢您的支持！编辑丨xk他是中国的一名富商，耗费8亿元完成了自己的梦想。可梦想落地成为现实的时候，他却在4年后莫名其妙的死去。他就是张晖，上个世纪末海南岛旅游业的龙头当家人。,https://toutiao.com/group/7427288913095492134/,,0,0,False
涉嫌违反反垄断法 英伟达被立案调查,2024-12-09 11:32,8134,11328,央视新闻,央视新闻,近日，因英伟达公司涉嫌违反《中华人民共和国反垄断法》及《市场监管总局关于附加限制性条件批准英伟达公司收购迈络思科技有限公司股权案反垄断审查决定的公告》（市场监管总局公告〔2020〕第16号），市场监管总局依法对英伟达公司开展立案调查。,https://content-static.cctvnews.cctv.com/snow-book/index.html?item_id=6510218410825795776&source=50006&sub_source=50006_001,,0,1,False
新乱世佳人：美妇求县长帮忙，县长却打起她的主意,2024-12-06 06:25,2695,366,乐视娱乐乐翻车,乐视娱乐乐翻车,,https://toutiao.com/group/7445181070040891931/,,0,0,True
2025年1月起，退休人员医保划入金额调整，能有400元吗？,2024-12-09 04:09,2733,452,社保之心,社保之心,2025年1月起，退休人员医保划入金额调整，能有400元吗?时间来到12月9日，距离2025年已经不满一个月的时间了，回顾2024年，我们迎来勒养老金的第20次上涨，企事业单位养老金改革正式完成，以及延迟退休政策尘埃落定。,https://toutiao.com/group/7446257736989409833/,,0,0,False
大学生4年间艾滋病感染12397例，60%存在这一行为,2024-12-03 10:16,5223,4335,凤凰网,凤凰网,据相关数据，2020年至2023年，新报告青年学生病例分别为:2977人、3677人、2733人、3010人，四年间共报告12397人。,https://toutiao.com/group/7444127197663396364/,,0,0,False
美国霸权是世界乱源，拜登卸任前把天下搞大乱，遍地烽火生民涂炭,2024-12-09 06:01,10235,145,邱毅台湾,邱毅台湾,,https://toutiao.com/group/7446288140483953152/,,0,0,True
