title,publish_time,like_count,comment_count,media_name,source,abstract,article_url,tag,is_yaowen,article_sub_type,has_video
国乒5朵金花的家庭：王艺迪体二代，陈梦富二代，王曼昱父亲泪目,2024-08-04 02:03,2718,151,不似少溓游,不似少溓游,想要在国内靠乒乓球打出名堂，仅仅有天赋是完全不够的。因为在中国乒坛，万里挑一的天才遍地都是。以至于有不少人都选择放弃，甚至还有田志希这样为了能打乒乓球而选择归化韩国的球手。,https://toutiao.com/group/7398094722457289266/,,0,0,False
华为三折叠跌下神坛？发售15天被“打回原形”，黄牛已瑟瑟发抖,2024-10-04 07:38,1550,1325,行哥嘚啵嘚,行哥嘚啵嘚,,https://toutiao.com/group/7421821653820113423/,,0,0,True
上山采蜜误闯蛇窝，20几条毒性不一，姑娘当场吓尿，头发竖起来了,2024-07-24 02:13,1820,231,兴凯湖莹莹,兴凯湖莹莹,,https://toutiao.com/group/7395019818291692032/,,0,0,True
大结局要来？30国撤侨，伊朗真正敌人出现，不是以色列也不是美国,2024-10-04 07:52,1377,234,吴学兰,吴学兰,“抵抗之弧”开始发力，以色列被轰炸，内塔尼亚胡政府誓言将重大报复，30国紧急撤侨，大结局要来了吗?在这种形势下，美国、中国和俄罗斯等30国纷纷撤侨，美国已安排航班从黎巴嫩撤走100名美国公民，俄罗斯撤离了60名外交人员家属。,https://toutiao.com/group/7421825056038650422/,,0,0,False
4年骑行结束，1500天终于回到老家，感谢大家一路陪伴有缘江湖见,2024-09-07 03:50,73412,16855,刘伟元的旅行,刘伟元的旅行,4年骑行结束，1500天终于回到老家，感谢大家一路陪伴有缘江湖见！,https://toutiao.com/group/7411715839100977716/,,0,0,True
山西一女大学生白嫖被拒恼羞成怒：当初有多嚣张，如今就有多慌张,2024-09-28 05:45,2098,1069,鲸探所,鲸探所,很难想象，因为一包12.99元的红枣，一位大学生竟然能对客服辱骂一个小时。这样的事情，听起来似乎确实让人感觉有点难以置信，可它就这么水灵灵的发生了，而且还被曝光出来了。,https://toutiao.com/group/7419561787948941876/,,0,0,False
警示：现代战争的大风暴终于来了,2024-10-04 15:33,2238,359,司马南,司马南,如今加沙在打，叙利亚在打，黎巴嫩在打，伊朗跟以色列又开打，俄乌战争那边已经打了三年了。现代战争有一些很重要的特点，我在华山穹剑上读了一篇文章，有一个观点说现代战争的规则已经变了，需要三种能力。,https://toutiao.com/group/7421941351971013170/,,0,0,False
为什么1984年阅兵无法被超越？看到这样的劈枪和脚步就知道了,2024-07-14 05:28,20058,1760,悠闲入口,悠闲入口,,https://toutiao.com/group/7391359236577428007/,,0,0,True
有人冒充我男朋友，算不算诈骗？遇到奇葩事你会怎么办？,2024-09-06 05:52,1650,217,兴凯湖莹莹,兴凯湖莹莹,,https://toutiao.com/group/7411404025502892554/,,0,0,True
长相太美被导演收入房中，27年同居无名分，63岁因一件事幡然醒悟,2024-08-08 07:54,2527,109,8卦娱,8卦娱,写作不易，文中会有5s广告，观看后可免费阅读全文，精彩值得期待！文|8卦娱“以色侍人，能好几时？”谁能想到《康熙王朝》“后宫”的“是非”，竟从戏里“争斗”到戏外，女演员之间的较量，简直令人别开生面。那么她们之间到底有何恩怨？为什么说“容妃”戏如人生？,https://toutiao.com/group/7400667604068680233/,,0,0,False
他于9月30日凌晨因交通意外不幸去世，年仅35岁,2024-10-04 02:45,1142,528,大皖新闻,大皖新闻,10月3日，南昌百餐及赣乡野餐饮管理有限公司发布了一则《沉重公告》。讣告显示，百餐创始人兼赣乡野董事长魏昆先生于2024年9月30日凌晨因交通意外不幸去世，享年35岁。据江南君电话联系公告上的朱先生，他表示他是魏昆的合伙人，这件事是真的。,http://www.ahwang.cn/toutiao/202410/2753656.html,,0,1,False
我哥哥，和朋友一起前往新疆种地后，离奇失踪32年，生死未卜,2024-07-07 22:06,8845,4499,真实人物采访,真实人物采访,#头条寻人##寻人路上的故事##失踪##回家#这是我们讲述的第4291位真人故事我是杨琼英，今年56岁，这是我找哥哥的第四个年头。32年前，我哥哥杨文斌在其好友代志福的多次劝说下，和他一同前往新疆种地，从此便和家人失去了联系。,https://toutiao.com/group/7388842950048875049/,,0,0,False
今天才知道！电动车“每天充”和“用完再充”，到底哪个更伤电池,2024-08-27 11:19,8126,1657,鲸探所,鲸探所,“今天到底给车充不充电？”估计大多数人每天回家都会想这个问题，看着自己的电动车电量又多又少的，充不充电也是一件非常难以抉择的事情。那么，电动车到底应该怎样充电呢？是每天都充，还是用完之后再充呢？电动车充电不管是在城市还是农村，电动车其实都是人们出门最常见的交通工具。,https://toutiao.com/group/7407773012533117475/,,0,0,False
5名青年蒙冤入狱21年，出狱后拒绝赔偿，只求当年办案人员被法办,2024-10-04 11:12,367,161,艾弥儿,艾弥儿,声明：真实人物故事，文末附权威资料来源1996年，安徽的5名青年含冤入狱，受限于当时的技术能力，法院草草审理此案，判处2人死刑、1人无期、2人15年有期。谁曾想，21年后，真相大白，他们也终于沉冤昭雪。,https://toutiao.com/group/7421872750219903515/,,0,0,False
女儿美国读高中花掉110万，单亲妈妈发起募捐：求捐200万读大学！,2024-07-25 10:10,925,1834,笑史云烟,笑史云烟,都说寒门出贵子，这话其实不假，就像单亲妈妈郑女士辛苦拉扯长大的女儿小杰，在努力下直接考上了美国加州大学。,https://toutiao.com/group/7395473835161616936/,,0,0,False
写歌30年穷困潦倒，前妻失望选择离婚，谁料51岁靠一首歌一夜成名,2024-08-12 03:37,24641,3942,八号探秘人,八号探秘人,在阅读此文之前，辛苦您点击一下“关注”，既方便您进行讨论和分享，又能给您带来不一样的参与感，感谢您的支持！编辑：LY无数人都想要一个一夜成名的机会，但机会来了也不是每个人都能把握住的。他用了三十年的时间来准备迎接属于自己的机会。为了这个机会他放弃了一切，甚至包括家庭。,https://toutiao.com/group/7402090890367484428/,,0,0,False
一部剧，戳穿36岁刘亦菲的“真实处境”，终究难逃“干爹”陈金飞,2024-07-13 07:27,810,103,八号探秘人,八号探秘人,在阅读此文之前，辛苦您点击一下“关注”，既方便您进行讨论和分享，又能给您带来不一样的参与感，感谢您的支持！本文叙述皆有官方信源，为了读者有更好体验放在了文章后缀！编辑：YY出道即巅峰，不少男明星都把她看作“白月光”般的存在。可多年来，除了宋承宪，刘亦菲几乎没有传过其他绯闻。,https://toutiao.com/group/7391016864593314316/,,0,0,False
5座车拉6个人被判超员，车主1句话把交警问懵,2024-08-05 20:20,17108,3998,奇妙钢笔pA8JyP,奇妙钢笔pA8JyP,,https://toutiao.com/group/7399752843772559906/,,0,0,True
她是央视最惨主持人，男友被判死缓，丈夫诈骗入狱，47岁无人敢娶,2024-08-27 23:30,2182,207,闻书识焉,闻书识焉,她曾是央视的台柱子，和董卿、周涛并称为央视的三朵金花。回顾刘芳菲的前半生，最令人感到惋惜的，便是她的感情生活，47岁至今无人敢娶。,https://toutiao.com/group/7407743113688564258/,,0,0,False
万万没想到，35岁杨颖兜兜转转干回“老本行”，活成内娱最大笑话,2024-09-06 07:55,534,135,读万卷书的张飞,读万卷书的张飞,文l张飞编辑l张飞曾经你看不起别人；如今谁又瞧得上你？在节目中丝毫不考虑他人状态，一味地只追求自己的镜头。甚至还在采访中公然表示“自己早就应该把所有奖拿了个遍了”。更关键的是丝毫没有任何“报恩”之心。所以如今曾经所有的“嚣张”“高高在上”遭到反噬，只能说现在谁还“愿意”认识她！,https://toutiao.com/group/7411434661014012456/,,0,0,False
伊朗导弹从90%被拦截率，到90%突破率：美军终于明白有大国已出手,2024-10-04 07:29,921,197,深度工场,深度工场,今年4月，伊朗导弹打击以色列，美国和以色列拦截成功率是90%。但是今年10月，伊朗导弹打击以色列，按照伊朗方面公布数据，伊朗导弹突破率已经达到90%。,https://toutiao.com/group/7421806687595594281/,,0,0,False
2013年，湖南26岁女孩嫁给71岁老头，婚后还生下一子，如今怎样了,2024-07-12 11:59,26527,2407,智史通鉴,智史通鉴,2013年4月17日，长沙宁乡县的民政局迎来了一对特殊的夫妻。一个71岁的老头和一个26岁的女孩，离远了看，甚至像爷爷和孙女。面对工作人员异样的眼光，女孩说：“我和他是真心相爱的！”这让人好奇，这对相差45岁的夫妻，他们之间到底有着怎样的爱情故事？,https://toutiao.com/group/7390696631223534120/,,0,0,False
演员张瑜：离婚后单身30年，再见前夫仍感到心动，66岁没有子女,2024-07-24 10:51,16701,1184,八号探秘人,八号探秘人,在阅读此文之前，辛苦您点击一下“关注”，既方便您进行讨论和分享，又能给您带来不一样的参与感，感谢您的支持！写作不易，作者每天辛苦写稿，只是为了养家糊口，希望各位观众老爷可以多多理解。文中加入5秒广告解锁，观看5秒后便可免费阅读全文啦，感谢各位观众老爷的理解与支持！,https://toutiao.com/group/7395130917804720640/,,0,0,False
男人和女人的需求差别这么大？,2024-07-12 11:00,29502,2111,周小鹏,周小鹏,男人和女人的需求差别这么大？,https://toutiao.com/group/7388885573953389092/,,0,0,True
他和6个老婆共处一室，每人每月7万零花钱，71岁又娶了20岁小娇妻,2024-10-03 03:25,868,134,八号探秘人,八号探秘人,如果不是雷洪的这番操作，或许大家永远都不知道，现实中竟然真的有人和韦小宝一样，坐享三妻四妾之福，拥有七个老婆。,https://toutiao.com/group/7420736326078628392/,,0,0,False
牛市疯了：3天赚了一百万，高兴得太早，回头发现“卖飞了”,2024-10-03 13:00,3579,4639,凤凰网财经,凤凰网财经,编者按:30岁的孙默，在北京有一份稳定的工作，五年前，手里刚有一点积蓄，他就全部投入股市，没想到紧接着迎来了疫情。,https://toutiao.com/group/7421533420930482703/,,0,0,False
男子与女子在河中嬉戏玩耍，突然连续将女子的头按入水中,2024-09-26 04:40,1169,160,经视看天下,经视看天下,,https://toutiao.com/group/7418807108637819444/,,0,0,True
原来他才是毁掉刘翔真凶，因贪1200万被公审，让刘翔背负多年骂名,2024-08-29 09:58,8036,214,八号探秘人,八号探秘人,在田径场上创造的成绩，至今无人能够打破，甚至在国际上享有盛名。本该继续夺冠之路，却两次因伤退赛，遭到了全网辱骂。,https://toutiao.com/group/7408489498465616410/,,0,0,False
中国接到挑战书，32国对华施压，人民币付款陷困境，中俄贸易质变,2024-10-03 07:06,5676,132,大白话瞰世界,大白话瞰世界,北约新秘书长刚上台就迫不及待对华发出挑战书，不允许中国支持俄罗斯。当前，人民币付款交易陷入困境，中俄经贸合作已经发生新的改变。北约对华施压的目的是什么？中俄合作又将发生怎样的变化？,https://toutiao.com/group/7421442204532474406/,,0,0,True
中国国乒又火了！决胜时刻，领军人物疯狂逆转，上演最解气的一幕,2024-09-29 06:49,5440,531,乐播体育,乐播体育,,https://toutiao.com/group/7419953587779797515/,,0,0,True
她曾被前夫一巴掌扇到离婚！二婚嫁世界冠军，如今生活幸福滋润,2024-09-10 09:12,8529,159,豆莱说,豆莱说,“漂亮的让人挪不开眼”是圈内人对她的评价，和“山杏”不一样的是，李琳在现实生活中的感情很是幸运，遇到了导演王小列。,https://toutiao.com/group/7412930201929204236/,,0,0,False
40年前供销社卖过的20个生活用品，见过一半算你厉害，你认识几个,2024-07-23 08:56,8591,893,万物知识局,万物知识局,文/万物知识局本文陈述所有内容皆有可靠信息来源，赘述在文章结尾童年的岁月无论过多久都会因为某件事或某个物品而激发回忆，如今早已长大的我们时常还会想起过往，在看到某个熟悉的老物件时，回忆就如同潮涌般难以抑制，就仿佛再次将我们带回到那个熟悉的午后和熟悉的房间。,https://toutiao.com/group/7394736337166926346/,,0,0,False
以后想吃回锅肉你就像我这样做，肥而不腻，咸香适口，太解馋了,2024-08-06 11:19,26516,952,家常的味道,家常的味道,,https://toutiao.com/group/7399984507362738742/,,0,0,True
时隔27年找初恋，他若单身我愿嫁他，相见两人泪流满面,2024-08-02 04:56,27693,4062,彤儿说事,彤儿说事,,https://toutiao.com/group/7398401586776506906/,,0,0,True
