title,publish_time,like_count,comment_count,media_name,source,abstract,article_url,tag,is_yaowen,article_sub_type,has_video
三条腿的陈赓介绍对象这段，据说笑趴整个导演组，太搞笑了,2025-01-02 06:45,1811,363,南哥硬汉秀,南哥硬汉秀,,https://toutiao.com/group/7455192536127275539/,,0,0,True
厨师长教你：“家常肘子”口感耙糯 软烂入味 肥而不腻,2025-01-02 09:00,1773,243,美食作家王刚,美食作家王刚,厨师长教你：“家常肘子”口感耙糯 软烂入味 肥而不腻,https://toutiao.com/group/7455138904249893416/,,0,0,True
清华简彻底解密三星堆！三星堆居然与上古巫族和墨家息息相关,2025-01-03 10:36,6673,565,seeker大师兄,seeker大师兄,,https://toutiao.com/group/7455636143020474906/,,0,0,True
广西49岁老汉娶19岁姑娘，结婚21年生下15个孩子，如今有何下场？,2024-10-20 08:32,10416,1275,艺述史,艺述史,她19岁出嫁，21年里总共生育了15个孩子，其中4个男孩子11个女孩子，家里热闹的像是开了一所学校一样。,https://toutiao.com/group/7427400319418384948/,,0,0,False
小女孩上部队找爸爸，少校阿姨主动搭讪，谁知看到女孩父亲傻眼了,2024-12-23 16:01,3280,769,乐视群星访谈秀,乐视群星访谈秀,,https://toutiao.com/group/7451525814283960872/,,0,0,True
夜里翻来覆去睡不着，原来几根芹菜根就搞定，做法简单，省钱实用,2024-12-25 11:02,9986,1187,百变小厨坊,百变小厨坊,夜里翻来覆去睡不着，原来几根芹菜根就搞定，做法简单，省钱实用,https://toutiao.com/group/7452303315842368052/,,0,0,True
歼36首飞一周后，美军司令打破沉默：这是9·11以来最紧张时刻,2025-01-02 05:43,31577,107,阿尔法军事,阿尔法军事,歼36首飞一周后，美国印太司令部司令塞缪尔·帕帕罗作为“对华一线”最高指挥官发表了声明，他首先用两句话给整个声明定了调：一是中美要和平共处不要新冷战；二是美国无意与华进行军备竞赛。,https://toutiao.com/group/7455189778258985506/,,0,0,True
韩国派出特警队逮捕尹锡悦，驻韩美军下令护尹，安全部队强力阻挡,2025-01-04 07:57,25501,1606,邱毅台湾,邱毅台湾,,https://toutiao.com/group/7455966319511339570/,,0,0,True
不得不说，韩国再次创造了历史,2025-01-04 02:18,3979,466,牛弹琴,牛弹琴,未来三天，韩国不排除更有大戏上演,https://toutiao.com/group/7455879046824460854/,,0,0,True
“六星街里还传来巴扬琴声吗……”狼戈、张英席合唱《苹果香》,2024-12-31 14:55,3266,154,央视频,央视频,,https://toutiao.com/group/7454589818538820115/,,0,0,True
今年会举行阅兵仪式吗？我大胆作个猜测,2025-01-03 09:11,13226,1522,金灿荣教授,金灿荣教授,,https://toutiao.com/group/7455614288229728803/,,0,0,True
新婚33天卷走274万4套房，出逃后丈夫跨国追捕，如今下场大快人心,2024-12-20 22:06,5166,268,八号探秘人,八号探秘人,在阅读此文之前，辛苦您点击一下“关注”，既方便您进行讨论和分享，又能给您带来不一样的参与感，感谢您的支持！编辑丨QQ·B“色字头上一把刀！”深圳富豪结婚33天竟被卷走274万元和名下4套房产。不仅如此，他还被扣上了“接盘侠”的帽子，啥也没干喜当爹。,https://toutiao.com/group/7450399558821052982/,,0,0,False
98岁老郎中教我苹果养生新吃法，每天坚持这样吃，睡眠好，身体棒,2024-12-31 11:43,10919,1067,百变小厨坊,百变小厨坊,98岁老郎中教我苹果养生新吃法，每天坚持这样吃，睡眠好，身体棒,https://toutiao.com/group/7454540163725656628/,,0,0,True
老纪和珅这段对话，以前小时候听不懂，如今听完受益终身,2024-12-28 23:16,5859,1711,乐视扒剧小妹儿,乐视扒剧小妹儿,,https://toutiao.com/group/7453420191947424293/,,0,0,True
印度没戏了！英国金融时报承认了,2025-01-04 09:30,5695,262,诚阅ChengYue,诚阅ChengYue,,https://toutiao.com/group/7455990226163335695/,,0,0,True
团长壮的像头牛，新婚夜却耕了一晚上的地，下属秒懂！,2024-11-25 03:42,1016,397,乐视最爱综艺说,乐视最爱综艺说,,https://toutiao.com/group/7441057170428264970/,,0,0,True
抗美援朝的将军亮相，全体明星自发起立，这幕太感人,2025-01-03 07:32,10237,1233,乐视天天剧好看,乐视天天剧好看,,https://toutiao.com/group/7455587633452843572/,,0,0,True
历史最大泡沫快破裂！贵金属专家：黄金是投资者唯一避难所 TA是崩盘关键催化剂,2025-01-02 03:29,1369,414,金融界,金融界,贵金属专家、Goldmoney研究主管阿拉斯代尔·麦克劳德警告市场，全球金融体系正处于崩溃的边缘，历史上最大的经济泡沫快破裂，投资者的唯一避难所将是黄金。,http://m.jrj.com.cn/toutiao/2025/1/2/47026230.shtml,,0,0,False
“蛇钞”溢价200%背后：三大原因刺激二手行情走高,2025-01-04 08:51,172,327,上游新闻,上游新闻,1月3日，蛇年纪念币、蛇年纪念钞（市场俗称“蛇币”“蛇钞”）迎来首个兑换日，相关话题迅速冲上热搜第一的位置。有报道称，有地区“蛇钞”目前二手价格溢价已达200%。我国有发行生肖纪念币的传统，12生肖纪念币已经发行了近两轮，为什么今年发行的“蛇币”“蛇钞”火出了圈？它们为什么火？,https://wap.cqcb.com/shangyou_news/NewsDetail?classId=7788&newsId=5734080,,0,0,False
厨师长教你：“葱爆羊肉”羊肉滑嫩、鲜香不膻,2024-12-27 07:34,3571,657,美食作家王刚,美食作家王刚,厨师长教你：“葱爆羊肉”羊肉滑嫩、鲜香不膻,https://toutiao.com/group/7452991735665263139/,,0,0,True
甲流高峰来袭，比去年还要厉害，牢记“3要做2多吃”，提高免疫力,2024-12-30 12:00,1223,145,39健康网,39健康网,“这两天一直头晕，感觉又是流感。”“好像又出现了新毒株！”“我身边有好多人中招，这次感觉比之前要猛许多。”随着天气越来越冷，流感逐渐进入了高发期。,https://toutiao.com/group/7454140779846533669/,,0,0,False
罕见！一个月内官方三次明确上调养老金，2025养老金调整有惊喜？,2025-01-04 02:56,4882,2677,思之想之,思之想之,在一个月内，官方至少三次明确上调2025年养老金，这个频率是前所未有的，这传递了什么信号呢?思之想之发现，从2024年12月12日开始至今，在一个月内的时间里，官方至少三次明确提出上调2025年养老金。,https://toutiao.com/group/7455850117002691135/,,0,0,False
250倍守号侠继续坚守，144倍票创亿元连出奇迹？双色球002期晒票,2025-01-04 03:08,657,203,彩市分析,彩市分析,大家好，福彩双色球第25002期开奖已经列入日程。最近彩市最热闹的新闻无非就是双色球的5.3亿巨奖，在领奖后依然有不少人在热烈讨论。晒票侠看在眼里记在心上，也想获得这份殊荣，如果在亿元奖的带动下倍投票增多，不知道这能否实现亿元连开的记录呢？,https://toutiao.com/group/7455888546923070002/,,0,0,False
石破茂亲中吗？,2025-01-03 13:55,9026,462,静思有我,静思有我,,https://toutiao.com/group/7455642885552079395/,,0,0,True
清华才女李一诺：27岁博士毕业，4年生3娃，能替世界首富花钱,2024-12-18 05:51,8484,378,云莳一,云莳一,家庭是她第一个学校，妈妈是她第一任老师。李一诺27岁博士毕业进入美国麦肯锡公司，33岁成为公司全球董事合伙人，之后四年连生3娃。,https://toutiao.com/group/7449591069311779355/,,0,0,False
他的资历比朱德还老，授勋时却错失元帅，毛主席特批享受元帅待遇,2024-12-12 10:24,3242,133,品古观今,品古观今,在我军革命史上，有一位将军的资历比朱德还老，连毛主席都说:“共产党能对国民党将领说话的人不多，他就是其一。”可这样的人却在大授衔时，错失了元帅，后来经过毛主席的一番关心，才得以享受与元帅的同等待遇。,https://toutiao.com/group/7447468654758871592/,,0,0,False
萝卜和鸡蛋这样做，比吃补药还补，顿顿吃都不会腻，又香又下饭,2024-10-30 12:28,72777,4416,小寒厨艺,小寒厨艺,萝卜和鸡蛋这样做，比吃补药还补，顿顿吃都不会腻，又香又下饭,https://toutiao.com/group/7431405463378919975/,,0,0,True
小子相亲故意扮老，谁知道对方一见面就叫他大爷，这段太逗了,2024-12-24 08:17,3637,839,乐视热播综艺精选,乐视热播综艺精选,,https://toutiao.com/group/7451886130837848610/,,0,0,True
原来火腿肠铝环下藏着个“小机关”，轻轻一拉，完整剥开，太棒了,2024-12-30 12:48,4444,2781,百变小厨坊,百变小厨坊,原来火腿肠铝环下藏着个“小机关”，轻轻一拉，完整剥开，太棒了,https://toutiao.com/group/7454186052081680911/,,0,0,True
煮米饭别总是加水了，难怪不好吃，教你酒店不外传的秘诀，非常香,2024-12-06 08:45,4378,913,明玥美食,明玥美食,,https://toutiao.com/group/7445217195929371190/,,0,0,True
34岁雌雄同体的女性，具备男女两性器官，她该如何生存下去？,2024-10-17 03:32,4497,214,大象微视,大象微视,这个词在我们生活中并不常见，简而言之，双性人就是既拥有男性的生殖器官，也具备女性的特征的人。1989年，王梓淇出生在山西太原的一个家庭，她的家里经营着一家小生意，虽然谈不上富裕，但足够让一家人过得舒心自在。,https://toutiao.com/group/7426578550418948618/,,0,0,False
拜登下台前搅动南海风云，美菲连手挑衅中国，中国不再忍强硬回击,2025-01-03 03:44,19877,893,邱毅台湾,邱毅台湾,,https://toutiao.com/group/7455530031461171753/,,0,0,True
弹性退休细则公布！65后、70后、75后退休节点有变化，如何选择？,2025-01-02 00:07,1554,328,社保当家,社保当家,人社部等部门在1月1日正式发布了《实施弹性退休制度暂行办法》，明确了如何办理弹性退休手续，对养老金领取有何影响等事项，及时了解下。,https://toutiao.com/group/7454882770310119987/,,0,0,False
牛肉价格为啥持续下降？,2024-12-29 16:26,7581,279,强老师儿,强老师儿,,https://toutiao.com/group/7453871032575721999/,,0,0,True
充电时，先插手机还是充电器？方法错误手机坏得快,2025-01-02 01:19,1779,139,人民日报,人民日报,手机电量还剩多少，对现代社会的许多人而言，都是一个“性命攸关”的问题。人们对手机充电的强烈需求，也让市面上催生出了许多噱头：无线充电，二倍速充电，以及能连着用一周的高能充电宝。乱花渐欲迷人眼，但到底什么才是手机充电的正确姿势呢？手机一定要满充满放吗？,https://www.peopleapp.com/column/30047895447-500006027199?utm_source=头条号&promote=true,,0,1,False
大陆就统一时间表表态，20万台胞已办身份证？台当局称严查,2025-01-03 11:03,3103,355,第一军情,第一军情,台湾问题是中国核心利益中的核心，已困扰了我们整整75年，成为每一个中国人心中的痛。日前，大陆著名学者在一篇文章表示，未来四年时间，大陆不会制定统一台湾的时间表。,https://toutiao.com/group/7455640102287557156/,,0,0,False
“喝酒三巨头”：一年全没，有的去世当天喝4瓶白酒，都不满36岁,2024-11-05 10:32,3202,1713,睿之悦,睿之悦,他们的每一次出现都离不开酒，也曾是很多人眼中的“酒中豪杰”。但“小酌怡情，大饮伤身”，这三位博主以生命为代价，再一次给大家带来了警醒。,https://toutiao.com/group/7433739040179520038/,,0,0,False
综艺：真是神童一个，算术自学成才，6岁就能对战北大高材生,2024-11-16 20:44,20583,2559,乐视综艺咖,乐视综艺咖,,https://toutiao.com/group/7437795240771060258/,,0,0,True
乞丐上台唱歌引起评委质疑，一首歌唱完让观众起立鼓掌,2024-11-01 02:16,4894,787,乐视综艺咖,乐视综艺咖,,https://toutiao.com/group/7432129044134494771/,,0,0,True
我家米醋从来不外面买，教你在家做，无添加剂，好吃又卫生,2024-10-31 11:36,6134,811,百变小厨坊,百变小厨坊,,https://toutiao.com/group/7431902258318541324/,,0,0,True
沈春阳笑死个人，满口胡说八道，小沈阳气得说不出话,2024-12-28 16:52,4628,734,乐视影视圈,乐视影视圈,,https://toutiao.com/group/7453290317240861199/,,0,0,True
司马南：韦东奕是人不是神，世上的确有神人,2025-01-02 15:08,4697,288,司马说集,司马说集,,https://toutiao.com/group/7455335157022360075/,,0,0,True
2025大年初一，这5个生肖可不要穿红色！请一定认真查看,2025-01-04 07:39,564,118,恋上白色碎花裙,恋上白色碎花裙,,https://toutiao.com/group/7455961774219592219/,,0,0,True
有多少人没有注意到这一幕，孙颖莎上齐腰的冠军台，这方法绝了,2025-01-04 00:43,2750,407,颜小羽,颜小羽,,https://toutiao.com/group/7455854580778140172/,,0,0,True
央视官宣！国际乒联介入！正式审查WTT规章，樊振东事件还在发酵,2025-01-04 03:40,972,264,后妃秘史,后妃秘史,国际乒联继否认知道樊振东退出排名后，官宣正式介入!最近乒坛可不太平，一场由国乒大将樊振东掀起的波澜，那是越演越烈，直接冲上了国际舞台的聚光灯下。,https://toutiao.com/group/7455891795914850854/,,0,0,False
记者采访全红婵，套不出话，因为她不按牌理出牌，笑死我了,2025-01-02 00:39,4776,966,开朗旭日,开朗旭日,,https://toutiao.com/group/7454957414484279834/,,0,0,True
WTT四大金主曝光，全来自中国，网友：拿我们赞助还敢欺樊振东？,2024-12-30 10:39,4331,2033,体坛1号站,体坛1号站,12月30日，“WTT长期赞助商只有4个”冲上热搜，而这4家赞助商全部都来自中国，长期以来，球迷一直好奇WTT的背后金主，是谁愿意为市场化不高的乒乓球买单，如今答案终于揭晓了。,https://toutiao.com/group/7454134666891641394/,,0,0,False
