title,publish_time,like_count,comment_count,media_name,source,abstract,article_url,tag,is_yaowen,article_sub_type,has_video
俄乌升级、黎以停战，美国想干啥？拜登为儿子不会对特朗普下狠手,2024-11-28 22:01,8028,177,黎建南台湾,黎建南台湾,,https://toutiao.com/group/7442453599042404879/,,0,0,True
1米3袖珍美女嫁给1米48男孩，婚后丈夫奇迹长高，两人却不欢而散,2024-09-07 02:55,7007,383,睿之悦,睿之悦,杨萍和葛存苗的婚礼 文|睿之悦 编辑|睿之悦2019年，成都的民政局来了两个“10岁小孩”来登记，工作人员以为是玩闹。两个“小孩”拿出身份证让工作人员看，这才明白，原来是两个再也长不高的成年袖珍人情侣。,https://toutiao.com/group/7411713833267364386/,,0,0,False
拦车收费？交警不管！景区不管！政府看不见！九寨沟咋全是土匪？,2024-09-22 15:55,229845,44343,行哥嘚啵嘚,行哥嘚啵嘚,,https://toutiao.com/group/7417496641638400527/,,0,0,True
罕见！100年前，英国游客拍下的清朝乡村，和想象中完全不一样,2024-09-20 02:07,8168,727,万物知识局,万物知识局,泥泞的土路，衣不蔽体的老百姓，即便是达官显贵的家中也十分破败，而这些都是清王朝的历史痕迹，虽说那时候中国摄影技术并不发达，但也有许多外国游客来到这里，拍摄下了许多老照片，为我们留下了珍贵的历史资料，那清朝到底是怎样的面貌呢?,https://toutiao.com/group/7416287738871267855/,,0,0,False
母亲瘫痪、父亲疯了，当年那个744分的高考状元，7年后却成了这样,2024-09-08 00:54,13438,1924,八号探秘人,八号探秘人,母亲截肢瘫痪、父亲疯癫痴傻，可对于自己的亲人，他却做出了这样的评价。而今，7年已过，曾经那个让无数人动容的少年，现在如何?,https://toutiao.com/group/7411852147648496162/,,0,0,False
“中企遭大规模拒签，前所未有”,2024-12-02 09:13,4801,1694,环球时报新媒体,环球时报新媒体,“中企遭大规模拒签，前所未有”,https://toutiao.com/group/7443740275974865423/,,0,0,True
美联储收割印度，1.3万亿资金撤离，印度或将倒退24年被打回原形,2024-12-02 05:38,1698,139,BWC中文网,BWC中文网,,https://toutiao.com/group/7443684657033380387/,,0,0,True
弟弟光荣退伍，姐姐兴奋去车站接他，怎料一见弟弟瞬间哭了,2024-11-05 06:34,29060,2859,乐视天天剧好看,乐视天天剧好看,,https://toutiao.com/group/7433679820573934091/,,0,0,True
俄乌冲突结束方案三方不同意，10万部队入乌维和，瓜分还是占领？,2024-12-01 12:09,12908,1123,杜文龙,杜文龙,,https://toutiao.com/group/7443414453669855783/,,0,0,True
羽绒服“暴雷”，普通人买羽绒服，看不懂水洗标上这3个词，容易吃大亏！,2024-11-30 09:21,623,325,环球网,环球网,来源：科普中国 近日，有关羽绒服的话题频繁上热搜。有服装行业人士说，90%的鸭绒从去年的35万涨到今年的59万一吨；90%的鹅绒从去年的70万涨到今年的125万一吨。成本的暴涨，导致某些厂家用50%的鸭绒冒充90%的鹅绒，甚至拿废丝掺在鹅绒里。我们普通消费者，要怎么选购羽绒服呢？,https://3w.huanqiu.com/a/3084ce/4KT1XWDBsfa?agt=20,,0,0,False
女友怀孕了，男友不装了，带她回豪宅！,2024-11-23 08:01,8061,680,乐视大综艺咖,乐视大综艺咖,,https://toutiao.com/group/7440353629540483593/,,0,0,True
警惕“先用后付”小心欠下账单～（央视频号：光华路资讯）,2024-11-27 12:44,17003,4928,央视频,央视频,,https://toutiao.com/group/7441939150552433179/,,0,0,True
包厢全是刚出狱的恶霸，结果一看到饭店主厨，立马怂了,2024-11-11 01:21,10310,249,乐视群星访谈秀,乐视群星访谈秀,,https://toutiao.com/group/7435825833048015400/,,0,0,True
广西49岁老汉娶19岁姑娘，结婚21年生下15个孩子，如今有何下场？,2024-10-20 08:32,5306,661,艺述史,艺述史,她19岁出嫁，21年里总共生育了15个孩子，其中4个男孩子11个女孩子，家里热闹的像是开了一所学校一样。,https://toutiao.com/group/7427400319418384948/,,0,0,False
郭有才：当迷失方向忘记初心后，曾经飘得多高，如今摔得就多惨,2024-11-11 06:53,1395,673,八号探秘人,八号探秘人,在阅读此文之前，辛苦您点击一下“关注”，既方便您进行讨论和分享，又能给您带来不一样的参与感，感谢您的支持！编辑丨brt因为一首翻唱，他一夜之间成为了拥有千万粉丝的网红。但是“人红是非多”，不久他就因为版权等问题陷入了舆论风波。他的人气一落千丈，从万众瞩目变成了现在的无人问津。,https://toutiao.com/group/7435901170239078948/,,0,0,False
湖北29名建筑工赴港，3万月薪，亲历者：电话被“打爆”，同事素质高、专业性强,2024-12-02 06:33,1846,889,九派新闻,九派新闻,“拿到工资就放下了担忧！香港对打工人的福利待遇和人文关怀，让人印象深刻。”近日，29名湖北宜昌的建筑工人在香港月薪3万多港币一事引发关注。九派新闻了解到，他们所在的广盛集团和香港方面在2018年就开始接触，彼时共同在宜昌投资装配式建筑生产基地。,http://feed.huiwen.co/rssv2/toutiaohao_article_ttjpnews_9fc19a1f956448fb9826b9fcb4695509/item/IL213N3PGXCVGAD.html,,0,0,False
张纪中有5个孩子，最大的女儿47岁比继母还大4岁！最小的刚出生,2024-11-12 03:20,392,197,昕昕局,昕昕局,本文陈述所有内容皆有可靠信息来源，赘述在文章结尾。如今73岁的张纪中有5个孩子，最大的女儿47岁，最小的孩子前一段时间刚出生!—≺ 从演员到制片人 ≻—,https://toutiao.com/group/7436224491883168297/,,0,0,False
河南警察3岁女儿被拐，苦寻全国23年无果，结果却发现女儿在对门,2024-11-05 07:43,2365,225,八号探秘人,八号探秘人,寻亲23年无果，丢失的女儿竟住在对门?但它却真实发生在河南洛阳的梁绍波身上。是意外走丢，还是人贩子所为，三岁的女儿怎会离奇失踪?,https://toutiao.com/group/7433697108120142345/,,0,0,False
突然关闭？退货率暴涨，有商家怒了：“比快递费还贵”！有人薅“运费险”8个月骗取100多万元，律师：5万元以上构成犯罪,2024-12-02 17:03,371,413,每日经济新闻,每日经济新闻,公开资料显示，这一险种已出现了10余年，彼时，为解决电子商务发展中退货邮费的消费痛点，电商平台与保险公司共同推出了这一产品。,http://www.nbd.com.cn/rss/jinri_toutiao/articles/3669501.html,,0,0,False
3年前，宁夏7岁小女孩一笑走红，后拒百万签约，如今怎么样了？他们后悔了吗？,2024-09-19 07:25,14521,1953,睿之悦,睿之悦,2021年，视频镜头中出现的女孩儿用那一抹甜美的笑容，迅速引起了网友们的广泛关注。有媒体公司看到这一机遇，提出愿意用百万巨资与女孩儿签约，然而，女孩儿的父母却坚决拒绝了这一提议。,https://toutiao.com/group/7416250139544879679/,,0,0,False
组委会回应6岁女孩跑完42公里全马：其父不顾裁判多次阻拦让女儿违规蹭跑，已处罚,2024-12-02 09:35,767,1329,九派新闻,九派新闻,近日，在江西上饶婺源县举办的一场马拉松赛事中，一位父亲因体力不支放弃比赛，6岁女孩独自跑完42公里全马，引发关注。有网友质疑该女孩违规参赛，“6岁的小孩怎么能报名全马？,http://feed.huiwen.co/rssv2/toutiaohao_article_ttjpnews_9fc19a1f956448fb9826b9fcb4695509/item/IL213SPK9S5UOVC.html,,0,0,False
二哈学人睡觉盖被子，当主人强行掀开被子后，大家千万憋住别笑,2024-11-26 12:57,3917,1226,马桶的逗比狗生,马桶的逗比狗生,,https://toutiao.com/group/7441571286935699977/,,0,0,True
黑龙江勃利县东北虎进村（邻居完整剪辑版）,2024-11-21 15:19,866,267,小玛宝宝,小玛宝宝,,https://toutiao.com/group/7439752539572011574/,,0,0,True
石川佳纯近况：不悔暗恋马龙10年，哪怕母亲催婚，31岁的她仍单身,2024-12-02 08:57,754,112,写球的莎莎,写球的莎莎,,https://toutiao.com/group/7443736083839320611/,,0,0,True
10分钟就做好的营养早餐饼，做法简单，适合上班赶时间的朋友,2024-11-08 07:51,3278,205,家常的味道,家常的味道,,https://toutiao.com/group/7434812999635829275/,,0,0,True
今天才知道！电动车“充满不拔”和“没充满拔”，到底哪个更伤车,2024-09-18 07:05,4363,434,鲸探所,鲸探所,电动车对于人们出行来说，是一个非常重要，而且必不可少的交通工具。有的人家中可能不只有一辆电动车，可能家里每个人出行都要备上一辆。,https://toutiao.com/group/7415873367415063080/,,0,0,False
海南富商张晖：花8亿建108米海上观音像，4年后死在水中死因成谜,2024-10-19 04:49,2070,275,八号探秘人,八号探秘人,在阅读此文之前，辛苦您点击一下“关注”，既方便您进行讨论和分享，又能给您带来不一样的参与感，感谢您的支持！编辑丨xk他是中国的一名富商，耗费8亿元完成了自己的梦想。可梦想落地成为现实的时候，他却在4年后莫名其妙的死去。他就是张晖，上个世纪末海南岛旅游业的龙头当家人。,https://toutiao.com/group/7427288913095492134/,,0,0,False
好物分享｜炖牛肉时切记三放两不放，这样炖出来的牛肉才会汤鲜味美,2024-10-15 08:50,5576,226,家味美食,家味美食,,https://toutiao.com/group/7425922043991360037/,,0,0,True
炸肉丸子，到底用淀粉还是面粉，教你一招，外酥里软超好吃,2024-10-01 09:23,5703,407,家常的味道,家常的味道,,https://toutiao.com/group/7420735473208787492/,,0,0,True
马龙访台，台湾人热烈欢迎，台独焦虑不安视为大敌使出妖魔化老招,2024-11-29 09:56,24296,1011,邱毅台湾,邱毅台湾,,https://toutiao.com/group/7442637867307762230/,,0,0,True
67岁执意生娃，如今却坐轮椅无法自理，5岁的天赐被迫独立学洗衣,2024-11-04 10:32,7662,1793,睿之悦,睿之悦,2019年，已经67岁的田新菊执意生下了自己的第三个孩子小天赐。那么，现如今5年的时间过去了，这“天赐”的礼物到底是福还是祸呢?,https://toutiao.com/group/7433367394946384435/,,0,0,False
近5年最热的十部剧，《狂飙》第9，《繁华》第6，第1名很难超越,2024-12-01 03:58,256,109,电影烂番茄,电影烂番茄,今天，番叔就结合口碑，给大家盘点一下近五年，热度最高的十部电视剧。第十名:《都挺好》 猫眼热度 9775.8，播出时间2019年。,https://toutiao.com/group/7430845717314273831/,,0,0,False
这绝对是我吃过最好吃的蒜蓉蒸鸡做法,2024-11-11 12:49,2906,232,天天相见厨房(阿见),天天相见厨房(阿见),,https://toutiao.com/group/7436003114588570123/,,0,0,True
中国大姐给东北虎打针火爆外网：这哪是老虎，这是爱撒娇的大猫！#老外看中国 #人与动物和谐共处 #东北虎,2024-12-01 05:27,3464,515,宠物大本营,宠物大本营,,http://toutiao.com/item/7443310890458055168/,,0,0,True
炸萝卜丸子到底用面粉还是淀粉，教你正确做法，外焦里嫩，太香了,2024-10-26 09:25,13325,870,家常的味道,家常的味道,,https://toutiao.com/group/7430012978277122611/,,0,0,True
美妇约见老情人，见面场景真是太逗了，这俩人绝配！,2024-10-27 16:25,4481,566,乐视明星的那点事,乐视明星的那点事,美妇约见老情人，见面场景真是太逗了，这俩人绝配！,https://toutiao.com/group/7428157095108674088/,,0,0,True
