title,publish_time,like_count,comment_count,media_name,source,abstract,article_url,tag,is_yaowen,article_sub_type,has_video
19岁男子看守所身亡，家属申请国赔500余万元，成都市公安局书面答复：不予赔偿,2025-04-09 08:56,2375,4746,闽南网,闽南网,四川19岁男子易某进看守所后死亡，家属提出国家赔偿申请500万余元。鉴定意见通知书显示，成都市看守所医疗机构的过错与易某的死亡存在因果关系，负次要责任。,https://toutiao.com/group/7491234096899768842/,,0,0,False
愿石家庄平安 愿所有善良、真诚的人，平安！#石家庄大风,2025-04-11 17:28,3774,600,杨晖团队,杨晖团队,,https://toutiao.com/group/7492108784400073253/,,0,0,True
这就是胡蝶戴笠的真实的样貌，并非演员扮演，货真价实的罕见照片,2025-04-02 08:47,2787,386,火星X计划,火星X计划,本文所有内容皆有官方可靠信息来源，具体资料赘述在文章内部或结尾。翻开民国老照片历史中，作为蓝衣社的“老板”和军统头子戴笠，他以冷峻威严和杀伐果决的形象，一直被认为是最神秘的人物。,https://toutiao.com/group/7488634235818000896/,,0,0,False
SU7和迈巴赫青岛相撞事故完整视频，谁的责任一目了然,2025-04-12 13:09,4191,3997,风轻尘落,风轻尘落,,https://toutiao.com/group/7492412952776016418/,,0,0,True
男子开车1千多公里来找恩人，报恩途中，发现恩人的女儿好漂亮…,2025-04-07 07:46,2618,1158,听雯音乐,听雯音乐,,https://toutiao.com/group/7490474504272052799/,,0,0,True
