title,publish_time,like_count,comment_count,media_name,source,abstract,article_url,tag,is_yaowen,article_sub_type,has_video
表面是艺人，实际是富家千金的5位女星，无人敢惹更别说潜规则了,2024-08-28 02:06,7909,631,八号探秘人,八号探秘人,在德云班主郭德纲的作品中，有过这么一句话。虽说此言尤为刺耳，但话糙理不糙。当今娱乐圈，很多女星为出人头地，自愿或被迫做出违反道德底线之事。,https://toutiao.com/group/7407984985224872459/,,0,0,False
黑龙江美女囚犯毕丽梅，被枪决后在殡仪馆苏醒，家属：放了她吧?,2024-08-25 14:32,1782,256,冯律讲法,冯律讲法,女死刑犯被枪决后在殡仪馆起死回生，当场把火化的工作人员吓得够呛，就连随行的警察都吓了一跳，壮着胆上前检查一番后，立马把离奇的情况上报。不一会儿法医赶到现场，证实了女犯人的确还活着，亲属闻声下跪，以死过一回为理由，恳求放了她。,https://toutiao.com/group/7407082388163002921/,,0,0,False
上山采蜜误闯蛇窝，20几条毒性不一，姑娘当场吓尿，头发竖起来了,2024-07-24 02:13,1815,231,兴凯湖莹莹,兴凯湖莹莹,,https://toutiao.com/group/7395019818291692032/,,0,0,True
山西一女大学生白嫖被拒恼羞成怒：当初有多嚣张，如今就有多慌张,2024-09-28 05:45,1644,831,鲸探所,鲸探所,很难想象，因为一包12.99元的红枣，一位大学生竟然能对客服辱骂一个小时。这样的事情，听起来似乎确实让人感觉有点难以置信，可它就这么水灵灵的发生了，而且还被曝光出来了。,https://toutiao.com/group/7419561787948941876/,,0,0,False
全球约一半肝癌在中国，再次提醒：家中的4种食物，尽早撤下餐桌,2024-08-13 08:36,93895,3524,梁医学社梁怡璋医生,梁医学社梁怡璋医生,,https://toutiao.com/group/7402540119712629311/,,0,0,True
有人冒充我男朋友，算不算诈骗？遇到奇葩事你会怎么办？,2024-09-06 05:52,1623,212,兴凯湖莹莹,兴凯湖莹莹,,https://toutiao.com/group/7411404025502892554/,,0,0,True
3年前河北老人砸楼梯，让邻居爬云梯交50万过路费，最终结局如何,2024-08-08 11:09,1397,775,鲸探所,鲸探所,“想上楼，先交50万！”听说过过路费、过桥费，但是上楼费，真的还是第一次听说。2021年，家住河北石家庄某小区的住户，就遇到了这么一件十分“奇葩”的事情。上楼要交“过楼费”下班回家，天经地义。对于打工人来说，下班之后回家，就是一件再普通不过的事情了。,https://toutiao.com/group/7400717881501860379/,,0,0,False
洲际导弹试验内幕：美军妄想打捞导弹残骸，中美航母在莱特湾角力,2024-09-28 15:29,1746,238,南友汇,南友汇,日前军事专家秦蓁撰文公布了此次解放军洲际弹道导弹试射的内幕，首先就是解放军为了确保本次试验的圆满成功，防止美日及其他国家窥测导弹测试的机密信息，提前将辽宁号航母战斗群部署到了弹着点海域附近，同行的还有1艘“远望6号”航天观测船。,https://toutiao.com/group/7419716270628667919/,,0,0,False
5座车拉6个人被判超员，车主1句话把交警问懵,2024-08-05 20:20,15247,3661,奇妙钢笔pA8JyP,奇妙钢笔pA8JyP,,https://toutiao.com/group/7399752843772559906/,,0,0,True
陈若琳把全红婵养得是真好啊,2024-08-07 03:21,2973,184,中工网,中工网,<p style='text-indent: 2em;'>原标题：陈若琳把全红婵养得是真好啊</p><p style='text-indent: 2em;'>昨晚，巴黎奥运会女子10米跳台跳水决赛，全红婵夺得金牌！赛后采访，她说，我不是你们所说的天才，都是练的，一遍一遍地练。教练陈若琳见证了全红婵的努力与刻苦。@陈若琳sunny@全红婵这对被称为“王炸”组合的师徒，在奥运赛场上都有过非常亮眼的表现。为帮全红婵突破发育关，陈若琳下了不少功夫。每天七八个小时的训练，恨不得将全红婵“拴在裤腰带上”严密看管。执教能力虽受过质疑，但她从不回避，而是找出问题，各个击破。她说：“我走过的弯路，不想让全红婵再走一遍。”中国队加油！（央视）</p>,http://db.workercn.cn/media/2024/08/07/64B10057EEF44DC3904C945F112F757A/preview.mp4,,0,0,True
石破茂刚当选，对华立场曝光，称想每年都来中国，并分享访华趣事,2024-09-29 03:41,971,105,菲常视野陈菲,菲常视野陈菲,,https://toutiao.com/group/7419905170596692515/,,0,0,True
原来他才是毁掉刘翔真凶，因贪1200万被公审，让刘翔背负多年骂名,2024-08-29 09:58,6131,147,八号探秘人,八号探秘人,在田径场上创造的成绩，至今无人能够打破，甚至在国际上享有盛名。本该继续夺冠之路，却两次因伤退赛，遭到了全网辱骂。,https://toutiao.com/group/7408489498465616410/,,0,0,False
军号一响，全军出击！,2024-09-19 08:01,15774,1018,中国军号,中国军号,,https://toutiao.com/group/7416261401477382668/,,0,0,True
时隔27年找初恋，他若单身我愿嫁他，相见两人泪流满面,2024-08-02 04:56,26524,3955,彤儿说事,彤儿说事,,https://toutiao.com/group/7398401586776506906/,,0,0,True
老外-这是解放军-第一眼还以为是美军来了-这火力谁能顶得住,2024-09-28 08:14,4261,616,有趣的河流,有趣的河流,,https://toutiao.com/group/7419604305566499378/,,0,0,True
2013年，湖南26岁女孩嫁给71岁老头，婚后还生下一子，如今怎样了,2024-07-12 11:59,25030,2358,智史通鉴,智史通鉴,2013年4月17日，长沙宁乡县的民政局迎来了一对特殊的夫妻。一个71岁的老头和一个26岁的女孩，离远了看，甚至像爷爷和孙女。面对工作人员异样的眼光，女孩说：“我和他是真心相爱的！”这让人好奇，这对相差45岁的夫妻，他们之间到底有着怎样的爱情故事？,https://toutiao.com/group/7390696631223534120/,,0,0,False
