title,publish_time,like_count,comment_count,media_name,source,abstract,article_url,tag,is_yaowen,article_sub_type,has_video
4年骑行结束，1500天终于回到老家，感谢大家一路陪伴有缘江湖见,2024-09-07 03:50,73703,16733,刘伟元的旅行,刘伟元的旅行,4年骑行结束，1500天终于回到老家，感谢大家一路陪伴有缘江湖见！,https://toutiao.com/group/7411715839100977716/,,0,0,True
紧跟美国，新西兰军舰刚闯台海，求锤得锤？外媒：支援舰突发沉没,2024-10-06 01:40,1126,162,烽火前站,烽火前站,新西兰海军的规模非常小，仅有10艘左右的军舰，除了安扎克级导弹护卫舰之外，就是一些后勤舰船，不过新西兰却敢于在台岛问题上公然发起挑衅。,https://toutiao.com/group/7422465354448568851/,,0,0,False
写歌30年穷困潦倒，前妻失望选择离婚，谁料51岁靠一首歌一夜成名,2024-08-12 03:37,24992,4009,八号探秘人,八号探秘人,在阅读此文之前，辛苦您点击一下“关注”，既方便您进行讨论和分享，又能给您带来不一样的参与感，感谢您的支持！编辑：LY无数人都想要一个一夜成名的机会，但机会来了也不是每个人都能把握住的。他用了三十年的时间来准备迎接属于自己的机会。为了这个机会他放弃了一切，甚至包括家庭。,https://toutiao.com/group/7402090890367484428/,,0,0,False
王曼昱因家庭原因退赛，总教练李隼：回家处理变故，只能临时取消参赛，已申请替补陈幸同参赛,2024-10-07 08:54,911,438,九派新闻,九派新闻,另据《乒乓世界》杂志报道，记者从中国乒乓球队获得消息，王曼昱因为家庭原因，临时取消亚锦赛参赛计划。总教练李隼介绍说:“王曼昱因为回家处理变故，只能临时取消亚锦赛参赛。中国乒乓球队同亚乒联进行申请替补陈幸同参赛。”,https://toutiao.com/group/7422953753147490826/,,0,0,False
5年前站在美国军舰上，用中文警告我国海军的华人女兵，现在如何,2024-10-06 09:06,1525,203,陈志华观天下,陈志华观天下,2019年，华裔女兵郑浩儿站在一艘美国军舰上，用一口标准的中文喊话威胁中国海军:“我们只是正常巡视，再往前一步，我们不介意发动战争!”,https://toutiao.com/group/7422585983588024883/,,0,0,False
网红郭有才，泡沫散去之后，曾经飘的有多高，如今摔得就有多惨,2024-09-30 09:36,704,427,八号探秘人,八号探秘人,曾经那个卖烧烤的店小二，可能怎么都想不到，自己会成为一个千万粉丝的网红。郭有才在刚成为网红之后的期望也很有意思，那就是每天能赚到300元就行。可现实却是靠着直播广告分成，他的收入直接比期望值翻了上千倍。有人说他其貌不扬，但是平凡人逆袭的典范，还有的人说他长的像日本人。,https://toutiao.com/group/7419978325617082932/,,0,0,False
她是央视最惨主持人，男友被判死缓，丈夫诈骗入狱，47岁无人敢娶,2024-08-27 23:30,2187,207,闻书识焉,闻书识焉,她曾是央视的台柱子，和董卿、周涛并称为央视的三朵金花。回顾刘芳菲的前半生，最令人感到惋惜的，便是她的感情生活，47岁至今无人敢娶。,https://toutiao.com/group/7407743113688564258/,,0,0,False
明知道山姆贵，为啥还非要买？消费者都昏了头吗？,2024-08-17 00:00,1530,282,兴凯湖莹莹,兴凯湖莹莹,,https://toutiao.com/group/7403748761362498083/,,0,0,True
5座车拉6个人被判超员，车主1句话把交警问懵,2024-08-05 20:20,18206,4189,奇妙钢笔pA8JyP,奇妙钢笔pA8JyP,,https://toutiao.com/group/7399752843772559906/,,0,0,True
2013年，湖南26岁女孩嫁给71岁老头，婚后还生下一子，如今怎样了,2024-07-12 11:59,27486,2462,智史通鉴,智史通鉴,2013年4月17日，长沙宁乡县的民政局迎来了一对特殊的夫妻。一个71岁的老头和一个26岁的女孩，离远了看，甚至像爷爷和孙女。面对工作人员异样的眼光，女孩说：“我和他是真心相爱的！”这让人好奇，这对相差45岁的夫妻，他们之间到底有着怎样的爱情故事？,https://toutiao.com/group/7390696631223534120/,,0,0,False
为国争光却遭郎平弃用！转身效力土耳其的王一梅，如今咋样了？,2024-08-31 13:19,936,142,豆莱说,豆莱说,光阴似箭，日月如梭，当初的少女早已退役，成为了排球场的幕后人，这么多年她都经历了什么，现在又怎么样了呢?,https://toutiao.com/group/7409287778514567718/,,0,0,False
男子与女子在河中嬉戏玩耍，突然连续将女子的头按入水中,2024-09-26 04:40,1292,168,经视看天下,经视看天下,,https://toutiao.com/group/7418807108637819444/,,0,0,True
疯狂的以色列，已经不听美国招呼，美国或赌上国运 #以伊最新局势,2024-10-06 03:09,1866,159,利刃,利刃,,https://toutiao.com/group/7422494474594419211/,,0,0,True
主动归还中国领土背后的大阴谋，此国行为被识破，中国直接拒绝,2024-10-06 10:56,3996,123,海阔天空,海阔天空,,https://toutiao.com/group/7422529068957958668/,,0,0,True
今天才知道！电动车“每天充”和“用完再充”，到底哪个更伤电池,2024-08-27 11:19,8887,1775,鲸探所,鲸探所,“今天到底给车充不充电？”估计大多数人每天回家都会想这个问题，看着自己的电动车电量又多又少的，充不充电也是一件非常难以抉择的事情。那么，电动车到底应该怎样充电呢？是每天都充，还是用完之后再充呢？电动车充电不管是在城市还是农村，电动车其实都是人们出门最常见的交通工具。,https://toutiao.com/group/7407773012533117475/,,0,0,False
覃海洋工作室发声明：针对恶意抹黑运动员形象的不实言论，正在收集相关证据，必要时向公安机关报案,2024-10-07 10:27,1100,1575,九派新闻,九派新闻,10月7日，覃海洋工作室发声明回应网上言论。声明如下：社交平台出现的关于运动员覃海洋先生的相关言论，充斥恶意中伤、诋毁的不实内容，严重损害了覃海洋先生个人名誉。,https://toutiao.com/group/7422977896580481563/,,0,0,False
国乒5朵金花的家庭：王艺迪体二代，陈梦富二代，王曼昱父亲泪目,2024-08-04 02:03,3293,172,不似少溓游,不似少溓游,想要在国内靠乒乓球打出名堂，仅仅有天赋是完全不够的。因为在中国乒坛，万里挑一的天才遍地都是。以至于有不少人都选择放弃，甚至还有田志希这样为了能打乒乓球而选择归化韩国的球手。,https://toutiao.com/group/7398094722457289266/,,0,0,False
奉陪到底，解放军报发出统一强音，台上将发现，大陆在等锁岛时机,2024-10-06 10:00,1648,205,强武堂,强武堂,最近，台海军“司令”唐华的一番话，直接引起了岛内热议，他说解放军已掌控台海，正以“蟒蛇战术”困住台湾，只要等到一个时机，便可随时进行全岛封锁。,https://toutiao.com/group/7422599740354789929/,,0,0,False
他和6个老婆共处一室，每人每月7万零花钱，71岁又娶了20岁小娇妻,2024-10-05 09:31,318,105,书生talk,书生talk,在我国建国之后，对于婚姻制度就是一夫一妻制度，至今也没有改变，在这么多年之内，也有专家建议取消一夫一妻的制度，以此来增加生育率，但是这样的提议也是遭到了众多人的反对，所以也没有执行。,https://toutiao.com/group/7422221676558959104/,,0,0,False
"中美台海""必有一战""？大陆统一台湾胸有成竹，美军必遭歼灭！",2024-10-06 22:00,2855,151,黄阿原,黄阿原,,https://toutiao.com/group/7422618545030169151/,,0,0,True
原来他才是毁掉刘翔真凶，因贪1200万被公审，让刘翔背负多年骂名,2024-08-29 09:58,8853,239,八号探秘人,八号探秘人,在田径场上创造的成绩，至今无人能够打破，甚至在国际上享有盛名。本该继续夺冠之路，却两次因伤退赛，遭到了全网辱骂。,https://toutiao.com/group/7408489498465616410/,,0,0,False
如今回头看恒大，许家印是赢了还是输了？！,2024-07-29 11:03,41142,23162,缤纷海燕YrEkWp,缤纷海燕YrEkWp,,https://toutiao.com/group/7397011739571421708/,,0,0,True
"国家要“动真格”?催三胎不成,专家出“好主意”,你赞成吗?",2024-08-04 00:25,23827,4495,科普熊,科普熊,与之相对的则是年轻人生育率的持续下滑，新生儿数量更是屡创新低，这使得我国对于计划生育政策进行频繁调整，二胎、三胎政策更是先后出台。,https://toutiao.com/group/7398948488773517863/,,0,0,False
演员张瑜：离婚后单身30年，再见前夫仍感到心动，66岁没有子女,2024-07-24 10:51,17514,1238,八号探秘人,八号探秘人,在阅读此文之前，辛苦您点击一下“关注”，既方便您进行讨论和分享，又能给您带来不一样的参与感，感谢您的支持！写作不易，作者每天辛苦写稿，只是为了养家糊口，希望各位观众老爷可以多多理解。文中加入5秒广告解锁，观看5秒后便可免费阅读全文啦，感谢各位观众老爷的理解与支持！,https://toutiao.com/group/7395130917804720640/,,0,0,False
国庆返程高速公路惊现大量图钉，多车轮胎被扎！官方回应,2024-10-07 08:01,138,121,上观新闻,上观新闻,10月6日，有网友在网上发布视频称：多辆汽车轮胎在沪渝高速公路重庆忠州服务区附近扎满图钉，不知是什么原因。10月7日上午，记者从重庆高速交警及忠县政府获悉，扎满轮胎的图钉系货车不小心掉落，非人为因素。目前掉落的图钉已被清理干净，警方正在寻找肇事车辆。,https://export.shobserver.com/toutiao/html/804433.html,,0,1,False
妹子独自去大山里里直播，豺狼虎豹蛇吓死宝宝啦！直播间会有人吗,2024-07-20 23:00,1488,181,兴凯湖莹莹,兴凯湖莹莹,,https://toutiao.com/group/7393717094480609827/,,0,0,True
