title,publish_time,like_count,comment_count,media_name,source,abstract,article_url,tag,is_yaowen,article_sub_type,has_video
乌克兰阵亡士兵墓地实拍。网友:乌克兰已经打完一代人！,2025-02-28 09:30,37819,13521,晓晓杂谈,晓晓杂谈,,https://toutiao.com/group/7476399945663300133/,,0,0,True
惊爆！小伙买鱼付款后说鱼不用杀，商户闻听鱼不卖了，,2025-03-02 04:07,5518,5033,帝国重汽,帝国重汽,,https://toutiao.com/group/7476961373608542759/,,0,0,True
一车人都这么冷漠，如果有人站出来为司机发声可能就不是这个结果,2025-02-12 10:57,5354,1729,厚德载物,厚德载物,,https://toutiao.com/group/7470485070348943891/,,0,0,True
撒贝宁已经笑的不行了，别看小丫头不大，满口金句！,2025-03-04 03:47,2976,259,儒雅小丸子Y,儒雅小丸子Y,,https://toutiao.com/group/7477796004528390693/,,0,0,True
许家印第二！又一个“大佬”跑路，花光几百亿，总部一片狼藉,2025-03-05 12:16,2407,487,天天历史,天天历史,2023年9月10日，沈晖发了条微博，写到“这周出差去了慕尼黑，然后纽约。好事多磨，静待花开。”就在沈晖出国一个月后，威马汽车正式申请了破产，留下的只有一地鸡毛。,https://toutiao.com/group/7478197991749190159/,,0,0,False
中俄为何要站在一起，李显龙一语道破，我们还会遇到美国霸权,2025-03-04 16:52,26576,1145,孙绪闻,孙绪闻,中俄为何要站在一起，李显龙一语道破，我们还会遇到美国霸权,https://toutiao.com/group/7477998067472482828/,,0,0,True
持续 9分 29 秒泽连斯基与特朗普，在白宫激烈争吵全过程。,2025-02-28 23:00,86276,13526,环看全球,环看全球,,https://toutiao.com/group/7476608873550316032/,,0,0,True
辛酸，泽连斯基提前站在那里等待，这一次他不敢不全力以赴,2025-03-01 03:27,25288,5930,平安喜乐,平安喜乐,,https://toutiao.com/group/7476677588736311859/,,0,0,True
乌克兰首都基辅现状，拍摄于2025年3月3日，看看街上还有多少男人,2025-03-03 01:01,16552,7083,王哥说事,王哥说事,,https://toutiao.com/group/7477381859442229801/,,0,0,True
