title,publish_time,like_count,comment_count,media_name,source,abstract,article_url,tag,is_yaowen,article_sub_type,has_video
时政微纪录丨习主席的喀山时间·“大金砖合作”高光时刻,2024-10-24 16:51,1905,1046,央视新闻,央视新闻,应俄罗斯联邦总统普京邀请，国家主席习近平于10月22日至24日赴俄罗斯喀山出席金砖国家领导人第十六次会晤。习近平主席在喀山出席领导人小范围、大范围会议，“金砖+”领导人对话会等活动并发表重要讲话。今年是“大金砖合作”开局之年，此次会晤是金砖扩员后首次举行，国际社会广泛关注。,https://content-static.cctvnews.cctv.com/snow-book/index.html?item_id=2078648018331645194&source=50006&sub_source=50006_001,,0,0,False
和家人户外抓蛤蟆，看今天收获如何？被称为东北第一鲜#,2024-10-23 23:30,721,137,兴凯湖莹莹,兴凯湖莹莹,,https://toutiao.com/group/7429117468938863114/,,0,0,True
中美印世界500强城市，上榜数量断崖：美56，印13，中国令人意外,2024-10-24 09:57,1753,104,泌尿外科李医生,泌尿外科李医生,声明：本文内容均是根据权威资料结合个人观点撰写的原创内容，在今日头条全网首发72小时，感谢各位看官点击支持原创，文末已标注文献来源及截图，请知悉。在全球经济格局中，存在一种非常明显的“老中青”交替现象。,https://toutiao.com/group/7429278092809536035/,,0,0,False
51年洪学智妻子寻女无果，到老乡家歇脚老乡惊呼：你要找得就是我,2024-09-22 01:07,5396,364,品古观今,品古观今,前言1951年，阳曲县委大院突然来了7、8位解放军同志，其中一位女同志，就是洪学智的妻子张文。她此番前来，就是为了寻找多年前因战乱而寄养于民间的爱女。可昔日的小村落早已蜕变成另一番景象，这无异于是大海捞针。,https://toutiao.com/group/7417034363226915354/,,0,0,False
15 年保安徒手接跳楼女孩，女孩母亲：我女儿若有事，你一辈子负责,2024-10-05 09:59,800,187,陈志华观天下,陈志华观天下,2015 年，28 岁的保安曲岩用胳膊接住了跳楼自杀的女孩。2015 年 10 月 12 日，吉林大学第四医院人来人往。,https://toutiao.com/group/7422228565413872139/,,0,0,False
她是央视最惨主持人，男友被判死缓，丈夫诈骗入狱，47岁无人敢娶,2024-08-27 23:30,2264,210,闻书识焉,闻书识焉,她曾是央视的台柱子，和董卿、周涛并称为央视的三朵金花。回顾刘芳菲的前半生，最令人感到惋惜的，便是她的感情生活，47岁至今无人敢娶。,https://toutiao.com/group/7407743113688564258/,,0,0,False
除了戴头盔，12月起，电动车、摩托车、三轮车上路有4个新标准,2024-10-24 07:21,1434,233,新能源战略家,新能源战略家,请您在阅读前，先点击上面的“关注”。感谢您的支持，我们将为您带来更多有价值的内容。随着10月接近尾声， 整个电动车行业也进入今年最后的发展阶段。但事实上，每到年底，全国各地针对电动车市场的整治和检查强度都会迎来直接的提升。,https://toutiao.com/group/7429238621447701004/,,0,0,False
善恶终有报：疫情时对中国一毛不拔，却大方捐美国6亿，如今咋样,2024-09-29 05:50,873,117,睿之悦,睿之悦,可就是这样一位在中国土生土长起来的富豪，在疫情期间面对同胞的困境却一毛不拔，反而大方的捐助了6亿给美国。,https://toutiao.com/group/7419859345154015798/,,0,0,False
罕见！100年前，英国游客拍下的清朝乡村，和想象中完全不一样,2024-09-20 02:07,2951,398,万物知识局,万物知识局,泥泞的土路，衣不蔽体的老百姓，即便是达官显贵的家中也十分破败，而这些都是清王朝的历史痕迹，虽说那时候中国摄影技术并不发达，但也有许多外国游客来到这里，拍摄下了许多老照片，为我们留下了珍贵的历史资料，那清朝到底是怎样的面貌呢?,https://toutiao.com/group/7416287738871267855/,,0,0,False
4天4名国乒队员宣布退出国家队,2024-10-24 12:16,290,134,济南时报-新黄河,济南时报-新黄河,10月24日，中国乒乓球队队员曹巍在个人社媒上发文宣布退出国家队。随后，队友王楚钦在评论区留言鼓励并送上祝福：“未来会更好，加油草莓熊！”此前，国乒女队队员张瑞和国乒男队队员刘丁硕、王晨策纷纷在社交媒体发文，宣布退出国家队。,http://www.hzfanews.com/detail.html?id=F3929458A73F73D328BBB646EE8D0BC73847A3373125F182,,0,0,False
"万万没想到,53岁“丁克”半辈子的康辉，一生遗憾竟然是一通电话",2024-08-21 22:14,28277,5445,峰哥正读,峰哥正读,在阅读此文之前，麻烦您点击一下“关注”，既方便您进行讨论和分享，又能给您带来不一样的参与感，感谢您的支持！文/编辑：蘑菇百善孝为先。但是到底怎么做才算是“孝”，康辉用了半辈子才明白。央视知名主持人康辉，事业顺遂，家庭幸福，在外人看来是一个人生赢家。,https://toutiao.com/group/7405504703687115273/,,0,0,False
青岛中院悬赏最高990万元，征集西王集团董事长王勇等人财产线索,2024-10-23 00:20,2929,1669,澎湃新闻,澎湃新闻,山东省青岛市中级人民法院悬 赏 通 告（2024）鲁02执383号被执行人：西王国际贸易（青岛）有限公司，住所地：山东省青岛市市北区敦化路138号3801室。法定代表人：王伟，董事长兼经理。被执行人：西王集团有限公司，住所地：山东省邹平市西王工业园。法定代表人：王勇，董事长。,https://m.thepaper.cn/newsDetail_forward_29117849?from=toutiao,,0,0,False
小伙送美女回家，怎料俩人感情突然升温，下秒不得了,2024-10-18 16:30,2000,136,乐视独爱真人秀,乐视独爱真人秀,,https://toutiao.com/group/7426997752761942567/,,0,0,True
中印军队已开始从中印边境喜马拉雅附近撤退？外交部回应,2024-10-25 07:42,5210,5765,环球网,环球网,【环球时报-环球网报道 记者乌元春】外交部发言人林剑主持10月25日例行记者会。会上有外媒记者提问称：印度官员透露，中印军队已开始从中印边境喜马拉雅附近撤退。你能否证实，以及提供一些细节？,https://toutiao.com/group/7429615496368046642/,,0,0,False
冲刺太夸张了！潘展乐夺男子400自金牌，最后50米第4追至第1,2024-10-24 13:13,734,199,四川观察,四川观察,10月24日，游泳世界杯韩国站男子400米自由泳决赛，中国选手潘展乐在最后50米从第4追至第1，最终以3分36秒43获得金牌，并将个人最好成绩提高了6秒之多。,https://kscgc.scgchc.com/sctv/h5/v7/newsShare.html?id=1849405847768653825,,0,0,False
1976年周、朱、毛同一年逝世，临终前，三位伟人都交代了什么话？,2024-09-24 09:46,10258,449,呷谈历史,呷谈历史,1976年是最令人悲伤的一年，那一年三位伟人相继离世，还发生了唐山大地震。三位伟人在离世前都交代了一些事情，这些事情都和之后国家的发展有关系。,https://toutiao.com/group/7418141722196197900/,,0,0,False
差点没认出来小沈阳！已悄悄爆改好似韩国欧巴,2024-10-24 23:34,281,534,大象新闻,大象新闻,一头金发配上无袖背心好似韩国欧巴，大家差点没认出来小沈阳。网友:“眼前一亮”“已悄悄爆改韩国爱豆”!,https://share.hntv.tv/news/0/1849585927594663937,,0,0,False
