title,publish_time,like_count,comment_count,media_name,source,abstract,article_url,tag,is_yaowen,article_sub_type,has_video
她是央视最惨主持人，男友被判死缓，丈夫诈骗入狱，47岁无人敢娶,2024-08-27 23:30,2179,207,闻书识焉,闻书识焉,她曾是央视的台柱子，和董卿、周涛并称为央视的三朵金花。回顾刘芳菲的前半生，最令人感到惋惜的，便是她的感情生活，47岁至今无人敢娶。,https://toutiao.com/group/7407743113688564258/,,0,0,False
太阳突发巨大耀斑，7年以来最大！网友：怪不得头晕头疼睡不着,2024-10-03 15:22,201,124,中国气象爱好者,中国气象爱好者,在10月3日晚，太阳迎来了一次惊人的耀斑爆发。此次爆发的耀斑强度达到了X9.0级别，不仅是自2020年太阳活动周期以来最强的一次，也是自2017年9月的X9.3级耀斑事件以来的最大耀斑。,https://toutiao.com/group/7421569184087556647/,,0,0,False
太炸裂了!我也要焚烧秸秆！,2024-10-03 12:48,4902,1598,智勇双全旭日erEb8B,智勇双全旭日erEb8B,,https://toutiao.com/group/7421530422804218431/,,0,0,True
为什么1984年阅兵无法被超越？看到这样的劈枪和脚步就知道了,2024-07-14 05:28,19891,1750,悠闲入口,悠闲入口,,https://toutiao.com/group/7391359236577428007/,,0,0,True
千万别让陈佩斯遇上冯巩，俩人嘴皮子一个比一个溜，笑翻台下大咖,2024-08-23 00:31,3712,512,一人观天下,一人观天下,,https://toutiao.com/group/7405749806213104143/,,0,0,True
国乒5朵金花的家庭：王艺迪体二代，陈梦富二代，王曼昱父亲泪目,2024-08-04 02:03,2594,148,不似少溓游,不似少溓游,想要在国内靠乒乓球打出名堂，仅仅有天赋是完全不够的。因为在中国乒坛，万里挑一的天才遍地都是。以至于有不少人都选择放弃，甚至还有田志希这样为了能打乒乓球而选择归化韩国的球手。,https://toutiao.com/group/7398094722457289266/,,0,0,False
中国🇨🇳人民的好总理,2024-09-03 15:46,202046,21447,话说,话说,这个老人一生只做一件事，那就是为了人民鞠躬尽瘁，死而后已,https://toutiao.com/group/7410443709928210955/,,0,0,True
全红婵采访界的搞笑女，奶声奶气，好解压好治愈，听10遍都不腻,2024-08-25 10:11,4812,850,木子说事,木子说事,,https://toutiao.com/group/7407017722083476002/,,0,0,True
富婆深夜独自回家 看到两个男人在敲自己家门 下秒做法太机智了,2024-08-09 10:20,11325,948,车界前说,车界前说,,https://toutiao.com/group/7401082708190822963/,,0,0,True
乌军撤出，俄方获“重大胜利”,2024-10-03 14:34,2853,239,环球时报,环球时报,美国全国广播公司等外媒强调，拿下这个战略要地对俄方来说是一场“重大胜利”。在武赫列达尔地区作战的乌克兰部队2日发文称:“最高指挥部允许从武赫列达尔撤军，以保存人员和军事装备，并为进一步行动做准备。”,https://toutiao.com/group/7421557521095082522/,,0,0,False
他于9月30日凌晨因交通意外不幸去世，年仅35岁,2024-10-04 02:45,889,477,大皖新闻,大皖新闻,10月3日，南昌百餐及赣乡野餐饮管理有限公司发布了一则《沉重公告》。讣告显示，百餐创始人兼赣乡野董事长魏昆先生于2024年9月30日凌晨因交通意外不幸去世，享年35岁。据江南君电话联系公告上的朱先生，他表示他是魏昆的合伙人，这件事是真的。,http://www.ahwang.cn/toutiao/202410/2753656.html,,0,1,False
众多冠军列队欢迎人生头一遭😃😃,2024-08-31 10:14,5118,413,李发彬,李发彬,,https://toutiao.com/group/7409245022303814155/,,0,0,True
2013年，湖南26岁女孩嫁给71岁老头，婚后还生下一子，如今怎样了,2024-07-12 11:59,26394,2404,智史通鉴,智史通鉴,2013年4月17日，长沙宁乡县的民政局迎来了一对特殊的夫妻。一个71岁的老头和一个26岁的女孩，离远了看，甚至像爷爷和孙女。面对工作人员异样的眼光，女孩说：“我和他是真心相爱的！”这让人好奇，这对相差45岁的夫妻，他们之间到底有着怎样的爱情故事？,https://toutiao.com/group/7390696631223534120/,,0,0,False
为国争光却遭郎平弃用！转身效力土耳其的王一梅，如今咋样了？,2024-08-31 13:19,932,139,豆莱说,豆莱说,光阴似箭，日月如梭，当初的少女早已退役，成为了排球场的幕后人，这么多年她都经历了什么，现在又怎么样了呢?,https://toutiao.com/group/7409287778514567718/,,0,0,False
男子与女子在河中嬉戏玩耍，突然连续将女子的头按入水中,2024-09-26 04:40,1153,158,经视看天下,经视看天下,,https://toutiao.com/group/7418807108637819444/,,0,0,True
见过守株待兔的，没见过蛇守马路逮人的，蛇居然蹦起来想咬人,2024-07-27 02:22,5474,893,昆明广播电视台,昆明广播电视台,,https://toutiao.com/group/7396135269709939200/,,0,0,True
中国一枚导弹打醒美国，这话说得太气人！（上）,2024-09-29 09:00,7932,259,占豪,占豪,,https://toutiao.com/group/7419987341437043200/,,0,0,True
今天才知道！电动车“每天充”和“用完再充”，到底哪个更伤电池,2024-08-27 11:19,8006,1636,鲸探所,鲸探所,“今天到底给车充不充电？”估计大多数人每天回家都会想这个问题，看着自己的电动车电量又多又少的，充不充电也是一件非常难以抉择的事情。那么，电动车到底应该怎样充电呢？是每天都充，还是用完之后再充呢？电动车充电不管是在城市还是农村，电动车其实都是人们出门最常见的交通工具。,https://toutiao.com/group/7407773012533117475/,,0,0,False
光芒万丈，陕西再探会会牛娃，小奎说出头那天回报社会 #蜜月之旅,2024-08-03 02:13,13963,2381,海哥量地球,海哥量地球,,https://toutiao.com/group/7398730663160971816/,,0,0,True
为啥有人跑农村收“废手机”。收回来干些什么？看完你就明白了,2024-07-18 13:17,20553,515,阿丽观世界,阿丽观世界,,https://toutiao.com/group/7392964301276840459/,,0,0,True
牛市疯了：3天赚了一百万，高兴得太早，回头发现“卖飞了”,2024-10-03 13:00,2730,3722,凤凰网财经,凤凰网财经,编者按:30岁的孙默，在北京有一份稳定的工作，五年前，手里刚有一点积蓄，他就全部投入股市，没想到紧接着迎来了疫情。,https://toutiao.com/group/7421533420930482703/,,0,0,False
5座车拉6个人被判超员，车主1句话把交警问懵,2024-08-05 20:20,16969,3964,奇妙钢笔pA8JyP,奇妙钢笔pA8JyP,,https://toutiao.com/group/7399752843772559906/,,0,0,True
长相太美被导演收入房中，27年同居无名分，63岁因一件事幡然醒悟,2024-08-08 07:54,2509,109,8卦娱,8卦娱,写作不易，文中会有5s广告，观看后可免费阅读全文，精彩值得期待！文|8卦娱“以色侍人，能好几时？”谁能想到《康熙王朝》“后宫”的“是非”，竟从戏里“争斗”到戏外，女演员之间的较量，简直令人别开生面。那么她们之间到底有何恩怨？为什么说“容妃”戏如人生？,https://toutiao.com/group/7400667604068680233/,,0,0,False
盘点那些采访爆笑瞬间，一个敢问一个敢答，小姐姐都太豪横了,2024-07-11 08:37,45773,2689,开心呱呱笑,开心呱呱笑,盘点那些采访爆笑瞬间，一个敢问一个敢答，小姐姐都太豪横了,https://toutiao.com/group/7390294511139684879/,,0,0,True
乌克兰媳妇远嫁中国农村，到地方后傻眼了：你们管这叫农村？,2024-08-29 09:19,12216,1603,乌克兰媳妇让娜,乌克兰媳妇让娜,乌克兰媳妇远嫁中国农村，到地方后傻眼了：你们管这叫农村？,https://toutiao.com/group/7408433469161734682/,,0,0,True
写歌30年穷困潦倒，前妻失望选择离婚，谁料51岁靠一首歌一夜成名,2024-08-12 03:37,24513,3922,八号探秘人,八号探秘人,在阅读此文之前，辛苦您点击一下“关注”，既方便您进行讨论和分享，又能给您带来不一样的参与感，感谢您的支持！编辑：LY无数人都想要一个一夜成名的机会，但机会来了也不是每个人都能把握住的。他用了三十年的时间来准备迎接属于自己的机会。为了这个机会他放弃了一切，甚至包括家庭。,https://toutiao.com/group/7402090890367484428/,,0,0,False
40年前供销社卖过的20个生活用品，见过一半算你厉害，你认识几个,2024-07-23 08:56,8529,889,万物知识局,万物知识局,文/万物知识局本文陈述所有内容皆有可靠信息来源，赘述在文章结尾童年的岁月无论过多久都会因为某件事或某个物品而激发回忆，如今早已长大的我们时常还会想起过往，在看到某个熟悉的老物件时，回忆就如同潮涌般难以抑制，就仿佛再次将我们带回到那个熟悉的午后和熟悉的房间。,https://toutiao.com/group/7394736337166926346/,,0,0,False
全球约一半肝癌在中国，再次提醒：家中的4种食物，尽早撤下餐桌,2024-08-13 08:36,95190,3537,梁医学社梁怡璋医生,梁医学社梁怡璋医生,,https://toutiao.com/group/7402540119712629311/,,0,0,True
张紫妍：被迫陪睡31人近百次，遭道具虐待，29岁自杀留230页遗书,2024-07-24 02:37,12899,900,八号探秘人,八号探秘人,在阅读此文之前，辛苦您点击一下“关注”，既方便您进行讨论和分享，又能给您带来不一样的参与感，感谢您的支持！本文叙述皆有官方信源，为了读者有更好体验，放在了文章后缀！,https://toutiao.com/group/7394994383675736576/,,0,0,False
伊朗和以色列继续开打，谁最终扛不住？,2024-10-03 21:56,1355,108,秦安战略,秦安战略,中东态势极为严峻，本来伊朗新总统跑到美国去，说要合作，想通过妥协免除制裁。结果事与愿违，以色列看到伊朗解除报复威胁，直接斩首真主党领袖，团灭高层，希望这次把伊朗震醒了。伊朗也明确要派兵到黎巴嫩，说不能黎巴嫩孤军作战，哈梅内伊在家召集紧急会议，伊朗外长：当前中东一切皆可能发生，另外，网传内塔尼亚胡受袭身亡。,https://toutiao.com/group/7421545185206600226/,,0,0,True
湖南88岁老太喝药自尽，5个儿媳围看等3小时，咽气后直接拉去火化,2024-07-29 06:37,2268,372,陈志华观天下,陈志华观天下,2014年，湖南衡阳一位88岁的老母亲，在绝望之际服毒自杀。更令人心寒的是，她的几个儿媳竟冷眼旁观，眼睁睁的看着老母亲痛苦挣扎三个小时后含泪离去。,https://toutiao.com/group/7396938793066086951/,,0,0,False
