title,publish_time,like_count,comment_count,media_name,source,abstract,article_url,tag,is_yaowen,article_sub_type,has_video
总书记的这个倡议，既有大工程也有“小而美”,2024-12-04 04:14,1444,622,人民日报,人民日报,一张蓝图绘到底 一茬接着一茬干赵政12月2日，习近平总书记出席第四次“一带一路”建设工作座谈会并发表重要讲话强调：“共建‘一带一路’已经进入高质量发展新阶段”“坚定不移推进高质量共建‘一带一路’，为推动构建人类命运共同体作出更大贡献”。,https://www.peopleapp.com/column/30047566221-500005971490?utm_source=头条号&promote=true,,0,0,False
马龙访台，台湾人热烈欢迎，台独焦虑不安视为大敌使出妖魔化老招,2024-11-29 09:56,25798,1068,邱毅台湾,邱毅台湾,,https://toutiao.com/group/7442637867307762230/,,0,0,True
外交态度逆转，立陶宛与中方对峙的内幕是？ #立陶宛,2024-12-03 09:02,17889,1462,卢克文工作室,卢克文工作室,,https://toutiao.com/group/7444108279917052425/,,0,0,True
赖清德过境夏威夷，病急乱投医，找上佩洛西通电话，惹怒特朗普,2024-12-03 09:30,14491,209,邱毅台湾,邱毅台湾,,https://toutiao.com/group/7444115695816442395/,,0,0,True
1米3袖珍美女嫁给1米48男孩，婚后丈夫奇迹长高，两人却不欢而散,2024-09-07 02:55,7369,404,睿之悦,睿之悦,杨萍和葛存苗的婚礼 文|睿之悦 编辑|睿之悦2019年，成都的民政局来了两个“10岁小孩”来登记，工作人员以为是玩闹。两个“小孩”拿出身份证让工作人员看，这才明白，原来是两个再也长不高的成年袖珍人情侣。,https://toutiao.com/group/7411713833267364386/,,0,0,False
韩国对韩国动手了,2024-12-04 15:12,14872,217,静思有我,静思有我,,https://toutiao.com/group/7444574797130662435/,,0,0,True
作家琼瑶去世，五天前发文，回忆亡夫，暗示对方子女对自己不孝！,2024-12-04 10:42,193,184,阳光看世界,阳光看世界,这个充满哀思的日子，我们告别了一位文学巨匠——台湾著名作家琼瑶。2024年12月4日，她在新北市淡水区的家中，以86岁高龄，选择了与世长辞。她的离去，如同她笔下的故事，充满了深情与决绝。,https://toutiao.com/group/7444503779006857769/,,0,0,False
被婆家赶走5年后，再看小朦妈妈的现状，董宇辉的话终于有人信了,2024-09-15 08:56,2004,181,八号探秘人,八号探秘人,大家是否还记得，有位百万粉丝博主在街头随机采访了一位年仅21岁，冒着风雨送外卖的单亲妈妈，她的遭遇曾一度让无数网友破防。,https://toutiao.com/group/7414668247301177907/,,0,0,False
近5年最热的十部剧，《狂飙》第9，《繁华》第6，第1名很难超越,2024-12-01 03:58,417,177,电影烂番茄,电影烂番茄,今天，番叔就结合口碑，给大家盘点一下近五年，热度最高的十部电视剧。第十名:《都挺好》 猫眼热度 9775.8，播出时间2019年。,https://toutiao.com/group/7430845717314273831/,,0,0,False
大学生4年间艾滋病感染12397例，60%存在这一行为,2024-12-03 10:16,4696,3940,凤凰网,凤凰网,据相关数据，2020年至2023年，新报告青年学生病例分别为:2977人、3677人、2733人、3010人，四年间共报告12397人。,https://toutiao.com/group/7444127197663396364/,,0,0,False
韩国政坛巨变：6小时戒严成闹剧，尹锡悦政治生涯倒计时？,2024-12-04 05:42,11562,190,邱震海,邱震海,,https://toutiao.com/group/7444427835889943055/,,0,0,True
3年前，宁夏7岁小女孩一笑走红，后拒百万签约，如今怎么样了？他们后悔了吗？,2024-09-19 07:25,14696,1964,睿之悦,睿之悦,2021年，视频镜头中出现的女孩儿用那一抹甜美的笑容，迅速引起了网友们的广泛关注。有媒体公司看到这一机遇，提出愿意用百万巨资与女孩儿签约，然而，女孩儿的父母却坚决拒绝了这一提议。,https://toutiao.com/group/7416250139544879679/,,0,0,False
河南警察3岁女儿被拐，苦寻全国23年无果，结果却发现女儿在对门,2024-11-05 07:43,2657,252,八号探秘人,八号探秘人,寻亲23年无果，丢失的女儿竟住在对门?但它却真实发生在河南洛阳的梁绍波身上。是意外走丢，还是人贩子所为，三岁的女儿怎会离奇失踪?,https://toutiao.com/group/7433697108120142345/,,0,0,False
秒空！华为“史上最强Mate”开卖,2024-12-04 06:28,254,200,潇湘晨报•晨视频,潇湘晨报•晨视频,12月4日，被称为华为“史上最强Mate”的Mate 70系列手机开启首销。华为终端BG CEO何刚现身位于深圳万象天地的华为首家全球旗舰店“直播带货”。,http://api.chenshipin.com/wap/a/674ff2ab842017214b77dc44/90f456b81afce808c1fcfbd3f5761f65/1733293622/4db1dc6580f39548e259ed66c9b522c1323917a84e71b345a6ad11d2f1c7b7dd,,0,0,False
不要再称呼女性为美女了，太过时，现在流行这4种称呼！,2024-09-29 09:01,1172,217,读者,读者,据《光明日报》的一篇文章考据:得益于网络信息技术的发展，“美女”作为社会称呼语的流行始于20世纪90年代。,https://toutiao.com/group/7419864692362969663/,,0,0,False
琼瑶5亿豪宅可园被拆除，全家福曝光，两个孙女皆是古典气质美女,2024-12-04 12:43,1679,381,开心吃瓜,开心吃瓜,她的《还珠格格》里香妃变成蝴蝶飞走了。1959年，21岁的琼瑶嫁给了庆筠，结婚后才发现庆筠赌博成瘾，不学无术。,https://toutiao.com/group/7444529660785984052/,,0,0,False
包厢全是刚出狱的恶霸，结果一看到饭店主厨，立马怂了,2024-11-11 01:21,10908,281,乐视群星访谈秀,乐视群星访谈秀,,https://toutiao.com/group/7435825833048015400/,,0,0,True
母亲瘫痪、父亲疯了，当年那个744分的高考状元，7年后却成了这样,2024-09-08 00:54,14039,1975,八号探秘人,八号探秘人,母亲截肢瘫痪、父亲疯癫痴傻，可对于自己的亲人，他却做出了这样的评价。而今，7年已过，曾经那个让无数人动容的少年，现在如何?,https://toutiao.com/group/7411852147648496162/,,0,0,False
天冷电动车充满电，一加油门就掉2格，不怪电池，真实原因告诉你,2024-11-26 05:02,1541,101,新能源战略家,新能源战略家,电动车使用方便、价格便宜，已经成为了不少朋友通勤代步的首选，但在使用过程中偶尔也有让人糟心的问题。像爆胎、刹车不灵敏这类问题可以通过门店维修来解决，但如果遇到电池出现异常情况，不仅问题难以排查，而且维修成本也不低。,https://toutiao.com/group/7441448742575702563/,,0,0,False
中北大学推出巡飞枪，枪身弹药创新设计，后坐力小射击精度更高,2024-11-28 09:54,22888,1462,杜文龙,杜文龙,,https://toutiao.com/group/7442266246671761932/,,0,0,True
女友怀孕了，男友不装了，带她回豪宅！,2024-11-23 08:01,8494,709,乐视大综艺咖,乐视大综艺咖,,https://toutiao.com/group/7440353629540483593/,,0,0,True
广西49岁老汉娶19岁姑娘，结婚21年生下15个孩子，如今有何下场？,2024-10-20 08:32,5772,695,艺述史,艺述史,她19岁出嫁，21年里总共生育了15个孩子，其中4个男孩子11个女孩子，家里热闹的像是开了一所学校一样。,https://toutiao.com/group/7427400319418384948/,,0,0,False
炸肉丸子，到底用淀粉还是面粉，教你一招，外酥里软超好吃,2024-10-01 09:23,5866,424,家常的味道,家常的味道,,https://toutiao.com/group/7420735473208787492/,,0,0,True
俄乌冲突结束方案三方不同意，10万部队入乌维和，瓜分还是占领？,2024-12-01 12:09,16431,1290,杜文龙,杜文龙,,https://toutiao.com/group/7443414453669855783/,,0,0,True
给近三年最好的10部年代剧排个名：《人世间》第6，第1名没有争议,2024-09-06 08:08,13586,4105,皮皮电影,皮皮电影,时尚是个轮回，电视剧也是。在2020年之前的那些年，电视剧市场基本上都被偶像剧、都市剧霸占。曾经撑起国剧品质的《闯关东》《岁月》这类年代好剧，难见踪影。,https://toutiao.com/group/7411390030722712090/,,0,0,False
羽绒服“暴雷”，普通人买羽绒服，看不懂水洗标上这3个词，容易吃大亏！,2024-11-30 09:21,741,361,环球网,环球网,来源：科普中国 近日，有关羽绒服的话题频繁上热搜。有服装行业人士说，90%的鸭绒从去年的35万涨到今年的59万一吨；90%的鹅绒从去年的70万涨到今年的125万一吨。成本的暴涨，导致某些厂家用50%的鸭绒冒充90%的鹅绒，甚至拿废丝掺在鹅绒里。我们普通消费者，要怎么选购羽绒服呢？,https://3w.huanqiu.com/a/3084ce/4KT1XWDBsfa?agt=20,,0,0,False
作家琼瑶自杀身亡，享年86岁。遗书：我已经“翩然”的去了,2024-12-04 11:11,415,121,全国党媒信息公共平台,全国党媒信息公共平台,来源：【大河健康报】本文来自【大河健康报】，仅代表作者观点。全国党媒信息公共平台提供信息发布传播服务。,https://api-m.hubpd.com/transfer?nextUrl=https%3A%2F%2Fwww.hubpd.com%2Fhubpd%2Frss%2Fjrttvideo%2Findex.html&contentId=7782220156099532268,,0,0,False
富二代当兵却逃跑回家，班长去他家抓人，一进家门瞬间惊了,2024-10-26 02:59,12325,1078,乐视天天剧好看,乐视天天剧好看,,https://toutiao.com/group/7429913203359875636/,,0,0,True
罕见！100年前，英国游客拍下的清朝乡村，和想象中完全不一样,2024-09-20 02:07,8353,736,万物知识局,万物知识局,泥泞的土路，衣不蔽体的老百姓，即便是达官显贵的家中也十分破败，而这些都是清王朝的历史痕迹，虽说那时候中国摄影技术并不发达，但也有许多外国游客来到这里，拍摄下了许多老照片，为我们留下了珍贵的历史资料，那清朝到底是怎样的面貌呢?,https://toutiao.com/group/7416287738871267855/,,0,0,False
67岁执意生娃，如今却坐轮椅无法自理，5岁的天赐被迫独立学洗衣,2024-11-04 10:32,8048,1862,睿之悦,睿之悦,2019年，已经67岁的田新菊执意生下了自己的第三个孩子小天赐。那么，现如今5年的时间过去了，这“天赐”的礼物到底是福还是祸呢?,https://toutiao.com/group/7433367394946384435/,,0,0,False
20岁的关之琳属实太美，出水芙蓉洁白柔嫩，果然名不虚传！,2024-11-27 06:10,1184,115,乐享综艺剧场,乐享综艺剧场,,https://toutiao.com/group/7441836884977779200/,,0,0,True
红房子：这段堪称最精彩，范伟和李小璐演技炸裂，百看不厌！,2024-11-11 02:36,1862,199,南瓜热剧回放,南瓜热剧回放,红房子：这段堪称最精彩，范伟和李小璐演技炸裂，百看不厌！,https://toutiao.com/group/7435845105006674458/,,0,0,True
弟弟光荣退伍，姐姐兴奋去车站接他，怎料一见弟弟瞬间哭了,2024-11-05 06:34,29789,2885,乐视天天剧好看,乐视天天剧好看,,https://toutiao.com/group/7433679820573934091/,,0,0,True
太恶劣！引众怒！警方深夜通报：千万粉丝网红，被行拘！,2024-12-05 00:50,652,651,环球网,环球网,来源：新闻晨报 近日，有4000余万粉丝的网红“祁天道”因直播时做出不当行为引发热议，其直播权限被限时封禁。此前报道→4664万粉丝网红直播擦边、调戏女性！网友炸了！,https://3w.huanqiu.com/a/a7835f/4KWsOL1MYxn?agt=20,,0,0,False
