title,publish_time,like_count,comment_count,media_name,source,abstract,article_url,tag,is_yaowen,article_sub_type,has_video
这就是旺三代的媳妇，祖上积德啊，才能娶到这么好的媳妇👍,2025-01-27 10:33,25036,2176,趣知达人,趣知达人,,https://toutiao.com/group/7464541223764705842/,,0,0,True
点燃烟花递给警察，镜头一捕捉笑翻全场！,2025-01-04 10:36,48339,5108,King,King,,https://toutiao.com/group/7456006626227618367/,,0,0,True
外国人怀疑东北虎的凶猛，让比特犬去干老虎，镜头拍下惨烈过程,2025-01-27 09:36,1749,223,森林中的故事会,森林中的故事会,,https://toutiao.com/group/7463027975139721737/,,0,0,True
赵本山给央视春晚准备的却被毙了！没想到在辽台春晚成经典,2025-01-07 06:49,470,112,山丘,山丘,,https://toutiao.com/group/7457061687603036707/,,0,0,True
扫地机器人用了近两个小时，将家里打扫干净网友：看着也太解压了,2025-01-03 06:39,1263,380,上进雨天5s5R,上进雨天5s5R,,https://toutiao.com/group/7455572832236487206/,,0,0,True
翟欣欣为了钱，竟然可以克服生理厌恶和苏某结婚，也真是个狠人,2025-01-22 09:22,4474,1268,乐见Talk,乐见Talk,索要千万逼死前夫的翟欣欣，认罪认罚！天理昭昭，报应不爽，迟到七年半的审判终于来了。本以为的一场婚姻纠纷，伴随着一封遗书解开了翟欣欣蛇蝎面目。,https://toutiao.com/group/7462559129823953442/,,0,0,False
情侣闹分手零下20几度的天气，把衣服脱光！,2025-01-27 08:53,2527,1259,欢快橘子j0,欢快橘子j0,,https://toutiao.com/group/7464515509640380991/,,0,0,True
