title,publish_time,like_count,comment_count,media_name,source,abstract,article_url,tag,is_yaowen,article_sub_type,has_video
黎智英香港出庭抖内幕，美国介入，蔡英文参与，还有赵少康金小刀,2024-11-27 09:24,34071,2171,邱毅台湾,邱毅台湾,,https://toutiao.com/group/7441887559757595190/,,0,0,True
1米3袖珍美女嫁给1米48男孩，婚后丈夫奇迹长高，两人却不欢而散,2024-09-07 02:55,6582,355,睿之悦,睿之悦,杨萍和葛存苗的婚礼 文|睿之悦 编辑|睿之悦2019年，成都的民政局来了两个“10岁小孩”来登记，工作人员以为是玩闹。两个“小孩”拿出身份证让工作人员看，这才明白，原来是两个再也长不高的成年袖珍人情侣。,https://toutiao.com/group/7411713833267364386/,,0,0,False
马龙访台，台湾人热烈欢迎，台独焦虑不安视为大敌使出妖魔化老招,2024-11-29 09:56,17456,757,邱毅台湾,邱毅台湾,,https://toutiao.com/group/7442637867307762230/,,0,0,True
包厢全是刚出狱的恶霸，结果一看到饭店主厨，立马怂了,2024-11-11 01:21,9299,196,乐视群星访谈秀,乐视群星访谈秀,,https://toutiao.com/group/7435825833048015400/,,0,0,True
三舰岛平直甲板，中国试验“奇特航母”，或改变未来海战格局,2024-11-29 08:39,6784,304,杜文龙,杜文龙,,https://toutiao.com/group/7442618152862614068/,,0,0,True
河南警察3岁女儿被拐，苦寻全国23年无果，结果却发现女儿在对门,2024-11-05 07:43,1947,171,八号探秘人,八号探秘人,寻亲23年无果，丢失的女儿竟住在对门?但它却真实发生在河南洛阳的梁绍波身上。是意外走丢，还是人贩子所为，三岁的女儿怎会离奇失踪?,https://toutiao.com/group/7433697108120142345/,,0,0,False
富二代当兵却逃跑回家，班长去他家抓人，一进家门瞬间惊了,2024-10-26 02:59,11756,1039,乐视天天剧好看,乐视天天剧好看,,https://toutiao.com/group/7429913203359875636/,,0,0,True
3年前，宁夏7岁小女孩一笑走红，后拒百万签约，如今怎么样了？他们后悔了吗？,2024-09-19 07:25,14100,1909,睿之悦,睿之悦,2021年，视频镜头中出现的女孩儿用那一抹甜美的笑容，迅速引起了网友们的广泛关注。有媒体公司看到这一机遇，提出愿意用百万巨资与女孩儿签约，然而，女孩儿的父母却坚决拒绝了这一提议。,https://toutiao.com/group/7416250139544879679/,,0,0,False
警惕“先用后付”小心欠下账单～（央视频号：光华路资讯）,2024-11-27 12:44,15461,4942,央视频,央视频,,https://toutiao.com/group/7441939150552433179/,,0,0,True
弟弟光荣退伍，姐姐兴奋去车站接他，怎料一见弟弟瞬间哭了,2024-11-05 06:34,27962,2817,乐视天天剧好看,乐视天天剧好看,,https://toutiao.com/group/7433679820573934091/,,0,0,True
47岁女人晒一人午餐，走红朋友圈，网友：羡慕，这才是活的明白！,2024-09-14 06:19,1785,1216,傻姐美食,傻姐美食,大家好我是傻姐美食，今年47岁的我，独自生活已经很多年了。今天的午餐，我在朋友圈晒了一张照片:简单的一盘豆角手擀面，配上炒丝瓜，居然意外走红，很多朋友纷纷点赞，说我这样的生活状态真是羡慕。,https://toutiao.com/group/7413580591322513946/,,0,0,False
67岁执意生娃，如今却坐轮椅无法自理，5岁的天赐被迫独立学洗衣,2024-11-04 10:32,6881,1602,睿之悦,睿之悦,2019年，已经67岁的田新菊执意生下了自己的第三个孩子小天赐。那么，现如今5年的时间过去了，这“天赐”的礼物到底是福还是祸呢?,https://toutiao.com/group/7433367394946384435/,,0,0,False
51年洪学智妻子寻女无果，到老乡家歇脚老乡惊呼：你要找得就是我,2024-09-22 01:07,15962,1013,品古观今,品古观今,前言1951年，阳曲县委大院突然来了7、8位解放军同志，其中一位女同志，就是洪学智的妻子张文。她此番前来，就是为了寻找多年前因战乱而寄养于民间的爱女。可昔日的小村落早已蜕变成另一番景象，这无异于是大海捞针。,https://toutiao.com/group/7417034363226915354/,,0,0,False
罕见！100年前，英国游客拍下的清朝乡村，和想象中完全不一样,2024-09-20 02:07,7975,722,万物知识局,万物知识局,泥泞的土路，衣不蔽体的老百姓，即便是达官显贵的家中也十分破败，而这些都是清王朝的历史痕迹，虽说那时候中国摄影技术并不发达，但也有许多外国游客来到这里，拍摄下了许多老照片，为我们留下了珍贵的历史资料，那清朝到底是怎样的面貌呢?,https://toutiao.com/group/7416287738871267855/,,0,0,False
有人要抓内塔尼亚胡，中国怎么看？,2024-11-29 13:59,5773,155,静思有我,静思有我,,https://toutiao.com/group/7442700602863256098/,,0,0,True
女友怀孕了，男友不装了，带她回豪宅！,2024-11-23 08:01,7563,648,乐视大综艺咖,乐视大综艺咖,,https://toutiao.com/group/7440353629540483593/,,0,0,True
乌克兰蒙了，欧洲慌了，美国也冷静了,2024-11-26 10:42,13243,456,张元伟,张元伟,,https://toutiao.com/group/7441536551424623114/,,0,0,True
四年前拜登上台时，我就预测特朗普会卷土重来,2024-11-23 09:15,17945,1326,张维为,张维为,《这就是中国》第259期精彩片段,https://toutiao.com/group/7440400982275523091/,,0,0,True
炸萝卜丸子到底用面粉还是淀粉，教你正确做法，外焦里嫩，太香了,2024-10-26 09:25,12865,846,家常的味道,家常的味道,,https://toutiao.com/group/7430012978277122611/,,0,0,True
身上有静电，一招就解决? #静电#健康养生#生活常识,2024-11-26 09:30,927,289,人性狼牙站,人性狼牙站,,https://toutiao.com/group/7441518130460885514/,,0,0,True
广西49岁老汉娶19岁姑娘，结婚21年生下15个孩子，如今有何下场？,2024-10-20 08:32,4903,633,艺述史,艺述史,她19岁出嫁，21年里总共生育了15个孩子，其中4个男孩子11个女孩子，家里热闹的像是开了一所学校一样。,https://toutiao.com/group/7427400319418384948/,,0,0,False
老房子该怎么办？看完清清楚楚,2024-11-29 01:58,226,111,温义飞的急救财经,温义飞的急救财经,老破小红利，已经结束了吗?过去几十年，老破小房子的确搭上了“三波政策红利”，但从力度来看，每一波都在减弱。,https://toutiao.com/group/7442510352769745460/,,0,0,False
女教师因丈夫被开除，不料她丈夫竟是将军，校长要完了,2024-11-27 08:32,1853,278,南瓜说异,南瓜说异,,https://toutiao.com/group/7441874251113562636/,,0,0,True
老人疑因嫖娼死亡 社区回应：已确认死亡，老人尸体已被家属抬走,2024-11-27 10:09,1361,767,海峡网,海峡网,近日，网传湖南张家界一名老人疑因嫖娼死亡，引发了大量网友的关注和热议。当地社区回应:已确认死亡，老人尸体已被家属抬走。,http://m.hxnews.com/dzbhz/news/kx/202411/27/jrtt_2182946.shtml,,0,0,False
乌即将完蛋! 注定赔夫人又折兵! 欢迎收看《谦秋论》第732集播出,2024-11-29 02:00,6542,226,赖岳谦官方,赖岳谦官方,,https://toutiao.com/group/7442515208112701964/,,0,0,True
俩人相亲互相看不上，哪料男方一报母亲身份，姑娘乐了,2024-11-08 01:50,10747,2373,乐视群星访谈秀,乐视群星访谈秀,,https://toutiao.com/group/7434719902990074395/,,0,0,True
综艺：范丞丞首度公开真实姓名，震惊在场众人，太不可思议,2024-11-29 16:07,478,135,PP宫斗放映厅,PP宫斗放映厅,,https://toutiao.com/group/7442625322467459618/,,0,0,True
“喝酒三巨头”：一年全没，有的去世当天喝4瓶白酒，都不满36岁,2024-11-05 10:32,2464,1500,睿之悦,睿之悦,他们的每一次出现都离不开酒，也曾是很多人眼中的“酒中豪杰”。但“小酌怡情，大饮伤身”，这三位博主以生命为代价，再一次给大家带来了警醒。,https://toutiao.com/group/7433739040179520038/,,0,0,False
刚从中国返俄，苏-57飞行员传来新消息,2024-11-25 10:15,7835,256,环球时报新媒体,环球时报新媒体,刚从中国返俄，苏-57飞行员传来新消息,https://toutiao.com/group/7441158524530328127/,,0,0,True
看了凌晨三点上海交大，我发现有的大学生失业真不怪社会,2024-11-27 13:31,4098,2585,洞见,洞见,根据资料显示，近五年，上交大毕业生毕业去向落实率始终在97%以上。其中本科生毕业去向落实率94%以上，硕士和博士研究生毕业去向落实率保持在98%以上。,https://toutiao.com/group/7441950261666398771/,,0,0,False
得了中方恩惠后，石破茂看清局势，向中国派出一支等了12年的队伍,2024-11-29 08:03,957,144,博览历史,博览历史,自从日本核废水排海事件之后，中日两国的关系一度陷入冰点，而随着台海事件的升级，日本前任首相针对于台湾问题模棱两可，甚至是公然挑衅的态度，也使得两国之间的关系，始终无法得到改善。,https://toutiao.com/group/7442544303844459008/,,0,0,False
终审宣判！知名女星丈夫获刑13年，已入监服刑！知情人：她得知判决后很伤心,2024-11-29 16:33,519,131,每日经济新闻,每日经济新闻,据中新文娱消息，今年4月，女演员安以轩老公陈荣炼被控不法经营赌博、诈骗和洗黑钱等83项罪名，34项成立，遭判14年徒刑，已入监服刑至今。澳门特别行政区终审法院近日对涉德晋集团刑事犯罪的上诉案件做出终审裁决。陈荣炼刑期减为13年有期徒刑，罚金18亿港币（约2.32亿美元）。,http://www.nbd.com.cn/rss/jinri_toutiao/articles/3666661.html,,0,0,False
信阳一副镇长开套牌车被抓现行后打人？官方：套牌属实，已介入调查,2024-11-30 04:42,5539,7812,极目新闻,极目新闻,极目新闻记者 丁鹏11月29日，河南信阳商城县一网友发视频称，该县汪岗镇副镇长开套牌车，被被套牌车主发现后打人骂人。30日，极目新闻记者从被套牌车主和当地官方相关部门了解到，汪岗镇副镇长游某套牌一事属实，目前当地交警正在处理，纪委监委已介入调查。,http://jms.ctdsb.net/jmythshare/#/index_share?cId=0&contentType=5&contentId=2317304,,0,0,False
在上海，三元成本能吃到什么面？这钱花的值吗？#抖音美食推荐官,2024-09-13 08:53,884,106,兴凯湖莹莹,兴凯湖莹莹,,https://toutiao.com/group/7414048068313547303/,,0,0,True
