title,publish_time,like_count,comment_count,media_name,source,abstract,article_url,tag,is_yaowen,article_sub_type,has_video
监控下的10级狂风，看看就知道了！,2025-04-11 09:45,2468,623,世间美好录,世间美好录,,https://toutiao.com/group/7491989298909020683/,,0,0,True
内娱最意想不到的一对，正式官宣离婚,2025-04-11 04:33,4919,788,槽值小妹,槽值小妹,在微博上，她以一句话为这段维系近十年的婚姻画上了句号:“是的，分开已经有一段时间了，出于对孩子的保护，没有跟大家同步我的生活。没有狗血的剧情，对于，我们，走散成了，你，我，我很遗憾!”,http://mp.weixin.qq.com/s?__biz=MzIzNDAxNjkxOA==&mid=2650944223&idx=1&sn=0d97b5c1f540aeb45f20f1fef6b55ee3,,0,0,False
不到5块钱把我脾胃养好了，喝完肚子真舒服，这配方我能吃到99岁,2025-02-05 04:21,5866,974,麦田小麦垛,麦田小麦垛,我想很多人应该都不知道。真是太神级了，这碗鸡蛋面汤不到五块钱就养好了我的玻璃胃，这么好的配方我可以吃到99岁。,https://toutiao.com/group/7467752202041246234/,,0,0,False
这就是胡蝶戴笠的真实的样貌，并非演员扮演，货真价实的罕见照片,2025-04-02 08:47,2573,368,火星X计划,火星X计划,本文所有内容皆有官方可靠信息来源，具体资料赘述在文章内部或结尾。翻开民国老照片历史中，作为蓝衣社的“老板”和军统头子戴笠，他以冷峻威严和杀伐果决的形象，一直被认为是最神秘的人物。,https://toutiao.com/group/7488634235818000896/,,0,0,False
特朗普急发文，给中国一天半时间撤回反制，不然失去一切谈判机会,2025-04-13 03:04,3245,105,女公子来也,女公子来也,,https://toutiao.com/group/7491979952443703827/,,0,0,True
