title,publish_time,like_count,comment_count,media_name,source,abstract,article_url,tag,is_yaowen,article_sub_type,has_video
两会上，甄子丹发言如雷霆炸响引热议，难怪两会从不邀请流量明星,2025-03-10 06:36,5224,479,洲洲影视娱评,洲洲影视娱评,在光影交错的《叶问》中，甄子丹身着简约长衫。这位荧幕硬汉又摇身一变，以文化艺术界代表的身份。眼含热泪，用一番肺腑之言，再次震撼众人。,https://toutiao.com/group/7480054953755574819/,,0,0,False
看了鸨鸟怎么交配，才知道古代青楼的老板娘，为何叫“老鸨”！,2025-02-05 12:14,48047,1846,子青说历史,子青说历史,有妓女的地方就是青楼，而青楼里必有老鸨。说起老鸨，无人不晓，但何谓“鸨”?老鸨，在古代指开办青楼的老板娘，到了近代，还泛指青楼妓女的管理者。,https://toutiao.com/group/7467906890459939378/,,0,0,False
Deepseek分析：如何在网上上一天稳定挣到50块钱,2025-03-10 01:49,258,113,西借东风,西借东风,,https://toutiao.com/group/7479992060977447434/,,0,0,False
许家印第二！又一个“大佬”跑路，花光几百亿，总部一片狼藉,2025-03-05 12:16,6437,1288,天天历史,天天历史,2023年9月10日，沈晖发了条微博，写到“这周出差去了慕尼黑，然后纽约。好事多磨，静待花开。”就在沈晖出国一个月后，威马汽车正式申请了破产，留下的只有一地鸡毛。,https://toutiao.com/group/7478197991749190159/,,0,0,False
王晶真敢说！揭李连杰经纪人被杀内幕，难怪61岁的李连杰极速衰老,2025-03-10 07:12,1619,310,后妃秘史,后妃秘史,就在光天化日之下，一位大佬级人物，蔡子明，竟遭枪击，身中数弹，当场毙命，这事儿轰动全港，吓得功夫巨星李连杰连门都不敢出，身边得围着七八个便衣保镖才敢喘口气。,https://toutiao.com/group/7480034316441895476/,,0,0,False
安徽小伙娶深圳富婆，富婆大他22岁，47岁生下儿子，婚后1年离婚,2025-02-25 05:23,5355,354,财经科创聚焦,财经科创聚焦,在2019年的初春时节，42岁的深圳女企业家棋棋返回了位于湖北荆州的老家进行探亲。在此期间，她邂逅了一位在理疗店工作的年轻小伙——20岁的涛涛，来自安徽。,https://toutiao.com/group/7475219731243368997/,,0,0,False
八路军饿晕了到处借粮食，意外发现鬼子机场，精彩了,2024-12-17 05:40,13950,1592,热播综艺精选,热播综艺精选,,https://toutiao.com/group/7449249251990700559/,,0,0,True
山西悬崖上，发现1700年前巨型石洞，里面竟然住着9个红衣女子,2025-02-26 22:20,64901,5777,学军的农村生活,学军的农村生活,山西悬崖上，发现1700年前巨型石洞，里面竟然住着9个红衣女子,https://toutiao.com/group/7474843100557656627/,,0,0,True
