title,publish_time,like_count,comment_count,media_name,source,abstract,article_url,tag,is_yaowen,article_sub_type,has_video
冰雪春天丨微视频：白雪换白银 “冷资源”变“热产业”,2025-01-21 05:44,477,215,人民网,人民网,曾经，冰天雪地是漫长寒冬的寂静写照；如今，它已然变身成为经济发展的炽热引擎。习近平总书记指出：“把发展冰雪经济作为新增长点，推动冰雪运动、冰雪文化、冰雪装备、冰雪旅游全产业链发展。”“冷资源”变“热产业”，正为持续向好的中国经济写下生动注脚。,https://toutiao.com/group/7462239391499436580/,,0,0,False
风光：妻子不把丈夫当人看，哪料丈夫提出离婚，妻子崩溃了！,2025-01-11 06:00,2436,368,乐视谍战影视营,乐视谍战影视营,,https://toutiao.com/group/7458377879160750601/,,0,0,True
人民币大涨！中国资产爆发,2025-01-21 01:15,412,207,每日经济新闻,每日经济新闻,1月20日晚间，离岸人民币兑美元持续拉升，接连收复7.31、7.30、7.29、7.28、7.27关口，日内一度上涨近750点。消息面来看，美国当选总统特朗普于周一发布备忘录，但备忘录本身并未实施任何新的关税，市场情绪有所提振。,http://www.nbd.com.cn/rss/jinri_toutiao/articles/3729808.html,,0,0,False
台南凌晨6.2级地震致全台摇晃：阿里山突冒“闪光” 屏东鸟群飞翔,2025-01-20 23:04,5903,1203,海客新闻,海客新闻,1月21日0时17分，台湾台南市发生6.2级地震，震源深度14公里。台北震感明显，摇晃感长达十余秒，之后发生多次余震。台南市有房屋倒塌，有人员受困，目前正在抢救中。,https://toutiao.com/group/7462137272922669602/,,0,0,True
赵本山凭这一个小品，捧红了王小利，全程笑点不断,2025-01-04 20:46,4594,1010,娱快很简单,娱快很简单,,https://toutiao.com/group/7454123678406541824/,,0,0,True
女房东爱上24岁男租客，这样的话也说得出口，涂磊神助攻,2025-01-18 02:53,3350,159,金曲大荟萃,金曲大荟萃,女房东爱上24岁男租客，这样的话也说得出口，涂磊神助攻,https://toutiao.com/group/7461083095078044195/,,0,0,True
