title,publish_time,like_count,comment_count,media_name,source,abstract,article_url,tag,is_yaowen,article_sub_type,has_video
一习话丨“领导干部要扑下身子深入群众”,2025-04-02 06:34,1120,2293,央广网,央广网,“要坚持工作重心下移，扑下身子深入群众，面对面、心贴心、实打实做好群众工作，着力解决群众反映强烈的突出问题。”党的十八大以来，习近平总书记身体力行，考察调研足迹遍布大江南北，问需于民、问计于民的脚步从未停歇，贯穿始终的是对人民的赤子之心。,https://toutiao.com/group/7488600001766097435/,,0,0,False
不许与李嘉诚合作，中方已下达禁令？长和速战速决，港府果断出手,2025-03-28 12:43,12622,1481,北大王勇教授,北大王勇教授,不许与李嘉诚合作，中方已下达禁令？长和速战速决，港府果断出手,https://toutiao.com/group/7486839975956021779/,,0,0,True
麻绳专挑细处断，超乎想象的缅甸地震，与我何干？,2025-04-01 08:11,4953,535,小遥说商业,小遥说商业,麻绳专挑细处断，超乎想象的缅甸地震，与我何干？,https://toutiao.com/group/7488254274770993703/,,0,0,True
一口气看完欧美犯罪电影,2025-02-26 10:34,2936,103,娜娜日常分享,娜娜日常分享,,https://toutiao.com/group/7475674319280931338/,,0,0,True
丈夫难忘貌美初恋，妻子要求见面，初恋一上台妻子傻眼了,2025-01-04 02:08,1627,618,热播综艺精选,热播综艺精选,,https://toutiao.com/group/7455875520882803237/,,0,0,True
“人没了”，3人身亡！男友发声：女友遇难，两人只差一个婚礼！小米通报细节,2025-04-01 15:44,684,632,21世纪经济报道,21世纪经济报道,针对小米SU7被曝“在高速路上碰撞后爆燃致人员伤亡”一事，4月1日12时46分，小米公司发言人微博回应“一辆小米SU7在高速公路上遭遇严重交通事故致3人死亡”一事。,http://mp.weixin.qq.com/s?__biz=MjI3Njc0NTk4MQ==&mid=2650465229&idx=1&sn=d2c8c1de98875a09c0e875a6648215dc,,0,0,False
