title,publish_time,like_count,comment_count,media_name,source,abstract,article_url,tag,is_yaowen,article_sub_type,has_video
“一次拿不完，开三轮车来”，张扬的发钱活动背后：一座被刘强东改变的村庄,2025-01-08 09:16,1068,436,上观新闻,上观新闻,8日上午9点，宿迁市来龙镇光明村水泄不通，红色的旗子、展板、装饰布满了光明村党群服务中心的小广场。上千村民聚集在广场附近，排队等着领取刘强东派送的现金和年货。村里60周岁以上的老人每人能领一万元现金红包，家里老人多的能领上四五万。刘强东在校时的14位小学老师每人能拿到10万元。,https://export.shobserver.com/toutiao/html/840875.html,,0,1,False
中土签协议后，土耳其坐地起价：不交出稀土技术，中企就打道回府,2025-01-08 03:26,12574,4787,田柳Talk,田柳Talk,土耳其发现世界上第二大稀土矿，然而却在选择国外伙伴时，摆了中国一道，划下一道红线，中企投资可以，但必须转让稀土加工技术，否则不能合作。,https://toutiao.com/group/7457086089631711759/,,0,0,False
“颜十六”至少已骗4人赴泰：其微信状态异常，名下公司显示税收违法 警方已接到报案,2025-01-09 09:42,215,169,红星新闻,红星新闻,1月7日，王星返回泰国后与泰国警察交谈。图据视觉中国近日，多名演艺圈从业者被招募赴泰国进组拍戏后，在泰缅边境失联，引发舆论关注。据泰媒1月8日报道，泰国皇家警察透露，中国演员王星（艺名“星星”）是人口贩卖的受害者，发现他存在被骗到邻国进行选角工作的情况。,https://cdsbrss.cdsb.com/toutiao_no_video.php?url=https%3A%2F%2Fstatic.cdsb.com%2Fmicropub%2FArticles%2F202501%2F14a11d691203098edd3dbebee124e190.html,,0,0,False
男子参加同学婚宴饮酒后身亡，家属起诉新郎及同桌5人索赔138万余元 法院判了,2025-01-08 17:01,1474,1732,极目新闻,极目新闻,2023年12月，陕西富县男子辛某参加同学的婚宴，饮用白酒后被送回家中，第二天被家人发现时已死亡，引发了一起诉讼纠纷。事发当天，辛某到同学任某家参加婚宴，与他人同坐一桌用餐。,http://jms.ctdsb.net/jmythshare/#/index_share?cId=0&contentType=5&contentId=2348346,,0,0,False
中国第4艘航母，被卫星发现蛛丝马迹，直接十万吨级核动力？,2025-01-07 02:11,2088,816,蒋福伟,蒋福伟,卫星发现新航母的“蛛丝马迹”，中国下一艘航母或直接十万吨级核动力?近日，有西方军事专家援引商业卫星照片称，中国航母楼的外形出现了肉眼可见的变化。,https://toutiao.com/group/7456990223185035816/,,0,0,False
夫妇因征地纠纷被羁押600多天后检方撤诉 获国家赔偿80多万难到位；山东胶州相关部门：财政状况致未及时支付,2025-01-09 08:00,792,513,大风新闻,大风新闻,“财政啥时候才能挤出这笔赔偿款？我在维权中曾经受过伤，身体也不好，还等着钱治病呢！”孙女士焦急地说。在当地检察院和法院均已做出刑事赔偿决定数月之后，山东省胶州市的黄先生、孙女士夫妇二人却未能拿到赔偿款。,https://toutiao.com/group/7457818567929512475/,,0,0,False
一觉醒来，加拿大政府垮了,2025-01-06 23:30,9690,3666,牛弹琴,牛弹琴,一觉醒来，加拿大政府也垮了。加拿大时间1月6日，特鲁多正式宣布，他将辞去自由党党魁和总理职务，在自由党选出新领袖前，他还会继续留任一段时间总理。为什么要辞？特鲁多承认，由于内部争斗，他已经搞不下去了。,https://toutiao.com/group/7456943585049543205/,,0,0,False
高速上被赶下车女生称被网暴 顺风车满足车主自身出行为前提的“民事互助行为”，边界在哪？,2025-01-08 15:55,134,725,红星新闻,红星新闻,1月5日晚间，天津蓟州警方发布警情通报称，公安机关已对李某某违反《道路交通安全法》的行为，依法作出罚款并予以记分;,https://cdsbrss.cdsb.com/toutiao_no_video.php?url=https%3A%2F%2Fstatic.cdsb.com%2Fmicropub%2FArticles%2F202501%2F8243c7dcb4e45dd698276da0322bc0e0.html,,0,0,False
