title,publish_time,like_count,comment_count,media_name,source,abstract,article_url,tag,is_yaowen,article_sub_type,has_video
一习话·温暖聆听丨元宵佳节共祝美好 总书记的祝福与叮嘱,2025-02-12 13:20,1547,679,央广网,央广网,作为中华民族的重要传统节日，春节和元宵节是海内外中华儿女共祝美好生活的日子，承载着天人相合、团圆和谐、国泰民安的文化认知与美好祈愿。每当重要节日到来之际，习近平总书记都会看望慰问基层干部群众，和大家共享祥和、共祝美好。心系民生冷暖，情牵万家灯火。,https://www.cnr.cn/newscenter/local/dftj/20250212/t20250212_527069852.shtml,,0,0,False
河南南阳:楼上男子扔烟头，楼下炮摊被引爆,2025-02-11 06:27,23887,10151,五月天影视,五月天影视,,https://toutiao.com/group/7470044141720846848/,,0,0,True
大姐戴祖母绿手镯寻找身世之谜，倪萍：你这镯子能买整栋楼,2025-01-21 01:49,6560,326,明星爆料站,明星爆料站,,https://toutiao.com/group/7462179951463137811/,,0,0,True
公公大街上捉到儿媳妇偷腥，高声吆喝：这就是30万彩礼娶的,2025-02-11 05:44,2649,722,平凡的生活,平凡的生活,,https://toutiao.com/group/7470033130225779236/,,0,0,True
陈数很少演小品，但演了就是经典，跟黄宏这个小品演的太好,2025-01-16 19:07,7822,208,谁是卧底影社剧院,谁是卧底影社剧院,,https://toutiao.com/group/7460406377236726287/,,0,0,True
新任市长穿便衣被暴打，富商们在身后看好戏，不料事闹大了,2025-01-21 02:50,8137,692,动作点播台剧院,动作点播台剧院,,https://toutiao.com/group/7462195591880491556/,,0,0,True
有这样的老婆，你家祖坟都冒青烟了！,2025-02-04 03:11,66553,11116,乐观的冰淇淋I,乐观的冰淇淋I,,https://toutiao.com/group/7467226170908606976/,,0,0,True
河南濮阳高速撞车事件，车内的全过程,2025-02-10 03:53,654,235,微笑橙子j,微笑橙子j,,https://toutiao.com/group/7469633598703174196/,,0,0,True
两口子打架，哪料媳妇下手太狠，把自己半辈子幸福都毁了,2025-01-21 02:03,3749,535,大聊影视厅,大聊影视厅,,https://toutiao.com/group/7462176595467076150/,,0,0,True
郭冬临爆笑小品，郭子总怀疑媳妇给自己戴绿帽子，笑料百出乐疯了,2025-01-19 16:55,2493,520,小阿东i,小阿东i,,https://toutiao.com/group/7460711738821755428/,,0,0,True
