title,publish_time,like_count,comment_count,media_name,source,abstract,article_url,tag,is_yaowen,article_sub_type,has_video
习语品读｜纷飞的雪花千姿百态，不同文明也各具风采,2025-02-14 11:54,908,390,国际在线,国际在线,编者按:党的十八大以来，习近平总书记发表的一系列重要讲话和重要文章，风格鲜明、思想深邃、内涵深刻，用历史映照现实、远观未来，闪耀着马克思主义的真理光芒。,https://news.cri.cn/toutiaopic/f3d88e96-94c2-40bc-2dfd-2f85ef3b4540.html,,0,0,False
这么高的个子，不跳广场舞可惜了,2024-11-20 23:28,28179,3615,成武融媒,成武融媒,,https://toutiao.com/group/7439507575931929127/,,0,0,True
问政山东态度最嚣张的领导,2024-11-24 05:14,4397,908,各地都观察一波,各地都观察一波,,https://toutiao.com/group/7440709918975328804/,,0,0,True
媳妇玩到半夜才回来，以为老公不在家，进门这操作把老公看懵了,2025-01-24 09:38,11412,3160,滕菲,滕菲,,https://toutiao.com/group/7463414214191743497/,,0,0,True
小姑子30岁不嫁人，天天就喜欢和哥哥腻在一起，嫂子忍无可忍爆发,2025-01-23 02:38,7670,1529,影视随意看,影视随意看,,https://toutiao.com/group/7462934734751007284/,,0,0,True
