title,publish_time,like_count,comment_count,media_name,source,abstract,article_url,tag,is_yaowen,article_sub_type,has_video
一利尿，二润肺，三养胃，四健脾，全身都是宝，可惜很多人当草！,2025-02-15 16:49,2086,295,小沐娱,小沐娱,蒸面条菜。,https://toutiao.com/group/7471688851368296998/,,0,0,False
最高院：再次重申机动车与非机动车发生交通事故，非机动车一方存在过错的，应当依法减轻机动车一方赔偿责任,2025-04-04 01:54,1199,484,青海普法,青海普法,非机动车一方存在过错的，应当依法减轻机动车一方赔偿责任。——王某与李某、某保险公司机动车交通事故责任纠纷案。,https://toutiao.com/group/7488914613439054388/,,0,0,False
路人偶遇46岁刘涛，真实状态曝光，快来围观！,2025-04-03 09:51,3866,1204,淡定风铃Lda077x,淡定风铃Lda077x,,https://toutiao.com/group/7489022202907329051/,,0,0,False
春天，使劲吃这菜，一降火，二化痰，三通便，四强免疫，吃起来！,2025-03-27 03:31,2383,473,爱玉门,爱玉门,儿菜炒牛肉。红油儿菜。,https://toutiao.com/group/7485651411372343820/,,0,0,False
“这可能是冷战后前所未有的一次巨大冲击”,2025-04-05 08:13,3846,343,环球时报新媒体,环球时报新媒体,“这可能是冷战后前所未有的一次巨大冲击”,https://toutiao.com/group/7489739208962146843/,,0,0,True
