title,publish_time,like_count,comment_count,media_name,source,abstract,article_url,tag,is_yaowen,article_sub_type,has_video
14年儿子坐马航失联，多年后父亲收到回信，坚信儿子去了平行世界,2025-02-20 02:38,7467,699,谛听骨语,谛听骨语,MH370失联的第10年，马来西亚政府宣布在2024年12月20日重启寻找马航MH370的项目。如果后续进展顺利的话，马航MH370会在2025年的1月到4月期间重新展开全面地搜寻。凭空消失的客机，有希望被揭露的失踪真相，这一切都是让人充满了期待。,https://toutiao.com/group/7473322554179895817/,,0,0,False
当“网红”混进央视《六姊妹》，演技烂得像外行，梅婷都带不动,2025-03-04 01:09,568,129,通观报道,通观报道,这些年轻演员们，脸上还带着些许稚气，眼眸中满是懵懂，他们来演绎十九二十岁的角色，仿佛是时光回溯，把那个年代年轻人特有的青春气息展现得淋漓尽致。,https://toutiao.com/group/7477755113906487860/,,0,0,False
"""云南游客被困购物店！三万多的碗？文旅局急回应！""",2025-03-03 10:25,3954,2384,清泉石上流,清泉石上流,"""云南游客被困购物店！三万多的碗？文旅局急回应！""",https://toutiao.com/group/7477527188977107508/,,0,0,True
吃饭“8分饱”是错的？医生提醒：65岁后吃饭尽量做到这4点,2025-03-03 23:33,3455,118,老k谈健康,老k谈健康,,https://toutiao.com/group/7477493545096528418/,,0,0,True
万斯的完整采访！,2025-03-04 07:38,898,402,会沉寂吗,会沉寂吗,,https://toutiao.com/group/7477855382409462335/,,0,0,True
村干部一天正事没干过，只惦记喂兔子，东窗事发跳井自杀,2025-01-26 01:51,1291,118,明星太秀了,明星太秀了,,https://toutiao.com/group/7463417166331920935/,,0,0,True
多年后前妻再见到前夫，两人相视一笑，一笑泯恩仇,2025-02-22 06:34,2641,910,烽火看电影,烽火看电影,,https://toutiao.com/group/7474127176493711909/,,0,0,True
惊爆！小伙买鱼付款后说鱼不用杀，商户闻听鱼不卖了，,2025-03-02 04:07,5038,4605,帝国重汽,帝国重汽,,https://toutiao.com/group/7476961373608542759/,,0,0,True
局面已经越来越不对劲，中国小县城的工资开始崩溃了!,2025-03-05 00:30,4890,936,挽风,挽风,,https://toutiao.com/group/7477945173566095926/,,0,0,True
