title,publish_time,like_count,comment_count,media_name,source,abstract,article_url,tag,is_yaowen,article_sub_type,has_video
公公竟然和儿媳偷情，哪料被妻子撞见，这下有戏看了！,2025-01-21 08:05,11272,932,南瓜午夜厅,南瓜午夜厅,,https://toutiao.com/group/7462273852651979274/,,0,0,True
开始反击，中国对美加征15%关税！力度有多大？,2025-02-04 09:21,10363,321,一林大话世界,一林大话世界,,https://toutiao.com/group/7467491552005227027/,,0,0,True
华为200万年薪都留不住他！天才少年彭志辉离职后，现状曝光,2025-01-16 09:28,5617,820,与君説,与君説,在阅读此文之前，麻烦您点击一下“关注”，既方便您进行讨论和分享，又能给您带来不一样的参与感，感谢您的支持文、编辑|小娄你敢相信吗？大厂华为200万年薪的工作，竟然也有人不屑一顾。入职华为两年后，彭志辉毅然决然选择离职。,https://toutiao.com/group/7460439446131884579/,,0,0,False
北京98岁老人中央单位退休，学历能惊掉下巴，退休金令人羡慕,2025-02-04 06:22,5845,576,北平秋天的美好,北平秋天的美好,,https://toutiao.com/group/7467445407782535734/,,0,0,True
相声：张康贾旭明说《三国》，真是俩相声天才，不输德云社！,2025-01-29 21:08,4874,1010,PP爱情放映厅,PP爱情放映厅,,https://toutiao.com/group/7463035074229977600/,,0,0,True
东北媳妇过年回娘家，才知道什么叫漏风的小棉袄,2025-02-01 21:30,15001,5152,紫韵幽梦,紫韵幽梦,,https://toutiao.com/group/7466565989161796148/,,0,0,True
美国机器人跳舞，对比春晚机器人哪个更好？#机器人,2025-02-02 16:55,18180,10649,荼岑,荼岑,,https://toutiao.com/group/7466866382051901979/,,0,0,True
穷小伙找富婆借钱买房子，富婆直接答应，却提出条件,2025-01-07 03:09,2478,478,南瓜热剧回放,南瓜热剧回放,,https://toutiao.com/group/7457005446646202916/,,0,0,True
110：警方侦破新型招嫖方式，犯罪手段简单，民警法眼显神威,2025-01-21 23:26,3946,2234,嘎嘎剧有料,嘎嘎剧有料,,https://toutiao.com/group/7462328582048711205/,,0,0,True
罪域：中央最大老虎被查，没人敢抓捕，书记：后台再硬我亲自去抓,2025-01-14 06:17,16389,629,乐视谍战影视营,乐视谍战影视营,,https://toutiao.com/group/7459651246346043919/,,0,0,True
