title,publish_time,like_count,comment_count,media_name,source,abstract,article_url,tag,is_yaowen,article_sub_type,has_video
男子结婚去接亲的时候，竟然踹门你们觉得对吗?,2025-01-16 05:24,14946,3981,爱喝牛奶,爱喝牛奶,,https://toutiao.com/group/7460379773781475850/,,0,0,True
放弃鸡娃的中产，捧红了这个小众高薪工作,2025-01-19 06:07,362,222,新周刊,新周刊,人们容易只关注到名校，关注那些极其优秀的孩子。对自媒体和培训机构来说，这些孩子总会成为他们的“优秀案例”。Jenny说，但是家长会被大环境裹挟，以为自己的孩子也可以是那千分之一。,https://app.neweekly.com.cn/webm/article/shp1346848180,,0,0,False
这次，被扒了个底朝天的李小冉，彻底颠覆了大众对她的固有认知！,2025-01-14 10:15,645,261,与君説,与君説,在阅读此文之前，麻烦您点击一下“关注”，既方便您进行讨论和分享，又能给您带来不一样的参与感，感谢您的支持文、编辑|小娄“我以为她去了会被欺负，没想到她去了是欺负别人的。”几个月前，某平台推出了一部新的真人秀综艺，名为《一路繁花》。,https://toutiao.com/group/7459708721183195699/,,0,0,False
罪域：中央最大老虎被查，没人敢抓捕，书记：后台再硬我亲自去抓,2025-01-14 06:17,9232,404,乐视谍战影视营,乐视谍战影视营,,https://toutiao.com/group/7459651246346043919/,,0,0,True
境外“电诈”亲历者讲述：长得没姿色的女子，最终的归宿是公海,2025-01-10 07:23,12332,4029,鲸探所,鲸探所,当时电影《孤注一掷》上映的时候，里面有很多场景让人感觉非常残酷，可实际上，这部电影的导演表示，能拍出来的电影尺度已经是非常克制的了，很多都是点到为止，真实情况比这还要黑暗、残酷百倍千倍。,https://toutiao.com/group/7458180288431899151/,,0,0,False
