title,publish_time,like_count,comment_count,media_name,source,abstract,article_url,tag,is_yaowen,article_sub_type,has_video
独家视频丨习近平会见国际工商界代表：投资中国就是投资未来,2025-03-28 10:35,946,147,国际在线,国际在线,3月28日上午，国家主席习近平在北京人民大会堂会见国际工商界代表。习近平指出，对外开放是中国的基本国策，中国正在推进高水平对外开放，稳步扩大规则、规制、管理、标准等制度型开放，开放的大门只会越开越大，利用外资的政策没有变也不会变。,https://news.cri.cn/toutiaopic/ef1a6d5f-f553-5981-38b0-50b1f3a6d1b6.html,,0,0,False
王诗龄放假喜提70万新车！身体复胖小胡子明显，与妈妈李湘一个样,2025-03-25 02:40,718,660,柠檬菲菲娱乐,柠檬菲菲娱乐,,https://toutiao.com/group/7485571343472132635/,,0,0,False
安徽小伙娶深圳富婆，富婆大他22岁，47岁生下儿子，婚后1年离婚,2025-02-25 05:23,7630,562,财经科创聚焦,财经科创聚焦,在2019年的初春时节，42岁的深圳女企业家棋棋返回了位于湖北荆州的老家进行探亲。在此期间，她邂逅了一位在理疗店工作的年轻小伙——20岁的涛涛，来自安徽。,https://toutiao.com/group/7475219731243368997/,,0,0,False
刘雨欣挑战跳水，这身材比例太棒了！看了都喜欢！,2025-01-16 05:39,10435,605,海洋之心,海洋之心,,https://toutiao.com/group/7460383552011371060/,,0,0,True
30张40年前的老照片，40岁以下就别点了吧，因为你看不懂,2025-01-16 07:22,1673,1012,怀旧影集,怀旧影集,40年前的生活是什么样的，想必很多没经历过的人都很好奇，今天小编就给大家分享一些40年前的老照片，让你认识你爷爷奶奶或者爸爸妈妈那一代人是怎么生活的!,https://toutiao.com/group/7460410236684337702/,,0,0,False
张庭15岁女儿上海时装周走秀，容貌好像没有继承到妈妈的优良基因,2025-03-27 13:24,851,3210,小卿卿159,小卿卿159,,https://toutiao.com/group/7486478669083329074/,,0,0,False
