title,publish_time,like_count,comment_count,media_name,source,abstract,article_url,tag,is_yaowen,article_sub_type,has_video
时习之 微视频丨“和”字里的大国外交,2024-11-29 13:15,1280,554,人民网,人民网,2014年11月28日，习近平在中央外事工作会议上发表重要讲话强调，中国必须有自己特色的大国外交。我们要在总结实践经验的基础上，丰富和发展对外工作理念，使我国对外工作有鲜明的中国特色、中国风格、中国气派。10年间，习近平以大国领袖的襟怀气度，同各方共话友好合作、共商天下大计。,https://toutiao.com/group/7442688916777337371/,,0,0,False
黎智英香港出庭抖内幕，美国介入，蔡英文参与，还有赵少康金小刀,2024-11-27 09:24,33054,2125,邱毅台湾,邱毅台湾,,https://toutiao.com/group/7441887559757595190/,,0,0,True
弟弟光荣退伍，姐姐兴奋去车站接他，怎料一见弟弟瞬间哭了,2024-11-05 06:34,27754,2810,乐视天天剧好看,乐视天天剧好看,,https://toutiao.com/group/7433679820573934091/,,0,0,True
菲律宾总统和副总统开干，其实就是媚美反中与亲中远美的路线之争,2024-11-26 09:37,20265,204,邱毅台湾,邱毅台湾,,https://toutiao.com/group/7441519866256818714/,,0,0,True
炸萝卜丸子到底用面粉还是淀粉，教你正确做法，外焦里嫩，太香了,2024-10-26 09:25,12791,841,家常的味道,家常的味道,,https://toutiao.com/group/7430012978277122611/,,0,0,True
67岁执意生娃，如今却坐轮椅无法自理，5岁的天赐被迫独立学洗衣,2024-11-04 10:32,6741,1578,睿之悦,睿之悦,2019年，已经67岁的田新菊执意生下了自己的第三个孩子小天赐。那么，现如今5年的时间过去了，这“天赐”的礼物到底是福还是祸呢?,https://toutiao.com/group/7433367394946384435/,,0,0,False
1米3袖珍美女嫁给1米48男孩，婚后丈夫奇迹长高，两人却不欢而散,2024-09-07 02:55,6533,345,睿之悦,睿之悦,杨萍和葛存苗的婚礼 文|睿之悦 编辑|睿之悦2019年，成都的民政局来了两个“10岁小孩”来登记，工作人员以为是玩闹。两个“小孩”拿出身份证让工作人员看，这才明白，原来是两个再也长不高的成年袖珍人情侣。,https://toutiao.com/group/7411713833267364386/,,0,0,False
好物分享｜意料之外，清真大拿做酱牛肉，居然这么简单,2024-11-15 13:00,4598,491,老饭骨,老饭骨,,https://toutiao.com/group/7437081397237383719/,,0,0,True
包厢全是刚出狱的恶霸，结果一看到饭店主厨，立马怂了,2024-11-11 01:21,9146,193,乐视群星访谈秀,乐视群星访谈秀,,https://toutiao.com/group/7435825833048015400/,,0,0,True
乌即将完蛋! 注定赔夫人又折兵! 欢迎收看《谦秋论》第732集播出,2024-11-29 02:00,5200,190,赖岳谦官方,赖岳谦官方,,https://toutiao.com/group/7442515208112701964/,,0,0,True
广西49岁老汉娶19岁姑娘，结婚21年生下15个孩子，如今有何下场？,2024-10-20 08:32,4803,628,艺述史,艺述史,她19岁出嫁，21年里总共生育了15个孩子，其中4个男孩子11个女孩子，家里热闹的像是开了一所学校一样。,https://toutiao.com/group/7427400319418384948/,,0,0,False
警惕“先用后付”小心欠下账单～（央视频号：光华路资讯）,2024-11-27 12:44,14672,4947,央视频,央视频,,https://toutiao.com/group/7441939150552433179/,,0,0,True
女友怀孕了，男友不装了，带她回豪宅！,2024-11-23 08:01,7423,641,乐视大综艺咖,乐视大综艺咖,,https://toutiao.com/group/7440353629540483593/,,0,0,True
刚从中国返俄，苏-57飞行员传来新消息,2024-11-25 10:15,7667,250,环球时报新媒体,环球时报新媒体,刚从中国返俄，苏-57飞行员传来新消息,https://toutiao.com/group/7441158524530328127/,,0,0,True
马龙在台湾被包围!,2024-11-28 11:47,3647,236,吴东昇台湾蓝绿红,吴东昇台湾蓝绿红,,https://toutiao.com/group/7442295423428985363/,,0,0,True
1.91米的“女神”，开启新身份,2024-11-21 08:37,2105,135,环球人物杂志,环球人物杂志,“排球绝不仅仅是我以前在赛场上看到的那一种模样。”作者：陈佳莉今年9月，奥运冠军惠若琪迎来了属于自己的第一个教师节。从南京师范大学博士毕业后，因为延续着对排球的热爱，惠若琪选择留校任教。对于曾站上过梦想的世界之巅，也体验过手术台上与死神擦肩而过的她来说，讲台成为最新的“赛场”。,https://toutiao.com/group/7439648518744113683/,,0,0,False
乌克兰蒙了，欧洲慌了，美国也冷静了,2024-11-26 10:42,12748,445,张元伟,张元伟,,https://toutiao.com/group/7441536551424623114/,,0,0,True
小学教职工“2元早餐”抢了学生午餐的肉？从孩子碗里夺食，贪婪吃相太难看！,2024-11-28 04:44,174,172,极目新闻,极目新闻,极目新闻评论员 屈旌近日，指尖新闻从多个权威渠道获悉，有着黑龙江省百家教育示范基地称号的哈尔滨市道里区抚顺小学校长李佩妍正在接受当地纪委调查，知情人称其部分违纪行为涉及与给学校配餐的餐饮公司有不正当经济往来。11月25日，道里区教育局孙姓局长证实，李佩妍已接受调查月余。,http://jms.ctdsb.net/jmythshare/#/index_share?cId=0&contentType=5&contentId=2315957,,0,0,False
美妇约见老情人，见面场景真是太逗了，这俩人绝配！,2024-10-27 16:25,4360,553,乐视明星的那点事,乐视明星的那点事,美妇约见老情人，见面场景真是太逗了，这俩人绝配！,https://toutiao.com/group/7428157095108674088/,,0,0,True
罕见！100年前，英国游客拍下的清朝乡村，和想象中完全不一样,2024-09-20 02:07,7936,722,万物知识局,万物知识局,泥泞的土路，衣不蔽体的老百姓，即便是达官显贵的家中也十分破败，而这些都是清王朝的历史痕迹，虽说那时候中国摄影技术并不发达，但也有许多外国游客来到这里，拍摄下了许多老照片，为我们留下了珍贵的历史资料，那清朝到底是怎样的面貌呢?,https://toutiao.com/group/7416287738871267855/,,0,0,False
央视曝光：从里到外都是假的！,2024-11-25 01:05,2255,1032,直播日照,直播日照,冬季来临，羽绒服、羽绒被等羽绒制品成为市场上的香饽饽，但一部分“假羽绒制品”却在线上、线下市场肆意泛滥。,https://www.rzw.com.cn/redian/2024-11-25/9KpKioo3ULdxXYhU.html,,0,0,False
马龙访台，台湾人热烈欢迎，台独焦虑不安视为大敌使出妖魔化老招,2024-11-29 09:56,9667,263,邱毅台湾,邱毅台湾,,https://toutiao.com/group/7442637867307762230/,,0,0,True
3元自助早餐，杀疯了,2024-11-27 06:04,1147,674,中国新闻周刊,中国新闻周刊,连续早起7年后，北京宝妈Emma最近解放了，再也不用为孩子早餐发愁了。原因是小区门口新开的南城香，成了全家人早餐的新快乐老家。,https://toutiao.com/group/7441835816147583551/,,0,0,False
10分钟就做好的营养早餐饼，做法简单，适合上班赶时间的朋友,2024-11-08 07:51,3073,184,家常的味道,家常的味道,,https://toutiao.com/group/7434812999635829275/,,0,0,True
女教师因丈夫被开除，不料她丈夫竟是将军，校长要完了,2024-11-27 08:32,1218,165,南瓜说异,南瓜说异,,https://toutiao.com/group/7441874251113562636/,,0,0,True
包菜炒粉条，切记不要焯水和直接下锅，教你一招，清脆爽口不出水,2024-11-11 11:50,6850,337,家常的味道,家常的味道,,https://toutiao.com/group/7435987746101690930/,,0,0,True
炒白菜千万不要直接下锅，难怪不好吃，教你技巧，鲜嫩入味不出水,2024-10-30 09:23,14142,787,家常的味道,家常的味道,,https://toutiao.com/group/7431496869400576550/,,0,0,True
好物分享｜炖牛肉时切记三放两不放，这样炖出来的牛肉才会汤鲜味美,2024-10-15 08:50,5291,205,家味美食,家味美食,,https://toutiao.com/group/7425922043991360037/,,0,0,True
三舰岛平直甲板，中国试验“奇特航母”，或改变未来海战格局,2024-11-29 08:39,4154,199,杜文龙,杜文龙,,https://toutiao.com/group/7442618152862614068/,,0,0,True
体感温度-30度的一天，生活在内蒙牧区的，我们是怎么度过的,2024-11-26 11:28,7355,1108,河南姑娘远嫁在内蒙,河南姑娘远嫁在内蒙,,https://toutiao.com/group/7441548328887648819/,,0,0,True
全家人爱吃的懒人早餐，5分钟出锅，比包子好吃，比油条还香,2024-11-13 03:50,3071,388,家味美食,家味美食,,https://toutiao.com/group/7436606239527666212/,,0,0,True
母亲瘫痪、父亲疯了，当年那个744分的高考状元，7年后却成了这样,2024-09-08 00:54,12481,1841,八号探秘人,八号探秘人,母亲截肢瘫痪、父亲疯癫痴傻，可对于自己的亲人，他却做出了这样的评价。而今，7年已过，曾经那个让无数人动容的少年，现在如何?,https://toutiao.com/group/7411852147648496162/,,0,0,False
有人冒充我男朋友，算不算诈骗？遇到奇葩事你会怎么办？,2024-09-06 05:52,1847,231,兴凯湖莹莹,兴凯湖莹莹,,https://toutiao.com/group/7411404025502892554/,,0,0,True
【崔哥天天侃11/29】默克尔出书爆料，是她把普京给骗了,2024-11-28 23:08,10287,615,北美崔哥,北美崔哥,,https://toutiao.com/group/7442470886336102946/,,0,0,True
