title,publish_time,like_count,comment_count,media_name,source,abstract,article_url,tag,is_yaowen,article_sub_type,has_video
时政新闻眼丨习近平给“关键少数”上的这一课，释放哪些重要信息？,2024-10-30 01:30,4108,1691,央视新闻,央视新闻,10月29日，面向“关键少数”的重要一课，在中央党校（国家行政学院）举行。,https://content-static.cctvnews.cctv.com/snow-book/index.html?item_id=14850865314774586846&source=50006&sub_source=50006_001,,0,0,False
人民日报评论员：坚定信心凝心聚力，推动改革行稳致远,2024-10-29 23:14,1029,465,人民日报,人民日报,原标题:坚定信心凝心聚力，推动改革行稳致远。“要把学习贯彻党的二十届三中全会精神不断引向深入，引导全党全国人民坚定改革信心，更好凝心聚力推动改革行稳致远。”,https://www.peopleapp.com/column/30047165521-500005874792?utm_source=头条号&promote=true,,0,0,False
穷小子去富婆家里，富婆笑咧嘴把保姆支开，保姆心知肚明,2024-10-26 06:34,1167,155,乐视情感讲堂,乐视情感讲堂,穷小子去富婆家里，富婆笑咧嘴把保姆支开，保姆心知肚明,https://toutiao.com/group/7429969094939509311/,,0,0,True
土豆搭配洋葱，教你一个神仙吃法，一次3斤不够吃，太解馋了,2024-09-26 09:09,28489,1708,家常的味道,家常的味道,土豆搭配洋葱，教你一个神仙吃法，一次3斤不够吃，太解馋了,https://toutiao.com/group/7418876506660667904/,,0,0,True
善恶终有报：疫情时对中国一毛不拔，却大方捐美国6亿，如今咋样,2024-09-29 05:50,928,127,睿之悦,睿之悦,可就是这样一位在中国土生土长起来的富豪，在疫情期间面对同胞的困境却一毛不拔，反而大方的捐助了6亿给美国。,https://toutiao.com/group/7419859345154015798/,,0,0,False
孙涛的小品那么差，为啥还能年年上春晚？看他老婆是谁就明白了,2024-10-22 05:55,402,403,八号探秘人,八号探秘人,2006年春晚舞台上的一句“我骄傲!”，使他成为了人尽皆知的喜剧演员。任谁也不会想到，如今家喻户晓的喜剧明星，曾经是个一上舞台就怯场的人。,https://toutiao.com/group/7427286254939406900/,,0,0,False
小西天景区67岁保安大爷感言已“憋屈离职”，称透露薪资被约谈后因病买药脱岗被辞，引舆情后又被叫回去,2024-10-30 09:13,690,654,大风新闻,大风新闻,山西小西天景区67岁保安大爷所谓“因言获罪被辞”一事可谓一波三折，牵动了不少热心网友的关切。10月15日，保安高大爷笑谈“涨薪500元”的视频引发全网关注。10月18日，有网友称该保安大爷因透露工资被辞退。20日，相关单位称，该保安大爷未被辞退，且已调到更轻松的岗位。,https://toutiao.com/group/7431493470767907355/,,0,0,False
挣扎了几个月，泽连斯基认命改口：怎么跟俄罗斯谈，全听中国安排,2024-10-28 08:46,991,151,阿尔法军事,阿尔法军事,挣扎了好几个月，即便内心有万分的不情愿，泽连斯基还是决定，与俄罗斯的和平方案该怎么谈，还是得听中方的安排。,https://toutiao.com/group/7430744495617999360/,,0,0,False
44岁男子与67岁包子铺老板娘相恋3年，曾被认为是对方儿子，想要张结婚证有归属感，女方：我要年轻点就好了,2024-10-30 06:58,1543,888,九派新闻,九派新闻,10月30日，据四川广播电视台《黄金三十分》报道，在成都市新都区，67岁的包子店老板娘胡蓉与44岁的男友阿穆相恋，这段有着23岁年龄差距的恋情引发外界关注。阿穆80年出生，今年44岁，在胡蓉包子铺帮忙时，有时候会被人认为是胡蓉的儿子。,https://toutiao.com/group/7431448516058219059/,,0,0,False
以后想吃回锅肉你就像我这样做，肥而不腻，咸香适口，太解馋了,2024-08-06 11:19,36656,1331,家常的味道,家常的味道,,https://toutiao.com/group/7399984507362738742/,,0,0,True
给近三年最好的10部年代剧排个名：《人世间》第6，第1名没有争议,2024-09-06 08:08,9502,3153,皮皮电影,皮皮电影,时尚是个轮回，电视剧也是。在2020年之前的那些年，电视剧市场基本上都被偶像剧、都市剧霸占。曾经撑起国剧品质的《闯关东》《岁月》这类年代好剧，难见踪影。,https://toutiao.com/group/7411390030722712090/,,0,0,False
神十九乘组亲友看发射直播：宋令东母亲抹泪 王浩泽家属紧张屏息,2024-10-29 23:36,3366,191,海客新闻,海客新闻,10月30日清晨，神舟十九号载人飞船成功飞天，中国“神箭”再探苍穹。三名航天员蔡旭哲、宋令东、王浩泽的亲友也在电视机前观看了飞船发射的直播。,https://toutiao.com/group/7431345531005174307/,,0,0,True
杨妞花声音嘶哑念判决书：第一次看到余华英双手发抖,2024-10-25 03:49,5368,645,海客新闻,海客新闻,杨妞花声音嘶哑念判决书：第一次看到余华英双手发抖 她心里面是害怕的,https://toutiao.com/group/7429555385935069732/,,0,0,True
山西五台山悬崖上的狐仙洞，发现住着2个千年狐仙，上去吓得腿软,2024-10-22 03:00,4935,523,山西凡凡,山西凡凡,,https://toutiao.com/group/7428429414959940106/,,0,0,True
农村小情侣深夜约会，在屋内过着二人世界，兴奋坏了,2024-10-16 01:14,2156,228,乐视热播综艺精选,乐视热播综艺精选,农村小情侣深夜约会，在屋内过着二人世界，兴奋坏了,https://toutiao.com/group/7426173284741284364/,,0,0,True
“歼24”横空出世！论起高空高速，它是我军第二强，仅次于歼20,2024-10-30 08:06,1391,133,利刃,利刃,最近，一组歼-8战机编队飞行的照片亮相于网络，由于3架飞机飞得很密集，网友纷纷调侃“三八二十四，歼-24横空出世”！那么，在我军大批装备三代半和四代战机、甚至很多二代机部队直接换装歼-20的情况下，歼-8这款老飞机，还有存在的必要吗？,https://toutiao.com/group/7431476845067797001/,,0,0,False
“太害怕”！因太多人刷礼物，她关闭直播，“全捐”,2024-10-30 04:26,748,126,环球网,环球网,来源：广州日报 近日贵州被拐26年当事人杨妞花引起广泛关注28日晚，杨妞花和养父同框直播吸引了超630万人次观看截至29日上午9时许，杨妞花账号粉丝量已达224万。据第三方数据平台数据显示，自10月25日以来，该账号5天已涨粉90万。来源：当事人社交账号“太害怕了！,https://3w.huanqiu.com/a/340a94/4K36IioqdOR?agt=20,,0,0,False
富婆给儿子买房，怎料看中售楼女孩，要把她介绍给儿子,2024-10-25 06:56,3680,456,乐视娱乐乐透社,乐视娱乐乐透社,,https://toutiao.com/group/7429603554647605798/,,0,0,True
"万万没想到,53岁“丁克”半辈子的康辉，一生遗憾竟然是一通电话",2024-08-21 22:14,28508,5474,峰哥正读,峰哥正读,在阅读此文之前，麻烦您点击一下“关注”，既方便您进行讨论和分享，又能给您带来不一样的参与感，感谢您的支持！文/编辑：蘑菇百善孝为先。但是到底怎么做才算是“孝”，康辉用了半辈子才明白。央视知名主持人康辉，事业顺遂，家庭幸福，在外人看来是一个人生赢家。,https://toutiao.com/group/7405504703687115273/,,0,0,False
民间上坟传统：“上坟不带 5 果，家中不惹灾祸”，哪“5果”？,2024-08-08 10:30,18525,1783,惠农圈,惠农圈,在中国传统文化中，祭祀祖先一直是一项备受重视的活动，它承载着对先人的缅怀、敬意和感恩之情。在上坟的时候，人们会提前准备好供品，比如肉类、酒水，还有水果。其中关于水果的准备，也有着诸多的讲究和禁忌，比如“上坟不带 5 果，家中不惹灾祸”的说法。,https://toutiao.com/group/7400584207141192207/,,0,0,False
最绝望的死法：北大30岁女博士倒挂长城2小时，目睹自己走向死亡,2024-10-20 01:08,700,178,客观听書,客观听書,一名北大女博士在即将毕业之际，决定挑战“箭扣野长城”，为了拍几张不同凡响的照片，最终倒挂长城2小时，亲眼目睹了自己生命的终结。,https://toutiao.com/group/7427375431667499561/,,0,0,False
人贩子余华英的眼神有多恐怖？被抓前一天穿粉外套，戴金项链逛街,2024-10-28 11:55,621,262,鲸探所,鲸探所,“她当时一定在想，当年怎么没有弄死我。”10月25日，余华英拐卖儿童发回重审案一审宣判：余华英以拐卖儿童罪被判处死刑，剥夺政治权利终身，并且没收个人全部财产。当这个宣判出来之后，杨妞花的眼泪就流了出来，这个结果，她等的实在是太久了。,https://toutiao.com/group/7430789956693541387/,,0,0,False
安徽美女道士胡小慧被捕：精通“胡媚术”，九名男徒弟揭露其罪行,2024-09-12 08:10,3755,427,艺述史,艺述史,在安徽一处偏僻山头上，有座神秘的道观，外表平平无奇，但里面却有着一位名气很高的美女道士。美女道士的名字叫做胡小慧，据说有着高深的法力，能帮人消灾解难。很多人慕名前来，交上丰厚的香火钱，在袅袅青烟里，试图从这个年轻道士身上获得一些生活的支撑。,https://toutiao.com/group/7413662261274739200/,,0,0,False
小伙洗完澡故意秀肌肉，富婆心跳加速被当场拿下，这下好看了,2024-10-26 16:20,3093,154,乐视情感讲堂,乐视情感讲堂,小伙洗完澡故意秀肌肉，富婆心跳加速被当场拿下，这下好看了,https://toutiao.com/group/7430011217881596426/,,0,0,True
罕见！100年前，英国游客拍下的清朝乡村，和想象中完全不一样,2024-09-20 02:07,3535,444,万物知识局,万物知识局,泥泞的土路，衣不蔽体的老百姓，即便是达官显贵的家中也十分破败，而这些都是清王朝的历史痕迹，虽说那时候中国摄影技术并不发达，但也有许多外国游客来到这里，拍摄下了许多老照片，为我们留下了珍贵的历史资料，那清朝到底是怎样的面貌呢?,https://toutiao.com/group/7416287738871267855/,,0,0,False
15年前他在爱妻葬礼上哭到昏厥，发誓永不再娶，如今他做到了吗？,2024-08-24 02:17,18028,570,八号探秘人,八号探秘人,在阅读此文之前，辛苦您点击一下“关注”，既方便您进行讨论和分享，又能给您带来不一样的参与感，感谢您的支持！编辑丨xk纵观鱼龙混杂的娱乐圈，有人背叛，有人痴情。而果靖霖则是公认的好男儿，将一生都奉献给妻子。但妻子却仅仅陪他走了半生，没能战胜病魔，不幸离开人世。,https://toutiao.com/group/7406210316734710283/,,0,0,False
