title,publish_time,like_count,comment_count,media_name,source,abstract,article_url,tag,is_yaowen,article_sub_type,has_video
习近平向全国广大农民和工作在“三农”战线上的同志们致以节日祝贺和诚挚问候,2024-09-21 09:40,7230,4532,新华社,新华社,习近平向全国广大农民和工作在“三农”战线上的同志们致以节日祝贺和诚挚问候。在第七个“中国农民丰收节”到来之际，中共中央总书记、国家主席、中央军委主席习近平代表党中央，向全国广大农民和工作在“三农”战线上的同志们致以节日祝贺和诚挚问候。,http://mp.weixin.qq.com/s?__biz=MzA4NDI3NjcyNA==&mid=2650074248&idx=1&sn=6a1a77c66084f74c4d25123af2cc4bd5,,0,0,False
多少：赵本山装病上黑诊所，这段百看不厌，场面太逗了！,2024-09-21 02:46,1335,239,青涩星球yS,青涩星球yS,,https://toutiao.com/group/7416922331924136463/,,0,0,True
2013年，湖南26岁女孩嫁给71岁老头，婚后还生下一子，如今怎样了,2024-07-12 11:59,22625,2244,智史通鉴,智史通鉴,2013年4月17日，长沙宁乡县的民政局迎来了一对特殊的夫妻。一个71岁的老头和一个26岁的女孩，离远了看，甚至像爷爷和孙女。面对工作人员异样的眼光，女孩说：“我和他是真心相爱的！”这让人好奇，这对相差45岁的夫妻，他们之间到底有着怎样的爱情故事？,https://toutiao.com/group/7390696631223534120/,,0,0,False
以色列这一炸全搞砸了，中东地区迎来去美国化：中国成为最大赢家,2024-09-20 07:56,3255,1031,深度工场,深度工场,以色列这一炸全搞砸了。以色列在黎巴嫩这一炸，在战术上来说，确实很成功，杀伤4500多名黎巴嫩真主党成员。,https://toutiao.com/group/7416630160327279158/,,0,0,False
为国争光却遭郎平弃用！转身效力土耳其的王一梅，如今咋样了？,2024-08-31 13:19,869,120,豆莱说,豆莱说,光阴似箭，日月如梭，当初的少女早已退役，成为了排球场的幕后人，这么多年她都经历了什么，现在又怎么样了呢?,https://toutiao.com/group/7409287778514567718/,,0,0,False
军号一响，全军出击！,2024-09-19 08:01,10030,636,中国军号,中国军号,,https://toutiao.com/group/7416261401477382668/,,0,0,True
为什么说从2025年开始，70岁以上的老人，可能面临“两大”问题？,2024-09-01 14:12,2125,269,水大叔,水大叔,据可靠数据了解，我国70岁以上的人口数量已经达到了2.5亿人次，占到全国总人口数量的18%。伴随着人口老龄化的出现，养老问题也成了重中之重，要知道养老不仅仅是家庭的责任，更是社会责任。,https://toutiao.com/group/7409677025897710106/,,0,0,False
董卿父亲董善祥：我这辈子最后悔的事，就是让宝贝女儿嫁给密春雷,2024-09-11 06:59,1372,150,稻述,稻述,提起央视主持，现在挑大梁的几乎就是撒贝宁、尼格买提、龙洋等人了，他们也都非常优秀，但常有人怀念起董卿还在的日子。,https://toutiao.com/group/7413267526601228852/,,0,0,False
她认干爹改国籍，曾叫嚣要击败女国乒，却在巴黎奥运会丢尽了脸,2024-08-26 14:00,470,302,吃瓜崽崽,吃瓜崽崽,她曾是中国国籍，却因认干爹入韩籍。十九岁的她被国人认为是乒坛叛徒，还曾叫嚣女国乒。如今却成为了韩国乒乓一姐。,https://toutiao.com/group/7407375792933044790/,,0,0,False
骂专家，骂交警，骂城管这股歪风邪气，已经到了非治不可的地步了,2024-09-04 13:58,15586,37976,家和万事兴a9s6I,家和万事兴a9s6I,,https://toutiao.com/group/7410786907263369743/,,0,0,True
恭喜中国女篮新领袖终于出现了！百发百中！统治力让对手深深绝望,2024-06-25 07:11,24711,1347,乐播体育,乐播体育,,https://toutiao.com/group/7384335028576059923/,,0,0,True
国庆放假最新通知！不仅放假7天，而且还有4个好消息告诉大家,2024-09-21 06:53,3491,277,笑史云烟,笑史云烟,相信不少人已经准备好迎接这难得的七天长假，无论是准备出游看看祖国的大好河山，还是回家与家人团聚，亦或是宅在家里放松休息，大家的心情都充满了期待。,https://toutiao.com/group/7416981278681809423/,,0,0,False
这是调戏还是搭讪？,2024-08-16 04:36,1828,105,潍坊市广播电视台,潍坊市广播电视台,,https://toutiao.com/group/7403591622725272100/,,0,0,True
全球约一半肝癌在中国，再次提醒：家中的4种食物，尽早撤下餐桌,2024-08-13 08:36,90823,3453,梁医学社梁怡璋医生,梁医学社梁怡璋医生,,https://toutiao.com/group/7402540119712629311/,,0,0,True
罕见！100年前，英国游客拍下的清朝乡村，和想象中完全不一样,2024-09-20 02:07,1418,172,万物知识局,万物知识局,泥泞的土路，衣不蔽体的老百姓，即便是达官显贵的家中也十分破败，而这些都是清王朝的历史痕迹，虽说那时候中国摄影技术并不发达，但也有许多外国游客来到这里，拍摄下了许多老照片，为我们留下了珍贵的历史资料，那清朝到底是怎样的面貌呢?,https://toutiao.com/group/7416287738871267855/,,0,0,False
表面是艺人，实际是富家千金的5位女星，无人敢惹更别说潜规则了,2024-08-28 02:06,5775,424,八号探秘人,八号探秘人,在德云班主郭德纲的作品中，有过这么一句话。虽说此言尤为刺耳，但话糙理不糙。当今娱乐圈，很多女星为出人头地，自愿或被迫做出违反道德底线之事。,https://toutiao.com/group/7407984985224872459/,,0,0,False
姑娘远嫁山东十年未回家，带着孩子偷偷回娘家，到家眼前一幕哭了,2024-09-09 08:25,19901,8632,小乔家里的事,小乔家里的事,,https://toutiao.com/group/7412556561718968870/,,0,0,True
