title,publish_time,like_count,comment_count,media_name,source,abstract,article_url,tag,is_yaowen,article_sub_type,has_video
赖清德讲话积极作用，促两岸加速统一,2024-10-10 17:54,16479,1689,司马南,司马南,"马英九呼吁赖清德，立即冷静下心来，悬崖勒马，以全体台湾人民的幸福为念，放弃荒谬的“新两国论”，不要为了个人错误的意识形态再让全体台湾人民陷入险境。
乌克兰毁掉自己，把俄国拖下水。
有乌克兰的例子在先，居然还要这么做。
#马英九怒批赖清德# #国台办批驳赖清德#",https://toutiao.com/group/7424206813735682594/,,0,0,True
全红婵采访界的搞笑女，奶声奶气，好解压好治愈，听10遍都不腻,2024-08-25 10:11,5398,903,木子说事,木子说事,,https://toutiao.com/group/7407017722083476002/,,0,0,True
今天才知道！电动车“每天充”和“用完再充”，到底哪个更伤电池,2024-08-27 11:19,10511,1975,鲸探所,鲸探所,“今天到底给车充不充电？”估计大多数人每天回家都会想这个问题，看着自己的电动车电量又多又少的，充不充电也是一件非常难以抉择的事情。那么，电动车到底应该怎样充电呢？是每天都充，还是用完之后再充呢？电动车充电不管是在城市还是农村，电动车其实都是人们出门最常见的交通工具。,https://toutiao.com/group/7407773012533117475/,,0,0,False
万万没想到，35岁杨颖兜兜转转干回“老本行”，活成内娱最大笑话,2024-09-06 07:55,535,137,读万卷书的张飞,读万卷书的张飞,文l张飞编辑l张飞曾经你看不起别人；如今谁又瞧得上你？在节目中丝毫不考虑他人状态，一味地只追求自己的镜头。甚至还在采访中公然表示“自己早就应该把所有奖拿了个遍了”。更关键的是丝毫没有任何“报恩”之心。所以如今曾经所有的“嚣张”“高高在上”遭到反噬，只能说现在谁还“愿意”认识她！,https://toutiao.com/group/7411434661014012456/,,0,0,False
15年前他在爱妻葬礼上哭到昏厥，发誓永不再娶，如今他做到了吗？,2024-08-24 02:17,11955,338,八号探秘人,八号探秘人,在阅读此文之前，辛苦您点击一下“关注”，既方便您进行讨论和分享，又能给您带来不一样的参与感，感谢您的支持！编辑丨xk纵观鱼龙混杂的娱乐圈，有人背叛，有人痴情。而果靖霖则是公认的好男儿，将一生都奉献给妻子。但妻子却仅仅陪他走了半生，没能战胜病魔，不幸离开人世。,https://toutiao.com/group/7406210316734710283/,,0,0,False
写歌30年穷困潦倒，前妻失望选择离婚，谁料51岁靠一首歌一夜成名,2024-08-12 03:37,25766,4237,八号探秘人,八号探秘人,在阅读此文之前，辛苦您点击一下“关注”，既方便您进行讨论和分享，又能给您带来不一样的参与感，感谢您的支持！编辑：LY无数人都想要一个一夜成名的机会，但机会来了也不是每个人都能把握住的。他用了三十年的时间来准备迎接属于自己的机会。为了这个机会他放弃了一切，甚至包括家庭。,https://toutiao.com/group/7402090890367484428/,,0,0,False
她是央视最惨主持人，男友被判死缓，丈夫诈骗入狱，47岁无人敢娶,2024-08-27 23:30,2209,208,闻书识焉,闻书识焉,她曾是央视的台柱子，和董卿、周涛并称为央视的三朵金花。回顾刘芳菲的前半生，最令人感到惋惜的，便是她的感情生活，47岁至今无人敢娶。,https://toutiao.com/group/7407743113688564258/,,0,0,False
“五常”变“六常”？美俄达成一致，中方讲明标准，印度认清现实,2024-10-10 00:17,3026,439,全荃,全荃,美国频频提及改革，企图扩大安理会常任理事国席位，这一提议牵动着全球神经。对此，中方讲明标准，印度不得不认清现实。,https://toutiao.com/group/7423934431829787199/,,0,0,False
以军猛轰多国哨所，中国维和部队自卫权引发全球热议浪潮,2024-10-14 01:26,167,133,香蕉玻璃,香蕉玻璃,维和部队的“布娃娃”困境：维和士兵难道只能挨打不还手？联合国维和部队，这一和平象征，现如今却被推到了舆论的风口浪尖上。中国维和士兵提出自卫权，引发了全球一片热议。问题的焦点在于：这些身披蓝盔的士兵们到底应不应该还手？,https://toutiao.com/group/7425431530887004672/,,0,0,False
以色列杀红眼了，中国维和部队最新发声！,2024-10-13 17:33,4904,3503,四川观察,四川观察,以色列可以说是真的杀红了眼。先是6颗航弹在中国驻黎巴嫩维和部队营区外爆炸，虽然没有造成人员伤亡，但对营区造成了严重破坏，严重威胁到维和官兵的安全。紧接着，以色列对联合国驻黎巴嫩维和部队（以下简称“联黎部队”）发起了数次袭击，手段之残忍、计划之周密，令人发指。,https://kscgc.scgchc.com/sctv/h5/v7/newsShare.html?id=1845486002538672130,,0,0,False
民间上坟传统：“上坟不带 5 果，家中不惹灾祸”，哪“5果”？,2024-08-08 10:30,12194,1456,惠农圈,惠农圈,在中国传统文化中，祭祀祖先一直是一项备受重视的活动，它承载着对先人的缅怀、敬意和感恩之情。在上坟的时候，人们会提前准备好供品，比如肉类、酒水，还有水果。其中关于水果的准备，也有着诸多的讲究和禁忌，比如“上坟不带 5 果，家中不惹灾祸”的说法。,https://toutiao.com/group/7400584207141192207/,,0,0,False
5年前站在美国军舰上，用中文警告我国海军的华人女兵，现在如何,2024-10-06 09:06,1705,228,陈志华观天下,陈志华观天下,2019年，华裔女兵郑浩儿站在一艘美国军舰上，用一口标准的中文喊话威胁中国海军:“我们只是正常巡视，再往前一步，我们不介意发动战争!”,https://toutiao.com/group/7422585983588024883/,,0,0,False
如果取消城管，人员何去何从了？,2024-09-13 12:02,422,314,大气枫叶z,大气枫叶z,如果取消城管，您认为城市会脏乱差吗？城管自主择业您怎么看？,https://toutiao.com/group/7414092734614471168/,,0,0,False
2005年高秀敏家中猝死，13年后情人揭露真相：撒谎把命搭进去了,2024-10-09 01:07,1165,153,赫薰辞,赫薰辞,可惜在05年的时候，高秀敏因为心脏病意外去世，被发现时已经死亡一天，也正因如此，不少人怀疑高秀敏的死亡有蹊跷。,https://toutiao.com/group/7422913625783878180/,,0,0,False
村主任撞死村官赔650万后死刑改判15年，遇害者女儿：我不想要钱,2024-10-14 02:45,279,111,河南商报,河南商报,九派新闻消息，父亲的案件结束一周后，刘晴（化名）得知判决结果。5年前，她的父亲、华埠村村主任，被塘坊村31岁的村主任陈某驾车撞死。两年后，株洲市中级人民法院（以下简称“株洲中院”）一审判决，陈某因故意杀人罪被判处死刑。2023年，该判决结果被上级法院裁定撤销原判，发回重审。,https://toutiao.com/group/7425456935438352930/,,0,0,False
