title,publish_time,like_count,comment_count,media_name,source,abstract,article_url,tag,is_yaowen,article_sub_type,has_video
黎智英香港出庭抖内幕，美国介入，蔡英文参与，还有赵少康金小刀,2024-11-27 09:24,31207,2004,邱毅台湾,邱毅台湾,,https://toutiao.com/group/7441887559757595190/,,0,0,True
包厢全是刚出狱的恶霸，结果一看到饭店主厨，立马怂了,2024-11-11 01:21,8961,184,乐视群星访谈秀,乐视群星访谈秀,,https://toutiao.com/group/7435825833048015400/,,0,0,True
67岁执意生娃，如今却坐轮椅无法自理，5岁的天赐被迫独立学洗衣,2024-11-04 10:32,6584,1552,睿之悦,睿之悦,2019年，已经67岁的田新菊执意生下了自己的第三个孩子小天赐。那么，现如今5年的时间过去了，这“天赐”的礼物到底是福还是祸呢?,https://toutiao.com/group/7433367394946384435/,,0,0,False
女友怀孕了，男友不装了，带她回豪宅！,2024-11-23 08:01,7244,636,乐视大综艺咖,乐视大综艺咖,,https://toutiao.com/group/7440353629540483593/,,0,0,True
广西49岁老汉娶19岁姑娘，结婚21年生下15个孩子，如今有何下场？,2024-10-20 08:32,4664,623,艺述史,艺述史,她19岁出嫁，21年里总共生育了15个孩子，其中4个男孩子11个女孩子，家里热闹的像是开了一所学校一样。,https://toutiao.com/group/7427400319418384948/,,0,0,False
美国准备抽身了？俄乌结局将至，欧洲何去何从，对中国有何影响？,2024-11-28 07:50,21072,226,邱震海,邱震海,,https://toutiao.com/group/7442234324528661044/,,0,0,True
1米3袖珍美女嫁给1米48男孩，婚后丈夫奇迹长高，两人却不欢而散,2024-09-07 02:55,6477,341,睿之悦,睿之悦,杨萍和葛存苗的婚礼 文|睿之悦 编辑|睿之悦2019年，成都的民政局来了两个“10岁小孩”来登记，工作人员以为是玩闹。两个“小孩”拿出身份证让工作人员看，这才明白，原来是两个再也长不高的成年袖珍人情侣。,https://toutiao.com/group/7411713833267364386/,,0,0,False
警惕“先用后付”小心欠下账单～（央视频号：光华路资讯）,2024-11-27 12:44,13170,4957,央视频,央视频,,https://toutiao.com/group/7441939150552433179/,,0,0,True
罕见！100年前，英国游客拍下的清朝乡村，和想象中完全不一样,2024-09-20 02:07,7890,719,万物知识局,万物知识局,泥泞的土路，衣不蔽体的老百姓，即便是达官显贵的家中也十分破败，而这些都是清王朝的历史痕迹，虽说那时候中国摄影技术并不发达，但也有许多外国游客来到这里，拍摄下了许多老照片，为我们留下了珍贵的历史资料，那清朝到底是怎样的面貌呢?,https://toutiao.com/group/7416287738871267855/,,0,0,False
包菜炒粉条，切记不要焯水和直接下锅，教你一招，清脆爽口不出水,2024-11-11 11:50,6718,329,家常的味道,家常的味道,,https://toutiao.com/group/7435987746101690930/,,0,0,True
炸萝卜丸子到底用面粉还是淀粉，教你正确做法，外焦里嫩，太香了,2024-10-26 09:25,12628,830,家常的味道,家常的味道,,https://toutiao.com/group/7430012978277122611/,,0,0,True
马龙在台湾被包围!,2024-11-28 11:47,2364,148,吴东昇台湾蓝绿红,吴东昇台湾蓝绿红,,https://toutiao.com/group/7442295423428985363/,,0,0,True
郭有才：当迷失方向忘记初心后，曾经飘得多高，如今摔得就多惨,2024-11-11 06:53,1246,616,八号探秘人,八号探秘人,在阅读此文之前，辛苦您点击一下“关注”，既方便您进行讨论和分享，又能给您带来不一样的参与感，感谢您的支持！编辑丨brt因为一首翻唱，他一夜之间成为了拥有千万粉丝的网红。但是“人红是非多”，不久他就因为版权等问题陷入了舆论风波。他的人气一落千丈，从万众瞩目变成了现在的无人问津。,https://toutiao.com/group/7435901170239078948/,,0,0,False
刚从中国返俄，苏-57飞行员传来新消息,2024-11-25 10:15,7504,247,环球时报新媒体,环球时报新媒体,刚从中国返俄，苏-57飞行员传来新消息,https://toutiao.com/group/7441158524530328127/,,0,0,True
军官被逼相亲，没想到看了一眼女方相貌，当场沦陷了,2024-10-31 16:01,5136,633,PP宫斗放映厅,PP宫斗放映厅,,https://toutiao.com/group/7431881223405830665/,,0,0,True
“内蒙古警察枪击案”重审：正当防卫还是故意杀人？,2024-11-28 15:41,218,146,新京报,新京报,11月26日，内蒙古自治区乌兰察布市中级人民法院借用卓资县人民法院法庭，对内蒙古四子王旗公安局原副局长邢志强1995年涉嫌故意杀人一案重审开庭，庭审持续了两日。,https://m.bjnews.com.cn/detail/1732808462168660.html,,0,0,False
1.91米的“女神”，开启新身份,2024-11-21 08:37,1893,122,环球人物杂志,环球人物杂志,“排球绝不仅仅是我以前在赛场上看到的那一种模样。”作者：陈佳莉今年9月，奥运冠军惠若琪迎来了属于自己的第一个教师节。从南京师范大学博士毕业后，因为延续着对排球的热爱，惠若琪选择留校任教。对于曾站上过梦想的世界之巅，也体验过手术台上与死神擦肩而过的她来说，讲台成为最新的“赛场”。,https://toutiao.com/group/7439648518744113683/,,0,0,False
弟弟光荣退伍，姐姐兴奋去车站接他，怎料一见弟弟瞬间哭了,2024-11-05 06:34,27413,2799,乐视天天剧好看,乐视天天剧好看,,https://toutiao.com/group/7433679820573934091/,,0,0,True
体感温度-30度的一天，生活在内蒙牧区的，我们是怎么度过的,2024-11-26 11:28,7174,1083,河南姑娘远嫁在内蒙,河南姑娘远嫁在内蒙,,https://toutiao.com/group/7441548328887648819/,,0,0,True
特务男扮女装混进村子，孩子兵顿时发现不对劲，这下精彩了,2024-10-28 06:09,6700,649,乐视群星访谈秀,乐视群星访谈秀,,https://toutiao.com/group/7430704630294413878/,,0,0,True
从“抛弃”到“香饽饽”，发展迅猛！我国可持续航空燃料产量潜力大,2024-11-24 07:01,1590,129,国际在线,国际在线,,https://crionline-media.cri.cn/cb5a6d96-d0c4-4fd0-a895-b6135667d84a/video/bffc92277d6b4ff5aff857474a3d4437.mp4,,0,0,True
基本养老金将在2035年耗尽？社保专家回应,2024-11-28 08:17,521,639,大河报,大河报,界面新闻记者 | 苗艺伟界面新闻编辑 | 江怡曼近年来，多家相关机构曾经发布报告，称我国基本养老金将要在2029年或者2035年耗尽累计结余。因此，80、90后很可能成为无养老金可领的一代。然而，上述说法却遭到了社保养老金专家金维刚的坚决否认。,https://toutiao.com/group/7442241302269411879/,,0,0,False
央视曝光！#制假售假“一条龙”！,2024-11-24 12:16,4413,1754,央视财经,央视财经,,https://toutiao.com/group/7440818726712115762/,,0,0,True
