title,publish_time,like_count,comment_count,media_name,source,abstract,article_url,tag,is_yaowen,article_sub_type,has_video
有人冒充我男朋友，算不算诈骗？遇到奇葩事你会怎么办？,2024-09-06 05:52,1701,225,兴凯湖莹莹,兴凯湖莹莹,,https://toutiao.com/group/7411404025502892554/,,0,0,True
土豆搭配洋葱，教你一个神仙吃法，一次3斤不够吃，太解馋了,2024-09-26 09:09,21092,1306,家常的味道,家常的味道,土豆搭配洋葱，教你一个神仙吃法，一次3斤不够吃，太解馋了,https://toutiao.com/group/7418876506660667904/,,0,0,True
万万没想到，35岁杨颖兜兜转转干回“老本行”，活成内娱最大笑话,2024-09-06 07:55,534,137,读万卷书的张飞,读万卷书的张飞,文l张飞编辑l张飞曾经你看不起别人；如今谁又瞧得上你？在节目中丝毫不考虑他人状态，一味地只追求自己的镜头。甚至还在采访中公然表示“自己早就应该把所有奖拿了个遍了”。更关键的是丝毫没有任何“报恩”之心。所以如今曾经所有的“嚣张”“高高在上”遭到反噬，只能说现在谁还“愿意”认识她！,https://toutiao.com/group/7411434661014012456/,,0,0,False
一巴掌的代价，公交车上大妈打晕患癌小伙，断送退休后的幸福生活,2024-10-14 09:53,838,493,客观听書,客观听書,公交车上老太太和小伙吵了起来，老太太更是当仁不让直接给了小伙一巴掌。这名小伙直接倒地，老大大根本就不会想到正是因为他的一巴掌，鲜活的生命就这样消失在他的手里。,https://toutiao.com/group/7425563455358468627/,,0,0,False
"金正恩""震怒开炸""！朝韩引爆开战危机，朝鲜半岛必有一战？",2024-10-15 22:00,2290,103,黄阿原,黄阿原,,https://toutiao.com/group/7425952850519261706/,,0,0,True
她是央视最惨主持人，男友被判死缓，丈夫诈骗入狱，47岁无人敢娶,2024-08-27 23:30,2241,209,闻书识焉,闻书识焉,她曾是央视的台柱子，和董卿、周涛并称为央视的三朵金花。回顾刘芳菲的前半生，最令人感到惋惜的，便是她的感情生活，47岁至今无人敢娶。,https://toutiao.com/group/7407743113688564258/,,0,0,False
翟天临：我这辈子最正确的决定，就是退圈前，与辛芷蕾在一起了,2024-08-31 05:46,1043,591,八号探秘人,八号探秘人,“好多人都放弃了我，辛芷蕾没有......”圈内好友纷纷隐身，生怕舆论波及自身，但辛芷蕾却是个例外。即便赌上事业，也要与翟天临相濡以沫，一起承受流言蜚语。,https://toutiao.com/group/7409131751957611008/,,0,0,False
中国海军三艘航母同时出海，史无前例的一幕，让美国产生警惕,2024-10-17 01:04,1426,105,大国纪录,大国纪录,近日，我国海军以一种前所未有的方式向世界展示了自己的实力。辽宁舰、山东舰、福建舰，我国的三艘航母同时出海了！这一幕，让国人为之振奋。,https://toutiao.com/group/7426544218522255912/,,0,0,True
15年前他在爱妻葬礼上哭到昏厥，发誓永不再娶，如今他做到了吗？,2024-08-24 02:17,14775,464,八号探秘人,八号探秘人,在阅读此文之前，辛苦您点击一下“关注”，既方便您进行讨论和分享，又能给您带来不一样的参与感，感谢您的支持！编辑丨xk纵观鱼龙混杂的娱乐圈，有人背叛，有人痴情。而果靖霖则是公认的好男儿，将一生都奉献给妻子。但妻子却仅仅陪他走了半生，没能战胜病魔，不幸离开人世。,https://toutiao.com/group/7406210316734710283/,,0,0,False
韩国2024年10月1日举行大阅兵，韩国网友惊呼：世界第一！,2024-10-15 07:13,577,451,小君君搞笑,小君君搞笑,,https://toutiao.com/group/7425897077194654227/,,0,0,True
山西6岁女孩遭7名同学群殴致满嘴是血，父亲：不追究，不要一分钱,2024-10-17 01:18,151,367,晨光曦语,晨光曦语,山西6岁女孩遭群殴山西晋中，一名年仅六岁的小女孩在学校内遭到七名同学的群殴，导致满嘴是血，门牙脱落，这一事件迅速在网上发酵，引起了社会各界的广泛关注。,https://toutiao.com/group/7426542909161325056/,,0,0,False
写歌30年穷困潦倒，前妻失望选择离婚，谁料51岁靠一首歌一夜成名,2024-08-12 03:37,26034,4327,八号探秘人,八号探秘人,在阅读此文之前，辛苦您点击一下“关注”，既方便您进行讨论和分享，又能给您带来不一样的参与感，感谢您的支持！编辑：LY无数人都想要一个一夜成名的机会，但机会来了也不是每个人都能把握住的。他用了三十年的时间来准备迎接属于自己的机会。为了这个机会他放弃了一切，甚至包括家庭。,https://toutiao.com/group/7402090890367484428/,,0,0,False
中日已谈妥，当着我高层的面，石破茂连做3项保证，信号极不寻常,2024-10-15 08:52,2436,632,议史纪,议史纪,,https://toutiao.com/group/7425922725736088103/,,0,0,True
原来他才是毁掉刘翔真凶，因贪1200万被公审，让刘翔背负多年骂名,2024-08-29 09:58,11615,347,八号探秘人,八号探秘人,在田径场上创造的成绩，至今无人能够打破，甚至在国际上享有盛名。本该继续夺冠之路，却两次因伤退赛，遭到了全网辱骂。,https://toutiao.com/group/7408489498465616410/,,0,0,False
梅艳芳100岁母亲被申请破产！嫌每月23万元不够用，曾试图一次性取出7100万遗产,2024-10-16 22:31,1567,1736,上观新闻,上观新闻,据港媒15日报道，梅艳芳的100岁母亲覃美金因拖欠诉讼费被起诉，律政司司长申请梅妈破产。据悉，梅艳芳2003年去世后留下4条遗嘱，梅妈每月可领7万生活费，在其去世之后剩余的财产将被捐出。,https://export.shobserver.com/toutiao/html/807883.html,,0,1,False
全球约一半肝癌在中国，再次提醒：家中的4种食物，尽早撤下餐桌,2024-08-13 08:36,102643,3533,梁医学社梁怡璋医生,梁医学社梁怡璋医生,,https://toutiao.com/group/7402540119712629311/,,0,0,True
这一次，被批“不男不女”的毕凌，把父亲毕福剑的体面撕的稀碎,2024-08-31 05:00,684,194,卿羽飞,卿羽飞,曾经的《星光大道》是多少人童年时最喜欢看的综艺节目，捧红了非常多的草根艺人，让他们能够实现自己的梦想。,https://toutiao.com/group/7409154770201559591/,,0,0,False
今天才知道！电动车“每天充”和“用完再充”，到底哪个更伤电池,2024-08-27 11:19,11897,2150,鲸探所,鲸探所,“今天到底给车充不充电？”估计大多数人每天回家都会想这个问题，看着自己的电动车电量又多又少的，充不充电也是一件非常难以抉择的事情。那么，电动车到底应该怎样充电呢？是每天都充，还是用完之后再充呢？电动车充电不管是在城市还是农村，电动车其实都是人们出门最常见的交通工具。,https://toutiao.com/group/7407773012533117475/,,0,0,False
演员张瑜：离婚后单身30年，再见前夫仍感到心动，66岁没有子女,2024-07-24 10:51,20780,1423,八号探秘人,八号探秘人,在阅读此文之前，辛苦您点击一下“关注”，既方便您进行讨论和分享，又能给您带来不一样的参与感，感谢您的支持！写作不易，作者每天辛苦写稿，只是为了养家糊口，希望各位观众老爷可以多多理解。文中加入5秒广告解锁，观看5秒后便可免费阅读全文啦，感谢各位观众老爷的理解与支持！,https://toutiao.com/group/7395130917804720640/,,0,0,False
