title,publish_time,like_count,comment_count,media_name,source,abstract,article_url,tag,is_yaowen,article_sub_type,has_video
邱毅教授讲述湾湾领导人刚刚经历的事，太丢人了！,2025-01-24 00:01,10081,170,知非,知非,,https://toutiao.com/group/7463265216126517760/,,0,0,True
公公竟然和儿媳偷情，哪料被妻子撞见，这下有戏看了！,2025-01-21 08:05,6315,615,南瓜午夜厅,南瓜午夜厅,,https://toutiao.com/group/7462273852651979274/,,0,0,True
1998年录像，大陆机长携妻劫机逃往台湾省，空中遭遇战机拦截,2025-01-23 11:15,11082,1485,西溪历史,西溪历史,1998年袁斌劫机逃往台湾,https://toutiao.com/group/7462974224857940519/,,0,0,True
华为200万年薪都留不住他！天才少年彭志辉离职后，现状曝光,2025-01-16 09:28,1330,134,与君説,与君説,在阅读此文之前，麻烦您点击一下“关注”，既方便您进行讨论和分享，又能给您带来不一样的参与感，感谢您的支持文、编辑|小娄你敢相信吗？大厂华为200万年薪的工作，竟然也有人不屑一顾。入职华为两年后，彭志辉毅然决然选择离职。,https://toutiao.com/group/7460439446131884579/,,0,0,False
三哥放炮，一顿操作打偏了！网友：这配乐，绝了！打正了就怪了！,2025-01-11 04:14,62545,36956,迷彩洞察站,迷彩洞察站,,https://toutiao.com/group/7458296459483349519/,,0,0,True
加州大火这是又烧起来了 一波未灭一波又起,2025-01-23 09:14,5009,303,布林结,布林结,,https://toutiao.com/group/7463036931522167350/,,0,0,True
恒大歌舞团团长白珊珊删除恒大标签，准备进军网红界，焕然一新！,2025-01-19 15:21,2529,722,秋秋酱说剧,秋秋酱说剧,,https://toutiao.com/group/7461301881088868899/,,0,0,True
记者问，你认为多长时间才能结束俄乌冲突,2025-01-22 09:39,10033,1736,文不加点,文不加点,,https://toutiao.com/group/7462671992337236543/,,0,0,True
女房东爱上24岁男租客，这样的话也说得出口，涂磊神助攻,2025-01-18 02:53,4213,205,金曲大荟萃,金曲大荟萃,女房东爱上24岁男租客，这样的话也说得出口，涂磊神助攻,https://toutiao.com/group/7461083095078044195/,,0,0,True
恒大歌舞团白珊珊，许老板进去以后，她为何火急火燎的结婚了？,2025-01-22 08:04,3337,729,秋秋酱说剧,秋秋酱说剧,,https://toutiao.com/group/7462476643894919719/,,0,0,True
男人目睹了妻子的偷情，下一秒情夫和妻子就遭到了他的制裁！,2025-01-23 09:05,3798,323,橙子影视吖6,橙子影视吖6,,https://toutiao.com/group/7463034403476734527/,,0,0,True
地铁一女子拿背包占座，乘务员沟通半天无果，邻座大妈突然出手！,2025-01-22 02:03,6162,2700,客家林胖哥,客家林胖哥,南京地铁上一女子把背包放到座位上，另外一个站点有乘客上车想座这个位置，结果背包的主人说“这是我放包的，你人不能站着吗”？女乘客就叫来了乘务员，可是乘务员沟通半天女子就是不愿意把背包放地上。最后，邻座的大妈实在看不下去，一把把女子的背包给抓起来丢地上，她一屁股坐过去，然后把她的位置让给这个乘客，大妈那个动作真的太帅了！！,https://toutiao.com/group/7462554677310210623/,,0,0,True
