title,publish_time,like_count,comment_count,media_name,source,abstract,article_url,tag,is_yaowen,article_sub_type,has_video
习言道｜同发展、共繁荣的道路必将越走越宽广,2024-12-17 01:53,1606,1577,中国新闻网,中国新闻网,今年，是澳门回归祖国25周年。澳门以前所未有的发展奇迹，向世界展示了具有澳门特色“一国两制”的成功实践。自澳门回归以来，习近平曾数次到访澳门，心系澳门同胞福祉、牵挂着澳门发展。,https://www.chinanews.com.cn/gn/shipin/cns/2024/12-17/news1008014.shtml,,0,0,False
李在明悬了？韩东勋成下任韩国总统黑马，这个年轻人不简单！,2024-12-16 22:01,7623,301,黎建南台湾,黎建南台湾,,https://toutiao.com/group/7449133132277613106/,,0,0,True
中国公开高超音速飞行器，速度6.56马赫，一夜之间要翻盘子？,2024-12-16 14:05,10414,555,陈虎点兵,陈虎点兵,,https://toutiao.com/group/7449010500773347890/,,0,0,True
中央定调！2025年养老金迎来新调整，退休新规实施，还有个好消息,2024-12-14 00:24,6628,577,思之想之,思之想之,2025年马上就要来了，这是一个充满变化的关键的年份，这是十四五规划的最后一年，很多政策将会兑现。2025年，除了养老金继续用来调整之外，退休新规也将会正式实施，还有一个好消息，具体是什么呢?,https://toutiao.com/group/7448052182332473867/,,0,0,False
这事儿，深圳碾压美国,2024-12-16 13:50,10207,304,静思有我,静思有我,,https://toutiao.com/group/7449006742492414505/,,0,0,True
2025年春节将至，社会上出现了“三大反常”现象，你发现了吗？,2024-12-11 14:19,504,103,水大叔,水大叔,2025年春节将至，社会上出现了“三大反常”现象，你发现了吗？在我国有很多传统节日，不同的小动物节日也代表着不同的寓意，在这些传统节日当中，春节绝对算得上是一个至关重要的节日了。,https://toutiao.com/group/7447156563485229568/,,0,0,False
女友怀孕了，男友不装了，带她回豪宅！,2024-11-23 08:01,15851,1197,乐视大综艺咖,乐视大综艺咖,,https://toutiao.com/group/7440353629540483593/,,0,0,True
普京宣布全线反击，覆盖军事文化等4大领域,2024-12-16 06:35,6916,103,路路观察室,路路观察室,日前，普京通电全国并反复提及一个词，意义重大，在这个关键时刻，中国也已经收到来自普京的求援。,https://toutiao.com/group/7448894526669718031/,,0,0,True
个人养老金制度推行将带来哪些影响？一文解读,2024-12-13 03:32,1977,789,国际在线,国际在线,,https://crionline-media.cri.cn/cb5a6d96-d0c4-4fd0-a895-b6135667d84a/video/40d1574ab9094c2c91da2c53e8db16ca.mp4,,0,0,True
多次删减，这部满是禁忌的国产片，能上映真不容易！,2024-12-13 09:58,2921,148,越哥说电影,越哥说电影,,https://toutiao.com/group/7447833700995170856/,,0,0,True
著名空间物理学家和空间天气学家张效信遭遇交通事故逝世，享年62岁,2024-12-17 06:22,1498,4719,九派新闻,九派新闻,12月17日，据“空间天气”微信公众号消息，国家卫星气象中心（国家空间天气监测预警中心）发布讣告：著名空间物理学家和空间天气学家、国家卫星气象中心（国家空间天气监测预警中心）研究员张效信博士，因遭遇交通事故，于2024年12月15日18时58分在北京逝世，享年62岁。,https://toutiao.com/group/7449260579505668658/,,0,0,False
俄博主盛赞朝鲜士兵，行动迅速作战凶猛，跟俄军表现完全不一样,2024-12-16 11:13,9852,1177,杜文龙,杜文龙,,https://toutiao.com/group/7448966209216709156/,,0,0,True
车晓谈前夫李兆会：世上除了我妈他最爱我，但他的爱令我无法承受,2024-09-21 06:26,2673,566,八号探秘人,八号探秘人,200辆迎亲车、500桌流水席，价值20万的黄金项链，没什么作品的她成了娱圈人人羡慕的对象。成龙做媒、嫁身价40亿山西最年轻首富，走上人生巅峰的她不料却迅速跌入谷底。,https://toutiao.com/group/7416978879144788530/,,0,0,False
广西49岁老汉娶19岁姑娘，结婚21年生下15个孩子，如今有何下场？,2024-10-20 08:32,7851,948,艺述史,艺述史,她19岁出嫁，21年里总共生育了15个孩子，其中4个男孩子11个女孩子，家里热闹的像是开了一所学校一样。,https://toutiao.com/group/7427400319418384948/,,0,0,False
弟弟光荣退伍，姐姐兴奋去车站接他，怎料一见弟弟瞬间哭了,2024-11-05 06:34,36568,3131,乐视天天剧好看,乐视天天剧好看,,https://toutiao.com/group/7433679820573934091/,,0,0,True
曹德旺预言：2025年，没有买房的人，五年后是失败者还是幸运儿？,2024-12-16 05:57,3806,1460,议史纪,议史纪,其实早在多年前年，“玻璃大王”曹德旺就曾预言:“房地产将成为有钱人击鼓传花的游戏”，房子就是钢筋混凝土，是不会保值的?,https://toutiao.com/group/7448883228297003539/,,0,0,False
河南警察3岁女儿被拐，苦寻全国23年无果，结果却发现女儿在对门,2024-11-05 07:43,4445,511,八号探秘人,八号探秘人,寻亲23年无果，丢失的女儿竟住在对门?但它却真实发生在河南洛阳的梁绍波身上。是意外走丢，还是人贩子所为，三岁的女儿怎会离奇失踪?,https://toutiao.com/group/7433697108120142345/,,0,0,False
夫妻俩5年生下6个孩子，上台场面热闹非凡，连杨帆都看得目瞪口呆,2024-12-01 07:36,7858,501,山西广电文娱,山西广电文娱,,https://toutiao.com/group/7443344028558426662/,,0,0,True
这是非洲的五菱汽车，是个人都能造车，百公里仅需三个馒头,2024-12-11 16:07,4512,599,百家纪实,百家纪实,,https://toutiao.com/group/7447140344900092442/,,0,0,True
李建平被执行死刑,2024-12-17 05:42,418,336,环球时报,环球时报,经最高人民法院核准，2024年12月17日上午，内蒙古自治区兴安盟中级人民法院依法对李建平执行了死刑。李建平二审庭审现场。,https://toutiao.com/group/7449251413655765558/,,0,0,False
明确了！2025年养老金实现双增长，三类人可以多涨，两类人不涨,2024-12-15 05:23,1191,327,社保当家,社保当家,明确了！2025年养老金实现双增长，三类人可以多涨，两类人不涨在2025年到来之前，关于养老金上涨的消息就已经明确，中央经济工作会议给退休人员送上了一个大大的惊喜。2025年，养老金将继续实现双增长，不过有三类人可以多涨，两类人不涨，一起来看看。,https://toutiao.com/group/7448496604800762394/,,0,0,False
清华学生会主席发言，全程脱稿，谈笑自若，掌控全场，后生可畏,2024-12-11 03:58,31500,3064,大通教育课堂,大通教育课堂,"清华大学（Tsinghua University），简称“清华”，位于北京市海淀区清华园， 由教育部与北京市重点共建，是国家教育部直属的全国重点大学，中央直管高校 ，国家首批“双一流”A类、“985工程”、“211工程”重点建设高校。 
学校入选2011计划、101计划、珠峰计划、强基计划、111计划、英才计划、卓越工程师教育培养计划，是九校联盟、松联盟、中国大学校长联谊会、亚洲大学联盟、全球大学校长论坛、环太平洋大学联盟、中俄综合性大学联盟成员，被誉为“红色工程师的摇篮”。
清华大学的前身为始建于1911年的清华学堂，1912年更名为清华学校。1928年更名为国立清华大学。",https://toutiao.com/group/7446998849107558946/,,0,0,True
莫斯科突发！他据报在爆炸中身亡,2024-12-17 06:32,431,292,环球时报,环球时报,消息称俄军高官及其助手在莫斯科居民楼爆炸事故中死亡基里洛夫 资料图当地时间17日，今日俄罗斯电视台援引消息人士的话报道称，俄罗斯莫斯科居民楼爆炸事故中的遇难者是俄罗斯武装力量辐射、化学和生物防护部队司令基里洛夫及其助手。消息人士同时透露，爆炸事件由乌克兰军方策划和实施。,https://toutiao.com/group/7449264532234551827/,,0,0,False
百亩麦田发现一条野生老黄鳝，挖开一看吓一大跳，再一次刷新记录,2024-11-26 14:34,9316,1858,户外打野阿飝哥,户外打野阿飝哥,百亩麦田发现一条野生鳝鱼王，头比鸡蛋大长二米，再一次刷新记录,https://toutiao.com/group/7441596481590526474/,,0,0,True
一个雷佳音加一个张小斐就够搞笑了，再加一个岳云鹏，这段能笑死,2024-10-23 05:10,9352,706,颜小羽,颜小羽,,https://toutiao.com/group/7428834244249518604/,,0,0,True
只发行了660枚的麦穗五角，一枚46200元！千万别花掉了,2024-11-20 13:06,12393,4220,小hua聊收藏,小hua聊收藏,五角硬币大家并不陌生，市面上常见的有荷花五角，在这之前的梅花五角已经很少见了。细数钱币发行以来，发行过长城五角，梅花五角，金、白荷花五角，那么对比起来哪个更值钱呢。,https://toutiao.com/group/7439293128831484453/,,0,0,False
一个敢坐，一个敢开，当走到河中心那一刻，我算是彻底服了,2024-12-17 02:00,2616,476,趣观世界,趣观世界,一个敢坐，一个敢开，当走到河中心那一刻，我算是彻底服了,https://toutiao.com/group/7446853023407538751/,,0,0,True
又逼疯一个，都开始当街跳舞了,2024-11-24 22:23,73473,20493,玺蓥天下,玺蓥天下,,https://toutiao.com/group/7440974951316488755/,,0,0,True
赵本山买鸡这段，据说导演组都笑趴了，真是老戏骨,2024-11-04 06:23,2910,270,PP大咖剧院,PP大咖剧院,,https://toutiao.com/group/7433305507969892927/,,0,0,True
中央定调！2025年养老金确定上涨，1954年前出生多涨养老金吗？,2024-12-16 08:40,1465,237,思之想之,思之想之,新年新气象，中央已经提前定调，2025年养老金确实上涨，将会惠及1.4亿多企业和机关事业单位退休人员。有退休人员关心，2025年养老金确定上调，高龄退休人员会不会享受倾斜调整？1954年以前出生的退休人员，可以多涨养老金吗？,https://toutiao.com/group/7448919838451401255/,,0,0,False
中央定调！2025年养老金双增长，养老金领取条件有变，一类人不涨,2024-12-14 08:18,3605,308,思之想之,思之想之,2025年养老金调整最新消息来了，中央已经定调，2025年养老金将迎来双增长。另外提醒大家，2025年起养老金领取条件有变，一类人不参加2025年养老金调整，具体是什么呢？一起来了解。,https://toutiao.com/group/7448174128252682788/,,0,0,False
特朗普打破美国150年惯例，邀请中方出席就职典礼！没邀请普京,2024-12-13 09:36,3202,384,主持人雪莹,主持人雪莹,,https://toutiao.com/group/7447827933797810723/,,0,0,True
交通站：潘长江查郭德纲的良民证，小品对碰相声，导演都被逗乐了,2024-12-03 16:00,1757,258,PP街坊放映厅,PP街坊放映厅,,https://toutiao.com/group/7442908698684424715/,,0,0,True
这绝对是我吃过最好吃的蒜蓉蒸鸡做法,2024-11-11 12:49,3671,302,天天相见厨房(阿见),天天相见厨房(阿见),,https://toutiao.com/group/7436003114588570123/,,0,0,True
冲上热搜！千万粉丝博主B太被“围攻”，双方回应,2024-12-16 14:40,261,1062,极目新闻,极目新闻,这段经历在网上引起了大量讨论，不少网友在评论区围攻，称B太的行为存在夸大其辞，并质疑其“急性肠胃炎”另有起因。,http://jms.ctdsb.net/jmythshare/#/index_share?cId=0&contentType=5&contentId=2331047,,0,0,False
给近三年最好10部刑侦剧排个名：《我是刑警》仅第5，第1名没争议,2024-12-16 09:06,637,144,皮皮电影,皮皮电影,没想到，2024年临近末尾，国产刑侦剧却烧起了一把猛火。先是潘粤明主演的《白夜破晓》。前作《白夜追凶》曾登上网剧之巅，观众喊了7年，这部续作终于姗姗来迟。有网友感慨，当年和女友第一看第一部，第二部播出时孩子都已经上幼儿园了。随后《我是刑警》登陆央视，掀起收视热潮。,https://toutiao.com/group/7448904675966878248/,,0,0,False
邢台村民家灶台封条已撤掉，柴火灶台也已拆除，燃气公司负责人被约谈训诫,2024-12-16 13:38,239,606,大风新闻,大风新闻,12月15日，华商报大风新闻报道了河北邢台市新河县一村民家中的柴火灶，因存在安全隐患被新河县中裕燃气有限公司贴上封条，引发关注。12月16日，记者联系邢台市住建局，工作人员称此事已妥善处理，“具体是局里‘双代办’负责此事的处理。‘双代’是指‘气代煤’和‘电代煤’。,https://toutiao.com/group/7449002618275299880/,,0,0,False
罕见！秦兵马俑有新发现,2024-12-16 13:01,466,162,上观新闻,上观新闻,秦兵马俑二号坑发掘出罕见“将军俑”，专家推测为“单元最高军事指挥官”今年是秦兵马俑考古发掘50周年，记者今天从秦始皇帝陵博物院获悉，考古人员近日在秦兵马俑二号坑中发现了一尊罕见的高级军吏俑。,https://export.shobserver.com/toutiao/html/830337.html,,0,1,False
帅哥看不上相亲女，撒谎没车没房没户口，姑娘的反应绝了,2024-11-18 05:47,3635,374,乐视天天剧好看,乐视天天剧好看,,https://toutiao.com/group/7438491946131128872/,,0,0,True
3年前，宁夏7岁小女孩一笑走红，后拒百万签约，如今怎么样了？他们后悔了吗？,2024-09-19 07:25,15932,2113,睿之悦,睿之悦,2021年，视频镜头中出现的女孩儿用那一抹甜美的笑容，迅速引起了网友们的广泛关注。有媒体公司看到这一机遇，提出愿意用百万巨资与女孩儿签约，然而，女孩儿的父母却坚决拒绝了这一提议。,https://toutiao.com/group/7416250139544879679/,,0,0,False
