title,publish_time,like_count,comment_count,media_name,source,abstract,article_url,tag,is_yaowen,article_sub_type,has_video
中国首例5胞胎现状曝光：父亲过劳去世，如今22年过去，母亲竟然直言后悔……,2024-08-19 08:57,3982,1195,读者,读者,在我看来，这个故事更为让人动容的地方，是爱和责任。缴宝存殚精竭虑、省吃俭用，只为一家人撑起一片天;王翠英将5个孩子全都带在自己身边，教他们识字，教他们做人，教他们团结友爱。,https://toutiao.com/group/7404674971840086540/,,0,0,False
演员张瑜：离婚后单身30年，再见前夫仍感到心动，66岁没有子女,2024-07-24 10:51,11391,844,八号探秘人,八号探秘人,在阅读此文之前，辛苦您点击一下“关注”，既方便您进行讨论和分享，又能给您带来不一样的参与感，感谢您的支持！写作不易，作者每天辛苦写稿，只是为了养家糊口，希望各位观众老爷可以多多理解。文中加入5秒广告解锁，观看5秒后便可免费阅读全文啦，感谢各位观众老爷的理解与支持！,https://toutiao.com/group/7395130917804720640/,,0,0,False
4年骑行结束，1500天终于回到老家，感谢大家一路陪伴有缘江湖见,2024-09-07 03:50,65546,15955,刘伟元的旅行,刘伟元的旅行,4年骑行结束，1500天终于回到老家，感谢大家一路陪伴有缘江湖见！,https://toutiao.com/group/7411715839100977716/,,0,0,True
相约北京文化论坛｜雅克·马拉泰尔：我所感受到的中华文明，令我真的很乐意去探索它,2024-09-15 23:43,24700,582,北京日报客户端,北京日报客户端,,https://rss2.bjd.com.cn/content/s66e770b8e4b01a5d71c8c00d.html,,0,0,True
国务院：从2030年1月1日起将职工按月领取基本养老金最低缴费年限由十五年逐步提高至二十年 每年提高六个月,2024-09-13 06:38,8171,11611,财联社,财联社,【国务院：从2030年1月1日起将职工按月领取基本养老金最低缴费年限由十五年逐步提高至二十年 每年提高六个月】财联社9月13日电，国务院关于渐进式延迟法定退休年龄的办法发布，从2030年1月1日起，将职工按月领取基本养老金最低缴费年限由十五年逐步提高至二十年，每年提高六个月。,https://www.cls.cn/depth/1798592,,0,0,False
央视又出“黑马”剧！才播2集全国收视第一，老戏骨飙戏太炸裂！,2024-09-10 11:21,3817,551,晓瑜海棠,晓瑜海棠,剧荒怎么办？当然是看央八推出的新剧啊！7月8月暑期档，相信各位观众们已经烦透了《长相思2》、《玫瑰的故事》这类“暑期特供”无脑爱情剧。终于等到学生们开学，影视圈由央视推出年代剧《迎风的青春》带头，回到正轨。开播第一天直空降榜首不说，观众的好评更是一抓一大把。,https://toutiao.com/group/7412948016674275874/,,0,0,False
她是央视最惨主持人，男友被判死缓，丈夫诈骗入狱，47岁无人敢娶,2024-08-27 23:30,2008,206,闻书识焉,闻书识焉,她曾是央视的台柱子，和董卿、周涛并称为央视的三朵金花。回顾刘芳菲的前半生，最令人感到惋惜的，便是她的感情生活，47岁至今无人敢娶。,https://toutiao.com/group/7407743113688564258/,,0,0,False
曹德旺说：我不会逃跑，但要给政府提个醒 #曹德旺 #福耀科技大学,2024-06-28 06:51,24573,3409,正直鲸鱼LxhXfoC,正直鲸鱼LxhXfoC,,https://toutiao.com/group/7385443277144588834/,,0,0,True
如今回头看恒大，许家印是赢了还是输了？！,2024-07-29 11:03,38335,22357,缤纷海燕YrEkWp,缤纷海燕YrEkWp,,https://toutiao.com/group/7397011739571421708/,,0,0,True
2013年，湖南26岁女孩嫁给71岁老头，婚后还生下一子，如今怎样了,2024-07-12 11:59,20531,2155,智史通鉴,智史通鉴,2013年4月17日，长沙宁乡县的民政局迎来了一对特殊的夫妻。一个71岁的老头和一个26岁的女孩，离远了看，甚至像爷爷和孙女。面对工作人员异样的眼光，女孩说：“我和他是真心相爱的！”这让人好奇，这对相差45岁的夫妻，他们之间到底有着怎样的爱情故事？,https://toutiao.com/group/7390696631223534120/,,0,0,False
写歌30年穷困潦倒，前妻失望选择离婚，谁料51岁靠一首歌一夜成名,2024-08-12 03:37,18158,2997,八号探秘人,八号探秘人,在阅读此文之前，辛苦您点击一下“关注”，既方便您进行讨论和分享，又能给您带来不一样的参与感，感谢您的支持！编辑：LY无数人都想要一个一夜成名的机会，但机会来了也不是每个人都能把握住的。他用了三十年的时间来准备迎接属于自己的机会。为了这个机会他放弃了一切，甚至包括家庭。,https://toutiao.com/group/7402090890367484428/,,0,0,False
4架美机逼近辽宁舰，歼15冒暴风雨起飞，硬碰硬分出胜负,2024-09-15 06:19,3962,236,第一军情,第一军情,央视军事9月15日报道了辽宁舰航母编队在西太平洋某海域，遭到4架外方战斗机的逼近。在这个关键时刻，辽宁舰上的歼-15舰载机，冒着强对流暴风雨，挂载实弹升空，对外机进行拦截，一番“硬碰硬”后最终成功逼退外机编队。,https://toutiao.com/group/7414749448699413027/,,0,0,False
患难见真情，9艘船装载武器运往俄罗斯，俄盟友出手，美英法急了,2024-09-14 23:13,3266,163,美洲话姐,美洲话姐,作为执掌俄罗斯长达20多年的强人，普京很清楚，决定俄乌冲突走向的因素有很多，战场上的胜败得失固然重要，但战场之外的较量，同样不能忽略。,https://toutiao.com/group/7414640590115897896/,,0,0,False
5座车拉6个人被判超员，车主1句话把交警问懵,2024-08-05 20:20,7881,1794,奇妙钢笔pA8JyP,奇妙钢笔pA8JyP,,https://toutiao.com/group/7399752843772559906/,,0,0,True
“心系百姓”、“为人民服务”确确切切是件令一国总理最头痛的事,2024-09-04 04:55,278074,30753,舟曲東去西燕飛,舟曲東去西燕飛,,https://toutiao.com/group/7410647010543403554/,,0,0,True
无论炒什么肉，不要用盐和料酒腌制，大厨教我绝招，肉片滑嫩不腥,2024-07-11 08:24,74085,2948,家常的味道,家常的味道,无论炒什么肉，不要用盐和料酒腌制，大厨教我绝招，肉片滑嫩不腥,https://toutiao.com/group/7390291377185096204/,,0,0,True
秋葵的神仙吃法，比吃补药还补，做法简单，鲜香滑嫩又多汁，真香,2024-07-29 12:39,36088,3115,一画美食,一画美食,,https://toutiao.com/group/7397036492566856244/,,0,0,True
没有人敢信他是个男的，直到他说话了，绝了,2024-08-20 05:20,2567,127,经视看天下,经视看天下,,https://toutiao.com/group/7405087362341470774/,,0,0,True
今天才知道！电动车“每天充”和“用完再充”，到底哪个更伤电池,2024-08-27 11:19,2982,707,鲸探所,鲸探所,“今天到底给车充不充电？”估计大多数人每天回家都会想这个问题，看着自己的电动车电量又多又少的，充不充电也是一件非常难以抉择的事情。那么，电动车到底应该怎样充电呢？是每天都充，还是用完之后再充呢？电动车充电不管是在城市还是农村，电动车其实都是人们出门最常见的交通工具。,https://toutiao.com/group/7407773012533117475/,,0,0,False
147票压过3票，欧洲通过涉台议案，不许两岸统一，蒋万安突然离岛,2024-09-13 09:45,3727,2518,凤凰卫视金亮,凤凰卫视金亮,美欧联合阻挡中国统一，蒋万安演讲提及“一个中华”，新加坡对台发出警告，岛内表明战争担忧，美方要颠覆战后秩序吗?,https://toutiao.com/group/7414061277322838564/,,0,0,False
恭喜中国女篮新领袖终于出现了！百发百中！统治力让对手深深绝望,2024-06-25 07:11,23911,1278,乐播体育,乐播体育,,https://toutiao.com/group/7384335028576059923/,,0,0,True
张紫妍：被迫陪睡31人近百次，遭道具虐待，29岁自杀留230页遗书,2024-07-24 02:37,11147,765,八号探秘人,八号探秘人,在阅读此文之前，辛苦您点击一下“关注”，既方便您进行讨论和分享，又能给您带来不一样的参与感，感谢您的支持！本文叙述皆有官方信源，为了读者有更好体验，放在了文章后缀！,https://toutiao.com/group/7394994383675736576/,,0,0,False
表面是艺人，实际是富家千金的5位女星，无人敢惹更别说潜规则了,2024-08-28 02:06,3880,238,八号探秘人,八号探秘人,在德云班主郭德纲的作品中，有过这么一句话。虽说此言尤为刺耳，但话糙理不糙。当今娱乐圈，很多女星为出人头地，自愿或被迫做出违反道德底线之事。,https://toutiao.com/group/7407984985224872459/,,0,0,False
在外国旅行了几个月，我们终于到家了，见到孩子都激动哭了。,2024-09-14 13:15,2427,271,旅行者小多,旅行者小多,,https://toutiao.com/group/7414486686875845161/,,0,0,True
钱贝换了一身旗袍，中秋节带小年糕回安吉啦，回娘家看望外公外婆,2024-09-16 02:21,1517,186,麦小兜和钱贝,麦小兜和钱贝,,https://toutiao.com/group/7415060466923209254/,,0,0,True
又一大佬跑路！烧光62亿就跑路，令上千员工失业，投资者血本无归,2024-09-10 10:10,1383,297,云舟史策,云舟史策,遇到这样的老板你就只能哭了，有事他是真跑啊！没有任何预兆，老板就消失的无影无踪了。员工赶紧找去他的家里，豪华别墅里早就人去楼空了，只留下员工痛骂的声音在豪宅中回荡。而这位陈群老板用自己仅剩的良心留下了一张纸条。他还不上投资人的62亿，只能逃了。,https://toutiao.com/group/7412926445183336995/,,0,0,False
“三级艳后”曾拒绝成龙，如今61岁胖到220斤，依旧美到撩人心弦,2024-06-21 22:11,3806,250,梓梓珠玑,梓梓珠玑,看起来像坏女人，就一定是坏女人吗?香港女演员吴家丽，一度被称为“最美艳星”，更是一位凭借三级片获得影后的女演员。,https://toutiao.com/group/7382869368532681225/,,0,0,False
两个姑爷来农村 #农家院农家菜农家生活 #农村生活 鸡鱼招待,2024-08-07 09:04,6310,820,农民王小,农民王小,,https://toutiao.com/group/7400320946991301160/,,0,0,True
该来的还是来了,2024-08-25 23:47,986,159,牛弹琴,牛弹琴,8月25日，以色列和真主党之间，爆发了一场多年来最激烈的大战。刀光剑影，杀戮血腥，但却又极富戏剧性。,https://toutiao.com/group/7407227670834102799/,,0,0,False
为什么算命先生不认识你，却知道你家里有几口人，方法这么简单。,2024-06-19 22:16,36769,6279,幻爸短视频,幻爸短视频,,https://toutiao.com/group/7382225519021457970/,,0,0,True
坏父母：红脸先生 坏父母：红脸先生,2024-09-14 06:06,2042,413,鲤鱼Ace,鲤鱼Ace,,https://toutiao.com/group/7414376267044258323/,,0,0,True
