title,publish_time,like_count,comment_count,media_name,source,abstract,article_url,tag,is_yaowen,article_sub_type,has_video
时政微观察丨喀山之行，习主席深刻阐释“精神”和“担当”,2024-10-26 11:50,2205,1121,央视新闻,央视新闻,面对是任由世界动荡不安，还是推动其重回和平发展正道的关键抉择，习近平主席给出中国答案:“时代的风浪越大，我们越要勇立潮头，以坚韧不拔之志、敢为人先之勇、识变应变之谋，把金砖打造成促进‘全球南方’团结合作的主要渠道、推动全球治理变革的先锋力量。”,https://content-static.cctvnews.cctv.com/snow-book/index.html?item_id=16870785223407090759&source=50006&sub_source=50006_001,,0,0,False
中俄印高层在一起，莫迪竖起大拇指，中印就此翻篇？美国反应很大,2024-10-25 10:26,4828,431,田柳Talk,田柳Talk,,https://toutiao.com/group/7429657712616538650/,,0,0,True
炸萝卜丸子，放面粉和淀粉就错了，教你正确做法，焦香酥脆不吸油,2024-09-28 10:13,16643,627,家常的味道,家常的味道,,https://toutiao.com/group/7419635124758643227/,,0,0,True
1976年周、朱、毛同一年逝世，临终前，三位伟人都交代了什么话？,2024-09-24 09:46,11153,485,呷谈历史,呷谈历史,1976年是最令人悲伤的一年，那一年三位伟人相继离世，还发生了唐山大地震。三位伟人在离世前都交代了一些事情，这些事情都和之后国家的发展有关系。,https://toutiao.com/group/7418141722196197900/,,0,0,False
432比60，欧洲议会高票挺台，挑战联大2758号决议，中方反击到位,2024-10-26 02:27,958,149,大白话瞰世界,大白话瞰世界,432比60，欧洲议会高票通过“挺台”决议，挑战联大2758号决议，中方反击到位，欧洲议会的“挺台”决议具体讲了什么?,https://toutiao.com/group/7429904879818146315/,,0,0,False
大地主刘文彩的五姨太：比丈夫小26岁，2003年还在念叨“老头子”,2024-09-14 10:05,2046,167,博览历史,博览历史,声明|本文内容均引用权威资料结合个人观点进行撰写，文末已标注文献来源及截图，请知悉。位于四川省成都市大邑县安仁镇的刘氏庄园，又称大邑刘氏庄园博物馆，是第四批全国重点文物保护单位。,https://toutiao.com/group/7413674366816354857/,,0,0,False
除了戴头盔，12月起，电动车、摩托车、三轮车上路有4个新标准,2024-10-24 07:21,2217,341,新能源战略家,新能源战略家,请您在阅读前，先点击上面的“关注”。感谢您的支持，我们将为您带来更多有价值的内容。随着10月接近尾声， 整个电动车行业也进入今年最后的发展阶段。但事实上，每到年底，全国各地针对电动车市场的整治和检查强度都会迎来直接的提升。,https://toutiao.com/group/7429238621447701004/,,0,0,False
给近三年最好的10部年代剧排个名：《人世间》第6，第1名没有争议,2024-09-06 08:08,8410,2820,皮皮电影,皮皮电影,时尚是个轮回，电视剧也是。在2020年之前的那些年，电视剧市场基本上都被偶像剧、都市剧霸占。曾经撑起国剧品质的《闯关东》《岁月》这类年代好剧，难见踪影。,https://toutiao.com/group/7411390030722712090/,,0,0,False
芬兰提议废除中国一票否决权，我们还没说什么，美国率先不同意？,2024-10-25 04:34,4205,4312,军武次位面,军武次位面,前不久，芬兰总统亚历山大·斯图布突然如“中邪”一般，在联合国发表了一通“高论”。第二，由于中国的常任理事国待遇导致中国国际权力过大，建议取消中国的一票否决权。,https://toutiao.com/group/7429564478041162255/,,0,0,False
台海形势已经大变，打响“第一枪”的人，可能让大家都意想不到？,2024-10-24 06:44,2458,139,蒋福伟,蒋福伟,台海形势出现了深刻变化，在台海打响“第一枪”的人，可能让大家都意想不到。中国大陆海警持续加强在台海周边的执法巡航力量，岛内媒体担忧称大陆很可能会通过此举封锁台岛。,https://toutiao.com/group/7429229108334297600/,,0,0,False
73岁张纪中，突传消息！,2024-10-26 00:15,370,140,潇湘晨报,潇湘晨报,据天眼查显示，10月24日，上海纪中文化发展股份有限公司新增一则破产审查案件，申请人为上海纪中文化发展股份有限公司，经办法院为上海市第三中级人民法院。,http://api.chenshipin.com/wap/a/671c328b84201770bc68b048/90f456b81afce808c1fcfbd3f5761f65/1729901584/b39ba6e38124d9f428c9046ce80c11472e5724ed83a23d453f98eefe4a792050,,0,0,False
以后想吃回锅肉你就像我这样做，肥而不腻，咸香适口，太解馋了,2024-08-06 11:19,34780,1276,家常的味道,家常的味道,,https://toutiao.com/group/7399984507362738742/,,0,0,True
农村小情侣深夜约会，在屋内过着二人世界，兴奋坏了,2024-10-16 01:14,1469,152,乐视热播综艺精选,乐视热播综艺精选,农村小情侣深夜约会，在屋内过着二人世界，兴奋坏了,https://toutiao.com/group/7426173284741284364/,,0,0,True
东北一家同睡一炕上，新婚夫妻不尴尬吗？对于这事当地人怎么说？,2024-10-18 08:26,786,163,昕昕局,昕昕局,文 | 昕昕●—≺ 前 言 ≻—●“睡过北方的炕，才知道什么是冬天”。这句话，在社交网络上被无数南方网友奉为金句。的确，对于很多没去过东北的人来说，“炕”是一个充满神秘感的词语。它究竟是什么？为什么东北人对它如此情有独钟？,https://toutiao.com/group/7427028724601651727/,,0,0,False
杨妞花声音嘶哑念判决书：第一次看到余华英双手发抖,2024-10-25 03:49,4237,520,海客新闻,海客新闻,杨妞花声音嘶哑念判决书：第一次看到余华英双手发抖 她心里面是害怕的,https://toutiao.com/group/7429555385935069732/,,0,0,True
2024年度最佳华语猛片！绝对真实事件改编，怒斩12项大奖！,2024-10-19 07:09,1748,137,宇哥侃故事,宇哥侃故事,,https://toutiao.com/group/7427380436173357620/,,0,0,True
死刑执行现场：当犯人突然回头的那一刻，经验丰富的法警当场崩溃,2024-08-31 07:19,921,159,闻史天绪,闻史天绪,可令人意外的是，即便是经验丰富的法警，在看到死刑犯回头的时候，竟然会吓得手抖不已，有些人甚至当场崩溃。,https://toutiao.com/group/7409197491951845929/,,0,0,False
5年前站在美国军舰上，用中文警告我国海军的华人女兵，如今怎样,2024-10-08 12:28,644,104,西瓜名人榜,西瓜名人榜,2019年，一位华裔中国女孩站在美国军舰上，用一口流利的普通话对着中国海军喊话。“我作为华裔美国士兵能向中国海军传话感到无比荣幸，我方只是在正常巡视，请你们不要阻挡，否则中方就是在蓄意挑起战争。”,https://toutiao.com/group/7423376393075819047/,,0,0,False
小伙送美女回家，怎料俩人感情突然升温，下秒不得了,2024-10-18 16:30,2631,188,乐视独爱真人秀,乐视独爱真人秀,,https://toutiao.com/group/7426997752761942567/,,0,0,True
善恶终有报：疫情时对中国一毛不拔，却大方捐美国6亿，如今咋样,2024-09-29 05:50,889,123,睿之悦,睿之悦,可就是这样一位在中国土生土长起来的富豪，在疫情期间面对同胞的困境却一毛不拔，反而大方的捐助了6亿给美国。,https://toutiao.com/group/7419859345154015798/,,0,0,False
罕见！100年前，英国游客拍下的清朝乡村，和想象中完全不一样,2024-09-20 02:07,3124,418,万物知识局,万物知识局,泥泞的土路，衣不蔽体的老百姓，即便是达官显贵的家中也十分破败，而这些都是清王朝的历史痕迹，虽说那时候中国摄影技术并不发达，但也有许多外国游客来到这里，拍摄下了许多老照片，为我们留下了珍贵的历史资料，那清朝到底是怎样的面貌呢?,https://toutiao.com/group/7416287738871267855/,,0,0,False
阿斯麦向美国承诺：只要解放军攻台，立刻远程瘫痪台积电光刻机,2024-10-25 14:34,4661,1893,司马南,司马南,偶然看到一则信息，阿斯麦公司向美国作出保证，如果中国人民解放军攻打台湾地区，他们便立刻远程瘫痪台积电的光刻机。,https://toutiao.com/group/7429718340911858195/,,0,0,False
军号一响，全军出击！,2024-09-19 08:01,24543,1573,中国军号,中国军号,,https://toutiao.com/group/7416261401477382668/,,0,0,True
她是央视最惨主持人，男友被判死缓，丈夫诈骗入狱，47岁无人敢娶,2024-08-27 23:30,2265,210,闻书识焉,闻书识焉,她曾是央视的台柱子，和董卿、周涛并称为央视的三朵金花。回顾刘芳菲的前半生，最令人感到惋惜的，便是她的感情生活，47岁至今无人敢娶。,https://toutiao.com/group/7407743113688564258/,,0,0,False
网友：这小孩最起码吃了三个田震、一个许巍和一个刀郎！,2024-09-04 13:00,75425,6716,小石头和孩子们,小石头和孩子们,,https://toutiao.com/group/7410772059594981915/,,0,0,True
4年骑行结束，1500天终于回到老家，感谢大家一路陪伴有缘江湖见,2024-09-07 03:50,74848,16755,刘伟元的旅行,刘伟元的旅行,4年骑行结束，1500天终于回到老家，感谢大家一路陪伴有缘江湖见！,https://toutiao.com/group/7411715839100977716/,,0,0,True
