title,publish_time,like_count,comment_count,media_name,source,abstract,article_url,tag,is_yaowen,article_sub_type,has_video
俄乌战争大局已定？特朗普和普京首次通话，开出三大停战条件,2024-11-11 09:23,22749,2187,邱震海,邱震海,,https://toutiao.com/group/7435949966587232807/,,0,0,True
“蜂巢母舰”亮相珠海航展，搭载不同型号无人机，侦察攻击两不误,2024-11-08 12:07,19326,1381,杜文龙,杜文龙,,https://toutiao.com/group/7434878976956465716/,,0,0,True
小伙洗完澡故意秀肌肉，富婆心跳加速被当场拿下，这下好看了,2024-10-26 16:20,6908,280,乐视情感讲堂,乐视情感讲堂,小伙洗完澡故意秀肌肉，富婆心跳加速被当场拿下，这下好看了,https://toutiao.com/group/7430011217881596426/,,0,0,True
真低俗还是假专业？一场演唱会，揭开刀郎真实处境，难怪他们力挺,2024-09-23 06:37,1296,195,读万卷书的张飞,读万卷书的张飞,正如《罗刹海市》中的歌词，你能说没有内涵某些人吗?《2002年的第一场雪》爆火，专辑销售量更是吊打所谓的“资源咖”，乐坛出现了刀郎。,https://toutiao.com/group/7417723405191758351/,,0,0,False
被拐男子认亲一年后，与家人彻底决裂！,2024-11-05 08:45,3134,1656,环球网,环球网,来源：宁波晚报 近日因寻亲走红的郁豹豹与家人决裂的消息引发关注，冲上热搜。据报道，2023年9月，被拐卖34年的郁豹豹寻亲成功。认亲不到半个月，郁豹豹与两个弟弟开始直播带货。不到两个月，三兄弟逐渐走向分崩离析。令他更无法接受的是，他与母亲也渐生隔阂。,https://3w.huanqiu.com/a/14459a/4K8FGmdmzMW?agt=20,,0,0,False
特朗普胜了，收割清算越南，1600万亿撤退，越南工厂重返中国,2024-11-09 06:49,5848,407,BWC中文网,BWC中文网,特朗普胜了，收割清算越南，1600万亿撤退，越南工厂重返中国,https://toutiao.com/group/7435167979589632566/,,0,0,True
特朗普为啥说中国不会武统？,2024-11-09 14:00,19380,110,静思有我,静思有我,,https://toutiao.com/group/7435279079740047872/,,0,0,True
中国国乒又火了！决胜时刻，领军人物疯狂逆转，上演最解气的一幕,2024-11-04 00:00,6226,706,乐播体育,乐播体育,,https://toutiao.com/group/7433056969079915020/,,0,0,True
女儿花500块租男友，没想他是身价过亿的总裁，这下好运了,2024-10-18 09:42,7861,1462,乐视娱乐乐透社,乐视娱乐乐透社,,https://toutiao.com/group/7427048858267419190/,,0,0,True
续航2208.719km！一项新的吉尼斯世界纪录在上海诞生,2024-11-08 14:54,552,689,封面新闻,封面新闻,11月8日，一项新的吉尼斯世界纪录在上海诞生，荣威D7 DMH世界冠军版以2208.719km续航和2.49L/100KM的平均油耗，打破吉尼斯“插电式混合动力轿车单次满油满电行驶最远距离”世界纪录，荣膺“全球最省混动B级车”称号。,https://m.thecover.cn/news_details.html?from=web&eid=U8IIOnh0j6WH90qSdq8Jkw==,,0,0,False
歼-35正式亮相，有两大重要意义,2024-11-08 14:59,4499,113,金灿荣教授,金灿荣教授,,https://toutiao.com/group/7434835299319939620/,,0,0,True
俩人相亲互相看不上，哪料男方一报母亲身份，姑娘乐了,2024-11-08 01:50,6915,1728,乐视群星访谈秀,乐视群星访谈秀,,https://toutiao.com/group/7434719902990074395/,,0,0,True
特朗普要台灣交哪些保護費？不僅只有軍費，還有台積電和波音飛機,2024-11-10 09:42,14212,796,邱毅台湾,邱毅台湾,,https://toutiao.com/group/7435583741042360859/,,0,0,True
没被特朗普邀请加入新政府，蓬佩奥回应,2024-11-11 01:07,3264,1438,观察者网,观察者网,日前，美国当选总统特朗普表态，不会邀请美国前国务卿迈克·蓬佩奥（Mike Pompeo）加入他的新政府。对此，蓬佩奥在社交平台上发布了特朗普在竞选期间夸赞他的视频，并表示，很自豪能与特朗普共事，上周两人曾制定了一个让世界更安全、不发生新战争的计划。,https://www.guancha.cn/internation/2024_11_11_754902.shtml,,0,0,False
特朗普即将接盘的美国，已经落后中国一个世界 #热点 #中国 #美国,2024-11-08 09:08,7998,485,眉山剑客陈平,眉山剑客陈平,,https://toutiao.com/group/7434832818846302758/,,0,0,True
51年洪学智妻子寻女无果，到老乡家歇脚老乡惊呼：你要找得就是我,2024-09-22 01:07,13079,865,品古观今,品古观今,前言1951年，阳曲县委大院突然来了7、8位解放军同志，其中一位女同志，就是洪学智的妻子张文。她此番前来，就是为了寻找多年前因战乱而寄养于民间的爱女。可昔日的小村落早已蜕变成另一番景象，这无异于是大海捞针。,https://toutiao.com/group/7417034363226915354/,,0,0,False
67岁执意生娃，如今却坐轮椅无法自理，5岁的天赐被迫独立学洗衣,2024-11-04 10:32,2464,617,睿之悦,睿之悦,2019年，已经67岁的田新菊执意生下了自己的第三个孩子小天赐。那么，现如今5年的时间过去了，这“天赐”的礼物到底是福还是祸呢?,https://toutiao.com/group/7433367394946384435/,,0,0,False
特朗普赢了，对中国是好还是坏？(上),2024-11-07 14:53,37759,1980,静思有我,静思有我,,https://toutiao.com/group/7434550628703011391/,,0,0,True
罕见！100年前，英国游客拍下的清朝乡村，和想象中完全不一样,2024-09-20 02:07,5716,603,万物知识局,万物知识局,泥泞的土路，衣不蔽体的老百姓，即便是达官显贵的家中也十分破败，而这些都是清王朝的历史痕迹，虽说那时候中国摄影技术并不发达，但也有许多外国游客来到这里，拍摄下了许多老照片，为我们留下了珍贵的历史资料，那清朝到底是怎样的面貌呢?,https://toutiao.com/group/7416287738871267855/,,0,0,False
特朗普杀回来了，第二次贸易战要来了，中国要做哪些准备？,2024-11-07 15:49,11984,2027,金灿荣教授,金灿荣教授,,https://toutiao.com/group/7434468272764650020/,,0,0,True
3年前，宁夏7岁小女孩一笑走红，后拒百万签约，如今怎么样了？他们后悔了吗？,2024-09-19 07:25,9395,1340,睿之悦,睿之悦,2021年，视频镜头中出现的女孩儿用那一抹甜美的笑容，迅速引起了网友们的广泛关注。有媒体公司看到这一机遇，提出愿意用百万巨资与女孩儿签约，然而，女孩儿的父母却坚决拒绝了这一提议。,https://toutiao.com/group/7416250139544879679/,,0,0,False
“特朗普+马斯克”时代，1大胆预测！普京不会联美抗中，5点理由,2024-11-10 13:31,21445,1564,终南剑客,终南剑客,本期话题，特朗普的反全球化，马斯克的复仇，普京的多极梦。,https://toutiao.com/group/7435642868561904168/,,0,0,True
特朗普能使俄乌战争停火？他的方案已触礁，现在主导情势的是普京,2024-11-11 05:49,11916,530,邱毅台湾,邱毅台湾,,https://toutiao.com/group/7435894833719280179/,,0,0,True
特朗普在忙什么？他的新政府许多反华人士入列，中美关系会怎么走,2024-11-08 10:05,30165,1522,邱毅台湾,邱毅台湾,,https://toutiao.com/group/7434847402797990452/,,0,0,True
给近三年最好的10部年代剧排个名：《人世间》第6，第1名没有争议,2024-09-06 08:08,11620,3681,皮皮电影,皮皮电影,时尚是个轮回，电视剧也是。在2020年之前的那些年，电视剧市场基本上都被偶像剧、都市剧霸占。曾经撑起国剧品质的《闯关东》《岁月》这类年代好剧，难见踪影。,https://toutiao.com/group/7411390030722712090/,,0,0,False
拦车收费？交警不管！景区不管！政府看不见！九寨沟咋全是土匪？,2024-09-22 15:55,223941,44377,行哥嘚啵嘚,行哥嘚啵嘚,,https://toutiao.com/group/7417496641638400527/,,0,0,True
好物分享｜炖牛肉时切记三放两不放，这样炖出来的牛肉才会汤鲜味美,2024-10-15 08:50,3902,132,家味美食,家味美食,,https://toutiao.com/group/7425922043991360037/,,0,0,True
1米3袖珍美女嫁给1米48男孩，婚后丈夫奇迹长高，两人却不欢而散,2024-09-07 02:55,3576,202,睿之悦,睿之悦,杨萍和葛存苗的婚礼 文|睿之悦 编辑|睿之悦2019年，成都的民政局来了两个“10岁小孩”来登记，工作人员以为是玩闹。两个“小孩”拿出身份证让工作人员看，这才明白，原来是两个再也长不高的成年袖珍人情侣。,https://toutiao.com/group/7411713833267364386/,,0,0,False
炒白菜千万不要直接下锅，难怪不好吃，教你技巧，鲜嫩入味不出水,2024-10-30 09:23,7006,345,家常的味道,家常的味道,,https://toutiao.com/group/7431496869400576550/,,0,0,True
美妇约见老情人，见面场景真是太逗了，这俩人绝配！,2024-10-27 16:25,2691,340,乐视明星的那点事,乐视明星的那点事,美妇约见老情人，见面场景真是太逗了，这俩人绝配！,https://toutiao.com/group/7428157095108674088/,,0,0,True
珠海航展 “机器狼”首次公开亮相！“铁翼飞旋”带你一探究竟,2024-11-09 02:27,48994,6170,央视频,央视频,,https://toutiao.com/group/7435100516647502336/,,0,0,True
炸萝卜丸子到底用面粉还是淀粉，教你正确做法，外焦里嫩，太香了,2024-10-26 09:25,6271,416,家常的味道,家常的味道,,https://toutiao.com/group/7430012978277122611/,,0,0,True
特朗普和平方案曝光，恐牺牲乌克兰领土，俄罗斯或成最大赢家？,2024-11-11 09:18,14118,947,邱震海,邱震海,,https://toutiao.com/group/7435948591723577871/,,0,0,True
今天才知道！电动车“每天充”和“用完再充”，到底哪个更伤电池,2024-08-27 11:19,15293,2356,鲸探所,鲸探所,“今天到底给车充不充电？”估计大多数人每天回家都会想这个问题，看着自己的电动车电量又多又少的，充不充电也是一件非常难以抉择的事情。那么，电动车到底应该怎样充电呢？是每天都充，还是用完之后再充呢？电动车充电不管是在城市还是农村，电动车其实都是人们出门最常见的交通工具。,https://toutiao.com/group/7407773012533117475/,,0,0,False
特朗普战胜哈里斯重新上台，对中国是好是坏？,2024-11-06 08:28,27572,7661,第一军情,第一军情,据央视新闻11月6日最新报道，特朗普成功战胜哈里斯，赢得了2024年美国总统大选，和很多人想象的“战事焦灼”不同，本次美国大选却呈现出一边倒的态势，特朗普兵不血刃，在多个摇摆州成功“翻红”，战胜了民主党候选人哈里斯，再次问鼎美国总统的宝座。那么，既然美国未来四年的“掌门人”已经敲定，对中国又将有什么深远影响，或者用更贴地气的话：对中国是好是坏呢？,https://toutiao.com/group/7434080229624119844/,,0,0,True
私家车加塞武警车队，战士可不惯着他，一把方向教他开车！,2024-11-04 02:53,4412,927,乐视群星访谈秀,乐视群星访谈秀,,https://toutiao.com/group/7433251780755980800/,,0,0,True
土豆搭配洋葱，教你一个神仙吃法，一次3斤不够吃，太解馋了,2024-09-26 09:09,32476,1924,家常的味道,家常的味道,土豆搭配洋葱，教你一个神仙吃法，一次3斤不够吃，太解馋了,https://toutiao.com/group/7418876506660667904/,,0,0,True
春晚：赵四这演技让赵本山都笑场了，台下也笑的人仰马翻！经典！,2024-11-04 08:35,1524,262,乐视综艺咖,乐视综艺咖,,https://toutiao.com/group/7433340063349015051/,,0,0,True
收评：A股缩量大反包，明天怎么走？老手讲3点得出结论 收评,2024-11-11 08:40,4329,695,来自股市的猩猩,来自股市的猩猩,,https://toutiao.com/group/7435938930589729289/,,0,0,True
炸萝卜丸子，放面粉和淀粉就错了，教你正确做法，焦香酥脆不吸油,2024-09-28 10:13,23106,997,家常的味道,家常的味道,,https://toutiao.com/group/7419635124758643227/,,0,0,True
时隔近5年收获生涯第15冠！丁俊晖：很开心孩子能在现场见证爸爸夺冠，自己和球迷都挺过来了,2024-11-11 00:19,718,179,九派新闻,九派新闻,当地时间11月10日，2024世界斯诺克国际锦标赛决赛，丁俊晖vs克里斯·韦克林。开场韦克林取得4-1领先，丁俊晖稳住心态找回手感，打出五杆50+，连扳6局，以7-4反超。韦克林打出单杆82分和89分，连追两局。丁俊晖回敬单杆98分，8-6领先。韦克林随后又扳回一局。,https://toutiao.com/group/7435806811007009307/,,0,0,False
两次交火让朝军开眼界，朝鲜1万大军存在缺陷：1个月还无法打大仗,2024-11-09 08:10,12619,4416,深度工场,深度工场,朝鲜军队混编在俄军第810海兵旅，在库尔斯克州苏贾地区，连续打了两次战斗，可以说开了眼界。朝鲜军队1万大军已经抵达俄罗斯大约1个月，这批朝鲜军队全都是特种兵，至少训练了四年，五年的老兵。,https://toutiao.com/group/7435186488997855807/,,0,0,False
男子在路边被黄鼠狼盯住，咬住他的鞋不松口,2024-10-14 06:46,18915,3797,山西广电文娱,山西广电文娱,,https://toutiao.com/group/7425519012454335003/,,0,0,True
15年前他在爱妻葬礼上哭到昏厥，发誓永不再娶，如今他做到了吗？,2024-08-24 02:17,19214,591,八号探秘人,八号探秘人,在阅读此文之前，辛苦您点击一下“关注”，既方便您进行讨论和分享，又能给您带来不一样的参与感，感谢您的支持！编辑丨xk纵观鱼龙混杂的娱乐圈，有人背叛，有人痴情。而果靖霖则是公认的好男儿，将一生都奉献给妻子。但妻子却仅仅陪他走了半生，没能战胜病魔，不幸离开人世。,https://toutiao.com/group/7406210316734710283/,,0,0,False
被姚明抱着上奥运的小英雄，曾发誓考上清华，16年后活成了这样,2024-11-07 08:07,1172,342,睿之悦,睿之悦,2008年，年仅9岁的林浩，在姚明的带领下走进了北京奥运会开幕式的舞台上，成为了万众瞩目的“焦点”。,https://toutiao.com/group/7434444094551687707/,,0,0,False
