title,publish_time,like_count,comment_count,media_name,source,abstract,article_url,tag,is_yaowen,article_sub_type,has_video
央行决定暂停开展公开市场国债买入操作，原因几何？,2025-01-10 02:32,262,407,第一财经,第一财经,1月10日早间，央行公告称，鉴于近期政府债券市场持续供不应求，中国人民银行决定，2025年1月起暂停开展公开市场国债买入操作，后续将视国债市场供求状况择机恢复。,https://m.yicai.com/news/102435976.html,,0,0,False
铁公鸡来相亲，一听不用买单拼命点菜，哪料姑娘做法更狠,2024-12-26 09:06,3398,951,乐视热播综艺精选,乐视热播综艺精选,,https://toutiao.com/group/7452643056194421286/,,0,0,True
萝卜和鸡蛋这样做，比吃补药还补，顿顿吃都不会腻，又香又下饭,2024-10-30 12:28,74216,4484,小寒厨艺,小寒厨艺,萝卜和鸡蛋这样做，比吃补药还补，顿顿吃都不会腻，又香又下饭,https://toutiao.com/group/7431405463378919975/,,0,0,True
无人能挡，特朗普引发四大世界惊变！中国统一，也已在路上！,2025-01-09 13:40,15889,1706,占豪,占豪,无人能挡，特朗普正让世界惊变!万万没想到，特朗普还没上台，已让世界出现了四大惊变!第一大惊变:中东剧变，伊朗危险。,https://toutiao.com/group/7457910009901351424/,,0,0,False
湖南最长寿老人124岁高龄，长寿秘诀出世，让人大开眼界,2024-12-21 16:00,2438,227,乐视群星访谈秀,乐视群星访谈秀,,https://toutiao.com/group/7450730131821167140/,,0,0,True
老纪和珅这段对话，以前小时候听不懂，如今听完受益终身,2024-12-28 23:16,6887,1972,乐视扒剧小妹儿,乐视扒剧小妹儿,,https://toutiao.com/group/7453420191947424293/,,0,0,True
夜里翻来覆去睡不着，原来几根芹菜根就搞定，做法简单，省钱实用,2024-12-25 11:02,12143,1471,百变小厨坊,百变小厨坊,夜里翻来覆去睡不着，原来几根芹菜根就搞定，做法简单，省钱实用,https://toutiao.com/group/7452303315842368052/,,0,0,True
小子相亲故意扮老，谁知道对方一见面就叫他大爷，这段太逗了,2024-12-24 08:17,4215,942,乐视热播综艺精选,乐视热播综艺精选,,https://toutiao.com/group/7451886130837848610/,,0,0,True
小女孩上部队找爸爸，少校阿姨主动搭讪，谁知看到女孩父亲傻眼了,2024-12-23 16:01,4573,1018,乐视群星访谈秀,乐视群星访谈秀,,https://toutiao.com/group/7451525814283960872/,,0,0,True
炸鱼块，到底用淀粉还是面粉，今天分享一个又香又脆的做法,2025-01-02 09:26,10224,670,家常的味道,家常的味道,,https://toutiao.com/group/7455247105683096076/,,0,0,True
