title,publish_time,like_count,comment_count,media_name,source,abstract,article_url,tag,is_yaowen,article_sub_type,has_video
[视频]中共中央举行纪念乔石同志诞辰100周年座谈会 习近平发表重要讲话,2024-12-16 11:59,2791,899,国际在线,国际在线,央视网消息（新闻联播）：中共中央16日上午在人民大会堂举行座谈会，纪念乔石同志诞辰100周年。,https://news.cri.cn/toutiaopic/600d2e67-7692-2192-43d6-ef061de953ae.html,,0,0,False
情满濠江丨特殊的“桥梁”,2024-12-15 23:14,490,179,央视新闻,央视新闻,罗沛婷的家族一百多年前来到澳门，她的曾祖父于1916年成立了一家洋行，在葡萄牙和内地之间做产品的进出口生意。近年来，随着中国和葡语国家交往日益密切，作为第四代接班人的罗沛婷，正面对一个崭新的天地。,https://content-static.cctvnews.cctv.com/snow-book/index.html?item_id=15247686177286788069&source=50006&sub_source=50006_001,,0,1,False
土豆搭配洋葱，教你一个神仙吃法，一次3斤不够吃，太解馋了,2024-09-26 09:09,38188,2261,家常的味道,家常的味道,土豆搭配洋葱，教你一个神仙吃法，一次3斤不够吃，太解馋了,https://toutiao.com/group/7418876506660667904/,,0,0,True
20年前蔡振华开除国家队的4人，结局各不相同，现在都怎么样了？,2024-12-05 11:08,1130,122,晓娱海棠,晓娱海棠,都说中国乒乓球队从不缺世界冠军，我国在乒乓球领域一直是一骑绝尘，甚至还有着“乒乓球外交”一说。但在这国球辉煌发展的背后，其实离不开这个人的付出。,https://toutiao.com/group/7444842921527919131/,,0,0,False
明确了！2025年养老金实现双增长，三类人可以多涨，两类人不涨,2024-12-15 05:23,1153,315,社保当家,社保当家,明确了！2025年养老金实现双增长，三类人可以多涨，两类人不涨在2025年到来之前，关于养老金上涨的消息就已经明确，中央经济工作会议给退休人员送上了一个大大的惊喜。2025年，养老金将继续实现双增长，不过有三类人可以多涨，两类人不涨，一起来看看。,https://toutiao.com/group/7448496604800762394/,,0,0,False
帅哥看不上相亲女，撒谎没车没房没户口，姑娘的反应绝了,2024-11-18 05:47,3487,365,乐视天天剧好看,乐视天天剧好看,,https://toutiao.com/group/7438491946131128872/,,0,0,True
韩国又创造了历史,2024-12-10 02:30,8627,241,牛弹琴,牛弹琴,韩国总统被禁止出境，外界目瞪口呆,https://toutiao.com/group/7446604989465625151/,,0,0,True
百年古树上发现一个蛇窝，爷爷说藏着一条2米长的蛇，一起来看看,2024-11-07 14:53,6503,623,乡农小陈,乡农小陈,百年古树上发现一个蛇窝，爷爷说藏着一条2米长的蛇，一起来看看,https://toutiao.com/group/7434550715466383926/,,0,0,True
8年前，那个3岁识三千字、6岁夺央视冠军的神童王恒屹，如今怎样,2024-12-16 02:58,1412,169,昕昕局,昕昕局,本文陈述所有内容皆有可靠信息来源，赘述在文章结尾文 | 昕昕●—≺ 前 言 ≻—●神童是最少见也最常见的存在，因为只要有神童出现，各种节目就会邀请他们展现自己的能力，曾经就有一位来自山东的神童，让全国为之震动。年仅3岁，他已识千字；6岁时，他更是技压群雄，摘得桂冠。,https://toutiao.com/group/7448837570743779840/,,0,0,False
“为农机买柴油被罚3万元”当事人决定申诉，律师：处罚合法但不太合情理,2024-12-16 07:20,663,1432,极目新闻,极目新闻,极目新闻记者 谢茂12月16日，极目新闻记者从“因为农机买柴油被罚3万元”当事人顾先生处获悉，他对自己所接受的处罚已依法进行申诉。,http://jms.ctdsb.net/jmythshare/#/index_share?cId=0&contentType=5&contentId=2330474,,0,0,False
中央定调！2025年养老金双增长，养老金领取条件有变，一类人不涨,2024-12-14 08:18,3288,292,思之想之,思之想之,2025年养老金调整最新消息来了，中央已经定调，2025年养老金将迎来双增长。另外提醒大家，2025年起养老金领取条件有变，一类人不参加2025年养老金调整，具体是什么呢？一起来了解。,https://toutiao.com/group/7448174128252682788/,,0,0,False
韩国政坛的孤胆复仇者—文在寅,2024-12-16 03:50,2232,117,楠哥有财气,楠哥有财气,,https://toutiao.com/group/7448852009400140297/,,0,0,True
女友怀孕了，男友不装了，带她回豪宅！,2024-11-23 08:01,15021,1147,乐视大综艺咖,乐视大综艺咖,,https://toutiao.com/group/7440353629540483593/,,0,0,True
67岁执意生娃，如今却坐轮椅无法自理，5岁的天赐被迫独立学洗衣,2024-11-04 10:32,9167,2076,睿之悦,睿之悦,2019年，已经67岁的田新菊执意生下了自己的第三个孩子小天赐。那么，现如今5年的时间过去了，这“天赐”的礼物到底是福还是祸呢?,https://toutiao.com/group/7433367394946384435/,,0,0,False
小品：杨帆演小沈阳，撒贝宁演赵本山，台词功底太强了吧,2024-11-23 06:13,6029,114,PP宫斗放映厅,PP宫斗放映厅,,https://toutiao.com/group/7440353912709710386/,,0,0,True
冬季自驾游，零下四十度睡车里，半夜冻醒了，车里全部冻住了！,2024-12-13 11:02,11638,2468,旅行者小多,旅行者小多,,https://toutiao.com/group/7447850219347116544/,,0,0,True
才发现，橘子甜不甜，瞧一眼这个位置就知道，一挑一个准，快试试,2024-12-10 15:09,2043,330,明玥美食,明玥美食,,https://toutiao.com/group/7446800638819697188/,,0,0,True
养殖虾都是吃抗生素、激素长大的？到底能不能吃？告诉你真相,2024-10-10 10:02,1571,456,奇妙的本草,奇妙的本草,菜市场里，几位阿姨一起围着在一处海鲜档口处讨论！“现在的虾真是大个儿，还这么便宜！不买上几斤感觉都亏了！”李阿姨高兴地说。王阿姨却连连摇头：“可别太高兴，我听说这些大都是养殖虾，吃了不少激素和抗生素呢，吃了对身体不好。”“真的吗？”李阿姨惊讶地问。,https://toutiao.com/group/7424084752157950516/,,0,0,False
炸肉丸子，到底用淀粉还是面粉，教你一招，外酥里软超好吃,2024-10-01 09:23,6616,510,家常的味道,家常的味道,,https://toutiao.com/group/7420735473208787492/,,0,0,True
丈母娘觉得女婿没本事，谁料去他单位一看，被女婿官威吓傻,2024-11-25 02:07,759,176,南瓜最前线,南瓜最前线,,https://toutiao.com/group/7441032711340294696/,,0,0,True
今天解锁一个皮蛋的神仙吃法 #妈呀太香了 #皮蛋的神仙吃法,2024-12-11 09:40,2961,185,家常的味道,家常的味道,,https://toutiao.com/group/7447086779884110346/,,0,0,True
水煮荷包蛋这样做太好吃了，不散花不起沫，个个圆溜溜,2024-10-15 09:49,5939,295,家常的味道,家常的味道,,https://toutiao.com/group/7425937309142352434/,,0,0,True
炸萝卜丸子到底用面粉还是淀粉，教你正确做法，外焦里嫩，太香了,2024-10-26 09:25,15376,1033,家常的味道,家常的味道,,https://toutiao.com/group/7430012978277122611/,,0,0,True
近5年最热的十部剧，《狂飙》第9，《繁华》第6，第1名很难超越,2024-12-01 03:58,1224,457,电影烂番茄,电影烂番茄,今天，番叔就结合口碑，给大家盘点一下近五年，热度最高的十部电视剧。第十名:《都挺好》 猫眼热度 9775.8，播出时间2019年。,https://toutiao.com/group/7430845717314273831/,,0,0,False
