title,publish_time,like_count,comment_count,media_name,source,abstract,article_url,tag,is_yaowen,article_sub_type,has_video
总裁故意扮成保安，试探相亲姑娘，不料对方反应逗了,2024-11-01 09:44,1666,226,乐视热播综艺精选,乐视热播综艺精选,,https://toutiao.com/group/7431780632960696847/,,0,0,True
布林肯的结局已定，他在交权之前，留下了几句关于中国的忠告,2024-11-01 06:16,13591,742,庆彬有理,庆彬有理,随着拜登4年任期所剩无几，布林肯的国务卿生涯也即将走到尽头。不过，尽管自己结局已定，但布林肯在交权之前，依然想着给自己的继任者，留下几句关于中国的忠告。,https://toutiao.com/group/7432190912496665088/,,0,0,True
首例5胞胎长大了，父亲已过劳去世 母亲直言：如能重来一个也不要,2024-08-31 03:06,1344,359,睿之悦,睿之悦,2002年，在北京的一家妇产医院中，一位来自河北的孕妇顺利生下了两男三女的五胞胎，创造了一个全国罕见的奇迹。,https://toutiao.com/group/7409098624111575603/,,0,0,False
51年洪学智妻子寻女无果，到老乡家歇脚老乡惊呼：你要找得就是我,2024-09-22 01:07,11736,797,品古观今,品古观今,前言1951年，阳曲县委大院突然来了7、8位解放军同志，其中一位女同志，就是洪学智的妻子张文。她此番前来，就是为了寻找多年前因战乱而寄养于民间的爱女。可昔日的小村落早已蜕变成另一番景象，这无异于是大海捞针。,https://toutiao.com/group/7417034363226915354/,,0,0,False
给近三年最好的10部年代剧排个名：《人世间》第6，第1名没有争议,2024-10-28 07:10,626,354,稻述,稻述,到了20世纪初，偶像剧成为人们的掌中宝，但要说现在什么剧最受欢迎，那一定是年代剧!其中《人世间》只能排第六，第一名人人都爱看，最后一名也比上不足比下有余。,https://toutiao.com/group/7430715494055264783/,,0,0,False
覃海洋未婚妻深夜发长文，晒多条聊天记录：最后一次解释和他的事,2024-11-03 20:24,163,421,直播吧,直播吧,直播吧11月04日讯 中国游泳运动员覃海洋未婚妻凌晨发表社媒，表示最后一次解释两人之间的事情。多肉饱饱自我救赎版（覃海洋未婚妻微博账号）：翻看聊天记录的时候 感慨万千。我和覃海洋2019年10月28日在一起后到现在分分合合纠缠了这么多年，到最后落成这样子下场，唏嘘不已。,https://news.zhibo8.com/other/2024-11-04/6727d9bf8472fnative.htm,,0,0,False
神舟十八号乘组凌晨重返地球：采用绕地5圈快速返回方案，着陆现场亮如白昼,2024-11-03 18:08,892,140,红星新闻,红星新闻,11月4日凌晨，三名航天员叶光富、李聪、李广苏乘坐神舟十八号载人飞船返回舱，安全着陆于东风着陆场，现场医监医保人员确认三名航天员身体状态良好，神舟十八号载人飞行任务取得圆满成功。,https://cdsbrss.cdsb.com/toutiao_no_video.php?url=https%3A%2F%2Fstatic.cdsb.com%2Fmicropub%2FArticles%2F202411%2F6bdcd962b5142a198372ddc7c59a1e37.html,,0,0,False
杭州这个环卫大叔刷屏了！捡到2460000元，接下来的举动太赞了！,2024-11-02 03:01,698,281,极目新闻,极目新闻,11月1日晚，杭州环卫工拾到百万存单交还失主的故事，在很多萧山人朋友圈刷屏。246万元！什么概念？环卫大叔说了：“这算啥拾金不昧？捡到当然要还给人家的。”10月31日早上7点，萧山闻堰三洞闸街，68岁的环卫工人汪惠明正在三江名苑北门区域进行清洁工作，突然发现马路上丢着两张单据。,http://jms.ctdsb.net/jmythshare/#/index_share?cId=0&contentType=5&contentId=2294699,,0,0,False
特务男扮女装混进村子，孩子兵顿时发现不对劲，这下精彩了,2024-10-28 06:09,2052,204,乐视群星访谈秀,乐视群星访谈秀,,https://toutiao.com/group/7430704630294413878/,,0,0,True
1米3袖珍美女嫁给1米48男孩，婚后丈夫奇迹长高，两人却不欢而散,2024-09-07 02:55,2313,128,睿之悦,睿之悦,杨萍和葛存苗的婚礼 文|睿之悦 编辑|睿之悦2019年，成都的民政局来了两个“10岁小孩”来登记，工作人员以为是玩闹。两个“小孩”拿出身份证让工作人员看，这才明白，原来是两个再也长不高的成年袖珍人情侣。,https://toutiao.com/group/7411713833267364386/,,0,0,False
双航母同框，解析张召忠流泪,2024-11-03 12:39,21590,1098,司马南,司马南,"这一刻祖国强大具象化了，有朋友翻出了20年前的军事杂志《舰船知识》，还有朋友翻出了20年前在论坛上说出的“梦”…..那时候，还被人嘲笑。
那时候大家受的是什么窝囊气，70后、80后都记得，1993年“银河号”事件,1996年台海危机，1999年北约轰炸驻南联盟大使馆….…….这三件事被叫做“三大恨”。
#双航母同框背后的三重信息#",https://toutiao.com/group/7433000975378186790/,,0,0,True
冲上热搜！全网老公都在被问这个问题，网友吵翻,2024-11-03 13:40,466,1700,潇湘晨报,潇湘晨报,“8个瑞士卷怎么分？”今天全网的老公都在被问这个问题，相关词条还冲上了微博热搜，到底什么情况？这个问题源自于网络上的一个视频，近日，一位宝妈发布视频。视频记录了她与老公的一次争吵，据这位宝妈描述，家里买了一盒瑞士卷，总共8个瑞士卷，女儿吃了2个，儿子吃了2个，老公吃了2个。,http://api.chenshipin.com/wap/a/67277c0784201730365d5195/90f456b81afce808c1fcfbd3f5761f65/1730641040/7407a327025389be5dbafec41606e8c7f9776290c5dd14576367c59c2f07ff04,,0,0,False
小伙洗完澡故意秀肌肉，富婆心跳加速被当场拿下，这下好看了,2024-10-26 16:20,4829,210,乐视情感讲堂,乐视情感讲堂,小伙洗完澡故意秀肌肉，富婆心跳加速被当场拿下，这下好看了,https://toutiao.com/group/7430011217881596426/,,0,0,True
罕见！100年前，英国游客拍下的清朝乡村，和想象中完全不一样,2024-09-20 02:07,4439,528,万物知识局,万物知识局,泥泞的土路，衣不蔽体的老百姓，即便是达官显贵的家中也十分破败，而这些都是清王朝的历史痕迹，虽说那时候中国摄影技术并不发达，但也有许多外国游客来到这里，拍摄下了许多老照片，为我们留下了珍贵的历史资料，那清朝到底是怎样的面貌呢?,https://toutiao.com/group/7416287738871267855/,,0,0,False
隐形战机苏-57首次来到中国，降落太原,2024-11-03 08:12,1560,1010,环球网,环球网,来源：央视军事 今天14时20分许，隐形战机苏-57首次来到中国，在太原降落。,https://3w.huanqiu.com/a/d2d030/4K6Zwgx1JXv?agt=20,,0,0,False
中国绝版老香烟，见过5种以上都是爷爷辈的，老烟民们抽过几种？,2024-08-20 08:54,731,126,万物知识局,万物知识局,文/万物知识局本文陈述所有内容皆有可靠信息来源，赘述在文章结尾在中国的历史长河中，烟草的传奇故事已历经四百载春秋。从明朝嘉靖年间葡萄牙使者带来的烟草，到如今琳琅满目的香烟品牌，烟草不仅见证了时代的变迁，也承载了无数人的记忆与情感。,https://toutiao.com/group/7405119584723927578/,,0,0,False
吉林美女带俩娃，嫁给头婚小叔子，婆婆一手撮合，如今过得怎样了,2024-11-01 08:01,855,252,睿之悦,睿之悦,说出来可能很多人都不相信，吉林一位带着两个孩子的美女在婆婆的大力撮合下嫁给了自己的小叔子。2020年，这位女子的丈夫因为意外去世，留下了她们孤儿寡母悲痛欲绝。,https://toutiao.com/group/7432216069030363682/,,0,0,False
善恶终有报：疫情时对中国一毛不拔，却大方捐美国6亿，如今咋样,2024-09-29 05:50,962,127,睿之悦,睿之悦,可就是这样一位在中国土生土长起来的富豪，在疫情期间面对同胞的困境却一毛不拔，反而大方的捐助了6亿给美国。,https://toutiao.com/group/7419859345154015798/,,0,0,False
写歌30年穷困潦倒，前妻失望选择离婚，谁料51岁靠一首歌一夜成名,2024-08-12 03:37,26222,4349,八号探秘人,八号探秘人,在阅读此文之前，辛苦您点击一下“关注”，既方便您进行讨论和分享，又能给您带来不一样的参与感，感谢您的支持！编辑：LY无数人都想要一个一夜成名的机会，但机会来了也不是每个人都能把握住的。他用了三十年的时间来准备迎接属于自己的机会。为了这个机会他放弃了一切，甚至包括家庭。,https://toutiao.com/group/7402090890367484428/,,0,0,False
军号一响，全军出击！,2024-09-19 08:01,28471,1781,中国军号,中国军号,,https://toutiao.com/group/7416261401477382668/,,0,0,True
网友：这小孩最起码吃了三个田震、一个许巍和一个刀郎！,2024-09-04 13:00,76527,6773,小石头和孩子们,小石头和孩子们,,https://toutiao.com/group/7410772059594981915/,,0,0,True
母亲瘫痪、父亲疯了，当年那个744分的高考状元，7年后却成了这样,2024-09-08 00:54,7271,1216,八号探秘人,八号探秘人,母亲截肢瘫痪、父亲疯癫痴傻，可对于自己的亲人，他却做出了这样的评价。而今，7年已过，曾经那个让无数人动容的少年，现在如何?,https://toutiao.com/group/7411852147648496162/,,0,0,False
有人冒充我男朋友，算不算诈骗？遇到奇葩事你会怎么办？,2024-09-06 05:52,1773,226,兴凯湖莹莹,兴凯湖莹莹,,https://toutiao.com/group/7411404025502892554/,,0,0,True
4年骑行结束，1500天终于回到老家，感谢大家一路陪伴有缘江湖见,2024-09-07 03:50,75109,16747,刘伟元的旅行,刘伟元的旅行,4年骑行结束，1500天终于回到老家，感谢大家一路陪伴有缘江湖见！,https://toutiao.com/group/7411715839100977716/,,0,0,True
原来他才是毁掉刘翔真凶，因贪1200万被公审，让刘翔背负多年骂名,2024-08-29 09:58,13354,407,八号探秘人,八号探秘人,在田径场上创造的成绩，至今无人能够打破，甚至在国际上享有盛名。本该继续夺冠之路，却两次因伤退赛，遭到了全网辱骂。,https://toutiao.com/group/7408489498465616410/,,0,0,False
又被全世界打脸，这是美国今年最耻辱的失败,2024-11-01 00:10,7326,1902,牛弹琴,牛弹琴,资料图又被全世界打脸，这是美国今年最耻辱的一次失败。之所以说“又”，很简单，以前每年都有过，结果也差不多。事实上，这也成了一年一次联合国大会，最后的保留曲目，全世界同声谴责美国，全世界一起看美国笑话。因为全世界投票，要求美国必须终止对古巴的经济、商业和金融封锁。,https://toutiao.com/group/7432095642685686291/,,0,0,False
15年前他在爱妻葬礼上哭到昏厥，发誓永不再娶，如今他做到了吗？,2024-08-24 02:17,18445,579,八号探秘人,八号探秘人,在阅读此文之前，辛苦您点击一下“关注”，既方便您进行讨论和分享，又能给您带来不一样的参与感，感谢您的支持！编辑丨xk纵观鱼龙混杂的娱乐圈，有人背叛，有人痴情。而果靖霖则是公认的好男儿，将一生都奉献给妻子。但妻子却仅仅陪他走了半生，没能战胜病魔，不幸离开人世。,https://toutiao.com/group/7406210316734710283/,,0,0,False
女子被诱骗拘禁近5年遭强奸产女，男子因强奸罪获刑15年，曾称“把你搞来就为要个儿子”,2024-11-02 06:26,534,322,大风新闻,大风新闻,终于拿到判决书了。37岁的张玲期待着，自己能就此远离那场噩梦。在乡下的10年里，她每天都被农活包围，打油菜籽、喂鸡鸭、做饭、照顾6岁的儿子，生活平静庸常。只是偶尔，身体会不自觉地露出异样。,https://toutiao.com/group/7432563482551255579/,,0,0,False
美媒：中国又一艘新航母曝光，模样怪异，是干什么用的？,2024-11-02 08:26,3048,160,军武次位面,军武次位面,最近，位于中国广州的广船国际造船厂内，一艘神秘舰艇的突然现身引起了美国媒体的高度关注。这艘舰艇不仅拥有大型开放式飞行甲板，还具有轻型航空母舰或两栖攻击舰的典型特征，一时成为外媒争相报道的热点。,https://toutiao.com/group/7432224320463569427/,,0,0,True
特朗普又要赢了？是福是祸？,2024-10-29 23:00,28472,3169,高志凯频道,高志凯频道,种种迹象表明，懂王要赢了？硅谷科技巨头转向支持特朗普其实就是风向之一。关键是，特朗普如果赢，对于我们是福是祸呢？,https://toutiao.com/group/7429979269775753747/,,0,0,True
穷小子去富婆家里，富婆笑咧嘴把保姆支开，保姆心知肚明,2024-10-26 06:34,1650,204,乐视情感讲堂,乐视情感讲堂,穷小子去富婆家里，富婆笑咧嘴把保姆支开，保姆心知肚明,https://toutiao.com/group/7429969094939509311/,,0,0,True
“姜某事件”调查结果公布，一图梳理时间线,2024-11-03 06:33,417,1623,济南时报-新黄河,济南时报-新黄河,阿里巴巴全球数学竞赛获奖名单已正式发布，共有86名选手获奖，其中金奖5名，银奖10名，铜奖20名，优秀奖51名。,https://api.jinantimes.com.cn/h5/content.html?catid=216&id=4989506,,0,0,False
