title,publish_time,like_count,comment_count,media_name,source,abstract,article_url,tag,is_yaowen,article_sub_type,has_video
联播观察｜强震来袭 生命至上,2025-01-10 22:59,3254,1264,国际在线,国际在线,“现在抗震救灾工作处在关键阶段，不能有丝毫松懈。”1月9日，习近平总书记主持召开中共中央政治局常务委员会会议，研究部署西藏定日抗震救灾工作。,https://news.cri.cn/toutiaopic/15d5fadb-371c-7f60-5d79-a684d15d916e.html,,0,0,False
习言道｜一支党和人民完全可以信赖的有坚强战斗力的队伍,2025-01-09 23:43,1620,894,中国新闻网,中国新闻网,我国人民警察是一支党和人民完全可以信赖的有坚强战斗力的队伍，致敬人民警察！,https://www.chinanews.com.cn/gn/shipin/cns/2025/01-10/news1010231.shtml,,0,0,False
12台中国混动车挑战死亡公路，全程不加油/充电谁能直通北冰洋？,2025-01-07 04:00,8120,2417,懂车帝原创,懂车帝原创,包括问界M9、仰望U8、魏牌蓝山、方程豹豹5等等热门车系在内的12辆中国新能源车集体挑战有着“死亡公路”之称的美国阿拉斯加道顿公路，在-30℃的极寒中，哪辆混动车型能完成不加油不充电，纵贯道顿公路直通北冰洋壮举？,https://toutiao.com/group/7456737631636816396/,,0,0,True
广西49岁老汉娶19岁姑娘，结婚21年生下15个孩子，如今有何下场？,2024-10-20 08:32,11138,1314,艺述史,艺述史,她19岁出嫁，21年里总共生育了15个孩子，其中4个男孩子11个女孩子，家里热闹的像是开了一所学校一样。,https://toutiao.com/group/7427400319418384948/,,0,0,False
女子接到可疑电话全程录音:一句话让对方“破防” 把骗子气到大叫,2025-01-09 13:48,4377,798,海客新闻,海客新闻,女子接到可疑电话全程录音：一句话让对方“破防” 把骗子气到大叫,https://toutiao.com/group/7457911574020325900/,,0,0,True
无人能挡，特朗普引发四大世界惊变！中国统一，也已在路上！,2025-01-09 13:40,23591,2585,占豪,占豪,无人能挡，特朗普正让世界惊变!万万没想到，特朗普还没上台，已让世界出现了四大惊变!第一大惊变:中东剧变，伊朗危险。,https://toutiao.com/group/7457910009901351424/,,0,0,False
尹锡悦的三个靠山没了，三道防线破了，第二次逮捕，他是在劫难逃,2025-01-11 05:29,12211,283,邱毅台湾,邱毅台湾,,https://toutiao.com/group/7458525776640475667/,,0,0,True
布林肯前脚刚离开，韩国就展开第二波逮捕尹锡悦行动，胜算如何？,2025-01-08 07:08,16175,446,邱毅台湾,邱毅台湾,,https://toutiao.com/group/7457438209384677938/,,0,0,True
