title,publish_time,like_count,comment_count,media_name,source,abstract,article_url,tag,is_yaowen,article_sub_type,has_video
时政微纪录丨习近平总书记闽皖行,2024-10-19 13:12,1898,1123,央视新闻,央视新闻,金秋十月，习近平总书记赴福建和安徽考察，并前往火箭军某旅视察。15日下午，习近平首先来到漳州市东山县考察。在陈城镇澳角村，习近平步行察看澳角湾海域环境和村容村貌，详细了解海鲜干货和渔获产品交易情况。,https://content-static.cctvnews.cctv.com/snow-book/index.html?item_id=8639466343077398612&source=50006&sub_source=50006_001,,0,0,False
半岛局势紧张的肇事者是谁？不是韩国更不是朝鲜，得利者浮出水面,2024-10-18 05:56,12059,903,陈虎点兵,陈虎点兵,,https://toutiao.com/group/7426990598878167567/,,0,0,True
初中毕业去当流水线女工，五年后却成为世界冠军，22岁成人生赢家,2024-08-02 10:46,6356,1213,豆莱说,豆莱说,文：豆莱说编辑：豆莱说支持作者，写作不易，文中会有5s广告，观看后可免费阅读全文父母曾设想过子女的千百种可能，只是对于一个走上中专之路的孩子，无非也是毕业，打工，进工厂，养家糊口。,https://toutiao.com/group/7398489613888766475/,,0,0,False
军号一响，全军出击！,2024-09-19 08:01,20804,1334,中国军号,中国军号,,https://toutiao.com/group/7416261401477382668/,,0,0,True
一巴掌的代价，公交车上大妈打晕患癌小伙，断送退休后的幸福生活,2024-10-14 09:53,995,535,客观听書,客观听書,公交车上老太太和小伙吵了起来，老太太更是当仁不让直接给了小伙一巴掌。这名小伙直接倒地，老大大根本就不会想到正是因为他的一巴掌，鲜活的生命就这样消失在他的手里。,https://toutiao.com/group/7425563455358468627/,,0,0,False
"万万没想到,53岁“丁克”半辈子的康辉，一生遗憾竟然是一通电话",2024-08-21 22:14,28027,5414,峰哥正读,峰哥正读,在阅读此文之前，麻烦您点击一下“关注”，既方便您进行讨论和分享，又能给您带来不一样的参与感，感谢您的支持！文/编辑：蘑菇百善孝为先。但是到底怎么做才算是“孝”，康辉用了半辈子才明白。央视知名主持人康辉，事业顺遂，家庭幸福，在外人看来是一个人生赢家。,https://toutiao.com/group/7405504703687115273/,,0,0,False
他因病医治无效于18日逝世，享年56岁,2024-10-19 14:15,3607,757,大皖新闻,大皖新闻,10月19日，严立淼同志治丧委员会发布讣告，亿联控股集团创始人、董事长严立淼同志因病医治无效，于2024年10月18日23时30分逝世，享年56岁。严立淼 资料图严立淼出生于1968年8月，浙江温州人，亿联控股集团创始人、董事长。,http://www.ahwang.cn/toutiao/202410/2760593.html,,0,1,False
15年前他在爱妻葬礼上哭到昏厥，发誓永不再娶，如今他做到了吗？,2024-08-24 02:17,15826,501,八号探秘人,八号探秘人,在阅读此文之前，辛苦您点击一下“关注”，既方便您进行讨论和分享，又能给您带来不一样的参与感，感谢您的支持！编辑丨xk纵观鱼龙混杂的娱乐圈，有人背叛，有人痴情。而果靖霖则是公认的好男儿，将一生都奉献给妻子。但妻子却仅仅陪他走了半生，没能战胜病魔，不幸离开人世。,https://toutiao.com/group/7406210316734710283/,,0,0,False
1976年周、朱、毛同一年逝世，临终前，三位伟人都交代了什么话？,2024-09-24 09:46,4473,221,呷谈历史,呷谈历史,1976年是最令人悲伤的一年，那一年三位伟人相继离世，还发生了唐山大地震。三位伟人在离世前都交代了一些事情，这些事情都和之后国家的发展有关系。,https://toutiao.com/group/7418141722196197900/,,0,0,False
她曾被前夫一巴掌扇到离婚！二婚嫁世界冠军，如今生活幸福滋润,2024-09-10 09:12,13026,239,豆莱说,豆莱说,“漂亮的让人挪不开眼”是圈内人对她的评价，和“山杏”不一样的是，李琳在现实生活中的感情很是幸运，遇到了导演王小列。,https://toutiao.com/group/7412930201929204236/,,0,0,False
她是央视最惨主持人，男友被判死缓，丈夫诈骗入狱，47岁无人敢娶,2024-08-27 23:30,2250,209,闻书识焉,闻书识焉,她曾是央视的台柱子，和董卿、周涛并称为央视的三朵金花。回顾刘芳菲的前半生，最令人感到惋惜的，便是她的感情生活，47岁至今无人敢娶。,https://toutiao.com/group/7407743113688564258/,,0,0,False
张紫妍：被迫陪睡31人近百次，遭道具虐待，29岁自杀留230页遗书,2024-07-24 02:37,13832,981,八号探秘人,八号探秘人,在阅读此文之前，辛苦您点击一下“关注”，既方便您进行讨论和分享，又能给您带来不一样的参与感，感谢您的支持！本文叙述皆有官方信源，为了读者有更好体验，放在了文章后缀！,https://toutiao.com/group/7394994383675736576/,,0,0,False
给近三年最好的10部年代剧排个名：《人世间》第6，第1名没有争议,2024-09-06 08:08,5060,1758,皮皮电影,皮皮电影,时尚是个轮回，电视剧也是。在2020年之前的那些年，电视剧市场基本上都被偶像剧、都市剧霸占。曾经撑起国剧品质的《闯关东》《岁月》这类年代好剧，难见踪影。,https://toutiao.com/group/7411390030722712090/,,0,0,False
有人冒充我男朋友，算不算诈骗？遇到奇葩事你会怎么办？,2024-09-06 05:52,1712,225,兴凯湖莹莹,兴凯湖莹莹,,https://toutiao.com/group/7411404025502892554/,,0,0,True
3年前，宁夏7岁小女孩一笑走红，后拒百万签约，如今怎么样了？他们后悔了吗？,2024-09-19 07:25,3096,579,睿之悦,睿之悦,2021年，视频镜头中出现的女孩儿用那一抹甜美的笑容，迅速引起了网友们的广泛关注。有媒体公司看到这一机遇，提出愿意用百万巨资与女孩儿签约，然而，女孩儿的父母却坚决拒绝了这一提议。,https://toutiao.com/group/7416250139544879679/,,0,0,False
西方专家：中国发射东风31AG不可怕，可怕的是另一件事,2024-10-14 00:38,2979,251,大国纪录,大国纪录,今年国庆节前夕，中国人民解放军火箭军发射了一枚洲际弹道导弹，如同是在国际社会，尤其是美西方为主体的欧美国家，投下了一枚重磅炸弹。,https://toutiao.com/group/7425423279743058473/,,0,0,False
写歌30年穷困潦倒，前妻失望选择离婚，谁料51岁靠一首歌一夜成名,2024-08-12 03:37,26096,4329,八号探秘人,八号探秘人,在阅读此文之前，辛苦您点击一下“关注”，既方便您进行讨论和分享，又能给您带来不一样的参与感，感谢您的支持！编辑：LY无数人都想要一个一夜成名的机会，但机会来了也不是每个人都能把握住的。他用了三十年的时间来准备迎接属于自己的机会。为了这个机会他放弃了一切，甚至包括家庭。,https://toutiao.com/group/7402090890367484428/,,0,0,False
中国小伙向阿拉伯女孩表白，女孩：我不希望你以后娶4个老婆,2024-10-18 03:16,20801,3712,今日国土杂志社,今日国土杂志社,,https://toutiao.com/group/7426949356139315746/,,0,0,True
以后想吃回锅肉你就像我这样做，肥而不腻，咸香适口，太解馋了,2024-08-06 11:19,32131,1190,家常的味道,家常的味道,,https://toutiao.com/group/7399984507362738742/,,0,0,True
贪污上亿、侵吞善款，韩红被实名举报，4年了，有人给她道歉吗？,2024-10-19 07:24,2577,235,昕昕局,昕昕局,2020年初，新冠疫情肆虐，武汉告急，全国上下万众一心，与时间赛跑，与病魔较量，就在这场没有硝烟的战争中，一个熟悉的身影出现在抗疫一线，她带着物资，带着希望，奔赴在最危险的地方，她就是韩红。,https://toutiao.com/group/7427383862491120179/,,0,0,False
今天才知道！电动车“每天充”和“用完再充”，到底哪个更伤电池,2024-08-27 11:19,12501,2205,鲸探所,鲸探所,“今天到底给车充不充电？”估计大多数人每天回家都会想这个问题，看着自己的电动车电量又多又少的，充不充电也是一件非常难以抉择的事情。那么，电动车到底应该怎样充电呢？是每天都充，还是用完之后再充呢？电动车充电不管是在城市还是农村，电动车其实都是人们出门最常见的交通工具。,https://toutiao.com/group/7407773012533117475/,,0,0,False
55岁乒乓奥运冠军乔红近况：邓亚萍队友，50岁结婚，已老到认不出,2024-08-02 10:57,3405,661,豆莱说,豆莱说,写作不易，希望各位观众老爷理解，每天作者写作超过12小时，收益只有50多块，文中加入5秒广告解锁，就是能为了多几块收益，观看后可免费阅读全文。文：豆莱说编辑：豆莱说乒乓是我国之骄傲，而我国优秀的乒乓球员更是数不胜数。,https://toutiao.com/group/7398484272216130087/,,0,0,False
原来他才是毁掉刘翔真凶，因贪1200万被公审，让刘翔背负多年骂名,2024-08-29 09:58,12157,370,八号探秘人,八号探秘人,在田径场上创造的成绩，至今无人能够打破，甚至在国际上享有盛名。本该继续夺冠之路，却两次因伤退赛，遭到了全网辱骂。,https://toutiao.com/group/7408489498465616410/,,0,0,False
王刚：我没移民美国，也没有10个亿，我只有一个比我小60岁的儿子,2024-09-30 15:55,1259,135,豆莱说,豆莱说,国家一级演员王刚，他在《铁齿铜牙纪晓岚》当中扮演的和珅入木三分，一度达到了以假乱真的地步。然而事实却截然相反，演了和珅的王刚并没有所谓富可敌国的家产，带着家人移民美国同样是无稽之谈。,https://toutiao.com/group/7420460816580756005/,,0,0,False
万万没想到，35岁杨颖兜兜转转干回“老本行”，活成内娱最大笑话,2024-09-16 02:41,298,191,八号探秘人,八号探秘人,“一失足成千古恨”，这句话用在她的身上，显得格外贴切。当别人35岁还在想办法红的时候，她就已经经历了从“嫩模”到“顶流”再到“嫩模”的轮回。,https://toutiao.com/group/7414910623407931923/,,0,0,False
越闹越大！一家三口被撞身亡，官方下场 家属发声，肇事者家境曝光,2024-10-16 06:31,1792,1147,赫薰辞,赫薰辞,在阅读此文之前，麻烦您点击一下“关注”，感谢大家的支持哦。文|濑名泉编辑|濑名泉前言原本幸福快乐的一家三口，却因为廖某某的一时情绪失控而丢了性命。三人全部死亡，不满2岁的孙子甚至直接就被撞碎了，现场一片狼藉。如今一家三口都已经入土为安，三棺并列，死者的母亲在葬礼上崩溃大哭。,https://toutiao.com/group/7425893474094023220/,,0,0,False
"韩国:怎么一觉醒来天又塌了!冲锋号还没吹响,19国联军就跑了一半",2024-10-19 14:13,6115,553,简单奶茶KNj,简单奶茶KNj,,https://toutiao.com/group/7427489699926639167/,,0,0,True
