title,publish_time,like_count,comment_count,media_name,source,abstract,article_url,tag,is_yaowen,article_sub_type,has_video
土豆搭配洋葱，教你一个神仙吃法，一次3斤不够吃，太解馋了,2024-09-26 09:09,18539,1136,家常的味道,家常的味道,土豆搭配洋葱，教你一个神仙吃法，一次3斤不够吃，太解馋了,https://toutiao.com/group/7418876506660667904/,,0,0,True
今天才知道！电动车“每天充”和“用完再充”，到底哪个更伤电池,2024-08-27 11:19,11126,2054,鲸探所,鲸探所,“今天到底给车充不充电？”估计大多数人每天回家都会想这个问题，看着自己的电动车电量又多又少的，充不充电也是一件非常难以抉择的事情。那么，电动车到底应该怎样充电呢？是每天都充，还是用完之后再充呢？电动车充电不管是在城市还是农村，电动车其实都是人们出门最常见的交通工具。,https://toutiao.com/group/7407773012533117475/,,0,0,False
一巴掌的代价，公交车上大妈打晕患癌小伙，断送退休后的幸福生活,2024-10-14 09:53,795,485,客观听書,客观听書,公交车上老太太和小伙吵了起来，老太太更是当仁不让直接给了小伙一巴掌。这名小伙直接倒地，老大大根本就不会想到正是因为他的一巴掌，鲜活的生命就这样消失在他的手里。,https://toutiao.com/group/7425563455358468627/,,0,0,False
夫妻俩结婚第4天还没洞房，妻子憋笑说出背后原因，丈夫表情亮了,2024-08-26 16:17,1236,161,虹新闻,虹新闻,,https://toutiao.com/group/7407483060251263539/,,0,0,True
上门女婿离婚后回老家自建房，前妻来找要复婚,2024-10-13 22:48,10647,5707,精彩话题,精彩话题,,https://toutiao.com/group/7425395887410512421/,,0,0,True
翟天临：我这辈子最正确的决定，就是退圈前，与辛芷蕾在一起了,2024-08-31 05:46,938,538,八号探秘人,八号探秘人,“好多人都放弃了我，辛芷蕾没有......”圈内好友纷纷隐身，生怕舆论波及自身，但辛芷蕾却是个例外。即便赌上事业，也要与翟天临相濡以沫，一起承受流言蜚语。,https://toutiao.com/group/7409131751957611008/,,0,0,False
已确定！央视不转播,2024-10-15 03:02,715,1273,河南商报,河南商报,在世界杯亚洲区预选赛18强赛遭遇三连败后，中国男足国家队15日将在青岛对阵印度尼西亚队。10月14日下午2点，中国足协发布了国足比赛的直播预告海报。海报显示，央视依然不在此次转播平台之列。历经长途飞行的国足，能否在3天的休整备赛后，找到应对之策？,https://toutiao.com/group/7425832543658590772/,,0,0,False
为什么演完“张桂梅”后劲这么大！,2024-10-14 23:44,1017,239,济南时报-新黄河,济南时报-新黄河,今年教师节，根据张桂梅真实事迹改编的电视剧《山花烂漫时》播出。剧播完大半个月了，口碑还在攀升，截至目前，10万人打出9.4分，拿下今年国产剧最高分。 演员宋佳，以细腻爽利的演技还原了一个张桂梅都认可的“张桂梅”。,http://www.hzfanews.com/detail.html?id=E3A55DF0398C1F6F4BCFA27E793211AFCE1035A7C63CD194,,0,0,False
网红郭有才，泡沫散去之后，曾经飘的有多高，如今摔得就有多惨,2024-09-30 09:36,711,431,八号探秘人,八号探秘人,曾经那个卖烧烤的店小二，可能怎么都想不到，自己会成为一个千万粉丝的网红。郭有才在刚成为网红之后的期望也很有意思，那就是每天能赚到300元就行。可现实却是靠着直播广告分成，他的收入直接比期望值翻了上千倍。有人说他其貌不扬，但是平凡人逆袭的典范，还有的人说他长的像日本人。,https://toutiao.com/group/7419978325617082932/,,0,0,False
如今回头看恒大，许家印是赢了还是输了？！,2024-07-29 11:03,42040,23392,缤纷海燕YrEkWp,缤纷海燕YrEkWp,,https://toutiao.com/group/7397011739571421708/,,0,0,True
有人冒充我男朋友，算不算诈骗？遇到奇葩事你会怎么办？,2024-09-06 05:52,1696,224,兴凯湖莹莹,兴凯湖莹莹,,https://toutiao.com/group/7411404025502892554/,,0,0,True
万万没想到，35岁杨颖兜兜转转干回“老本行”，活成内娱最大笑话,2024-09-06 07:55,535,137,读万卷书的张飞,读万卷书的张飞,文l张飞编辑l张飞曾经你看不起别人；如今谁又瞧得上你？在节目中丝毫不考虑他人状态，一味地只追求自己的镜头。甚至还在采访中公然表示“自己早就应该把所有奖拿了个遍了”。更关键的是丝毫没有任何“报恩”之心。所以如今曾经所有的“嚣张”“高高在上”遭到反噬，只能说现在谁还“愿意”认识她！,https://toutiao.com/group/7411434661014012456/,,0,0,False
韩国在集结部队,2024-10-15 12:46,638,356,飞先生,飞先生,,https://toutiao.com/group/7425982832272474659/,,0,0,True
正在消失的中国方便面,2024-10-14 09:00,2110,1340,读者,读者,饥饿来临时，只要能在柜子里翻出一包方便面，心里的大石便可轻轻落下。撕开塑料碗，噼里啪啦声，在一饼干面条上挤上酱料包，注入开水，趁着水汽逃逸之前，盖上泡面盖。,https://toutiao.com/group/7425462077387293195/,,0,0,False
演员张瑜：离婚后单身30年，再见前夫仍感到心动，66岁没有子女,2024-07-24 10:51,20018,1371,八号探秘人,八号探秘人,在阅读此文之前，辛苦您点击一下“关注”，既方便您进行讨论和分享，又能给您带来不一样的参与感，感谢您的支持！写作不易，作者每天辛苦写稿，只是为了养家糊口，希望各位观众老爷可以多多理解。文中加入5秒广告解锁，观看5秒后便可免费阅读全文啦，感谢各位观众老爷的理解与支持！,https://toutiao.com/group/7395130917804720640/,,0,0,False
她曾被前夫一巴掌扇到离婚！二婚嫁世界冠军，如今生活幸福滋润,2024-09-10 09:12,11776,227,豆莱说,豆莱说,“漂亮的让人挪不开眼”是圈内人对她的评价，和“山杏”不一样的是，李琳在现实生活中的感情很是幸运，遇到了导演王小列。,https://toutiao.com/group/7412930201929204236/,,0,0,False
她是央视最惨主持人，男友被判死缓，丈夫诈骗入狱，47岁无人敢娶,2024-08-27 23:30,2222,209,闻书识焉,闻书识焉,她曾是央视的台柱子，和董卿、周涛并称为央视的三朵金花。回顾刘芳菲的前半生，最令人感到惋惜的，便是她的感情生活，47岁至今无人敢娶。,https://toutiao.com/group/7407743113688564258/,,0,0,False
如何看待朝鲜宣布永久切断并封锁与韩国交界的南部国境这一事件？,2024-10-12 11:30,11126,149,李莉观察,李莉观察,如何看待朝鲜宣布永久切断并封锁与韩国交界的南部国境这一事件？,https://toutiao.com/group/7424768697903874579/,,0,0,True
“央视一姐”到“查无此人”，54岁的鲁豫，终将还是走到今天这步,2024-09-02 06:24,356,327,八号探秘人,八号探秘人,可谁又能想到，曾经的主持女王，如今却沦落到“查无此人”的地步。然而，当54岁的她再次出现在荧幕上时，不禁令无数观众对她的境况感到唏嘘。,https://toutiao.com/group/7409927726951399976/,,0,0,False
1000在上海怎么活？饥一顿饱一顿的！今天五斤牛排一瓶酒，爱谁谁,2024-07-18 00:00,2379,604,兴凯湖莹莹,兴凯湖莹莹,消费降级，钱难赚，能省则省,https://toutiao.com/group/7392619432863859234/,,0,0,True
新华社快讯：据韩国媒体报道，韩军向韩朝军事分界线以南进行应对射击,2024-10-15 04:17,2971,6007,红星新闻,红星新闻,新华社快讯：据韩国媒体15日报道，韩军向韩朝军事分界线以南进行应对射击。,https://toutiao.com/group/7425851589014995510/,,0,0,False
