title,publish_time,like_count,comment_count,media_name,source,abstract,article_url,tag,is_yaowen,article_sub_type,has_video
小伙洗完澡故意秀肌肉，富婆心跳加速被当场拿下，这下好看了,2024-10-26 16:20,6782,274,乐视情感讲堂,乐视情感讲堂,小伙洗完澡故意秀肌肉，富婆心跳加速被当场拿下，这下好看了,https://toutiao.com/group/7430011217881596426/,,0,0,True
吉林美女带俩娃，嫁给头婚小叔子，婆婆一手撮合，如今过得怎样了,2024-11-01 08:01,2841,855,睿之悦,睿之悦,说出来可能很多人都不相信，吉林一位带着两个孩子的美女在婆婆的大力撮合下嫁给了自己的小叔子。2020年，这位女子的丈夫因为意外去世，留下了她们孤儿寡母悲痛欲绝。,https://toutiao.com/group/7432216069030363682/,,0,0,False
真低俗还是假专业？一场演唱会，揭开刀郎真实处境，难怪他们力挺,2024-09-23 06:37,1161,169,读万卷书的张飞,读万卷书的张飞,正如《罗刹海市》中的歌词，你能说没有内涵某些人吗?《2002年的第一场雪》爆火，专辑销售量更是吊打所谓的“资源咖”，乐坛出现了刀郎。,https://toutiao.com/group/7417723405191758351/,,0,0,False
拜登下台前，还想和中方见一面，背后有三大目的，中方态度很明显,2024-11-10 03:38,4002,3780,兵说,兵说,但令人没想到的是，当了快四年总统都没有访华的拜登，在这总统生涯的最后时刻态度却是出现了重大变化，突然想要和中方见一面。,https://toutiao.com/group/7435488747547869705/,,0,0,False
被拐男子认亲一年后，与家人彻底决裂！,2024-11-05 08:45,3000,1624,环球网,环球网,来源：宁波晚报 近日因寻亲走红的郁豹豹与家人决裂的消息引发关注，冲上热搜。据报道，2023年9月，被拐卖34年的郁豹豹寻亲成功。认亲不到半个月，郁豹豹与两个弟弟开始直播带货。不到两个月，三兄弟逐渐走向分崩离析。令他更无法接受的是，他与母亲也渐生隔阂。,https://3w.huanqiu.com/a/14459a/4K8FGmdmzMW?agt=20,,0,0,False
深夜通报：已拘留！情况属实！,2024-11-10 07:19,1459,345,全国党媒信息公共平台,全国党媒信息公共平台,11月8日，一名网络博主发视频爆料，称自己接到投稿线索，10月17日在河南安阳市妇幼保健院内发现隐藏针孔摄像头，安装于医院二楼的一间护士更衣室内。,https://api-m.hubpd.com/transfer?nextUrl=https%3A%2F%2Fwww.hubpd.com%2Fhubpd%2Frss%2Ftoutiao%2Findex.html&contentId=3170534137672085200,,0,1,False
特朗普官宣首个人事任命，对华政策将如何变？中方需把握四大要点,2024-11-10 08:37,19018,1282,邱震海,邱震海,,https://toutiao.com/group/7435567059721552421/,,0,0,True
俩人相亲互相看不上，哪料男方一报母亲身份，姑娘乐了,2024-11-08 01:50,6216,1596,乐视群星访谈秀,乐视群星访谈秀,,https://toutiao.com/group/7434719902990074395/,,0,0,True
珠海航展 “机器狼”首次公开亮相！“铁翼飞旋”带你一探究竟,2024-11-09 02:27,46796,5951,央视频,央视频,,https://toutiao.com/group/7435100516647502336/,,0,0,True
台积电被曝将应美国要求，从11月11日起停止向中国大陆客户供货先进AI芯片,2024-11-10 06:27,1914,2317,观察者网,观察者网,据路透社当地时间11月9日援引一名知情人士独家报道称，美国已要求台积电从11月11日开始，停止向中国大陆客户运送常用于人工智能应用领域的先进芯片。,https://www.guancha.cn/internation/2024_11_10_754844.shtml,,0,0,False
特务男扮女装混进村子，孩子兵顿时发现不对劲，这下精彩了,2024-10-28 06:09,3182,313,乐视群星访谈秀,乐视群星访谈秀,,https://toutiao.com/group/7430704630294413878/,,0,0,True
吃播网红恩克半年吃110只羊，眼神呆滞脸黑成炭，网友求他别吃了,2024-11-04 08:22,1041,746,与君説,与君説,在阅读此文之前，麻烦您点击一下“关注”，既方便您进行讨论和分享，又能给您带来不一样的参与感，感谢您的支持文、编辑|是否古人估计都没想到后世子孙通过吃饭就能赚得盆满钵满。短视频的迅速崛起给人们带来了很多生财之道，吃播就是其中一个。,https://toutiao.com/group/7433333039997977107/,,0,0,False
快消失的12个生活用品！40年前在供销社红极一时，你家还在用吗？,2024-09-29 07:58,4989,356,万物知识局,万物知识局,在这里，可以买到从油盐酱醋到衣物鞋帽，再到农具化肥等各种生活必需品，每一样物品都凝聚着时代的特色，见证了那个年代人们的生活状态，今天我们就来走进那些年能够在供销社里买到的生活用品，看看你们还记得哪些。,https://toutiao.com/group/7419937237548237322/,,0,0,False
罕见！100年前，英国游客拍下的清朝乡村，和想象中完全不一样,2024-09-20 02:07,5622,596,万物知识局,万物知识局,泥泞的土路，衣不蔽体的老百姓，即便是达官显贵的家中也十分破败，而这些都是清王朝的历史痕迹，虽说那时候中国摄影技术并不发达，但也有许多外国游客来到这里，拍摄下了许多老照片，为我们留下了珍贵的历史资料，那清朝到底是怎样的面貌呢?,https://toutiao.com/group/7416287738871267855/,,0,0,False
5年前站在美国军舰上，用中文警告我国海军的华人女兵，现在如何,2024-10-08 09:57,715,147,睿之悦,睿之悦,2019年，身为华裔女兵的郑浩儿站在一艘美国军舰上，用着一口标准的中文喊话中国海军。事件一出便令无数国人都感到十分的愤慨，很多人也将她和“卖国贼”联系在一起。,https://toutiao.com/group/7423340415275581952/,,0,0,False
他是著名歌唱家，63岁抛弃结发妻子，65岁再婚娶小30岁学生引争议,2024-11-09 07:40,1146,600,不似少溓游,不似少溓游,文 | 不似少溓游编辑 | 不似少溓游两个月前，著名歌唱家莫华伦与妻子王冰冰一起到日本游玩。或许是因为年龄差距太明显，举止亲密的他们总是引来路人的侧目。也难怪，毕竟莫华伦今年都已经65岁了，但王冰冰却才35岁，两人站在一起时简直活像祖孙俩。,https://toutiao.com/group/7435095988886405651/,,0,0,False
1米3袖珍美女嫁给1米48男孩，婚后丈夫奇迹长高，两人却不欢而散,2024-09-07 02:55,3455,198,睿之悦,睿之悦,杨萍和葛存苗的婚礼 文|睿之悦 编辑|睿之悦2019年，成都的民政局来了两个“10岁小孩”来登记，工作人员以为是玩闹。两个“小孩”拿出身份证让工作人员看，这才明白，原来是两个再也长不高的成年袖珍人情侣。,https://toutiao.com/group/7411713833267364386/,,0,0,False
安徽美女道士胡小慧被捕：精通“胡媚术”，九名男徒弟揭露其罪行,2024-09-12 08:10,3800,429,艺述史,艺述史,在安徽一处偏僻山头上，有座神秘的道观，外表平平无奇，但里面却有着一位名气很高的美女道士。美女道士的名字叫做胡小慧，据说有着高深的法力，能帮人消灾解难。很多人慕名前来，交上丰厚的香火钱，在袅袅青烟里，试图从这个年轻道士身上获得一些生活的支撑。,https://toutiao.com/group/7413662261274739200/,,0,0,False
穷小子去富婆家里，富婆笑咧嘴把保姆支开，保姆心知肚明,2024-10-26 06:34,1960,237,乐视情感讲堂,乐视情感讲堂,穷小子去富婆家里，富婆笑咧嘴把保姆支开，保姆心知肚明,https://toutiao.com/group/7429969094939509311/,,0,0,True
被姚明抱着上奥运的小英雄，曾发誓考上清华，16年后活成了这样,2024-11-07 08:07,1036,299,睿之悦,睿之悦,2008年，年仅9岁的林浩，在姚明的带领下走进了北京奥运会开幕式的舞台上，成为了万众瞩目的“焦点”。,https://toutiao.com/group/7434444094551687707/,,0,0,False
湖南衡阳一15岁孩子骑电动车为躲交警罚款，逆行被撞身亡？当地居民：逝者是40岁左右男性,2024-11-09 12:19,289,313,极目新闻,极目新闻,今天（9日），都市现场记者注意到有网友发布视频，称11月7日在湖南省衡阳市衡州大道万达广场门口，一名15岁骑电动车的孩子遇交警查车，为躲避20元罚款逆向行驶逃逸，被小车撞飞身亡。都市现场记者在网友发布的视频中看到，事发现场一辆印有“衡阳市中心医院”的120救护车已经到达。,http://jms.ctdsb.net/jmythshare/#/index_share?cId=0&contentType=5&contentId=2300112,,0,0,False
中国国乒又火了！决胜时刻，领军人物疯狂逆转，上演最解气的一幕,2024-11-04 00:00,6173,703,乐播体育,乐播体育,,https://toutiao.com/group/7433056969079915020/,,0,0,True
15年前他在爱妻葬礼上哭到昏厥，发誓永不再娶，如今他做到了吗？,2024-08-24 02:17,19105,588,八号探秘人,八号探秘人,在阅读此文之前，辛苦您点击一下“关注”，既方便您进行讨论和分享，又能给您带来不一样的参与感，感谢您的支持！编辑丨xk纵观鱼龙混杂的娱乐圈，有人背叛，有人痴情。而果靖霖则是公认的好男儿，将一生都奉献给妻子。但妻子却仅仅陪他走了半生，没能战胜病魔，不幸离开人世。,https://toutiao.com/group/7406210316734710283/,,0,0,False
“两头婚”在国内悄然出现，“两头婚”逐渐增多？你能接受吗？,2024-10-16 09:01,795,728,读者,读者,你听说过“两头婚”吗？最近这几年，在年轻人中间流行起了一种新型婚姻形式——两头婚。对于他们而言，这种婚姻形式不仅仅是一种全新尝试，更是除了传统婚姻之外的一种完美选择。那么，这种新型的婚姻模式，真的代表了更理想的婚姻选择吗？,https://toutiao.com/group/7426187021527384615/,,0,0,False
中国制造到底怎么样？最近，美媒说了句大实话！,2024-11-06 11:50,2653,240,火星方阵,火星方阵,美媒彭博社感叹，尽管近6年多来美国对华实施了加征关税、出口管制和金融制裁，但中国仍在新兴技术方面稳步前进。例如中国制造的电动车、光伏板、智能手机等产品，在除美国外的全球范围内被广泛使用。彭博社还特别指出，在全球13项关键技术中，中国在5项中获得全球领先地位，7项进步神速。,https://toutiao.com/group/7434101803479728640/,,0,0,True
67岁执意生娃，如今却坐轮椅无法自理，5岁的天赐被迫独立学洗衣,2024-11-04 10:32,2306,595,睿之悦,睿之悦,2019年，已经67岁的田新菊执意生下了自己的第三个孩子小天赐。那么，现如今5年的时间过去了，这“天赐”的礼物到底是福还是祸呢?,https://toutiao.com/group/7433367394946384435/,,0,0,False
美妇约见老情人，见面场景真是太逗了，这俩人绝配！,2024-10-27 16:25,2616,333,乐视明星的那点事,乐视明星的那点事,美妇约见老情人，见面场景真是太逗了，这俩人绝配！,https://toutiao.com/group/7428157095108674088/,,0,0,True
佩洛西警告选民：由于大脑机能的恶化，特朗普将干不完四年总统,2024-11-04 04:02,8278,5167,中国国情,中国国情,佩洛西警告选民：由于大脑机能的恶化，特朗普将干不完四年总统,https://toutiao.com/group/7433269630753309225/,,0,0,True
外国博主发布我在24小时内离开了中国“地狱”之旅的视频,2024-11-02 00:53,20283,5219,分享有趣故事,分享有趣故事,,https://toutiao.com/group/7432478785422754345/,,0,0,True
