title,publish_time,like_count,comment_count,media_name,source,abstract,article_url,tag,is_yaowen,article_sub_type,has_video
中方亲口证实，解放军开始反制，战区司令发声促统，7国不许收台,2025-03-18 05:59,8873,4708,徐量,徐量,7国集团不许收台又做了什么?近来，岛内赖清德当局以及美西方外部势力在涉台问题上的挑衅动作接连不断。而在这之前，美国及其盟友还不断地派遣军机军舰擅闯台湾海峡，以此来向赖当局及岛内“台独”势力释放严重错误信号。,https://toutiao.com/group/7483024499546407433/,,0,0,False
连夜下架！央视315曝光：国民酸奶再暴雷！喝过的快检查身体,2025-03-18 13:44,1174,442,奋发荷叶OA,奋发荷叶OA,,https://toutiao.com/group/7483145045945451059/,,0,0,True
15年的金赛纶嫩得可以掐出水来，怎么看都是小妹妹啊怎么会这样,2025-03-18 06:37,415,235,小卿卿159,小卿卿159,,https://toutiao.com/group/7483033889238155795/,,0,0,False
全世界睡不着的就是百度老板李彦宏了，没想到自己公司有卧龙凤雏,2025-03-18 14:50,840,840,清清河水,清清河水,自己本来想设两个副总裁职位帮助自己打理事业的万万没想到就是这两个副总裁马上要把自己的事业搞没了。身为女生本来以为是个精英，应该展现自己好的一面，万万没想到就因为一个一段发言直接被骂上了热搜。,https://toutiao.com/group/7483161924453073462/,,0,0,False
日本“妻子机器人”迅速售空，与人造子宫结合或淘汰女性？太扯了,2025-03-18 22:53,851,122,答案在这儿,答案在这儿,如果能制造一台仿生人，然后在仿生人上搭载这种人工智能软件，那么这种仿生人就能成为在表现上非常接近人类的“伴侣机器人”。,https://toutiao.com/group/7482685235918881320/,,0,0,False
判了，在香港国泰航班上“大打出手”的内地与香港两女子这样结案了！国泰航空歧视风波后的整改承诺兑现了吗,2025-03-13 14:03,1572,581,粤港澳观察,粤港澳观察,一名内地女子和一名香港女子在国泰航空的一架航班上，因一名儿童哭喊而引发口角，随后双方“大打出手”，两人先互相投掷水瓶，随后又互扔软垫等物品。,https://toutiao.com/group/7481258246406160932/,,0,0,False
王思聪和懒懒现身伦敦购物，全程提东西付款好绅士 女友脸好小,2025-03-15 23:55,160,198,自由的苹果41,自由的苹果41,,https://toutiao.com/group/7481971994792133135/,,0,0,False
