title,publish_time,like_count,comment_count,media_name,source,abstract,article_url,tag,is_yaowen,article_sub_type,has_video
公公竟然和儿媳偷情，哪料被妻子撞见，这下有戏看了！,2025-01-21 08:05,7773,705,南瓜午夜厅,南瓜午夜厅,,https://toutiao.com/group/7462273852651979274/,,0,0,True
来不及：小姨子找姐夫要说法，没想姐夫衣冠禽兽，小姨子都不放过,2025-01-22 18:37,2236,154,乐视激斗影院,乐视激斗影院,,https://toutiao.com/group/7462625291735695923/,,0,0,True
女房东爱上24岁男租客，这样的话也说得出口，涂磊神助攻,2025-01-18 02:53,4530,222,金曲大荟萃,金曲大荟萃,女房东爱上24岁男租客，这样的话也说得出口，涂磊神助攻,https://toutiao.com/group/7461083095078044195/,,0,0,True
宋小宝撞上闫学晶，俩唱二人转的真人精！笑点疯狂往外抖,2025-01-06 03:43,3801,531,PP影视圈剧院,PP影视圈剧院,,https://toutiao.com/group/7456641563670676018/,,0,0,True
赵本山凭这一个小品，捧红了王小利，全程笑点不断,2025-01-04 20:46,6151,1318,娱快很简单,娱快很简单,,https://toutiao.com/group/7454123678406541824/,,0,0,True
前妻刚做了手术，老白来照顾，想复婚就直说嘛,2025-01-21 16:08,3497,752,PP大咖剧院,PP大咖剧院,,https://toutiao.com/group/7461496017377116707/,,0,0,True
老虎罕见捕猎镜头，比大片还震撼！……,2025-01-24 05:44,3108,732,你若不离不弃！我必生死相依！,你若不离不弃！我必生死相依！,,https://toutiao.com/group/7463353764549526016/,,0,0,True
