title,publish_time,like_count,comment_count,media_name,source,abstract,article_url,tag,is_yaowen,article_sub_type,has_video
最高院：再次重申机动车与非机动车发生交通事故，非机动车一方存在过错的，应当依法减轻机动车一方赔偿责任,2025-04-04 01:54,1221,435,青海普法,青海普法,非机动车一方存在过错的，应当依法减轻机动车一方赔偿责任。——王某与李某、某保险公司机动车交通事故责任纠纷案。,https://toutiao.com/group/7488914613439054388/,,0,0,False
夫妻本是同林鸟，但很抱歉，这次就算是罗晋也救不了唐嫣,2025-04-03 16:00,328,163,娱乐小火花,娱乐小火花,从杨幂的《狐妖小红娘·月红篇》到刘诗诗的《淮水竹亭》再到唐嫣的《念无双》。更何况，仙侠剧这种类型在90/95小花的市场已经饱和。,https://toutiao.com/group/7489018261896446475/,,0,0,False
缅甸地方武装到底有多豪横，让我们看看这段视频就知道了，,2025-04-04 18:30,6523,1103,小团团圆圆,小团团圆圆,,https://toutiao.com/group/7489526767607104035/,,0,0,True
静思有我:李嘉诚事件已收场！点评透彻！！,2025-03-31 04:11,7494,537,优雅溪流,优雅溪流,,https://toutiao.com/group/7487821388864619047/,,0,0,True
这才是刚走完长征的毛主席相貌，美国人拍摄，满脸憔悴，瘦得脱相,2025-02-06 07:41,7316,364,历史李老师,历史李老师,毛主席众所周知，毛主席走完长征抵达陕北后，初期来到保安县（今志丹县）生活，但留下的照片寥寥无几，其中绝大多数都是出自美国记者埃德加·斯诺之手。本文开始这张老照片拍摄于1936年春夏之际，这也是一张极其珍贵的毛主席照片。,https://toutiao.com/group/7466467145896116771/,,0,0,False
李湘每天富养自己，却吃成这样了。网友：这该有200斤吧！,2025-04-04 04:56,300,221,浮生,浮生,,https://toutiao.com/group/7489316871007650344/,,0,0,False
