title,publish_time,like_count,comment_count,media_name,source,abstract,article_url,tag,is_yaowen,article_sub_type,has_video
沙利文的结局已定，他在离开白宫之前，说出了中美发生战争的结果,2024-12-16 02:48,12448,318,全荃,全荃,沙利文的结局已定，他在离开白宫之前，说出了中美发生战争的结果,https://toutiao.com/group/7448833372408775187/,,0,0,True
著名表演艺术家谢芳今天凌晨逝世，走前半小时与家人说了一句话……,2024-12-19 01:00,7783,2461,大河报,大河报,北京日报客户端记者独家获悉，著名电影表演艺术家，电影《青春之歌》中林道静的扮演者谢芳，于今日（12月19日）凌晨2时14分在北京安贞医院逝世，享年89岁。谢芳的儿媳妇李海平向北京日报客户端记者证实了这个消息。,https://news.dahebao.cn/dahe/appcommunity/2127437?newsId=2127437,,0,0,False
马光远：大城市才有机会的观点过时了 #财经大咖来了,2024-12-17 06:00,6435,485,光远看经济,光远看经济,,https://toutiao.com/group/7449256659496469027/,,0,0,True
广西49岁老汉娶19岁姑娘，结婚21年生下15个孩子，如今有何下场？,2024-10-20 08:32,8089,986,艺述史,艺述史,她19岁出嫁，21年里总共生育了15个孩子，其中4个男孩子11个女孩子，家里热闹的像是开了一所学校一样。,https://toutiao.com/group/7427400319418384948/,,0,0,False
女子被多人密谋灌醉强奸后投江自尽，生前在手机备忘录记下被胁迫经过，三男子获罪,2024-12-18 16:40,7772,6714,红星新闻,红星新闻,投河自尽前，黄某某于2023年7月4日在其手机内创建了备忘录，记录下了她被胁迫的经过，这也成为了公检法日后侦查、起诉和判决的重要物证。,https://cdsbrss.cdsb.com/toutiao_no_video.php?url=https%3A%2F%2Fstatic.cdsb.com%2Fmicropub%2FArticles%2F202412%2Fc6419feb940b5f2c2302f01847e73bb8.html,,0,0,False
丈母娘觉得女婿没本事，谁料去他单位一看，被女婿官威吓傻,2024-11-25 02:07,913,205,南瓜最前线,南瓜最前线,,https://toutiao.com/group/7441032711340294696/,,0,0,True
80岁老奶奶做红烧鱼从来不粘锅不破皮，原来技巧这么简单,2024-10-16 12:07,5975,331,家常的味道,家常的味道,,https://toutiao.com/group/7426343891651985974/,,0,0,True
小品：杨帆演小沈阳，撒贝宁演赵本山，台词功底太强了吧,2024-11-23 06:13,6323,119,PP宫斗放映厅,PP宫斗放映厅,,https://toutiao.com/group/7440353912709710386/,,0,0,True
67岁执意生娃，如今却坐轮椅无法自理，5岁的天赐被迫独立学洗衣,2024-11-04 10:32,9372,2105,睿之悦,睿之悦,2019年，已经67岁的田新菊执意生下了自己的第三个孩子小天赐。那么，现如今5年的时间过去了，这“天赐”的礼物到底是福还是祸呢?,https://toutiao.com/group/7433367394946384435/,,0,0,False
养殖虾都是吃抗生素、激素长大的？到底能不能吃？告诉你真相,2024-10-10 10:02,1671,532,奇妙的本草,奇妙的本草,菜市场里，几位阿姨一起围着在一处海鲜档口处讨论！“现在的虾真是大个儿，还这么便宜！不买上几斤感觉都亏了！”李阿姨高兴地说。王阿姨却连连摇头：“可别太高兴，我听说这些大都是养殖虾，吃了不少激素和抗生素呢，吃了对身体不好。”“真的吗？”李阿姨惊讶地问。,https://toutiao.com/group/7424084752157950516/,,0,0,False
中央定调！2025年养老金双增长，养老金领取条件有变，一类人不涨,2024-12-14 08:18,4105,340,思之想之,思之想之,2025年养老金调整最新消息来了，中央已经定调，2025年养老金将迎来双增长。另外提醒大家，2025年起养老金领取条件有变，一类人不参加2025年养老金调整，具体是什么呢？一起来了解。,https://toutiao.com/group/7448174128252682788/,,0,0,False
土豆搭配洋葱，教你一个神仙吃法，一次3斤不够吃，太解馋了,2024-09-26 09:09,38399,2274,家常的味道,家常的味道,土豆搭配洋葱，教你一个神仙吃法，一次3斤不够吃，太解馋了,https://toutiao.com/group/7418876506660667904/,,0,0,True
“取消公摊面积”，一周两地官宣！购房成本会降吗？业内人士：“取消公摊”与“按套内面积计价”是两码事,2024-12-18 16:31,299,866,每日经济新闻,每日经济新闻,12月17日，河北省张家口市发文明确，取消商品房销售价格限价机制，鼓励实行“现房销售”，逐步推进“取消公摊”。,http://www.nbd.com.cn/rss/jinri_toutiao/articles/3691083.html,,0,0,False
包厢全是刚出狱的恶霸，结果一看到饭店主厨，立马怂了,2024-11-11 01:21,13163,362,乐视群星访谈秀,乐视群星访谈秀,,https://toutiao.com/group/7435825833048015400/,,0,0,True
女友怀孕了，男友不装了，带她回豪宅！,2024-11-23 08:01,17793,1302,乐视大综艺咖,乐视大综艺咖,,https://toutiao.com/group/7440353629540483593/,,0,0,True
炸肉丸子，到底用淀粉还是面粉，教你一招，外酥里软超好吃,2024-10-01 09:23,6830,529,家常的味道,家常的味道,,https://toutiao.com/group/7420735473208787492/,,0,0,True
海南富商张晖：花8亿建108米海上观音像，4年后死在水中死因成谜,2024-10-19 04:49,3503,595,八号探秘人,八号探秘人,在阅读此文之前，辛苦您点击一下“关注”，既方便您进行讨论和分享，又能给您带来不一样的参与感，感谢您的支持！编辑丨xk他是中国的一名富商，耗费8亿元完成了自己的梦想。可梦想落地成为现实的时候，他却在4年后莫名其妙的死去。他就是张晖，上个世纪末海南岛旅游业的龙头当家人。,https://toutiao.com/group/7427288913095492134/,,0,0,False
河南警察3岁女儿被拐，苦寻全国23年无果，结果却发现女儿在对门,2024-11-05 07:43,4706,536,八号探秘人,八号探秘人,寻亲23年无果，丢失的女儿竟住在对门?但它却真实发生在河南洛阳的梁绍波身上。是意外走丢，还是人贩子所为，三岁的女儿怎会离奇失踪?,https://toutiao.com/group/7433697108120142345/,,0,0,False
特朗普就职典礼邀请中方，不按常理出牌！接不接招？,2024-12-13 04:00,5365,1152,蒋晓峰Terry,蒋晓峰Terry,,https://toutiao.com/group/7447741482288546338/,,0,0,True
俄罗斯用血的代价又给我们上了一课，未来终极一战开打，严防内鬼,2024-12-18 11:03,3739,951,书房点兵,书房点兵,我们可以简单例数下，最近一段时间莫斯科遭遇的各类袭击:12月17日，俄军三防部队司令伊戈尔·基里洛夫在莫斯科主干道梁赞大街上遭遇路边炸弹爆炸袭击，当场身亡。,https://toutiao.com/group/7449705021043950107/,,0,0,False
温州多家私人影院“可触摸服务人员隐私部位”？记者暗访后报警！警方：已对三个场所行政立案,2024-12-17 08:00,11779,3756,大风新闻,大风新闻,挂着“私人影院”的招牌，线上招徕生意，线下如同幽灵，连地址都是虚假的，居然还设“暗室”对付查处。近日，有网民向大皖新闻反映，在浙江省温州市一些颇受年轻人青睐的私人影院，悄然滋生了一些涉黄服务。,https://toutiao.com/group/7449286844203713062/,,0,0,False
中央定调！2025年养老金迎来新调整，退休新规实施，还有个好消息,2024-12-14 00:24,7316,604,思之想之,思之想之,2025年马上就要来了，这是一个充满变化的关键的年份，这是十四五规划的最后一年，很多政策将会兑现。2025年，除了养老金继续用来调整之外，退休新规也将会正式实施，还有一个好消息，具体是什么呢?,https://toutiao.com/group/7448052182332473867/,,0,0,False
郭有才：当迷失方向忘记初心后，曾经飘得多高，如今摔得就多惨,2024-11-11 06:53,1932,863,八号探秘人,八号探秘人,在阅读此文之前，辛苦您点击一下“关注”，既方便您进行讨论和分享，又能给您带来不一样的参与感，感谢您的支持！编辑丨brt因为一首翻唱，他一夜之间成为了拥有千万粉丝的网红。但是“人红是非多”，不久他就因为版权等问题陷入了舆论风波。他的人气一落千丈，从万众瞩目变成了现在的无人问津。,https://toutiao.com/group/7435901170239078948/,,0,0,False
美国遣返中国非法移民？他们跟中国已经没关系了，爱到哪到哪,2024-12-14 01:05,27951,5069,金灿荣教授,金灿荣教授,,https://toutiao.com/group/7447851020526289423/,,0,0,True
美国对华布局与韩国戒严巧合？尹锡悦被弹劾困兽犹斗，手握王牌,2024-12-15 22:01,30392,1257,黎建南台湾,黎建南台湾,,https://toutiao.com/group/7448762044733456908/,,0,0,True
富二代当兵却逃跑回家，班长去他家抓人，一进家门瞬间惊了,2024-10-26 02:59,13938,1139,乐视天天剧好看,乐视天天剧好看,,https://toutiao.com/group/7429913203359875636/,,0,0,True
毛人凤下令带走死囚，哪料死囚的靠山露面了，毛人凤当场懵了,2024-11-25 03:05,11826,2085,南哥硬汉秀,南哥硬汉秀,,https://toutiao.com/group/7441047753771188799/,,0,0,True
明确了！2025年养老金实现双增长，三类人可以多涨，两类人不涨,2024-12-15 05:23,1258,334,社保当家,社保当家,明确了！2025年养老金实现双增长，三类人可以多涨，两类人不涨在2025年到来之前，关于养老金上涨的消息就已经明确，中央经济工作会议给退休人员送上了一个大大的惊喜。2025年，养老金将继续实现双增长，不过有三类人可以多涨，两类人不涨，一起来看看。,https://toutiao.com/group/7448496604800762394/,,0,0,False
黄渤找孙红雷借钱这段，据说笑趴整个剧组，百看不厌！,2024-12-03 02:43,816,113,南瓜最前线,南瓜最前线,,https://toutiao.com/group/7444010734444347904/,,0,0,True
俄博主盛赞朝鲜士兵，行动迅速作战凶猛，跟俄军表现完全不一样,2024-12-16 11:13,14058,1750,杜文龙,杜文龙,,https://toutiao.com/group/7448966209216709156/,,0,0,True
冬季自驾游，零下四十度睡车里，半夜冻醒了，车里全部冻住了！,2024-12-13 11:02,12925,2758,旅行者小多,旅行者小多,,https://toutiao.com/group/7447850219347116544/,,0,0,True
曹德旺预言：2025年，没有买房的人，五年后是失败者还是幸运儿？,2024-12-16 05:57,5023,1758,议史纪,议史纪,其实早在多年前年，“玻璃大王”曹德旺就曾预言:“房地产将成为有钱人击鼓传花的游戏”，房子就是钢筋混凝土，是不会保值的?,https://toutiao.com/group/7448883228297003539/,,0,0,False
明确了！2025年养老金实现双增长，还有两个好消息，同样值得看看,2024-12-16 00:08,1247,222,社保当家,社保当家,明确了！2025年养老金实现双增长，还有两个好消息，同样值得看看2025年就要跟我们见面了，关于养老金的好消息也接踵而至，其中让人感到惊喜的，无疑是中央经济工作会议明确了2025年将继续提高养老金，而且还是同时提高职工养老金和城乡居民养老金，也就是实现双增长。,https://toutiao.com/group/7448518245453218354/,,0,0,False
炸小鱼，放面粉或淀粉是大错，教你正确做法，酥脆好吃太解馋了,2024-11-13 13:37,2934,280,天天做美味,天天做美味,,https://toutiao.com/group/7436757641869427212/,,0,0,True
“取消公摊面积”，一周两地官宣！购房成本会降吗？,2024-12-18 23:52,143,132,看看新闻,看看新闻,“取消公摊面积”，一周两地官宣！购房成本会降吗？,http://mediaplay.kksmg.com/2024/12/19/h264_720p_600k_78496-smgnews-20241219065500-9000-966232-600k_mp4.mp4,,0,0,True
个人养老金制度推行将带来哪些影响？一文解读,2024-12-13 03:32,2239,860,国际在线,国际在线,,https://crionline-media.cri.cn/cb5a6d96-d0c4-4fd0-a895-b6135667d84a/video/40d1574ab9094c2c91da2c53e8db16ca.mp4,,0,0,True
冬季骑行西藏，害怕有狼借宿废弃小屋，还有柴火炉可以取暖做饭吃,2024-12-16 03:59,30709,4439,刘伟元的旅行,刘伟元的旅行,,https://toutiao.com/group/7448551716082942505/,,0,0,True
弟弟光荣退伍，姐姐兴奋去车站接他，怎料一见弟弟瞬间哭了,2024-11-05 06:34,38264,3198,乐视天天剧好看,乐视天天剧好看,,https://toutiao.com/group/7433679820573934091/,,0,0,True
32步广场舞《活在世上就要快乐》苦了累了听一听，放松心情,2024-11-04 00:05,911,171,华美舞动广场舞,华美舞动广场舞,华美舞动广场舞《活在世上就要快乐》网络热歌，32步背面演示，学跳更轻松更方便,https://toutiao.com/group/7433204407086350898/,,0,0,True
