title,publish_time,like_count,comment_count,media_name,source,abstract,article_url,tag,is_yaowen,article_sub_type,has_video
画面过于血腥，有人要中国道歉,2024-09-22 12:45,29281,3743,司马南,司马南,"以色列以其卑鄙的无耻的下流的创意，以大规模的国家恐怖主义的方法，将民用设备通信工具变成杀人的武器。
如此厚颜无耻，竟然信誓旦旦，丝毫不加掩饰。
#巴以冲突# #黎巴嫩人害怕爆炸不敢用手机#",https://toutiao.com/group/7417447762943279628/,,0,0,True
2013年，湖南26岁女孩嫁给71岁老头，婚后还生下一子，如今怎样了,2024-07-12 11:59,23035,2278,智史通鉴,智史通鉴,2013年4月17日，长沙宁乡县的民政局迎来了一对特殊的夫妻。一个71岁的老头和一个26岁的女孩，离远了看，甚至像爷爷和孙女。面对工作人员异样的眼光，女孩说：“我和他是真心相爱的！”这让人好奇，这对相差45岁的夫妻，他们之间到底有着怎样的爱情故事？,https://toutiao.com/group/7390696631223534120/,,0,0,False
又出大瓜？73岁“风流妖精”刘晓庆，如今已经走上另一条道路,2024-09-21 05:32,1156,179,冯律讲法,冯律讲法,近日，四火姐姐在直播间中透露了一件事，即“身边有位老师，70多岁了，还在谈恋爱，有八个男朋友，所有人都认识她。”,https://toutiao.com/group/7416939451584102939/,,0,0,False
打了30个月，普京终于回过神，下令俄军全面换装，不再吃苏联老本,2024-09-21 07:20,7564,1064,冲哥瞰天下,冲哥瞰天下,打了30个月，俄罗斯也意识自己的问题了，装备陈旧、作战理念陈旧，二十世纪的想法来打二十一世纪的战争这是不行的，面对西方的先进武器，它们决定要做出改变了。,https://toutiao.com/group/7416992954596491839/,,0,0,True
吃牛排时，为何旁边都放一个溏心蛋，不懂别随便吃，免得闹笑话,2024-07-13 06:05,2801,2628,云莳一,云莳一,阅读此文之前，麻烦您点击一下“关注”，既方便您进行讨论和分享，又能给您带来不一样的参与感，感谢您的支持。文|夏夜芦苇荡编辑|夏夜芦苇荡本文陈述所有内容皆有可靠信息来源赘述在文章结尾，但为提升文章可读性，细节可能存在润色，请理智阅读，仅供参考！,https://toutiao.com/group/7390663951204106787/,,0,0,False
这部台湾电影拍的真大胆，中年夫妻间的不堪，没结婚的禁止观看！,2024-08-16 06:44,4506,148,小胡谈事件,小胡谈事件,"电影名：幸福城市
 这部台湾电影拍的真大胆，中年夫妻间的不堪，没结婚的禁止观看！",https://toutiao.com/group/7403624512404587047/,,0,0,True
网友：这小孩最起码吃了三个田震、一个许巍和一个刀郎！,2024-09-04 13:00,60550,5618,小石头和孩子们,小石头和孩子们,,https://toutiao.com/group/7410772059594981915/,,0,0,True
国庆放假最新通知！不仅放假7天，而且还有4个好消息告诉大家,2024-09-21 06:53,6464,610,笑史云烟,笑史云烟,相信不少人已经准备好迎接这难得的七天长假，无论是准备出游看看祖国的大好河山，还是回家与家人团聚，亦或是宅在家里放松休息，大家的心情都充满了期待。,https://toutiao.com/group/7416981278681809423/,,0,0,False
全球最富揭晓：美国首富造火箭，印度首富搞能源，中国首富在干嘛,2024-08-02 07:38,2363,3747,智史通鉴,智史通鉴,2024年4月3日，新一轮的福布斯排行榜出炉，法国奢侈品品牌LV的总裁荣登榜首。同时，马斯克也凭借第二的名次也又一次为了美国的首富。众所周知，马斯克的特斯拉公司最近几年发展势头极好，spaceX公司造火箭的工作也进行的如火如荼。,https://toutiao.com/group/7398431880397324839/,,0,0,False
5座车拉6个人被判超员，车主1句话把交警问懵,2024-08-05 20:20,11640,2771,奇妙钢笔pA8JyP,奇妙钢笔pA8JyP,,https://toutiao.com/group/7399752843772559906/,,0,0,True
罕见！100年前，英国游客拍下的清朝乡村，和想象中完全不一样,2024-09-20 02:07,1829,230,万物知识局,万物知识局,泥泞的土路，衣不蔽体的老百姓，即便是达官显贵的家中也十分破败，而这些都是清王朝的历史痕迹，虽说那时候中国摄影技术并不发达，但也有许多外国游客来到这里，拍摄下了许多老照片，为我们留下了珍贵的历史资料，那清朝到底是怎样的面貌呢?,https://toutiao.com/group/7416287738871267855/,,0,0,False
曹德旺说：我不会逃跑，但要给政府提个醒 #曹德旺 #福耀科技大学,2024-06-28 06:51,25662,3493,正直鲸鱼LxhXfoC,正直鲸鱼LxhXfoC,,https://toutiao.com/group/7385443277144588834/,,0,0,True
陈若琳把全红婵养得是真好啊,2024-08-07 03:21,2831,180,中工网,中工网,<p style='text-indent: 2em;'>原标题：陈若琳把全红婵养得是真好啊</p><p style='text-indent: 2em;'>昨晚，巴黎奥运会女子10米跳台跳水决赛，全红婵夺得金牌！赛后采访，她说，我不是你们所说的天才，都是练的，一遍一遍地练。教练陈若琳见证了全红婵的努力与刻苦。@陈若琳sunny@全红婵这对被称为“王炸”组合的师徒，在奥运赛场上都有过非常亮眼的表现。为帮全红婵突破发育关，陈若琳下了不少功夫。每天七八个小时的训练，恨不得将全红婵“拴在裤腰带上”严密看管。执教能力虽受过质疑，但她从不回避，而是找出问题，各个击破。她说：“我走过的弯路，不想让全红婵再走一遍。”中国队加油！（央视）</p>,http://db.workercn.cn/media/2024/08/07/64B10057EEF44DC3904C945F112F757A/preview.mp4,,0,0,True
温铁军：形势非常严峻，战争随时可能爆发！〔上〕,2024-09-11 15:44,15787,2045,淡泊的海浪AAm,淡泊的海浪AAm,,https://toutiao.com/group/7413411885322371621/,,0,0,True
山东男子，当街暴打母亲，事件后续来了 #热点新闻事件,2024-09-22 02:21,1489,440,探索世界奇迹,探索世界奇迹,,https://toutiao.com/group/7417286991403811364/,,0,0,True
母亲瘫痪、父亲疯了，当年那个744分的高考状元，7年后却成了这样,2024-09-08 00:54,1807,255,八号探秘人,八号探秘人,母亲截肢瘫痪、父亲疯癫痴傻，可对于自己的亲人，他却做出了这样的评价。而今，7年已过，曾经那个让无数人动容的少年，现在如何?,https://toutiao.com/group/7411852147648496162/,,0,0,False
姑娘远嫁山东十年未回家，带着孩子偷偷回娘家，到家眼前一幕哭了,2024-09-09 08:25,20755,8932,小乔家里的事,小乔家里的事,,https://toutiao.com/group/7412556561718968870/,,0,0,True
反超华为、阿里！中国第一大民企诞生，营收破1万亿，员工超60万,2024-09-18 08:47,1482,887,云舟史策,云舟史策,刘强东白手起家的神话迎来新纪录！2024年财富世界500强企业中，京东一举成为中国第一大民间企业。而排在京东前面的15家中国公司，全是传统的能源，工程国企和银行。唯一的高科技企业鸿海精密，则是台湾省的富士康母公司。其中阿里巴巴排名全世界第70名，恒力集团排名81，华为排名103。,https://toutiao.com/group/7415861358157120037/,,0,0,False
张紫妍：被迫陪睡31人近百次，遭道具虐待，29岁自杀留230页遗书,2024-07-24 02:37,11731,794,八号探秘人,八号探秘人,在阅读此文之前，辛苦您点击一下“关注”，既方便您进行讨论和分享，又能给您带来不一样的参与感，感谢您的支持！本文叙述皆有官方信源，为了读者有更好体验，放在了文章后缀！,https://toutiao.com/group/7394994383675736576/,,0,0,False
她是央视最惨主持人，男友被判死缓，丈夫诈骗入狱，47岁无人敢娶,2024-08-27 23:30,2092,206,闻书识焉,闻书识焉,她曾是央视的台柱子，和董卿、周涛并称为央视的三朵金花。回顾刘芳菲的前半生，最令人感到惋惜的，便是她的感情生活，47岁至今无人敢娶。,https://toutiao.com/group/7407743113688564258/,,0,0,False
这是调戏还是搭讪？,2024-08-16 04:36,1857,108,潍坊市广播电视台,潍坊市广播电视台,,https://toutiao.com/group/7403591622725272100/,,0,0,True
"万万没想到,53岁“丁克”半辈子的康辉，一生遗憾竟然是一通电话",2024-08-21 22:14,21556,4530,峰哥正读,峰哥正读,在阅读此文之前，麻烦您点击一下“关注”，既方便您进行讨论和分享，又能给您带来不一样的参与感，感谢您的支持！文/编辑：蘑菇百善孝为先。但是到底怎么做才算是“孝”，康辉用了半辈子才明白。央视知名主持人康辉，事业顺遂，家庭幸福，在外人看来是一个人生赢家。,https://toutiao.com/group/7405504703687115273/,,0,0,False
小伙路上偶遇骑行的媳妇，本想质问一番，原来自己是小丑,2024-09-13 05:41,3514,990,山西广电文娱,山西广电文娱,,https://toutiao.com/group/7413998825330704911/,,0,0,True
4年骑行结束，1500天终于回到老家，感谢大家一路陪伴有缘江湖见,2024-09-07 03:50,69595,16578,刘伟元的旅行,刘伟元的旅行,4年骑行结束，1500天终于回到老家，感谢大家一路陪伴有缘江湖见！,https://toutiao.com/group/7411715839100977716/,,0,0,True
日本作出让步，换取中国解禁水产，万没料到市场被上千家俄企抢光,2024-09-21 09:13,2126,2651,田柳Talk,田柳Talk,日本排放核污水之后，中国一直通过各种努力督促日方放弃错误做法，最近两国首次就福岛核污水排海问题达成共识。,https://toutiao.com/group/7416629217696203275/,,0,0,False
安徽美女道士胡小慧被捕：精通“胡媚术”，九名男徒弟揭露其罪行,2024-09-12 08:10,2894,341,艺述史,艺述史,在安徽一处偏僻山头上，有座神秘的道观，外表平平无奇，但里面却有着一位名气很高的美女道士。美女道士的名字叫做胡小慧，据说有着高深的法力，能帮人消灾解难。很多人慕名前来，交上丰厚的香火钱，在袅袅青烟里，试图从这个年轻道士身上获得一些生活的支撑。,https://toutiao.com/group/7413662261274739200/,,0,0,False
董卿父亲董善祥：我这辈子最后悔的事，就是让宝贝女儿嫁给密春雷,2024-09-11 06:59,1407,155,稻述,稻述,提起央视主持，现在挑大梁的几乎就是撒贝宁、尼格买提、龙洋等人了，他们也都非常优秀，但常有人怀念起董卿还在的日子。,https://toutiao.com/group/7413267526601228852/,,0,0,False
全球约一半肝癌在中国，再次提醒：家中的4种食物，尽早撤下餐桌,2024-08-13 08:36,91319,3468,梁医学社梁怡璋医生,梁医学社梁怡璋医生,,https://toutiao.com/group/7402540119712629311/,,0,0,True
军号一响，全军出击！,2024-09-19 08:01,11326,730,中国军号,中国军号,,https://toutiao.com/group/7416261401477382668/,,0,0,True
曾为师踢馆报仇，现没参加刀郎演唱会的云朵，已经走上另一条道路,2024-09-05 07:00,630,161,稻述,稻述,说到这两天华语乐坛最炙手可热的歌手，还得是刀郎老师了，阔别舞台已久的他还是宝刀未老，回归后一场线上演唱会给内娱歌手好好上了一课。,https://toutiao.com/group/7411041303573905920/,,0,0,False
