title,publish_time,like_count,comment_count,media_name,source,abstract,article_url,tag,is_yaowen,article_sub_type,has_video
97岁李嘉诚赌输了！香港特首发声，中国甩出3张王牌，重开一局！,2025-03-23 05:30,2056,184, 冰枫观察室, 冰枫观察室,,https://toutiao.com/group/7484170901571781156/,,0,0,True
现在嫌她们丑，当年追成狗！这些发福的女明星，当年都是大美女,2025-01-24 10:06,4234,1430,晓娱海棠,晓娱海棠,现在嫌她们丑，当年追成狗!娱乐圈的美女明星虽说一抓一大把，但终究没能抵过岁月这把杀猪刀!曾经的她们美到让人窒息，没有一个网红脸，却都美的倾国倾城。,https://toutiao.com/group/7463407460499145227/,,0,0,False
许家印第二！又一个“大佬”跑路，花光几百亿，总部一片狼藉,2025-03-05 12:16,6902,1396,天天历史,天天历史,2023年9月10日，沈晖发了条微博，写到“这周出差去了慕尼黑，然后纽约。好事多磨，静待花开。”就在沈晖出国一个月后，威马汽车正式申请了破产，留下的只有一地鸡毛。,https://toutiao.com/group/7478197991749190159/,,0,0,False
小两口闹别扭，狗狗像人一样劝架，太搞笑了，妥妥的狗婆婆！,2025-03-23 11:07,19140,2245,活泼山雀tt,活泼山雀tt,,https://toutiao.com/group/7484959848606515731/,,0,0,True
李嘉诚15天内签字，美国对华交易亮一张红牌，不能为赚钱出卖灵魂,2025-03-22 01:39,2542,361,蓉蓉有话说,蓉蓉有话说,,https://toutiao.com/group/7484436814121222675/,,0,0,True
