title,publish_time,like_count,comment_count,media_name,source,abstract,article_url,tag,is_yaowen,article_sub_type,has_video
珠海航展亮点多，新型武器装备集体出现，美国人有点慌,2024-11-06 12:19,6657,230,杜文龙,杜文龙,,https://toutiao.com/group/7434139771879981583/,,0,0,True
67岁执意生娃，如今却坐轮椅无法自理，5岁的天赐被迫独立学洗衣,2024-11-04 10:32,2004,555,睿之悦,睿之悦,2019年，已经67岁的田新菊执意生下了自己的第三个孩子小天赐。那么，现如今5年的时间过去了，这“天赐”的礼物到底是福还是祸呢?,https://toutiao.com/group/7433367394946384435/,,0,0,False
养殖虾都是吃抗生素、激素长大的？到底能不能吃？告诉你真相,2024-10-14 10:32,2808,605,奇妙的本草,奇妙的本草,,https://toutiao.com/group/7425577390057488959/,,0,0,True
一巴掌的代价，公交车上大妈打晕患癌小伙，断送退休后的幸福生活,2024-10-14 09:53,1898,1162,客观听書,客观听書,公交车上老太太和小伙吵了起来，老太太更是当仁不让直接给了小伙一巴掌。这名小伙直接倒地，老大大根本就不会想到正是因为他的一巴掌，鲜活的生命就这样消失在他的手里。,https://toutiao.com/group/7425563455358468627/,,0,0,False
51年洪学智妻子寻女无果，到老乡家歇脚老乡惊呼：你要找得就是我,2024-09-22 01:07,12739,850,品古观今,品古观今,前言1951年，阳曲县委大院突然来了7、8位解放军同志，其中一位女同志，就是洪学智的妻子张文。她此番前来，就是为了寻找多年前因战乱而寄养于民间的爱女。可昔日的小村落早已蜕变成另一番景象，这无异于是大海捞针。,https://toutiao.com/group/7417034363226915354/,,0,0,False
特朗普战胜哈里斯重新上台，对中国是好是坏？,2024-11-06 08:28,27350,7633,第一军情,第一军情,据央视新闻11月6日最新报道，特朗普成功战胜哈里斯，赢得了2024年美国总统大选，和很多人想象的“战事焦灼”不同，本次美国大选却呈现出一边倒的态势，特朗普兵不血刃，在多个摇摆州成功“翻红”，战胜了民主党候选人哈里斯，再次问鼎美国总统的宝座。那么，既然美国未来四年的“掌门人”已经敲定，对中国又将有什么深远影响，或者用更贴地气的话：对中国是好是坏呢？,https://toutiao.com/group/7434080229624119844/,,0,0,True
炸萝卜丸子到底用面粉还是淀粉，教你正确做法，外焦里嫩，太香了,2024-10-26 09:25,5715,374,家常的味道,家常的味道,,https://toutiao.com/group/7430012978277122611/,,0,0,True
山西五台山悬崖上的狐仙洞，发现住着2个千年狐仙，上去吓得腿软,2024-10-22 03:00,7010,692,山西凡凡,山西凡凡,,https://toutiao.com/group/7428429414959940106/,,0,0,True
俩人相亲互相看不上，哪料男方一报母亲身份，姑娘乐了,2024-11-08 01:50,4645,1225,乐视群星访谈秀,乐视群星访谈秀,,https://toutiao.com/group/7434719902990074395/,,0,0,True
特朗普在忙什么？他的新政府许多反华人士入列，中美关系会怎么走,2024-11-08 10:05,25366,1361,邱毅台湾,邱毅台湾,,https://toutiao.com/group/7434847402797990452/,,0,0,True
男子在路边被黄鼠狼盯住，咬住他的鞋不松口,2024-10-14 06:46,18370,3707,山西广电文娱,山西广电文娱,,https://toutiao.com/group/7425519012454335003/,,0,0,True
特朗普2.0强势归来，两岸如何应对？任性施为恐成脱缰野马,2024-11-08 23:00,8401,112,游梓翔,游梓翔,,https://toutiao.com/group/7434872583981367843/,,0,0,True
1米3袖珍美女嫁给1米48男孩，婚后丈夫奇迹长高，两人却不欢而散,2024-09-07 02:55,3215,186,睿之悦,睿之悦,杨萍和葛存苗的婚礼 文|睿之悦 编辑|睿之悦2019年，成都的民政局来了两个“10岁小孩”来登记，工作人员以为是玩闹。两个“小孩”拿出身份证让工作人员看，这才明白，原来是两个再也长不高的成年袖珍人情侣。,https://toutiao.com/group/7411713833267364386/,,0,0,False
刘德华在台北演唱会唱《中国人》，民进党玻璃心碎了，台独崩溃了,2024-11-04 08:14,35745,2702,邱毅台湾,邱毅台湾,,https://toutiao.com/group/7433334683380744731/,,0,0,True
今天才知道！电动车“每天充”和“用完再充”，到底哪个更伤电池,2024-08-27 11:19,15130,2346,鲸探所,鲸探所,“今天到底给车充不充电？”估计大多数人每天回家都会想这个问题，看着自己的电动车电量又多又少的，充不充电也是一件非常难以抉择的事情。那么，电动车到底应该怎样充电呢？是每天都充，还是用完之后再充呢？电动车充电不管是在城市还是农村，电动车其实都是人们出门最常见的交通工具。,https://toutiao.com/group/7407773012533117475/,,0,0,False
特朗普杀回来了，第二次贸易战要来了，中国要做哪些准备？,2024-11-07 15:49,10880,1883,金灿荣教授,金灿荣教授,,https://toutiao.com/group/7434468272764650020/,,0,0,True
小伙洗完澡故意秀肌肉，富婆心跳加速被当场拿下，这下好看了,2024-10-26 16:20,6403,264,乐视情感讲堂,乐视情感讲堂,小伙洗完澡故意秀肌肉，富婆心跳加速被当场拿下，这下好看了,https://toutiao.com/group/7430011217881596426/,,0,0,True
特朗普赢了，对中国是好还是坏？(上),2024-11-07 14:53,34447,1860,静思有我,静思有我,,https://toutiao.com/group/7434550628703011391/,,0,0,True
女儿花500块租男友，没想他是身价过亿的总裁，这下好运了,2024-10-18 09:42,7764,1432,乐视娱乐乐透社,乐视娱乐乐透社,,https://toutiao.com/group/7427048858267419190/,,0,0,True
特朗普的新孤立主义启动，泽连斯基、尹锡悦、赖清德都瑟瑟发抖了,2024-11-07 06:48,61057,2797,邱毅台湾,邱毅台湾,,https://toutiao.com/group/7434425551684633100/,,0,0,True
特朗普胜了，收割清算越南，1600万亿撤退，越南工厂重返中国,2024-11-09 06:49,3058,208,BWC中文网,BWC中文网,特朗普胜了，收割清算越南，1600万亿撤退，越南工厂重返中国,https://toutiao.com/group/7435167979589632566/,,0,0,True
罕见！100年前，英国游客拍下的清朝乡村，和想象中完全不一样,2024-09-20 02:07,5365,566,万物知识局,万物知识局,泥泞的土路，衣不蔽体的老百姓，即便是达官显贵的家中也十分破败，而这些都是清王朝的历史痕迹，虽说那时候中国摄影技术并不发达，但也有许多外国游客来到这里，拍摄下了许多老照片，为我们留下了珍贵的历史资料，那清朝到底是怎样的面貌呢?,https://toutiao.com/group/7416287738871267855/,,0,0,False
吃播网红恩克半年吃110只羊，眼神呆滞脸黑成炭，网友求他别吃了,2024-11-04 08:22,826,609,与君説,与君説,在阅读此文之前，麻烦您点击一下“关注”，既方便您进行讨论和分享，又能给您带来不一样的参与感，感谢您的支持文、编辑|是否古人估计都没想到后世子孙通过吃饭就能赚得盆满钵满。短视频的迅速崛起给人们带来了很多生财之道，吃播就是其中一个。,https://toutiao.com/group/7433333039997977107/,,0,0,False
大老虎在总统套房潇洒，殊不知对面住着中央领导，有戏看！,2024-10-15 02:37,4553,190,乐视群星访谈秀,乐视群星访谈秀,大老虎在总统套房潇洒，殊不知对面住着中央领导，有戏看！,https://toutiao.com/group/7425826039802102284/,,0,0,True
15年前他在爱妻葬礼上哭到昏厥，发誓永不再娶，如今他做到了吗？,2024-08-24 02:17,18929,585,八号探秘人,八号探秘人,在阅读此文之前，辛苦您点击一下“关注”，既方便您进行讨论和分享，又能给您带来不一样的参与感，感谢您的支持！编辑丨xk纵观鱼龙混杂的娱乐圈，有人背叛，有人痴情。而果靖霖则是公认的好男儿，将一生都奉献给妻子。但妻子却仅仅陪他走了半生，没能战胜病魔，不幸离开人世。,https://toutiao.com/group/7406210316734710283/,,0,0,False
"特朗普的第一把火正在点燃,大收割开始,或没收外国人房产黄金美元",2024-11-08 11:41,9683,3095,BWC中文网,BWC中文网,,https://toutiao.com/group/7434872159333253658/,,0,0,True
珠海航展 “机器狼”首次公开亮相！“铁翼飞旋”带你一探究竟,2024-11-09 02:27,34446,4415,央视频,央视频,,https://toutiao.com/group/7435100516647502336/,,0,0,True
河南方城4名公职人员涉酒驾死亡，亲属：外甥女本已计划结婚，孩子父母哭干了眼泪,2024-11-09 06:19,3402,4295,极目新闻,极目新闻,极目新闻记者 余渊支离破碎的汽车零件，混在沙土中散落一地。支离破碎的汽车零件散落一地罗女士（化姓）怎么也想不到，自己年轻的外甥女，和另一名远房亲戚的儿子，会在一场车祸中，双双殒命。据央视新闻消息，11月4日，河南南阳方城县发生一起交通事故，致4人死亡。,http://jms.ctdsb.net/jmythshare/#/index_share?cId=0&contentType=5&contentId=2299863,,0,0,False
特朗普再次当选，台湾已经开始紧张了！【维为道来】,2024-11-06 12:06,38063,107,张维为,张维为,,https://toutiao.com/group/7434136570266911251/,,0,0,True
首例5胞胎长大了，父亲已过劳去世 母亲直言：如能重来一个也不要,2024-08-31 03:06,1793,468,睿之悦,睿之悦,2002年，在北京的一家妇产医院中，一位来自河北的孕妇顺利生下了两男三女的五胞胎，创造了一个全国罕见的奇迹。,https://toutiao.com/group/7409098624111575603/,,0,0,False
春晚：赵四这演技让赵本山都笑场了，台下也笑的人仰马翻！经典！,2024-11-04 08:35,1283,202,乐视综艺咖,乐视综艺咖,,https://toutiao.com/group/7433340063349015051/,,0,0,True
炸萝卜丸子，放面粉和淀粉就错了，教你正确做法，焦香酥脆不吸油,2024-09-28 10:13,22414,954,家常的味道,家常的味道,,https://toutiao.com/group/7419635124758643227/,,0,0,True
“蜂巢母舰”亮相珠海航展，搭载不同型号无人机，侦察攻击两不误,2024-11-08 12:07,11192,703,杜文龙,杜文龙,,https://toutiao.com/group/7434878976956465716/,,0,0,True
排骨里打入两个鸡蛋，不红烧不油炸，出锅瞬间变美食，太香了,2024-10-18 00:43,3993,208,家味美食,家味美食,,https://toutiao.com/group/7426909886904009225/,,0,0,True
奶奶的黄金手镯戴了50年，还说是清代几百年前的？鉴宝结果如何,2024-08-16 05:52,26529,9848,小闫打铁镯,小闫打铁镯,奶奶的黄金手镯戴了50年，还说是清代几百年前的？鉴宝结果如何,https://toutiao.com/group/7403611154913690121/,,0,0,True
反击：婆婆进城欢迎解放军，政委一看她鞋，顿时就明白她是特务,2024-10-17 04:31,2164,107,乐视热播综艺精选,乐视热播综艺精选,反击：婆婆进城欢迎解放军，政委一看她鞋，顿时就明白她是特务,https://toutiao.com/group/7426597593733399075/,,0,0,True
担心被特朗普清算？哈里斯承诺和平交权，佩洛西在现场一度失态,2024-11-07 10:08,8243,2037,千钧堂,千钧堂,,https://toutiao.com/group/7434477132157288972/,,0,0,True
爸妈中，谁的基因决定孩子的智商和长相，专家回答很统一，太准了,2024-08-31 12:04,862,238,5分钟快读,5分钟快读,阅读此文前，诚邀您点击一下“关注”按钮，方便以后持续为您推送此类文章，同时也便于您进行讨论与分享，您的支持是我们坚持创作的动力~在生活中，许多人都相信：“男生随妈妈，女生随爸爸”这一说法。长久以来，许多人对这一说法深信不疑。但随着科学的普及，越来越多的人也对此产生了怀疑。,https://toutiao.com/group/7409241548929499660/,,0,0,False
被拐男子认亲一年后，与家人彻底决裂！,2024-11-05 08:45,2428,1404,环球网,环球网,来源：宁波晚报 近日因寻亲走红的郁豹豹与家人决裂的消息引发关注，冲上热搜。据报道，2023年9月，被拐卖34年的郁豹豹寻亲成功。认亲不到半个月，郁豹豹与两个弟弟开始直播带货。不到两个月，三兄弟逐渐走向分崩离析。令他更无法接受的是，他与母亲也渐生隔阂。,https://3w.huanqiu.com/a/14459a/4K8FGmdmzMW?agt=20,,0,0,False
刀郎刘德华与凤飞飞，他们的歌让台湾人真的想回家了！,2024-11-05 22:05,66385,6176,黎建南台湾,黎建南台湾,,https://toutiao.com/group/7433919847295091210/,,0,0,True
是谁给了哈里斯致命一击？民主党大佬答案令人震惊，特朗普捡到宝,2024-11-08 10:03,12287,1199,煮天下,煮天下,哈里斯为何惨败？特朗普挖到最大票仓,https://toutiao.com/group/7434847005434479156/,,0,0,True
全球约一半肝癌在中国，再次提醒：家中的4种食物，尽早撤下餐桌,2024-08-13 08:36,108201,3636,梁医学社梁怡璋医生,梁医学社梁怡璋医生,,https://toutiao.com/group/7402540119712629311/,,0,0,True
忆往昔，泽连斯基被泼冷水，看今日，更加被动只能尽快休战,2024-11-07 10:20,25019,1975,宋忠平,宋忠平,忆往昔，泽连斯基被泼冷水，看今日，更加被动只能尽快休战,https://toutiao.com/group/7434480186654982656/,,0,0,True
