title,publish_time,like_count,comment_count,media_name,source,abstract,article_url,tag,is_yaowen,article_sub_type,has_video
华裔美军女孩，谈对中国的感受,2025-02-22 13:11,815,721,自由水滴,自由水滴,,https://toutiao.com/group/7474230359383753250/,,0,0,True
有这样的老婆，你家祖坟都冒青烟了！,2025-02-04 03:11,79512,12823,乐观的冰淇淋I,乐观的冰淇淋I,,https://toutiao.com/group/7467226170908606976/,,0,0,True
她3岁被弃，20岁获22个世界冠军，母亲后悔想认亲，结果怎样？,2025-02-10 08:59,2188,107,与君説,与君説,在阅读此文之前，麻烦您点击一下“关注”，既方便您进行讨论和分享，又能给您带来不一样的参与感，感谢您的支持文、编辑|是否如果不是一场公开地认亲，估计大家都不知道“跳水皇后”陈若琳的身世竟然如此凄惨让人心疼。彼时她才刚刚3岁就被父母抛弃，最终只能寄人篱下，小心翼翼地生活。,https://toutiao.com/group/7469708633769591308/,,0,0,False
蠢女人  活该被抛弃  胸大无脑 自以为是,2025-02-19 11:11,785,553,飞飞音乐库,飞飞音乐库,,https://toutiao.com/group/7470145540357915148/,,0,0,True
美国：你们根本无法想象电影院里疯狂喊“China”的场面,2025-02-13 05:09,7552,1069,奈奈纪实分享,奈奈纪实分享,,https://toutiao.com/group/7470766336378274319/,,0,0,True
小伙一看得了便宜，还装傻，真可恶,2025-02-18 05:36,2158,115,南瓜午夜厅,南瓜午夜厅,,https://toutiao.com/group/7472627117151306291/,,0,0,True
