title,publish_time,like_count,comment_count,media_name,source,abstract,article_url,tag,is_yaowen,article_sub_type,has_video
习近平出席澳门特别行政区政府欢迎晚宴并发表重要讲话,2024-12-19 11:37,4153,2033,央视新闻,央视新闻,国家主席习近平19日晚出席澳门特别行政区政府欢迎晚宴并发表重要讲话。,https://content-static.cctvnews.cctv.com/snow-book/index.html?item_id=7823683207718866455&source=50006&sub_source=50006_001,,0,0,False
100年前，清朝罕见留影，王爷妻妾婀娜多姿，乞丐全身挂满垃圾,2024-10-14 09:58,2613,293,万物知识局,万物知识局,每一张老照片，都像是时间的低语，它们静静地躺在历史的相册中，却在不经意间将我们拉回到那个遥远而神秘的年代。,https://toutiao.com/group/7425457574731579919/,,0,0,False
中央定调！2025年养老金迎来新调整，退休新规实施，还有个好消息,2024-12-14 00:24,7434,608,思之想之,思之想之,2025年马上就要来了，这是一个充满变化的关键的年份，这是十四五规划的最后一年，很多政策将会兑现。2025年，除了养老金继续用来调整之外，退休新规也将会正式实施，还有一个好消息，具体是什么呢?,https://toutiao.com/group/7448052182332473867/,,0,0,False
重磅！国家已释放5个重磅信号，2025年中国将迎惊天动地的大机会,2024-12-17 13:20,3973,464,占豪,占豪,这一年，因战乱而死的人估计数十万，巴以冲突、俄乌战场，人可能瞬间就没了，当地老百姓生活也是真的苦，叙利亚以前还能吃免费大饼，现在连免费大饼也没了，巴勒斯坦早就没大饼吃了······说心里话，和纷乱的世界相比，不得不感叹和平真好!,https://toutiao.com/group/7449369382092718629/,,0,0,False
海南富商张晖：花8亿建108米海上观音像，4年后死在水中死因成谜,2024-10-19 04:49,3534,598,八号探秘人,八号探秘人,在阅读此文之前，辛苦您点击一下“关注”，既方便您进行讨论和分享，又能给您带来不一样的参与感，感谢您的支持！编辑丨xk他是中国的一名富商，耗费8亿元完成了自己的梦想。可梦想落地成为现实的时候，他却在4年后莫名其妙的死去。他就是张晖，上个世纪末海南岛旅游业的龙头当家人。,https://toutiao.com/group/7427288913095492134/,,0,0,False
郜春海：马斯克具有超强的解构能力,2024-12-19 08:11,532,114,凤凰网财经,凤凰网财经,,https://toutiao.com/group/7450032592033841675/,,0,0,True
中国公开高超音速飞行器，速度6.56马赫，一夜之间要翻盘子？,2024-12-16 14:05,14480,687,陈虎点兵,陈虎点兵,,https://toutiao.com/group/7449010500773347890/,,0,0,True
曹德旺预言：2025年，没有买房的人，五年后是失败者还是幸运儿？,2024-12-16 05:57,5134,1783,议史纪,议史纪,其实早在多年前年，“玻璃大王”曹德旺就曾预言:“房地产将成为有钱人击鼓传花的游戏”，房子就是钢筋混凝土，是不会保值的?,https://toutiao.com/group/7448883228297003539/,,0,0,False
县长看不上乡长送的烟，给他退回来，乡长打开一看乐了,2024-11-13 08:16,9586,1599,乐视大综艺咖,乐视大综艺咖,,https://toutiao.com/group/7436672568578277925/,,0,0,True
著名表演艺术家谢芳今天凌晨逝世，走前半小时与家人说了一句话……,2024-12-19 01:00,10511,2843,大河报,大河报,北京日报客户端记者独家获悉，著名电影表演艺术家，电影《青春之歌》中林道静的扮演者谢芳，于今日（12月19日）凌晨2时14分在北京安贞医院逝世，享年89岁。谢芳的儿媳妇李海平向北京日报客户端记者证实了这个消息。,https://news.dahebao.cn/dahe/appcommunity/2127437?newsId=2127437,,0,0,False
热搜第一，舒淇自曝被传染,2024-12-19 07:41,365,157,环球时报,环球时报,12月18日舒淇在社交平台发文称自己被传染病毒登上热搜第一并详细描述了自己的病程及症状“第一天，一天拉八次；第二天胃疼想吐，拉四次；第三天，吃了四种胃药胃散都不管用；第四天，吃了个胃散胃好了，但吃了蛋塔又发作了，沙发上躺了一晚，慢慢地胃不疼了 但头开始有点疼～ 现在头晕头疼，想吐,https://toutiao.com/group/7450024511040127551/,,0,0,False
伊朗受重挫！,2024-12-19 02:27,1440,128,胡锡进,胡锡进,叙利亚变天，受冲击最大的是伊朗，而非俄罗斯。俄的回旋空间大，而伊朗的最大战略资产“抵抗之弧”被冲垮了。而且不时有人预言，阿萨德倒台并非中东这场大震荡的句号。以色列“杀红了眼”，且风头正劲，伊朗面临地区和国内两个方向的双重挑战。西方媒体甚至渲染：伊朗正处于“现代史上最危险的时刻”。,https://toutiao.com/group/7449943665033675301/,,0,0,False
弟弟光荣退伍，姐姐兴奋去车站接他，怎料一见弟弟瞬间哭了,2024-11-05 06:34,38533,3210,乐视天天剧好看,乐视天天剧好看,,https://toutiao.com/group/7433679820573934091/,,0,0,True
广州新机场获国务院批复建设，将打造为广东第三大国际航空枢纽机场,2024-12-19 06:39,1007,1227,21世纪经济报道,21世纪经济报道,南方财经全媒体记者高慧超 佛山报道12月19日，南方财经全媒体记者从佛山市高明区2024年招商推介会上获悉，位于佛山市高明区的广州新机场已正式获得国务院批复同意建设，航站楼、跑道等基础设施即将动工，预计12月25日启动前期同步实施工程。,https://m.21jingji.com/article/20241219/herald/4442a3bd5af10d84facd7843cf52a55f.html,,0,0,False
马光远：东南沿海一带的小城市被严重低估 #财经大咖来了,2024-12-17 06:17,6593,340,光远看经济,光远看经济,,https://toutiao.com/group/7449261133652820518/,,0,0,True
中国商飞披露国产飞机新进展，更大的C939飞机在预研,2024-12-19 11:09,840,159,第一财经,第一财经,“2024年国产C919和C909飞机新增330架订单，交付近50架，创历史新高。”在今日举行的哈尔滨国际航空枢纽建设大会上，中国商飞公司副总经理魏应彪披露了两款国产飞机在2024年取得的成绩单。,https://m.yicai.com/news/102409492.html,,0,0,False
“取消公摊面积”，一周两地官宣！购房成本会降吗？,2024-12-18 23:52,396,285,看看新闻,看看新闻,“取消公摊面积”，一周两地官宣！购房成本会降吗？,http://mediaplay.kksmg.com/2024/12/19/h264_720p_600k_78496-smgnews-20241219065500-9000-966232-600k_mp4.mp4,,0,0,True
袁记云饺，被立案调查！,2024-12-19 10:44,548,402,红星新闻,红星新闻,近日，北京市海淀区市场监督管理局。此前，据媒体报道，11月19日，一位消费者在袁记云饺北京市海淀区六道口店花14元购买了一份鲜肉云吞面，但食用到最后竟发现其中有一条蚯蚓。,https://toutiao.com/group/7450071697258070580/,,0,0,False
个人养老金制度推行将带来哪些影响？一文解读,2024-12-13 03:32,2276,870,国际在线,国际在线,,https://crionline-media.cri.cn/cb5a6d96-d0c4-4fd0-a895-b6135667d84a/video/40d1574ab9094c2c91da2c53e8db16ca.mp4,,0,0,True
利智一扭一扭走上台，台下谢贤猛咽口水，何鸿燊反应太真实｜综艺,2024-12-19 01:38,328,101,PP宫斗放映厅,PP宫斗放映厅,,https://toutiao.com/group/7449931220609139250/,,0,0,True
逼退美国航母战斗群，055被严重高估了吗？真相曝光后令人心酸,2024-11-28 01:55,3822,359,迷彩虎说,迷彩虎说,毕竟只是一艘驱逐舰而已，就算是之前055曾经有过单舰吓退美国航母战斗群的记录，也有人认为仅仅是在和平时期，美国不想和中国爆发热战，所以选择退却，如果在实战情况下他们肯定能击沉055。,https://toutiao.com/group/7441771958783492619/,,0,0,False
微信上从不发“朋友圈”的人，不是低调，十有八九是这3种人！,2024-12-17 09:04,408,253,读者,读者,记不清从什么时候开始，微信“朋友圈”几乎成了人们日常生活的缩影。我们在这里分享美食、旅行、工作、情感，甚至是生活中的点滴小事。然而，在“朋友圈”的热闹中，总有一些人显得格外安静，他们从不轻易展示自己的生活。细细观察，我们会发现微信上从不发“朋友圈”的人，大多属于以下3种类型。,https://toutiao.com/group/7449174767946514983/,,0,0,False
中央定调！2025年养老金双增长，养老金领取条件有变，一类人不涨,2024-12-14 08:18,4264,346,思之想之,思之想之,2025年养老金调整最新消息来了，中央已经定调，2025年养老金将迎来双增长。另外提醒大家，2025年起养老金领取条件有变，一类人不参加2025年养老金调整，具体是什么呢？一起来了解。,https://toutiao.com/group/7448174128252682788/,,0,0,False
冬季自驾游，零下四十度睡车里，半夜冻醒了，车里全部冻住了！,2024-12-13 11:02,13182,2810,旅行者小多,旅行者小多,,https://toutiao.com/group/7447850219347116544/,,0,0,True
马光远：大城市才有机会的观点过时了 #财经大咖来了,2024-12-17 06:00,6468,489,光远看经济,光远看经济,,https://toutiao.com/group/7449256659496469027/,,0,0,True
沙利文的结局已定，他在离开白宫之前，说出了中美发生战争的结果,2024-12-16 02:48,13062,340,全荃,全荃,沙利文的结局已定，他在离开白宫之前，说出了中美发生战争的结果,https://toutiao.com/group/7448833372408775187/,,0,0,True
女子被多人密谋灌醉强奸后投江自尽，生前在手机备忘录记下被胁迫经过，三男子获罪,2024-12-18 16:40,9431,8002,红星新闻,红星新闻,投河自尽前，黄某某于2023年7月4日在其手机内创建了备忘录，记录下了她被胁迫的经过，这也成为了公检法日后侦查、起诉和判决的重要物证。,https://cdsbrss.cdsb.com/toutiao_no_video.php?url=https%3A%2F%2Fstatic.cdsb.com%2Fmicropub%2FArticles%2F202412%2Fc6419feb940b5f2c2302f01847e73bb8.html,,0,0,False
马光远：东南沿海小城市被严重低估 年轻人尽早放下北上广深执念,2024-12-17 06:30,3076,598,每日经济新闻,每日经济新闻,,https://toutiao.com/group/7449229105741955594/,,0,0,True
