title,publish_time,like_count,comment_count,media_name,source,abstract,article_url,tag,is_yaowen,article_sub_type,has_video
习近平向全国广大农民和工作在“三农”战线上的同志们致以节日祝贺和诚挚问候,2024-09-21 09:40,3723,2316,新华社,新华社,习近平向全国广大农民和工作在“三农”战线上的同志们致以节日祝贺和诚挚问候。在第七个“中国农民丰收节”到来之际，中共中央总书记、国家主席、中央军委主席习近平代表党中央，向全国广大农民和工作在“三农”战线上的同志们致以节日祝贺和诚挚问候。,http://mp.weixin.qq.com/s?__biz=MzA4NDI3NjcyNA==&mid=2650074248&idx=1&sn=6a1a77c66084f74c4d25123af2cc4bd5,,0,0,False
恭喜中国女篮新领袖终于出现了！百发百中！统治力让对手深深绝望,2024-06-25 07:11,24695,1347,乐播体育,乐播体育,,https://toutiao.com/group/7384335028576059923/,,0,0,True
9月21日凌晨，北京天安门发生如此感人场面，令人眼含热泪,2024-09-20 23:06,4427,291,好邻居李亮,好邻居李亮,,https://toutiao.com/group/7416865499553727014/,,0,0,True
以色列这一炸全搞砸了，中东地区迎来去美国化：中国成为最大赢家,2024-09-20 07:56,2942,937,深度工场,深度工场,以色列这一炸全搞砸了。以色列在黎巴嫩这一炸，在战术上来说，确实很成功，杀伤4500多名黎巴嫩真主党成员。,https://toutiao.com/group/7416630160327279158/,,0,0,False
董卿父亲董善祥：我这辈子最后悔的事，就是让宝贝女儿嫁给密春雷,2024-09-11 06:59,1368,150,稻述,稻述,提起央视主持，现在挑大梁的几乎就是撒贝宁、尼格买提、龙洋等人了，他们也都非常优秀，但常有人怀念起董卿还在的日子。,https://toutiao.com/group/7413267526601228852/,,0,0,False
大陆开启经济战，取消台湾农产品的零关税优惠，赖清德惊惶失措？,2024-09-21 05:10,14701,1349,邱毅台湾,邱毅台湾,,https://toutiao.com/group/7416959396648845843/,,0,0,True
没有人敢信他是个男的，直到他说话了，绝了,2024-08-20 05:20,3755,183,经视看天下,经视看天下,,https://toutiao.com/group/7405087362341470774/,,0,0,True
与中交手美失去自信！想却又害怕跟中打仗！,2024-09-20 04:07,10499,642,赖岳谦官方,赖岳谦官方,,https://toutiao.com/group/7416572093988340250/,,0,0,True
为国争光却遭郎平弃用！转身效力土耳其的王一梅，如今咋样了？,2024-08-31 13:19,868,120,豆莱说,豆莱说,光阴似箭，日月如梭，当初的少女早已退役，成为了排球场的幕后人，这么多年她都经历了什么，现在又怎么样了呢?,https://toutiao.com/group/7409287778514567718/,,0,0,False
为什么说从2025年开始，70岁以上的老人，可能面临“两大”问题？,2024-09-01 14:12,2123,269,水大叔,水大叔,据可靠数据了解，我国70岁以上的人口数量已经达到了2.5亿人次，占到全国总人口数量的18%。伴随着人口老龄化的出现，养老问题也成了重中之重，要知道养老不仅仅是家庭的责任，更是社会责任。,https://toutiao.com/group/7409677025897710106/,,0,0,False
美联储收割转向，中国买家大撤退，应验两大预言，美国盟友反击,2024-09-20 13:44,2824,126,BWC中文网,BWC中文网,美联储收割转向，中国买家大撤退，应验两大预言，美国盟友反击,https://toutiao.com/group/7416720852752564786/,,0,0,True
网友：这小孩最起码吃了三个田震、一个许巍和一个刀郎！,2024-09-04 13:00,59751,5542,小石头和孩子们,小石头和孩子们,,https://toutiao.com/group/7410772059594981915/,,0,0,True
国庆放假最新通知！不仅放假7天，而且还有4个好消息告诉大家,2024-09-21 06:53,2099,157,笑史云烟,笑史云烟,相信不少人已经准备好迎接这难得的七天长假，无论是准备出游看看祖国的大好河山，还是回家与家人团聚，亦或是宅在家里放松休息，大家的心情都充满了期待。,https://toutiao.com/group/7416981278681809423/,,0,0,False
军号一响，全军出击！,2024-09-19 08:01,9895,632,中国军号,中国军号,,https://toutiao.com/group/7416261401477382668/,,0,0,True
突发！6枚航弹从天而降，中方营区受损险酿伤亡，凶手身份很明显,2024-09-21 08:45,447,163,兵说,兵说,至少6枚航弹突然从天而降飞向中方赴黎巴嫩维和部队营区，造成设施受损，差点酿成严重伤亡，这件事情到底是谁干的?,https://toutiao.com/group/7417014478829421056/,,0,0,False
陈若琳把全红婵养得是真好啊,2024-08-07 03:21,2806,180,中工网,中工网,<p style='text-indent: 2em;'>原标题：陈若琳把全红婵养得是真好啊</p><p style='text-indent: 2em;'>昨晚，巴黎奥运会女子10米跳台跳水决赛，全红婵夺得金牌！赛后采访，她说，我不是你们所说的天才，都是练的，一遍一遍地练。教练陈若琳见证了全红婵的努力与刻苦。@陈若琳sunny@全红婵这对被称为“王炸”组合的师徒，在奥运赛场上都有过非常亮眼的表现。为帮全红婵突破发育关，陈若琳下了不少功夫。每天七八个小时的训练，恨不得将全红婵“拴在裤腰带上”严密看管。执教能力虽受过质疑，但她从不回避，而是找出问题，各个击破。她说：“我走过的弯路，不想让全红婵再走一遍。”中国队加油！（央视）</p>,http://db.workercn.cn/media/2024/08/07/64B10057EEF44DC3904C945F112F757A/preview.mp4,,0,0,True
她是央视最惨主持人，男友被判死缓，丈夫诈骗入狱，47岁无人敢娶,2024-08-27 23:30,2077,206,闻书识焉,闻书识焉,她曾是央视的台柱子，和董卿、周涛并称为央视的三朵金花。回顾刘芳菲的前半生，最令人感到惋惜的，便是她的感情生活，47岁至今无人敢娶。,https://toutiao.com/group/7407743113688564258/,,0,0,False
张紫妍：被迫陪睡31人近百次，遭道具虐待，29岁自杀留230页遗书,2024-07-24 02:37,11655,789,八号探秘人,八号探秘人,在阅读此文之前，辛苦您点击一下“关注”，既方便您进行讨论和分享，又能给您带来不一样的参与感，感谢您的支持！本文叙述皆有官方信源，为了读者有更好体验，放在了文章后缀！,https://toutiao.com/group/7394994383675736576/,,0,0,False
2013年，湖南26岁女孩嫁给71岁老头，婚后还生下一子，如今怎样了,2024-07-12 11:59,22550,2241,智史通鉴,智史通鉴,2013年4月17日，长沙宁乡县的民政局迎来了一对特殊的夫妻。一个71岁的老头和一个26岁的女孩，离远了看，甚至像爷爷和孙女。面对工作人员异样的眼光，女孩说：“我和他是真心相爱的！”这让人好奇，这对相差45岁的夫妻，他们之间到底有着怎样的爱情故事？,https://toutiao.com/group/7390696631223534120/,,0,0,False
姑娘远嫁山东十年未回家，带着孩子偷偷回娘家，到家眼前一幕哭了,2024-09-09 08:25,19821,8618,小乔家里的事,小乔家里的事,,https://toutiao.com/group/7412556561718968870/,,0,0,True
“心系百姓”、“为人民服务”确确切切是件令一国总理最头痛的事,2024-09-04 04:55,302761,33021,舟曲東去西燕飛,舟曲東去西燕飛,,https://toutiao.com/group/7410647010543403554/,,0,0,True
她认干爹改国籍，曾叫嚣要击败女国乒，却在巴黎奥运会丢尽了脸,2024-08-26 14:00,470,302,吃瓜崽崽,吃瓜崽崽,她曾是中国国籍，却因认干爹入韩籍。十九岁的她被国人认为是乒坛叛徒，还曾叫嚣女国乒。如今却成为了韩国乒乓一姐。,https://toutiao.com/group/7407375792933044790/,,0,0,False
中国🇨🇳人民的好总理,2024-09-03 15:46,155159,17750,话说,话说,这个老人一生只做一件事，那就是为了人民鞠躬尽瘁，死而后已,https://toutiao.com/group/7410443709928210955/,,0,0,True
太诡异了，难以置信😱😱😱,2024-08-07 07:55,399,132,微笑风筝E5k5bJl,微笑风筝E5k5bJl,,https://toutiao.com/group/7400303044833608192/,,0,0,True
