title,publish_time,like_count,comment_count,media_name,source,abstract,article_url,tag,is_yaowen,article_sub_type,has_video
你知道印度有多乱吗/看完视频颠覆你的三观！,2024-11-30 05:41,2469,437,娜姐生活纪实,娜姐生活纪实,,https://toutiao.com/group/7442943454394450466/,,0,0,True
贪官酒桌上的权钱交易，语言天衣无缝，听懂三分都是人精！,2024-11-23 16:24,3311,414,乐视扒剧小妹儿,乐视扒剧小妹儿,,https://toutiao.com/group/7440378916130259496/,,0,0,True
100年前，清朝罕见留影，王爷妻妾婀娜多姿，乞丐全身挂满垃圾,2024-10-14 09:58,2817,312,万物知识局,万物知识局,每一张老照片，都像是时间的低语，它们静静地躺在历史的相册中，却在不经意间将我们拉回到那个遥远而神秘的年代。,https://toutiao.com/group/7425457574731579919/,,0,0,False
中国成功打通世界最长隧道，通车一幕惊呆欧美28国,2024-12-27 16:54,5757,564,mm886,mm886,,https://toutiao.com/group/7453136028145025570/,,0,0,True
孙女在爷爷公司实习，各种怼爷爷，惊得公司高层乍舌,2024-11-07 13:31,47765,1620,一心一意水滴f,一心一意水滴f,孙女在爷爷公司实习，各种怼爷爷，惊得公司高层乍舌,https://toutiao.com/group/7434529524655751720/,,0,0,True
河南警察3岁女儿被拐，苦寻全国23年无果，结果却发现女儿在对门,2024-11-05 07:43,5803,659,八号探秘人,八号探秘人,寻亲23年无果，丢失的女儿竟住在对门?但它却真实发生在河南洛阳的梁绍波身上。是意外走丢，还是人贩子所为，三岁的女儿怎会离奇失踪?,https://toutiao.com/group/7433697108120142345/,,0,0,False
海南富商张晖：花8亿建108米海上观音像，4年后死在水中死因成谜,2024-10-19 04:49,4431,763,八号探秘人,八号探秘人,在阅读此文之前，辛苦您点击一下“关注”，既方便您进行讨论和分享，又能给您带来不一样的参与感，感谢您的支持！编辑丨xk他是中国的一名富商，耗费8亿元完成了自己的梦想。可梦想落地成为现实的时候，他却在4年后莫名其妙的死去。他就是张晖，上个世纪末海南岛旅游业的龙头当家人。,https://toutiao.com/group/7427288913095492134/,,0,0,False
湖南最长寿老人124岁高龄，长寿秘诀出世，让人大开眼界,2024-12-21 16:00,1489,149,乐视群星访谈秀,乐视群星访谈秀,,https://toutiao.com/group/7450730131821167140/,,0,0,True
当得知女友怀孕了，男友不再装穷，直接带妻子回豪宅住,2024-12-17 03:23,3501,112,乐视经典热综回放,乐视经典热综回放,,https://toutiao.com/group/7449215721336209935/,,0,0,True
香港九龙寨城老照片：曾是香港最邪恶肮脏之地，图9场景令人作呕,2024-11-21 11:32,2724,482,万物知识局,万物知识局,有这么一个地方，他虽然地处极度繁华的都市香港，但是却脏乱不堪，环境极度的恶劣，各种违法的交易都在这里进行，甚至黄赌毒，也在这里悄然滋生，这就是九龙城寨。,https://toutiao.com/group/7439657140518519296/,,0,0,False
广西49岁老汉娶19岁姑娘，结婚21年生下15个孩子，如今有何下场？,2024-10-20 08:32,9367,1170,艺述史,艺述史,她19岁出嫁，21年里总共生育了15个孩子，其中4个男孩子11个女孩子，家里热闹的像是开了一所学校一样。,https://toutiao.com/group/7427400319418384948/,,0,0,False
疑似两款新战机同日试飞，都是六代战机吗？,2024-12-28 12:31,8817,677,凤凰卫视,凤凰卫视,,https://toutiao.com/group/7453439302903530025/,,0,0,True
世界变天，到了该亮剑的时候了！（下）,2024-12-27 22:30,3936,158,占豪,占豪,未来全球的货币到底本位于什么？没有这样一个大池子，别人怎么去长期持有人民币呢？,https://toutiao.com/group/7453026076818670132/,,0,0,True
萝卜和鸡蛋这样做，比吃补药还补，顿顿吃都不会腻，又香又下饭,2024-10-30 12:28,70391,4296,小寒厨艺,小寒厨艺,萝卜和鸡蛋这样做，比吃补药还补，顿顿吃都不会腻，又香又下饭,https://toutiao.com/group/7431405463378919975/,,0,0,True
益生菌真的那么神奇吗？有关益生菌的几个误区 你“踩雷”了吗？,2024-12-07 02:35,1901,107,央视频,央视频,,https://toutiao.com/group/7445492942887715365/,,0,0,True
清华才女李一诺：27岁博士毕业，4年生3娃，能替世界首富花钱,2024-12-18 05:51,6899,333,云莳一,云莳一,家庭是她第一个学校，妈妈是她第一任老师。李一诺27岁博士毕业进入美国麦肯锡公司，33岁成为公司全球董事合伙人，之后四年连生3娃。,https://toutiao.com/group/7449591069311779355/,,0,0,False
WTT关于樊振东及陈梦退出国际乒联世界排名的声明,2024-12-28 14:09,2405,2481,红星新闻,红星新闻,我们对樊振东和陈梦两位球员的贡献深表敬意，他们激励了全世界无数的球迷和运动员。针对就WTT手册提出的关切，我们希望澄清以下几点：1. 规则并非最新出台樊振东和陈梦提到的规则并不是最新出台。这些规定包括世界排名靠前的球员自动入围参赛名单，自四年前WTT成立以来一直沿用至今。,https://toutiao.com/group/7453464017349214732/,,0,0,False
马斯克76岁母亲在中国火了，自称几乎每个月都来，对中国赞不绝口,2024-12-28 11:42,6043,269,国际时事快递,国际时事快递,,https://toutiao.com/group/7453361562800095779/,,0,0,True
"明道带王鸥见家长，王鸥脸红不敢进，明道忽悠,直接叫爸妈丨相爱",2024-12-24 03:21,3683,807,乐视天天剧好看,乐视天天剧好看,,https://toutiao.com/group/7451811744126599695/,,0,0,True
中国新型飞行器，肉眼可见的领先，到底应该算是几代机？,2024-12-27 06:07,37508,2172,陈虎点兵,陈虎点兵,,https://toutiao.com/group/7452969355765088820/,,0,0,True
郭有才：当迷失方向忘记初心后，曾经飘得多高，如今摔得就多惨,2024-11-11 06:53,2137,895,八号探秘人,八号探秘人,在阅读此文之前，辛苦您点击一下“关注”，既方便您进行讨论和分享，又能给您带来不一样的参与感，感谢您的支持！编辑丨brt因为一首翻唱，他一夜之间成为了拥有千万粉丝的网红。但是“人红是非多”，不久他就因为版权等问题陷入了舆论风波。他的人气一落千丈，从万众瞩目变成了现在的无人问津。,https://toutiao.com/group/7435901170239078948/,,0,0,False
男子从老婆手中里解救出小三后，牵着狗头也不回的离开了,2024-11-20 09:07,38031,13290,橙橙分享,橙橙分享,,https://toutiao.com/group/7439285557244461606/,,0,0,True
未来四年大陆不会有统一台湾时间表？随时可解放台湾，何需时间表,2024-12-26 05:50,22441,2075,邱毅台湾,邱毅台湾,,https://toutiao.com/group/7452593764326965800/,,0,0,True
新婚33天卷走274万4套房，出逃后丈夫跨国追捕，如今下场大快人心,2024-12-20 22:06,4161,225,八号探秘人,八号探秘人,在阅读此文之前，辛苦您点击一下“关注”，既方便您进行讨论和分享，又能给您带来不一样的参与感，感谢您的支持！编辑丨QQ·B“色字头上一把刀！”深圳富豪结婚33天竟被卷走274万元和名下4套房产。不仅如此，他还被扣上了“接盘侠”的帽子，啥也没干喜当爹。,https://toutiao.com/group/7450399558821052982/,,0,0,False
五年老员工工资降到两千，辞职走人，下秒老板后悔晚了,2024-12-25 08:36,2888,870,南瓜热剧回放,南瓜热剧回放,,https://toutiao.com/group/7452234729299902976/,,0,0,True
叙利亚乱了，会乱多久？(下),2024-12-27 15:44,5285,158,静思有我,静思有我,,https://toutiao.com/group/7453118130856919587/,,0,0,True
厨师长教你：“葱爆羊肉”羊肉滑嫩、鲜香不膻,2024-12-27 07:34,1911,313,美食作家王刚,美食作家王刚,厨师长教你：“葱爆羊肉”羊肉滑嫩、鲜香不膻,https://toutiao.com/group/7452991735665263139/,,0,0,True
阜阳41岁教师袁宁因病去世，200多名毕业生赶来送行，亲属：学生们陪他到生命最后一刻,2024-12-28 07:54,578,203,极目新闻,极目新闻,极目新闻记者 姚赟12月25日，安徽阜阳第五中学教师袁宁因病离世，享年41岁。27日，在阜阳市殡仪馆，200多名毕业生从全国各地赶来送行。有亲属告诉记者，袁宁患病后仍在坚持工作，曾带着氧气筒去上课。而在他病重后，学生们也一直守护着他，直到生命的最后一刻。,http://jms.ctdsb.net/jmythshare/#/index_share?cId=0&contentType=5&contentId=2339700,,0,0,False
被姚明抱着上奥运的小英雄，曾发誓考上清华，16年后活成了这样,2024-11-07 08:07,4104,800,睿之悦,睿之悦,2008年，年仅9岁的林浩，在姚明的带领下走进了北京奥运会开幕式的舞台上，成为了万众瞩目的“焦点”。,https://toutiao.com/group/7434444094551687707/,,0,0,False
成都市武侯区人民法院：关于被告人贺某阳故意伤害、虐待刑事附带民事诉讼案的说明,2024-12-27 09:43,547,1532,环球网,环球网,,https://toutiao.com/group/7453024640584139274/,,0,0,False
车厘子价格大跳水！或跌到近几年新低，有网友直呼：买早了，亏大了,2024-12-28 12:07,102,176,上观新闻,上观新闻,随着元旦假期临近水果市场“应节明星”车厘子价格、品质广受消费者关注11月初刚上市的空运车厘子动辄百元一斤面对令人咋舌的价格不少人表示“再等等”而本月初随着海运车厘子陆续到港坚挺的车厘子价格开始松动价格下跌速度加快这几天“车厘子价格大‘跳水’”的消息在各大平台疯狂刷屏有网友直呼：“,https://export.shobserver.com/toutiao/html/835351.html,,0,1,False
“现在慢慢能说话，站起来做康复训练”，赵露思朋友报平安！,2024-12-28 15:34,522,545,潇湘晨报•晨视频,潇湘晨报•晨视频,12月28日晚，赵露思朋友在小红书发文，向关心赵露思的网友和粉丝们透露其最新情况：“她委托我跟大家报个平安，希望能稍稍解一下大家的心宽。现在慢慢能说话，开始站起来做康复训练。”该朋友透露，赵露思18日生病，这段时间在医院积极配合治疗。,http://api.chenshipin.com/wap/a/677013568420172dfa016b7a/90f456b81afce808c1fcfbd3f5761f65/1735399932/bf0486d9654a38a5728a3bb0af50678fa557456e0d4b4f7d6b67138451ea7d39,,0,0,False
美军前飞行员：沈飞型像“第六代格斗机”，成飞型根本不是战斗机,2024-12-28 17:35,2701,892,南国工场,南国工场,目前，中国成飞，沈飞两款新一代战斗机，引发了全世界全面关注，特别是美国方面，那真是“天塌了”的感觉，大量美国媒体，博主，网红，对中国新一代战斗机全面关注，其中包括了美国空军前F-16战斗机飞行员，飞行2500多个小时，执行了180次战斗任务的约翰·沃特斯，目前他是一名波音-777的民航机飞行员，正在全球各地飞行。,https://toutiao.com/group/7453503182770045492/,,0,0,False
“最晚12点还在发作业”，家长在群里质疑布置作业太晚，被班主任踢出群！本人要求公开道歉，当地教育局回应,2024-12-28 13:44,645,1570,红星新闻,红星新闻,12月27日，甘肃省武威市一位小学家长发视频反映，因为自己在家长群里质疑三年级英语老师布置作业过晚，问题没解决，自己倒被班主任踢出群。12月28日，记者从武威市教育局证实，凉州区教育局已转给学校核查处理。,https://toutiao.com/group/7453457839143567908/,,0,0,False
女子回乡当“猪大王”成劳模，猪场被强拆自称损失逾9000万，一审判赔328万上诉后已开庭待宣判,2024-12-27 02:53,568,578,大风新闻,大风新闻,她养猪成为当年重庆红红火火的劳动模范，但自从猪场被毁后拿起法律武器走上维权之路，如今疲惫不堪。从上海回乡当“猪大王”，被授予重庆市劳动模范称号她叫覃继英，今年58岁，重庆市大足区人。,https://toutiao.com/group/7452916350076387878/,,0,0,False
未成年禁止观看！2024年全球爆片，尺度大到生理不适,2024-12-23 07:19,3271,105,禾芷解说,禾芷解说,深度解说电影《某种物质》,https://toutiao.com/group/7451503435595121191/,,0,0,True
