title,publish_time,like_count,comment_count,media_name,source,abstract,article_url,tag,is_yaowen,article_sub_type,has_video
原版老电影《追捕》（1976） 日本 高清 中文翻译带字幕,2025-01-04 11:23,1609,205,经典影视鉴赏,经典影视鉴赏,,https://toutiao.com/group/7456017889569653258/,,0,0,True
上海人开豪车向韩国游客炫富，已传到韩国，看看韩国网友怎么说的,2025-01-11 01:25,176,286,小溪水,小溪水,最近有件事儿在网上引起热议，消息甚至传到了韩国，那就是上海的富二代们开着豪车，在街头晃悠，引得人们一阵议论。,https://toutiao.com/group/7458437858731524619/,,0,0,False
当来自缅北诈骗电话被揭穿以后，骗子平静的语气中透出灵魂的绝望,2025-01-08 04:29,2696,422,小七纪实,小七纪实,,https://toutiao.com/group/7457396669752951346/,,0,0,True
深圳电商巨头倒了，三个创始人套现21亿，把“烂摊子”丢给了股民,2025-01-10 08:10,457,296,漫悠芸端,漫悠芸端,相关数据显示，2023年有棵树营收4.64亿元，同比下滑40%，归母净利润为-4.85亿元，相比2022年亏损面继续扩大。,https://toutiao.com/group/7458191540171686451/,,0,0,False
这是张学良老婆赵四小姐真实样貌，并非演员饰演而是货真价实真品,2024-12-28 11:28,16028,1904,历史伟人,历史伟人,赵四小姐，原名赵一荻，她从十六岁开始她终生陪伴张学良，历经坎坷，赵一荻是富家大小姐，但是在张学良囚禁期间，她选择陪伴软禁中的张学良，后悔过吗?,https://toutiao.com/group/7453422736652698175/,,0,0,False
俄罗斯评论家：中国试飞的飞机根本不是六代机！那应该是什么机？,2025-01-10 07:52,2978,750,剑道万古似长夜,剑道万古似长夜,随着中国两款六代机相继成功试飞，世界各国震惊之余，有个别国家的个别专家又开始按照自己的理解贬低中国六代机，为自己的落后找补了。前几天，就有日本的军事专家把中国的歼-36的设计说成是搞笑的，是为了吓唬敌人让其举白旗投降的样子货，就是一场宣传上的“宏大叙事”。,https://toutiao.com/group/7458191337175794211/,,0,0,False
零食很忙被罚175万！你以为买零食占便宜，实际在给他们送钱,2025-01-08 08:21,2031,1026,老张随笔,老张随笔,"最近，""零食很忙""因为违反反垄断法，被罚了175万。说实话，这点罚款对一个年收入76.6亿的企业来说，简直就是挠痒痒。""鸣鸣很忙""可能大家伙不知道是何方神圣，一说起""零食很忙""和""赵一鸣零食""，大家就懂了。",https://toutiao.com/group/7457454597850808866/,,0,0,False
宋美龄106岁去世，贴身厨子回家后不久自尽，事后妻子透露出缘由,2024-10-28 09:22,16712,600,历史与江湖,历史与江湖,2003年10月，106岁的宋美龄在美国纽约去世，这位世纪老人虽然永远地闭上了双眼，但是却留下了一个长寿神话。,https://toutiao.com/group/7430753866158817855/,,0,0,False
全国流感病毒阳性率快速上升,2025-01-06 00:02,1637,120,看看新闻,看看新闻,全国流感病毒阳性率快速上升,http://mediaplay.kksmg.com/2025/01/06/h264_720p_600k_79921-smgnews-20250106065500-9000-979191-600k_mp4.mp4,,0,0,True
