title,publish_time,like_count,comment_count,media_name,source,abstract,article_url,tag,is_yaowen,article_sub_type,has_video
男子从老婆手中里解救出小三后，牵着狗头也不回的离开了,2024-11-20 09:07,38688,13450,橙橙分享,橙橙分享,,https://toutiao.com/group/7439285557244461606/,,0,0,True
贪官酒桌上的权钱交易，语言天衣无缝，听懂三分都是人精！,2024-11-23 16:24,3518,430,乐视扒剧小妹儿,乐视扒剧小妹儿,,https://toutiao.com/group/7440378916130259496/,,0,0,True
代理总统也遭弹劾！一个月内换三任总统，韩国民主还有救吗？,2024-12-28 06:35,11196,104,邱震海,邱震海,,https://toutiao.com/group/7453347580572631592/,,0,0,True
煮米饭别总是加水了，难怪不好吃，教你酒店不外传的秘诀，非常香,2024-12-06 08:45,3331,730,明玥美食,明玥美食,,https://toutiao.com/group/7445217195929371190/,,0,0,True
海南富商张晖：花8亿建108米海上观音像，4年后死在水中死因成谜,2024-10-19 04:49,4602,817,八号探秘人,八号探秘人,在阅读此文之前，辛苦您点击一下“关注”，既方便您进行讨论和分享，又能给您带来不一样的参与感，感谢您的支持！编辑丨xk他是中国的一名富商，耗费8亿元完成了自己的梦想。可梦想落地成为现实的时候，他却在4年后莫名其妙的死去。他就是张晖，上个世纪末海南岛旅游业的龙头当家人。,https://toutiao.com/group/7427288913095492134/,,0,0,False
公安机关侦破缅北果敢明家犯罪集团案：卧虎山庄“10.20”案真相揭开！,2024-12-30 02:01,6538,3056,人民日报,人民日报,针对此前网上流传的“缅北‘10.20案’中有4名中国警察被杀害”“缅北活埋中国警察，造成上百人伤亡”等一系列不实言论，温州市公安局常务副局长王造对真实情况进行回应，同时全面介绍了缅北果敢明家犯罪集团案侦办情况。另外，昆明市公安局刑侦支队支队长纳新为人民日报记者详细介绍了“10.,https://www.peopleapp.com/column/30047862822-500006021192?utm_source=头条号&promote=true,,0,1,False
当得知女友怀孕了，男友不再装穷，直接带妻子回豪宅住,2024-12-17 03:23,3782,128,乐视经典热综回放,乐视经典热综回放,,https://toutiao.com/group/7449215721336209935/,,0,0,True
炖鸡肉不要焯水和直接下锅，教你一招，鸡肉鲜香滑嫩不腥不柴,2024-12-15 08:45,6601,321,家常的味道,家常的味道,炖鸡肉千万不要焯水和直接下锅，教你秒招，鸡肉鲜香滑嫩不腥不柴,https://toutiao.com/group/7448556944597451275/,,0,0,True
最新！韩国代总统提出新要求，101架波音737-800型客机将被全面检查，波音和美国航空机构专家赴韩,2024-12-30 03:50,1073,1077,红星新闻,红星新闻,韩国国土交通部30日宣布，将对韩国国内现有的101架波音737-800型客机进行全面特别检查。韩国代总统：全面革新韩国航空安全体系韩国代总统崔相穆30日要求对韩国航空运营体系进行安全检查，并全面革新韩国航空安全体系。,https://toutiao.com/group/7454044096223527463/,,0,0,False
六代机双飞、四川舰三个第一，神雕无人预警机，中国军工震惊美国,2024-12-30 06:02,18851,1003,邱毅台湾,邱毅台湾,,https://toutiao.com/group/7454081205471085107/,,0,0,True
说一说成飞的新飞机，网上传的越来越玄乎，究竟有多厉害？,2024-12-29 13:21,10065,1186,陈虎点兵,陈虎点兵,,https://toutiao.com/group/7453823402932732435/,,0,0,True
萝卜和鸡蛋这样做，比吃补药还补，顿顿吃都不会腻，又香又下饭,2024-10-30 12:28,70871,4328,小寒厨艺,小寒厨艺,萝卜和鸡蛋这样做，比吃补药还补，顿顿吃都不会腻，又香又下饭,https://toutiao.com/group/7431405463378919975/,,0,0,True
把8斤黄鳝放在水池里养，一年后放干水看长多大了，是赔还是赚？,2024-11-20 16:24,13404,3184,幺妹儿,幺妹儿,,https://toutiao.com/group/7439398131826950691/,,0,0,True
【空气炸锅烤红薯】直接烤是大错！教你一招，红薯香甜软糯流蜜汁,2024-12-25 14:05,964,394,明玥美食,明玥美食,【空气炸锅烤红薯】直接烤是大错！教你一招，红薯香甜软糯流蜜汁，比买的好吃,https://toutiao.com/group/7452350435098919443/,,0,0,True
包厢全是刚出狱的恶霸，结果一看到饭店主厨，立马怂了,2024-11-11 01:21,14261,387,乐视群星访谈秀,乐视群星访谈秀,,https://toutiao.com/group/7435825833048015400/,,0,0,True
中国两种六代机试飞，美国不再是“领头羊”，我们为何跑得更快？,2024-12-28 10:38,8512,620,杜文龙,杜文龙,,https://toutiao.com/group/7453410241116373513/,,0,0,True
面粉这个做法绝了，比包子馅饼好吃，有菜有肉，1周可以吃好几次,2024-11-21 13:06,5627,667,小寒厨艺,小寒厨艺,面粉这个做法绝了，比包子馅饼好吃，有菜有肉，1周可以吃好几次,https://toutiao.com/group/7439718337031963171/,,0,0,True
疑似两款新战机同日试飞，都是六代战机吗？,2024-12-28 12:31,16115,1109,凤凰卫视,凤凰卫视,,https://toutiao.com/group/7453439302903530025/,,0,0,True
老纪和珅这段对话，以前小时候听不懂，如今听完受益终身,2024-12-28 23:16,2800,921,乐视扒剧小妹儿,乐视扒剧小妹儿,,https://toutiao.com/group/7453420191947424293/,,0,0,True
广西49岁老汉娶19岁姑娘，结婚21年生下15个孩子，如今有何下场？,2024-10-20 08:32,9764,1215,艺述史,艺述史,她19岁出嫁，21年里总共生育了15个孩子，其中4个男孩子11个女孩子，家里热闹的像是开了一所学校一样。,https://toutiao.com/group/7427400319418384948/,,0,0,False
中国第六代战机首飞成功！美国震惊,2024-12-28 09:27,11163,507,王丰台北,王丰台北,这两天，大陆网上流传著两个视频，也就是传闻很久的中国新型第六代战机的试飞画面。这两个视频引起了中外军迷的热烈讨论。第一时间有人看了这两个视频之后，认为这画面真假莫辨。不敢相信这真的就是中国第六代战机在作试飞。但是，一天之中居然在中国不同地点，有人同时发布两则视频，公开了两款不同的第六代战机试飞画面，这立马成为轰动世界的大新闻。当天稍晚，甚至连来自美国的外电都在议论这两个视频，美国西方也确认中国同时发布了两款第六代战机的试飞画面。美国也承认这是板上钉钉，证明中国的第六代战机已经横空出世，正式诞生了。(声明:本视频脚本文稿全部都是作者自己亲自撰写，视频中如有引述新闻信息素材时，作者都会在视频中口头说明来源。其它绝大多数素材内容均属作者本身之论述观点创意，特此声明),https://toutiao.com/group/7453391948548669962/,,0,0,True
新婚33天卷走274万4套房，出逃后丈夫跨国追捕，如今下场大快人心,2024-12-20 22:06,4332,228,八号探秘人,八号探秘人,在阅读此文之前，辛苦您点击一下“关注”，既方便您进行讨论和分享，又能给您带来不一样的参与感，感谢您的支持！编辑丨QQ·B“色字头上一把刀！”深圳富豪结婚33天竟被卷走274万元和名下4套房产。不仅如此，他还被扣上了“接盘侠”的帽子，啥也没干喜当爹。,https://toutiao.com/group/7450399558821052982/,,0,0,False
马斯克76岁母亲在中国火了，自称几乎每个月都来，对中国赞不绝口,2024-12-28 11:42,15717,645,国际时事快递,国际时事快递,,https://toutiao.com/group/7453361562800095779/,,0,0,True
益生菌真的那么神奇吗？有关益生菌的几个误区 你“踩雷”了吗？,2024-12-07 02:35,1924,109,央视频,央视频,,https://toutiao.com/group/7445492942887715365/,,0,0,True
县长看不上乡长送的烟，给他退回来，乡长打开一看乐了,2024-11-13 08:16,11159,1843,乐视大综艺咖,乐视大综艺咖,,https://toutiao.com/group/7436672568578277925/,,0,0,True
中美贸易战中，我们已不再被动！,2024-12-29 03:00,22791,233,卢克文工作室,卢克文工作室,,https://toutiao.com/group/7453398751932219941/,,0,0,True
厨师长教你：“葱爆羊肉”羊肉滑嫩、鲜香不膻,2024-12-27 07:34,2388,434,美食作家王刚,美食作家王刚,厨师长教你：“葱爆羊肉”羊肉滑嫩、鲜香不膻,https://toutiao.com/group/7452991735665263139/,,0,0,True
弟弟光荣退伍，姐姐兴奋去车站接他，怎料一见弟弟瞬间哭了,2024-11-05 06:34,43190,3406,乐视天天剧好看,乐视天天剧好看,,https://toutiao.com/group/7433679820573934091/,,0,0,True
雷军亲自挖人！为95后“天才少女”开出千万年薪,2024-12-30 00:58,552,235,极目新闻,极目新闻,雷军亲自挖人，95后“天才少女”，年薪千万。最近，国产大模型DeepSeek在全球火了，并带火了一个95后AI“天才少女”罗福莉。据证券时报报道，雷军亲自出手“挖人”，支付的薪酬，在千万元级别。 图源：雷军视频号 95后AI“天才少女”刷屏！,http://jms.ctdsb.net/jmythshare/#/index_share?cId=0&contentType=5&contentId=2340413,,0,0,False
河南警察3岁女儿被拐，苦寻全国23年无果，结果却发现女儿在对门,2024-11-05 07:43,5890,681,八号探秘人,八号探秘人,寻亲23年无果，丢失的女儿竟住在对门?但它却真实发生在河南洛阳的梁绍波身上。是意外走丢，还是人贩子所为，三岁的女儿怎会离奇失踪?,https://toutiao.com/group/7433697108120142345/,,0,0,False
近5年最热的十部剧，《狂飙》第9，《繁华》第6，第1名很难超越,2024-12-01 03:58,1813,648,电影烂番茄,电影烂番茄,今天，番叔就结合口碑，给大家盘点一下近五年，热度最高的十部电视剧。第十名:《都挺好》 猫眼热度 9775.8，播出时间2019年。,https://toutiao.com/group/7430845717314273831/,,0,0,False
小子相亲故意扮老，谁知道对方一见面就叫他大爷，这段太逗了,2024-12-24 08:17,2048,466,乐视热播综艺精选,乐视热播综艺精选,,https://toutiao.com/group/7451886130837848610/,,0,0,True
