title,publish_time,like_count,comment_count,media_name,source,abstract,article_url,tag,is_yaowen,article_sub_type,has_video
把三个女儿弄去坐牢后，蓝翔校长再送原配入狱，这次被“反杀”了,2024-10-25 00:51,797,270,客观听書,客观听書,荣兰翔作为蓝翔学校的校长，本应该是人生赢家，却没想到和妻子已经到了反目成仇的地步。她举报丈夫曾经存在巨额的偷税漏税行为，并且长年家暴，甚至在外还有私生子，这则消息一经公布瞬间引发了不小的轰动。,https://toutiao.com/group/7429243688062124563/,,0,0,False
中美印世界500强城市，上榜数量断崖：美56，印13，中国令人意外,2024-10-24 09:57,2188,133,泌尿外科李医生,泌尿外科李医生,声明：本文内容均是根据权威资料结合个人观点撰写的原创内容，在今日头条全网首发72小时，感谢各位看官点击支持原创，文末已标注文献来源及截图，请知悉。在全球经济格局中，存在一种非常明显的“老中青”交替现象。,https://toutiao.com/group/7429278092809536035/,,0,0,False
河南男子昆仑山死亡谷回来后精神失常，临终前说：里面的不是人,2024-10-21 09:58,386,112,微趣史,微趣史,在中国的古代神话中，这里是仙境，是传说中的西王母居住之地。一个河南男子自昆仑山归来后就精神失常，时常自言自语，临终时更是不断重复一句话:里面的不是人。,https://toutiao.com/group/7428165778752520715/,,0,0,False
罕见！100年前，英国游客拍下的清朝乡村，和想象中完全不一样,2024-09-20 02:07,3008,403,万物知识局,万物知识局,泥泞的土路，衣不蔽体的老百姓，即便是达官显贵的家中也十分破败，而这些都是清王朝的历史痕迹，虽说那时候中国摄影技术并不发达，但也有许多外国游客来到这里，拍摄下了许多老照片，为我们留下了珍贵的历史资料，那清朝到底是怎样的面貌呢?,https://toutiao.com/group/7416287738871267855/,,0,0,False
东北一家同睡一炕上，新婚夫妻不尴尬吗？对于这事当地人怎么说？,2024-10-18 08:26,644,138,昕昕局,昕昕局,文 | 昕昕●—≺ 前 言 ≻—●“睡过北方的炕，才知道什么是冬天”。这句话，在社交网络上被无数南方网友奉为金句。的确，对于很多没去过东北的人来说，“炕”是一个充满神秘感的词语。它究竟是什么？为什么东北人对它如此情有独钟？,https://toutiao.com/group/7427028724601651727/,,0,0,False
大陆决意收台之日，特朗普说出的对策，让美媒都有些猝不及防,2024-10-19 09:08,9718,179,庆彬有理,庆彬有理,在接受美媒《华尔街日报》采访时，特朗普语出惊人，称要是台海局势生变，中国大陆对台湾岛采取行动，特别是“进入台湾”，他就会对中国大陆“征收额外的关税”，比例高达150%到200%。,https://toutiao.com/group/7427411001140363839/,,0,0,True
离婚3年后，37岁赵丽颖深夜发文，高调宣布喜讯，终于等到这一天,2024-10-25 08:38,1228,244,云莳一,云莳一,不知不觉中，今年37岁的赵丽颖已经离婚3年了，一向低调的她，却在2024年10月21日，按捺不住内心的激动，深夜发文高调宣布喜讯。,https://toutiao.com/group/7429557982087709203/,,0,0,False
她是央视最惨主持人，男友被判死缓，丈夫诈骗入狱，47岁无人敢娶,2024-08-27 23:30,2264,210,闻书识焉,闻书识焉,她曾是央视的台柱子，和董卿、周涛并称为央视的三朵金花。回顾刘芳菲的前半生，最令人感到惋惜的，便是她的感情生活，47岁至今无人敢娶。,https://toutiao.com/group/7407743113688564258/,,0,0,False
“人生赢家”吕中：儿子是导演，儿媳是影后，女儿是她一生的骄傲,2024-09-23 10:09,1045,145,青衫书生,青衫书生,如果说娱乐圈里唱歌、跳舞等行业多数是吃青春饭的话，那表演行业则恰恰相反。一个好的演员，只要是一直深耕于影视圈，不断地提高自己的演技，那即使是年龄增长也不会对自己的发展造成多大的影响。这也是大家常常在荧幕上看见“老戏骨”，却很少看见年龄较大的歌手和舞者的原因。,https://toutiao.com/group/7417769032868233780/,,0,0,False
台海形势已经大变，打响“第一枪”的人，可能让大家都意想不到？,2024-10-24 06:44,2137,126,蒋福伟,蒋福伟,台海形势出现了深刻变化，在台海打响“第一枪”的人，可能让大家都意想不到。中国大陆海警持续加强在台海周边的执法巡航力量，岛内媒体担忧称大陆很可能会通过此举封锁台岛。,https://toutiao.com/group/7429229108334297600/,,0,0,False
全球约一半肝癌在中国，再次提醒：家中的4种食物，尽早撤下餐桌,2024-08-13 08:36,105544,3575,梁医学社梁怡璋医生,梁医学社梁怡璋医生,,https://toutiao.com/group/7402540119712629311/,,0,0,True
善恶终有报：疫情时对中国一毛不拔，却大方捐美国6亿，如今咋样,2024-09-29 05:50,876,117,睿之悦,睿之悦,可就是这样一位在中国土生土长起来的富豪，在疫情期间面对同胞的困境却一毛不拔，反而大方的捐助了6亿给美国。,https://toutiao.com/group/7419859345154015798/,,0,0,False
抛弃24年原配，转身迎娶小娇妻，不料儿子30年的报复让他遗憾终生,2024-09-21 01:57,2273,199,八号探秘人,八号探秘人,这是电视剧《亮剑》里的一句经典台词，也正因此，47岁的李幼斌一炮而红。当了30年的演员，他可谓是大器晚成，可人红是非多，随之而来的是他备受争议的私生活。,https://toutiao.com/group/7416692713007120934/,,0,0,False
3年前，宁夏7岁小女孩一笑走红，后拒百万签约，如今怎么样了？他们后悔了吗？,2024-09-19 07:25,5603,910,睿之悦,睿之悦,2021年，视频镜头中出现的女孩儿用那一抹甜美的笑容，迅速引起了网友们的广泛关注。有媒体公司看到这一机遇，提出愿意用百万巨资与女孩儿签约，然而，女孩儿的父母却坚决拒绝了这一提议。,https://toutiao.com/group/7416250139544879679/,,0,0,False
塞尔维亚，最终抛弃了俄罗斯！武契奇明确表态：拒参金砖会议,2024-10-22 09:53,2027,1445,利刃,利刃,据观察者网10月22日的报道，塞尔维亚总统武契奇对媒体表示，由于要接待欧委会主席冯德莱恩、希腊总理米佐塔基斯以及波兰总理图斯克，他太忙了，无法参加在俄罗斯喀山举行的金砖会议。,https://toutiao.com/group/7428535449653658138/,,0,0,False
给近三年最好的10部年代剧排个名：《人世间》第6，第1名没有争议,2024-09-06 08:08,8209,2748,皮皮电影,皮皮电影,时尚是个轮回，电视剧也是。在2020年之前的那些年，电视剧市场基本上都被偶像剧、都市剧霸占。曾经撑起国剧品质的《闯关东》《岁月》这类年代好剧，难见踪影。,https://toutiao.com/group/7411390030722712090/,,0,0,False
阿斯麦向美国承诺：只要解放军攻台，立刻远程瘫痪台积电光刻机,2024-10-25 14:34,625,161,司马南,司马南,偶然看到一则信息，阿斯麦公司向美国作出保证，如果中国人民解放军攻打台湾地区，他们便立刻远程瘫痪台积电的光刻机。,https://toutiao.com/group/7429718340911858195/,,0,0,False
写歌30年穷困潦倒，前妻失望选择离婚，谁料51岁靠一首歌一夜成名,2024-08-12 03:37,26172,4327,八号探秘人,八号探秘人,在阅读此文之前，辛苦您点击一下“关注”，既方便您进行讨论和分享，又能给您带来不一样的参与感，感谢您的支持！编辑：LY无数人都想要一个一夜成名的机会，但机会来了也不是每个人都能把握住的。他用了三十年的时间来准备迎接属于自己的机会。为了这个机会他放弃了一切，甚至包括家庭。,https://toutiao.com/group/7402090890367484428/,,0,0,False
除了戴头盔，12月起，电动车、摩托车、三轮车上路有4个新标准,2024-10-24 07:21,1815,270,新能源战略家,新能源战略家,请您在阅读前，先点击上面的“关注”。感谢您的支持，我们将为您带来更多有价值的内容。随着10月接近尾声， 整个电动车行业也进入今年最后的发展阶段。但事实上，每到年底，全国各地针对电动车市场的整治和检查强度都会迎来直接的提升。,https://toutiao.com/group/7429238621447701004/,,0,0,False
今天才知道！电动车“每天充”和“用完再充”，到底哪个更伤电池,2024-08-27 11:19,13390,2264,鲸探所,鲸探所,“今天到底给车充不充电？”估计大多数人每天回家都会想这个问题，看着自己的电动车电量又多又少的，充不充电也是一件非常难以抉择的事情。那么，电动车到底应该怎样充电呢？是每天都充，还是用完之后再充呢？电动车充电不管是在城市还是农村，电动车其实都是人们出门最常见的交通工具。,https://toutiao.com/group/7407773012533117475/,,0,0,False
1976年周、朱、毛同一年逝世，临终前，三位伟人都交代了什么话？,2024-09-24 09:46,10548,457,呷谈历史,呷谈历史,1976年是最令人悲伤的一年，那一年三位伟人相继离世，还发生了唐山大地震。三位伟人在离世前都交代了一些事情，这些事情都和之后国家的发展有关系。,https://toutiao.com/group/7418141722196197900/,,0,0,False
以后想吃回锅肉你就像我这样做，肥而不腻，咸香适口，太解馋了,2024-08-06 11:19,34415,1260,家常的味道,家常的味道,,https://toutiao.com/group/7399984507362738742/,,0,0,True
农村小情侣深夜约会，在屋内过着二人世界，兴奋坏了,2024-10-16 01:14,1296,134,乐视热播综艺精选,乐视热播综艺精选,农村小情侣深夜约会，在屋内过着二人世界，兴奋坏了,https://toutiao.com/group/7426173284741284364/,,0,0,True
51年洪学智妻子寻女无果，到老乡家歇脚老乡惊呼：你要找得就是我,2024-09-22 01:07,5720,381,品古观今,品古观今,前言1951年，阳曲县委大院突然来了7、8位解放军同志，其中一位女同志，就是洪学智的妻子张文。她此番前来，就是为了寻找多年前因战乱而寄养于民间的爱女。可昔日的小村落早已蜕变成另一番景象，这无异于是大海捞针。,https://toutiao.com/group/7417034363226915354/,,0,0,False
15 年保安徒手接跳楼女孩，女孩母亲：我女儿若有事，你一辈子负责,2024-10-05 09:59,852,194,陈志华观天下,陈志华观天下,2015 年，28 岁的保安曲岩用胳膊接住了跳楼自杀的女孩。2015 年 10 月 12 日，吉林大学第四医院人来人往。,https://toutiao.com/group/7422228565413872139/,,0,0,False
为国争光却遭郎平弃用！转身效力土耳其的王一梅，如今咋样了？,2024-08-31 13:19,942,144,豆莱说,豆莱说,光阴似箭，日月如梭，当初的少女早已退役，成为了排球场的幕后人，这么多年她都经历了什么，现在又怎么样了呢?,https://toutiao.com/group/7409287778514567718/,,0,0,False
