title,publish_time,like_count,comment_count,media_name,source,abstract,article_url,tag,is_yaowen,article_sub_type,has_video
中共中央政治局召开民主生活会 习近平主持会议并发表重要讲话,2024-12-27 11:14,5112,2776,央视新闻,央视新闻,原标题：中共中央政治局召开民主生活会强调巩固深化党纪学习教育成果在加强党的纪律建设上发挥示范引领作用中共中央总书记习近平主持会议并发表重要讲话中共中央政治局于12月26日至27日召开民主生活会，深入学习贯彻习近平新时代中国特色社会主义思想，围绕巩固深化党纪学习教育成果、综合发挥党,https://content-static.cctvnews.cctv.com/snow-book/index.html?item_id=12603532969921553222&source=50006&sub_source=50006_001,,0,0,False
学习卡丨2024年国内考察，总书记格外关注这个方面,2024-12-27 12:26,678,381,央视新闻,央视新闻,2024年，习近平总书记多次赴地方考察，先后去往天津、湖南、重庆、山东等地，强调优先抓好民生领域各项改革，着力解决人民群众急难愁盼问题。,https://content-static.cctvnews.cctv.com/snow-book/index.html?item_id=15486219581661835332&source=50006&sub_source=50006_001,,0,0,False
郜春海：低空经济的发展空间远超新能源，颠覆未来商业模式,2024-12-19 08:10,2928,646,凤凰网财经,凤凰网财经,,https://toutiao.com/group/7450032423821115914/,,0,0,True
益生菌真的那么神奇吗？有关益生菌的几个误区 你“踩雷”了吗？,2024-12-07 02:35,1877,107,央视频,央视频,,https://toutiao.com/group/7445492942887715365/,,0,0,True
六代机刚首飞，076紧接下水，五角大楼忙得团团转，国会紧急问责,2024-12-27 07:15,1246,288,东方点兵,东方点兵,在过去很长一段时间以来，中国在航空领域远远不如美国，已是一个众所周知的共识。然而随着时间的推移，解放军大批量的先进装备相继问世，这一评价转变成了“不分伯仲”。,https://toutiao.com/group/7452986116057891378/,,0,0,False
曾美慧孜：穿越逆境抵达繁星，每个人的故事都是一部史诗,2024-12-25 02:49,2721,266,澎湃新闻,澎湃新闻,作为演员，曾美慧孜珍惜每个表演的机会，那是“在不同的时间和空间中雕刻时光”。每一次启程，都是重拾自己。当第一道曙光划破黑暗，我们如何重新启程？,https://cloudvideo.thepaper.cn/video/f7d084fa8442481d8171472a1de2768e/hd/1735093377000_nyiZkY_1735093517840.mp4,,0,0,True
阿富汗“卖枪”犹如卖白菜 ，外国人竟能随便买？喷子威力太大了,2024-12-26 10:00,10395,1184,耀阳环游记,耀阳环游记,,https://toutiao.com/group/7452374019187147315/,,0,0,True
未来四年大陆不会有统一台湾时间表？随时可解放台湾，何需时间表,2024-12-26 05:50,19204,1784,邱毅台湾,邱毅台湾,,https://toutiao.com/group/7452593764326965800/,,0,0,True
萝卜和鸡蛋这样做，比吃补药还补，顿顿吃都不会腻，又香又下饭,2024-10-30 12:28,69920,4265,小寒厨艺,小寒厨艺,萝卜和鸡蛋这样做，比吃补药还补，顿顿吃都不会腻，又香又下饭,https://toutiao.com/group/7431405463378919975/,,0,0,True
县长看不上乡长送的烟，给他退回来，乡长打开一看乐了,2024-11-13 08:16,10717,1794,乐视大综艺咖,乐视大综艺咖,,https://toutiao.com/group/7436672568578277925/,,0,0,True
两款新战机同时亮相，美国人“天塌了”：震惊、质疑、令人沮丧,2024-12-27 02:59,24834,2708,第一军情,第一军情,12月26日，大量的社交媒体发布视频和图片，显示一架从未见过的新式飞行器在西南上空亮相，这架飞机采用钻石式三角机翼、无尾设计和扁平化设计，还配备了三台航空发动机，造型奇特让伴飞的双座版歼-20S战机都黯然失色。紧接着，数千公里之外的东北，一架体型稍小、采用“兰姆达”式后掠翼和无尾设计的飞行器首次公开亮相，由沈飞的歼-16担任“追逐机”。,https://toutiao.com/group/7452920971226251813/,,0,0,True
马航MH370将再度搜索，为何没有中国参与？逆向推定可能原因,2024-12-26 22:01,10844,523,黎建南台湾,黎建南台湾,,https://toutiao.com/group/7452843981844513317/,,0,0,True
深圳夫妻生育两女后再迎四胞胎女儿，如今顿顿吃面条,2024-12-27 07:02,558,273,大河报,大河报,来源：极目新闻租住在深圳龙华区的城中村，陈小波每天上午8点多准时骑着电动车到几公里外的公司上班，在外忙碌一天，往往晚上9点左右才能到家。,https://toutiao.com/group/7452982583643701810/,,0,0,False
"明道带王鸥见家长，王鸥脸红不敢进，明道忽悠,直接叫爸妈丨相爱",2024-12-24 03:21,3412,737,乐视天天剧好看,乐视天天剧好看,,https://toutiao.com/group/7451811744126599695/,,0,0,True
中疾控：流感阳性率16.5%！用好2个中成药，扶正固表防流感,2024-12-25 23:42,919,137,李药师谈健康,李药师谈健康,监测数据显示，12月9日到12月15日第50周，呼吸道样本病原体核酸检测阳性率中，流感病毒的阳性率已经由前一周的10.83%，进一步升高到了16.5%!,https://toutiao.com/group/7452498433225392640/,,0,0,False
马光远：大城市才有机会的观点过时了 #财经大咖来了,2024-12-17 06:00,7457,560,光远看经济,光远看经济,,https://toutiao.com/group/7449256659496469027/,,0,0,True
柯文哲获交保出监狱，重见天日，下面艰难的司法战，有多少胜算？,2024-12-27 11:09,7781,439,邱毅台湾,邱毅台湾,,https://toutiao.com/group/7453047137757037071/,,0,0,True
震撼航拍！舰舷喷射绚丽彩带 船坞开始注水 四川舰来了→,2024-12-27 06:21,1369,247,国际在线,国际在线,,https://crionline-media.cri.cn/cb5a6d96-d0c4-4fd0-a895-b6135667d84a/video/a6d94bf03587433b9b5197cc7fcc8d9e.mp4,,0,0,True
英媒预测：中国将提前十年达成，其他国家根本没法比,2024-12-27 03:51,2830,313,环球时报,环球时报,12月26日，英国《金融时报》援引多家研究机构提供的数据预测称，预计明年，中国电动汽车销量将首次超过内燃机汽车。分析人士指出，作为全球最大汽车市场，中国比预期提前了足足10年达成这一历史性拐点，在汽车电动化进程方面“没有哪个国家能与中国相比”。,https://toutiao.com/group/7452934277244649984/,,0,0,True
20岁女孩身高2.26米，貌美如花，妈妈却嫌弃：比门还高，咋找对象,2024-10-31 20:55,10313,2284,鲨娱崽崽,鲨娱崽崽,虽然夸张了些，但是北方人确实大多数都是人高马大，身材高挑的。男生超过1米9绝对是加分项，可女生一旦超过1米7就会让许多人望而生畏，不敢上前。,https://toutiao.com/group/7431759048413954596/,,0,0,False
100年前，清朝罕见留影，王爷妻妾婀娜多姿，乞丐全身挂满垃圾,2024-10-14 09:58,2773,310,万物知识局,万物知识局,每一张老照片，都像是时间的低语，它们静静地躺在历史的相册中，却在不经意间将我们拉回到那个遥远而神秘的年代。,https://toutiao.com/group/7425457574731579919/,,0,0,False
河南警察3岁女儿被拐，苦寻全国23年无果，结果却发现女儿在对门,2024-11-05 07:43,5678,640,八号探秘人,八号探秘人,寻亲23年无果，丢失的女儿竟住在对门?但它却真实发生在河南洛阳的梁绍波身上。是意外走丢，还是人贩子所为，三岁的女儿怎会离奇失踪?,https://toutiao.com/group/7433697108120142345/,,0,0,False
中国制造2025发威  中美科技战逆转,2024-12-25 11:57,9289,318,郭正亮台湾,郭正亮台湾,大家好，我是郭正亮，你可以叫我亮哥。我来今日头条开帐号，这是我的唯一官方号《郭正亮台湾》，欢迎你时常造访与亮哥谈天说地！,https://toutiao.com/group/7452317340374401545/,,0,0,True
美军战机到底被谁打下来的？这次真的出大事了（上）,2024-12-26 10:00,2224,126,占豪,占豪,这美军不是全球最牛的海军吗？怎么就把自己的战机都击落了？事实到底应该是怎样的呢？,https://toutiao.com/group/7452265675122278912/,,0,0,True
清华才女李一诺：27岁博士毕业，4年生3娃，能替世界首富花钱,2024-12-18 05:51,6258,315,云莳一,云莳一,家庭是她第一个学校，妈妈是她第一任老师。李一诺27岁博士毕业进入美国麦肯锡公司，33岁成为公司全球董事合伙人，之后四年连生3娃。,https://toutiao.com/group/7449591069311779355/,,0,0,False
无力承担罚款！奥运冠军陈梦、樊振东同日退出世界排名,2024-12-27 06:56,2570,998,九派新闻,九派新闻,12月27日，乒乓球运动员樊振东发文，称将退出世界排名，但不会退役。随后乒乓球运动员陈梦点赞樊振东动态，同时也发文称将退出世界排名。,https://toutiao.com/group/7452981636553064997/,,0,0,False
中国下一代战机画面引爆外媒：震撼！中国航空工业实现了又一里程碑,2024-12-27 08:47,8008,3090,观察者网,观察者网,【文/观察者网 刘程辉】 我们的下一代战机，真的就这么来了？！ 12月26日，毛泽东同志诞辰131周年纪念日。,https://www.guancha.cn/internation/2024_12_27_760307.shtml,,0,0,False
台湾又拍大尺度！ 太羞耻了，注定只能网盘见,2024-12-10 09:40,3976,203,禾芷解说,禾芷解说,深度解说台湾电影《亲爱的杀手》,https://toutiao.com/group/7446671812101931572/,,0,0,True
“突然通知关停”！上海知名网红夜市彻底消失！摊主：从月入10万到日赚几十元，动不动就断电，卫生状况也不好……,2024-12-24 13:54,1183,725,每日经济新闻,每日经济新闻,去年夏天，在浦星公路旁紧邻地铁8号线芦恒路的中欧街，一座夜市尚未在网络出圈就已经人气满满。和一些夜市“脏、乱、差”的情况相比，这里既接地气，又整齐规范，深受周边居民的喜爱。今年7月份，记者曾走访中欧街夜市，其人气不减，但美食等选择相对雷同。,http://www.nbd.com.cn/rss/jinri_toutiao/articles/3697935.html,,0,0,False
笑得肚子疼夫妻搞笑对话，一个我都对付不了，还想三妻四妾,2024-12-20 23:56,7743,263,悠悠情感正能量,悠悠情感正能量,,https://toutiao.com/group/7450647187001705011/,,0,0,True
中国新型飞行器，肉眼可见的领先，到底应该算是几代机？,2024-12-27 06:07,28784,1809,陈虎点兵,陈虎点兵,,https://toutiao.com/group/7452969355765088820/,,0,0,True
成都市武侯区人民法院：关于被告人贺某阳故意伤害、虐待刑事附带民事诉讼案的说明,2024-12-27 09:43,178,504,环球网,环球网,,https://toutiao.com/group/7453024640584139274/,,0,0,False
中国新型战机气场强大，采用飞翼式布局，会是歼轰-26吗？,2024-12-27 07:26,17867,1487,杜文龙,杜文龙,,https://toutiao.com/group/7452989773662126618/,,0,0,True
毛主席遗体46年不腐，每天靠天价保养费维持？工作人员揭开内幕,2024-12-26 23:13,1091,101,多才多艺豆浆GG,多才多艺豆浆GG,,https://toutiao.com/group/7452862736142172699/,,0,0,True
哥哥直播时，全红婵来电话，开口就问老妈呢？兄妹俩聊天真搞笑！,2024-12-19 07:26,4236,409,小城拾荒者,小城拾荒者,,https://toutiao.com/group/7450021028383687168/,,0,0,True
嘿嘿嘿，要过年了下饺子喽，076牛在哪？造几条？,2024-12-27 06:43,20786,1310,金灿荣教授,金灿荣教授,,https://toutiao.com/group/7452978619871134258/,,0,0,True
