title,publish_time,like_count,comment_count,media_name,source,abstract,article_url,tag,is_yaowen,article_sub_type,has_video
黎智英香港出庭抖内幕，美国介入，蔡英文参与，还有赵少康金小刀,2024-11-27 09:24,35956,2252,邱毅台湾,邱毅台湾,,https://toutiao.com/group/7441887559757595190/,,0,0,True
包厢全是刚出狱的恶霸，结果一看到饭店主厨，立马怂了,2024-11-11 01:21,9706,218,乐视群星访谈秀,乐视群星访谈秀,,https://toutiao.com/group/7435825833048015400/,,0,0,True
1米3袖珍美女嫁给1米48男孩，婚后丈夫奇迹长高，两人却不欢而散,2024-09-07 02:55,6695,361,睿之悦,睿之悦,杨萍和葛存苗的婚礼 文|睿之悦 编辑|睿之悦2019年，成都的民政局来了两个“10岁小孩”来登记，工作人员以为是玩闹。两个“小孩”拿出身份证让工作人员看，这才明白，原来是两个再也长不高的成年袖珍人情侣。,https://toutiao.com/group/7411713833267364386/,,0,0,False
马龙访台，台湾人热烈欢迎，台独焦虑不安视为大敌使出妖魔化老招,2024-11-29 09:56,22004,918,邱毅台湾,邱毅台湾,,https://toutiao.com/group/7442637867307762230/,,0,0,True
羽绒服“暴雷”，普通人买羽绒服，看不懂水洗标上这3个词，容易吃大亏！,2024-11-30 09:21,424,230,环球网,环球网,来源：科普中国 近日，有关羽绒服的话题频繁上热搜。有服装行业人士说，90%的鸭绒从去年的35万涨到今年的59万一吨；90%的鹅绒从去年的70万涨到今年的125万一吨。成本的暴涨，导致某些厂家用50%的鸭绒冒充90%的鹅绒，甚至拿废丝掺在鹅绒里。我们普通消费者，要怎么选购羽绒服呢？,https://3w.huanqiu.com/a/3084ce/4KT1XWDBsfa?agt=20,,0,0,False
为什么女生总是喊疼？真相不是你想的那样！,2024-10-17 03:44,2585,116,好奇博士的实验室,好奇博士的实验室,在大部分人的印象里。女生总是比男生更怕疼。这事儿还真不是瞎说。早就有很多研究都证明了。不是矫情也不是撒娇。,https://toutiao.com/group/7426291473987011082/,,0,0,False
河南警察3岁女儿被拐，苦寻全国23年无果，结果却发现女儿在对门,2024-11-05 07:43,2114,187,八号探秘人,八号探秘人,寻亲23年无果，丢失的女儿竟住在对门?但它却真实发生在河南洛阳的梁绍波身上。是意外走丢，还是人贩子所为，三岁的女儿怎会离奇失踪?,https://toutiao.com/group/7433697108120142345/,,0,0,False
全家人爱吃的懒人早餐，5分钟出锅，比包子好吃，比油条还香,2024-11-13 03:50,3212,414,家味美食,家味美食,,https://toutiao.com/group/7436606239527666212/,,0,0,True
女友怀孕了，男友不装了，带她回豪宅！,2024-11-23 08:01,7806,658,乐视大综艺咖,乐视大综艺咖,,https://toutiao.com/group/7440353629540483593/,,0,0,True
中国“三舰岛航母”出海，美媒质疑：造型这么奇怪，干啥用的？,2024-11-28 05:42,5541,354,第一军情,第一军情,近日，广州传来了一个振奋人心的消息，此前网上多次流传的“民用版075”出海试航了。从曝光的视频中看到，该舰有个非常奇特的地方——既有075两栖攻击舰的那种平直大甲板，又有3个舰岛，中间的舰岛非常大，前后两个舰岛又是一大一小。,https://toutiao.com/group/7442201448009433615/,,0,0,True
警惕“先用后付”小心欠下账单～（央视频号：光华路资讯）,2024-11-27 12:44,16306,4936,央视频,央视频,,https://toutiao.com/group/7441939150552433179/,,0,0,True
泽连斯基开出停火条件，俄方回应了,2024-11-30 23:18,1664,3287,齐鲁壹点,齐鲁壹点,据乌克兰国际文传电讯社29日晚报道，乌总统泽连斯基当天接受英国媒体采访时表示，在乌克兰政府控制的领土被纳入北约保护的前提下，他愿意停止热战。,http://m.ql1d.com/new/general/25204820,,0,0,False
女教师因丈夫被开除，不料她丈夫竟是将军，校长要完了,2024-11-27 08:32,3394,552,南瓜说异,南瓜说异,,https://toutiao.com/group/7441874251113562636/,,0,0,True
突发讣告！今晨3时18分，他因病医治无效在汉逝世,2024-11-30 14:19,2687,581,红星新闻,红星新闻,11月30日，武汉大学哲学学院发布讣告：武汉大学哲学学院教授、博士生导师、中国民主同盟成员程炼，因病医治无效，于2024年11月30日3时18分在武汉逝世，享年60岁。,https://toutiao.com/group/7443075934711775798/,,0,0,False
目前，全军13所正师级部队医院的驻地在哪，前身分别是哪些医院？,2024-09-21 06:26,11202,825,作家杨文山,作家杨文山,军改这阵风刮得猛，非作战单位首当其冲，譬如部队医院、军校、科研机构，都免不了挨上一刀。如今，全军剩下那13所正师级部队医院，各自驻在哪儿，前身又是哪几家老牌医院?,https://toutiao.com/group/7416978804062634550/,,0,0,False
弟弟光荣退伍，姐姐兴奋去车站接他，怎料一见弟弟瞬间哭了,2024-11-05 06:34,28445,2836,乐视天天剧好看,乐视天天剧好看,,https://toutiao.com/group/7433679820573934091/,,0,0,True
母亲瘫痪、父亲疯了，当年那个744分的高考状元，7年后却成了这样,2024-09-08 00:54,12987,1889,八号探秘人,八号探秘人,母亲截肢瘫痪、父亲疯癫痴傻，可对于自己的亲人，他却做出了这样的评价。而今，7年已过，曾经那个让无数人动容的少年，现在如何?,https://toutiao.com/group/7411852147648496162/,,0,0,False
刚从中国返俄，苏-57飞行员传来新消息,2024-11-25 10:15,8066,259,环球时报新媒体,环球时报新媒体,刚从中国返俄，苏-57飞行员传来新消息,https://toutiao.com/group/7441158524530328127/,,0,0,True
中国是真伟大，这种事只有我们能办到了！（上）,2024-11-30 22:00,4060,319,占豪,占豪,啥是给沙漠“锁边合龙”？就这些成绩，哪个国家能做到？,https://toutiao.com/group/7442630441128952371/,,0,0,True
央视曝光！#制假售假“一条龙”！,2024-11-24 12:16,4600,1781,央视财经,央视财经,,https://toutiao.com/group/7440818726712115762/,,0,0,True
杀疯了的「北京市服」，统一全国审美？,2024-11-25 00:30,1902,878,凤凰WEEKLY,凤凰WEEKLY,文/馍王编辑/闫如意众所周知，凤凰编辑部位于北京市。众所又知，北京的冬天，有一种统一所有人穿搭审美的魔力。这个冬天，编辑部的穿搭呈现出了无限趋同。上班时，人均穿着一件柔软的摇粒绒内衬，蜷缩在工位上。下班点一到，用一件宽大冲锋衣把摇粒绒一锁，挺胸抬头，跟扇大铁门似的走出公司。,https://toutiao.com/group/7440858414693040678/,,0,0,False
1.91米的“女神”，开启新身份,2024-11-21 08:37,2429,148,环球人物杂志,环球人物杂志,“排球绝不仅仅是我以前在赛场上看到的那一种模样。”作者：陈佳莉今年9月，奥运冠军惠若琪迎来了属于自己的第一个教师节。从南京师范大学博士毕业后，因为延续着对排球的热爱，惠若琪选择留校任教。对于曾站上过梦想的世界之巅，也体验过手术台上与死神擦肩而过的她来说，讲台成为最新的“赛场”。,https://toutiao.com/group/7439648518744113683/,,0,0,False
广西49岁老汉娶19岁姑娘，结婚21年生下15个孩子，如今有何下场？,2024-10-20 08:32,5028,639,艺述史,艺述史,她19岁出嫁，21年里总共生育了15个孩子，其中4个男孩子11个女孩子，家里热闹的像是开了一所学校一样。,https://toutiao.com/group/7427400319418384948/,,0,0,False
马龙燃爆台湾，民进党心惊胆寒！中华基因抹不掉，优质魅力挡不了,2024-11-30 22:01,11240,539,黎建南台湾,黎建南台湾,,https://toutiao.com/group/7443195770188071465/,,0,0,True
香港九龙寨城老照片：曾是香港最邪恶肮脏之地，图9场景令人作呕,2024-11-21 11:32,1831,377,万物知识局,万物知识局,有这么一个地方，他虽然地处极度繁华的都市香港，但是却脏乱不堪，环境极度的恶劣，各种违法的交易都在这里进行，甚至黄赌毒，也在这里悄然滋生，这就是九龙城寨。,https://toutiao.com/group/7439657140518519296/,,0,0,False
3年前，宁夏7岁小女孩一笑走红，后拒百万签约，如今怎么样了？他们后悔了吗？,2024-09-19 07:25,14274,1929,睿之悦,睿之悦,2021年，视频镜头中出现的女孩儿用那一抹甜美的笑容，迅速引起了网友们的广泛关注。有媒体公司看到这一机遇，提出愿意用百万巨资与女孩儿签约，然而，女孩儿的父母却坚决拒绝了这一提议。,https://toutiao.com/group/7416250139544879679/,,0,0,False
黄晓明发文悼念姥姥,2024-12-01 05:16,786,894,红星新闻,红星新闻,12月1日，黄晓明发文悼念自己的姥姥。,https://toutiao.com/group/7443307374179336767/,,0,0,False
67岁执意生娃，如今却坐轮椅无法自理，5岁的天赐被迫独立学洗衣,2024-11-04 10:32,7183,1676,睿之悦,睿之悦,2019年，已经67岁的田新菊执意生下了自己的第三个孩子小天赐。那么，现如今5年的时间过去了，这“天赐”的礼物到底是福还是祸呢?,https://toutiao.com/group/7433367394946384435/,,0,0,False
越南批准高铁项目：总投资近4900亿，2027年开工,2024-11-30 14:07,1513,1364,观察者网,观察者网,据越通社、越南《先锋报》等媒体报道，当地时间11月30日，越南国会批准表决通过关于“北南高铁投资项目”的决议草案。该项目计划修建一条从越南北部城市谅山至南部城市芹苴，贯穿国境南北的高铁，预计总投资近1.7万万亿越南盾（约4896亿元人民币），最早将于2027年开工建设。,https://www.guancha.cn/internation/2024_11_30_757278.shtml,,0,0,False
刀郎被举报抄袭20首歌曲，知情人：举报人曾是娱记，多年前就和刀郎有过节,2024-11-30 12:01,166,127,齐鲁壹点,齐鲁壹点,沉寂多年的歌手刀郎复出后，开始在全国巡回演出，正在这时有人实名举报他涉嫌抄袭歌曲，将红火的他推上风口浪尖。事情真相究竟如何？,http://m.ql1d.com/new/general/25203630,,0,0,False
五大利好传来，A股又有增量资金要进场了！12月行情可期？,2024-12-01 03:40,869,814,每日经济新闻,每日经济新闻,每经记者：肖芮冬 每经编辑：赵云刚过去的交易周（11.25~11.29），A股结束了11月行情，市场用整整5个交易日来消化和修复上周五的大阴线，最终虽然没有反包，但至少情绪已基本扭转，且保住了月线收红。相信很多人的收益曲线和大盘走势相似：月初爆赚，月中爆亏，月底回了点血。,http://www.nbd.com.cn/rss/jinri_toutiao/articles/3667081.html,,0,0,False
