title,publish_time,like_count,comment_count,media_name,source,abstract,article_url,tag,is_yaowen,article_sub_type,has_video
冰雪春天丨热“雪”沸腾 与习近平一起共赴冰雪之约,2025-02-16 08:21,448,209,人民网,人民网,2025年2月14日晚，哈尔滨第九届亚洲冬季运动会落下帷幕。在本届精彩绝伦的冰雪盛会上，中国体育代表团以32金27银26铜的成绩，拿下金牌榜和奖牌榜双料第一，创造了亚冬历史最好战绩。“春暖冰城，情动亚洲”，哈尔滨的冰雪正在消融，但亚冬会播下的友谊种子正在生根发芽。,https://toutiao.com/group/7471928981286076963/,,0,0,False
全自动化养鸡大棚着大火,2025-02-14 05:42,1450,1407,东星,东星,,https://toutiao.com/group/7471146007749804598/,,0,0,True
大S抢救内幕惊人曝光，离奇细节让人瞠目结舌！,2025-02-15 04:13,6767,1266,财富海景天下,财富海景天下,,https://toutiao.com/group/7471494115964781091/,,0,0,True
媳妇玩到半夜才回来，以为老公不在家，进门这操作把老公看懵了,2025-01-24 09:38,11656,3227,滕菲,滕菲,,https://toutiao.com/group/7463414214191743497/,,0,0,True
有这样的老婆，你家祖坟都冒青烟了！,2025-02-04 03:11,70937,11722,乐观的冰淇淋I,乐观的冰淇淋I,,https://toutiao.com/group/7467226170908606976/,,0,0,True
父母都已不在，男子还未成家，一个人回家过年，鞭炮也不能少。,2025-02-13 10:15,20970,3558,乐天派叶子,乐天派叶子,,https://toutiao.com/group/7470845080074502667/,,0,0,True
韩国队偷师兔子战术，被任子威机智破解，帮助中国队再夺一冠#,2025-02-14 03:49,2516,181,过客,过客,,https://toutiao.com/group/7471116882972557861/,,0,0,True
国足U20阿森纳式进球11脚传递！惊艳全场！如此国足怎能不爱,2025-02-14 03:38,15197,2512,铁血墨缘,铁血墨缘,,https://toutiao.com/group/7471113984419152447/,,0,0,True
丈母娘看不起穷女婿，全家聚餐没给女婿留筷子，女儿做法漂亮！,2025-01-27 16:01,3390,901,群星访谈秀,群星访谈秀,,https://toutiao.com/group/7462286897130291724/,,0,0,True
妻子出轨丈夫捉奸在床，结果发现是自己的好兄弟,2025-02-14 03:49,3743,668,咸宁视讯,咸宁视讯,,https://toutiao.com/group/7471116723467338267/,,0,0,True
老公冷战生气不吃饭，媳妇过去哄老公吃饭，结果掀开被子气冒烟了,2025-01-31 09:58,6161,407,财万万,财万万,,http://toutiao.com/item/7466016930663662143/,,0,0,True
