title,publish_time,like_count,comment_count,media_name,source,abstract,article_url,tag,is_yaowen,article_sub_type,has_video
文脉华章|要加强非物质文化遗产保护传承,2024-12-06 12:07,646,288,大象新闻,大象新闻,2024年12月4日，中国申报的“春节——中国人庆祝传统新年的社会实践”在巴拉圭亚松森举行的联合国教科文组织保护非物质文化遗产政府间委员会第19届常会上通过评审，列入联合国教科文组织人类非物质文化遗产代表作名录。,https://share.hntv.tv/news/0/1864929560430854146,,0,0,False
美落井下石！尹锡悦没救了！！ 欢迎收看《谦言谦语》播出,2024-12-06 02:00,9770,223,赖岳谦官方,赖岳谦官方,,https://toutiao.com/group/7445112782787183114/,,0,0,True
俩人相亲互相看不上，哪料男方一报母亲身份，姑娘乐了,2024-11-08 01:50,10975,2403,乐视群星访谈秀,乐视群星访谈秀,,https://toutiao.com/group/7434719902990074395/,,0,0,True
炸萝卜丸子到底用面粉还是淀粉，教你正确做法，外焦里嫩，太香了,2024-10-26 09:25,14054,927,家常的味道,家常的味道,,https://toutiao.com/group/7430012978277122611/,,0,0,True
天冷电动车充满电，一加油门就掉2格，不怪电池，真实原因告诉你,2024-11-26 05:02,1668,108,新能源战略家,新能源战略家,电动车使用方便、价格便宜，已经成为了不少朋友通勤代步的首选，但在使用过程中偶尔也有让人糟心的问题。像爆胎、刹车不灵敏这类问题可以通过门店维修来解决，但如果遇到电池出现异常情况，不仅问题难以排查，而且维修成本也不低。,https://toutiao.com/group/7441448742575702563/,,0,0,False
包厢全是刚出狱的恶霸，结果一看到饭店主厨，立马怂了,2024-11-11 01:21,11563,311,乐视群星访谈秀,乐视群星访谈秀,,https://toutiao.com/group/7435825833048015400/,,0,0,True
河南警察3岁女儿被拐，苦寻全国23年无果，结果却发现女儿在对门,2024-11-05 07:43,3099,327,八号探秘人,八号探秘人,寻亲23年无果，丢失的女儿竟住在对门?但它却真实发生在河南洛阳的梁绍波身上。是意外走丢，还是人贩子所为，三岁的女儿怎会离奇失踪?,https://toutiao.com/group/7433697108120142345/,,0,0,False
赖清德过境夏威夷，病急乱投医，找上佩洛西通电话，惹怒特朗普,2024-12-03 09:30,15948,229,邱毅台湾,邱毅台湾,,https://toutiao.com/group/7444115695816442395/,,0,0,True
明年养老金或迎来第21连涨，涨幅与哪些因素相关？哪些人能多涨？,2024-12-02 14:37,517,152,暖心财经说,暖心财经说,还不到一个月的时间，即将迎来2025年了。全国目前有1.4亿多离退休人员，这些人员都将在2025年的养老金调整中获益。退休养老金的涨幅与哪些因素相关呢？是否有了能够多涨？一起了解一下。退休养老金的涨幅与哪些因素相关？,https://toutiao.com/group/7443819173911872015/,,0,0,False
俄乌冲突结束方案三方不同意，10万部队入乌维和，瓜分还是占领？,2024-12-01 12:09,18799,1438,杜文龙,杜文龙,,https://toutiao.com/group/7443414453669855783/,,0,0,True
琼瑶与江苏：她的母亲是武进人，大姨更是江苏名人,2024-12-04 14:41,1618,520,扬子晚报,扬子晚报,在华语文学的天空中，琼瑶的名字如同一颗璀璨的星辰，照亮了一代又一代人的情感世界。然而，当这颗星辰悄然陨落，我们不禁感叹岁月的无情与生命的脆弱。琼瑶的离世，不仅让文学界失去了一位巨匠，也让她的血脉故乡江苏，失去了一位与这片土地情深意长的文化使者。,https://wap.yzwb.net/wap/news/4184552.html,,0,0,False
早期经典港片，刘嘉玲真是太拼了，连刘青云都看傻眼了！,2024-11-29 08:22,1057,192,南瓜说异,南瓜说异,,https://toutiao.com/group/7442613621286240777/,,0,0,True
67岁执意生娃，如今却坐轮椅无法自理，5岁的天赐被迫独立学洗衣,2024-11-04 10:32,8277,1900,睿之悦,睿之悦,2019年，已经67岁的田新菊执意生下了自己的第三个孩子小天赐。那么，现如今5年的时间过去了，这“天赐”的礼物到底是福还是祸呢?,https://toutiao.com/group/7433367394946384435/,,0,0,False
真没想到！这四类人不属于公务员，甚至连编制都没有,2024-10-26 03:31,1306,109,青衫书生,青衫书生,本以为这些是正式编制工作！“宇宙的尽头是考公”，这句网络流行语，道出了当下年轻人对“铁饭碗”的渴望。公务员是多少人梦寐以求的工作，甚至也可以说相当于一个养老工作。然而，在现实生活中，人们对公务员身份的认知，却存在着不少误区。,https://toutiao.com/group/7429913474316239423/,,0,0,False
5位劣迹艺人复出失败，评论区翻车、演出被取消，全部遭到抵制,2024-11-26 12:25,1038,166,豆莱说,豆莱说,文：豆莱说编辑：豆莱说娱乐圈里潜藏着诸多诱惑与陷阱，明星们表面上享受着聚光灯和掌声，但是稍微一不注意，行差踏错，就会失去原有的关注和地位。而近年来，有明星偷税漏税，私德有亏或者更严重的违法犯罪行为的消息也是层出不穷，引来的结果自然也是星途毁于一旦，遭遇封杀。,https://toutiao.com/group/7441541113179111936/,,0,0,False
女友怀孕了，男友不装了，带她回豪宅！,2024-11-23 08:01,9410,761,乐视大综艺咖,乐视大综艺咖,,https://toutiao.com/group/7440353629540483593/,,0,0,True
央视曝光！#制假售假“一条龙”！,2024-11-24 12:16,4760,1834,央视财经,央视财经,,https://toutiao.com/group/7440818726712115762/,,0,0,True
吉林美女带俩娃，嫁给头婚小叔子，婆婆一手撮合，如今过得怎样了,2024-11-01 08:01,5337,1342,睿之悦,睿之悦,说出来可能很多人都不相信，吉林一位带着两个孩子的美女在婆婆的大力撮合下嫁给了自己的小叔子。2020年，这位女子的丈夫因为意外去世，留下了她们孤儿寡母悲痛欲绝。,https://toutiao.com/group/7432216069030363682/,,0,0,False
多地中小学校长，接连被查,2024-12-07 02:13,1934,2067,环球网,环球网,来源：中国新闻网 从湖北通报11名中小学校领导，到多地中小学校长接连被查……近期，教育系统反腐受到关注，多地出手整治基础教育领域不正之风和腐败问题，一批“蝇贪”“蚁贪”被揪出。,https://3w.huanqiu.com/a/a4d1ef/4KYaQeL51iL?agt=20,,0,0,False
杀疯了的「北京市服」，统一全国审美？,2024-11-25 00:30,2868,1178,凤凰WEEKLY,凤凰WEEKLY,文/馍王编辑/闫如意众所周知，凤凰编辑部位于北京市。众所又知，北京的冬天，有一种统一所有人穿搭审美的魔力。这个冬天，编辑部的穿搭呈现出了无限趋同。上班时，人均穿着一件柔软的摇粒绒内衬，蜷缩在工位上。下班点一到，用一件宽大冲锋衣把摇粒绒一锁，挺胸抬头，跟扇大铁门似的走出公司。,https://toutiao.com/group/7440858414693040678/,,0,0,False
马丽在办公室一会一觉，模仿老干部喝茶太形象了，沈腾都差点笑场,2024-11-14 08:33,4213,818,妹子要开心,妹子要开心,,https://toutiao.com/group/7436667895561585190/,,0,0,True
“中企遭大规模拒签，前所未有”,2024-12-02 09:13,10062,3037,环球时报新媒体,环球时报新媒体,“中企遭大规模拒签，前所未有”,https://toutiao.com/group/7443740275974865423/,,0,0,True
“深圳禁摩案法学教授舌战群雄胜诉”？权威回应来了：没有胜诉，并非法学院教职工,2024-12-06 08:24,295,476,极目新闻,极目新闻,近日，一段深圳市盐田区人民法院的行政案件庭审录像在网络上流传，引发广泛关注。录像中，原告摩托车主王勇独自出庭应诉，熟练引用法律条文，与被告交警部门四名出庭人员展开激烈辩论。,http://jms.ctdsb.net/jmythshare/#/index_share?cId=0&contentType=5&contentId=2322092,,0,0,False
湖北29名建筑工赴港务工月薪3万 中介机构：先一次性交6.2万元中介费,2024-12-04 08:41,288,227,海报新闻,海报新闻,海报新闻记者 黄晓荣 报道近日，29名湖北宜昌的建筑工人在香港月薪3万多港币一事引发关注。工资高、假期多、工友素质高，让许多内地打工人心动不已。那么，去香港务工真就如此高薪、如此简单吗？,http://hb.dzwww.com/p/pftFWecS1Ge.html,,0,0,False
美媒评中国最新出口管制：中国开创先例，禁止他国向美国出售商品,2024-12-06 13:48,14117,8794,观察者网,观察者网,【文/观察者网 齐倩】12月3日，中国商务部发布公告，宣布严控对美出口镓、锗、锑、超硬材料、石墨等相关两用物项。外媒普遍将此视作对美国出口管制行为的迅速反制，同时注意到了公告中的一句表述：“任何国家和地区的组织和个人违反相关规定，将依法追究责任。,https://www.guancha.cn/internation/2024_12_06_757979.shtml,,0,0,False
央行：明年1月起将个人活期存款、非银行支付机构客户备付金纳入M1统计口径,2024-12-02 11:19,2084,412,澎湃新闻,澎湃新闻,中国人民银行决定自统计2025年1月份数据起，启用新修订的狭义货币（M1）统计口径。修订后的M1包括：流通中货币（M0）、单位活期存款、个人活期存款、非银行支付机构客户备付金。,https://m.thepaper.cn/newsDetail_forward_29521291?from=toutiao,,0,0,False
海南富商张晖：花8亿建108米海上观音像，4年后死在水中死因成谜,2024-10-19 04:49,2253,299,八号探秘人,八号探秘人,在阅读此文之前，辛苦您点击一下“关注”，既方便您进行讨论和分享，又能给您带来不一样的参与感，感谢您的支持！编辑丨xk他是中国的一名富商，耗费8亿元完成了自己的梦想。可梦想落地成为现实的时候，他却在4年后莫名其妙的死去。他就是张晖，上个世纪末海南岛旅游业的龙头当家人。,https://toutiao.com/group/7427288913095492134/,,0,0,False
被姚明抱着上奥运的小英雄，曾发誓考上清华，16年后活成了这样,2024-11-07 08:07,3330,712,睿之悦,睿之悦,2008年，年仅9岁的林浩，在姚明的带领下走进了北京奥运会开幕式的舞台上，成为了万众瞩目的“焦点”。,https://toutiao.com/group/7434444094551687707/,,0,0,False
江苏盐城一村干部公示“1993年出生，1999年入伍”？最新消息,2024-12-07 03:41,210,225,大风新闻,大风新闻,12月6日，有网传消息称江苏盐城市滨海县某村副书记公示信息中，出现干部朱某某简历显示1993年出生，1999年入伍的情况。该消息后经部分媒体报道后引发关注，大量网友质疑该干部任选存在问题。,https://toutiao.com/group/7445508939933876745/,,0,0,False
100年前，清朝罕见留影，王爷妻妾婀娜多姿，乞丐全身挂满垃圾,2024-10-14 09:58,2247,251,万物知识局,万物知识局,每一张老照片，都像是时间的低语，它们静静地躺在历史的相册中，却在不经意间将我们拉回到那个遥远而神秘的年代。,https://toutiao.com/group/7425457574731579919/,,0,0,False
军号一响，全军出击！,2024-09-19 08:01,32992,2029,中国军号,中国军号,,https://toutiao.com/group/7416261401477382668/,,0,0,True
罕见！100年前，英国游客拍下的清朝乡村，和想象中完全不一样,2024-09-20 02:07,8458,745,万物知识局,万物知识局,泥泞的土路，衣不蔽体的老百姓，即便是达官显贵的家中也十分破败，而这些都是清王朝的历史痕迹，虽说那时候中国摄影技术并不发达，但也有许多外国游客来到这里，拍摄下了许多老照片，为我们留下了珍贵的历史资料，那清朝到底是怎样的面貌呢?,https://toutiao.com/group/7416287738871267855/,,0,0,False
10年交了23万元保费，取出来要等到2084年……知情人士：能理解需要钱的心情，但确实没有误导,2024-12-07 00:55,145,271,环球网,环球网,来源：每日经济新闻 每经记者 袁园 每经编辑 卢祥勇 马子卿近日，据浙江电视台“1818黄金眼”报道，金华浦江的张女士（化名）反映，她给儿子和女儿各买了一份分红型的两全保险，10年总共交了23万余元，最近她发现该产品的保险期长达73年，这也意味着要等到2084年才能领取，为何这款,https://3w.huanqiu.com/a/f2cd3b/4KYXZy6rrrY?agt=143,,0,0,False
赵丽颖回应粉丝：“是我自己发的，别叽歪了”,2024-12-07 04:32,397,566,大河报,大河报,近日，赵丽颖新加坡电影节造型引发争议。12月6日，她发文表示：“我觉得今天很nice。不废话了，晚安。”有粉丝质疑赵丽颖的IP在北京，不是本人发的。对此，赵丽颖在评论区补充：“是我自己发的，IP是自己显示的。别叽歪了，晚安，梦里什么都有。,https://toutiao.com/group/7445523057818567222/,,0,0,False
超标290倍！紫燕百味鸡被曝光，网友：天塌了！,2024-12-07 00:00,2120,2515,大河报,大河报,11月29日，测评博主@老爸评测-魏老爸 发布了对紫燕百味鸡等卤味的检测报告，引发广泛关注。据老爸测评，因太多网友反映吃卤味拉肚子，于是他从多家卤味品牌官方旗舰店购入了卤味样品进行检测。,https://news.dahebao.cn/dahe/appcommunity/2121822?newsId=2121822,,0,0,False
尹锡悦疯了 李在明赢了 美国火大了,2024-12-05 08:12,12657,1095,台灣中天主播盧秀芳,台灣中天主播盧秀芳,尹锡悦疯了 李在明赢了 美国火大了,https://toutiao.com/group/7444837777838965289/,,0,0,True
奥地利作家在中国：用手机叫出租车、在餐厅订餐并付款……很惭愧我对中国一无所知,2024-12-06 22:33,964,326,环球网,环球网,德国《法兰克福评论报》12月5日文章，原题:在中国旅途中——长城后面尽管交通顺畅，从机场到上海市中心的车程仍需要很长时间。,https://3w.huanqiu.com/a/de583b/4KYJdCjysZD?agt=20,,0,0,False
韩国事变第二天，又有新情况,2024-12-05 02:37,6216,399,牛弹琴,牛弹琴,事变第二天，尹锡悦闭门不出，形势正在起变化,https://toutiao.com/group/7444749861411127808/,,0,0,True
平鑫涛遗嘱：财产留给原配和子女，把爱留给琼瑶，琼瑶称他心机,2024-12-06 12:39,1567,575,清闲的百灵鸟z,清闲的百灵鸟z,,https://toutiao.com/group/7445277524696760870/,,0,0,True
紫燕百味鸡被曝大肠菌群超标290倍！,2024-12-07 00:12,317,196,看看新闻,看看新闻,紫燕百味鸡被曝大肠菌群超标290倍！,http://mediaplay.kksmg.com/2024/12/07/h264_720p_600k_77832-smgnews-20241207065500-9000-957882-600k_mp4.mp4,,0,0,True
大学生4年间艾滋病感染12397例，60%存在这一行为,2024-12-03 10:16,5086,4286,凤凰网,凤凰网,据相关数据，2020年至2023年，新报告青年学生病例分别为:2977人、3677人、2733人、3010人，四年间共报告12397人。,https://toutiao.com/group/7444127197663396364/,,0,0,False
中国车企全军覆没？全球汽车可靠性排行出炉,2024-12-06 07:12,1426,1488,中关村在线,中关村在线,日前，美国《消费者报告》发布了最新的汽车可靠性排行榜单。榜单揭示了当前汽车市场中混合动力汽车与燃油车相较于电动汽车依然具有更高的可靠性。不过上榜名单中没有中国品牌，这不得不让人怀疑这份榜单的客观性。,https://m.zol.com.cn/article/9250307.html?tuiguangid=toutiao,,0,0,False
陕西通报：不要买、不要吃！,2024-12-06 07:08,3088,1210,闽南网,闽南网,近期，陕西省市场监督管理局组织对淀粉及淀粉制品、炒货食品及坚果制品、蜂产品、糕点、食用油、油脂及其制品、乳制品、肉制品、方便食品、茶叶及相关制品、餐饮食品10大类食品1677批次样品进行了食品安全监督抽检，其中淀粉及淀粉制品、炒货食品及坚果制品、蜂产品、糕点4大类7批次样品不合格，检出超范围超限量使用食品添加剂、质量指标不达标、禁用兽药的问题。,https://toutiao.com/group/7445192096975307302/,,0,0,False
弟弟光荣退伍，姐姐兴奋去车站接他，怎料一见弟弟瞬间哭了,2024-11-05 06:34,30481,2915,乐视天天剧好看,乐视天天剧好看,,https://toutiao.com/group/7433679820573934091/,,0,0,True
江苏盐城一村干部公示“6岁入伍”？最新消息,2024-12-07 03:13,538,674,红星新闻,红星新闻,12月6日，有网传消息称江苏盐城市滨海县某村副书记公示信息中，出现干部朱某某简历显示1993年出生，1999年入伍的情况。该消息后经部分媒体报道后引发关注，大量网友质疑该干部任选存在问题。,https://toutiao.com/group/7445502500272390690/,,0,0,False
买房已经比租房划算了？,2024-12-06 06:42,148,226,财经杂志,财经杂志,若仅对比租房成本和买房成本，则全国九成以上的城市现在买房都比租房划算。但在决定是否买房时，房租房贷的对比与收入预期的考量，这两个因素应该给予同等权重文｜《财经》执行主编 马克近来房地产市场政策暖风频吹，二手房交易活跃度明显提升，不少人担心，再不买房房价又要涨起来了？,http://mp.weixin.qq.com/s?__biz=MjM5NDU5NTM4MQ==&mid=2653668722&idx=1&sn=0c4e30aeb2806a6400a16bbcb620d372,,0,0,False
丫头回东北捡水稻一天能赚六七百，比大城市捡垃圾强多啦！,2024-10-16 22:53,1513,241,兴凯湖莹莹,兴凯湖莹莹,,https://toutiao.com/group/7426510446334575119/,,0,0,True
20岁的关之琳属实太美，出水芙蓉洁白柔嫩，果然名不虚传！,2024-11-27 06:10,1531,134,乐享综艺剧场,乐享综艺剧场,,https://toutiao.com/group/7441836884977779200/,,0,0,True
今天才知道！电动车“充满不拔”和“没充满拔”，到底哪个更伤车,2024-09-18 07:05,4818,507,鲸探所,鲸探所,电动车对于人们出行来说，是一个非常重要，而且必不可少的交通工具。有的人家中可能不只有一辆电动车，可能家里每个人出行都要备上一辆。,https://toutiao.com/group/7415873367415063080/,,0,0,False
近5年最热的十部剧，《狂飙》第9，《繁华》第6，第1名很难超越,2024-12-01 03:58,609,250,电影烂番茄,电影烂番茄,今天，番叔就结合口碑，给大家盘点一下近五年，热度最高的十部电视剧。第十名:《都挺好》 猫眼热度 9775.8，播出时间2019年。,https://toutiao.com/group/7430845717314273831/,,0,0,False
包菜炒粉条，切记不要焯水和直接下锅，教你一招，清脆爽口不出水,2024-11-11 11:50,8238,397,家常的味道,家常的味道,,https://toutiao.com/group/7435987746101690930/,,0,0,True
