title,publish_time,like_count,comment_count,media_name,source,abstract,article_url,tag,is_yaowen,article_sub_type,has_video
宋小宝在舞台上搀扶着赵本山，这一幕又想乐又想哭😂。,2025-02-02 06:53,5535,619,爱吃西瓜的菜菜,爱吃西瓜的菜菜,,https://toutiao.com/group/7466711119210512932/,,0,0,True
上海爷叔谈大S去世，直言人生感悟，一席话令人深思,2025-02-04 06:07,7658,407,魔都溜达,魔都溜达,,https://toutiao.com/group/7467441549350060563/,,0,0,True
丈夫把媳妇借给大哥生娃，老婆从不乐意到心甘情愿，太痛苦 。,2025-02-03 09:42,3732,191,乐视多啦a梦道具大全,乐视多啦a梦道具大全,,https://toutiao.com/group/7467125801625698879/,,0,0,True
赵家班集体演奏《赛马》！现场气氛太好了！,2025-01-12 10:01,33220,5222,紫萱档案馆,紫萱档案馆,,https://toutiao.com/group/7458895824550937129/,,0,0,True
华为200万年薪都留不住他！天才少年彭志辉离职后，现状曝光,2025-01-16 09:28,5859,853,与君説,与君説,在阅读此文之前，麻烦您点击一下“关注”，既方便您进行讨论和分享，又能给您带来不一样的参与感，感谢您的支持文、编辑|小娄你敢相信吗？大厂华为200万年薪的工作，竟然也有人不屑一顾。入职华为两年后，彭志辉毅然决然选择离职。,https://toutiao.com/group/7460439446131884579/,,0,0,False
移居中国13年的英国人🇬🇧当他回到伦敦时他震惊了…儿子想走,2025-01-13 03:37,40839,10106,Goujohnson,Goujohnson,移居中国13年的英国人🇬🇧当他回到伦敦时他震惊了…儿子想走,https://toutiao.com/group/7459238917565317644/,,0,0,True
冯巩再次突破自己巅峰，新小品红的一塌糊涂，看完不笑算你狠!,2025-01-16 02:10,13003,1915,扒剧小妹儿,扒剧小妹儿,,https://toutiao.com/group/7460329787261813286/,,0,0,True
温岭613爆炸影像，20人死175人受伤，附近小区被夷为平地,2024-11-23 08:09,9479,1417,万物Explorer,万物Explorer,,https://toutiao.com/group/7440383926046196235/,,0,0,True
相声：《去缅北面试》老郭谦哥巅峰经典爆笑相声,2025-01-25 10:53,4982,245,爆笑相声荟萃,爆笑相声荟萃,,https://toutiao.com/group/7463773324586385935/,,0,0,True
韩国人回国后发现完全没了韩国人的优越感，对中国一无所知,2025-01-12 05:30,10434,2485,多才多艺未来可期b,多才多艺未来可期b,,https://toutiao.com/group/7458896824057823770/,,0,0,True
