title,publish_time,like_count,comment_count,media_name,source,abstract,article_url,tag,is_yaowen,article_sub_type,has_video
女医生太漂亮，小伙假装生病，趁机背后抱住她,2025-01-13 16:11,2146,105,情感讲堂,情感讲堂,,https://toutiao.com/group/7458968909371146802/,,0,0,True
发现大型不明生物！上海相关部门紧急处置，后续或将公开展出,2025-01-18 05:00,905,306,上观新闻,上观新闻,经初步观察确认该漂浮物是属于野生保护动物级别市、区两级农业执法部门以及上海自然博物馆相关人员随后对死亡鲸鱼进行现场检查由于鲸鱼体积较大，在起吊上岸后，当天将其运输至相关区域给予解剖处理，肌肉和内脏无害化处理后，留存皮张和骨骼。,https://sghexport.shobserver.com/html/toutiao/2025/01/18/1499040.html,,0,1,False
中国外交的一次罕见举动,2025-01-17 03:18,18786,350,牛弹琴,牛弹琴,中国先礼后兵，应该已在行动中,https://toutiao.com/group/7460718371198321202/,,0,0,True
​2025年央视春晚第三次联排，36位大咖亮相，全是老熟人，今年稳了,2025-01-18 03:50,2547,1399,闻书识焉,闻书识焉,1月18日，央视春晚开始了第三次联排。众多大咖明星亮相，从现场发出的路透来看，全是老熟人。看到这些人，感觉今年的春晚算是稳了。,https://toutiao.com/group/7461091398754845247/,,0,0,False
吉林文旅再次回应重庆女游客事件！花棉袄主播连夜改名难逃网暴,2025-01-17 03:40,266,265,易霄寒,易霄寒,文 |易霄寒编辑 |易霄寒本文陈述所有内容，皆有可靠来源图片来源于网络序冬天的旅游景点中东北绝对算是top1，可火了两年的东北如今可能要栽在吉林一大爷手里。好心扶人垫付医药费最后还反被这名重庆女游客讹，这让不少网友梦回前几千的“扶不扶”。,https://toutiao.com/group/7460721340715139638/,,0,0,False
新婚33天卷走274万4套房，出逃后丈夫跨国追捕，如今下场大快人心,2024-12-20 22:06,6964,348,八号探秘人,八号探秘人,在阅读此文之前，辛苦您点击一下“关注”，既方便您进行讨论和分享，又能给您带来不一样的参与感，感谢您的支持！编辑丨QQ·B“色字头上一把刀！”深圳富豪结婚33天竟被卷走274万元和名下4套房产。不仅如此，他还被扣上了“接盘侠”的帽子，啥也没干喜当爹。,https://toutiao.com/group/7450399558821052982/,,0,0,False
这次，被扒了个底朝天的李小冉，彻底颠覆了大众对她的固有认知！,2025-01-14 10:15,615,250,与君説,与君説,在阅读此文之前，麻烦您点击一下“关注”，既方便您进行讨论和分享，又能给您带来不一样的参与感，感谢您的支持文、编辑|小娄“我以为她去了会被欺负，没想到她去了是欺负别人的。”几个月前，某平台推出了一部新的真人秀综艺，名为《一路繁花》。,https://toutiao.com/group/7459708721183195699/,,0,0,False
台积电董事长：“门都没有”,2025-01-18 06:26,1851,107,环球时报新媒体,环球时报新媒体,台积电董事长：“门都没有”,https://toutiao.com/group/7461137808124576291/,,0,0,True
