title,publish_time,like_count,comment_count,media_name,source,abstract,article_url,tag,is_yaowen,article_sub_type,has_video
马光远：东南沿海一带的小城市被严重低估 #财经大咖来了,2024-12-17 06:17,6506,336,光远看经济,光远看经济,,https://toutiao.com/group/7449261133652820518/,,0,0,True
温州多家私人影院“可触摸服务人员隐私部位”？记者暗访后报警！警方：已对三个场所行政立案,2024-12-17 08:00,11895,3767,大风新闻,大风新闻,挂着“私人影院”的招牌，线上招徕生意，线下如同幽灵，连地址都是虚假的，居然还设“暗室”对付查处。近日，有网民向大皖新闻反映，在浙江省温州市一些颇受年轻人青睐的私人影院，悄然滋生了一些涉黄服务。,https://toutiao.com/group/7449286844203713062/,,0,0,False
海南富商张晖：花8亿建108米海上观音像，4年后死在水中死因成谜,2024-10-19 04:49,3511,598,八号探秘人,八号探秘人,在阅读此文之前，辛苦您点击一下“关注”，既方便您进行讨论和分享，又能给您带来不一样的参与感，感谢您的支持！编辑丨xk他是中国的一名富商，耗费8亿元完成了自己的梦想。可梦想落地成为现实的时候，他却在4年后莫名其妙的死去。他就是张晖，上个世纪末海南岛旅游业的龙头当家人。,https://toutiao.com/group/7427288913095492134/,,0,0,False
人口减少对房地产的影响有多大？,2024-12-19 06:36,6007,1588,温义飞的急救财经,温义飞的急救财经,,https://toutiao.com/group/7450008090864255503/,,0,0,True
河南警察3岁女儿被拐，苦寻全国23年无果，结果却发现女儿在对门,2024-11-05 07:43,4723,537,八号探秘人,八号探秘人,寻亲23年无果，丢失的女儿竟住在对门?但它却真实发生在河南洛阳的梁绍波身上。是意外走丢，还是人贩子所为，三岁的女儿怎会离奇失踪?,https://toutiao.com/group/7433697108120142345/,,0,0,False
弟弟光荣退伍，姐姐兴奋去车站接他，怎料一见弟弟瞬间哭了,2024-11-05 06:34,38404,3204,乐视天天剧好看,乐视天天剧好看,,https://toutiao.com/group/7433679820573934091/,,0,0,True
美国遣返中国非法移民？他们跟中国已经没关系了，爱到哪到哪,2024-12-14 01:05,28042,5088,金灿荣教授,金灿荣教授,,https://toutiao.com/group/7447851020526289423/,,0,0,True
马光远：大城市才有机会的观点过时了 #财经大咖来了,2024-12-17 06:00,6447,487,光远看经济,光远看经济,,https://toutiao.com/group/7449256659496469027/,,0,0,True
明确了！2025年养老金实现双增长，三类人可以多涨，两类人不涨,2024-12-15 05:23,1259,334,社保当家,社保当家,明确了！2025年养老金实现双增长，三类人可以多涨，两类人不涨在2025年到来之前，关于养老金上涨的消息就已经明确，中央经济工作会议给退休人员送上了一个大大的惊喜。2025年，养老金将继续实现双增长，不过有三类人可以多涨，两类人不涨，一起来看看。,https://toutiao.com/group/7448496604800762394/,,0,0,False
曹德旺预言：2025年，没有买房的人，五年后是失败者还是幸运儿？,2024-12-16 05:57,5068,1766,议史纪,议史纪,其实早在多年前年，“玻璃大王”曹德旺就曾预言:“房地产将成为有钱人击鼓传花的游戏”，房子就是钢筋混凝土，是不会保值的?,https://toutiao.com/group/7448883228297003539/,,0,0,False
“取消公摊面积”，一周两地官宣！购房成本会降吗？业内人士：“取消公摊”与“按套内面积计价”是两码事,2024-12-18 16:31,547,1430,每日经济新闻,每日经济新闻,12月17日，河北省张家口市发文明确，取消商品房销售价格限价机制，鼓励实行“现房销售”，逐步推进“取消公摊”。,http://www.nbd.com.cn/rss/jinri_toutiao/articles/3691083.html,,0,0,False
单身汉帮大姐抓鸭子，哪料迎来了桃花运，接下来精彩了,2024-11-20 08:01,1166,142,南瓜热剧回放,南瓜热剧回放,单身汉帮大姐抓鸭子，哪料迎来了桃花运，接下来精彩了,https://toutiao.com/group/7439268526860272163/,,0,0,True
明确了！2025年养老金实现双增长，还有两个好消息，同样值得看看,2024-12-16 00:08,1258,223,社保当家,社保当家,明确了！2025年养老金实现双增长，还有两个好消息，同样值得看看2025年就要跟我们见面了，关于养老金的好消息也接踵而至，其中让人感到惊喜的，无疑是中央经济工作会议明确了2025年将继续提高养老金，而且还是同时提高职工养老金和城乡居民养老金，也就是实现双增长。,https://toutiao.com/group/7448518245453218354/,,0,0,False
沙利文的结局已定，他在离开白宫之前，说出了中美发生战争的结果,2024-12-16 02:48,12684,328,全荃,全荃,沙利文的结局已定，他在离开白宫之前，说出了中美发生战争的结果,https://toutiao.com/group/7448833372408775187/,,0,0,True
毛人凤下令带走死囚，哪料死囚的靠山露面了，毛人凤当场懵了,2024-11-25 03:05,11887,2108,南哥硬汉秀,南哥硬汉秀,,https://toutiao.com/group/7441047753771188799/,,0,0,True
黄渤找孙红雷借钱这段，据说笑趴整个剧组，百看不厌！,2024-12-03 02:43,817,114,南瓜最前线,南瓜最前线,,https://toutiao.com/group/7444010734444347904/,,0,0,True
首尔爱情故事（下）：尹锡悦为了金建希，都做了什么得罪人的事？,2024-12-18 10:11,7746,110,卢克文工作室,卢克文工作室,,https://toutiao.com/group/7449692347006190089/,,0,0,True
