title,publish_time,like_count,comment_count,media_name,source,abstract,article_url,tag,is_yaowen,article_sub_type,has_video
一巴掌的代价，公交车上大妈打晕患癌小伙，断送退休后的幸福生活,2024-10-14 09:53,1885,1150,客观听書,客观听書,公交车上老太太和小伙吵了起来，老太太更是当仁不让直接给了小伙一巴掌。这名小伙直接倒地，老大大根本就不会想到正是因为他的一巴掌，鲜活的生命就这样消失在他的手里。,https://toutiao.com/group/7425563455358468627/,,0,0,False
快消失的12个生活用品！40年前在供销社红极一时，你家还在用吗？,2024-09-29 07:58,4679,341,万物知识局,万物知识局,在这里，可以买到从油盐酱醋到衣物鞋帽，再到农具化肥等各种生活必需品，每一样物品都凝聚着时代的特色，见证了那个年代人们的生活状态，今天我们就来走进那些年能够在供销社里买到的生活用品，看看你们还记得哪些。,https://toutiao.com/group/7419937237548237322/,,0,0,False
担心被特朗普清算？哈里斯承诺和平交权，佩洛西在现场一度失态,2024-11-07 10:08,7920,1961,千钧堂,千钧堂,,https://toutiao.com/group/7434477132157288972/,,0,0,True
吃播网红恩克半年吃110只羊，眼神呆滞脸黑成炭，网友求他别吃了,2024-11-04 08:22,719,529,与君説,与君説,在阅读此文之前，麻烦您点击一下“关注”，既方便您进行讨论和分享，又能给您带来不一样的参与感，感谢您的支持文、编辑|是否古人估计都没想到后世子孙通过吃饭就能赚得盆满钵满。短视频的迅速崛起给人们带来了很多生财之道，吃播就是其中一个。,https://toutiao.com/group/7433333039997977107/,,0,0,False
51年洪学智妻子寻女无果，到老乡家歇脚老乡惊呼：你要找得就是我,2024-09-22 01:07,12638,842,品古观今,品古观今,前言1951年，阳曲县委大院突然来了7、8位解放军同志，其中一位女同志，就是洪学智的妻子张文。她此番前来，就是为了寻找多年前因战乱而寄养于民间的爱女。可昔日的小村落早已蜕变成另一番景象，这无异于是大海捞针。,https://toutiao.com/group/7417034363226915354/,,0,0,False
特朗普战胜哈里斯重新上台，对中国是好是坏？,2024-11-06 08:28,27219,7601,第一军情,第一军情,据央视新闻11月6日最新报道，特朗普成功战胜哈里斯，赢得了2024年美国总统大选，和很多人想象的“战事焦灼”不同，本次美国大选却呈现出一边倒的态势，特朗普兵不血刃，在多个摇摆州成功“翻红”，战胜了民主党候选人哈里斯，再次问鼎美国总统的宝座。那么，既然美国未来四年的“掌门人”已经敲定，对中国又将有什么深远影响，或者用更贴地气的话：对中国是好是坏呢？,https://toutiao.com/group/7434080229624119844/,,0,0,True
特朗普赢了，对中国是好还是坏？(上),2024-11-07 14:53,32336,1778,静思有我,静思有我,,https://toutiao.com/group/7434550628703011391/,,0,0,True
67岁执意生娃，如今却坐轮椅无法自理，5岁的天赐被迫独立学洗衣,2024-11-04 10:32,1816,544,睿之悦,睿之悦,2019年，已经67岁的田新菊执意生下了自己的第三个孩子小天赐。那么，现如今5年的时间过去了，这“天赐”的礼物到底是福还是祸呢?,https://toutiao.com/group/7433367394946384435/,,0,0,False
15年前他在爱妻葬礼上哭到昏厥，发誓永不再娶，如今他做到了吗？,2024-08-24 02:17,18855,585,八号探秘人,八号探秘人,在阅读此文之前，辛苦您点击一下“关注”，既方便您进行讨论和分享，又能给您带来不一样的参与感，感谢您的支持！编辑丨xk纵观鱼龙混杂的娱乐圈，有人背叛，有人痴情。而果靖霖则是公认的好男儿，将一生都奉献给妻子。但妻子却仅仅陪他走了半生，没能战胜病魔，不幸离开人世。,https://toutiao.com/group/7406210316734710283/,,0,0,False
女儿花500块租男友，没想他是身价过亿的总裁，这下好运了,2024-10-18 09:42,7738,1419,乐视娱乐乐透社,乐视娱乐乐透社,,https://toutiao.com/group/7427048858267419190/,,0,0,True
罕见！100年前，英国游客拍下的清朝乡村，和想象中完全不一样,2024-09-20 02:07,5234,561,万物知识局,万物知识局,泥泞的土路，衣不蔽体的老百姓，即便是达官显贵的家中也十分破败，而这些都是清王朝的历史痕迹，虽说那时候中国摄影技术并不发达，但也有许多外国游客来到这里，拍摄下了许多老照片，为我们留下了珍贵的历史资料，那清朝到底是怎样的面貌呢?,https://toutiao.com/group/7416287738871267855/,,0,0,False
1米3袖珍美女嫁给1米48男孩，婚后丈夫奇迹长高，两人却不欢而散,2024-09-07 02:55,3094,175,睿之悦,睿之悦,杨萍和葛存苗的婚礼 文|睿之悦 编辑|睿之悦2019年，成都的民政局来了两个“10岁小孩”来登记，工作人员以为是玩闹。两个“小孩”拿出身份证让工作人员看，这才明白，原来是两个再也长不高的成年袖珍人情侣。,https://toutiao.com/group/7411713833267364386/,,0,0,False
刀郎刘德华与凤飞飞，他们的歌让台湾人真的想回家了！,2024-11-05 22:05,64105,5957,黎建南台湾,黎建南台湾,,https://toutiao.com/group/7433919847295091210/,,0,0,True
特朗普隐忍整整4年，上台掌权第一件事，先拿死敌开刀立威？,2024-11-07 03:32,16533,1892,庆彬有理,庆彬有理,特朗普重返白宫，在论功行赏之余，或许还有一件事情要做，那就是对自己的政敌展开全面清算。过去4年，民主党、共和党的建制派，乃至于主流媒体对特朗普在各个领域的围堵，一度让他疲于奔命，甚至还被定下了重罪。,https://toutiao.com/group/7434375201880310324/,,0,0,True
母亲瘫痪、父亲疯了，当年那个744分的高考状元，7年后却成了这样,2024-09-08 00:54,7785,1278,八号探秘人,八号探秘人,母亲截肢瘫痪、父亲疯癫痴傻，可对于自己的亲人，他却做出了这样的评价。而今，7年已过，曾经那个让无数人动容的少年，现在如何?,https://toutiao.com/group/7411852147648496162/,,0,0,False
国家要“动真格”？催三胎不成，专家出“好主意”，你赞成吗？,2024-10-31 04:51,8152,3925,阿皮历史库,阿皮历史库,,https://toutiao.com/group/7431797819591098934/,,0,0,True
特朗普胜选好过哈里斯，“台独”心惊被卖钱？副总统万斯更加激进,2024-11-06 11:26,79168,2412,黎建南台湾,黎建南台湾,,https://toutiao.com/group/7434126202526401024/,,0,0,True
川普上台之后的中美关系和世界局势会如何演变呢？做好准备吧！,2024-11-06 08:31,68016,111,大刘说说,大刘说说,美国的选举结果基本上板上钉钉了，结果非常惊悚。大家可能都是盯着总统的选举人票了，忽视了一个重要的因素，美国的参众两院。,https://toutiao.com/group/7434081172805648930/,,0,0,True
拦车收费？交警不管！景区不管！政府看不见！九寨沟咋全是土匪？,2024-09-22 15:55,222401,44102,行哥嘚啵嘚,行哥嘚啵嘚,,https://toutiao.com/group/7417496641638400527/,,0,0,True
被拐男子认亲一年后，与家人彻底决裂！,2024-11-05 08:45,2235,1341,环球网,环球网,来源：宁波晚报 近日因寻亲走红的郁豹豹与家人决裂的消息引发关注，冲上热搜。据报道，2023年9月，被拐卖34年的郁豹豹寻亲成功。认亲不到半个月，郁豹豹与两个弟弟开始直播带货。不到两个月，三兄弟逐渐走向分崩离析。令他更无法接受的是，他与母亲也渐生隔阂。,https://3w.huanqiu.com/a/14459a/4K8FGmdmzMW?agt=20,,0,0,False
全球约一半肝癌在中国，再次提醒：家中的4种食物，尽早撤下餐桌,2024-08-13 08:36,108127,3636,梁医学社梁怡璋医生,梁医学社梁怡璋医生,,https://toutiao.com/group/7402540119712629311/,,0,0,True
小伙洗完澡故意秀肌肉，富婆心跳加速被当场拿下，这下好看了,2024-10-26 16:20,6313,261,乐视情感讲堂,乐视情感讲堂,小伙洗完澡故意秀肌肉，富婆心跳加速被当场拿下，这下好看了,https://toutiao.com/group/7430011217881596426/,,0,0,True
给近三年最好的10部年代剧排个名：《人世间》第6，第1名没有争议,2024-09-06 08:08,11268,3597,皮皮电影,皮皮电影,时尚是个轮回，电视剧也是。在2020年之前的那些年，电视剧市场基本上都被偶像剧、都市剧霸占。曾经撑起国剧品质的《闯关东》《岁月》这类年代好剧，难见踪影。,https://toutiao.com/group/7411390030722712090/,,0,0,False
刘德华在台北演唱会唱《中国人》，民进党玻璃心碎了，台独崩溃了,2024-11-04 08:14,35283,2678,邱毅台湾,邱毅台湾,,https://toutiao.com/group/7433334683380744731/,,0,0,True
中国国乒又火了！决胜时刻，领军人物疯狂逆转，上演最解气的一幕,2024-11-04 00:00,5796,651,乐播体育,乐播体育,,https://toutiao.com/group/7433056969079915020/,,0,0,True
"特朗普的第一把火正在点燃,大收割开始,或没收外国人房产黄金美元",2024-11-08 11:41,4223,1432,BWC中文网,BWC中文网,,https://toutiao.com/group/7434872159333253658/,,0,0,True
俩人相亲互相看不上，哪料男方一报母亲身份，姑娘乐了,2024-11-08 01:50,2390,698,乐视群星访谈秀,乐视群星访谈秀,,https://toutiao.com/group/7434719902990074395/,,0,0,True
美国大选刚结束，中方宣布出访计划，中美之间，还有一场重头戏？,2024-11-08 09:47,4186,105,菲常视野陈菲,菲常视野陈菲,刚结束的美国大选角逐出了下一任美国总统，但在特朗普宣誓就职之前，拜登仍然是事实意义上的美国国家元首。,https://toutiao.com/group/7434832853453603366/,,0,0,False
特朗普的新孤立主义启动，泽连斯基、尹锡悦、赖清德都瑟瑟发抖了,2024-11-07 06:48,58366,2696,邱毅台湾,邱毅台湾,,https://toutiao.com/group/7434425551684633100/,,0,0,True
特朗普杀回来了，第二次贸易战要来了，中国要做哪些准备？,2024-11-07 15:49,10240,1801,金灿荣教授,金灿荣教授,,https://toutiao.com/group/7434468272764650020/,,0,0,True
特朗普即将接盘的美国，已经落后中国一个世界 #热点 #中国 #美国,2024-11-08 09:08,5093,337,眉山剑客陈平,眉山剑客陈平,,https://toutiao.com/group/7434832818846302758/,,0,0,True
今天才知道！电动车“每天充”和“用完再充”，到底哪个更伤电池,2024-08-27 11:19,15097,2342,鲸探所,鲸探所,“今天到底给车充不充电？”估计大多数人每天回家都会想这个问题，看着自己的电动车电量又多又少的，充不充电也是一件非常难以抉择的事情。那么，电动车到底应该怎样充电呢？是每天都充，还是用完之后再充呢？电动车充电不管是在城市还是农村，电动车其实都是人们出门最常见的交通工具。,https://toutiao.com/group/7407773012533117475/,,0,0,False
2025年，企业和机关事业退休人员丧葬补助金和抚恤金是一样的吗？,2024-10-29 15:45,764,138,暖心财经说,暖心财经说,2025年开始，我国的职工养老保险制度将会迎来新变化，渐进式延迟退休即将实施，企业职工病残津贴制度也将实施，企业和机关事业单位退休人员的丧葬补助金和抚恤金，会是一样的吗？企业退休人员的丧葬补助金和抚恤金。,https://toutiao.com/group/7431217294867268130/,,0,0,False
直接增加地方化债资源10万亿元 地方政府化债压力将大大减轻,2024-11-08 08:26,911,107,央视新闻,央视新闻,财政部部长蓝佛安在11月8日举行的十四届全国人大常委会第十二次会议新闻发布会上介绍，从2024年开始，我国将连续五年每年从新增地方政府专项债券中安排8000亿元，专门用于化债，累计可置换隐性债务4万亿元。,https://content-static.cctvnews.cctv.com/snow-book/index.html?item_id=15988199454498468822&source=50006&sub_source=50006_001,,0,1,False
炸萝卜丸子，放面粉和淀粉就错了，教你正确做法，焦香酥脆不吸油,2024-09-28 10:13,22215,947,家常的味道,家常的味道,,https://toutiao.com/group/7419635124758643227/,,0,0,True
珠海航展亮点多，新型武器装备集体出现，美国人有点慌,2024-11-06 12:19,6127,209,杜文龙,杜文龙,,https://toutiao.com/group/7434139771879981583/,,0,0,True
炸萝卜丸子到底用面粉还是淀粉，教你正确做法，外焦里嫩，太香了,2024-10-26 09:25,5507,354,家常的味道,家常的味道,,https://toutiao.com/group/7430012978277122611/,,0,0,True
特朗普在忙什么？他的新政府许多反华人士入列，中美关系会怎么走,2024-11-08 10:05,20002,1104,邱毅台湾,邱毅台湾,,https://toutiao.com/group/7434847402797990452/,,0,0,True
锵锵：马未都聊嫖娼的话题，听起来太有意思了，看完会涨知识的,2024-11-04 10:07,2482,480,乐视综艺咖,乐视综艺咖,,https://toutiao.com/group/7433360748253807144/,,0,0,True
争夺250万美元冠军奖金！郑钦文与高芙目前都收获230.5万美元奖金,2024-11-08 19:28,397,311,直播吧,直播吧,郑钦文与高芙小组赛都是2胜1负，两人目前在年终总决赛都收获230.5万美元奖金和800积分。明天凌晨0点，郑钦文将与高芙争夺冠军，冠军将获得250万美元奖金和500积分。,https://news.zhibo8.com/other/2024-11-09/672e652c6e2ccnative.htm,,0,0,False
美国是一个伪装成国家的公司，老特坏了“道上”的规矩,2024-11-05 15:25,7583,181,金灿荣教授,金灿荣教授,,https://toutiao.com/group/7433708408525718027/,,0,0,True
逛一下河南第一首富的家，康百万庄园，地下金库让人大开眼界,2024-10-15 11:27,5291,459,大海去旅行,大海去旅行,,https://toutiao.com/group/7425962594709537290/,,0,0,True
有一种“算计”叫董明珠与孟羽童，分开不过一年，输赢已见分晓,2024-11-07 07:15,225,260,8卦娱,8卦娱,在经过一场“闹剧”之后，如今的孟羽童早已走上了一条“不归路”。要知道董明珠一直以来都有着“霸道女总裁”的称号，平时对待工作的她可谓是十分认真且严厉，因此能成为她身边的秘书，可见当年孟羽童的实力。,https://toutiao.com/group/7434429063554646547/,,0,0,False
女省长下乡视察，穷大叔一看愣住了，竟是当年救下的女乞丐,2024-10-29 03:52,4053,382,乐视娱乐乐透社,乐视娱乐乐透社,,https://toutiao.com/group/7431040293010407988/,,0,0,True
