title,publish_time,like_count,comment_count,media_name,source,abstract,article_url,tag,is_yaowen,article_sub_type,has_video
哪一刻 硬控了你的2024？,2024-12-24 09:01,2928,1463,央视新闻,央视新闻,哪个时刻，硬控你的2024？是热辣滚烫的浪潮来临，还是充满passion的圆梦奥运；是飞天浪漫的星光熠熠，还是每一步都算数的踏实底气。无论哪一刻，都凭实力硬控你的2024！,https://content-static.cctvnews.cctv.com/snow-book/index.html?item_id=1119859611919555747&source=50006&sub_source=50006_001,,0,0,False
《总书记的回信》比利时篇,2024-12-24 04:45,758,393,大象新闻,大象新闻,你以为这里是中国其实 这儿是蓝精灵的故乡——比利时你能想象吗在地球的另一端有一片全欧洲最大的中国园林这片园林的创始人是埃里克·董博他曾在这里给中国写了一封信讲述他守护中国“神奇动物”的故事在比利时天堂动物园哪个动物最受欢迎绝对是中国国宝大熊猫这是“好好”这是“星辉”这是“天宝”这,https://share.hntv.tv/news/0/1871171974415970305,,0,0,False
郜春海：低空经济的发展空间远超新能源，颠覆未来商业模式,2024-12-19 08:10,2929,646,凤凰网财经,凤凰网财经,,https://toutiao.com/group/7450032423821115914/,,0,0,True
给《我是刑警》演技最好10位演员排座次：于和伟第3，第1名没争议,2024-12-18 04:06,2175,394,皮皮电影,皮皮电影,《我是刑警》收官之际，网上的争议，却也多了不少。有人盛赞它是“近10年最硬核刑侦剧”，老派纪实的剧作风格，令人着迷。受其影响，很多观众开始追起了二十多年前的《中国刑侦1号案》《12·1枪杀大案》。有人评价它“高开低走”。,https://toutiao.com/group/7449562650628866595/,,0,0,False
新婚33天卷走274万4套房，出逃后丈夫跨国追捕，如今下场大快人心,2024-12-20 22:06,3021,178,八号探秘人,八号探秘人,在阅读此文之前，辛苦您点击一下“关注”，既方便您进行讨论和分享，又能给您带来不一样的参与感，感谢您的支持！编辑丨QQ·B“色字头上一把刀！”深圳富豪结婚33天竟被卷走274万元和名下4套房产。不仅如此，他还被扣上了“接盘侠”的帽子，啥也没干喜当爹。,https://toutiao.com/group/7450399558821052982/,,0,0,False
中央定调2025年养老金上涨，计算公式，企退人员能涨7%以上吗？,2024-12-18 04:29,2961,429,社保当家,社保当家,中央定调2025年养老金上涨，计算公式，企业退休人员能涨7%以上吗？在2025年到来之际，养老金上涨的消息就早早地确定了，这无疑给广大退休人员吃上了定心丸。因为根据近期召开的中央经济工作会议，已经明确提出要适当提高退休人员的基本养老金待遇。,https://toutiao.com/group/7447756391172833827/,,0,0,False
多地缺钱暂停捕猎，野猪真的已“泛滥”？专家建议开展枪猎，可出售食用,2024-12-24 03:16,300,319,极目新闻,极目新闻,四川巴中市通江县，是全国首批防控野猪危害综合试点县之一。近日，通江县林业局野生动植物保护中心主任李斌接受记者采访时坦言，该县已暂停野猪猎捕。原计划2021年750头的猎捕目标，至今也没完成。,http://jms.ctdsb.net/jmythshare/#/index_share?cId=0&contentType=5&contentId=2336667,,0,0,False
县长看不上乡长送的烟，给他退回来，乡长打开一看乐了,2024-11-13 08:16,10390,1723,乐视大综艺咖,乐视大综艺咖,,https://toutiao.com/group/7436672568578277925/,,0,0,True
女子被多人密谋灌醉强奸后投江自尽，生前在手机备忘录记下被胁迫经过，三男子获罪,2024-12-18 16:40,12440,9723,红星新闻,红星新闻,投河自尽前，黄某某于2023年7月4日在其手机内创建了备忘录，记录下了她被胁迫的经过，这也成为了公检法日后侦查、起诉和判决的重要物证。,https://cdsbrss.cdsb.com/toutiao_no_video.php?url=https%3A%2F%2Fstatic.cdsb.com%2Fmicropub%2FArticles%2F202412%2Fc6419feb940b5f2c2302f01847e73bb8.html,,0,0,False
萝卜和鸡蛋这样做，比吃补药还补，顿顿吃都不会腻，又香又下饭,2024-10-30 12:28,68321,4197,小寒厨艺,小寒厨艺,萝卜和鸡蛋这样做，比吃补药还补，顿顿吃都不会腻，又香又下饭,https://toutiao.com/group/7431405463378919975/,,0,0,True
小伙去看病，没想女医生是自己前任，下秒对话太逗了,2024-12-08 07:38,5288,1183,南瓜说异,南瓜说异,,https://toutiao.com/group/7445939678059954740/,,0,0,True
正部级“老虎”吴英杰被决定逮捕！在西藏工作近47年，被批严重影响西藏高质量发展，多名下属“落马”,2024-12-24 02:06,1977,2908,九派新闻,九派新闻,正义网记者12月24日从最高人民检察院获悉，十四届全国政协原常委、文化文史和学习委员会原主任吴英杰涉嫌受贿一案，由国家监察委员会调查终结，移送检察机关审查起诉。日前，最高人民检察院依法以涉嫌受贿罪对吴英杰作出逮捕决定。该案正在进一步办理中。,https://toutiao.com/group/7451793548275466804/,,0,0,False
西安男童遭恶犬咬伤病危？警方通报,2024-12-24 03:32,2595,3951,界面快讯,界面快讯,西安男童遭恶犬咬伤病危?警方通报,https://toutiao.com/group/7451815990470279719/,,0,0,False
如何看待美国出台的《2024中国军力报告》？,2024-12-23 05:18,20553,1122,大刘说说,大刘说说,美国国防部最近出台了2024中国军力报告，今年我们来聊聊西方世界是如何看待中国的军力发展的,https://toutiao.com/group/7451472335464301096/,,0,0,True
全球最大电磁弹射无人机航母，两栖攻击舰 076即将下水,2024-12-22 09:48,26857,1220,杜文龙,杜文龙,,https://toutiao.com/group/7451170777983877632/,,0,0,True
益生菌真的那么神奇吗？有关益生菌的几个误区 你“踩雷”了吗？,2024-12-07 02:35,1783,103,央视频,央视频,,https://toutiao.com/group/7445492942887715365/,,0,0,True
弟弟光荣退伍，姐姐兴奋去车站接他，怎料一见弟弟瞬间哭了,2024-11-05 06:34,41457,3335,乐视天天剧好看,乐视天天剧好看,,https://toutiao.com/group/7433679820573934091/,,0,0,True
四川：可4倍音速飞行 成都造“筋斗云”成功试飞,2024-12-20 10:52,4040,367,看看新闻,看看新闻,四川：可4倍音速飞行 成都造“筋斗云”成功试飞,http://mediaplay.kksmg.com/2024/12/20/h264_720p_600k_78546-DFTVHD-20241220175000-4800-967537-600k_mp4.mp4,,0,0,True
金融战进入下半场,2024-12-24 06:52,6750,375,汤山老王,汤山老王,,https://toutiao.com/group/7451867763561202211/,,0,0,True
蛇年纪念币钞难抢？还能捡漏吗？多家银行回应,2024-12-24 08:29,125,272,中新经纬,中新经纬,中新经纬12月24日电 (周奕航 李自曼)“根本预约不到，刚进入页面就显示没有额度”“没抢到纪念币，但抢到纪念钞了，美滋滋”“蛇年纪念币这么难抢吗？全军覆没”……23日晚10点，2025年贺岁普通纪念币和2025年贺岁纪念钞预约正式开启，“蛇年纪念币好难抢”等相关话题登上热搜。,http://www.jwview.com/jingwei/html/12-24/613625.shtml,,0,0,False
67岁执意生娃，如今却坐轮椅无法自理，5岁的天赐被迫独立学洗衣,2024-11-04 10:32,9827,2253,睿之悦,睿之悦,2019年，已经67岁的田新菊执意生下了自己的第三个孩子小天赐。那么，现如今5年的时间过去了，这“天赐”的礼物到底是福还是祸呢?,https://toutiao.com/group/7433367394946384435/,,0,0,False
河南警察3岁女儿被拐，苦寻全国23年无果，结果却发现女儿在对门,2024-11-05 07:43,5338,605,八号探秘人,八号探秘人,寻亲23年无果，丢失的女儿竟住在对门?但它却真实发生在河南洛阳的梁绍波身上。是意外走丢，还是人贩子所为，三岁的女儿怎会离奇失踪?,https://toutiao.com/group/7433697108120142345/,,0,0,False
台湾又拍大尺度！ 太羞耻了，注定只能网盘见,2024-12-10 09:40,3837,194,禾芷解说,禾芷解说,深度解说台湾电影《亲爱的杀手》,https://toutiao.com/group/7446671812101931572/,,0,0,True
上海：首座人形机器人工厂实现商用量产,2024-12-23 11:02,2002,419,看看新闻,看看新闻,上海：首座人形机器人工厂实现商用量产,http://mediaplay.kksmg.com/2024/12/23/h264_720p_600k_78886-DFTVHD-20241223175000-4800-969188-600k_mp4.mp4,,0,0,True
财政部：2025年要提高城乡居民基础养老金,2024-12-24 04:17,4645,10541,央视新闻,央视新闻,12月23至24日，全国财政工作会议在北京召开。会议强调，2025年要重点做好六方面工作。一是支持扩大国内需求。适当提高退休人员基本养老金，提高城乡居民基础养老金，提高城乡居民医保财政补助标准，大力提振消费。,https://content-static.cctvnews.cctv.com/snow-book/index.html?item_id=4907883216418251291&source=50006&sub_source=50006_001,,0,1,False
朝鲜军人在库尔斯克死战，多人拒不投降，拉响手榴弹炸死自己,2024-12-23 03:51,9201,369,国力说,国力说,,https://toutiao.com/group/7451449878200189440/,,0,0,True
赖清德的下场有四个选择：泽连斯基、巴沙尔、尹锡悦，还有傅作义,2024-12-24 09:37,11873,838,邱毅台湾,邱毅台湾,,https://toutiao.com/group/7451910234425000467/,,0,0,True
