title,publish_time,like_count,comment_count,media_name,source,abstract,article_url,tag,is_yaowen,article_sub_type,has_video
习语｜探月工程成果充分展现中国人志气骨气底气,2025-02-12 14:48,739,351,人民日报,人民日报,飞天揽月是中华民族延续千年的梦想。习近平总书记多次亲切会见探月工程任务参研参试人员代表，并提出殷切期望，再听依然让人心潮澎湃。元宵节之际，想起“嫦娥奔月”，不忘“嫦娥”揽月，一起回顾！,https://www.peopleapp.com/column/30048244214-500006089683?utm_source=头条号&promote=true,,0,0,False
年轻小伙出轨60岁老太，妻子当场崩溃…,2025-02-04 23:50,4772,1019,温暖剧情,温暖剧情,,https://toutiao.com/group/7467715297085112886/,,0,0,True
马斯克转发的美国人已发布视频,2025-02-11 09:53,7714,953,有趣的云朵,有趣的云朵,,https://toutiao.com/group/7470097464666718747/,,0,0,True
央视：Deepseek全面接入,2025-02-13 03:42,3141,338,杨毛卷儿,杨毛卷儿,,https://toutiao.com/group/7470743831328080425/,,0,0,True
110：警方侦破新型招嫖方式，犯罪手段简单，民警法眼显神威,2025-01-21 23:26,4646,2606,嘎嘎剧有料,嘎嘎剧有料,,https://toutiao.com/group/7462328582048711205/,,0,0,True
老婆卖淫、老公放风，城中村滋生“夫妻档”团伙，警方出击拔毒瘤,2025-02-03 03:52,5346,1792,观剧傻白甜,观剧傻白甜,,https://toutiao.com/group/7467035747732701736/,,0,0,True
马斯克磨刀霍霍，正面挑战五角大楼，美国军方会狗急跳墙吗？,2025-02-12 21:00,7112,223,包明说,包明说,2月9日，特朗普正式授权马斯克，开始对美国国防部进行审计。,https://toutiao.com/group/7470640358817268264/,,0,0,True
美俄联手布局，策动俄乌和谈，四州归俄或成定局，谁是最大赢家？,2025-02-13 07:40,18352,1558,邱震海,邱震海,,https://toutiao.com/group/7470805330692211239/,,0,0,True
有这样的老婆，你家祖坟都冒青烟了！,2025-02-04 03:11,67524,11226,乐观的冰淇淋I,乐观的冰淇淋I,,https://toutiao.com/group/7467226170908606976/,,0,0,True
罪域：中央最大老虎被查，没人敢抓捕，书记：后台再硬我亲自去抓,2025-01-14 06:17,18439,691,谍战影视营,谍战影视营,,https://toutiao.com/group/7459651246346043919/,,0,0,True
