title,publish_time,like_count,comment_count,media_name,source,abstract,article_url,tag,is_yaowen,article_sub_type,has_video
尹锡悦已经逃跑？或与布林肯有关，在野党命令警方立即追捕,2025-01-08 11:00,1618,170,绝对君视,绝对君视,分析认为，布林肯大概率是“视察”韩国动荡不安的政局，也有人认为，拜登政府可能会力保尹锡悦。据《参考消息》1月8日报道，尹锡悦可能已经逃离汉南洞总统官邸，而韩国警方则称“总统所在地带不宜公开”。,https://toutiao.com/group/7457496251534295587/,,0,0,False
日本专家：中国六代机惹人发笑，想吓唬敌人举手投降,2025-01-07 03:44,8123,4089,第一军情,第一军情,对于中国取得的国防成就，日本人的态度非常有意思，他们在表面上给予了假惺惺的赞扬，但背后却隐藏着怀疑和不安。,https://toutiao.com/group/7457013487617802787/,,0,0,False
李思:生父李连杰把我和妈妈抛弃，如果可以的话我不想是他的女儿,2025-01-08 06:41,889,241,扬声观察,扬声观察,大家才明白，原来利智才是拿捏人心的高手。原来，他们早已不是当年的英俊小伙和美艳女神了。从照片中能够看到，一行人坐在院子里专注地听着大师讲话。,https://toutiao.com/group/7457430809524372018/,,0,0,False
原山西省委巡视组长，家里搜出上亿现金,2024-11-12 07:35,15151,14996,金陵长安,金陵长安,曾经的山西省委巡视组长刘向东所采取的“灯下黑”手法确实是贪腐分子常用的伎俩之一。他以纪检监督的身份，表面上是为了揪出腐败问题，实际上却在背后掩盖自己的贪腐行为。刘向东于1955年出生在河北平山，他在一个普通的农村家庭中长大。长大之后于1970年参加工作。,https://toutiao.com/group/7436292896946455080/,,0,0,False
一文速览丨特朗普发表胜选获国会确认后首次讲话 都有哪些要点？,2025-01-07 23:27,3645,8152,央视新闻,央视新闻,△特朗普（资料图）当地时间1月6日，唐纳德·特朗普赢得2024年美国总统选举的结果正式获得国会参众两院联席会议确认。当地时间7日，特朗普在佛罗里达州海湖庄园举行新闻发布会，提到了多项上任后将实施的政令和改革。,https://content-static.cctvnews.cctv.com/snow-book/index.html?item_id=5386275821338758674&source=50006&sub_source=50006_001,,0,1,False
又一起失联！23岁中国船员疑被绑至缅甸，遭殴打视频曝光！家属被勒索10万元,2025-01-08 02:04,1242,1131,新民晚报,新民晚报,昨天（1月7日），“中国船员疑抵泰国后失联被绑至缅甸”一事持续引发关注，登上多个平台热搜。,https://toutiao.com/group/7457358928017179176/,,0,0,False
2025年城乡居民基本养老保险缴费开始啦！,2025-01-07 07:08,427,116,章贡发布,章贡发布,各位城乡居民：2025年度城乡居民基本养老保险缴费已经开始，现将缴费有关事项通知如下：一、缴费对象年满16周岁（不含在校学生），非国家机关和事业单位工作人员及不属于职工基本养老保险制度覆盖范围、具有本区户籍的城乡居民。,https://toutiao.com/group/7457066405775671834/,,0,0,False
苦口婆心！央视四天内就解禁烟花爆竹连续发声，重点提不要一刀切,2025-01-02 04:38,448,629,8卦娱,8卦娱,2024年已经过去了，不过在跨年夜当晚，很多网友都在分享自己跨年的同时，也有很多人认为已经缺少了很多年味儿了。,https://toutiao.com/group/7455172411600781858/,,0,0,False
“火葬”将被淘汰？新方式已经在国内试用，很多人表示不能接受,2024-12-22 08:28,16344,1004,万史浮华,万史浮华,文、编辑|万史浮华«——【·新的丧葬方式·】——»自古以来，中国人就讲究入土为安，所以土葬的方式传承千年。到了上世纪五十年代，火葬却成为了一种新的丧葬浪潮，并逐渐成为主流。时过境迁，正当人们已经习惯火葬送别亲人时，另一种新的丧葬方式却悄然出现。,https://toutiao.com/group/7451148708990812709/,,0,0,False
毛岸英牺牲与彭德怀有没有关系？毛主席一句话揭开毛岸英真实死因,2024-11-26 02:13,19775,115,历史伟人,历史伟人,对于毛岸英的牺牲，彭德怀要负主要责任，这个论调，在1950年11月28日，毛岸英牺牲后，可谓甚嚣尘上。但是毛岸英牺牲究竟和彭德怀有没有关系，毛主席的一席话，道出不为人知的真相。,https://toutiao.com/group/7441405247324488218/,,0,0,False
河南警察3岁女儿被拐，苦寻全国23年无果，结果却发现女儿在对门,2024-11-05 07:43,6422,693,八号探秘人,八号探秘人,寻亲23年无果，丢失的女儿竟住在对门?但它却真实发生在河南洛阳的梁绍波身上。是意外走丢，还是人贩子所为，三岁的女儿怎会离奇失踪?,https://toutiao.com/group/7433697108120142345/,,0,0,False
中日，一出好戏即将上演,2025-01-01 23:38,8655,7564,牛弹琴,牛弹琴,年终上演精彩大戏，新年不排除更有一出好戏。反正，从积极的角度看，中日关系，正处于近20年来最好时期。之所以能说最好，是因为之前实在是太糟。三个值得关注的动向。第一个动向，日本首相石破茂的表态。日前在接受电视访谈时，石破茂说：“日本首相访问中国是极为重要的事。,https://toutiao.com/group/7455091815717388850/,,0,0,False
花9000万“润”到英国后，他成了“韭菜”,2025-01-04 11:04,1850,626,环球人物杂志,环球人物杂志,他在山西金融领域掀起一场惊涛骇浪，走上了一条不归路。作者：陈佳莉即将到来的农历新年，将是田文军夫妻在英国度过的第六个春节，但可能是一个无家可归的春节。他们所居住的位于伦敦汉普斯特德郊区的一处豪宅于近日被“充公”，这是他们刚来英国时的落脚地，一定意义上被视为新的家。,https://toutiao.com/group/7456014483631260194/,,0,0,False
特朗普开始行动了，派儿子去了格陵兰岛,2025-01-07 23:29,1863,1361,牛弹琴,牛弹琴,有道是“打仗亲兄弟，上阵父子兵”。特朗普果然开始行动了，1月7日，派儿子乘坐特朗普私人飞机，就去了格陵兰岛。去干什么？丹麦人很紧张，来者不善，黄鼠狼给鸡拜年来了！在小特朗普启程前一天，特朗普就在社交媒体上称昭告天下：“我听说格陵兰的人民支持‘让美国再次伟大(MAGA)’。,https://toutiao.com/group/7457314743175447078/,,0,0,False
蒋介石孙子召开发布会，要将“两蒋”移灵大陆，两句话让世人唏嘘,2024-12-06 07:24,26097,3174,赢梯,赢梯,“你爷爷、你父亲生前都有一个遗愿，希望去世后，能葬在大陆。”1995年，79岁的蒋纬国，在和侄子蒋孝勇聊天时，提到了这件事。,https://toutiao.com/group/7445194705530569256/,,0,0,False
中国第4艘航母，被卫星发现蛛丝马迹，直接十万吨级核动力？,2025-01-07 02:11,1913,788,蒋福伟,蒋福伟,卫星发现新航母的“蛛丝马迹”，中国下一艘航母或直接十万吨级核动力?近日，有西方军事专家援引商业卫星照片称，中国航母楼的外形出现了肉眼可见的变化。,https://toutiao.com/group/7456990223185035816/,,0,0,False
34岁雌雄同体的女性，具备男女两性器官，她该如何生存下去？,2024-10-17 03:32,5507,250,大象微视,大象微视,这个词在我们生活中并不常见，简而言之，双性人就是既拥有男性的生殖器官，也具备女性的特征的人。1989年，王梓淇出生在山西太原的一个家庭，她的家里经营着一家小生意，虽然谈不上富裕，但足够让一家人过得舒心自在。,https://toutiao.com/group/7426578550418948618/,,0,0,False
从美国的经验来看，中国未来房价的结局,2024-12-18 11:18,8892,2097,资本论,资本论,你如果在两年前问我，房价会不会继续跌，我大概率会告诉你还会继续跌。现在聊到中国房价未来走势的时候，很多人都会提到两个案例，一个是日本案例，另一个则是美国案例。,https://toutiao.com/group/7449709577114894886/,,0,0,False
我国哪里的面粉无添加？经对比，有这行字就是零添加，可以放心买,2025-01-02 10:44,3506,1359,鲸探所,鲸探所,面粉是我们日常生活中离不开的一种主食，在我国人们的餐桌上是有着非常重要的地位的。可以说，基本上家家户户都是需要用到面粉的，已经快到年下了，许多人也开始往家里置备年货了，而面粉，也是最重要的年货之一。,https://toutiao.com/group/7455263523673834024/,,0,0,False
保存腊肉，放冰箱冻是大错！教你2招，放1年都不会坏。,2025-01-02 02:09,2276,111,爱做美食的秦秦,爱做美食的秦秦,导读想让腊肉香飘一年，不坏不硬？别再傻傻放冰箱冻了！网上流传的腊肉保存方法五花八门，让人眼花缭乱，到底哪些靠谱？哪些又是美丽的陷阱？今天，咱们就来好好说道说道，让你彻底掌握腊肉保存的秘诀！首先，我们得明确一个问题：为啥腊肉保存这么难？,https://toutiao.com/group/7455134227873399306/,,0,0,False
宋留根被执行死刑，戴镣铐与妻子告别，临刑前浑身发抖流泪不止,2025-01-04 10:14,1896,129,慧言史说,慧言史说,从1993年开始，直到2003年落网。在那段时间里，宋留根这个名字，就像是梦魇一般，笼罩在郑州纺织品批发商的头上，直到他被执行死刑。,https://toutiao.com/group/7455981614795915830/,,0,0,False
23年的相濡以沫败给23岁的小三，儿子自杀后，她让小三终生不育,2024-10-28 08:08,15941,1673,浮世蒹葭,浮世蒹葭,二人很快的谈起了恋爱，此时的金庸一无所有。朱玟并不介意金庸离过一次婚，反而非常欣赏他的艺术才情，没过多久二人就结了婚。虽然现在看很快，但是在那个年代来说，这也是再正常不过了。,https://toutiao.com/group/7426661622040576512/,,0,0,False
新婚33天卷走274万4套房，出逃后丈夫跨国追捕，如今下场大快人心,2024-12-20 22:06,5692,276,八号探秘人,八号探秘人,在阅读此文之前，辛苦您点击一下“关注”，既方便您进行讨论和分享，又能给您带来不一样的参与感，感谢您的支持！编辑丨QQ·B“色字头上一把刀！”深圳富豪结婚33天竟被卷走274万元和名下4套房产。不仅如此，他还被扣上了“接盘侠”的帽子，啥也没干喜当爹。,https://toutiao.com/group/7450399558821052982/,,0,0,False
他的资历比朱德还老，授勋时却错失元帅，毛主席特批享受元帅待遇,2024-12-12 10:24,3906,149,品古观今,品古观今,在我军革命史上，有一位将军的资历比朱德还老，连毛主席都说:“共产党能对国民党将领说话的人不多，他就是其一。”可这样的人却在大授衔时，错失了元帅，后来经过毛主席的一番关心，才得以享受与元帅的同等待遇。,https://toutiao.com/group/7447468654758871592/,,0,0,False
充电时，先插手机还是充电器？方法错误手机坏得快,2025-01-02 01:19,2334,172,人民日报,人民日报,手机电量还剩多少，对现代社会的许多人而言，都是一个“性命攸关”的问题。人们对手机充电的强烈需求，也让市面上催生出了许多噱头：无线充电，二倍速充电，以及能连着用一周的高能充电宝。乱花渐欲迷人眼，但到底什么才是手机充电的正确姿势呢？手机一定要满充满放吗？,https://www.peopleapp.com/column/30047895447-500006027199?utm_source=头条号&promote=true,,0,1,False
我国楼市大局已定，未来全国45%的家庭，或将面临“5大挑战”,2024-12-15 11:45,711,108,苍暮颜,苍暮颜,前言:21世纪开始，中国房地产市场一路高歌猛进，繁荣的景象更是吸引了无数投资者和购房者，房价也是一路攀升，也成为了房地产经济增长的重要引擎。,https://toutiao.com/group/7448599203455975947/,,0,0,False
外媒：绑架王星幕后老板已被抓！“当时情况比较凶险”，救援详情披露：救援人员发现两处关押场所，均有中国人,2025-01-08 09:54,649,692,每日经济新闻,每日经济新闻,1月8日下午15点20分，演员王星女友 @失眠爹地 发布最新微博，表示“我和星星已于今日上午在位于曼谷的泰国官方机构见面，并在使馆工作人员和律所的陪同下，向警方了解了最新情况和后续安排”，并附上与星星的牵手图。,http://www.nbd.com.cn/rss/jinri_toutiao/articles/3714618.html,,0,0,False
这是张学良老婆赵四小姐真实样貌，并非演员饰演而是货真价实真品,2024-12-28 11:28,14427,1802,历史伟人,历史伟人,赵四小姐，原名赵一荻，她从十六岁开始她终生陪伴张学良，历经坎坷，赵一荻是富家大小姐，但是在张学良囚禁期间，她选择陪伴软禁中的张学良，后悔过吗?,https://toutiao.com/group/7453422736652698175/,,0,0,False
