title,publish_time,like_count,comment_count,media_name,source,abstract,article_url,tag,is_yaowen,article_sub_type,has_video
尹锡悦关押在拘留所，还有翻盘机会吗？金建希悠闲遛狗，为什么？,2025-01-17 11:44,9033,306,邱毅台湾,邱毅台湾,,https://toutiao.com/group/7460848869161566772/,,0,0,True
出生率回升，性别比例更平衡，最新人口数据来了！,2025-01-17 10:11,761,524,上观新闻,上观新闻,栏目主编：尤莼洁 来源：作者：解放日报 崔艺林 狄斐 曹俊,https://export.shobserver.com/toutiao/html/846708.html,,0,1,False
大姐人在自己家，肾却不翼而飞，医生检查完片子后脸色大变,2025-01-16 01:36,958,207,娱乐乐透社,娱乐乐透社,,https://toutiao.com/group/7460321089265091111/,,0,0,True
印度机器狗亮相阅兵式，一人遛一狗，智能作战领域与中国差距惊人,2025-01-17 09:19,3843,466,杜文龙,杜文龙,,https://toutiao.com/group/7460811586316304948/,,0,0,True
刀郎的歌让日本观察到中国国魂！日开始不“轻”中，开始“轻”美,2025-01-17 22:01,11428,714,黎建南台湾,黎建南台湾,,https://toutiao.com/group/7461007862559408675/,,0,0,True
女子带两娃摆摊后续！前老公跳河，二婚被赶出门，今有好消息传来,2025-01-17 02:40,3110,661,那一片雪花啊,那一片雪花啊,2025年伊始，重庆一位带两娃摆摊的28岁女子火了!近日，一位博主走在重庆夜晚的街头，风很凉，不由得让人裹紧了衣服，可接下来博主却看到了令他感到疑惑的一幕!,https://toutiao.com/group/7460655797899379241/,,0,0,False
如果我当美国防长,2025-01-17 13:52,10094,526,静思有我,静思有我,,https://toutiao.com/group/7460881868464980507/,,0,0,True
小女孩上部队找爸爸，少校阿姨主动搭讪，谁知看到女孩父亲傻眼了,2024-12-23 16:01,6282,1360,群星访谈秀,群星访谈秀,,https://toutiao.com/group/7451525814283960872/,,0,0,True
