title,publish_time,like_count,comment_count,media_name,source,abstract,article_url,tag,is_yaowen,article_sub_type,has_video
我哥哥，和朋友一起前往新疆种地后，离奇失踪32年，生死未卜,2024-07-07 22:06,7482,4194,真实人物采访,真实人物采访,#头条寻人##寻人路上的故事##失踪##回家#这是我们讲述的第4291位真人故事我是杨琼英，今年56岁，这是我找哥哥的第四个年头。32年前，我哥哥杨文斌在其好友代志福的多次劝说下，和他一同前往新疆种地，从此便和家人失去了联系。,https://toutiao.com/group/7388842950048875049/,,0,0,False
10月2日上午，天安门毛主席纪念堂竟然发生如此感人场面，哭了,2024-10-02 01:25,3016,163,好邻居李亮,好邻居李亮,,https://toutiao.com/group/7420983448451580450/,,0,0,True
航天功勋吴美蓉院士突然死亡，死因曝光，三年前的遭遇令人心痛,2024-08-03 13:02,2552,292,笑史云烟,笑史云烟,就在全国人民都将注意力放在巴黎奥运会上时候，国内突然传来一纸讣告，宣布了一个女科研工作者致敬的离世。,https://toutiao.com/group/7398895345454416403/,,0,0,False
演员张瑜：离婚后单身30年，再见前夫仍感到心动，66岁没有子女,2024-07-24 10:51,16108,1152,八号探秘人,八号探秘人,在阅读此文之前，辛苦您点击一下“关注”，既方便您进行讨论和分享，又能给您带来不一样的参与感，感谢您的支持！写作不易，作者每天辛苦写稿，只是为了养家糊口，希望各位观众老爷可以多多理解。文中加入5秒广告解锁，观看5秒后便可免费阅读全文啦，感谢各位观众老爷的理解与支持！,https://toutiao.com/group/7395130917804720640/,,0,0,False
女儿美国读高中花掉110万，单亲妈妈发起募捐：求捐200万读大学！,2024-07-25 10:10,925,1833,笑史云烟,笑史云烟,都说寒门出贵子，这话其实不假，就像单亲妈妈郑女士辛苦拉扯长大的女儿小杰，在努力下直接考上了美国加州大学。,https://toutiao.com/group/7395473835161616936/,,0,0,False
突发！伊朗向以色列发动导弹袭击，“90%命中目标”“摧毁大量以军坦克”，以总理：伊朗将付出代价！146名中国公民撤离黎巴嫩,2024-10-01 23:43,181,111,每日经济新闻,每日经济新闻,中东局势再次升级！就在以色列先后空袭加沙地带、黎巴嫩、也门、叙利亚等并宣布开始对黎巴嫩南部进行“有限地面行动”后，伊朗对以色列发动了大规模导弹袭击。当地时间10月1日，以色列国防军发表声明称，有导弹从伊朗发射到以色列境内。耶路撒冷响起警报。声明表示，以色列防空系统已全面投入运行。,http://www.nbd.com.cn/rss/jinri_toutiao/articles/3578014.html,,0,0,False
4年骑行结束，1500天终于回到老家，感谢大家一路陪伴有缘江湖见,2024-09-07 03:50,73084,16944,刘伟元的旅行,刘伟元的旅行,4年骑行结束，1500天终于回到老家，感谢大家一路陪伴有缘江湖见！,https://toutiao.com/group/7411715839100977716/,,0,0,True
带村花抽水坑碰上“鱼群聚会”，成群靓货抓不过来，这是个发财坑,2024-09-14 03:36,1125,144,渔戈兄弟赶海,渔戈兄弟赶海,,https://toutiao.com/group/7407400256825983500/,,0,0,True
骑行浙江回老家，翻越大山借宿凉亭，50元半只烤鸭两瓶啤酒吃的爽,2024-08-29 04:00,33303,5496,刘伟元的旅行,刘伟元的旅行,骑行浙江回老家，翻越大山借宿凉亭，50元半只烤鸭两瓶啤酒吃的爽,https://toutiao.com/group/7408253260588384768/,,0,0,True
大美中国之兴义市,2024-08-25 03:24,579,129,山河画卷,山河画卷,今天带大家走进兴义市一起领略祖国的大好河山,https://toutiao.com/group/7406744167956611596/,,0,0,True
中国🇨🇳人民的好总理,2024-09-03 15:46,198272,21144,话说,话说,这个老人一生只做一件事，那就是为了人民鞠躬尽瘁，死而后已,https://toutiao.com/group/7410443709928210955/,,0,0,True
网红郭有才，泡沫散去之后，曾经飘的有多高，如今摔得就有多惨,2024-09-30 09:36,670,428,八号探秘人,八号探秘人,曾经那个卖烧烤的店小二，可能怎么都想不到，自己会成为一个千万粉丝的网红。郭有才在刚成为网红之后的期望也很有意思，那就是每天能赚到300元就行。可现实却是靠着直播广告分成，他的收入直接比期望值翻了上千倍。有人说他其貌不扬，但是平凡人逆袭的典范，还有的人说他长的像日本人。,https://toutiao.com/group/7419978325617082932/,,0,0,False
2013年，湖南26岁女孩嫁给71岁老头，婚后还生下一子，如今怎样了,2024-07-12 11:59,25820,2391,智史通鉴,智史通鉴,2013年4月17日，长沙宁乡县的民政局迎来了一对特殊的夫妻。一个71岁的老头和一个26岁的女孩，离远了看，甚至像爷爷和孙女。面对工作人员异样的眼光，女孩说：“我和他是真心相爱的！”这让人好奇，这对相差45岁的夫妻，他们之间到底有着怎样的爱情故事？,https://toutiao.com/group/7390696631223534120/,,0,0,False
山西一女大学生白嫖被拒恼羞成怒：当初有多嚣张，如今就有多慌张,2024-09-28 05:45,1912,977,鲸探所,鲸探所,很难想象，因为一包12.99元的红枣，一位大学生竟然能对客服辱骂一个小时。这样的事情，听起来似乎确实让人感觉有点难以置信，可它就这么水灵灵的发生了，而且还被曝光出来了。,https://toutiao.com/group/7419561787948941876/,,0,0,False
国乒5朵金花的家庭：王艺迪体二代，陈梦富二代，王曼昱父亲泪目,2024-08-04 02:03,2246,133,不似少溓游,不似少溓游,想要在国内靠乒乓球打出名堂，仅仅有天赋是完全不够的。因为在中国乒坛，万里挑一的天才遍地都是。以至于有不少人都选择放弃，甚至还有田志希这样为了能打乒乓球而选择归化韩国的球手。,https://toutiao.com/group/7398094722457289266/,,0,0,False
男子与女子在河中嬉戏玩耍，突然连续将女子的头按入水中,2024-09-26 04:40,1049,155,经视看天下,经视看天下,,https://toutiao.com/group/7418807108637819444/,,0,0,True
公鸡强行霸占了狗窝，小狗狗回家的第一反应，把主人笑得肚子疼！,2024-07-09 14:51,8341,379,维E爱动物,维E爱动物,公鸡强行霸占了狗窝，小狗狗回家的第一反应，把主人笑得肚子疼！,https://toutiao.com/group/7389648897754268170/,,0,0,True
东风41恐惧症在欧美蔓延：外媒坚定认为，先进导弹绝非东风31AG,2024-10-01 14:26,2973,802,南友汇,南友汇,日前以英国《金融时报》，美国《华盛顿时报》为首的欧美国家媒体撰文称，解放军本次试射的洲际导弹绝非是东风31AG，而是解放军现役更先进的东风41洲际导弹。,https://toutiao.com/group/7420812639297520163/,,0,0,False
她是央视最惨主持人，男友被判死缓，丈夫诈骗入狱，47岁无人敢娶,2024-08-27 23:30,2172,207,闻书识焉,闻书识焉,她曾是央视的台柱子，和董卿、周涛并称为央视的三朵金花。回顾刘芳菲的前半生，最令人感到惋惜的，便是她的感情生活，47岁至今无人敢娶。,https://toutiao.com/group/7407743113688564258/,,0,0,False
淘汰王楚钦！丹麦选手林德庆祝：我赢了世界第一！在他的主场！,2024-10-01 15:48,1245,2806,直播吧,直播吧,直播吧10月01日讯 WTT中国大满贯2024男单1/16决赛，王楚钦1-3爆冷不敌丹麦选手林德。赛后，赛事方晒出了林德录制的庆祝视频。林德在视频中说：“我刚刚击败了世界第一，在他的主场中国，这真是我一生中最重要的时刻。感谢所有支持我的人，我会继续战斗希望赢得更多比赛。,https://news.zhibo8.com/other/2024-10-01/66fc17b8f1f2fnative.htm,,0,0,False
原来他才是毁掉刘翔真凶，因贪1200万被公审，让刘翔背负多年骂名,2024-08-29 09:58,7164,176,八号探秘人,八号探秘人,在田径场上创造的成绩，至今无人能够打破，甚至在国际上享有盛名。本该继续夺冠之路，却两次因伤退赛，遭到了全网辱骂。,https://toutiao.com/group/7408489498465616410/,,0,0,False
10月10号开始国家要动真格了，目前社会上出现的新四害。,2024-10-01 23:09,3362,243,无双蜻蜓5ci,无双蜻蜓5ci,,https://toutiao.com/group/7420948349735404070/,,0,0,True
"万万没想到,53岁“丁克”半辈子的康辉，一生遗憾竟然是一通电话",2024-08-21 22:14,23677,4745,峰哥正读,峰哥正读,在阅读此文之前，麻烦您点击一下“关注”，既方便您进行讨论和分享，又能给您带来不一样的参与感，感谢您的支持！文/编辑：蘑菇百善孝为先。但是到底怎么做才算是“孝”，康辉用了半辈子才明白。央视知名主持人康辉，事业顺遂，家庭幸福，在外人看来是一个人生赢家。,https://toutiao.com/group/7405504703687115273/,,0,0,False
在两性关系中，女性最多能接受多少岁的男人，3位女人说出心里话,2024-07-25 23:38,27464,8580,玲儿说说,玲儿说说,,https://toutiao.com/group/7395721886363025920/,,0,0,True
黑龙江美女囚犯毕丽梅，被枪决后在殡仪馆苏醒，家属：放了她吧?,2024-08-25 14:32,1824,260,冯律讲法,冯律讲法,女死刑犯被枪决后在殡仪馆起死回生，当场把火化的工作人员吓得够呛，就连随行的警察都吓了一跳，壮着胆上前检查一番后，立马把离奇的情况上报。不一会儿法医赶到现场，证实了女犯人的确还活着，亲属闻声下跪，以死过一回为理由，恳求放了她。,https://toutiao.com/group/7407082388163002921/,,0,0,False
写歌30年穷困潦倒，前妻失望选择离婚，谁料51岁靠一首歌一夜成名,2024-08-12 03:37,24036,3821,八号探秘人,八号探秘人,在阅读此文之前，辛苦您点击一下“关注”，既方便您进行讨论和分享，又能给您带来不一样的参与感，感谢您的支持！编辑：LY无数人都想要一个一夜成名的机会，但机会来了也不是每个人都能把握住的。他用了三十年的时间来准备迎接属于自己的机会。为了这个机会他放弃了一切，甚至包括家庭。,https://toutiao.com/group/7402090890367484428/,,0,0,False
人民日报痛斥电动车管理政策!禁行､限行让老百姓“寸步难行”,2024-09-30 14:46,1878,628,比心,比心,,https://toutiao.com/group/7420447724333433382/,,0,0,True
