title,publish_time,like_count,comment_count,media_name,source,abstract,article_url,tag,is_yaowen,article_sub_type,has_video
会心不远，要登绝顶莫辞劳——写在“十四五”规划收官之年,2025-02-27 23:13,362,114,人民日报,人民日报,时间刻度，亦是奋斗标尺。“2025年，我们将全面完成‘十四五’规划。要实施更加积极有为的政策，聚精会神抓好高质量发展，推动高水平科技自立自强，保持经济社会发展良好势头。”“十四五”规划收官之年，习近平总书记指明方向，提出要求。,https://www.peopleapp.com/column/30048372384-500006116746?utm_source=头条号&promote=true,,0,1,False
8道家常小炒做法简单，学会了招待客人特有面子#家常小炒,2024-12-17 09:28,3110,209,勇往直前的秋雪,勇往直前的秋雪,,https://toutiao.com/group/7449310376384004617/,,0,0,True
有这样的老婆，你家祖坟都冒青烟了！,2025-02-04 03:11,88885,14244,乐观的冰淇淋I,乐观的冰淇淋I,,https://toutiao.com/group/7467226170908606976/,,0,0,True
中国斜爆震发动机突破，16马赫时速2万公里，一小时飞遍全球,2025-02-27 10:45,11407,1381,杜文龙,杜文龙,,https://toutiao.com/group/7476048237850264103/,,0,0,True
从3月以后，国家已明令禁收这5种物业费，业主们别再多交钱了！,2025-02-27 16:01,404,126,山西广电文娱,山西广电文娱,我们每月按时缴纳物业费，本是为了换取舒适、安心的居住环境，可有时候，这个本该和谐的 “交易” 却出现了一些不和谐的音符。,https://toutiao.com/group/7475999307523523091/,,0,0,False
厨师长教你：“葱爆羊肉”羊肉滑嫩、鲜香不膻,2024-12-27 07:34,6867,1222,美食作家王刚,美食作家王刚,厨师长教你：“葱爆羊肉”羊肉滑嫩、鲜香不膻,https://toutiao.com/group/7452991735665263139/,,0,0,True
还是二叔会心疼人，害怕晓薇感冒，把晓薇的脚放到自己胸膛取暖,2025-02-01 06:11,4798,1240,谍战影视营,谍战影视营,,https://toutiao.com/group/7466298269832905268/,,0,0,True
33岁单身女护士公园邂逅58岁已婚教授，怀孕后对方两帆布口袋装400万了断，她再次索要600万被判三缓五,2025-02-27 02:49,7581,6126,大风新闻,大风新闻,她与他女儿年龄相仿，两人原本仅仅是同在一个城市生活而已，然而一天晚上公园散步的邂逅，却引发了后续的感情纠葛和一桩刑案。,https://toutiao.com/group/7475921711276261939/,,0,0,False
一觉醒来，德国变天了,2025-02-24 08:00,13750,524,牛弹琴,牛弹琴,德国大选尘埃落定，最大输家和赢家分别是他们,https://toutiao.com/group/7474892409533628982/,,0,0,True
继承权不用再争了！2025年开始，父母的房子，全按“新规定”处理,2025-02-27 16:02,873,417,山西广电文娱,山西广电文娱,2025 年带着全新的生活篇章向我们走来，而房产继承领域也迎来了一系列影响深远的新变化。在以往，房子继承在很多人心中是一件再简单不过的事情，想着父母的房子将来肯定顺理成章地归自己所有。,https://toutiao.com/group/7475999875415507492/,,0,0,False
