title,publish_time,like_count,comment_count,media_name,source,abstract,article_url,tag,is_yaowen,article_sub_type,has_video
有人买华为Mate 70 Pro+嘛？为什么感觉全世界就我一个人在用？,2025-02-17 06:01,168,834,小豪数码,小豪数码,影像从mate40pro转过来的，最大的感觉是按下拍照按钮后嗯成像速度快了，颜色不发白了，最关键的是可以拍实况照片了，拍照体验的提升还是挺大的，至于成像素质，我没有其他旗舰机，没法对比，不作评论了，我感觉我自己使用是够了。,https://toutiao.com/group/7472264084784710155/,,0,0,False
「无人区有回声」第三期 终见圣湖,2025-04-03 04:00,4403,156,头条车选,头条车选,🔥三天三夜！庞博&亢岳驾驶奇瑞瑞虎8L硬核穿越无人区！翻越4400米生死盘山道，闯进阿尔金秘境！当车轮碾过古海床遗迹，眼前铺开的阿亚克库木湖让所有人窒息——这是用勇气丈量出的地球史诗！地表最强座驾已就位，敢不敢和我们一起征服时光雕刻的岩溶奇迹？🚙💨,https://toutiao.com/group/7488680625306698280/,,0,0,True
听听在美国的华人说的，就知道这波关税让他们当地人有多难了！,2025-04-09 08:47,2313,511,世间美好录,世间美好录,,https://toutiao.com/group/7491232219051098643/,,0,0,True
女儿爬山累了，爸爸自制“下山索道”给女高兴的合不拢嘴！,2025-04-09 12:15,3028,609,高级熊猫QuKZE,高级熊猫QuKZE,,https://toutiao.com/group/7491285963621843507/,,0,0,True
全红婵太逗了：被问首拿第2名有何感想？耿直回答笑翻现场,2025-04-06 07:57,1678,434,十六月,十六月,,https://toutiao.com/group/7490106258968642058/,,0,0,True
