title,publish_time,like_count,comment_count,media_name,source,abstract,article_url,tag,is_yaowen,article_sub_type,has_video
老话说“二月怕十五”，明日二月十五，到底怕啥？看看老人怎么说,2025-03-13 05:19,2090,131,袁先生第一讲,袁先生第一讲,“人攀明月不可得，月行却与人相随“，在古代“月亮”不仅是一种天文现象，月亮的阴晴圆缺更是有着“月圆人团圆”的意象，无论在诗句还是文学作品中，月亮常被用来抒发对家乡、亲人的思念之情。,https://toutiao.com/group/7481098829971112483/,,0,0,False
这是张学良老婆赵四小姐真实样貌，并非演员饰演而是货真价实真品,2024-12-28 11:28,33561,2739,历史伟人,历史伟人,赵四小姐，原名赵一荻，她从十六岁开始她终生陪伴张学良，历经坎坷，赵一荻是富家大小姐，但是在张学良囚禁期间，她选择陪伴软禁中的张学良，后悔过吗?,https://toutiao.com/group/7453422736652698175/,,0,0,False
统一进入快车道，台当局向大陆提出要求，美国计划封锁马六甲,2025-03-12 08:03,13673,1973,张殿成军情观察,张殿成军情观察,当前，大陆正加速对台行使行政，司法和军事管辖权，这意味统一已经进入快车道。大陆海警持续在金门和马祖海峡的巡逻和执法，且不断向台湾本岛方向拓展。,https://toutiao.com/group/7480823812272112139/,,0,0,False
出租车司机半路捡个姑娘，直接带回家，老婆一看反应笑翻了,2025-01-14 07:28,13679,638,南瓜钟意你,南瓜钟意你,,https://toutiao.com/group/7459669645180650024/,,0,0,True
凌晨1时15分！杨姓女歌手全国巡回演唱会后被抓,2025-03-13 07:03,1813,733,光明网,光明网,据湖南湘潭市中级人民法院3月10日消息，一名拥有百万粉丝的网红歌手拒绝还债隐匿行踪，还打算开全国巡回演唱会。,https://m.gmw.cn/toutiao/2025-03/13/content_1303990154.htm,,0,1,False
山西悬崖上，发现1700年前巨型石洞，里面竟然住着9个红衣女子,2025-02-26 22:20,65223,5790,学军的农村生活,学军的农村生活,山西悬崖上，发现1700年前巨型石洞，里面竟然住着9个红衣女子,https://toutiao.com/group/7474843100557656627/,,0,0,True
