title,publish_time,like_count,comment_count,media_name,source,abstract,article_url,tag,is_yaowen,article_sub_type,has_video
时政微视频丨百姓冷暖系心间,2025-01-29 23:11,2781,1841,国际在线,国际在线,新春佳节阖家团圆的时刻，总有人在岗位上过节，在坚守中奉献。气象万千的新春图景，离不开千千万万的劳动者、奉献者、守护者。“各行各业的人们都在挥洒汗水，每一个平凡的人都作出了不平凡的贡献！”心之所系，行之所至。,https://news.cri.cn/toutiaopic/efd3c406-e850-da7a-7eda-baeb290d941b.html,,0,0,False
【团圆年】习言道｜在北京的胡同里，习近平贴下“福”字,2025-01-30 06:50,1178,805,中国新闻网,中国新闻网,题:在北京的胡同里，习近平贴下“福”字。每逢新春到来，习近平总书记总会深入基层考察，听民声、问冷暖，并与各地群众一起迎新春。,http://ku.m.chinanews.com/wapapp/cns/gn/2025/01-30/10361716.shtml,,0,0,False
熊孩子一个炮仗，你爸爸这下头皮发麻了！,2025-01-30 15:08,8550,2862,大迷糊图图,大迷糊图图,,https://toutiao.com/group/7465725371435024932/,,0,0,True
越南购入韩国无人机坠机现场，火爆表演泡汤,2025-01-30 18:57,5386,489,星空体育,星空体育,,https://toutiao.com/group/7465784290173846055/,,0,0,True
点燃烟花递给警察，镜头一捕捉笑翻全场！,2025-01-04 10:36,83025,7615,King,King,,https://toutiao.com/group/7456006626227618367/,,0,0,True
这就是旺三代的媳妇，祖上积德啊，才能娶到这么好的媳妇👍,2025-01-27 10:33,39402,3264,趣知达人,趣知达人,,https://toutiao.com/group/7464541223764705842/,,0,0,True
相声：张康贾旭明又讽刺了，不懂装懂，自己不尴尬尴尬的就是别人,2024-11-08 16:20,1835,406,PP情感鸳鸯锅剧院,PP情感鸳鸯锅剧院,相声：张康贾旭明又讽刺了，不懂装懂，自己不尴尬尴尬的就是别人,https://toutiao.com/group/7434835848308195840/,,0,0,True
#跳水冠军#全红婵#回家又是放鞭炮又是贴对联#希望新的一年会更好,2025-01-28 05:50,936,108,燕子天使,燕子天使,,https://toutiao.com/group/7464839536419291688/,,0,0,True
小沈阳夫妇把演唱会开到了北京春晚舞台！,2025-01-29 16:47,14129,2498,非凡蛋糕mu,非凡蛋糕mu,,https://toutiao.com/group/7465379968436994623/,,0,0,True
千万不要嫁到我老家，我土生土长每年回老家过年都受不了#回老家,2025-01-30 11:10,13006,6834,沪漂深蓝失业记,沪漂深蓝失业记,,https://toutiao.com/group/7465664409025643058/,,0,0,True
什么是人间极品，这才是人间最美姑娘！,2025-01-30 01:02,26192,6490,余笙随伈,余笙随伈,,https://toutiao.com/group/7465507288162370100/,,0,0,True
相声《爽剧人生》表演：郭德纲、于  谦,2025-01-29 11:56,6178,386,天津卫视,天津卫视,"《京津冀过大年-2025天津相声春晚》相声《爽剧人生》表演：郭德纲、于  谦
#郭德纲拍短剧捧于谦当霸总# 、#郭德纲说自己想拍短剧#",https://toutiao.com/group/7465304865271661083/,,0,0,True
陈梦i人演小品｜2025新春喜剧之夜 #陈梦,2025-01-30 04:10,718,101,忆乡4991,忆乡4991,,https://toutiao.com/group/7465555895611769398/,,0,0,True
过年催婚压力太大，爸爸终于出手啦！过年回家被催婚，好麻烦,2025-01-29 08:56,2036,640,看雨,看雨,,https://toutiao.com/group/7465258472062435903/,,0,0,True
