title,publish_time,like_count,comment_count,media_name,source,abstract,article_url,tag,is_yaowen,article_sub_type,has_video
时政新闻眼丨从三个维度看习近平湖北之行强调了什么,2024-11-06 13:09,2326,848,央视新闻,央视新闻,11月4日至6日，习近平总书记在湖北考察。2013年党的十八届三中全会前夕，湖北之行是习近平总书记谋划改革的重要一站。他在武汉鲜明提出了全面深化改革需要调查研究的六个重大问题。,https://content-static.cctvnews.cctv.com/snow-book/index.html?item_id=4462150041793534425&source=50006&sub_source=50006_001,,0,0,False
1米3袖珍美女嫁给1米48男孩，婚后丈夫奇迹长高，两人却不欢而散,2024-09-07 02:55,2904,166,睿之悦,睿之悦,杨萍和葛存苗的婚礼 文|睿之悦 编辑|睿之悦2019年，成都的民政局来了两个“10岁小孩”来登记，工作人员以为是玩闹。两个“小孩”拿出身份证让工作人员看，这才明白，原来是两个再也长不高的成年袖珍人情侣。,https://toutiao.com/group/7411713833267364386/,,0,0,False
珠海航展亮点多，新型武器装备集体出现，美国人有点慌,2024-11-06 12:19,4196,152,杜文龙,杜文龙,,https://toutiao.com/group/7434139771879981583/,,0,0,True
反击：婆婆进城欢迎解放军，政委一看她鞋，顿时就明白她是特务,2024-10-17 04:31,2104,105,乐视热播综艺精选,乐视热播综艺精选,反击：婆婆进城欢迎解放军，政委一看她鞋，顿时就明白她是特务,https://toutiao.com/group/7426597593733399075/,,0,0,True
国家要“动真格”？催三胎不成，专家出“好主意”，你赞成吗？,2024-10-31 04:51,7712,3859,阿皮历史库,阿皮历史库,,https://toutiao.com/group/7431797819591098934/,,0,0,True
特朗普隐忍整整4年，上台掌权第一件事，先拿死敌开刀立威？,2024-11-07 03:32,11916,1440,庆彬有理,庆彬有理,特朗普重返白宫，在论功行赏之余，或许还有一件事情要做，那就是对自己的政敌展开全面清算。过去4年，民主党、共和党的建制派，乃至于主流媒体对特朗普在各个领域的围堵，一度让他疲于奔命，甚至还被定下了重罪。,https://toutiao.com/group/7434375201880310324/,,0,0,True
一巴掌的代价，公交车上大妈打晕患癌小伙，断送退休后的幸福生活,2024-10-14 09:53,1848,1124,客观听書,客观听書,公交车上老太太和小伙吵了起来，老太太更是当仁不让直接给了小伙一巴掌。这名小伙直接倒地，老大大根本就不会想到正是因为他的一巴掌，鲜活的生命就这样消失在他的手里。,https://toutiao.com/group/7425563455358468627/,,0,0,False
爸妈中，谁的基因决定孩子的智商和长相，专家回答很统一，太准了,2024-08-31 12:04,844,231,5分钟快读,5分钟快读,阅读此文前，诚邀您点击一下“关注”按钮，方便以后持续为您推送此类文章，同时也便于您进行讨论与分享，您的支持是我们坚持创作的动力~在生活中，许多人都相信：“男生随妈妈，女生随爸爸”这一说法。长久以来，许多人对这一说法深信不疑。但随着科学的普及，越来越多的人也对此产生了怀疑。,https://toutiao.com/group/7409241548929499660/,,0,0,False
特朗普又上台，世界将面临的10大变化,2024-11-06 07:25,15500,4803,牛弹琴,牛弹琴,最终，结果出来了:特朗普梅开二度，再度当选美国总统。世界已经见识了特朗普1.0，马上又要见识特朗普2.0。,https://toutiao.com/group/7434059596894913035/,,0,0,False
全球约一半肝癌在中国，再次提醒：家中的4种食物，尽早撤下餐桌,2024-08-13 08:36,107982,3634,梁医学社梁怡璋医生,梁医学社梁怡璋医生,,https://toutiao.com/group/7402540119712629311/,,0,0,True
男子在路边被黄鼠狼盯住，咬住他的鞋不松口,2024-10-14 06:46,17814,3631,山西广电文娱,山西广电文娱,,https://toutiao.com/group/7425519012454335003/,,0,0,True
特朗普的新孤立主义启动，泽连斯基、尹锡悦、赖清德都瑟瑟发抖了,2024-11-07 06:48,35211,1688,邱毅台湾,邱毅台湾,,https://toutiao.com/group/7434425551684633100/,,0,0,True
犯人瞧不起中级法院，怒骂审判长，一听判死刑立马慌了,2024-10-31 06:01,1933,450,乐视综艺咖,乐视综艺咖,,https://toutiao.com/group/7431815851738661385/,,0,0,True
被拐男子认亲一年后，与家人彻底决裂！,2024-11-05 08:45,1768,1125,环球网,环球网,来源：宁波晚报 近日因寻亲走红的郁豹豹与家人决裂的消息引发关注，冲上热搜。据报道，2023年9月，被拐卖34年的郁豹豹寻亲成功。认亲不到半个月，郁豹豹与两个弟弟开始直播带货。不到两个月，三兄弟逐渐走向分崩离析。令他更无法接受的是，他与母亲也渐生隔阂。,https://3w.huanqiu.com/a/14459a/4K8FGmdmzMW?agt=20,,0,0,False
51年洪学智妻子寻女无果，到老乡家歇脚老乡惊呼：你要找得就是我,2024-09-22 01:07,12453,832,品古观今,品古观今,前言1951年，阳曲县委大院突然来了7、8位解放军同志，其中一位女同志，就是洪学智的妻子张文。她此番前来，就是为了寻找多年前因战乱而寄养于民间的爱女。可昔日的小村落早已蜕变成另一番景象，这无异于是大海捞针。,https://toutiao.com/group/7417034363226915354/,,0,0,False
炸萝卜丸子到底用面粉还是淀粉，教你正确做法，外焦里嫩，太香了,2024-10-26 09:25,5028,308,家常的味道,家常的味道,,https://toutiao.com/group/7430012978277122611/,,0,0,True
刘德华在台北演唱会唱《中国人》，民进党玻璃心碎了，台独崩溃了,2024-11-04 08:14,33677,2605,邱毅台湾,邱毅台湾,,https://toutiao.com/group/7433334683380744731/,,0,0,True
2025年，企业和机关事业退休人员丧葬补助金和抚恤金是一样的吗？,2024-10-29 15:45,669,128,暖心财经说,暖心财经说,2025年开始，我国的职工养老保险制度将会迎来新变化，渐进式延迟退休即将实施，企业职工病残津贴制度也将实施，企业和机关事业单位退休人员的丧葬补助金和抚恤金，会是一样的吗？企业退休人员的丧葬补助金和抚恤金。,https://toutiao.com/group/7431217294867268130/,,0,0,False
炸萝卜丸子，放面粉和淀粉就错了，教你正确做法，焦香酥脆不吸油,2024-09-28 10:13,21823,916,家常的味道,家常的味道,,https://toutiao.com/group/7419635124758643227/,,0,0,True
中俄通婚剧增，若不了解俄罗斯女性生理缺陷，婚后可能会很痛苦,2024-11-06 07:00,731,187,艾弥儿,艾弥儿,随着时代的迅速发展，人们经常可以看到大街上的跨国恋情侣，这种现象在大城市居多，而很多跨国恋中的女方都是俄罗斯女性。,https://toutiao.com/group/7433997303429136931/,,0,0,False
美国是一个伪装成国家的公司，老特坏了“道上”的规矩,2024-11-05 15:25,7235,170,金灿荣教授,金灿荣教授,,https://toutiao.com/group/7433708408525718027/,,0,0,True
特朗普战胜哈里斯重新上台，对中国是好是坏？,2024-11-06 08:28,26432,7454,第一军情,第一军情,据央视新闻11月6日最新报道，特朗普成功战胜哈里斯，赢得了2024年美国总统大选，和很多人想象的“战事焦灼”不同，本次美国大选却呈现出一边倒的态势，特朗普兵不血刃，在多个摇摆州成功“翻红”，战胜了民主党候选人哈里斯，再次问鼎美国总统的宝座。那么，既然美国未来四年的“掌门人”已经敲定，对中国又将有什么深远影响，或者用更贴地气的话：对中国是好是坏呢？,https://toutiao.com/group/7434080229624119844/,,0,0,True
罕见！100年前，英国游客拍下的清朝乡村，和想象中完全不一样,2024-09-20 02:07,4958,546,万物知识局,万物知识局,泥泞的土路，衣不蔽体的老百姓，即便是达官显贵的家中也十分破败，而这些都是清王朝的历史痕迹，虽说那时候中国摄影技术并不发达，但也有许多外国游客来到这里，拍摄下了许多老照片，为我们留下了珍贵的历史资料，那清朝到底是怎样的面貌呢?,https://toutiao.com/group/7416287738871267855/,,0,0,False
刀郎刘德华与凤飞飞，他们的歌让台湾人真的想回家了！,2024-11-05 22:05,54688,5005,黎建南台湾,黎建南台湾,,https://toutiao.com/group/7433919847295091210/,,0,0,True
特朗普完全执政 台海3结局+1,2024-11-07 07:51,4740,158,台灣中天主播盧秀芳,台灣中天主播盧秀芳,特朗普完全执政 台海3结局+1,https://toutiao.com/group/7434441928076165644/,,0,0,True
中国国乒又火了！决胜时刻，领军人物疯狂逆转，上演最解气的一幕,2024-11-04 00:00,5326,600,乐播体育,乐播体育,,https://toutiao.com/group/7433056969079915020/,,0,0,True
姑娘花500块租男友，却不知人家是身价过亿总裁，好运来了,2024-11-03 04:00,1064,181,乐视明星的那点事,乐视明星的那点事,,https://toutiao.com/group/7432588748926812682/,,0,0,True
67岁执意生娃，如今却坐轮椅无法自理，5岁的天赐被迫独立学洗衣,2024-11-04 10:32,1420,485,睿之悦,睿之悦,2019年，已经67岁的田新菊执意生下了自己的第三个孩子小天赐。那么，现如今5年的时间过去了，这“天赐”的礼物到底是福还是祸呢?,https://toutiao.com/group/7433367394946384435/,,0,0,False
特务男扮女装混进村子，孩子兵顿时发现不对劲，这下精彩了,2024-10-28 06:09,2706,257,乐视群星访谈秀,乐视群星访谈秀,,https://toutiao.com/group/7430704630294413878/,,0,0,True
她是第一位博士级歌唱家，12次荣登春晚，丈夫的身份更是深藏不露,2024-08-10 11:05,17280,544,豆莱说,豆莱说,文：豆莱说编辑：豆莱说支持作者，写作不易，文中会有5s广告，观看后可免费阅读全文在当下华语乐坛中，有很多的出色的歌唱家，雷佳就是其中一位。因为她不仅是我国首个荣获了博士学位的歌唱家，更是出道20年就12次登上了春晚舞台的歌唱家。而且，她丈夫的身份也是不容小觑。,https://toutiao.com/group/7401461240674943542/,,0,0,False
拦车收费？交警不管！景区不管！政府看不见！九寨沟咋全是土匪？,2024-09-22 15:55,221626,43905,行哥嘚啵嘚,行哥嘚啵嘚,,https://toutiao.com/group/7417496641638400527/,,0,0,True
特朗普再次当选，台湾已经开始紧张了！【维为道来】,2024-11-06 12:06,35264,109,张维为,张维为,,https://toutiao.com/group/7434136570266911251/,,0,0,True
排骨里打入两个鸡蛋，不红烧不油炸，出锅瞬间变美食，太香了,2024-10-18 00:43,3880,195,家味美食,家味美食,,https://toutiao.com/group/7426909886904009225/,,0,0,True
中国两艘航母早已服役，为何此时才进行双航母演练？,2024-11-02 12:39,10239,316,凤凰卫视,凤凰卫视,,https://toutiao.com/group/7432660637521543719/,,0,0,True
快消失的12个生活用品！40年前在供销社红极一时，你家还在用吗？,2024-09-29 07:58,4517,340,万物知识局,万物知识局,在这里，可以买到从油盐酱醋到衣物鞋帽，再到农具化肥等各种生活必需品，每一样物品都凝聚着时代的特色，见证了那个年代人们的生活状态，今天我们就来走进那些年能够在供销社里买到的生活用品，看看你们还记得哪些。,https://toutiao.com/group/7419937237548237322/,,0,0,False
万万没想到，35岁杨颖兜兜转转干回“老本行”，活成内娱最大笑话,2024-09-06 07:55,538,135,读万卷书的张飞,读万卷书的张飞,文l张飞编辑l张飞曾经你看不起别人；如今谁又瞧得上你？在节目中丝毫不考虑他人状态，一味地只追求自己的镜头。甚至还在采访中公然表示“自己早就应该把所有奖拿了个遍了”。更关键的是丝毫没有任何“报恩”之心。所以如今曾经所有的“嚣张”“高高在上”遭到反噬，只能说现在谁还“愿意”认识她！,https://toutiao.com/group/7411434661014012456/,,0,0,False
