title,publish_time,like_count,comment_count,media_name,source,abstract,article_url,tag,is_yaowen,article_sub_type,has_video
上山采蜜误闯蛇窝，20几条毒性不一，姑娘当场吓尿，头发竖起来了,2024-07-24 02:13,1832,235,兴凯湖莹莹,兴凯湖莹莹,,https://toutiao.com/group/7395019818291692032/,,0,0,True
一巴掌的代价，公交车上大妈打晕患癌小伙，断送退休后的幸福生活,2024-10-14 09:53,833,489,客观听書,客观听書,公交车上老太太和小伙吵了起来，老太太更是当仁不让直接给了小伙一巴掌。这名小伙直接倒地，老大大根本就不会想到正是因为他的一巴掌，鲜活的生命就这样消失在他的手里。,https://toutiao.com/group/7425563455358468627/,,0,0,False
她是央视最惨主持人，男友被判死缓，丈夫诈骗入狱，47岁无人敢娶,2024-08-27 23:30,2234,209,闻书识焉,闻书识焉,她曾是央视的台柱子，和董卿、周涛并称为央视的三朵金花。回顾刘芳菲的前半生，最令人感到惋惜的，便是她的感情生活，47岁至今无人敢娶。,https://toutiao.com/group/7407743113688564258/,,0,0,False
写歌30年穷困潦倒，前妻失望选择离婚，谁料51岁靠一首歌一夜成名,2024-08-12 03:37,25996,4316,八号探秘人,八号探秘人,在阅读此文之前，辛苦您点击一下“关注”，既方便您进行讨论和分享，又能给您带来不一样的参与感，感谢您的支持！编辑：LY无数人都想要一个一夜成名的机会，但机会来了也不是每个人都能把握住的。他用了三十年的时间来准备迎接属于自己的机会。为了这个机会他放弃了一切，甚至包括家庭。,https://toutiao.com/group/7402090890367484428/,,0,0,False
"万万没想到,53岁“丁克”半辈子的康辉，一生遗憾竟然是一通电话",2024-08-21 22:14,27390,5350,峰哥正读,峰哥正读,在阅读此文之前，麻烦您点击一下“关注”，既方便您进行讨论和分享，又能给您带来不一样的参与感，感谢您的支持！文/编辑：蘑菇百善孝为先。但是到底怎么做才算是“孝”，康辉用了半辈子才明白。央视知名主持人康辉，事业顺遂，家庭幸福，在外人看来是一个人生赢家。,https://toutiao.com/group/7405504703687115273/,,0,0,False
15年前他在爱妻葬礼上哭到昏厥，发誓永不再娶，如今他做到了吗？,2024-08-24 02:17,14420,445,八号探秘人,八号探秘人,在阅读此文之前，辛苦您点击一下“关注”，既方便您进行讨论和分享，又能给您带来不一样的参与感，感谢您的支持！编辑丨xk纵观鱼龙混杂的娱乐圈，有人背叛，有人痴情。而果靖霖则是公认的好男儿，将一生都奉献给妻子。但妻子却仅仅陪他走了半生，没能战胜病魔，不幸离开人世。,https://toutiao.com/group/7406210316734710283/,,0,0,False
一夜之间跌落神坛，钟南山院士究竟做了什么？为何那么多人骂他？,2024-10-16 04:15,1030,539,杨杨说历史,杨杨说历史,,https://toutiao.com/group/7426222424129831458/,,0,0,True
今天才知道！电动车“每天充”和“用完再充”，到底哪个更伤电池,2024-08-27 11:19,11707,2128,鲸探所,鲸探所,“今天到底给车充不充电？”估计大多数人每天回家都会想这个问题，看着自己的电动车电量又多又少的，充不充电也是一件非常难以抉择的事情。那么，电动车到底应该怎样充电呢？是每天都充，还是用完之后再充呢？电动车充电不管是在城市还是农村，电动车其实都是人们出门最常见的交通工具。,https://toutiao.com/group/7407773012533117475/,,0,0,False
原来他才是毁掉刘翔真凶，因贪1200万被公审，让刘翔背负多年骂名,2024-08-29 09:58,11454,339,八号探秘人,八号探秘人,在田径场上创造的成绩，至今无人能够打破，甚至在国际上享有盛名。本该继续夺冠之路，却两次因伤退赛，遭到了全网辱骂。,https://toutiao.com/group/7408489498465616410/,,0,0,False
这一次，被批“不男不女”的毕凌，把父亲毕福剑的体面撕的稀碎,2024-08-31 05:00,681,193,卿羽飞,卿羽飞,曾经的《星光大道》是多少人童年时最喜欢看的综艺节目，捧红了非常多的草根艺人，让他们能够实现自己的梦想。,https://toutiao.com/group/7409154770201559591/,,0,0,False
中日已谈妥，当着我高层的面，石破茂连做3项保证，信号极不寻常,2024-10-15 08:52,2316,198,议史纪,议史纪,,https://toutiao.com/group/7425922725736088103/,,0,0,True
赖清德讲话积极作用，促两岸加速统一,2024-10-10 17:54,19706,1934,司马南,司马南,"马英九呼吁赖清德，立即冷静下心来，悬崖勒马，以全体台湾人民的幸福为念，放弃荒谬的“新两国论”，不要为了个人错误的意识形态再让全体台湾人民陷入险境。
乌克兰毁掉自己，把俄国拖下水。
有乌克兰的例子在先，居然还要这么做。
#马英九怒批赖清德# #国台办批驳赖清德#",https://toutiao.com/group/7424206813735682594/,,0,0,True
夫妻俩刚领完证异地两个月，终于见面 监控下两人好甜蜜,2024-09-29 04:25,2869,287,直播日照,直播日照,,https://toutiao.com/group/7419916383196021288/,,0,0,True
有人冒充我男朋友，算不算诈骗？遇到奇葩事你会怎么办？,2024-09-06 05:52,1700,224,兴凯湖莹莹,兴凯湖莹莹,,https://toutiao.com/group/7411404025502892554/,,0,0,True
全球约一半肝癌在中国，再次提醒：家中的4种食物，尽早撤下餐桌,2024-08-13 08:36,102297,3530,梁医学社梁怡璋医生,梁医学社梁怡璋医生,,https://toutiao.com/group/7402540119712629311/,,0,0,True
万万没想到，35岁杨颖兜兜转转干回“老本行”，活成内娱最大笑话,2024-09-06 07:55,535,137,读万卷书的张飞,读万卷书的张飞,文l张飞编辑l张飞曾经你看不起别人；如今谁又瞧得上你？在节目中丝毫不考虑他人状态，一味地只追求自己的镜头。甚至还在采访中公然表示“自己早就应该把所有奖拿了个遍了”。更关键的是丝毫没有任何“报恩”之心。所以如今曾经所有的“嚣张”“高高在上”遭到反噬，只能说现在谁还“愿意”认识她！,https://toutiao.com/group/7411434661014012456/,,0,0,False
🍉惊天巨瓜？微博网友爆料易建联裸照+身份证照片+聊天记录！,2024-10-17 02:00,641,2809,直播吧,直播吧,微博网友爆料易建联惊天大瓜，其裸照和身份证照片均被曝光，还有一张聊天记录。,https://news.zhibo8.com/nba/2024-10-17/67106e77b53c7native.htm,,0,0,False
厉害了！中国演习不仅吓坏美国，连俄罗斯都刮目相看,2024-10-16 09:41,6051,167,永哥聊一聊,永哥聊一聊,厉害了！中国演习不仅吓坏美国，连俄罗斯都刮目相看,https://toutiao.com/group/7426306397115810354/,,0,0,True
