title,publish_time,like_count,comment_count,media_name,source,abstract,article_url,tag,is_yaowen,article_sub_type,has_video
充电时，先插手机还是充电器？方法错误手机坏得快,2025-01-02 01:19,1979,161,人民日报,人民日报,手机电量还剩多少，对现代社会的许多人而言，都是一个“性命攸关”的问题。人们对手机充电的强烈需求，也让市面上催生出了许多噱头：无线充电，二倍速充电，以及能连着用一周的高能充电宝。乱花渐欲迷人眼，但到底什么才是手机充电的正确姿势呢？手机一定要满充满放吗？,https://www.peopleapp.com/column/30047895447-500006027199?utm_source=头条号&promote=true,,0,1,False
香港女子花400万买15平房子，晚上睡衣柜顶，客厅宽敞还有大阳台,2024-12-26 04:06,924,513,鲸探所,鲸探所,都说香港寸土寸金，但是对于我们来说，其实这句话只是一个概念而已，只知道贵，但不知道到底能贵到哪种程度。但是看完一位女子花了400万在香港买的房子之后，“寸土寸金”这个词，真的让人“具象化”了。,https://toutiao.com/group/7452564162242265640/,,0,0,False
57岁于文华现状，与丈夫住农村简陋房子，裙子拖地喂着狗生活幸福,2024-12-17 01:24,1310,218,焰墨绘史,焰墨绘史,在阅读此文之前，麻烦您点击一下“关注”，既方便您进行讨论和分享，又能给您带来不一样的参与感，感谢您的支持。本文内容均引用权威资料结合个人观点进行撰写，文中已标注文献来源及截图，请知悉。提起于文华，想必当大家都不会陌生，当年的她凭借那首《纤夫的爱》，一夜间家喻户晓。,https://toutiao.com/group/7448948632033722889/,,0,0,False
高安国被押前留下英雄壮语，赖清德恶贯满盈，何时方能恶有恶报？,2025-01-05 04:00,23467,2511,邱毅台湾,邱毅台湾,,https://toutiao.com/group/7455975347708920383/,,0,0,True
小子相亲故意扮老，谁知道对方一见面就叫他大爷，这段太逗了,2024-12-24 08:17,3886,881,乐视热播综艺精选,乐视热播综艺精选,,https://toutiao.com/group/7451886130837848610/,,0,0,True
老纪和珅这段对话，以前小时候听不懂，如今听完受益终身,2024-12-28 23:16,6212,1794,乐视扒剧小妹儿,乐视扒剧小妹儿,,https://toutiao.com/group/7453420191947424293/,,0,0,True
夜里翻来覆去睡不着，原来几根芹菜根就搞定，做法简单，省钱实用,2024-12-25 11:02,10832,1282,百变小厨坊,百变小厨坊,夜里翻来覆去睡不着，原来几根芹菜根就搞定，做法简单，省钱实用,https://toutiao.com/group/7452303315842368052/,,0,0,True
他的资历比朱德还老，授勋时却错失元帅，毛主席特批享受元帅待遇,2024-12-12 10:24,3601,145,品古观今,品古观今,在我军革命史上，有一位将军的资历比朱德还老，连毛主席都说:“共产党能对国民党将领说话的人不多，他就是其一。”可这样的人却在大授衔时，错失了元帅，后来经过毛主席的一番关心，才得以享受与元帅的同等待遇。,https://toutiao.com/group/7447468654758871592/,,0,0,False
卡特去逝，拜登宣布降半旗，特朗普火大，他真能使美国再次伟大？,2025-01-06 06:44,6951,208,邱毅台湾,邱毅台湾,,https://toutiao.com/group/7456689683951518271/,,0,0,True
炖鸡肉不要焯水和直接下锅，教你一招，鸡肉鲜香滑嫩不腥不柴,2024-12-15 08:45,8696,432,家常的味道,家常的味道,炖鸡肉千万不要焯水和直接下锅，教你秒招，鸡肉鲜香滑嫩不腥不柴,https://toutiao.com/group/7448556944597451275/,,0,0,True
抗美援朝的将军亮相，全体明星自发起立，这幕太感人,2025-01-03 07:32,11734,1346,乐视天天剧好看,乐视天天剧好看,,https://toutiao.com/group/7455587633452843572/,,0,0,True
小女孩上部队找爸爸，少校阿姨主动搭讪，谁知看到女孩父亲傻眼了,2024-12-23 16:01,3694,862,乐视群星访谈秀,乐视群星访谈秀,,https://toutiao.com/group/7451525814283960872/,,0,0,True
萝卜和鸡蛋这样做，比吃补药还补，顿顿吃都不会腻，又香又下饭,2024-10-30 12:28,73281,4444,小寒厨艺,小寒厨艺,萝卜和鸡蛋这样做，比吃补药还补，顿顿吃都不会腻，又香又下饭,https://toutiao.com/group/7431405463378919975/,,0,0,True
98岁老郎中教我苹果养生新吃法，每天坚持这样吃，睡眠好，身体棒,2024-12-31 11:43,12070,1188,百变小厨坊,百变小厨坊,98岁老郎中教我苹果养生新吃法，每天坚持这样吃，睡眠好，身体棒,https://toutiao.com/group/7454540163725656628/,,0,0,True
34岁雌雄同体的女性，具备男女两性器官，她该如何生存下去？,2024-10-17 03:32,4902,235,大象微视,大象微视,这个词在我们生活中并不常见，简而言之，双性人就是既拥有男性的生殖器官，也具备女性的特征的人。1989年，王梓淇出生在山西太原的一个家庭，她的家里经营着一家小生意，虽然谈不上富裕，但足够让一家人过得舒心自在。,https://toutiao.com/group/7426578550418948618/,,0,0,False
今年会举行阅兵仪式吗？我大胆作个猜测,2025-01-03 09:11,14602,1667,金灿荣教授,金灿荣教授,,https://toutiao.com/group/7455614288229728803/,,0,0,True
长期使用等于自杀？海飞丝等20种洗发水被伪科学测评抹黑 洗发水荧光反应不等于有荧光剂,2025-01-03 00:12,2265,640,看看新闻,看看新闻,长期使用等于自杀？海飞丝等20种洗发水被伪科学测评抹黑 洗发水荧光反应不等于有荧光剂,http://mediaplay.kksmg.com/2025/01/03/h264_720p_600k_79529-smgnews-20250103065500-9000-977372-600k_mp4.mp4,,0,0,True
罕见！一个月内官方三次明确上调养老金，2025养老金调整有惊喜？,2025-01-04 02:56,6331,3459,思之想之,思之想之,在一个月内，官方至少三次明确上调2025年养老金，这个频率是前所未有的，这传递了什么信号呢?思之想之发现，从2024年12月12日开始至今，在一个月内的时间里，官方至少三次明确提出上调2025年养老金。,https://toutiao.com/group/7455850117002691135/,,0,0,False
我国哪里的面粉无添加？经对比，有这行字就是零添加，可以放心买,2025-01-02 10:44,2982,1208,鲸探所,鲸探所,面粉是我们日常生活中离不开的一种主食，在我国人们的餐桌上是有着非常重要的地位的。可以说，基本上家家户户都是需要用到面粉的，已经快到年下了，许多人也开始往家里置备年货了，而面粉，也是最重要的年货之一。,https://toutiao.com/group/7455263523673834024/,,0,0,False
山楂干泡水很多人都泡错了，难怪没用，今天教你正确做法，真管用,2024-11-02 11:46,7964,300,百变小厨坊,百变小厨坊,,https://toutiao.com/group/7432646945211941402/,,0,0,True
原来火腿肠铝环下藏着个“小机关”，轻轻一拉，完整剥开，太棒了,2024-12-30 12:48,5028,3084,百变小厨坊,百变小厨坊,原来火腿肠铝环下藏着个“小机关”，轻轻一拉，完整剥开，太棒了,https://toutiao.com/group/7454186052081680911/,,0,0,True
我家米醋从来不外面买，教你在家做，无添加剂，好吃又卫生,2024-10-31 11:36,6775,885,百变小厨坊,百变小厨坊,,https://toutiao.com/group/7431902258318541324/,,0,0,True
腐竹用清水和开水泡是大错，酒店大厨教我1招，快速柔软还不夹生,2024-11-06 11:49,6636,151,百变小厨坊,百变小厨坊,腐竹用清水和开水泡是大错，酒店大厨教我1招，快速柔软还不夹生,https://toutiao.com/group/7434132052506575394/,,0,0,True
清汤面好吃有诀窍，教你面馆30年不外传的秘诀，劲道爽滑汤鲜味美,2024-12-13 13:30,8306,1110,百变小厨坊,百变小厨坊,,https://toutiao.com/group/7447888258186347018/,,0,0,True
毛岸英牺牲与彭德怀有没有关系？毛主席一句话揭开毛岸英真实死因,2024-11-26 02:13,19140,112,历史伟人,历史伟人,对于毛岸英的牺牲，彭德怀要负主要责任，这个论调，在1950年11月28日，毛岸英牺牲后，可谓甚嚣尘上。但是毛岸英牺牲究竟和彭德怀有没有关系，毛主席的一席话，道出不为人知的真相。,https://toutiao.com/group/7441405247324488218/,,0,0,False
中日，一出好戏即将上演,2025-01-01 23:38,7195,6781,牛弹琴,牛弹琴,年终上演精彩大戏，新年不排除更有一出好戏。反正，从积极的角度看，中日关系，正处于近20年来最好时期。之所以能说最好，是因为之前实在是太糟。三个值得关注的动向。第一个动向，日本首相石破茂的表态。日前在接受电视访谈时，石破茂说：“日本首相访问中国是极为重要的事。,https://toutiao.com/group/7455091815717388850/,,0,0,False
演员星星被曝在泰缅边境失联，演员徐大久称其“已进入园区头发都剃了，确认在妙瓦底”！我驻清迈总领事馆回应,2025-01-06 04:25,842,1340,极目新闻,极目新闻,1月6日，微博话题演员星星（王星）在泰缅边境失联冲上热搜第一，引发网友关注。据多家媒体报道，微博账号“失眠爹地”5日深夜发文，自称“嘉嘉”，其男友“星星”是一名演员，日前赴泰国拍戏，在北京时间1月3日中午于泰缅边境失联，距离最后一次发消息已经超过60个小时。,http://jms.ctdsb.net/jmythshare/#/index_share?cId=0&contentType=5&contentId=2345618,,0,0,False
女市长爱上小男友，俩人爱的轰轰烈烈，让女市长感到害怕,2024-12-18 08:13,2917,510,乐视经典热综回放,乐视经典热综回放,,https://toutiao.com/group/7449661362671714850/,,0,0,True
苦口婆心！央视四天内就解禁烟花爆竹连续发声，重点提不要一刀切,2025-01-02 04:38,294,379,8卦娱,8卦娱,2024年已经过去了，不过在跨年夜当晚，很多网友都在分享自己跨年的同时，也有很多人认为已经缺少了很多年味儿了。,https://toutiao.com/group/7455172411600781858/,,0,0,False
不得不说，韩国再次创造了历史,2025-01-04 02:18,6331,672,牛弹琴,牛弹琴,未来三天，韩国不排除更有大戏上演,https://toutiao.com/group/7455879046824460854/,,0,0,True
厨师长教你：“羊肉汤”汤质优美，营养丰富；不膻不腥，味道鲜美,2024-11-21 02:57,6913,805,美食作家王刚,美食作家王刚,厨师长教你：“羊肉汤”汤质优美，营养丰富；不膻不腥，味道鲜美,https://toutiao.com/group/7439561371424915994/,,0,0,True
厨师长教你：“葱爆羊肉”羊肉滑嫩、鲜香不膻,2024-12-27 07:34,3885,715,美食作家王刚,美食作家王刚,厨师长教你：“葱爆羊肉”羊肉滑嫩、鲜香不膻,https://toutiao.com/group/7452991735665263139/,,0,0,True
不吹不贬，中国“神秘战机”究竟是多重的砝码？,2025-01-03 13:30,1605,479,胡锡进,胡锡进,被广泛猜测的中国“第六代战机”以及隐身无人机相继亮相，如果都如专业人士分析的那样，我认为它们会重新定义亚洲和西太平洋的天空，它们甚至预示了美军在军事科技方面绝对优势时代正在走向终结。《华盛顿邮报》是这样写的：中国的先进飞机令分析人士感到意外。,https://toutiao.com/group/7455680403169378825/,,0,0,False
新婚33天卷走274万4套房，出逃后丈夫跨国追捕，如今下场大快人心,2024-12-20 22:06,5374,270,八号探秘人,八号探秘人,在阅读此文之前，辛苦您点击一下“关注”，既方便您进行讨论和分享，又能给您带来不一样的参与感，感谢您的支持！编辑丨QQ·B“色字头上一把刀！”深圳富豪结婚33天竟被卷走274万元和名下4套房产。不仅如此，他还被扣上了“接盘侠”的帽子，啥也没干喜当爹。,https://toutiao.com/group/7450399558821052982/,,0,0,False
千万别上当！美国著名智囊学者提醒美军：歼-36是中国式“圈套”,2024-12-31 07:24,8629,3034,高峰军事观察,高峰军事观察,虽然B-21还没有量产服役，但是一个流传出来的美军B-21战略打击中队的“臂章”，透露出美国空军的“野心”。,https://toutiao.com/group/7454461747441779200/,,0,0,False
拜登下台前搅动南海风云，美菲连手挑衅中国，中国不再忍强硬回击,2025-01-03 03:44,22510,962,邱毅台湾,邱毅台湾,,https://toutiao.com/group/7455530031461171753/,,0,0,True
职工按月领取基本养老金最低缴费年限 从2030年起 由15年逐步提高至20年,2025-01-01 11:12,13587,365,看看新闻,看看新闻,职工按月领取基本养老金最低缴费年限 从2030年起 由15年逐步提高至20年,http://mediaplay.kksmg.com/2025/01/01/h264_720p_600k_79569-smgnews-20250101182000-3900-976086-600k_mp4.mp4,,0,0,True
被千万人吐槽的“蠢设计”，得知正确用法后，蠢得原来是我自己！,2024-12-11 03:04,748,239,睿之悦,睿之悦,文|睿之悦编辑|睿之悦“难以拆开的米面袋子”，“五孔插座往往只能插一个……”在生活中，总有一些物品的使用在无形之中给很多人带来了麻烦。但其实这些物品不是不好用，而是我们没能够找到它们正确的使用方法。那么，这些物品都是什么呢？而它们的正确用法又是怎样的呢？,https://toutiao.com/group/7446982751296832000/,,0,0,False
中国小伙缅甸边境旅游，在离园区100米附近参观，被对岸的人盯上,2025-01-01 09:48,1092,232,桑代克的猹,桑代克的猹,“缅甸园区离泰国边境仅一河之隔，如今竟还有人偷渡”12月27号旅游博主张张在自媒体账号上发布了自己在泰国旅游的危险经历，看的手机这头的网友都为他捏了一把汗。因为视频中他正站在离缅甸园区仅一河之隔的泰国边境，河的对面就是缅甸妙瓦底。,https://toutiao.com/group/7454877418117923339/,,0,0,False
重大突破！新发现超2000万吨！,2025-01-06 01:04,1056,240,每日经济新闻,每日经济新闻,每经编辑：毕陆名据央视新闻6日报道，记者从自然资源部中国地质调查局获悉，我国在青藏高原取得找矿重大突破，新发现铜矿资源量2000余万吨。据介绍，在青藏高原形成了玉龙、多龙、巨龙－甲玛和雄村-朱诺四个千万吨级的铜矿资源基地，预测资源潜力达1.,http://www.nbd.com.cn/rss/jinri_toutiao/articles/3710495.html,,0,0,False
贪官酒桌上的权钱交易，语言天衣无缝，听懂三分都是人精！,2024-11-23 16:24,4214,499,乐视扒剧小妹儿,乐视扒剧小妹儿,,https://toutiao.com/group/7440378916130259496/,,0,0,True
830买36斤海鲜，做麻辣香锅堆成山，20多人海鲜当饭吃，真爽,2025-01-02 10:00,5098,887,阿胖山,阿胖山,830买36斤海鲜，做麻辣香锅堆成山，20多人海鲜当饭吃，真爽,https://toutiao.com/group/7455158446430618149/,,0,0,True
海南富商张晖：花8亿建108米海上观音像，4年后死在水中死因成谜,2024-10-19 04:49,5176,910,八号探秘人,八号探秘人,在阅读此文之前，辛苦您点击一下“关注”，既方便您进行讨论和分享，又能给您带来不一样的参与感，感谢您的支持！编辑丨xk他是中国的一名富商，耗费8亿元完成了自己的梦想。可梦想落地成为现实的时候，他却在4年后莫名其妙的死去。他就是张晖，上个世纪末海南岛旅游业的龙头当家人。,https://toutiao.com/group/7427288913095492134/,,0,0,False
给近三年最好的10部年代剧排个名：《人世间》第6，第1名没有争议,2024-10-28 07:10,3336,1603,稻述,稻述,到了20世纪初，偶像剧成为人们的掌中宝，但要说现在什么剧最受欢迎，那一定是年代剧!其中《人世间》只能排第六，第一名人人都爱看，最后一名也比上不足比下有余。,https://toutiao.com/group/7430715494055264783/,,0,0,False
“喝酒三巨头”：一年全没，有的去世当天喝4瓶白酒，都不满36岁,2024-11-05 10:32,3222,1719,睿之悦,睿之悦,他们的每一次出现都离不开酒，也曾是很多人眼中的“酒中豪杰”。但“小酌怡情，大饮伤身”，这三位博主以生命为代价，再一次给大家带来了警醒。,https://toutiao.com/group/7433739040179520038/,,0,0,False
年仅47岁：我国无人机专家张代兵去世，网传因公司债务压力而跳楼,2025-01-06 11:48,359,369,观察者网,观察者网,1月6日消息，近日，一则讣告在无人机行业内传开：我国无人机领域的专家，原国防科技大学无人系统研究所副所长，长沙市云智航科技有限公司创始人与董事长，于2025年1月3日，在长沙不幸离世，享年47岁。,https://www.guancha.cn/economy/2025_01_06_761252.shtml,,0,0,False
清华才女李一诺：27岁博士毕业，4年生3娃，能替世界首富花钱,2024-12-18 05:51,8725,405,云莳一,云莳一,家庭是她第一个学校，妈妈是她第一任老师。李一诺27岁博士毕业进入美国麦肯锡公司，33岁成为公司全球董事合伙人，之后四年连生3娃。,https://toutiao.com/group/7449591069311779355/,,0,0,False
突发讣告！他在工作岗位不幸牺牲，终年40岁,2025-01-06 02:32,2660,974,红星新闻,红星新闻,1月6日，北京平谷消防发布讣告，全文如下。讣 告李子斌，男，汉族，1984年12月出生，山西省忻州市代县人。2007年6月入伍，生前系平谷区消防救援支队后勤装备科初级专业技术职务（专业技术九级），专业技术三级指挥长消防救援衔。,https://toutiao.com/group/7456624284509667851/,,0,0,False
男人怀疑自己有病，女友亲自上阵，一晚上给治好了,2025-01-04 02:03,1592,511,南瓜热剧回放,南瓜热剧回放,,https://toutiao.com/group/7455875274023666186/,,0,0,True
货车碰撞出殡人群致20死19伤，事故整改评估报告发布,2025-01-06 03:29,1772,745,上观新闻,上观新闻,江西省应急管理厅2025年1月3日发布《江西南昌“1·8”重大道路交通事故整改和防范措施落实情况评估报告》（下称《整改评估报告》）。该报告公布了当地主要整改措施和工作成效，其中包括安全生产专项整治、道路交通安全专项整治、强化企业监管、加大治超力度等、规范殡葬活动、强化宣传教育等。,https://export.shobserver.com/toutiao/html/839831.html,,0,1,False
河南警察3岁女儿被拐，苦寻全国23年无果，结果却发现女儿在对门,2024-11-05 07:43,6318,681,八号探秘人,八号探秘人,寻亲23年无果，丢失的女儿竟住在对门?但它却真实发生在河南洛阳的梁绍波身上。是意外走丢，还是人贩子所为，三岁的女儿怎会离奇失踪?,https://toutiao.com/group/7433697108120142345/,,0,0,False
中国外交部新任发言人郭嘉昆亮相,2025-01-06 07:05,12311,4709,央视新闻,央视新闻,中国外交部新任发言人郭嘉昆今天（1月6日）正式主持外交部例行记者会，成为外交部第35任发言人。外交部自1983年建立新闻发言人制度，是最早设立固定新闻发布机制的中国政府部委之一。（总台央视记者 黄惠馨 赵超逸）©2025中央广播电视总台版权所有。未经许可，请勿转载使用。,https://content-static.cctvnews.cctv.com/snow-book/index.html?channelId=1119&item_id=1365001468722236405&share_to=wechat&source=50006&sub_source=50006_001&toc_style_id=feeds_default&track_id=5c499186-cd0a-4db9-8612-885d6f406834,,0,0,False
沈春阳笑死个人，满口胡说八道，小沈阳气得说不出话,2024-12-28 16:52,4902,771,乐视影视圈,乐视影视圈,,https://toutiao.com/group/7453290317240861199/,,0,0,True
刀郎北京演唱会最后10分钟：三首连唱，点燃爱国热情！,2024-12-31 14:37,28109,5490,哇事记,哇事记,,https://toutiao.com/group/7454585113318261288/,,0,0,True
迈合村为留住全红婵的根，决定提供宅基地,2025-01-06 06:23,922,287,小茶分享,小茶分享,,https://toutiao.com/group/7456684300114362931/,,0,0,True
