title,publish_time,like_count,comment_count,media_name,source,abstract,article_url,tag,is_yaowen,article_sub_type,has_video
穷小伙找富婆借钱买房子，富婆直接答应，却提出条件,2025-01-07 03:09,3776,698,南瓜热剧回放,南瓜热剧回放,,https://toutiao.com/group/7457005446646202916/,,0,0,True
年轻小伙出轨60岁老太，妻子当场崩溃…,2025-02-04 23:50,4877,1045,温暖剧情,温暖剧情,,https://toutiao.com/group/7467715297085112886/,,0,0,True
陈数很少演小品，但演了就是经典，跟黄宏这个小品演的太好,2025-01-16 19:07,8236,219,谁是卧底影社剧院,谁是卧底影社剧院,,https://toutiao.com/group/7460406377236726287/,,0,0,True
喜事变乌龙，新郎尴尬走人,2025-02-02 06:00,44819,15147,蛀蟲,蛀蟲,,https://toutiao.com/group/7466697530655523343/,,0,0,True
这妈太狠了，一点不给女儿留面,2025-01-16 01:42,65138,5577,那一抹温柔,那一抹温柔,,https://toutiao.com/group/7460322606747632137/,,0,0,True
媳妇玩到半夜才回来，以为老公不在家，进门这操作把老公看懵了,2025-01-24 09:38,11309,3145,滕菲,滕菲,,https://toutiao.com/group/7463414214191743497/,,0,0,True
赵本山带上赵四赶紧下场吧，这部小品真是极品，观众都快笑分岔气,2024-12-13 03:50,6101,1366,my彩虹分享,my彩虹分享,,https://toutiao.com/group/7447738864753443378/,,0,0,True
假装去上班，然后偷偷回家，看媳妇一个人在家干啥？结果尴尬了,2025-01-08 00:05,4239,1011,艳姐的生活记,艳姐的生活记,,https://toutiao.com/group/7457329057584939558/,,0,0,True
婆婆瞧不起农村儿媳，如今一看孙女乐坏了，赶紧接回豪宅,2025-01-28 16:00,3613,887,科幻物语剧院,科幻物语剧院,,https://toutiao.com/group/7462680837016781350/,,0,0,True
这一刻娶到这样的老婆，多少彩礼都值了，男的面子老婆给足了,2025-02-11 05:12,1241,144,不怕狼的洋,不怕狼的洋,,https://toutiao.com/group/7470025004021776947/,,0,0,True
