title,publish_time,like_count,comment_count,media_name,source,abstract,article_url,tag,is_yaowen,article_sub_type,has_video
今天才知道！电动车“每天充”和“用完再充”，到底哪个更伤电池,2024-08-27 11:19,3771,844,鲸探所,鲸探所,“今天到底给车充不充电？”估计大多数人每天回家都会想这个问题，看着自己的电动车电量又多又少的，充不充电也是一件非常难以抉择的事情。那么，电动车到底应该怎样充电呢？是每天都充，还是用完之后再充呢？电动车充电不管是在城市还是农村，电动车其实都是人们出门最常见的交通工具。,https://toutiao.com/group/7407773012533117475/,,0,0,False
给近三年最好的10部年代剧排个名：《人世间》第6，第1名没有争议,2024-09-06 08:08,1019,346,皮皮电影,皮皮电影,时尚是个轮回，电视剧也是。在2020年之前的那些年，电视剧市场基本上都被偶像剧、都市剧霸占。曾经撑起国剧品质的《闯关东》《岁月》这类年代好剧，难见踪影。,https://toutiao.com/group/7411390030722712090/,,0,0,False
万万没想到！35岁杨颖兜兜转转干回“老本行”，成了内娱最大笑话,2024-09-18 08:30,423,174,豆莱说,豆莱说,有的人逆风翻盘，有的人一手好牌却打的稀烂，35岁的杨颖属于后者。曾经的她只是一个嫩模，出道后签约了日本的经纪公司，成为了他们的专属模特，可是她却硬生生的挤进来娱乐圈，开始在各个影视剧中做客串。,https://toutiao.com/group/7415889298743935498/,,0,0,False
反超华为、阿里！中国第一大民企诞生，营收破1万亿，员工超60万,2024-09-18 08:47,1121,704,云舟史策,云舟史策,刘强东白手起家的神话迎来新纪录！2024年财富世界500强企业中，京东一举成为中国第一大民间企业。而排在京东前面的15家中国公司，全是传统的能源，工程国企和银行。唯一的高科技企业鸿海精密，则是台湾省的富士康母公司。其中阿里巴巴排名全世界第70名，恒力集团排名81，华为排名103。,https://toutiao.com/group/7415861358157120037/,,0,0,False
离婚2年多，46岁黄晓明官宣与叶珂在一起，女方比心回应，此前称“黄晓明没结婚”莫名其妙,2024-09-19 06:49,654,746,九派新闻,九派新闻,近日，网传称，黄晓明与叶珂疑似结婚。19日，黄晓明发文称，抱歉占用公共资源，大家别猜啦，我们在一起了。对此，叶珂比心回应。此前，叶珂发文：#黄晓明 没结婚#，有点莫名其妙了。并配上聊天记录，截图显示，有人称台媒在造谣，黄晓明表示同意。,https://toutiao.com/group/7416242170878853684/,,0,0,False
5座车拉6个人被判超员，车主1句话把交警问懵,2024-08-05 20:20,9713,2310,奇妙钢笔pA8JyP,奇妙钢笔pA8JyP,,https://toutiao.com/group/7399752843772559906/,,0,0,True
姑娘远嫁山东十年未回家，带着孩子偷偷回娘家，到家眼前一幕哭了,2024-09-09 08:25,17398,7806,小乔家里的事,小乔家里的事,,https://toutiao.com/group/7412556561718968870/,,0,0,True
曹德旺说：我不会逃跑，但要给政府提个醒 #曹德旺 #福耀科技大学,2024-06-28 06:51,25296,3463,正直鲸鱼LxhXfoC,正直鲸鱼LxhXfoC,,https://toutiao.com/group/7385443277144588834/,,0,0,True
新娘发现新郎是蜈蚣男，立马取消婚约 ，你知道啥叫蜈蚣男吗？,2024-09-14 08:12,1035,219,远见卓识敏敏,远见卓识敏敏,,https://toutiao.com/group/7414408758995976714/,,0,0,True
美国已经确定降息了，万亿美元将进入中国，但他们绝不可能甘心,2024-09-13 22:00,990,103,迷彩虎说,迷彩虎说,当然，我们都知道，美国现在的加息已经走到了尽头，不可能再加了，再加美国经济就要崩盘了，但是我之前分析过，美国现在面对高美息带来的经济风险，还有两条路能走，除了降息之外，还有一条路就是通过大规模战争转嫁金融风险。,https://toutiao.com/group/7413958913781170729/,,0,0,False
时隔27年找初恋，他若单身我愿嫁他，相见两人泪流满面,2024-08-02 04:56,22955,3664,彤儿说事,彤儿说事,,https://toutiao.com/group/7398401586776506906/,,0,0,True
为什么说从2025年开始，70岁以上的老人，可能面临“两大”问题？,2024-09-01 14:12,2092,266,水大叔,水大叔,据可靠数据了解，我国70岁以上的人口数量已经达到了2.5亿人次，占到全国总人口数量的18%。伴随着人口老龄化的出现，养老问题也成了重中之重，要知道养老不仅仅是家庭的责任，更是社会责任。,https://toutiao.com/group/7409677025897710106/,,0,0,False
魏启颖：女儿赵薇被封杀后，丈夫也去世，儿子离婚被分一半财产,2024-08-12 15:57,758,230,吃瓜崽崽,吃瓜崽崽,女儿被封杀，儿子感情突发变故，曾经风光无限的赵家荡然无存。她喜欢音乐，想当音乐老师，父母也大力支持，从不会横加干涉。,https://toutiao.com/group/7402251567493333519/,,0,0,False
恭喜中国女篮新领袖终于出现了！百发百中！统治力让对手深深绝望,2024-06-25 07:11,24367,1324,乐播体育,乐播体育,,https://toutiao.com/group/7384335028576059923/,,0,0,True
中国🇨🇳人民的好总理,2024-09-03 15:46,143968,16829,话说,话说,这个老人一生只做一件事，那就是为了人民鞠躬尽瘁，死而后已,https://toutiao.com/group/7410443709928210955/,,0,0,True
中国海军三艘航母同时出海，史无前例的一幕，让美国很担忧,2024-09-19 01:35,934,120,第一军情,第一军情,有细心的网友发现，日前西太平洋上出现了史无前例的一幕:中国海军的三艘航母，同时出海了。根据对岸和日本方面的消息，中国海军“辽宁舰”航母编队，日前穿越了日控与那国岛与台岛之间的水域，一度进入日本毗邻海域，随后进入了西太平洋。,https://toutiao.com/group/7416161552887235082/,,0,0,False
陈若琳把全红婵养得是真好啊,2024-08-07 03:21,2758,180,中工网,中工网,<p style='text-indent: 2em;'>原标题：陈若琳把全红婵养得是真好啊</p><p style='text-indent: 2em;'>昨晚，巴黎奥运会女子10米跳台跳水决赛，全红婵夺得金牌！赛后采访，她说，我不是你们所说的天才，都是练的，一遍一遍地练。教练陈若琳见证了全红婵的努力与刻苦。@陈若琳sunny@全红婵这对被称为“王炸”组合的师徒，在奥运赛场上都有过非常亮眼的表现。为帮全红婵突破发育关，陈若琳下了不少功夫。每天七八个小时的训练，恨不得将全红婵“拴在裤腰带上”严密看管。执教能力虽受过质疑，但她从不回避，而是找出问题，各个击破。她说：“我走过的弯路，不想让全红婵再走一遍。”中国队加油！（央视）</p>,http://db.workercn.cn/media/2024/08/07/64B10057EEF44DC3904C945F112F757A/preview.mp4,,0,0,True
泪奔！藏族盲童动情演唱《绿度母心咒》，天籁之音太治愈了！,2024-07-18 12:14,78545,9207,妙曲西瓜湾,妙曲西瓜湾,,https://toutiao.com/group/7392948036525097481/,,0,0,True
147票压过3票，欧洲通过涉台议案，不许两岸统一，蒋万安突然离岛,2024-09-13 09:45,4181,2700,凤凰卫视金亮,凤凰卫视金亮,美欧联合阻挡中国统一，蒋万安演讲提及“一个中华”，新加坡对台发出警告，岛内表明战争担忧，美方要颠覆战后秩序吗?,https://toutiao.com/group/7414061277322838564/,,0,0,False
任素汐：导演因为省钱找她唱主题曲，结果她要砸了所有歌手的饭碗,2024-08-29 01:22,28240,4816,被风吹过的夏天,被风吹过的夏天,,https://toutiao.com/group/7408365605805359670/,,0,0,True
