title,publish_time,like_count,comment_count,media_name,source,abstract,article_url,tag,is_yaowen,article_sub_type,has_video
现场航拍！八月十八钱塘看涌潮“江面似山崩地裂、涌起千座雪峰”,2024-09-20 07:59,1821,128,海客新闻,海客新闻,现场航拍！八月十八钱塘看涌潮“江面似山崩地裂、涌起千座雪峰”,https://toutiao.com/group/7416631860521861667/,,0,0,True
2013年，湖南26岁女孩嫁给71岁老头，婚后还生下一子，如今怎样了,2024-07-12 11:59,22139,2229,智史通鉴,智史通鉴,2013年4月17日，长沙宁乡县的民政局迎来了一对特殊的夫妻。一个71岁的老头和一个26岁的女孩，离远了看，甚至像爷爷和孙女。面对工作人员异样的眼光，女孩说：“我和他是真心相爱的！”这让人好奇，这对相差45岁的夫妻，他们之间到底有着怎样的爱情故事？,https://toutiao.com/group/7390696631223534120/,,0,0,False
魏启颖：女儿赵薇被封杀后，丈夫也去世，儿子离婚被分一半财产,2024-08-12 15:57,760,230,吃瓜崽崽,吃瓜崽崽,女儿被封杀，儿子感情突发变故，曾经风光无限的赵家荡然无存。她喜欢音乐，想当音乐老师，父母也大力支持，从不会横加干涉。,https://toutiao.com/group/7402251567493333519/,,0,0,False
温铁军：形势非常严峻，战争随时可能爆发！〔上〕,2024-09-18 08:03,3563,498,无忧的布丁,无忧的布丁,,https://toutiao.com/group/7415890813118480906/,,0,0,True
蛋仔派对：评论区随机挑战？用“那咋了”跟秀儿说话，粉丝真狠呀,2024-08-12 09:48,1214,240,游小浪Game,游小浪Game,,https://toutiao.com/group/7402187581716988456/,,0,0,True
相约北京文化论坛｜雅克·马拉泰尔：我所感受到的中华文明，令我真的很乐意去探索它,2024-09-15 23:43,25279,578,北京日报客户端,北京日报客户端,,https://rss2.bjd.com.cn/content/s66e770b8e4b01a5d71c8c00d.html,,0,0,True
涉重大刑事案件！内蒙古警方悬赏5万元：24岁男子潜逃时穿迷彩鞋，携带望远镜，左侧颧骨有一颗黑痣,2024-09-20 09:28,131,119,九派新闻,九派新闻,9月20日，平安乌兰察布发布一则《悬赏通告》：卓资县公安局正在侦办一起重大刑事案件，经查，何玉龙有重大作案嫌疑，于2024年9月18日潜逃。,https://toutiao.com/group/7416653349476499968/,,0,0,False
蛋仔派对：飞机规则怪谈？如果你误入诡异航班 ，请遵守以下规则,2024-07-04 08:36,3614,163,辉哥游戏解说,辉哥游戏解说,,https://toutiao.com/group/7387696668101050932/,,0,0,True
河南叶县强拆果园为高速让路，当地成立联合调查组，果园负责人发声,2024-09-20 03:20,420,755,极目新闻,极目新闻,极目新闻记者 詹钘近日有媒体报道，在河南叶县，当地政府为修建高速公路征地，在未能达成赔偿协议的条件下对一家果园进行了强拆。19日，果园负责人贾先生接受极目新闻记者采访时表示，他不认同政府定的赔偿金额依据，因为与其实际损失差距太大。当地政府则回应称，对此事会进行积极沟通和协调。,http://jms.ctdsb.net/jmythshare/#/index_share?cId=0&contentType=5&contentId=2259207,,0,0,False
她认干爹改国籍，曾叫嚣要击败女国乒，却在巴黎奥运会丢尽了脸,2024-08-26 14:00,467,302,吃瓜崽崽,吃瓜崽崽,她曾是中国国籍，却因认干爹入韩籍。十九岁的她被国人认为是乒坛叛徒，还曾叫嚣女国乒。如今却成为了韩国乒乓一姐。,https://toutiao.com/group/7407375792933044790/,,0,0,False
董卿父亲董善祥：我这辈子最后悔的事，就是让宝贝女儿嫁给密春雷,2024-09-11 06:59,1323,148,稻述,稻述,提起央视主持，现在挑大梁的几乎就是撒贝宁、尼格买提、龙洋等人了，他们也都非常优秀，但常有人怀念起董卿还在的日子。,https://toutiao.com/group/7413267526601228852/,,0,0,False
蛋仔派对：秀儿耍酒疯，到处撒蛋币？可把我急坏了！,2024-07-07 01:34,1515,176,游小浪Game,游小浪Game,,https://toutiao.com/group/7388701183105303067/,,0,0,True
时隔27年找初恋，他若单身我愿嫁他，相见两人泪流满面,2024-08-02 04:56,23555,3712,彤儿说事,彤儿说事,,https://toutiao.com/group/7398401586776506906/,,0,0,True
5座车拉6个人被判超员，车主1句话把交警问懵,2024-08-05 20:20,10464,2475,奇妙钢笔pA8JyP,奇妙钢笔pA8JyP,,https://toutiao.com/group/7399752843772559906/,,0,0,True
张紫妍：被迫陪睡31人近百次，遭道具虐待，29岁自杀留230页遗书,2024-07-24 02:37,11577,788,八号探秘人,八号探秘人,在阅读此文之前，辛苦您点击一下“关注”，既方便您进行讨论和分享，又能给您带来不一样的参与感，感谢您的支持！本文叙述皆有官方信源，为了读者有更好体验，放在了文章后缀！,https://toutiao.com/group/7394994383675736576/,,0,0,False
关键时刻，普京做了一个重大决定,2024-09-17 10:00,2498,138,牛弹琴,牛弹琴,普京下了大决心，又增加俄军18万,https://toutiao.com/group/7415549733680185890/,,0,0,True
苹果手机突发！微信整个都废了？最新回应↗,2024-09-20 09:12,534,713,北青网,北青网,"昨天（9月19日）开始有用户在社交平台上反映📱自己的iPhone 14 Pro Max更新了苹果iOS18系统后点开微信公众号遭遇闪退问题""整个公众号都废了，怎么操作都闪退，目前已经尝试了多种方法""。",http://t.ynet.cn/h5/35849709.html,,0,0,False
恭喜中国女篮新领袖终于出现了！百发百中！统治力让对手深深绝望,2024-06-25 07:11,24562,1335,乐播体育,乐播体育,,https://toutiao.com/group/7384335028576059923/,,0,0,True
姑娘远嫁山东十年未回家，带着孩子偷偷回娘家，到家眼前一幕哭了,2024-09-09 08:25,19005,8282,小乔家里的事,小乔家里的事,,https://toutiao.com/group/7412556561718968870/,,0,0,True
干部发现山头长得像毛主席，孔令华初见落泪，李讷感叹：太像了,2024-07-20 07:50,6304,1177,孔甲丙,孔甲丙,本文内容均引用权威资料进行撰写，文末已标注文献来源及截图，请知悉。随着观察角度的变化，那块岩石似乎越发展现出了毛主席的面部特征:高高的前额、深邃的眼眶以及宽阔的鼻梁。,https://toutiao.com/group/7393622033382277686/,,0,0,False
军号一响，全军出击！,2024-09-19 08:01,7754,494,中国军号,中国军号,,https://toutiao.com/group/7416261401477382668/,,0,0,True
为什么说从2025年开始，70岁以上的老人，可能面临“两大”问题？,2024-09-01 14:12,2107,267,水大叔,水大叔,据可靠数据了解，我国70岁以上的人口数量已经达到了2.5亿人次，占到全国总人口数量的18%。伴随着人口老龄化的出现，养老问题也成了重中之重，要知道养老不仅仅是家庭的责任，更是社会责任。,https://toutiao.com/group/7409677025897710106/,,0,0,False
