title,publish_time,like_count,comment_count,media_name,source,abstract,article_url,tag,is_yaowen,article_sub_type,has_video
14年儿子坐马航失联，多年后父亲收到回信，坚信儿子去了平行世界,2025-02-20 02:38,8003,749,谛听骨语,谛听骨语,MH370失联的第10年，马来西亚政府宣布在2024年12月20日重启寻找马航MH370的项目。如果后续进展顺利的话，马航MH370会在2025年的1月到4月期间重新展开全面地搜寻。凭空消失的客机，有希望被揭露的失踪真相，这一切都是让人充满了期待。,https://toutiao.com/group/7473322554179895817/,,0,0,False
一妻二夫的女人太难了,2024-12-20 21:38,15183,175,杨杨娱乐,杨杨娱乐,,https://toutiao.com/group/7450611568212967988/,,0,0,True
大蒜立大功？浙大研究发现：大蒜可在36小时清除70%有害菌群？,2025-03-05 05:44,8611,628,开视观天下,开视观天下,在中国，它的种植历史更是源远流长，古代先辈们早早发现了它在烹饪与药用上的价值，让大蒜开启了在中华大地漫长的 “建功立业” 之旅。,https://toutiao.com/group/7478196926505107980/,,0,0,False
天呐！打麻将的热乎劲还没过，人却突然没了，究竟咋回事,2025-03-03 06:42,5181,2788,梓萱分享,梓萱分享,,https://toutiao.com/group/7477470011406221863/,,0,0,True
中俄为何要站在一起，李显龙一语道破，我们还会遇到美国霸权,2025-03-04 16:52,34497,1534,孙绪闻,孙绪闻,中俄为何要站在一起，李显龙一语道破，我们还会遇到美国霸权,https://toutiao.com/group/7477998067472482828/,,0,0,True
又疯了一个☝,2025-03-05 03:11,3904,1951,花猫爱趣事,花猫爱趣事,,https://toutiao.com/group/7478157683036619301/,,0,0,True
乌克兰首都基辅现状，拍摄于2025年3月3日，看看街上还有多少男人,2025-03-03 01:01,17567,7021,王哥说事,王哥说事,,https://toutiao.com/group/7477381859442229801/,,0,0,True
小品：暴躁丈母娘太可怕，句句扎心，评委已笑抽！,2025-02-13 07:17,4474,167,娱圈万事通,娱圈万事通,,https://toutiao.com/group/7470799235462480384/,,0,0,True
