title,publish_time,like_count,comment_count,media_name,source,abstract,article_url,tag,is_yaowen,article_sub_type,has_video
这就是胡蝶戴笠的真实的样貌，并非演员扮演，货真价实的罕见照片,2025-04-01 09:37,8304,1032,大壮实验室,大壮实验室,不过今天的这一组罕见的照片，没有演员的演绎，纯粹是历史的真实定格，将我们真真切切地将我们拉回那个动荡又迷人的年代。照片中的胡蝶，面容姣好，眼神灵动，温婉的气质中透着东方女性独有的韵味，每一寸肌肤都诉说着风华绝代。,https://toutiao.com/group/7488242839579542042/,,0,0,False
路人偶遇46岁刘涛，真实状态曝光，快来围观！,2025-04-03 09:51,3946,1212,淡定风铃Lda077x,淡定风铃Lda077x,,https://toutiao.com/group/7489022202907329051/,,0,0,False
扫墓失火，瞬间火势就控制不住，现场车辆都被烧没了！,2025-04-06 04:01,1284,580,醉墨斋jrtt2021,醉墨斋jrtt2021,,https://toutiao.com/group/7490045379333849610/,,0,0,True
巴拿马事件圆满收官，航运安全直接拉满。,2025-04-06 03:06,5407,235,优雅溪流,优雅溪流,,https://toutiao.com/group/7490031183472951847/,,0,0,True
缅甸地方武装到底有多豪横，让我们看看这段视频就知道了，,2025-04-04 18:30,6458,1090,小团团圆圆,小团团圆圆,,https://toutiao.com/group/7489526767607104035/,,0,0,True
韩国宪法法庭有结果了！尹锡悦被罢免下台，李在明时代即将登场？,2025-04-05 04:16,11813,325,邱毅台湾,邱毅台湾,,https://toutiao.com/group/7489647268220486180/,,0,0,True
