title,publish_time,like_count,comment_count,media_name,source,abstract,article_url,tag,is_yaowen,article_sub_type,has_video
万万没想到，35岁杨颖兜兜转转干回“老本行”，活成内娱最大笑话,2024-09-06 07:55,535,137,读万卷书的张飞,读万卷书的张飞,文l张飞编辑l张飞曾经你看不起别人；如今谁又瞧得上你？在节目中丝毫不考虑他人状态，一味地只追求自己的镜头。甚至还在采访中公然表示“自己早就应该把所有奖拿了个遍了”。更关键的是丝毫没有任何“报恩”之心。所以如今曾经所有的“嚣张”“高高在上”遭到反噬，只能说现在谁还“愿意”认识她！,https://toutiao.com/group/7411434661014012456/,,0,0,False
善恶终有报！疫情时对中国一毛不拔，却大方捐美国6亿，现状如何,2024-10-06 06:09,710,146,昕昕局,昕昕局,SOHO中国的董事长潘石屹和其夫人张欣，在2014年向哈佛大学捐赠了1500万美元，这还不算什么，潘石屹的基金会甚至还计划要捐赠1亿美元!,https://toutiao.com/group/7422540167589708288/,,0,0,False
疯狂的以色列，已经不听美国招呼，美国或赌上国运 #以伊最新局势,2024-10-06 03:09,1855,157,利刃,利刃,,https://toutiao.com/group/7422494474594419211/,,0,0,True
4年骑行结束，1500天终于回到老家，感谢大家一路陪伴有缘江湖见,2024-09-07 03:50,73691,16730,刘伟元的旅行,刘伟元的旅行,4年骑行结束，1500天终于回到老家，感谢大家一路陪伴有缘江湖见！,https://toutiao.com/group/7411715839100977716/,,0,0,True
她是央视最惨主持人，男友被判死缓，丈夫诈骗入狱，47岁无人敢娶,2024-08-27 23:30,2188,207,闻书识焉,闻书识焉,她曾是央视的台柱子，和董卿、周涛并称为央视的三朵金花。回顾刘芳菲的前半生，最令人感到惋惜的，便是她的感情生活，47岁至今无人敢娶。,https://toutiao.com/group/7407743113688564258/,,0,0,False
主动归还中国领土背后的大阴谋，此国行为被识破，中国直接拒绝,2024-10-06 10:56,3793,116,海阔天空,海阔天空,,https://toutiao.com/group/7422529068957958668/,,0,0,True
5年前站在美国军舰上，用中文警告我国海军的华人女兵，现在如何,2024-10-06 09:06,1514,203,陈志华观天下,陈志华观天下,2019年，华裔女兵郑浩儿站在一艘美国军舰上，用一口标准的中文喊话威胁中国海军:“我们只是正常巡视，再往前一步，我们不介意发动战争!”,https://toutiao.com/group/7422585983588024883/,,0,0,False
唐一军、窦万贵、张平被“双开”，杜梓被开除党籍,2024-10-07 09:10,3376,3311,界面快讯,界面快讯,中央纪委国家监委网站10月7日通报，经中共中央批准，中央纪委国家监委对江西省政协原党组书记、主席唐一军严重违纪违法问题进行了立案审查调查。,https://toutiao.com/group/7422957782632038921/,,0,0,False
女排名将王梦洁今天上午举行婚礼，郎平和多位女排队员参加,2024-10-07 04:06,507,208,直播吧,直播吧,直播吧10月7日讯 据《北京日报》，今天上午，中国女排名将王梦洁与国家男排助教、北京汽车女排助教牛思嘉的婚礼在北京法式花园宴会中心举行。前中国女排主教练郎平，昔日国手魏秋月、惠若琪、沈静思、林莉、刘晓彤、曾春蕾等，以及现役国手李盈莹、张常宁等来到现场庆贺。,https://news.zhibo8.com/other/2024-10-07/67035d7e25173native.htm,,0,0,False
他和6个老婆共处一室，每人每月7万零花钱，71岁又娶了20岁小娇妻,2024-10-05 09:31,306,102,书生talk,书生talk,在我国建国之后，对于婚姻制度就是一夫一妻制度，至今也没有改变，在这么多年之内，也有专家建议取消一夫一妻的制度，以此来增加生育率，但是这样的提议也是遭到了众多人的反对，所以也没有执行。,https://toutiao.com/group/7422221676558959104/,,0,0,False
东风41恐惧症在欧美蔓延：外媒坚定认为，先进导弹绝非东风31AG,2024-10-01 14:26,4873,867,南友汇,南友汇,日前以英国《金融时报》，美国《华盛顿时报》为首的欧美国家媒体撰文称，解放军本次试射的洲际导弹绝非是东风31AG，而是解放军现役更先进的东风41洲际导弹。,https://toutiao.com/group/7420812639297520163/,,0,0,False
为国争光却遭郎平弃用！转身效力土耳其的王一梅，如今咋样了？,2024-08-31 13:19,935,142,豆莱说,豆莱说,光阴似箭，日月如梭，当初的少女早已退役，成为了排球场的幕后人，这么多年她都经历了什么，现在又怎么样了呢?,https://toutiao.com/group/7409287778514567718/,,0,0,False
2013年，湖南26岁女孩嫁给71岁老头，婚后还生下一子，如今怎样了,2024-07-12 11:59,27454,2458,智史通鉴,智史通鉴,2013年4月17日，长沙宁乡县的民政局迎来了一对特殊的夫妻。一个71岁的老头和一个26岁的女孩，离远了看，甚至像爷爷和孙女。面对工作人员异样的眼光，女孩说：“我和他是真心相爱的！”这让人好奇，这对相差45岁的夫妻，他们之间到底有着怎样的爱情故事？,https://toutiao.com/group/7390696631223534120/,,0,0,False
男子与女子在河中嬉戏玩耍，突然连续将女子的头按入水中,2024-09-26 04:40,1288,168,经视看天下,经视看天下,,https://toutiao.com/group/7418807108637819444/,,0,0,True
未婚妻控诉覃海洋：出轨甚至孕期出轨，聊骚，录亲密视频威胁我！,2024-10-07 06:56,2377,4685,直播吧,直播吧,本想着给你留点脸面，但是你的逃避态度实在让我觉得真真切切的爱错了人。相信你一次次的是我活该 从今天起不再替你遮掩任何问题 收拾任何残局 任何的事件求锤得锤 聊天记录 录音 一切证据我都有 你有任何觉得冤枉可以起诉我 我随时等候。,https://news.zhibo8.com/other/2024-10-07/67038527c32f2native.htm,,0,0,False
原来他才是毁掉刘翔真凶，因贪1200万被公审，让刘翔背负多年骂名,2024-08-29 09:58,8824,240,八号探秘人,八号探秘人,在田径场上创造的成绩，至今无人能够打破，甚至在国际上享有盛名。本该继续夺冠之路，却两次因伤退赛，遭到了全网辱骂。,https://toutiao.com/group/7408489498465616410/,,0,0,False
演员张瑜：离婚后单身30年，再见前夫仍感到心动，66岁没有子女,2024-07-24 10:51,17492,1236,八号探秘人,八号探秘人,在阅读此文之前，辛苦您点击一下“关注”，既方便您进行讨论和分享，又能给您带来不一样的参与感，感谢您的支持！写作不易，作者每天辛苦写稿，只是为了养家糊口，希望各位观众老爷可以多多理解。文中加入5秒广告解锁，观看5秒后便可免费阅读全文啦，感谢各位观众老爷的理解与支持！,https://toutiao.com/group/7395130917804720640/,,0,0,False
上山采蜜误闯蛇窝，20几条毒性不一，姑娘当场吓尿，头发竖起来了,2024-07-24 02:13,1822,231,兴凯湖莹莹,兴凯湖莹莹,,https://toutiao.com/group/7395019818291692032/,,0,0,True
写歌30年穷困潦倒，前妻失望选择离婚，谁料51岁靠一首歌一夜成名,2024-08-12 03:37,24985,4008,八号探秘人,八号探秘人,在阅读此文之前，辛苦您点击一下“关注”，既方便您进行讨论和分享，又能给您带来不一样的参与感，感谢您的支持！编辑：LY无数人都想要一个一夜成名的机会，但机会来了也不是每个人都能把握住的。他用了三十年的时间来准备迎接属于自己的机会。为了这个机会他放弃了一切，甚至包括家庭。,https://toutiao.com/group/7402090890367484428/,,0,0,False
全球约一半肝癌在中国，再次提醒：家中的4种食物，尽早撤下餐桌,2024-08-13 08:36,96022,3555,梁医学社梁怡璋医生,梁医学社梁怡璋医生,,https://toutiao.com/group/7402540119712629311/,,0,0,True
为什么说从2025年开始，70岁以上的老人，可能面临“两大”问题？,2024-09-01 14:12,2249,280,水大叔,水大叔,据可靠数据了解，我国70岁以上的人口数量已经达到了2.5亿人次，占到全国总人口数量的18%。伴随着人口老龄化的出现，养老问题也成了重中之重，要知道养老不仅仅是家庭的责任，更是社会责任。,https://toutiao.com/group/7409677025897710106/,,0,0,False
张紫妍：被迫陪睡31人近百次，遭道具虐待，29岁自杀留230页遗书,2024-07-24 02:37,13084,913,八号探秘人,八号探秘人,在阅读此文之前，辛苦您点击一下“关注”，既方便您进行讨论和分享，又能给您带来不一样的参与感，感谢您的支持！本文叙述皆有官方信源，为了读者有更好体验，放在了文章后缀！,https://toutiao.com/group/7394994383675736576/,,0,0,False
扔的虾头捡回来炼出虾油，做一顿虾油拌面，真的太香啦，直接光盘,2024-07-17 00:00,1403,472,兴凯湖莹莹,兴凯湖莹莹,,https://toutiao.com/group/7392176994165490228/,,0,0,True
11种中国绝版的老香烟，见过5种以上的，差不多是“爷爷”辈人了,2024-09-30 06:22,207,189,万物知识局,万物知识局,香烟是一种非常神奇的产物，它既能让烟民缓解心中紧张的情绪，也能在特定的时候成为老烟民们心中一种情绪的释放，在很多人焦虑的时候，总会想抽一口，缓解压力。,https://toutiao.com/group/7420275305845113354/,,0,0,False
"中美台海""必有一战""？大陆统一台湾胸有成竹，美军必遭歼灭！",2024-10-06 22:00,2547,132,黄阿原,黄阿原,,https://toutiao.com/group/7422618545030169151/,,0,0,True
“解放军随时可以封锁台湾”台海军司令这番话让台当局很头大！,2024-10-05 04:19,5744,143,海峡新干线,海峡新干线,“解放军随时可以封锁台湾”台海军司令这番话让台当局很头大！,https://toutiao.com/group/7422141462373990938/,,0,0,True
富庶小国崩溃有多快？三年变地狱：全国断电缺粮，连吃饭都成问题,2024-08-04 04:14,4994,623,鲸探所,鲸探所,凭借着富裕的石油，中东国家也过上了坐在金钱堆里的生活，“头顶一块布，中东我最富”更是很多国家对于中东国家的“印象”。然而在满是石油和金钱的中东地区，却有一个例外:黎巴嫩。,https://toutiao.com/group/7398766345946399273/,,0,0,False
奉陪到底，解放军报发出统一强音，台上将发现，大陆在等锁岛时机,2024-10-06 10:00,1625,203,强武堂,强武堂,最近，台海军“司令”唐华的一番话，直接引起了岛内热议，他说解放军已掌控台海，正以“蟒蛇战术”困住台湾，只要等到一个时机，便可随时进行全岛封锁。,https://toutiao.com/group/7422599740354789929/,,0,0,False
美国预警伊朗袭击以色列，二三十架F-35被摧毁？这个可能性有多大,2024-10-03 08:37,15285,680,陈虎点兵,陈虎点兵,,https://toutiao.com/group/7421465700525179429/,,0,0,True
