title,publish_time,like_count,comment_count,media_name,source,abstract,article_url,tag,is_yaowen,article_sub_type,has_video
李湘分享和女儿合影，王诗龄已经比妈妈高了，温婉优雅的大女孩！,2025-03-17 15:15,707,320,小郭仔,小郭仔,,https://toutiao.com/group/7482796910101807616/,,0,0,False
"315晚会后，不出意外的话，这几样东西将""无人问津""，白给也不要",2025-03-17 06:40,2656,831,观今言史,观今言史,说到315晚会，恐怕闹得最严重的应该是晚会之前的黄焖鸡事件，顾客吃剩下的不说，甚至很多已经变质的东西还要拿来加工。,https://toutiao.com/group/7482657122413527578/,,0,0,False
这是张学良老婆赵四小姐真实样貌，并非演员饰演而是货真价实真品,2024-12-28 11:28,35056,2789,历史伟人,历史伟人,赵四小姐，原名赵一荻，她从十六岁开始她终生陪伴张学良，历经坎坷，赵一荻是富家大小姐，但是在张学良囚禁期间，她选择陪伴软禁中的张学良，后悔过吗?,https://toutiao.com/group/7453422736652698175/,,0,0,False
58岁女子确诊肺癌，强忍泪水坦言：手部早出现了问题，没有多重视,2025-03-18 02:36,3322,189,沈阳生活广播,沈阳生活广播,在咱们身边，总有一些人过着平凡又惬意的小日子，李阿姨就是其中一位。她 58 岁，是社区图书馆的管理员，每天就爱待在那一排排书架中间，沉浸在书的海洋里。,https://toutiao.com/group/7482972886584623650/,,0,0,False
已下架，七大著名酸奶全军覆没，实为科技糖水，以后别再当冤大头,2025-03-19 07:14,6895,2006,影子红了,影子红了,作为一种风味极佳，营养十分不俗的饮品，酸奶在我国奶制品的销售市场中一直都占据着很大一块地盘，但随着这次315前后的不断爆料，不少人这才发现，原来我们日常生活中所追捧热衷的酸奶竟然并不是真正的“酸奶”，反而是充斥着“科技与狠活”的糖水。,https://toutiao.com/group/7483408707901063743/,,0,0,False
