title,publish_time,like_count,comment_count,media_name,source,abstract,article_url,tag,is_yaowen,article_sub_type,has_video
丫头回东北捡水稻一天能赚六七百，比大城市捡垃圾强多啦！,2024-10-16 22:53,1520,244,兴凯湖莹莹,兴凯湖莹莹,,https://toutiao.com/group/7426510446334575119/,,0,0,True
河南警察3岁女儿被拐，苦寻全国23年无果，结果却发现女儿在对门,2024-11-05 07:43,3622,376,八号探秘人,八号探秘人,寻亲23年无果，丢失的女儿竟住在对门?但它却真实发生在河南洛阳的梁绍波身上。是意外走丢，还是人贩子所为，三岁的女儿怎会离奇失踪?,https://toutiao.com/group/7433697108120142345/,,0,0,False
57岁周立波现状：头发稀疏身体暴瘦，定居美国和富豪妻子低调生活,2024-12-09 23:01,472,230,峰哥正读,峰哥正读,前段时间，周立波在美国街头的一张照片引起了热议，只见他戴着黑框大眼镜，发际线后移，头发稀疏，撇着嘴，神色间是我们熟悉的桀骜不驯。,https://toutiao.com/group/7446308823331111461/,,0,0,False
泽连斯基命令俄境内乌军死守，他提出停战方案，普京不同意？,2024-12-08 04:00,14659,252,邱毅台湾,邱毅台湾,,https://toutiao.com/group/7445206239379718708/,,0,0,True
山西走失13年女硕士的“收留者”张某：没领证办过酒席，没有拘禁她,2024-12-10 02:55,1397,1305,大皖新闻,大皖新闻,大皖新闻讯日前，有媒体报道称，山西女硕士卜某（又名花花）因患精神分裂症走失13年，后被好心人收留，找回时已生育一儿一女，该事件一经披露迅速引发广泛关注。,http://www.ahwang.cn/toutiao/202412/2784862.html,,0,1,False
美国霸权是世界乱源，拜登卸任前把天下搞大乱，遍地烽火生民涂炭,2024-12-09 06:01,17416,831,邱毅台湾,邱毅台湾,,https://toutiao.com/group/7446288140483953152/,,0,0,True
逼退美国航母战斗群，055被严重高估了吗？真相曝光后令人心酸,2024-11-28 01:55,2917,247,迷彩虎说,迷彩虎说,毕竟只是一艘驱逐舰而已，就算是之前055曾经有过单舰吓退美国航母战斗群的记录，也有人认为仅仅是在和平时期，美国不想和中国爆发热战，所以选择退却，如果在实战情况下他们肯定能击沉055。,https://toutiao.com/group/7441771958783492619/,,0,0,False
弟弟光荣退伍，姐姐兴奋去车站接他，怎料一见弟弟瞬间哭了,2024-11-05 06:34,31995,2974,乐视天天剧好看,乐视天天剧好看,,https://toutiao.com/group/7433679820573934091/,,0,0,True
工信部给燃油车吃了一颗“定心丸”，淘汰燃油车的声音终于安静了,2024-12-04 09:16,1706,761,议史纪,议史纪,随着新能源汽车的发展越来越强大，燃油车的热度似乎被影响了。您现在的车是新能源，还是燃油车呢?也正是因为新能源的崛起，大家关于燃油车看法也逐渐有了争议。,https://toutiao.com/group/7444481609710977570/,,0,0,False
县长看不上乡长送的烟，给他退回来，乡长打开一看乐了,2024-11-13 08:16,6272,1088,乐视大综艺咖,乐视大综艺咖,,https://toutiao.com/group/7436672568578277925/,,0,0,True
农业农村部原部长唐仁健被决定逮捕！被批“部署不力”“盲目决策”,2024-12-10 07:02,1358,106,红星新闻,红星新闻,正义网记者12月10日从最高人民检察院获悉，农业农村部原党组书记、部长唐仁健涉嫌受贿一案，由国家监察委员会调查终结，移送检察机关审查起诉。,https://toutiao.com/group/7446674757694620175/,,0,0,False
明年起，满18岁男性必须兵役登记！否则影响上大学、找工作,2024-12-09 06:44,17281,14700,大河报,大河报,重要提醒！2025年兵役登记工作将于2025年1月1日开始已经进行过兵役登记，有参军意向的可直接参加网上应征报名。依法服兵役和进行兵役登记是每个适龄公民应尽的光荣义务和神圣责任。《中华人民共和国兵役法》明确国家实行兵役登记制度，每名男性青年在年满18周岁时都要履行兵役登记义务。,https://toutiao.com/group/7446299249363157558/,,0,0,False
领了结婚证和闺蜜报喜，谁料闺蜜看了结婚证，我是你老公的妈妈,2024-12-09 02:03,2014,615,乐视群星访谈秀,乐视群星访谈秀,,https://toutiao.com/group/7446226813443015178/,,0,0,True
包厢全是刚出狱的恶霸，结果一看到饭店主厨，立马怂了,2024-11-11 01:21,12517,345,乐视群星访谈秀,乐视群星访谈秀,,https://toutiao.com/group/7435825833048015400/,,0,0,True
阿萨德早知今日，提前做好了布局！（上）,2024-12-10 09:49,2686,178,占豪,占豪,叙利亚突然变天，随着消息披露和梳理，现在总算逐渐梳理明白是咋回事了！,https://toutiao.com/group/7446718052365763106/,,0,0,True
新生育时代：三个“二孩家庭”的上海样本,2024-12-08 11:02,716,279,看看新闻,看看新闻,新生育时代：三个“二孩家庭”的上海样本,http://mediaplay.kksmg.com/2024/12/08/h264_720p_600k_77882-DFTVHD-20241208175000-4800-958532-600k_mp4.mp4,,0,0,True
央视曝光！#制假售假“一条龙”！,2024-11-24 12:16,5253,2015,央视财经,央视财经,,https://toutiao.com/group/7440818726712115762/,,0,0,True
韩国707特种部队队长自曝身份公开道歉：我们都被他利用了,2024-12-10 06:51,3392,393,环球时报军事,环球时报军事,“我们都被利用了，我将承担所有责任，并离开心爱的部队。”当地时间12月9日，韩国号称最精锐特种部队“707特种任务大队”队长金炫兑上校现身首尔龙山区的国防部战争纪念馆，召开记者会。,https://toutiao.com/group/7446672164113089078/,,0,0,True
美落井下石！尹锡悦没救了！！ 欢迎收看《谦言谦语》播出,2024-12-06 02:00,12579,266,赖岳谦官方,赖岳谦官方,,https://toutiao.com/group/7445112782787183114/,,0,0,True
罕见！100年前，英国游客拍下的清朝乡村，和想象中完全不一样,2024-09-20 02:07,8672,760,万物知识局,万物知识局,泥泞的土路，衣不蔽体的老百姓，即便是达官显贵的家中也十分破败，而这些都是清王朝的历史痕迹，虽说那时候中国摄影技术并不发达，但也有许多外国游客来到这里，拍摄下了许多老照片，为我们留下了珍贵的历史资料，那清朝到底是怎样的面貌呢?,https://toutiao.com/group/7416287738871267855/,,0,0,False
炸肉丸子，到底用淀粉还是面粉，教你一招，外酥里软超好吃,2024-10-01 09:23,6252,462,家常的味道,家常的味道,,https://toutiao.com/group/7420735473208787492/,,0,0,True
姑娘在山洞换衣服，小伙看周围没人，直接霸王硬上弓！,2024-12-05 05:33,618,103,南瓜午夜厅,南瓜午夜厅,,https://toutiao.com/group/7444796602683752971/,,0,0,True
包菜炒粉条，切记不要焯水和直接下锅，教你一招，清脆爽口不出水,2024-11-11 11:50,8960,445,家常的味道,家常的味道,,https://toutiao.com/group/7435987746101690930/,,0,0,True
郭有才：当迷失方向忘记初心后，曾经飘得多高，如今摔得就多惨,2024-11-11 06:53,1639,768,八号探秘人,八号探秘人,在阅读此文之前，辛苦您点击一下“关注”，既方便您进行讨论和分享，又能给您带来不一样的参与感，感谢您的支持！编辑丨brt因为一首翻唱，他一夜之间成为了拥有千万粉丝的网红。但是“人红是非多”，不久他就因为版权等问题陷入了舆论风波。他的人气一落千丈，从万众瞩目变成了现在的无人问津。,https://toutiao.com/group/7435901170239078948/,,0,0,False
北大学霸不顾一切娶农村毁容女孩，20年过去了，他们如今怎样了？,2024-09-12 09:10,4886,432,读者,读者,2022年11月22日，浙江省杭州市。一中年女子将自己和老公相识20年的心路历程发布到了网上:她是从小面部被灼伤的毁容女孩，前途渺茫，看不到将来;两个不同世界的人，却因为书信有了来往。,https://toutiao.com/group/7413563977009087012/,,0,0,False
相爱37年零绯闻，丁勇岱对赵雪华一见钟情，如今却对儿子很失望,2024-11-09 21:43,3188,296,八号探秘人,八号探秘人,在阅读此文之前，辛苦您点击一下“关注”，既方便您进行讨论和分享，又能给您带来不一样的参与感，感谢您的支持！编辑丨xk1985年，丁勇岱转过楼梯拐角，撞到人生挚爱，这一下把他撞“开窍”了。那时他还不是《末路》里的白宝山。也不是《跨过鸭绿江》里的彭老总，更不是《人世间》里的周志刚。,https://toutiao.com/group/7435160230918406707/,,0,0,False
这绝对是我吃过最好吃的蒜蓉蒸鸡做法,2024-11-11 12:49,3415,279,天天相见厨房(阿见),天天相见厨房(阿见),,https://toutiao.com/group/7436003114588570123/,,0,0,True
马克龙邀请特朗普、泽连斯基沟通，拜登妄想巨款军援乌克兰受阻,2024-12-10 08:24,6350,105,邱毅台湾,邱毅台湾,,https://toutiao.com/group/7446696314223460902/,,0,0,True
河南女子去世，山东丈夫将手机埋墓里，充1000元话费，每天打电话,2024-11-01 06:52,3976,3198,何止电影,何止电影,2014年11月17日，河南肿瘤医院的病房中举行着一场特殊的婚礼，主角是于海宁跟他的患有癌症的妻子范会香。在几个月前范会香确诊癌症，跟男友提出分手，于海宁不远万里来到了女友的城市，照顾患癌女友。得知女友时日无多，在病房中跟女友求婚，在病房中举办了婚礼，婚后一年，范会香去世。,https://toutiao.com/group/7432199981609534004/,,0,0,False
近5年最热的十部剧，《狂飙》第9，《繁华》第6，第1名很难超越,2024-12-01 03:58,939,365,电影烂番茄,电影烂番茄,今天，番叔就结合口碑，给大家盘点一下近五年，热度最高的十部电视剧。第十名:《都挺好》 猫眼热度 9775.8，播出时间2019年。,https://toutiao.com/group/7430845717314273831/,,0,0,False
济大学生称超市煮泡面卖10元挤走卖3.5元的食堂老板，学校：已要超市整改，热食商品下架,2024-12-10 08:16,1840,2336,九派新闻,九派新闻,近日，济南大学舜耕校区“泡面价格战”引发热议。网友发帖称，学校六食堂一档口的煮方便面卖3.5元，自带面则收5毛加工费。超市也新增此业务，但售价10元，不仅如此，超市老板还要求食堂的泡面涨价，被拒绝后，将食堂泡面档口的老板排挤出了学校。,http://feed.huiwen.co/rssv2/toutiaohao_article_ttjpnews_9fc19a1f956448fb9826b9fcb4695509/item/IL21C0UK7IMMPBG.html,,0,0,False
韩国又创造了历史,2024-12-10 02:30,5123,149,牛弹琴,牛弹琴,韩国总统被禁止出境，外界目瞪口呆,https://toutiao.com/group/7446604989465625151/,,0,0,True
著名前央视主持人方静，一生未婚44岁客死异乡，成为父母余生之痛,2024-11-22 02:11,1563,410,八号探秘人,八号探秘人,23岁即踏入央视大门，事业一路高歌猛进。是诸多主持人中极少数拥有博士学位的“台柱”，也是一级播音员的主持人。,https://toutiao.com/group/7439610920277459492/,,0,0,False
二婚男女相亲，一个敢问一个还真敢答，真是人才，把我笑得肚子疼,2024-09-14 04:06,19827,299,乐观的饺子YV57Em,乐观的饺子YV57Em,,https://toutiao.com/group/7414345432521769481/,,0,0,True
阿萨德政权倒台，叙利亚混乱局势背后，俄罗斯成最大输家？,2024-12-09 10:52,23373,1692,邱震海,邱震海,,https://toutiao.com/group/7446363348780483113/,,0,0,True
女友怀孕了，男友不装了，带她回豪宅！,2024-11-23 08:01,10233,810,乐视大综艺咖,乐视大综艺咖,,https://toutiao.com/group/7440353629540483593/,,0,0,True
