title,publish_time,like_count,comment_count,media_name,source,abstract,article_url,tag,is_yaowen,article_sub_type,has_video
微观察｜“不仅要高山仰止，还要见贤思齐”,2024-10-20 23:06,1706,753,人民日报,人民日报,“不仅要高山仰止，还要见贤思齐”庆祝新中国75周年华诞后不久，习近平总书记到福建、安徽考察，走进谷文昌纪念馆。,https://www.peopleapp.com/column/30047042755-500005848521?utm_source=头条号,,0,0,False
一巴掌的代价，公交车上大妈打晕患癌小伙，断送退休后的幸福生活,2024-10-14 09:53,1060,549,客观听書,客观听書,公交车上老太太和小伙吵了起来，老太太更是当仁不让直接给了小伙一巴掌。这名小伙直接倒地，老大大根本就不会想到正是因为他的一巴掌，鲜活的生命就这样消失在他的手里。,https://toutiao.com/group/7425563455358468627/,,0,0,False
1976年周、朱、毛同一年逝世，临终前，三位伟人都交代了什么话？,2024-09-24 09:46,6193,288,呷谈历史,呷谈历史,1976年是最令人悲伤的一年，那一年三位伟人相继离世，还发生了唐山大地震。三位伟人在离世前都交代了一些事情，这些事情都和之后国家的发展有关系。,https://toutiao.com/group/7418141722196197900/,,0,0,False
给近三年最好的10部年代剧排个名：《人世间》第6，第1名没有争议,2024-09-06 08:08,5965,2045,皮皮电影,皮皮电影,时尚是个轮回，电视剧也是。在2020年之前的那些年，电视剧市场基本上都被偶像剧、都市剧霸占。曾经撑起国剧品质的《闯关东》《岁月》这类年代好剧，难见踪影。,https://toutiao.com/group/7411390030722712090/,,0,0,False
3年前，宁夏7岁小女孩一笑走红，后拒百万签约，如今怎么样了？他们后悔了吗？,2024-09-19 07:25,3610,638,睿之悦,睿之悦,2021年，视频镜头中出现的女孩儿用那一抹甜美的笑容，迅速引起了网友们的广泛关注。有媒体公司看到这一机遇，提出愿意用百万巨资与女孩儿签约，然而，女孩儿的父母却坚决拒绝了这一提议。,https://toutiao.com/group/7416250139544879679/,,0,0,False
“名嘴”宋世雄：携妻走过57年坎坷岁月，晚年孤老儿女都不在身边,2024-10-07 02:34,818,114,赫薰辞,赫薰辞,在阅读此文之前，麻烦您点击一下“关注”，感谢大家的支持哦。文|濑名泉编辑|濑名泉前言“央视播音三巨头”之一的宋世雄，一生解说了2000多场比赛，是体育解说界的鼻祖，更是无数解说员前行路上的标杆。,https://toutiao.com/group/7422586637319815731/,,0,0,False
以后想吃回锅肉你就像我这样做，肥而不腻，咸香适口，太解馋了,2024-08-06 11:19,32430,1195,家常的味道,家常的味道,,https://toutiao.com/group/7399984507362738742/,,0,0,True
为国争光却遭郎平弃用！转身效力土耳其的王一梅，如今咋样了？,2024-08-31 13:19,941,144,豆莱说,豆莱说,光阴似箭，日月如梭，当初的少女早已退役，成为了排球场的幕后人，这么多年她都经历了什么，现在又怎么样了呢?,https://toutiao.com/group/7409287778514567718/,,0,0,False
拦车收费？交警不管！景区不管！政府看不见！九寨沟咋全是土匪？,2024-09-22 15:55,205015,40484,行哥嘚啵嘚,行哥嘚啵嘚,,https://toutiao.com/group/7417496641638400527/,,0,0,True
两个姑爷来农村 #农家院农家菜农家生活 #农村生活 鸡鱼招待,2024-08-07 09:04,6870,839,农民王小,农民王小,,https://toutiao.com/group/7400320946991301160/,,0,0,True
首例5胞胎长大了，父亲已过劳去世 母亲直言：如能重来一个也不要,2024-10-09 06:30,1722,577,墨影云光,墨影云光,2001年，一位35岁的农村妇女意外怀上了五胞胎。面对多胎妊娠的风险，医生建议她减胎，但她坚持将五个孩子全都留下。在顺利降生后，五胞胎受邀参加北京奥运会火炬传递，被亲切地称为“奥运福娃”。,https://toutiao.com/group/7423656349587784255/,,0,0,False
万万没想到，35岁杨颖兜兜转转干回“老本行”，活成内娱最大笑话,2024-09-06 07:55,535,137,读万卷书的张飞,读万卷书的张飞,文l张飞编辑l张飞曾经你看不起别人；如今谁又瞧得上你？在节目中丝毫不考虑他人状态，一味地只追求自己的镜头。甚至还在采访中公然表示“自己早就应该把所有奖拿了个遍了”。更关键的是丝毫没有任何“报恩”之心。所以如今曾经所有的“嚣张”“高高在上”遭到反噬，只能说现在谁还“愿意”认识她！,https://toutiao.com/group/7411434661014012456/,,0,0,False
性能力强的男性有什么特征？能不能一眼识别出来？医生来告诉你！,2024-10-12 09:50,1412,171,番茄健康,番茄健康,这句话从最初的鼓励与加油之意，慢慢演变成了男性对性能力的重视，这也直接反映出性能力在男性朋友心里的重视程度之高。,https://toutiao.com/group/7424792723569492507/,,0,0,False
浙江女子主动辞职却被驳回！网友怒赞：神仙公司,2024-10-20 06:04,1508,432,环球网,环球网,来源：杭州交通918 近日，一则暖心的故事引发全网关注浙江姑娘祝乙琪5岁时，患上肾母细胞瘤，失去了右肾；今年5月初，确诊直肠癌晚期…担心影响工作，她随后向公司提出辞职。没想到，公司驳回请求并叮嘱她安心养病：可以边工作边看病，不会抛弃一个生病的员工。相关话题冲上热搜！,https://3w.huanqiu.com/a/b6960a/4JusVbEBR6C?agt=20,,0,0,False
越扒越多！这一次，被爆“嫖娼”的易建联，彻底揭开圈内的潜规则,2024-10-19 21:02,844,165,海豚女王,海豚女王,不管男女，结婚之后应该对自己负责，对自己的婚姻负责，但是有的人，因为追求一时刺激，把自己搞的身败名裂。,https://toutiao.com/group/7427590797396034098/,,0,0,False
美专家警告：中国地缘政治存在缺点，可能存在灭国的危险,2024-09-09 03:17,2371,208,猫腿说事,猫腿说事,因此，中国有着得天独厚的地缘政治优势，几乎单独占据整个东亚，北面是俄罗斯、蒙古国、南邻南海，西边是印度、尼泊尔、不丹等亚洲国家，在西北面则和中亚几个斯坦相邻。,https://toutiao.com/group/7412476404467614220/,,0,0,False
凌娅自首：“瘾”犯了就脱衣让下属满足她，造太子奶冤案,2024-09-21 10:24,2114,404,南笙,南笙,老板李途纯原来是个普通工人，但人勤快，又特别能吃苦，对益生菌技术也有自己的一套想法，就这么辛辛苦苦地开了自己的公司。,https://toutiao.com/group/7417018178540192268/,,0,0,False
写歌30年穷困潦倒，前妻失望选择离婚，谁料51岁靠一首歌一夜成名,2024-08-12 03:37,26110,4330,八号探秘人,八号探秘人,在阅读此文之前，辛苦您点击一下“关注”，既方便您进行讨论和分享，又能给您带来不一样的参与感，感谢您的支持！编辑：LY无数人都想要一个一夜成名的机会，但机会来了也不是每个人都能把握住的。他用了三十年的时间来准备迎接属于自己的机会。为了这个机会他放弃了一切，甚至包括家庭。,https://toutiao.com/group/7402090890367484428/,,0,0,False
村干部换届有新规？多地出台年龄限制，4类人优先、6类人禁参选,2024-10-20 09:07,548,145,惠农圈,惠农圈,但村干部的待遇虽然提高了，可多地为了发展新农村，也出台了年龄限制，过去动辄55岁以上的老村长，如今已很少看到。,https://toutiao.com/group/7427781534546477631/,,0,0,False
贪污上亿、侵吞善款，韩红被实名举报，4年了，有人给她道歉吗？,2024-10-19 07:24,2670,243,昕昕局,昕昕局,2020年初，新冠疫情肆虐，武汉告急，全国上下万众一心，与时间赛跑，与病魔较量，就在这场没有硝烟的战争中，一个熟悉的身影出现在抗疫一线，她带着物资，带着希望，奔赴在最危险的地方，她就是韩红。,https://toutiao.com/group/7427383862491120179/,,0,0,False
