title,publish_time,like_count,comment_count,media_name,source,abstract,article_url,tag,is_yaowen,article_sub_type,has_video
几个月没见媳妇，刚回来就拽住媳妇又搂又抱，真是小别胜新婚啊！,2024-07-19 03:27,8283,726,瑞涵妈妈,瑞涵妈妈,,https://toutiao.com/group/7393183385576505890/,,0,0,True
联合利剑2024B演习，这次针对的是什么？会不会上手段上强度,2024-10-14 06:32,5832,292,陈虎点兵,陈虎点兵,,https://toutiao.com/group/7425515542246588979/,,0,0,True
为国争光却遭郎平弃用！转身效力土耳其的王一梅，如今咋样了？,2024-08-31 13:19,938,144,豆莱说,豆莱说,光阴似箭，日月如梭，当初的少女早已退役，成为了排球场的幕后人，这么多年她都经历了什么，现在又怎么样了呢?,https://toutiao.com/group/7409287778514567718/,,0,0,False
我的房子不对劲！深不可测的恐惧 第五章，逃离伍德伯里,2024-10-05 23:00,2555,365,鲤鱼Ace,鲤鱼Ace,溯源之惧 第五章，逃离伍德伯里,https://toutiao.com/group/7422325180422160930/,,0,0,True
"""请祖国和人民放心！"" 已在掩体度过10余天 我赴黎维和官兵报平安",2024-10-13 09:31,30554,5359,海客新闻,海客新闻,,https://toutiao.com/group/7425190591098520076/,,0,0,True
"美国要在以色列狠下功夫，一旦部署""萨德""，报复力度可能更加强烈",2024-10-13 10:53,2658,212,杜文龙,杜文龙,,https://toutiao.com/group/7425211759520121383/,,0,0,True
假如特朗普再次当选，他的第一个打击对象会是？,2024-10-13 01:00,2144,137,凤凰卫视,凤凰卫视,,https://toutiao.com/group/7424419596356026914/,,0,0,True
