title,publish_time,like_count,comment_count,media_name,source,abstract,article_url,tag,is_yaowen,article_sub_type,has_video
这就是旺三代的媳妇，祖上积德啊，才能娶到这么好的媳妇👍,2025-01-27 10:33,40829,3364,趣知达人,趣知达人,,https://toutiao.com/group/7464541223764705842/,,0,0,True
小沈阳夫妇把演唱会开到了北京春晚舞台！,2025-01-29 16:47,14357,2542,非凡蛋糕mu,非凡蛋糕mu,,https://toutiao.com/group/7465379968436994623/,,0,0,True
相声《爽剧人生》表演：郭德纲、于  谦,2025-01-29 11:56,6510,404,天津卫视,天津卫视,"《京津冀过大年-2025天津相声春晚》相声《爽剧人生》表演：郭德纲、于  谦
#郭德纲拍短剧捧于谦当霸总# 、#郭德纲说自己想拍短剧#",https://toutiao.com/group/7465304865271661083/,,0,0,True
越南民众围观中国放烟花过大年 河边密密麻麻全是人！越南人慕了,2025-01-29 05:01,74357,10241,熟悉的陌生人,熟悉的陌生人,,https://toutiao.com/group/7465197989557862953/,,0,0,True
老外看中国春晚感动哭了！团结、国泰民安，他以前从未感受到过,2025-01-29 03:46,7156,889,随心,随心,,https://toutiao.com/group/7465178578746638874/,,0,0,True
女子在医院怒揍AI机器人，中国第一个和ai机器人打架的女人,2025-01-28 13:22,8387,2938,幽默白云CI,幽默白云CI,,https://toutiao.com/group/7464955866953826850/,,0,0,True
小姑子30岁不嫁人，天天就喜欢和哥哥腻在一起，嫂子忍无可忍爆发,2025-01-23 02:38,5656,1130,影视随意看,影视随意看,,https://toutiao.com/group/7462934734751007284/,,0,0,True
夫妻冷战一个月，媳妇想和好故意来找茬，结果老公的反应太逗了,2025-01-30 04:19,543,138,懂王啥都懂,懂王啥都懂,,https://toutiao.com/group/7465550649908855332/,,0,0,True
赵本山凭这一个小品，捧红了王小利，全程笑点不断,2025-01-04 20:46,7496,1558,娱快很简单,娱快很简单,,https://toutiao.com/group/7454123678406541824/,,0,0,True
