title,publish_time,like_count,comment_count,media_name,source,abstract,article_url,tag,is_yaowen,article_sub_type,has_video
时政微视频丨总书记最深的牵挂,2024-12-28 05:06,1957,878,央视新闻,央视新闻,“老百姓的事情，是最重要的事情。”这一年，习近平总书记时刻记挂群众冷暖，看乡村、到社区、入企业、进校园，心之所系、行之所至！一件件民生“小事”，一次次考察调研，总书记念兹在兹是人民。悠悠百姓事，枝叶总关情。民生为大，是总书记最深的牵挂。,https://content-static.cctvnews.cctv.com/snow-book/index.html?item_id=10639376883264281782&source=50006&sub_source=50006_001,,0,0,False
【讲习所·2024与时偕行】“乘坐在一条命运与共的大船上”,2024-12-28 01:32,586,229,国际在线,国际在线,【本期导读】“地球就这么大，人类面临这么多共同挑战。中国古人讲‘同舟共济’，我看现在需要‘同球共济’。”“我们要以‘同球共济’精神珍爱和呵护地球，为子孙后代留下一片生存的乐土。”“要以‘同球共济’的精神，凝聚推动构建人类命运共同体的广泛共识。,https://news.cri.cn/toutiaopic/601696fe-a0db-5e43-b8fb-950aabfb2673.html,,0,0,False
权威数读｜一周“靓”数,2024-12-28 03:20,517,240,新华网,新华网,策划：令伟家设计：潘红宇文案：李茜 缪异星,http://my-h5news.app.xinhuanet.com/h5/article.html?articleId=0037ec06defcd4e155e7eee3653cef10,,0,0,False
丑闻曝光！前中国奥运冠军爆料，恩师是披着人皮的狼，逼学员吃药,2024-12-28 01:13,1495,442,8卦娱,8卦娱,从表面看，他确实是一个非常专业的教练，能够带出5名奥运冠军和那么多的省市冠军，可让人没想到的是，在这光鲜亮丽的背后，竟然还隐藏着这么多的“黑暗”。,https://toutiao.com/group/7453264201478373903/,,0,0,False
新婚33天卷走274万4套房，出逃后丈夫跨国追捕，如今下场大快人心,2024-12-20 22:06,4110,223,八号探秘人,八号探秘人,在阅读此文之前，辛苦您点击一下“关注”，既方便您进行讨论和分享，又能给您带来不一样的参与感，感谢您的支持！编辑丨QQ·B“色字头上一把刀！”深圳富豪结婚33天竟被卷走274万元和名下4套房产。不仅如此，他还被扣上了“接盘侠”的帽子，啥也没干喜当爹。,https://toutiao.com/group/7450399558821052982/,,0,0,False
中国新型战机横空出世，美国后悔叫停第六代战机研发？ 回复,2024-12-27 22:26,16367,1191,王冰汝,王冰汝,,https://toutiao.com/group/7453221650381668902/,,0,0,True
世界变天，到了该亮剑的时候了！（下）,2024-12-27 22:30,3412,135,占豪,占豪,未来全球的货币到底本位于什么？没有这样一个大池子，别人怎么去长期持有人民币呢？,https://toutiao.com/group/7453026076818670132/,,0,0,True
美妇约见老情人，见面场景真是太逗了，这俩人绝配！,2024-10-27 16:25,5086,637,乐视明星的那点事,乐视明星的那点事,美妇约见老情人，见面场景真是太逗了，这俩人绝配！,https://toutiao.com/group/7428157095108674088/,,0,0,True
徐克出品，必属精品，近年来为数不多的精良动作片,2024-12-13 03:48,1613,426,乐视典藏金曲汇,乐视典藏金曲汇,,https://toutiao.com/group/7447707364414718498/,,0,0,True
中方调查进口牛肉，巴西回应,2024-12-28 02:57,2453,7785,观察者网,观察者网,12月27日，中国商务部发布公告称，决定自当天起对进口牛肉进行保障措施立案调查。 中国畜牧业协会等申请人认为，近年来中国牛肉进口数量急剧增长，对国内产业产生了重大不利影响。商务部强调，此次调查不针对特定国家和地区，不区分产品来源地，调查期间不影响正常贸易。,https://www.guancha.cn/internation/2024_12_28_760369.shtml,,0,0,False
中国新型飞行器，肉眼可见的领先，到底应该算是几代机？,2024-12-27 06:07,36525,2133,陈虎点兵,陈虎点兵,,https://toutiao.com/group/7452969355765088820/,,0,0,True
厨师长教你：“葱爆羊肉”羊肉滑嫩、鲜香不膻,2024-12-27 07:34,1680,281,美食作家王刚,美食作家王刚,厨师长教你：“葱爆羊肉”羊肉滑嫩、鲜香不膻,https://toutiao.com/group/7452991735665263139/,,0,0,True
暗访山羊“保养”黑幕：上千只活羊凌晨被灌食增重，活羊被灌“嗷嗷”叫,2024-12-28 04:13,1154,813,湖南日报,湖南日报,上述知情人士表示，唯一的区别不过是灌的料多一些还是少一些，“被灌食的羊，有的当场就被撑死，就算是活羊，买回去养着也是百分之百养不活的。”,https://m.voc.com.cn/portal/news/show?id=21564327,,0,0,False
县长看不上乡长送的烟，给他退回来，乡长打开一看乐了,2024-11-13 08:16,10809,1808,乐视大综艺咖,乐视大综艺咖,,https://toutiao.com/group/7436672568578277925/,,0,0,True
想吃零食别出去买，家里有苹果鸡蛋就能做，外酥里软比买的还好吃,2024-12-10 13:36,4015,315,小寒厨艺,小寒厨艺,想吃零食别出去买，家里有苹果鸡蛋就能做，外酥里软比买的还好吃,https://toutiao.com/group/7446704956704293402/,,0,0,True
深圳夫妻生育两女后再迎四胞胎女儿，如今顿顿吃面条,2024-12-27 07:02,1410,723,大河报,大河报,来源：极目新闻租住在深圳龙华区的城中村，陈小波每天上午8点多准时骑着电动车到几公里外的公司上班，在外忙碌一天，往往晚上9点左右才能到家。,https://toutiao.com/group/7452982583643701810/,,0,0,False
成飞沈飞两种新机试飞，外形科幻能力强，如何选择成了幸福的烦恼,2024-12-27 09:04,13543,1114,杜文龙,杜文龙,,https://toutiao.com/group/7453014844267037223/,,0,0,True
益生菌真的那么神奇吗？有关益生菌的几个误区 你“踩雷”了吗？,2024-12-07 02:35,1897,107,央视频,央视频,,https://toutiao.com/group/7445492942887715365/,,0,0,True
当得知女友怀孕了，男友不再装穷，直接带妻子回豪宅住,2024-12-17 03:23,3437,104,乐视经典热综回放,乐视经典热综回放,,https://toutiao.com/group/7449215721336209935/,,0,0,True
萝卜和鸡蛋这样做，比吃补药还补，顿顿吃都不会腻，又香又下饭,2024-10-30 12:28,70257,4284,小寒厨艺,小寒厨艺,萝卜和鸡蛋这样做，比吃补药还补，顿顿吃都不会腻，又香又下饭,https://toutiao.com/group/7431405463378919975/,,0,0,True
中国两种六代机的首飞，是否会导致轰20项目下马？答案揭晓,2024-12-28 01:36,4164,386,张斌论评,张斌论评,,https://toutiao.com/group/7453270692008559113/,,0,0,True
广西49岁老汉娶19岁姑娘，结婚21年生下15个孩子，如今有何下场？,2024-10-20 08:32,9265,1166,艺述史,艺述史,她19岁出嫁，21年里总共生育了15个孩子，其中4个男孩子11个女孩子，家里热闹的像是开了一所学校一样。,https://toutiao.com/group/7427400319418384948/,,0,0,False
中国新型战机气场强大，采用飞翼式布局，会是歼轰-26吗？,2024-12-27 07:26,22303,1851,杜文龙,杜文龙,,https://toutiao.com/group/7452989773662126618/,,0,0,True
特朗普上台倒计时，发表各种“暴论”，他究竟想干什么？,2024-12-25 10:09,8976,180,陈虎点兵,陈虎点兵,,https://toutiao.com/group/7452289539952869922/,,0,0,True
女儿着急去排练，一听是奢香夫人，玲花：这个我熟｜综艺,2024-12-19 16:00,28820,1819,PP宫斗放映厅,PP宫斗放映厅,,https://toutiao.com/group/7450045373738910223/,,0,0,True
未来四年大陆不会有统一台湾时间表？随时可解放台湾，何需时间表,2024-12-26 05:50,21787,2019,邱毅台湾,邱毅台湾,,https://toutiao.com/group/7452593764326965800/,,0,0,True
未成年禁止观看！2024年全球爆片，尺度大到生理不适,2024-12-23 07:19,3158,102,禾芷解说,禾芷解说,深度解说电影《某种物质》,https://toutiao.com/group/7451503435595121191/,,0,0,True
四百万外国人，正在涌入上海,2024-12-25 14:20,2107,1681,华尔街见闻,华尔街见闻,"“周五下班去中国！”这句近期很火的话来自我们相邻的韩国。是的，继今年一句""City不City""让大家见识到一大群异国面孔回流向上海之后，如今韩国也来了。",http://mp.weixin.qq.com/s?__biz=MjM5NzAwMzU0MA==&mid=2247617804&idx=1&sn=22f9336dfdc7b9005bad1100d36aced0,,0,0,False
66岁的“情趣用品女王”冲上热搜，中国最性感的生意，被她带火了,2024-12-28 04:58,1887,209,毒sir财经,毒sir财经,情趣用品市场越来越爆火了！2023年中国情趣用品市场规模已达1794.3亿元，预计2025年将突破2000亿元。中国的情趣用品行业正在快速走向千亿规模。但是你知道“中国情趣用品女王”是谁吗？一位来自中国东北的66岁老太太——Lisa。,https://toutiao.com/group/7453072707693904447/,,0,0,False
韩国又一次创造了历史,2024-12-28 00:25,1886,347,牛弹琴,牛弹琴,怪不得韩剧那么精彩，因为韩国现实更精彩。12月27日，韩国国会又以192票赞成，通过了对代总统韩德洙弹劾案。刚当了不到两周代总统的韩德洙，也靠边站了。算起来，这是韩国史上第一次，时隔两周先后弹劾总统、代总统。感觉韩国政治真是杀疯了。,https://toutiao.com/group/7453249344129614373/,,0,0,False
举世瞩目！中国迎来好消息，美英法德没做到的事，中国做到了,2024-12-28 05:13,4739,295,美洲话姐,美洲话姐,这几天，无论是“四川舰”的横空出世，还是第六代战机的首飞，都引起了全世界的注意，外媒对此进行了大量报道。美媒频繁使用了“出人意料、震惊、令人沮丧”等词去形容两款新式战机的亮相。,https://toutiao.com/group/7453326270357602870/,,0,0,False
成都市武侯区人民法院：关于被告人贺某阳故意伤害、虐待刑事附带民事诉讼案的说明,2024-12-27 09:43,467,1382,环球网,环球网,,https://toutiao.com/group/7453024640584139274/,,0,0,False
特朗普向中国伸橄榄枝，对中美做积极表态，是美国政坛的重要进步,2024-12-22 09:00,3851,1216,评论员庚欣,评论员庚欣,,https://toutiao.com/group/7451158392506974735/,,0,0,True
贪官酒桌上的权钱交易，语言天衣无缝，听懂三分都是人精！,2024-11-23 16:24,3252,412,乐视扒剧小妹儿,乐视扒剧小妹儿,,https://toutiao.com/group/7440378916130259496/,,0,0,True
万万没想到白菜和鸡蛋这样做，出锅会这么好吃，用来做早餐最适合,2024-11-30 11:17,4816,360,小寒厨艺,小寒厨艺,万万没想到白菜和鸡蛋这样做，出锅会这么好吃，用来做早餐最适合,https://toutiao.com/group/7443030049606402560/,,0,0,True
牛肉价格狂降！只因进口牛肉太多了？养殖户和消费者应保哪一方,2024-12-28 05:46,2211,491,照理说事,照理说事,牛肉价格狂降！只因进口牛肉太多了？养殖户和消费者应保哪一方,https://toutiao.com/group/7453335076823269915/,,0,0,True
美英以三国开始下死手，猛炸胡塞武装，想把其变成下一个阿萨德？,2024-12-28 02:05,314,201,兵说,兵说,阿萨德政权垮台，叙利亚变天后，伊朗系武装的“抵抗之弧”战略几乎遭到腰斩，高度依赖伊朗支援的胡塞武装，这回确实是非常危险了。而美英以三国自然不会放过这个重要机会，三大军事强国迅速开始对胡塞武装发起狂轰滥炸，开始下死手。,https://toutiao.com/group/7453276504353440275/,,0,0,False
小品：杨帆演小沈阳，撒贝宁演赵本山，台词功底太强了吧,2024-11-23 06:13,6869,147,PP宫斗放映厅,PP宫斗放映厅,,https://toutiao.com/group/7440353912709710386/,,0,0,True
宋美龄106岁去世，贴身厨子回家后不久自尽，事后妻子透露出缘由,2024-10-28 09:22,15159,533,历史与江湖,历史与江湖,2003年10月，106岁的宋美龄在美国纽约去世，这位世纪老人虽然永远地闭上了双眼，但是却留下了一个长寿神话。,https://toutiao.com/group/7430753866158817855/,,0,0,False
芋头学会这做法，孩子三天两头点名吃，软糯酥脆香甜，越吃越过瘾,2024-12-05 12:56,2766,343,小寒厨艺,小寒厨艺,芋头学会这做法，孩子三天两头点名吃，软糯酥脆香甜，越吃越过瘾,https://toutiao.com/group/7444910891562172937/,,0,0,True
