title,publish_time,like_count,comment_count,media_name,source,abstract,article_url,tag,is_yaowen,article_sub_type,has_video
首例5胞胎长大了，父亲已过劳去世 母亲直言：如能重来一个也不要,2024-08-31 03:06,773,186,睿之悦,睿之悦,2002年，在北京的一家妇产医院中，一位来自河北的孕妇顺利生下了两男三女的五胞胎，创造了一个全国罕见的奇迹。,https://toutiao.com/group/7409098624111575603/,,0,0,False
王亮即将被判决，刘能拿钱换谅解书，对方表态“不差钱就要追责”,2024-10-26 02:10,1143,204,赫薰辞,赫薰辞,阅读此文之前，麻烦您点击一下“关注”，既方便您进行讨论和分享，又能给您带来不一样的参与感，感谢您的支持。文|33编辑|33王亮与关小平，虽为晚辈和长辈，现在却因一场风波而法庭对峙。王亮直播磕头道歉，父亲刘能更是想拿钱摆平，关小平仍是态度坚决，不肯出具调解书。,https://toutiao.com/group/7429643954423038476/,,0,0,False
善恶终有报：疫情时对中国一毛不拔，却大方捐美国6亿，如今咋样,2024-09-29 05:50,899,123,睿之悦,睿之悦,可就是这样一位在中国土生土长起来的富豪，在疫情期间面对同胞的困境却一毛不拔，反而大方的捐助了6亿给美国。,https://toutiao.com/group/7419859345154015798/,,0,0,False
军号一响，全军出击！,2024-09-19 08:01,24815,1580,中国军号,中国军号,,https://toutiao.com/group/7416261401477382668/,,0,0,True
今年落马的第一只老虎被公诉，与周永康被控同一罪名！,2024-10-26 13:25,2113,118,大河报,大河报,据最高人民检察院10月25日消息，自然资源部原党组成员，中国地质调查局原党组书记、局长钟自然涉嫌受贿、故意泄露国家秘密一案，由国家监察委员会调查终结，经最高人民检察院指定，由浙江省宁波市人民检察院审查起诉。近日，宁波市人民检察院已向宁波市中级人民法院提起公诉。,https://toutiao.com/group/7430055624068579878/,,0,0,False
写歌30年穷困潦倒，前妻失望选择离婚，谁料51岁靠一首歌一夜成名,2024-08-12 03:37,26179,4330,八号探秘人,八号探秘人,在阅读此文之前，辛苦您点击一下“关注”，既方便您进行讨论和分享，又能给您带来不一样的参与感，感谢您的支持！编辑：LY无数人都想要一个一夜成名的机会，但机会来了也不是每个人都能把握住的。他用了三十年的时间来准备迎接属于自己的机会。为了这个机会他放弃了一切，甚至包括家庭。,https://toutiao.com/group/7402090890367484428/,,0,0,False
“两头婚”在国内悄然出现，“两头婚”逐渐增多？你能接受吗？,2024-10-16 09:01,648,603,读者,读者,你听说过“两头婚”吗？最近这几年，在年轻人中间流行起了一种新型婚姻形式——两头婚。对于他们而言，这种婚姻形式不仅仅是一种全新尝试，更是除了传统婚姻之外的一种完美选择。那么，这种新型的婚姻模式，真的代表了更理想的婚姻选择吗？,https://toutiao.com/group/7426187021527384615/,,0,0,False
阿斯麦向美国承诺：只要解放军攻台，立刻远程瘫痪台积电光刻机,2024-10-25 14:34,5553,2136,司马南,司马南,偶然看到一则信息，阿斯麦公司向美国作出保证，如果中国人民解放军攻打台湾地区，他们便立刻远程瘫痪台积电的光刻机。,https://toutiao.com/group/7429718340911858195/,,0,0,False
3年前，宁夏7岁小女孩一笑走红，后拒百万签约，如今怎么样了？他们后悔了吗？,2024-09-19 07:25,5989,943,睿之悦,睿之悦,2021年，视频镜头中出现的女孩儿用那一抹甜美的笑容，迅速引起了网友们的广泛关注。有媒体公司看到这一机遇，提出愿意用百万巨资与女孩儿签约，然而，女孩儿的父母却坚决拒绝了这一提议。,https://toutiao.com/group/7416250139544879679/,,0,0,False
网友：这小孩最起码吃了三个田震、一个许巍和一个刀郎！,2024-09-04 13:00,75545,6715,小石头和孩子们,小石头和孩子们,,https://toutiao.com/group/7410772059594981915/,,0,0,True
从体弱多病到6块腹肌，20岁姑娘把“林黛玉倒拔垂杨柳”具象化了！网友：反差好大,2024-10-27 01:32,377,276,极目新闻,极目新闻,近日，浙江诸暨一女孩突然火了。她在网上晒出自己健身练出的麒麟臂，网友看后直呼“林黛玉倒拔垂杨柳”具象化了。读书时体弱多病决定健身改变自己这个诸暨女孩叫小许今年20多岁，视频里，小许甜美的外表和硬汉的麒麟臂形成了巨大反差。,http://jms.ctdsb.net/jmythshare/#/index_share?cId=0&contentType=5&contentId=2289665,,0,0,False
美方通知中国，将再次派大型飞机遣返非法移民，中方明确回应,2024-10-24 07:31,3533,1316,阿皮历史库,阿皮历史库,,https://toutiao.com/group/7429241426850644499/,,0,0,True
猪肉别总是炒着吃了，教你简单又好吃的做法，简直太香了,2024-09-11 09:11,10292,518,家常的味道,家常的味道,猪肉别总是炒着吃了，教你简单又好吃的做法，简直太香了,https://toutiao.com/group/7413310656981664283/,,0,0,True
初中毕业去当流水线女工，五年后却成为世界冠军，22岁成人生赢家,2024-08-02 10:46,6369,1220,豆莱说,豆莱说,文：豆莱说编辑：豆莱说支持作者，写作不易，文中会有5s广告，观看后可免费阅读全文父母曾设想过子女的千百种可能，只是对于一个走上中专之路的孩子，无非也是毕业，打工，进工厂，养家糊口。,https://toutiao.com/group/7398489613888766475/,,0,0,False
以后想吃回锅肉你就像我这样做，肥而不腻，咸香适口，太解馋了,2024-08-06 11:19,35036,1285,家常的味道,家常的味道,,https://toutiao.com/group/7399984507362738742/,,0,0,True
关键摇摆州密歇根拉票 哈里斯获前第一夫人米歇尔站台,2024-10-27 02:18,6768,2265,中国网资讯,中国网资讯,关键摇摆州密歇根拉票 哈里斯获前第一夫人米歇尔站台,https://toutiao.com/group/7430274225636409866/,,0,0,True
04年，福建美女被执行注射死刑，被按执行床前，她向狱警深深鞠躬,2024-10-25 08:27,826,108,艺述史,艺述史,2004年6月的一个清晨，31岁的方晓红被狱警从监室带出，走向执行车，离去了。一般的犯人到这一步，不是手脚发软就是痛哭流涕，但方晓红却很是淡定，甚至还对着狱警深深鞠了一躬，上车离开了。,https://toutiao.com/group/7429625579554472511/,,0,0,False
