title,publish_time,like_count,comment_count,media_name,source,abstract,article_url,tag,is_yaowen,article_sub_type,has_video
独家完整版视频丨国家主席习近平发表二〇二五年新年贺词,2024-12-31 11:15,23097,14407,央视新闻,央视新闻,新年前夕，国家主席习近平通过中央广播电视总台和互联网，发表了二〇二五年新年贺词。全文如下：大家好！时间过得很快，新的一年即将到来，我在北京向大家致以美好的祝福！2024年，我们一起走过春夏秋冬，一道经历风雨彩虹，一个个瞬间定格在这不平凡的一年，令人感慨、难以忘怀。,https://content-static.cctvnews.cctv.com/snow-book/index.html?item_id=1506781951411024055&source=50006&sub_source=50006_001,,0,0,False
独家视频丨国家主席习近平向大家致以美好的祝福,2024-12-31 11:04,865,700,央视新闻,央视新闻,新年前夕，国家主席习近平通过中央广播电视总台和互联网，发表了二〇二五年新年贺词。习近平：大家好！时间过得很快，新的一年即将到来，我在北京向大家致以美好的祝福！©2024中央广播电视总台版权所有。未经许可，请勿转载使用。,https://content-static.cctvnews.cctv.com/snow-book/index.html?item_id=3058834507220543667&source=50006&sub_source=50006_001,,0,0,False
独家视频丨习近平：两岸同胞一家亲 谁也无法割断我们的血脉亲情,2024-12-31 11:12,362,399,央视新闻,央视新闻,新年前夕，国家主席习近平通过中央广播电视总台和互联网，发表了二〇二五年新年贺词。习近平：两岸同胞一家亲，谁也无法割断我们的血脉亲情，谁也不能阻挡祖国统一的历史大势！©2024中央广播电视总台版权所有。未经许可，请勿转载使用。,https://content-static.cctvnews.cctv.com/snow-book/index.html?item_id=13327794526506738937&source=50006&sub_source=50006_001,,0,0,False
老纪和珅这段对话，以前小时候听不懂，如今听完受益终身,2024-12-28 23:16,4303,1281,乐视扒剧小妹儿,乐视扒剧小妹儿,,https://toutiao.com/group/7453420191947424293/,,0,0,True
萝卜和鸡蛋这样做，比吃补药还补，顿顿吃都不会腻，又香又下饭,2024-10-30 12:28,71214,4347,小寒厨艺,小寒厨艺,萝卜和鸡蛋这样做，比吃补药还补，顿顿吃都不会腻，又香又下饭,https://toutiao.com/group/7431405463378919975/,,0,0,True
新婚33天卷走274万4套房，出逃后丈夫跨国追捕，如今下场大快人心,2024-12-20 22:06,4490,233,八号探秘人,八号探秘人,在阅读此文之前，辛苦您点击一下“关注”，既方便您进行讨论和分享，又能给您带来不一样的参与感，感谢您的支持！编辑丨QQ·B“色字头上一把刀！”深圳富豪结婚33天竟被卷走274万元和名下4套房产。不仅如此，他还被扣上了“接盘侠”的帽子，啥也没干喜当爹。,https://toutiao.com/group/7450399558821052982/,,0,0,False
解放军反制快准狠，万吨大驱与轰6共抵黄岩岛，菲律宾要好自为之,2024-12-31 07:25,704,243,黄教授,黄教授,图为轰6轰炸机最近，想起一句老话，时代变了，前朝的剑斩不了本朝的官。今天的菲律宾就还在用美国的中程导弹威胁中国，结果这下子求锤得锤，等来了解放军的轰6和055大驱，等来了解放军海军火速进军黄岩岛。那么，解放军轰6与万吨大驱进军黄岩岛，仅仅是敲打菲律宾？,https://toutiao.com/group/7454473481880404520/,,0,0,False
明天起，全体公民法定节假日增加2天！,2024-12-31 00:29,1358,434,闽南网,闽南网,根据2024年11月修订的《全国年节及纪念日放假办法》，自2025年1月1日起，全体公民放假的假日增加2天，即农历除夕、5月2日。增加后，春节放假4天（农历除夕、正月初一至初三），劳动节放假2天（5月1日、2日）。放假总天数从11天增加至13天。,https://toutiao.com/group/7454366142983913993/,,0,0,False
蒋介石孙子召开发布会，要将“两蒋”移灵大陆，两句话让世人唏嘘,2024-12-06 07:24,19265,2161,赢梯,赢梯,“你爷爷、你父亲生前都有一个遗愿，希望去世后，能葬在大陆。”1995年，79岁的蒋纬国，在和侄子蒋孝勇聊天时，提到了这件事。,https://toutiao.com/group/7445194705530569256/,,0,0,False
到底是外公亲，还是爷爷亲？心理学家的答案很统一,2024-12-30 06:35,538,248,第一心理,第一心理,一位读者来信，提到最近自己遇到的一些家庭相关的琐事，并提出了自己的一些疑问。具体情况如下：这位读者是一个孩子的母亲，与丈夫结婚之后，一直在丈夫家所在城市生活，也受了公公婆婆不少接济，由于自己父母在另外的城市，有点距离但是不远，孩子出生之后也一直与爷爷奶奶接触更多。,https://toutiao.com/group/7454088472568857126/,,0,0,False
六代机双飞、四川舰三个第一，神雕无人预警机，中国军工震惊美国,2024-12-30 06:02,39621,2079,邱毅台湾,邱毅台湾,,https://toutiao.com/group/7454081205471085107/,,0,0,True
老人在家带孙女，儿媳从监控看到这画面泪目了,2024-12-31 02:41,2036,175,新派新闻,新派新闻,,https://toutiao.com/group/7454215156852064818/,,0,0,True
煮米饭别总是加水了，难怪不好吃，教你酒店不外传的秘诀，非常香,2024-12-06 08:45,3606,777,明玥美食,明玥美食,,https://toutiao.com/group/7445217195929371190/,,0,0,True
明天是元旦，点开这首歌听听，2025 年一切都如愿！,2024-12-30 23:07,4625,833,大地春晖,大地春晖,明天是元旦，点开这首歌听听，2025 年一切都如愿！,https://toutiao.com/group/7453763957321368083/,,0,0,True
包厢全是刚出狱的恶霸，结果一看到饭店主厨，立马怂了,2024-11-11 01:21,14330,388,乐视群星访谈秀,乐视群星访谈秀,,https://toutiao.com/group/7435825833048015400/,,0,0,True
央视跨年晚会节目单出炉！,2024-12-31 09:54,550,986,环球时报,环球时报,《启航2025——中央广播电视总台跨年晚会》节目单出炉！戳↓↓你最期待哪一个？别错过！,https://toutiao.com/group/7454502317837025818/,,0,0,False
赖当局为何羁押高安国将军？解放军六代机及076舰震惊台湾,2024-12-30 22:01,24580,1516,黎建南台湾,黎建南台湾,,https://toutiao.com/group/7454328325800985126/,,0,0,True
贪官酒桌上的权钱交易，语言天衣无缝，听懂三分都是人精！,2024-11-23 16:24,3688,444,乐视扒剧小妹儿,乐视扒剧小妹儿,,https://toutiao.com/group/7440378916130259496/,,0,0,True
湖南最长寿老人124岁高龄，长寿秘诀出世，让人大开眼界,2024-12-21 16:00,1792,171,乐视群星访谈秀,乐视群星访谈秀,,https://toutiao.com/group/7450730131821167140/,,0,0,True
马斯克76岁母亲在中国火了，自称几乎每个月都来，对中国赞不绝口,2024-12-28 11:42,20857,725,国际时事快递,国际时事快递,,https://toutiao.com/group/7453361562800095779/,,0,0,True
被央媒怒批，目不识丁，丢人现眼，这几位“文盲”明星凭什么走红,2024-12-30 10:52,2279,592,与君説,与君説,在阅读此文之前，麻烦您点击一下“关注”，既方便您进行讨论和分享，又能给您带来不一样的参与感，感谢您的支持文、编辑|小娄郭德纲曾说“可以没文凭，但不能没文化”。老郭的这句话在儿子郭麒麟身上体现得淋漓尽致。虽然郭麒麟初中就辍学了，但人家有思想有内涵，是个名副其实的“文化人”。,https://toutiao.com/group/7454151513221661234/,,0,0,False
说一说成飞的新飞机，网上传的越来越玄乎，究竟有多厉害？,2024-12-29 13:21,11533,1359,陈虎点兵,陈虎点兵,,https://toutiao.com/group/7453823402932732435/,,0,0,True
中国已经下水第8艘航母？美媒宣称：14年下水8艘航母，速度创纪录,2024-12-30 09:28,2115,472,东方点兵,东方点兵,076官宣正式下水，美媒宣称，这是中国海军“下水”的第8艘航母，14年接连下水8艘航母，速度史无前例。,https://toutiao.com/group/7454133080303976999/,,0,0,False
10派23.3元！A股又现大额分红,2024-12-30 20:39,974,318,中国证券报,中国证券报,12月30日晚，包括古井贡酒、洋河股份、国泰环保、阿拉丁、川仪股份、佳驰科技在内的30余家上市公司发布三季度或者中期分红相关公告，引发市场关注。,http://mp.weixin.qq.com/s?__biz=MjM5MzMwNjM0MA==&mid=2651264219&idx=2&sn=34de6f52c39ced47bc6a0dcd69e79025,,0,0,False
成飞新机的动力会是三发动机吗？追求高空高速，是为了更大的航程,2024-12-30 10:18,7298,883,陈虎点兵,陈虎点兵,,https://toutiao.com/group/7454145253613601319/,,0,0,True
央视跨年晚会阵容曝光，看完明星名单，厕所都不敢去上了,2024-12-31 09:19,1002,653,闻书识焉,闻书识焉,其中最受关注的还是央视跨年晚会，昨日，央视也官宣了晚会第一批明星阵容和播出时间。看到演员阵容真的是百花齐放、星光熠熠，不是一般的豪华，中途厕所都不敢去了。,https://toutiao.com/group/7454493031660667411/,,0,0,False
海南富商张晖：花8亿建108米海上观音像，4年后死在水中死因成谜,2024-10-19 04:49,4709,839,八号探秘人,八号探秘人,在阅读此文之前，辛苦您点击一下“关注”，既方便您进行讨论和分享，又能给您带来不一样的参与感，感谢您的支持！编辑丨xk他是中国的一名富商，耗费8亿元完成了自己的梦想。可梦想落地成为现实的时候，他却在4年后莫名其妙的死去。他就是张晖，上个世纪末海南岛旅游业的龙头当家人。,https://toutiao.com/group/7427288913095492134/,,0,0,False
中国第八道硬菜上桌，美国绝对消化不良！（上）,2024-12-30 22:00,3862,158,占豪,占豪,面对中国科技大爆发，美国怎么办？现在临时再加大力度投入能行吗？,https://toutiao.com/group/7454120162862563840/,,0,0,True
高安国夫妻被秘密收押，赖清德下狠手消灭统派，下一个会是谁？,2024-12-31 08:40,11177,2294,邱毅台湾,邱毅台湾,,https://toutiao.com/group/7454493107262849575/,,0,0,True
欧洲会爆发世界大战吗？俄乌2025年能否止战？|凤凰《非常2024》,2024-12-30 07:54,2172,152,凤凰卫视,凤凰卫视,,https://toutiao.com/group/7454110252754010664/,,0,0,True
广西49岁老汉娶19岁姑娘，结婚21年生下15个孩子，如今有何下场？,2024-10-20 08:32,9902,1228,艺述史,艺述史,她19岁出嫁，21年里总共生育了15个孩子，其中4个男孩子11个女孩子，家里热闹的像是开了一所学校一样。,https://toutiao.com/group/7427400319418384948/,,0,0,False
厨师长教你：“葱爆羊肉”羊肉滑嫩、鲜香不膻,2024-12-27 07:34,2659,484,美食作家王刚,美食作家王刚,厨师长教你：“葱爆羊肉”羊肉滑嫩、鲜香不膻,https://toutiao.com/group/7452991735665263139/,,0,0,True
再现久违声音！蔡磊借助AI完成了一场演讲,2024-12-31 01:12,7237,1069,央视新闻,央视新闻,“我坚信，我们终有战胜渐冻症的那一天。”在《AI奇妙夜》晚会现场，渐冻人蔡磊借助AI完成了一场演讲，重获新“声”！,https://toutiao.com/group/7454377687977722422/,,0,0,True
县长看不上乡长送的烟，给他退回来，乡长打开一看乐了,2024-11-13 08:16,11359,1878,乐视大综艺咖,乐视大综艺咖,,https://toutiao.com/group/7436672568578277925/,,0,0,True
千万别上当！美国著名智囊学者提醒美军：歼-36是中国式“圈套”,2024-12-31 07:24,3667,1408,高峰军事观察,高峰军事观察,虽然B-21还没有量产服役，但是一个流传出来的美军B-21战略打击中队的“臂章”，透露出美国空军的“野心”。,https://toutiao.com/group/7454461747441779200/,,0,0,False
中美贸易战中，我们已不再被动！,2024-12-29 03:00,26242,285,卢克文工作室,卢克文工作室,,https://toutiao.com/group/7453398751932219941/,,0,0,True
河南警察3岁女儿被拐，苦寻全国23年无果，结果却发现女儿在对门,2024-11-05 07:43,5940,609,八号探秘人,八号探秘人,寻亲23年无果，丢失的女儿竟住在对门?但它却真实发生在河南洛阳的梁绍波身上。是意外走丢，还是人贩子所为，三岁的女儿怎会离奇失踪?,https://toutiao.com/group/7433697108120142345/,,0,0,False
世界变天，到了该亮剑的时候了！（下）,2024-12-27 22:30,5183,204,占豪,占豪,未来全球的货币到底本位于什么？没有这样一个大池子，别人怎么去长期持有人民币呢？,https://toutiao.com/group/7453026076818670132/,,0,0,True
弟弟光荣退伍，姐姐兴奋去车站接他，怎料一见弟弟瞬间哭了,2024-11-05 06:34,43597,3432,乐视天天剧好看,乐视天天剧好看,,https://toutiao.com/group/7433679820573934091/,,0,0,True
清华才女李一诺：27岁博士毕业，4年生3娃，能替世界首富花钱,2024-12-18 05:51,7637,350,云莳一,云莳一,家庭是她第一个学校，妈妈是她第一任老师。李一诺27岁博士毕业进入美国麦肯锡公司，33岁成为公司全球董事合伙人，之后四年连生3娃。,https://toutiao.com/group/7449591069311779355/,,0,0,False
小子相亲故意扮老，谁知道对方一见面就叫他大爷，这段太逗了,2024-12-24 08:17,2604,585,乐视热播综艺精选,乐视热播综艺精选,,https://toutiao.com/group/7451886130837848610/,,0,0,True
特朗普要结束俄乌冲突，从两个角度来分析，为什么欧洲先慌了神,2024-12-26 07:32,13779,297,陈虎点兵,陈虎点兵,,https://toutiao.com/group/7452620108058329627/,,0,0,True
金价大跌！“接待不过来”，商户每天发走七八千件，网友：四五百再买,2024-12-31 07:34,232,132,潇湘晨报•晨视频,潇湘晨报•晨视频,近日，深圳水贝金价跌至622元每克的消息冲上热搜。随着国际金价大幅走低，近日，部分传统零售金店金价跌破800元/克关口，深圳水贝市场的金价则进一步跌至622元/克。金价下跌，叠加元旦、春节双节将近，黄金销售市场开始热闹起来。,http://api.chenshipin.com/wap/a/67739d528420170a551901a6/90f456b81afce808c1fcfbd3f5761f65/1735630290/9e06c602c01aecf0fb8650a5ee044f8684fe0ac548f292350f29650815b38150,,0,0,False
