title,publish_time,like_count,comment_count,media_name,source,abstract,article_url,tag,is_yaowen,article_sub_type,has_video
一习话·奋进的春天丨以文化人  聚人心、暖民心、强信心,2025-03-03 13:10,357,1275,央广网,央广网,“泱泱中华，历史何其悠久，文明何其博大，这是我们的自信之基、力量之源。”习近平总书记始终将文化建设摆在治国理政突出位置，就此作出一系列重要论述，强调“讲好中国故事”“通过以文化人更好聚人心、暖民心、强信心”。,https://www.cnr.cn/newscenter/local/dftj/20250303/t20250303_527088621.shtml,,0,0,False
当“网红”混进央视《六姊妹》，演技烂得像外行，梅婷都带不动,2025-03-04 01:09,525,118,通观报道,通观报道,这些年轻演员们，脸上还带着些许稚气，眼眸中满是懵懂，他们来演绎十九二十岁的角色，仿佛是时光回溯，把那个年代年轻人特有的青春气息展现得淋漓尽致。,https://toutiao.com/group/7477755113906487860/,,0,0,False
"92岁老太翻过两米大门逃出养老院,全程仅用了24秒",2025-03-03 05:44,5953,1347,民生阳光纪事,民生阳光纪事,,https://toutiao.com/group/7477455089364632102/,,0,0,True
中俄为何要站在一起，李显龙一语道破，我们还会遇到美国霸权,2025-03-04 16:52,16179,651,孙绪闻,孙绪闻,中俄为何要站在一起，李显龙一语道破，我们还会遇到美国霸权,https://toutiao.com/group/7477998067472482828/,,0,0,True
东北虎进村了,2025-02-28 10:30,13594,2744,趣味人生,趣味人生,,https://toutiao.com/group/7476415274527277603/,,0,0,True
理性解决第三者,2025-03-04 16:14,3064,366,桃源壹佰生活事,桃源壹佰生活事,,https://toutiao.com/group/7477988517591679526/,,0,0,True
中国狠狠出击，大批美间谍卖掉百万房产，连夜携款逃窜！丨中国,2025-03-02 04:46,8645,232,影综大咖秀,影综大咖秀,,https://toutiao.com/group/7477069023109186074/,,0,0,True
赵本山买鸡这段，据说导演组都笑趴了，真是老戏骨,2025-01-06 15:43,36309,4696,山丘,山丘,,https://toutiao.com/group/7456827104982811170/,,0,0,True
难以置信，这是塞尔维亚国家议会现场？！,2025-03-04 15:02,5635,3348,随风飘散的水分子,随风飘散的水分子,,https://toutiao.com/group/7477969756642755135/,,0,0,True
“我们不属于中国？”街头采访引发的争议,2025-03-05 01:19,1623,1520,橙橙分享,橙橙分享,,https://toutiao.com/group/7478128886837019187/,,0,0,True
万斯的完整采访！,2025-03-04 07:38,884,402,会沉寂吗,会沉寂吗,,https://toutiao.com/group/7477855382409462335/,,0,0,True
可爱的婵宝把领导给整不会了！,2024-12-26 03:30,10530,898,狗子讲解,狗子讲解,可爱的婵宝把领导给整不会了！,https://toutiao.com/group/7452557841941922314/,,0,0,True
