title,publish_time,like_count,comment_count,media_name,source,abstract,article_url,tag,is_yaowen,article_sub_type,has_video
人民日报社论：强农固本，为推进中国式现代化提供基础支撑,2025-02-23 22:48,974,473,人民日报,人民日报,原标题：强农固本，为推进中国式现代化提供基础支撑（社论） 春为一岁首，农为百事先。新春伊始，部署做好“三农”工作，关涉全年，关系大局。中共中央、国务院公开发布《关于进一步深化农村改革 扎实推进乡村全面振兴的意见》。,https://www.peopleapp.com/column/30048332976-500006107896?utm_source=头条号&promote=true,,0,0,False
突发！云南某景区发生雪崩，瞬间淹没人群。,2025-02-22 07:43,1150,223,艾琦,艾琦,,https://toutiao.com/group/7474145800726037026/,,0,0,True
有这样的老婆，你家祖坟都冒青烟了！,2025-02-04 03:11,80992,13025,乐观的冰淇淋I,乐观的冰淇淋I,,https://toutiao.com/group/7467226170908606976/,,0,0,True
三个女婿早就习惯了，所以车都没下，估计连火都没熄！,2025-02-10 23:46,7307,1070,优美小红花情感正能量,优美小红花情感正能量,,https://toutiao.com/group/7469940786830950964/,,0,0,True
中国小将陆永面对不公判罚，用实力打脸裁判，将金牌留在中国！,2025-02-10 14:43,14576,1103,中国好青年,中国好青年,,https://toutiao.com/group/7469800968171913755/,,0,0,True
媳妇玩到半夜才回来，以为老公不在家，进门这操作把老公看懵了,2025-01-24 09:38,13131,3468,滕菲,滕菲,,https://toutiao.com/group/7463414214191743497/,,0,0,True
“你多大呀？”💄✨💓,2025-01-28 23:38,26247,2959,海不会等风来,海不会等风来,,https://toutiao.com/group/7465020691469828648/,,0,0,True
这个最能体现资本家的嘴脸了，又丑又难看！,2025-02-19 01:35,21820,7202,乐乐纪实,乐乐纪实,,https://toutiao.com/group/7472937629332275753/,,0,0,True
调戏一下老公，增进夫妻感情！,2025-01-30 09:08,4121,139,L&T,L&T,,https://toutiao.com/group/7465612989018669580/,,0,0,True
公公竟然和儿媳偷情，哪料被妻子撞见，这下有戏看了！,2025-01-21 08:05,13531,1085,南瓜午夜厅,南瓜午夜厅,,https://toutiao.com/group/7462273852651979274/,,0,0,True
一觉醒来，德国变天了,2025-02-23 23:40,1805,331,牛弹琴,牛弹琴,一觉醒来，尘埃落定，德国变天了。朔尔茨大叔，将不是德国总理了。选举政治，上上下下，也都在意料之中。只是2月23日的德国大选，朔尔茨领衔的社民党，却只拿到16%的选票，沦为最大的输家。,https://toutiao.com/group/7474760347635761679/,,0,0,False
