title,publish_time,like_count,comment_count,media_name,source,abstract,article_url,tag,is_yaowen,article_sub_type,has_video
老虎进院子！站的最高的竟然是最危险的,2025-02-16 16:15,54797,6539,事实听风者,事实听风者,,https://toutiao.com/group/7472051200083591720/,,0,0,True
突发、上海松江车墩电商物流仓库着火！,2025-02-16 23:29,1368,599,亲切咖啡i,亲切咖啡i,,https://toutiao.com/group/7472163047797293594/,,0,0,True
不是做梦！国足U20巴萨式连续11脚传递，惊艳全场！打进完美进球,2025-02-15 15:24,4981,1360,1w体育课,1w体育课,,https://toutiao.com/group/7471666792251834895/,,0,0,True
公公竟然和儿媳偷情，哪料被妻子撞见，这下有戏看了！,2025-01-21 08:05,13327,1076,南瓜午夜厅,南瓜午夜厅,,https://toutiao.com/group/7462273852651979274/,,0,0,True
新冠疫苗三针影响寿命？真相来了,2025-02-18 02:11,805,394,智者白云,智者白云,,https://toutiao.com/group/7472557509568365110/,,0,0,True
太可怕了！这混乱的场景让我心惊胆战！,2025-02-06 12:39,5535,3022,【江湖规矩,【江湖规矩,,https://toutiao.com/group/7468284742652166690/,,0,0,True
出租车司机半路捡个姑娘，直接带回家，老婆一看反应笑翻了,2025-01-14 07:28,11808,602,南瓜钟意你,南瓜钟意你,,https://toutiao.com/group/7459669645180650024/,,0,0,True
离婚九年我出差路过前岳母家，叫了十几年爸妈，还是进去看了一眼,2024-12-17 05:52,3522,876,福乐满心,福乐满心,离婚九年我出差路过前岳母家，叫了十几年爸妈，还是进去看了一眼,https://toutiao.com/group/7448948161780908595/,,0,0,True
严重怀疑爸爸是缅甸高层回国了，要被笑死了😃 ！大饼画的不错,2025-02-18 01:37,7493,1316,热爱分享的小蜜蜂,热爱分享的小蜜蜂,,https://toutiao.com/group/7472567202438087220/,,0,0,True
U20亚洲杯中国队攻破澳大利亚球门！凌空抽射，这球太漂亮了！,2025-02-18 12:15,2172,261,皮皮看世界,皮皮看世界,,https://toutiao.com/group/7472731587587703348/,,0,0,True
