title,publish_time,like_count,comment_count,media_name,source,abstract,article_url,tag,is_yaowen,article_sub_type,has_video
德国总理朔尔茨和普京通电话，泽连斯基怒了，马斯克随即补上一刀,2024-11-18 06:10,21525,707,邱毅台湾,邱毅台湾,,https://toutiao.com/group/7438497761214857739/,,0,0,True
真经不在西天，而在路途。苦难72变，笑对81难，星辰之光，终闪烁,2024-10-21 09:31,3912,350,冒险雷探长,冒险雷探长,,https://toutiao.com/group/7426665794982904330/,,0,0,True
拜登挑衅普京！美政权移交生变数！ 欢迎收看《谦言谦语》播出,2024-11-19 02:03,6204,110,赖岳谦官方,赖岳谦官方,,https://toutiao.com/group/7438805272979571236/,,0,0,True
拜登突然对俄下死手，批准乌克兰轰炸俄罗斯？特朗普儿子表态了,2024-11-19 06:06,4323,316,历史有点冷,历史有点冷,拜登突然对俄下死手，批准乌克兰轰炸俄罗斯？特朗普儿子表态了,https://toutiao.com/group/7438867958148891162/,,0,0,True
许家印，最新消息,2024-11-19 04:16,271,378,全国党媒信息公共平台,全国党媒信息公共平台,近日，广州市南沙区人民法院向中国恒大集团及许家印发出限制消费令，因中国恒大集团未按执行通知书指定的期间履行生效法律文书确定的给付义务，对中国恒大集团采取限制消费措施，限制中国恒大集团及其主要负责人许家印不得实施所列出的高消费及非生活和工作必需的消费行为。,https://api-m.hubpd.com/transfer?nextUrl=https%3A%2F%2Fwww.hubpd.com%2Fhubpd%2Frss%2Ftoutiao%2Findex.html&contentId=2017612633065255440,,0,1,False
央视曝光！含致癌物，很多家庭都还在用,2024-11-18 08:30,512,268,环球网,环球网,来源：海南广播电视总台 近日#央视曝光乳胶床垫造假黑幕#等相关话题引发网友热议许多假乳胶枕也被曝光出来据媒体报道，一些劣质乳胶枕除了乳胶含量不达标，功能减弱，甚至还会挥发苯乙烯致癌物，对人体造成伤害。这种枕头、床垫含致癌物核辐射超标！,https://3w.huanqiu.com/a/d4d603/4KJ2DCsUkGa?agt=20,,0,0,False
成交2800亿，售出1195架飞机，中国拿下大单，足够造46艘055大驱,2024-11-18 10:32,4032,738,东方点兵,东方点兵,本届珠海航展成交金额再创新高，达到了2800亿，以这个价格来计算的话已经足够再造46艘055大驱，进一步彰显了中国制造实力的同时，也展示了中国军工的蓬勃发展。01 本届珠海航展卖出1195架飞机本届珠海航展3款五代机同款亮相，达成了历史性一幕的同时，也让这次航展的成交额再创新高。,https://toutiao.com/group/7438561690305839657/,,0,0,False
吕礼诗参观珠海航展，见中国强激动流下男儿泪，台独玻璃心又碎了,2024-11-16 04:45,33468,1342,邱毅台湾,邱毅台湾,,https://toutiao.com/group/7437733759829180969/,,0,0,True
她陪伴陈道明8年，2亿身价不求名分，转身嫁王菲初恋成人生赢家,2024-09-28 04:05,694,117,八号探秘人,八号探秘人,很难想象，作为一个出道近30年的演员，她一直把父亲的这句话当做从业的信条。从打字员到演员，沉寂十年一炮而红，可她却选择再次沉淀。,https://toutiao.com/group/7419540029581591103/,,0,0,False
红房子：这段堪称最精彩，范伟和李小璐演技炸裂，百看不厌！,2024-11-11 02:36,1376,153,南瓜热剧回放,南瓜热剧回放,红房子：这段堪称最精彩，范伟和李小璐演技炸裂，百看不厌！,https://toutiao.com/group/7435845105006674458/,,0,0,True
曾被张艺谋力捧，火后与富豪卷款61亿逃亡国外，现在的她过得如何,2024-11-02 09:26,1602,160,八号探秘人,八号探秘人,她就是韩熙庭，就在人们以为中国影视圈又要多出一位重磅影后时，她却突然销声匿迹，与一位富豪携巨款逃亡去了国外。,https://toutiao.com/group/7432569178801898034/,,0,0,False
“全家都崩溃了”！花重金请来的月嫂，上岗第10天就被发现……,2024-11-14 10:10,3405,1278,环球网,环球网,来源：新闻晨报 为照顾新生的宝宝，祝女士提前在天鹅到家平台预约了一名月嫂黄阿姨。黄阿姨不仅曾经是一名医师，而且还会“开乳”和产后康复。10月8日，祝女士的宝宝降生后，黄阿姨就带着自己的行李，在他们的“城市经理”陪同下上岗了。,https://3w.huanqiu.com/a/a7835f/4KFkEYL1QL8?agt=20,,0,0,False
1米3袖珍美女嫁给1米48男孩，婚后丈夫奇迹长高，两人却不欢而散,2024-09-07 02:55,5241,291,睿之悦,睿之悦,杨萍和葛存苗的婚礼 文|睿之悦 编辑|睿之悦2019年，成都的民政局来了两个“10岁小孩”来登记，工作人员以为是玩闹。两个“小孩”拿出身份证让工作人员看，这才明白，原来是两个再也长不高的成年袖珍人情侣。,https://toutiao.com/group/7411713833267364386/,,0,0,False
印度试射首枚高超音速导弹，戴着“歪帽”飞行，这到底是个啥？,2024-11-19 07:15,3445,632,杜文龙,杜文龙,,https://toutiao.com/group/7438885631647351336/,,0,0,True
风水：梁朝伟给富婆看风水，这服务必须到位，这段太精彩了,2024-11-19 01:57,2817,469,南瓜钟意你,南瓜钟意你,风水：梁朝伟给富婆看风水，这服务必须到位，这段太精彩了,https://toutiao.com/group/7438803799575102003/,,0,0,True
阿里走了，陌陌走了，望京中产也在卖房离开,2024-11-19 09:10,542,290,36氪,36氪,近日，市场传闻在望京驻扎了10年的老住户陌陌科技也将从望京搬离。从今年8月份开始，陌陌在酒仙桥的新办公楼就已经开始装修，目前已经施工3个月，距离搬新家也不远了。,https://36kr.com/p/3043086140836488,,0,0,False
俩人相亲互相看不上，哪料男方一报母亲身份，姑娘乐了,2024-11-08 01:50,9369,2190,乐视群星访谈秀,乐视群星访谈秀,,https://toutiao.com/group/7434719902990074395/,,0,0,True
包厢全是刚出狱的恶霸，结果一看到饭店主厨，立马怂了,2024-11-11 01:21,6705,148,乐视群星访谈秀,乐视群星访谈秀,,https://toutiao.com/group/7435825833048015400/,,0,0,True
人被咬伤门被撞坏找谁赔？自卫若失手打死老虎违法吗？抓到如何处置？律师详解,2024-11-18 10:22,602,803,极目新闻,极目新闻,11月18日，黑龙江勃利县出现老虎进村伤人事件。目前，县公安局、林业和草原局、应急管理局等部门及属地乡镇工作人员正在追踪老虎行踪。据伤者家属称，这次有“两只老虎”进村，家人被袭时用手臂阻挡避险时被咬，伤情较重，手臂恐怕难以保住。,http://jms.ctdsb.net/jmythshare/#/index_share?cId=0&contentType=5&contentId=2307224,,0,0,False
初中生在校10元晚餐仅一汉堡吃不饱？当事学校称反映不实，教育局：学生可自带餐食，配餐问题正核实,2024-11-19 09:37,175,220,大风新闻,大风新闻,近日，一山东IP网友称学校10元配餐太敷衍，只有一个小汉堡，初中生难以饱腹，引发关注。网友吐槽——学校10元配餐太敷衍，初中生怎么能吃饱网友的视频配文显示，“学校配餐太狠了。”视频中，一个拳头大小的汉堡，中间仅夹了块鸡柳排和一片黄瓜。,https://toutiao.com/group/7438920196905107978/,,0,0,False
4队6分！积分榜：国足跌至第5，日本16分领跑，印尼击败沙特升第3,2024-11-19 14:09,209,316,直播吧,直播吧,直播吧11月19日讯 世预赛亚洲区第三阶段C组第6轮，中国男足1-3不敌日本，印尼2-0击败沙特。目前C组积分榜上，日本队16分断层领跑，印尼连超沙特和中国队升至第3，国足跌至第5。北京时间明天凌晨2点15分，巴林将在主场对阵澳大利亚。,https://news.zhibo8.com/zuqiu/2024-11-19/673c95bf2a3a3native.htm,,0,0,False
美妇约见老情人，见面场景真是太逗了，这俩人绝配！,2024-10-27 16:25,3798,492,乐视明星的那点事,乐视明星的那点事,美妇约见老情人，见面场景真是太逗了，这俩人绝配！,https://toutiao.com/group/7428157095108674088/,,0,0,True
原来他才是毁掉刘翔真凶，因贪1200万被公审，让刘翔背负多年骂名,2024-08-29 09:58,15002,454,八号探秘人,八号探秘人,在田径场上创造的成绩，至今无人能够打破，甚至在国际上享有盛名。本该继续夺冠之路，却两次因伤退赛，遭到了全网辱骂。,https://toutiao.com/group/7408489498465616410/,,0,0,False
罕见！100年前，英国游客拍下的清朝乡村，和想象中完全不一样,2024-09-20 02:07,6783,663,万物知识局,万物知识局,泥泞的土路，衣不蔽体的老百姓，即便是达官显贵的家中也十分破败，而这些都是清王朝的历史痕迹，虽说那时候中国摄影技术并不发达，但也有许多外国游客来到这里，拍摄下了许多老照片，为我们留下了珍贵的历史资料，那清朝到底是怎样的面貌呢?,https://toutiao.com/group/7416287738871267855/,,0,0,False
男子为骗保开车撞树当场身亡，现场没有刹车痕迹，报案人是死者表兄弟，却跟警方说是去买茶叶路上发现事故,2024-11-19 03:10,314,413,大河报,大河报,一起蹊跷的事故中，交警发现现场疑点重重，于是他们顺藤摸瓜，居然牵出了一起骗保案。2024年2月12日晚，河南桐柏县公安局110指挥中心接到了一起交通事故的报警。,https://toutiao.com/group/7438821406575526454/,,0,0,False
神奇时间，13时52分！A股强势逆转，近百股涨停，还有的跌停变涨停！中间发生了什么？,2024-11-19 09:04,898,653,每日经济新闻,每日经济新闻,今日午后，上证指数一度跌破3300点，13时52分左右，指数强势逆转，随后持续走强。截至收盘，沪指涨0.67%，深成指涨1.9%，创业板指涨3%。北证50涨0.89%，此前一度跌超6%。锂电股爆发今日全市场超4500只个股上涨，97只个股涨停，市场迅速扭转低迷情绪。,http://www.nbd.com.cn/rss/jinri_toutiao/articles/3651125.html,,0,0,False
