title,publish_time,like_count,comment_count,media_name,source,abstract,article_url,tag,is_yaowen,article_sub_type,has_video
媳妇玩到半夜才回来，以为老公不在家，进门这操作把老公看懵了,2025-01-24 09:38,11602,3213,滕菲,滕菲,,https://toutiao.com/group/7463414214191743497/,,0,0,True
震撼！十秒内连续弹射三架重型战斗机！,2025-01-18 23:48,15312,2145,辉哥杂谈。,辉哥杂谈。,,https://toutiao.com/group/7461406546325406218/,,0,0,True
公公竟然和儿媳偷情，哪料被妻子撞见，这下有戏看了！,2025-01-21 08:05,12782,1045,南瓜午夜厅,南瓜午夜厅,,https://toutiao.com/group/7462273852651979274/,,0,0,True
父母都已不在，男子还未成家，一个人回家过年，鞭炮也不能少。,2025-02-13 10:15,18147,3150,乐天派叶子,乐天派叶子,,https://toutiao.com/group/7470845080074502667/,,0,0,True
有这样的老婆，你家祖坟都冒青烟了！,2025-02-04 03:11,70338,11647,乐观的冰淇淋I,乐观的冰淇淋I,,https://toutiao.com/group/7467226170908606976/,,0,0,True
初中生因好奇将14颗磁力珠塞尿道：每颗直径约5mm，总长约7cm,2025-02-15 01:05,481,150,椒点视频,椒点视频,,https://toutiao.com/group/7471445494242411047/,,0,0,True
出租车司机半路捡个姑娘，直接带回家，老婆一看反应笑翻了,2025-01-14 07:28,11302,579,南瓜钟意你,南瓜钟意你,,https://toutiao.com/group/7459669645180650024/,,0,0,True
在两性关系中女人最多能接受多少岁的男人三位女性说出心里话,2025-01-16 11:08,3129,303,浩言养老,浩言养老,,https://toutiao.com/group/7460468507068449291/,,0,0,True
丈母娘看不起穷女婿，全家聚餐没给女婿留筷子，女儿做法漂亮！,2025-01-27 16:01,3316,880,群星访谈秀,群星访谈秀,,https://toutiao.com/group/7462286897130291724/,,0,0,True
相亲！ 嘴角止不住的上扬！女方颜值太高男方狂献殷勤！,2025-01-24 05:02,21595,6279,圆桌派·话天下,圆桌派·话天下,相亲！ 嘴角止不住的上扬！女方颜值太高男方狂献殷勤！,https://toutiao.com/group/7463342720514327075/,,0,0,True
50岁袖珍大爷，娶了一个漂亮媳妇，妻子一登场王为念羡慕了,2025-01-21 08:56,14750,2455,笑哈哈,笑哈哈,,https://toutiao.com/group/7462174126573240841/,,0,0,True
王志文找江珊复婚，看两人对话简直太享受，不愧是老戏骨啊,2024-11-30 19:30,8066,780,娱快很简单,娱快很简单,,https://toutiao.com/group/7441487197062201893/,,0,0,True
