title,publish_time,like_count,comment_count,media_name,source,abstract,article_url,tag,is_yaowen,article_sub_type,has_video
中日，一出好戏即将上演,2025-01-01 23:38,8633,7555,牛弹琴,牛弹琴,年终上演精彩大戏，新年不排除更有一出好戏。反正，从积极的角度看，中日关系，正处于近20年来最好时期。之所以能说最好，是因为之前实在是太糟。三个值得关注的动向。第一个动向，日本首相石破茂的表态。日前在接受电视访谈时，石破茂说：“日本首相访问中国是极为重要的事。,https://toutiao.com/group/7455091815717388850/,,0,0,False
小品：赵本山经典小品，观众笑声停不住，可惜没上春晚,2024-11-12 02:20,4635,694,PP毒鸡汤剧院,PP毒鸡汤剧院,,https://toutiao.com/group/7436212026386416165/,,0,0,True
这是张学良老婆赵四小姐真实样貌，并非演员饰演而是货真价实真品,2024-12-28 11:28,14329,1795,历史伟人,历史伟人,赵四小姐，原名赵一荻，她从十六岁开始她终生陪伴张学良，历经坎坷，赵一荻是富家大小姐，但是在张学良囚禁期间，她选择陪伴软禁中的张学良，后悔过吗?,https://toutiao.com/group/7453422736652698175/,,0,0,False
一觉醒来，加拿大政府垮了,2025-01-06 23:30,8219,2972,牛弹琴,牛弹琴,一觉醒来，加拿大政府也垮了。加拿大时间1月6日，特鲁多正式宣布，他将辞去自由党党魁和总理职务，在自由党选出新领袖前，他还会继续留任一段时间总理。为什么要辞？特鲁多承认，由于内部争斗，他已经搞不下去了。,https://toutiao.com/group/7456943585049543205/,,0,0,False
记者采访全红婵，套不出话，因为她不按牌理出牌，笑死我了,2025-01-02 00:39,5654,1115,开朗旭日,开朗旭日,,https://toutiao.com/group/7454957414484279834/,,0,0,True
12月23日 15:00 你不知道的全红婵，比你想像中强太多了！,2024-12-23 07:11,1370,171,木子说,木子说,12月23日 15:00 你不知道的全红婵，比你想像中强太多了！,https://toutiao.com/group/7451480373222965787/,,0,0,True
笑死!怪不得全红婵最怕陈若琳，陈若琳回复笑翻网友:相爱相杀,2024-12-28 01:53,1757,163,朝朝爱生活,朝朝爱生活,,https://toutiao.com/group/7453275061521220137/,,0,0,True
可爱的婵宝把领导给整不会了！,2024-12-26 03:30,5598,532,狗子讲解,狗子讲解,可爱的婵宝把领导给整不会了！,https://toutiao.com/group/7452557841941922314/,,0,0,True
中国第4艘航母，被卫星发现蛛丝马迹，直接十万吨级核动力？,2025-01-07 02:11,1882,778,蒋福伟,蒋福伟,卫星发现新航母的“蛛丝马迹”，中国下一艘航母或直接十万吨级核动力?近日，有西方军事专家援引商业卫星照片称，中国航母楼的外形出现了肉眼可见的变化。,https://toutiao.com/group/7456990223185035816/,,0,0,False
外媒：绑架王星幕后老板已被抓！“当时情况比较凶险”，救援详情披露：救援人员发现两处关押场所，均有中国人,2025-01-08 09:54,356,428,每日经济新闻,每日经济新闻,1月8日下午15点20分，演员王星女友 @失眠爹地 发布最新微博，表示“我和星星已于今日上午在位于曼谷的泰国官方机构见面，并在使馆工作人员和律所的陪同下，向警方了解了最新情况和后续安排”，并附上与星星的牵手图。,http://www.nbd.com.cn/rss/jinri_toutiao/articles/3714618.html,,0,0,False
对话地震背同学逃生高中生父亲：他从小就善良，家里开小超市，姐姐去年刚公派德国留学,2025-01-08 00:00,598,218,九派新闻,九派新闻,1月2日16时43分，银川市金凤区发生4.6级地震。地震来临瞬间，本已经往外跑的郭庆看到一名腿脚不便的同学，又迅速折回，将其背起后再次冲出。这一过程被学校的监控记录了下来。央视、人民网等媒体报道，全网点赞他的行为。6日，郭庆获得学校表彰。,http://feed.huiwen.co/rssv2/toutiaohao_article_ttjpnews_9fc19a1f956448fb9826b9fcb4695509/item/IL2DY0LJ4SDV50D.html,,0,0,False
辽宁一冤案历时5年才平反，应调查办案人员是否渎职失职丨快评,2025-01-06 17:00,1399,670,南方周末,南方周末,近日，辽宁省鞍山市岫岩县检察院作出一份《不起诉决定书》，一起持续了5年多的“替父追债被判寻衅滋事”冤案终于全部平反，涉案的6人全部被认定无罪。,http://www.infzm.com/content/285892,,0,0,False
刘强东，全网刷屏！,2025-01-07 16:47,2075,1062,第一财经,第一财经,1月7日，“刘强东给自己小学老师每人发10万”“老家村民到刘强东家门口放鞭炮感谢”“刘强东父亲再光明村与网友唠家常”等话题接连冲上热搜，全网刷屏，引发关注。,http://mp.weixin.qq.com/s?__biz=MTU1OTI4NDM4MQ==&mid=2652266546&idx=1&sn=bded95bf064478cb6962965649d38eab,,0,0,False
冻雨！大雪！全国进入“三九”，南方今年首轮大范围雨雪来袭,2025-01-08 03:32,306,208,红星新闻,红星新闻,今天（1月8日）进入“三九”，冷空气持续影响我国，中东部大部等地降温明显，寒意加重。眼下，南方正在经历今年首轮大范围雨雪天气，今天夜间至明天上午将进入降雪核心时段。,https://toutiao.com/group/7457382169439224383/,,0,0,False
又一起失联！23岁中国船员疑被绑至缅甸，遭殴打视频曝光！家属被勒索10万元,2025-01-08 02:04,993,941,新民晚报,新民晚报,昨天（1月7日），“中国船员疑抵泰国后失联被绑至缅甸”一事持续引发关注，登上多个平台热搜。,https://toutiao.com/group/7457358928017179176/,,0,0,False
一文速览丨特朗普发表胜选获国会确认后首次讲话 都有哪些要点？,2025-01-07 23:27,3180,7462,央视新闻,央视新闻,△特朗普（资料图）当地时间1月6日，唐纳德·特朗普赢得2024年美国总统选举的结果正式获得国会参众两院联席会议确认。当地时间7日，特朗普在佛罗里达州海湖庄园举行新闻发布会，提到了多项上任后将实施的政令和改革。,https://content-static.cctvnews.cctv.com/snow-book/index.html?item_id=5386275821338758674&source=50006&sub_source=50006_001,,0,1,False
中方宣布：取得重大突破！,2025-01-08 06:49,2091,308,闽南网,闽南网,据中评社1月8日报道，自然资源部中国地质调查局8日宣布，中国锂矿找矿取得一系列重大突破，锂矿储量从全球占比6%升至16.5%，从世界第六跃至第二，重塑了全球锂资源格局。,https://toutiao.com/group/7457433098695803430/,,0,0,False
郑钦文捐100万！韩红基金会收到1118万！这些艺人、企业伸出援手——,2025-01-08 06:50,447,135,津云,津云,西藏自治区日喀则市定日县7日发生6.8级地震。正值寒冬腊月，灾区气温骤降，极端天气给受灾群众的生活和救援工作带来了极大挑战。地震发生后，郑钦文、韩红、黄晓明等众多文艺体育界名人以及国人熟悉的企业第一时间捐赠驰援西藏灾区。,https://toutiao.com/group/7457432498016977419/,,0,0,False
一学生在学校跑步时猝死，法院判决,2025-01-07 13:45,259,333,红星新闻,红星新闻,海南省琼中黎族苗族自治县某学校学生小林在体育课跑步时突发疾病，经抢救无效死亡。小林的父母以已提前告知小林体质原因不适合跑步为由要求学校担责，而学校投保的保险公司则认为小林的情况不属于校园责任险赔偿范围，小林父母林某和陈某将学校诉至法院。,https://toutiao.com/group/7457168859796177448/,,0,0,False
河南警察3岁女儿被拐，苦寻全国23年无果，结果却发现女儿在对门,2024-11-05 07:43,6418,692,八号探秘人,八号探秘人,寻亲23年无果，丢失的女儿竟住在对门?但它却真实发生在河南洛阳的梁绍波身上。是意外走丢，还是人贩子所为，三岁的女儿怎会离奇失踪?,https://toutiao.com/group/7433697108120142345/,,0,0,False
充电时，先插手机还是充电器？方法错误手机坏得快,2025-01-02 01:19,2314,172,人民日报,人民日报,手机电量还剩多少，对现代社会的许多人而言，都是一个“性命攸关”的问题。人们对手机充电的强烈需求，也让市面上催生出了许多噱头：无线充电，二倍速充电，以及能连着用一周的高能充电宝。乱花渐欲迷人眼，但到底什么才是手机充电的正确姿势呢？手机一定要满充满放吗？,https://www.peopleapp.com/column/30047895447-500006027199?utm_source=头条号&promote=true,,0,1,False
大陆就统一时间表表态，20万台胞已办身份证？台当局称严查,2025-01-03 11:03,3991,470,第一军情,第一军情,台湾问题是中国核心利益中的核心，已困扰了我们整整75年，成为每一个中国人心中的痛。日前，大陆著名学者在一篇文章表示，未来四年时间，大陆不会制定统一台湾的时间表。,https://toutiao.com/group/7455640102287557156/,,0,0,False
新婚33天卷走274万4套房，出逃后丈夫跨国追捕，如今下场大快人心,2024-12-20 22:06,5679,276,八号探秘人,八号探秘人,在阅读此文之前，辛苦您点击一下“关注”，既方便您进行讨论和分享，又能给您带来不一样的参与感，感谢您的支持！编辑丨QQ·B“色字头上一把刀！”深圳富豪结婚33天竟被卷走274万元和名下4套房产。不仅如此，他还被扣上了“接盘侠”的帽子，啥也没干喜当爹。,https://toutiao.com/group/7450399558821052982/,,0,0,False
我国楼市大局已定，未来全国45%的家庭，或将面临“5大挑战”,2024-12-15 11:45,711,108,苍暮颜,苍暮颜,前言:21世纪开始，中国房地产市场一路高歌猛进，繁荣的景象更是吸引了无数投资者和购房者，房价也是一路攀升，也成为了房地产经济增长的重要引擎。,https://toutiao.com/group/7448599203455975947/,,0,0,False
一家八口分批撤离，姐姐先行，弟弟随后，已成功套现2.4亿元,2025-01-07 07:55,581,429,昕昕局,昕昕局,资本市场上，总有一些让人跌破眼镜的“操作”，近日，一则上市公司公告，揭开了某实控人家族的惊人套现术:八口之家，竟上演了一出分批转移、姐弟接力的好戏!,https://toutiao.com/group/7457015358612849171/,,0,0,False
34岁雌雄同体的女性，具备男女两性器官，她该如何生存下去？,2024-10-17 03:32,5455,250,大象微视,大象微视,这个词在我们生活中并不常见，简而言之，双性人就是既拥有男性的生殖器官，也具备女性的特征的人。1989年，王梓淇出生在山西太原的一个家庭，她的家里经营着一家小生意，虽然谈不上富裕，但足够让一家人过得舒心自在。,https://toutiao.com/group/7426578550418948618/,,0,0,False
日本专家：中国六代机惹人发笑，想吓唬敌人举手投降,2025-01-07 03:44,7950,4088,第一军情,第一军情,对于中国取得的国防成就，日本人的态度非常有意思，他们在表面上给予了假惺惺的赞扬，但背后却隐藏着怀疑和不安。,https://toutiao.com/group/7457013487617802787/,,0,0,False
广州男篮一运动员被禁赛，“把女友装行李箱带进宿舍通宵学习”,2025-01-08 10:55,415,380,极目新闻,极目新闻,刚刚，广州龙狮男篮官方宣布，基于球员张兴亮违反俱乐部一队相关管理条例的客观事实，即日起，张兴亮将暂停参加俱乐部一队比赛。据直播吧报道，1月5日对阵青岛赛前，张兴亮把女友装在行李箱里带进宿舍，熬夜通宵一晚，帮女友准备作业，而他的女友还骄傲地发在微博里，目前该微博已删除。,http://jms.ctdsb.net/jmythshare/#/index_share?cId=0&contentType=5&contentId=2348073,,0,0,False
香港女子花400万买15平房子，晚上睡衣柜顶，客厅宽敞还有大阳台,2024-12-26 04:06,1082,590,鲸探所,鲸探所,都说香港寸土寸金，但是对于我们来说，其实这句话只是一个概念而已，只知道贵，但不知道到底能贵到哪种程度。但是看完一位女子花了400万在香港买的房子之后，“寸土寸金”这个词，真的让人“具象化”了。,https://toutiao.com/group/7452564162242265640/,,0,0,False
丁关根：原铁道部部长，中共中央统战部原部长，中宣部原部长,2024-12-19 11:07,5640,729,御史夫子,御史夫子,1987年的一天，素有“铁面部长”之称的丁关根，正在严厉地训斥一位段长，而这位段长在一旁大气不敢出。,https://toutiao.com/group/7450073526009741876/,,0,0,False
男子称在银行取现2.9万遭报警排查来源用途 银行回应,2025-01-08 02:20,517,892,华商网,华商网,大风新闻消息，“我取自己的钱，银行不给取现金，而且还报警要求查客户的详细信息。”1月6日，山东滨州一男子拍视频称在无棣农商行取账户的钱遇阻。,https://news.hsw.cn/system/2025/0108/1814341.shtml,,0,0,False
德国女外长的尴尬让世界看呆了,2025-01-06 18:13,3794,956,胡锡进,胡锡进,德国女外长贝尔伯克被叙利亚实际控制者艾哈迈德·沙拉拒绝握手的一幕传遍世界，这是她本人的尴尬、也让德国挺没面子。如果说是女性拒绝同男性握手，被拒者还有较大诙谐自嘲的空间。,https://toutiao.com/group/7456866324845707813/,,0,0,False
绑架王星的嫌疑人已被抓！身份曝光是广东籍人，国内有多家公司,2025-01-08 09:00,1984,852,卿羽飞,卿羽飞,说来也挺令人无奈的，王星这位在中国内地并不是太有名气的演员，之前在接到了一家名为金阳国际的公司选角邀请后，竟然真的信了。,https://toutiao.com/group/7457459706693534271/,,0,0,False
特朗普开始行动了，派儿子去了格陵兰岛,2025-01-07 23:29,1737,1322,牛弹琴,牛弹琴,有道是“打仗亲兄弟，上阵父子兵”。特朗普果然开始行动了，1月7日，派儿子乘坐特朗普私人飞机，就去了格陵兰岛。去干什么？丹麦人很紧张，来者不善，黄鼠狼给鸡拜年来了！在小特朗普启程前一天，特朗普就在社交媒体上称昭告天下：“我听说格陵兰的人民支持‘让美国再次伟大(MAGA)’。,https://toutiao.com/group/7457314743175447078/,,0,0,False
演员王星缅甸获救背后：174位被困缅甸“星星”联合求救,2025-01-08 07:40,643,414,大河报,大河报,近日，演员王星于泰缅边界失联引发各界关注，据中国驻泰国大使馆消息，王星已于当地时间7日成功获救。 据央视新闻报道，自2023年9月以来，针对缅北涉我电信网络诈骗犯罪，公安部部署推进边境警务执法合作，开展了一系列行动，截至2024年11月已累计抓获5.,https://news.dahebao.cn/dahe/appcommunity/2136046?newsId=2136046,,0,0,False
被骗细节、时间线公布！王星现身发声,2025-01-08 00:22,347,375,环球网,环球网,来源：中国新闻社 1月7日，被接到泰国达府的演员王星接受当地媒体采访，表示感谢泰国政府和移民局的帮助，让他安全抵达当地。王星已经离开了达府移民局，被送往湄索机场。,https://3w.huanqiu.com/a/1cc7c6/4Kz4uq2AsFs?agt=20,,0,0,False
