title,publish_time,like_count,comment_count,media_name,source,abstract,article_url,tag,is_yaowen,article_sub_type,has_video
这个菜是“降脂霸”，隔三岔五吃一点，帮你清理血管，身体更健康,2025-01-13 10:41,2963,265,爱玉门,爱玉门,荠菜鸡蛋饼!荠菜窝窝头!荠菜香菇鸡蛋汤!,https://toutiao.com/group/7457740354180203047/,,0,0,False
《六姊妹》原来梅婷和曾剑竟然是真夫妻，真是郎才女貌，太般配了,2025-02-21 10:46,2160,526,小新新事,小新新事,戏里大姐夫张建国对妻子百依百顺，连孩子姓氏都能妥协，可你们知道吗?可惜这场女强男弱的婚姻撑了七年就散了，但梅婷愣是没说过前任半句坏话，转头就靠《父母爱情》拿奖拿到手软。,https://toutiao.com/group/7473821543223525898/,,0,0,False
住建部大招！“三不两严” 农村危旧房改造新政，农民成最大赢家！,2025-03-06 05:34,2610,1008,世相记录者,世相记录者,近日，住房城乡建设部正式公布了全国农村危旧房屋改造计划实施方案，这项惠及亿万农民的民生工程将于今年全面启动。,https://toutiao.com/group/7478560829034529318/,,0,0,False
14年儿子坐马航失联，多年后父亲收到回信，坚信儿子去了平行世界,2025-02-20 02:38,9181,868,谛听骨语,谛听骨语,MH370失联的第10年，马来西亚政府宣布在2024年12月20日重启寻找马航MH370的项目。如果后续进展顺利的话，马航MH370会在2025年的1月到4月期间重新展开全面地搜寻。凭空消失的客机，有希望被揭露的失踪真相，这一切都是让人充满了期待。,https://toutiao.com/group/7473322554179895817/,,0,0,False
今明两年打算买房的老百姓，要牢记7字真言：买旧、买大、不买三,2024-12-12 10:31,6255,566,消费快报,消费快报,然而，市场上的房源种类繁多，质量参差不齐，这给购房者带来了不小的挑战。在这样的背景下，“买旧、买大、不买三”的购房建议逐渐受到人们的重视。,https://toutiao.com/group/7447470862556611108/,,0,0,False
够打造11支航母打击群？中国2025年军费公布，美俄为何坐不住了？,2025-03-10 03:42,3902,533,军武次位面,军武次位面,近日，中国2025年国防预算正式敲定:1.78万亿元人民币，同比增长7.2%。然而，这一预算的公布却引发了国际社会的广泛关注，尤其是美俄两国近期提出的“共同削减军费”提议，更是让中国的国防预算成为焦点。,https://toutiao.com/group/7480015244964217398/,,0,0,False
自带“青霉素”的5种菜，隔天吃1次，增强免疫少生病，中老年多吃,2024-12-26 07:19,12113,602,临沂临港发布,临沂临港发布,姐妹们，我刚从菜市场回来，别提有多兴奋了!今天我发现咱家附近新开的农贸市场里，那些日常见的便宜菜，竟然是天然的“抗生素”!,https://toutiao.com/group/7452616764364292643/,,0,0,False
胡蝶与戴笠的真实彩色照片，胡蝶一颦一笑妩媚多姿，戴笠不怒自威,2025-02-17 10:26,4397,459,浩舞默画,浩舞默画,只看照片，就连其美的三分之一，也感知不到。胡蝶出生时并不知道她会成为当红的明星，每一个孩子初次来到这个人间时，发出第一个声音，永远是啼哭，似乎来到这个人间并非是一件幸运的事情。,https://toutiao.com/group/7472271893941207563/,,0,0,False
