title,publish_time,like_count,comment_count,media_name,source,abstract,article_url,tag,is_yaowen,article_sub_type,has_video
一习话·温暖聆听丨元宵佳节共祝美好 总书记的祝福与叮嘱,2025-02-12 13:20,1802,789,央广网,央广网,作为中华民族的重要传统节日，春节和元宵节是海内外中华儿女共祝美好生活的日子，承载着天人相合、团圆和谐、国泰民安的文化认知与美好祈愿。每当重要节日到来之际，习近平总书记都会看望慰问基层干部群众，和大家共享祥和、共祝美好。心系民生冷暖，情牵万家灯火。,https://www.cnr.cn/newscenter/local/dftj/20250212/t20250212_527069852.shtml,,0,0,False
接收几百个频道#建议大家学起来,2025-02-05 05:06,3336,356,安心小窝,安心小窝,,http://toutiao.com/item/7467796953879953970/,,0,0,True
相声：张康贾旭明说《三国》，真是俩相声天才，不输德云社！,2025-01-29 21:08,11685,2143,爱情放映厅,爱情放映厅,,https://toutiao.com/group/7463035074229977600/,,0,0,True
公公竟然和儿媳偷情，哪料被妻子撞见，这下有戏看了！,2025-01-21 08:05,12593,1029,南瓜午夜厅,南瓜午夜厅,,https://toutiao.com/group/7462273852651979274/,,0,0,True
《一壶老酒》北漂哥唱的比原唱还好听,2025-01-14 09:30,31177,5048,华哥分享,华哥分享,,https://toutiao.com/group/7459701189173658163/,,0,0,True
集市上10元一斤的散酒，是纯粮酒吗？听听内行人怎么说,2025-01-20 13:33,4588,1372,悦悦纪实,悦悦纪实,,https://toutiao.com/group/7461990229696643611/,,0,0,True
2025年新疆与援疆省市电视春节联欢晚会 《苹果香》,2025-01-28 09:13,2358,140,湖南日报,湖南日报,,https://m.voc.com.cn/portal/news/show?id=27354517,,0,0,True
数学天才被当傻子被退学，上台算术吊打大学教授,2025-01-22 03:59,8658,683,好看捞剧社,好看捞剧社,,https://toutiao.com/group/7462574524123365942/,,0,0,True
大哥寻找12年前的初恋，得知初恋女孩至今单身，男子当场求婚,2025-01-15 06:54,27909,10478,江湖研究院剧院,江湖研究院剧院,大哥寻找12年前的初恋，得知初恋女孩至今单身，男子当场求婚,https://toutiao.com/group/7460031861084013090/,,0,0,True
于谦得了肺炎，郭德纲安慰大嫂：别怕，火葬场咱有熟人,2025-02-03 03:47,5616,1690,家庭哪些事,家庭哪些事,,https://toutiao.com/group/7457827514375766537/,,0,0,True
河南濮阳高速撞车事件，车内的全过程,2025-02-10 11:29,6105,4949,王哥说事,王哥说事,,https://toutiao.com/group/7469750948731994665/,,0,0,True
