title,publish_time,like_count,comment_count,media_name,source,abstract,article_url,tag,is_yaowen,article_sub_type,has_video
少女吃完肯德基把骨头从垃圾桶捡回来，做一顿鸡架泡饭，香迷糊了,2024-07-16 00:00,882,297,兴凯湖莹莹,兴凯湖莹莹,,https://toutiao.com/group/7391891049913778740/,,0,0,True
5座车拉6个人被判超员，车主1句话把交警问懵,2024-08-05 20:20,7855,1790,奇妙钢笔pA8JyP,奇妙钢笔pA8JyP,,https://toutiao.com/group/7399752843772559906/,,0,0,True
没有人敢信他是个男的，直到他说话了，绝了,2024-08-20 05:20,2557,126,经视看天下,经视看天下,,https://toutiao.com/group/7405087362341470774/,,0,0,True
蛋仔派对：评论区随机挑战？用“那咋了”跟秀儿说话，粉丝真狠呀,2024-08-12 09:48,1194,236,游小浪Game,游小浪Game,,https://toutiao.com/group/7402187581716988456/,,0,0,True
张博宇：张丰毅吕丽萍的亲儿子，今却走上父母老路，成为离婚人士,2024-08-20 06:16,1383,201,稻述,稻述,文 | 招财小羊编辑 | 招财小羊“这是张丰毅的儿子？怎么看起来这么邋遢？”8月19日，李亚鹏的二婚妻子海哈金喜晒出了一条视频。没想到，却偏偏让张博宇成为了最大的话题人物！原来，那天海哈金喜现身北京参加了大学同学的婚礼。而在多个镜头之中，张博宇的身影忽隐忽现。,https://toutiao.com/group/7405097740415304230/,,0,0,False
全球约一半肝癌在中国，再次提醒：家中的4种食物，尽早撤下餐桌,2024-08-13 08:36,86376,3314,梁医学社梁怡璋医生,梁医学社梁怡璋医生,,https://toutiao.com/group/7402540119712629311/,,0,0,True
中国🇨🇳人民的好总理,2024-09-03 15:46,127050,14900,话说,话说,这个老人一生只做一件事，那就是为了人民鞠躬尽瘁，死而后已,https://toutiao.com/group/7410443709928210955/,,0,0,True
恭喜中国女篮新领袖终于出现了！百发百中！统治力让对手深深绝望,2024-06-25 07:11,23901,1276,乐播体育,乐播体育,,https://toutiao.com/group/7384335028576059923/,,0,0,True
2013年，湖南26岁女孩嫁给71岁老头，婚后还生下一子，如今怎样了,2024-07-12 11:59,20522,2154,智史通鉴,智史通鉴,2013年4月17日，长沙宁乡县的民政局迎来了一对特殊的夫妻。一个71岁的老头和一个26岁的女孩，离远了看，甚至像爷爷和孙女。面对工作人员异样的眼光，女孩说：“我和他是真心相爱的！”这让人好奇，这对相差45岁的夫妻，他们之间到底有着怎样的爱情故事？,https://toutiao.com/group/7390696631223534120/,,0,0,False
147票压过3票，欧洲通过涉台议案，不许两岸统一，蒋万安突然离岛,2024-09-13 09:45,3717,2516,凤凰卫视金亮,凤凰卫视金亮,美欧联合阻挡中国统一，蒋万安演讲提及“一个中华”，新加坡对台发出警告，岛内表明战争担忧，美方要颠覆战后秩序吗?,https://toutiao.com/group/7414061277322838564/,,0,0,False
为什么说从2025年开始，70岁以上的老人，可能面临“两大”问题？,2024-09-01 14:12,2024,262,水大叔,水大叔,据可靠数据了解，我国70岁以上的人口数量已经达到了2.5亿人次，占到全国总人口数量的18%。伴随着人口老龄化的出现，养老问题也成了重中之重，要知道养老不仅仅是家庭的责任，更是社会责任。,https://toutiao.com/group/7409677025897710106/,,0,0,False
张紫妍：被迫陪睡31人近百次，遭道具虐待，29岁自杀留230页遗书,2024-07-24 02:37,11145,764,八号探秘人,八号探秘人,在阅读此文之前，辛苦您点击一下“关注”，既方便您进行讨论和分享，又能给您带来不一样的参与感，感谢您的支持！本文叙述皆有官方信源，为了读者有更好体验，放在了文章后缀！,https://toutiao.com/group/7394994383675736576/,,0,0,False
她是央视最惨主持人，男友被判死缓，丈夫诈骗入狱，47岁无人敢娶,2024-08-27 23:30,2008,206,闻书识焉,闻书识焉,她曾是央视的台柱子，和董卿、周涛并称为央视的三朵金花。回顾刘芳菲的前半生，最令人感到惋惜的，便是她的感情生活，47岁至今无人敢娶。,https://toutiao.com/group/7407743113688564258/,,0,0,False
陈若琳把全红婵养得是真好啊,2024-08-07 03:21,2684,174,中工网,中工网,<p style='text-indent: 2em;'>原标题：陈若琳把全红婵养得是真好啊</p><p style='text-indent: 2em;'>昨晚，巴黎奥运会女子10米跳台跳水决赛，全红婵夺得金牌！赛后采访，她说，我不是你们所说的天才，都是练的，一遍一遍地练。教练陈若琳见证了全红婵的努力与刻苦。@陈若琳sunny@全红婵这对被称为“王炸”组合的师徒，在奥运赛场上都有过非常亮眼的表现。为帮全红婵突破发育关，陈若琳下了不少功夫。每天七八个小时的训练，恨不得将全红婵“拴在裤腰带上”严密看管。执教能力虽受过质疑，但她从不回避，而是找出问题，各个击破。她说：“我走过的弯路，不想让全红婵再走一遍。”中国队加油！（央视）</p>,http://db.workercn.cn/media/2024/08/07/64B10057EEF44DC3904C945F112F757A/preview.mp4,,0,0,True
女孩15岁就能接客！性是生活也是工作，捷克为什么成了色情大国？,2024-09-13 09:10,1859,287,鲸探所,鲸探所,女孩15岁就到了合法性交年龄?18岁是成年，可15岁，仅仅只是一个初中生。很多人都以为，在韩国日本荷兰这些国家，色情产业应该是最“发达”的，可是捷克的色情产业，也并不是一个省油的灯。,https://toutiao.com/group/7414048497181164068/,,0,0,False
相约北京文化论坛｜雅克·马拉泰尔：我所感受到的中华文明，令我真的很乐意去探索它,2024-09-15 23:43,24471,577,北京日报客户端,北京日报客户端,,https://rss2.bjd.com.cn/content/s66e770b8e4b01a5d71c8c00d.html,,0,0,True
央视又出“黑马”剧！才播2集全国收视第一，老戏骨飙戏太炸裂！,2024-09-10 11:21,3798,550,晓瑜海棠,晓瑜海棠,剧荒怎么办？当然是看央八推出的新剧啊！7月8月暑期档，相信各位观众们已经烦透了《长相思2》、《玫瑰的故事》这类“暑期特供”无脑爱情剧。终于等到学生们开学，影视圈由央视推出年代剧《迎风的青春》带头，回到正轨。开播第一天直空降榜首不说，观众的好评更是一抓一大把。,https://toutiao.com/group/7412948016674275874/,,0,0,False
“心系百姓”、“为人民服务”确确切切是件令一国总理最头痛的事,2024-09-04 04:55,277705,30725,舟曲東去西燕飛,舟曲東去西燕飛,,https://toutiao.com/group/7410647010543403554/,,0,0,True
教师退休工资出来了瞬间炸锅了看看到底发多少,2024-09-11 03:56,3321,771,正大光明奶酪,正大光明奶酪,,https://toutiao.com/group/7413229517143015945/,,0,0,True
国务院：从2030年1月1日起将职工按月领取基本养老金最低缴费年限由十五年逐步提高至二十年 每年提高六个月,2024-09-13 06:38,8152,11586,财联社,财联社,【国务院：从2030年1月1日起将职工按月领取基本养老金最低缴费年限由十五年逐步提高至二十年 每年提高六个月】财联社9月13日电，国务院关于渐进式延迟法定退休年龄的办法发布，从2030年1月1日起，将职工按月领取基本养老金最低缴费年限由十五年逐步提高至二十年，每年提高六个月。,https://www.cls.cn/depth/1798592,,0,0,False
写歌30年穷困潦倒，前妻失望选择离婚，谁料51岁靠一首歌一夜成名,2024-08-12 03:37,18139,2994,八号探秘人,八号探秘人,在阅读此文之前，辛苦您点击一下“关注”，既方便您进行讨论和分享，又能给您带来不一样的参与感，感谢您的支持！编辑：LY无数人都想要一个一夜成名的机会，但机会来了也不是每个人都能把握住的。他用了三十年的时间来准备迎接属于自己的机会。为了这个机会他放弃了一切，甚至包括家庭。,https://toutiao.com/group/7402090890367484428/,,0,0,False
延迟退休年龄对照表公布,2024-09-13 06:46,28750,64515,央视新闻,央视新闻,​​​第十四届全国人民代表大会常务委员会第十一次会议通过了《关于实施渐进式延迟法定退休年龄的决定》，本决定自2025年1月1日起施行。,https://content-static.cctvnews.cctv.com/snow-book/index.html?item_id=13903555071406623131&source=50006&sub_source=50006_001,,0,1,False
4架美机逼近辽宁舰，歼15冒暴风雨起飞，硬碰硬分出胜负,2024-09-15 06:19,3903,230,第一军情,第一军情,央视军事9月15日报道了辽宁舰航母编队在西太平洋某海域，遭到4架外方战斗机的逼近。在这个关键时刻，辽宁舰上的歼-15舰载机，冒着强对流暴风雨，挂载实弹升空，对外机进行拦截，一番“硬碰硬”后最终成功逼退外机编队。,https://toutiao.com/group/7414749448699413027/,,0,0,False
美女医生幽默爆笑对话：一本正经的胡说八道，看一遍笑一遍,2024-08-28 13:30,38443,5222,牙牙爱爆笑,牙牙爱爆笑,,https://toutiao.com/group/7408077299670581800/,,0,0,True
