title,publish_time,like_count,comment_count,media_name,source,abstract,article_url,tag,is_yaowen,article_sub_type,has_video
众行致远丨微视频：7场双边会见 合作是一条主线,2024-11-26 10:37,1292,876,人民网,人民网,当地时间11月17日至19日，国家主席习近平在巴西里约热内卢出席二十国集团领导人第十九次峰会，并举行多场双边会见。其间，习近平主席分别会见了英国、澳大利亚、墨西哥、德国、法国、玻利维亚、阿根廷的领导人。7场双边会见，合作是一条主线。每一重合作擘画中，都有着时代的课题。,https://toutiao.com/group/7441535163672117786/,,0,0,False
许家印最新消息！广州法院出手了,2024-11-26 13:53,340,165,每日经济新闻,每日经济新闻,每经编辑：黄胜11月26日晚间，中国恒大在港交所公告称，中华人民共和国广州市南沙区人民法院11月14日发出案号为（2024）粤0115执8571号的法院命令。,http://www.nbd.com.cn/rss/jinri_toutiao/articles/3661024.html,,0,0,False
11月27日凌晨2:00点 俄乌局势 最新消息,2024-11-26 20:23,6412,593,后海不是海,后海不是海,,https://toutiao.com/group/7441686245677204003/,,0,0,True
在美国的华人终于开始慌了,2024-11-24 09:12,3128,315,泽泽说事,泽泽说事,在美国的华人终于开始慌了,https://toutiao.com/group/7440770785473462834/,,0,0,True
首例5胞胎长大了，父亲已过劳去世 母亲直言：如能重来一个也不要,2024-08-31 03:06,3367,897,睿之悦,睿之悦,2002年，在北京的一家妇产医院中，一位来自河北的孕妇顺利生下了两男三女的五胞胎，创造了一个全国罕见的奇迹。,https://toutiao.com/group/7409098624111575603/,,0,0,False
母亲瘫痪、父亲疯了，当年那个744分的高考状元，7年后却成了这样,2024-09-08 00:54,11722,1772,八号探秘人,八号探秘人,母亲截肢瘫痪、父亲疯癫痴傻，可对于自己的亲人，他却做出了这样的评价。而今，7年已过，曾经那个让无数人动容的少年，现在如何?,https://toutiao.com/group/7411852147648496162/,,0,0,False
体感温度-30度的一天，生活在内蒙牧区的，我们是怎么度过的,2024-11-26 11:28,2823,282,河南姑娘远嫁在内蒙,河南姑娘远嫁在内蒙,,https://toutiao.com/group/7441548328887648819/,,0,0,True
罕见！100年前，英国游客拍下的清朝乡村，和想象中完全不一样,2024-09-20 02:07,7720,708,万物知识局,万物知识局,泥泞的土路，衣不蔽体的老百姓，即便是达官显贵的家中也十分破败，而这些都是清王朝的历史痕迹，虽说那时候中国摄影技术并不发达，但也有许多外国游客来到这里，拍摄下了许多老照片，为我们留下了珍贵的历史资料，那清朝到底是怎样的面貌呢?,https://toutiao.com/group/7416287738871267855/,,0,0,False
河南警察3岁女儿被拐，苦寻全国23年无果，结果却发现女儿在对门,2024-11-05 07:43,1494,110,八号探秘人,八号探秘人,寻亲23年无果，丢失的女儿竟住在对门?但它却真实发生在河南洛阳的梁绍波身上。是意外走丢，还是人贩子所为，三岁的女儿怎会离奇失踪?,https://toutiao.com/group/7433697108120142345/,,0,0,False
讣告！100岁叶嘉莹去世：17岁丧母，52岁丧女，94岁裸捐，她是中国最后一位“穿裙子的士”,2024-11-26 01:20,2709,479,读者,读者,从南开大学获悉，古典文学研究学者、南开大学讲席教授叶嘉莹，于2024年11月24日去世，享年100岁。她，是加拿大不列颠哥伦比亚大学终身教授，却在54岁写信给中国教育部，申请免费来华教学。来华任教后，她辗转全国多所高校讲授古诗词，不遗余力地传承中国古典文化。,https://toutiao.com/group/7441390504039793163/,,0,0,False
3年前，宁夏7岁小女孩一笑走红，后拒百万签约，如今怎么样了？他们后悔了吗？,2024-09-19 07:25,13505,1853,睿之悦,睿之悦,2021年，视频镜头中出现的女孩儿用那一抹甜美的笑容，迅速引起了网友们的广泛关注。有媒体公司看到这一机遇，提出愿意用百万巨资与女孩儿签约，然而，女孩儿的父母却坚决拒绝了这一提议。,https://toutiao.com/group/7416250139544879679/,,0,0,False
湘潭大学宿舍投毒案已移交法院，被害人亲属：希望投毒者承担刑责,2024-11-26 10:21,910,528,极目新闻,极目新闻,极目新闻记者 邓波11月26日，极目新闻记者从湖南省湘潭市人民检察院获悉，此前备受关注的湘潭大学宿舍投毒案已经移交到法院。被害人亲属告诉极目新闻记者，希望投毒者能承担其应负的刑事责任。,http://jms.ctdsb.net/jmythshare/#/index_share?cId=0&contentType=5&contentId=2314395,,0,0,False
前中国体操队员吴柳芳转行“擦边”性感女主播，“袋鼠摇”奥运冠军管晨辰发文怒批,2024-11-23 09:22,611,1025,大河报,大河报,前体操运动员吴柳芳和现役运动员管晨辰因网络互动引发了一场激烈的争论。吴柳芳曾在2010年至2011年间多次夺得体操世界杯的各项冠军，退役后转型为性感女主播，引起了广泛的争议。江南君获悉，这场争端始于吴柳芳发布了一段视频，随后管晨辰在其评论区留言，表达了对她行为的不满。,https://toutiao.com/group/7440402485900001826/,,0,0,False
乌克兰蒙了，欧洲慌了，美国也冷静了,2024-11-26 10:42,4940,214,张元伟,张元伟,,https://toutiao.com/group/7441536551424623114/,,0,0,True
“星二代”影帝廖凡，出道24年从不拼爹，妻子是周星驰的黄金拍档,2024-11-20 10:31,1378,515,与君説,与君説,在阅读此文之前，麻烦您点击一下“关注”，既方便您进行讨论和分享，又能给您带来不一样的参与感，感谢您的支持文、编辑|是否提起廖凡大家还记得自己是通过哪部剧认识他的吗？是《白日焰火》中的“失败警察”张自力，还是《邪不压正》中的反派朱潜龙，亦或是最近正在热播的影视剧《宿敌》。,https://toutiao.com/group/7439303764571521551/,,0,0,False
香港九龙寨城老照片：曾是香港最邪恶肮脏之地，图9场景令人作呕,2024-11-21 11:32,1460,327,万物知识局,万物知识局,有这么一个地方，他虽然地处极度繁华的都市香港，但是却脏乱不堪，环境极度的恶劣，各种违法的交易都在这里进行，甚至黄赌毒，也在这里悄然滋生，这就是九龙城寨。,https://toutiao.com/group/7439657140518519296/,,0,0,False
送给所有知道我名字的人 想送一份祝愿给大家，所以唱了这首歌,2024-11-13 04:30,138593,22924,李子柒,李子柒,,https://toutiao.com/group/7436616916803781171/,,0,0,True
河南女子去世，山东丈夫将手机埋墓里，充1000元话费，每天打电话,2024-11-01 06:52,3466,3051,何止电影,何止电影,2014年11月17日，河南肿瘤医院的病房中举行着一场特殊的婚礼，主角是于海宁跟他的患有癌症的妻子范会香。在几个月前范会香确诊癌症，跟男友提出分手，于海宁不远万里来到了女友的城市，照顾患癌女友。得知女友时日无多，在病房中跟女友求婚，在病房中举办了婚礼，婚后一年，范会香去世。,https://toutiao.com/group/7432199981609534004/,,0,0,False
刚从中国返俄，苏-57飞行员传来新消息,2024-11-25 10:15,6156,212,环球时报新媒体,环球时报新媒体,刚从中国返俄，苏-57飞行员传来新消息,https://toutiao.com/group/7441158524530328127/,,0,0,True
1米3袖珍美女嫁给1米48男孩，婚后丈夫奇迹长高，两人却不欢而散,2024-09-07 02:55,6230,315,睿之悦,睿之悦,杨萍和葛存苗的婚礼 文|睿之悦 编辑|睿之悦2019年，成都的民政局来了两个“10岁小孩”来登记，工作人员以为是玩闹。两个“小孩”拿出身份证让工作人员看，这才明白，原来是两个再也长不高的成年袖珍人情侣。,https://toutiao.com/group/7411713833267364386/,,0,0,False
包厢全是刚出狱的恶霸，结果一看到饭店主厨，立马怂了,2024-11-11 01:21,8559,178,乐视群星访谈秀,乐视群星访谈秀,,https://toutiao.com/group/7435825833048015400/,,0,0,True
月薪过万 我为何还从胖东来离职？丨封面头条,2024-11-26 09:18,380,1100,封面新闻,封面新闻,近年来，胖东来是热搜榜单的“座上宾”，而当下胖东来关于涉足员工婚嫁彩礼收取、请客办酒的新闻引起了社会又一波的热议。生活在河南许昌的梁梦看着评论区和营销号，对胖东来或贬低或高唱的论调，心中都不再起波澜。,https://m.thecover.cn/news_details.html?from=web&eid=zF0xC09FFmqH90qSdq8Jkw==,,0,0,False
67岁执意生娃，如今却坐轮椅无法自理，5岁的天赐被迫独立学洗衣,2024-11-04 10:32,6012,1449,睿之悦,睿之悦,2019年，已经67岁的田新菊执意生下了自己的第三个孩子小天赐。那么，现如今5年的时间过去了，这“天赐”的礼物到底是福还是祸呢?,https://toutiao.com/group/7433367394946384435/,,0,0,False
防弹车油耗竟有这么高！穿越中东到底要花多少钱？,2024-11-25 10:14,9105,1161,耀阳环游记,耀阳环游记,防弹车的油耗出炉了，不过这还只是高速油耗，要是越野或沙漠的话，完全不敢想[捂脸],https://toutiao.com/group/7441158395744223782/,,0,0,True
女友怀孕了，男友不装了，带她回豪宅！,2024-11-23 08:01,6392,587,乐视大综艺咖,乐视大综艺咖,,https://toutiao.com/group/7440353629540483593/,,0,0,True
四年前拜登上台时，我就预测特朗普会卷土重来,2024-11-23 09:15,15706,1171,张维为,张维为,《这就是中国》第259期精彩片段,https://toutiao.com/group/7440400982275523091/,,0,0,True
炒白菜千万不要直接下锅，难怪不好吃，教你技巧，鲜嫩入味不出水,2024-10-30 09:23,12948,715,家常的味道,家常的味道,,https://toutiao.com/group/7431496869400576550/,,0,0,True
炸萝卜丸子到底用面粉还是淀粉，教你正确做法，外焦里嫩，太香了,2024-10-26 09:25,12216,798,家常的味道,家常的味道,,https://toutiao.com/group/7430012978277122611/,,0,0,True
天下之大无奇不有，监控一幕太惊恐。惊不惊喜，意不意外？,2024-11-26 09:32,1462,708,阿梅分享,阿梅分享,,https://toutiao.com/group/7441518533357339171/,,0,0,True
黑龙江勃利县东北虎进村（邻居完整剪辑版）,2024-11-21 15:19,613,163,小玛宝宝,小玛宝宝,,https://toutiao.com/group/7439752539572011574/,,0,0,True
综艺：千万别把闫妮和靳东放在一起，真是笑死个人，绝了啊！,2024-11-08 00:41,11948,1325,橙子说剧,橙子说剧,,https://toutiao.com/group/7434702042024641035/,,0,0,True
白菜炖豆腐怎么做才好吃？诀窍告诉你，鲜香美味，炖一大锅不够吃,2024-09-28 12:00,45078,2131,茉茉妈妈小厨,茉茉妈妈小厨,,https://toutiao.com/group/7419662693868503561/,,0,0,True
上万条束带蛇的盛大宴会场面异常壮观#野生动物零距离#,2024-11-24 06:39,1537,361,人生风景,人生风景,,https://toutiao.com/group/7440731849209184805/,,0,0,True
国家一级演员，已被除名，看看都有谁?,2024-11-24 04:08,1508,103,小李看世界,小李看世界,,https://toutiao.com/group/7440692924112699958/,,0,0,True
勃利老虎进村清晰完整视频,2024-11-19 23:47,7554,4783,雪落长安里,雪落长安里,,https://toutiao.com/group/7439141397858353679/,,0,0,True
为什么村干部天天催缴医保？,2024-11-26 08:00,924,142,乐乐爱生活,乐乐爱生活,为什么村干部天天催缴医保,https://toutiao.com/group/7441494920789787151/,,0,0,True
弟弟光荣退伍，姐姐兴奋去车站接他，怎料一见弟弟瞬间哭了,2024-11-05 06:34,26558,2772,乐视天天剧好看,乐视天天剧好看,,https://toutiao.com/group/7433679820573934091/,,0,0,True
被姚明抱着上奥运的小英雄，曾发誓考上清华，16年后活成了这样,2024-11-07 08:07,2895,672,睿之悦,睿之悦,2008年，年仅9岁的林浩，在姚明的带领下走进了北京奥运会开幕式的舞台上，成为了万众瞩目的“焦点”。,https://toutiao.com/group/7434444094551687707/,,0,0,False
养殖虾都是吃抗生素、激素长大的？到底能不能吃？告诉你真相,2024-11-20 12:11,923,208,39健康网,39健康网,这虾，我们还能安心享用吗?其实说到虾，市面上我们见到的，大多都是养殖的，市场占比超过80%。2023年我国农业部曾统计，当年水产品总产量7100万吨，而养殖类占到5812万吨，类别涵盖鱼虾蟹、贝壳、藻等各种水产品，占比达到82%。,https://toutiao.com/group/7439238682625835520/,,0,0,False
给近三年最好的10部年代剧排个名：《人世间》第6，第1名没有争议,2024-09-06 08:08,13168,4019,皮皮电影,皮皮电影,时尚是个轮回，电视剧也是。在2020年之前的那些年，电视剧市场基本上都被偶像剧、都市剧霸占。曾经撑起国剧品质的《闯关东》《岁月》这类年代好剧，难见踪影。,https://toutiao.com/group/7411390030722712090/,,0,0,False
郭有才：当迷失方向忘记初心后，曾经飘得多高，如今摔得就多惨,2024-11-11 06:53,1172,596,八号探秘人,八号探秘人,在阅读此文之前，辛苦您点击一下“关注”，既方便您进行讨论和分享，又能给您带来不一样的参与感，感谢您的支持！编辑丨brt因为一首翻唱，他一夜之间成为了拥有千万粉丝的网红。但是“人红是非多”，不久他就因为版权等问题陷入了舆论风波。他的人气一落千丈，从万众瞩目变成了现在的无人问津。,https://toutiao.com/group/7435901170239078948/,,0,0,False
美妇约见老情人，见面场景真是太逗了，这俩人绝配！,2024-10-27 16:25,4283,544,乐视明星的那点事,乐视明星的那点事,美妇约见老情人，见面场景真是太逗了，这俩人绝配！,https://toutiao.com/group/7428157095108674088/,,0,0,True
姜昆洋徒弟大山：四上春晚红遍全国，终因冯巩一句话果断离开中国,2024-08-30 04:47,3888,196,八号探秘人,八号探秘人,明明是土生土长、如假包换的加拿大公民，可因为热爱，他把传播、交流中华文化作为毕生的事业。拜姜昆为师，四上春晚，娶中国媳妇，就连人民日报都这样评价他:“大山是外国人，却不是外人”。,https://toutiao.com/group/7408758222099595791/,,0,0,False
菲律宾，开始摊牌了,2024-11-24 05:31,20573,930,牛弹琴,牛弹琴,菲律宾，“殊死搏斗”开始了,https://toutiao.com/group/7440714259027198498/,,0,0,True
好物分享｜炖牛肉时切记三放两不放，这样炖出来的牛肉才会汤鲜味美,2024-10-15 08:50,5057,195,家味美食,家味美食,,https://toutiao.com/group/7425922043991360037/,,0,0,True
拜登挖坑摆烂，特朗普眼前困难重重荆棘满布，各国向中国靠拢避险,2024-11-22 08:15,26681,658,邱毅台湾,邱毅台湾,,https://toutiao.com/group/7440014294332211727/,,0,0,True
