title,publish_time,like_count,comment_count,media_name,source,abstract,article_url,tag,is_yaowen,article_sub_type,has_video
张子宇2024年最振奋人心的“封神一战”，没有之一，看得太解气了,2024-06-26 14:00,4393,421,华少体育解说,华少体育解说,,https://toutiao.com/group/7384811516509291018/,,0,0,True
母亲瘫痪、父亲疯了，当年那个744分的高考状元，7年后却成了这样,2024-09-08 00:54,1355,174,八号探秘人,八号探秘人,母亲截肢瘫痪、父亲疯癫痴傻，可对于自己的亲人，他却做出了这样的评价。而今，7年已过，曾经那个让无数人动容的少年，现在如何?,https://toutiao.com/group/7411852147648496162/,,0,0,False
美国216吨大飞机：起飞全过程曝光，飞行员驾驶急速升空，真猛,2024-08-22 10:14,79560,14248,录有片,录有片,,https://toutiao.com/group/7405905170619597362/,,0,0,True
陈若琳把全红婵养得是真好啊,2024-08-07 03:21,2779,180,中工网,中工网,<p style='text-indent: 2em;'>原标题：陈若琳把全红婵养得是真好啊</p><p style='text-indent: 2em;'>昨晚，巴黎奥运会女子10米跳台跳水决赛，全红婵夺得金牌！赛后采访，她说，我不是你们所说的天才，都是练的，一遍一遍地练。教练陈若琳见证了全红婵的努力与刻苦。@陈若琳sunny@全红婵这对被称为“王炸”组合的师徒，在奥运赛场上都有过非常亮眼的表现。为帮全红婵突破发育关，陈若琳下了不少功夫。每天七八个小时的训练，恨不得将全红婵“拴在裤腰带上”严密看管。执教能力虽受过质疑，但她从不回避，而是找出问题，各个击破。她说：“我走过的弯路，不想让全红婵再走一遍。”中国队加油！（央视）</p>,http://db.workercn.cn/media/2024/08/07/64B10057EEF44DC3904C945F112F757A/preview.mp4,,0,0,True
魏启颖：女儿赵薇被封杀后，丈夫也去世，儿子离婚被分一半财产,2024-08-12 15:57,760,230,吃瓜崽崽,吃瓜崽崽,女儿被封杀，儿子感情突发变故，曾经风光无限的赵家荡然无存。她喜欢音乐，想当音乐老师，父母也大力支持，从不会横加干涉。,https://toutiao.com/group/7402251567493333519/,,0,0,False
她认干爹改国籍，曾叫嚣要击败女国乒，却在巴黎奥运会丢尽了脸,2024-08-26 14:00,467,302,吃瓜崽崽,吃瓜崽崽,她曾是中国国籍，却因认干爹入韩籍。十九岁的她被国人认为是乒坛叛徒，还曾叫嚣女国乒。如今却成为了韩国乒乓一姐。,https://toutiao.com/group/7407375792933044790/,,0,0,False
恭喜中国女篮新领袖终于出现了！百发百中！统治力让对手深深绝望,2024-06-25 07:11,24558,1335,乐播体育,乐播体育,,https://toutiao.com/group/7384335028576059923/,,0,0,True
她是央视最惨主持人，男友被判死缓，丈夫诈骗入狱，47岁无人敢娶,2024-08-27 23:30,2067,206,闻书识焉,闻书识焉,她曾是央视的台柱子，和董卿、周涛并称为央视的三朵金花。回顾刘芳菲的前半生，最令人感到惋惜的，便是她的感情生活，47岁至今无人敢娶。,https://toutiao.com/group/7407743113688564258/,,0,0,False
董卿父亲董善祥：我这辈子最后悔的事，就是让宝贝女儿嫁给密春雷,2024-09-11 06:59,1321,148,稻述,稻述,提起央视主持，现在挑大梁的几乎就是撒贝宁、尼格买提、龙洋等人了，他们也都非常优秀，但常有人怀念起董卿还在的日子。,https://toutiao.com/group/7413267526601228852/,,0,0,False
湖南省财政厅厅长刘文杰不幸遇害，官方发布讣告,2024-09-20 08:51,8841,18428,界面快讯,界面快讯,9月20日，湖南省财政厅发布讣告，中国共产党的优秀党员，中国共产党第二十次全国代表大会代表，第十四届全国人民代表大会代表，中国共产党湖南省第十二届委员会委员，湖南省财政厅党组书记、厅长刘文杰同志不幸遇害，于2024年9月19日9时12分在湖南长沙逝世，享年58岁。,https://toutiao.com/group/7416645143278830091/,,0,0,False
农村人不可怜，最可怜的是城里的下岗工人，你认同吗？,2024-09-17 09:23,826,1577,聪明的轮船YLlOUl9,聪明的轮船YLlOUl9,,https://toutiao.com/group/7415540161196327461/,,0,0,True
泪奔！藏族盲童动情演唱《绿度母心咒》，天籁之音太治愈了！,2024-07-18 12:14,79048,9287,妙曲西瓜湾,妙曲西瓜湾,,https://toutiao.com/group/7392948036525097481/,,0,0,True
简直是猪狗不如 看完这段视频才知道他们到底有多疯狂,2024-09-20 02:57,488,117,快乐,快乐,,https://toutiao.com/group/7416554140500754955/,,0,0,True
演员张瑜：离婚后单身30年，再见前夫仍感到心动，66岁没有子女,2024-07-24 10:51,12587,920,八号探秘人,八号探秘人,在阅读此文之前，辛苦您点击一下“关注”，既方便您进行讨论和分享，又能给您带来不一样的参与感，感谢您的支持！写作不易，作者每天辛苦写稿，只是为了养家糊口，希望各位观众老爷可以多多理解。文中加入5秒广告解锁，观看5秒后便可免费阅读全文啦，感谢各位观众老爷的理解与支持！,https://toutiao.com/group/7395130917804720640/,,0,0,False
他于9月19日在云南逝世，享年55岁,2024-09-20 04:45,2535,393,大皖新闻,大皖新闻,澎湃新闻记者从云南大学方面获悉，云南大学历史与档案学院刘强教授，因病医治无效，于2024年9月19日下午在云南大学附属医院逝世，享年55岁。公开资料显示，刘强，男，汉族，中共党员，1969年1月2日出生于山东省无棣县，2007年毕业于浙江大学理学院物理化学专业，获取博士学位。,http://www.ahwang.cn/toutiao/202409/2747008.html,,0,1,False
2013年，湖南26岁女孩嫁给71岁老头，婚后还生下一子，如今怎样了,2024-07-12 11:59,22105,2227,智史通鉴,智史通鉴,2013年4月17日，长沙宁乡县的民政局迎来了一对特殊的夫妻。一个71岁的老头和一个26岁的女孩，离远了看，甚至像爷爷和孙女。面对工作人员异样的眼光，女孩说：“我和他是真心相爱的！”这让人好奇，这对相差45岁的夫妻，他们之间到底有着怎样的爱情故事？,https://toutiao.com/group/7390696631223534120/,,0,0,False
写歌30年穷困潦倒，前妻失望选择离婚，谁料51岁靠一首歌一夜成名,2024-08-12 03:37,20256,3279,八号探秘人,八号探秘人,在阅读此文之前，辛苦您点击一下“关注”，既方便您进行讨论和分享，又能给您带来不一样的参与感，感谢您的支持！编辑：LY无数人都想要一个一夜成名的机会，但机会来了也不是每个人都能把握住的。他用了三十年的时间来准备迎接属于自己的机会。为了这个机会他放弃了一切，甚至包括家庭。,https://toutiao.com/group/7402090890367484428/,,0,0,False
网红“娟子”，被永久封禁！网友：可以无知，但不能无畏,2024-09-19 01:17,623,758,海峡网,海峡网,9月18日，江苏一位有41万粉丝的网红“娟子爱吃”在直播间公然调侃“918”，称自己不是中国人。网友指出问题的严重性后，她直怼网友管得多：“你们是瞧不起没文化的人吗？”18日晚，该网红的社交平台主页显示已被禁言。,https://toutiao.com/group/7416156994861548073/,,0,0,False
“心系百姓”、“为人民服务”确确切切是件令一国总理最头痛的事,2024-09-04 04:55,299349,32688,舟曲東去西燕飛,舟曲東去西燕飛,,https://toutiao.com/group/7410647010543403554/,,0,0,True
为什么没事千万别惹2.28米的张子宇？不然后果很严重，看看这一战,2024-06-30 01:48,3579,157,华少体育解说,华少体育解说,,https://toutiao.com/group/7386107221332984320/,,0,0,True
