title,publish_time,like_count,comment_count,media_name,source,abstract,article_url,tag,is_yaowen,article_sub_type,has_video
续写“亚太奇迹”,2024-11-12 23:30,294,155,人民日报,人民日报,‍‍‍‌‍‍‌“亚太是我们安身立命之所，也是全球经济增长动力之源。”过去几十年，亚太区域经济合作蓬勃发展，创造了举世瞩目的“亚太奇迹”。如何打造亚太发展的下一个“黄金三十年”？亚太经合组织第三十一次领导人非正式会议即将召开之际，一起聆听习近平主席给出的答案。,https://www.peopleapp.com/column/30047329740-500005911707?utm_source=头条号&promote=true,,0,0,False
内阁人选出炉，对华立场各异，两派博弈，将如何左右特朗普决策？,2024-11-12 09:49,20156,1225,邱震海,邱震海,,https://toutiao.com/group/7436327724950094373/,,0,0,True
迈向世界最强海军！中国赶造第一艘核动力航母,2024-11-13 00:15,5092,245,王丰台北,王丰台北,世界上所有的海军强权，都有一段艰辛而漫长的建军备战历程，从西班牙无敌舰队，到荷兰帝国海军，再到英国帝国海军，乃至今天的美国海军，它们都经历了一段艰难的建军过程。西方的谚语说，只有含泪播种的人才可以含笑收获。我们要完成祖国统一大业，要完成民族伟大复兴，必须要有一套宏伟的方法论，而建军备战就是脚踏实地的方法论。(声明:本视频脚本文稿全部都是作者自己亲自撰写，视频中如有引述新闻信息素材时，作者都会在视频中口头说明来源。其它绝大多数素材内容均属作者本身之论述观点创意，特此声明),https://toutiao.com/group/7436550789524357670/,,0,0,True
小学教师郭某某等三人，被执行死刑,2024-11-13 08:22,1231,117,环球时报,环球时报,未成年人健康成长关乎亿万家庭幸福安宁，关乎中华民族伟大复兴。性侵害未成年人犯罪严重损害未成年人身心健康，给未成年人的人生蒙上阴影，使未成年人父母及家庭背负沉重精神负担，社会影响特别恶劣，人民群众深恶痛绝。人民法院对此类犯罪坚决依法从严惩处，绝不手软。,https://toutiao.com/group/7436676002228568585/,,0,0,False
包厢全是刚出狱的恶霸，结果一看到饭店主厨，立马怂了,2024-11-11 01:21,4047,116,乐视群星访谈秀,乐视群星访谈秀,,https://toutiao.com/group/7435825833048015400/,,0,0,True
意大利姑娘眼中对中国人充满了喜爱，毫不掩饰表达想法，小伙飘了,2024-11-13 06:00,5613,593,意大利西蒙记,意大利西蒙记,意大利姑娘眼中对中国人充满了喜爱，毫不掩饰表达想法，小伙飘了,https://toutiao.com/group/7436639673310511635/,,0,0,True
郭有才：当迷失方向忘记初心后，曾经飘得多高，如今摔得就多惨,2024-11-11 06:53,625,370,八号探秘人,八号探秘人,在阅读此文之前，辛苦您点击一下“关注”，既方便您进行讨论和分享，又能给您带来不一样的参与感，感谢您的支持！编辑丨brt因为一首翻唱，他一夜之间成为了拥有千万粉丝的网红。但是“人红是非多”，不久他就因为版权等问题陷入了舆论风波。他的人气一落千丈，从万众瞩目变成了现在的无人问津。,https://toutiao.com/group/7435901170239078948/,,0,0,False
美妇约见老情人，见面场景真是太逗了，这俩人绝配！,2024-10-27 16:25,3030,378,乐视明星的那点事,乐视明星的那点事,美妇约见老情人，见面场景真是太逗了，这俩人绝配！,https://toutiao.com/group/7428157095108674088/,,0,0,True
罕见！100年前，英国游客拍下的清朝乡村，和想象中完全不一样,2024-09-20 02:07,5991,615,万物知识局,万物知识局,泥泞的土路，衣不蔽体的老百姓，即便是达官显贵的家中也十分破败，而这些都是清王朝的历史痕迹，虽说那时候中国摄影技术并不发达，但也有许多外国游客来到这里，拍摄下了许多老照片，为我们留下了珍贵的历史资料，那清朝到底是怎样的面貌呢?,https://toutiao.com/group/7416287738871267855/,,0,0,False
冷冻馒头会长黄曲霉毒素，真的吗？,2024-11-13 04:21,496,283,环球网,环球网,来源：上海网络辟谣 由中国科协、卫生健康委、应急管理部和市场监管总局等部委主办，中央网信办指导，全国学会、权威媒体、社会机构和科技工作者共同打造。最近，一条声称“浙大研究发现：冷冻馒头不能吃，冷冻超过两天会长黄曲霉素”的短视频迅速走红，并登上多平台热搜，引发广泛关注和恐慌。,https://3w.huanqiu.com/a/e98776/4KEjwHaEV5Y?agt=20,,0,0,False
“朱令案”最新进展：北京人民检察院已正式答复,2024-11-13 12:00,2534,1510,大皖新闻,大皖新闻,11月13日，据媒体消息，11月11日，朱令父母了收到北京市人民检察院的书面答复，结论是：经审查，未发现公安机关存在侦查违法情形。,http://www.ahwang.cn/toutiao/202411/2772666.html,,0,1,False
3年前，宁夏7岁小女孩一笑走红，后拒百万签约，如今怎么样了？他们后悔了吗？,2024-09-19 07:25,10005,1404,睿之悦,睿之悦,2021年，视频镜头中出现的女孩儿用那一抹甜美的笑容，迅速引起了网友们的广泛关注。有媒体公司看到这一机遇，提出愿意用百万巨资与女孩儿签约，然而，女孩儿的父母却坚决拒绝了这一提议。,https://toutiao.com/group/7416250139544879679/,,0,0,False
空仓而来、满载而归！沙特600万租300平展厅啥都不摆，进货来了？,2024-11-12 05:36,3230,596,军武次位面,军武次位面,第十五届珠海航展如约开幕，各国展商带着各自最新的军工装备、技术展示而来。他们租下了约300平米的展厅，租金高达数百万人民币，但展厅内却空无一物。,https://toutiao.com/group/7436255538167431714/,,0,0,False
中国绝版老香烟，见过5种以上都是爷爷辈的，老烟民们抽过几种？,2024-08-20 08:54,963,151,万物知识局,万物知识局,文/万物知识局本文陈述所有内容皆有可靠信息来源，赘述在文章结尾在中国的历史长河中，烟草的传奇故事已历经四百载春秋。从明朝嘉靖年间葡萄牙使者带来的烟草，到如今琳琅满目的香烟品牌，烟草不仅见证了时代的变迁，也承载了无数人的记忆与情感。,https://toutiao.com/group/7405119584723927578/,,0,0,False
李玟墓地被曝杂草丛生 粉丝要求恢复原貌,2024-11-13 00:54,571,720,大象新闻,大象新闻,11月11日，李玟位于武汉石门峰纪念公园的墓地被曝杂草丛生、鲜花凌乱不堪的场景，让众多粉丝心痛不已，纷纷站出来为她鸣不平，要求恢复原貌。李玟的墓地坐落在武汉石门峰纪念公园的一处山清水秀之地，这里原本是她家人精心挑选的安息之所。,https://share.hntv.tv/news/0/1856493260006088706,,0,0,False
河南女子去世，山东丈夫将手机埋墓里，充1000元话费，每天打电话,2024-11-01 06:52,2036,2115,何止电影,何止电影,2014年11月17日，河南肿瘤医院的病房中举行着一场特殊的婚礼，主角是于海宁跟他的患有癌症的妻子范会香。在几个月前范会香确诊癌症，跟男友提出分手，于海宁不远万里来到了女友的城市，照顾患癌女友。得知女友时日无多，在病房中跟女友求婚，在病房中举办了婚礼，婚后一年，范会香去世。,https://toutiao.com/group/7432199981609534004/,,0,0,False
2个月伤亡8万多人，俄军战场伤亡惨重：才明白我军三三制有多厉害,2024-11-12 08:06,1829,303,深度工场,深度工场,英国《每日电讯报》 报道，俄军伤亡在10月达到了最顶峰，创造了新记录。在今年10月的惨烈战斗当中，俄军平均一天伤亡1345人，在整个10月，俄军阵亡和负伤人数达到了41980人。,https://toutiao.com/group/7436292741274862080/,,0,0,False
樊振东、马龙、陈梦退出WTT福冈总决赛2024,2024-11-13 07:37,392,717,新京报,新京报,新京报讯 11月13日，世界乒乓球职业大联盟发布消息称，樊振东、马龙、陈梦退出WTT福冈总决赛2024。樊振东退赛，贝内迪克特·杜达递补；马龙退赛，安东·卡尔伯格递补；陈梦退赛，伯纳黛特·斯佐科斯递补。,https://m.bjnews.com.cn/detail/1731483236129765.html,,0,0,False
住房交易税收新政：家庭唯一和第二套住房不超过140平方米统一按1%税率缴纳契税 城市取消普通住宅标准后购房满2年再销售免征增值税,2024-11-13 09:50,1203,736,财联社,财联社,【住房交易税收新政：家庭唯一和第二套住房不超过140平方米统一按1%税率缴纳契税 城市取消普通住宅标准后购房满2年再销售免征增值税】财联社11月13日电，财政部等三部门发布关于促进房地产市场平稳健康发展有关税收政策的公告。,https://www.cls.cn/detail/1857553,,0,0,False
独家专访李子柒：归来依旧热爱,2024-11-13 05:51,3878,591,新华网,新华网,,https://toutiao.com/group/7436637529778717222/,,0,0,True
俩人相亲互相看不上，哪料男方一报母亲身份，姑娘乐了,2024-11-08 01:50,7523,1845,乐视群星访谈秀,乐视群星访谈秀,,https://toutiao.com/group/7434719902990074395/,,0,0,True
谁支持了特朗普上台？原来美国教会及中产，打败了政治邪恶力量！,2024-11-12 22:06,11865,633,黎建南台湾,黎建南台湾,,https://toutiao.com/group/7436517585706811930/,,0,0,True
广西49岁老汉娶19岁姑娘，结婚21年生下15个孩子，如今有何下场？,2024-10-20 08:32,2068,284,艺述史,艺述史,她19岁出嫁，21年里总共生育了15个孩子，其中4个男孩子11个女孩子，家里热闹的像是开了一所学校一样。,https://toutiao.com/group/7427400319418384948/,,0,0,False
“90后”男子强奸16岁继女，获刑三年二个月,2024-11-12 04:35,2756,3945,大皖新闻,大皖新闻,大皖新闻讯 本该尽到照顾、保护之责，但却动了非分之想，武汉一继父在与继女单独相处期间，强行与其发生性关系，后投案。近日，湖北省武汉市东西湖区人民法院公开该案一审刑事判决书，被告人何某某因犯强奸罪，获刑三年二个月。被告人何某某，1991年出生，重庆市人。,http://www.ahwang.cn/toutiao/202411/2771795.html,,0,1,False
住房交易税收新政！购买家庭唯一及第二套住房 不超140㎡按1%缴纳契税,2024-11-13 09:48,4166,7201,央视新闻,央视新闻,财政部、税务总局、住房城乡建设部发布《关于促进房地产市场平稳健康发展有关税收政策的公告》，明确多项支持房地产市场发展的税收优惠政策。公告明确，加大住房交易环节契税优惠力度，积极支持居民刚性和改善性住房需求；降低土地增值税预征率下限，缓解房地产企业财务困难。,https://content-static.cctvnews.cctv.com/snow-book/index.html?item_id=12709488495512861955&source=50006&sub_source=50006_001,,0,1,False
首例5胞胎长大了，父亲已过劳去世 母亲直言：如能重来一个也不要,2024-08-31 03:06,2125,517,睿之悦,睿之悦,2002年，在北京的一家妇产医院中，一位来自河北的孕妇顺利生下了两男三女的五胞胎，创造了一个全国罕见的奇迹。,https://toutiao.com/group/7409098624111575603/,,0,0,False
15年前他在爱妻葬礼上哭到昏厥，发誓永不再娶，如今他做到了吗？,2024-08-24 02:17,19593,604,八号探秘人,八号探秘人,在阅读此文之前，辛苦您点击一下“关注”，既方便您进行讨论和分享，又能给您带来不一样的参与感，感谢您的支持！编辑丨xk纵观鱼龙混杂的娱乐圈，有人背叛，有人痴情。而果靖霖则是公认的好男儿，将一生都奉献给妻子。但妻子却仅仅陪他走了半生，没能战胜病魔，不幸离开人世。,https://toutiao.com/group/7406210316734710283/,,0,0,False
1米3袖珍美女嫁给1米48男孩，婚后丈夫奇迹长高，两人却不欢而散,2024-09-07 02:55,3985,221,睿之悦,睿之悦,杨萍和葛存苗的婚礼 文|睿之悦 编辑|睿之悦2019年，成都的民政局来了两个“10岁小孩”来登记，工作人员以为是玩闹。两个“小孩”拿出身份证让工作人员看，这才明白，原来是两个再也长不高的成年袖珍人情侣。,https://toutiao.com/group/7411713833267364386/,,0,0,False
被姚明抱着上奥运的小英雄，曾发誓考上清华，16年后活成了这样,2024-11-07 08:07,1570,437,睿之悦,睿之悦,2008年，年仅9岁的林浩，在姚明的带领下走进了北京奥运会开幕式的舞台上，成为了万众瞩目的“焦点”。,https://toutiao.com/group/7434444094551687707/,,0,0,False
67岁执意生娃，如今却坐轮椅无法自理，5岁的天赐被迫独立学洗衣,2024-11-04 10:32,2958,714,睿之悦,睿之悦,2019年，已经67岁的田新菊执意生下了自己的第三个孩子小天赐。那么，现如今5年的时间过去了，这“天赐”的礼物到底是福还是祸呢?,https://toutiao.com/group/7433367394946384435/,,0,0,False
罪域：中央最大老虎被捕，惊动书记：后台再硬我亲自去抓，好看了,2024-10-25 03:31,5692,112,乐视大综艺咖,乐视大综艺咖,罪域：中央最大老虎被捕，惊动书记：后台再硬我亲自去抓，好看了,https://toutiao.com/group/7429550761878487589/,,0,0,True
送给所有知道我名字的人 想送一份祝愿给大家，所以唱了这首歌,2024-11-13 04:30,74298,12782,李子柒,李子柒,,https://toutiao.com/group/7436616916803781171/,,0,0,True
雷探长探访欧洲淫窟立陶宛，采访路人多位美女。#立陶宛,2024-11-13 12:23,5215,578,冒险雷探长,冒险雷探长,,https://toutiao.com/group/7436738422735471130/,,0,0,True
著名专家预言：试管婴儿寿命仅40年，那首例试管婴儿如今怎样了？,2024-09-01 06:05,8479,446,睿之悦,睿之悦,文|睿之悦编辑|睿之悦“试管婴儿活不到40岁？”1988年3月10日，我国首例试管婴儿顺利诞生。在当时，试管婴儿的技术正处于起步阶段，因此，有人将其视为医学的奇迹，但也有人则预言试管婴儿活不过40岁。那么，36年的时间过去了，我国首例试管婴儿如今怎么样了呢？,https://toutiao.com/group/7409105262277853733/,,0,0,False
相爱37年零绯闻，丁勇岱对赵雪华一见钟情，如今却对儿子很失望,2024-11-09 21:43,1768,133,八号探秘人,八号探秘人,在阅读此文之前，辛苦您点击一下“关注”，既方便您进行讨论和分享，又能给您带来不一样的参与感，感谢您的支持！编辑丨xk1985年，丁勇岱转过楼梯拐角，撞到人生挚爱，这一下把他撞“开窍”了。那时他还不是《末路》里的白宝山。也不是《跨过鸭绿江》里的彭老总，更不是《人世间》里的周志刚。,https://toutiao.com/group/7435160230918406707/,,0,0,False
