title,publish_time,like_count,comment_count,media_name,source,abstract,article_url,tag,is_yaowen,article_sub_type,has_video
春天，这菜使劲吃！一养肝、二护眼、三排毒、四通便，鲜嫩营养高,2025-02-26 11:49,5173,635,秀厨娘,秀厨娘,春风拂过田野，沉睡一冬的泥土里冒出了星星点点的嫩芽。这种带着淡淡清香的野菜，是春天给我们的第一份健康好食材。,https://toutiao.com/group/7475671861737570816/,,0,0,False
“天然造血库”不是红枣，而是它！3天吃一次，降肝火还抗衰老!,2025-02-28 04:00,1901,209,爱玉门,爱玉门,艾草煮荷包蛋!艾草青团子!艾草煎蛋!,https://toutiao.com/group/7475263640372036108/,,0,0,False
14年儿子坐马航失联，多年后父亲收到回信，坚信儿子去了平行世界,2025-02-20 02:38,9949,973,谛听骨语,谛听骨语,MH370失联的第10年，马来西亚政府宣布在2024年12月20日重启寻找马航MH370的项目。如果后续进展顺利的话，马航MH370会在2025年的1月到4月期间重新展开全面地搜寻。凭空消失的客机，有希望被揭露的失踪真相，这一切都是让人充满了期待。,https://toutiao.com/group/7473322554179895817/,,0,0,False
回来了！地产大佬套现300亿去美国，五年后回国，人民日报说对了,2025-03-10 08:25,1237,327,娱海拾忆人,娱海拾忆人,前有范逃逃后有潘逃逃，当年套现300亿跑到美国，给美国高校捐款6亿的潘石屹，在留下一大笔烂摊子，受到无数网友的责骂，而如今网友们却惊奇的发现潘石屹的IP地址已经从美国变成了北京，这让很多人不禁疑惑已经离开5年的潘石屹这次回来的目的到底是什么。,https://toutiao.com/group/7480090536477557288/,,0,0,False
坚持每隔两天炖一次，晚上沾床就睡，早上起来精气神十足,2025-02-27 03:31,3871,526,陈皮美食日志,陈皮美食日志,大家好，这里是陈皮的厨房，关注我持续为你输出美食配方。不管你是主动熬夜还是被动熬夜，都请试试这碗莲子百合猪心汤，安神养心，由内润到外。,https://toutiao.com/group/7475929963872190985/,,0,0,False
原始社会没人性，女人就如同男人的玩物，毫无文明可言,2025-02-27 16:01,7200,107,群星访谈秀,群星访谈秀,,https://toutiao.com/group/7474798582516761125/,,0,0,True
