title,publish_time,like_count,comment_count,media_name,source,abstract,article_url,tag,is_yaowen,article_sub_type,has_video
习语｜“我专门来看看你们”,2025-01-31 13:50,1083,451,人民日报,人民日报,6年前的2019年2月1日，习近平总书记看望春节前仍在工作的“快递小哥”，给他们拜年。听民声、问冷暖、送祝福，这样的场景，暖！,https://www.peopleapp.com/column/30048153360-500006073464?utm_source=头条号&promote=true,,0,0,False
公公竟然和儿媳偷情，哪料被妻子撞见，这下有戏看了！,2025-01-21 08:05,10244,873,南瓜午夜厅,南瓜午夜厅,,https://toutiao.com/group/7462273852651979274/,,0,0,True
小沈阳夫妇把演唱会开到了北京春晚舞台！,2025-01-29 16:47,14745,2612,非凡蛋糕mu,非凡蛋糕mu,,https://toutiao.com/group/7465379968436994623/,,0,0,True
特朗普宣布对中、加、墨加征关税，2月1日立即生效？ #美国 #关税,2025-01-31 23:20,7998,1845,王冰汝,王冰汝,,https://toutiao.com/group/7466223445513077275/,,0,0,True
小姑子30岁不嫁人，天天就喜欢和哥哥腻在一起，嫂子忍无可忍爆发,2025-01-23 02:38,5807,1154,影视随意看,影视随意看,,https://toutiao.com/group/7462934734751007284/,,0,0,True
这就是旺三代的媳妇，祖上积德啊，才能娶到这么好的媳妇👍,2025-01-27 10:33,44166,3618,趣知达人,趣知达人,,https://toutiao.com/group/7464541223764705842/,,0,0,True
苑举正教授被deep seek感动到,2025-01-31 14:07,12537,1323,常思,常思,,https://toutiao.com/group/7466080869346787840/,,0,0,True
女博士单位房被领导占了，博士不吵不闹，直接中断研究走人,2025-01-28 16:00,1896,129,PP科幻物语剧院,PP科幻物语剧院,,https://toutiao.com/group/7462671329154581029/,,0,0,True
过年期间外国女孩在中国相亲，彻底打乱了中国的相亲市场。,2025-01-30 16:30,8949,1848,三哥陈晓宝,三哥陈晓宝,,https://toutiao.com/group/7465746539105894946/,,0,0,True
网友：我老婆昨晚1:37分偷偷出去，早上5:28悄悄回来。,2025-01-21 09:27,4765,3151,观察小羊,观察小羊,网友：我老婆昨晚1:37分偷偷出去，早上5:28悄悄回来。你们说4个小时能去做什么事？,https://toutiao.com/group/7462297825670365731/,,0,0,True
