title,publish_time,like_count,comment_count,media_name,source,abstract,article_url,tag,is_yaowen,article_sub_type,has_video
郜春海：低空经济的发展空间远超新能源，颠覆未来商业模式,2024-12-19 08:10,2934,646,凤凰网财经,凤凰网财经,,https://toutiao.com/group/7450032423821115914/,,0,0,True
益生菌真的那么神奇吗？有关益生菌的几个误区 你“踩雷”了吗？,2024-12-07 02:35,1713,103,央视频,央视频,,https://toutiao.com/group/7445492942887715365/,,0,0,True
给《我是刑警》演技最好10位演员排座次：于和伟第3，第1名没争议,2024-12-18 04:06,1476,312,皮皮电影,皮皮电影,《我是刑警》收官之际，网上的争议，却也多了不少。有人盛赞它是“近10年最硬核刑侦剧”，老派纪实的剧作风格，令人着迷。受其影响，很多观众开始追起了二十多年前的《中国刑侦1号案》《12·1枪杀大案》。有人评价它“高开低走”。,https://toutiao.com/group/7449562650628866595/,,0,0,False
温州多家私人影院“可触摸服务人员隐私部位”？记者暗访后报警！警方：已对三个场所行政立案,2024-12-17 08:00,14894,4040,大风新闻,大风新闻,挂着“私人影院”的招牌，线上招徕生意，线下如同幽灵，连地址都是虚假的，居然还设“暗室”对付查处。近日，有网民向大皖新闻反映，在浙江省温州市一些颇受年轻人青睐的私人影院，悄然滋生了一些涉黄服务。,https://toutiao.com/group/7449286844203713062/,,0,0,False
广西49岁老汉娶19岁姑娘，结婚21年生下15个孩子，如今有何下场？,2024-10-20 08:32,8544,1059,艺述史,艺述史,她19岁出嫁，21年里总共生育了15个孩子，其中4个男孩子11个女孩子，家里热闹的像是开了一所学校一样。,https://toutiao.com/group/7427400319418384948/,,0,0,False
今年冬至60年一遇，5大特殊，过年冷不冷就看冬至的表现！,2024-12-21 00:17,5950,906,惠农圈,惠农圈,冬至到啦，这可是冬季最大的一个节气，也是一个节日，在民间素有“冬至大如年”的说法。在古代社会，那些常年在外地工作的人，在冬至这一天会赶回家。,https://toutiao.com/group/7450652001870594614/,,0,0,False
人间真实，北约赶在特朗普之前把乌克兰卖了,2024-12-21 07:13,2239,813,军情作家陈曦,军情作家陈曦,据报道，北约秘书长马克·吕特在保加利亚的公开讲话中，向外界透露了一个令人不太意外的事实:北约成员国没有义务与乌克兰签署双边安全协议。,https://toutiao.com/group/7450759482589250086/,,0,0,False
马光远：东南沿海小城市被严重低估 年轻人尽早放下北上广深执念,2024-12-17 06:30,3111,605,每日经济新闻,每日经济新闻,,https://toutiao.com/group/7449229105741955594/,,0,0,True
弟弟光荣退伍，姐姐兴奋去车站接他，怎料一见弟弟瞬间哭了,2024-11-05 06:34,40391,3299,乐视天天剧好看,乐视天天剧好看,,https://toutiao.com/group/7433679820573934091/,,0,0,True
印度媒体绝望了：歼-10C东南西三线夹击！将成为印度空军的噩梦？,2024-12-16 05:28,3237,512,军武次位面,军武次位面,【军武次位面】作者：天狼最近，社交媒体上一则关于孟加拉国可能采购中国歼-10C战斗机的消息让印度媒体集体“破防”。,https://toutiao.com/group/7448873550952038964/,,0,0,False
中央定调2025年养老金上涨，计算公式，企退人员能涨7%以上吗？,2024-12-18 04:29,1961,233,社保当家,社保当家,中央定调2025年养老金上涨，计算公式，企业退休人员能涨7%以上吗？在2025年到来之际，养老金上涨的消息就早早地确定了，这无疑给广大退休人员吃上了定心丸。因为根据近期召开的中央经济工作会议，已经明确提出要适当提高退休人员的基本养老金待遇。,https://toutiao.com/group/7447756391172833827/,,0,0,False
32岁飞行员晋升机长失败当天失联,2024-12-21 23:40,710,541,大象新闻,大象新闻,近日，网上一段疑似飞行员深夜在大桥上失联的事引发广泛关注。视频：飞行员深夜桥上失联，家人发布寻人启事网上一段8秒视频中有一男子的两张图片，其中一张穿着黑色上衣，显得阳光帅气，精神十足，另一张疑似其以前的照片。,https://share.hntv.tv/news/0/1870596225543892994,,0,0,False
沙利文的结局已定，他在离开白宫之前，说出了中美发生战争的结果,2024-12-16 02:48,15488,955,全荃,全荃,沙利文的结局已定，他在离开白宫之前，说出了中美发生战争的结果,https://toutiao.com/group/7448833372408775187/,,0,0,True
县长看不上乡长送的烟，给他退回来，乡长打开一看乐了,2024-11-13 08:16,9938,1641,乐视大综艺咖,乐视大综艺咖,,https://toutiao.com/group/7436672568578277925/,,0,0,True
#人间烟火 #东北菜 又忙活一天，酸菜大包子看着就馋人,2024-12-04 07:58,2779,506,农民王小,农民王小,,https://toutiao.com/group/7444462874421887528/,,0,0,True
全球最大电磁弹射无人机航母，两栖攻击舰 076即将下水,2024-12-22 09:48,7958,461,杜文龙,杜文龙,,https://toutiao.com/group/7451170777983877632/,,0,0,True
"蒋家与赖清德""不共戴天之仇""，深仇血恨！中正纪念堂将被拔除",2024-12-21 22:00,4907,201,黄阿原,黄阿原,,https://toutiao.com/group/7450837942110519808/,,0,0,True
中国考古报道：国内首次发现较完整桶装瓷器,2024-12-20 16:12,1236,159,看看新闻,看看新闻,长江口二号古船考古发掘有了最新进展：船体南部11号舱首次发现了国内较为完整的桶装瓷器，装桶直径约70厘米。试掘工作开启以来，文物也首次“上新”：一对粉彩瓜棱把杯尤其引人注目，上面绘有传统教子图与瓜瓞绵绵纹，经查证为“巧克力杯”，印证了当时海上贸易与东西方文化交流。这个3600多平方米的工作空间，可以,https://videocloud-tp.kksmg.com/pub/2024/12/21/eb5f9f69-beb1-11ef-9987-e381e28b6b61_b53e292f-1f24-30a1-a7ff-3f7acf48f481.mp4,,0,0,True
郜春海：马斯克具有超强的解构能力,2024-12-19 08:11,2522,568,凤凰网财经,凤凰网财经,,https://toutiao.com/group/7450032592033841675/,,0,0,True
80岁姑姑和83岁姑父相守一辈子，侄女探望二老，身体怎么样？,2024-11-04 23:30,984,131,兴凯湖莹莹,兴凯湖莹莹,,https://toutiao.com/group/7433570490595148298/,,0,0,True
中国大力推动数字经济，美国“薅”全球羊毛的日子要到头了？,2024-12-19 10:10,6212,209,张维为,张维为,《这就是中国》第263期精彩片段,https://toutiao.com/group/7450063397460116018/,,0,0,True
萝卜和鸡蛋这样做，比吃补药还补，顿顿吃都不会腻，又香又下饭,2024-10-30 12:28,67285,4140,小寒厨艺,小寒厨艺,萝卜和鸡蛋这样做，比吃补药还补，顿顿吃都不会腻，又香又下饭,https://toutiao.com/group/7431405463378919975/,,0,0,True
俄罗斯的决心很大，俄乌冲突可能到了最危险的时刻,2024-12-20 11:34,8100,577,金灿荣教授,金灿荣教授,,https://toutiao.com/group/7450456114459574820/,,0,0,True
袁记云饺已被立案调查，全国门店超4000家！盘点其商业版图,2024-12-20 08:07,1622,1183,潇湘晨报•晨视频,潇湘晨报•晨视频,据媒体报道，因存在食物中混有异物的问题，招牌为“袁记云饺”的北京府学餐饮管理发展有限公司被立案调查。在通报中，另有招牌名称为“袁记云饺”的北京鑫鑫晟餐饮店（个体工商户）、北京星冉餐饮有限公司，均存在“两个责任”落实不到位的问题，被责令改正，给予警告。,http://api.chenshipin.com/wap/a/67651f7e8420175f2c6cf075/90f456b81afce808c1fcfbd3f5761f65/1734681977/36a84677c11d27f529185e921480aea340580d21e4d85153d3da7445a7a2ca6d,,0,0,False
100年前，清朝罕见留影，王爷妻妾婀娜多姿，乞丐全身挂满垃圾,2024-10-14 09:58,2665,298,万物知识局,万物知识局,每一张老照片，都像是时间的低语，它们静静地躺在历史的相册中，却在不经意间将我们拉回到那个遥远而神秘的年代。,https://toutiao.com/group/7425457574731579919/,,0,0,False
海南富商张晖：花8亿建108米海上观音像，4年后死在水中死因成谜,2024-10-19 04:49,3700,626,八号探秘人,八号探秘人,在阅读此文之前，辛苦您点击一下“关注”，既方便您进行讨论和分享，又能给您带来不一样的参与感，感谢您的支持！编辑丨xk他是中国的一名富商，耗费8亿元完成了自己的梦想。可梦想落地成为现实的时候，他却在4年后莫名其妙的死去。他就是张晖，上个世纪末海南岛旅游业的龙头当家人。,https://toutiao.com/group/7427288913095492134/,,0,0,False
三人毁了一部剧！《我是刑警》这些“戏混子”，快收手吧,2024-12-20 03:17,271,315,青衫书生,青衫书生,《我是刑警》最近热播程度已经肉眼可见。可谓是收视率和口碑双在线。开播一集的时候就已经破百万收视率。可令人没想到的是，到后面大结局的时评分是越来越低。这也让大部分人对这部剧的编剧引起了怀疑....那问题来了，到底是剧本的烂、破案的随意..还是说和演员的演技挂钩？,https://toutiao.com/group/7450325520689922587/,,0,0,False
