title,publish_time,like_count,comment_count,media_name,source,abstract,article_url,tag,is_yaowen,article_sub_type,has_video
中东变化，以色列的噩梦才刚刚开始！（下）,2024-10-30 10:00,3759,134,占豪,占豪,美国不敢下手的后果是什么呢？现在以色列干的事情那么恶劣，后续还能有好日子？,https://toutiao.com/group/7431112725591228947/,,0,0,True
罕见！100年前，英国游客拍下的清朝乡村，和想象中完全不一样,2024-09-20 02:07,3618,451,万物知识局,万物知识局,泥泞的土路，衣不蔽体的老百姓，即便是达官显贵的家中也十分破败，而这些都是清王朝的历史痕迹，虽说那时候中国摄影技术并不发达，但也有许多外国游客来到这里，拍摄下了许多老照片，为我们留下了珍贵的历史资料，那清朝到底是怎样的面貌呢?,https://toutiao.com/group/7416287738871267855/,,0,0,False
善恶终有报：疫情时对中国一毛不拔，却大方捐美国6亿，如今咋样,2024-09-29 05:50,934,127,睿之悦,睿之悦,可就是这样一位在中国土生土长起来的富豪，在疫情期间面对同胞的困境却一毛不拔，反而大方的捐助了6亿给美国。,https://toutiao.com/group/7419859345154015798/,,0,0,False
母亲瘫痪、父亲疯了，当年那个744分的高考状元，7年后却成了这样,2024-09-08 00:54,6963,1170,八号探秘人,八号探秘人,母亲截肢瘫痪、父亲疯癫痴傻，可对于自己的亲人，他却做出了这样的评价。而今，7年已过，曾经那个让无数人动容的少年，现在如何?,https://toutiao.com/group/7411852147648496162/,,0,0,False
小伙洗完澡故意秀肌肉，富婆心跳加速被当场拿下，这下好看了,2024-10-26 16:20,3449,162,乐视情感讲堂,乐视情感讲堂,小伙洗完澡故意秀肌肉，富婆心跳加速被当场拿下，这下好看了,https://toutiao.com/group/7430011217881596426/,,0,0,True
写歌30年穷困潦倒，前妻失望选择离婚，谁料51岁靠一首歌一夜成名,2024-08-12 03:37,26207,4343,八号探秘人,八号探秘人,在阅读此文之前，辛苦您点击一下“关注”，既方便您进行讨论和分享，又能给您带来不一样的参与感，感谢您的支持！编辑：LY无数人都想要一个一夜成名的机会，但机会来了也不是每个人都能把握住的。他用了三十年的时间来准备迎接属于自己的机会。为了这个机会他放弃了一切，甚至包括家庭。,https://toutiao.com/group/7402090890367484428/,,0,0,False
姚明：之所以选择在这个时候离开中国篮协，主要还是基于对中国篮球未来的考虑,2024-10-31 10:19,207,246,环球网,环球网,来源：新华网 新华社北京10月31日电（记者王镜宇、林德韧）中国篮球协会执委会31日举行会议，完成负责人届中调整，郭振明接替姚明担任中国篮协主席。姚明表示，从今天起，他将不再担任中国篮协主席一职，这是经过慎重思考之后做出的决定。而郭振明说，接任之后会群策群力做好协会的工作。,https://3w.huanqiu.com/a/3458fa/4K4A4m31N8o?agt=20,,0,0,False
她被封禁，彻底凉凉！,2024-10-30 23:37,597,376,环球网,环球网,来源：新闻晨报 10月30日，有网友曝光博主“阿淼淼（miao）”在发布的作品中称“南京大屠杀属于日本内政”，引发广泛关注。记者搜索该博主账号时，发现其已被封禁。该博主账号主页自我介绍是“211的90后小学渣一枚”，被禁言前共有5.,https://3w.huanqiu.com/a/a7835f/4K3myobxSUm?agt=20,,0,0,False
15年前他在爱妻葬礼上哭到昏厥，发誓永不再娶，如今他做到了吗？,2024-08-24 02:17,18099,570,八号探秘人,八号探秘人,在阅读此文之前，辛苦您点击一下“关注”，既方便您进行讨论和分享，又能给您带来不一样的参与感，感谢您的支持！编辑丨xk纵观鱼龙混杂的娱乐圈，有人背叛，有人痴情。而果靖霖则是公认的好男儿，将一生都奉献给妻子。但妻子却仅仅陪他走了半生，没能战胜病魔，不幸离开人世。,https://toutiao.com/group/7406210316734710283/,,0,0,False
工行、农行、中行、建行、交行、邮储银行等，集体公告,2024-10-31 03:40,3176,2034,新京报,新京报,央视新闻10月31日消息，工商银行、农业银行、中国银行、建设银行、交通银行、邮储银行六大商业银行今天（31日）发布公告，将从明天（11月1日）起，陆续对商业性个人住房贷款利率实行新的定价机制。,https://m.bjnews.com.cn/detail/1730341873129336.html,,0,0,False
4年骑行结束，1500天终于回到老家，感谢大家一路陪伴有缘江湖见,2024-09-07 03:50,75011,16748,刘伟元的旅行,刘伟元的旅行,4年骑行结束，1500天终于回到老家，感谢大家一路陪伴有缘江湖见！,https://toutiao.com/group/7411715839100977716/,,0,0,True
“我有罪，对不起人民！”中国高铁总设计师被判死刑前，含泪忏悔,2024-10-30 05:24,2203,106,孔甲丙,孔甲丙,多山地，少平原，地势条件复杂，气候多样是中国地理上的突出特点。因此，中国至今最重要的交通物流途径是铁路，而为了管理维护和建设铁路，中国在建国之初便成立了铁道部专门负责相关事宜。,https://toutiao.com/group/7431434867827458594/,,0,0,False
人贩子余华英的眼神有多恐怖？被抓前一天穿粉外套，戴金项链逛街,2024-10-28 11:55,633,269,鲸探所,鲸探所,“她当时一定在想，当年怎么没有弄死我。”10月25日，余华英拐卖儿童发回重审案一审宣判：余华英以拐卖儿童罪被判处死刑，剥夺政治权利终身，并且没收个人全部财产。当这个宣判出来之后，杨妞花的眼泪就流了出来，这个结果，她等的实在是太久了。,https://toutiao.com/group/7430789956693541387/,,0,0,False
特务男扮女装混进村子，孩子兵顿时发现不对劲，这下精彩了,2024-10-28 06:09,1163,126,乐视群星访谈秀,乐视群星访谈秀,,https://toutiao.com/group/7430704630294413878/,,0,0,True
“两头婚”在国内悄然出现，“两头婚”逐渐增多？你能接受吗？,2024-10-16 09:01,685,646,读者,读者,你听说过“两头婚”吗？最近这几年，在年轻人中间流行起了一种新型婚姻形式——两头婚。对于他们而言，这种婚姻形式不仅仅是一种全新尝试，更是除了传统婚姻之外的一种完美选择。那么，这种新型的婚姻模式，真的代表了更理想的婚姻选择吗？,https://toutiao.com/group/7426187021527384615/,,0,0,False
“歼24”横空出世！论起高空高速，它是我军第二强，仅次于歼20,2024-10-30 08:06,2732,247,利刃,利刃,最近，一组歼-8战机编队飞行的照片亮相于网络，由于3架飞机飞得很密集，网友纷纷调侃“三八二十四，歼-24横空出世”！那么，在我军大批装备三代半和四代战机、甚至很多二代机部队直接换装歼-20的情况下，歼-8这款老飞机，还有存在的必要吗？,https://toutiao.com/group/7431476845067797001/,,0,0,False
双航母编队演练现场画面，来了！,2024-10-31 07:56,6969,1070,人民日报,人民日报,,https://www.peopleapp.com/column/30047187445-500005881513?utm_source=头条号&promote=true,,0,1,True
给近三年最好的10部年代剧排个名：《人世间》第6，第1名没有争议,2024-10-28 07:10,367,239,稻述,稻述,到了20世纪初，偶像剧成为人们的掌中宝，但要说现在什么剧最受欢迎，那一定是年代剧!其中《人世间》只能排第六，第一名人人都爱看，最后一名也比上不足比下有余。,https://toutiao.com/group/7430715494055264783/,,0,0,False
民间上坟传统：“上坟不带 5 果，家中不惹灾祸”，哪“5果”？,2024-08-08 10:30,18767,1806,惠农圈,惠农圈,在中国传统文化中，祭祀祖先一直是一项备受重视的活动，它承载着对先人的缅怀、敬意和感恩之情。在上坟的时候，人们会提前准备好供品，比如肉类、酒水，还有水果。其中关于水果的准备，也有着诸多的讲究和禁忌，比如“上坟不带 5 果，家中不惹灾祸”的说法。,https://toutiao.com/group/7400584207141192207/,,0,0,False
昨天下午5点13分，北京天安门震撼降下国旗，场面令人激动落泪,2024-10-31 01:56,1218,104,好邻居李亮,好邻居李亮,昨天下午5点13分，北京天安门震撼降下国旗，场面令人激动落泪,https://toutiao.com/group/7431752892984099380/,,0,0,True
至少57块碎片！美国卫星突然解体，神十八还没返航，航天员怎么办,2024-10-26 09:14,637,117,8卦娱,8卦娱,10月19日，美国通信卫星Intelsat于地球静止轨道解体。解体之初美媒称通信卫星碎片数量为二十多块，但经过调查，如今通信卫星产生的碎片数量已经达到了57块。,https://toutiao.com/group/7430009754304414249/,,0,0,False
军号一响，全军出击！,2024-09-19 08:01,27118,1703,中国军号,中国军号,,https://toutiao.com/group/7416261401477382668/,,0,0,True
挣扎了几个月，泽连斯基认命改口：怎么跟俄罗斯谈，全听中国安排,2024-10-28 08:46,1049,162,阿尔法军事,阿尔法军事,挣扎了好几个月，即便内心有万分的不情愿，泽连斯基还是决定，与俄罗斯的和平方案该怎么谈，还是得听中方的安排。,https://toutiao.com/group/7430744495617999360/,,0,0,False
她是第一位博士级歌唱家，12次荣登春晚，丈夫的身份更是深藏不露,2024-08-10 11:05,16248,480,豆莱说,豆莱说,文：豆莱说编辑：豆莱说支持作者，写作不易，文中会有5s广告，观看后可免费阅读全文在当下华语乐坛中，有很多的出色的歌唱家，雷佳就是其中一位。因为她不仅是我国首个荣获了博士学位的歌唱家，更是出道20年就12次登上了春晚舞台的歌唱家。而且，她丈夫的身份也是不容小觑。,https://toutiao.com/group/7401461240674943542/,,0,0,False
农村小情侣深夜约会，在屋内过着二人世界，兴奋坏了,2024-10-16 01:14,2299,247,乐视热播综艺精选,乐视热播综艺精选,农村小情侣深夜约会，在屋内过着二人世界，兴奋坏了,https://toutiao.com/group/7426173284741284364/,,0,0,True
长沙被打碎头骨女孩今天上学了！父亲发声：申请对前班主任“毁灭证据”立案调查,2024-10-31 11:50,203,114,大河报,大河报,大河报·豫视频记者 陈甜甜 长沙9岁女孩被老师打破头骨案持续引发关注。10月31日，受害女孩父亲刘先生告诉大河报·豫视频《看见》记者：“孩子今天去学校读书了。,https://news.dahebao.cn/dahe/appcommunity/2105206?newsId=2105206,,0,0,False
3年前，宁夏7岁小女孩一笑走红，后拒百万签约，如今怎么样了？他们后悔了吗？,2024-09-19 07:25,6664,1026,睿之悦,睿之悦,2021年，视频镜头中出现的女孩儿用那一抹甜美的笑容，迅速引起了网友们的广泛关注。有媒体公司看到这一机遇，提出愿意用百万巨资与女孩儿签约，然而，女孩儿的父母却坚决拒绝了这一提议。,https://toutiao.com/group/7416250139544879679/,,0,0,False
安徽美女道士胡小慧被捕：精通“胡媚术”，九名男徒弟揭露其罪行,2024-09-12 08:10,3759,427,艺述史,艺述史,在安徽一处偏僻山头上，有座神秘的道观，外表平平无奇，但里面却有着一位名气很高的美女道士。美女道士的名字叫做胡小慧，据说有着高深的法力，能帮人消灾解难。很多人慕名前来，交上丰厚的香火钱，在袅袅青烟里，试图从这个年轻道士身上获得一些生活的支撑。,https://toutiao.com/group/7413662261274739200/,,0,0,False
187票赞成！这一投票结束后，联大会议厅响起热烈掌声,2024-10-31 00:00,1987,688,大皖新闻,大皖新闻,当地时间10月30日，第79届联大针对“必须终止美国对古巴的经济、商业和金融封锁”完成一般性辩论后，就A/79/L.6决议草案进行投票，结果为187票赞成，2票反对，1票弃权，其中美国和以色列投下反对票。△古巴常驻联合国代表团投票结束后，联大会议厅响起热烈掌声。,http://www.ahwang.cn/toutiao/202410/2765991.html,,0,1,False
“187票赞成，2票反对，1票弃权”，联大压倒性通过决议,2024-10-31 00:17,2838,2331,闽南网,闽南网,当地时间10月30日，第79届联大针对“必须终止美国对古巴的经济、商业和金融封锁”完成一般性辩论后，就A/79/L.6决议草案进行投票，结果为187票赞成，2票反对，1票弃权，其中美国和以色列投下反对票。,https://toutiao.com/group/7431726871366074889/,,0,0,False
涉故意伤害罪等 湘雅二医院副主任医师刘翔峰一审获刑17年,2024-10-31 04:07,2485,7694,央视新闻,央视新闻,10月31日，长沙市中级人民法院依法对刘翔峰案一审公开宣判。,https://content-static.cctvnews.cctv.com/snow-book/index.html?item_id=12441934326728248129&source=50006&sub_source=50006_001,,0,1,False
