title,publish_time,like_count,comment_count,media_name,source,abstract,article_url,tag,is_yaowen,article_sub_type,has_video
学习卡丨“我最大的心愿，就是大家都能欢欢喜喜过好年”,2025-02-01 02:45,989,475,国际在线,国际在线,习近平总书记曾说:“我最大的心愿，就是大家都能欢欢喜喜过好年。”在这辞旧迎新、万家团圆之际，让我们聆听总书记的暖心话语，一起学习。,https://news.cri.cn/toutiaopic/2111ed92-b217-c65c-330a-449df3e7e759.html,,0,0,False
1月31号走了，过年期间喝酒害了多少人，多少家庭,2025-02-02 08:13,4560,1207,风花雪月%,风花雪月%,,https://toutiao.com/group/7466727272175649307/,,0,0,True
华为200万年薪都留不住他！天才少年彭志辉离职后，现状曝光,2025-01-16 09:28,4889,721,与君説,与君説,在阅读此文之前，麻烦您点击一下“关注”，既方便您进行讨论和分享，又能给您带来不一样的参与感，感谢您的支持文、编辑|小娄你敢相信吗？大厂华为200万年薪的工作，竟然也有人不屑一顾。入职华为两年后，彭志辉毅然决然选择离职。,https://toutiao.com/group/7460439446131884579/,,0,0,False
中国人的后代，他们盼回家。果敢同盟军2025年春节联欢晚会现场,2025-01-31 09:19,45102,5422,卫文布棋,卫文布棋,,https://toutiao.com/group/7466006571915543074/,,0,0,True
小姑子30岁不嫁人，天天就喜欢和哥哥腻在一起，嫂子忍无可忍爆发,2025-01-23 02:38,6207,1222,影视随意看,影视随意看,,https://toutiao.com/group/7462934734751007284/,,0,0,True
因为在高速上开的慢被恶意报复，造成多车追尾事故,2025-01-28 02:37,9292,10531,漂亮Lady,漂亮Lady,,https://toutiao.com/group/7464789840128426546/,,0,0,True
丈母娘看不起穷女婿，全家聚餐没给女婿留筷子，女儿做法漂亮！,2025-01-27 16:01,2200,555,群星访谈秀,群星访谈秀,,https://toutiao.com/group/7462286897130291724/,,0,0,True
还是二叔会心疼人，害怕晓薇感冒，把晓薇的脚放到自己胸膛取暖,2025-02-01 06:11,1957,650,乐视谍战影视营,乐视谍战影视营,,https://toutiao.com/group/7466298269832905268/,,0,0,True
相声：张康贾旭明说《三国》，真是俩相声天才，不输德云社！,2025-01-29 21:08,2915,625,PP爱情放映厅,PP爱情放映厅,,https://toutiao.com/group/7463035074229977600/,,0,0,True
