title,publish_time,like_count,comment_count,media_name,source,abstract,article_url,tag,is_yaowen,article_sub_type,has_video
大漠苍狼：农村姑娘收留乞丐，下秒乞丐洗干净了，姑娘心里乐开花,2025-01-11 07:55,5449,1123,热剧聚宝盆,热剧聚宝盆,大漠苍狼：农村姑娘收留乞丐，下秒乞丐洗干净了，姑娘心里乐开了花,https://toutiao.com/group/7458563417540919835/,,0,0,True
外甥正月理发舅舅当晚身亡，舅妈告其杀人索赔百万！法院：驳回！,2025-02-09 01:26,7755,2359,椒点视频,椒点视频,,https://toutiao.com/group/7469224432129573412/,,0,0,True
紫牛热点|男子与原同事婚外情近10年，相互转账数百笔累计数十万元，法院判了,2025-02-11 06:31,524,231,扬子晚报,扬子晚报,南通一男子与原同事保持了长达近十年的婚外情关系，通过微信红包、代还信用卡等方式向对方转账超20万元，而婚外情的女方也以各种方式向其转账11.8万余元。多年下来，两人之间的往来款项竟多达数百笔。妻子发现后，将婚外情女方起诉至法院，要求对方归还钱款。,https://wap.yzwb.net/wap/news/4317585.html,,0,0,False
王志文找江珊复婚，看两人对话简直太享受，不愧是老戏骨啊,2024-11-30 19:30,7583,772,娱快很简单,娱快很简单,,https://toutiao.com/group/7441487197062201893/,,0,0,True
女市长爱上小男友，俩人爱的轰轰烈烈，让女市长感到害怕,2024-12-18 08:13,6057,1099,经典热综回放,经典热综回放,,https://toutiao.com/group/7449661362671714850/,,0,0,True
二少爷装疯卖傻，少奶奶派出丫鬟前去试探他，有好戏看了,2024-11-23 23:28,7462,1310,乐享综艺剧场,乐享综艺剧场,,https://toutiao.com/group/7439971404629410342/,,0,0,True
赵本山凭这一个小品，捧红了王小利，全程笑点不断,2025-01-04 20:46,8971,1817,娱快很简单,娱快很简单,,https://toutiao.com/group/7454123678406541824/,,0,0,True
出租车司机半路捡个姑娘，直接带回家，老婆一看反应笑翻了,2025-01-14 07:28,10646,559,南瓜钟意你,南瓜钟意你,,https://toutiao.com/group/7459669645180650024/,,0,0,True
有这样的老婆，你家祖坟都冒青烟了！,2025-02-04 03:11,63959,10738,乐观的冰淇淋I,乐观的冰淇淋I,,https://toutiao.com/group/7467226170908606976/,,0,0,True
