title,publish_time,like_count,comment_count,media_name,source,abstract,article_url,tag,is_yaowen,article_sub_type,has_video
海南部分旅居人群成逃难大军，对于这样的生活，大家怎么看？,2025-02-09 10:48,4592,914,采云飘飘,采云飘飘,,https://toutiao.com/group/7469369555660309055/,,0,0,True
乌克兰阵亡士兵墓地实拍。网友:乌克兰已经打完一代人！,2025-02-28 09:30,39075,13978,晓晓杂谈,晓晓杂谈,,https://toutiao.com/group/7476399945663300133/,,0,0,True
吃饭“8分饱”是错的？医生提醒：65岁后吃饭尽量做到这4点,2025-03-03 23:33,4842,140,老k谈健康,老k谈健康,,https://toutiao.com/group/7477493545096528418/,,0,0,True
机器人首次登台，竟公然向评委喷水，笑坏郭德纲,2025-02-11 09:00,4338,874,大城小爱剧场剧院,大城小爱剧场剧院,,https://toutiao.com/group/7470083368625996288/,,0,0,True
《六姊妹》：最阴险的2个人没人察觉，大家都被他们的表面迷惑了,2025-03-02 04:58,629,124,石榴熟了,石榴熟了,《六姐妹》这部家长里短的年代大剧，剧情非常符合普通人的生活，虽然结局有些仓促不符情理，可过程就是多子女家庭的真实写照。,https://toutiao.com/group/7477072028164440613/,,0,0,False
老外花5万美元买的宇树机器人，带着去吃饭，现场老外都惊呆了！,2025-02-10 04:58,5927,836,有趣的小鱼儿,有趣的小鱼儿,,https://toutiao.com/group/7469434698880664091/,,0,0,True
中俄为何要站在一起，李显龙一语道破，我们还会遇到美国霸权,2025-03-04 16:52,30809,1324,孙绪闻,孙绪闻,中俄为何要站在一起，李显龙一语道破，我们还会遇到美国霸权,https://toutiao.com/group/7477998067472482828/,,0,0,True
许家印第二！又一个“大佬”跑路，花光几百亿，总部一片狼藉,2025-03-05 12:16,4064,761,天天历史,天天历史,2023年9月10日，沈晖发了条微博，写到“这周出差去了慕尼黑，然后纽约。好事多磨，静待花开。”就在沈晖出国一个月后，威马汽车正式申请了破产，留下的只有一地鸡毛。,https://toutiao.com/group/7478197991749190159/,,0,0,False
六姊妹 结局刘小玲教训家喜这段看得太解气，美心也终于看清老六,2025-02-25 01:32,1725,468,影娱奶酪,影娱奶酪,,https://toutiao.com/group/7475163371558617615/,,0,0,True
郭晶晶结婚后，霍家对她有多好！,2025-03-05 07:29,1521,136,进取风筝cr,进取风筝cr,,https://toutiao.com/group/7478223781874450956/,,0,0,True
