title,publish_time,like_count,comment_count,media_name,source,abstract,article_url,tag,is_yaowen,article_sub_type,has_video
时政微视频丨总书记最深的牵挂,2024-12-28 05:06,2386,1062,央视新闻,央视新闻,“老百姓的事情，是最重要的事情。”这一年，习近平总书记时刻记挂群众冷暖，看乡村、到社区、入企业、进校园，心之所系、行之所至！一件件民生“小事”，一次次考察调研，总书记念兹在兹是人民。悠悠百姓事，枝叶总关情。民生为大，是总书记最深的牵挂。,https://content-static.cctvnews.cctv.com/snow-book/index.html?item_id=10639376883264281782&source=50006&sub_source=50006_001,,0,0,False
【讲习所·2024与时偕行】“乘坐在一条命运与共的大船上”,2024-12-28 01:32,707,285,国际在线,国际在线,【本期导读】“地球就这么大，人类面临这么多共同挑战。中国古人讲‘同舟共济’，我看现在需要‘同球共济’。”“我们要以‘同球共济’精神珍爱和呵护地球，为子孙后代留下一片生存的乐土。”“要以‘同球共济’的精神，凝聚推动构建人类命运共同体的广泛共识。,https://news.cri.cn/toutiaopic/601696fe-a0db-5e43-b8fb-950aabfb2673.html,,0,0,False
权威数读｜一周“靓”数,2024-12-28 03:20,548,253,新华网,新华网,策划：令伟家设计：潘红宇文案：李茜 缪异星,http://my-h5news.app.xinhuanet.com/h5/article.html?articleId=0037ec06defcd4e155e7eee3653cef10,,0,0,False
徐克出品，必属精品，近年来为数不多的精良动作片,2024-12-13 03:48,1617,426,乐视典藏金曲汇,乐视典藏金曲汇,,https://toutiao.com/group/7447707364414718498/,,0,0,True
【空气炸锅烤红薯】直接烤是大错！教你一招，红薯香甜软糯流蜜汁,2024-12-25 14:05,788,323,明玥美食,明玥美食,【空气炸锅烤红薯】直接烤是大错！教你一招，红薯香甜软糯流蜜汁，比买的好吃,https://toutiao.com/group/7452350435098919443/,,0,0,True
未来四年大陆不会有统一台湾时间表？随时可解放台湾，何需时间表,2024-12-26 05:50,21863,2027,邱毅台湾,邱毅台湾,,https://toutiao.com/group/7452593764326965800/,,0,0,True
小子从小被猴养大，长大成半人半兽，身怀出神入化的武功,2024-11-22 03:36,859,139,乐视群星访谈秀,乐视群星访谈秀,,https://toutiao.com/group/7439942541555794471/,,0,0,True
河南警察3岁女儿被拐，苦寻全国23年无果，结果却发现女儿在对门,2024-11-05 07:43,5779,658,八号探秘人,八号探秘人,寻亲23年无果，丢失的女儿竟住在对门?但它却真实发生在河南洛阳的梁绍波身上。是意外走丢，还是人贩子所为，三岁的女儿怎会离奇失踪?,https://toutiao.com/group/7433697108120142345/,,0,0,False
世界变天，到了该亮剑的时候了！（下）,2024-12-27 22:30,3505,139,占豪,占豪,未来全球的货币到底本位于什么？没有这样一个大池子，别人怎么去长期持有人民币呢？,https://toutiao.com/group/7453026076818670132/,,0,0,True
未成年禁止观看！2024年全球爆片，尺度大到生理不适,2024-12-23 07:19,3173,102,禾芷解说,禾芷解说,深度解说电影《某种物质》,https://toutiao.com/group/7451503435595121191/,,0,0,True
韩国又一次创造了历史,2024-12-28 00:25,1952,361,牛弹琴,牛弹琴,怪不得韩剧那么精彩，因为韩国现实更精彩。12月27日，韩国国会又以192票赞成，通过了对代总统韩德洙弹劾案。刚当了不到两周代总统的韩德洙，也靠边站了。算起来，这是韩国史上第一次，时隔两周先后弹劾总统、代总统。感觉韩国政治真是杀疯了。,https://toutiao.com/group/7453249344129614373/,,0,0,False
WTT关于樊振东及陈梦退出国际乒联世界排名的声明,2024-12-28 14:09,1513,1698,红星新闻,红星新闻,我们对樊振东和陈梦两位球员的贡献深表敬意，他们激励了全世界无数的球迷和运动员。针对就WTT手册提出的关切，我们希望澄清以下几点：1. 规则并非最新出台樊振东和陈梦提到的规则并不是最新出台。这些规定包括世界排名靠前的球员自动入围参赛名单，自四年前WTT成立以来一直沿用至今。,https://toutiao.com/group/7453464017349214732/,,0,0,False
中国新型飞行器，肉眼可见的领先，到底应该算是几代机？,2024-12-27 06:07,36653,2136,陈虎点兵,陈虎点兵,,https://toutiao.com/group/7452969355765088820/,,0,0,True
海南富商张晖：花8亿建108米海上观音像，4年后死在水中死因成谜,2024-10-19 04:49,4384,758,八号探秘人,八号探秘人,在阅读此文之前，辛苦您点击一下“关注”，既方便您进行讨论和分享，又能给您带来不一样的参与感，感谢您的支持！编辑丨xk他是中国的一名富商，耗费8亿元完成了自己的梦想。可梦想落地成为现实的时候，他却在4年后莫名其妙的死去。他就是张晖，上个世纪末海南岛旅游业的龙头当家人。,https://toutiao.com/group/7427288913095492134/,,0,0,False
当得知女友怀孕了，男友不再装穷，直接带妻子回豪宅住,2024-12-17 03:23,3440,106,乐视经典热综回放,乐视经典热综回放,,https://toutiao.com/group/7449215721336209935/,,0,0,True
郭有才：当迷失方向忘记初心后，曾经飘得多高，如今摔得就多惨,2024-11-11 06:53,2129,888,八号探秘人,八号探秘人,在阅读此文之前，辛苦您点击一下“关注”，既方便您进行讨论和分享，又能给您带来不一样的参与感，感谢您的支持！编辑丨brt因为一首翻唱，他一夜之间成为了拥有千万粉丝的网红。但是“人红是非多”，不久他就因为版权等问题陷入了舆论风波。他的人气一落千丈，从万众瞩目变成了现在的无人问津。,https://toutiao.com/group/7435901170239078948/,,0,0,False
中国两种六代机试飞，美国不再是“领头羊”，我们为何跑得更快？,2024-12-28 10:38,2775,192,杜文龙,杜文龙,,https://toutiao.com/group/7453410241116373513/,,0,0,True
麻将口诀：逢二不拆一，赢到三家捶桌子，看我给您演示一下,2024-12-09 05:36,2801,1011,麻将高手阿涛,麻将高手阿涛,,https://toutiao.com/group/7446281763141190207/,,0,0,True
甲流来袭，比去年还要厉害，7种西药和5类中药收藏备用,2024-12-28 02:52,3781,471,中医科李医生,中医科李医生,自从2020年初新冠病毒“突袭”国人以来，这几年人们轮番接触过新冠、支原体肺炎、腺病毒、合胞病毒、甲流、乙流等呼吸道疾病，逐步形成“三个确定，三个不确定”认识:1、目前和将来，每年确定会遭遇呼吸道传染病高峰，但不确定是什么类型的呼吸道病症，如同“开盲盒”。,https://toutiao.com/group/7453287405047513635/,,0,0,False
只发行了660枚的麦穗五角，一枚46200元！千万别花掉了,2024-11-20 13:06,15365,5047,小hua聊收藏,小hua聊收藏,五角硬币大家并不陌生，市面上常见的有荷花五角，在这之前的梅花五角已经很少见了。细数钱币发行以来，发行过长城五角，梅花五角，金、白荷花五角，那么对比起来哪个更值钱呢。,https://toutiao.com/group/7439293128831484453/,,0,0,False
买羽绒服，别老盯着波司登！这6个宝藏国货品牌，不坑中国人,2024-11-21 23:25,4788,2310,萍萍说点事儿,萍萍说点事儿,近两年因为消费降级的趋势，越来越多的消费者开始重拾国货，那么外套中最保暖的羽绒服也成为了消费者重拾国货的焦点所在。然而却有不少雄心勃勃的国产品牌想要通过这波国货热潮提升自己的市场价值。,https://toutiao.com/group/7439874910119346707/,,0,0,False
不要再提“三星堆”了！地球不该出现的外来物质！三星堆就不该挖,2024-12-07 18:11,2059,277,河导师,河导师,,https://toutiao.com/group/7445734309790482956/,,0,0,True
五角大楼激辩一夜，决定重新定义六代机：美国再次领先中国,2024-12-28 04:16,4341,585,第一军情,第一军情,面对中国军工的“新年献礼”，某些以中国为假想敌的国家可是不好受了，其中自封为“世界警察”的美国尤其破防，给人一种“输不起”的感觉。,https://toutiao.com/group/7453311753498133002/,,0,0,True
成都市武侯区人民法院：关于被告人贺某阳故意伤害、虐待刑事附带民事诉讼案的说明,2024-12-27 09:43,474,1400,环球网,环球网,,https://toutiao.com/group/7453024640584139274/,,0,0,False
66岁的“情趣用品女王”冲上热搜，中国最性感的生意，被她带火了,2024-12-28 04:58,2073,225,毒sir财经,毒sir财经,情趣用品市场越来越爆火了！2023年中国情趣用品市场规模已达1794.3亿元，预计2025年将突破2000亿元。中国的情趣用品行业正在快速走向千亿规模。但是你知道“中国情趣用品女王”是谁吗？一位来自中国东北的66岁老太太——Lisa。,https://toutiao.com/group/7453072707693904447/,,0,0,False
中国两种六代机的首飞，是否会导致轰20项目下马？答案揭晓,2024-12-28 01:36,4340,401,张斌论评,张斌论评,,https://toutiao.com/group/7453270692008559113/,,0,0,True
100年前，清朝罕见留影，王爷妻妾婀娜多姿，乞丐全身挂满垃圾,2024-10-14 09:58,2802,313,万物知识局,万物知识局,每一张老照片，都像是时间的低语，它们静静地躺在历史的相册中，却在不经意间将我们拉回到那个遥远而神秘的年代。,https://toutiao.com/group/7425457574731579919/,,0,0,False
一口气买了3种蹄子，食叔秘制蹄花大咖，一口下去都是筋，真香,2024-12-28 08:30,1831,409,乡村食叔,乡村食叔,"农村大叔秘制蹄花大咖,做法独特，色香味俱全，看得我直流口水。下饭菜，美味，吃肉，吃喝，下酒菜，喝酒，吃货，过瘾，小吃，啤酒，日常，生活，vlog，厨艺。",https://toutiao.com/group/7453377390715077120/,,0,0,True
台湾又拍大尺度！ 太羞耻了，注定只能网盘见,2024-12-10 09:40,4033,203,禾芷解说,禾芷解说,深度解说台湾电影《亲爱的杀手》,https://toutiao.com/group/7446671812101931572/,,0,0,True
中国新型战机横空出世，美国后悔叫停第六代战机研发？ 回复,2024-12-27 22:26,16693,1216,王冰汝,王冰汝,,https://toutiao.com/group/7453221650381668902/,,0,0,True
清华才女李一诺：27岁博士毕业，4年生3娃，能替世界首富花钱,2024-12-18 05:51,6747,330,云莳一,云莳一,家庭是她第一个学校，妈妈是她第一任老师。李一诺27岁博士毕业进入美国麦肯锡公司，33岁成为公司全球董事合伙人，之后四年连生3娃。,https://toutiao.com/group/7449591069311779355/,,0,0,False
香港九龙寨城老照片：曾是香港最邪恶肮脏之地，图9场景令人作呕,2024-11-21 11:32,2715,479,万物知识局,万物知识局,有这么一个地方，他虽然地处极度繁华的都市香港，但是却脏乱不堪，环境极度的恶劣，各种违法的交易都在这里进行，甚至黄赌毒，也在这里悄然滋生，这就是九龙城寨。,https://toutiao.com/group/7439657140518519296/,,0,0,False
