title,publish_time,like_count,comment_count,media_name,source,abstract,article_url,tag,is_yaowen,article_sub_type,has_video
11年狂赚200亿，骗了10万中国人后跑路的亿万富翁，下场如何呢？,2024-09-26 09:05,3559,1121,八号探秘人,八号探秘人,盘继彪，一个狂妄自大的骗子，11年间骗走200亿，把十几万中国人坑得是血本无归家破人亡。不仅如此，他还在跑路之前，杀人诛心的在他们公司官网发布了一条“我们跑路了“的公告，嘲讽受害者。,https://toutiao.com/group/7418792738887729704/,,0,0,False
炒白菜千万不要直接下锅，难怪不好吃，教你技巧，鲜嫩入味不出水,2024-10-30 09:23,13583,750,家常的味道,家常的味道,,https://toutiao.com/group/7431496869400576550/,,0,0,True
为什么过了70岁的老年人，更需要同居生活？看完你就明白了,2024-09-26 08:22,9240,157,身心驿站,身心驿站,,https://toutiao.com/group/7418864306399216179/,,0,0,True
刚从中国返俄，苏-57飞行员传来新消息,2024-11-25 10:15,6811,228,环球时报新媒体,环球时报新媒体,刚从中国返俄，苏-57飞行员传来新消息,https://toutiao.com/group/7441158524530328127/,,0,0,True
包厢全是刚出狱的恶霸，结果一看到饭店主厨，立马怂了,2024-11-11 01:21,8688,181,乐视群星访谈秀,乐视群星访谈秀,,https://toutiao.com/group/7435825833048015400/,,0,0,True
67岁执意生娃，如今却坐轮椅无法自理，5岁的天赐被迫独立学洗衣,2024-11-04 10:32,6198,1488,睿之悦,睿之悦,2019年，已经67岁的田新菊执意生下了自己的第三个孩子小天赐。那么，现如今5年的时间过去了，这“天赐”的礼物到底是福还是祸呢?,https://toutiao.com/group/7433367394946384435/,,0,0,False
乌克兰蒙了，欧洲慌了，美国也冷静了,2024-11-26 10:42,9386,364,张元伟,张元伟,,https://toutiao.com/group/7441536551424623114/,,0,0,True
给近三年最好的10部年代剧排个名：《人世间》第6，第1名没有争议,2024-10-28 07:10,2571,1363,稻述,稻述,到了20世纪初，偶像剧成为人们的掌中宝，但要说现在什么剧最受欢迎，那一定是年代剧!其中《人世间》只能排第六，第一名人人都爱看，最后一名也比上不足比下有余。,https://toutiao.com/group/7430715494055264783/,,0,0,False
黎智英香港出庭抖内幕，美国介入，蔡英文参与，还有赵少康金小刀,2024-11-27 09:24,15409,1050,邱毅台湾,邱毅台湾,,https://toutiao.com/group/7441887559757595190/,,0,0,True
炸萝卜丸子到底用面粉还是淀粉，教你正确做法，外焦里嫩，太香了,2024-10-26 09:25,12378,812,家常的味道,家常的味道,,https://toutiao.com/group/7430012978277122611/,,0,0,True
河南警察3岁女儿被拐，苦寻全国23年无果，结果却发现女儿在对门,2024-11-05 07:43,1566,118,八号探秘人,八号探秘人,寻亲23年无果，丢失的女儿竟住在对门?但它却真实发生在河南洛阳的梁绍波身上。是意外走丢，还是人贩子所为，三岁的女儿怎会离奇失踪?,https://toutiao.com/group/7433697108120142345/,,0,0,False
北约对俄罗斯态度变了！普京称冲突正在演化，32个国家蠢蠢欲动,2024-11-27 06:20,3827,471,杜文龙,杜文龙,,https://toutiao.com/group/7441840147903021577/,,0,0,True
女友怀孕了，男友不装了，带她回豪宅！,2024-11-23 08:01,6752,605,乐视大综艺咖,乐视大综艺咖,,https://toutiao.com/group/7440353629540483593/,,0,0,True
1米3袖珍美女嫁给1米48男孩，婚后丈夫奇迹长高，两人却不欢而散,2024-09-07 02:55,6339,325,睿之悦,睿之悦,杨萍和葛存苗的婚礼 文|睿之悦 编辑|睿之悦2019年，成都的民政局来了两个“10岁小孩”来登记，工作人员以为是玩闹。两个“小孩”拿出身份证让工作人员看，这才明白，原来是两个再也长不高的成年袖珍人情侣。,https://toutiao.com/group/7411713833267364386/,,0,0,False
郭有才：当迷失方向忘记初心后，曾经飘得多高，如今摔得就多惨,2024-11-11 06:53,1189,600,八号探秘人,八号探秘人,在阅读此文之前，辛苦您点击一下“关注”，既方便您进行讨论和分享，又能给您带来不一样的参与感，感谢您的支持！编辑丨brt因为一首翻唱，他一夜之间成为了拥有千万粉丝的网红。但是“人红是非多”，不久他就因为版权等问题陷入了舆论风波。他的人气一落千丈，从万众瞩目变成了现在的无人问津。,https://toutiao.com/group/7435901170239078948/,,0,0,False
菲律宾总统和副总统开干，其实就是媚美反中与亲中远美的路线之争,2024-11-26 09:37,15981,148,邱毅台湾,邱毅台湾,,https://toutiao.com/group/7441519866256818714/,,0,0,True
菲律宾，开始摊牌了,2024-11-24 05:31,20838,930,牛弹琴,牛弹琴,菲律宾，“殊死搏斗”开始了,https://toutiao.com/group/7440714259027198498/,,0,0,True
好物分享｜炖牛肉时切记三放两不放，这样炖出来的牛肉才会汤鲜味美,2024-10-15 08:50,5125,199,家味美食,家味美食,,https://toutiao.com/group/7425922043991360037/,,0,0,True
拜登挖坑摆烂，特朗普眼前困难重重荆棘满布，各国向中国靠拢避险,2024-11-22 08:15,27680,675,邱毅台湾,邱毅台湾,,https://toutiao.com/group/7440014294332211727/,,0,0,True
这绝对是我吃过最好吃的蒜蓉蒸鸡做法,2024-11-11 12:49,2556,199,天天相见厨房(阿见),天天相见厨房(阿见),,https://toutiao.com/group/7436003114588570123/,,0,0,True
体感温度-30度的一天，生活在内蒙牧区的，我们是怎么度过的,2024-11-26 11:28,6023,870,河南姑娘远嫁在内蒙,河南姑娘远嫁在内蒙,,https://toutiao.com/group/7441548328887648819/,,0,0,True
冬季骑行遭遇下大雪，有狼有熊靠着意志力翻越雪山，晚上太危险了,2024-11-23 04:00,32518,6600,刘伟元的旅行,刘伟元的旅行,,https://toutiao.com/group/7440177196649415180/,,0,0,True
从“抛弃”到“香饽饽”，发展迅猛！我国可持续航空燃料产量潜力大,2024-11-24 07:01,1330,107,国际在线,国际在线,,https://crionline-media.cri.cn/cb5a6d96-d0c4-4fd0-a895-b6135667d84a/video/bffc92277d6b4ff5aff857474a3d4437.mp4,,0,0,True
全家人爱吃的懒人早餐，5分钟出锅，比包子好吃，比油条还香,2024-11-13 03:50,2800,349,家味美食,家味美食,,https://toutiao.com/group/7436606239527666212/,,0,0,True
弟弟光荣退伍，姐姐兴奋去车站接他，怎料一见弟弟瞬间哭了,2024-11-05 06:34,26819,2780,乐视天天剧好看,乐视天天剧好看,,https://toutiao.com/group/7433679820573934091/,,0,0,True
48小时内，俄罗斯遭大规模袭击，北约找到出兵借口，波兰要打头阵,2024-11-27 03:35,2936,522,金亮,金亮,过去一天的时间里，俄罗斯再次遭到乌军大规模袭击。北约现在找到了出兵介入的借口，而波兰却准备打头阵。,https://toutiao.com/group/7441797724758639140/,,0,0,True
未来三年：稳住，你就赢了,2024-08-31 13:38,5562,818,洞见,洞见,财经博主@曹多鱼说过一个扎心的现象:这两年有上进心的人，都负债累累了。“大环境不明朗的情况下，你就像陷进了泥坑里。,https://toutiao.com/group/7409296614000427571/,,0,0,False
讣告！100岁叶嘉莹去世：17岁丧母，52岁丧女，94岁裸捐，她是中国最后一位“穿裙子的士”,2024-11-26 01:20,3412,600,读者,读者,从南开大学获悉，古典文学研究学者、南开大学讲席教授叶嘉莹，于2024年11月24日去世，享年100岁。她，是加拿大不列颠哥伦比亚大学终身教授，却在54岁写信给中国教育部，申请免费来华教学。来华任教后，她辗转全国多所高校讲授古诗词，不遗余力地传承中国古典文化。,https://toutiao.com/group/7441390504039793163/,,0,0,False
被驱逐出中国的他，早就“翻车”了,2024-11-21 08:18,3171,141,环球人物杂志,环球人物杂志,他可能从没想过，有一天会以这样的形式离开。作者：陈佳莉55岁的大众汽车集团（中国）首席运营官约亨·森皮尔不光彩地离开了中国。10月下旬，因为血液中被检测出毒品，森皮尔在被拘留10日后驱逐出境。两年前，作为知名汽车品牌大众集团的在华高管，森皮尔带着光鲜履历和艰巨使命来到中国。,https://toutiao.com/group/7439643917601079849/,,0,0,False
“逃”到美国的皇室女，“金主”破产了,2024-11-21 08:33,1959,255,环球人物杂志,环球人物杂志,她放弃皇室身份，却无法摆脱舆论漩涡。作者：尹洁10月26日，真子嫁给小室圭整三年。作为日本天皇德仁的侄女、皇嗣秋筱宫文仁的长女，真子在婚前的身份是日本皇族。媒体和大众叫她公主，日本官方称她“真子内亲王”。结婚后，因为丈夫是平民，她没有了皇室身份，名字从夫姓，成了“小室真子”。,https://toutiao.com/group/7439647636958757412/,,0,0,False
2元一斤和20元一斤的大米，有什么区别？真的越贵越好？,2024-11-25 08:13,439,144,人民日报,人民日报,不管是红烧肉这样的硬菜，还是清炒时蔬、西红柿鸡蛋这样的小清新，都得搭配上一碗香喷喷的米饭，那才叫完美。,https://www.peopleapp.com/column/30047476348-500005947193?utm_source=头条号&promote=true,,0,1,False
1.91米的“女神”，开启新身份,2024-11-21 08:37,1628,109,环球人物杂志,环球人物杂志,“排球绝不仅仅是我以前在赛场上看到的那一种模样。”作者：陈佳莉今年9月，奥运冠军惠若琪迎来了属于自己的第一个教师节。从南京师范大学博士毕业后，因为延续着对排球的热爱，惠若琪选择留校任教。对于曾站上过梦想的世界之巅，也体验过手术台上与死神擦肩而过的她来说，讲台成为最新的“赛场”。,https://toutiao.com/group/7439648518744113683/,,0,0,False
罕见！100年前，英国游客拍下的清朝乡村，和想象中完全不一样,2024-09-20 02:07,7787,714,万物知识局,万物知识局,泥泞的土路，衣不蔽体的老百姓，即便是达官显贵的家中也十分破败，而这些都是清王朝的历史痕迹，虽说那时候中国摄影技术并不发达，但也有许多外国游客来到这里，拍摄下了许多老照片，为我们留下了珍贵的历史资料，那清朝到底是怎样的面貌呢?,https://toutiao.com/group/7416287738871267855/,,0,0,False
月薪过万 我为何还从胖东来离职？丨封面头条,2024-11-26 09:18,512,1434,封面新闻,封面新闻,近年来，胖东来是热搜榜单的“座上宾”，而当下胖东来关于涉足员工婚嫁彩礼收取、请客办酒的新闻引起了社会又一波的热议。生活在河南许昌的梁梦看着评论区和营销号，对胖东来或贬低或高唱的论调，心中都不再起波澜。,https://m.thecover.cn/news_details.html?from=web&eid=zF0xC09FFmqH90qSdq8Jkw==,,0,0,False
黎以停火协议达成，以色列战线收缩后，对抗伊朗成主要目标？,2024-11-27 07:20,8701,347,邱震海,邱震海,,https://toutiao.com/group/7441855479933993507/,,0,0,True
首例5胞胎长大了，父亲已过劳去世 母亲直言：如能重来一个也不要,2024-08-31 03:06,3434,912,睿之悦,睿之悦,2002年，在北京的一家妇产医院中，一位来自河北的孕妇顺利生下了两男三女的五胞胎，创造了一个全国罕见的奇迹。,https://toutiao.com/group/7409098624111575603/,,0,0,False
她曾被前夫一巴掌扇到离婚！二婚嫁世界冠军，如今生活幸福滋润,2024-09-10 09:12,17855,309,豆莱说,豆莱说,“漂亮的让人挪不开眼”是圈内人对她的评价，和“山杏”不一样的是，李琳在现实生活中的感情很是幸运，遇到了导演王小列。,https://toutiao.com/group/7412930201929204236/,,0,0,False
