title,publish_time,like_count,comment_count,media_name,source,abstract,article_url,tag,is_yaowen,article_sub_type,has_video
8道家常小炒做法简单，学会了招待客人特有面子#家常小炒,2024-12-17 09:28,3250,220,勇往直前的秋雪,勇往直前的秋雪,,https://toutiao.com/group/7449310376384004617/,,0,0,True
济南这一二十年没见过这么大的雪,2025-03-02 07:25,2593,457,东哥CBD趣生活,东哥CBD趣生活,,http://toutiao.com/item/7477109977111331369/,,0,0,True
原来她就是雷军的妻子，怪不得做什么都能来财，娶一个贤妻旺三代,2025-03-01 03:52,799,133,与君説,与君説,在阅读此文之前，麻烦您点击一下“关注”，既方便您进行讨论和分享，又能给您带来不一样的参与感，感谢您的支持文、编辑|小莉雷军拼了，为了卖新车，他竟然连自己极少在公众前露面的老婆都拉出来了！不过令人啼笑皆非的是，在通过视频看到雷军妻子的那一刻，很多网友竟然把她认成了销售人员。,https://toutiao.com/group/7476681649682399755/,,0,0,False
白宫闹崩后，10个严重后果,2025-03-02 07:05,8205,940,牛弹琴,牛弹琴,在伦敦，泽连斯基受到英雄般的欢迎,https://toutiao.com/group/7477104703914951183/,,0,0,True
复婚：前妻突然登门，前夫却很嫌弃：瞎折腾！,2025-02-24 04:26,2956,185,综艺剧集营,综艺剧集营,复婚：前妻突然登门，前夫却很嫌弃：瞎折腾！,https://toutiao.com/group/7474837280738312756/,,0,0,True
3月2日，看看这些无法行驶的汽车，就知道济南大暴雪到底有多大了,2025-03-02 09:21,1184,502,振振有词儿,振振有词儿,,https://toutiao.com/group/7477139649048134144/,,0,0,True
春天，这菜使劲吃！一养肝、二护眼、三排毒、四通便，鲜嫩营养高,2025-02-26 11:49,1778,256,秀厨娘,秀厨娘,春风拂过田野，沉睡一冬的泥土里冒出了星星点点的嫩芽。这种带着淡淡清香的野菜，是春天给我们的第一份健康好食材。,https://toutiao.com/group/7475671861737570816/,,0,0,False
夫妻冷战老公下班回家，看到没有自己的饭，失望的回到自己的房间,2025-02-24 12:26,11120,1721,非李莫属,非李莫属,,https://toutiao.com/group/7474960956410397211/,,0,0,True
中国作协副主席评《哪吒2》：低俗艺术，污染神话！张艺谋被牵连,2025-02-27 13:08,11770,21174,小水往前飞,小水往前飞,当我们自己的文化作品正在走向世界巅峰时候，有人眼红了，还是我们自己的人。近日，中国作家协会副主席阎晶明发文谈《哪吒2》的观后感。,https://toutiao.com/group/7476070418471502388/,,0,0,False
