title,publish_time,like_count,comment_count,media_name,source,abstract,article_url,tag,is_yaowen,article_sub_type,has_video
吃饭“8分饱”是错的？医生提醒：65岁后吃饭尽量做到这4点,2025-03-03 23:33,4038,129,老k谈健康,老k谈健康,,https://toutiao.com/group/7477493545096528418/,,0,0,True
六姊妹 结局刘小玲教训家喜这段看得太解气，美心也终于看清老六,2025-02-25 01:32,1700,463,影娱奶酪,影娱奶酪,,https://toutiao.com/group/7475163371558617615/,,0,0,True
14年儿子坐马航失联，多年后父亲收到回信，坚信儿子去了平行世界,2025-02-20 02:38,7578,711,谛听骨语,谛听骨语,MH370失联的第10年，马来西亚政府宣布在2024年12月20日重启寻找马航MH370的项目。如果后续进展顺利的话，马航MH370会在2025年的1月到4月期间重新展开全面地搜寻。凭空消失的客机，有希望被揭露的失踪真相，这一切都是让人充满了期待。,https://toutiao.com/group/7473322554179895817/,,0,0,False
老外花5万美元买的宇树机器人，带着去吃饭，现场老外都惊呆了！,2025-02-10 04:58,5919,836,有趣的小鱼儿,有趣的小鱼儿,,https://toutiao.com/group/7469434698880664091/,,0,0,True
许家印第二！又一个“大佬”跑路，花光几百亿，总部一片狼藉,2025-03-05 12:16,3008,583,天天历史,天天历史,2023年9月10日，沈晖发了条微博，写到“这周出差去了慕尼黑，然后纽约。好事多磨，静待花开。”就在沈晖出国一个月后，威马汽车正式申请了破产，留下的只有一地鸡毛。,https://toutiao.com/group/7478197991749190159/,,0,0,False
机器人首次登台，竟公然向评委喷水，笑坏郭德纲,2025-02-11 09:00,4302,866,大城小爱剧场剧院,大城小爱剧场剧院,,https://toutiao.com/group/7470083368625996288/,,0,0,True
见证历史！第一次见白宫里吵架 中国记者惊了：画面“丧权辱国”,2025-03-01 02:11,41024,17809,中国品牌,中国品牌,2月28日，美国总统特朗普与乌克兰总统泽连斯基在白宫举行会谈。会谈过程中，双方在媒体前爆发激烈争吵，泽连斯基提前离开白宫。原计划的联合记者会被取消，美乌矿产协议未能签署。,https://toutiao.com/group/7476657950241817088/,,0,0,True
人间：丈夫突然提出分房睡，妻子偷偷装监控，发现惊人的一幕,2024-12-14 08:55,17372,169,经典影视大联欢,经典影视大联欢,,https://toutiao.com/group/7448188651097293349/,,0,0,True
人过60，无论你的儿女多么孝顺，都要懂得麻雀定律，别不当回事！,2025-02-24 21:34,2643,573,热闹海风Ooa,热闹海风Ooa,人过60，天过午，生命的年轮已经过去一大半了。大半辈子中，是努力过，奋斗过，也拼搏过!人过60岁，要照顾好渐渐老去的自己，不要凡事都依赖孩子。,https://toutiao.com/group/7474579197240607284/,,0,0,False
