title,publish_time,like_count,comment_count,media_name,source,abstract,article_url,tag,is_yaowen,article_sub_type,has_video
全网上线！中国式现代化主题励志短片《主角》,2025-03-03 01:50,2815,1223,人民日报,人民日报,‍‍‍‌‍‍‌“中国式现代化的新征程上，每一个人都是主角，每一份付出都弥足珍贵，每一束光芒都熠熠生辉。”2025年全国两会之际，人民日报新媒体推出中国式现代化主题励志短片《主角》。未来的领衔主演，是每一个为梦想拼搏的你。新的春天，一起出发，一起奋斗！,https://www.peopleapp.com/column/30048398605-500006122480?utm_source=头条号&promote=true,,0,0,False
习语 | 两会上，总书记关心的那些事,2025-03-02 15:20,1036,1324,人民日报,人民日报,每年全国两会“到团组”，百姓冷暖、民生福祉都是习近平总书记心头最大的牵挂。一次次询问，一句句叮嘱，温暖人心。,https://www.peopleapp.com/column/30048396299-500006122183?utm_source=头条号&promote=true,,0,0,False
乌克兰首都基辅现状，拍摄于2025年3月3日，看看街上还有多少男人,2025-03-03 01:01,10031,4529,王哥说事,王哥说事,,https://toutiao.com/group/7477381859442229801/,,0,0,True
济南这一二十年没见过这么大的雪,2025-03-02 07:25,3352,640,东哥CBD趣生活,东哥CBD趣生活,,http://toutiao.com/item/7477109977111331369/,,0,0,True
网传菲律宾非法坐滩军舰“葬身火海”，真相究竟如何？,2025-03-03 06:01,3706,692,第一军情,第一军情,#春日生活打卡季#文/空山近期，菲律宾在南海方向动作频频，不断拉拢域外国家撑腰，菲军方甚至威胁出动战机，为侵闯南海岛礁的舰机“护航”，这引起了中方的强烈反应，就在此时，有自媒体宣称，菲律宾在仁爱礁非法坐滩的“马德雷山”号登陆舰“葬身火海”、“船员纷纷跳海”，暗示甚至直言“中方出手,https://toutiao.com/group/7477457818199654922/,,0,0,False
复婚：前妻突然登门，前夫却很嫌弃：瞎折腾！,2025-02-24 04:26,3191,190,综艺剧集营,综艺剧集营,复婚：前妻突然登门，前夫却很嫌弃：瞎折腾！,https://toutiao.com/group/7474837280738312756/,,0,0,True
泽连斯基发布最新视频,2025-03-03 07:31,1176,584,北京青年报,北京青年报,,https://toutiao.com/group/7477482700736528930/,,0,0,True
白宫闹崩后，10个严重后果,2025-03-02 07:05,15383,1549,牛弹琴,牛弹琴,在伦敦，泽连斯基受到英雄般的欢迎,https://toutiao.com/group/7477104703914951183/,,0,0,True
