title,publish_time,like_count,comment_count,media_name,source,abstract,article_url,tag,is_yaowen,article_sub_type,has_video
习近平会见俄罗斯联邦安全会议秘书绍伊古,2025-02-28 11:19,1591,110,新华网,新华网,2月28日下午，国家主席习近平在北京人民大会堂会见俄罗斯联邦安全会议秘书绍伊古。习近平指出，中俄是山水相连的友好邻邦，更是百炼成钢的真心朋友。,http://my-h5news.app.xinhuanet.com/h5/article.html?articleId=f10f7bbacd7efab6493a82320db11468,,0,0,False
1950-1969年出生，以前交过公粮的农村老人，现在终于熬到享福了,2025-02-20 06:25,4741,1969,春日不可思,春日不可思,,https://toutiao.com/group/7473352475769078311/,,0,0,True
百年棋局：美国为何不让俄罗斯倒下？,2025-02-27 11:55,6815,735,张元伟,张元伟,,https://toutiao.com/group/7476033849567281703/,,0,0,True
演技烂得像混子，《六姊妹》一群神仙混进俩“关系户”，真招人嫌,2025-02-24 20:45,1956,489,山西广电文娱,山西广电文娱,《六姊妹》便是这样一部承载着无数期待重磅登场的佳作。自其播出那一刻起，热度便一路飙升，收视率稳稳占据全国榜单首位，成为观众茶余饭后热议的焦点。,https://toutiao.com/group/7475087387861828131/,,0,0,False
中国斜爆震发动机突破，16马赫时速2万公里，一小时飞遍全球,2025-02-27 10:45,18902,2147,杜文龙,杜文龙,,https://toutiao.com/group/7476048237850264103/,,0,0,True
18匹野马全军覆没困在泥塘里奄奄一息，幸亏中国消防战士🪖,2024-12-22 05:59,178137,16119,郑阿姨美容美体养生馆,郑阿姨美容美体养生馆,,https://toutiao.com/group/7451111856770384421/,,0,0,True
10万吨核动力，中国005型航母2025年下水？美媒：颠覆性技术加持,2025-02-28 00:56,1776,171,阵匠,阵匠,而与此同时，中国也很有可能在紧锣密鼓地建造着另一艘令人瞩目的战舰——005型航母，有消息甚至称该航母预计将于2025年下水。,https://toutiao.com/group/7476093155374105128/,,0,0,False
坚持每隔两天炖一次，晚上沾床就睡，早上起来精气神十足,2025-02-27 03:31,1759,193,陈皮美食日志,陈皮美食日志,大家好，这里是陈皮的厨房，关注我持续为你输出美食配方。不管你是主动熬夜还是被动熬夜，都请试试这碗莲子百合猪心汤，安神养心，由内润到外。,https://toutiao.com/group/7475929963872190985/,,0,0,False
