title,publish_time,like_count,comment_count,media_name,source,abstract,article_url,tag,is_yaowen,article_sub_type,has_video
广西49岁老汉娶19岁姑娘，结婚21年生下15个孩子，如今有何下场？,2024-10-20 08:32,11563,1340,艺述史,艺述史,她19岁出嫁，21年里总共生育了15个孩子，其中4个男孩子11个女孩子，家里热闹的像是开了一所学校一样。,https://toutiao.com/group/7427400319418384948/,,0,0,False
清华才女李一诺：27岁博士毕业，4年生3娃，能替世界首富花钱,2024-12-18 05:51,10163,448,云莳一,云莳一,家庭是她第一个学校，妈妈是她第一任老师。李一诺27岁博士毕业进入美国麦肯锡公司，33岁成为公司全球董事合伙人，之后四年连生3娃。,https://toutiao.com/group/7449591069311779355/,,0,0,False
含量过高！中国的商场，怎么全是预制菜？,2025-01-14 02:31,199,154,毒sir财经,毒sir财经,万万没想到，“预制菜”的风还是吹到了最寻常的水饺上。最近，被誉为水饺界天花板的“袁记云饺”被爆，水饺馅是冷冻的，水饺皮不是现擀的。合着店里包水饺的大妈们，都是演员？顾客吃的不是新鲜水饺，是“妈妈的代餐”？然而，这并非个例。,https://toutiao.com/group/7459227890333286921/,,0,0,False
新华社：三问深圳小学生数学期末考卷,2025-01-14 09:19,685,1301,环球时报,环球时报,20片羽毛球场地，有54人打球，问单打双打的场地各有多少；《长城谣》歌词中的“四万万同胞心一样”是近似数还是精确数；海底捞针、瓜熟蒂落、旭日东升、水滴穿石等成语所描述的事件哪个发生的概率最小……近期，深圳市南山区小学数学期末考卷引发关注和热议。,https://toutiao.com/group/7459697798855557682/,,0,0,False
新婚33天卷走274万4套房，出逃后丈夫跨国追捕，如今下场大快人心,2024-12-20 22:06,6572,320,八号探秘人,八号探秘人,在阅读此文之前，辛苦您点击一下“关注”，既方便您进行讨论和分享，又能给您带来不一样的参与感，感谢您的支持！编辑丨QQ·B“色字头上一把刀！”深圳富豪结婚33天竟被卷走274万元和名下4套房产。不仅如此，他还被扣上了“接盘侠”的帽子，啥也没干喜当爹。,https://toutiao.com/group/7450399558821052982/,,0,0,False
美媒关注中国特种船，120米长臂送坦克上岸，登陆作战出现新模式,2025-01-12 07:26,4991,950,杜文龙,杜文龙,据说这种船的船头部分有一条长臂，长臂长达120米，之前无论是坦克登陆舰，包括两栖攻击舰，如果在滩头登陆，特别是在地质不好，地形较差的滩头登陆，一般会面临较大困难，行动速度慢，以容易被对方火力杀伤。,https://toutiao.com/group/7458926622519984674/,,0,0,False
