title,publish_time,like_count,comment_count,media_name,source,abstract,article_url,tag,is_yaowen,article_sub_type,has_video
人民日报整版报道：2024中国文化有多出圈,2024-12-30 08:06,728,237,人民日报,人民日报,2024，China Travel升温，春节申遗成功，《黑神话:悟空》海外掀起“西游热”，博物馆文创美到next level…这一年，精彩的中国文化故事不断上演，你印象最深的是哪一段?,https://www.peopleapp.com/column/30047861785-500006022060?utm_source=头条号&promote=true,,0,0,False
六代机双飞、四川舰三个第一，神雕无人预警机，中国军工震惊美国,2024-12-30 06:02,36362,1920,邱毅台湾,邱毅台湾,,https://toutiao.com/group/7454081205471085107/,,0,0,True
妻子到处说丈夫不行，丈夫脸都丢光了，回家把妻子当狗打,2024-11-13 08:41,1174,107,乐视扒剧小妹儿,乐视扒剧小妹儿,,https://toutiao.com/group/7436679409567793673/,,0,0,True
第6代战机，是怎样炼成的？(上),2024-12-29 14:51,11798,374,静思有我,静思有我,,https://toutiao.com/group/7453846576981606912/,,0,0,True
韩国又一次创造了历史,2024-12-28 04:21,3736,147,牛弹琴,牛弹琴,韩国又创造了历史，更精彩的还在后面,https://toutiao.com/group/7453313008731685411/,,0,0,True
马斯克76岁母亲在中国火了，自称几乎每个月都来，对中国赞不绝口,2024-12-28 11:42,18581,699,国际时事快递,国际时事快递,,https://toutiao.com/group/7453361562800095779/,,0,0,True
厨师长教你：“葱爆羊肉”羊肉滑嫩、鲜香不膻,2024-12-27 07:34,2561,459,美食作家王刚,美食作家王刚,厨师长教你：“葱爆羊肉”羊肉滑嫩、鲜香不膻,https://toutiao.com/group/7452991735665263139/,,0,0,True
零下35度睡到帐篷里，半夜被热醒了，真的太热了,2024-12-30 11:22,2755,545,旅行者小多,旅行者小多,,https://toutiao.com/group/7454163664929554971/,,0,0,True
新婚33天卷走274万4套房，出逃后丈夫跨国追捕，如今下场大快人心,2024-12-20 22:06,4426,230,八号探秘人,八号探秘人,在阅读此文之前，辛苦您点击一下“关注”，既方便您进行讨论和分享，又能给您带来不一样的参与感，感谢您的支持！编辑丨QQ·B“色字头上一把刀！”深圳富豪结婚33天竟被卷走274万元和名下4套房产。不仅如此，他还被扣上了“接盘侠”的帽子，啥也没干喜当爹。,https://toutiao.com/group/7450399558821052982/,,0,0,False
被央媒怒批，目不识丁，丢人现眼，这几位“文盲”明星凭什么走红,2024-12-30 10:52,1576,410,与君説,与君説,在阅读此文之前，麻烦您点击一下“关注”，既方便您进行讨论和分享，又能给您带来不一样的参与感，感谢您的支持文、编辑|小娄郭德纲曾说“可以没文凭，但不能没文化”。老郭的这句话在儿子郭麒麟身上体现得淋漓尽致。虽然郭麒麟初中就辍学了，但人家有思想有内涵，是个名副其实的“文化人”。,https://toutiao.com/group/7454151513221661234/,,0,0,False
老纪和珅这段对话，以前小时候听不懂，如今听完受益终身,2024-12-28 23:16,3882,1231,乐视扒剧小妹儿,乐视扒剧小妹儿,,https://toutiao.com/group/7453420191947424293/,,0,0,True
说一说成飞的新飞机，网上传的越来越玄乎，究竟有多厉害？,2024-12-29 13:21,11282,1322,陈虎点兵,陈虎点兵,,https://toutiao.com/group/7453823402932732435/,,0,0,True
2025春晚导演组名单曝光！看到语言节目负责人，网友：怎么又是她,2024-12-30 07:08,538,539,卿羽飞,卿羽飞,在今年圣诞节之前，有关春晚的消息就已经成为社会的关注话题。然而，令人很遗憾的是，当网友看到导演名单上的那个名字后，都纷纷表示:怎么又是她?,https://toutiao.com/group/7454094506703602187/,,0,0,False
四川女生在澳洲农场打工的真实生活：早上4点摘草莓，时薪29澳元,2024-12-28 04:26,1415,497,鲸探所,鲸探所,网上有一位博主分享了自己在澳洲农场打工的真实生活，每天早上四点起床摘草莓，一个小时29澳元，一天只需要工作6个小时左右。,https://toutiao.com/group/7453312348158231081/,,0,0,False
代理总统也遭弹劾！一个月内换三任总统，韩国民主还有救吗？,2024-12-28 06:35,11906,106,邱震海,邱震海,,https://toutiao.com/group/7453347580572631592/,,0,0,True
海南富商张晖：花8亿建108米海上观音像，4年后死在水中死因成谜,2024-10-19 04:49,4692,835,八号探秘人,八号探秘人,在阅读此文之前，辛苦您点击一下“关注”，既方便您进行讨论和分享，又能给您带来不一样的参与感，感谢您的支持！编辑丨xk他是中国的一名富商，耗费8亿元完成了自己的梦想。可梦想落地成为现实的时候，他却在4年后莫名其妙的死去。他就是张晖，上个世纪末海南岛旅游业的龙头当家人。,https://toutiao.com/group/7427288913095492134/,,0,0,False
中国已经下水第8艘航母？美媒宣称：14年下水8艘航母，速度创纪录,2024-12-30 09:28,1806,441,东方点兵,东方点兵,076官宣正式下水，美媒宣称，这是中国海军“下水”的第8艘航母，14年接连下水8艘航母，速度史无前例。,https://toutiao.com/group/7454133080303976999/,,0,0,False
清华才女李一诺：27岁博士毕业，4年生3娃，能替世界首富花钱,2024-12-18 05:51,7559,354,云莳一,云莳一,家庭是她第一个学校，妈妈是她第一任老师。李一诺27岁博士毕业进入美国麦肯锡公司，33岁成为公司全球董事合伙人，之后四年连生3娃。,https://toutiao.com/group/7449591069311779355/,,0,0,False
57岁于文华现状，与丈夫住农村简陋房子，裙子拖地喂着狗生活幸福,2024-12-17 01:24,909,129,焰墨绘史,焰墨绘史,在阅读此文之前，麻烦您点击一下“关注”，既方便您进行讨论和分享，又能给您带来不一样的参与感，感谢您的支持。本文内容均引用权威资料结合个人观点进行撰写，文中已标注文献来源及截图，请知悉。提起于文华，想必当大家都不会陌生，当年的她凭借那首《纤夫的爱》，一夜间家喻户晓。,https://toutiao.com/group/7448948632033722889/,,0,0,False
中国第八道硬菜上桌，美国绝对消化不良！（上）,2024-12-30 22:00,2219,101,占豪,占豪,面对中国科技大爆发，美国怎么办？现在临时再加大力度投入能行吗？,https://toutiao.com/group/7454120162862563840/,,0,0,True
