title,publish_time,like_count,comment_count,media_name,source,abstract,article_url,tag,is_yaowen,article_sub_type,has_video
幸福生活，像花儿一样绽放——习近平总书记在贵州和云南考察纪实,2025-03-22 00:15,2826,1248,新华网,新华网,列车在祖国大西南的群山峻岭间飞驰，这里有壮美的山川，有厚重的历史，有绚丽的文化，有欣欣向荣的发展。全国两会闭幕不到一周，习近平总书记即赴贵州和云南考察调研。5年前，“十三五”收官，考察云南，要求“全面建成小康社会，一个民族都不能少”。,http://my-h5news.app.xinhuanet.com/h5/article.html?articleId=67c078cc188a2986d767104ef8b7c93c,,0,0,False
全球仅剩50多只！新疆首次拍到，蒙古国的“国宝”为何跑来中国,2025-03-21 23:54,4235,568,萌萌说俗语,萌萌说俗语,全球仅剩50多只！新疆首次拍到，蒙古国的“国宝”为何跑来中国,https://toutiao.com/group/7484152608589660709/,,0,0,True
2025年工龄满30年的人要偷着乐！国家送上3个重磅福利，最后一个能多拿4万！,2025-03-20 03:22,1525,131,国际速探,国际速探,2025年工龄满30年的朋友要享福了，国家给咱们准备了三个实打实的“退休大礼包”，尤其是最后一个能让家属多拿好几万。,https://toutiao.com/group/7483725561320178227/,,0,0,False
香椿立大功？研究发现：香椿可在40小时内清除体内40%有害菌群？,2025-03-22 03:34,806,109,河山锐新闻,河山锐新闻,春日的微风轻拂，仿佛大自然的温柔唤醒，菜市场也随之苏醒，瞬间变成了一个生机勃勃的奇妙世界。在这片新鲜食材的海洋中，香椿宛如一位神秘的精灵，悄然现身，散发着独特魅力，吸引着众人的目光。,https://toutiao.com/group/7484152131709239843/,,0,0,False
这是张学良老婆赵四小姐真实样貌，并非演员饰演而是货真价实真品,2024-12-28 11:28,35526,2811,历史伟人,历史伟人,赵四小姐，原名赵一荻，她从十六岁开始她终生陪伴张学良，历经坎坷，赵一荻是富家大小姐，但是在张学良囚禁期间，她选择陪伴软禁中的张学良，后悔过吗?,https://toutiao.com/group/7453422736652698175/,,0,0,False
58岁女子确诊肺癌，强忍泪水坦言：手部早出现了问题，没有多重视,2025-03-18 02:36,4227,254,沈阳生活广播,沈阳生活广播,在咱们身边，总有一些人过着平凡又惬意的小日子，李阿姨就是其中一位。她 58 岁，是社区图书馆的管理员，每天就爱待在那一排排书架中间，沉浸在书的海洋里。,https://toutiao.com/group/7482972886584623650/,,0,0,False
中考，又变了,2025-03-20 12:19,1649,2277,中国新闻周刊,中国新闻周刊,日前，北京市教委发布2025年的中考政策，录取总成绩满分为510分，计入成绩的统考科目为6门，这也意味着历史、地理、化学、生物学“小四科”不计入总分。,https://toutiao.com/group/7483864523737170458/,,0,0,False
正式官宣！45岁霍启刚再升职，级别有点高，妻子郭晶晶坐不住了,2025-03-21 09:20,2277,430,启娱说,启娱说,本文所述内容均有可靠信源，具体信息来源赘述在文章最后。霍启刚提议，打响了整治反内卷第一枪。这不，最近，45岁的霍启刚又升职了。,https://toutiao.com/group/7484189045195686415/,,0,0,False
