title,publish_time,like_count,comment_count,media_name,source,abstract,article_url,tag,is_yaowen,article_sub_type,has_video
小沈阳夫妇把演唱会开到了北京春晚舞台！,2025-01-29 16:47,7667,1449,非凡蛋糕mu,非凡蛋糕mu,,https://toutiao.com/group/7465379968436994623/,,0,0,True
翟欣欣为了钱，竟然可以克服生理厌恶和苏某结婚，也真是个狠人,2025-01-22 09:22,4812,1333,乐见Talk,乐见Talk,索要千万逼死前夫的翟欣欣，认罪认罚！天理昭昭，报应不爽，迟到七年半的审判终于来了。本以为的一场婚姻纠纷，伴随着一封遗书解开了翟欣欣蛇蝎面目。,https://toutiao.com/group/7462559129823953442/,,0,0,False
公公竟然和儿媳偷情，哪料被妻子撞见，这下有戏看了！,2025-01-21 08:05,9303,801,南瓜午夜厅,南瓜午夜厅,,https://toutiao.com/group/7462273852651979274/,,0,0,True
点燃烟花递给警察，镜头一捕捉笑翻全场！,2025-01-04 10:36,79286,7357,King,King,,https://toutiao.com/group/7456006626227618367/,,0,0,True
2009年巅峰的刘谦，第一次上台就被惊艳到,2025-01-29 03:09,1857,540,网络热评,网络热评,,https://toutiao.com/group/7465168879430451753/,,0,0,True
我家小梦真的会演小品#陈梦,2025-01-29 17:34,601,123,未来会更好,未来会更好,,https://toutiao.com/group/7465391976247083520/,,0,0,True
因为在高速上开的慢被恶意报复，造成多车追尾事故,2025-01-28 02:37,5606,7385,漂亮Lady,漂亮Lady,,https://toutiao.com/group/7464789840128426546/,,0,0,True
小姑子30岁不嫁人，天天就喜欢和哥哥腻在一起，嫂子忍无可忍爆发,2025-01-23 02:38,5159,1060,影视随意看,影视随意看,,https://toutiao.com/group/7462934734751007284/,,0,0,True
提灯定损上春晚了！艺术果然来源于生活！,2025-01-28 17:26,5810,1478,醉语闲言,醉语闲言,不知道江西那个提灯定损的房东一家人看了作何感想！,https://toutiao.com/group/7465019012091724329/,,0,0,True
