title,publish_time,like_count,comment_count,media_name,source,abstract,article_url,tag,is_yaowen,article_sub_type,has_video
时政微观察丨三个维度看中国经济的底气和信心,2024-12-11 08:09,633,662,央视新闻,央视新闻,时至年终，中国经济运行形势备受瞩目。回看今年中国经济的整体表现，一、二、三季度，国内生产总值分别增长5.3%、4.7%、4.6%，前三季度增长4.8%。9月以来，随着一揽子增量政策持续显效，经济保持回升向好态势。12月9日，中共中央政治局召开会议。,https://content-static.cctvnews.cctv.com/snow-book/index.html?item_id=13444306819040469755&source=50006&sub_source=50006_001,,0,0,False
女友怀孕了，男友不装了，带她回豪宅！,2024-11-23 08:01,10330,817,乐视大综艺咖,乐视大综艺咖,,https://toutiao.com/group/7440353629540483593/,,0,0,True
57岁周立波现状：头发稀疏身体暴瘦，定居美国和富豪妻子低调生活,2024-12-09 23:01,556,271,峰哥正读,峰哥正读,前段时间，周立波在美国街头的一张照片引起了热议，只见他戴着黑框大眼镜，发际线后移，头发稀疏，撇着嘴，神色间是我们熟悉的桀骜不驯。,https://toutiao.com/group/7446308823331111461/,,0,0,False
给近三年最好10部年代剧排个名：《人世间》仅第6名，第1名没争议,2024-12-07 12:40,1215,294,皮皮电影,皮皮电影,不久前，《小巷人家》完结，虽然高开低走，但依然在水准之上，正午阳光出品，还是有质量保障的。《小巷人家》的热播，也再次唤起观众对年代剧这一类型的关注。年代剧是国剧中的一个重要分支，几乎每年都会出一两部精品，观众可以在年代剧中，感受到岁月流转。,https://toutiao.com/group/7444021041967415818/,,0,0,False
阿萨德早知今日，提前做好了布局！（中）,2024-12-10 22:00,4543,492,占豪,占豪,谁能知道叙利亚竟然穷到这种份上了？伊朗现在怎么样了呢？,https://toutiao.com/group/7446716459814519330/,,0,0,True
广西49岁老汉娶19岁姑娘，结婚21年生下15个孩子，如今有何下场？,2024-10-20 08:32,6779,822,艺述史,艺述史,她19岁出嫁，21年里总共生育了15个孩子，其中4个男孩子11个女孩子，家里热闹的像是开了一所学校一样。,https://toutiao.com/group/7427400319418384948/,,0,0,False
叙利亚变天，谁赢谁输？(上),2024-12-10 03:05,11285,549,静思有我,静思有我,,https://toutiao.com/group/7446614119396704809/,,0,0,True
冬天洗澡多久一次最好？这4个时候，劝你不要洗,2024-12-07 10:01,2014,276,环球网,环球网,来源：健康杭州 最近杭城的气温 一天天走低 忙活了一整天，洗个热乎乎的澡 再钻进暖暖的被窝，再舒服不过！ 然而不少人洗澡时 或多或少会犯些错 结果把本该舒服又养人的“养生澡”硬生生洗成了“伤身澡”冬天多久洗一次澡最好？洗澡频率主要取决于个体的需求和偏好。,https://3w.huanqiu.com/a/106d4f/4KYr5sh4XfC?agt=20,,0,0,False
成功拦截！美国首次！,2024-12-11 00:22,482,588,闽南网,闽南网,美国导弹防御局10日发表声明说，美国首次在西太平洋关岛成功进行弹道导弹拦截测试。声明说，美在当天进行的测试中使用配备新型AN/TPY-6雷达和垂直发射装置的“宙斯盾”反导系统发射了一枚“标准-3 Block 2A”型导弹，在关岛安德森空军基地海岸附近拦截了一枚空射型中程弹道导弹。,https://toutiao.com/group/7446942704921805321/,,0,0,False
美落井下石！尹锡悦没救了！！ 欢迎收看《谦言谦语》播出,2024-12-06 02:00,12871,269,赖岳谦官方,赖岳谦官方,,https://toutiao.com/group/7445112782787183114/,,0,0,True
河南警察3岁女儿被拐，苦寻全国23年无果，结果却发现女儿在对门,2024-11-05 07:43,3723,385,八号探秘人,八号探秘人,寻亲23年无果，丢失的女儿竟住在对门?但它却真实发生在河南洛阳的梁绍波身上。是意外走丢，还是人贩子所为，三岁的女儿怎会离奇失踪?,https://toutiao.com/group/7433697108120142345/,,0,0,False
二少爷装疯卖傻，少奶奶派出丫鬟前去试探他，有好戏看了,2024-11-23 23:28,2058,482,乐享综艺剧场,乐享综艺剧场,,https://toutiao.com/group/7439971404629410342/,,0,0,True
央视曝光！#制假售假“一条龙”！,2024-11-24 12:16,5293,2028,央视财经,央视财经,,https://toutiao.com/group/7440818726712115762/,,0,0,True
新生育时代：三个“二孩家庭”的上海样本,2024-12-08 11:02,769,313,看看新闻,看看新闻,新生育时代：三个“二孩家庭”的上海样本,http://mediaplay.kksmg.com/2024/12/08/h264_720p_600k_77882-DFTVHD-20241208175000-4800-958532-600k_mp4.mp4,,0,0,True
中国5万吨航母即将下水，电磁弹射器比福建号长，可弹射歼35战机,2024-12-10 08:55,1041,104,第一军情,第一军情,近日，网上曝出了076最新照片，业内人士看后表示，雷达已经安装完毕，预示着下水在即。此前，美国智库发布报告称，中国正在建造的076两栖攻击舰，排水量至少有50000吨，是日本“出云”号的两倍，也比美军的“黄蜂”级两攻要大。,https://toutiao.com/group/7446702246705873444/,,0,0,False
美国土耳其干起来了，叙新政权倾向俄罗斯，或成第二个阿萨德,2024-12-10 06:20,7397,1477,军情作家陈曦,军情作家陈曦,叙利亚的变天，并不是和平的开始，而是大乱斗的开始。阿萨德掌权的时候，叙利亚虽然没能实现统一，但各方保持了一种微妙的平衡。因为美国支持的库尔德武装，利用俄罗斯和伊朗支持的阿萨德政府军，压制了土耳其、以色列支持的反对派武装。,https://toutiao.com/group/7446664051716866610/,,0,0,False
泽连斯基命令俄境内乌军死守，他提出停战方案，普京不同意？,2024-12-08 04:00,15380,254,邱毅台湾,邱毅台湾,,https://toutiao.com/group/7445206239379718708/,,0,0,True
美国霸权是世界乱源，拜登卸任前把天下搞大乱，遍地烽火生民涂炭,2024-12-09 06:01,18910,881,邱毅台湾,邱毅台湾,,https://toutiao.com/group/7446288140483953152/,,0,0,True
9年前，那个为救白血病弟弟，狠心打掉腹中双胎的女子后来怎样,2024-10-11 10:01,817,502,睿之悦,睿之悦,2015年，武汉一女子柯希在经过了8年的备孕，终于怀上了一对双胞胎。可就当他们全家人都沉浸在喜悦中时，意外却发生了，柯希的弟弟柯旭不幸查出了白血病。,https://toutiao.com/group/7424454488704729600/,,0,0,False
台湾又拍大尺度！ 太羞耻了，注定只能网盘见,2024-12-10 09:40,1883,119,何止电影,何止电影,深度解说台湾电影《亲爱的杀手》,https://toutiao.com/group/7446671812101931572/,,0,0,True
明年起，满18岁男性必须兵役登记！否则影响上大学、找工作,2024-12-09 06:44,17622,15047,大河报,大河报,重要提醒！2025年兵役登记工作将于2025年1月1日开始已经进行过兵役登记，有参军意向的可直接参加网上应征报名。依法服兵役和进行兵役登记是每个适龄公民应尽的光荣义务和神圣责任。《中华人民共和国兵役法》明确国家实行兵役登记制度，每名男性青年在年满18周岁时都要履行兵役登记义务。,https://toutiao.com/group/7446299249363157558/,,0,0,False
跑道总长5公里！美媒：神秘飞机现身中国西北机场，极具战略价值,2024-12-05 09:30,2110,197,军武次位面,军武次位面,图像显示，在中国西北地区的一个偏远机场跑道末端，有一个奇怪的白色物体，旁边还散布着一些小型物体，疑似支援设备。,https://toutiao.com/group/7444822774259941923/,,0,0,False
2024年叶诚尘被执行死刑，警方曝光大量聊天内容，发现她很变态,2024-12-10 09:04,491,291,云舟史策,云舟史策,2024年1月31日，重庆市法院对杀人犯张波，以及教唆他把一双儿女扔下楼的情人叶诚尘，执行死刑。虎毒尚且不食子！张波杀死两个孩子，竟然只是为了讨女恶魔叶诚尘的欢心。是怎么样的一个女人，能把张波迷惑的连亲生孩子都可以杀死。,https://toutiao.com/group/7446676739951985189/,,0,0,False
台军进入高度戒备状态“应对解放军全面军事威慑”,2024-12-10 09:37,3231,3563,观察者网,观察者网,综合多家台媒和路透社12月9日报道，台军方周一上午成立了紧急反应中心并提升了警戒级别，称中国大陆已设立七个“防空区”，并向台岛周边海域派遣了海军舰队和海警船只。,https://www.guancha.cn/military-affairs/2024_12_10_758323.shtml,,0,0,False
多家银行宣布：上调存款利率！,2024-12-10 01:37,1710,953,封面新闻,封面新闻,临近年末，多家银行备战“揽储大战”。据记者注意，近期，不仅多地银行密集上架大额存单产品，甚至在存款利率不断下调趋势下，部分中小银行还逆势上调存款利率来“吸客”。,https://m.thecover.cn/news_details.html?from=web&eid=OXR9mOad1X2H90qSdq8Jkw==,,0,0,False
67岁执意生娃，如今却坐轮椅无法自理，5岁的天赐被迫独立学洗衣,2024-11-04 10:32,8711,2013,睿之悦,睿之悦,2019年，已经67岁的田新菊执意生下了自己的第三个孩子小天赐。那么，现如今5年的时间过去了，这“天赐”的礼物到底是福还是祸呢?,https://toutiao.com/group/7433367394946384435/,,0,0,False
罕见！100年前，英国游客拍下的清朝乡村，和想象中完全不一样,2024-09-20 02:07,8731,770,万物知识局,万物知识局,泥泞的土路，衣不蔽体的老百姓，即便是达官显贵的家中也十分破败，而这些都是清王朝的历史痕迹，虽说那时候中国摄影技术并不发达，但也有许多外国游客来到这里，拍摄下了许多老照片，为我们留下了珍贵的历史资料，那清朝到底是怎样的面貌呢?,https://toutiao.com/group/7416287738871267855/,,0,0,False
韩国又创造了历史,2024-12-09 23:25,8323,2282,牛弹琴,牛弹琴,不得不说，韩国又创造了历史。12月9日，韩国高级公职人员犯罪调查处方面表示，禁止总统尹锡悦出境。什么意思？堂堂一国总统，居然不能出国了。出国访问就不用说了，哪怕有重大国际会议，尹锡悦总统，你也不能出去。为什么？怕他跑了。真是让人哭笑不得。这还没有完。,https://toutiao.com/group/7446553692741894710/,,0,0,False
郭有才：当迷失方向忘记初心后，曾经飘得多高，如今摔得就多惨,2024-11-11 06:53,1667,782,八号探秘人,八号探秘人,在阅读此文之前，辛苦您点击一下“关注”，既方便您进行讨论和分享，又能给您带来不一样的参与感，感谢您的支持！编辑丨brt因为一首翻唱，他一夜之间成为了拥有千万粉丝的网红。但是“人红是非多”，不久他就因为版权等问题陷入了舆论风波。他的人气一落千丈，从万众瞩目变成了现在的无人问津。,https://toutiao.com/group/7435901170239078948/,,0,0,False
15年保安徒手接跳楼女孩，女孩母亲：我女儿若有事，你一辈子负责,2024-10-07 09:28,539,220,睿之悦,睿之悦,文|睿之悦编辑|睿之悦“我的女儿要是有什么事情的话，你要负一辈子的责任！”2015年，一名保安在得知有人跳楼的时候，不顾自身的安危，徒手将跳楼的女孩给救了下来。可令人感到的心寒的是，被救女孩的家属不仅没有感谢这名保安，反而还对他恶语相向。那么，这究竟是怎么一回事呢？,https://toutiao.com/group/7422961323312431656/,,0,0,False
美媒评中国最新出口管制：中国开创先例，禁止他国向美国出售商品,2024-12-06 13:48,20096,12115,观察者网,观察者网,【文/观察者网 齐倩】12月3日，中国商务部发布公告，宣布严控对美出口镓、锗、锑、超硬材料、石墨等相关两用物项。外媒普遍将此视作对美国出口管制行为的迅速反制，同时注意到了公告中的一句表述：“任何国家和地区的组织和个人违反相关规定，将依法追究责任。,https://www.guancha.cn/internation/2024_12_06_757979.shtml,,0,0,False
相爱37年零绯闻，丁勇岱对赵雪华一见钟情，如今却对儿子很失望,2024-11-09 21:43,3191,296,八号探秘人,八号探秘人,在阅读此文之前，辛苦您点击一下“关注”，既方便您进行讨论和分享，又能给您带来不一样的参与感，感谢您的支持！编辑丨xk1985年，丁勇岱转过楼梯拐角，撞到人生挚爱，这一下把他撞“开窍”了。那时他还不是《末路》里的白宝山。也不是《跨过鸭绿江》里的彭老总，更不是《人世间》里的周志刚。,https://toutiao.com/group/7435160230918406707/,,0,0,False
3年前，宁夏7岁小女孩一笑走红，后拒百万签约，如今怎么样了？他们后悔了吗？,2024-09-19 07:25,15215,2031,睿之悦,睿之悦,2021年，视频镜头中出现的女孩儿用那一抹甜美的笑容，迅速引起了网友们的广泛关注。有媒体公司看到这一机遇，提出愿意用百万巨资与女孩儿签约，然而，女孩儿的父母却坚决拒绝了这一提议。,https://toutiao.com/group/7416250139544879679/,,0,0,False
姐姐苦寻弟弟28年，如今弟弟已成富翁，开门一刻令人泪奔,2024-11-13 13:17,21162,3016,乐视娱乐fun,乐视娱乐fun,,https://toutiao.com/group/7436752393397600819/,,0,0,True
猪皮冻用水熬是大错，教你一招，皮冻晶莹透亮，吃一次就念念不忘,2024-11-23 14:12,13944,1841,橙子美食达人,橙子美食达人,,https://toutiao.com/group/7440477379308290579/,,0,0,True
