title,publish_time,like_count,comment_count,media_name,source,abstract,article_url,tag,is_yaowen,article_sub_type,has_video
张颂文方终于回应了，剧组发布声明，回应姜尘录音，反转了？,2025-01-07 03:14,279,202,藏剑游侠儿,藏剑游侠儿,张颂文事件随着女演员姜尘在直播中爆料前任家暴、收取学费、强迫发生关系、跟前任是老乡、养过猴子等细节，引起了吃瓜网友的好奇心，开始深扒这人的身份。,https://toutiao.com/group/7457004712824177167/,,0,0,False
一觉醒来，加拿大政府垮了,2025-01-06 23:30,5815,1899,牛弹琴,牛弹琴,一觉醒来，加拿大政府也垮了。加拿大时间1月6日，特鲁多正式宣布，他将辞去自由党党魁和总理职务，在自由党选出新领袖前，他还会继续留任一段时间总理。为什么要辞？特鲁多承认，由于内部争斗，他已经搞不下去了。,https://toutiao.com/group/7456943585049543205/,,0,0,False
女市长爱上小男友，俩人爱的轰轰烈烈，让女市长感到害怕,2024-12-18 08:13,3106,547,乐视经典热综回放,乐视经典热综回放,,https://toutiao.com/group/7449661362671714850/,,0,0,True
12台中国混动车挑战死亡公路，全程不加油/充电谁能直通北冰洋？,2025-01-07 04:00,3709,1177,懂车帝原创,懂车帝原创,包括问界M9、仰望U8、魏牌蓝山、方程豹豹5等等热门车系在内的12辆中国新能源车集体挑战有着“死亡公路”之称的美国阿拉斯加道顿公路，在-30℃的极寒中，哪辆混动车型能完成不加油不充电，纵贯道顿公路直通北冰洋壮举？,https://toutiao.com/group/7456737631636816396/,,0,0,True
中国核动力航母就要来了！,2025-01-06 23:47,6689,255,王丰台北,王丰台北,2024年与2025年交界的这两个星期，对我们中国人而言真的是惊喜连连。视频先是惊爆了两架第六代战机横空出世，紧接著视频又披露了轰20的雄姿。接下来，还会有什么更麻辣的新闻引爆出来呢？就好像吃麻辣锅，不够麻辣就不过瘾，接下来据说就是核动力航母该出场了。所谓好戏在后头，总不能一下就演完了，好戏要连台，好戏要紧锣密鼓，但也不能餐餐都吃麻辣锅，吃麻辣锅的中间总要有一点水果甜点，再接著吃麻辣锅才回味无穷。没错，今天讲核动力航母。(声明:本视频系本人自己拍摄原创制作，脚本文稿全部都是作者自己亲自撰写，脚本素材如有引述新闻信息素材时，作者都会在视频中口头说明来源。特此声明),https://toutiao.com/group/7456953349444502027/,,0,0,True
清汤面好吃有诀窍，教你面馆30年不外传的秘诀，劲道爽滑汤鲜味美,2024-12-13 13:30,8681,1159,百变小厨坊,百变小厨坊,,https://toutiao.com/group/7447888258186347018/,,0,0,True
院长不服领导是女的，带头集体闹辞职，下秒就被免职！,2025-01-04 21:55,1967,145,南瓜说异,南瓜说异,,https://toutiao.com/group/7454511678265229835/,,0,0,True
21时58分，杜梅不幸去世，年仅30岁！,2025-01-06 23:41,1476,330,极目新闻,极目新闻,据中国青年网2025年1月6日报道，3日21时58分，同济大学上海国际知识产权学院2021级博士生杜梅因病不幸逝世，年仅30岁。,http://jms.ctdsb.net/jmythshare/#/index_share?cId=0&contentType=5&contentId=2346423,,0,0,False
泰国皇家警察总署署长搭乘特快专机接演员星星,2025-01-07 06:58,816,2249,潇湘晨报•晨视频,潇湘晨报•晨视频,（泰国皇家警察总署署长搭乘特快专机接中国演员星星。）（泰国总理确认已找到中国演员“星星”。）1月7日，泰国皇家警察总署署长、警察总监Pol. Gen. Kitirat Phanphet将军在泰国总理确认已找到中国演员“星星”后，搭乘特快专机飞往湄索接他。,http://api.chenshipin.com/wap/a/677ccfc684201745727e5c85/90f456b81afce808c1fcfbd3f5761f65/1736232963/b4d322e3adb6f943b6adbdadc98726535d257f1cb48e384848b89189327e3f2b,,0,0,False
厨师长教你：“羊肉汤”汤质优美，营养丰富；不膻不腥，味道鲜美,2024-11-21 02:57,6941,809,美食作家王刚,美食作家王刚,厨师长教你：“羊肉汤”汤质优美，营养丰富；不膻不腥，味道鲜美,https://toutiao.com/group/7439561371424915994/,,0,0,True
现场视频！运-20抵达西藏日喀则定日机场,2025-01-07 10:32,3803,153,国际在线,国际在线,,https://crionline-media.cri.cn/cb5a6d96-d0c4-4fd0-a895-b6135667d84a/video/4d0f0e26f79d4321b03dd4755f8df89f.mp4,,0,0,True
苦口婆心！央视四天内就解禁烟花爆竹连续发声，重点提不要一刀切,2025-01-02 04:38,386,534,8卦娱,8卦娱,2024年已经过去了，不过在跨年夜当晚，很多网友都在分享自己跨年的同时，也有很多人认为已经缺少了很多年味儿了。,https://toutiao.com/group/7455172411600781858/,,0,0,False
铁公鸡来相亲，一听不用买单拼命点菜，哪料姑娘做法更狠,2024-12-26 09:06,1759,534,乐视热播综艺精选,乐视热播综艺精选,,https://toutiao.com/group/7452643056194421286/,,0,0,True
厨师长教你：“葱爆羊肉”羊肉滑嫩、鲜香不膻,2024-12-27 07:34,4060,738,美食作家王刚,美食作家王刚,厨师长教你：“葱爆羊肉”羊肉滑嫩、鲜香不膻,https://toutiao.com/group/7452991735665263139/,,0,0,True
男人怀疑自己有病，女友亲自上阵，一晚上给治好了,2025-01-04 02:03,2343,752,南瓜热剧回放,南瓜热剧回放,,https://toutiao.com/group/7455875274023666186/,,0,0,True
日本专家：中国六代机惹人发笑，想吓唬敌人举手投降,2025-01-07 03:44,5304,2650,第一军情,第一军情,对于中国取得的国防成就，日本人的态度非常有意思，他们在表面上给予了假惺惺的赞扬，但背后却隐藏着怀疑和不安。,https://toutiao.com/group/7457013487617802787/,,0,0,False
刘强东又给老家发现金，60以上老人发1万！村民：以后不发也感恩,2025-01-02 09:36,1734,579,稻述,稻述,文 | 招财小羊编辑 | 招财小羊“活这么大岁数，自家儿子也没说给我1万块钱，我都是托大强子的福啊！”元旦刚过，在江苏省宿迁市宿豫区来龙镇的光明村，老百姓们又得到了一个好消息。那就是曾经从这里走出来的“大强子”今年又来给他们发钱发年货了！,https://toutiao.com/group/7455244431168471586/,,0,0,False
直击救援现场：武警部队驰援西藏灾区 多名受困群众被从废墟救出,2025-01-07 07:01,7748,872,海客新闻,海客新闻,直击救援现场：武警部队驰援西藏灾区 多名受困群众被从废墟救出,https://toutiao.com/group/7457064708265263657/,,0,0,True
炸鱼块，到底用淀粉还是面粉，今天分享一个又香又脆的做法,2025-01-02 09:26,8527,540,家常的味道,家常的味道,,https://toutiao.com/group/7455247105683096076/,,0,0,True
父母来看女儿，把合租小伙当成女婿，让两人睡一屋,2025-01-04 07:13,1763,535,乐视天天剧好看,乐视天天剧好看,,https://toutiao.com/group/7455953838555415076/,,0,0,True
“喝酒三巨头”：一年全没，有的去世当天喝4瓶白酒，都不满36岁,2024-11-05 10:32,3240,1724,睿之悦,睿之悦,他们的每一次出现都离不开酒，也曾是很多人眼中的“酒中豪杰”。但“小酌怡情，大饮伤身”，这三位博主以生命为代价，再一次给大家带来了警醒。,https://toutiao.com/group/7433739040179520038/,,0,0,False
台湾又拍大尺度！ 太羞耻了，注定只能网盘见,2024-12-10 09:40,4375,212,何止电影,何止电影,深度解说台湾电影《亲爱的杀手》,https://toutiao.com/group/7446671812101931572/,,0,0,True
海南富商张晖：花8亿建108米海上观音像，4年后死在水中死因成谜,2024-10-19 04:49,5266,929,八号探秘人,八号探秘人,在阅读此文之前，辛苦您点击一下“关注”，既方便您进行讨论和分享，又能给您带来不一样的参与感，感谢您的支持！编辑丨xk他是中国的一名富商，耗费8亿元完成了自己的梦想。可梦想落地成为现实的时候，他却在4年后莫名其妙的死去。他就是张晖，上个世纪末海南岛旅游业的龙头当家人。,https://toutiao.com/group/7427288913095492134/,,0,0,False
34岁雌雄同体的女性，具备男女两性器官，她该如何生存下去？,2024-10-17 03:32,5153,242,大象微视,大象微视,这个词在我们生活中并不常见，简而言之，双性人就是既拥有男性的生殖器官，也具备女性的特征的人。1989年，王梓淇出生在山西太原的一个家庭，她的家里经营着一家小生意，虽然谈不上富裕，但足够让一家人过得舒心自在。,https://toutiao.com/group/7426578550418948618/,,0,0,False
新婚33天卷走274万4套房，出逃后丈夫跨国追捕，如今下场大快人心,2024-12-20 22:06,5588,274,八号探秘人,八号探秘人,在阅读此文之前，辛苦您点击一下“关注”，既方便您进行讨论和分享，又能给您带来不一样的参与感，感谢您的支持！编辑丨QQ·B“色字头上一把刀！”深圳富豪结婚33天竟被卷走274万元和名下4套房产。不仅如此，他还被扣上了“接盘侠”的帽子，啥也没干喜当爹。,https://toutiao.com/group/7450399558821052982/,,0,0,False
拜登下台前搅动南海风云，美菲连手挑衅中国，中国不再忍强硬回击,2025-01-03 03:44,23670,1007,邱毅台湾,邱毅台湾,,https://toutiao.com/group/7455530031461171753/,,0,0,True
我国楼市大局已定，未来全国45%的家庭，或将面临“5大挑战”,2024-12-15 11:45,711,108,苍暮颜,苍暮颜,前言:21世纪开始，中国房地产市场一路高歌猛进，繁荣的景象更是吸引了无数投资者和购房者，房价也是一路攀升，也成为了房地产经济增长的重要引擎。,https://toutiao.com/group/7448599203455975947/,,0,0,False
河南警察3岁女儿被拐，苦寻全国23年无果，结果却发现女儿在对门,2024-11-05 07:43,6366,684,八号探秘人,八号探秘人,寻亲23年无果，丢失的女儿竟住在对门?但它却真实发生在河南洛阳的梁绍波身上。是意外走丢，还是人贩子所为，三岁的女儿怎会离奇失踪?,https://toutiao.com/group/7433697108120142345/,,0,0,False
