title,publish_time,like_count,comment_count,media_name,source,abstract,article_url,tag,is_yaowen,article_sub_type,has_video
公公竟然和儿媳偷情，哪料被妻子撞见，这下有戏看了！,2025-01-21 08:05,6161,602,南瓜午夜厅,南瓜午夜厅,,https://toutiao.com/group/7462273852651979274/,,0,0,True
三哥放炮，一顿操作打偏了！网友：这配乐，绝了！打正了就怪了！,2025-01-11 04:14,62290,36846,迷彩洞察站,迷彩洞察站,,https://toutiao.com/group/7458296459483349519/,,0,0,True
沪昆高速车祸瞬间，行车安全第一！,2025-01-23 15:17,3256,1578,洪哥分享,洪哥分享,,https://toutiao.com/group/7463130001102193192/,,0,0,True
街头偶遇大爷谈过年不走亲戚，句句肺腑太真实,2025-01-17 22:00,6152,1197,近观魔都,近观魔都,,https://toutiao.com/group/7460820965300175375/,,0,0,True
数学天才被当傻子被退学，上台算术吊打大学教授,2025-01-22 03:59,3664,337,好看捞剧社,好看捞剧社,,https://toutiao.com/group/7462574524123365942/,,0,0,True
男人目睹了妻子的偷情，下一秒情夫和妻子就遭到了他的制裁！,2025-01-23 09:05,3637,315,橙子影视吖6,橙子影视吖6,,https://toutiao.com/group/7463034403476734527/,,0,0,True
地铁一女子拿背包占座，乘务员沟通半天无果，邻座大妈突然出手！,2025-01-22 02:03,5947,2625,客家林胖哥,客家林胖哥,南京地铁上一女子把背包放到座位上，另外一个站点有乘客上车想座这个位置，结果背包的主人说“这是我放包的，你人不能站着吗”？女乘客就叫来了乘务员，可是乘务员沟通半天女子就是不愿意把背包放地上。最后，邻座的大妈实在看不下去，一把把女子的背包给抓起来丢地上，她一屁股坐过去，然后把她的位置让给这个乘客，大妈那个动作真的太帅了！！,https://toutiao.com/group/7462554677310210623/,,0,0,True
妻子深夜加班，丈夫感觉不对劲偷偷跟踪，看到真相瞬间崩溃,2024-10-28 06:59,31571,609,金曲大荟萃,金曲大荟萃,妻子深夜加班，丈夫感觉不对劲偷偷跟踪，看到真相瞬间崩溃,https://toutiao.com/group/7430717509566726656/,,0,0,True
76岁老汉娶29岁流浪女，生下儿子10年后傻眼  ，结果谁也想不到,2025-01-08 01:05,10556,692,恋爱剧中剧,恋爱剧中剧,,https://toutiao.com/group/7457344571770339892/,,0,0,True
小女孩上部队找爸爸，少校阿姨主动搭讪，谁知看到女孩父亲傻眼了,2024-12-23 16:01,7258,1573,群星访谈秀,群星访谈秀,,https://toutiao.com/group/7451525814283960872/,,0,0,True
女子怀孕5个月，每天听到肚子里有哭声，检查后医生大骂丈夫渣男,2025-01-12 05:13,5741,214,喜悦分享,喜悦分享,,https://toutiao.com/group/7458892907936743945/,,0,0,True
