title,publish_time,like_count,comment_count,media_name,source,abstract,article_url,tag,is_yaowen,article_sub_type,has_video
一见·从秘鲁之行，透视中国外交的“文明密码”,2024-11-15 16:18,717,341,人民日报,人民日报,时隔8年再次踏上秘鲁这片历史悠久的土地，习近平主席感言，“古老文明的深厚积淀，赋予中秘两国智慧和胸怀”，让两国“成为不同体量、不同制度、不同文化国家团结合作的典范”。,https://www.peopleapp.com/column/30047373824-500005920038?utm_source=头条号&promote=true,,0,0,False
江苏无锡一学院发生持刀伤人事件 致8死17伤,2024-11-16 15:30,4267,13342,央视新闻,央视新闻,11月16日18时30分左右，无锡工艺职业技术学院发生一起持刀伤人案件，共造成8人死亡、17人受伤，犯罪嫌疑人被当场抓获。警方发布警情通报：（总台记者 李筱 黄成）©2024中央广播电视总台版权所有。未经许可，请勿转载使用。,https://content-static.cctvnews.cctv.com/snow-book/index.html?item_id=2073230601850871874&source=50006&sub_source=50006_001,,1,1,False
炸萝卜丸子，放面粉和淀粉就错了，教你正确做法，焦香酥脆不吸油,2024-09-28 10:13,25313,1144,家常的味道,家常的味道,,https://toutiao.com/group/7419635124758643227/,,0,0,True
首例5胞胎长大了，父亲已过劳去世 母亲直言：如能重来一个也不要,2024-08-31 03:06,2759,756,睿之悦,睿之悦,2002年，在北京的一家妇产医院中，一位来自河北的孕妇顺利生下了两男三女的五胞胎，创造了一个全国罕见的奇迹。,https://toutiao.com/group/7409098624111575603/,,0,0,False
破解特朗普加征关税，中国有7招,2024-11-15 14:05,18595,1262,静思有我,静思有我,,https://toutiao.com/group/7437506977830044200/,,0,0,True
1米3袖珍美女嫁给1米48男孩，婚后丈夫奇迹长高，两人却不欢而散,2024-09-07 02:55,4619,252,睿之悦,睿之悦,杨萍和葛存苗的婚礼 文|睿之悦 编辑|睿之悦2019年，成都的民政局来了两个“10岁小孩”来登记，工作人员以为是玩闹。两个“小孩”拿出身份证让工作人员看，这才明白，原来是两个再也长不高的成年袖珍人情侣。,https://toutiao.com/group/7411713833267364386/,,0,0,False
从“中国巨星”到“查无此人”，走上没有回头路的赵薇，后悔了吗,2024-11-04 10:58,350,157,晓娱海棠,晓娱海棠,一夜爆红，家喻户晓，风光无量，这些词都曾是赵薇的标签。凭借《还珠格格》一夜爆红的她，成为了大家心中的“国民偶像”。可这手好牌却活生生的被她“打了个稀烂”！“亲日辱华、操纵股市、殴打孕妇”这些毫无道德底线的事情都被赵薇一一揽入怀中，然而面对大家的谴责，赵薇竟丝毫不知悔改！,https://toutiao.com/group/7433349577568174602/,,0,0,False
包厢全是刚出狱的恶霸，结果一看到饭店主厨，立马怂了,2024-11-11 01:21,5704,132,乐视群星访谈秀,乐视群星访谈秀,,https://toutiao.com/group/7435825833048015400/,,0,0,True
51年洪学智妻子寻女无果，到老乡家歇脚老乡惊呼：你要找得就是我,2024-09-22 01:07,14068,917,品古观今,品古观今,前言1951年，阳曲县委大院突然来了7、8位解放军同志，其中一位女同志，就是洪学智的妻子张文。她此番前来，就是为了寻找多年前因战乱而寄养于民间的爱女。可昔日的小村落早已蜕变成另一番景象，这无异于是大海捞针。,https://toutiao.com/group/7417034363226915354/,,0,0,False
排骨里打入两个鸡蛋，不红烧不油炸，出锅瞬间变美食，太香了,2024-10-18 00:43,4399,255,家味美食,家味美食,,https://toutiao.com/group/7426909886904009225/,,0,0,True
俩人相亲互相看不上，哪料男方一报母亲身份，姑娘乐了,2024-11-08 01:50,8616,2036,乐视群星访谈秀,乐视群星访谈秀,,https://toutiao.com/group/7434719902990074395/,,0,0,True
内阁人选出炉，对华立场各异，两派博弈，将如何左右特朗普决策？,2024-11-12 09:49,26343,1568,邱震海,邱震海,,https://toutiao.com/group/7436327724950094373/,,0,0,True
拦车收费？交警不管！景区不管！政府看不见！九寨沟咋全是土匪？,2024-09-22 15:55,226395,44395,行哥嘚啵嘚,行哥嘚啵嘚,,https://toutiao.com/group/7417496641638400527/,,0,0,True
特朗普赢却难就职？拜登怕追责，佩洛西怕牢饭，三大集团蠢蠢欲动,2024-11-14 22:04,32821,1425,黎建南台湾,黎建南台湾,,https://toutiao.com/group/7437259350143402515/,,0,0,True
黄芪伤肾，黄芪泡水喝危害多？再次提醒：真正伤肾的是这3类中药,2024-10-29 07:34,28590,2316,梁医学社梁怡璋医生,梁医学社梁怡璋医生,,https://toutiao.com/group/7431097743307473408/,,0,0,True
女儿花500块租男友，没想他是身价过亿的总裁，这下好运了,2024-10-18 09:42,8053,1498,乐视娱乐乐透社,乐视娱乐乐透社,,https://toutiao.com/group/7427048858267419190/,,0,0,True
炸萝卜丸子到底用面粉还是淀粉，教你正确做法，外焦里嫩，太香了,2024-10-26 09:25,8383,555,家常的味道,家常的味道,,https://toutiao.com/group/7430012978277122611/,,0,0,True
太空开箱视频来了！神十九航天员乘组开始“拆快递”,2024-11-16 05:45,3197,209,海客新闻,海客新闻,11月16日早上，神舟十九号航天员乘组在地面配合下打开天舟八号舱门，开始太空“拆快递”。8时26分，航天员蔡旭哲打开天舟八号舱门，进入天舟八号货运飞船。神舟十九号航天员乘组将按计划继续开展货物转运等工作。,https://toutiao.com/group/7437749126202130996/,,0,0,True
特朗普怎么结束俄乌战争和中东战争，泽连斯基纳塔亚胡命运大不同,2024-11-14 05:39,16717,528,邱毅台湾,邱毅台湾,,https://toutiao.com/group/7437005549285147187/,,0,0,True
特朗普2.0时代即将开启，中方如何应对？掌握“三气”是关键,2024-11-16 04:48,7406,543,邱震海,邱震海,,https://toutiao.com/group/7437734368304431616/,,0,0,True
谁支持了特朗普上台？原来美国教会及中产，打败了政治邪恶力量！,2024-11-12 22:06,18014,864,黎建南台湾,黎建南台湾,,https://toutiao.com/group/7436517585706811930/,,0,0,True
大老虎在总统套房潇洒，殊不知对面住着中央领导，有戏看！,2024-10-15 02:37,4836,205,乐视群星访谈秀,乐视群星访谈秀,大老虎在总统套房潇洒，殊不知对面住着中央领导，有戏看！,https://toutiao.com/group/7425826039802102284/,,0,0,True
12万亿的化债一落地，猪又要飞上天了！年底之前1大行业急剧上涨,2024-11-15 03:39,3532,482,量子教育新商学,量子教育新商学,,https://toutiao.com/group/7437345740701860390/,,0,0,True
“特朗普+马斯克”时代，大胆预测之三！3件事看他们能否改变美国,2024-11-15 13:16,14598,1252,终南剑客,终南剑客,本期话题，3个事，巧、怪、讽刺，来看“特朗普+马斯克组合”，能不能改变美国？,https://toutiao.com/group/7437494442094756392/,,0,0,True
特朗普为什么不用蓬佩奥，而且面子里子都不给，老蓬犯了什么禁忌,2024-11-12 09:23,41324,1518,邱毅台湾,邱毅台湾,,https://toutiao.com/group/7436320981239235087/,,0,0,True
为什么网上的药，比实体药店便宜？是不是假药？现在就告诉你真相,2024-11-10 10:00,435,202,泌尿外科李医生,泌尿外科李医生,小李生活中是一个非常节俭的人，平时生病都是硬扛过去的。但是这一次，小李发现自己的咳嗽比较严重，不得已需要买一些消炎药吃。,https://toutiao.com/group/7435586137348899364/,,0,0,False
给近三年最好的10部年代剧排个名：《人世间》第6，第1名没有争议,2024-10-28 07:10,1794,1026,稻述,稻述,到了20世纪初，偶像剧成为人们的掌中宝，但要说现在什么剧最受欢迎，那一定是年代剧!其中《人世间》只能排第六，第一名人人都爱看，最后一名也比上不足比下有余。,https://toutiao.com/group/7430715494055264783/,,0,0,False
2024年最新：糖尿病的诊断标准变了！绝大多数人还不知道,2024-11-15 23:00,1560,228,糖尿病之友,糖尿病之友,糖尿病诊断标准有了新变化！昨天（11月14日）是世界糖尿病日，也是中华医学会糖尿病学分会第二十六次学术会议（CDS2024）召开的日子，在这次会议上，带来了一个最新消息！,https://toutiao.com/group/7437501113017909797/,,0,0,False
国际知名心理学家、神经科学家周永迪逝世，享年69岁,2024-11-16 04:05,1764,217,大皖新闻,大皖新闻,澎湃新闻记者从相关方面获悉，华东师范大学心理与认知科学学院首任院长、深圳大学心理学院原院长，国际知名心理学家、神经科学家周永迪教授，因病不幸于2024年11月15日在上海逝世，享年69岁。,http://www.ahwang.cn/toutiao/202411/2774081.html,,0,1,False
十个化疗九个死？医生坦言：4种癌症无需化疗，或起到反作用…,2024-09-04 13:17,4687,433,39健康网,39健康网,李梅爸爸已经走了一个月了，可李梅还是不能原谅自己。李梅爸爸此前确诊了肺癌，医生的建议是接受化疗。临床上，很多病人拒绝化疗，认为化疗只会让癌症扩散，这是真的吗?,https://toutiao.com/group/7410743786244801039/,,0,0,False
女友叶珂退网5天后，黄晓明哽咽鞠躬道歉：内心很难过，我现在非常需要大家的支持，一定会处理好私事,2024-11-16 02:32,748,1475,九派新闻,九派新闻,11月10日，黄晓明女友叶珂就近期争议发文道歉并宣布退网。15日，黄晓明哽咽鞠躬道歉。黄晓明表示很感谢大家的支持：“最近让很多人担心了，也怕耽误了电影，所以内心非常忐忑。能在这个时候买电影票支持我的朋友们，亲朋好友以及行业的朋友，我非常感谢你们，因为这个时候非常需要你们的支持。,https://toutiao.com/group/7437694162291081766/,,0,0,False
罕见！100年前，英国游客拍下的清朝乡村，和想象中完全不一样,2024-09-20 02:07,6412,643,万物知识局,万物知识局,泥泞的土路，衣不蔽体的老百姓，即便是达官显贵的家中也十分破败，而这些都是清王朝的历史痕迹，虽说那时候中国摄影技术并不发达，但也有许多外国游客来到这里，拍摄下了许多老照片，为我们留下了珍贵的历史资料，那清朝到底是怎样的面貌呢?,https://toutiao.com/group/7416287738871267855/,,0,0,False
67岁执意生娃，如今却坐轮椅无法自理，5岁的天赐被迫独立学洗衣,2024-11-04 10:32,3555,898,睿之悦,睿之悦,2019年，已经67岁的田新菊执意生下了自己的第三个孩子小天赐。那么，现如今5年的时间过去了，这“天赐”的礼物到底是福还是祸呢?,https://toutiao.com/group/7433367394946384435/,,0,0,False
著名专家预言：试管婴儿寿命仅40年，那首例试管婴儿如今怎样了？,2024-09-01 06:05,9471,464,睿之悦,睿之悦,文|睿之悦编辑|睿之悦“试管婴儿活不到40岁？”1988年3月10日，我国首例试管婴儿顺利诞生。在当时，试管婴儿的技术正处于起步阶段，因此，有人将其视为医学的奇迹，但也有人则预言试管婴儿活不过40岁。那么，36年的时间过去了，我国首例试管婴儿如今怎么样了呢？,https://toutiao.com/group/7409105262277853733/,,0,0,False
“虎鲸”首次公开亮相！宋晓军：载荷达500吨，在全球凤毛麟角,2024-11-13 04:34,14049,644,海峡新干线,海峡新干线,“虎鲸”首次公开亮相！宋晓军：载荷达500吨，在全球凤毛麟角,https://toutiao.com/group/7436617670335660607/,,0,0,True
