title,publish_time,like_count,comment_count,media_name,source,abstract,article_url,tag,is_yaowen,article_sub_type,has_video
习近平向纳米比亚当选总统恩代特瓦致贺电,2024-12-05 09:14,962,435,新华网,新华网,12月5日，国家主席习近平致电内通博·南迪-恩代特瓦，祝贺她当选纳米比亚共和国总统。习近平指出，中国同纳米比亚传统友好。,http://my-h5news.app.xinhuanet.com/h5/article.html?articleId=97fd1e2627ddb2eaf23d041830f27fef,,0,0,False
尹锡悦下台四大原因曝光，后悔也完蛋了（上）,2024-12-04 10:07,5052,252,占豪,占豪,韩国夜里国家变天了，很多早上起来都还不明就里，事在天还没亮的时候就解决了！结果是啥？,https://toutiao.com/group/7444496200104935987/,,0,0,True
河南警察3岁女儿被拐，苦寻全国23年无果，结果却发现女儿在对门,2024-11-05 07:43,2771,259,八号探秘人,八号探秘人,寻亲23年无果，丢失的女儿竟住在对门?但它却真实发生在河南洛阳的梁绍波身上。是意外走丢，还是人贩子所为，三岁的女儿怎会离奇失踪?,https://toutiao.com/group/7433697108120142345/,,0,0,False
老总送一条项链！美女乖乖脱下衣服，下秒随了心愿！,2024-11-30 03:27,1002,163,南瓜钟意你,南瓜钟意你,,https://toutiao.com/group/7442908746533044786/,,0,0,True
尹锡悦众叛亲离成韩国公敌，他会被弹劾下台吗？谁可能取而代之？,2024-12-05 06:34,11705,321,邱毅台湾,邱毅台湾,,https://toutiao.com/group/7444812537344590348/,,0,0,True
琼瑶与江苏：她的母亲是武进人，大姨更是江苏名人,2024-12-04 14:41,1156,432,扬子晚报,扬子晚报,在华语文学的天空中，琼瑶的名字如同一颗璀璨的星辰，照亮了一代又一代人的情感世界。然而，当这颗星辰悄然陨落，我们不禁感叹岁月的无情与生命的脆弱。琼瑶的离世，不仅让文学界失去了一位巨匠，也让她的血脉故乡江苏，失去了一位与这片土地情深意长的文化使者。,https://wap.yzwb.net/wap/news/4184552.html,,0,0,False
关于过年，两个好消息！,2024-12-05 01:40,812,111,闽南网,闽南网,北京时间12月4日，我国申报的“春节——中国人庆祝传统新年的社会实践”在巴拉圭亚松森举行的联合国教科文组织保护非物质文化遗产政府间委员会第19届常会上通过评审，列入联合国教科文组织人类非物质文化遗产代表作名录。,https://toutiao.com/group/7444736357462786570/,,0,0,False
包厢全是刚出狱的恶霸，结果一看到饭店主厨，立马怂了,2024-11-11 01:21,11107,291,乐视群星访谈秀,乐视群星访谈秀,,https://toutiao.com/group/7435825833048015400/,,0,0,True
重庆一中42岁教师醉酒与两学生起冲突，咬伤一学生耳朵摔成骨折，被拘留10天罚款500元；教委：撤销教师资格,2024-12-05 06:34,370,419,大风新闻,大风新闻,近日，网传重庆一中一名教师酒后与两学生发生冲突时，除扇一学生耳光外，还咬伤另一学生耳朵，此事引发广泛关注。,https://toutiao.com/group/7444810471516471835/,,0,0,False
天冷电动车充满电，一加油门就掉2格，不怪电池，真实原因告诉你,2024-11-26 05:02,1588,102,新能源战略家,新能源战略家,电动车使用方便、价格便宜，已经成为了不少朋友通勤代步的首选，但在使用过程中偶尔也有让人糟心的问题。像爆胎、刹车不灵敏这类问题可以通过门店维修来解决，但如果遇到电池出现异常情况，不仅问题难以排查，而且维修成本也不低。,https://toutiao.com/group/7441448742575702563/,,0,0,False
包菜炒粉条，切记不要焯水和直接下锅，教你一招，清脆爽口不出水,2024-11-11 11:50,7922,383,家常的味道,家常的味道,,https://toutiao.com/group/7435987746101690930/,,0,0,True
近5年最热的十部剧，《狂飙》第9，《繁华》第6，第1名很难超越,2024-12-01 03:58,460,189,电影烂番茄,电影烂番茄,今天，番叔就结合口碑，给大家盘点一下近五年，热度最高的十部电视剧。第十名:《都挺好》 猫眼热度 9775.8，播出时间2019年。,https://toutiao.com/group/7430845717314273831/,,0,0,False
未来5年没大年三十，都是月亮惹的祸！2262年有两个春节放假怎么安排？,2024-12-03 05:12,1175,584,极目新闻,极目新闻,2025年1月29日将迎来农历新年蛇年，但2025年没有大年三十，大年二十九过后就是大年初一。据悉，从2025年开始直到2029年，连续五年的除夕都是“大年二十九”。,http://jms.ctdsb.net/jmythshare/#/index_share?cId=0&contentType=5&contentId=2319456,,0,0,False
炸萝卜丸子到底用面粉还是淀粉，教你正确做法，外焦里嫩，太香了,2024-10-26 09:25,13784,911,家常的味道,家常的味道,,https://toutiao.com/group/7430012978277122611/,,0,0,True
10分钟就做好的营养早餐饼，做法简单，适合上班赶时间的朋友,2024-11-08 07:51,3426,215,家常的味道,家常的味道,,https://toutiao.com/group/7434812999635829275/,,0,0,True
韩国事变第二天，又有新情况,2024-12-05 02:37,5226,366,牛弹琴,牛弹琴,事变第二天，尹锡悦闭门不出，形势正在起变化,https://toutiao.com/group/7444749861411127808/,,0,0,True
保险公司回应“10年交23万保费取钱还要等60年”：无营销员误导证据，难退全款 律师解读,2024-12-05 00:23,157,517,极目新闻,极目新闻,分红险，是保险公司每年按一定的比例，将实际经营成果的可分配盈余，按一定比例分配给客户的保险产品。近年来，分红险在受到消费者青睐的同时，也引发过一些纠纷。,http://jms.ctdsb.net/jmythshare/#/index_share?cId=0&contentType=5&contentId=2320817,,0,0,False
乌克兰突然宣布：停止！,2024-12-05 00:48,1114,324,闽南网,闽南网,当地时间12月4日，乌克兰能源部副部长罗曼·安达拉克表示，2025年1月1日起，乌克兰将停止俄罗斯天然气过境运输，各种迹象已表明几年前看似不可能的事情正在成为现实。,https://toutiao.com/group/7444722864705618442/,,0,0,False
三亚警方深夜通报：4000万粉丝网红被行拘,2024-12-05 03:00,311,475,大皖新闻,大皖新闻,大皖新闻讯 近日，“祁天道”在某平台进行户外直播时，为了博取流量，竟在直播过程中欲对女游客做出极低俗的骚扰行为。此举引发网友愤慨，令人诧异的是，如此擦边低俗的网红竟坐拥超4000万粉丝。12月4日，关于网红“祁天道”的词条登上微博热搜。,http://www.ahwang.cn/toutiao/202412/2782901.html,,0,1,False
差距断崖！美国稀土储量180万吨，再看中国稀土资源，差距太大！,2024-11-04 05:58,2340,516,焰墨绘史,焰墨绘史,在阅读此文之前，麻烦您点击一下“关注”，既方便您进行讨论和分享，又能给您带来不一样的参与感，感谢您的支持。本文内容均引用权威资料结合个人观点进行撰写，文中已标注文献来源及截图，请知悉。,https://toutiao.com/group/7433248574328013352/,,0,0,False
猪肉别总是炒着吃了，教你简单又好吃的做法，简直太香了,2024-09-11 09:11,15826,791,家常的味道,家常的味道,猪肉别总是炒着吃了，教你简单又好吃的做法，简直太香了,https://toutiao.com/group/7413310656981664283/,,0,0,True
罕见！100年前，英国游客拍下的清朝乡村，和想象中完全不一样,2024-09-20 02:07,8380,738,万物知识局,万物知识局,泥泞的土路，衣不蔽体的老百姓，即便是达官显贵的家中也十分破败，而这些都是清王朝的历史痕迹，虽说那时候中国摄影技术并不发达，但也有许多外国游客来到这里，拍摄下了许多老照片，为我们留下了珍贵的历史资料，那清朝到底是怎样的面貌呢?,https://toutiao.com/group/7416287738871267855/,,0,0,False
母亲瘫痪、父亲疯了，当年那个744分的高考状元，7年后却成了这样,2024-09-08 00:54,14158,1987,八号探秘人,八号探秘人,母亲截肢瘫痪、父亲疯癫痴傻，可对于自己的亲人，他却做出了这样的评价。而今，7年已过，曾经那个让无数人动容的少年，现在如何?,https://toutiao.com/group/7411852147648496162/,,0,0,False
赖清德过境夏威夷，病急乱投医，找上佩洛西通电话，惹怒特朗普,2024-12-03 09:30,15088,215,邱毅台湾,邱毅台湾,,https://toutiao.com/group/7444115695816442395/,,0,0,True
土豆搭配洋葱，教你一个神仙吃法，一次3斤不够吃，太解馋了,2024-09-26 09:09,37022,2189,家常的味道,家常的味道,土豆搭配洋葱，教你一个神仙吃法，一次3斤不够吃，太解馋了,https://toutiao.com/group/7418876506660667904/,,0,0,True
大学生4年间艾滋病感染12397例，60%存在这一行为,2024-12-03 10:16,4882,4209,凤凰网,凤凰网,据相关数据，2020年至2023年，新报告青年学生病例分别为:2977人、3677人、2733人、3010人，四年间共报告12397人。,https://toutiao.com/group/7444127197663396364/,,0,0,False
女友怀孕了，男友不装了，带她回豪宅！,2024-11-23 08:01,8605,716,乐视大综艺咖,乐视大综艺咖,,https://toutiao.com/group/7440353629540483593/,,0,0,True
“中企遭大规模拒签，前所未有”,2024-12-02 09:13,9165,2722,环球时报新媒体,环球时报新媒体,“中企遭大规模拒签，前所未有”,https://toutiao.com/group/7443740275974865423/,,0,0,True
