title,publish_time,like_count,comment_count,media_name,source,abstract,article_url,tag,is_yaowen,article_sub_type,has_video
女友怀孕了，男友不装了，带她回豪宅！,2024-11-23 08:01,6908,615,乐视大综艺咖,乐视大综艺咖,,https://toutiao.com/group/7440353629540483593/,,0,0,True
羽绒服上没有这几个字，再贵都是劣质飞丝，看完别再买错了！,2024-11-26 07:11,455,160,卿羽飞,卿羽飞,文 | 卿羽飞编辑 | 卿羽飞天气日渐寒冷，我们也该将压在箱底快一年时间的厚衣服翻出来了，但是让人没想到的一点是，有人在对这件事情上做出了让人气愤的事情。毕竟谁也不希望，自己花着羽绒服的价格，买到的却是十足的假货。尤其是这件事情，也引起了众多大媒体的注意，并且进行了报道。,https://toutiao.com/group/7441478469030904360/,,0,0,False
警惕“先用后付”小心欠下账单～（央视频号：光华路资讯）,2024-11-27 12:44,7802,4094,央视频,央视频,,https://toutiao.com/group/7441939150552433179/,,0,0,True
黎智英香港出庭抖内幕，美国介入，蔡英文参与，还有赵少康金小刀,2024-11-27 09:24,24669,1639,邱毅台湾,邱毅台湾,,https://toutiao.com/group/7441887559757595190/,,0,0,True
菲律宾总统和副总统开干，其实就是媚美反中与亲中远美的路线之争,2024-11-26 09:37,17277,161,邱毅台湾,邱毅台湾,,https://toutiao.com/group/7441519866256818714/,,0,0,True
刚从中国返俄，苏-57飞行员传来新消息,2024-11-25 10:15,7125,240,环球时报新媒体,环球时报新媒体,刚从中国返俄，苏-57飞行员传来新消息,https://toutiao.com/group/7441158524530328127/,,0,0,True
弟弟光荣退伍，姐姐兴奋去车站接他，怎料一见弟弟瞬间哭了,2024-11-05 06:34,26989,2786,乐视天天剧好看,乐视天天剧好看,,https://toutiao.com/group/7433679820573934091/,,0,0,True
讣告！100岁叶嘉莹去世：17岁丧母，52岁丧女，94岁裸捐，她是中国最后一位“穿裙子的士”,2024-11-26 01:20,3952,682,读者,读者,从南开大学获悉，古典文学研究学者、南开大学讲席教授叶嘉莹，于2024年11月24日去世，享年100岁。她，是加拿大不列颠哥伦比亚大学终身教授，却在54岁写信给中国教育部，申请免费来华教学。来华任教后，她辗转全国多所高校讲授古诗词，不遗余力地传承中国古典文化。,https://toutiao.com/group/7441390504039793163/,,0,0,False
羽绒服爆大雷！3000多元买的羽绒服拆开全是飞丝！许多网友剪开了自己的衣服……,2024-11-27 16:13,657,925,每日经济新闻,每日经济新闻,寒潮来袭，御寒神器羽绒服再度登场，但当大家赶紧掏出羽绒服，却发现羽绒服“出事”了。近日，央视《财经调查》曝光了不法商家以“丝”代“绒”的羽绒制品造假乱象，相关话题冲上热搜。网友们赶紧对标自己的羽绒服发现，很多都昂贵但不符合标准。,http://www.nbd.com.cn/rss/jinri_toutiao/articles/3662963.html,,0,0,False
月薪过万 我为何还从胖东来离职？丨封面头条,2024-11-26 09:18,530,1450,封面新闻,封面新闻,近年来，胖东来是热搜榜单的“座上宾”，而当下胖东来关于涉足员工婚嫁彩礼收取、请客办酒的新闻引起了社会又一波的热议。生活在河南许昌的梁梦看着评论区和营销号，对胖东来或贬低或高唱的论调，心中都不再起波澜。,https://m.thecover.cn/news_details.html?from=web&eid=zF0xC09FFmqH90qSdq8Jkw==,,0,0,False
美媒：中国新航母不是双舰岛而是三舰岛，从开工到海试不足一年！,2024-11-27 10:07,1358,200,军武次位面,军武次位面,在珠海航展上露面的科幻无人艇“虎鲸”，已经够惊艳，但和它在一个造船厂建造的“1.5万吨民用版双舰岛无人机航母”，由于始终没有明确用途，还是让大家很期待。,https://toutiao.com/group/7441898400842285583/,,0,0,False
老人凑热闹领喜糖后跌倒死亡，家属向新人索赔14万！法院判了,2024-11-25 01:41,1404,1446,大河网,大河网,患心脏病老人凑热闹领喜糖后不慎跌倒去世2023年12月某日上午，新郎徐某甲前往某宾馆迎娶新娘。徐某甲的亲属徐某乙按照农村习俗在宾馆大厅门口向来“沾喜气”的人们发放喜烟、喜糖等喜物。与妻儿一同看热闹的王老汉在徐某的亲属处拿取喜物后离开，在宾馆院内行走时突然跌倒。,https://toutiao.com/group/7441025632852558372/,,0,0,False
山东沂南警方回应小米su7被外借拍色情片：3名违法嫌疑人被行拘,2024-11-27 13:00,1685,1009,大皖新闻,大皖新闻,大皖新闻讯近日，有消息称，山东省临沂市沂南县居民张先生（化姓）将自己的小米su7爱车外借朋友，车辆却被不法分子用于拍摄色情视频。此消息一出迅速引起广泛关注。,http://www.ahwang.cn/toutiao/202411/2779625.html,,0,1,False
67岁执意生娃，如今却坐轮椅无法自理，5岁的天赐被迫独立学洗衣,2024-11-04 10:32,6333,1518,睿之悦,睿之悦,2019年，已经67岁的田新菊执意生下了自己的第三个孩子小天赐。那么，现如今5年的时间过去了，这“天赐”的礼物到底是福还是祸呢?,https://toutiao.com/group/7433367394946384435/,,0,0,False
美妇约见老情人，见面场景真是太逗了，这俩人绝配！,2024-10-27 16:25,4322,548,乐视明星的那点事,乐视明星的那点事,美妇约见老情人，见面场景真是太逗了，这俩人绝配！,https://toutiao.com/group/7428157095108674088/,,0,0,True
乌克兰蒙了，欧洲慌了，美国也冷静了,2024-11-26 10:42,10368,391,张元伟,张元伟,,https://toutiao.com/group/7441536551424623114/,,0,0,True
1米3袖珍美女嫁给1米48男孩，婚后丈夫奇迹长高，两人却不欢而散,2024-09-07 02:55,6383,335,睿之悦,睿之悦,杨萍和葛存苗的婚礼 文|睿之悦 编辑|睿之悦2019年，成都的民政局来了两个“10岁小孩”来登记，工作人员以为是玩闹。两个“小孩”拿出身份证让工作人员看，这才明白，原来是两个再也长不高的成年袖珍人情侣。,https://toutiao.com/group/7411713833267364386/,,0,0,False
罕见！100年前，英国游客拍下的清朝乡村，和想象中完全不一样,2024-09-20 02:07,7821,716,万物知识局,万物知识局,泥泞的土路，衣不蔽体的老百姓，即便是达官显贵的家中也十分破败，而这些都是清王朝的历史痕迹，虽说那时候中国摄影技术并不发达，但也有许多外国游客来到这里，拍摄下了许多老照片，为我们留下了珍贵的历史资料，那清朝到底是怎样的面貌呢?,https://toutiao.com/group/7416287738871267855/,,0,0,False
逆袭人生，找老婆建别墅当上老板，小奎一家终得圆满#娟奎之恋,2024-08-31 05:27,17093,2852,海哥量地球,海哥量地球,,https://toutiao.com/group/7409170930649268771/,,0,0,True
中国不承认双重国籍！被美国遣返的这些华人，会被送去哪里？,2024-11-27 12:04,2257,612,历史揭密档案,历史揭密档案,中国不承认双重国籍！被美国遣返的这些华人，会被送去哪里？,https://toutiao.com/group/7441928871996064291/,,0,0,True
首例5胞胎长大了，父亲已过劳去世 母亲直言：如能重来一个也不要,2024-08-31 03:06,3456,920,睿之悦,睿之悦,2002年，在北京的一家妇产医院中，一位来自河北的孕妇顺利生下了两男三女的五胞胎，创造了一个全国罕见的奇迹。,https://toutiao.com/group/7409098624111575603/,,0,0,False
6年前，因批评“鸿茅药酒”，被跨省抓捕的医学硕士，现状如何？,2024-09-10 07:05,9070,5027,八号探秘人,八号探秘人,在电视机作为传播主流的时代，鸿茅药酒凭借这句广告语，火遍大江南北。但就在2017年，一篇文章《中国神酒“鸿茅药酒”，来自天堂的毒药》中。,https://toutiao.com/group/7412891004535144970/,,0,0,False
100年前，清朝罕见留影，王爷妻妾婀娜多姿，乞丐全身挂满垃圾,2024-10-14 09:58,1969,226,万物知识局,万物知识局,每一张老照片，都像是时间的低语，它们静静地躺在历史的相册中，却在不经意间将我们拉回到那个遥远而神秘的年代。,https://toutiao.com/group/7425457574731579919/,,0,0,False
母亲瘫痪、父亲疯了，当年那个744分的高考状元，7年后却成了这样,2024-09-08 00:54,11989,1806,八号探秘人,八号探秘人,母亲截肢瘫痪、父亲疯癫痴傻，可对于自己的亲人，他却做出了这样的评价。而今，7年已过，曾经那个让无数人动容的少年，现在如何?,https://toutiao.com/group/7411852147648496162/,,0,0,False
河南女子去世，山东丈夫将手机埋墓里，充1000元话费，每天打电话,2024-11-01 06:52,3555,3094,何止电影,何止电影,2014年11月17日，河南肿瘤医院的病房中举行着一场特殊的婚礼，主角是于海宁跟他的患有癌症的妻子范会香。在几个月前范会香确诊癌症，跟男友提出分手，于海宁不远万里来到了女友的城市，照顾患癌女友。得知女友时日无多，在病房中跟女友求婚，在病房中举办了婚礼，婚后一年，范会香去世。,https://toutiao.com/group/7432199981609534004/,,0,0,False
白百何，突传消息！,2024-11-28 01:07,274,260,潇湘晨报•晨视频,潇湘晨报•晨视频,她不仅亲自接孩子，还在回家的路上背着小儿子上了车，而她的现任丈夫张思麟则拿着书包跟在后面。随后，一家三口开车来到了某商业区，在那里张思麟先抱着儿子玩大风车，接着夫妻俩又在报亭给小儿子买了玩具，最后他们一起去了手工店陪伴小儿子制作手工艺品。,http://api.chenshipin.com/wap/a/6747bdd9842017133e7d33f9/90f456b81afce808c1fcfbd3f5761f65/1732755882/f76a1e67a02559880eb132a9e30358ec37d10279f83abbb0519ef18d531259ed,,0,0,False
