title,publish_time,like_count,comment_count,media_name,source,abstract,article_url,tag,is_yaowen,article_sub_type,has_video
郜春海：低空经济的发展空间远超新能源，颠覆未来商业模式,2024-12-19 08:10,2921,643,凤凰网财经,凤凰网财经,,https://toutiao.com/group/7450032423821115914/,,0,0,True
沙利文的结局已定，他在离开白宫之前，说出了中美发生战争的结果,2024-12-16 02:48,14254,868,全荃,全荃,沙利文的结局已定，他在离开白宫之前，说出了中美发生战争的结果,https://toutiao.com/group/7448833372408775187/,,0,0,True
温州多家私人影院“可触摸服务人员隐私部位”？记者暗访后报警！警方：已对三个场所行政立案,2024-12-17 08:00,13262,3893,大风新闻,大风新闻,挂着“私人影院”的招牌，线上招徕生意，线下如同幽灵，连地址都是虚假的，居然还设“暗室”对付查处。近日，有网民向大皖新闻反映，在浙江省温州市一些颇受年轻人青睐的私人影院，悄然滋生了一些涉黄服务。,https://toutiao.com/group/7449286844203713062/,,0,0,False
100年前，清朝罕见留影，王爷妻妾婀娜多姿，乞丐全身挂满垃圾,2024-10-14 09:58,2636,293,万物知识局,万物知识局,每一张老照片，都像是时间的低语，它们静静地躺在历史的相册中，却在不经意间将我们拉回到那个遥远而神秘的年代。,https://toutiao.com/group/7425457574731579919/,,0,0,False
给《我是刑警》演技最好的10位演员排座次：于和伟第3，第1没争议,2024-12-18 04:06,644,166,皮皮电影,皮皮电影,《我是刑警》收官之际，网上的争议，却也多了不少。有人盛赞它是“近10年最硬核刑侦剧”，老派纪实的剧作风格，令人着迷。受其影响，很多观众开始追起了二十多年前的《中国刑侦1号案》《12·1枪杀大案》。有人评价它“高开低走”。,https://toutiao.com/group/7449562650628866595/,,0,0,False
河南警察3岁女儿被拐，苦寻全国23年无果，结果却发现女儿在对门,2024-11-05 07:43,4880,562,八号探秘人,八号探秘人,寻亲23年无果，丢失的女儿竟住在对门?但它却真实发生在河南洛阳的梁绍波身上。是意外走丢，还是人贩子所为，三岁的女儿怎会离奇失踪?,https://toutiao.com/group/7433697108120142345/,,0,0,False
冬季骑行西藏，害怕有狼借宿废弃小屋，还有柴火炉可以取暖做饭吃,2024-12-16 03:59,32345,4515,刘伟元的旅行,刘伟元的旅行,,https://toutiao.com/group/7448551716082942505/,,0,0,True
团圆三年后回访孙海洋：我还是那个“打气的人”,2024-12-20 00:00,972,116,极目新闻,极目新闻,,https://toutiao.com/group/7450086387292602895/,,0,0,True
中央定调！2025年养老金迎来新调整，退休新规实施，还有个好消息,2024-12-14 00:24,7718,628,思之想之,思之想之,2025年马上就要来了，这是一个充满变化的关键的年份，这是十四五规划的最后一年，很多政策将会兑现。2025年，除了养老金继续用来调整之外，退休新规也将会正式实施，还有一个好消息，具体是什么呢?,https://toutiao.com/group/7448052182332473867/,,0,0,False
重磅！国家已释放5个重磅信号，2025年中国将迎惊天动地的大机会,2024-12-17 13:20,4353,515,占豪,占豪,这一年，因战乱而死的人估计数十万，巴以冲突、俄乌战场，人可能瞬间就没了，当地老百姓生活也是真的苦，叙利亚以前还能吃免费大饼，现在连免费大饼也没了，巴勒斯坦早就没大饼吃了······说心里话，和纷乱的世界相比，不得不感叹和平真好!,https://toutiao.com/group/7449369382092718629/,,0,0,False
失联10年，马航MH370传来最新消息！失联乘客家属发声,2024-12-20 13:23,617,142,上观新闻,上观新闻,当地时间20日，马来西亚交通部长陆兆福表示，原则上同意恢复对马航MH370航班的搜索工作。陆兆福说，马来西亚内阁在12月13日的会议上同意一家名为“海洋无限”的水下探测公司在南太平洋一处1.5万平方公里面积的水域继续以“无发现无收费”的原则展开搜索。,https://export.shobserver.com/toutiao/html/832060.html,,0,1,False
毛人凤下令带走死囚，哪料死囚的靠山露面了，毛人凤当场懵了,2024-11-25 03:05,12284,2182,南哥硬汉秀,南哥硬汉秀,,https://toutiao.com/group/7441047753771188799/,,0,0,True
曹德旺预言：2025年，没有买房的人，五年后是失败者还是幸运儿？,2024-12-16 05:57,5354,1841,议史纪,议史纪,其实早在多年前年，“玻璃大王”曹德旺就曾预言:“房地产将成为有钱人击鼓传花的游戏”，房子就是钢筋混凝土，是不会保值的?,https://toutiao.com/group/7448883228297003539/,,0,0,False
女友怀孕了，男友不装了，带她回豪宅！,2024-11-23 08:01,17882,1304,乐视大综艺咖,乐视大综艺咖,,https://toutiao.com/group/7440353629540483593/,,0,0,True
3%的存款利率重出江湖，银行年底全力火拼，客户错过再等一年,2024-12-16 06:03,1498,155,议史纪,议史纪,大家都知道，今年各大银行的存款利率已经不断下调三次，有些民营银行和小银行更是多次下调存款利率，最直接的结果就是，年终存款量目标无法达成。,https://toutiao.com/group/7448884806307398156/,,0,0,False
马斯克权力这么大！发推让国会法案难产，还要取代众院议长？,2024-12-19 22:53,8975,878,王冰汝,王冰汝,,https://toutiao.com/group/7450259789738672649/,,0,0,True
马光远：东南沿海一带的小城市被严重低估 #财经大咖来了,2024-12-17 06:17,6609,337,光远看经济,光远看经济,,https://toutiao.com/group/7449261133652820518/,,0,0,True
中央定调！2025年养老金双增长，养老金领取条件有变，一类人不涨,2024-12-14 08:18,4662,384,思之想之,思之想之,2025年养老金调整最新消息来了，中央已经定调，2025年养老金将迎来双增长。另外提醒大家，2025年起养老金领取条件有变，一类人不参加2025年养老金调整，具体是什么呢？一起来了解。,https://toutiao.com/group/7448174128252682788/,,0,0,False
郜春海：马斯克具有超强的解构能力,2024-12-19 08:11,2525,565,凤凰网财经,凤凰网财经,,https://toutiao.com/group/7450032592033841675/,,0,0,True
冬季自驾游，零下四十度睡车里，半夜冻醒了，车里全部冻住了！,2024-12-13 11:02,13574,2891,旅行者小多,旅行者小多,,https://toutiao.com/group/7447850219347116544/,,0,0,True
弟弟光荣退伍，姐姐兴奋去车站接他，怎料一见弟弟瞬间哭了,2024-11-05 06:34,39196,3248,乐视天天剧好看,乐视天天剧好看,,https://toutiao.com/group/7433679820573934091/,,0,0,True
67岁执意生娃，如今却坐轮椅无法自理，5岁的天赐被迫独立学洗衣,2024-11-04 10:32,9494,2137,睿之悦,睿之悦,2019年，已经67岁的田新菊执意生下了自己的第三个孩子小天赐。那么，现如今5年的时间过去了，这“天赐”的礼物到底是福还是祸呢?,https://toutiao.com/group/7433367394946384435/,,0,0,False
郭有才：当迷失方向忘记初心后，曾经飘得多高，如今摔得就多惨,2024-11-11 06:53,1956,847,八号探秘人,八号探秘人,在阅读此文之前，辛苦您点击一下“关注”，既方便您进行讨论和分享，又能给您带来不一样的参与感，感谢您的支持！编辑丨brt因为一首翻唱，他一夜之间成为了拥有千万粉丝的网红。但是“人红是非多”，不久他就因为版权等问题陷入了舆论风波。他的人气一落千丈，从万众瞩目变成了现在的无人问津。,https://toutiao.com/group/7435901170239078948/,,0,0,False
女子被多人密谋灌醉强奸后投江自尽，生前在手机备忘录记下被胁迫经过，三男子获罪,2024-12-18 16:40,11318,9328,红星新闻,红星新闻,投河自尽前，黄某某于2023年7月4日在其手机内创建了备忘录，记录下了她被胁迫的经过，这也成为了公检法日后侦查、起诉和判决的重要物证。,https://cdsbrss.cdsb.com/toutiao_no_video.php?url=https%3A%2F%2Fstatic.cdsb.com%2Fmicropub%2FArticles%2F202412%2Fc6419feb940b5f2c2302f01847e73bb8.html,,0,0,False
2024年中国的房价见底了吗？,2024-12-19 06:41,4297,194,温义飞的急救财经,温义飞的急救财经,,https://toutiao.com/group/7450009540067590692/,,0,0,True
