title,publish_time,like_count,comment_count,media_name,source,abstract,article_url,tag,is_yaowen,article_sub_type,has_video
时政微视频 | 习近平与古茶场的故事,2024-12-04 11:53,524,221,国际在线,国际在线,浙江磐安玉山古茶场始建于宋朝，是中国现存最早的官方茶叶交易场所。2006年，时任浙江省委书记习近平在视察古茶场时提出“要保护开发好玉山古茶场”的殷切希望，他还仔细地察看了修复规划图纸，并向有关部门了解修缮的资金预算是多少、怎么解决。,https://news.cri.cn/toutiaopic/75abd876-ea21-ca8e-4929-8a7b343ab18d.html,,0,0,False
11岁男孩打乒乓评上国家一级运动员，网友：这名字强得可怕,2024-12-03 23:40,1258,439,大象新闻,大象新闻,11岁男生乒乓球打到全国第二名，获得“国家一级运动员”称号！小小年纪取得这样的成绩，让人震惊又佩服。他叫马国栋，是杭州市文澜实验学校五年级学生，前段时间参加全国青少年精英系列赛，过五关斩六将，夺得全国亚军，并获得国青队集训资格。,https://share.hntv.tv/news/0/1864078499382747137,,0,0,False
韩国政坛巨变：6小时戒严成闹剧，尹锡悦政治生涯倒计时？,2024-12-04 05:42,9908,164,邱震海,邱震海,,https://toutiao.com/group/7444427835889943055/,,0,0,True
罕见！100年前，英国游客拍下的清朝乡村，和想象中完全不一样,2024-09-20 02:07,8324,735,万物知识局,万物知识局,泥泞的土路，衣不蔽体的老百姓，即便是达官显贵的家中也十分破败，而这些都是清王朝的历史痕迹，虽说那时候中国摄影技术并不发达，但也有许多外国游客来到这里，拍摄下了许多老照片，为我们留下了珍贵的历史资料，那清朝到底是怎样的面貌呢?,https://toutiao.com/group/7416287738871267855/,,0,0,False
外交态度逆转，立陶宛与中方对峙的内幕是？ #立陶宛,2024-12-03 09:02,16527,1374,卢克文工作室,卢克文工作室,,https://toutiao.com/group/7444108279917052425/,,0,0,True
宣布赦免其儿子后，拜登这句话，突然在美国网络上爆火,2024-12-03 07:13,5109,2054,环球时报,环球时报,美国总统拜登1日改变立场，突然宣布赦免其子亨特·拜登，并希望美国人理解他作为父亲和总统作出的这一决定，引发美国朝野哗然。,https://toutiao.com/group/7444079195803615770/,,0,0,True
67岁执意生娃，如今却坐轮椅无法自理，5岁的天赐被迫独立学洗衣,2024-11-04 10:32,8010,1848,睿之悦,睿之悦,2019年，已经67岁的田新菊执意生下了自己的第三个孩子小天赐。那么，现如今5年的时间过去了，这“天赐”的礼物到底是福还是祸呢?,https://toutiao.com/group/7433367394946384435/,,0,0,False
温州富婆胡洁，前脚送巨贪前夫进监狱，后脚嫁周立波，将其宠成宝,2024-12-03 11:58,1566,102,豆莱说,豆莱说,在和周立波结婚之前，胡洁还曾有过一段婚姻，但是她却亲手将前夫送进了监狱，嫁给周立波之后，胡洁则是专心辅助丈夫的事业。,https://toutiao.com/group/7444106485011022373/,,0,0,False
大学生4年间艾滋病感染12397例，60%存在这一行为,2024-12-03 10:16,3929,2772,凤凰网,凤凰网,据相关数据，2020年至2023年，新报告青年学生病例分别为:2977人、3677人、2733人、3010人，四年间共报告12397人。,https://toutiao.com/group/7444127197663396364/,,0,0,False
20岁的关之琳属实太美，出水芙蓉洁白柔嫩，果然名不虚传！,2024-11-27 06:10,1131,112,乐享综艺剧场,乐享综艺剧场,,https://toutiao.com/group/7441836884977779200/,,0,0,True
老总送一条项链！美女乖乖脱下衣服，下秒随了心愿！,2024-11-30 03:27,924,155,南瓜钟意你,南瓜钟意你,,https://toutiao.com/group/7442908746533044786/,,0,0,True
“青瓦台魔咒”或降临，尹锡悦大势已去？冲冠一怒代价惨重,2024-12-04 05:30,13982,729,陈虎点兵,陈虎点兵,,https://toutiao.com/group/7444424854045983259/,,0,0,True
韩国一夜变天，10个关键问题,2024-12-03 23:14,6511,1339,牛弹琴,牛弹琴,万万没想到，韩国一夜变天，总统尹锡悦掀桌子了。12月3日深夜，他突然宣布，韩国紧急戒严。有朋友问：戒严是什么概念？那是涉及到国本的大事。是要动刀动枪，抓人杀人的。要知道，韩国上次戒严，还是40多年前了。随后，韩国军队上街，首尔市民抗议，世界各国震惊。,https://toutiao.com/group/7444325422541619748/,,0,0,False
韩国老百姓吃不起饭了？真相诡异 | 地球知识局,2024-12-04 02:39,319,105,地球知识局,地球知识局,(⊙_⊙)每天一篇全球人文与地理微信公众号：地球知识局NO.2696-韩国吃饭问题文字：那日苏制图：板栗 / 校稿：朝乾 / 编辑：板栗韩国，是发达国家么？2021年，韩国首次被联合国认定为发达国家。去年，韩国人均GDP基本追平日本，这好日子，似乎是越来越甜了。,https://toutiao.com/group/7444375262441013800/,,0,0,False
银行存款 “一夜大改”！12月1日开始，5万以上存款家庭要注意了,2024-12-04 02:00,1825,183,晴小天爱说话,晴小天爱说话,银行存款 “一夜大改”！12月1日开始，5万以上存款家庭要注意了,https://toutiao.com/group/7444370649126011403/,,0,0,True
包厢全是刚出狱的恶霸，结果一看到饭店主厨，立马怂了,2024-11-11 01:21,10855,280,乐视群星访谈秀,乐视群星访谈秀,,https://toutiao.com/group/7435825833048015400/,,0,0,True
炸萝卜丸子到底用面粉还是淀粉，教你正确做法，外焦里嫩，太香了,2024-10-26 09:25,13645,899,家常的味道,家常的味道,,https://toutiao.com/group/7430012978277122611/,,0,0,True
1米3袖珍美女嫁给1米48男孩，婚后丈夫奇迹长高，两人却不欢而散,2024-09-07 02:55,7329,403,睿之悦,睿之悦,杨萍和葛存苗的婚礼 文|睿之悦 编辑|睿之悦2019年，成都的民政局来了两个“10岁小孩”来登记，工作人员以为是玩闹。两个“小孩”拿出身份证让工作人员看，这才明白，原来是两个再也长不高的成年袖珍人情侣。,https://toutiao.com/group/7411713833267364386/,,0,0,False
美国权力即将交接之际，台湾两个举动不寻常，释放什么危险信号？,2024-12-02 09:57,11871,119,邱震海,邱震海,,https://toutiao.com/group/7443751437550486057/,,0,0,True
63岁蔡明与倪萍刘晓庆逛丽江，脸拉垮疑医美过度，难怪不再上春晚,2024-12-04 03:33,356,117,峰哥正读,峰哥正读,拟邀嘉宾刘晓庆、斯琴高娃、向太、蔡明等人参加旅行综艺，该片单一出当时很多人都觉得片方这是在闹着玩的。,https://toutiao.com/group/7444372363631886860/,,0,0,False
未来5年没大年三十，都是月亮惹的祸！2262年有两个春节放假怎么安排？,2024-12-03 05:12,1027,498,极目新闻,极目新闻,2025年1月29日将迎来农历新年蛇年，但2025年没有大年三十，大年二十九过后就是大年初一。据悉，从2025年开始直到2029年，连续五年的除夕都是“大年二十九”。,http://jms.ctdsb.net/jmythshare/#/index_share?cId=0&contentType=5&contentId=2319456,,0,0,False
俄乌冲突结束方案三方不同意，10万部队入乌维和，瓜分还是占领？,2024-12-01 12:09,15961,1259,杜文龙,杜文龙,,https://toutiao.com/group/7443414453669855783/,,0,0,True
女友怀孕了，男友不装了，带她回豪宅！,2024-11-23 08:01,8395,697,乐视大综艺咖,乐视大综艺咖,,https://toutiao.com/group/7440353629540483593/,,0,0,True
马龙访台，台湾人热烈欢迎，台独焦虑不安视为大敌使出妖魔化老招,2024-11-29 09:56,25553,1063,邱毅台湾,邱毅台湾,,https://toutiao.com/group/7442637867307762230/,,0,0,True
传奇：凌晨时分 女子睡梦中突然感觉异样 睁开眼却看到可怕的一幕,2024-09-13 04:08,5138,155,江西卫视传奇故事,江西卫视传奇故事,,https://toutiao.com/group/7413943942749618707/,,0,0,True
广西49岁老汉娶19岁姑娘，结婚21年生下15个孩子，如今有何下场？,2024-10-20 08:32,5673,686,艺述史,艺述史,她19岁出嫁，21年里总共生育了15个孩子，其中4个男孩子11个女孩子，家里热闹的像是开了一所学校一样。,https://toutiao.com/group/7427400319418384948/,,0,0,False
郭有才：当迷失方向忘记初心后，曾经飘得多高，如今摔得就多惨,2024-11-11 06:53,1449,691,八号探秘人,八号探秘人,在阅读此文之前，辛苦您点击一下“关注”，既方便您进行讨论和分享，又能给您带来不一样的参与感，感谢您的支持！编辑丨brt因为一首翻唱，他一夜之间成为了拥有千万粉丝的网红。但是“人红是非多”，不久他就因为版权等问题陷入了舆论风波。他的人气一落千丈，从万众瞩目变成了现在的无人问津。,https://toutiao.com/group/7435901170239078948/,,0,0,False
母亲瘫痪、父亲疯了，当年那个744分的高考状元，7年后却成了这样,2024-09-08 00:54,13931,1969,八号探秘人,八号探秘人,母亲截肢瘫痪、父亲疯癫痴傻，可对于自己的亲人，他却做出了这样的评价。而今，7年已过，曾经那个让无数人动容的少年，现在如何?,https://toutiao.com/group/7411852147648496162/,,0,0,False
中北大学推出巡飞枪，枪身弹药创新设计，后坐力小射击精度更高,2024-11-28 09:54,22633,1457,杜文龙,杜文龙,,https://toutiao.com/group/7442266246671761932/,,0,0,True
