title,publish_time,like_count,comment_count,media_name,source,abstract,article_url,tag,is_yaowen,article_sub_type,has_video
小伙去相亲，谁料看到相亲女孩乐了，两人早就认识,2025-01-15 08:13,7065,1080,南瓜钟意你,南瓜钟意你,,https://toutiao.com/group/7460052415774065178/,,0,0,True
全自动化养鸡大棚着大火,2025-02-14 05:42,1383,1340,东星,东星,,https://toutiao.com/group/7471146007749804598/,,0,0,True
168票通过！尹锡悦支持者冲击中使馆,2025-02-15 03:45,2690,245,星河文史,星河文史,,https://toutiao.com/group/7471486742932095540/,,0,0,True
穷小伙找富婆借钱买房子，富婆直接答应，却提出条件,2025-01-07 03:09,4067,763,南瓜热剧回放,南瓜热剧回放,,https://toutiao.com/group/7457005446646202916/,,0,0,True
媳妇玩到半夜才回来，以为老公不在家，进门这操作把老公看懵了,2025-01-24 09:38,11548,3196,滕菲,滕菲,,https://toutiao.com/group/7463414214191743497/,,0,0,True
父母都已不在，男子还未成家，一个人回家过年，鞭炮也不能少。,2025-02-13 10:15,16702,2938,乐天派叶子,乐天派叶子,,https://toutiao.com/group/7470845080074502667/,,0,0,True
这就是旺三代的媳妇，祖上积德啊，才能娶到这么好的媳妇👍,2025-01-27 10:33,60746,4907,趣知达人,趣知达人,,https://toutiao.com/group/7464541223764705842/,,0,0,True
哪吒2海外失控了！,2025-02-14 08:18,10531,635,一勺晚安丶九分喜欢,一勺晚安丶九分喜欢,,https://toutiao.com/group/7471186190582972963/,,0,0,True
丈母娘看不起穷女婿，全家聚餐没给女婿留筷子，女儿做法漂亮！,2025-01-27 16:01,3302,870,群星访谈秀,群星访谈秀,,https://toutiao.com/group/7462286897130291724/,,0,0,True
赵本山带上赵四赶紧下场吧，这部小品真是极品，观众都快笑分岔气,2024-12-13 03:50,6275,1406,my彩虹分享,my彩虹分享,,https://toutiao.com/group/7447738864753443378/,,0,0,True
《哪吒2》海外版  片段,2025-02-11 13:54,1867,414,治愈猪,治愈猪,《哪吒之魔童闹海》（海外版）是《哪吒之魔童降世》的续集，讲述了哪吒与敖丙在天劫之后灵魂得以保全，但肉身却岌岌可危的故事。,https://toutiao.com/group/7470159411818873371/,,0,0,True
退役女特警来报到，被领导看不起，谁知她是领导的上司,2025-01-27 17:38,6536,139,剧美影视剧院,剧美影视剧院,,https://toutiao.com/group/7462980954747978266/,,0,0,True
