title,publish_time,like_count,comment_count,media_name,source,abstract,article_url,tag,is_yaowen,article_sub_type,has_video
不变的关心和信心——数看习近平主席新年贺词,2025-01-04 11:55,2506,228,环球网,环球网,“中国式现代化的新征程上，每一个人都是主角，每一份付出都弥足珍贵，每一束光芒都熠熠生辉。”2024年12月31日晚，国家主席习近平发表二〇二五年新年贺词。,https://toutiao.com/group/7456026909688873481/,,0,0,False
短视频丨6个热词感受2024年中国经济活力,2025-01-04 12:00,608,298,人民网,人民网,2024年，面对国内外形势带来的挑战，以习近平同志为核心的党中央团结带领全党全国各族人民，沉着应变、综合施策，顺利完成经济社会发展主要目标任务，高质量发展扎实推进，中国式现代化迈出新的坚实步伐。这一成绩来之不易，分量十足，很不平凡。让我们用6个热词，感受2024年中国经济活力。,https://toutiao.com/group/7456028724249575988/,,0,0,False
韩国派出特警队逮捕尹锡悦，驻韩美军下令护尹，安全部队强力阻挡,2025-01-04 07:57,20574,1312,邱毅台湾,邱毅台湾,,https://toutiao.com/group/7455966319511339570/,,0,0,True
老纪和珅这段对话，以前小时候听不懂，如今听完受益终身,2024-12-28 23:16,5800,1698,乐视扒剧小妹儿,乐视扒剧小妹儿,,https://toutiao.com/group/7453420191947424293/,,0,0,True
小子相亲故意扮老，谁知道对方一见面就叫他大爷，这段太逗了,2024-12-24 08:17,3593,827,乐视热播综艺精选,乐视热播综艺精选,,https://toutiao.com/group/7451886130837848610/,,0,0,True
乞丐上台唱歌引起评委质疑，一首歌唱完让观众起立鼓掌,2024-11-01 02:16,4887,786,乐视综艺咖,乐视综艺咖,,https://toutiao.com/group/7432129044134494771/,,0,0,True
牛肉价格为啥持续下降？,2024-12-29 16:26,7176,273,强老师儿,强老师儿,,https://toutiao.com/group/7453871032575721999/,,0,0,True
煮米饭别总是加水了，难怪不好吃，教你酒店不外传的秘诀，非常香,2024-12-06 08:45,4314,905,明玥美食,明玥美食,,https://toutiao.com/group/7445217195929371190/,,0,0,True
清华才女李一诺：27岁博士毕业，4年生3娃，能替世界首富花钱,2024-12-18 05:51,8403,369,云莳一,云莳一,家庭是她第一个学校，妈妈是她第一任老师。李一诺27岁博士毕业进入美国麦肯锡公司，33岁成为公司全球董事合伙人，之后四年连生3娃。,https://toutiao.com/group/7449591069311779355/,,0,0,False
充电时，先插手机还是充电器？方法错误手机坏得快,2025-01-02 01:19,1737,135,人民日报,人民日报,手机电量还剩多少，对现代社会的许多人而言，都是一个“性命攸关”的问题。人们对手机充电的强烈需求，也让市面上催生出了许多噱头：无线充电，二倍速充电，以及能连着用一周的高能充电宝。乱花渐欲迷人眼，但到底什么才是手机充电的正确姿势呢？手机一定要满充满放吗？,https://www.peopleapp.com/column/30047895447-500006027199?utm_source=头条号&promote=true,,0,1,False
石破茂亲中吗？,2025-01-03 13:55,8081,422,静思有我,静思有我,,https://toutiao.com/group/7455642885552079395/,,0,0,True
贪官酒桌上的权钱交易，语言天衣无缝，听懂三分都是人精！,2024-11-23 16:24,4083,488,乐视扒剧小妹儿,乐视扒剧小妹儿,,https://toutiao.com/group/7440378916130259496/,,0,0,True
34岁雌雄同体的女性，具备男女两性器官，她该如何生存下去？,2024-10-17 03:32,4388,211,大象微视,大象微视,这个词在我们生活中并不常见，简而言之，双性人就是既拥有男性的生殖器官，也具备女性的特征的人。1989年，王梓淇出生在山西太原的一个家庭，她的家里经营着一家小生意，虽然谈不上富裕，但足够让一家人过得舒心自在。,https://toutiao.com/group/7426578550418948618/,,0,0,False
不打了，暂别CBA！新疆队官宣赵睿停赛，新赛季夺冠格局再起悬念,2025-01-04 02:21,800,280,易霄寒,易霄寒,【前言】在前两天的CBA联赛中，出现了让球迷们都不敢相信的一幕，著名球星赵睿在比赛过程中恶心冲撞裁判，并与裁判发生肢体冲突，随后被驱逐出场。这在任何一个联赛都是非常罕见的一件事，新疆男篮主场被山东男篮攻克，很多人都没想到这个结果。,https://toutiao.com/group/7455877633885110799/,,0,0,False
弹性退休细则公布！65后、70后、75后退休节点有变化，如何选择？,2025-01-02 00:07,1502,314,社保当家,社保当家,人社部等部门在1月1日正式发布了《实施弹性退休制度暂行办法》，明确了如何办理弹性退休手续，对养老金领取有何影响等事项，及时了解下。,https://toutiao.com/group/7454882770310119987/,,0,0,False
夜里翻来覆去睡不着，原来几根芹菜根就搞定，做法简单，省钱实用,2024-12-25 11:02,9746,1163,百变小厨坊,百变小厨坊,夜里翻来覆去睡不着，原来几根芹菜根就搞定，做法简单，省钱实用,https://toutiao.com/group/7452303315842368052/,,0,0,True
98岁老郎中教我苹果养生新吃法，每天坚持这样吃，睡眠好，身体棒,2024-12-31 11:43,10514,1027,百变小厨坊,百变小厨坊,98岁老郎中教我苹果养生新吃法，每天坚持这样吃，睡眠好，身体棒,https://toutiao.com/group/7454540163725656628/,,0,0,True
原来火腿肠铝环下藏着个“小机关”，轻轻一拉，完整剥开，太棒了,2024-12-30 12:48,4288,2689,百变小厨坊,百变小厨坊,原来火腿肠铝环下藏着个“小机关”，轻轻一拉，完整剥开，太棒了,https://toutiao.com/group/7454186052081680911/,,0,0,True
我家米醋从来不外面买，教你在家做，无添加剂，好吃又卫生,2024-10-31 11:36,5976,788,百变小厨坊,百变小厨坊,,https://toutiao.com/group/7431902258318541324/,,0,0,True
抗美援朝的将军亮相，全体明星自发起立，这幕太感人,2025-01-03 07:32,10004,1205,乐视天天剧好看,乐视天天剧好看,,https://toutiao.com/group/7455587633452843572/,,0,0,True
小女孩上部队找爸爸，少校阿姨主动搭讪，谁知看到女孩父亲傻眼了,2024-12-23 16:01,3228,753,乐视群星访谈秀,乐视群星访谈秀,,https://toutiao.com/group/7451525814283960872/,,0,0,True
我国哪里的面粉无添加？经对比，有这行字就是零添加，可以放心买,2025-01-02 10:44,2214,1016,鲸探所,鲸探所,面粉是我们日常生活中离不开的一种主食，在我国人们的餐桌上是有着非常重要的地位的。可以说，基本上家家户户都是需要用到面粉的，已经快到年下了，许多人也开始往家里置备年货了，而面粉，也是最重要的年货之一。,https://toutiao.com/group/7455263523673834024/,,0,0,False
腐竹用清水和开水泡是大错，酒店大厨教我1招，快速柔软还不夹生,2024-11-06 11:49,6138,138,百变小厨坊,百变小厨坊,腐竹用清水和开水泡是大错，酒店大厨教我1招，快速柔软还不夹生,https://toutiao.com/group/7434132052506575394/,,0,0,True
炒猪肉时，瘦肉发柴嚼不动？教你一招，像吃豆腐一样嫩滑，真香,2025-01-03 21:05,1182,129,简单香瓜6FJ,简单香瓜6FJ,,https://toutiao.com/group/7455794988992135720/,,0,0,True
沈春阳笑死个人，满口胡说八道，小沈阳气得说不出话,2024-12-28 16:52,4574,726,乐视影视圈,乐视影视圈,,https://toutiao.com/group/7453290317240861199/,,0,0,True
刀郎北京演唱会最后10分钟：三首连唱，点燃爱国热情！,2024-12-31 14:37,23777,4583,哇事记,哇事记,,https://toutiao.com/group/7454585113318261288/,,0,0,True
麻将口诀：逢二不拆一，赢到三家捶桌子，看我给您演示一下,2024-12-09 05:36,3954,1380,麻将高手阿涛,麻将高手阿涛,,https://toutiao.com/group/7446281763141190207/,,0,0,True
他的资历比朱德还老，授勋时却错失元帅，毛主席特批享受元帅待遇,2024-12-12 10:24,3130,128,品古观今,品古观今,在我军革命史上，有一位将军的资历比朱德还老，连毛主席都说:“共产党能对国民党将领说话的人不多，他就是其一。”可这样的人却在大授衔时，错失了元帅，后来经过毛主席的一番关心，才得以享受与元帅的同等待遇。,https://toutiao.com/group/7447468654758871592/,,0,0,False
被央媒怒批，目不识丁，丢人现眼，这几位“文盲”明星凭什么走红,2024-12-30 10:52,4488,1192,与君説,与君説,在阅读此文之前，麻烦您点击一下“关注”，既方便您进行讨论和分享，又能给您带来不一样的参与感，感谢您的支持文、编辑|小娄郭德纲曾说“可以没文凭，但不能没文化”。老郭的这句话在儿子郭麒麟身上体现得淋漓尽致。虽然郭麒麟初中就辍学了，但人家有思想有内涵，是个名副其实的“文化人”。,https://toutiao.com/group/7454151513221661234/,,0,0,False
河南警察3岁女儿被拐，苦寻全国23年无果，结果却发现女儿在对门,2024-11-05 07:43,6206,665,八号探秘人,八号探秘人,寻亲23年无果，丢失的女儿竟住在对门?但它却真实发生在河南洛阳的梁绍波身上。是意外走丢，还是人贩子所为，三岁的女儿怎会离奇失踪?,https://toutiao.com/group/7433697108120142345/,,0,0,False
香港女子花400万买15平房子，晚上睡衣柜顶，客厅宽敞还有大阳台,2024-12-26 04:06,787,435,鲸探所,鲸探所,都说香港寸土寸金，但是对于我们来说，其实这句话只是一个概念而已，只知道贵，但不知道到底能贵到哪种程度。但是看完一位女子花了400万在香港买的房子之后，“寸土寸金”这个词，真的让人“具象化”了。,https://toutiao.com/group/7452564162242265640/,,0,0,False
大陆就统一时间表表态，20万台胞已办身份证？台当局称严查,2025-01-03 11:03,3017,349,第一军情,第一军情,台湾问题是中国核心利益中的核心，已困扰了我们整整75年，成为每一个中国人心中的痛。日前，大陆著名学者在一篇文章表示，未来四年时间，大陆不会制定统一台湾的时间表。,https://toutiao.com/group/7455640102287557156/,,0,0,False
新婚33天卷走274万4套房，出逃后丈夫跨国追捕，如今下场大快人心,2024-12-20 22:06,5126,268,八号探秘人,八号探秘人,在阅读此文之前，辛苦您点击一下“关注”，既方便您进行讨论和分享，又能给您带来不一样的参与感，感谢您的支持！编辑丨QQ·B“色字头上一把刀！”深圳富豪结婚33天竟被卷走274万元和名下4套房产。不仅如此，他还被扣上了“接盘侠”的帽子，啥也没干喜当爹。,https://toutiao.com/group/7450399558821052982/,,0,0,False
山楂干泡水很多人都泡错了，难怪没用，今天教你正确做法，真管用,2024-11-02 11:46,7720,289,百变小厨坊,百变小厨坊,,https://toutiao.com/group/7432646945211941402/,,0,0,True
2024年度最佳华语猛片！绝对真实事件改编，怒斩12项大奖！,2024-10-19 07:09,4695,371,宇哥侃故事,宇哥侃故事,,https://toutiao.com/group/7427380436173357620/,,0,0,True
不吹不贬，中国“神秘战机”究竟是多重的砝码？,2025-01-03 13:30,1234,404,胡锡进,胡锡进,被广泛猜测的中国“第六代战机”以及隐身无人机相继亮相，如果都如专业人士分析的那样，我认为它们会重新定义亚洲和西太平洋的天空，它们甚至预示了美军在军事科技方面绝对优势时代正在走向终结。《华盛顿邮报》是这样写的：中国的先进飞机令分析人士感到意外。,https://toutiao.com/group/7455680403169378825/,,0,0,False
清汤面好吃有诀窍，教你面馆30年不外传的秘诀，劲道爽滑汤鲜味美,2024-12-13 13:30,7602,1029,百变小厨坊,百变小厨坊,,https://toutiao.com/group/7447888258186347018/,,0,0,True
清华简彻底解密三星堆！三星堆居然与上古巫族和墨家息息相关,2025-01-03 10:36,6375,543,seeker大师兄,seeker大师兄,,https://toutiao.com/group/7455636143020474906/,,0,0,True
萝卜和鸡蛋这样做，比吃补药还补，顿顿吃都不会腻，又香又下饭,2024-10-30 12:28,72693,4409,小寒厨艺,小寒厨艺,萝卜和鸡蛋这样做，比吃补药还补，顿顿吃都不会腻，又香又下饭,https://toutiao.com/group/7431405463378919975/,,0,0,True
气疯的美国政府，和一骑绝尘的中国无人机,2025-01-03 15:27,2870,511,胡锡进,胡锡进,大疆无人机的名气出圈，不断打压它的美国政府成了事实上的抬轿子者。美国商务部1月2日宣布，将就限制或禁止大疆在美国境内使用征求公众意见。现在对美国人来说，中国最知名的品牌除了华为，大概就是大疆了。▲大疆生产的无人机。近年来，美国政府出了千奇百怪限制美国人使用中国无人机的规定。,https://toutiao.com/group/7455711017402663434/,,0,0,False
炖鸡肉不要焯水和直接下锅，教你一招，鸡肉鲜香滑嫩不腥不柴,2024-12-15 08:45,8184,404,家常的味道,家常的味道,炖鸡肉千万不要焯水和直接下锅，教你秒招，鸡肉鲜香滑嫩不腥不柴,https://toutiao.com/group/7448556944597451275/,,0,0,True
天冷电动车充足电，加油门就掉2格电，告诉你原因并分享改善方法,2024-11-29 23:13,1331,166,境心说车,境心说车,在寒冷的天气里很多朋友都反馈电池没有以前耐用了，明明电池已经充足电但上路行驶一加油门，电量表就会突然掉两格电，车辆续航里程也大幅下降。,https://toutiao.com/group/7442528079165096448/,,0,0,False
