title,publish_time,like_count,comment_count,media_name,source,abstract,article_url,tag,is_yaowen,article_sub_type,has_video
党的自我革命永远在路上——写在二十届中央纪委四次全会召开之际,2025-01-05 22:53,2536,2052,人民日报,人民日报,2024年12月26日至27日，中共中央政治局召开民主生活会，习近平总书记主持会议并发表重要讲话，体现了以上率下深入推进党的自我革命的明确要求，树立了激励干部担当作为的鲜明导向。,https://www.peopleapp.com/column/30047929144-500006034152?utm_source=头条号&promote=true,,0,0,False
人民日报刊文：从新年贺词感受习近平主席的天下情怀,2025-01-05 23:08,807,387,人民日报,人民日报,——从新年贺词感受习近平主席的天下情怀。在二〇二五年新年贺词中，习近平主席重申中国愿同各国一道做文明互鉴的推动者。,https://www.peopleapp.com/column/30047929158-500006034317?utm_source=头条号&promote=true,,0,0,False
花9000万“润”到英国后，他成了“韭菜”,2025-01-04 11:04,1652,578,环球人物杂志,环球人物杂志,他在山西金融领域掀起一场惊涛骇浪，走上了一条不归路。作者：陈佳莉即将到来的农历新年，将是田文军夫妻在英国度过的第六个春节，但可能是一个无家可归的春节。他们所居住的位于伦敦汉普斯特德郊区的一处豪宅于近日被“充公”，这是他们刚来英国时的落脚地，一定意义上被视为新的家。,https://toutiao.com/group/7456014483631260194/,,0,0,False
福彩5.3亿巨奖得主极速领奖，无图无票领亿元大奖会成常态？,2025-01-04 09:38,334,640,彩市分析,彩市分析,备受关注的福彩双色球5.3亿巨奖得主已现身领奖，中心发布了这位彩友的领奖公告，显示这位彩友在1月3日即中奖后第二天就已现身领奖，缴纳偶然所得税高达1亿多元：公告内容比较简单，除了介绍中奖方式外，最关键的信息就是说明这位5.3亿得主已经完成领奖，并按照20%固定税率缴纳1.,https://toutiao.com/group/7455988416660980275/,,0,0,False
高安国被押前留下英雄壮语，赖清德恶贯满盈，何时方能恶有恶报？,2025-01-05 04:00,19870,2224,邱毅台湾,邱毅台湾,,https://toutiao.com/group/7455975347708920383/,,0,0,True
小女孩上部队找爸爸，少校阿姨主动搭讪，谁知看到女孩父亲傻眼了,2024-12-23 16:01,3543,831,乐视群星访谈秀,乐视群星访谈秀,,https://toutiao.com/group/7451525814283960872/,,0,0,True
广西49岁老汉娶19岁姑娘，结婚21年生下15个孩子，如今有何下场？,2024-10-20 08:32,10549,1280,艺述史,艺述史,她19岁出嫁，21年里总共生育了15个孩子，其中4个男孩子11个女孩子，家里热闹的像是开了一所学校一样。,https://toutiao.com/group/7427400319418384948/,,0,0,False
拜登下台前搅动南海风云，美菲连手挑衅中国，中国不再忍强硬回击,2025-01-03 03:44,21921,942,邱毅台湾,邱毅台湾,,https://toutiao.com/group/7455530031461171753/,,0,0,True
炸鱼块，到底用淀粉还是面粉，今天分享一个又香又脆的做法,2025-01-02 09:26,7227,458,家常的味道,家常的味道,,https://toutiao.com/group/7455247105683096076/,,0,0,True
抗美援朝的将军亮相，全体明星自发起立，这幕太感人,2025-01-03 07:32,11214,1309,乐视天天剧好看,乐视天天剧好看,,https://toutiao.com/group/7455587633452843572/,,0,0,True
98岁老郎中教我苹果养生新吃法，每天坚持这样吃，睡眠好，身体棒,2024-12-31 11:43,11715,1151,百变小厨坊,百变小厨坊,98岁老郎中教我苹果养生新吃法，每天坚持这样吃，睡眠好，身体棒,https://toutiao.com/group/7454540163725656628/,,0,0,True
欧洲会爆发世界大战吗？俄乌2025年能否止战？|凤凰《非常2024》,2024-12-30 07:54,3278,215,凤凰卫视,凤凰卫视,,https://toutiao.com/group/7454110252754010664/,,0,0,True
厨师长教你：“家常肘子”口感耙糯 软烂入味 肥而不腻,2025-01-02 09:00,1934,257,美食作家王刚,美食作家王刚,厨师长教你：“家常肘子”口感耙糯 软烂入味 肥而不腻,https://toutiao.com/group/7455138904249893416/,,0,0,True
新婚33天卷走274万4套房，出逃后丈夫跨国追捕，如今下场大快人心,2024-12-20 22:06,5309,270,八号探秘人,八号探秘人,在阅读此文之前，辛苦您点击一下“关注”，既方便您进行讨论和分享，又能给您带来不一样的参与感，感谢您的支持！编辑丨QQ·B“色字头上一把刀！”深圳富豪结婚33天竟被卷走274万元和名下4套房产。不仅如此，他还被扣上了“接盘侠”的帽子，啥也没干喜当爹。,https://toutiao.com/group/7450399558821052982/,,0,0,False
清华简彻底解密三星堆！三星堆居然与上古巫族和墨家息息相关,2025-01-03 10:36,7527,614,seeker大师兄,seeker大师兄,,https://toutiao.com/group/7455636143020474906/,,0,0,True
“六星街里还传来巴扬琴声吗……”狼戈、张英席合唱《苹果香》,2024-12-31 14:55,3349,166,央视频,央视频,,https://toutiao.com/group/7454589818538820115/,,0,0,True
县长看不上乡长送的烟，给他退回来，乡长打开一看乐了,2024-11-13 08:16,12233,2010,乐视大综艺咖,乐视大综艺咖,,https://toutiao.com/group/7436672568578277925/,,0,0,True
厨师长教你：“葱爆羊肉”羊肉滑嫩、鲜香不膻,2024-12-27 07:34,3778,693,美食作家王刚,美食作家王刚,厨师长教你：“葱爆羊肉”羊肉滑嫩、鲜香不膻,https://toutiao.com/group/7452991735665263139/,,0,0,True
今年会举行阅兵仪式吗？我大胆作个猜测,2025-01-03 09:11,14312,1640,金灿荣教授,金灿荣教授,,https://toutiao.com/group/7455614288229728803/,,0,0,True
我国哪里的面粉无添加？经对比，有这行字就是零添加，可以放心买,2025-01-02 10:44,2822,1171,鲸探所,鲸探所,面粉是我们日常生活中离不开的一种主食，在我国人们的餐桌上是有着非常重要的地位的。可以说，基本上家家户户都是需要用到面粉的，已经快到年下了，许多人也开始往家里置备年货了，而面粉，也是最重要的年货之一。,https://toutiao.com/group/7455263523673834024/,,0,0,False
女市长爱上小男友，俩人爱的轰轰烈烈，让女市长感到害怕,2024-12-18 08:13,2789,486,乐视经典热综回放,乐视经典热综回放,,https://toutiao.com/group/7449661362671714850/,,0,0,True
河南警察3岁女儿被拐，苦寻全国23年无果，结果却发现女儿在对门,2024-11-05 07:43,6297,673,八号探秘人,八号探秘人,寻亲23年无果，丢失的女儿竟住在对门?但它却真实发生在河南洛阳的梁绍波身上。是意外走丢，还是人贩子所为，三岁的女儿怎会离奇失踪?,https://toutiao.com/group/7433697108120142345/,,0,0,False
神十八乘组本月计划与公众见面,2025-01-05 07:39,659,263,人民日报,人民日报,1998年的今天中国人民解放军航天员大队正式成立为国出征叩苍穹从1998到2025从神舟五号到神舟十九号已有24名中国航天员飞上太空一次次凯旋 成就一个个飞天英雄一次次迈步 背后是航天员们的努力拼搏中国航天一次次书写新的传奇他们，是真正的“中国天团”今天，“神舟家族”成团27周年,https://www.peopleapp.com/column/30047926228-500006033663?utm_source=头条号&promote=true,,0,1,False
印度女主播：歼36和076是“光鲜新玩具”，能否生存都是问题,2025-01-02 09:28,4144,1051,第一军情,第一军情,日前，在印度知名度非常高的美女主持人帕尔基-夏尔马在电视节目中，“锐评”了中国先进武器的“井喷”式亮相。夏尔马质疑中国六代机也好，新型两栖攻击舰也好，都是没经过实战考验的“纸老虎”，虽然看起来光鲜亮丽，但真打起来很可能露馅。,https://toutiao.com/group/7455247647847219749/,,0,0,True
歼36首飞一周后，美军司令打破沉默：这是9·11以来最紧张时刻,2025-01-02 05:43,32711,117,阿尔法军事,阿尔法军事,歼36首飞一周后，美国印太司令部司令塞缪尔·帕帕罗作为“对华一线”最高指挥官发表了声明，他首先用两句话给整个声明定了调：一是中美要和平共处不要新冷战；二是美国无意与华进行军备竞赛。,https://toutiao.com/group/7455189778258985506/,,0,0,True
大陆就统一时间表表态，20万台胞已办身份证？台当局称严查,2025-01-03 11:03,3464,395,第一军情,第一军情,台湾问题是中国核心利益中的核心，已困扰了我们整整75年，成为每一个中国人心中的痛。日前，大陆著名学者在一篇文章表示，未来四年时间，大陆不会制定统一台湾的时间表。,https://toutiao.com/group/7455640102287557156/,,0,0,False
我国楼市大局已定，未来全国45%的家庭，或将面临“5大挑战”,2024-12-15 11:45,711,108,苍暮颜,苍暮颜,前言:21世纪开始，中国房地产市场一路高歌猛进，繁荣的景象更是吸引了无数投资者和购房者，房价也是一路攀升，也成为了房地产经济增长的重要引擎。,https://toutiao.com/group/7448599203455975947/,,0,0,False
保镖小金库暴露！竟攒了150万，荣登村落首富，准备迎娶二媳妇啦,2024-11-04 00:08,17579,1655,非洲小五,非洲小五,,https://toutiao.com/group/7433209191692501514/,,0,0,True
34岁雌雄同体的女性，具备男女两性器官，她该如何生存下去？,2024-10-17 03:32,4767,231,大象微视,大象微视,这个词在我们生活中并不常见，简而言之，双性人就是既拥有男性的生殖器官，也具备女性的特征的人。1989年，王梓淇出生在山西太原的一个家庭，她的家里经营着一家小生意，虽然谈不上富裕，但足够让一家人过得舒心自在。,https://toutiao.com/group/7426578550418948618/,,0,0,False
小子相亲故意扮老，谁知道对方一见面就叫他大爷，这段太逗了,2024-12-24 08:17,3818,871,乐视热播综艺精选,乐视热播综艺精选,,https://toutiao.com/group/7451886130837848610/,,0,0,True
夜里翻来覆去睡不着，原来几根芹菜根就搞定，做法简单，省钱实用,2024-12-25 11:02,10617,1252,百变小厨坊,百变小厨坊,夜里翻来覆去睡不着，原来几根芹菜根就搞定，做法简单，省钱实用,https://toutiao.com/group/7452303315842368052/,,0,0,True
被央媒怒批，目不识丁，丢人现眼，这几位“文盲”明星凭什么走红,2024-12-30 10:52,4629,1231,与君説,与君説,在阅读此文之前，麻烦您点击一下“关注”，既方便您进行讨论和分享，又能给您带来不一样的参与感，感谢您的支持文、编辑|小娄郭德纲曾说“可以没文凭，但不能没文化”。老郭的这句话在儿子郭麒麟身上体现得淋漓尽致。虽然郭麒麟初中就辍学了，但人家有思想有内涵，是个名副其实的“文化人”。,https://toutiao.com/group/7454151513221661234/,,0,0,False
山楂干泡水很多人都泡错了，难怪没用，今天教你正确做法，真管用,2024-11-02 11:46,7900,298,百变小厨坊,百变小厨坊,,https://toutiao.com/group/7432646945211941402/,,0,0,True
腐竹用清水和开水泡是大错，酒店大厨教我1招，快速柔软还不夹生,2024-11-06 11:49,6475,150,百变小厨坊,百变小厨坊,腐竹用清水和开水泡是大错，酒店大厨教我1招，快速柔软还不夹生,https://toutiao.com/group/7434132052506575394/,,0,0,True
