title,publish_time,like_count,comment_count,media_name,source,abstract,article_url,tag,is_yaowen,article_sub_type,has_video
一见·为何这件事，“任何时候都必须紧紧抓在手上”,2025-02-09 08:25,3171,1392,人民日报,人民日报,2月8日，习近平总书记在听取吉林省委和省政府工作汇报时指出，统筹发展和安全，任何时候都必须紧紧抓在手上。安全和发展是一体之两翼、驱动之双轮。从2014年首次提出总体国家安全观，到多个重要场合阐明发展和安全的辩证关系，习近平总书记对统筹发展和安全的高度重视，不言而喻。,https://www.peopleapp.com/column/30048214095-500006084397?utm_source=头条号&promote=true,,0,0,False
前六大省份经济总量合计近六十万亿元——地区经济迎难而上稳中有进,2025-02-09 22:50,564,262,中国经济网,中国经济网,来源：经济日报近期，各省份2024年经济成绩单陆续公布。在外部压力加大、内部困难增多的复杂严峻形势下，各地加力提效落实存量增量政策，地区经济运行总体平稳、稳中有进，多地经济总量取得新突破，七成省份增速超过或持平于全国水平。总量进阶盘点2024年地方经济年报，“突破”是一个高频词。,http://m.ce.cn/ttt/202502/10/t20250210_39286442.shtml,,0,0,False
为什么黑人特别受女人欢迎?听完30岁的少妇说完，我恍然大悟!,2025-02-10 06:33,552,205,简单的小鱼,简单的小鱼,,https://toutiao.com/group/7469674722171634203/,,0,0,True
影视：丑女相亲很满意，立马摘下眼镜脱掉衬衫，太惊艳,2025-01-25 02:07,2313,701,扒剧小妹儿,扒剧小妹儿,,https://toutiao.com/group/7463668758595453491/,,0,0,True
宋小宝撞上闫学晶，俩唱二人转的真人精！笑点疯狂往外抖,2025-01-06 03:43,6114,800,PP影视圈剧院,PP影视圈剧院,,https://toutiao.com/group/7456641563670676018/,,0,0,True
爆震发动机一打开，飞机直接没影了。,2025-02-10 02:41,10030,1622,橙子更新,橙子更新,,https://toutiao.com/group/7469615118813282857/,,0,0,True
身高171的金晨换上体操服！1米1的腿瞬间成焦点，一字马惊艳全场,2025-01-16 00:18,4977,919,青涩星空sn,青涩星空sn,,https://toutiao.com/group/7460300720655319586/,,0,0,True
喜事变乌龙，新郎尴尬走人,2025-02-02 06:00,43038,14509,蛀蟲,蛀蟲,,https://toutiao.com/group/7466697530655523343/,,0,0,True
媳妇玩到半夜才回来，以为老公不在家，进门这操作把老公看懵了,2025-01-24 09:38,10876,3056,滕菲,滕菲,,https://toutiao.com/group/7463414214191743497/,,0,0,True
公公竟然和儿媳偷情，哪料被妻子撞见，这下有戏看了！,2025-01-21 08:05,12337,1011,南瓜午夜厅,南瓜午夜厅,,https://toutiao.com/group/7462273852651979274/,,0,0,True
大叔8个女儿一个儿子，女儿个个貌美如花，儿子英俊帅气。,2025-01-27 00:09,6696,3802,霞霞情感正能量,霞霞情感正能量,,https://toutiao.com/group/7464380594751881791/,,0,0,True
男人目睹了妻子的偷情，下一秒情夫和妻子就遭到了他的制裁！,2025-01-23 09:05,7557,593,橙子影视吖6,橙子影视吖6,,https://toutiao.com/group/7463034403476734527/,,0,0,True
断奶三天的小奶娃，看到妈妈脱衣服时。,2025-02-09 05:39,6945,1132,沉思的录者,沉思的录者,,https://toutiao.com/group/7469289629905175059/,,0,0,True
李佩霞的颜值有多高？,2025-02-10 04:19,5118,1814,橘子不是唯一的水果,橘子不是唯一的水果,,https://toutiao.com/group/7469640214600811058/,,0,0,True
