title,publish_time,like_count,comment_count,media_name,source,abstract,article_url,tag,is_yaowen,article_sub_type,has_video
厨师长教你：“葱爆羊肉”羊肉滑嫩、鲜香不膻,2024-12-27 07:34,3587,658,美食作家王刚,美食作家王刚,厨师长教你：“葱爆羊肉”羊肉滑嫩、鲜香不膻,https://toutiao.com/group/7452991735665263139/,,0,0,True
突然！美联储，重磅发声！,2025-01-04 05:48,462,116,券商中国,券商中国,当地时间1月3日，美国里士满联储主席巴尔金在最新的讲话中表示，通胀上升的风险确实更大一些，工资和产品成本可能会面临压力，鉴于潜在的通胀上行风险，希望利率在更长时间内保持具有限制性。,https://toutiao.com/group/7455932570950205979/,,0,0,False
中日，一出好戏即将上演,2025-01-01 23:38,6283,6190,牛弹琴,牛弹琴,年终上演精彩大戏，新年不排除更有一出好戏。反正，从积极的角度看，中日关系，正处于近20年来最好时期。之所以能说最好，是因为之前实在是太糟。三个值得关注的动向。第一个动向，日本首相石破茂的表态。日前在接受电视访谈时，石破茂说：“日本首相访问中国是极为重要的事。,https://toutiao.com/group/7455091815717388850/,,0,0,False
河北菜市场火灾后续：致8死15伤，知情人爆料着火原因，当地通报,2025-01-04 11:05,550,211,三农一姐,三农一姐,新年刚到，河北一菜市场突然发生大火，造成8人死亡15人受伤的火灾事故，非常令人痛心!菜市场是用于批发蔬菜，或者是零售菜的地方，一般就是整上建一个大棚，大棚里就是一排排卖蔬菜、肉类、蛋类、水产海鲜类农副产品等的市场，这些不应该是着火的东西，而且菜市场也有很多的水。,https://toutiao.com/group/7456002865845305907/,,0,0,False
韩国派出特警队逮捕尹锡悦，驻韩美军下令护尹，安全部队强力阻挡,2025-01-04 07:57,27054,1697,邱毅台湾,邱毅台湾,,https://toutiao.com/group/7455966319511339570/,,0,0,True
刀郎北京演唱会最后10分钟：三首连唱，点燃爱国热情！,2024-12-31 14:37,24631,4770,哇事记,哇事记,,https://toutiao.com/group/7454585113318261288/,,0,0,True
石破茂亲中吗？,2025-01-03 13:55,9275,472,静思有我,静思有我,,https://toutiao.com/group/7455642885552079395/,,0,0,True
沈春阳笑死个人，满口胡说八道，小沈阳气得说不出话,2024-12-28 16:52,4657,739,乐视影视圈,乐视影视圈,,https://toutiao.com/group/7453290317240861199/,,0,0,True
后续！江西国道金溪之眼：儿媳打包行李回娘家，女婿身份被扒出,2024-12-31 06:31,269,312,吟古今的张清风,吟古今的张清风,文|张吹吹编辑|张吹吹“金溪最牛女婿，凭一己之力打碎小舅子的一夜暴富梦。”前有“海珠之眼”，没想到后脚还能有个“金溪之眼”，相信不少网友都在网上刷到了“金溪钉子户”。3年前政府准备拆迁修国道，为每户人家准备了将近200万的拆迁款和3套宅基地，对普通人家来说这已经是天大的富贵了。,https://toutiao.com/group/7454453112166826523/,,0,0,False
韦东奕采访被问：有收到过情书吗？耿直回答笑翻全场，韦神太逗了,2024-12-31 23:27,3656,450,开朗春风Lwh,开朗春风Lwh,,https://toutiao.com/group/7454721804150506024/,,0,0,True
安理会改革即将开始谈判，俄方点名两国不能入常，中国已作出选择,2025-01-04 08:49,5183,106,贺文萍,贺文萍,这一方面是因为现在的安理会在解决实际问题上存在缺陷，致使联合国在俄乌冲突、巴以冲突中没发挥多大作用;,https://toutiao.com/group/7455973155593552435/,,0,0,False
河南警察3岁女儿被拐，苦寻全国23年无果，结果却发现女儿在对门,2024-11-05 07:43,6235,669,八号探秘人,八号探秘人,寻亲23年无果，丢失的女儿竟住在对门?但它却真实发生在河南洛阳的梁绍波身上。是意外走丢，还是人贩子所为，三岁的女儿怎会离奇失踪?,https://toutiao.com/group/7433697108120142345/,,0,0,False
老纪和珅这段对话，以前小时候听不懂，如今听完受益终身,2024-12-28 23:16,5895,1722,乐视扒剧小妹儿,乐视扒剧小妹儿,,https://toutiao.com/group/7453420191947424293/,,0,0,True
苦口婆心！央视四天内就解禁烟花爆竹连续发声，重点提不要一刀切,2025-01-02 04:38,232,321,8卦娱,8卦娱,2024年已经过去了，不过在跨年夜当晚，很多网友都在分享自己跨年的同时，也有很多人认为已经缺少了很多年味儿了。,https://toutiao.com/group/7455172411600781858/,,0,0,False
云南乱不乱你们说了算,2024-12-16 07:47,934,276,十一丫,十一丫,,https://toutiao.com/group/7448913169675715083/,,0,0,True
100年前，清朝罕见留影，王爷妻妾婀娜多姿，乞丐全身挂满垃圾,2024-10-14 09:58,2978,332,万物知识局,万物知识局,每一张老照片，都像是时间的低语，它们静静地躺在历史的相册中，却在不经意间将我们拉回到那个遥远而神秘的年代。,https://toutiao.com/group/7425457574731579919/,,0,0,False
男子从老婆手中里解救出小三后，牵着狗头也不回的离开了,2024-11-20 09:07,41281,14181,橙橙分享,橙橙分享,,https://toutiao.com/group/7439285557244461606/,,0,0,True
男子相亲没想到碰到了初恋，火药味十足。缘分真是妙不可言！,2025-01-02 02:43,3968,1153,浪漫大爷,浪漫大爷,,https://toutiao.com/group/7455142306899886643/,,0,0,True
上海队教练透露奥运会内幕，王励勤亲自带队保障樊振东，细节曝光,2025-01-04 07:05,673,313,易霄寒,易霄寒,【前言】2024年底除了乒超联赛的激烈比拼之外，樊振东公开表示自己退出世界排名的事情也一直在舆论的热搜上。随着2024乒超总决赛落幕，让人遗憾的是，樊振东所在的上海队止步半决赛，樊振东自己也输给了王楚钦。,https://toutiao.com/group/7455941819814314496/,,0,0,False
被央媒怒批，目不识丁，丢人现眼，这几位“文盲”明星凭什么走红,2024-12-30 10:52,4534,1209,与君説,与君説,在阅读此文之前，麻烦您点击一下“关注”，既方便您进行讨论和分享，又能给您带来不一样的参与感，感谢您的支持文、编辑|小娄郭德纲曾说“可以没文凭，但不能没文化”。老郭的这句话在儿子郭麒麟身上体现得淋漓尽致。虽然郭麒麟初中就辍学了，但人家有思想有内涵，是个名副其实的“文化人”。,https://toutiao.com/group/7454151513221661234/,,0,0,False
新婚33天卷走274万4套房，出逃后丈夫跨国追捕，如今下场大快人心,2024-12-20 22:06,5183,268,八号探秘人,八号探秘人,在阅读此文之前，辛苦您点击一下“关注”，既方便您进行讨论和分享，又能给您带来不一样的参与感，感谢您的支持！编辑丨QQ·B“色字头上一把刀！”深圳富豪结婚33天竟被卷走274万元和名下4套房产。不仅如此，他还被扣上了“接盘侠”的帽子，啥也没干喜当爹。,https://toutiao.com/group/7450399558821052982/,,0,0,False
小子相亲故意扮老，谁知道对方一见面就叫他大爷，这段太逗了,2024-12-24 08:17,3659,843,乐视热播综艺精选,乐视热播综艺精选,,https://toutiao.com/group/7451886130837848610/,,0,0,True
厨师长教你：“家常肘子”口感耙糯 软烂入味 肥而不腻,2025-01-02 09:00,1791,244,美食作家王刚,美食作家王刚,厨师长教你：“家常肘子”口感耙糯 软烂入味 肥而不腻,https://toutiao.com/group/7455138904249893416/,,0,0,True
“六星街里还传来巴扬琴声吗……”狼戈、张英席合唱《苹果香》,2024-12-31 14:55,3275,155,央视频,央视频,,https://toutiao.com/group/7454589818538820115/,,0,0,True
不得不说，韩国再次创造了历史,2025-01-04 02:18,4245,497,牛弹琴,牛弹琴,未来三天，韩国不排除更有大戏上演,https://toutiao.com/group/7455879046824460854/,,0,0,True
98岁老郎中教我苹果养生新吃法，每天坚持这样吃，睡眠好，身体棒,2024-12-31 11:43,10985,1080,百变小厨坊,百变小厨坊,98岁老郎中教我苹果养生新吃法，每天坚持这样吃，睡眠好，身体棒,https://toutiao.com/group/7454540163725656628/,,0,0,True
女市长爱上小男友，俩人爱的轰轰烈烈，让女市长感到害怕,2024-12-18 08:13,2549,442,乐视经典热综回放,乐视经典热综回放,,https://toutiao.com/group/7449661362671714850/,,0,0,True
今年会举行阅兵仪式吗？我大胆作个猜测,2025-01-03 09:11,13399,1547,金灿荣教授,金灿荣教授,,https://toutiao.com/group/7455614288229728803/,,0,0,True
广西49岁老汉娶19岁姑娘，结婚21年生下15个孩子，如今有何下场？,2024-10-20 08:32,10432,1278,艺述史,艺述史,她19岁出嫁，21年里总共生育了15个孩子，其中4个男孩子11个女孩子，家里热闹的像是开了一所学校一样。,https://toutiao.com/group/7427400319418384948/,,0,0,False
苹果降价遇上国产机购新补贴落地，谁能抢占市场制高点？,2025-01-04 02:20,406,818,南方都市报,南方都市报,2025开年，数码消费市场迎来一则重磅消息。1月3日，国务院新闻办公室宣布购新补贴政策正式实施，将手机、平板、智能手表等数码设备纳入国家补贴范围。根据政策，消费者购买符合条件的设备可享受直接补贴，补贴金额根据产品类别和性能有所不同，最高可达数百元。,https://m.mp.oeeee.com/a/BAAFRD0000202501031041620.html,,0,0,False
历史最大泡沫快破裂！贵金属专家：黄金是投资者唯一避难所 TA是崩盘关键催化剂,2025-01-02 03:29,1378,414,金融界,金融界,贵金属专家、Goldmoney研究主管阿拉斯代尔·麦克劳德警告市场，全球金融体系正处于崩溃的边缘，历史上最大的经济泡沫快破裂，投资者的唯一避难所将是黄金。,http://m.jrj.com.cn/toutiao/2025/1/2/47026230.shtml,,0,0,False
罕见！一个月内官方三次明确上调养老金，2025养老金调整有惊喜？,2025-01-04 02:56,5084,2800,思之想之,思之想之,在一个月内，官方至少三次明确上调2025年养老金，这个频率是前所未有的，这传递了什么信号呢?思之想之发现，从2024年12月12日开始至今，在一个月内的时间里，官方至少三次明确提出上调2025年养老金。,https://toutiao.com/group/7455850117002691135/,,0,0,False
印度女主播：歼36和076是“光鲜新玩具”，能否生存都是问题,2025-01-02 09:28,3724,957,第一军情,第一军情,日前，在印度知名度非常高的美女主持人帕尔基-夏尔马在电视节目中，“锐评”了中国先进武器的“井喷”式亮相。夏尔马质疑中国六代机也好，新型两栖攻击舰也好，都是没经过实战考验的“纸老虎”，虽然看起来光鲜亮丽，但真打起来很可能露馅。,https://toutiao.com/group/7455247647847219749/,,0,0,True
人均月薪4万多、年终奖约20万的“卷王之王”，又要拓展版图了,2025-01-03 08:26,1172,401,凤凰网财经,凤凰网财经,在深圳，夜幕下的“天空之城”灯火通明，即便是晚上十点多，楼底下依旧有很多打车回家的工程师们，也有还在鏖战的研发人员。,https://toutiao.com/group/7455602227311280694/,,0,0,False
歼36首飞一周后，美军司令打破沉默：这是9·11以来最紧张时刻,2025-01-02 05:43,31814,107,阿尔法军事,阿尔法军事,歼36首飞一周后，美国印太司令部司令塞缪尔·帕帕罗作为“对华一线”最高指挥官发表了声明，他首先用两句话给整个声明定了调：一是中美要和平共处不要新冷战；二是美国无意与华进行军备竞赛。,https://toutiao.com/group/7455189778258985506/,,0,0,True
欧洲会爆发世界大战吗？俄乌2025年能否止战？|凤凰《非常2024》,2024-12-30 07:54,3180,215,凤凰卫视,凤凰卫视,,https://toutiao.com/group/7454110252754010664/,,0,0,True
我国哪里的面粉无添加？经对比，有这行字就是零添加，可以放心买,2025-01-02 10:44,2430,1064,鲸探所,鲸探所,面粉是我们日常生活中离不开的一种主食，在我国人们的餐桌上是有着非常重要的地位的。可以说，基本上家家户户都是需要用到面粉的，已经快到年下了，许多人也开始往家里置备年货了，而面粉，也是最重要的年货之一。,https://toutiao.com/group/7455263523673834024/,,0,0,False
三条腿的陈赓介绍对象这段，据说笑趴整个导演组，太搞笑了,2025-01-02 06:45,2033,424,南哥硬汉秀,南哥硬汉秀,,https://toutiao.com/group/7455192536127275539/,,0,0,True
印度没戏了！英国金融时报承认了,2025-01-04 09:30,6520,316,诚阅ChengYue,诚阅ChengYue,,https://toutiao.com/group/7455990226163335695/,,0,0,True
萝卜和鸡蛋这样做，比吃补药还补，顿顿吃都不会腻，又香又下饭,2024-10-30 12:28,72798,4419,小寒厨艺,小寒厨艺,萝卜和鸡蛋这样做，比吃补药还补，顿顿吃都不会腻，又香又下饭,https://toutiao.com/group/7431405463378919975/,,0,0,True
抗美援朝的将军亮相，全体明星自发起立，这幕太感人,2025-01-03 07:32,10356,1241,乐视天天剧好看,乐视天天剧好看,,https://toutiao.com/group/7455587633452843572/,,0,0,True
叙利亚前总统被谁下毒？俄如何打阿萨德这张牌，不只有交人不交人,2025-01-04 09:00,8471,1913,吕宁思,吕宁思,,https://toutiao.com/group/7455982500683186697/,,0,0,True
花9000万“润”到英国后，他成了“韭菜”,2025-01-04 11:04,1252,460,环球人物杂志,环球人物杂志,他在山西金融领域掀起一场惊涛骇浪，走上了一条不归路。作者：陈佳莉即将到来的农历新年，将是田文军夫妻在英国度过的第六个春节，但可能是一个无家可归的春节。他们所居住的位于伦敦汉普斯特德郊区的一处豪宅于近日被“充公”，这是他们刚来英国时的落脚地，一定意义上被视为新的家。,https://toutiao.com/group/7456014483631260194/,,0,0,False
清华才女李一诺：27岁博士毕业，4年生3娃，能替世界首富花钱,2024-12-18 05:51,8497,380,云莳一,云莳一,家庭是她第一个学校，妈妈是她第一任老师。李一诺27岁博士毕业进入美国麦肯锡公司，33岁成为公司全球董事合伙人，之后四年连生3娃。,https://toutiao.com/group/7449591069311779355/,,0,0,False
县长看不上乡长送的烟，给他退回来，乡长打开一看乐了,2024-11-13 08:16,11986,1982,乐视大综艺咖,乐视大综艺咖,,https://toutiao.com/group/7436672568578277925/,,0,0,True
小女孩上部队找爸爸，少校阿姨主动搭讪，谁知看到女孩父亲傻眼了,2024-12-23 16:01,3328,783,乐视群星访谈秀,乐视群星访谈秀,,https://toutiao.com/group/7451525814283960872/,,0,0,True
