title,publish_time,like_count,comment_count,media_name,source,abstract,article_url,tag,is_yaowen,article_sub_type,has_video
翟欣欣为了钱，竟然可以克服生理厌恶和苏某结婚，也真是个狠人,2025-01-22 09:22,4649,1305,乐见Talk,乐见Talk,索要千万逼死前夫的翟欣欣，认罪认罚！天理昭昭，报应不爽，迟到七年半的审判终于来了。本以为的一场婚姻纠纷，伴随着一封遗书解开了翟欣欣蛇蝎面目。,https://toutiao.com/group/7462559129823953442/,,0,0,False
女房东爱上24岁男租客，这样的话也说得出口，涂磊神助攻,2025-01-18 02:53,5105,239,金曲大荟萃,金曲大荟萃,女房东爱上24岁男租客，这样的话也说得出口，涂磊神助攻,https://toutiao.com/group/7461083095078044195/,,0,0,True
银行紧急通知：定期存款本息归还！,2025-01-22 01:25,3585,487,奶酪爱生活,奶酪爱生活,,https://toutiao.com/group/7462544695181328935/,,0,0,True
大叔去光棍家问他要不要老婆，以为是开玩笑，谁料真送来了,2025-01-23 16:01,2596,581,群星访谈秀,群星访谈秀,,https://toutiao.com/group/7460803397575311922/,,0,0,True
小姑子30岁不嫁人，天天就喜欢和哥哥腻在一起，嫂子忍无可忍爆发,2025-01-23 02:38,5038,1051,影视随意看,影视随意看,,https://toutiao.com/group/7462934734751007284/,,0,0,True
