title,publish_time,like_count,comment_count,media_name,source,abstract,article_url,tag,is_yaowen,article_sub_type,has_video
一习话丨“相信中国就是相信明天”,2025-04-09 12:01,915,165,央广网,央广网,特斯拉上海储能超级工厂正式投产，阿斯利康宣布斥资25亿美元在京投建全球研发中心，武田制药的数字医疗创新中心落子成都，西门子医疗全新研发制造基地项目在深圳奠基，德国蔡司在上海购地自建大中华区总部……今年以来，多家头部跨国企业锚定中国市场，“中国制造”正加快进阶为“中国智造”“中国研,https://www.cnr.cn/newscenter/local/dftj/20250409/t20250409_527128526.shtml,,0,0,False
中共中央、国务院印发重磅规划！,2025-04-09 02:19,3924,507,人民论坛网,人民论坛网,中共中央、国务院近日印发《加快建设农业强国规划》，亮出了当前和未来一个时期加快建设农业强国的路线图和施工图。,https://toutiao.com/group/7491131974501925411/,,0,0,False
听听在美国的华人说的，就知道这波关税让他们当地人有多难了！,2025-04-09 08:47,2481,529,世间美好录,世间美好录,,https://toutiao.com/group/7491232219051098643/,,0,0,True
直击老年公寓大火：知情人说20具尸体已无法辨认，一87岁老人清明回家逃过一劫,2025-04-10 03:19,1018,239,凤凰WEEKLY,凤凰WEEKLY,文丨王思思 李一鸣编辑丨雪梨王养老院的火灾总要比其他地方来得更残忍一些——被困住的，往往是那些连呼救都困难的老人。4月8日21时许，河北省承德市隆化县国恩老年公寓发生火灾。据初步统计，截至9日凌晨3时，火灾共造成20人死亡。,https://toutiao.com/group/7491517590850830888/,,0,0,False
“9岁女孩被老师砸伤头骨案”二审维持原判，妈妈发声：庭审前对方用凶狠的眼神盯着我和孩子,2025-04-10 04:41,159,383,九派新闻,九派新闻,4月10日，湖南省长沙市中级人民法院依法对宋雨明故意伤害案二审宣判，裁定驳回上诉，维持原判。长沙市岳麓区人民法院一审认定:2023年9月6日16时许，宋雨明开展课后服务期间，在多次制止、管束学生喧闹无效后，将半截三角尺扔向一吵闹学生，砸中该生前座刘某辰额部，致刘某辰重伤、九级伤残。,https://toutiao.com/group/7491539834486653440/,,0,0,False
三河市一医院红十字标识被刷绿后一天又遭整体拆除,2025-04-10 04:24,3129,6856,大象新闻,大象新闻,4月9日，男子发视频吐槽三河市禁用红色做招牌，连医院红十字都换成绿色，引发网友热议。4月10日，大象新闻记者就此事采访三河市卫健局，三河市卫健局一名工作人员称未接到医院更改红十字背景颜色的报备，并称如果城管要求更改颜色的话，卫健局会坚持使用红色作为红十字标识的背景色。,https://share.hntv.tv/news/0/1910186226675339265?track=tth,,0,1,False
全红婵太逗了：被问首拿第2名有何感想？耿直回答笑翻现场,2025-04-06 07:57,1679,434,十六月,十六月,,https://toutiao.com/group/7490106258968642058/,,0,0,True
出租车司机半路捡个姑娘，直接带回家，老婆一看反应笑翻了,2025-01-14 07:28,15848,691,钟意你,钟意你,,https://toutiao.com/group/7459669645180650024/,,0,0,True
新闻联播首次出现这种震撼动作,2025-04-08 04:59,2829,427,吹牛不用打草稿,吹牛不用打草稿,,https://toutiao.com/group/7490723374084145714/,,0,0,True
