title,publish_time,like_count,comment_count,media_name,source,abstract,article_url,tag,is_yaowen,article_sub_type,has_video
壹视界·微视频|从“嫦娥奔月”到“嫦娥”揽月,2025-02-14 07:46,789,378,人民日报,人民日报,‍‍‍‌‍‍‌天上月圆，人间团圆。想起“嫦娥奔月”，亦想起“嫦娥”揽月。二〇二五年新年贺词中，习近平主席点赞“嫦娥六号首次月背采样”等科技创新成果，“展现了中国人逐梦星辰大海的豪情壮志”。“探索浩瀚宇宙、和平利用太空，是中华民族的千年梦想和不渝追求。,https://www.peopleapp.com/column/30048259791-500006092562?utm_source=头条号&promote=true,,0,0,False
小姑子30岁不嫁人，天天就喜欢和哥哥腻在一起，嫂子忍无可忍爆发,2025-01-23 02:38,7733,1546,影视随意看,影视随意看,,https://toutiao.com/group/7462934734751007284/,,0,0,True
原配抓小三，男子从妻子手中解救小三头也不回的就走啦！！,2024-11-27 01:42,61607,11076,甜甜分享,甜甜分享,,https://toutiao.com/group/7441768400278028851/,,0,0,True
海南部分旅居人群成逃难大军，对于这样的生活，大家怎么看？,2025-02-09 10:48,2390,499,采云飘飘,采云飘飘,,https://toutiao.com/group/7469369555660309055/,,0,0,True
美国机器人跳舞，对比春晚机器人哪个更好？#机器人,2025-02-03 01:15,1120,754,微笑橙子j,微笑橙子j,,https://toutiao.com/group/7466995259948450313/,,0,0,True
各位家长一定要看好自己孩子，天下没有后悔药……,2025-02-10 03:14,3108,1307,平淡才是真,平淡才是真,,https://toutiao.com/group/7469623533899891226/,,0,0,True
又逼疯一个，都开始当街跳舞了,2024-11-24 22:23,95404,24759,玺蓥天下,玺蓥天下,,https://toutiao.com/group/7440974951316488755/,,0,0,True
《哪吒2》海外版  片段,2025-02-11 13:54,1693,378,治愈猪,治愈猪,《哪吒之魔童闹海》（海外版）是《哪吒之魔童降世》的续集，讲述了哪吒与敖丙在天劫之后灵魂得以保全，但肉身却岌岌可危的故事。,https://toutiao.com/group/7470159411818873371/,,0,0,True
生理课上，老师讲男孩生殖器官。生动形象。超负责!,2024-12-26 10:56,4693,202,小鱼分享,小鱼分享,,https://toutiao.com/group/7452672815855862313/,,0,0,True
