title,publish_time,like_count,comment_count,media_name,source,abstract,article_url,tag,is_yaowen,article_sub_type,has_video
大同订婚强奸案明日开庭，男方母亲称，双方在庭前会议上都提交了新证据,2025-03-24 08:37,474,1351,大河报,大河报,当日，大河报·豫视频《看见》记者从被告人席某某母亲郑女士处获悉，她作为公民辩护人与辩护律师殷清利共同出席，出席会议的还有三名大同市中级人民法院合议庭成员，以及大同市检察院两名检察员、一名检察官助理。,https://toutiao.com/group/7485292129682539034/,,0,0,False
DeepSeek推理:38岁无一技之长，不想上班，如何轻轻松松日入300,2025-02-18 08:00,1387,986,齐一琦,齐一琦,,https://toutiao.com/group/7472664398520238604/,,0,0,False
福耀科技大学公布了：首届招100人以内，年学费5460元！大四到境外名校学习一年，与剑桥、牛津、斯坦福等合作,2025-03-23 10:33,3396,1999,每日经济新闻,每日经济新闻,据《福州晚报》3月22日消息，今年该校计划招收100名以内学生，学费每年5460元，采取本硕博贯通培养模式，本科阶段将获得双学位。,http://www.nbd.com.cn/rss/jinri_toutiao/articles/3801145.html,,0,0,False
三星这2个设置太绝了‼️我要让所有人知道,2025-03-02 07:23,428,181,金陵凡凡,金陵凡凡,,https://toutiao.com/group/7477109351283442186/,,0,0,False
60岁的林忆莲身材发福，断崖式衰老，网友：自然老去依然很美,2025-03-13 03:28,346,127,快乐驿站,快乐驿站,,https://toutiao.com/group/7481109959724433931/,,0,0,False
上海七旬大爷被小18岁前妻强行提供性服务？法院驳回诉求,2025-03-24 00:50,5259,589,大皖新闻,大皖新闻,近日，家住上海徐汇区的王大爷向法院提出诉讼，请求确认他与林女士于2024年3月1日登记的婚姻无效。王大爷今年72岁，林女士54岁，两人相差18岁。,http://www.ahwang.cn/toutiao/202503/2827131.html,,0,1,False
美国排协官宣，事关郎平动向，5月份赴美国亮相，朱婷祝福,2025-03-23 07:30,726,221,寿光融媒,寿光融媒,原来，美国排协将于 5 月份在 DENVOR 举办一场盛大的名人堂授奖仪式，郎平荣获 “2025 年全能教练” 这一殊荣。,https://toutiao.com/group/7484903801456722466/,,0,0,False
一婚娶央视主持人，二婚娶演员，三婚娶小30岁美女，64岁终于当爹,2025-01-10 01:04,3023,532,安德烈的笔记,安德烈的笔记,都说导演爱找女演员，那下面这位导演更是了不得:一婚娶了央视主持人，二婚娶了知名演员，63岁第三次结婚又娶了33岁的美女演员。,https://toutiao.com/group/7458085924157653541/,,0,0,False
