title,publish_time,like_count,comment_count,media_name,source,abstract,article_url,tag,is_yaowen,article_sub_type,has_video
时政微观察丨担负新的文化使命 铸就中华文化新辉煌,2024-10-07 09:48,3619,2241,央视新闻,央视新闻,9月10日，秦岭脚下，陕西宝鸡青铜器博物院内，习近平总书记在国宝级青铜器何尊前停下脚步，久久注视。习近平总书记感慨:“中华文明五千年，还要进一步挖掘，深入研究、阐释它的内涵和精神，宣传好其中蕴含的伟大智慧，从而让大家更加尊崇热爱，增强对中华文明的自豪感，弘扬爱国主义精神，把中华优秀传统文化一代一代传下去。”,https://content-static.cctvnews.cctv.com/snow-book/index.html?item_id=15642223879354546871&source=50006&sub_source=50006_001,,0,0,False
美股普跌中概股V型反转上涨！A股大涨十月开门红！银行存款搬家忙,2024-10-07 23:40,3325,467,股帮,股帮,,https://toutiao.com/group/7423182731925783066/,,0,0,True
今天才知道！电动车“每天充”和“用完再充”，到底哪个更伤电池,2024-08-27 11:19,9073,1804,鲸探所,鲸探所,“今天到底给车充不充电？”估计大多数人每天回家都会想这个问题，看着自己的电动车电量又多又少的，充不充电也是一件非常难以抉择的事情。那么，电动车到底应该怎样充电呢？是每天都充，还是用完之后再充呢？电动车充电不管是在城市还是农村，电动车其实都是人们出门最常见的交通工具。,https://toutiao.com/group/7407773012533117475/,,0,0,False
奉陪到底，解放军报发出统一强音，台上将发现，大陆在等锁岛时机,2024-10-06 10:00,1772,223,强武堂,强武堂,最近，台海军“司令”唐华的一番话，直接引起了岛内热议，他说解放军已掌控台海，正以“蟒蛇战术”困住台湾，只要等到一个时机，便可随时进行全岛封锁。,https://toutiao.com/group/7422599740354789929/,,0,0,False
打脸了！中国高铁被踢出保加利亚后，如今西班牙无法交付取消项目,2024-10-06 03:53,701,171,开心营业厅,开心营业厅,前言今年3月，中国中车参与竞标保加利亚高铁项目，可没过多久，欧盟却以《外国补贴条例》，将我国高铁踢出了保加利亚。我国企业退出之后，西班牙高铁公司“趁胜追击”，用花言巧语俘获了保加利亚的“芳心”，可没想到的是，打脸实在来得太快！,https://toutiao.com/group/7422502205620273703/,,0,0,False
表面是艺人，实际是富家千金的5位女星，无人敢惹更别说潜规则了,2024-08-28 02:06,10027,801,八号探秘人,八号探秘人,在德云班主郭德纲的作品中，有过这么一句话。虽说此言尤为刺耳，但话糙理不糙。当今娱乐圈，很多女星为出人头地，自愿或被迫做出违反道德底线之事。,https://toutiao.com/group/7407984985224872459/,,0,0,False
2013年，湖南26岁女孩嫁给71岁老头，婚后还生下一子，如今怎样了,2024-07-12 11:59,27679,2468,智史通鉴,智史通鉴,2013年4月17日，长沙宁乡县的民政局迎来了一对特殊的夫妻。一个71岁的老头和一个26岁的女孩，离远了看，甚至像爷爷和孙女。面对工作人员异样的眼光，女孩说：“我和他是真心相爱的！”这让人好奇，这对相差45岁的夫妻，他们之间到底有着怎样的爱情故事？,https://toutiao.com/group/7390696631223534120/,,0,0,False
初中毕业去当流水线女工，五年后却成为世界冠军，22岁成人生赢家,2024-08-02 10:46,6359,1217,豆莱说,豆莱说,文：豆莱说编辑：豆莱说支持作者，写作不易，文中会有5s广告，观看后可免费阅读全文父母曾设想过子女的千百种可能，只是对于一个走上中专之路的孩子，无非也是毕业，打工，进工厂，养家糊口。,https://toutiao.com/group/7398489613888766475/,,0,0,False
男子与女子在河中嬉戏玩耍，突然连续将女子的头按入水中,2024-09-26 04:40,1316,168,经视看天下,经视看天下,,https://toutiao.com/group/7418807108637819444/,,0,0,True
10月7日，一切都杀红眼了,2024-10-07 23:40,606,247,牛弹琴,牛弹琴,10月7日，改变中东历史的一天，又是血腥杀戮的一天。在世界各地，人们在纪念一年前的惨剧；在中东，杀戮在继续，一切真杀红了眼。这一天，在打了整整一年的加沙，以色列继续对哈马斯目标发动猛烈空袭，至少11人死亡。不少平民，据说还被埋在废墟下。这是当今世界最凄惨的一幕。,https://toutiao.com/group/7423182272100057651/,,0,0,False
刀郎发表了声明，大家应该恢复冷静,2024-10-07 02:11,1560,2750,一心一意花猫1naWC4,一心一意花猫1naWC4,,https://toutiao.com/group/7422850505280094772/,,0,0,True
她是央视最惨主持人，男友被判死缓，丈夫诈骗入狱，47岁无人敢娶,2024-08-27 23:30,2187,207,闻书识焉,闻书识焉,她曾是央视的台柱子，和董卿、周涛并称为央视的三朵金花。回顾刘芳菲的前半生，最令人感到惋惜的，便是她的感情生活，47岁至今无人敢娶。,https://toutiao.com/group/7407743113688564258/,,0,0,False
5年前站在美国军舰上，用中文警告我国海军的华人女兵，现在如何,2024-10-06 09:06,1583,210,陈志华观天下,陈志华观天下,2019年，华裔女兵郑浩儿站在一艘美国军舰上，用一口标准的中文喊话威胁中国海军:“我们只是正常巡视，再往前一步，我们不介意发动战争!”,https://toutiao.com/group/7422585983588024883/,,0,0,False
写歌30年穷困潦倒，前妻失望选择离婚，谁料51岁靠一首歌一夜成名,2024-08-12 03:37,25030,4022,八号探秘人,八号探秘人,在阅读此文之前，辛苦您点击一下“关注”，既方便您进行讨论和分享，又能给您带来不一样的参与感，感谢您的支持！编辑：LY无数人都想要一个一夜成名的机会，但机会来了也不是每个人都能把握住的。他用了三十年的时间来准备迎接属于自己的机会。为了这个机会他放弃了一切，甚至包括家庭。,https://toutiao.com/group/7402090890367484428/,,0,0,False
善恶终有报！疫情时对中国一毛不拔，却大方捐美国6亿，现状如何,2024-10-06 06:09,917,194,昕昕局,昕昕局,SOHO中国的董事长潘石屹和其夫人张欣，在2014年向哈佛大学捐赠了1500万美元，这还不算什么，潘石屹的基金会甚至还计划要捐赠1亿美元!,https://toutiao.com/group/7422540167589708288/,,0,0,False
演员张瑜：离婚后单身30年，再见前夫仍感到心动，66岁没有子女,2024-07-24 10:51,17650,1248,八号探秘人,八号探秘人,在阅读此文之前，辛苦您点击一下“关注”，既方便您进行讨论和分享，又能给您带来不一样的参与感，感谢您的支持！写作不易，作者每天辛苦写稿，只是为了养家糊口，希望各位观众老爷可以多多理解。文中加入5秒广告解锁，观看5秒后便可免费阅读全文啦，感谢各位观众老爷的理解与支持！,https://toutiao.com/group/7395130917804720640/,,0,0,False
2024年湖北晨跑女遇害案，张虎执行死刑，临刑时浑身哆嗦跪地痛哭,2024-08-28 10:45,1332,300,文史烟云,文史烟云,2024年2月19日，作恶多端的张虎即将被执行死刑，曾经天不怕地不怕的罪犯，此刻却是止不住的颤抖，甚至跪地求饶，祈求再给他一次机会。,https://toutiao.com/group/7408139221095842338/,,0,0,False
为国争光却遭郎平弃用！转身效力土耳其的王一梅，如今咋样了？,2024-08-31 13:19,937,143,豆莱说,豆莱说,光阴似箭，日月如梭，当初的少女早已退役，成为了排球场的幕后人，这么多年她都经历了什么，现在又怎么样了呢?,https://toutiao.com/group/7409287778514567718/,,0,0,False
猛烈轰炸！已致超1100人死亡！这一国，面临严重危机,2024-10-07 07:20,311,196,红星新闻,红星新闻,当地时间6日，黎巴嫩看守总理纳吉布·米卡提会见了来访的联合国难民事务高级专员菲利普·格兰迪。米卡提要求以色列停止侵略黎巴嫩，并呼吁立即停火。格兰迪表示，以色列对黎巴嫩的多次袭击违反了国际人道主义法，且由于以色列在黎巴嫩不断升级的空袭，黎巴嫩正面临“严重的流离失所危机”。,https://toutiao.com/group/7422930046966383156/,,0,0,False
张小斐被写入北影喜剧教材的封神名场面！吃饭时千万别看，会笑喷,2024-09-30 06:00,10491,1341,欢乐每一添,欢乐每一添,张小斐被写入北影喜剧教材的封神名场面！吃饭时千万别看，会笑喷,https://toutiao.com/group/7420312039739884066/,,0,0,True
美军有能力打赢解放军吗？俄媒：两军差距大，除兵员其他全是劣势,2024-10-06 01:54,2765,812,朝子亥,朝子亥,美军有能力打赢解放军吗？俄媒：两军差距大，除兵员其他全是劣势,https://toutiao.com/group/7420434190144897545/,,0,0,True
"中俄未出手,西方各国就开始打起来了。",2024-10-05 13:40,4905,269,夕阳产业,夕阳产业,,https://toutiao.com/group/7422285915604648475/,,0,0,True
万万没想到，35岁杨颖兜兜转转干回“老本行”，活成内娱最大笑话,2024-09-16 02:41,250,171,八号探秘人,八号探秘人,“一失足成千古恨”，这句话用在她的身上，显得格外贴切。当别人35岁还在想办法红的时候，她就已经经历了从“嫩模”到“顶流”再到“嫩模”的轮回。,https://toutiao.com/group/7414910623407931923/,,0,0,False
紧跟美国，新西兰军舰刚闯台海，求锤得锤？外媒：支援舰突发沉没,2024-10-06 01:40,1151,168,烽火前站,烽火前站,新西兰海军的规模非常小，仅有10艘左右的军舰，除了安扎克级导弹护卫舰之外，就是一些后勤舰船，不过新西兰却敢于在台岛问题上公然发起挑衅。,https://toutiao.com/group/7422465354448568851/,,0,0,False
富士康“赌输”了！郭台铭做梦也没有想到，“制裁”会来的这么快,2024-10-07 08:28,2388,207,议史纪,议史纪,,https://toutiao.com/group/7422947835361886731/,,0,0,True
善恶终有报！66岁“消失”了的陈宝国，可谓是娱乐圈的悲哀与损失,2024-09-27 06:29,2126,131,八号探秘人,八号探秘人,“我真的挺不喜欢听艺人这个词，前两年听得我一个劲儿地倒胃口”。当很多人挤破脑袋想要进娱乐圈当一名艺人的时候，他却说了这样一句话。,https://toutiao.com/group/7419206100681114153/,,0,0,False
中国🇨🇳人民的好总理,2024-09-03 15:46,204627,21660,话说,话说,这个老人一生只做一件事，那就是为了人民鞠躬尽瘁，死而后已,https://toutiao.com/group/7410443709928210955/,,0,0,True
