title,publish_time,like_count,comment_count,media_name,source,abstract,article_url,tag,is_yaowen,article_sub_type,has_video
喜事变乌龙，新郎尴尬走人,2025-02-02 06:00,34841,11945,蛀蟲,蛀蟲,,https://toutiao.com/group/7466697530655523343/,,0,0,True
宋小宝上春晚多年，这是公认最牛的一个小品！笑点杠杠的,2025-01-19 00:24,11819,2462,潜伏剧院,潜伏剧院,,https://toutiao.com/group/7460858238515380751/,,0,0,True
媳妇玩到半夜才回来，以为老公不在家，进门这操作把老公看懵了,2025-01-24 09:38,10176,2900,滕菲,滕菲,,https://toutiao.com/group/7463414214191743497/,,0,0,True
村花看上单身汉，又是送毛巾又是送粽子的，这下有好戏看了,2025-02-04 05:41,3204,737,明星太秀了,明星太秀了,,https://toutiao.com/group/7467434883494494732/,,0,0,True
有这样的老婆，你家祖坟都冒青烟了！,2025-02-04 03:11,48030,8631,乐观的冰淇淋I,乐观的冰淇淋I,,https://toutiao.com/group/7467226170908606976/,,0,0,True
美国又坠机一架！犹如导弹袭击，事发美国费城，多角度视频曝光,2025-02-01 03:41,10449,2646,孟莉服装劳保店,孟莉服装劳保店,,https://toutiao.com/group/7466290541097927208/,,0,0,True
女子回村遇儿时要娶自己的男生，上前打招呼被嫌弃，下一幕更扎心,2024-12-28 01:40,1904,305,黄石融媒发布,黄石融媒发布,,https://toutiao.com/group/7453271656836891162/,,0,0,True
老公冷战生气不吃饭，媳妇过去哄老公吃饭，结果掀开被子气冒烟了,2025-01-31 09:58,5296,356,财万万,财万万,,http://toutiao.com/item/7466016930663662143/,,0,0,True
丈夫把媳妇借给大哥生娃，老婆从不乐意到心甘情愿，太痛苦 。,2025-02-03 09:42,4427,213,乐视多啦a梦道具大全,乐视多啦a梦道具大全,,https://toutiao.com/group/7467125801625698879/,,0,0,True
你想多了，看看在美华人怎么说遣送！,2025-02-02 16:08,1006,585,小梁纪实,小梁纪实,,https://toutiao.com/group/7466854165734507060/,,0,0,True
还是二叔会心疼人，害怕晓薇感冒，把晓薇的脚放到自己胸膛取暖,2025-02-01 06:11,2667,847,乐视谍战影视营,乐视谍战影视营,,https://toutiao.com/group/7466298269832905268/,,0,0,True
