title,publish_time,like_count,comment_count,media_name,source,abstract,article_url,tag,is_yaowen,article_sub_type,has_video
冬季自驾游，零下四十度睡车里，半夜冻醒了，车里全部冻住了！,2024-12-13 11:02,13570,2891,旅行者小多,旅行者小多,,https://toutiao.com/group/7447850219347116544/,,0,0,True
弟弟光荣退伍，姐姐兴奋去车站接他，怎料一见弟弟瞬间哭了,2024-11-05 06:34,39185,3248,乐视天天剧好看,乐视天天剧好看,,https://toutiao.com/group/7433679820573934091/,,0,0,True
中央定调！2025年养老金双增长，养老金领取条件有变，一类人不涨,2024-12-14 08:18,4656,385,思之想之,思之想之,2025年养老金调整最新消息来了，中央已经定调，2025年养老金将迎来双增长。另外提醒大家，2025年起养老金领取条件有变，一类人不参加2025年养老金调整，具体是什么呢？一起来了解。,https://toutiao.com/group/7448174128252682788/,,0,0,False
河南警察3岁女儿被拐，苦寻全国23年无果，结果却发现女儿在对门,2024-11-05 07:43,4880,561,八号探秘人,八号探秘人,寻亲23年无果，丢失的女儿竟住在对门?但它却真实发生在河南洛阳的梁绍波身上。是意外走丢，还是人贩子所为，三岁的女儿怎会离奇失踪?,https://toutiao.com/group/7433697108120142345/,,0,0,False
冬季骑行西藏，害怕有狼借宿废弃小屋，还有柴火炉可以取暖做饭吃,2024-12-16 03:59,32331,4514,刘伟元的旅行,刘伟元的旅行,,https://toutiao.com/group/7448551716082942505/,,0,0,True
拜登下台前遭到中国“致命一击”，昔日遏华大招让全世界看了笑话,2024-12-20 09:00,7175,101,评论员杜平,评论员杜平,,https://toutiao.com/group/7450416385311638054/,,0,0,True
2024年中国的房价见底了吗？,2024-12-19 06:41,4296,194,温义飞的急救财经,温义飞的急救财经,,https://toutiao.com/group/7450009540067590692/,,0,0,True
给《我是刑警》演技最好的10位演员排座次：于和伟第3，第1没争议,2024-12-18 04:06,639,165,皮皮电影,皮皮电影,《我是刑警》收官之际，网上的争议，却也多了不少。有人盛赞它是“近10年最硬核刑侦剧”，老派纪实的剧作风格，令人着迷。受其影响，很多观众开始追起了二十多年前的《中国刑侦1号案》《12·1枪杀大案》。有人评价它“高开低走”。,https://toutiao.com/group/7449562650628866595/,,0,0,False
沙利文的结局已定，他在离开白宫之前，说出了中美发生战争的结果,2024-12-16 02:48,14239,866,全荃,全荃,沙利文的结局已定，他在离开白宫之前，说出了中美发生战争的结果,https://toutiao.com/group/7448833372408775187/,,0,0,True
重磅！国家已释放5个重磅信号，2025年中国将迎惊天动地的大机会,2024-12-17 13:20,4344,515,占豪,占豪,这一年，因战乱而死的人估计数十万，巴以冲突、俄乌战场，人可能瞬间就没了，当地老百姓生活也是真的苦，叙利亚以前还能吃免费大饼，现在连免费大饼也没了，巴勒斯坦早就没大饼吃了······说心里话，和纷乱的世界相比，不得不感叹和平真好!,https://toutiao.com/group/7449369382092718629/,,0,0,False
美国遣返中国非法移民？他们跟中国已经没关系了，爱到哪到哪,2024-12-14 01:05,28653,5170,金灿荣教授,金灿荣教授,,https://toutiao.com/group/7447851020526289423/,,0,0,True
67岁执意生娃，如今却坐轮椅无法自理，5岁的天赐被迫独立学洗衣,2024-11-04 10:32,9493,2137,睿之悦,睿之悦,2019年，已经67岁的田新菊执意生下了自己的第三个孩子小天赐。那么，现如今5年的时间过去了，这“天赐”的礼物到底是福还是祸呢?,https://toutiao.com/group/7433367394946384435/,,0,0,False
郜春海：低空经济的发展空间远超新能源，颠覆未来商业模式,2024-12-19 08:10,2920,643,凤凰网财经,凤凰网财经,,https://toutiao.com/group/7450032423821115914/,,0,0,True
郜春海：马斯克具有超强的解构能力,2024-12-19 08:11,2523,565,凤凰网财经,凤凰网财经,,https://toutiao.com/group/7450032592033841675/,,0,0,True
尹锡悦要弹劾下台，还得过宪法法庭这关卡，要进监狱关键在三个人,2024-12-17 09:51,10444,145,邱毅台湾,邱毅台湾,,https://toutiao.com/group/7449316198883263026/,,0,0,True
美电动车产业遇“寒冬”，多重限制升级，特朗普此举，意在何为？,2024-12-17 06:55,14484,248,邱震海,邱震海,,https://toutiao.com/group/7449270863540519465/,,0,0,True
3%的存款利率重出江湖，银行年底全力火拼，客户错过再等一年,2024-12-16 06:03,1494,155,议史纪,议史纪,大家都知道，今年各大银行的存款利率已经不断下调三次，有些民营银行和小银行更是多次下调存款利率，最直接的结果就是，年终存款量目标无法达成。,https://toutiao.com/group/7448884806307398156/,,0,0,False
女子被多人密谋灌醉强奸后投江自尽，生前在手机备忘录记下被胁迫经过，三男子获罪,2024-12-18 16:40,11310,9326,红星新闻,红星新闻,投河自尽前，黄某某于2023年7月4日在其手机内创建了备忘录，记录下了她被胁迫的经过，这也成为了公检法日后侦查、起诉和判决的重要物证。,https://cdsbrss.cdsb.com/toutiao_no_video.php?url=https%3A%2F%2Fstatic.cdsb.com%2Fmicropub%2FArticles%2F202412%2Fc6419feb940b5f2c2302f01847e73bb8.html,,0,0,False
马光远：东南沿海一带的小城市被严重低估 #财经大咖来了,2024-12-17 06:17,6609,337,光远看经济,光远看经济,,https://toutiao.com/group/7449261133652820518/,,0,0,True
马光远：东南沿海小城市被严重低估 年轻人尽早放下北上广深执念,2024-12-17 06:30,3085,602,每日经济新闻,每日经济新闻,,https://toutiao.com/group/7449229105741955594/,,0,0,True
俄罗斯的决心很大，俄乌冲突可能到了最危险的时刻,2024-12-20 11:34,3209,251,金灿荣教授,金灿荣教授,,https://toutiao.com/group/7450456114459574820/,,0,0,True
今天解锁一个皮蛋的神仙吃法 #妈呀太香了 #皮蛋的神仙吃法,2024-12-11 09:40,5859,365,家常的味道,家常的味道,,https://toutiao.com/group/7447086779884110346/,,0,0,True
包厢全是刚出狱的恶霸，结果一看到饭店主厨，立马怂了,2024-11-11 01:21,13223,364,乐视群星访谈秀,乐视群星访谈秀,,https://toutiao.com/group/7435825833048015400/,,0,0,True
郭有才：当迷失方向忘记初心后，曾经飘得多高，如今摔得就多惨,2024-11-11 06:53,1956,847,八号探秘人,八号探秘人,在阅读此文之前，辛苦您点击一下“关注”，既方便您进行讨论和分享，又能给您带来不一样的参与感，感谢您的支持！编辑丨brt因为一首翻唱，他一夜之间成为了拥有千万粉丝的网红。但是“人红是非多”，不久他就因为版权等问题陷入了舆论风波。他的人气一落千丈，从万众瞩目变成了现在的无人问津。,https://toutiao.com/group/7435901170239078948/,,0,0,False
温州多家私人影院“可触摸服务人员隐私部位”？记者暗访后报警！警方：已对三个场所行政立案,2024-12-17 08:00,13239,3889,大风新闻,大风新闻,挂着“私人影院”的招牌，线上招徕生意，线下如同幽灵，连地址都是虚假的，居然还设“暗室”对付查处。近日，有网民向大皖新闻反映，在浙江省温州市一些颇受年轻人青睐的私人影院，悄然滋生了一些涉黄服务。,https://toutiao.com/group/7449286844203713062/,,0,0,False
炸肉丸子，到底用淀粉还是面粉，教你一招，外酥里软超好吃,2024-10-01 09:23,6931,539,家常的味道,家常的味道,,https://toutiao.com/group/7420735473208787492/,,0,0,True
女友怀孕了，男友不装了，带她回豪宅！,2024-11-23 08:01,17882,1304,乐视大综艺咖,乐视大综艺咖,,https://toutiao.com/group/7440353629540483593/,,0,0,True
丈母娘觉得女婿没本事，谁料去他单位一看，被女婿官威吓傻,2024-11-25 02:07,1039,226,南瓜最前线,南瓜最前线,,https://toutiao.com/group/7441032711340294696/,,0,0,True
厨师长教你：“羊肉汤”汤质优美，营养丰富；不膻不腥，味道鲜美,2024-11-21 02:57,6126,707,美食作家王刚,美食作家王刚,厨师长教你：“羊肉汤”汤质优美，营养丰富；不膻不腥，味道鲜美,https://toutiao.com/group/7439561371424915994/,,0,0,True
明天就是冬至，大家千万要牢记，2不露3不睡，很多人都忽略了,2024-12-20 08:36,1301,184,小李聊生活,小李聊生活,#冬至快乐#经验分享#健康生活#口播#冬至,https://toutiao.com/group/7450410247455244815/,,0,0,True
毛人凤下令带走死囚，哪料死囚的靠山露面了，毛人凤当场懵了,2024-11-25 03:05,12278,2175,南哥硬汉秀,南哥硬汉秀,,https://toutiao.com/group/7441047753771188799/,,0,0,True
土豆搭配洋葱，教你一个神仙吃法，一次3斤不够吃，太解馋了,2024-09-26 09:09,38500,2280,家常的味道,家常的味道,土豆搭配洋葱，教你一个神仙吃法，一次3斤不够吃，太解馋了,https://toutiao.com/group/7418876506660667904/,,0,0,True
这绝对是我吃过最好吃的蒜蓉蒸鸡做法,2024-11-11 12:49,3782,311,天天相见厨房(阿见),天天相见厨房(阿见),,https://toutiao.com/group/7436003114588570123/,,0,0,True
