title,publish_time,like_count,comment_count,media_name,source,abstract,article_url,tag,is_yaowen,article_sub_type,has_video
坚实的步伐丨“老百姓的事情是最重要的事情”,2024-12-24 07:01,2568,2584,央视新闻,央视新闻,“我到地方考察，总要到农村、城市社区，看看人民群众生活得怎么样，有什么好的经验可以交流推广，有什么操心事、烦心事需要我们解决。”,https://content-static.cctvnews.cctv.com/snow-book/index.html?item_id=9345052810586479115&source=50006&sub_source=50006_001,,0,0,False
新思想引领新征程丨以科技创新引领产业创新 激发创造活力,2024-12-24 11:53,412,192,央视新闻,央视新闻,习近平总书记指出，推进中国式现代化，科学技术要打头阵，科技创新是必由之路。2024年，我国科技实力持续增强，创新型国家建设成果丰硕，科创投入持续增加，国家创新体系更加健全，科技创新成果不断涌现，科技产出量质齐升。今天的中国，正向着世界科技强国的宏伟目标阔步前进。,https://content-static.cctvnews.cctv.com/snow-book/index.html?item_id=6084633799084154600&source=50006&sub_source=50006_001,,0,0,False
郜春海：低空经济的发展空间远超新能源，颠覆未来商业模式,2024-12-19 08:10,2929,646,凤凰网财经,凤凰网财经,,https://toutiao.com/group/7450032423821115914/,,0,0,True
益生菌真的那么神奇吗？有关益生菌的几个误区 你“踩雷”了吗？,2024-12-07 02:35,1789,104,央视频,央视频,,https://toutiao.com/group/7445492942887715365/,,0,0,True
财政部明确，明年适当提高退休人员基本养老金，哪些人员能多涨？,2024-12-24 10:44,647,507,暖心财经说,暖心财经说,近日，全国财政工作会议如期在年底召开，再次明确了中央经济工作会议精神，2025年将继续适当提高退休人员基本养老金，企业退休人员养老金将迎来第21连涨，也将是企业和机关事业单位退休人员养老金统一调整的第十年。,https://toutiao.com/group/7451920368798892544/,,0,0,False
河南警察3岁女儿被拐，苦寻全国23年无果，结果却发现女儿在对门,2024-11-05 07:43,5380,609,八号探秘人,八号探秘人,寻亲23年无果，丢失的女儿竟住在对门?但它却真实发生在河南洛阳的梁绍波身上。是意外走丢，还是人贩子所为，三岁的女儿怎会离奇失踪?,https://toutiao.com/group/7433697108120142345/,,0,0,False
抵抗20年全白费？巴内战、伊妥协、俄撤军，伊朗当局愧对苏莱曼尼,2024-12-24 08:43,197,130,东方点兵,东方点兵,巴勒斯坦突发内战，阿萨德政权崩溃伊拉克妥协，以色列趁机出击，战局逆转大赢特赢，俄罗斯被迫撤军，苏莱曼尼苦心构建对以包围网全被戳破，伊朗当局愧对苏莱曼尼?,https://toutiao.com/group/7451894189677101568/,,0,0,False
一剪到底《继母》韩片狗血的剧情,2024-09-27 09:40,5351,115,changsuoyu,changsuoyu,,https://toutiao.com/group/7419255448529797643/,,0,0,True
孙女在爷爷公司实习，各种怼爷爷，惊得公司高层乍舌,2024-11-07 13:31,46407,1596,一心一意水滴f,一心一意水滴f,孙女在爷爷公司实习，各种怼爷爷，惊得公司高层乍舌,https://toutiao.com/group/7434529524655751720/,,0,0,True
波司登回应羽绒裤仅3克绒：绒跟绒不一样，我们用的绒朵没杂质,2024-12-24 08:13,514,1826,新京报,新京报,新京报贝壳财经讯（记者李铮 王恺一）12月24日，新京报贝壳财经记者获悉，有消费者在社交媒体发文展示自己与波司登某专卖店客服的对话，其中提到该品牌一条售价700多元的羽绒裤，充绒量只有3克。,https://m.bjnews.com.cn/detail/1735027984168035.html,,0,0,False
蛇年纪念币钞难抢？还能捡漏吗？多家银行回应,2024-12-24 08:29,150,430,中新经纬,中新经纬,中新经纬12月24日电 (周奕航 李自曼)“根本预约不到，刚进入页面就显示没有额度”“没抢到纪念币，但抢到纪念钞了，美滋滋”“蛇年纪念币这么难抢吗？全军覆没”……23日晚10点，2025年贺岁普通纪念币和2025年贺岁纪念钞预约正式开启，“蛇年纪念币好难抢”等相关话题登上热搜。,http://www.jwview.com/jingwei/html/12-24/613625.shtml,,0,0,False
该不该取消公摊？住宅以套内面积交易或成趋势,2024-12-24 23:30,148,155,人民日报,人民日报,当我们聊起家里的住房面积有多大时，习惯说房本上记载的建筑面积。但大家心里都清楚，实际的使用面积要在建筑面积上打个百分之二十几甚至更多的折扣。建筑面积和套内使用面积之间的差额，通常被称为公摊。近日，湖南省衡阳市明确，从2025年开始，商品房实行按套内建筑面积计价销售。,https://www.peopleapp.com/column/30047810775-500006012142?utm_source=头条号&promote=true,,0,1,False
笑得肚子疼夫妻搞笑对话，一个我都对付不了，还想三妻四妾,2024-12-20 23:56,5952,210,悠悠情感正能量,悠悠情感正能量,,https://toutiao.com/group/7450647187001705011/,,0,0,True
弟弟光荣退伍，姐姐兴奋去车站接他，怎料一见弟弟瞬间哭了,2024-11-05 06:34,41563,3342,乐视天天剧好看,乐视天天剧好看,,https://toutiao.com/group/7433679820573934091/,,0,0,True
县长看不上乡长送的烟，给他退回来，乡长打开一看乐了,2024-11-13 08:16,10419,1725,乐视大综艺咖,乐视大综艺咖,,https://toutiao.com/group/7436672568578277925/,,0,0,True
萝卜和鸡蛋这样做，比吃补药还补，顿顿吃都不会腻，又香又下饭,2024-10-30 12:28,68426,4200,小寒厨艺,小寒厨艺,萝卜和鸡蛋这样做，比吃补药还补，顿顿吃都不会腻，又香又下饭,https://toutiao.com/group/7431405463378919975/,,0,0,True
全球最大电磁弹射无人机航母，两栖攻击舰 076即将下水,2024-12-22 09:48,27501,1241,杜文龙,杜文龙,,https://toutiao.com/group/7451170777983877632/,,0,0,True
给《我是刑警》演技最好10位演员排座次：于和伟第3，第1名没争议,2024-12-18 04:06,2206,399,皮皮电影,皮皮电影,《我是刑警》收官之际，网上的争议，却也多了不少。有人盛赞它是“近10年最硬核刑侦剧”，老派纪实的剧作风格，令人着迷。受其影响，很多观众开始追起了二十多年前的《中国刑侦1号案》《12·1枪杀大案》。有人评价它“高开低走”。,https://toutiao.com/group/7449562650628866595/,,0,0,False
海一天，不靠当领导的父亲，46岁才走红，娶二婚妻子待继子如亲生,2024-12-19 06:54,1872,459,豆莱说,豆莱说,文：豆莱说编辑：豆莱说在娱乐圈中，不乏有很多星二代，他们一出生便含着金汤匙，什么不用做就已经到达了普通人努力一辈子都到达不了的罗马。但是海一天却是一个例外，他从不靠着家里的关系，凭借着自己的努力进入演艺圈，可是却一直籍籍无名，直到46岁才走红，可算是真正的大器晚成。,https://toutiao.com/group/7450010154218668553/,,0,0,False
李永乐老师：微波炉的原理，对人体有没有伤害！,2024-12-13 00:21,6458,363,mdl雨花石,mdl雨花石,,https://toutiao.com/group/7447684939296571939/,,0,0,True
包厢全是刚出狱的恶霸，结果一看到饭店主厨，立马怂了,2024-11-11 01:21,13822,377,乐视群星访谈秀,乐视群星访谈秀,,https://toutiao.com/group/7435825833048015400/,,0,0,True
中央定调2025年养老金上涨，计算公式，企退人员能涨7%以上吗？,2024-12-18 04:29,3094,459,社保当家,社保当家,中央定调2025年养老金上涨，计算公式，企业退休人员能涨7%以上吗？在2025年到来之际，养老金上涨的消息就早早地确定了，这无疑给广大退休人员吃上了定心丸。因为根据近期召开的中央经济工作会议，已经明确提出要适当提高退休人员的基本养老金待遇。,https://toutiao.com/group/7447756391172833827/,,0,0,False
“突然通知关停”！上海知名网红夜市彻底消失！摊主：从月入10万到日赚几十元，动不动就断电，卫生状况也不好……,2024-12-24 13:54,580,397,每日经济新闻,每日经济新闻,去年夏天，在浦星公路旁紧邻地铁8号线芦恒路的中欧街，一座夜市尚未在网络出圈就已经人气满满。和一些夜市“脏、乱、差”的情况相比，这里既接地气，又整齐规范，深受周边居民的喜爱。今年7月份，记者曾走访中欧街夜市，其人气不减，但美食等选择相对雷同。,http://www.nbd.com.cn/rss/jinri_toutiao/articles/3697935.html,,0,0,False
3岁女童唱戏萌翻全场，一句话哄着评委团团转，太可爱,2024-12-16 03:22,2104,273,乐视娱乐乐透社,乐视娱乐乐透社,,https://toutiao.com/group/7448844070421529125/,,0,0,True
如何看待美国出台的《2024中国军力报告》？,2024-12-23 05:18,21495,1169,大刘说说,大刘说说,美国国防部最近出台了2024中国军力报告，今年我们来聊聊西方世界是如何看待中国的军力发展的,https://toutiao.com/group/7451472335464301096/,,0,0,True
新婚33天卷走274万4套房，出逃后丈夫跨国追捕，如今下场大快人心,2024-12-20 22:06,3133,185,八号探秘人,八号探秘人,在阅读此文之前，辛苦您点击一下“关注”，既方便您进行讨论和分享，又能给您带来不一样的参与感，感谢您的支持！编辑丨QQ·B“色字头上一把刀！”深圳富豪结婚33天竟被卷走274万元和名下4套房产。不仅如此，他还被扣上了“接盘侠”的帽子，啥也没干喜当爹。,https://toutiao.com/group/7450399558821052982/,,0,0,False
赖清德的下场有四个选择：泽连斯基、巴沙尔、尹锡悦，还有傅作义,2024-12-24 09:37,16138,1090,邱毅台湾,邱毅台湾,,https://toutiao.com/group/7451910234425000467/,,0,0,True
被中国大陆立案调查2周后，英伟达作出决定，将在台湾建海外总部,2024-12-24 07:16,217,110,开心营业厅,开心营业厅,12月9日，随着中国展开了对芯片巨头英伟达的反垄断调查，结果对方的回应竟然是他们是凭借优势赢得胜利，只口不提垄断的事情，显得非常“傲慢”。,https://toutiao.com/group/7451865619718357523/,,0,0,False
7人将竞选新一任国际奥委会主席 他们都是谁？,2024-12-21 07:22,3909,102,国际在线,国际在线,,https://crionline-media.cri.cn/cb5a6d96-d0c4-4fd0-a895-b6135667d84a/video/add1b10d9bdf40f0bb6cc906d61f587a.mp4,,0,0,True
连续工作12个小时后，女员工拒绝年会跳舞被辞退！公司称不服从安排、顶撞领导，专家：不合理也不合法,2024-12-24 05:28,616,902,九派新闻,九派新闻,不知不觉又到年底，各大企业正举办年会，打工人又要准备节目了！此前，杭州一位女员工因“不想跳舞”被辞退，该话题登上热搜，引发热议！事件回顾王女士36岁，在杭州一家健康管理公司的下沙门店做美容师。△劳动合同2021年1月中旬的一天，在连续工作12小时后，王女士于晚上9点下班。,https://toutiao.com/group/7451844166637617673/,,0,0,False
大福星我想和你借你一样东西可以吗？😍😍,2024-10-25 12:12,16308,5870,妮妮爱你,妮妮爱你,,https://toutiao.com/group/7429684939504747020/,,0,0,True
帅哥看不上相亲女，撒谎没车没房没户口，姑娘的反应绝了,2024-11-18 05:47,4704,436,乐视天天剧好看,乐视天天剧好看,,https://toutiao.com/group/7438491946131128872/,,0,0,True
近5年最热的十部剧，《狂飙》第9，《繁华》第6，第1名很难超越,2024-12-01 03:58,1498,545,电影烂番茄,电影烂番茄,今天，番叔就结合口碑，给大家盘点一下近五年，热度最高的十部电视剧。第十名:《都挺好》 猫眼热度 9775.8，播出时间2019年。,https://toutiao.com/group/7430845717314273831/,,0,0,False
