title,publish_time,like_count,comment_count,media_name,source,abstract,article_url,tag,is_yaowen,article_sub_type,has_video
他的资历比朱德还老，授勋时却错失元帅，毛主席特批享受元帅待遇,2024-12-12 10:24,5030,194,品古观今,品古观今,在我军革命史上，有一位将军的资历比朱德还老，连毛主席都说:“共产党能对国民党将领说话的人不多，他就是其一。”可这样的人却在大授衔时，错失了元帅，后来经过毛主席的一番关心，才得以享受与元帅的同等待遇。,https://toutiao.com/group/7447468654758871592/,,0,0,False
拒4500万分手费，跑国外生子拿9个亿，王思聪惊呼她才是顶级玩家,2025-01-15 11:50,843,143,晓娱海棠,晓娱海棠,“4000万够吗？”面对“沪上皇”秦奋开出的天价分手费，韦雪轻轻摇头，嘴角勾起一个浅笑。如果有人给你4000万，换取一次分手，你会怎么选？大部分人可能毫不犹豫地接受，但韦雪却偏偏选择了更具风险的一条路。,https://toutiao.com/group/7460046784807633462/,,0,0,False
女子带两娃摆摊后续！前老公跳河，二婚被赶出门，今有好消息传来,2025-01-17 02:40,1604,321,那一片雪花啊,那一片雪花啊,2025年伊始，重庆一位带两娃摆摊的28岁女子火了!近日，一位博主走在重庆夜晚的街头，风很凉，不由得让人裹紧了衣服，可接下来博主却看到了令他感到疑惑的一幕!,https://toutiao.com/group/7460655797899379241/,,0,0,False
为了永留美国，在联合国大楼举牌抹黑中国的张晓宁，终于“圆梦”,2025-01-15 12:59,1626,853,八号探秘人,八号探秘人,可怀揣“美国梦”的她，却因一时冲动走上极端的“不归路”。还变本加厉在联合国大楼下，高举侮辱中国的牌匾，甚至公然提刀杀人。,https://toutiao.com/group/7460021341844931124/,,0,0,False
排水量12万吨！水泥航母扩建完成：004型航母将是全球最大航母？,2025-01-16 08:20,2178,257,军武次位面,军武次位面,【军武次位面】作者：天狼近年来，中国航母事业步入快车道。从辽宁舰到山东舰，再到福建舰，我国在航母设计与建造上突飞猛进。尤其是“福建舰”首次采用的电磁弹射系统，标志着我国航母技术已经迈向了世界一流水平。,https://toutiao.com/group/7460389225578430986/,,0,0,False
16个外甥来家过寒假，“宇宙舅舅”今年准备了三头猪，此前暑假花了6万元,2025-01-17 03:35,1789,1020,极目新闻,极目新闻,据海报新闻1月16日报道，重庆的龚先生有三个姐姐一个妹妹，一共16个外甥。每年的寒暑假外甥们都会来家里度假，今年寒假准备了3头猪，寒假这几天不算水电费，一天要花千儿八百元，过年打算给每人1000元红包。他说：“那种快乐是很多人体会不到的，我不想让下一代疏远了。,http://jms.ctdsb.net/jmythshare/#/index_share?cId=0&contentType=5&contentId=2354591,,0,0,False
中国GDP突破134万亿，意味着什么？,2025-01-17 07:34,1570,510,北京日报客户端,北京日报客户端,134.9万亿元，这是刚刚公布的中国2024年GDP，经济总量又上了一个新台阶。从体量规模上看，134.9万亿元大致相当于4.1个德国，4.5个日本，4.9个印度。总量保持增长，质量和结构也新意十足。 新突破。2024年，农林牧渔业在GDP中的比重约6.8%，保持稳定。,https://rss2.bjd.com.cn/content/s678a07b3e4b08edd28f3ee4c.html,,0,0,False
