title,publish_time,like_count,comment_count,media_name,source,abstract,article_url,tag,is_yaowen,article_sub_type,has_video
习言道｜把各民族优秀传统文化发扬光大,2025-02-11 09:31,586,332,中国新闻网,中国新闻网,文化是一个民族的魂魄，文化认同是民族团结的根脉。习近平总书记始终重视民族文化保护和传承，强调把各民族优秀传统文化发扬光大。,http://ku.m.chinanews.com/wapapp/cns/gn/2025/02-11/10366848.shtml,,0,0,False
时隔47年老知青回陕北和女儿相认，女儿不恨他，他给女儿红包,2025-02-10 16:42,723,105,涂焖脸艳,涂焖脸艳,,https://toutiao.com/group/7469831610385580607/,,0,0,True
读书有什么用？北大才女刘媛媛4分多钟演讲，发人深省！,2025-02-05 03:45,7355,1681,PP千里江湖剧院,PP千里江湖剧院,,https://toutiao.com/group/7467773498556744244/,,0,0,True
王志文找江珊复婚，看两人对话简直太享受，不愧是老戏骨啊,2024-11-30 19:30,7599,772,娱快很简单,娱快很简单,,https://toutiao.com/group/7441487197062201893/,,0,0,True
五百米悬崖半空竟有人居住你敢信吗！！,2025-01-23 09:44,9366,1895,默默,默默,,https://toutiao.com/group/7463044422482117147/,,0,0,True
震撼！十秒内连续弹射三架重型战斗机！,2025-01-18 23:48,14669,2057,辉哥杂谈。,辉哥杂谈。,,https://toutiao.com/group/7461406546325406218/,,0,0,True
集市上10元一斤的散酒，是纯粮酒吗？听听内行人怎么说,2025-01-20 13:33,4527,1342,悦悦纪实,悦悦纪实,,https://toutiao.com/group/7461990229696643611/,,0,0,True
演讲：白岩松惊讶大医院判了死刑的病，一介乡医，几副草药搞定！,2025-01-25 23:02,20251,1398,小胖侃视界,小胖侃视界,,https://toutiao.com/group/7463064456348746255/,,0,0,True
很好看，熬夜也要看完。,2025-02-02 02:37,18797,873,我爱你中国,我爱你中国,,https://toutiao.com/group/7466645082817528370/,,0,0,True
一曲笛子吹服了评委，这哪像个孩子，分明是个艺术家！,2025-01-10 03:14,20815,3312,影视猛回头,影视猛回头,,https://toutiao.com/group/7458119719481131539/,,0,0,True
大哥寻找12年前的初恋，得知初恋女孩至今单身，男子当场求婚,2025-01-15 06:54,27717,10395,江湖研究院剧院,江湖研究院剧院,大哥寻找12年前的初恋，得知初恋女孩至今单身，男子当场求婚,https://toutiao.com/group/7460031861084013090/,,0,0,True
苹果搭配红枣，作用真是太厉害了，帮助了很多人，实用,2025-01-03 09:20,2078,222,昕璇小厨娘,昕璇小厨娘,苹果搭配红枣，作用真是太厉害了，帮助了很多人，实用,https://toutiao.com/group/7453040622518141475/,,0,0,True
57岁富婆嫁给小19岁丈夫，竟生下3胞胎，丈夫上台全场惊呆,2024-12-13 09:19,9696,325,热剧收藏馆剧院,热剧收藏馆剧院,57岁富婆嫁给小19岁丈夫，竟生下3胞胎，丈夫上台全场惊呆,https://toutiao.com/group/7447823728131441204/,,0,0,True
