title,publish_time,like_count,comment_count,media_name,source,abstract,article_url,tag,is_yaowen,article_sub_type,has_video
俩人相亲互相看不上，哪料男方一报母亲身份，姑娘乐了,2024-11-08 01:50,9954,2262,乐视群星访谈秀,乐视群星访谈秀,,https://toutiao.com/group/7434719902990074395/,,0,0,True
“榛树”导弹落地6秒钟，从这几个点可以看出，俄罗斯下了大功夫,2024-11-23 09:11,5024,378,杜文龙,杜文龙,,https://toutiao.com/group/7440399745962476041/,,0,0,True
男子投诉环保问题被打断肋骨，经过区、镇干部协调和解后获赔300万元，一年后被判寻衅滋事追缴违法所得,2024-11-22 14:04,12896,7605,大风新闻,大风新闻,持续向上级投诉山东重山集团有限公司环保问题多年的王长征，在2021年6月23日与重山集团保安人员的冲突中被打致局部脑损伤、头部及全身多处软组织损伤、颈部损伤、多根肋骨骨折。,https://toutiao.com/group/7440095550873027106/,,0,0,False
未来三年：稳住，你就赢了,2024-08-31 13:38,4400,663,洞见,洞见,财经博主@曹多鱼说过一个扎心的现象:这两年有上进心的人，都负债累累了。“大环境不明朗的情况下，你就像陷进了泥坑里。,https://toutiao.com/group/7409296614000427571/,,0,0,False
消费者称旺仔牛奶喝出异物，否认“摆拍” 旺旺集团凌晨公告回应,2024-11-23 02:16,155,322,红星新闻,红星新闻,11月20日，有网友在互联网发布视频，称自己的孩子在喝旺仔牛奶时感觉到有异味，于是他将奶瓶用刀割开，发现里面有异状物。11月23日凌晨，旺旺集团针对近日旺仔牛奶相关舆论发布说明。,https://cdsbrss.cdsb.com/toutiao_no_video.php?url=https%3A%2F%2Fstatic.cdsb.com%2Fmicropub%2FArticles%2F202411%2Fab86c6aa339a0f3c27f60a1a880862bb.html,,0,0,False
宋美龄106岁去世，贴身厨子回家后不久自尽，事后妻子透露出缘由,2024-10-28 09:22,9368,293,历史与江湖,历史与江湖,2003年10月，106岁的宋美龄在美国纽约去世，这位世纪老人虽然永远地闭上了双眼，但是却留下了一个长寿神话。,https://toutiao.com/group/7430753866158817855/,,0,0,False
央视新华社直接点名是台独首恶，台独金孙现出原形，变成台独龟孙,2024-11-23 08:00,10703,636,邱毅台湾,邱毅台湾,,https://toutiao.com/group/7440039757029048866/,,0,0,True
特朗普时代，中日合作机遇显现？俄乌对峙升级，明年有重大拐点,2024-11-20 10:52,14630,927,邱震海,邱震海,,https://toutiao.com/group/7439312593905025562/,,0,0,True
黑龙江七台河当地24小时不间断追踪咬人老虎踪迹,2024-11-23 01:14,885,260,澎湃新闻,澎湃新闻,11月18日，黑龙江七台河。一名村民手被老虎咬伤，已经送往医疗机构接受治疗。目前，当地已经成立排查队伍，对老虎24小时不间断开展排查追踪。,https://cloudvideo.thepaper.cn/video/30305036c2f94c76bc61a07edd986b57/hd/20241122214800682cf6db150-fa00-4324-b793-ba0199ea1ae3-14f9ac27-a74c-833c-5d7e-4d1cbe5cf9a6.mp4,,0,0,True
俄罗斯一枚导弹震撼全球，必将打掉美西方信心，将改写战争历史,2024-11-23 07:02,3020,265,罗富强观察室,罗富强观察室,这是人类历史上射程达到6000公里的导弹首次投入实战。关键是，这不是老旧技术的导弹，而是无法拦截的俄罗斯最新型高超音速弹道导弹。,https://toutiao.com/group/7440366661741314614/,,0,0,True
男子实名举报县委副书记婚内出轨自己老婆，聊天截图被曝光,2024-11-22 14:45,1325,409,大皖新闻,大皖新闻,11月19日，湖南长沙的程先生在社交平台，手持身份证实名举报海南省陵水黎族自治县县委副书记兼政法委书记肖某，破坏其家庭，长期与其爱人保持不正当关系。并晒出多张妻子和肖某的露骨聊天截图，聊天内容十分暧昧。,http://www.ahwang.cn/toutiao/202411/2777644.html,,0,1,False
弟弟光荣退伍，姐姐兴奋去车站接他，怎料一见弟弟瞬间哭了,2024-11-05 06:34,23633,2621,乐视天天剧好看,乐视天天剧好看,,https://toutiao.com/group/7433679820573934091/,,0,0,True
美国暗流涌动，特朗普对深层政府摊牌，拜登会否成“五日京兆”？,2024-11-21 22:01,20989,528,黎建南台湾,黎建南台湾,,https://toutiao.com/group/7439856002679177768/,,0,0,True
中英法航展交易额差距出炉：英1036亿美元，法1500亿美元，中国呢,2024-11-22 11:31,1035,553,云帘逸仙,云帘逸仙,文|祁言声明：本文内容均是根据权威资料，结合个人观点撰写的原创内容，文中标注文献来源及截图，请知悉。源于网络前言11月17日，随着珠海航展完美落幕，无数军迷们也是在此次航展上大饱眼福，见识到了我国各种新型战机，也见证了我国航天发展的进步。,https://toutiao.com/group/7440055024065020467/,,0,0,False
