title,publish_time,like_count,comment_count,media_name,source,abstract,article_url,tag,is_yaowen,article_sub_type,has_video
山东新泰通报“12岁女孩感染HPV”：17岁男子被采取刑事强制措施,2024-12-16 05:42,3485,3612,澎湃新闻,澎湃新闻,12月16日，山东省新泰市联合调查组通过新泰市官网发布通报称，关于网传一女孩被性侵事，新泰市第一时间成立由公安、卫健、妇联等部门组成的联合调查组展开调查。经查，该女孩于2024年5月通过网络认识17岁男孩李某某并发展为男女朋友，之后发生性关系。,https://m.thepaper.cn/newsDetail_forward_29660872?from=toutiao,,0,0,False
妻子深夜加班，丈夫感觉不对劲偷偷跟踪，看到真相瞬间崩溃,2024-10-28 06:59,10376,215,乐视金曲大荟萃,乐视金曲大荟萃,妻子深夜加班，丈夫感觉不对劲偷偷跟踪，看到真相瞬间崩溃,https://toutiao.com/group/7430717509566726656/,,0,0,True
弹劾案通过后，尹锡悦发表最后讲话,2024-12-15 08:45,1447,422,热情春风pV,热情春风pV,,https://toutiao.com/group/7448556981456994857/,,0,0,True
怪不得赵本山捧宋小宝，他的小品笑死个人，看一次笑一次,2024-11-13 02:18,3932,480,PP戏看放映厅,PP戏看放映厅,,https://toutiao.com/group/7436582638133903926/,,0,0,True
新型“卖淫方式”出现了！让人防不胜防，你身边可能潜伏着危险！,2024-10-24 03:09,5907,223,啰嗦翔子,啰嗦翔子,曾经，我们谈“黄赌毒”，总是联想到那些藏污纳垢的场所:昏暗的灯光、暧昧的音乐，空气中弥漫着廉价香水的味道。,https://toutiao.com/group/7429162154459038247/,,0,0,False
这才是红烧排骨简单正确做法，颜色红亮软烂脱骨，学习了,2024-10-30 03:42,1603,221,张大神美食,张大神美食,,https://toutiao.com/group/7431408956326543891/,,0,0,True
弟弟光荣退伍，姐姐兴奋去车站接他，怎料一见弟弟瞬间哭了,2024-11-05 06:34,35777,3104,乐视天天剧好看,乐视天天剧好看,,https://toutiao.com/group/7433679820573934091/,,0,0,True
67岁执意生娃，如今却坐轮椅无法自理，5岁的天赐被迫独立学洗衣,2024-11-04 10:32,9130,2082,睿之悦,睿之悦,2019年，已经67岁的田新菊执意生下了自己的第三个孩子小天赐。那么，现如今5年的时间过去了，这“天赐”的礼物到底是福还是祸呢?,https://toutiao.com/group/7433367394946384435/,,0,0,False
100年前，清朝罕见留影，王爷妻妾婀娜多姿，乞丐全身挂满垃圾,2024-10-14 09:58,2505,278,万物知识局,万物知识局,每一张老照片，都像是时间的低语，它们静静地躺在历史的相册中，却在不经意间将我们拉回到那个遥远而神秘的年代。,https://toutiao.com/group/7425457574731579919/,,0,0,False
郭有才：当迷失方向忘记初心后，曾经飘得多高，如今摔得就多惨,2024-11-11 06:53,1848,835,八号探秘人,八号探秘人,在阅读此文之前，辛苦您点击一下“关注”，既方便您进行讨论和分享，又能给您带来不一样的参与感，感谢您的支持！编辑丨brt因为一首翻唱，他一夜之间成为了拥有千万粉丝的网红。但是“人红是非多”，不久他就因为版权等问题陷入了舆论风波。他的人气一落千丈，从万众瞩目变成了现在的无人问津。,https://toutiao.com/group/7435901170239078948/,,0,0,False
中央定调！2025年养老金迎来新调整，退休新规实施，还有个好消息,2024-12-14 00:24,6145,538,思之想之,思之想之,2025年马上就要来了，这是一个充满变化的关键的年份，这是十四五规划的最后一年，很多政策将会兑现。2025年，除了养老金继续用来调整之外，退休新规也将会正式实施，还有一个好消息，具体是什么呢?,https://toutiao.com/group/7448052182332473867/,,0,0,False
罕见！100年前，英国游客拍下的清朝乡村，和想象中完全不一样,2024-09-20 02:07,9098,790,万物知识局,万物知识局,泥泞的土路，衣不蔽体的老百姓，即便是达官显贵的家中也十分破败，而这些都是清王朝的历史痕迹，虽说那时候中国摄影技术并不发达，但也有许多外国游客来到这里，拍摄下了许多老照片，为我们留下了珍贵的历史资料，那清朝到底是怎样的面貌呢?,https://toutiao.com/group/7416287738871267855/,,0,0,False
河南警察3岁女儿被拐，苦寻全国23年无果，结果却发现女儿在对门,2024-11-05 07:43,4315,487,八号探秘人,八号探秘人,寻亲23年无果，丢失的女儿竟住在对门?但它却真实发生在河南洛阳的梁绍波身上。是意外走丢，还是人贩子所为，三岁的女儿怎会离奇失踪?,https://toutiao.com/group/7433697108120142345/,,0,0,False
震惊！中国产大蒜，对美国食品安全造成极大威胁？,2024-12-13 21:05,4145,580,蜜蜂先生,蜜蜂先生,,https://toutiao.com/group/7447925311884231231/,,0,0,True
15年保安徒手接跳楼女孩，女孩母亲：我女儿若有事，你一辈子负责,2024-10-07 09:28,674,274,睿之悦,睿之悦,文|睿之悦编辑|睿之悦“我的女儿要是有什么事情的话，你要负一辈子的责任！”2015年，一名保安在得知有人跳楼的时候，不顾自身的安危，徒手将跳楼的女孩给救了下来。可令人感到的心寒的是，被救女孩的家属不仅没有感谢这名保安，反而还对他恶语相向。那么，这究竟是怎么一回事呢？,https://toutiao.com/group/7422961323312431656/,,0,0,False
痛悼！他于14日11时因突发疾病不幸离世，年仅40岁,2024-12-16 05:35,827,314,大皖新闻,大皖新闻,12月14日深夜，贵州省公安厅官微贵州贵州警事发布一则消息，具体内容如下：朱凌晨，男，汉族，浙江义乌人，大学本科，1984年4月8日出生，2008年退伍，2010年10月参加公安工作，生前系黔东南州黄平县公安局禁毒大队副大队长、二级警长。,http://www.ahwang.cn/toutiao/202412/2787626.html,,0,1,False
3年前，宁夏7岁小女孩一笑走红，后拒百万签约，如今怎么样了？他们后悔了吗？,2024-09-19 07:25,15784,2089,睿之悦,睿之悦,2021年，视频镜头中出现的女孩儿用那一抹甜美的笑容，迅速引起了网友们的广泛关注。有媒体公司看到这一机遇，提出愿意用百万巨资与女孩儿签约，然而，女孩儿的父母却坚决拒绝了这一提议。,https://toutiao.com/group/7416250139544879679/,,0,0,False
相爱37年零绯闻，丁勇岱对赵雪华一见钟情，如今却对儿子很失望,2024-11-09 21:43,3247,305,八号探秘人,八号探秘人,在阅读此文之前，辛苦您点击一下“关注”，既方便您进行讨论和分享，又能给您带来不一样的参与感，感谢您的支持！编辑丨xk1985年，丁勇岱转过楼梯拐角，撞到人生挚爱，这一下把他撞“开窍”了。那时他还不是《末路》里的白宝山。也不是《跨过鸭绿江》里的彭老总，更不是《人世间》里的周志刚。,https://toutiao.com/group/7435160230918406707/,,0,0,False
范伟买菜这段！据说整个导演组都笑趴了，实在太逗了,2024-12-10 11:34,922,177,南瓜小龙哥,南瓜小龙哥,,https://toutiao.com/group/7446735461529158159/,,0,0,True
遍地开花的俄罗斯商品馆，打着进口旗号卖国货？加盟总部称80%系进口，火腿列巴等产自东北,2024-12-11 00:32,2620,1223,看看新闻,看看新闻,遍地开花的俄罗斯商品馆，打着进口旗号卖国货？加盟总部称80%系进口，火腿列巴等产自东北,http://mediaplay.kksmg.com/2024/12/11/h264_720p_600k_78163-smgnews-20241211065500-9000-960313-600k_mp4.mp4,,0,0,True
夫妻俩5年生下6个孩子，上台场面热闹非凡，连杨帆都看得目瞪口呆,2024-12-01 07:36,7530,475,山西广电文娱,山西广电文娱,,https://toutiao.com/group/7443344028558426662/,,0,0,True
毛人凤下令带走死囚，哪料死囚的靠山露面了，毛人凤当场懵了,2024-11-25 03:05,8075,1418,南哥硬汉秀,南哥硬汉秀,,https://toutiao.com/group/7441047753771188799/,,0,0,True
炸萝卜丸子，别直接加淀粉和水，教你配方和秘诀，真正的外酥里嫩,2024-12-03 02:00,2355,245,老东北美食,老东北美食,炸萝卜丸子，别直接加淀粉和水，教你配方和秘诀，真正的外酥里嫩。炸丸子，萝卜，肉丸子，凉菜，素丸子，菜谱，食谱，炒菜，烹饪，烹饪技巧，厨艺，美食教程，家常菜，素菜，特色菜，美食，下饭菜，小吃，东北菜，鲁菜,https://toutiao.com/group/7443825051196981812/,,0,0,True
美国对华布局与韩国戒严巧合？尹锡悦被弹劾困兽犹斗，手握王牌,2024-12-15 22:01,12830,263,黎建南台湾,黎建南台湾,,https://toutiao.com/group/7448762044733456908/,,0,0,True
天冷电动车充满电，一加油门就掉2格，不怪电池，真实原因告诉你,2024-11-26 05:02,1911,139,新能源战略家,新能源战略家,电动车使用方便、价格便宜，已经成为了不少朋友通勤代步的首选，但在使用过程中偶尔也有让人糟心的问题。像爆胎、刹车不灵敏这类问题可以通过门店维修来解决，但如果遇到电池出现异常情况，不仅问题难以排查，而且维修成本也不低。,https://toutiao.com/group/7441448742575702563/,,0,0,False
美国遣返中国非法移民？他们跟中国已经没关系了，爱到哪到哪,2024-12-14 01:05,25000,4584,金灿荣教授,金灿荣教授,,https://toutiao.com/group/7447851020526289423/,,0,0,True
大蒜威胁国家安全？美国歧视变本加厉，不给中国发展提供任何助力,2024-12-13 06:23,7902,1566,杜文龙,杜文龙,,https://toutiao.com/group/7447778326313173544/,,0,0,True
王芳当媒人！撮合王丽云和王为念，看看女儿车晓怎么说,2024-11-21 03:27,4567,630,PP撩剧放映厅,PP撩剧放映厅,,https://toutiao.com/group/7439565390424605199/,,0,0,True
废机油丢掉太可惜，大叔打造出机油暖炉，整个冬天都不用开空调了,2024-11-28 05:17,4786,675,托马斯手工,托马斯手工,,https://toutiao.com/group/7442194927636709922/,,0,0,True
小品：杨帆演小沈阳，撒贝宁演赵本山，台词功底太强了吧,2024-11-23 06:13,5989,114,PP宫斗放映厅,PP宫斗放映厅,,https://toutiao.com/group/7440353912709710386/,,0,0,True
冬季自驾游，零下四十度睡车里，半夜冻醒了，车里全部冻住了！,2024-12-13 11:02,10928,2323,旅行者小多,旅行者小多,,https://toutiao.com/group/7447850219347116544/,,0,0,True
