title,publish_time,like_count,comment_count,media_name,source,abstract,article_url,tag,is_yaowen,article_sub_type,has_video
有人跟踪我？浪哥，救命啊！ #蛋仔派对逃出惊魂夜 #蛋仔电影节,2024-08-07 09:45,1618,102,魔鬼鱼秀儿,魔鬼鱼秀儿,,https://toutiao.com/group/7400331364136682019/,,0,0,True
罕见！100年前，英国游客拍下的清朝乡村，和想象中完全不一样,2024-09-20 02:07,2682,356,万物知识局,万物知识局,泥泞的土路，衣不蔽体的老百姓，即便是达官显贵的家中也十分破败，而这些都是清王朝的历史痕迹，虽说那时候中国摄影技术并不发达，但也有许多外国游客来到这里，拍摄下了许多老照片，为我们留下了珍贵的历史资料，那清朝到底是怎样的面貌呢?,https://toutiao.com/group/7416287738871267855/,,0,0,False
“骗购”中国坦克，用完就退货，想求买中国无人机，中国只卖不租,2024-09-24 22:42,1278,231,开心营业厅,开心营业厅,自古以来诚信都是一个很重要的东西，不管是国家交往还是做生意，没有人愿意和一个不守信的人打交道。然而2009年，秘鲁为了在阅兵仪式上展示军事实力，“骗购”中国坦克撑场面，用完以后却以技术问题为由退货。,https://toutiao.com/group/7418121417771762215/,,0,0,False
善恶终有报！66岁“消失”了的陈宝国，可谓是娱乐圈的悲哀与损失,2024-09-27 06:29,2126,131,八号探秘人,八号探秘人,“我真的挺不喜欢听艺人这个词，前两年听得我一个劲儿地倒胃口”。当很多人挤破脑袋想要进娱乐圈当一名艺人的时候，他却说了这样一句话。,https://toutiao.com/group/7419206100681114153/,,0,0,False
10月4号，北京大街上看到的一幕，这可如何是好！,2024-10-04 11:26,1196,109,清风快乐游,清风快乐游,,https://toutiao.com/group/7421880273639309859/,,0,0,True
伊朗领袖祈祷现场，曝光中国沉默猎手激光炮，让以军导弹统统哑火,2024-10-07 08:25,706,128,科大烽火,科大烽火,近期，拍摄于伊朗首都德黑兰的祈祷现场照片显示，在伊朗最高领袖哈梅内伊发表讲话之际，一型采用白色涂装的激光防御武器突然出现在了会场，从而引起广泛关注。,https://toutiao.com/group/7422944121502876170/,,0,0,False
看一下外国电视台节目里中国军队的样子,2024-10-07 08:11,4621,887,西瓜群众176,西瓜群众176,,https://toutiao.com/group/7422943404075516443/,,0,0,True
5年前站在美国军舰上，用中文警告我国海军的华人女兵，现在如何,2024-10-06 09:06,1587,211,陈志华观天下,陈志华观天下,2019年，华裔女兵郑浩儿站在一艘美国军舰上，用一口标准的中文喊话威胁中国海军:“我们只是正常巡视，再往前一步，我们不介意发动战争!”,https://toutiao.com/group/7422585983588024883/,,0,0,False
A股三大指数集体高开，仅20分钟，两市成交额突破1万亿！半导体板块爆发，券商板块继续大涨,2024-10-08 02:03,213,581,每日经济新闻,每日经济新闻,每经编辑：杜宇10月8日，沪指高开10.13%，深成指高开12.67%，创业板指高开18.44%，超千股涨逾19%。截至发稿，数据显示，开盘后仅20分钟，沪深两市成交额突破1万亿元，较昨日此时放量超2400亿元，刷新此前9月30日创下的历史最快万亿纪录。,http://www.nbd.com.cn/rss/jinri_toutiao/articles/3580181.html,,0,0,False
李大霄：今天的行情不太正常 部分踏空资金不问青红皂白地买进,2024-10-08 02:11,1178,3694,凤凰网财经,凤凰网财经,对于当下行情，前券商首席经济学家李大霄对凤凰网财经表示，今天的行情不太正常，部分踏空的资金不问青红皂白地买进，这可能是不太合适的，行情越火爆越要注意公司的质地，行情火爆也不能上杠杆。,https://toutiao.com/group/7423221195400593920/,,0,0,False
男人和女人的需求差别这么大？,2024-07-12 11:00,29915,2134,周小鹏,周小鹏,男人和女人的需求差别这么大？,https://toutiao.com/group/7388885573953389092/,,0,0,True
为国争光却遭郎平弃用！转身效力土耳其的王一梅，如今咋样了？,2024-08-31 13:19,937,143,豆莱说,豆莱说,光阴似箭，日月如梭，当初的少女早已退役，成为了排球场的幕后人，这么多年她都经历了什么，现在又怎么样了呢?,https://toutiao.com/group/7409287778514567718/,,0,0,False
东风41恐惧症在欧美蔓延：外媒坚定认为，先进导弹绝非东风31AG,2024-10-01 14:26,4960,883,南友汇,南友汇,日前以英国《金融时报》，美国《华盛顿时报》为首的欧美国家媒体撰文称，解放军本次试射的洲际导弹绝非是东风31AG，而是解放军现役更先进的东风41洲际导弹。,https://toutiao.com/group/7420812639297520163/,,0,0,False
牛市疯了：3天赚了一百万，高兴得太早，回头发现“卖飞了”,2024-10-03 13:00,4843,5963,凤凰网财经,凤凰网财经,编者按:30岁的孙默，在北京有一份稳定的工作，五年前，手里刚有一点积蓄，他就全部投入股市，没想到紧接着迎来了疫情。,https://toutiao.com/group/7421533420930482703/,,0,0,False
夫妻俩刚领完证异地两个月，终于见面 监控下两人好甜蜜,2024-09-29 04:25,1016,102,直播日照,直播日照,,https://toutiao.com/group/7419916383196021288/,,0,0,True
4年骑行结束，1500天终于回到老家，感谢大家一路陪伴有缘江湖见,2024-09-07 03:50,73747,16738,刘伟元的旅行,刘伟元的旅行,4年骑行结束，1500天终于回到老家，感谢大家一路陪伴有缘江湖见！,https://toutiao.com/group/7411715839100977716/,,0,0,True
2013年，湖南26岁女孩嫁给71岁老头，婚后还生下一子，如今怎样了,2024-07-12 11:59,27712,2469,智史通鉴,智史通鉴,2013年4月17日，长沙宁乡县的民政局迎来了一对特殊的夫妻。一个71岁的老头和一个26岁的女孩，离远了看，甚至像爷爷和孙女。面对工作人员异样的眼光，女孩说：“我和他是真心相爱的！”这让人好奇，这对相差45岁的夫妻，他们之间到底有着怎样的爱情故事？,https://toutiao.com/group/7390696631223534120/,,0,0,False
唐一军、窦万贵、张平被“双开”，杜梓被开除党籍,2024-10-07 09:10,7583,8965,界面快讯,界面快讯,中央纪委国家监委网站10月7日通报，经中共中央批准，中央纪委国家监委对江西省政协原党组书记、主席唐一军严重违纪违法问题进行了立案审查调查。,https://toutiao.com/group/7422957782632038921/,,0,0,False
万万没想到，35岁杨颖兜兜转转干回“老本行”，活成内娱最大笑话,2024-09-06 07:55,535,137,读万卷书的张飞,读万卷书的张飞,文l张飞编辑l张飞曾经你看不起别人；如今谁又瞧得上你？在节目中丝毫不考虑他人状态，一味地只追求自己的镜头。甚至还在采访中公然表示“自己早就应该把所有奖拿了个遍了”。更关键的是丝毫没有任何“报恩”之心。所以如今曾经所有的“嚣张”“高高在上”遭到反噬，只能说现在谁还“愿意”认识她！,https://toutiao.com/group/7411434661014012456/,,0,0,False
打脸了！中国高铁被踢出保加利亚后，如今西班牙无法交付取消项目,2024-10-06 03:53,724,183,开心营业厅,开心营业厅,前言今年3月，中国中车参与竞标保加利亚高铁项目，可没过多久，欧盟却以《外国补贴条例》，将我国高铁踢出了保加利亚。我国企业退出之后，西班牙高铁公司“趁胜追击”，用花言巧语俘获了保加利亚的“芳心”，可没想到的是，打脸实在来得太快！,https://toutiao.com/group/7422502205620273703/,,0,0,False
疯狂的以色列，已经不听美国招呼，美国或赌上国运 #以伊最新局势,2024-10-06 03:09,2020,165,利刃,利刃,,https://toutiao.com/group/7422494474594419211/,,0,0,True
已致超220人死亡！数百人失联…噩耗不断，重创美政府,2024-10-07 11:46,2330,326,司马南,司马南,有人说，不就是死了二百多人——死了二百多人，那是媒体报道出来的，除此之外还有几百人失踪，到现在找不着。,https://toutiao.com/group/7422995893500019251/,,0,0,False
有人冒充我男朋友，算不算诈骗？遇到奇葩事你会怎么办？,2024-09-06 05:52,1661,220,兴凯湖莹莹,兴凯湖莹莹,,https://toutiao.com/group/7411404025502892554/,,0,0,True
表面是艺人，实际是富家千金的5位女星，无人敢惹更别说潜规则了,2024-08-28 02:06,10043,803,八号探秘人,八号探秘人,在德云班主郭德纲的作品中，有过这么一句话。虽说此言尤为刺耳，但话糙理不糙。当今娱乐圈，很多女星为出人头地，自愿或被迫做出违反道德底线之事。,https://toutiao.com/group/7407984985224872459/,,0,0,False
奉陪到底，解放军报发出统一强音，台上将发现，大陆在等锁岛时机,2024-10-06 10:00,1795,228,强武堂,强武堂,最近，台海军“司令”唐华的一番话，直接引起了岛内热议，他说解放军已掌控台海，正以“蟒蛇战术”困住台湾，只要等到一个时机，便可随时进行全岛封锁。,https://toutiao.com/group/7422599740354789929/,,0,0,False
“长大后发现，老王这段讽刺曹德旺的采访，说的全是真的！”,2024-09-30 09:49,6905,1737,博学海风T,博学海风T,,https://toutiao.com/group/7420371105111605814/,,0,0,True
5座车拉6个人被判超员，车主1句话把交警问懵,2024-08-05 20:20,18415,4213,奇妙钢笔pA8JyP,奇妙钢笔pA8JyP,,https://toutiao.com/group/7399752843772559906/,,0,0,True
认祖归宗？蒙古国的“阳谋”将至！计划 2025年恢复蒙文与内蒙接轨,2024-09-08 03:03,1342,225,智史通鉴,智史通鉴,大家都知道，在历史上，外蒙古和内蒙古曾是“一家人”。后来清朝时期，外蒙古就开始独立出去，到现在，他们不仅加入了联合国，还将传统的蒙古语抛弃了，用了新的西里尔新蒙古文。可是随着时间的流逝，蒙古国似乎有一个“阳谋”渐渐浮出水面：他们计划在2025年，恢复传统的回鹘蒙文的使用。,https://toutiao.com/group/7412094989640958502/,,0,0,False
明知道山姆贵，为啥还非要买？消费者都昏了头吗？,2024-08-17 00:00,1530,282,兴凯湖莹莹,兴凯湖莹莹,,https://toutiao.com/group/7403748761362498083/,,0,0,True
"中美台海""必有一战""？大陆统一台湾胸有成竹，美军必遭歼灭！",2024-10-06 22:00,3808,193,黄阿原,黄阿原,,https://toutiao.com/group/7422618545030169151/,,0,0,True
国庆返程高速公路惊现大量图钉，多车轮胎被扎！官方回应,2024-10-07 08:01,452,294,上观新闻,上观新闻,10月6日，有网友在网上发布视频称：多辆汽车轮胎在沪渝高速公路重庆忠州服务区附近扎满图钉，不知是什么原因。10月7日上午，记者从重庆高速交警及忠县政府获悉，扎满轮胎的图钉系货车不小心掉落，非人为因素。目前掉落的图钉已被清理干净，警方正在寻找肇事车辆。,https://export.shobserver.com/toutiao/html/804433.html,,0,1,False
紧跟美国，新西兰军舰刚闯台海，求锤得锤？外媒：支援舰突发沉没,2024-10-06 01:40,1155,168,烽火前站,烽火前站,新西兰海军的规模非常小，仅有10艘左右的军舰，除了安扎克级导弹护卫舰之外，就是一些后勤舰船，不过新西兰却敢于在台岛问题上公然发起挑衅。,https://toutiao.com/group/7422465354448568851/,,0,0,False
原来他才是毁掉刘翔真凶，因贪1200万被公审，让刘翔背负多年骂名,2024-08-29 09:58,9074,250,八号探秘人,八号探秘人,在田径场上创造的成绩，至今无人能够打破，甚至在国际上享有盛名。本该继续夺冠之路，却两次因伤退赛，遭到了全网辱骂。,https://toutiao.com/group/7408489498465616410/,,0,0,False
她是央视最惨主持人，男友被判死缓，丈夫诈骗入狱，47岁无人敢娶,2024-08-27 23:30,2188,207,闻书识焉,闻书识焉,她曾是央视的台柱子，和董卿、周涛并称为央视的三朵金花。回顾刘芳菲的前半生，最令人感到惋惜的，便是她的感情生活，47岁至今无人敢娶。,https://toutiao.com/group/7407743113688564258/,,0,0,False
"万万没想到,53岁“丁克”半辈子的康辉，一生遗憾竟然是一通电话",2024-08-21 22:14,25535,5086,峰哥正读,峰哥正读,在阅读此文之前，麻烦您点击一下“关注”，既方便您进行讨论和分享，又能给您带来不一样的参与感，感谢您的支持！文/编辑：蘑菇百善孝为先。但是到底怎么做才算是“孝”，康辉用了半辈子才明白。央视知名主持人康辉，事业顺遂，家庭幸福，在外人看来是一个人生赢家。,https://toutiao.com/group/7405504703687115273/,,0,0,False
男子与女子在河中嬉戏玩耍，突然连续将女子的头按入水中,2024-09-26 04:40,1321,168,经视看天下,经视看天下,,https://toutiao.com/group/7418807108637819444/,,0,0,True
今天才知道！电动车“每天充”和“用完再充”，到底哪个更伤电池,2024-08-27 11:19,9094,1808,鲸探所,鲸探所,“今天到底给车充不充电？”估计大多数人每天回家都会想这个问题，看着自己的电动车电量又多又少的，充不充电也是一件非常难以抉择的事情。那么，电动车到底应该怎样充电呢？是每天都充，还是用完之后再充呢？电动车充电不管是在城市还是农村，电动车其实都是人们出门最常见的交通工具。,https://toutiao.com/group/7407773012533117475/,,0,0,False
她曾被前夫一巴掌扇到离婚！二婚嫁世界冠军，如今生活幸福滋润,2024-09-10 09:12,9691,190,豆莱说,豆莱说,“漂亮的让人挪不开眼”是圈内人对她的评价，和“山杏”不一样的是，李琳在现实生活中的感情很是幸运，遇到了导演王小列。,https://toutiao.com/group/7412930201929204236/,,0,0,False
