title,publish_time,like_count,comment_count,media_name,source,abstract,article_url,tag,is_yaowen,article_sub_type,has_video
有一种“算计”叫马伊琍和文章，离婚5年后，才看懂这盘大棋！,2024-10-31 09:25,822,218,喜盼晴,喜盼晴,从意气风发到跌落深渊，文章只用了十年。这十年，与其说是一场滑铁卢式的崩塌，不如说是一场自我毁灭式的沉沦。,https://toutiao.com/group/7431868194790310454/,,0,0,False
善恶终有报：疫情时对中国一毛不拔，却大方捐美国6亿，如今咋样,2024-09-29 05:50,950,127,睿之悦,睿之悦,可就是这样一位在中国土生土长起来的富豪，在疫情期间面对同胞的困境却一毛不拔，反而大方的捐助了6亿给美国。,https://toutiao.com/group/7419859345154015798/,,0,0,False
他突发疾病在上海逝世，终年56周岁,2024-11-02 05:15,787,237,大皖新闻,大皖新闻,澎湃新闻记者从华东理工大学方面获悉，华东理工大学化工学院原副院长方波教授，因突发疾病，医治无效，于2024年10月29日15时27分在上海不幸逝世，终年56周岁。公开资料显示，方波早年在青岛化工学院获学士、硕士学位，在华东理工大学获工学博士学位。,http://www.ahwang.cn/toutiao/202411/2767244.html,,0,1,False
"万万没想到,53岁“丁克”半辈子的康辉，一生遗憾竟然是一通电话",2024-08-21 22:14,28610,5486,峰哥正读,峰哥正读,在阅读此文之前，麻烦您点击一下“关注”，既方便您进行讨论和分享，又能给您带来不一样的参与感，感谢您的支持！文/编辑：蘑菇百善孝为先。但是到底怎么做才算是“孝”，康辉用了半辈子才明白。央视知名主持人康辉，事业顺遂，家庭幸福，在外人看来是一个人生赢家。,https://toutiao.com/group/7405504703687115273/,,0,0,False
封锁台湾、精准“斩首”、中美谈判 三天便能完成统一,2024-11-01 01:30,17119,1148,王炳忠台湾,王炳忠台湾,王炳忠来了：封锁台湾、精准“斩首”、中美谈判 三天便能完成统一,https://toutiao.com/group/7432044799760269887/,,0,0,True
15年前他在爱妻葬礼上哭到昏厥，发誓永不再娶，如今他做到了吗？,2024-08-24 02:17,18326,573,八号探秘人,八号探秘人,在阅读此文之前，辛苦您点击一下“关注”，既方便您进行讨论和分享，又能给您带来不一样的参与感，感谢您的支持！编辑丨xk纵观鱼龙混杂的娱乐圈，有人背叛，有人痴情。而果靖霖则是公认的好男儿，将一生都奉献给妻子。但妻子却仅仅陪他走了半生，没能战胜病魔，不幸离开人世。,https://toutiao.com/group/7406210316734710283/,,0,0,False
被囚禁的5年，被转向的人生,2024-11-02 02:04,1323,965,新京报,新京报,终于拿到判决书了。37岁的张玲期待着，自己能就此远离那场噩梦。在乡下的10年里，她每天都被农活包围，打油菜籽、喂鸡鸭、做饭、照顾6岁的儿子，生活平静庸常。只是偶尔，身体会不自觉地露出异样。,https://m.bjnews.com.cn/detail/1730512655168178.html,,0,0,False
女省长下乡视察，穷大叔一看愣住了，竟是当年救下的女乞丐,2024-10-29 03:52,3295,308,乐视娱乐乐透社,乐视娱乐乐透社,,https://toutiao.com/group/7431040293010407988/,,0,0,True
中国绝版老香烟，见过5种以上都是爷爷辈的，老烟民们抽过几种？,2024-08-20 08:54,707,124,万物知识局,万物知识局,文/万物知识局本文陈述所有内容皆有可靠信息来源，赘述在文章结尾在中国的历史长河中，烟草的传奇故事已历经四百载春秋。从明朝嘉靖年间葡萄牙使者带来的烟草，到如今琳琅满目的香烟品牌，烟草不仅见证了时代的变迁，也承载了无数人的记忆与情感。,https://toutiao.com/group/7405119584723927578/,,0,0,False
特务男扮女装混进村子，孩子兵顿时发现不对劲，这下精彩了,2024-10-28 06:09,1812,181,乐视群星访谈秀,乐视群星访谈秀,,https://toutiao.com/group/7430704630294413878/,,0,0,True
黑龙江美女囚犯毕丽梅，被枪决后在殡仪馆苏醒，家属：放了她吧?,2024-08-25 14:32,1947,262,墨山看客,墨山看客,女死刑犯被枪决后在殡仪馆起死回生，当场把火化的工作人员吓得够呛，就连随行的警察都吓了一跳，壮着胆上前检查一番后，立马把离奇的情况上报。不一会儿法医赶到现场，证实了女犯人的确还活着，亲属闻声下跪，以死过一回为理由，恳求放了她。,https://toutiao.com/group/7407082388163002921/,,0,0,False
河南女子去世，山东丈夫将手机埋墓里，充1000元话费，每天打电话,2024-11-01 06:52,629,1012,何止电影,何止电影,2014年11月17日，河南肿瘤医院的病房中举行着一场特殊的婚礼，主角是于海宁跟他的患有癌症的妻子范会香。在几个月前范会香确诊癌症，跟男友提出分手，于海宁不远万里来到了女友的城市，照顾患癌女友。得知女友时日无多，在病房中跟女友求婚，在病房中举办了婚礼，婚后一年，范会香去世。,https://toutiao.com/group/7432199981609534004/,,0,0,False
罕见！100年前，英国游客拍下的清朝乡村，和想象中完全不一样,2024-09-20 02:07,4166,508,万物知识局,万物知识局,泥泞的土路，衣不蔽体的老百姓，即便是达官显贵的家中也十分破败，而这些都是清王朝的历史痕迹，虽说那时候中国摄影技术并不发达，但也有许多外国游客来到这里，拍摄下了许多老照片，为我们留下了珍贵的历史资料，那清朝到底是怎样的面貌呢?,https://toutiao.com/group/7416287738871267855/,,0,0,False
写歌30年穷困潦倒，前妻失望选择离婚，谁料51岁靠一首歌一夜成名,2024-08-12 03:37,26221,4344,八号探秘人,八号探秘人,在阅读此文之前，辛苦您点击一下“关注”，既方便您进行讨论和分享，又能给您带来不一样的参与感，感谢您的支持！编辑：LY无数人都想要一个一夜成名的机会，但机会来了也不是每个人都能把握住的。他用了三十年的时间来准备迎接属于自己的机会。为了这个机会他放弃了一切，甚至包括家庭。,https://toutiao.com/group/7402090890367484428/,,0,0,False
1米3袖珍美女嫁给1米48男孩，婚后丈夫奇迹长高，两人却不欢而散,2024-09-07 02:55,2109,118,睿之悦,睿之悦,杨萍和葛存苗的婚礼 文|睿之悦 编辑|睿之悦2019年，成都的民政局来了两个“10岁小孩”来登记，工作人员以为是玩闹。两个“小孩”拿出身份证让工作人员看，这才明白，原来是两个再也长不高的成年袖珍人情侣。,https://toutiao.com/group/7411713833267364386/,,0,0,False
4年前，那个被刀郎告上法庭后退出歌坛的降央卓玛，如今状况如何,2024-10-26 08:07,738,356,睿之悦,睿之悦,降央卓玛，这位藏族女孩简直是上天的宠儿，从一个服务员到当红歌手，她仅仅用一首《西海情歌》。可为何这样一名曾红遍大江南北，一度被誉为天下最美女中音，却在事业最巅峰之时，被最好的朋友刀郎告上了法庭，究竟是什么原因让曾经的好友反目成仇呢?,https://toutiao.com/group/7429991088355721762/,,0,0,False
3年前，宁夏7岁小女孩一笑走红，后拒百万签约，如今怎么样了？他们后悔了吗？,2024-09-19 07:25,7442,1138,睿之悦,睿之悦,2021年，视频镜头中出现的女孩儿用那一抹甜美的笑容，迅速引起了网友们的广泛关注。有媒体公司看到这一机遇，提出愿意用百万巨资与女孩儿签约，然而，女孩儿的父母却坚决拒绝了这一提议。,https://toutiao.com/group/7416250139544879679/,,0,0,False
几十名登山者擅闯私人别墅，在泳池洗鞋……房主：至今没收到公开道歉,2024-11-02 09:57,2836,3205,环球网,环球网,来源：北京青年报微信 近日，杭州市民陈龙（化名）在社交平台发帖称，他在杭州龙坞茶镇的拍摄基地被数十名陌生人擅闯，对方还在别墅露天泳池清洗满是泥泞的鞋子和登山杖，导致泳池被污染。此外，基地里部分草地损毁严重，还有一把太阳伞被折断。,https://3w.huanqiu.com/a/d47dcc/4K5o6ALOSaA?agt=20,,0,0,False
盘点19个难以置信的意外瞬间，你会发现生活中的意外无处不在,2024-11-02 09:54,1722,130,趣闻那点事,趣闻那点事,盘点19个难以置信的意外瞬间，你会发现生活中的意外无处不在。,https://toutiao.com/group/7432587332434035236/,,0,0,True
给近三年最好的10部年代剧排个名：《人世间》第6，第1名没有争议,2024-09-06 08:08,10259,3359,皮皮电影,皮皮电影,时尚是个轮回，电视剧也是。在2020年之前的那些年，电视剧市场基本上都被偶像剧、都市剧霸占。曾经撑起国剧品质的《闯关东》《岁月》这类年代好剧，难见踪影。,https://toutiao.com/group/7411390030722712090/,,0,0,False
安徽美女道士胡小慧被捕：精通“胡媚术”，九名男徒弟揭露其罪行,2024-09-12 08:10,3770,427,艺述史,艺述史,在安徽一处偏僻山头上，有座神秘的道观，外表平平无奇，但里面却有着一位名气很高的美女道士。美女道士的名字叫做胡小慧，据说有着高深的法力，能帮人消灾解难。很多人慕名前来，交上丰厚的香火钱，在袅袅青烟里，试图从这个年轻道士身上获得一些生活的支撑。,https://toutiao.com/group/7413662261274739200/,,0,0,False
逆袭人生，找老婆建别墅当上老板，小奎一家终得圆满#娟奎之恋,2024-08-31 05:27,16726,2848,海哥量地球,海哥量地球,,https://toutiao.com/group/7409170930649268771/,,0,0,True
辽宁舰山东舰双航母亮相，战略层面摊牌，局势已经突变多国表态,2024-11-02 01:47,1519,277,川陀说美日动态,川陀说美日动态,一旦福建舰加入编队，那就是三航母战斗群，彻底不装了，摊牌了！我们就是列强！所以，从战略层面看，双航母战斗群首次形成编队，其实是在释放西太平洋的话语权必须由我们说的算的重要信号。,https://toutiao.com/group/7432490261776810508/,,0,0,False
母亲瘫痪、父亲疯了，当年那个744分的高考状元，7年后却成了这样,2024-09-08 00:54,7176,1205,八号探秘人,八号探秘人,母亲截肢瘫痪、父亲疯癫痴傻，可对于自己的亲人，他却做出了这样的评价。而今，7年已过，曾经那个让无数人动容的少年，现在如何?,https://toutiao.com/group/7411852147648496162/,,0,0,False
骗子酒馆 #骗子酒馆 #骗子酒吧  Liar's Bar,2024-10-30 09:36,1114,146,鲤鱼Ace,鲤鱼Ace,,https://toutiao.com/group/7431500279108862473/,,0,0,True
3天生产1架！英国《简氏防务周刊》：中国歼-20总数已突破200架！,2024-10-31 10:58,1637,700,军武次位面,军武次位面,近日，权威机构英国《简氏防务周刊》对歼-20的服役数量和产能进行了报道，称目前歼-20已装备12个航空旅，总数接近200架，且这一数量还在不断增加。,https://toutiao.com/group/7431837492355072527/,,0,0,False
真听劝！网友画的洗衣机被小米造出来了，雷军回应,2024-11-02 05:38,770,814,极目新闻,极目新闻,11月1日，小米CEO雷军开直播。谈及近期小米洗衣机火爆，雷军表示“我特别惊讶的是小米洗衣机冲上热搜第四。我们的手机和汽车冲到排行榜第四都很困难。”据直播间主持人回忆，今年有用户在雷军抖音评论区手绘了一张图，说想要双区洗衣机，要一大一小两个分区的洗衣机，不用占很大体积。,http://jms.ctdsb.net/jmythshare/#/index_share?cId=0&contentType=5&contentId=2294818,,0,0,False
总台记者专访丨再战萨巴伦卡遗憾失利 郑钦文：已找到调整方向,2024-11-02 22:44,1191,2255,央视新闻,央视新闻,北京时间11月2日，2024年WTA年终总决赛开赛，郑钦文首秀迎战老对手萨巴伦卡。经过1个多小时鏖战，郑钦文0比2不敌萨巴伦卡，未能拿下小组赛首胜，两盘比分为3比6、4比6。赛后，郑钦文接受了总台记者独家专访。在采访中，郑钦文总结了失利原因，并表示已明确未来进步和调整的方向。,https://content-static.cctvnews.cctv.com/snow-book/index.html?item_id=7596280535233845324&source=50006&sub_source=50006_001,,0,1,False
延长股票交易半小时！这里宣布，11月5日起施行,2024-11-02 07:05,603,327,红星新闻,红星新闻,据共同社报道，日本东京证券交易所将从11月5日起，把股票交易时间延长至总计5.5小时，交易结束时间推迟30分钟至下午3点半。这是东京证交所自1954年以来，时隔70年再次延长交易时间。此举将提高在系统故障发生后恢复交易的可能性，并为海外投资者提供更加便于参与的环境。,https://toutiao.com/group/7432573802904601127/,,0,0,False
穷小子去富婆家里，富婆笑咧嘴把保姆支开，保姆心知肚明,2024-10-26 06:34,1572,196,乐视情感讲堂,乐视情感讲堂,穷小子去富婆家里，富婆笑咧嘴把保姆支开，保姆心知肚明,https://toutiao.com/group/7429969094939509311/,,0,0,True
以后想吃回锅肉你就像我这样做，肥而不腻，咸香适口，太解馋了,2024-08-06 11:19,38060,1367,家常的味道,家常的味道,,https://toutiao.com/group/7399984507362738742/,,0,0,True
51年洪学智妻子寻女无果，到老乡家歇脚老乡惊呼：你要找得就是我,2024-09-22 01:07,11384,788,品古观今,品古观今,前言1951年，阳曲县委大院突然来了7、8位解放军同志，其中一位女同志，就是洪学智的妻子张文。她此番前来，就是为了寻找多年前因战乱而寄养于民间的爱女。可昔日的小村落早已蜕变成另一番景象，这无异于是大海捞针。,https://toutiao.com/group/7417034363226915354/,,0,0,False
民间上坟传统：“上坟不带 5 果，家中不惹灾祸”，哪“5果”？,2024-08-08 10:30,19222,1845,惠农圈,惠农圈,在中国传统文化中，祭祀祖先一直是一项备受重视的活动，它承载着对先人的缅怀、敬意和感恩之情。在上坟的时候，人们会提前准备好供品，比如肉类、酒水，还有水果。其中关于水果的准备，也有着诸多的讲究和禁忌，比如“上坟不带 5 果，家中不惹灾祸”的说法。,https://toutiao.com/group/7400584207141192207/,,0,0,False
美媒：中国又一艘新航母曝光，模样怪异，是干什么用的？,2024-11-02 08:26,1714,108,军武次位面,军武次位面,最近，位于中国广州的广船国际造船厂内，一艘神秘舰艇的突然现身引起了美国媒体的高度关注。这艘舰艇不仅拥有大型开放式飞行甲板，还具有轻型航空母舰或两栖攻击舰的典型特征，一时成为外媒争相报道的热点。,https://toutiao.com/group/7432224320463569427/,,0,0,True
特朗普又要赢了？是福是祸？,2024-10-29 23:00,27062,2990,高志凯频道,高志凯频道,种种迹象表明，懂王要赢了？硅谷科技巨头转向支持特朗普其实就是风向之一。关键是，特朗普如果赢，对于我们是福是祸呢？,https://toutiao.com/group/7429979269775753747/,,0,0,True
小伙洗完澡故意秀肌肉，富婆心跳加速被当场拿下，这下好看了,2024-10-26 16:20,4512,196,乐视情感讲堂,乐视情感讲堂,小伙洗完澡故意秀肌肉，富婆心跳加速被当场拿下，这下好看了,https://toutiao.com/group/7430011217881596426/,,0,0,True
现场直击哈里斯大选总结陈词，华盛顿7.5万人集会盛况空前！,2024-10-30 04:19,12193,3483,王冰汝,王冰汝,,https://toutiao.com/group/7431418524259582473/,,0,0,True
总裁故意扮成保安，试探相亲姑娘，不料对方反应逗了,2024-11-01 09:44,1223,180,乐视热播综艺精选,乐视热播综艺精选,,https://toutiao.com/group/7431780632960696847/,,0,0,True
关于开展2024年中国福利彩票双色球游戏派奖活动的公告,2024-10-27 05:18,824,651,齐鲁壹点,齐鲁壹点,为回馈广大购彩者对中国福利彩票的关心和支持，中国福利彩票发行管理中心决定开展2024年双色球游戏派奖活动。,http://m.ql1d.com/new/general/24994880,,0,0,False
11月，等待新一轮大涨,2024-11-01 05:49,768,459,第一财经,第一财经,（本文作者薛洪言，星图金融研究院副院长）10月，A股整体处于疯涨后的“余震”阶段。剔除10月8日的疯涨尾声，主要宽基指数均录得下跌。10月9日—31日，创业板指（-15.13%）、科创100（-11.,https://m.yicai.com/news/102338532.html,,0,0,False
