title,publish_time,like_count,comment_count,media_name,source,abstract,article_url,tag,is_yaowen,article_sub_type,has_video
习近平总书记的两会之问,2025-03-04 03:45,1394,2802,人民日报,人民日报,党的十八大以来，每年全国两会期间，习近平总书记都会到团组同代表委员交流讨论，问政于民、问计于民、问需于民。,https://www.peopleapp.com/column/30048412395-500006124637?utm_source=tth&promote=true,,0,1,False
改变生命的食物——芫荽（香菜）,2025-02-13 07:50,13909,2231,莱山发布,莱山发布,,https://toutiao.com/group/7470807303827816998/,,0,0,False
乌克兰首都基辅现状，拍摄于2025年3月3日，看看街上还有多少男人,2025-03-03 01:01,14167,6229,王哥说事,王哥说事,,https://toutiao.com/group/7477381859442229801/,,0,0,True
坚持用香皂洗头4个月，头发真的变好了，长出好多新头发！#脱发,2025-02-28 06:48,4305,1049,功成名就,功成名就,,https://toutiao.com/group/7476349657484935731/,,0,0,True
总演坏人的李明，藏着军人世家背景，一曲《天边》惊艳全场！,2025-02-27 07:49,20352,826,御姐音乐L,御姐音乐L,,https://toutiao.com/group/7476002776410046991/,,0,0,True
所有人都认为去银行买金条很简单，但实际上也是大有玄机的。,2025-01-13 05:59,2346,254,岁月静好,岁月静好,,https://toutiao.com/group/7459275615993070080/,,0,0,True
乌克兰阵亡士兵墓地实拍。网友:乌克兰已经打完一代人！,2025-02-28 09:30,34656,12639,晓晓杂谈,晓晓杂谈,,https://toutiao.com/group/7476399945663300133/,,0,0,True
海南部分旅居人群成逃难大军，对于这样的生活，大家怎么看？,2025-02-09 10:48,4474,889,采云飘飘,采云飘飘,,https://toutiao.com/group/7469369555660309055/,,0,0,True
今明两年打算买房的老百姓，要牢记7字真言：买旧、买大、不买三,2024-12-12 10:31,5904,550,消费快报,消费快报,然而，市场上的房源种类繁多，质量参差不齐，这给购房者带来了不小的挑战。在这样的背景下，“买旧、买大、不买三”的购房建议逐渐受到人们的重视。,https://toutiao.com/group/7447470862556611108/,,0,0,False
海面突然伸出一条巨臂，船上的人瞬间吓傻了！,2024-12-17 03:15,88410,13903,笑琴畅谈,笑琴畅谈,,https://toutiao.com/group/7449214050841395724/,,0,0,True
