title,publish_time,like_count,comment_count,media_name,source,abstract,article_url,tag,is_yaowen,article_sub_type,has_video
冰雪春天丨冰天雪地也是金山银山,2025-01-14 07:44,138,279,人民网,人民网,近年来，随着“冰天雪地也是金山银山”理念的深入推广、“带动三亿人参与冰雪运动”成果的不断巩固和扩大，我国优质冰雪“冷资源”向经济发展的“热动力”加速转化，冰天雪地成为群众致富、乡村振兴的“金山银山”。,http://m2.people.cn/news/toutiao.html?s=MV8xXzQwNDAxODIyXzE2NDExM18xNzM2ODM5MTcx,,0,0,False
广西49岁老汉娶19岁姑娘，结婚21年生下15个孩子，如今有何下场？,2024-10-20 08:32,11645,1341,艺述史,艺述史,她19岁出嫁，21年里总共生育了15个孩子，其中4个男孩子11个女孩子，家里热闹的像是开了一所学校一样。,https://toutiao.com/group/7427400319418384948/,,0,0,False
境外“电诈”亲历者讲述：长得没姿色的女子，最终的归宿是公海,2025-01-10 07:23,10698,3553,鲸探所,鲸探所,当时电影《孤注一掷》上映的时候，里面有很多场景让人感觉非常残酷，可实际上，这部电影的导演表示，能拍出来的电影尺度已经是非常克制的了，很多都是点到为止，真实情况比这还要黑暗、残酷百倍千倍。,https://toutiao.com/group/7458180288431899151/,,0,0,False
57岁于文华现状，与丈夫住农村简陋房子，裙子拖地喂着狗生活幸福,2024-12-17 01:24,1934,263,焰墨绘史,焰墨绘史,在阅读此文之前，麻烦您点击一下“关注”，既方便您进行讨论和分享，又能给您带来不一样的参与感，感谢您的支持。本文内容均引用权威资料结合个人观点进行撰写，文中已标注文献来源及截图，请知悉。提起于文华，想必当大家都不会陌生，当年的她凭借那首《纤夫的爱》，一夜间家喻户晓。,https://toutiao.com/group/7448948632033722889/,,0,0,False
铁公鸡来相亲，一听不用买单拼命点菜，哪料姑娘做法更狠,2024-12-26 09:06,4465,1196,热播综艺精选,热播综艺精选,,https://toutiao.com/group/7452643056194421286/,,0,0,True
到底是外公亲，还是爷爷亲？心理学家的答案很统一,2024-12-30 06:35,2373,1192,第一心理,第一心理,一位读者来信，提到最近自己遇到的一些家庭相关的琐事，并提出了自己的一些疑问。具体情况如下：这位读者是一个孩子的母亲，与丈夫结婚之后，一直在丈夫家所在城市生活，也受了公公婆婆不少接济，由于自己父母在另外的城市，有点距离但是不远，孩子出生之后也一直与爷爷奶奶接触更多。,https://toutiao.com/group/7454088472568857126/,,0,0,False
小子相亲故意扮老，谁知道对方一见面就叫他大爷，这段太逗了,2024-12-24 08:17,4831,1077,热播综艺精选,热播综艺精选,,https://toutiao.com/group/7451886130837848610/,,0,0,True
