title,publish_time,like_count,comment_count,media_name,source,abstract,article_url,tag,is_yaowen,article_sub_type,has_video
第一视点·学习手记丨重温“主动来一场‘学习的革命’”,2025-03-24 01:42,806,125,潮新闻,潮新闻,潮新闻这个春天，创新之风劲吹。DeepSeek横空出世，量子科技、具身智能、6G、“人工智能+”被写入政府工作报告……习近平总书记在今年全国两会期间多次强调科技创新。当新一轮科技革命以裂变方式重塑时代版图，领导干部的能力如何与之相匹配？,https://mp.weixin.qq.com/s?__biz=MzkxODIyMzk0Mg==&mid=2247663194&idx=1&sn=9c86f973da8e0359fa9a841fe951f230&cnl=TOUTIAOHAO&source=000080,,0,0,False
“潘金莲”的扮演者王思懿老了后颜值大变完全认不出，但气质还行,2025-03-25 01:49,240,190,小卿卿159,小卿卿159,,https://toutiao.com/group/7485556971072995879/,,0,0,False
安徽小伙娶深圳富婆，富婆大他22岁，47岁生下儿子，婚后1年离婚,2025-02-25 05:23,7157,492,财经科创聚焦,财经科创聚焦,在2019年的初春时节，42岁的深圳女企业家棋棋返回了位于湖北荆州的老家进行探亲。在此期间，她邂逅了一位在理疗店工作的年轻小伙——20岁的涛涛，来自安徽。,https://toutiao.com/group/7475219731243368997/,,0,0,False
人社部定调！2025养老金调整方向：让工龄长、收入低群体“双赢”,2025-03-21 11:31,5560,2866,社保指南针,社保指南针,2025年退休人员基本养老金调整方向已敲定，这轮涉及1.4亿人的退休人“银发红利”暗藏玄机。人社部在年初新闻发布会和两会期间两次释放关键信号:调整机制将向主动中低收入人群精准倾斜，这是关乎“代际公平”的养老金改革重要一环。,https://toutiao.com/group/7484211007951503911/,,0,0,False
神农架野人真相大曝光！,2025-03-03 00:45,4949,199,九儿看世界2W赞,九儿看世界2W赞,,https://toutiao.com/group/7477103809560166964/,,0,0,True
