title,publish_time,like_count,comment_count,media_name,source,abstract,article_url,tag,is_yaowen,article_sub_type,has_video
时政新闻眼丨习近平给“关键少数”上的这一课，释放哪些重要信息？,2024-10-30 01:30,4416,1837,央视新闻,央视新闻,10月29日，面向“关键少数”的重要一课，在中央党校（国家行政学院）举行。,https://content-static.cctvnews.cctv.com/snow-book/index.html?item_id=14850865314774586846&source=50006&sub_source=50006_001,,0,0,False
人民日报评论员：坚定信心凝心聚力，推动改革行稳致远,2024-10-29 23:14,1106,507,人民日报,人民日报,原标题:坚定信心凝心聚力，推动改革行稳致远。“要把学习贯彻党的二十届三中全会精神不断引向深入，引导全党全国人民坚定改革信心，更好凝心聚力推动改革行稳致远。”,https://www.peopleapp.com/column/30047165521-500005874792?utm_source=头条号&promote=true,,0,0,False
小伙洗完澡故意秀肌肉，富婆心跳加速被当场拿下，这下好看了,2024-10-26 16:20,3105,154,乐视情感讲堂,乐视情感讲堂,小伙洗完澡故意秀肌肉，富婆心跳加速被当场拿下，这下好看了,https://toutiao.com/group/7430011217881596426/,,0,0,True
善恶终有报：疫情时对中国一毛不拔，却大方捐美国6亿，如今咋样,2024-09-29 05:50,928,127,睿之悦,睿之悦,可就是这样一位在中国土生土长起来的富豪，在疫情期间面对同胞的困境却一毛不拔，反而大方的捐助了6亿给美国。,https://toutiao.com/group/7419859345154015798/,,0,0,False
罕见！100年前，英国游客拍下的清朝乡村，和想象中完全不一样,2024-09-20 02:07,3536,444,万物知识局,万物知识局,泥泞的土路，衣不蔽体的老百姓，即便是达官显贵的家中也十分破败，而这些都是清王朝的历史痕迹，虽说那时候中国摄影技术并不发达，但也有许多外国游客来到这里，拍摄下了许多老照片，为我们留下了珍贵的历史资料，那清朝到底是怎样的面貌呢?,https://toutiao.com/group/7416287738871267855/,,0,0,False
初二男生放学后买农药自杀身亡，父母起诉学校和农药经营方索赔上百万元 法院判了,2024-10-30 02:36,1649,1682,红星新闻,红星新闻,一名初二男生在放学离校后，买下一瓶农药并喝下自杀，后经抢救无效死亡。事后，家属提起诉讼，向学校及农药的经营方索赔111万余元。,https://cdsbrss.cdsb.com/toutiao_no_video.php?url=https%3A%2F%2Fstatic.cdsb.com%2Fmicropub%2FArticles%2F202410%2F7d727eed8a311a7fcc2f93cf1ee57fd3.html,,0,0,False
统一临近，中美即将摊牌？继工厂内迁后，东风26突然大举增产,2024-10-29 08:30,4728,639,利刃,利刃,这一情况让西方大吃一惊，随即调取了2023年至今的卫星照片，发现该地起码生产了72辆东风-26导弹车，其数量几乎可以装备3个导弹旅，按照每个导弹车2辆备弹车计算，那就是整整216枚东风-26导弹，这还是一个地区一年的“产量”。,https://toutiao.com/group/7431111644132000294/,,0,0,False
小西天景区67岁保安大爷感言已“憋屈离职”，称透露薪资被约谈后因病买药脱岗被辞，引舆情后又被叫回去,2024-10-30 09:13,706,663,大风新闻,大风新闻,山西小西天景区67岁保安大爷所谓“因言获罪被辞”一事可谓一波三折，牵动了不少热心网友的关切。10月15日，保安高大爷笑谈“涨薪500元”的视频引发全网关注。10月18日，有网友称该保安大爷因透露工资被辞退。20日，相关单位称，该保安大爷未被辞退，且已调到更轻松的岗位。,https://toutiao.com/group/7431493470767907355/,,0,0,False
农村小情侣深夜约会，在屋内过着二人世界，兴奋坏了,2024-10-16 01:14,2163,228,乐视热播综艺精选,乐视热播综艺精选,农村小情侣深夜约会，在屋内过着二人世界，兴奋坏了,https://toutiao.com/group/7426173284741284364/,,0,0,True
44岁男子与67岁包子铺老板娘相恋3年，曾被认为是对方儿子，想要张结婚证有归属感，女方：我要年轻点就好了,2024-10-30 06:58,1671,932,九派新闻,九派新闻,10月30日，据四川广播电视台《黄金三十分》报道，在成都市新都区，67岁的包子店老板娘胡蓉与44岁的男友阿穆相恋，这段有着23岁年龄差距的恋情引发外界关注。阿穆80年出生，今年44岁，在胡蓉包子铺帮忙时，有时候会被人认为是胡蓉的儿子。,https://toutiao.com/group/7431448516058219059/,,0,0,False
她是第一位博士级歌唱家，12次荣登春晚，丈夫的身份更是深藏不露,2024-08-10 11:05,15938,470,豆莱说,豆莱说,文：豆莱说编辑：豆莱说支持作者，写作不易，文中会有5s广告，观看后可免费阅读全文在当下华语乐坛中，有很多的出色的歌唱家，雷佳就是其中一位。因为她不仅是我国首个荣获了博士学位的歌唱家，更是出道20年就12次登上了春晚舞台的歌唱家。而且，她丈夫的身份也是不容小觑。,https://toutiao.com/group/7401461240674943542/,,0,0,False
欧盟决定对中国电动汽车征收为期五年的最终反补贴税！德国汽车工业协会：全球自由贸易的倒退......,2024-10-29 23:53,163,172,每日经济新闻,每日经济新闻,每经编辑：杜宇据央视新闻10月30日消息，当地时间10月29日，欧盟委员会发布消息称结束了反补贴调查，决定对从中国进口的电动汽车（BEV）征收为期五年的最终反补贴税。相关决定预计将于当地时间30日在《欧盟官方公报》上公布，反补贴税将于31日起正式实施。,http://www.nbd.com.cn/rss/jinri_toutiao/articles/3619691.html,,0,0,False
"万万没想到,53岁“丁克”半辈子的康辉，一生遗憾竟然是一通电话",2024-08-21 22:14,28508,5474,峰哥正读,峰哥正读,在阅读此文之前，麻烦您点击一下“关注”，既方便您进行讨论和分享，又能给您带来不一样的参与感，感谢您的支持！文/编辑：蘑菇百善孝为先。但是到底怎么做才算是“孝”，康辉用了半辈子才明白。央视知名主持人康辉，事业顺遂，家庭幸福，在外人看来是一个人生赢家。,https://toutiao.com/group/7405504703687115273/,,0,0,False
军号一响，全军出击！,2024-09-19 08:01,26453,1662,中国军号,中国军号,,https://toutiao.com/group/7416261401477382668/,,0,0,True
阿斯麦向美国承诺：只要解放军攻台，立刻远程瘫痪台积电光刻机,2024-10-25 14:34,6990,2589,司马南,司马南,偶然看到一则信息，阿斯麦公司向美国作出保证，如果中国人民解放军攻打台湾地区，他们便立刻远程瘫痪台积电的光刻机。,https://toutiao.com/group/7429718340911858195/,,0,0,False
中国手机新三巨头诞生!华为升至第二 第一太稳了,2024-10-28 03:40,1890,1714,华商网,华商网,10月28日消息，据Counterpoint Research最新研报，2024年Q3中国智能手机销量同比增长2.3%，连续四个季度实现同比正增，市场有望实现五年来首次年增长。这也进一步确认了2024年市场回暖趋势，全年有望实现同比低个位数增长，提升了行业信心。,https://digi.hsw.cn/system/2024/1028/171909.shtml,,0,0,False
土豆搭配洋葱，教你一个神仙吃法，一次3斤不够吃，太解馋了,2024-09-26 09:09,28497,1708,家常的味道,家常的味道,土豆搭配洋葱，教你一个神仙吃法，一次3斤不够吃，太解馋了,https://toutiao.com/group/7418876506660667904/,,0,0,True
山西五台山悬崖上的狐仙洞，发现住着2个千年狐仙，上去吓得腿软,2024-10-22 03:00,4937,523,山西凡凡,山西凡凡,,https://toutiao.com/group/7428429414959940106/,,0,0,True
神十九乘组亲友看发射直播：宋令东母亲抹泪 王浩泽家属紧张屏息,2024-10-29 23:36,3371,191,海客新闻,海客新闻,10月30日清晨，神舟十九号载人飞船成功飞天，中国“神箭”再探苍穹。三名航天员蔡旭哲、宋令东、王浩泽的亲友也在电视机前观看了飞船发射的直播。,https://toutiao.com/group/7431345531005174307/,,0,0,True
以后想吃回锅肉你就像我这样做，肥而不腻，咸香适口，太解馋了,2024-08-06 11:19,36657,1331,家常的味道,家常的味道,,https://toutiao.com/group/7399984507362738742/,,0,0,True
给近三年最好的10部年代剧排个名：《人世间》第6，第1名没有争议,2024-09-06 08:08,9506,3154,皮皮电影,皮皮电影,时尚是个轮回，电视剧也是。在2020年之前的那些年，电视剧市场基本上都被偶像剧、都市剧霸占。曾经撑起国剧品质的《闯关东》《岁月》这类年代好剧，难见踪影。,https://toutiao.com/group/7411390030722712090/,,0,0,False
15年前他在爱妻葬礼上哭到昏厥，发誓永不再娶，如今他做到了吗？,2024-08-24 02:17,18028,570,八号探秘人,八号探秘人,在阅读此文之前，辛苦您点击一下“关注”，既方便您进行讨论和分享，又能给您带来不一样的参与感，感谢您的支持！编辑丨xk纵观鱼龙混杂的娱乐圈，有人背叛，有人痴情。而果靖霖则是公认的好男儿，将一生都奉献给妻子。但妻子却仅仅陪他走了半生，没能战胜病魔，不幸离开人世。,https://toutiao.com/group/7406210316734710283/,,0,0,False
穷小子去富婆家里，富婆笑咧嘴把保姆支开，保姆心知肚明,2024-10-26 06:34,1170,155,乐视情感讲堂,乐视情感讲堂,穷小子去富婆家里，富婆笑咧嘴把保姆支开，保姆心知肚明,https://toutiao.com/group/7429969094939509311/,,0,0,True
杨妞花声音嘶哑念判决书：第一次看到余华英双手发抖,2024-10-25 03:49,5369,645,海客新闻,海客新闻,杨妞花声音嘶哑念判决书：第一次看到余华英双手发抖 她心里面是害怕的,https://toutiao.com/group/7429555385935069732/,,0,0,True
富婆给儿子买房，怎料看中售楼女孩，要把她介绍给儿子,2024-10-25 06:56,3681,456,乐视娱乐乐透社,乐视娱乐乐透社,,https://toutiao.com/group/7429603554647605798/,,0,0,True
中国人民银行征信中心发布郑重声明！,2024-10-29 07:43,1235,1007,每日经济新闻,每日经济新闻,每经编辑：张锦河10月29日，中国人民银行征信中心在官方公众号发布郑重声明称，近日，我们发现有不法中介为达营销目的，散播所谓“2024年征信恢复新规”不实言论，以此诱导社会公众。为此，我中心郑重声明如下：一、目前并未有新规定发布。,http://www.nbd.com.cn/rss/jinri_toutiao/articles/3615541.html,,0,0,False
关于开展2024年中国福利彩票双色球游戏派奖活动的公告,2024-10-27 05:18,704,571,齐鲁壹点,齐鲁壹点,为回馈广大购彩者对中国福利彩票的关心和支持，中国福利彩票发行管理中心决定开展2024年双色球游戏派奖活动。,http://m.ql1d.com/new/general/24994880,,0,0,False
特朗普称大陆若对台动武将向大陆征收200%关税，国台办回应,2024-10-30 04:16,1676,1553,澎湃新闻,澎湃新闻,国务院台办10月30日上午举行例行新闻发布会，发言人朱凤莲回答记者提问。有记者问，美国共和党总统候选人特朗普日前受访谈到台湾问题时称，若其当选后“中共对台湾动武”，将对中国大陆征收150%至200%关税。他还称“如果台湾要美国保护，就该缴保护费”。对此有何评论？,https://m.thepaper.cn/newsDetail_forward_29189247?from=toutiao,,0,0,False
女省长下乡视察，穷大叔一看愣住了，竟是当年救下的女乞丐,2024-10-29 03:52,1876,194,乐视娱乐乐透社,乐视娱乐乐透社,,https://toutiao.com/group/7431040293010407988/,,0,0,True
写歌30年穷困潦倒，前妻失望选择离婚，谁料51岁靠一首歌一夜成名,2024-08-12 03:37,26200,4343,八号探秘人,八号探秘人,在阅读此文之前，辛苦您点击一下“关注”，既方便您进行讨论和分享，又能给您带来不一样的参与感，感谢您的支持！编辑：LY无数人都想要一个一夜成名的机会，但机会来了也不是每个人都能把握住的。他用了三十年的时间来准备迎接属于自己的机会。为了这个机会他放弃了一切，甚至包括家庭。,https://toutiao.com/group/7402090890367484428/,,0,0,False
台媒关注大陆是否愿意向台湾供电？国台办回应,2024-10-30 03:21,1657,186,中国台湾网,中国台湾网,中国台湾网10月30日讯 国务院台湾事务办公室今天上午举行例行新闻发布会，国台办发言人朱凤莲主持本次新闻发布会。 台湾《中国时报》记者：台经济主管部门负责人日前提出，在菲律宾和日本设置绿能发电厂，通过海底电缆或船运方式向台输电。对此有何评论？,http://www.taiwan.cn/xwzx/xwfbh/gtbxwfbh/tuwen/202410/t20241030_12659746.htm,,0,0,False
特朗普又要赢了？是福是祸？,2024-10-29 23:00,16658,1909,高志凯频道,高志凯频道,种种迹象表明，懂王要赢了？硅谷科技巨头转向支持特朗普其实就是风向之一。关键是，特朗普如果赢，对于我们是福是祸呢？,https://toutiao.com/group/7429979269775753747/,,0,0,True
李连杰经典之作，至今无人可超越的动作片，百看不厌！,2024-10-24 07:00,991,217,乐视典藏金曲汇,乐视典藏金曲汇,李连杰经典之作，至今无人可超越的动作片，百看不厌！,https://toutiao.com/group/7429164214465331724/,,0,0,True
