title,publish_time,like_count,comment_count,media_name,source,abstract,article_url,tag,is_yaowen,article_sub_type,has_video
央视曝光后，火速道歉！,2025-03-15 16:05,184,354,澎湃新闻,澎湃新闻,3月15日，啄木鸟家庭维修被央视“3·15”晚会曝光“无病乱修、小病大修、乱收费，坑骗消费者”等乱象。,http://mp.weixin.qq.com/s?__biz=MjM5MzI5NTU3MQ==&mid=2652429621&idx=1&sn=5bc870caae40bd42af28e1025ea13c5b,,0,0,False
突发！美军发动大规模空袭！,2025-03-16 00:42,591,403,闽南网,闽南网,胡塞武装说，也门首都萨那从15日晚开始遭到多次空袭，目前造成至少13人死亡、9人受伤。加沙、黎巴嫩局势尚不平静，美国为何又欲使中东一处再陷入战火之中?,https://toutiao.com/group/7482201121511997961/,,0,0,False
春天，这菜使劲吃！一养肝、二护眼、三排毒、四通便，鲜嫩营养高,2025-02-26 11:49,5603,688,秀厨娘,秀厨娘,春风拂过田野，沉睡一冬的泥土里冒出了星星点点的嫩芽。这种带着淡淡清香的野菜，是春天给我们的第一份健康好食材。,https://toutiao.com/group/7475671861737570816/,,0,0,False
“退货！退货！退货！”大量网友涌入！集体停播！,2025-03-16 00:44,730,759,行动新闻,行动新闻,济宁市委、市政府高度重视，立即成立由市场监管、卫生健康、公安等部门组成的联合调查组，第一时间赶赴现场，依法对涉事企业进行查封，控制了企业负责人。,https://toutiao.com/group/7482200736516882996/,,0,0,False
现在嫌她们丑，当年追成狗！这些发福的女明星，当年都是大美女,2025-01-24 10:06,3636,1263,晓娱海棠,晓娱海棠,现在嫌她们丑，当年追成狗!娱乐圈的美女明星虽说一抓一大把，但终究没能抵过岁月这把杀猪刀!曾经的她们美到让人窒息，没有一个网红脸，却都美的倾国倾城。,https://toutiao.com/group/7463407460499145227/,,0,0,False
拿走李嘉诚巴拿马港口的贝莱德，才高兴了几天，却发现自己上当了,2025-03-14 01:41,3690,305,阿华今天说事,阿华今天说事,,https://toutiao.com/group/7481474325049049600/,,0,0,True
胡蝶与戴笠的真实彩色照片，胡蝶一颦一笑妩媚多姿，戴笠不怒自威,2025-02-17 10:26,4942,502,浩舞默画,浩舞默画,只看照片，就连其美的三分之一，也感知不到。胡蝶出生时并不知道她会成为当红的明星，每一个孩子初次来到这个人间时，发出第一个声音，永远是啼哭，似乎来到这个人间并非是一件幸运的事情。,https://toutiao.com/group/7472271893941207563/,,0,0,False
有幸去了趟广西防城港，实话说，这座城市和我想象的完全不一样！,2025-01-06 14:30,343,156,博学多才的饼干eV,博学多才的饼干eV,说实话，之前对广西防城港的印象，就是一个小城市，可能也没啥特别的亮点。想象中它应该就是那种安静、低调的地方，风景不错，但也没什么太大惊喜。结果，上个月去了趟防城港，完全打破了我对这座城市的所有想象！你一定想不到，这座城市竟然藏着这么多惊喜！,https://toutiao.com/group/7456805135486943782/,,0,0,False
