title,publish_time,like_count,comment_count,media_name,source,abstract,article_url,tag,is_yaowen,article_sub_type,has_video
小沈阳夫妇把演唱会开到了北京春晚舞台！,2025-01-29 16:47,14916,2647,非凡蛋糕mu,非凡蛋糕mu,,https://toutiao.com/group/7465379968436994623/,,0,0,True
中国人的后代，他们盼回家。果敢同盟军2025年春节联欢晚会现场,2025-01-31 09:19,38618,4693,卫文布棋,卫文布棋,,https://toutiao.com/group/7466006571915543074/,,0,0,True
女房东爱上24岁男租客，这样的话也说得出口，涂磊神助攻,2025-01-18 02:53,5430,249,金曲大荟萃,金曲大荟萃,女房东爱上24岁男租客，这样的话也说得出口，涂磊神助攻,https://toutiao.com/group/7461083095078044195/,,0,0,True
华为200万年薪都留不住他！天才少年彭志辉离职后，现状曝光,2025-01-16 09:28,4405,653,与君説,与君説,在阅读此文之前，麻烦您点击一下“关注”，既方便您进行讨论和分享，又能给您带来不一样的参与感，感谢您的支持文、编辑|小娄你敢相信吗？大厂华为200万年薪的工作，竟然也有人不屑一顾。入职华为两年后，彭志辉毅然决然选择离职。,https://toutiao.com/group/7460439446131884579/,,0,0,False
宋小宝撞上闫学晶，俩唱二人转的真人精！笑点疯狂往外抖,2025-01-06 03:43,5023,672,PP影视圈剧院,PP影视圈剧院,,https://toutiao.com/group/7456641563670676018/,,0,0,True
特斯拉机器人与宇树Unitree G1机器人的行走方式比较,2025-01-23 10:40,2883,1672,油管那点热,油管那点热,,https://toutiao.com/group/7463059044324868648/,,0,0,True
在美国的华人开始慌了，没想到开始清算他们了,2025-01-31 05:12,6365,276,哈哈哈哈额,哈哈哈哈额,,https://toutiao.com/group/7465942869707178515/,,0,0,True
王志文找江珊复婚，看两人对话简直太享受，不愧是老戏骨啊,2024-11-30 19:30,6189,727,娱快很简单,娱快很简单,,https://toutiao.com/group/7441487197062201893/,,0,0,True
贵州省一户人家，100年祖坟搬迁，调来一台挖掘机挖开看看,2025-01-15 22:21,13533,6176,PP街坊放映厅,PP街坊放映厅,,https://toutiao.com/group/7458121649800413748/,,0,0,True
公公竟然和儿媳偷情，哪料被妻子撞见，这下有戏看了！,2025-01-21 08:05,10476,890,南瓜午夜厅,南瓜午夜厅,,https://toutiao.com/group/7462273852651979274/,,0,0,True
20岁藏族女孩一妻多夫制的生活 拥有两个老公 两人还是兄弟俩,2024-11-29 01:29,25250,3367,嘀嘀军情热点,嘀嘀军情热点,,https://toutiao.com/group/7442507233344094760/,,0,0,True
110：警方侦破新型招嫖方式，犯罪手段简单，民警法眼显神威,2025-01-21 23:26,3283,2002,嘎嘎剧有料,嘎嘎剧有料,,https://toutiao.com/group/7462328582048711205/,,0,0,True
