title,publish_time,like_count,comment_count,media_name,source,abstract,article_url,tag,is_yaowen,article_sub_type,has_video
习言道｜习近平提到的“幸福路”，特别在哪儿？,2025-01-18 12:16,877,483,中国新闻网,中国新闻网,题:习近平提到的“幸福路”，特别在哪儿?“你们因这条‘幸福路’与中国结缘，是中肯和中非友好合作的见证者、受益者，更是建设者和传播者。”,http://ku.m.chinanews.com/wapapp/cns/gn/2025/01-18/10355866.shtml,,0,0,False
吉林文旅再次回应重庆女游客事件！花棉袄主播连夜改名难逃网暴,2025-01-17 03:40,303,311,易霄寒,易霄寒,文 |易霄寒编辑 |易霄寒本文陈述所有内容，皆有可靠来源图片来源于网络序冬天的旅游景点中东北绝对算是top1，可火了两年的东北如今可能要栽在吉林一大爷手里。好心扶人垫付医药费最后还反被这名重庆女游客讹，这让不少网友梦回前几千的“扶不扶”。,https://toutiao.com/group/7460721340715139638/,,0,0,False
TikTok停止在美服务，称特朗普表示上任后将共同寻求恢复其使用,2025-01-19 04:00,3743,2566,界面快讯,界面快讯,界面新闻获悉，TikTok向美国用户推送信息称，“很抱歉，TikTok目前无法使用。美国已经颁布了一项禁止TikTok的法律。很遗憾，这意味着你暂时无法使用TikTok。幸运的是，特朗普总统（即将上任）表示，他上任后将与我们共同努力寻找解决方案，以恢复TikTok的使用。,https://m.jiemian.com/article/12266983_ttkx.html,,0,0,False
今天才知道，刮鱼鳞只需一个塑料袋，鱼鳞不飞溅不脏手，快又干净,2025-01-12 08:24,6768,2014,明玥美食,明玥美食,,https://toutiao.com/group/7458941865824617014/,,0,0,True
境外“电诈”亲历者讲述：长得没姿色的女子，最终的归宿是公海,2025-01-10 07:23,12032,3954,鲸探所,鲸探所,当时电影《孤注一掷》上映的时候，里面有很多场景让人感觉非常残酷，可实际上，这部电影的导演表示，能拍出来的电影尺度已经是非常克制的了，很多都是点到为止，真实情况比这还要黑暗、残酷百倍千倍。,https://toutiao.com/group/7458180288431899151/,,0,0,False
房子旁边住着有120条“狗母蛇”，很多人都没见过，拍给大家看看,2024-11-05 12:27,9286,3168,乡村小故事小妹,乡村小故事小妹,房子旁边住着有120条“狗母蛇”，很多人都没见过，拍给大家看看,https://toutiao.com/group/7433770965259354650/,,0,0,True
哥哥以为妹妹不会玩游戏，没想到竟是隐藏大佬,2025-01-02 04:22,2529,532,大综艺咖,大综艺咖,,https://toutiao.com/group/7455163691239998004/,,0,0,True
中国外交的一次罕见举动,2025-01-17 03:18,19758,372,牛弹琴,牛弹琴,中国先礼后兵，应该已在行动中,https://toutiao.com/group/7460718371198321202/,,0,0,True
弹性退休落地！1968年至1978年出生的男性，多个退休年龄要咋选？,2025-01-15 03:46,1728,267,社保当家,社保当家,弹性退休落地！1968年至1978年出生的男性，多个退休年龄该如何选择？看看2025年，延迟退休实施，让人欣喜的是，弹性退休办法也同步落地，每个人不再像过去那样按照固定、刚性的退休年龄来办理，而是多了弹性选择的空间，缓解了大家对延迟退休的焦虑。,https://toutiao.com/group/7459639651284894247/,,0,0,False
罪域：中央最大老虎被查，没人敢抓捕，书记：后台再硬我亲自去抓,2025-01-14 06:17,8351,373,乐视谍战影视营,乐视谍战影视营,,https://toutiao.com/group/7459651246346043919/,,0,0,True
上海独居老人离世，留下430万元和一套房无人继承……法院判了,2025-01-19 00:06,596,1299,红星新闻,红星新闻,老人离世后没立遗嘱、也没有继承人留下的遗产，谁来管理？这则新闻冲上热搜第一据上海法治报报道：3年前的夏天，徐汇区一小区内一独居老人葛老伯猝死家中。由于葛老伯未曾生育的女儿、老伴，以及祖父母、外祖父母均先于葛老伯死亡。,https://toutiao.com/group/7461410579249365539/,,0,0,False
