title,publish_time,like_count,comment_count,media_name,source,abstract,article_url,tag,is_yaowen,article_sub_type,has_video
有人冒充我男朋友，算不算诈骗？遇到奇葩事你会怎么办？,2024-09-06 05:52,1697,224,兴凯湖莹莹,兴凯湖莹莹,,https://toutiao.com/group/7411404025502892554/,,0,0,True
一巴掌的代价，公交车上大妈打晕患癌小伙，断送退休后的幸福生活,2024-10-14 09:53,829,486,客观听書,客观听書,公交车上老太太和小伙吵了起来，老太太更是当仁不让直接给了小伙一巴掌。这名小伙直接倒地，老大大根本就不会想到正是因为他的一巴掌，鲜活的生命就这样消失在他的手里。,https://toutiao.com/group/7425563455358468627/,,0,0,False
给近三年最好的10部年代剧排个名：《人世间》第6，第1名没有争议,2024-09-06 08:08,1567,494,皮皮电影,皮皮电影,时尚是个轮回，电视剧也是。在2020年之前的那些年，电视剧市场基本上都被偶像剧、都市剧霸占。曾经撑起国剧品质的《闯关东》《岁月》这类年代好剧，难见踪影。,https://toutiao.com/group/7411390030722712090/,,0,0,False
一夜之间跌落神坛，钟南山院士究竟做了什么？为何那么多人骂他？,2024-10-16 04:15,281,175,杨杨说历史,杨杨说历史,,https://toutiao.com/group/7426222424129831458/,,0,0,True
写歌30年穷困潦倒，前妻失望选择离婚，谁料51岁靠一首歌一夜成名,2024-08-12 03:37,25940,4293,八号探秘人,八号探秘人,在阅读此文之前，辛苦您点击一下“关注”，既方便您进行讨论和分享，又能给您带来不一样的参与感，感谢您的支持！编辑：LY无数人都想要一个一夜成名的机会，但机会来了也不是每个人都能把握住的。他用了三十年的时间来准备迎接属于自己的机会。为了这个机会他放弃了一切，甚至包括家庭。,https://toutiao.com/group/7402090890367484428/,,0,0,False
“黄晓明睡醒一看，天塌了”！叶珂乱说话，一夜之间得罪两位大佬,2024-10-15 17:18,144,491,自在胜过一切,自在胜过一切,对不起网友们，是我误会你们了！这个叶珂真该骂，黄晓明睡醒一看，天塌了，不该得罪的人，得罪了！叶珂直播时说伍佰的歌“猥琐”，吐槽《今天我要嫁给你》是一首很丢人的歌曲，突然觉得她真该骂，说话一点分寸都没有，还敢自称是豪门千金。,https://toutiao.com/group/7426040612263674409/,,0,0,False
中日已谈妥，当着我高层的面，石破茂连做3项保证，信号极不寻常,2024-10-15 08:52,1987,166,议史纪,议史纪,,https://toutiao.com/group/7425922725736088103/,,0,0,True
为国争光却遭郎平弃用！转身效力土耳其的王一梅，如今咋样了？,2024-08-31 13:19,938,144,豆莱说,豆莱说,光阴似箭，日月如梭，当初的少女早已退役，成为了排球场的幕后人，这么多年她都经历了什么，现在又怎么样了呢?,https://toutiao.com/group/7409287778514567718/,,0,0,False
土豆搭配洋葱，教你一个神仙吃法，一次3斤不够吃，太解馋了,2024-09-26 09:09,19616,1210,家常的味道,家常的味道,土豆搭配洋葱，教你一个神仙吃法，一次3斤不够吃，太解馋了,https://toutiao.com/group/7418876506660667904/,,0,0,True
今天才知道！电动车“每天充”和“用完再充”，到底哪个更伤电池,2024-08-27 11:19,11390,2096,鲸探所,鲸探所,“今天到底给车充不充电？”估计大多数人每天回家都会想这个问题，看着自己的电动车电量又多又少的，充不充电也是一件非常难以抉择的事情。那么，电动车到底应该怎样充电呢？是每天都充，还是用完之后再充呢？电动车充电不管是在城市还是农村，电动车其实都是人们出门最常见的交通工具。,https://toutiao.com/group/7407773012533117475/,,0,0,False
京东：刘强东章泽天夫妇已报案,2024-10-16 01:00,547,489,河南商报,河南商报,10月16日，@京东发言人 发布声明称，近日，有关章泽天女士加入“光明会”、恶意造谣抹黑刘强东章泽天夫妇家庭及私人生活等不实信息在网络上广泛传播，大量水军账号有组织地大肆散布、传播上述谣言，短时间内炮制出上万条谣言信息。,https://toutiao.com/group/7426171943390396928/,,0,0,False
初中毕业去当流水线女工，五年后却成为世界冠军，22岁成人生赢家,2024-08-02 10:46,6358,1213,豆莱说,豆莱说,文：豆莱说编辑：豆莱说支持作者，写作不易，文中会有5s广告，观看后可免费阅读全文父母曾设想过子女的千百种可能，只是对于一个走上中专之路的孩子，无非也是毕业，打工，进工厂，养家糊口。,https://toutiao.com/group/7398489613888766475/,,0,0,False
