title,publish_time,like_count,comment_count,media_name,source,abstract,article_url,tag,is_yaowen,article_sub_type,has_video
315曝光过的“10大食品黑名单”，越看越恶心，网友：希望天天315,2025-03-17 07:41,2053,689,爱玉门,爱玉门,2025年的晚会以“共铸诚信 提振消费”为主题，再次聚焦食品安全、公共安全等领域的违法行为，推动构建公平的消费环境。食品安全作为民生核心问题，始终是晚会的重中之重。,https://toutiao.com/group/7482680287500796452/,,0,0,False
这是张学良老婆赵四小姐真实样貌，并非演员饰演而是货真价实真品,2024-12-28 11:28,34389,2757,历史伟人,历史伟人,赵四小姐，原名赵一荻，她从十六岁开始她终生陪伴张学良，历经坎坷，赵一荻是富家大小姐，但是在张学良囚禁期间，她选择陪伴软禁中的张学良，后悔过吗?,https://toutiao.com/group/7453422736652698175/,,0,0,False
打通最后200米？武统全面加速，赖清德突破红线，投降都来不及?,2025-03-14 03:54,22904,6778,方清的视角,方清的视角,彻底不装了，赖清德公然将大陆定位为境外反对势力，已经突破了红线，关键时刻，解放军的登陆利器曝光，到时候台湾当局投降都来不及。,https://toutiao.com/group/7481507923127058980/,,0,0,False
信号强烈！72小时内，官方3批李嘉诚，再不回头将被钉历史耻辱柱,2025-03-16 16:29,632,324,正在说,正在说,商人追求利润，低买高卖，本身无可厚非，但是要是为了追求利益，居然连最基本的爱国底线都悍然抛弃的话，那么这样的一个商人虽然可能能够获得眼前一时的利益，但是最终必然会被钉到历史的耻辱柱上。,https://toutiao.com/group/7482444842446979634/,,0,0,False
"央视曝光“夺命保鲜膜”,有害物很多人都在用，看完一定停止使用",2025-03-17 05:18,329,134,半夏,半夏,,https://toutiao.com/group/7482643475340526095/,,0,0,True
李嘉诚：一旦房价再涨，未来10年中国近一半家庭或面临5大问题,2025-03-15 04:46,720,279,河山锐新闻,河山锐新闻,在社会经济的宏大棋局中，房价，无疑是那颗最受瞩目的棋子，一举一动都深深牵动着千家万户的心。然而，就在这一片看似乐观繁荣的楼市氛围中，94 岁高龄的商业巨擘李嘉诚，却宛如一位冷静的旁观者，抛出了令人震惊的观点:“房价再涨，近一半家庭要面临 5 大危机!”,https://toutiao.com/group/7481699044801331739/,,0,0,False
它被称为“天然杀菌菜”建议多吃，一 预防感冒 ，二健脾开胃促消化,2024-12-26 08:49,2125,787,敦煌发布,敦煌发布,大葱爆肉丝。葱烧豆腐。葱烧海参。葱烧鸡腿肉。葱爆牛肉。,https://toutiao.com/group/7452639895757144610/,,0,0,False
