title,publish_time,like_count,comment_count,media_name,source,abstract,article_url,tag,is_yaowen,article_sub_type,has_video
独家视频丨习近平抵达巴西利亚开始对巴西进行国事访问,2024-11-19 20:21,1450,942,央视新闻,央视新闻,当地时间11月19日下午，国家主席习近平乘专机抵达巴西利亚，开始对巴西进行国事访问。,https://content-static.cctvnews.cctv.com/snow-book/index.html?item_id=12160704686062364666&source=50006&sub_source=50006_001,,0,1,False
郑钦文、孙颖莎、全红婵……还有王嘉尔、易烊千玺，这个榜单正式揭晓！,2024-11-17 10:34,184,182,潇湘晨报•晨视频,潇湘晨报•晨视频,2024年APEC峰会期间，亚太U30杰出青年领袖榜单正式揭晓。中国运动员郑钦文、孙颖莎、全红婵、陈梦、樊振东、潘展乐、苏翊鸣入选。此外，中国歌手王嘉尔、易烊千玺，演员姚安娜也在名单之中。,http://api.chenshipin.com/wap/a/6739c55e842017742b3d58cf/90f456b81afce808c1fcfbd3f5761f65/1731839540/e5831033de2cdf4a4de7f3e0a32157dd483ae0dc80f6ee88da5ef89ef6db3155,,0,0,False
SpaceX星舰第六次试飞点火发射：特朗普到场观看 火箭携烈焰升空,2024-11-19 22:42,6845,2947,海客新闻,海客新闻,SpaceX星舰第六次试飞点火发射：特朗普到场观看 火箭携巨大烈焰升空,https://toutiao.com/group/7439124420800545319/,,0,0,True
人被咬伤门被撞坏找谁赔？自卫若失手打死老虎违法吗？抓到如何处置？律师详解,2024-11-18 10:22,613,813,极目新闻,极目新闻,11月18日，黑龙江勃利县出现老虎进村伤人事件。目前，县公安局、林业和草原局、应急管理局等部门及属地乡镇工作人员正在追踪老虎行踪。据伤者家属称，这次有“两只老虎”进村，家人被袭时用手臂阻挡避险时被咬，伤情较重，手臂恐怕难以保住。,http://jms.ctdsb.net/jmythshare/#/index_share?cId=0&contentType=5&contentId=2307224,,0,0,False
果然，特朗普开始发威了,2024-11-17 23:00,20272,2720,高志凯频道,高志凯频道,对于关键职位的最新提名，充分体现了对于特朗普来说，忠诚压倒一切。作为近年来权力最大的美国总统，特朗普的破坏力才刚刚开始,https://toutiao.com/group/7437717535526486555/,,0,0,True
著名专家预言：试管婴儿寿命仅40年，那首例试管婴儿如今怎样了？,2024-09-01 06:05,10288,494,睿之悦,睿之悦,文|睿之悦编辑|睿之悦“试管婴儿活不到40岁？”1988年3月10日，我国首例试管婴儿顺利诞生。在当时，试管婴儿的技术正处于起步阶段，因此，有人将其视为医学的奇迹，但也有人则预言试管婴儿活不过40岁。那么，36年的时间过去了，我国首例试管婴儿如今怎么样了呢？,https://toutiao.com/group/7409105262277853733/,,0,0,False
沦落到掏不出1.4万元？富婆赵薇传来最新消息，被申请强制执行，因30亿“蛇吞象”并购被监管层重罚，仍有400余起证券虚假陈述纠纷案件待处理,2024-11-19 06:59,6785,1990,金融界,金融界,金融界11月19日消息 在娱乐圈和A股名利场消息已久富婆赵薇传来最新消息，如今沦落到掏不出1.4万元?,http://m.jrj.com.cn/toutiao/2024/11/19/45442376.shtml,,0,0,False
包厢全是刚出狱的恶霸，结果一看到饭店主厨，立马怂了,2024-11-11 01:21,6738,149,乐视群星访谈秀,乐视群星访谈秀,,https://toutiao.com/group/7435825833048015400/,,0,0,True
手上一奇穴，让你肝血充足眼睛亮，现在揉效果最好,2024-10-21 07:30,91153,9732,梁医学社梁怡璋医生,梁医学社梁怡璋医生,,https://toutiao.com/group/7427920784783311396/,,0,0,True
首例5胞胎长大了，父亲已过劳去世 母亲直言：如能重来一个也不要,2024-08-31 03:06,2988,818,睿之悦,睿之悦,2002年，在北京的一家妇产医院中，一位来自河北的孕妇顺利生下了两男三女的五胞胎，创造了一个全国罕见的奇迹。,https://toutiao.com/group/7409098624111575603/,,0,0,False
15年前他在爱妻葬礼上哭到昏厥，发誓永不再娶，如今他做到了吗？,2024-08-24 02:17,21087,636,八号探秘人,八号探秘人,在阅读此文之前，辛苦您点击一下“关注”，既方便您进行讨论和分享，又能给您带来不一样的参与感，感谢您的支持！编辑丨xk纵观鱼龙混杂的娱乐圈，有人背叛，有人痴情。而果靖霖则是公认的好男儿，将一生都奉献给妻子。但妻子却仅仅陪他走了半生，没能战胜病魔，不幸离开人世。,https://toutiao.com/group/7406210316734710283/,,0,0,False
罕见！100年前，英国游客拍下的清朝乡村，和想象中完全不一样,2024-09-20 02:07,6823,663,万物知识局,万物知识局,泥泞的土路，衣不蔽体的老百姓，即便是达官显贵的家中也十分破败，而这些都是清王朝的历史痕迹，虽说那时候中国摄影技术并不发达，但也有许多外国游客来到这里，拍摄下了许多老照片，为我们留下了珍贵的历史资料，那清朝到底是怎样的面貌呢?,https://toutiao.com/group/7416287738871267855/,,0,0,False
长子让位，80后继母上任！杉杉股份百亿遗产大战风波落定,2024-11-19 07:13,498,273,大河报,大河报,11月18日晚间，杉杉股份（600884.SH）发布公告称，公司董事长郑驹拟辞任，董事会选举董事周婷为新任董事长，任期至第十一届董事会任期届满。郑驹 (图源企业公众号）同时，副董事长庄巍拟辞任，董事会选举董事郑驹为新任副董事长，任期同上。,https://toutiao.com/group/7438885058636726823/,,0,0,False
俩人相亲互相看不上，哪料男方一报母亲身份，姑娘乐了,2024-11-08 01:50,9398,2199,乐视群星访谈秀,乐视群星访谈秀,,https://toutiao.com/group/7434719902990074395/,,0,0,True
“安理会令人十分失望！” 中方代表直指：如果不是美国，安理会本不会如此软弱无能,2024-11-19 07:23,3567,167,中国网,中国网,“安理会令人十分失望！,http://lab.h5.china.cn/spider/front/pages/video?id=362,,0,0,False
破解特朗普加征关税，中国有7招,2024-11-15 14:05,27125,1758,静思有我,静思有我,,https://toutiao.com/group/7437506977830044200/,,0,0,True
炸萝卜丸子到底用面粉还是淀粉，教你正确做法，外焦里嫩，太香了,2024-10-26 09:25,9750,632,家常的味道,家常的味道,,https://toutiao.com/group/7430012978277122611/,,0,0,True
1米3袖珍美女嫁给1米48男孩，婚后丈夫奇迹长高，两人却不欢而散,2024-09-07 02:55,5278,292,睿之悦,睿之悦,杨萍和葛存苗的婚礼 文|睿之悦 编辑|睿之悦2019年，成都的民政局来了两个“10岁小孩”来登记，工作人员以为是玩闹。两个“小孩”拿出身份证让工作人员看，这才明白，原来是两个再也长不高的成年袖珍人情侣。,https://toutiao.com/group/7411713833267364386/,,0,0,False
养殖虾都是吃抗生素、激素长大的？到底能不能吃？告诉你真相,2024-10-10 10:02,1093,267,奇妙的本草,奇妙的本草,菜市场里，几位阿姨一起围着在一处海鲜档口处讨论！“现在的虾真是大个儿，还这么便宜！不买上几斤感觉都亏了！”李阿姨高兴地说。王阿姨却连连摇头：“可别太高兴，我听说这些大都是养殖虾，吃了不少激素和抗生素呢，吃了对身体不好。”“真的吗？”李阿姨惊讶地问。,https://toutiao.com/group/7424084752157950516/,,0,0,False
多地官宣！城乡居民基础养老金提高，最高上涨90元,2024-11-19 04:25,765,146,社保之心,社保之心,截止至11月19日，已经有上海、北京、江苏等十多个省市陆续宣布，提高城乡居民基础养老金最低标准，意味着部分农村老人的养老金，又要上涨了。,https://toutiao.com/group/7438839656029946368/,,0,0,False
67岁执意生娃，如今却坐轮椅无法自理，5岁的天赐被迫独立学洗衣,2024-11-04 10:32,4264,1061,睿之悦,睿之悦,2019年，已经67岁的田新菊执意生下了自己的第三个孩子小天赐。那么，现如今5年的时间过去了，这“天赐”的礼物到底是福还是祸呢?,https://toutiao.com/group/7433367394946384435/,,0,0,False
吕礼诗参观珠海航展，见中国强激动流下男儿泪，台独玻璃心又碎了,2024-11-16 04:45,33873,1356,邱毅台湾,邱毅台湾,,https://toutiao.com/group/7437733759829180969/,,0,0,True
给近三年最好的10部年代剧排个名：《人世间》第6，第1名没有争议,2024-09-06 08:08,12633,3909,皮皮电影,皮皮电影,时尚是个轮回，电视剧也是。在2020年之前的那些年，电视剧市场基本上都被偶像剧、都市剧霸占。曾经撑起国剧品质的《闯关东》《岁月》这类年代好剧，难见踪影。,https://toutiao.com/group/7411390030722712090/,,0,0,False
医生发现：不容易得癌症的人，一般都有5个“特质”，你占几个？,2024-11-15 11:19,4773,458,39健康网,39健康网,“癌症是人类追求健康路上难以回避的挑战。”近年来，癌症似乎越来越频繁地出现在人们的视线中。无论患者还是健康人，都对“患癌概率”心存疑问：为何偏偏是自己中招？自己的患癌风险究竟有多大？一、人活一辈子，得癌症的几率有多大？,https://toutiao.com/group/7437417286899646976/,,0,0,False
炒白菜千万不要直接下锅，难怪不好吃，教你技巧，鲜嫩入味不出水,2024-10-30 09:23,9397,499,家常的味道,家常的味道,,https://toutiao.com/group/7431496869400576550/,,0,0,True
11月18日下午4点56，北京天安门震撼降下国旗，场面令人激动落泪,2024-11-19 04:16,828,116,七七看世界,七七看世界,,https://toutiao.com/group/7438839467852431907/,,0,0,True
来了个老虎（左侧邻居监控版）,2024-11-19 15:47,6168,2926,小玛宝宝,小玛宝宝,,https://toutiao.com/group/7439017628938535461/,,0,0,True
母亲瘫痪、父亲疯了，当年那个744分的高考状元，7年后却成了这样,2024-09-08 00:54,9488,1508,八号探秘人,八号探秘人,母亲截肢瘫痪、父亲疯癫痴傻，可对于自己的亲人，他却做出了这样的评价。而今，7年已过，曾经那个让无数人动容的少年，现在如何?,https://toutiao.com/group/7411852147648496162/,,0,0,False
3年前，宁夏7岁小女孩一笑走红，后拒百万签约，如今怎么样了？他们后悔了吗？,2024-09-19 07:25,11801,1622,睿之悦,睿之悦,2021年，视频镜头中出现的女孩儿用那一抹甜美的笑容，迅速引起了网友们的广泛关注。有媒体公司看到这一机遇，提出愿意用百万巨资与女孩儿签约，然而，女孩儿的父母却坚决拒绝了这一提议。,https://toutiao.com/group/7416250139544879679/,,0,0,False
相爱37年零绯闻，丁勇岱对赵雪华一见钟情，如今却对儿子很失望,2024-11-09 21:43,2609,190,八号探秘人,八号探秘人,在阅读此文之前，辛苦您点击一下“关注”，既方便您进行讨论和分享，又能给您带来不一样的参与感，感谢您的支持！编辑丨xk1985年，丁勇岱转过楼梯拐角，撞到人生挚爱，这一下把他撞“开窍”了。那时他还不是《末路》里的白宝山。也不是《跨过鸭绿江》里的彭老总，更不是《人世间》里的周志刚。,https://toutiao.com/group/7435160230918406707/,,0,0,False
