title,publish_time,like_count,comment_count,media_name,source,abstract,article_url,tag,is_yaowen,article_sub_type,has_video
安徽小伙娶深圳富婆，富婆大他22岁，47岁生下儿子，婚后1年离婚,2025-02-25 05:23,7264,505,财经科创聚焦,财经科创聚焦,在2019年的初春时节，42岁的深圳女企业家棋棋返回了位于湖北荆州的老家进行探亲。在此期间，她邂逅了一位在理疗店工作的年轻小伙——20岁的涛涛，来自安徽。,https://toutiao.com/group/7475219731243368997/,,0,0,False
仅发行6年就退市了！价值1.56万！这样的100元请收好别花了~,2025-02-24 05:03,8167,666,巫凡读收藏,巫凡读收藏,大家都知道，我们现在用的100元纸币是第五套人民，但是第五套人民币中一共发行了三个版本，分别是99版、05版和15版的，目前在使用的是05版和15版，99版是大家公认的错版钞，且发行时间没多久就退市了。,https://toutiao.com/group/7474844512628507175/,,0,0,False
丧心病狂！28岁留英博士迷奸50名女性，1600小时性侵录像 法官吓坏,2025-03-20 10:30,2373,524,史海甄客百晓生,史海甄客百晓生,前言近日，英国伦敦市中心刑事法庭审理了一起性侵案件，涉案人员是一名 28 岁的留英博士生—邹某豪。据了解，在 2019 至 2024 年期间，其对超过 50 名女性实施下药侵犯，还丧心病狂地偷拍。,https://toutiao.com/group/7483822306641330707/,,0,0,False
普京背后高人浮出水面，俄罗斯的灵魂人物，没她普京难撑到现在？,2025-02-15 10:07,23483,994,热情的逗狐狸,热情的逗狐狸,俄罗斯总统普京一向被人称之为铁腕总统，但在普京刚刚上台之时，遭遇的危机是令她自己都解决不了的，好在她背后有高人相助。,https://toutiao.com/group/7471585183066522139/,,0,0,False
315曝光的七个知名酸奶全军覆没，实为科技糖水，看完你还敢买吗,2025-03-25 10:02,535,370,漫悠芸端,漫悠芸端,但这次315晚会的爆料，却揭开了酸奶行业最真实的面目，这时人们才发现，原来我们信以为真的营养食品，都是由各种添加剂勾兑的。,https://toutiao.com/group/7485636412436382243/,,0,0,False
