title,publish_time,like_count,comment_count,media_name,source,abstract,article_url,tag,is_yaowen,article_sub_type,has_video
淬火丨听，这是一代代中国军人的誓言,2024-09-18 12:03,4888,2457,央视新闻,央视新闻,听，这是一代代中国军人的誓言徐树年102岁，空军“王海大队”首任政委，参加过抗日战争、解放战争、抗美援朝出国作战，他第一次宣誓就是在战斗间隙。“冰雕连”战士周全弟90岁，长津湖战役中，潜伏在零下40℃的雪地里三天三夜，严重冻伤致四肢截肢。,https://content-static.cctvnews.cctv.com/snow-book/index.html?item_id=9402417226483880935&source=50006&sub_source=50006_001,,0,0,False
中国首例5胞胎现状曝光：父亲过劳去世，如今22年过去，母亲竟然直言后悔……,2024-08-19 08:57,4085,1214,读者,读者,在我看来，这个故事更为让人动容的地方，是爱和责任。缴宝存殚精竭虑、省吃俭用，只为一家人撑起一片天;王翠英将5个孩子全都带在自己身边，教他们识字，教他们做人，教他们团结友爱。,https://toutiao.com/group/7404674971840086540/,,0,0,False
陈梦“双喜临门”，官宣新身份正式上任，球迷：退役后不愁了,2024-09-18 10:56,339,107,品古观今,品古观今,殊不知，同一时间她收获了一个好消息——成为某高校的校长正式上任。9月15日，澳门冠军赛决赛当天，也是中秋假期的第一天，陈梦接到了一项新任命。,https://toutiao.com/group/7415903802957496871/,,0,0,False
147票压过3票，欧洲通过涉台议案，不许两岸统一，蒋万安突然离岛,2024-09-13 09:45,4143,2695,凤凰卫视金亮,凤凰卫视金亮,美欧联合阻挡中国统一，蒋万安演讲提及“一个中华”，新加坡对台发出警告，岛内表明战争担忧，美方要颠覆战后秩序吗?,https://toutiao.com/group/7414061277322838564/,,0,0,False
农村人不可怜，最可怜的是城里的下岗工人，你认同吗？,2024-09-17 09:23,725,1389,聪明的轮船YLlOUl9,聪明的轮船YLlOUl9,,https://toutiao.com/group/7415540161196327461/,,0,0,True
日本梅毒成灾，“不是为了传给客人，谁得了花柳病还去上班呢?”,2024-09-18 03:37,564,117,书生talk,书生talk,说直白一点就是跟梅毒患者有过亲密的接触，才会传染上这种疾病，而如今的日本，却成为了“梅毒大国”，现在日本国内众多的人患上了梅毒，原因显而易见，就是因为日本国内有着众多的“红灯产业”，收益可观。,https://toutiao.com/group/7415809751830823464/,,0,0,False
骂专家，骂交警，骂城管这股歪风邪气，已经到了非治不可的地步了,2024-09-04 13:58,13644,34040,家和万事兴a9s6I,家和万事兴a9s6I,,https://toutiao.com/group/7410786907263369743/,,0,0,True
全球约一半肝癌在中国，再次提醒：家中的4种食物，尽早撤下餐桌,2024-08-13 08:36,88747,3387,梁医学社梁怡璋医生,梁医学社梁怡璋医生,,https://toutiao.com/group/7402540119712629311/,,0,0,True
开国上将家中去世，死后无一人吊唁，儿子：没想到死后却进了医院,2024-08-08 09:29,16870,118,品古观今,品古观今,1980年7月25日，与许世友并称“山东双雄”的开国上将王建安告别了他波澜壮阔的一生，在家中悄然去世。,https://toutiao.com/group/7400697093196628480/,,0,0,False
少女吃完肯德基把骨头从垃圾桶捡回来，做一顿鸡架泡饭，香迷糊了,2024-07-16 00:00,883,298,兴凯湖莹莹,兴凯湖莹莹,,https://toutiao.com/group/7391891049913778740/,,0,0,True
全球最富揭晓：美国首富造火箭，印度首富搞能源，中国首富在干嘛,2024-08-02 07:38,1141,1931,智史通鉴,智史通鉴,2024年4月3日，新一轮的福布斯排行榜出炉，法国奢侈品品牌LV的总裁荣登榜首。同时，马斯克也凭借第二的名次也又一次为了美国的首富。众所周知，马斯克的特斯拉公司最近几年发展势头极好，spaceX公司造火箭的工作也进行的如火如荼。,https://toutiao.com/group/7398431880397324839/,,0,0,False
5座车拉6个人被判超员，车主1句话把交警问懵,2024-08-05 20:20,9588,2270,奇妙钢笔pA8JyP,奇妙钢笔pA8JyP,,https://toutiao.com/group/7399752843772559906/,,0,0,True
美英解禁“远程打击”未果，俄向白宫发暗示，英国却不买美国的账,2024-09-18 08:07,3075,275,吕宁思,吕宁思,,https://toutiao.com/group/7415891752638218778/,,0,0,True
她是央视最惨主持人，男友被判死缓，丈夫诈骗入狱，47岁无人敢娶,2024-08-27 23:30,2057,206,闻书识焉,闻书识焉,她曾是央视的台柱子，和董卿、周涛并称为央视的三朵金花。回顾刘芳菲的前半生，最令人感到惋惜的，便是她的感情生活，47岁至今无人敢娶。,https://toutiao.com/group/7407743113688564258/,,0,0,False
安徽合肥市肥东县附近发生5.0级左右地震,2024-09-18 12:11,2333,8125,中国地震台网速报,中国地震台网速报,据中国地震台网自动测定：2024年9月18日20时8分在安徽合肥市肥东县（北纬32.00度，东经117.60度）发生5.0级左右地震，最终结果以正式速报为准。,http://news.ceic.ac.cn/20240918200841.html,,0,0,False
贵州弃婴被美国夫妻领养，变化之大让所有人都吃惊#小湘君,2024-08-31 02:56,2190,549,老臧有话说,老臧有话说,,https://toutiao.com/group/7409132177494901288/,,0,0,True
写歌30年穷困潦倒，前妻失望选择离婚，谁料51岁靠一首歌一夜成名,2024-08-12 03:37,19605,3183,八号探秘人,八号探秘人,在阅读此文之前，辛苦您点击一下“关注”，既方便您进行讨论和分享，又能给您带来不一样的参与感，感谢您的支持！编辑：LY无数人都想要一个一夜成名的机会，但机会来了也不是每个人都能把握住的。他用了三十年的时间来准备迎接属于自己的机会。为了这个机会他放弃了一切，甚至包括家庭。,https://toutiao.com/group/7402090890367484428/,,0,0,False
全红婵哥哥经营的果蔬店被注销，此前称希望助农，当地：一直有在直播,2024-09-18 07:36,771,335,极目新闻,极目新闻,全红婵哥哥经营的果蔬店被注销，此前称希望助农，当地：一直有在直播潇湘晨报2024-09-18 15:17北京据天眼查信息显示，湛江市麻章区全入果蔬店已于9月13日被注销，其经营者是全红婵的哥哥全进华。,http://jms.ctdsb.net/jmythshare/#/index_share?cId=0&contentType=5&contentId=2257381,,0,0,False
4架美机逼近辽宁舰，歼15冒暴风雨起飞，硬碰硬分出胜负,2024-09-15 06:19,5166,286,第一军情,第一军情,央视军事9月15日报道了辽宁舰航母编队在西太平洋某海域，遭到4架外方战斗机的逼近。在这个关键时刻，辽宁舰上的歼-15舰载机，冒着强对流暴风雨，挂载实弹升空，对外机进行拦截，一番“硬碰硬”后最终成功逼退外机编队。,https://toutiao.com/group/7414749448699413027/,,0,0,False
反超华为、阿里！中国第一大民企诞生，营收破1万亿，员工超60万,2024-09-18 08:47,1018,654,云舟史策,云舟史策,刘强东白手起家的神话迎来新纪录！2024年财富世界500强企业中，京东一举成为中国第一大民间企业。而排在京东前面的15家中国公司，全是传统的能源，工程国企和银行。唯一的高科技企业鸿海精密，则是台湾省的富士康母公司。其中阿里巴巴排名全世界第70名，恒力集团排名81，华为排名103。,https://toutiao.com/group/7415861358157120037/,,0,0,False
国务院：从2030年1月1日起将职工按月领取基本养老金最低缴费年限由十五年逐步提高至二十年 每年提高六个月,2024-09-13 06:38,9468,12818,财联社,财联社,【国务院：从2030年1月1日起将职工按月领取基本养老金最低缴费年限由十五年逐步提高至二十年 每年提高六个月】财联社9月13日电，国务院关于渐进式延迟法定退休年龄的办法发布，从2030年1月1日起，将职工按月领取基本养老金最低缴费年限由十五年逐步提高至二十年，每年提高六个月。,https://www.cls.cn/depth/1798592,,0,0,False
4年来首次 美联储宣布降息50个基点,2024-09-18 18:05,2470,5596,央视新闻,央视新闻,美国联邦储备委员会当地时间18日宣布，将联邦基金利率目标区间下调50个基点，降至4.75%至5.00%之间的水平。这也是4年来，美联储首次降息。此外，根据美联储的预测，今年年底美国联邦基金利率将达到4.4%，即4.25%至4.5%的目标区间，到2025年将降至3.,https://content-static.cctvnews.cctv.com/snow-book/index.html?item_id=4826525383164431677&source=50006&sub_source=50006_001,,0,1,False
张紫妍：被迫陪睡31人近百次，遭道具虐待，29岁自杀留230页遗书,2024-07-24 02:37,11440,780,八号探秘人,八号探秘人,在阅读此文之前，辛苦您点击一下“关注”，既方便您进行讨论和分享，又能给您带来不一样的参与感，感谢您的支持！本文叙述皆有官方信源，为了读者有更好体验，放在了文章后缀！,https://toutiao.com/group/7394994383675736576/,,0,0,False
