title,publish_time,like_count,comment_count,media_name,source,abstract,article_url,tag,is_yaowen,article_sub_type,has_video
习近平的民生之问｜“食品原料从哪里进来的？”,2025-03-15 01:45,1071,127,中国新闻网,中国新闻网,在了解到食品原料从农田到餐桌都是安全有保障的情况后，总书记说道:“食品安全是最重要的，群众要吃得放心，这是我最关心的。”,http://ku.m.chinanews.com/wapapp/cns/gn/2025/03-15/10383519.shtml,,0,0,False
太吓人！央视3·15晚会曝光：严重超标！工人坦言：我自己从来不吃,2025-03-16 02:04,3582,1877,光明网,光明网,点开多家电商平台，很多消费者都会看到这样的广告推送，新鲜、饱满、有嚼劲的虾仁，只要你轻轻一点，一两天的时间，它就能出现在你的餐桌上，孩子老人都喜欢。,https://m.gmw.cn/toutiao/2025-03/16/content_1303992358.htm,,0,1,False
发现一个奇怪的现象：凡是让老人独自生活，自己忙事业的子女，大多活成了这样……,2025-03-12 09:00,2152,335,读者,读者,两代人的“围城”:住在一起是孝顺，还是枷锁?很多年轻人为了更好的生活，选择了去城市打拼，买房定居、结婚生子。,https://toutiao.com/group/7480751132806087183/,,0,0,False
官方再批李嘉诚卖港口给美国,2025-03-15 14:41,5639,7923,看看新闻,看看新闻,3月15日，中国国务院港澳办官网再次转载来源《大公报》的时评，题为“伟大的企业家都是铮铮爱国者”，就李嘉诚拟卖港口事件发声。这已是继13日后，港澳办第二次发声。日前，李嘉诚旗下香港长江和记实业拟将包括巴拿马运河两大港口在内43个港口出售给美国财团。,https://m.kankanews.com/detail/RXyOLG07gQV?utm_source=jinritoutiao,,0,0,False
春天，这菜使劲吃！一养肝、二护眼、三排毒、四通便，鲜嫩营养高,2025-02-26 11:49,5698,698,秀厨娘,秀厨娘,春风拂过田野，沉睡一冬的泥土里冒出了星星点点的嫩芽。这种带着淡淡清香的野菜，是春天给我们的第一份健康好食材。,https://toutiao.com/group/7475671861737570816/,,0,0,False
李鸿章小妾冬梅有多美？16岁留影，樱桃小嘴美艳动人，不输女明星,2025-03-15 08:12,701,111,历史李老师,历史李老师,1901年11月7日，晚清重臣李鸿章带着无尽的遗憾病逝于北京贤良寺，终年79岁。在生命的最后时刻，李鸿章给慈禧太后和光绪皇帝上了最后一道奏折。,https://toutiao.com/group/7481591063423074831/,,0,0,False
发疯不是向佐的上限 而是我的极限40岁向佐如今已经丢人丢出国门了,2025-03-15 23:50,341,659,博学多才的饼干k,博学多才的饼干k,,https://toutiao.com/group/7481854075626996259/,,0,0,False
