title,publish_time,like_count,comment_count,media_name,source,abstract,article_url,tag,is_yaowen,article_sub_type,has_video
“青瓦台魔咒”或降临，尹锡悦大势已去？冲冠一怒代价惨重,2024-12-04 05:30,5987,383,陈虎点兵,陈虎点兵,,https://toutiao.com/group/7444424854045983259/,,0,0,True
包厢全是刚出狱的恶霸，结果一看到饭店主厨，立马怂了,2024-11-11 01:21,10637,263,乐视群星访谈秀,乐视群星访谈秀,,https://toutiao.com/group/7435825833048015400/,,0,0,True
炸萝卜丸子到底用面粉还是淀粉，教你正确做法，外焦里嫩，太香了,2024-10-26 09:25,13556,891,家常的味道,家常的味道,,https://toutiao.com/group/7430012978277122611/,,0,0,True
警惕“先用后付”小心欠下账单～（央视频号：光华路资讯）,2024-11-27 12:44,17538,4922,央视频,央视频,,https://toutiao.com/group/7441939150552433179/,,0,0,True
女友怀孕了，男友不装了，带她回豪宅！,2024-11-23 08:01,8313,694,乐视大综艺咖,乐视大综艺咖,,https://toutiao.com/group/7440353629540483593/,,0,0,True
外交态度逆转，立陶宛与中方对峙的内幕是？ #立陶宛,2024-12-03 09:02,14692,1246,卢克文工作室,卢克文工作室,,https://toutiao.com/group/7444108279917052425/,,0,0,True
马龙访台，台湾人热烈欢迎，台独焦虑不安视为大敌使出妖魔化老招,2024-11-29 09:56,25301,1057,邱毅台湾,邱毅台湾,,https://toutiao.com/group/7442637867307762230/,,0,0,True
大学生4年间艾滋病感染12397例，60%存在这一行为,2024-12-03 10:16,3146,1988,凤凰网,凤凰网,据相关数据，2020年至2023年，新报告青年学生病例分别为:2977人、3677人、2733人、3010人，四年间共报告12397人。,https://toutiao.com/group/7444127197663396364/,,0,0,False
1米3袖珍美女嫁给1米48男孩，婚后丈夫奇迹长高，两人却不欢而散,2024-09-07 02:55,7242,398,睿之悦,睿之悦,杨萍和葛存苗的婚礼 文|睿之悦 编辑|睿之悦2019年，成都的民政局来了两个“10岁小孩”来登记，工作人员以为是玩闹。两个“小孩”拿出身份证让工作人员看，这才明白，原来是两个再也长不高的成年袖珍人情侣。,https://toutiao.com/group/7411713833267364386/,,0,0,False
未来5年没大年三十，都是月亮惹的祸！2262年有两个春节放假怎么安排？,2024-12-03 05:12,907,451,极目新闻,极目新闻,2025年1月29日将迎来农历新年蛇年，但2025年没有大年三十，大年二十九过后就是大年初一。据悉，从2025年开始直到2029年，连续五年的除夕都是“大年二十九”。,http://jms.ctdsb.net/jmythshare/#/index_share?cId=0&contentType=5&contentId=2319456,,0,0,False
俄乌冲突结束方案三方不同意，10万部队入乌维和，瓜分还是占领？,2024-12-01 12:09,15449,1241,杜文龙,杜文龙,,https://toutiao.com/group/7443414453669855783/,,0,0,True
广西49岁老汉娶19岁姑娘，结婚21年生下15个孩子，如今有何下场？,2024-10-20 08:32,5586,682,艺述史,艺述史,她19岁出嫁，21年里总共生育了15个孩子，其中4个男孩子11个女孩子，家里热闹的像是开了一所学校一样。,https://toutiao.com/group/7427400319418384948/,,0,0,False
母亲瘫痪、父亲疯了，当年那个744分的高考状元，7年后却成了这样,2024-09-08 00:54,13817,1956,八号探秘人,八号探秘人,母亲截肢瘫痪、父亲疯癫痴傻，可对于自己的亲人，他却做出了这样的评价。而今，7年已过，曾经那个让无数人动容的少年，现在如何?,https://toutiao.com/group/7411852147648496162/,,0,0,False
11岁男孩打乒乓评上国家一级运动员，网友：这名字强得可怕,2024-12-03 23:40,942,376,大象新闻,大象新闻,11岁男生乒乓球打到全国第二名，获得“国家一级运动员”称号！小小年纪取得这样的成绩，让人震惊又佩服。他叫马国栋，是杭州市文澜实验学校五年级学生，前段时间参加全国青少年精英系列赛，过五关斩六将，夺得全国亚军，并获得国青队集训资格。,https://share.hntv.tv/news/0/1864078499382747137,,0,0,False
弟弟光荣退伍，姐姐兴奋去车站接他，怎料一见弟弟瞬间哭了,2024-11-05 06:34,29504,2876,乐视天天剧好看,乐视天天剧好看,,https://toutiao.com/group/7433679820573934091/,,0,0,True
韩国一夜变天，10个关键问题,2024-12-04 04:54,1337,120,牛弹琴,牛弹琴,韩国一夜无眠，尹锡悦彻底失败了,https://toutiao.com/group/7444415593458958898/,,0,0,True
星光大道多位冠军现状：大多已无人问津，有人负债累累当搬运工,2024-11-29 06:50,3173,593,今娱良言,今娱良言,本文内容均引用权威资料结合个人观点进行撰写，具体信息来源已赘述在文章结尾。文/编辑 多多2004年，《星光大道》横空出世。不论出身、没有门槛，有梦想就可以站上舞台。有着“百姓自娱自乐”的宗旨吸引超10万人报名参赛。选手们有的因为节目一夜爆火，拥有极高国民度。,https://toutiao.com/group/7442529283056075314/,,0,0,False
杀疯了的「北京市服」，统一全国审美？,2024-11-25 00:30,2366,1019,凤凰WEEKLY,凤凰WEEKLY,文/馍王编辑/闫如意众所周知，凤凰编辑部位于北京市。众所又知，北京的冬天，有一种统一所有人穿搭审美的魔力。这个冬天，编辑部的穿搭呈现出了无限趋同。上班时，人均穿着一件柔软的摇粒绒内衬，蜷缩在工位上。下班点一到，用一件宽大冲锋衣把摇粒绒一锁，挺胸抬头，跟扇大铁门似的走出公司。,https://toutiao.com/group/7440858414693040678/,,0,0,False
琼瑶在台湾家中轻生身亡！终年86岁！​遗书全文曝光：不要哭，不要伤心，不要为我难过,2024-12-04 07:28,1439,805,大河报,大河报,据多家台湾媒体报道，知名作家琼瑶12月4日下午1时22分许，在新北市淡水区家中轻生身亡，享寿86岁。据香港01报道，新北市淡水区一处民宅4日下午发生一起死亡事件！,https://toutiao.com/group/7444454486665478667/,,0,0,False
67岁执意生娃，如今却坐轮椅无法自理，5岁的天赐被迫独立学洗衣,2024-11-04 10:32,7940,1839,睿之悦,睿之悦,2019年，已经67岁的田新菊执意生下了自己的第三个孩子小天赐。那么，现如今5年的时间过去了，这“天赐”的礼物到底是福还是祸呢?,https://toutiao.com/group/7433367394946384435/,,0,0,False
罕见！100年前，英国游客拍下的清朝乡村，和想象中完全不一样,2024-09-20 02:07,8291,736,万物知识局,万物知识局,泥泞的土路，衣不蔽体的老百姓，即便是达官显贵的家中也十分破败，而这些都是清王朝的历史痕迹，虽说那时候中国摄影技术并不发达，但也有许多外国游客来到这里，拍摄下了许多老照片，为我们留下了珍贵的历史资料，那清朝到底是怎样的面貌呢?,https://toutiao.com/group/7416287738871267855/,,0,0,False
军号一响，全军出击！,2024-09-19 08:01,32601,2015,中国军号,中国军号,,https://toutiao.com/group/7416261401477382668/,,0,0,True
河南女子去世，山东丈夫将手机埋墓里，充1000元话费，每天打电话,2024-11-01 06:52,3816,3160,何止电影,何止电影,2014年11月17日，河南肿瘤医院的病房中举行着一场特殊的婚礼，主角是于海宁跟他的患有癌症的妻子范会香。在几个月前范会香确诊癌症，跟男友提出分手，于海宁不远万里来到了女友的城市，照顾患癌女友。得知女友时日无多，在病房中跟女友求婚，在病房中举办了婚礼，婚后一年，范会香去世。,https://toutiao.com/group/7432199981609534004/,,0,0,False
《还珠格格》《一帘幽梦》作者琼瑶轻生身亡，终年86岁,2024-12-04 07:07,5247,12847,九派新闻,九派新闻,据ETtoday星光云消息：台湾新北市淡水区一处民宅4日下午发生一起死亡事件！一名86岁女性在家中轻生，死者身份是知名言情小说作家琼瑶，而琼瑶多部小说作品被改编为电影或电视剧，包括《还珠格格》《一帘幽梦》等，死讯传出后令人震惊。,https://toutiao.com/group/7444449188693279270/,,0,0,False
美国权力即将交接之际，台湾两个举动不寻常，释放什么危险信号？,2024-12-02 09:57,11470,113,邱震海,邱震海,,https://toutiao.com/group/7443751437550486057/,,0,0,True
富二代当兵却逃跑回家，班长去他家抓人，一进家门瞬间惊了,2024-10-26 02:59,12213,1072,乐视天天剧好看,乐视天天剧好看,,https://toutiao.com/group/7429913203359875636/,,0,0,True
东莞一男子转账被限额怒问银行“钱到底是谁的”，中国银行回应,2024-12-03 15:40,1071,2289,金羊网,金羊网,近日，一名男子转账遇限额，与中国银行工作人员发生争执。其间，男子情绪激动，怒问：“这（卡）里面的钱到底是谁的？”引发关注。12月3日，记者采访了解到，此事发生于广东东莞一中国银行网点，银行因担心客户遭诈骗，对客户的转账做了限额，在工作人员核实情况后，帮客户进行了处理。,https://news.ycwb.com/2024-12/03/content_53098975.htm,,0,0,False
这绝对是我吃过最好吃的蒜蓉蒸鸡做法,2024-11-11 12:49,2996,239,天天相见厨房(阿见),天天相见厨房(阿见),,https://toutiao.com/group/7436003114588570123/,,0,0,True
美妇约见老情人，见面场景真是太逗了，这俩人绝配！,2024-10-27 16:25,4589,572,乐视明星的那点事,乐视明星的那点事,美妇约见老情人，见面场景真是太逗了，这俩人绝配！,https://toutiao.com/group/7428157095108674088/,,0,0,True
选择联中抗美，石破茂真是亲华首相，在重要场合明确表态,2024-12-03 06:47,2014,276,军情作家陈曦,军情作家陈曦,据报道，日本首相石破茂在临时国会开幕式上，介绍了他之前与中方高层接触的情况，并阐明了自己的对华立场。,https://toutiao.com/group/7444073508466704923/,,0,0,False
包菜炒粉条，切记不要焯水和直接下锅，教你一招，清脆爽口不出水,2024-11-11 11:50,7670,374,家常的味道,家常的味道,,https://toutiao.com/group/7435987746101690930/,,0,0,True
郭有才：当迷失方向忘记初心后，曾经飘得多高，如今摔得就多惨,2024-11-11 06:53,1439,686,八号探秘人,八号探秘人,在阅读此文之前，辛苦您点击一下“关注”，既方便您进行讨论和分享，又能给您带来不一样的参与感，感谢您的支持！编辑丨brt因为一首翻唱，他一夜之间成为了拥有千万粉丝的网红。但是“人红是非多”，不久他就因为版权等问题陷入了舆论风波。他的人气一落千丈，从万众瞩目变成了现在的无人问津。,https://toutiao.com/group/7435901170239078948/,,0,0,False
近5年最热的十部剧，《狂飙》第9，《繁华》第6，第1名很难超越,2024-12-01 03:58,364,152,电影烂番茄,电影烂番茄,今天，番叔就结合口碑，给大家盘点一下近五年，热度最高的十部电视剧。第十名:《都挺好》 猫眼热度 9775.8，播出时间2019年。,https://toutiao.com/group/7430845717314273831/,,0,0,False
男子刷视频发现妻子与他人举办婚礼！背后的秘密更惊人,2024-12-03 00:21,1147,1135,极目新闻,极目新闻,一次偶然的机会，与妻子长期分居两地的阿强（化名）在刷视频时看到小自己11岁的娇妻阿芳（化名）正与他人举办婚礼，而随着阿强的进一步调查，更让他难以接受的事实接踵而至：自己养育了7年的女儿也不是亲生的，妻子口中为他所生的“儿子”更是凭空捏造……气愤、羞恼之余，淮安男子阿强选择拿起法律,http://jms.ctdsb.net/jmythshare/#/index_share?cId=0&contentType=5&contentId=2319202,,0,0,False
自从学会这个西红柿鸡蛋汤，做一辈子厨师的老丈人都对我刮目相看,2024-09-05 12:01,4913,460,一画美食,一画美食,,https://toutiao.com/group/7411128073514385983/,,0,0,True
彩票中2.25亿元男子已兑奖，纳税超4500万元！投注站老板：中奖者是中年老彩民,2024-12-04 03:30,169,347,大风新闻,大风新闻,12月2日，深圳市福利彩票发行中心发布公告称，2024年11月28日，中国福利彩票双色球游戏第2024137期开奖，当期深圳市中出一等奖40注，奖金合计人民币225470040元（含派奖奖金）。,https://toutiao.com/group/7444393517675266597/,,0,0,False
好物分享｜炖牛肉时切记三放两不放，这样炖出来的牛肉才会汤鲜味美,2024-10-15 08:50,5667,231,家味美食,家味美食,,https://toutiao.com/group/7425922043991360037/,,0,0,True
