title,publish_time,like_count,comment_count,media_name,source,abstract,article_url,tag,is_yaowen,article_sub_type,has_video
学习导读 | 面向省部级主要领导干部，习近平重点强调了什么？,2024-11-01 10:53,838,382,国际在线,国际在线,习近平总书记在开班式上发表重要讲话，深刻总结新时代全面深化改革取得的历史性成就，深刻阐明进一步全面深化改革的一系列重大理论和实践问题，对坚持守正创新、讲求科学方法、营造良好氛围提出明确要求，立意高远、思想深邃、论述精辟、内涵丰富，具有很强的政治性、理论性、针对性、指导性，对于我们全面准确理解党的二十届三中全会精神，在新征程上推动改革行稳致远、推动各项改革举措精准落地见效，具有十分重要的意义。,https://news.cri.cn/toutiaopic/d3157be1-b0f2-b654-65a0-146ae04bd872.html,,0,0,False
开房视频曝光！金华女教师出轨学生，更多信息被扒，颜值确实漂亮,2024-10-28 08:20,244,222,三暮小屋,三暮小屋,导语最近，浙江金华职业技术大学的一起师生恋丑闻引爆了网络。女教师刘徐某被丈夫曝光与网红学生“摆烂翱”有不当关系，甚至发布了监控视频，引发了公众的广泛讨论。,https://toutiao.com/group/7430734442244604416/,,0,0,False
1米3袖珍美女嫁给1米48男孩，婚后丈夫奇迹长高，两人却不欢而散,2024-09-07 02:55,1889,114,睿之悦,睿之悦,杨萍和葛存苗的婚礼 文|睿之悦 编辑|睿之悦2019年，成都的民政局来了两个“10岁小孩”来登记，工作人员以为是玩闹。两个“小孩”拿出身份证让工作人员看，这才明白，原来是两个再也长不高的成年袖珍人情侣。,https://toutiao.com/group/7411713833267364386/,,0,0,False
爆大冷！小将3-0横扫世界冠军，蒯曼狙击大藤沙月，国乒包揽冠亚,2024-11-01 13:02,484,129,品古观今,品古观今,值得高兴的是，有一个名不见经传的小将冒出了头，还3-0爆冷淘汰了世界冠军。目前，男女单打4强均已出炉，国乒大获全胜，单打4强的席位中男、女各占了3席。,https://toutiao.com/group/7432295116029510207/,,0,0,False
中国首例5胞胎现状曝光：父亲过劳去世，如今22年过去，母亲竟然直言后悔……,2024-08-19 08:57,4570,1315,读者,读者,在我看来，这个故事更为让人动容的地方，是爱和责任。缴宝存殚精竭虑、省吃俭用，只为一家人撑起一片天;王翠英将5个孩子全都带在自己身边，教他们识字，教他们做人，教他们团结友爱。,https://toutiao.com/group/7404674971840086540/,,0,0,False
罕见！100年前，英国游客拍下的清朝乡村，和想象中完全不一样,2024-09-20 02:07,3915,489,万物知识局,万物知识局,泥泞的土路，衣不蔽体的老百姓，即便是达官显贵的家中也十分破败，而这些都是清王朝的历史痕迹，虽说那时候中国摄影技术并不发达，但也有许多外国游客来到这里，拍摄下了许多老照片，为我们留下了珍贵的历史资料，那清朝到底是怎样的面貌呢?,https://toutiao.com/group/7416287738871267855/,,0,0,False
中国男篮公布18人集训名单，胡明轩、张宁入选，郭士强：将全力以赴赢下关岛和蒙古队,2024-11-01 10:42,359,467,九派新闻,九派新闻,11月1日，中国篮协宣布，为备战2025国际篮联男篮亚洲杯预选赛第二窗口期比赛，协会计划于11月4日至11月20日在国家体育总局训练局组织集训。根据男篮集训名单，周琦缺席，张宁首次入选。,https://toutiao.com/group/7432258456012227081/,,0,0,False
给近三年最好的10部年代剧排个名：《人世间》第6，第1名没有争议,2024-09-06 08:08,9908,3274,皮皮电影,皮皮电影,时尚是个轮回，电视剧也是。在2020年之前的那些年，电视剧市场基本上都被偶像剧、都市剧霸占。曾经撑起国剧品质的《闯关东》《岁月》这类年代好剧，难见踪影。,https://toutiao.com/group/7411390030722712090/,,0,0,False
计划生育的罚款应该退吗？,2024-11-01 05:38,2277,1017,好学海燕fq4Xr,好学海燕fq4Xr,,https://toutiao.com/group/7432181050781991424/,,0,0,True
63岁女子与30岁男子在逃，新疆阿勒泰市公开悬赏重大刑事案件嫌疑人,2024-10-31 23:33,687,322,济南时报-新黄河,济南时报-新黄河,据“阿勒泰市公安”消息，为依法严厉打击刑事犯罪，惩治违法犯罪分子，尽快将重大刑事案件在逃人员抓捕归案，切实消除社会治安隐患，阿勒泰市公安局决定公开悬赏征集以下在逃犯罪嫌疑人的相关线索。,https://api.jinantimes.com.cn/h5/content.html?catid=32&id=4988599,,0,0,False
首例5胞胎长大了，父亲已过劳去世 母亲直言：如能重来一个也不要,2024-08-31 03:06,816,186,睿之悦,睿之悦,2002年，在北京的一家妇产医院中，一位来自河北的孕妇顺利生下了两男三女的五胞胎，创造了一个全国罕见的奇迹。,https://toutiao.com/group/7409098624111575603/,,0,0,False
15 年保安徒手接跳楼女孩，女孩母亲：我女儿若有事，你一辈子负责,2024-10-05 09:59,1397,305,陈志华观天下,陈志华观天下,2015 年，28 岁的保安曲岩用胳膊接住了跳楼自杀的女孩。2015 年 10 月 12 日，吉林大学第四医院人来人往。,https://toutiao.com/group/7422228565413872139/,,0,0,False
又被全世界打脸，这是美国今年最耻辱的失败,2024-11-01 00:10,5808,1457,牛弹琴,牛弹琴,资料图又被全世界打脸，这是美国今年最耻辱的一次失败。之所以说“又”，很简单，以前每年都有过，结果也差不多。事实上，这也成了一年一次联合国大会，最后的保留曲目，全世界同声谴责美国，全世界一起看美国笑话。因为全世界投票，要求美国必须终止对古巴的经济、商业和金融封锁。,https://toutiao.com/group/7432095642685686291/,,0,0,False
“信用卡、房贷都不用还了，网贷清零，还能赚大钱”？揭秘 “全民清债”背后的真相⋯⋯,2024-10-31 09:59,712,418,每日经济新闻,每日经济新闻,"每经记者：张宏 每经编辑：段炼,张益铭每经记者注意到，社交平台上涌现出不少“全民清债”“民债清查、重磅出手”“央妈出台，暂停还款”“所有网贷全部强制清零”的信息。这些帖子大多宣称“国家有关部门出台帮扶政策，贷款不用还也不会被催收”。",http://www.nbd.com.cn/rss/jinri_toutiao/articles/3626029.html,,0,0,False
明确了，无牌电动二、三、四轮车上路处罚标准，不光罚款还扣车,2024-10-02 01:44,2432,1380,新能源战略家,新能源战略家,请您在阅读前，先点击上面的“关注”。感谢您的支持，我们将为您带来更多有价值的内容。目前电动车的管理趋于完善，很多地方都要求车辆必须上牌才能上路行驶，电动自行车这类非机动车要上绿牌、属于机动车的电动二三轮车要上蓝牌或黄牌、电动四轮车或者其他非标车型要上当地的临时号牌。,https://toutiao.com/group/7420987802646577690/,,0,0,False
“出厂就限制了”！明起，购买电动自行车有重大变化！,2024-10-31 08:43,764,564,潇湘晨报,潇湘晨报,11月1日起，新规定将实施，购买电动自行车要留意啦！,http://api.chenshipin.com/wap/a/6723417f84201704ed1f0d22/90f456b81afce808c1fcfbd3f5761f65/1730364022/7f2cadd2c4d790919960f778c400cb604ffde3ce1620853632e6e8327aa404b2,,0,0,False
王健林，突发！,2024-11-01 12:45,772,366,极目新闻,极目新闻,【导读】王健林继续出售境外资产中国基金报记者 泰勒王健林1.,http://jms.ctdsb.net/jmythshare/#/index_share?cId=0&contentType=5&contentId=2294507,,0,0,False
油价或将大幅下调！11月6日油价将调整，95号汽油价格或将重返七元时代,2024-11-01 00:20,651,642,闽南网,闽南网,国内油价或将大幅下调。柴油、汽油价格降幅创新高。油价最新调整消息:本轮油价调整时间为2024年11月06日24时。,https://toutiao.com/group/7432098328197808666/,,0,0,False
51年洪学智妻子寻女无果，到老乡家歇脚老乡惊呼：你要找得就是我,2024-09-22 01:07,10970,771,品古观今,品古观今,前言1951年，阳曲县委大院突然来了7、8位解放军同志，其中一位女同志，就是洪学智的妻子张文。她此番前来，就是为了寻找多年前因战乱而寄养于民间的爱女。可昔日的小村落早已蜕变成另一番景象，这无异于是大海捞针。,https://toutiao.com/group/7417034363226915354/,,0,0,False
她曾被前夫一巴掌扇到离婚！二婚嫁世界冠军，如今生活幸福滋润,2024-09-10 09:12,14700,258,豆莱说,豆莱说,“漂亮的让人挪不开眼”是圈内人对她的评价，和“山杏”不一样的是，李琳在现实生活中的感情很是幸运，遇到了导演王小列。,https://toutiao.com/group/7412930201929204236/,,0,0,False
南京大屠杀再添新证！“几乎未出现过”的照片曝光！,2024-10-31 23:11,2118,915,环球网,环球网,来源：扬子晚报 记者近日注意到，日本都留文科大学名誉教授笠原十九司在2024年第三期《日本侵华南京大屠杀研究》上发表论文《史料发掘：南京大屠杀的现场与照片——基于一个日军炮兵的阵中日记和回想录》。论文由侵华日军南京大屠杀遇难同胞纪念馆馆员芦鹏翻译。,https://3w.huanqiu.com/a/1b9fb2/4K4blr58m9M?agt=20,,0,0,False
善恶终有报：疫情时对中国一毛不拔，却大方捐美国6亿，如今咋样,2024-09-29 05:50,938,127,睿之悦,睿之悦,可就是这样一位在中国土生土长起来的富豪，在疫情期间面对同胞的困境却一毛不拔，反而大方的捐助了6亿给美国。,https://toutiao.com/group/7419859345154015798/,,0,0,False
乌克兰败局已定，美国物色新的“代理人”，新的战争即将打响?,2024-11-01 09:37,638,106,兵说,兵说,乌克兰大势已去，谢利多沃被俄军突破，乌军总司令赶赴前线扎波罗热，这是要放弃顿涅茨克了吗?在这种背景下，美国似乎打算放弃乌克兰扶持下一个“代理人”，继续和俄罗斯对抗。,https://toutiao.com/group/7432242564180361791/,,0,0,False
