title,publish_time,like_count,comment_count,media_name,source,abstract,article_url,tag,is_yaowen,article_sub_type,has_video
中老年人散步不要天天去？最新研究：是的，这么做太累，没必要,2025-01-05 03:42,2961,262,金羊网,金羊网,在如今这个快节奏的生活中，我们常常听到医生和健康专家的建议:每天要走5000步甚至10000步，才能维持良好的健康状态。尤其是对于中老年人群体来说，这个目标似乎有些遥不可及。,https://health.ycwb.com/2025-01/05/content_53164048.htm,,0,0,False
气疯的美国政府，和一骑绝尘的中国无人机,2025-01-03 15:27,3810,637,胡锡进,胡锡进,大疆无人机的名气出圈，不断打压它的美国政府成了事实上的抬轿子者。美国商务部1月2日宣布，将就限制或禁止大疆在美国境内使用征求公众意见。现在对美国人来说，中国最知名的品牌除了华为，大概就是大疆了。▲大疆生产的无人机。近年来，美国政府出了千奇百怪限制美国人使用中国无人机的规定。,https://toutiao.com/group/7455711017402663434/,,0,0,False
石破茂亲中吗？,2025-01-03 13:55,11454,577,静思有我,静思有我,,https://toutiao.com/group/7455642885552079395/,,0,0,True
骑行川藏中线天黑被困峡谷中，废弃铁皮房生火做饭吃，挡风又安全,2024-11-01 04:00,35254,6125,刘伟元的旅行,刘伟元的旅行,,https://toutiao.com/group/7432044366060847650/,,0,0,True
厨师长教你：“家常肘子”口感耙糯 软烂入味 肥而不腻,2025-01-02 09:00,2033,264,美食作家王刚,美食作家王刚,厨师长教你：“家常肘子”口感耙糯 软烂入味 肥而不腻,https://toutiao.com/group/7455138904249893416/,,0,0,True
“六星街里还传来巴扬琴声吗……”狼戈、张英席合唱《苹果香》,2024-12-31 14:55,3405,180,央视频,央视频,,https://toutiao.com/group/7454589818538820115/,,0,0,True
小女孩上部队找爸爸，少校阿姨主动搭讪，谁知看到女孩父亲傻眼了,2024-12-23 16:01,3717,868,乐视群星访谈秀,乐视群星访谈秀,,https://toutiao.com/group/7451525814283960872/,,0,0,True
他的资历比朱德还老，授勋时却错失元帅，毛主席特批享受元帅待遇,2024-12-12 10:24,3615,146,品古观今,品古观今,在我军革命史上，有一位将军的资历比朱德还老，连毛主席都说:“共产党能对国民党将领说话的人不多，他就是其一。”可这样的人却在大授衔时，错失了元帅，后来经过毛主席的一番关心，才得以享受与元帅的同等待遇。,https://toutiao.com/group/7447468654758871592/,,0,0,False
河南警察3岁女儿被拐，苦寻全国23年无果，结果却发现女儿在对门,2024-11-05 07:43,6321,681,八号探秘人,八号探秘人,寻亲23年无果，丢失的女儿竟住在对门?但它却真实发生在河南洛阳的梁绍波身上。是意外走丢，还是人贩子所为，三岁的女儿怎会离奇失踪?,https://toutiao.com/group/7433697108120142345/,,0,0,False
突发！鹿晗账号被全平台封禁，一天前还发动态，网友：大瓜来太快,2025-01-06 09:18,164,119,8卦娱,8卦娱,本文所有内容皆有官方可靠信息来源，具体资料赘述在文章内部或结尾。李明德和马天宇事件还没有完，没有想到近段时间“默不作声”的鹿晗竟然再次突发了状况。,https://toutiao.com/group/7456722965724463652/,,0,0,False
冬季骑行西藏，大雪封山推车前行，搭帐篷过夜生火鸡腿炖土豆吃,2024-12-10 04:00,27231,5307,刘伟元的旅行,刘伟元的旅行,,https://toutiao.com/group/7446401638215975458/,,0,0,True
清汤面好吃有诀窍，教你面馆30年不外传的秘诀，劲道爽滑汤鲜味美,2024-12-13 13:30,8393,1121,百变小厨坊,百变小厨坊,,https://toutiao.com/group/7447888258186347018/,,0,0,True
抗美援朝的将军亮相，全体明星自发起立，这幕太感人,2025-01-03 07:32,11834,1351,乐视天天剧好看,乐视天天剧好看,,https://toutiao.com/group/7455587633452843572/,,0,0,True
演员星星被曝在泰缅边境失联，演员徐大久称其“已进入园区头发都剃了，确认在妙瓦底”！我驻清迈总领事馆回应,2025-01-06 04:25,1169,1581,极目新闻,极目新闻,1月6日，微博话题演员星星（王星）在泰缅边境失联冲上热搜第一，引发网友关注。据多家媒体报道，微博账号“失眠爹地”5日深夜发文，自称“嘉嘉”，其男友“星星”是一名演员，日前赴泰国拍戏，在北京时间1月3日中午于泰缅边境失联，距离最后一次发消息已经超过60个小时。,http://jms.ctdsb.net/jmythshare/#/index_share?cId=0&contentType=5&contentId=2345618,,0,0,False
高安国被押前留下英雄壮语，赖清德恶贯满盈，何时方能恶有恶报？,2025-01-05 04:00,24136,2560,邱毅台湾,邱毅台湾,,https://toutiao.com/group/7455975347708920383/,,0,0,True
印度女主播：歼36和076是“光鲜新玩具”，能否生存都是问题,2025-01-02 09:28,4369,1099,第一军情,第一军情,日前，在印度知名度非常高的美女主持人帕尔基-夏尔马在电视节目中，“锐评”了中国先进武器的“井喷”式亮相。夏尔马质疑中国六代机也好，新型两栖攻击舰也好，都是没经过实战考验的“纸老虎”，虽然看起来光鲜亮丽，但真打起来很可能露馅。,https://toutiao.com/group/7455247647847219749/,,0,0,True
萝卜和鸡蛋这样做，比吃补药还补，顿顿吃都不会腻，又香又下饭,2024-10-30 12:28,73303,4444,小寒厨艺,小寒厨艺,萝卜和鸡蛋这样做，比吃补药还补，顿顿吃都不会腻，又香又下饭,https://toutiao.com/group/7431405463378919975/,,0,0,True
年仅47岁：我国无人机专家张代兵去世，网传因公司债务压力而跳楼,2025-01-06 11:48,653,651,观察者网,观察者网,1月6日消息，近日，一则讣告在无人机行业内传开：我国无人机领域的专家，原国防科技大学无人系统研究所副所长，长沙市云智航科技有限公司创始人与董事长，于2025年1月3日，在长沙不幸离世，享年47岁。,https://www.guancha.cn/economy/2025_01_06_761252.shtml,,0,0,False
香港女子花400万买15平房子，晚上睡衣柜顶，客厅宽敞还有大阳台,2024-12-26 04:06,944,524,鲸探所,鲸探所,都说香港寸土寸金，但是对于我们来说，其实这句话只是一个概念而已，只知道贵，但不知道到底能贵到哪种程度。但是看完一位女子花了400万在香港买的房子之后，“寸土寸金”这个词，真的让人“具象化”了。,https://toutiao.com/group/7452564162242265640/,,0,0,False
苦口婆心！央视四天内就解禁烟花爆竹连续发声，重点提不要一刀切,2025-01-02 04:38,296,381,8卦娱,8卦娱,2024年已经过去了，不过在跨年夜当晚，很多网友都在分享自己跨年的同时，也有很多人认为已经缺少了很多年味儿了。,https://toutiao.com/group/7455172411600781858/,,0,0,False
泽连斯基提出停火的先决条件,2025-01-06 08:33,458,941,北京日报客户端,北京日报客户端,据乌克兰国家通讯社6日报道，乌克兰总统泽连斯基日前接受美国媒体采访时表示，乌克兰获得安全保障是确保停火的先决条件。关于与俄方的停火谈判，泽连斯基表示，乌方将首先与美国领导人和欧盟就结束战争和向乌方提供明确安全保障等问题举行磋商并取得共识，然后才有可能与俄方举行谈判。,https://rss2.bjd.com.cn/content/s677b9443e4b068c68f0e2399.html,,0,0,False
今日头条将推进算法透明化，营造更好的网络生态,2025-01-06 09:30,5203,3435,今日头条,今日头条,今日头条是一个通用信息平台，致力于连接人与信息，打造健康、绿色、和谐的网络生态环境。为了回应社会关切，今日头条拟采取以下八项举措，优化平台生态，为广大用户营造风清气正的网络环境：深入推进算法透明化，破除“信息茧房”。,https://toutiao.com/group/7456731628141036067/,,0,0,False
冬季骑行西藏，害怕有狼借宿废弃小屋，还有柴火炉可以取暖做饭吃,2024-12-16 03:59,37646,4787,刘伟元的旅行,刘伟元的旅行,,https://toutiao.com/group/7448551716082942505/,,0,0,True
海南富商张晖：花8亿建108米海上观音像，4年后死在水中死因成谜,2024-10-19 04:49,5185,912,八号探秘人,八号探秘人,在阅读此文之前，辛苦您点击一下“关注”，既方便您进行讨论和分享，又能给您带来不一样的参与感，感谢您的支持！编辑丨xk他是中国的一名富商，耗费8亿元完成了自己的梦想。可梦想落地成为现实的时候，他却在4年后莫名其妙的死去。他就是张晖，上个世纪末海南岛旅游业的龙头当家人。,https://toutiao.com/group/7427288913095492134/,,0,0,False
香港九龙寨城老照片：曾是香港最邪恶肮脏之地，图9场景令人作呕,2024-11-21 11:32,2902,493,万物知识局,万物知识局,有这么一个地方，他虽然地处极度繁华的都市香港，但是却脏乱不堪，环境极度的恶劣，各种违法的交易都在这里进行，甚至黄赌毒，也在这里悄然滋生，这就是九龙城寨。,https://toutiao.com/group/7439657140518519296/,,0,0,False
给近三年最好的10部年代剧排个名：《人世间》第6，第1名没有争议,2024-10-28 07:10,3338,1603,稻述,稻述,到了20世纪初，偶像剧成为人们的掌中宝，但要说现在什么剧最受欢迎，那一定是年代剧!其中《人世间》只能排第六，第一名人人都爱看，最后一名也比上不足比下有余。,https://toutiao.com/group/7430715494055264783/,,0,0,False
她实在太会了！《美丽的女同学》四川方言版,2024-11-03 09:35,7875,385,文西与阿漆,文西与阿漆,本视频素材取自网络，由阿漆制作配音，希望大家喜欢！,https://toutiao.com/group/7432984463061025332/,,0,0,True
煮速冻饺子，切记别用开水和冷水煮，教你方法，出锅和现包的一样,2025-01-04 11:48,881,190,百变小厨坊,百变小厨坊,,https://toutiao.com/group/7456025845027570203/,,0,0,True
四年前，他靠倒卖口罩一年狂入60亿元，住5万一夜酒店，如今咋样,2024-12-28 00:11,1395,202,未央史默,未央史默,2021年2月，一个长相清秀，身穿一件紧身黑色毛衣的年轻人，正悠闲地躺在沙发上讲话。他靠倒卖口罩一年狂入60亿元，住5万一夜酒店，两年赚了众人一辈子都赚不到的钱。,https://toutiao.com/group/7453035122942689827/,,0,0,False
炸鱼块，到底用淀粉还是面粉，今天分享一个又香又脆的做法,2025-01-02 09:26,7938,494,家常的味道,家常的味道,,https://toutiao.com/group/7455247105683096076/,,0,0,True
厨师长教你：“葱爆羊肉”羊肉滑嫩、鲜香不膻,2024-12-27 07:34,3924,718,美食作家王刚,美食作家王刚,厨师长教你：“葱爆羊肉”羊肉滑嫩、鲜香不膻,https://toutiao.com/group/7452991735665263139/,,0,0,True
妻子深夜加班，丈夫感觉不对劲偷偷跟踪，看到真相瞬间崩溃,2024-10-28 06:59,24375,465,乐视金曲大荟萃,乐视金曲大荟萃,妻子深夜加班，丈夫感觉不对劲偷偷跟踪，看到真相瞬间崩溃,https://toutiao.com/group/7430717509566726656/,,0,0,True
中国小伙缅甸边境旅游，在离园区100米附近参观，被对岸的人盯上,2025-01-01 09:48,1251,291,桑代克的猹,桑代克的猹,“缅甸园区离泰国边境仅一河之隔，如今竟还有人偷渡”12月27号旅游博主张张在自媒体账号上发布了自己在泰国旅游的危险经历，看的手机这头的网友都为他捏了一把汗。因为视频中他正站在离缅甸园区仅一河之隔的泰国边境，河的对面就是缅甸妙瓦底。,https://toutiao.com/group/7454877418117923339/,,0,0,False
新婚33天卷走274万4套房，出逃后丈夫跨国追捕，如今下场大快人心,2024-12-20 22:06,5388,270,八号探秘人,八号探秘人,在阅读此文之前，辛苦您点击一下“关注”，既方便您进行讨论和分享，又能给您带来不一样的参与感，感谢您的支持！编辑丨QQ·B“色字头上一把刀！”深圳富豪结婚33天竟被卷走274万元和名下4套房产。不仅如此，他还被扣上了“接盘侠”的帽子，啥也没干喜当爹。,https://toutiao.com/group/7450399558821052982/,,0,0,False
老纪和珅这段对话，以前小时候听不懂，如今听完受益终身,2024-12-28 23:16,6249,1803,乐视扒剧小妹儿,乐视扒剧小妹儿,,https://toutiao.com/group/7453420191947424293/,,0,0,True
我国楼市大局已定，未来全国45%的家庭，或将面临“5大挑战”,2024-12-15 11:45,711,108,苍暮颜,苍暮颜,前言:21世纪开始，中国房地产市场一路高歌猛进，繁荣的景象更是吸引了无数投资者和购房者，房价也是一路攀升，也成为了房地产经济增长的重要引擎。,https://toutiao.com/group/7448599203455975947/,,0,0,False
男人怀疑自己有病，女友亲自上阵，一晚上给治好了,2025-01-04 02:03,1646,525,南瓜热剧回放,南瓜热剧回放,,https://toutiao.com/group/7455875274023666186/,,0,0,True
平均3天造一枚核弹，近日美国公开了中国核弹头生产速度！,2025-01-06 10:09,2010,792,军武次位面,军武次位面,前段时间，美国国防部发布的《2024中国军力报告》中提到，“中国的核弹头数量正在快速增长，从去年500枚增长到今年的600枚，并且预计2030年数量将达到1000枚。,https://toutiao.com/group/7456742462263001610/,,0,0,False
多次删减，这部满是禁忌的国产片，能上映真不容易！,2024-12-13 09:58,4329,189,越哥说电影,越哥说电影,,https://toutiao.com/group/7447833700995170856/,,0,0,True
