title,publish_time,like_count,comment_count,media_name,source,abstract,article_url,tag,is_yaowen,article_sub_type,has_video
上半年中美印新生人口：美国178万，印度1140万，中国让人意外,2024-09-23 12:16,1013,296,开心营业厅,开心营业厅,中美印是全球人口数量最多的三个国家，几乎占到了全球人口总数的近四成，不过，如今三个国家，却在生育率的问题上，遭遇了前所未有的挑战。,https://toutiao.com/group/7417736973647790628/,,0,0,False
火箭军向太平洋海域成功发射1发洲际弹道导弹,2024-09-25 02:03,18991,12256,新华社,新华社,新华社北京9月25日电 9月25日8时44分，中国人民解放军火箭军向太平洋相关公海海域，成功发射1发携载训练模拟弹头的洲际弹道导弹，准确落入预定海域。此次导弹发射，是火箭军年度军事训练例行性安排，有效检验武器装备性能和部队训练水平，达到了预期目的。中方提前向有关国家作了通报。,http://api.xinhua-news.com/newroute/newsdetail/101002024092470006109?dest=ALNtfVaYjPRzFanDTCE30lXEcrpMmexkEBAZEa466CGY,,0,0,False
2岁半女童失联43天，邻村悬崖底油葵地里找到遗体，家属怀疑孩子遇害希望严惩凶手,2024-09-25 03:07,153,110,大风新闻,大风新闻,9月24日，山西运城芮城县西陌镇马夭村董家庄2岁半女童的亲属张女士向华商报大风新闻记者证实，9月23日，侄女失踪第43天，孩子的遗体在邻村一处悬崖底下油葵地里被找到。目前，家属正考虑做尸检查明具体死因，芮城警方正加紧侦办。,https://toutiao.com/group/7418410529175978546/,,0,0,False
东哥美食推荐？叉烧肉走起,2024-09-24 12:09,3200,178,隽隽爱分享,隽隽爱分享,,https://toutiao.com/group/7418180603046822400/,,0,0,True
"万万没想到,53岁“丁克”半辈子的康辉，一生遗憾竟然是一通电话",2024-08-21 22:14,22142,4600,峰哥正读,峰哥正读,在阅读此文之前，麻烦您点击一下“关注”，既方便您进行讨论和分享，又能给您带来不一样的参与感，感谢您的支持！文/编辑：蘑菇百善孝为先。但是到底怎么做才算是“孝”，康辉用了半辈子才明白。央视知名主持人康辉，事业顺遂，家庭幸福，在外人看来是一个人生赢家。,https://toutiao.com/group/7405504703687115273/,,0,0,False
曹德旺说：我不会逃跑，但要给政府提个醒 #曹德旺 #福耀科技大学,2024-06-28 06:51,25892,3503,正直鲸鱼LxhXfoC,正直鲸鱼LxhXfoC,,https://toutiao.com/group/7385443277144588834/,,0,0,True
她认干爹改国籍，曾叫嚣要击败女国乒，却在巴黎奥运会丢尽了脸,2024-08-26 14:00,486,301,吃瓜崽崽,吃瓜崽崽,她曾是中国国籍，却因认干爹入韩籍。十九岁的她被国人认为是乒坛叛徒，还曾叫嚣女国乒。如今却成为了韩国乒乓一姐。,https://toutiao.com/group/7407375792933044790/,,0,0,False
又出大瓜？73岁“风流妖精”刘晓庆，如今已经走上另一条道路,2024-09-21 05:32,1745,236,冯律讲法,冯律讲法,近日，四火姐姐在直播间中透露了一件事，即“身边有位老师，70多岁了，还在谈恋爱，有八个男朋友，所有人都认识她。”,https://toutiao.com/group/7416939451584102939/,,0,0,False
港姐归来，小奎坐大奔热情迎接，爱人见面抱头痛哭 #相亲,2024-07-05 04:45,23521,4863,海哥量地球,海哥量地球,,https://toutiao.com/group/7388008203738415653/,,0,0,True
2013年，湖南26岁女孩嫁给71岁老头，婚后还生下一子，如今怎样了,2024-07-12 11:59,23723,2320,智史通鉴,智史通鉴,2013年4月17日，长沙宁乡县的民政局迎来了一对特殊的夫妻。一个71岁的老头和一个26岁的女孩，离远了看，甚至像爷爷和孙女。面对工作人员异样的眼光，女孩说：“我和他是真心相爱的！”这让人好奇，这对相差45岁的夫妻，他们之间到底有着怎样的爱情故事？,https://toutiao.com/group/7390696631223534120/,,0,0,False
陈若琳把全红婵养得是真好啊,2024-08-07 03:21,2876,181,中工网,中工网,<p style='text-indent: 2em;'>原标题：陈若琳把全红婵养得是真好啊</p><p style='text-indent: 2em;'>昨晚，巴黎奥运会女子10米跳台跳水决赛，全红婵夺得金牌！赛后采访，她说，我不是你们所说的天才，都是练的，一遍一遍地练。教练陈若琳见证了全红婵的努力与刻苦。@陈若琳sunny@全红婵这对被称为“王炸”组合的师徒，在奥运赛场上都有过非常亮眼的表现。为帮全红婵突破发育关，陈若琳下了不少功夫。每天七八个小时的训练，恨不得将全红婵“拴在裤腰带上”严密看管。执教能力虽受过质疑，但她从不回避，而是找出问题，各个击破。她说：“我走过的弯路，不想让全红婵再走一遍。”中国队加油！（央视）</p>,http://db.workercn.cn/media/2024/08/07/64B10057EEF44DC3904C945F112F757A/preview.mp4,,0,0,True
表面是艺人，实际是富家千金的5位女星，无人敢惹更别说潜规则了,2024-08-28 02:06,6942,536,八号探秘人,八号探秘人,在德云班主郭德纲的作品中，有过这么一句话。虽说此言尤为刺耳，但话糙理不糙。当今娱乐圈，很多女星为出人头地，自愿或被迫做出违反道德底线之事。,https://toutiao.com/group/7407984985224872459/,,0,0,False
两个姑爷来农村 #农家院农家菜农家生活 #农村生活 鸡鱼招待,2024-08-07 09:04,6392,834,农民王小,农民王小,,https://toutiao.com/group/7400320946991301160/,,0,0,True
5座车拉6个人被判超员，车主1句话把交警问懵,2024-08-05 20:20,12797,3037,奇妙钢笔pA8JyP,奇妙钢笔pA8JyP,,https://toutiao.com/group/7399752843772559906/,,0,0,True
11_用巨大的假蟒蛇恶搞路人-简直是太刺激了-,2024-08-05 00:17,9883,1441,外向辰星谈科普,外向辰星谈科普,,https://toutiao.com/group/7398353020251013644/,,0,0,True
姑娘远嫁山东十年未回家，带着孩子偷偷回娘家，到家眼前一幕哭了,2024-09-09 08:25,22411,9695,小乔家里的事,小乔家里的事,,https://toutiao.com/group/7412556561718968870/,,0,0,True
火箭军向太平洋发射洲际导弹，提醒美国人该冷静下了,2024-09-25 03:17,499,270,第一军情,第一军情,据新华社9月25日报道，周三上午8时44分，火箭军发射一枚洲际弹道导弹，准确击中了太平洋公海的预定海域。,https://toutiao.com/group/7418409985714979380/,,0,0,False
满堂：赵本山买鸡这段，据说导演组都笑趴了，不愧是老戏骨！,2024-09-03 02:27,2208,267,青涩星球yS,青涩星球yS,,https://toutiao.com/group/7410237919833391668/,,0,0,True
中国🇨🇳人民的好总理,2024-09-03 15:46,175883,19365,话说,话说,这个老人一生只做一件事，那就是为了人民鞠躬尽瘁，死而后已,https://toutiao.com/group/7410443709928210955/,,0,0,True
为什么没事千万别惹2.28米的张子宇？不然后果很严重，看看这一战,2024-06-30 01:48,3643,159,华少体育解说,华少体育解说,,https://toutiao.com/group/7386107221332984320/,,0,0,True
安徽美女道士胡小慧被捕：精通“胡媚术”，九名男徒弟揭露其罪行,2024-09-12 08:10,3077,366,艺述史,艺述史,在安徽一处偏僻山头上，有座神秘的道观，外表平平无奇，但里面却有着一位名气很高的美女道士。美女道士的名字叫做胡小慧，据说有着高深的法力，能帮人消灾解难。很多人慕名前来，交上丰厚的香火钱，在袅袅青烟里，试图从这个年轻道士身上获得一些生活的支撑。,https://toutiao.com/group/7413662261274739200/,,0,0,False
