title,publish_time,like_count,comment_count,media_name,source,abstract,article_url,tag,is_yaowen,article_sub_type,has_video
时政微视频丨百姓冷暖系心间,2025-01-29 23:11,1935,1252,国际在线,国际在线,新春佳节阖家团圆的时刻，总有人在岗位上过节，在坚守中奉献。气象万千的新春图景，离不开千千万万的劳动者、奉献者、守护者。“各行各业的人们都在挥洒汗水，每一个平凡的人都作出了不平凡的贡献！”心之所系，行之所至。,https://news.cri.cn/toutiaopic/efd3c406-e850-da7a-7eda-baeb290d941b.html,,0,0,False
【团圆年】习言道｜在北京的胡同里，习近平贴下“福”字,2025-01-30 06:50,722,501,中国新闻网,中国新闻网,题:在北京的胡同里，习近平贴下“福”字。每逢新春到来，习近平总书记总会深入基层考察，听民声、问冷暖，并与各地群众一起迎新春。,http://ku.m.chinanews.com/wapapp/cns/gn/2025/01-30/10361716.shtml,,0,0,False
小沈阳夫妇把演唱会开到了北京春晚舞台！,2025-01-29 16:47,14025,2481,非凡蛋糕mu,非凡蛋糕mu,,https://toutiao.com/group/7465379968436994623/,,0,0,True
西安黑老大丹姐抓捕真实影像，一脸清纯身材完美，长相堪比女明星,2025-01-30 04:00,1833,270,神秘说official,神秘说official,西安黑老大丹姐抓捕真实影像，一脸清纯身材完美，长相堪比女明星,https://toutiao.com/group/7464054149404819977/,,0,0,True
天津春晚证明，不给岳云鹏那么多束缚，14分钟内让你笑30次很容易,2025-01-30 02:09,6766,3021,相声圈外,相声圈外,,https://toutiao.com/group/7465524594917540389/,,0,0,True
广东突发地震！希望人员都平平安安,2025-01-30 15:06,2265,163,荔枝最理智,荔枝最理智,,https://toutiao.com/group/7465724894437720610/,,0,0,True
突发新闻：美国客机在首都华盛顿特区坠毁！,2025-01-30 03:39,2707,516,娜宝,娜宝,,https://toutiao.com/group/7465547937033847335/,,0,0,True
同事聚餐吃预制菜  网友:春晚五小时   都莫得这个视频有意思！,2025-01-30 09:51,5125,666,暗话&明说,暗话&明说,,https://toutiao.com/group/7465643901471228442/,,0,0,True
北京卫视春晚：小沈阳 沈春阳 合体带来经典歌曲串烧，互飙高音,2025-01-29 15:20,4861,1007,杜壮壮,杜壮壮,,https://toutiao.com/group/7465357502209671691/,,0,0,True
春晚总导演于蕾发声,2025-01-30 07:21,1343,2436,最牛人物,最牛人物,,https://toutiao.com/group/7465605232861512226/,,0,0,True
宋小宝上春晚多年，这是公认最牛的一个小品！笑点杠杠的,2025-01-19 00:24,6926,1387,潜伏剧院,潜伏剧院,,https://toutiao.com/group/7460858238515380751/,,0,0,True
大过年的，有什么事不能好好商量商量吗？非要打架……,2025-01-29 10:40,1878,710,小珏剪辑,小珏剪辑,,https://toutiao.com/group/7465285312671908393/,,0,0,True
资中放炮仗炸翻小车的小孩哥后续来了,2025-01-30 12:37,23279,6015,山妹有料,山妹有料,,https://toutiao.com/group/7465686272388989459/,,0,0,True
