title,publish_time,like_count,comment_count,media_name,source,abstract,article_url,tag,is_yaowen,article_sub_type,has_video
独家完整版视频丨国家主席习近平发表二〇二五年新年贺词,2024-12-31 11:15,38842,23706,央视新闻,央视新闻,新年前夕，国家主席习近平通过中央广播电视总台和互联网，发表了二〇二五年新年贺词。全文如下：大家好！时间过得很快，新的一年即将到来，我在北京向大家致以美好的祝福！2024年，我们一起走过春夏秋冬，一道经历风雨彩虹，一个个瞬间定格在这不平凡的一年，令人感慨、难以忘怀。,https://content-static.cctvnews.cctv.com/snow-book/index.html?item_id=1506781951411024055&source=50006&sub_source=50006_001,,0,0,False
独家视频丨国家主席习近平向大家致以美好的祝福,2024-12-31 11:04,2144,2056,央视新闻,央视新闻,新年前夕，国家主席习近平通过中央广播电视总台和互联网，发表了二〇二五年新年贺词。习近平：大家好！时间过得很快，新的一年即将到来，我在北京向大家致以美好的祝福！©2024中央广播电视总台版权所有。未经许可，请勿转载使用。,https://content-static.cctvnews.cctv.com/snow-book/index.html?item_id=3058834507220543667&source=50006&sub_source=50006_001,,0,0,False
独家视频丨习近平：两岸同胞一家亲 谁也无法割断我们的血脉亲情,2024-12-31 11:12,1065,1517,央视新闻,央视新闻,新年前夕，国家主席习近平通过中央广播电视总台和互联网，发表了二〇二五年新年贺词。习近平：两岸同胞一家亲，谁也无法割断我们的血脉亲情，谁也不能阻挡祖国统一的历史大势！©2024中央广播电视总台版权所有。未经许可，请勿转载使用。,https://content-static.cctvnews.cctv.com/snow-book/index.html?item_id=13327794526506738937&source=50006&sub_source=50006_001,,0,0,False
六代机双飞、四川舰三个第一，神雕无人预警机，中国军工震惊美国,2024-12-30 06:02,40946,2121,邱毅台湾,邱毅台湾,,https://toutiao.com/group/7454081205471085107/,,0,0,True
代理总统也遭弹劾！一个月内换三任总统，韩国民主还有救吗？,2024-12-28 06:35,12262,106,邱震海,邱震海,,https://toutiao.com/group/7453347580572631592/,,0,0,True
老人在家带孙女，儿媳从监控看到这画面泪目了,2024-12-31 02:41,3146,239,新派新闻,新派新闻,,https://toutiao.com/group/7454215156852064818/,,0,0,True
厨师长教你：“葱爆羊肉”羊肉滑嫩、鲜香不膻,2024-12-27 07:34,2720,499,美食作家王刚,美食作家王刚,厨师长教你：“葱爆羊肉”羊肉滑嫩、鲜香不膻,https://toutiao.com/group/7452991735665263139/,,0,0,True
四川女生在澳洲农场打工的真实生活：早上4点摘草莓，时薪29澳元,2024-12-28 04:26,1695,544,鲸探所,鲸探所,网上有一位博主分享了自己在澳洲农场打工的真实生活，每天早上四点起床摘草莓，一个小时29澳元，一天只需要工作6个小时左右。,https://toutiao.com/group/7453312348158231081/,,0,0,False
被央媒怒批，目不识丁，丢人现眼，这几位“文盲”明星凭什么走红,2024-12-30 10:52,2654,655,与君説,与君説,在阅读此文之前，麻烦您点击一下“关注”，既方便您进行讨论和分享，又能给您带来不一样的参与感，感谢您的支持文、编辑|小娄郭德纲曾说“可以没文凭，但不能没文化”。老郭的这句话在儿子郭麒麟身上体现得淋漓尽致。虽然郭麒麟初中就辍学了，但人家有思想有内涵，是个名副其实的“文化人”。,https://toutiao.com/group/7454151513221661234/,,0,0,False
赖当局为何羁押高安国将军？解放军六代机及076舰震惊台湾,2024-12-30 22:01,28183,1671,黎建南台湾,黎建南台湾,,https://toutiao.com/group/7454328325800985126/,,0,0,True
韩国又一次创造了历史,2024-12-28 04:21,3891,153,牛弹琴,牛弹琴,韩国又创造了历史，更精彩的还在后面,https://toutiao.com/group/7453313008731685411/,,0,0,True
零下35度睡到帐篷里，半夜被热醒了，真的太热了,2024-12-30 11:22,3735,687,旅行者小多,旅行者小多,,https://toutiao.com/group/7454163664929554971/,,0,0,True
经典高清战争老电影,2024-11-18 05:05,11269,331,小微娱乐创作,小微娱乐创作,,https://toutiao.com/group/7438481167495463424/,,0,0,True
广西49岁老汉娶19岁姑娘，结婚21年生下15个孩子，如今有何下场？,2024-10-20 08:32,9919,1228,艺述史,艺述史,她19岁出嫁，21年里总共生育了15个孩子，其中4个男孩子11个女孩子，家里热闹的像是开了一所学校一样。,https://toutiao.com/group/7427400319418384948/,,0,0,False
海南富商张晖：花8亿建108米海上观音像，4年后死在水中死因成谜,2024-10-19 04:49,4737,839,八号探秘人,八号探秘人,在阅读此文之前，辛苦您点击一下“关注”，既方便您进行讨论和分享，又能给您带来不一样的参与感，感谢您的支持！编辑丨xk他是中国的一名富商，耗费8亿元完成了自己的梦想。可梦想落地成为现实的时候，他却在4年后莫名其妙的死去。他就是张晖，上个世纪末海南岛旅游业的龙头当家人。,https://toutiao.com/group/7427288913095492134/,,0,0,False
老纪和珅这段对话，以前小时候听不懂，如今听完受益终身,2024-12-28 23:16,4489,1330,乐视扒剧小妹儿,乐视扒剧小妹儿,,https://toutiao.com/group/7453420191947424293/,,0,0,True
新婚33天卷走274万4套房，出逃后丈夫跨国追捕，如今下场大快人心,2024-12-20 22:06,4523,234,八号探秘人,八号探秘人,在阅读此文之前，辛苦您点击一下“关注”，既方便您进行讨论和分享，又能给您带来不一样的参与感，感谢您的支持！编辑丨QQ·B“色字头上一把刀！”深圳富豪结婚33天竟被卷走274万元和名下4套房产。不仅如此，他还被扣上了“接盘侠”的帽子，啥也没干喜当爹。,https://toutiao.com/group/7450399558821052982/,,0,0,False
男子从老婆手中里解救出小三后，牵着狗头也不回的离开了,2024-11-20 09:07,39522,13623,橙橙分享,橙橙分享,,https://toutiao.com/group/7439285557244461606/,,0,0,True
乞丐上台唱歌引起评委质疑，一首歌唱完让观众起立鼓掌,2024-11-01 02:16,4374,712,乐视综艺咖,乐视综艺咖,,https://toutiao.com/group/7432129044134494771/,,0,0,True
高安国夫妻被秘密收押，赖清德下狠手消灭统派，下一个会是谁？,2024-12-31 08:40,19321,3718,邱毅台湾,邱毅台湾,,https://toutiao.com/group/7454493107262849575/,,0,0,True
【空气炸锅烤红薯】直接烤是大错！教你一招，红薯香甜软糯流蜜汁,2024-12-25 14:05,1028,423,明玥美食,明玥美食,【空气炸锅烤红薯】直接烤是大错！教你一招，红薯香甜软糯流蜜汁，比买的好吃,https://toutiao.com/group/7452350435098919443/,,0,0,True
小子从小被猴养大，长大成半人半兽，身怀出神入化的武功,2024-11-22 03:36,1095,173,乐视群星访谈秀,乐视群星访谈秀,,https://toutiao.com/group/7439942541555794471/,,0,0,True
煮米饭别总是加水了，难怪不好吃，教你酒店不外传的秘诀，非常香,2024-12-06 08:45,3659,792,明玥美食,明玥美食,,https://toutiao.com/group/7445217195929371190/,,0,0,True
想吃零食别出去买，家里有苹果鸡蛋就能做，外酥里软比买的还好吃,2024-12-10 13:36,4252,338,小寒厨艺,小寒厨艺,想吃零食别出去买，家里有苹果鸡蛋就能做，外酥里软比买的还好吃,https://toutiao.com/group/7446704956704293402/,,0,0,True
包厢全是刚出狱的恶霸，结果一看到饭店主厨，立马怂了,2024-11-11 01:21,14358,390,乐视群星访谈秀,乐视群星访谈秀,,https://toutiao.com/group/7435825833048015400/,,0,0,True
唐嫣胡歌合唱《再回首》，糖糖这眼神绝了，罗晋看了都吃醋,2024-12-27 06:12,1818,343,乐视天天剧好看,乐视天天剧好看,,https://toutiao.com/group/7452970574004879908/,,0,0,True
在单位：不说三话，不透三底，不帮三忙，不交三人,2024-12-26 13:42,2436,338,洞见,洞见,作家熊太行曾说，每个职场上的王者，身体里面都应该有三个灵魂：一个文臣，谨小慎微，考虑风险；一个武将，积极努力，谋求胜利；一个商人，精打细算，心中有数。要明白，在单位真正能冒尖的人不仅要能力出众，还要带点脑子。你可以不圆滑，但一定要知世故。,https://toutiao.com/group/7452714747801109001/,,0,0,False
明天是元旦，点开这首歌听听，2025 年一切都如愿！,2024-12-30 23:07,5116,920,大地春晖,大地春晖,明天是元旦，点开这首歌听听，2025 年一切都如愿！,https://toutiao.com/group/7453763957321368083/,,0,0,True
精神病遇到精神病，两个人聊起天来，差点没把人笑死,2024-11-29 06:05,3632,406,乐视大综艺咖,乐视大综艺咖,,https://toutiao.com/group/7442578452600848936/,,0,0,True
第6代战机，是怎样炼成的？(上),2024-12-29 14:51,12935,425,静思有我,静思有我,,https://toutiao.com/group/7453846576981606912/,,0,0,True
欧洲会爆发世界大战吗？俄乌2025年能否止战？|凤凰《非常2024》,2024-12-30 07:54,2324,163,凤凰卫视,凤凰卫视,,https://toutiao.com/group/7454110252754010664/,,0,0,True
近5年最热的十部剧，《狂飙》第9，《繁华》第6，第1名很难超越,2024-12-01 03:58,1912,684,电影烂番茄,电影烂番茄,今天，番叔就结合口碑，给大家盘点一下近五年，热度最高的十部电视剧。第十名:《都挺好》 猫眼热度 9775.8，播出时间2019年。,https://toutiao.com/group/7430845717314273831/,,0,0,False
徐克出品，必属精品，近年来为数不多的精良动作片,2024-12-13 03:48,1693,443,乐视典藏金曲汇,乐视典藏金曲汇,,https://toutiao.com/group/7447707364414718498/,,0,0,True
妻子到处说丈夫不行，丈夫脸都丢光了，回家把妻子当狗打,2024-11-13 08:41,1231,110,乐视扒剧小妹儿,乐视扒剧小妹儿,,https://toutiao.com/group/7436679409567793673/,,0,0,True
再现久违声音！蔡磊借助AI完成了一场演讲,2024-12-31 01:12,9215,1307,央视新闻,央视新闻,“我坚信，我们终有战胜渐冻症的那一天。”在《AI奇妙夜》晚会现场，渐冻人蔡磊借助AI完成了一场演讲，重获新“声”！,https://toutiao.com/group/7454377687977722422/,,0,0,True
