title,publish_time,like_count,comment_count,media_name,source,abstract,article_url,tag,is_yaowen,article_sub_type,has_video
习近平向全国广大农民和工作在“三农”战线上的同志们致以节日祝贺和诚挚问候,2024-09-21 09:40,5246,3337,新华社,新华社,习近平向全国广大农民和工作在“三农”战线上的同志们致以节日祝贺和诚挚问候。在第七个“中国农民丰收节”到来之际，中共中央总书记、国家主席、中央军委主席习近平代表党中央，向全国广大农民和工作在“三农”战线上的同志们致以节日祝贺和诚挚问候。,http://mp.weixin.qq.com/s?__biz=MzA4NDI3NjcyNA==&mid=2650074248&idx=1&sn=6a1a77c66084f74c4d25123af2cc4bd5,,0,0,False
2013年，湖南26岁女孩嫁给71岁老头，婚后还生下一子，如今怎样了,2024-07-12 11:59,22584,2242,智史通鉴,智史通鉴,2013年4月17日，长沙宁乡县的民政局迎来了一对特殊的夫妻。一个71岁的老头和一个26岁的女孩，离远了看，甚至像爷爷和孙女。面对工作人员异样的眼光，女孩说：“我和他是真心相爱的！”这让人好奇，这对相差45岁的夫妻，他们之间到底有着怎样的爱情故事？,https://toutiao.com/group/7390696631223534120/,,0,0,False
军号一响，全军出击！,2024-09-19 08:01,9989,635,中国军号,中国军号,,https://toutiao.com/group/7416261401477382668/,,0,0,True
多少：赵本山装病上黑诊所，这段百看不厌，场面太逗了！,2024-09-21 02:46,1295,231,青涩星球yS,青涩星球yS,,https://toutiao.com/group/7416922331924136463/,,0,0,True
姑娘远嫁山东十年未回家，带着孩子偷偷回娘家，到家眼前一幕哭了,2024-09-09 08:25,19858,8624,小乔家里的事,小乔家里的事,,https://toutiao.com/group/7412556561718968870/,,0,0,True
曹德旺说：我不会逃跑，但要给政府提个醒 #曹德旺 #福耀科技大学,2024-06-28 06:51,25546,3488,正直鲸鱼LxhXfoC,正直鲸鱼LxhXfoC,,https://toutiao.com/group/7385443277144588834/,,0,0,True
董卿父亲董善祥：我这辈子最后悔的事，就是让宝贝女儿嫁给密春雷,2024-09-11 06:59,1371,150,稻述,稻述,提起央视主持，现在挑大梁的几乎就是撒贝宁、尼格买提、龙洋等人了，他们也都非常优秀，但常有人怀念起董卿还在的日子。,https://toutiao.com/group/7413267526601228852/,,0,0,False
上海台风来袭 ，27层楼房在晃 ，吓坏了#记录真实生活 #台风,2024-09-16 08:29,1374,219,兴凯湖莹莹,兴凯湖莹莹,,https://toutiao.com/group/7415155319245898276/,,0,0,True
国庆放假最新通知！不仅放假7天，而且还有4个好消息告诉大家,2024-09-21 06:53,2681,206,笑史云烟,笑史云烟,相信不少人已经准备好迎接这难得的七天长假，无论是准备出游看看祖国的大好河山，还是回家与家人团聚，亦或是宅在家里放松休息，大家的心情都充满了期待。,https://toutiao.com/group/7416981278681809423/,,0,0,False
恭喜中国女篮新领袖终于出现了！百发百中！统治力让对手深深绝望,2024-06-25 07:11,24701,1347,乐播体育,乐播体育,,https://toutiao.com/group/7384335028576059923/,,0,0,True
时隔27年找初恋，他若单身我愿嫁他，相见两人泪流满面,2024-08-02 04:56,23893,3754,彤儿说事,彤儿说事,,https://toutiao.com/group/7398401586776506906/,,0,0,True
男人和女人的需求差别这么大？,2024-07-12 11:00,27569,1988,周小鹏,周小鹏,男人和女人的需求差别这么大？,https://toutiao.com/group/7388885573953389092/,,0,0,True
为什么没事千万别惹2.28米的张子宇？不然后果很严重，看看这一战,2024-06-30 01:48,3591,157,华少体育解说,华少体育解说,,https://toutiao.com/group/7386107221332984320/,,0,0,True
罕见！100年前，英国游客拍下的清朝乡村，和想象中完全不一样,2024-09-20 02:07,1384,168,万物知识局,万物知识局,泥泞的土路，衣不蔽体的老百姓，即便是达官显贵的家中也十分破败，而这些都是清王朝的历史痕迹，虽说那时候中国摄影技术并不发达，但也有许多外国游客来到这里，拍摄下了许多老照片，为我们留下了珍贵的历史资料，那清朝到底是怎样的面貌呢?,https://toutiao.com/group/7416287738871267855/,,0,0,False
她是央视最惨主持人，男友被判死缓，丈夫诈骗入狱，47岁无人敢娶,2024-08-27 23:30,2077,206,闻书识焉,闻书识焉,她曾是央视的台柱子，和董卿、周涛并称为央视的三朵金花。回顾刘芳菲的前半生，最令人感到惋惜的，便是她的感情生活，47岁至今无人敢娶。,https://toutiao.com/group/7407743113688564258/,,0,0,False
以色列这一炸全搞砸了，中东地区迎来去美国化：中国成为最大赢家,2024-09-20 07:56,3116,988,深度工场,深度工场,以色列这一炸全搞砸了。以色列在黎巴嫩这一炸，在战术上来说，确实很成功，杀伤4500多名黎巴嫩真主党成员。,https://toutiao.com/group/7416630160327279158/,,0,0,False
4年骑行结束，1500天终于回到老家，感谢大家一路陪伴有缘江湖见,2024-09-07 03:50,69076,16461,刘伟元的旅行,刘伟元的旅行,4年骑行结束，1500天终于回到老家，感谢大家一路陪伴有缘江湖见！,https://toutiao.com/group/7411715839100977716/,,0,0,True
为什么说从2025年开始，70岁以上的老人，可能面临“两大”问题？,2024-09-01 14:12,2124,269,水大叔,水大叔,据可靠数据了解，我国70岁以上的人口数量已经达到了2.5亿人次，占到全国总人口数量的18%。伴随着人口老龄化的出现，养老问题也成了重中之重，要知道养老不仅仅是家庭的责任，更是社会责任。,https://toutiao.com/group/7409677025897710106/,,0,0,False
患难见真情，9艘船装载武器运往俄罗斯，俄盟友出手，美英法急了,2024-09-14 23:13,4206,212,美洲话姐,美洲话姐,作为执掌俄罗斯长达20多年的强人，普京很清楚，决定俄乌冲突走向的因素有很多，战场上的胜败得失固然重要，但战场之外的较量，同样不能忽略。,https://toutiao.com/group/7414640590115897896/,,0,0,False
5座车拉6个人被判超员，车主1句话把交警问懵,2024-08-05 20:20,11065,2654,奇妙钢笔pA8JyP,奇妙钢笔pA8JyP,,https://toutiao.com/group/7399752843772559906/,,0,0,True
6万中国军人一夜神秘消失,2024-09-16 04:48,2505,105,坦荡的风声,坦荡的风声,,https://toutiao.com/group/7415098419808567835/,,0,0,True
张紫妍：被迫陪睡31人近百次，遭道具虐待，29岁自杀留230页遗书,2024-07-24 02:37,11661,789,八号探秘人,八号探秘人,在阅读此文之前，辛苦您点击一下“关注”，既方便您进行讨论和分享，又能给您带来不一样的参与感，感谢您的支持！本文叙述皆有官方信源，为了读者有更好体验，放在了文章后缀！,https://toutiao.com/group/7394994383675736576/,,0,0,False
中国🇨🇳人民的好总理,2024-09-03 15:46,155564,17774,话说,话说,这个老人一生只做一件事，那就是为了人民鞠躬尽瘁，死而后已,https://toutiao.com/group/7410443709928210955/,,0,0,True
