title,publish_time,like_count,comment_count,media_name,source,abstract,article_url,tag,is_yaowen,article_sub_type,has_video
淘汰王楚钦！丹麦选手林德庆祝：我赢了世界第一！在他的主场！,2024-10-01 15:48,1148,2559,直播吧,直播吧,直播吧10月01日讯 WTT中国大满贯2024男单1/16决赛，王楚钦1-3爆冷不敌丹麦选手林德。赛后，赛事方晒出了林德录制的庆祝视频。林德在视频中说：“我刚刚击败了世界第一，在他的主场中国，这真是我一生中最重要的时刻。感谢所有支持我的人，我会继续战斗希望赢得更多比赛。,https://news.zhibo8.com/other/2024-10-01/66fc17b8f1f2fnative.htm,,0,0,False
全球约一半肝癌在中国，再次提醒：家中的4种食物，尽早撤下餐桌,2024-08-13 08:36,94571,3529,梁医学社梁怡璋医生,梁医学社梁怡璋医生,,https://toutiao.com/group/7402540119712629311/,,0,0,True
为什么冷冻的馒头超过三天就不能吃了？看完你就明白了,2024-09-29 09:10,2910,1232,身心驿站,身心驿站,,https://toutiao.com/group/7419990007072424484/,,0,0,True
伊朗200枚导弹夜袭以色列，下一步有何最新行动？凤凰记者连线,2024-10-02 01:59,3578,423,凤凰卫视,凤凰卫视,,https://toutiao.com/group/7420992156107538979/,,0,0,True
女子钻进露宿者的被窝，结果看懵一旁的另一名露宿者,2024-09-30 11:42,1026,128,商丘广播电视台,商丘广播电视台,,https://toutiao.com/group/7420400267135058495/,,0,0,True
为什么说从2025年开始，70岁以上的老人，可能面临“两大”问题？,2024-09-01 14:12,2241,280,水大叔,水大叔,据可靠数据了解，我国70岁以上的人口数量已经达到了2.5亿人次，占到全国总人口数量的18%。伴随着人口老龄化的出现，养老问题也成了重中之重，要知道养老不仅仅是家庭的责任，更是社会责任。,https://toutiao.com/group/7409677025897710106/,,0,0,False
写歌30年穷困潦倒，前妻失望选择离婚，谁料51岁靠一首歌一夜成名,2024-08-12 03:37,24013,3818,八号探秘人,八号探秘人,在阅读此文之前，辛苦您点击一下“关注”，既方便您进行讨论和分享，又能给您带来不一样的参与感，感谢您的支持！编辑：LY无数人都想要一个一夜成名的机会，但机会来了也不是每个人都能把握住的。他用了三十年的时间来准备迎接属于自己的机会。为了这个机会他放弃了一切，甚至包括家庭。,https://toutiao.com/group/7402090890367484428/,,0,0,False
中国🇨🇳人民的好总理,2024-09-03 15:46,198019,21127,话说,话说,这个老人一生只做一件事，那就是为了人民鞠躬尽瘁，死而后已,https://toutiao.com/group/7410443709928210955/,,0,0,True
我哥哥，和朋友一起前往新疆种地后，离奇失踪32年，生死未卜,2024-07-07 22:06,7411,4150,真实人物采访,真实人物采访,#头条寻人##寻人路上的故事##失踪##回家#这是我们讲述的第4291位真人故事我是杨琼英，今年56岁，这是我找哥哥的第四个年头。32年前，我哥哥杨文斌在其好友代志福的多次劝说下，和他一同前往新疆种地，从此便和家人失去了联系。,https://toutiao.com/group/7388842950048875049/,,0,0,False
“骗购”中国坦克，用完就退货，想求买中国无人机，中国只卖不租,2024-09-24 22:42,1260,228,开心营业厅,开心营业厅,自古以来诚信都是一个很重要的东西，不管是国家交往还是做生意，没有人愿意和一个不守信的人打交道。然而2009年，秘鲁为了在阅兵仪式上展示军事实力，“骗购”中国坦克撑场面，用完以后却以技术问题为由退货。,https://toutiao.com/group/7418121417771762215/,,0,0,False
张紫妍：被迫陪睡31人近百次，遭道具虐待，29岁自杀留230页遗书,2024-07-24 02:37,12683,889,八号探秘人,八号探秘人,在阅读此文之前，辛苦您点击一下“关注”，既方便您进行讨论和分享，又能给您带来不一样的参与感，感谢您的支持！本文叙述皆有官方信源，为了读者有更好体验，放在了文章后缀！,https://toutiao.com/group/7394994383675736576/,,0,0,False
罕见！100年前，英国游客拍下的清朝乡村，和想象中完全不一样,2024-09-20 02:07,2619,359,万物知识局,万物知识局,泥泞的土路，衣不蔽体的老百姓，即便是达官显贵的家中也十分破败，而这些都是清王朝的历史痕迹，虽说那时候中国摄影技术并不发达，但也有许多外国游客来到这里，拍摄下了许多老照片，为我们留下了珍贵的历史资料，那清朝到底是怎样的面貌呢?,https://toutiao.com/group/7416287738871267855/,,0,0,False
细看国庆招待会，拜请注意两个细节,2024-10-01 12:39,16921,1300,司马南,司马南,"今天国庆
我专门做了一期节目
《百年前的中国梦》。

当民族命运跌入谷底深渊的时候，
国人对未来的向往，
连细节都那么逼真，
读着前辈的文章
泪水不觉溢满了眼眶，
哽咽得说不出话来。
我不得不停止录制，
让自己的心情稍微平复一下。
#伟大的祖国繁荣昌盛# #祖国成立75周年#",https://toutiao.com/group/7420785879449109055/,,0,0,True
无论炒什么肉，不要用盐和料酒腌制，大厨教我绝招，肉片滑嫩不腥,2024-07-11 08:24,81265,3363,家常的味道,家常的味道,无论炒什么肉，不要用盐和料酒腌制，大厨教我绝招，肉片滑嫩不腥,https://toutiao.com/group/7390291377185096204/,,0,0,True
航天功勋吴美蓉院士突然死亡，死因曝光，三年前的遭遇令人心痛,2024-08-03 13:02,2518,291,笑史云烟,笑史云烟,就在全国人民都将注意力放在巴黎奥运会上时候，国内突然传来一纸讣告，宣布了一个女科研工作者致敬的离世。,https://toutiao.com/group/7398895345454416403/,,0,0,False
陈佩斯 冯巩同台说相声！堪称卧龙与凤雏的经典对决，笑点咔咔整,2024-08-29 11:07,11154,1469,欢乐小品匠,欢乐小品匠,陈佩斯 冯巩同台说相声！堪称卧龙与凤雏的经典对决，笑点咔咔整,https://toutiao.com/group/7408516437741928960/,,0,0,True
钮文新解析中央金融组合拳(四)： 这轮股市能涨多少？已有了答案,2024-10-01 07:37,16515,1752,司马南,司马南,,https://toutiao.com/group/7420708250498105896/,,0,0,True
密子君不花钱吃三斤蛙！再加7斤蛙！就为打包满锅花椒辣椒！,2024-07-10 11:00,4245,257,密子君,密子君,吃美蛙火锅就为这口满锅辣椒花椒！打包回去吃两顿！不花钱吃三斤蛙！,https://toutiao.com/group/7389887442734318134/,,0,0,True
2013年，湖南26岁女孩嫁给71岁老头，婚后还生下一子，如今怎样了,2024-07-12 11:59,25793,2390,智史通鉴,智史通鉴,2013年4月17日，长沙宁乡县的民政局迎来了一对特殊的夫妻。一个71岁的老头和一个26岁的女孩，离远了看，甚至像爷爷和孙女。面对工作人员异样的眼光，女孩说：“我和他是真心相爱的！”这让人好奇，这对相差45岁的夫妻，他们之间到底有着怎样的爱情故事？,https://toutiao.com/group/7390696631223534120/,,0,0,False
男子与女子在河中嬉戏玩耍，突然连续将女子的头按入水中,2024-09-26 04:40,1045,155,经视看天下,经视看天下,,https://toutiao.com/group/7418807108637819444/,,0,0,True
这就是中国排面！国庆升旗仪式上，国旗护卫队步步铿锵,2024-09-30 23:03,5895,526,北京日报客户端,北京日报客户端,,https://rss2.bjd.com.cn/content/s66fb2c1be4b01a5d71c96c58.html,,0,0,True
5座车拉6个人被判超员，车主1句话把交警问懵,2024-08-05 20:20,16195,3835,奇妙钢笔pA8JyP,奇妙钢笔pA8JyP,,https://toutiao.com/group/7399752843772559906/,,0,0,True
美国一黑人袭击妇女，美国警员到达现场直接开枪射击上演真人版CS,2024-07-30 02:00,94678,22169,诗意百灵鸟h6BjYa,诗意百灵鸟h6BjYa,,https://toutiao.com/group/7396751472052699663/,,0,0,True
靳东上台领奖，一看到颁奖的是谁，直接单膝下跪！丨国剧盛典,2024-09-02 09:37,15628,1522,机智的喜鹊yO,机智的喜鹊yO,,https://toutiao.com/group/7409977496797610511/,,0,0,True
演员张瑜：离婚后单身30年，再见前夫仍感到心动，66岁没有子女,2024-07-24 10:51,16084,1151,八号探秘人,八号探秘人,在阅读此文之前，辛苦您点击一下“关注”，既方便您进行讨论和分享，又能给您带来不一样的参与感，感谢您的支持！写作不易，作者每天辛苦写稿，只是为了养家糊口，希望各位观众老爷可以多多理解。文中加入5秒广告解锁，观看5秒后便可免费阅读全文啦，感谢各位观众老爷的理解与支持！,https://toutiao.com/group/7395130917804720640/,,0,0,False
上半年中美印新生人口：美国178万，印度1140万，中国让人意外,2024-09-25 23:00,632,298,赫薰辞,赫薰辞,据今年上半年世界人口统计，美国新生人口为178万，印度更是达到了1140万，相比之下，我国的新生人口的数据却令人意想不到。,https://toutiao.com/group/7418390293643084329/,,0,0,False
原来是他娶了谭维维！被誉为“不老男神”，曾在海拔5600米上求婚,2024-08-03 02:21,543,178,吃瓜崽崽,吃瓜崽崽,本文叙述皆有官方信源，为了读者有更好体验，放在了文章后缀!但这俩人让人津津乐道的，还得是当年轰动一时的“高山”求婚名场面。,https://toutiao.com/group/7398729453385466379/,,0,0,False
时隔27年找初恋，他若单身我愿嫁他，相见两人泪流满面,2024-08-02 04:56,27156,4023,彤儿说事,彤儿说事,,https://toutiao.com/group/7398401586776506906/,,0,0,True
网红郭有才，泡沫散去之后，曾经飘的有多高，如今摔得就有多惨,2024-09-30 09:36,670,428,八号探秘人,八号探秘人,曾经那个卖烧烤的店小二，可能怎么都想不到，自己会成为一个千万粉丝的网红。郭有才在刚成为网红之后的期望也很有意思，那就是每天能赚到300元就行。可现实却是靠着直播广告分成，他的收入直接比期望值翻了上千倍。有人说他其貌不扬，但是平凡人逆袭的典范，还有的人说他长的像日本人。,https://toutiao.com/group/7419978325617082932/,,0,0,False
姑娘远嫁山东十年未回家，带着孩子偷偷回娘家，到家眼前一幕哭了,2024-09-09 08:25,26296,11112,小乔远嫁在北方,小乔远嫁在北方,,https://toutiao.com/group/7412556561718968870/,,0,0,True
正处级干部退休每月拿多少退休金？看到金额后把我给惊讶到了！,2024-08-20 16:40,844,313,懂甄选,懂甄选,正处级干部退休每月拿多少退休金？看到金额后把我给惊讶到了！,https://toutiao.com/group/7405262491325825572/,,0,0,True
毛主席霸气的步伐，大将军紧跟随后，再好的演员也走不出这气场,2024-09-29 04:12,13417,802,自由的暖阳NvIg9U,自由的暖阳NvIg9U,,https://toutiao.com/group/7419913061521162788/,,0,0,True
为什么1984年阅兵无法被超越？看到这样的劈枪和脚步就知道了,2024-07-14 05:28,18631,1635,悠闲入口,悠闲入口,,https://toutiao.com/group/7391359236577428007/,,0,0,True
文章：出轨是我的错，今生最对不起三个女人，与马伊琍仍然是家人,2024-07-14 11:00,1548,191,八号探秘人,八号探秘人,本文叙述皆有官方信源，为了读者有更好体验，放在了文章后缀!“这个世界上没人比我更爱马伊琍。”如今再看这句话，只觉得好笑又嘲讽。,https://toutiao.com/group/7391289394180850212/,,0,0,False
一位平凡而又伟大的母亲，带着两个孩子在暴雨中佝偻着卖菜……,2024-08-10 10:20,83862,12317,阿豪与小花,阿豪与小花,她的坚强与淳朴深深的打动了我………,https://toutiao.com/group/7401453750096757259/,,0,0,True
她是央视最惨主持人，男友被判死缓，丈夫诈骗入狱，47岁无人敢娶,2024-08-27 23:30,2172,207,闻书识焉,闻书识焉,她曾是央视的台柱子，和董卿、周涛并称为央视的三朵金花。回顾刘芳菲的前半生，最令人感到惋惜的，便是她的感情生活，47岁至今无人敢娶。,https://toutiao.com/group/7407743113688564258/,,0,0,False
