title,publish_time,like_count,comment_count,media_name,source,abstract,article_url,tag,is_yaowen,article_sub_type,has_video
独家视频丨习近平等党和国家领导人向人民英雄敬献花篮,2024-09-30 02:52,5339,2878,央视新闻,央视新闻,烈士纪念日向人民英雄敬献花篮仪式今天上午在北京天安门广场隆重举行，习近平等党和国家领导人向人民英雄敬献花篮。©2024中央广播电视总台版权所有。未经许可，请勿转载使用。,https://toutiao.com/group/7420261176388354612/,,0,0,False
普京终于等到，9艘船装满武器运往俄罗斯？美西方急了：强烈谴责,2024-09-24 10:48,4809,268,中华网,中华网,布林肯指责伊朗向俄罗斯提供导弹，伊朗否认,https://toutiao.com/group/7417757761917682195/,,0,0,True
黑龙江美女囚犯毕丽梅，被枪决后在殡仪馆苏醒，家属：放了她吧?,2024-08-25 14:32,1792,257,冯律讲法,冯律讲法,女死刑犯被枪决后在殡仪馆起死回生，当场把火化的工作人员吓得够呛，就连随行的警察都吓了一跳，壮着胆上前检查一番后，立马把离奇的情况上报。不一会儿法医赶到现场，证实了女犯人的确还活着，亲属闻声下跪，以死过一回为理由，恳求放了她。,https://toutiao.com/group/7407082388163002921/,,0,0,False
表面是艺人，实际是富家千金的5位女星，无人敢惹更别说潜规则了,2024-08-28 02:06,8033,643,八号探秘人,八号探秘人,在德云班主郭德纲的作品中，有过这么一句话。虽说此言尤为刺耳，但话糙理不糙。当今娱乐圈，很多女星为出人头地，自愿或被迫做出违反道德底线之事。,https://toutiao.com/group/7407984985224872459/,,0,0,False
为国争光却遭郎平弃用！转身效力土耳其的王一梅，如今咋样了？,2024-08-31 13:19,927,135,豆莱说,豆莱说,光阴似箭，日月如梭，当初的少女早已退役，成为了排球场的幕后人，这么多年她都经历了什么，现在又怎么样了呢?,https://toutiao.com/group/7409287778514567718/,,0,0,False
上山采蜜误闯蛇窝，20几条毒性不一，姑娘当场吓尿，头发竖起来了,2024-07-24 02:13,1815,231,兴凯湖莹莹,兴凯湖莹莹,,https://toutiao.com/group/7395019818291692032/,,0,0,True
4年骑行结束，1500天终于回到老家，感谢大家一路陪伴有缘江湖见,2024-09-07 03:50,72564,16891,刘伟元的旅行,刘伟元的旅行,4年骑行结束，1500天终于回到老家，感谢大家一路陪伴有缘江湖见！,https://toutiao.com/group/7411715839100977716/,,0,0,True
山西一女大学生白嫖被拒恼羞成怒：当初有多嚣张，如今就有多慌张,2024-09-28 05:45,1731,879,鲸探所,鲸探所,很难想象，因为一包12.99元的红枣，一位大学生竟然能对客服辱骂一个小时。这样的事情，听起来似乎确实让人感觉有点难以置信，可它就这么水灵灵的发生了，而且还被曝光出来了。,https://toutiao.com/group/7419561787948941876/,,0,0,False
中共中央批准开除党籍的5只老虎，一周之内全部被逮捕！,2024-09-29 08:07,9204,3205,上观新闻,上观新闻,据最高人民检察院9月29日消息，黑龙江省政协原党组成员、副主席李海涛涉嫌受贿一案，由国家监察委员会调查终结，移送检察机关审查起诉。日前，最高人民检察院依法以涉嫌受贿罪对李海涛作出逮捕决定。该案正在进一步办理中。李海涛（资料图）2023年9月16日，李海涛被查。,https://export.shobserver.com/toutiao/html/802172.html,,0,1,False
斩首真主党领导人后，内塔尼亚胡返回以色列，被胡塞导弹“拦路”,2024-09-29 08:35,391,106,田柳Talk,田柳Talk,日前，内塔尼亚胡前往纽约出席联大一般性辩论，并以此作为障眼法下令以军空袭黎巴嫩真主党总部，将包括真主党领导人纳斯鲁拉在内的高层“一锅端”。,https://toutiao.com/group/7419905140754367012/,,0,0,False
中国明明有东风-41，为何用东风31AG展示核反击实力？美国能看懂,2024-09-29 08:12,14237,163,瞩望云霄,瞩望云霄,在中国从海南岛向太平洋发射洲际导弹事件上中，从央媒公开的画面来看，火箭军选择了东风-31AG而非更先进的东风-41。,https://toutiao.com/group/7419974996040090175/,,0,0,True
2013年，湖南26岁女孩嫁给71岁老头，婚后还生下一子，如今怎样了,2024-07-12 11:59,25204,2363,智史通鉴,智史通鉴,2013年4月17日，长沙宁乡县的民政局迎来了一对特殊的夫妻。一个71岁的老头和一个26岁的女孩，离远了看，甚至像爷爷和孙女。面对工作人员异样的眼光，女孩说：“我和他是真心相爱的！”这让人好奇，这对相差45岁的夫妻，他们之间到底有着怎样的爱情故事？,https://toutiao.com/group/7390696631223534120/,,0,0,False
小伙名字太特殊，被公安局警告：你不改，全国公安局的系统都要改,2024-09-02 03:15,766,207,赫薰辞,赫薰辞,2006年8月，江西小伙去公安局换第二代身份证，可结果却被工作人员告知名字太特殊，不能录入户籍系统，并要求改名字。,https://toutiao.com/group/7409872842268918281/,,0,0,False
她是央视最惨主持人，男友被判死缓，丈夫诈骗入狱，47岁无人敢娶,2024-08-27 23:30,2161,207,闻书识焉,闻书识焉,她曾是央视的台柱子，和董卿、周涛并称为央视的三朵金花。回顾刘芳菲的前半生，最令人感到惋惜的，便是她的感情生活，47岁至今无人敢娶。,https://toutiao.com/group/7407743113688564258/,,0,0,False
写歌30年穷困潦倒，前妻失望选择离婚，谁料51岁靠一首歌一夜成名,2024-08-12 03:37,23741,3788,八号探秘人,八号探秘人,在阅读此文之前，辛苦您点击一下“关注”，既方便您进行讨论和分享，又能给您带来不一样的参与感，感谢您的支持！编辑：LY无数人都想要一个一夜成名的机会，但机会来了也不是每个人都能把握住的。他用了三十年的时间来准备迎接属于自己的机会。为了这个机会他放弃了一切，甚至包括家庭。,https://toutiao.com/group/7402090890367484428/,,0,0,False
母亲瘫痪、父亲疯了，当年那个744分的高考状元，7年后却成了这样,2024-09-08 00:54,3264,500,八号探秘人,八号探秘人,母亲截肢瘫痪、父亲疯癫痴傻，可对于自己的亲人，他却做出了这样的评价。而今，7年已过，曾经那个让无数人动容的少年，现在如何?,https://toutiao.com/group/7411852147648496162/,,0,0,False
初中毕业去当流水线女工，五年后却成为世界冠军，22岁成人生赢家,2024-08-02 10:46,6356,1217,豆莱说,豆莱说,文：豆莱说编辑：豆莱说支持作者，写作不易，文中会有5s广告，观看后可免费阅读全文父母曾设想过子女的千百种可能，只是对于一个走上中专之路的孩子，无非也是毕业，打工，进工厂，养家糊口。,https://toutiao.com/group/7398489613888766475/,,0,0,False
中国首例5胞胎现状曝光：父亲过劳去世，如今22年过去，母亲竟然直言后悔……,2024-08-19 08:57,4382,1288,读者,读者,在我看来，这个故事更为让人动容的地方，是爱和责任。缴宝存殚精竭虑、省吃俭用，只为一家人撑起一片天;王翠英将5个孩子全都带在自己身边，教他们识字，教他们做人，教他们团结友爱。,https://toutiao.com/group/7404674971840086540/,,0,0,False
原来他才是毁掉刘翔真凶，因贪1200万被公审，让刘翔背负多年骂名,2024-08-29 09:58,6374,151,八号探秘人,八号探秘人,在田径场上创造的成绩，至今无人能够打破，甚至在国际上享有盛名。本该继续夺冠之路，却两次因伤退赛，遭到了全网辱骂。,https://toutiao.com/group/7408489498465616410/,,0,0,False
善恶终有报！疫情期间一毛不拔，赚中国的钱捐美国6亿，如今怎样,2024-09-03 09:00,2857,446,艾弥儿,艾弥儿,然而，就是这样一个在中国成长起来的富豪，在疫情期间面对自己同胞的困境一毛不拔，对与她毫无关系的美国却十分大方，并且一出手就是6亿美元。,https://toutiao.com/group/7410292416906920499/,,0,0,False
工、农、中、建四大行齐发公告：拟于10月12日发布存量房贷利率调整具体操作细则,2024-09-29 15:32,1530,772,财经网,财经网,9月29日，工商银行、农业银行、中国银行、建设银行集体于官网发布关于调整存量个人住房贷款利率的公告，表示坚决落实中国人民银行公告〔2024〕第11号政策要求，积极响应自律机制倡议，正在有序推进存量房贷利率调整工作，将于2024年10月12日发布具体操作事宜，并于2024年10月3,http://finance.caijing.com.cn/20240929/5040875.shtml,,0,0,False
陈若琳把全红婵养得是真好啊,2024-08-07 03:21,2984,185,中工网,中工网,<p style='text-indent: 2em;'>原标题：陈若琳把全红婵养得是真好啊</p><p style='text-indent: 2em;'>昨晚，巴黎奥运会女子10米跳台跳水决赛，全红婵夺得金牌！赛后采访，她说，我不是你们所说的天才，都是练的，一遍一遍地练。教练陈若琳见证了全红婵的努力与刻苦。@陈若琳sunny@全红婵这对被称为“王炸”组合的师徒，在奥运赛场上都有过非常亮眼的表现。为帮全红婵突破发育关，陈若琳下了不少功夫。每天七八个小时的训练，恨不得将全红婵“拴在裤腰带上”严密看管。执教能力虽受过质疑，但她从不回避，而是找出问题，各个击破。她说：“我走过的弯路，不想让全红婵再走一遍。”中国队加油！（央视）</p>,http://db.workercn.cn/media/2024/08/07/64B10057EEF44DC3904C945F112F757A/preview.mp4,,0,0,True
出卖东风导弹的绝密资料，让中国多年心血付之东流！,2024-09-29 15:32,2261,350,司马南,司马南,今年十月一日我们会迎来建国75周年，如果说75周年国庆有什么是最让人高兴的，那便是十一前放了一个大炮仗——洲际弹道导弹。,https://toutiao.com/group/7420086902302327347/,,0,0,False
男子与女子在河中嬉戏玩耍，突然连续将女子的头按入水中,2024-09-26 04:40,888,149,经视看天下,经视看天下,,https://toutiao.com/group/7418807108637819444/,,0,0,True
魏启颖：女儿赵薇被封杀后，丈夫也去世，儿子离婚被分一半财产,2024-08-12 15:57,767,233,吃瓜崽崽,吃瓜崽崽,女儿被封杀，儿子感情突发变故，曾经风光无限的赵家荡然无存。她喜欢音乐，想当音乐老师，父母也大力支持，从不会横加干涉。,https://toutiao.com/group/7402251567493333519/,,0,0,False
网友：这小孩最起码吃了三个田震、一个许巍和一个刀郎！,2024-09-04 13:00,64800,6004,小石头和孩子们,小石头和孩子们,,https://toutiao.com/group/7410772059594981915/,,0,0,True
姑娘远嫁山东十年未回家，带着孩子偷偷回娘家，到家眼前一幕哭了,2024-09-09 08:25,25602,10883,小乔远嫁在北方,小乔远嫁在北方,,https://toutiao.com/group/7412556561718968870/,,0,0,True
中国🇨🇳人民的好总理,2024-09-03 15:46,192481,20724,话说,话说,这个老人一生只做一件事，那就是为了人民鞠躬尽瘁，死而后已,https://toutiao.com/group/7410443709928210955/,,0,0,True
军号一响，全军出击！,2024-09-19 08:01,15922,1024,中国军号,中国军号,,https://toutiao.com/group/7416261401477382668/,,0,0,True
罕见！100年前，英国游客拍下的清朝乡村，和想象中完全不一样,2024-09-20 02:07,2589,353,万物知识局,万物知识局,泥泞的土路，衣不蔽体的老百姓，即便是达官显贵的家中也十分破败，而这些都是清王朝的历史痕迹，虽说那时候中国摄影技术并不发达，但也有许多外国游客来到这里，拍摄下了许多老照片，为我们留下了珍贵的历史资料，那清朝到底是怎样的面貌呢?,https://toutiao.com/group/7416287738871267855/,,0,0,False
5座车拉6个人被判超员，车主1句话把交警问懵,2024-08-05 20:20,15405,3699,奇妙钢笔pA8JyP,奇妙钢笔pA8JyP,,https://toutiao.com/group/7399752843772559906/,,0,0,True
时隔27年找初恋，他若单身我愿嫁他，相见两人泪流满面,2024-08-02 04:56,26668,3973,彤儿说事,彤儿说事,,https://toutiao.com/group/7398401586776506906/,,0,0,True
上半年中美印新生人口：美国178万，印度1140万，中国让人意外,2024-09-23 12:16,1299,374,开心营业厅,开心营业厅,中美印是全球人口数量最多的三个国家，几乎占到了全球人口总数的近四成，不过，如今三个国家，却在生育率的问题上，遭遇了前所未有的挑战。,https://toutiao.com/group/7417736973647790628/,,0,0,False
“骗购”中国坦克，用完就退货，想求买中国无人机，中国只卖不租,2024-09-24 22:42,1254,227,开心营业厅,开心营业厅,自古以来诚信都是一个很重要的东西，不管是国家交往还是做生意，没有人愿意和一个不守信的人打交道。然而2009年，秘鲁为了在阅兵仪式上展示军事实力，“骗购”中国坦克撑场面，用完以后却以技术问题为由退货。,https://toutiao.com/group/7418121417771762215/,,0,0,False
库尔斯克地区被瓦格纳抓住的乌军女兵下场,2024-09-26 01:42,11845,1099,自由的帆船,自由的帆船,库尔斯克地区被瓦格纳抓住的乌军女兵下场,https://toutiao.com/group/7418761328606577187/,,0,0,True
