title,publish_time,like_count,comment_count,media_name,source,abstract,article_url,tag,is_yaowen,article_sub_type,has_video
14年儿子坐马航失联，多年后父亲收到回信，坚信儿子去了平行世界,2025-02-20 02:38,8173,772,谛听骨语,谛听骨语,MH370失联的第10年，马来西亚政府宣布在2024年12月20日重启寻找马航MH370的项目。如果后续进展顺利的话，马航MH370会在2025年的1月到4月期间重新展开全面地搜寻。凭空消失的客机，有希望被揭露的失踪真相，这一切都是让人充满了期待。,https://toutiao.com/group/7473322554179895817/,,0,0,False
定档3月10号！TCL率先发布第四代液晶电视,2025-03-07 09:29,1913,377,深科技研究所,深科技研究所,华星的屏幕一直以来都是Mini LED的黄金拍档，要知道，早前推出的HVA广角低反屏，相比于使用 ADS 屏的 Mini LED 电视，原生对比度就能够提升近3倍，优势非常明显!,https://toutiao.com/group/7478992983451238952/,,0,0,False
李丽找刘华强报复吴天，不仅给钱还赔了身子，女人啊,2025-02-07 22:51,2594,192,神秘孔雀grK,神秘孔雀grK,,https://toutiao.com/group/7468581314866758144/,,0,0,True
一个独生子接母亲出院的过程被网友拍下，数百万人引发共鸣。,2025-02-23 02:38,34215,8404,响叮当,响叮当,,https://toutiao.com/group/7474438309831016987/,,0,0,True
中俄为何要站在一起，李显龙一语道破，我们还会遇到美国霸权,2025-03-04 16:52,35930,1600,孙绪闻,孙绪闻,中俄为何要站在一起，李显龙一语道破，我们还会遇到美国霸权,https://toutiao.com/group/7477998067472482828/,,0,0,True
从3月以后，国家已明令禁收这5种物业费，业主们别再多交钱了！,2025-03-04 01:48,493,304,见微直播,见微直播,国家早对不同等级物业收费做出明确规定:一级物业每平方米每月 1 元，二级物业 0.75 元，三级物业 0.45 - 0.50 元，四级物业 0.35 元。,https://toutiao.com/group/7477406679882252840/,,0,0,False
乌克兰首都基辅现状，拍摄于2025年3月3日，看看街上还有多少男人,2025-03-03 01:01,17823,7116,王哥说事,王哥说事,,https://toutiao.com/group/7477381859442229801/,,0,0,True
爷爷霸气进门撑腰，喝饮料被向园拿捏，全场得知关系傻眼,2025-01-31 06:58,1375,260,渴望永恒,渴望永恒,爷爷霸气进门撑腰，喝饮料被向园拿捏，全场得知关系傻眼,https://toutiao.com/group/7465710322234425908/,,0,0,True
