title,publish_time,like_count,comment_count,media_name,source,abstract,article_url,tag,is_yaowen,article_sub_type,has_video
#跳水冠军#全红婵#回家又是放鞭炮又是贴对联#希望新的一年会更好,2025-01-28 05:50,900,106,燕子天使,燕子天使,,https://toutiao.com/group/7464839536419291688/,,0,0,True
综合三个方面：若满分是100的话，岳云鹏的蛇年相声可以打120分,2025-01-28 22:16,3875,2104,相声圈外,相声圈外,,https://toutiao.com/group/7465093435838464539/,,0,0,True
越南民众围观中国放烟花过大年 河边密密麻麻全是人！越南人慕了,2025-01-29 05:01,33851,4826,熟悉的陌生人,熟悉的陌生人,,https://toutiao.com/group/7465197989557862953/,,0,0,True
为了看对岸中国的璀璨烟花，俄罗斯人冒着严寒守在中俄边境,2025-01-28 14:24,6725,1217,藍见椿,藍见椿,,https://toutiao.com/group/7464971794345099810/,,0,0,True
美F-35战机在美空军基地坠毁：失控重砸地面爆炸 巨大火球腾起,2025-01-29 02:09,4162,1240,海客新闻,海客新闻,美F-35战机在美空军基地坠毁：机身完全失控重砸地面爆炸 巨大火球腾起,https://toutiao.com/group/7465153720896979456/,,0,0,True
全红婵回老家过年，第一次坐自己的小红车出门，被众人堵住围观。,2025-01-27 10:25,3363,436,我咋的了,我咋的了,,https://toutiao.com/group/7464539209500574234/,,0,0,True
冯巩再次突破自己巅峰，新小品红的一塌糊涂，看完不笑算你狠!,2025-01-16 02:10,8308,1321,扒剧小妹儿,扒剧小妹儿,,https://toutiao.com/group/7460329787261813286/,,0,0,True
宋小宝撞上闫学晶，俩唱二人转的真人精！笑点疯狂往外抖,2025-01-06 03:43,4612,604,PP影视圈剧院,PP影视圈剧院,,https://toutiao.com/group/7456641563670676018/,,0,0,True
山东高速，大年初一的现实状况，百思不得其解,2025-01-29 08:15,3219,348,一人行走的远方,一人行走的远方,,https://toutiao.com/group/7465248166535758387/,,0,0,True
赵本山带上赵四赶紧下场吧，这部小品真是极品，观众都快笑分岔气,2024-12-13 03:50,846,207,my彩虹分享,my彩虹分享,,https://toutiao.com/group/7447738864753443378/,,0,0,True
2025安徽卫视春晚：宋小宝 文松 小品《购购购》哈哈哈,2025-01-27 23:05,2157,553,樱桃树,樱桃树,,https://toutiao.com/group/7464735143731790351/,,0,0,True
宋小宝：GDP全造了，连个P都没留，这段真是让人笑不活了,2024-11-07 06:55,12341,579,经典综艺台,经典综艺台,宋小宝：GDP全造了，连个P都没留，这段真是让人笑不活了,https://toutiao.com/group/7434427404677808694/,,0,0,True
