title,publish_time,like_count,comment_count,media_name,source,abstract,article_url,tag,is_yaowen,article_sub_type,has_video
小子相亲故意扮老，谁知道对方一见面就叫他大爷，这段太逗了,2024-12-24 08:17,3346,766,乐视热播综艺精选,乐视热播综艺精选,,https://toutiao.com/group/7451886130837848610/,,0,0,True
老纪和珅这段对话，以前小时候听不懂，如今听完受益终身,2024-12-28 23:16,5593,1642,乐视扒剧小妹儿,乐视扒剧小妹儿,,https://toutiao.com/group/7453420191947424293/,,0,0,True
综艺：真是神童一个，算术自学成才，6岁就能对战北大高材生,2024-11-16 20:44,19442,2408,乐视综艺咖,乐视综艺咖,,https://toutiao.com/group/7437795240771060258/,,0,0,True
牛肉价格为啥持续下降？,2024-12-29 16:26,6718,258,强老师儿,强老师儿,,https://toutiao.com/group/7453871032575721999/,,0,0,True
清华简彻底解密三星堆！三星堆居然与上古巫族和墨家息息相关,2025-01-03 10:36,4738,413,seeker大师兄,seeker大师兄,,https://toutiao.com/group/7455636143020474906/,,0,0,True
34岁雌雄同体的女性，具备男女两性器官，她该如何生存下去？,2024-10-17 03:32,4247,205,大象微视,大象微视,这个词在我们生活中并不常见，简而言之，双性人就是既拥有男性的生殖器官，也具备女性的特征的人。1989年，王梓淇出生在山西太原的一个家庭，她的家里经营着一家小生意，虽然谈不上富裕，但足够让一家人过得舒心自在。,https://toutiao.com/group/7426578550418948618/,,0,0,False
充电时，先插手机还是充电器？方法错误手机坏得快,2025-01-02 01:19,1645,128,人民日报,人民日报,手机电量还剩多少，对现代社会的许多人而言，都是一个“性命攸关”的问题。人们对手机充电的强烈需求，也让市面上催生出了许多噱头：无线充电，二倍速充电，以及能连着用一周的高能充电宝。乱花渐欲迷人眼，但到底什么才是手机充电的正确姿势呢？手机一定要满充满放吗？,https://www.peopleapp.com/column/30047895447-500006027199?utm_source=头条号&promote=true,,0,1,False
拜登下台前搅动南海风云，美菲连手挑衅中国，中国不再忍强硬回击,2025-01-03 03:44,15894,727,邱毅台湾,邱毅台湾,,https://toutiao.com/group/7455530031461171753/,,0,0,True
炸鱼块，到底用淀粉还是面粉，今天分享一个又香又脆的做法,2025-01-02 09:26,5034,322,家常的味道,家常的味道,,https://toutiao.com/group/7455247105683096076/,,0,0,True
小女孩上部队找爸爸，少校阿姨主动搭讪，谁知看到女孩父亲傻眼了,2024-12-23 16:01,2831,680,乐视群星访谈秀,乐视群星访谈秀,,https://toutiao.com/group/7451525814283960872/,,0,0,True
抗美援朝的将军亮相，全体明星自发起立，这幕太感人,2025-01-03 07:32,7877,331,乐视天天剧好看,乐视天天剧好看,,https://toutiao.com/group/7455587633452843572/,,0,0,True
山楂干泡水很多人都泡错了，难怪没用，今天教你正确做法，真管用,2024-11-02 11:46,7639,285,百变小厨坊,百变小厨坊,,https://toutiao.com/group/7432646945211941402/,,0,0,True
手机价格战开打、购新补贴来袭，国内消费电子市场迎变,2025-01-03 06:54,275,144,南方都市报,南方都市报,1月3日上午，国新办举行“中国经济高质量发展成效”系列新闻发布会。发布会上，相关负责人表示， 2025年将大幅增加超长期特别国债资金规模，加力扩围实施“两新”工作。,https://m.mp.oeeee.com/a/BAAFRD0000202501031041313.html,,0,0,False
原来火腿肠铝环下藏着个“小机关”，轻轻一拉，完整剥开，太棒了,2024-12-30 12:48,3952,2475,百变小厨坊,百变小厨坊,原来火腿肠铝环下藏着个“小机关”，轻轻一拉，完整剥开，太棒了,https://toutiao.com/group/7454186052081680911/,,0,0,True
煮米饭别总是加水了，难怪不好吃，教你酒店不外传的秘诀，非常香,2024-12-06 08:45,4250,891,明玥美食,明玥美食,,https://toutiao.com/group/7445217195929371190/,,0,0,True
印度女主播：歼36和076是“光鲜新玩具”，能否生存都是问题,2025-01-02 09:28,3220,831,第一军情,第一军情,日前，在印度知名度非常高的美女主持人帕尔基-夏尔马在电视节目中，“锐评”了中国先进武器的“井喷”式亮相。夏尔马质疑中国六代机也好，新型两栖攻击舰也好，都是没经过实战考验的“纸老虎”，虽然看起来光鲜亮丽，但真打起来很可能露馅。,https://toutiao.com/group/7455247647847219749/,,0,0,True
我家米醋从来不外面买，教你在家做，无添加剂，好吃又卫生,2024-10-31 11:36,5281,705,百变小厨坊,百变小厨坊,,https://toutiao.com/group/7431902258318541324/,,0,0,True
夜里翻来覆去睡不着，奶奶教我用一根莴笋解决问题，简单却很管用,2024-10-24 12:56,35437,4338,百变小厨坊,百变小厨坊,夜里翻来覆去睡不着，奶奶教我用一根莴笋解决问题，简单却很管用,https://toutiao.com/group/7429325312128713251/,,0,0,True
弹性退休细则公布！65后、70后、75后退休节点有变化，如何选择？,2025-01-02 00:07,1417,288,社保当家,社保当家,人社部等部门在1月1日正式发布了《实施弹性退休制度暂行办法》，明确了如何办理弹性退休手续，对养老金领取有何影响等事项，及时了解下。,https://toutiao.com/group/7454882770310119987/,,0,0,False
98岁老郎中教我苹果养生新吃法，每天坚持这样吃，睡眠好，身体棒,2024-12-31 11:43,9920,971,百变小厨坊,百变小厨坊,98岁老郎中教我苹果养生新吃法，每天坚持这样吃，睡眠好，身体棒,https://toutiao.com/group/7454540163725656628/,,0,0,True
萝卜和鸡蛋这样做，比吃补药还补，顿顿吃都不会腻，又香又下饭,2024-10-30 12:28,72439,4400,小寒厨艺,小寒厨艺,萝卜和鸡蛋这样做，比吃补药还补，顿顿吃都不会腻，又香又下饭,https://toutiao.com/group/7431405463378919975/,,0,0,True
57岁于文华现状，与丈夫住农村简陋房子，裙子拖地喂着狗生活幸福,2024-12-17 01:24,1217,205,焰墨绘史,焰墨绘史,在阅读此文之前，麻烦您点击一下“关注”，既方便您进行讨论和分享，又能给您带来不一样的参与感，感谢您的支持。本文内容均引用权威资料结合个人观点进行撰写，文中已标注文献来源及截图，请知悉。提起于文华，想必当大家都不会陌生，当年的她凭借那首《纤夫的爱》，一夜间家喻户晓。,https://toutiao.com/group/7448948632033722889/,,0,0,False
海南富商张晖：花8亿建108米海上观音像，4年后死在水中死因成谜,2024-10-19 04:49,4977,883,八号探秘人,八号探秘人,在阅读此文之前，辛苦您点击一下“关注”，既方便您进行讨论和分享，又能给您带来不一样的参与感，感谢您的支持！编辑丨xk他是中国的一名富商，耗费8亿元完成了自己的梦想。可梦想落地成为现实的时候，他却在4年后莫名其妙的死去。他就是张晖，上个世纪末海南岛旅游业的龙头当家人。,https://toutiao.com/group/7427288913095492134/,,0,0,False
我国楼市大局已定，未来全国45%的家庭，或将面临“5大挑战”,2024-12-15 11:45,711,108,苍暮颜,苍暮颜,前言:21世纪开始，中国房地产市场一路高歌猛进，繁荣的景象更是吸引了无数投资者和购房者，房价也是一路攀升，也成为了房地产经济增长的重要引擎。,https://toutiao.com/group/7448599203455975947/,,0,0,False
河南警察3岁女儿被拐，苦寻全国23年无果，结果却发现女儿在对门,2024-11-05 07:43,6178,660,八号探秘人,八号探秘人,寻亲23年无果，丢失的女儿竟住在对门?但它却真实发生在河南洛阳的梁绍波身上。是意外走丢，还是人贩子所为，三岁的女儿怎会离奇失踪?,https://toutiao.com/group/7433697108120142345/,,0,0,False
今年会举行阅兵仪式吗？我大胆作个猜测,2025-01-03 09:11,11000,1304,金灿荣教授,金灿荣教授,,https://toutiao.com/group/7455614288229728803/,,0,0,True
被央媒怒批，目不识丁，丢人现眼，这几位“文盲”明星凭什么走红,2024-12-30 10:52,4437,1182,与君説,与君説,在阅读此文之前，麻烦您点击一下“关注”，既方便您进行讨论和分享，又能给您带来不一样的参与感，感谢您的支持文、编辑|小娄郭德纲曾说“可以没文凭，但不能没文化”。老郭的这句话在儿子郭麒麟身上体现得淋漓尽致。虽然郭麒麟初中就辍学了，但人家有思想有内涵，是个名副其实的“文化人”。,https://toutiao.com/group/7454151513221661234/,,0,0,False
经典高清战争老电影,2024-11-18 05:05,11872,345,小微娱乐创作,小微娱乐创作,,https://toutiao.com/group/7438481167495463424/,,0,0,True
广西49岁老汉娶19岁姑娘，结婚21年生下15个孩子，如今有何下场？,2024-10-20 08:32,10328,1264,艺述史,艺述史,她19岁出嫁，21年里总共生育了15个孩子，其中4个男孩子11个女孩子，家里热闹的像是开了一所学校一样。,https://toutiao.com/group/7427400319418384948/,,0,0,False
二少爷装疯卖傻，少奶奶派出丫鬟前去试探他，有好戏看了,2024-11-23 23:28,5368,941,乐享综艺剧场,乐享综艺剧场,,https://toutiao.com/group/7439971404629410342/,,0,0,True
国家发改委明确了！2025换个新手机？,2025-01-03 12:07,1476,496,南方+客户端,南方+客户端,1月3日上午召开的“中国经济高质量发展成效”系列新闻发布会上，国家发展改革委有关负责人表示，要加力扩围实施“两新”政策，并重点提及“实施手机等数码产品购新补贴，对个人消费者购买手机、平板、智能手表手环等3类数码产品给予补贴。,https://static.nfnews.com/content/202501/03/c10402152.html,,0,0,False
告白：19岁大一姑娘爱上自己哥哥，哥哥亮相后，评委都被帅呆了,2024-11-14 05:15,35563,4721,经典影视大联欢,经典影视大联欢,,https://toutiao.com/group/7436999258307297803/,,0,0,True
负电价现象加剧，德国电价跌至零以下,2025-01-02 17:29,2541,10159,华尔街见闻,华尔街见闻,美东时间1月2日，由于风能发电量高达40吉瓦，远超当时的需求，德国隔夜市场再次出现了4小时的负电价，发电商不得不向用户付费以消耗多余电力。,https://dedicated.wallstreetcn.com/toutiao/articles/3738272,,0,0,False
俄乌战争！给我们带来了惊喜，我们迎来了最好的时代,2025-01-02 09:15,7972,283,安逸葡萄,安逸葡萄,,https://toutiao.com/group/7455244239892152832/,,0,0,True
高安国将军被迫害，大陆该出手了！135,2025-01-03 09:58,1130,121,博学解说,博学解说,,https://toutiao.com/group/7455626548118061603/,,0,0,True
我国哪里的面粉无添加？经对比，有这行字就是零添加，可以放心买,2025-01-02 10:44,1854,891,鲸探所,鲸探所,面粉是我们日常生活中离不开的一种主食，在我国人们的餐桌上是有着非常重要的地位的。可以说，基本上家家户户都是需要用到面粉的，已经快到年下了，许多人也开始往家里置备年货了，而面粉，也是最重要的年货之一。,https://toutiao.com/group/7455263523673834024/,,0,0,False
广东中出双色球5.31亿大奖！中奖彩票两张50倍单式和一张6+16复式,2025-01-03 05:27,622,1086,自在的梦想赢家,自在的梦想赢家,#冬季生活打卡季#1月2日晚，双色球第25001期开奖，广东省广州市中出101注双色球一等奖​，共计揽获奖金高达5.31亿元！这也是2025年的首个双色球亿元大奖，中奖消息一出立马就引起了轰动。,https://toutiao.com/group/7455550193065312780/,,0,0,False
赵本山与刘能小品《斗嘴》有多少人没看过，全程笑不停😂😂,2025-01-03 08:23,613,111,瑞运分享,瑞运分享,,https://toutiao.com/group/7455600954629505570/,,0,0,True
