title,publish_time,like_count,comment_count,media_name,source,abstract,article_url,tag,is_yaowen,article_sub_type,has_video
45名“港独”被判刑，美国威胁立即放人，真是笑话！,2024-11-21 06:43,2018,140,第一军情,第一军情,综合路透社、卫报等多家外媒11月20日报道，当地时间周二，中国香港地区高等法院针对47名在此前的“港毒”活动中被捕的“政治活动人士”作出正式判决。,https://toutiao.com/group/7439619443166020131/,,0,0,True
珠海航展现可疑男子，非法扫描解放军装备！3个细节暴露真实身份,2024-11-21 00:00,1100,105,迷彩虎说,迷彩虎说,珠海航展上出了一个非常嚣张的间谍，手持扫描仪在众目睽睽之下就对解放军的武器装备一顿扫描，到底是谁给了他勇气这么做的？,https://toutiao.com/group/7439292406937158163/,,0,0,True
妻子拿出一把吉他，让收废品的丈夫弹，丈夫深藏不露太惊艳,2024-11-19 07:42,35236,4315,今日国土杂志社,今日国土杂志社,,https://toutiao.com/group/7438892712218067508/,,0,0,True
炒白菜千万不要直接下锅，难怪不好吃，教你技巧，鲜嫩入味不出水,2024-10-30 09:23,10245,560,家常的味道,家常的味道,,https://toutiao.com/group/7431496869400576550/,,0,0,True
“最牛星二代”廖凡，出道24年从不拼爹，妻子是周星驰的黄金拍档,2024-11-20 05:35,1120,540,卿羽飞,卿羽飞,最近电视剧《宿敌》正在央视8台热播中，不知道大家有没有观看呢?这部电视剧的主演是廖凡和朱珠，这真的是让人意想不到的搭配，廖凡和朱珠也是非常的有CP感。,https://toutiao.com/group/7439209147201077812/,,0,0,False
1米3袖珍美女嫁给1米48男孩，婚后丈夫奇迹长高，两人却不欢而散,2024-09-07 02:55,5539,270,睿之悦,睿之悦,杨萍和葛存苗的婚礼 文|睿之悦 编辑|睿之悦2019年，成都的民政局来了两个“10岁小孩”来登记，工作人员以为是玩闹。两个“小孩”拿出身份证让工作人员看，这才明白，原来是两个再也长不高的成年袖珍人情侣。,https://toutiao.com/group/7411713833267364386/,,0,0,False
包厢全是刚出狱的恶霸，结果一看到饭店主厨，立马怂了,2024-11-11 01:21,7254,153,乐视群星访谈秀,乐视群星访谈秀,,https://toutiao.com/group/7435825833048015400/,,0,0,True
日本展出最新型激光武器，不比不知道，一比吓一跳,2024-11-19 12:12,20899,1591,陈虎点兵,陈虎点兵,,https://toutiao.com/group/7438962223550857768/,,0,0,True
今天才知道！电动车“每天充”和“用完再充”，到底哪个更伤电池,2024-08-27 11:19,15908,2387,鲸探所,鲸探所,“今天到底给车充不充电？”估计大多数人每天回家都会想这个问题，看着自己的电动车电量又多又少的，充不充电也是一件非常难以抉择的事情。那么，电动车到底应该怎样充电呢？是每天都充，还是用完之后再充呢？电动车充电不管是在城市还是农村，电动车其实都是人们出门最常见的交通工具。,https://toutiao.com/group/7407773012533117475/,,0,0,False
炸萝卜丸子到底用面粉还是淀粉，教你正确做法，外焦里嫩，太香了,2024-10-26 09:25,10441,666,家常的味道,家常的味道,,https://toutiao.com/group/7430012978277122611/,,0,0,True
世卫组织：比新冠更糟的疫情可能会出现，要做好准备,2024-11-21 07:01,2142,2082,潇湘晨报•晨视频,潇湘晨报•晨视频,新西兰电视台近日报道，世界卫生组织新冠疫情应对技术主管玛丽亚·范·科霍夫（Maria Van Kerkhove）透露，对来自动物的新病原体的监测存在“重大差距”，各国应为有生之年可能出现的、比新冠肺炎更严重的疫情做好准备。,http://api.chenshipin.com/wap/a/673eda718420172abe490062/90f456b81afce808c1fcfbd3f5761f65/1732172431/8064c9c0c352b3e13e6839d0f2f7018183e7b9464aa9d19638a9486ed0d6abcc,,0,0,False
67岁执意生娃，如今却坐轮椅无法自理，5岁的天赐被迫独立学洗衣,2024-11-04 10:32,4655,1156,睿之悦,睿之悦,2019年，已经67岁的田新菊执意生下了自己的第三个孩子小天赐。那么，现如今5年的时间过去了，这“天赐”的礼物到底是福还是祸呢?,https://toutiao.com/group/7433367394946384435/,,0,0,False
中国百强县市名单揭晓,2024-11-21 02:20,953,735,大河网,大河网,《中国县域发展监测报告2024》发布，中国百强县市、中国百强区名单揭晓　　11月19日，竞争力智库、北京中新城市规划设计研究院等机构在北京发布《中国县域发展监测报告2024》(以下简称《报告》)，《报告》揭晓了“2024中国综合竞争力百强县市”(简称2024中国百强县市)、“20,https://toutiao.com/group/7439551534523875849/,,0,0,False
“凶手出狱在逝者家附近摆宴席”事件最新进展：双方均表示不愿将矛盾延续到下代,2024-11-21 03:52,625,763,潇湘晨报•晨视频,潇湘晨报•晨视频,“20年前杀害我父亲的主谋出狱，在距离我家10米远的位置，大宴18桌宾客，鞭炮喧天，红毯铺地，亲朋好友夹道欢迎。”近日，四川绵阳涪城区青义镇男子向先生在网络发布相关文字和视频后，引起关注。11月20日下午，向先生告诉红星新闻，20年前，他父亲被对方雇凶在家中杀害。,http://api.chenshipin.com/wap/a/673eac4884201712ae0fa7b0/90f456b81afce808c1fcfbd3f5761f65/1732160932/8a1356850d4aae9aed52607655454f928eab93bc4713c0f0c10845e0cac99582,,0,0,False
惹众怒！苏州马拉松这对男女已找到！两人说……,2024-11-21 06:32,1172,1167,环球网,环球网,来源：新闻晨报 11月18日，江苏苏州吴中举行马拉松比赛，一男一女两名选手将大量免费提供的“能量胶”打包背走，引发网友谴责。此前，主办方曾表示系个人道德问题，不会取消两人成绩。,https://3w.huanqiu.com/a/a7835f/4KLSN7U0Cj0?agt=20,,0,0,False
刚刚！四川突发地震！震源深度18公里,2024-11-21 02:11,724,214,闽南网,闽南网,据中国地震台网正式测定，11月21日9时16分在四川甘孜州石渠县发生3.4级地震，震源深度18公里，震中位于北纬32.96度，东经98.43度。震中地形：震中5公里范围内平均海拔约4394米。,https://toutiao.com/group/7439549206924198409/,,0,0,False
太突然！知名房地产公司董事长去世,2024-11-21 10:40,660,365,大皖新闻,大皖新闻,11月21日，昆明尊园房地产经纪有限公司（以下简称昆明尊园地产）官方账号发出一则讣告：尊园地产创始人、董事长李云波先生，因病去世。,http://www.ahwang.cn/toutiao/202411/2776900.html,,0,1,False
突发讣告！她于昨晚去世！网友：不敢相信...,2024-11-21 07:19,1279,148,全国党媒信息公共平台,全国党媒信息公共平台,11月20日晚，著名演员、87版《红楼梦》“鸳鸯”扮演者郑铮在北京去世，享年61岁。据公开资料，郑铮出生于北京市，毕业于中央戏剧学院，中国内地影视女演员、话剧演员、导演、制作人。,https://api-m.hubpd.com/transfer?nextUrl=https%3A%2F%2Fwww.hubpd.com%2Fhubpd%2Frss%2Ftoutiao%2Findex.html&contentId=3458764513823737553,,0,1,False
特朗普时代，中日合作机遇显现？俄乌对峙升级，明年有重大拐点,2024-11-20 10:52,11730,725,邱震海,邱震海,,https://toutiao.com/group/7439312593905025562/,,0,0,True
她曾被前夫一巴掌扇到离婚！二婚嫁世界冠军，如今生活幸福滋润,2024-09-10 09:12,17170,297,豆莱说,豆莱说,“漂亮的让人挪不开眼”是圈内人对她的评价，和“山杏”不一样的是，李琳在现实生活中的感情很是幸运，遇到了导演王小列。,https://toutiao.com/group/7412930201929204236/,,0,0,False
俩人相亲互相看不上，哪料男方一报母亲身份，姑娘乐了,2024-11-08 01:50,9639,2239,乐视群星访谈秀,乐视群星访谈秀,,https://toutiao.com/group/7434719902990074395/,,0,0,True
11年狂赚200亿，骗了10万中国人后跑路的亿万富翁，下场如何呢？,2024-09-26 09:05,3036,930,八号探秘人,八号探秘人,盘继彪，一个狂妄自大的骗子，11年间骗走200亿，把十几万中国人坑得是血本无归家破人亡。不仅如此，他还在跑路之前，杀人诛心的在他们公司官网发布了一条“我们跑路了“的公告，嘲讽受害者。,https://toutiao.com/group/7418792738887729704/,,0,0,False
炸萝卜丸子，放面粉和淀粉就错了，教你正确做法，焦香酥脆不吸油,2024-09-28 10:13,26776,1246,家常的味道,家常的味道,,https://toutiao.com/group/7419635124758643227/,,0,0,True
好物分享｜炖牛肉时切记三放两不放，这样炖出来的牛肉才会汤鲜味美,2024-10-15 08:50,4540,163,家味美食,家味美食,,https://toutiao.com/group/7425922043991360037/,,0,0,True
给近三年最好的10部年代剧排个名：《人世间》第6，第1名没有争议,2024-10-28 07:10,2344,1279,稻述,稻述,到了20世纪初，偶像剧成为人们的掌中宝，但要说现在什么剧最受欢迎，那一定是年代剧!其中《人世间》只能排第六，第一名人人都爱看，最后一名也比上不足比下有余。,https://toutiao.com/group/7430715494055264783/,,0,0,False
郭有才：当迷失方向忘记初心后，曾经飘得多高，如今摔得就多惨,2024-11-11 06:53,1066,547,八号探秘人,八号探秘人,在阅读此文之前，辛苦您点击一下“关注”，既方便您进行讨论和分享，又能给您带来不一样的参与感，感谢您的支持！编辑丨brt因为一首翻唱，他一夜之间成为了拥有千万粉丝的网红。但是“人红是非多”，不久他就因为版权等问题陷入了舆论风波。他的人气一落千丈，从万众瞩目变成了现在的无人问津。,https://toutiao.com/group/7435901170239078948/,,0,0,False
电动车换一组电池，要多少钱？目前市场价多少，注意不要换贵了,2024-11-06 01:37,1366,144,新能源战略家,新能源战略家,随着行业发展，电动车的使用寿命也大幅增加，如果日常比较爱惜而且没有重度使用的话，一台车用上8-10年也没有问题。,https://toutiao.com/group/7433974055838958120/,,0,0,False
