title,publish_time,like_count,comment_count,media_name,source,abstract,article_url,tag,is_yaowen,article_sub_type,has_video
沙利文的结局已定，他在离开白宫之前，说出了中美发生战争的结果,2024-12-16 02:48,13464,352,全荃,全荃,沙利文的结局已定，他在离开白宫之前，说出了中美发生战争的结果,https://toutiao.com/group/7448833372408775187/,,0,0,True
马光远：东南沿海一带的小城市被严重低估 #财经大咖来了,2024-12-17 06:17,6598,339,光远看经济,光远看经济,,https://toutiao.com/group/7449261133652820518/,,0,0,True
郜春海：马斯克具有超强的解构能力,2024-12-19 08:11,882,189,凤凰网财经,凤凰网财经,,https://toutiao.com/group/7450032592033841675/,,0,0,True
女友怀孕了，男友不装了，带她回豪宅！,2024-11-23 08:01,17850,1304,乐视大综艺咖,乐视大综艺咖,,https://toutiao.com/group/7440353629540483593/,,0,0,True
广西49岁老汉娶19岁姑娘，结婚21年生下15个孩子，如今有何下场？,2024-10-20 08:32,8157,996,艺述史,艺述史,她19岁出嫁，21年里总共生育了15个孩子，其中4个男孩子11个女孩子，家里热闹的像是开了一所学校一样。,https://toutiao.com/group/7427400319418384948/,,0,0,False
中央定调！2025年养老金迎来新调整，退休新规实施，还有个好消息,2024-12-14 00:24,7499,613,思之想之,思之想之,2025年马上就要来了，这是一个充满变化的关键的年份，这是十四五规划的最后一年，很多政策将会兑现。2025年，除了养老金继续用来调整之外，退休新规也将会正式实施，还有一个好消息，具体是什么呢?,https://toutiao.com/group/7448052182332473867/,,0,0,False
女子被多人密谋灌醉强奸后投江自尽，生前在手机备忘录记下被胁迫经过，三男子获罪,2024-12-18 16:40,10131,8606,红星新闻,红星新闻,投河自尽前，黄某某于2023年7月4日在其手机内创建了备忘录，记录下了她被胁迫的经过，这也成为了公检法日后侦查、起诉和判决的重要物证。,https://cdsbrss.cdsb.com/toutiao_no_video.php?url=https%3A%2F%2Fstatic.cdsb.com%2Fmicropub%2FArticles%2F202412%2Fc6419feb940b5f2c2302f01847e73bb8.html,,0,0,False
河南警察3岁女儿被拐，苦寻全国23年无果，结果却发现女儿在对门,2024-11-05 07:43,4799,547,八号探秘人,八号探秘人,寻亲23年无果，丢失的女儿竟住在对门?但它却真实发生在河南洛阳的梁绍波身上。是意外走丢，还是人贩子所为，三岁的女儿怎会离奇失踪?,https://toutiao.com/group/7433697108120142345/,,0,0,False
马光远：大城市才有机会的观点过时了 #财经大咖来了,2024-12-17 06:00,6476,489,光远看经济,光远看经济,,https://toutiao.com/group/7449256659496469027/,,0,0,True
中央定调2025年养老金上涨，计算公式，企退人员能涨7%以上吗？,2024-12-18 04:29,809,108,社保当家,社保当家,中央定调2025年养老金上涨，计算公式，企业退休人员能涨7%以上吗？在2025年到来之际，养老金上涨的消息就早早地确定了，这无疑给广大退休人员吃上了定心丸。因为根据近期召开的中央经济工作会议，已经明确提出要适当提高退休人员的基本养老金待遇。,https://toutiao.com/group/7447756391172833827/,,0,0,False
温州多家私人影院“可触摸服务人员隐私部位”？记者暗访后报警！警方：已对三个场所行政立案,2024-12-17 08:00,12613,3833,大风新闻,大风新闻,挂着“私人影院”的招牌，线上招徕生意，线下如同幽灵，连地址都是虚假的，居然还设“暗室”对付查处。近日，有网民向大皖新闻反映，在浙江省温州市一些颇受年轻人青睐的私人影院，悄然滋生了一些涉黄服务。,https://toutiao.com/group/7449286844203713062/,,0,0,False
热搜第一，舒淇自曝被传染,2024-12-19 07:41,512,214,环球时报,环球时报,12月18日舒淇在社交平台发文称自己被传染病毒登上热搜第一并详细描述了自己的病程及症状“第一天，一天拉八次；第二天胃疼想吐，拉四次；第三天，吃了四种胃药胃散都不管用；第四天，吃了个胃散胃好了，但吃了蛋塔又发作了，沙发上躺了一晚，慢慢地胃不疼了 但头开始有点疼～ 现在头晕头疼，想吐,https://toutiao.com/group/7450024511040127551/,,0,0,False
重磅！国家已释放5个重磅信号，2025年中国将迎惊天动地的大机会,2024-12-17 13:20,4082,479,占豪,占豪,这一年，因战乱而死的人估计数十万，巴以冲突、俄乌战场，人可能瞬间就没了，当地老百姓生活也是真的苦，叙利亚以前还能吃免费大饼，现在连免费大饼也没了，巴勒斯坦早就没大饼吃了······说心里话，和纷乱的世界相比，不得不感叹和平真好!,https://toutiao.com/group/7449369382092718629/,,0,0,False
妈妈让小男孩帮忙买卫生巾，小男孩到超市的解释笑死人了😂😂😂,2024-12-19 11:47,859,406,有趣的水滴,有趣的水滴,,https://toutiao.com/group/7450088396343247411/,,0,0,True
美国遣返中国非法移民？他们跟中国已经没关系了，爱到哪到哪,2024-12-14 01:05,28320,5129,金灿荣教授,金灿荣教授,,https://toutiao.com/group/7447851020526289423/,,0,0,True
尹锡悦要弹劾下台，还得过宪法法庭这关卡，要进监狱关键在三个人,2024-12-17 09:51,10004,136,邱毅台湾,邱毅台湾,,https://toutiao.com/group/7449316198883263026/,,0,0,True
美国对华布局与韩国戒严巧合？尹锡悦被弹劾困兽犹斗，手握王牌,2024-12-15 22:01,31454,1290,黎建南台湾,黎建南台湾,,https://toutiao.com/group/7448762044733456908/,,0,0,True
八十多的外公晚上偷偷吸猫，吸完还抹了一把脸上的毛,2024-11-12 08:16,13799,1933,琦闻国际观点,琦闻国际观点,,https://toutiao.com/group/7436303855760966182/,,0,0,True
郜春海：低空经济的发展空间远超新能源，颠覆未来商业模式,2024-12-19 08:10,727,149,凤凰网财经,凤凰网财经,,https://toutiao.com/group/7450032423821115914/,,0,0,True
海南富商张晖：花8亿建108米海上观音像，4年后死在水中死因成谜,2024-10-19 04:49,3553,603,八号探秘人,八号探秘人,在阅读此文之前，辛苦您点击一下“关注”，既方便您进行讨论和分享，又能给您带来不一样的参与感，感谢您的支持！编辑丨xk他是中国的一名富商，耗费8亿元完成了自己的梦想。可梦想落地成为现实的时候，他却在4年后莫名其妙的死去。他就是张晖，上个世纪末海南岛旅游业的龙头当家人。,https://toutiao.com/group/7427288913095492134/,,0,0,False
3%的存款利率重出江湖，银行年底全力火拼，客户错过再等一年,2024-12-16 06:03,1409,149,议史纪,议史纪,大家都知道，今年各大银行的存款利率已经不断下调三次，有些民营银行和小银行更是多次下调存款利率，最直接的结果就是，年终存款量目标无法达成。,https://toutiao.com/group/7448884806307398156/,,0,0,False
67岁执意生娃，如今却坐轮椅无法自理，5岁的天赐被迫独立学洗衣,2024-11-04 10:32,9414,2115,睿之悦,睿之悦,2019年，已经67岁的田新菊执意生下了自己的第三个孩子小天赐。那么，现如今5年的时间过去了，这“天赐”的礼物到底是福还是祸呢?,https://toutiao.com/group/7433367394946384435/,,0,0,False
曹德旺预言：2025年，没有买房的人，五年后是失败者还是幸运儿？,2024-12-16 05:57,5224,1806,议史纪,议史纪,其实早在多年前年，“玻璃大王”曹德旺就曾预言:“房地产将成为有钱人击鼓传花的游戏”，房子就是钢筋混凝土，是不会保值的?,https://toutiao.com/group/7448883228297003539/,,0,0,False
富二代当兵却逃跑回家，班长去他家抓人，一进家门瞬间惊了,2024-10-26 02:59,13958,1140,乐视天天剧好看,乐视天天剧好看,,https://toutiao.com/group/7429913203359875636/,,0,0,True
《我是刑警》中的穿帮镜头，一个比一个搞笑，看看你都发现了哪些,2024-12-13 09:26,369,107,客观听書,客观听書,声明：本文皆有官方可靠信息来源，已赘述在文章中。文丨梅川秋裤编辑丨梅川秋裤前言最近最火的电视剧《我是刑警》在电视中热播，受到了观众的热烈欢迎。尺度可谓是之大，他更是结合我国内所有重型大案，可谓是看点十足。然而在电视剧中难免有穿帮的镜头，相信大家也都发现了不少。,https://toutiao.com/group/7447789735390528027/,,0,0,False
前妻来到前夫房间，还穿着真丝睡衣，前夫秒懂心思,2024-12-17 08:09,1520,102,南哥硬汉秀,南哥硬汉秀,,https://toutiao.com/group/7449290035327435300/,,0,0,True
弟弟光荣退伍，姐姐兴奋去车站接他，怎料一见弟弟瞬间哭了,2024-11-05 06:34,38741,3223,乐视天天剧好看,乐视天天剧好看,,https://toutiao.com/group/7433679820573934091/,,0,0,True
冬至即将来了，一定要牢记不洗这三澡，来年病不找,2024-12-19 05:42,6950,3590,执着的柳叶z9,执着的柳叶z9,,https://toutiao.com/group/7449994243877110322/,,0,0,True
坐牢21年，周永刚冤案平反获580万元国家赔偿，迄今国内冤错案最高赔偿，拟申请启动追责,2024-12-19 16:24,1144,1074,极目新闻,极目新闻,“周永刚已经拿到总额580万元国家赔偿，这是迄今为止国内冤错案件最高的赔偿。”12月19日，周永刚案辩护律师孙阔向华商报大风新闻记者证实了这一消息。,http://jms.ctdsb.net/jmythshare/#/index_share?cId=0&contentType=5&contentId=2333938,,0,0,False
帅哥看不上相亲女，撒谎没车没房没户口，姑娘的反应绝了,2024-11-18 05:47,4060,398,乐视天天剧好看,乐视天天剧好看,,https://toutiao.com/group/7438491946131128872/,,0,0,True
结婚18年才发现！“感觉天都塌下来了”湖北妻子：我们没发生过关系，他心里没数吗？,2024-12-17 08:16,378,179,潇湘晨报•晨视频,潇湘晨报•晨视频,结婚18年突然发现孩子不是自己亲生的，你会怎么办？2006年2月春节期间，在东莞务工的古先生回到老家湖北通城县，经熟人介绍和黎女士相亲，因为第一印象不错，双方感情发展迅速，不到一个月黎女士突然告诉古先生自己怀孕了，这让古先生非常惊喜。,http://api.chenshipin.com/wap/a/67612f9c84201705907c067d/90f456b81afce808c1fcfbd3f5761f65/1734423285/62566e18854196f106fd1d2bb8cba0bd2fd93650fd82c14d7f3c268eb8eb4dac,,0,0,False
