title,publish_time,like_count,comment_count,media_name,source,abstract,article_url,tag,is_yaowen,article_sub_type,has_video
万万没想到，35岁杨颖兜兜转转干回“老本行”，活成内娱最大笑话,2024-09-06 07:55,532,135,读万卷书的张飞,读万卷书的张飞,文l张飞编辑l张飞曾经你看不起别人；如今谁又瞧得上你？在节目中丝毫不考虑他人状态，一味地只追求自己的镜头。甚至还在采访中公然表示“自己早就应该把所有奖拿了个遍了”。更关键的是丝毫没有任何“报恩”之心。所以如今曾经所有的“嚣张”“高高在上”遭到反噬，只能说现在谁还“愿意”认识她！,https://toutiao.com/group/7411434661014012456/,,0,0,False
两个姑爷来农村 #农家院农家菜农家生活 #农村生活 鸡鱼招待,2024-08-07 09:04,6734,849,农民王小,农民王小,,https://toutiao.com/group/7400320946991301160/,,0,0,True
山西一女大学生白嫖被拒恼羞成怒：当初有多嚣张，如今就有多慌张,2024-09-28 05:45,2054,1042,鲸探所,鲸探所,很难想象，因为一包12.99元的红枣，一位大学生竟然能对客服辱骂一个小时。这样的事情，听起来似乎确实让人感觉有点难以置信，可它就这么水灵灵的发生了，而且还被曝光出来了。,https://toutiao.com/group/7419561787948941876/,,0,0,False
牛市疯了：3天赚了一百万，高兴得太早，回头发现“卖飞了”,2024-10-03 13:00,1706,2158,凤凰网财经,凤凰网财经,编者按:30岁的孙默，在北京有一份稳定的工作，五年前，手里刚有一点积蓄，他就全部投入股市，没想到紧接着迎来了疫情。,https://toutiao.com/group/7421533420930482703/,,0,0,False
网红郭有才，泡沫散去之后，曾经飘的有多高，如今摔得就有多惨,2024-09-30 09:36,692,429,八号探秘人,八号探秘人,曾经那个卖烧烤的店小二，可能怎么都想不到，自己会成为一个千万粉丝的网红。郭有才在刚成为网红之后的期望也很有意思，那就是每天能赚到300元就行。可现实却是靠着直播广告分成，他的收入直接比期望值翻了上千倍。有人说他其貌不扬，但是平凡人逆袭的典范，还有的人说他长的像日本人。,https://toutiao.com/group/7419978325617082932/,,0,0,False
4年骑行结束，1500天终于回到老家，感谢大家一路陪伴有缘江湖见,2024-09-07 03:50,73306,16847,刘伟元的旅行,刘伟元的旅行,4年骑行结束，1500天终于回到老家，感谢大家一路陪伴有缘江湖见！,https://toutiao.com/group/7411715839100977716/,,0,0,True
他于9月30日凌晨因交通意外不幸去世，年仅35岁,2024-10-04 02:45,555,339,大皖新闻,大皖新闻,10月3日，南昌百餐及赣乡野餐饮管理有限公司发布了一则《沉重公告》。讣告显示，百餐创始人兼赣乡野董事长魏昆先生于2024年9月30日凌晨因交通意外不幸去世，享年35岁。据江南君电话联系公告上的朱先生，他表示他是魏昆的合伙人，这件事是真的。,http://www.ahwang.cn/toutiao/202410/2753656.html,,0,1,False
写歌30年穷困潦倒，前妻失望选择离婚，谁料51岁靠一首歌一夜成名,2024-08-12 03:37,24427,3892,八号探秘人,八号探秘人,在阅读此文之前，辛苦您点击一下“关注”，既方便您进行讨论和分享，又能给您带来不一样的参与感，感谢您的支持！编辑：LY无数人都想要一个一夜成名的机会，但机会来了也不是每个人都能把握住的。他用了三十年的时间来准备迎接属于自己的机会。为了这个机会他放弃了一切，甚至包括家庭。,https://toutiao.com/group/7402090890367484428/,,0,0,False
骑行内蒙古一天100公里，来到镇子买上三天的食物，下一站阿尔山,2024-07-07 04:00,34079,4401,刘伟元的旅行,刘伟元的旅行,骑行内蒙古一天100公里，来到镇子买上三天的食物，下一站阿尔山,https://toutiao.com/group/7388581227227251200/,,0,0,True
49岁老汉娶19岁娇妻，结婚21年生下15个孩子，走红网络后如今怎样,2024-08-08 10:36,19199,2397,蛰萤鸣,蛰萤鸣,这真的是现实版的“超生游击队”，你敢相信吗，在广西的一个小山村里，一位已经49岁的中年大叔，居然被一个比自己小19岁的小姑娘穷追猛打。到底这个大叔身上有着怎样的魅力，让一个年纪轻轻的小姑娘，不顾他身上的老人味，也要跟他在一起？,https://toutiao.com/group/7400703483420115468/,,0,0,False
古力娜扎的“坎坷情史”：连续被爆亲密照，男友一个比一个渣,2024-07-23 09:08,2271,556,八号探秘人,八号探秘人,在阅读此文之前，辛苦您点击一下“关注”，既方便您进行讨论和分享，又能给您带来不一样的参与感，感谢您的支持！本文叙述皆有官方信源，为了读者有更好体验，放在了文章后缀！写作不易，文中会有5s广告，观看后点击右上角关闭即可免费阅读全文编辑丨xk入圈十几年，人前清纯，人后疯狂。,https://toutiao.com/group/7394708525111181858/,,0,0,False
为什么大量日本学校建立在中国，原来国家的用意是咱所体会不到的,2024-08-27 22:00,18347,22081,随风起随风落,随风起随风落,为什么大量日本学校建立在中国，原来国家的用意是咱所体会不到的,https://toutiao.com/group/7407695128791351820/,,0,0,True
没房没车贷开销要2-3万，而且住着破旧的出租房，养活一家四口,2024-09-03 02:46,729,209,深圳小英子,深圳小英子,,https://toutiao.com/group/7410242732729303615/,,0,0,True
2013年，湖南26岁女孩嫁给71岁老头，婚后还生下一子，如今怎样了,2024-07-12 11:59,26334,2400,智史通鉴,智史通鉴,2013年4月17日，长沙宁乡县的民政局迎来了一对特殊的夫妻。一个71岁的老头和一个26岁的女孩，离远了看，甚至像爷爷和孙女。面对工作人员异样的眼光，女孩说：“我和他是真心相爱的！”这让人好奇，这对相差45岁的夫妻，他们之间到底有着怎样的爱情故事？,https://toutiao.com/group/7390696631223534120/,,0,0,False
骑行浙江回老家，翻越大山借宿凉亭，50元半只烤鸭两瓶啤酒吃的爽,2024-08-29 04:00,33350,5440,刘伟元的旅行,刘伟元的旅行,骑行浙江回老家，翻越大山借宿凉亭，50元半只烤鸭两瓶啤酒吃的爽,https://toutiao.com/group/7408253260588384768/,,0,0,True
国宴打包第一人！全红婵参加国宴后打包回家，引热议，网友炸锅了,2024-10-04 01:04,346,324,美好时光,美好时光,全红婵在国宴上打包剩菜的行为，真是让不少人“吓了一跳”，毕竟这在公众人物里实在不多见。大家习惯了明星、名人“光鲜亮丽”的一面，一来就是大场面，二去肯定讲究“体面”，谁还会想到，堂堂奥运冠军会在国宴上打包剩饭呢？,https://toutiao.com/group/7421719180548637196/,,0,0,False
为啥有人跑农村收“废手机”。收回来干些什么？看完你就明白了,2024-07-18 13:17,20444,513,阿丽观世界,阿丽观世界,,https://toutiao.com/group/7392964301276840459/,,0,0,True
她是央视最惨主持人，男友被判死缓，丈夫诈骗入狱，47岁无人敢娶,2024-08-27 23:30,2179,207,闻书识焉,闻书识焉,她曾是央视的台柱子，和董卿、周涛并称为央视的三朵金花。回顾刘芳菲的前半生，最令人感到惋惜的，便是她的感情生活，47岁至今无人敢娶。,https://toutiao.com/group/7407743113688564258/,,0,0,False
长相太美被导演收入房中，27年同居无名分，63岁因一件事幡然醒悟,2024-08-08 07:54,2502,108,8卦娱,8卦娱,写作不易，文中会有5s广告，观看后可免费阅读全文，精彩值得期待！文|8卦娱“以色侍人，能好几时？”谁能想到《康熙王朝》“后宫”的“是非”，竟从戏里“争斗”到戏外，女演员之间的较量，简直令人别开生面。那么她们之间到底有何恩怨？为什么说“容妃”戏如人生？,https://toutiao.com/group/7400667604068680233/,,0,0,False
5座车拉6个人被判超员，车主1句话把交警问懵,2024-08-05 20:20,16872,3951,奇妙钢笔pA8JyP,奇妙钢笔pA8JyP,,https://toutiao.com/group/7399752843772559906/,,0,0,True
中国🇨🇳人民的好总理,2024-09-03 15:46,201799,21419,话说,话说,这个老人一生只做一件事，那就是为了人民鞠躬尽瘁，死而后已,https://toutiao.com/group/7410443709928210955/,,0,0,True
无论炒什么肉，不要用盐和料酒腌制，大厨教我绝招，肉片滑嫩不腥,2024-07-11 08:24,82184,3421,家常的味道,家常的味道,无论炒什么肉，不要用盐和料酒腌制，大厨教我绝招，肉片滑嫩不腥,https://toutiao.com/group/7390291377185096204/,,0,0,True
今天才知道！电动车“每天充”和“用完再充”，到底哪个更伤电池,2024-08-27 11:19,7943,1628,鲸探所,鲸探所,“今天到底给车充不充电？”估计大多数人每天回家都会想这个问题，看着自己的电动车电量又多又少的，充不充电也是一件非常难以抉择的事情。那么，电动车到底应该怎样充电呢？是每天都充，还是用完之后再充呢？电动车充电不管是在城市还是农村，电动车其实都是人们出门最常见的交通工具。,https://toutiao.com/group/7407773012533117475/,,0,0,False
民间上坟传统：“上坟不带 5 果，家中不惹灾祸”，哪“5果”？,2024-08-08 10:30,9716,1148,惠农圈,惠农圈,在中国传统文化中，祭祀祖先一直是一项备受重视的活动，它承载着对先人的缅怀、敬意和感恩之情。在上坟的时候，人们会提前准备好供品，比如肉类、酒水，还有水果。其中关于水果的准备，也有着诸多的讲究和禁忌，比如“上坟不带 5 果，家中不惹灾祸”的说法。,https://toutiao.com/group/7400584207141192207/,,0,0,False
为什么冷冻的馒头超过三天就不能吃了？看完你就明白了,2024-09-29 09:10,3983,1580,身心驿站,身心驿站,,https://toutiao.com/group/7419990007072424484/,,0,0,True
张紫妍：被迫陪睡31人近百次，遭道具虐待，29岁自杀留230页遗书,2024-07-24 02:37,12870,897,八号探秘人,八号探秘人,在阅读此文之前，辛苦您点击一下“关注”，既方便您进行讨论和分享，又能给您带来不一样的参与感，感谢您的支持！本文叙述皆有官方信源，为了读者有更好体验，放在了文章后缀！,https://toutiao.com/group/7394994383675736576/,,0,0,False
妈妈睡懒觉不吃饭，宝宝对着爷爷一顿吐槽，俩人的对话太搞笑了,2024-08-05 03:42,8979,872,我是闪电雯,我是闪电雯,,https://toutiao.com/group/7399495661067960843/,,0,0,True
苹果手机自带的Safari浏览器为什么很多人都不使用？,2024-08-12 01:40,175,590,超级塞北人,超级塞北人,最近发现一个很有趣的事情，那就是苹果虽然有众多的iPhone用户，但是使用Safari浏览器的人却寥寥无几。,https://toutiao.com/group/7402043701695906342/,,0,0,False
伊朗袭击以色列，为何双方公布的战果截然相反？,2024-10-02 11:48,9179,2178,凤凰卫视,凤凰卫视,,https://toutiao.com/group/7421143973919457818/,,0,0,True
全球约一半肝癌在中国，再次提醒：家中的4种食物，尽早撤下餐桌,2024-08-13 08:36,95123,3536,梁医学社梁怡璋医生,梁医学社梁怡璋医生,,https://toutiao.com/group/7402540119712629311/,,0,0,True
#人性电影,2024-09-30 03:54,919,140,时光剪影,时光剪影,,http://toutiao.com/item/7420279600897098274/,,0,0,True
对比1980年发射的东风系列导弹 火箭军最新的洲际导弹有何区别？,2024-09-30 10:00,7055,183,凤凰卫视,凤凰卫视,,https://toutiao.com/group/7419970438454837787/,,0,0,True
老人说“坟有6不葬，一葬穷三年”，哪6不葬？葬了穷三年？,2024-08-28 09:01,13480,663,惠农圈,惠农圈,之前实行土葬，关于土葬的说法有很多，比如“坟有六不葬，一葬穷三年”。那时候，人们认为逝者葬在哪里，不能葬在哪里，会给后人带来福或灾。,https://toutiao.com/group/7408111961839256064/,,0,0,False
富婆深夜独自回家 看到两个男人在敲自己家门 下秒做法太机智了,2024-08-09 10:20,11274,939,车界前说,车界前说,,https://toutiao.com/group/7401082708190822963/,,0,0,True
罕见！100年前，英国游客拍下的清朝乡村，和想象中完全不一样,2024-09-20 02:07,2640,352,万物知识局,万物知识局,泥泞的土路，衣不蔽体的老百姓，即便是达官显贵的家中也十分破败，而这些都是清王朝的历史痕迹，虽说那时候中国摄影技术并不发达，但也有许多外国游客来到这里，拍摄下了许多老照片，为我们留下了珍贵的历史资料，那清朝到底是怎样的面貌呢?,https://toutiao.com/group/7416287738871267855/,,0,0,False
伊朗200枚导弹夜袭以色列，下一步有何最新行动？凤凰记者连线,2024-10-02 01:59,6743,602,凤凰卫视,凤凰卫视,,https://toutiao.com/group/7420992156107538979/,,0,0,True
蛋仔派对：电梯规则怪谈？如果你被困诡异电梯 ，请遵守以下规则,2024-07-08 10:04,1496,127,辉哥游戏解说,辉哥游戏解说,,https://toutiao.com/group/7389203820254855695/,,0,0,True
善恶终有报！66岁“消失”了的陈宝国，可谓是娱乐圈的悲哀与损失,2024-09-27 06:29,1922,127,八号探秘人,八号探秘人,“我真的挺不喜欢听艺人这个词，前两年听得我一个劲儿地倒胃口”。当很多人挤破脑袋想要进娱乐圈当一名艺人的时候，他却说了这样一句话。,https://toutiao.com/group/7419206100681114153/,,0,0,False
美籍华人科学家吴瑛，在美国芝加哥家中服毒自杀，自杀原因曝光！,2024-09-04 05:28,1122,983,开心营业厅,开心营业厅,前言8月31日，香港《南华早报》报道：美籍华裔科学家吴瑛，在美国服用过量毒性药物，自杀身亡！她的离世，与美国政府对华人科学家的“迫害”有着直接的联系。美国为何频频针对华人科学家，难道说“科学无国界”真的成了一句笑话吗？,https://toutiao.com/group/7410619875699212826/,,0,0,False
东风41恐惧症在欧美蔓延：外媒坚定认为，先进导弹绝非东风31AG,2024-10-01 14:26,4264,768,南友汇,南友汇,日前以英国《金融时报》，美国《华盛顿时报》为首的欧美国家媒体撰文称，解放军本次试射的洲际导弹绝非是东风31AG，而是解放军现役更先进的东风41洲际导弹。,https://toutiao.com/group/7420812639297520163/,,0,0,False
乌军撤出，俄方获“重大胜利”,2024-10-03 14:34,2336,227,环球时报,环球时报,美国全国广播公司等外媒强调，拿下这个战略要地对俄方来说是一场“重大胜利”。在武赫列达尔地区作战的乌克兰部队2日发文称:“最高指挥部允许从武赫列达尔撤军，以保存人员和军事装备，并为进一步行动做准备。”,https://toutiao.com/group/7421557521095082522/,,0,0,False
66年，李宗仁和新婚妻子的合影，虽相差50岁，算得上郎才女貌,2024-07-27 03:23,6867,1158,万物知识局,万物知识局,李宗仁作为国民党军队中的将军，在抗日战争中可谓是立下了赫赫战功，指挥了许多战役，例如台儿庄战役等重大战斗的胜利，击得日军节节败退，可谓是民族英雄般的存在。,https://toutiao.com/group/7396115912748712499/,,0,0,False
