title,publish_time,like_count,comment_count,media_name,source,abstract,article_url,tag,is_yaowen,article_sub_type,has_video
俩人相亲互相看不上，哪料男方一报母亲身份，姑娘乐了,2024-11-08 01:50,8954,2113,乐视群星访谈秀,乐视群星访谈秀,,https://toutiao.com/group/7434719902990074395/,,0,0,True
破解特朗普加征关税，中国有7招,2024-11-15 14:05,23499,1567,静思有我,静思有我,,https://toutiao.com/group/7437506977830044200/,,0,0,True
特朗普2.0时代即将开启，中方如何应对？掌握“三气”是关键,2024-11-16 04:48,11079,777,邱震海,邱震海,,https://toutiao.com/group/7437734368304431616/,,0,0,True
国乒最新消息：世界冠军退队，王楚钦沦为众矢之的 马龙喜提新身份,2024-11-17 11:11,1016,197,品古观今,品古观今,这两天国乒就没怎么安生过，先是马龙即将作为“交换生”前往台湾，后是国乒三大主力先后退出福冈总决赛，导致日本捡漏成最大赢家。,https://toutiao.com/group/7437830113738899979/,,0,0,False
泽连斯基称，俄乌冲突将尽快结束，美国已完全实现目标,2024-11-17 10:13,2258,192,杜文龙,杜文龙,,https://toutiao.com/group/7438189310425170467/,,0,0,True
医生发现：不容易得癌症的人，一般都有5个“特质”，你占几个？,2024-11-15 11:19,4036,412,39健康网,39健康网,“癌症是人类追求健康路上难以回避的挑战。”近年来，癌症似乎越来越频繁地出现在人们的视线中。无论患者还是健康人，都对“患癌概率”心存疑问：为何偏偏是自己中招？自己的患癌风险究竟有多大？一、人活一辈子，得癌症的几率有多大？,https://toutiao.com/group/7437417286899646976/,,0,0,False
中国飞机卖爆了，自己都不够用了！其他国家有福了，霸权到头了,2024-11-16 23:00,787,140,国际新时讯,国际新时讯,中国飞机卖爆了，航展的第一天就卖出了130架飞机，很多网友表示，咱们自己的飞机都供不应求，那国外肯定是想买都买不到。但是其他国家也有福了，因为中国武器装备的出口，有助于增强其他国的国防能力，维护地区和平与稳定。,https://toutiao.com/group/7436680335134163468/,,0,0,False
15年前他在爱妻葬礼上哭到昏厥，发誓永不再娶，如今他做到了吗？,2024-08-24 02:17,20691,627,八号探秘人,八号探秘人,在阅读此文之前，辛苦您点击一下“关注”，既方便您进行讨论和分享，又能给您带来不一样的参与感，感谢您的支持！编辑丨xk纵观鱼龙混杂的娱乐圈，有人背叛，有人痴情。而果靖霖则是公认的好男儿，将一生都奉献给妻子。但妻子却仅仅陪他走了半生，没能战胜病魔，不幸离开人世。,https://toutiao.com/group/7406210316734710283/,,0,0,False
67岁执意生娃，如今却坐轮椅无法自理，5岁的天赐被迫独立学洗衣,2024-11-04 10:32,3750,943,睿之悦,睿之悦,2019年，已经67岁的田新菊执意生下了自己的第三个孩子小天赐。那么，现如今5年的时间过去了，这“天赐”的礼物到底是福还是祸呢?,https://toutiao.com/group/7433367394946384435/,,0,0,False
给近三年最好的10部年代剧排个名：《人世间》第6，第1名没有争议,2024-09-06 08:08,12330,3841,皮皮电影,皮皮电影,时尚是个轮回，电视剧也是。在2020年之前的那些年，电视剧市场基本上都被偶像剧、都市剧霸占。曾经撑起国剧品质的《闯关东》《岁月》这类年代好剧，难见踪影。,https://toutiao.com/group/7411390030722712090/,,0,0,False
送给所有知道我名字的人 想送一份祝愿给大家，所以唱了这首歌,2024-11-13 04:30,124059,20855,李子柒,李子柒,,https://toutiao.com/group/7436616916803781171/,,0,0,True
内阁人选出炉，对华立场各异，两派博弈，将如何左右特朗普决策？,2024-11-12 09:49,27387,1616,邱震海,邱震海,,https://toutiao.com/group/7436327724950094373/,,0,0,True
上海老两口怒了：3套房还给我们！给儿子一家洗衣做饭，还被这么欺负？,2024-11-17 01:46,1603,496,北青网,北青网,为了安享晚年得到儿子的赡养上海两位年近九旬的老人不仅将3套动迁房产权份额赠与儿子一家还将40余万元养老钱交儿媳保管然而儿子不仅没有尽孝而且还因推倒母亲被判处刑事处罚老两口为此诉至法院要求撤销赠与11月14日，记者从上海市浦东新区人民法院（以下简称上海浦东法院）获悉，此前，该院审理,http://t.ynet.cn/h5/36066785.html,,0,0,False
姑娘花500块租男友，却不知人家是身价过亿总裁，好运来了,2024-11-03 04:00,2616,401,乐视明星的那点事,乐视明星的那点事,,https://toutiao.com/group/7432588748926812682/,,0,0,True
母亲瘫痪、父亲疯了，当年那个744分的高考状元，7年后却成了这样,2024-09-08 00:54,9114,1441,八号探秘人,八号探秘人,母亲截肢瘫痪、父亲疯癫痴傻，可对于自己的亲人，他却做出了这样的评价。而今，7年已过，曾经那个让无数人动容的少年，现在如何?,https://toutiao.com/group/7411852147648496162/,,0,0,False
战忽局立功，美媒感觉不对劲：“白帝”战机是中国拖垮美国的阳谋,2024-11-16 06:29,9642,1593,邵永灵,邵永灵,,https://toutiao.com/group/7437760643861578294/,,0,0,True
著名专家预言：试管婴儿寿命仅40年，那首例试管婴儿如今怎样了？,2024-09-01 06:05,9837,475,睿之悦,睿之悦,文|睿之悦编辑|睿之悦“试管婴儿活不到40岁？”1988年3月10日，我国首例试管婴儿顺利诞生。在当时，试管婴儿的技术正处于起步阶段，因此，有人将其视为医学的奇迹，但也有人则预言试管婴儿活不过40岁。那么，36年的时间过去了，我国首例试管婴儿如今怎么样了呢？,https://toutiao.com/group/7409105262277853733/,,0,0,False
包厢全是刚出狱的恶霸，结果一看到饭店主厨，立马怂了,2024-11-11 01:21,6038,139,乐视群星访谈秀,乐视群星访谈秀,,https://toutiao.com/group/7435825833048015400/,,0,0,True
1米3袖珍美女嫁给1米48男孩，婚后丈夫奇迹长高，两人却不欢而散,2024-09-07 02:55,4869,270,睿之悦,睿之悦,杨萍和葛存苗的婚礼 文|睿之悦 编辑|睿之悦2019年，成都的民政局来了两个“10岁小孩”来登记，工作人员以为是玩闹。两个“小孩”拿出身份证让工作人员看，这才明白，原来是两个再也长不高的成年袖珍人情侣。,https://toutiao.com/group/7411713833267364386/,,0,0,False
马斯克糟了，涉嫌通俄大罪！好戏正在上演，马部长自身难保,2024-11-17 08:37,1536,113,李艺鹏观点,李艺鹏观点,马斯克糟了，涉嫌通俄大罪！好戏正在上演，马部长自身难保,https://toutiao.com/group/7438164700329673255/,,0,0,True
美摊牌了，先动中国最惠国待遇，中方祭出王炸，给特朗普划红线？,2024-11-16 09:40,6547,191,田柳Talk,田柳Talk,特朗普提名被中国列入制裁名单的卢比奥担任国务卿，可以说已经把未来4年继续抗华摆上了台面，不仅如此美众议员还提案取消中国的永久正常贸易关系地位，面对特朗普打出的这一套“组合拳”，中国不再忍让，反手打出了一张“王炸”。,https://toutiao.com/group/7437440913905648167/,,0,0,False
特朗普砸盘，马斯克：废除75%美国联邦机构，46个州宣布货币自立,2024-11-13 12:10,4085,961,BWC中文网,BWC中文网,特朗普砸盘，马斯克：废除75%美国联邦机构，46个州宣布货币自立,https://toutiao.com/group/7436731541847278120/,,0,0,True
拜登下台前，跟中国谈了什么？中美大局已定，中方还能做的两件事,2024-11-17 05:41,28750,2743,邱震海,邱震海,,https://toutiao.com/group/7438119196094890531/,,0,0,True
印度成功试射高超导弹，顶着“圆盘”升空，还要“警告”中国？,2024-11-17 10:25,1033,429,邵永灵,邵永灵,17日印度国防部宣布，印军在奥里萨邦海岸附近成功进行了首次高超音速导弹测试，并收集到高精度打击数据。,https://toutiao.com/group/7438192013125648896/,,0,0,False
独家专访李子柒：归来依旧热爱,2024-11-13 05:53,14338,2331,新华网,新华网,,https://toutiao.com/group/7436638041902416394/,,0,0,True
郭有才：当迷失方向忘记初心后，曾经飘得多高，如今摔得就多惨,2024-11-11 06:53,898,483,八号探秘人,八号探秘人,在阅读此文之前，辛苦您点击一下“关注”，既方便您进行讨论和分享，又能给您带来不一样的参与感，感谢您的支持！编辑丨brt因为一首翻唱，他一夜之间成为了拥有千万粉丝的网红。但是“人红是非多”，不久他就因为版权等问题陷入了舆论风波。他的人气一落千丈，从万众瞩目变成了现在的无人问津。,https://toutiao.com/group/7435901170239078948/,,0,0,False
男子丢失38吨稻谷，警方不作为、态度差还称想投诉就投诉？派出所回应,2024-11-17 01:21,1040,483,环球时报,环球时报,11月16日，有自媒体博主爆料称，江苏连云港灌云县从事粮食收购生意的高先生用货车运输38吨稻谷途中，连车带稻谷被人开走，稻谷被卖掉，报警后，事发地江苏淮安市涟水县成集派出所民警在与货主电话沟通时态度较差，让高先生“想投诉就去投诉”。,https://toutiao.com/group/7438051403358110219/,,0,0,False
非诚勿扰：小伙没房没车！24位姑娘全灭灯，他请求孟非放最后短片,2024-11-02 16:11,4948,266,乐视嘎嘎剧有料,乐视嘎嘎剧有料,,https://toutiao.com/group/7432638073738887714/,,0,0,True
喝点水，尿就多，这是提示肾好？还是肾虚呢？今天一次讲清楚,2024-11-04 03:20,1836,145,中医沈宏,中医沈宏,有的人，稍微喝点水尿就多，尤其是现在天冷的时候这种情况更加明显，那大部分人觉得尿频多尿，往往就是肾虚的表现，对此中医是怎么看的呢?,https://toutiao.com/group/7433251718583829026/,,0,0,False
校园持刀伤人事件，警方刚刚通报：致8死17伤！,2024-11-17 02:15,1798,3184,全国党媒信息公共平台,全国党媒信息公共平台,11月16日晚，江苏无锡市公安局发布警情通报:2024年11月16日18时30分许，宜兴无锡工艺职业技术学院发生一起持刀伤人案件，共造成8人死亡、17人受伤，犯罪嫌疑人被当场抓获。,https://api-m.hubpd.com/transfer?nextUrl=https%3A%2F%2Fwww.hubpd.com%2Fhubpd%2Frss%2Ftoutiao%2Findex.html&contentId=5476377146885787180,,0,1,False
罕见！100年前，英国游客拍下的清朝乡村，和想象中完全不一样,2024-09-20 02:07,6529,653,万物知识局,万物知识局,泥泞的土路，衣不蔽体的老百姓，即便是达官显贵的家中也十分破败，而这些都是清王朝的历史痕迹，虽说那时候中国摄影技术并不发达，但也有许多外国游客来到这里，拍摄下了许多老照片，为我们留下了珍贵的历史资料，那清朝到底是怎样的面貌呢?,https://toutiao.com/group/7416287738871267855/,,0,0,False
失去中年男性用户的丰田汉兰达，降价10万仍止不住销量下滑,2024-11-14 09:26,608,1079,金融界,金融界,曾经深受中年男人喜爱的丰田汉兰达彻底跌落神坛，不仅不用再加价，终端售价还大幅跳水，一些地区直降10万。可即便是优惠幅度如此巨大，仍然无法拯救汉兰达的销量，今年最低时仅月销4000多辆，与巅峰时期月销过万的辉煌相差巨大。,http://m.jrj.com.cn/toutiao/2024/11/14/45294924.shtml,,0,0,False
教育部发通知了：各地要落实乡村教师生活补助、艰苦边远地区津贴等政策,2024-11-16 07:39,559,186,农视网,农视网,近日，教育部印发《关于做好“优师计划”师范生就业工作的通知》，部署做好“优师计划”师范生就业工作，确保毕业生按照协议约定，到祖国和人民最需要的地方履约任教。具体内容一起了解——加强就业教育（一）强调履约要求。“优师计划”师范生毕业后须按协议约定，到定向县中小学履约任教。,http://mp.weixin.qq.com/s?__biz=MzA5OTAwMDMzNg==&mid=2701360188&idx=1&sn=efd6749f07ab472c50d8145b7da763fa,,0,0,False
