title,publish_time,like_count,comment_count,media_name,source,abstract,article_url,tag,is_yaowen,article_sub_type,has_video
党的自我革命永远在路上——写在二十届中央纪委四次全会召开之际,2025-01-05 22:53,3133,2476,人民日报,人民日报,2024年12月26日至27日，中共中央政治局召开民主生活会，习近平总书记主持会议并发表重要讲话，体现了以上率下深入推进党的自我革命的明确要求，树立了激励干部担当作为的鲜明导向。,https://www.peopleapp.com/column/30047929144-500006034152?utm_source=头条号&promote=true,,0,0,False
人民日报刊文：从新年贺词感受习近平主席的天下情怀,2025-01-05 23:08,1002,461,人民日报,人民日报,——从新年贺词感受习近平主席的天下情怀。在二〇二五年新年贺词中，习近平主席重申中国愿同各国一道做文明互鉴的推动者。,https://www.peopleapp.com/column/30047929158-500006034317?utm_source=头条号&promote=true,,0,0,False
石破茂亲中吗？,2025-01-03 13:55,10905,562,静思有我,静思有我,,https://toutiao.com/group/7455642885552079395/,,0,0,True
老纪和珅这段对话，以前小时候听不懂，如今听完受益终身,2024-12-28 23:16,6090,1771,乐视扒剧小妹儿,乐视扒剧小妹儿,,https://toutiao.com/group/7453420191947424293/,,0,0,True
乞丐上台唱歌引起评委质疑，一首歌唱完让观众起立鼓掌,2024-11-01 02:16,4973,800,乐视综艺咖,乐视综艺咖,,https://toutiao.com/group/7432129044134494771/,,0,0,True
夜里翻来覆去睡不着，原来几根芹菜根就搞定，做法简单，省钱实用,2024-12-25 11:02,10631,1258,百变小厨坊,百变小厨坊,夜里翻来覆去睡不着，原来几根芹菜根就搞定，做法简单，省钱实用,https://toutiao.com/group/7452303315842368052/,,0,0,True
小子相亲故意扮老，谁知道对方一见面就叫他大爷，这段太逗了,2024-12-24 08:17,3829,873,乐视热播综艺精选,乐视热播综艺精选,,https://toutiao.com/group/7451886130837848610/,,0,0,True
98岁老郎中教我苹果养生新吃法，每天坚持这样吃，睡眠好，身体棒,2024-12-31 11:43,11764,1153,百变小厨坊,百变小厨坊,98岁老郎中教我苹果养生新吃法，每天坚持这样吃，睡眠好，身体棒,https://toutiao.com/group/7454540163725656628/,,0,0,True
到底是外公亲，还是爷爷亲？心理学家的答案很统一,2024-12-30 06:35,1173,574,第一心理,第一心理,一位读者来信，提到最近自己遇到的一些家庭相关的琐事，并提出了自己的一些疑问。具体情况如下：这位读者是一个孩子的母亲，与丈夫结婚之后，一直在丈夫家所在城市生活，也受了公公婆婆不少接济，由于自己父母在另外的城市，有点距离但是不远，孩子出生之后也一直与爷爷奶奶接触更多。,https://toutiao.com/group/7454088472568857126/,,0,0,False
34岁雌雄同体的女性，具备男女两性器官，她该如何生存下去？,2024-10-17 03:32,4783,231,大象微视,大象微视,这个词在我们生活中并不常见，简而言之，双性人就是既拥有男性的生殖器官，也具备女性的特征的人。1989年，王梓淇出生在山西太原的一个家庭，她的家里经营着一家小生意，虽然谈不上富裕，但足够让一家人过得舒心自在。,https://toutiao.com/group/7426578550418948618/,,0,0,False
罕见！一个月内官方三次明确上调养老金，2025养老金调整有惊喜？,2025-01-04 02:56,5937,3254,思之想之,思之想之,在一个月内，官方至少三次明确上调2025年养老金，这个频率是前所未有的，这传递了什么信号呢?思之想之发现，从2024年12月12日开始至今，在一个月内的时间里，官方至少三次明确提出上调2025年养老金。,https://toutiao.com/group/7455850117002691135/,,0,0,False
高安国被押前留下英雄壮语，赖清德恶贯满盈，何时方能恶有恶报？,2025-01-05 04:00,20390,2268,邱毅台湾,邱毅台湾,,https://toutiao.com/group/7455975347708920383/,,0,0,True
夜里翻来覆去睡不着，奶奶教我用一根莴笋解决问题，简单却很管用,2024-10-24 12:56,35729,4371,百变小厨坊,百变小厨坊,夜里翻来覆去睡不着，奶奶教我用一根莴笋解决问题，简单却很管用,https://toutiao.com/group/7429325312128713251/,,0,0,True
弹性退休细则公布！65后、70后、75后退休节点有变化，如何选择？,2025-01-02 00:07,1683,359,社保当家,社保当家,人社部等部门在1月1日正式发布了《实施弹性退休制度暂行办法》，明确了如何办理弹性退休手续，对养老金领取有何影响等事项，及时了解下。,https://toutiao.com/group/7454882770310119987/,,0,0,False
拜登下台前搅动南海风云，美菲连手挑衅中国，中国不再忍强硬回击,2025-01-03 03:44,21991,944,邱毅台湾,邱毅台湾,,https://toutiao.com/group/7455530031461171753/,,0,0,True
腐竹用清水和开水泡是大错，酒店大厨教我1招，快速柔软还不夹生,2024-11-06 11:49,6486,150,百变小厨坊,百变小厨坊,腐竹用清水和开水泡是大错，酒店大厨教我1招，快速柔软还不夹生,https://toutiao.com/group/7434132052506575394/,,0,0,True
炸鱼块，到底用淀粉还是面粉，今天分享一个又香又脆的做法,2025-01-02 09:26,7265,460,家常的味道,家常的味道,,https://toutiao.com/group/7455247105683096076/,,0,0,True
退伍军人来应聘保安，一见女老板愣住了，竟是当年战友,2024-12-28 01:49,4283,129,乐视扒剧小妹儿,乐视扒剧小妹儿,,https://toutiao.com/group/7453273869261767203/,,0,0,True
我国哪里的面粉无添加？经对比，有这行字就是零添加，可以放心买,2025-01-02 10:44,2837,1175,鲸探所,鲸探所,面粉是我们日常生活中离不开的一种主食，在我国人们的餐桌上是有着非常重要的地位的。可以说，基本上家家户户都是需要用到面粉的，已经快到年下了，许多人也开始往家里置备年货了，而面粉，也是最重要的年货之一。,https://toutiao.com/group/7455263523673834024/,,0,0,False
欧洲会爆发世界大战吗？俄乌2025年能否止战？|凤凰《非常2024》,2024-12-30 07:54,3282,215,凤凰卫视,凤凰卫视,,https://toutiao.com/group/7454110252754010664/,,0,0,True
清汤面好吃有诀窍，教你面馆30年不外传的秘诀，劲道爽滑汤鲜味美,2024-12-13 13:30,8101,1087,百变小厨坊,百变小厨坊,,https://toutiao.com/group/7447888258186347018/,,0,0,True
原来火腿肠铝环下藏着个“小机关”，轻轻一拉，完整剥开，太棒了,2025-01-05 05:13,606,175,自由的喜鹊mte,自由的喜鹊mte,,https://toutiao.com/group/7456295222365684224/,,0,0,True
小女孩上部队找爸爸，少校阿姨主动搭讪，谁知看到女孩父亲傻眼了,2024-12-23 16:01,3560,833,乐视群星访谈秀,乐视群星访谈秀,,https://toutiao.com/group/7451525814283960872/,,0,0,True
萝卜和鸡蛋这样做，比吃补药还补，顿顿吃都不会腻，又香又下饭,2024-10-30 12:28,73146,4441,小寒厨艺,小寒厨艺,萝卜和鸡蛋这样做，比吃补药还补，顿顿吃都不会腻，又香又下饭,https://toutiao.com/group/7431405463378919975/,,0,0,True
抗美援朝的将军亮相，全体明星自发起立，这幕太感人,2025-01-03 07:32,11292,1315,乐视天天剧好看,乐视天天剧好看,,https://toutiao.com/group/7455587633452843572/,,0,0,True
神十八乘组本月计划与公众见面,2025-01-05 07:39,658,265,人民日报,人民日报,1998年的今天中国人民解放军航天员大队正式成立为国出征叩苍穹从1998到2025从神舟五号到神舟十九号已有24名中国航天员飞上太空一次次凯旋 成就一个个飞天英雄一次次迈步 背后是航天员们的努力拼搏中国航天一次次书写新的传奇他们，是真正的“中国天团”今天，“神舟家族”成团27周年,https://www.peopleapp.com/column/30047926228-500006033663?utm_source=头条号&promote=true,,0,1,False
印度女主播：歼36和076是“光鲜新玩具”，能否生存都是问题,2025-01-02 09:28,4171,1059,第一军情,第一军情,日前，在印度知名度非常高的美女主持人帕尔基-夏尔马在电视节目中，“锐评”了中国先进武器的“井喷”式亮相。夏尔马质疑中国六代机也好，新型两栖攻击舰也好，都是没经过实战考验的“纸老虎”，虽然看起来光鲜亮丽，但真打起来很可能露馅。,https://toutiao.com/group/7455247647847219749/,,0,0,True
大陆就统一时间表表态，20万台胞已办身份证？台当局称严查,2025-01-03 11:03,3483,396,第一军情,第一军情,台湾问题是中国核心利益中的核心，已困扰了我们整整75年，成为每一个中国人心中的痛。日前，大陆著名学者在一篇文章表示，未来四年时间，大陆不会制定统一台湾的时间表。,https://toutiao.com/group/7455640102287557156/,,0,0,False
安理会改革即将开始谈判，俄方点名两国不能入常，中国已作出选择,2025-01-04 08:49,6746,1292,贺文萍,贺文萍,这一方面是因为现在的安理会在解决实际问题上存在缺陷，致使联合国在俄乌冲突、巴以冲突中没发挥多大作用;,https://toutiao.com/group/7455973155593552435/,,0,0,False
贪官酒桌上的权钱交易，语言天衣无缝，听懂三分都是人精！,2024-11-23 16:24,4178,498,乐视扒剧小妹儿,乐视扒剧小妹儿,,https://toutiao.com/group/7440378916130259496/,,0,0,True
保镖小金库暴露！竟攒了150万，荣登村落首富，准备迎娶二媳妇啦,2024-11-04 00:08,17578,1655,非洲小五,非洲小五,,https://toutiao.com/group/7433209191692501514/,,0,0,True
女市长爱上小男友，俩人爱的轰轰烈烈，让女市长感到害怕,2024-12-18 08:13,2814,491,乐视经典热综回放,乐视经典热综回放,,https://toutiao.com/group/7449661362671714850/,,0,0,True
今年会举行阅兵仪式吗？我大胆作个猜测,2025-01-03 09:11,14348,1645,金灿荣教授,金灿荣教授,,https://toutiao.com/group/7455614288229728803/,,0,0,True
长期使用等于自杀？海飞丝等20种洗发水被伪科学测评抹黑 洗发水荧光反应不等于有荧光剂,2025-01-03 00:12,2121,612,看看新闻,看看新闻,长期使用等于自杀？海飞丝等20种洗发水被伪科学测评抹黑 洗发水荧光反应不等于有荧光剂,http://mediaplay.kksmg.com/2025/01/03/h264_720p_600k_79529-smgnews-20250103065500-9000-977372-600k_mp4.mp4,,0,0,True
5旬老太为占儿子遗产，逼疯儿媳赶走5岁孙女，28年后让孙女养老,2024-10-21 03:10,2805,926,大象微视,大象微视,文｜大象微视编辑｜大象微视“我唯一的心愿就是能够和孙女见上一面......！”那年，年过五旬的老太太，在儿子去世后为了独占儿子的遗产和房产，做出了一个震惊众人的选择：将年仅5岁的孙女赶出了家门，将她的儿媳逼到了绝境。,https://toutiao.com/group/7428056692493009460/,,0,0,False
充电时，先插手机还是充电器？方法错误手机坏得快,2025-01-02 01:19,1905,154,人民日报,人民日报,手机电量还剩多少，对现代社会的许多人而言，都是一个“性命攸关”的问题。人们对手机充电的强烈需求，也让市面上催生出了许多噱头：无线充电，二倍速充电，以及能连着用一周的高能充电宝。乱花渐欲迷人眼，但到底什么才是手机充电的正确姿势呢？手机一定要满充满放吗？,https://www.peopleapp.com/column/30047895447-500006027199?utm_source=头条号&promote=true,,0,1,False
被姚明抱着上奥运的小英雄，曾发誓考上清华，16年后活成了这样,2024-11-07 08:07,4430,825,睿之悦,睿之悦,2008年，年仅9岁的林浩，在姚明的带领下走进了北京奥运会开幕式的舞台上，成为了万众瞩目的“焦点”。,https://toutiao.com/group/7434444094551687707/,,0,0,False
香港女子花400万买15平房子，晚上睡衣柜顶，客厅宽敞还有大阳台,2024-12-26 04:06,874,496,鲸探所,鲸探所,都说香港寸土寸金，但是对于我们来说，其实这句话只是一个概念而已，只知道贵，但不知道到底能贵到哪种程度。但是看完一位女子花了400万在香港买的房子之后，“寸土寸金”这个词，真的让人“具象化”了。,https://toutiao.com/group/7452564162242265640/,,0,0,False
五年老员工工资降到两千，辞职走人，下秒老板后悔晚了,2024-12-25 08:36,7461,2171,南瓜热剧回放,南瓜热剧回放,,https://toutiao.com/group/7452234729299902976/,,0,0,True
海南富商张晖：花8亿建108米海上观音像，4年后死在水中死因成谜,2024-10-19 04:49,5147,900,八号探秘人,八号探秘人,在阅读此文之前，辛苦您点击一下“关注”，既方便您进行讨论和分享，又能给您带来不一样的参与感，感谢您的支持！编辑丨xk他是中国的一名富商，耗费8亿元完成了自己的梦想。可梦想落地成为现实的时候，他却在4年后莫名其妙的死去。他就是张晖，上个世纪末海南岛旅游业的龙头当家人。,https://toutiao.com/group/7427288913095492134/,,0,0,False
清华才女李一诺：27岁博士毕业，4年生3娃，能替世界首富花钱,2024-12-18 05:51,8644,390,云莳一,云莳一,家庭是她第一个学校，妈妈是她第一任老师。李一诺27岁博士毕业进入美国麦肯锡公司，33岁成为公司全球董事合伙人，之后四年连生3娃。,https://toutiao.com/group/7449591069311779355/,,0,0,False
中日，一出好戏即将上演,2025-01-01 23:38,6527,6282,牛弹琴,牛弹琴,年终上演精彩大戏，新年不排除更有一出好戏。反正，从积极的角度看，中日关系，正处于近20年来最好时期。之所以能说最好，是因为之前实在是太糟。三个值得关注的动向。第一个动向，日本首相石破茂的表态。日前在接受电视访谈时，石破茂说：“日本首相访问中国是极为重要的事。,https://toutiao.com/group/7455091815717388850/,,0,0,False
两口子吵架竟是因为董卿，孙涛闫学晶演小品，笑翻全场,2024-11-04 08:02,1449,180,乐视综艺咖,乐视综艺咖,,https://toutiao.com/group/7433331547190592040/,,0,0,True
河南警察3岁女儿被拐，苦寻全国23年无果，结果却发现女儿在对门,2024-11-05 07:43,6299,677,八号探秘人,八号探秘人,寻亲23年无果，丢失的女儿竟住在对门?但它却真实发生在河南洛阳的梁绍波身上。是意外走丢，还是人贩子所为，三岁的女儿怎会离奇失踪?,https://toutiao.com/group/7433697108120142345/,,0,0,False
不得不说，韩国再次创造了历史,2025-01-04 02:18,5965,647,牛弹琴,牛弹琴,未来三天，韩国不排除更有大戏上演,https://toutiao.com/group/7455879046824460854/,,0,0,True
郭有才：当迷失方向忘记初心后，曾经飘得多高，如今摔得就多惨,2024-11-11 06:53,2240,936,八号探秘人,八号探秘人,在阅读此文之前，辛苦您点击一下“关注”，既方便您进行讨论和分享，又能给您带来不一样的参与感，感谢您的支持！编辑丨brt因为一首翻唱，他一夜之间成为了拥有千万粉丝的网红。但是“人红是非多”，不久他就因为版权等问题陷入了舆论风波。他的人气一落千丈，从万众瞩目变成了现在的无人问津。,https://toutiao.com/group/7435901170239078948/,,0,0,False
近5年最热的十部剧，《狂飙》第9，《繁华》第6，第1名很难超越,2024-12-01 03:58,2180,759,电影烂番茄,电影烂番茄,今天，番叔就结合口碑，给大家盘点一下近五年，热度最高的十部电视剧。第十名:《都挺好》 猫眼热度 9775.8，播出时间2019年。,https://toutiao.com/group/7430845717314273831/,,0,0,False
扛不住了！知名品牌突然被曝：多家门店关闭！已人去楼空......,2025-01-05 07:11,304,449,全国党媒信息公共平台,全国党媒信息公共平台,据《大河报》报道，近期保时捷被曝位于郑州、唐山等地线下门店已经关店。据21世纪经济报道记者梳理，连年不理想的销量让保时捷在渠道端面临危机。,https://api-m.hubpd.com/transfer?nextUrl=https%3A%2F%2Fwww.hubpd.com%2Fhubpd%2Frss%2Ftoutiao%2Findex.html&contentId=5764607523037628890,,0,1,False
六代机的先进，好像都没说到位（下）,2024-12-31 13:58,23603,733,静思有我,静思有我,,https://toutiao.com/group/7454575132569240099/,,0,0,True
山楂干泡水很多人都泡错了，难怪没用，今天教你正确做法，真管用,2024-11-02 11:46,7907,298,百变小厨坊,百变小厨坊,,https://toutiao.com/group/7432646945211941402/,,0,0,True
著名前央视主持人方静，一生未婚44岁客死异乡，成为父母余生之痛,2024-11-22 02:11,3996,994,八号探秘人,八号探秘人,23岁即踏入央视大门，事业一路高歌猛进。是诸多主持人中极少数拥有博士学位的“台柱”，也是一级播音员的主持人。,https://toutiao.com/group/7439610920277459492/,,0,0,False
8年前，那个3岁识千字、6岁夺央视冠军山东神童王恒屹，如今怎样,2024-12-25 05:57,3242,308,中原新闻网,中原新闻网,在人才辈出的华夏大地上，时不时便会有一颗闪耀着独特光芒的新星闯入大众视野，王恒屹便是其中之一。这个来自山东青岛的孩子，曾以令人惊叹的天赋和才华，在诗词的浩瀚星空中留下了属于自己的璀璨轨迹，一度被人们冠以 “神童” 之名。,https://toutiao.com/group/7452224083275547188/,,0,0,False
从美国的经验来看，中国未来房价的结局,2024-12-18 11:18,8761,2069,资本论,资本论,你如果在两年前问我，房价会不会继续跌，我大概率会告诉你还会继续跌。现在聊到中国房价未来走势的时候，很多人都会提到两个案例，一个是日本案例，另一个则是美国案例。,https://toutiao.com/group/7449709577114894886/,,0,0,False
江西一女研究生嫁给帅气军官，结婚一年后，才得知丈夫的真实身份,2025-01-05 03:46,3469,637,奇闻奇谈,奇闻奇谈,,https://toutiao.com/group/7456272666794656271/,,0,0,True
三条腿的陈赓介绍对象这段，据说笑趴整个导演组，太搞笑了,2025-01-02 06:45,2688,557,南哥硬汉秀,南哥硬汉秀,,https://toutiao.com/group/7455192536127275539/,,0,0,True
我家米醋从来不外面买，教你在家做，无添加剂，好吃又卫生,2024-10-31 11:36,6571,863,百变小厨坊,百变小厨坊,,https://toutiao.com/group/7431902258318541324/,,0,0,True
