title,publish_time,like_count,comment_count,media_name,source,abstract,article_url,tag,is_yaowen,article_sub_type,has_video
公公竟然和儿媳偷情，哪料被妻子撞见，这下有戏看了！,2025-01-21 08:05,5729,554,南瓜午夜厅,南瓜午夜厅,,https://toutiao.com/group/7462273852651979274/,,0,0,True
为了这半个身位，我们拼搏了百年！#大国崛起,2025-01-21 03:13,91805,8046,有趣的奶酪Wz,有趣的奶酪Wz,,https://toutiao.com/group/7461918766536868392/,,0,0,True
宋小宝撞上闫学晶，俩唱二人转的真人精！笑点疯狂往外抖,2025-01-06 03:43,3193,488,PP影视圈剧院,PP影视圈剧院,,https://toutiao.com/group/7456641563670676018/,,0,0,True
婚礼上惊现债主讨债，欠款长达十年！新郎新娘这下可“火”了,2025-01-21 23:18,32842,14724,汤汤不怕烫,汤汤不怕烫,,https://toutiao.com/group/7462511986824249908/,,0,0,True
刘雯致大家的公开告白：我已经意识到了，胳膊可能拧不过大腿,2025-01-21 05:32,10939,2663,相声圈外,相声圈外,,https://toutiao.com/group/7462237325704905267/,,0,0,True
王毅：美方已经撕去了一切伪装，连巧取都没有，只剩下豪夺！,2025-01-22 23:13,53553,4644,台名嘴大本营,台名嘴大本营,,https://toutiao.com/group/7462881623952982563/,,0,0,True
来不及：小姨子找姐夫要说法，没想姐夫衣冠禽兽，小姨子都不放过,2025-01-22 18:37,1710,127,乐视激斗影院,乐视激斗影院,,https://toutiao.com/group/7462625291735695923/,,0,0,True
中国式关系：女秘书这腿有点粗,2025-01-22 03:03,1304,259,吃瓜追剧,吃瓜追剧,,https://toutiao.com/group/7462569997370507786/,,0,0,True
地铁一女子拿背包占座，乘务员沟通半天无果，邻座大妈突然出手！,2025-01-22 02:03,4020,2084,客家林胖哥,客家林胖哥,南京地铁上一女子把背包放到座位上，另外一个站点有乘客上车想座这个位置，结果背包的主人说“这是我放包的，你人不能站着吗”？女乘客就叫来了乘务员，可是乘务员沟通半天女子就是不愿意把背包放地上。最后，邻座的大妈实在看不下去，一把把女子的背包给抓起来丢地上，她一屁股坐过去，然后把她的位置让给这个乘客，大妈那个动作真的太帅了！！,https://toutiao.com/group/7462554677310210623/,,0,0,True
