title,publish_time,like_count,comment_count,media_name,source,abstract,article_url,tag,is_yaowen,article_sub_type,has_video
包厢全是刚出狱的恶霸，结果一看到饭店主厨，立马怂了,2024-11-11 01:21,10567,259,乐视群星访谈秀,乐视群星访谈秀,,https://toutiao.com/group/7435825833048015400/,,0,0,True
1米3袖珍美女嫁给1米48男孩，婚后丈夫奇迹长高，两人却不欢而散,2024-09-07 02:55,7185,393,睿之悦,睿之悦,杨萍和葛存苗的婚礼 文|睿之悦 编辑|睿之悦2019年，成都的民政局来了两个“10岁小孩”来登记，工作人员以为是玩闹。两个“小孩”拿出身份证让工作人员看，这才明白，原来是两个再也长不高的成年袖珍人情侣。,https://toutiao.com/group/7411713833267364386/,,0,0,False
罕见！100年前，英国游客拍下的清朝乡村，和想象中完全不一样,2024-09-20 02:07,8271,734,万物知识局,万物知识局,泥泞的土路，衣不蔽体的老百姓，即便是达官显贵的家中也十分破败，而这些都是清王朝的历史痕迹，虽说那时候中国摄影技术并不发达，但也有许多外国游客来到这里，拍摄下了许多老照片，为我们留下了珍贵的历史资料，那清朝到底是怎样的面貌呢?,https://toutiao.com/group/7416287738871267855/,,0,0,False
当年她败坏了印小天的名声，借此走红嫁给了导演，如今怎么样了？,2024-11-23 11:26,831,175,不似少溓游,不似少溓游,文 | 不似少溓游编辑 | 不似少溓游如今提到边潇潇，大部分人可能都没什么印象了。但倘若是在2012年左右关注过娱乐圈八卦的人，一定对这个名字记忆尤深。当年边潇潇一手引发了“插刀门事件”，险些葬送了印小天的演艺事业。真相大白之后，作为始作俑者的她反倒没什么损失。,https://toutiao.com/group/7440290425002312227/,,0,0,False
“中企遭大规模拒签，前所未有”,2024-12-02 09:13,8123,2481,环球时报新媒体,环球时报新媒体,“中企遭大规模拒签，前所未有”,https://toutiao.com/group/7443740275974865423/,,0,0,True
母亲瘫痪、父亲疯了，当年那个744分的高考状元，7年后却成了这样,2024-09-08 00:54,13729,1948,八号探秘人,八号探秘人,母亲截肢瘫痪、父亲疯癫痴傻，可对于自己的亲人，他却做出了这样的评价。而今，7年已过，曾经那个让无数人动容的少年，现在如何?,https://toutiao.com/group/7411852147648496162/,,0,0,False
疑王思聪新女友身份曝光！三周前才满20岁，大量个人私密照曝光,2024-12-02 09:32,108,179,8卦娱,8卦娱,近几日，王思聪再度登上了热搜，不过这一次这位富二代是在日本某家相机店被拍到的，而且让不少人感到惊讶的是，这次站在王思聪身边的女人。,https://toutiao.com/group/7443742142553473563/,,0,0,False
韩国一夜变天，10个关键问题,2024-12-03 23:14,3735,905,牛弹琴,牛弹琴,万万没想到，韩国一夜变天，总统尹锡悦掀桌子了。12月3日深夜，他突然宣布，韩国紧急戒严。有朋友问：戒严是什么概念？那是涉及到国本的大事。是要动刀动枪，抓人杀人的。要知道，韩国上次戒严，还是40多年前了。随后，韩国军队上街，首尔市民抗议，世界各国震惊。,https://toutiao.com/group/7444325422541619748/,,0,0,False
外交态度逆转，立陶宛与中方对峙的内幕是？ #立陶宛,2024-12-03 09:02,13005,1116,卢克文工作室,卢克文工作室,,https://toutiao.com/group/7444108279917052425/,,0,0,True
大兴机场被北漂睡成“洗浴中心”，撕开当下社会最体面的一幕,2024-12-02 12:50,1220,257,毒sir财经,毒sir财经,＃大兴机场被北漂睡成了“0元洗浴中心”的词条，迅速冲上热搜，引来广大网友热议。许多人有过，兜里窘迫，又想找个地方过夜的经历。,https://toutiao.com/group/7443795695737373196/,,0,0,False
女友怀孕了，男友不装了，带她回豪宅！,2024-11-23 08:01,8238,691,乐视大综艺咖,乐视大综艺咖,,https://toutiao.com/group/7440353629540483593/,,0,0,True
警惕“先用后付”小心欠下账单～（央视频号：光华路资讯）,2024-11-27 12:44,17423,4922,央视频,央视频,,https://toutiao.com/group/7441939150552433179/,,0,0,True
美国权力即将交接之际，台湾两个举动不寻常，释放什么危险信号？,2024-12-02 09:57,11180,109,邱震海,邱震海,,https://toutiao.com/group/7443751437550486057/,,0,0,True
海南富商张晖：花8亿建108米海上观音像，4年后死在水中死因成谜,2024-10-19 04:49,2136,279,八号探秘人,八号探秘人,在阅读此文之前，辛苦您点击一下“关注”，既方便您进行讨论和分享，又能给您带来不一样的参与感，感谢您的支持！编辑丨xk他是中国的一名富商，耗费8亿元完成了自己的梦想。可梦想落地成为现实的时候，他却在4年后莫名其妙的死去。他就是张晖，上个世纪末海南岛旅游业的龙头当家人。,https://toutiao.com/group/7427288913095492134/,,0,0,False
她曾被前夫一巴掌扇到离婚！二婚嫁世界冠军，如今生活幸福滋润,2024-09-10 09:12,18750,332,豆莱说,豆莱说,“漂亮的让人挪不开眼”是圈内人对她的评价，和“山杏”不一样的是，李琳在现实生活中的感情很是幸运，遇到了导演王小列。,https://toutiao.com/group/7412930201929204236/,,0,0,False
未来5年没大年三十，都是月亮惹的祸！2262年有两个春节放假怎么安排？,2024-12-03 05:12,795,401,极目新闻,极目新闻,2025年1月29日将迎来农历新年蛇年，但2025年没有大年三十，大年二十九过后就是大年初一。据悉，从2025年开始直到2029年，连续五年的除夕都是“大年二十九”。,http://jms.ctdsb.net/jmythshare/#/index_share?cId=0&contentType=5&contentId=2319456,,0,0,False
炸萝卜丸子到底用面粉还是淀粉，教你正确做法，外焦里嫩，太香了,2024-10-26 09:25,13507,884,家常的味道,家常的味道,,https://toutiao.com/group/7430012978277122611/,,0,0,True
复旦大学女生去台湾交流，看看面对台湾记者的刁难如何回应！爽,2024-12-03 11:20,3403,376,沉着小鱼AA,沉着小鱼AA,,https://toutiao.com/group/7444144068135518760/,,0,0,True
黎智英香港出庭抖内幕，美国介入，蔡英文参与，还有赵少康金小刀,2024-11-27 09:24,38711,2373,邱毅台湾,邱毅台湾,,https://toutiao.com/group/7441887559757595190/,,0,0,True
马龙访台，台湾人热烈欢迎，台独焦虑不安视为大敌使出妖魔化老招,2024-11-29 09:56,25126,1053,邱毅台湾,邱毅台湾,,https://toutiao.com/group/7442637867307762230/,,0,0,True
赖清德过境夏威夷，病急乱投医，找上佩洛西通电话，惹怒特朗普,2024-12-03 09:30,11600,163,邱毅台湾,邱毅台湾,,https://toutiao.com/group/7444115695816442395/,,0,0,True
马龙燃爆台湾，民进党心惊胆寒！中华基因抹不掉，优质魅力挡不了,2024-11-30 22:01,20404,814,黎建南台湾,黎建南台湾,,https://toutiao.com/group/7443195770188071465/,,0,0,True
大学生4年间艾滋病感染12397例，60%存在这一行为,2024-12-03 10:16,2270,1212,凤凰网,凤凰网,据相关数据，2020年至2023年，新报告青年学生病例分别为:2977人、3677人、2733人、3010人，四年间共报告12397人。,https://toutiao.com/group/7444127197663396364/,,0,0,False
羽绒服“暴雷”，普通人买羽绒服，看不懂水洗标上这3个词，容易吃大亏！,2024-11-30 09:21,696,344,环球网,环球网,来源：科普中国 近日，有关羽绒服的话题频繁上热搜。有服装行业人士说，90%的鸭绒从去年的35万涨到今年的59万一吨；90%的鹅绒从去年的70万涨到今年的125万一吨。成本的暴涨，导致某些厂家用50%的鸭绒冒充90%的鹅绒，甚至拿废丝掺在鹅绒里。我们普通消费者，要怎么选购羽绒服呢？,https://3w.huanqiu.com/a/3084ce/4KT1XWDBsfa?agt=20,,0,0,False
朔尔茨致电普京遭冷遇，贝尔伯克访华难改颓势，德国彻底坐不住了,2024-12-03 06:54,22880,1055,邱震海,邱震海,,https://toutiao.com/group/7444075394451374592/,,0,0,True
杀疯了的「北京市服」，统一全国审美？,2024-11-25 00:30,2262,1014,凤凰WEEKLY,凤凰WEEKLY,文/馍王编辑/闫如意众所周知，凤凰编辑部位于北京市。众所又知，北京的冬天，有一种统一所有人穿搭审美的魔力。这个冬天，编辑部的穿搭呈现出了无限趋同。上班时，人均穿着一件柔软的摇粒绒内衬，蜷缩在工位上。下班点一到，用一件宽大冲锋衣把摇粒绒一锁，挺胸抬头，跟扇大铁门似的走出公司。,https://toutiao.com/group/7440858414693040678/,,0,0,False
男子刷视频发现妻子与他人举办婚礼！背后的秘密更惊人,2024-12-03 00:21,988,968,极目新闻,极目新闻,一次偶然的机会，与妻子长期分居两地的阿强（化名）在刷视频时看到小自己11岁的娇妻阿芳（化名）正与他人举办婚礼，而随着阿强的进一步调查，更让他难以接受的事实接踵而至：自己养育了7年的女儿也不是亲生的，妻子口中为他所生的“儿子”更是凭空捏造……气愤、羞恼之余，淮安男子阿强选择拿起法律,http://jms.ctdsb.net/jmythshare/#/index_share?cId=0&contentType=5&contentId=2319202,,0,0,False
弟弟光荣退伍，姐姐兴奋去车站接他，怎料一见弟弟瞬间哭了,2024-11-05 06:34,29424,2872,乐视天天剧好看,乐视天天剧好看,,https://toutiao.com/group/7433679820573934091/,,0,0,True
美联储收割印度，1.3万亿资金撤离，印度或将倒退24年被打回原形,2024-12-02 05:38,2051,161,BWC中文网,BWC中文网,,https://toutiao.com/group/7443684657033380387/,,0,0,True
1.91米的“女神”，开启新身份,2024-11-21 08:37,2877,176,环球人物杂志,环球人物杂志,“排球绝不仅仅是我以前在赛场上看到的那一种模样。”作者：陈佳莉今年9月，奥运冠军惠若琪迎来了属于自己的第一个教师节。从南京师范大学博士毕业后，因为延续着对排球的热爱，惠若琪选择留校任教。对于曾站上过梦想的世界之巅，也体验过手术台上与死神擦肩而过的她来说，讲台成为最新的“赛场”。,https://toutiao.com/group/7439648518744113683/,,0,0,False
选择联中抗美，石破茂真是亲华首相，在重要场合明确表态,2024-12-03 06:47,1567,182,军情作家陈曦,军情作家陈曦,据报道，日本首相石破茂在临时国会开幕式上，介绍了他之前与中方高层接触的情况，并阐明了自己的对华立场。,https://toutiao.com/group/7444073508466704923/,,0,0,False
好日子过完了！三大部门严查柳家，柳传志背后“家族”被曝光,2024-12-03 14:29,435,131,奋发有为橘子N,奋发有为橘子N,,https://toutiao.com/group/7444192728092508724/,,0,0,True
中北大学推出巡飞枪，枪身弹药创新设计，后坐力小射击精度更高,2024-11-28 09:54,21799,1422,杜文龙,杜文龙,,https://toutiao.com/group/7442266246671761932/,,0,0,True
广西49岁老汉娶19岁姑娘，结婚21年生下15个孩子，如今有何下场？,2024-10-20 08:32,5499,678,艺述史,艺述史,她19岁出嫁，21年里总共生育了15个孩子，其中4个男孩子11个女孩子，家里热闹的像是开了一所学校一样。,https://toutiao.com/group/7427400319418384948/,,0,0,False
郭有才：当迷失方向忘记初心后，曾经飘得多高，如今摔得就多惨,2024-11-11 06:53,1429,685,八号探秘人,八号探秘人,在阅读此文之前，辛苦您点击一下“关注”，既方便您进行讨论和分享，又能给您带来不一样的参与感，感谢您的支持！编辑丨brt因为一首翻唱，他一夜之间成为了拥有千万粉丝的网红。但是“人红是非多”，不久他就因为版权等问题陷入了舆论风波。他的人气一落千丈，从万众瞩目变成了现在的无人问津。,https://toutiao.com/group/7435901170239078948/,,0,0,False
好物分享｜炖牛肉时切记三放两不放，这样炖出来的牛肉才会汤鲜味美,2024-10-15 08:50,5646,229,家味美食,家味美食,,https://toutiao.com/group/7425922043991360037/,,0,0,True
近5年最热的十部剧，《狂飙》第9，《繁华》第6，第1名很难超越,2024-12-01 03:58,345,146,电影烂番茄,电影烂番茄,今天，番叔就结合口碑，给大家盘点一下近五年，热度最高的十部电视剧。第十名:《都挺好》 猫眼热度 9775.8，播出时间2019年。,https://toutiao.com/group/7430845717314273831/,,0,0,False
包菜炒粉条，切记不要焯水和直接下锅，教你一招，清脆爽口不出水,2024-11-11 11:50,7614,372,家常的味道,家常的味道,,https://toutiao.com/group/7435987746101690930/,,0,0,True
