title,publish_time,like_count,comment_count,media_name,source,abstract,article_url,tag,is_yaowen,article_sub_type,has_video
独家视频丨习近平同印尼总统会谈：你正式就职后首先对中国进行国事访问 实现了我们的“北京之约”,2024-11-09 11:01,648,268,央视新闻,央视新闻,11月9日下午，国家主席习近平在北京人民大会堂同来华进行国事访问的印度尼西亚总统普拉博沃举行会谈。习近平指出，很高兴再次同普拉博沃总统见面。,https://content-static.cctvnews.cctv.com/snow-book/index.html?item_id=7115134593922228965&source=50006&sub_source=50006_001,,0,0,False
俩人相亲互相看不上，哪料男方一报母亲身份，姑娘乐了,2024-11-08 01:50,4756,1251,乐视群星访谈秀,乐视群星访谈秀,,https://toutiao.com/group/7434719902990074395/,,0,0,True
特朗普赢了，对中国是好还是坏？(上),2024-11-07 14:53,34783,1866,静思有我,静思有我,,https://toutiao.com/group/7434550628703011391/,,0,0,True
中国制造到底怎么样？最近，美媒说了句大实话！,2024-11-06 11:50,2015,175,火星方阵,火星方阵,美媒彭博社感叹，尽管近6年多来美国对华实施了加征关税、出口管制和金融制裁，但中国仍在新兴技术方面稳步前进。例如中国制造的电动车、光伏板、智能手机等产品，在除美国外的全球范围内被广泛使用。彭博社还特别指出，在全球13项关键技术中，中国在5项中获得全球领先地位，7项进步神速。,https://toutiao.com/group/7434101803479728640/,,0,0,True
一巴掌的代价，公交车上大妈打晕患癌小伙，断送退休后的幸福生活,2024-10-14 09:53,1900,1165,客观听書,客观听書,公交车上老太太和小伙吵了起来，老太太更是当仁不让直接给了小伙一巴掌。这名小伙直接倒地，老大大根本就不会想到正是因为他的一巴掌，鲜活的生命就这样消失在他的手里。,https://toutiao.com/group/7425563455358468627/,,0,0,False
两次交火让朝军开眼界，朝鲜1万大军存在缺陷：1个月还无法打大仗,2024-11-09 08:10,5610,168,深度工场,深度工场,朝鲜军队混编在俄军第810海兵旅，在库尔斯克州苏贾地区，连续打了两次战斗，可以说开了眼界。朝鲜军队1万大军已经抵达俄罗斯大约1个月，这批朝鲜军队全都是特种兵，至少训练了四年，五年的老兵。,https://toutiao.com/group/7435186488997855807/,,0,0,False
小伙洗完澡故意秀肌肉，富婆心跳加速被当场拿下，这下好看了,2024-10-26 16:20,6467,265,乐视情感讲堂,乐视情感讲堂,小伙洗完澡故意秀肌肉，富婆心跳加速被当场拿下，这下好看了,https://toutiao.com/group/7430011217881596426/,,0,0,True
特朗普在忙什么？他的新政府许多反华人士入列，中美关系会怎么走,2024-11-08 10:05,25809,1367,邱毅台湾,邱毅台湾,,https://toutiao.com/group/7434847402797990452/,,0,0,True
“蜂巢母舰”亮相珠海航展，搭载不同型号无人机，侦察攻击两不误,2024-11-08 12:07,13309,915,杜文龙,杜文龙,,https://toutiao.com/group/7434878976956465716/,,0,0,True
刀郎刘德华与凤飞飞，他们的歌让台湾人真的想回家了！,2024-11-05 22:05,66606,6204,黎建南台湾,黎建南台湾,,https://toutiao.com/group/7433919847295091210/,,0,0,True
67岁执意生娃，如今却坐轮椅无法自理，5岁的天赐被迫独立学洗衣,2024-11-04 10:32,2044,559,睿之悦,睿之悦,2019年，已经67岁的田新菊执意生下了自己的第三个孩子小天赐。那么，现如今5年的时间过去了，这“天赐”的礼物到底是福还是祸呢?,https://toutiao.com/group/7433367394946384435/,,0,0,False
被拐男子认亲一年后，与家人彻底决裂！,2024-11-05 08:45,2521,1430,环球网,环球网,来源：宁波晚报 近日因寻亲走红的郁豹豹与家人决裂的消息引发关注，冲上热搜。据报道，2023年9月，被拐卖34年的郁豹豹寻亲成功。认亲不到半个月，郁豹豹与两个弟弟开始直播带货。不到两个月，三兄弟逐渐走向分崩离析。令他更无法接受的是，他与母亲也渐生隔阂。,https://3w.huanqiu.com/a/14459a/4K8FGmdmzMW?agt=20,,0,0,False
特朗普胜了，收割清算越南，1600万亿撤退，越南工厂重返中国,2024-11-09 06:49,3584,237,BWC中文网,BWC中文网,特朗普胜了，收割清算越南，1600万亿撤退，越南工厂重返中国,https://toutiao.com/group/7435167979589632566/,,0,0,True
1米3袖珍美女嫁给1米48男孩，婚后丈夫奇迹长高，两人却不欢而散,2024-09-07 02:55,3237,187,睿之悦,睿之悦,杨萍和葛存苗的婚礼 文|睿之悦 编辑|睿之悦2019年，成都的民政局来了两个“10岁小孩”来登记，工作人员以为是玩闹。两个“小孩”拿出身份证让工作人员看，这才明白，原来是两个再也长不高的成年袖珍人情侣。,https://toutiao.com/group/7411713833267364386/,,0,0,False
特朗普胜选后，外交动作频频，泽连斯基的意外来电，折射出什么？,2024-11-09 10:10,12670,715,邱震海,邱震海,,https://toutiao.com/group/7435219987653984802/,,0,0,True
大老虎在总统套房潇洒，殊不知对面住着中央领导，有戏看！,2024-10-15 02:37,4560,190,乐视群星访谈秀,乐视群星访谈秀,大老虎在总统套房潇洒，殊不知对面住着中央领导，有戏看！,https://toutiao.com/group/7425826039802102284/,,0,0,True
"特朗普的第一把火正在点燃,大收割开始,或没收外国人房产黄金美元",2024-11-08 11:41,10128,3192,BWC中文网,BWC中文网,,https://toutiao.com/group/7434872159333253658/,,0,0,True
特朗普2.0强势归来，两岸如何应对？任性施为恐成脱缰野马,2024-11-08 23:00,9098,123,游梓翔,游梓翔,,https://toutiao.com/group/7434872583981367843/,,0,0,True
无特效药！多地发生病毒群体感染事件！疾控部门紧急提醒,2024-11-08 23:20,966,420,环球网,环球网,来源：央视财经 近日北京、河南、浙江、广东等多地疾控部门发布提醒诺如病毒引起的急性感染性腹泻已进入发病高峰期中国疾控中心相关专家介绍，诺如病毒是引起急性胃肠炎常见的病原体之一，传染性强，传播途径多样。,https://3w.huanqiu.com/a/1080fe/4KBFff49PAH?agt=20,,0,0,False
是谁给了哈里斯致命一击？民主党大佬答案令人震惊，特朗普捡到宝,2024-11-08 10:03,12566,1237,煮天下,煮天下,哈里斯为何惨败？特朗普挖到最大票仓,https://toutiao.com/group/7434847005434479156/,,0,0,True
河南方城4名公职人员涉酒驾死亡，亲属：外甥女本已计划结婚，孩子父母哭干了眼泪,2024-11-09 06:19,3889,4609,极目新闻,极目新闻,极目新闻记者 余渊支离破碎的汽车零件，混在沙土中散落一地。支离破碎的汽车零件散落一地罗女士（化姓）怎么也想不到，自己年轻的外甥女，和另一名远房亲戚的儿子，会在一场车祸中，双双殒命。据央视新闻消息，11月4日，河南南阳方城县发生一起交通事故，致4人死亡。,http://jms.ctdsb.net/jmythshare/#/index_share?cId=0&contentType=5&contentId=2299863,,0,0,False
特朗普的新孤立主义启动，泽连斯基、尹锡悦、赖清德都瑟瑟发抖了,2024-11-07 06:48,61414,2807,邱毅台湾,邱毅台湾,,https://toutiao.com/group/7434425551684633100/,,0,0,True
特朗普杀回来了，第二次贸易战要来了，中国要做哪些准备？,2024-11-07 15:49,10971,1898,金灿荣教授,金灿荣教授,,https://toutiao.com/group/7434468272764650020/,,0,0,True
15年前他在爱妻葬礼上哭到昏厥，发誓永不再娶，如今他做到了吗？,2024-08-24 02:17,18936,585,八号探秘人,八号探秘人,在阅读此文之前，辛苦您点击一下“关注”，既方便您进行讨论和分享，又能给您带来不一样的参与感，感谢您的支持！编辑丨xk纵观鱼龙混杂的娱乐圈，有人背叛，有人痴情。而果靖霖则是公认的好男儿，将一生都奉献给妻子。但妻子却仅仅陪他走了半生，没能战胜病魔，不幸离开人世。,https://toutiao.com/group/7406210316734710283/,,0,0,False
罕见！100年前，英国游客拍下的清朝乡村，和想象中完全不一样,2024-09-20 02:07,5387,567,万物知识局,万物知识局,泥泞的土路，衣不蔽体的老百姓，即便是达官显贵的家中也十分破败，而这些都是清王朝的历史痕迹，虽说那时候中国摄影技术并不发达，但也有许多外国游客来到这里，拍摄下了许多老照片，为我们留下了珍贵的历史资料，那清朝到底是怎样的面貌呢?,https://toutiao.com/group/7416287738871267855/,,0,0,False
美联储正式向特朗普宣战，投下“深水炸弹”，人民币变盘,2024-11-08 13:48,6157,109,BWC中文网,BWC中文网,美联储正式向特朗普宣战，投下“深水炸弹”，人民币变盘,https://toutiao.com/group/7434904868134847010/,,0,0,True
吃播网红恩克半年吃110只羊，眼神呆滞脸黑成炭，网友求他别吃了,2024-11-04 08:22,847,620,与君説,与君説,在阅读此文之前，麻烦您点击一下“关注”，既方便您进行讨论和分享，又能给您带来不一样的参与感，感谢您的支持文、编辑|是否古人估计都没想到后世子孙通过吃饭就能赚得盆满钵满。短视频的迅速崛起给人们带来了很多生财之道，吃播就是其中一个。,https://toutiao.com/group/7433333039997977107/,,0,0,False
吉林美女带俩娃，嫁给头婚小叔子，婆婆一手撮合，如今过得怎样了,2024-11-01 08:01,2569,778,睿之悦,睿之悦,说出来可能很多人都不相信，吉林一位带着两个孩子的美女在婆婆的大力撮合下嫁给了自己的小叔子。2020年，这位女子的丈夫因为意外去世，留下了她们孤儿寡母悲痛欲绝。,https://toutiao.com/group/7432216069030363682/,,0,0,False
美妇约见老情人，见面场景真是太逗了，这俩人绝配！,2024-10-27 16:25,2517,318,乐视明星的那点事,乐视明星的那点事,美妇约见老情人，见面场景真是太逗了，这俩人绝配！,https://toutiao.com/group/7428157095108674088/,,0,0,True
真低俗还是假专业？一场演唱会，揭开刀郎真实处境，难怪他们力挺,2024-09-23 06:37,873,127,读万卷书的张飞,读万卷书的张飞,正如《罗刹海市》中的歌词，你能说没有内涵某些人吗?《2002年的第一场雪》爆火，专辑销售量更是吊打所谓的“资源咖”，乐坛出现了刀郎。,https://toutiao.com/group/7417723405191758351/,,0,0,False
珠海航展 “机器狼”首次公开亮相！“铁翼飞旋”带你一探究竟,2024-11-09 02:27,36386,4599,央视频,央视频,,https://toutiao.com/group/7435100516647502336/,,0,0,True
中国国乒又火了！决胜时刻，领军人物疯狂逆转，上演最解气的一幕,2024-11-04 00:00,6008,680,乐播体育,乐播体育,,https://toutiao.com/group/7433056969079915020/,,0,0,True
"万万没想到,53岁“丁克”半辈子的康辉，一生遗憾竟然是一通电话",2024-08-21 22:14,28799,5493,峰哥正读,峰哥正读,在阅读此文之前，麻烦您点击一下“关注”，既方便您进行讨论和分享，又能给您带来不一样的参与感，感谢您的支持！文/编辑：蘑菇百善孝为先。但是到底怎么做才算是“孝”，康辉用了半辈子才明白。央视知名主持人康辉，事业顺遂，家庭幸福，在外人看来是一个人生赢家。,https://toutiao.com/group/7405504703687115273/,,0,0,False
穷小子去富婆家里，富婆笑咧嘴把保姆支开，保姆心知肚明,2024-10-26 06:34,1913,232,乐视情感讲堂,乐视情感讲堂,穷小子去富婆家里，富婆笑咧嘴把保姆支开，保姆心知肚明,https://toutiao.com/group/7429969094939509311/,,0,0,True
【崔哥天天侃11/9】印度打算申办奥运会，运动员立马肚子疼,2024-11-08 23:59,7893,281,北美崔哥,北美崔哥,,https://toutiao.com/group/7435062306154742283/,,0,0,True
特朗普赢了，乌克兰新总统也有人选了，泽连斯基的苦日子刚刚开始,2024-11-07 03:21,7029,112,票姚校尉,票姚校尉,特朗普赢了，乌克兰新总统也有人选了，泽连斯基的苦日子刚刚开始,https://toutiao.com/group/7434372338667225637/,,0,0,True
空间站狭小，8日游梦破碎，马斯克成最大赢家，波音要过苦日子了,2024-11-08 09:35,2865,122,宋忠平,宋忠平,空间站狭小，8日游梦破碎，马斯克成最大赢家，波音要过苦日子了,https://toutiao.com/group/7434839822629339648/,,0,0,True
