title,publish_time,like_count,comment_count,media_name,source,abstract,article_url,tag,is_yaowen,article_sub_type,has_video
微视频丨这就是中国气质,2024-12-22 00:49,1705,1107,人民日报,人民日报,‍‍‍‌‍‍‌2024年以来，外国来华旅游人数实现大幅增长，“China Travel”在海外社交平台不断升温。近日国家移民管理局宣布，中国过境免签政策全面放宽优化，“China Travel”再升级。网友：ChinaTravel的含金量还在上升！是什么吸引了外国游客？,https://www.peopleapp.com/column/30047781299-500006006974?utm_source=头条号&promote=true,,0,0,False
朝鲜军队用70年前的战术，遭到乌军“欢迎”，血染库尔斯克沙场,2024-12-20 07:54,21014,2538,瞩望云霄,瞩望云霄,,https://toutiao.com/group/7450399433667117595/,,0,0,True
广西49岁老汉娶19岁姑娘，结婚21年生下15个孩子，如今有何下场？,2024-10-20 08:32,8568,1064,艺述史,艺述史,她19岁出嫁，21年里总共生育了15个孩子，其中4个男孩子11个女孩子，家里热闹的像是开了一所学校一样。,https://toutiao.com/group/7427400319418384948/,,0,0,False
萝卜和鸡蛋这样做，比吃补药还补，顿顿吃都不会腻，又香又下饭,2024-10-30 12:28,67375,4143,小寒厨艺,小寒厨艺,萝卜和鸡蛋这样做，比吃补药还补，顿顿吃都不会腻，又香又下饭,https://toutiao.com/group/7431405463378919975/,,0,0,True
海南富商张晖：花8亿建108米海上观音像，4年后死在水中死因成谜,2024-10-19 04:49,3715,628,八号探秘人,八号探秘人,在阅读此文之前，辛苦您点击一下“关注”，既方便您进行讨论和分享，又能给您带来不一样的参与感，感谢您的支持！编辑丨xk他是中国的一名富商，耗费8亿元完成了自己的梦想。可梦想落地成为现实的时候，他却在4年后莫名其妙的死去。他就是张晖，上个世纪末海南岛旅游业的龙头当家人。,https://toutiao.com/group/7427288913095492134/,,0,0,False
四川：可4倍音速飞行 成都造“筋斗云”成功试飞,2024-12-20 10:52,3750,333,看看新闻,看看新闻,四川：可4倍音速飞行 成都造“筋斗云”成功试飞,http://mediaplay.kksmg.com/2024/12/20/h264_720p_600k_78546-DFTVHD-20241220175000-4800-967537-600k_mp4.mp4,,0,0,True
特朗普上任在即，拜登彻底不装了？对华连出重拳，中方如何破局？,2024-12-19 06:42,11076,749,邱震海,邱震海,,https://toutiao.com/group/7450009602017460751/,,0,0,True
香港九龙寨城老照片：曾是香港最邪恶肮脏之地，图9场景令人作呕,2024-11-21 11:32,2579,470,万物知识局,万物知识局,有这么一个地方，他虽然地处极度繁华的都市香港，但是却脏乱不堪，环境极度的恶劣，各种违法的交易都在这里进行，甚至黄赌毒，也在这里悄然滋生，这就是九龙城寨。,https://toutiao.com/group/7439657140518519296/,,0,0,False
温州多家私人影院“可触摸服务人员隐私部位”？记者暗访后报警！警方：已对三个场所行政立案,2024-12-17 08:00,15074,4064,大风新闻,大风新闻,挂着“私人影院”的招牌，线上招徕生意，线下如同幽灵，连地址都是虚假的，居然还设“暗室”对付查处。近日，有网民向大皖新闻反映，在浙江省温州市一些颇受年轻人青睐的私人影院，悄然滋生了一些涉黄服务。,https://toutiao.com/group/7449286844203713062/,,0,0,False
11年狂赚200亿，骗了10万中国人后跑路的亿万富翁，下场如何呢？,2024-09-26 09:05,5067,1551,八号探秘人,八号探秘人,盘继彪，一个狂妄自大的骗子，11年间骗走200亿，把十几万中国人坑得是血本无归家破人亡。不仅如此，他还在跑路之前，杀人诛心的在他们公司官网发布了一条“我们跑路了“的公告，嘲讽受害者。,https://toutiao.com/group/7418792738887729704/,,0,0,False
弟弟光荣退伍，姐姐兴奋去车站接他，怎料一见弟弟瞬间哭了,2024-11-05 06:34,40538,3306,乐视天天剧好看,乐视天天剧好看,,https://toutiao.com/group/7433679820573934091/,,0,0,True
中央定调2025年养老金上涨，计算公式，企退人员能涨7%以上吗？,2024-12-18 04:29,2037,246,社保当家,社保当家,中央定调2025年养老金上涨，计算公式，企业退休人员能涨7%以上吗？在2025年到来之际，养老金上涨的消息就早早地确定了，这无疑给广大退休人员吃上了定心丸。因为根据近期召开的中央经济工作会议，已经明确提出要适当提高退休人员的基本养老金待遇。,https://toutiao.com/group/7447756391172833827/,,0,0,False
今年冬至60年一遇，5大特殊，过年冷不冷就看冬至的表现！,2024-12-21 00:17,6099,915,惠农圈,惠农圈,冬至到啦，这可是冬季最大的一个节气，也是一个节日，在民间素有“冬至大如年”的说法。在古代社会，那些常年在外地工作的人，在冬至这一天会赶回家。,https://toutiao.com/group/7450652001870594614/,,0,0,False
县长看不上乡长送的烟，给他退回来，乡长打开一看乐了,2024-11-13 08:16,9960,1650,乐视大综艺咖,乐视大综艺咖,,https://toutiao.com/group/7436672568578277925/,,0,0,True
河南警察3岁女儿被拐，苦寻全国23年无果，结果却发现女儿在对门,2024-11-05 07:43,5147,588,八号探秘人,八号探秘人,寻亲23年无果，丢失的女儿竟住在对门?但它却真实发生在河南洛阳的梁绍波身上。是意外走丢，还是人贩子所为，三岁的女儿怎会离奇失踪?,https://toutiao.com/group/7433697108120142345/,,0,0,False
著名前央视主持人方静，一生未婚44岁客死异乡，成为父母余生之痛,2024-11-22 02:11,2991,756,八号探秘人,八号探秘人,23岁即踏入央视大门，事业一路高歌猛进。是诸多主持人中极少数拥有博士学位的“台柱”，也是一级播音员的主持人。,https://toutiao.com/group/7439610920277459492/,,0,0,False
67岁执意生娃，如今却坐轮椅无法自理，5岁的天赐被迫独立学洗衣,2024-11-04 10:32,9638,2185,睿之悦,睿之悦,2019年，已经67岁的田新菊执意生下了自己的第三个孩子小天赐。那么，现如今5年的时间过去了，这“天赐”的礼物到底是福还是祸呢?,https://toutiao.com/group/7433367394946384435/,,0,0,False
“门前不种桂花树”，它不是富贵树吗？为啥偏偏不能种门口？,2024-12-17 09:08,1749,246,艺述史,艺述史,桂花一开，满院飘香，让人闻了以后心旷神怡，所以不少家里有院子的人家，都喜欢在房子前面种桂花树。不过也有不少人说，房子前面千万不能种桂花树，这是为什么呢？,https://toutiao.com/group/7449305092588569114/,,0,0,True
才发现，原来保存小葱这么简单，放1年都不坏，依然和新鲜一样,2024-12-16 14:40,661,143,明玥美食,明玥美食,,https://toutiao.com/group/7449019538600886795/,,0,0,True
毛人凤下令带走死囚，哪料死囚的靠山露面了，毛人凤当场懵了,2024-11-25 03:05,12944,2309,南哥硬汉秀,南哥硬汉秀,,https://toutiao.com/group/7441047753771188799/,,0,0,True
给《我是刑警》演技最好10位演员排座次：于和伟第3，第1名没争议,2024-12-18 04:06,1580,323,皮皮电影,皮皮电影,《我是刑警》收官之际，网上的争议，却也多了不少。有人盛赞它是“近10年最硬核刑侦剧”，老派纪实的剧作风格，令人着迷。受其影响，很多观众开始追起了二十多年前的《中国刑侦1号案》《12·1枪杀大案》。有人评价它“高开低走”。,https://toutiao.com/group/7449562650628866595/,,0,0,False
包厢全是刚出狱的恶霸，结果一看到饭店主厨，立马怂了,2024-11-11 01:21,13420,367,乐视群星访谈秀,乐视群星访谈秀,,https://toutiao.com/group/7435825833048015400/,,0,0,True
炸裂！余华英曾与多人发生性关系！杨妞花门外站岗，更多内幕曝出,2024-12-21 01:34,1898,254,慕容,慕容,生命进入倒计时！20日，余华英拐卖儿童案迎来了终审，杨妞花声称这是最后一战，被害人以及家属也都全部出庭见证，余华英经过6次庭审，终审维持原判死刑。此消息一出，大快人心！从这个时间点上来看，大概率余华英的生命将终止在春节前了，这也符合历来秋冬问斩的传统。,https://toutiao.com/group/7444079611480162866/,,0,0,False
海一天，不靠当领导的父亲，46岁才走红，娶二婚妻子待继子如亲生,2024-12-19 06:54,1311,313,豆莱说,豆莱说,文：豆莱说编辑：豆莱说在娱乐圈中，不乏有很多星二代，他们一出生便含着金汤匙，什么不用做就已经到达了普通人努力一辈子都到达不了的罗马。但是海一天却是一个例外，他从不靠着家里的关系，凭借着自己的努力进入演艺圈，可是却一直籍籍无名，直到46岁才走红，可算是真正的大器晚成。,https://toutiao.com/group/7450010154218668553/,,0,0,False
给近三年最好10部刑侦剧排个名：《我是刑警》仅第5，第1名没争议,2024-12-16 09:06,1558,346,皮皮电影,皮皮电影,没想到，2024年临近末尾，国产刑侦剧却烧起了一把猛火。先是潘粤明主演的《白夜破晓》。前作《白夜追凶》曾登上网剧之巅，观众喊了7年，这部续作终于姗姗来迟。有网友感慨，当年和女友第一看第一部，第二部播出时孩子都已经上幼儿园了。随后《我是刑警》登陆央视，掀起收视热潮。,https://toutiao.com/group/7448904675966878248/,,0,0,False
尹锡悦要弹劾下台，还得过宪法法庭这关卡，要进监狱关键在三个人,2024-12-17 09:51,11188,156,邱毅台湾,邱毅台湾,,https://toutiao.com/group/7449316198883263026/,,0,0,True
“看上去很美”的“先享后付”暗含多少套路？,2024-12-16 04:42,842,238,看看新闻,看看新闻,“看上去很美”的“先享后付”暗含多少套路？,http://mediaplay.kksmg.com/2024/12/16/h264_720p_600k_78592-DFTVHD-20241216115500-3900-963959-600k_mp4.mp4,,0,0,True
丈母娘公司快要倒闭，农村女婿几杯酒解决，丈母娘感动哭,2024-12-12 09:44,2236,400,南哥硬汉秀,南哥硬汉秀,,https://toutiao.com/group/7447427947440374313/,,0,0,True
马桶冲水无力没有吸力？一般都是这4个原因，大部分自己就能解决,2024-12-08 11:33,1280,132,阿兵电器维修,阿兵电器维修,马桶冲水无力没有吸力？很简单，一般都是这4个原因，大部分自己就能解决,https://toutiao.com/group/7446002675537150491/,,0,0,True
炖鸡肉不要焯水和直接下锅，教你一招，鸡肉鲜香滑嫩不腥不柴,2024-12-15 08:45,3875,195,家常的味道,家常的味道,炖鸡肉千万不要焯水和直接下锅，教你秒招，鸡肉鲜香滑嫩不腥不柴,https://toutiao.com/group/7448556944597451275/,,0,0,True
给24年最好的十部国产剧排名：《我是刑警》仅第10，第1名没争议,2024-12-19 09:05,1086,216,皮皮电影,皮皮电影,2024年接近尾声，回顾这一年的国产剧，我们可以发现一些变化：第一大变化，是央视的动作。从2020年起，或许是面临网剧精品化的冲击，央视也开始主动求变。最开始的动作，还只是瞄准开年大剧，比如2021年的《觉醒年代》、2022年的《人世间》。,https://toutiao.com/group/7449943522318238260/,,0,0,False
厨师长教你：“羊肉汤”汤质优美，营养丰富；不膻不腥，味道鲜美,2024-11-21 02:57,6356,751,美食作家王刚,美食作家王刚,厨师长教你：“羊肉汤”汤质优美，营养丰富；不膻不腥，味道鲜美,https://toutiao.com/group/7439561371424915994/,,0,0,True
郭有才：当迷失方向忘记初心后，曾经飘得多高，如今摔得就多惨,2024-11-11 06:53,2004,853,八号探秘人,八号探秘人,在阅读此文之前，辛苦您点击一下“关注”，既方便您进行讨论和分享，又能给您带来不一样的参与感，感谢您的支持！编辑丨brt因为一首翻唱，他一夜之间成为了拥有千万粉丝的网红。但是“人红是非多”，不久他就因为版权等问题陷入了舆论风波。他的人气一落千丈，从万众瞩目变成了现在的无人问津。,https://toutiao.com/group/7435901170239078948/,,0,0,False
炸肉丸子，到底用淀粉还是面粉，教你一招，外酥里软超好吃,2024-10-01 09:23,7077,553,家常的味道,家常的味道,,https://toutiao.com/group/7420735473208787492/,,0,0,True
女友怀孕了，男友不装了，带她回豪宅！,2024-11-23 08:01,17946,1309,乐视大综艺咖,乐视大综艺咖,,https://toutiao.com/group/7440353629540483593/,,0,0,True
近5年最热的十部剧，《狂飙》第9，《繁华》第6，第1名很难超越,2024-12-01 03:58,1388,518,电影烂番茄,电影烂番茄,今天，番叔就结合口碑，给大家盘点一下近五年，热度最高的十部电视剧。第十名:《都挺好》 猫眼热度 9775.8，播出时间2019年。,https://toutiao.com/group/7430845717314273831/,,0,0,False
100年前，清朝罕见留影，王爷妻妾婀娜多姿，乞丐全身挂满垃圾,2024-10-14 09:58,2670,299,万物知识局,万物知识局,每一张老照片，都像是时间的低语，它们静静地躺在历史的相册中，却在不经意间将我们拉回到那个遥远而神秘的年代。,https://toutiao.com/group/7425457574731579919/,,0,0,False
丈母娘觉得女婿没本事，谁料去他单位一看，被女婿官威吓傻,2024-11-25 02:07,1196,269,南瓜最前线,南瓜最前线,,https://toutiao.com/group/7441032711340294696/,,0,0,True
被姚明抱着上奥运的小英雄，曾发誓考上清华，16年后活成了这样,2024-11-07 08:07,3807,758,睿之悦,睿之悦,2008年，年仅9岁的林浩，在姚明的带领下走进了北京奥运会开幕式的舞台上，成为了万众瞩目的“焦点”。,https://toutiao.com/group/7434444094551687707/,,0,0,False
