title,publish_time,like_count,comment_count,media_name,source,abstract,article_url,tag,is_yaowen,article_sub_type,has_video
媳妇玩到半夜才回来，以为老公不在家，进门这操作把老公看懵了,2025-01-24 09:38,12092,3302,滕菲,滕菲,,https://toutiao.com/group/7463414214191743497/,,0,0,True
华为200万年薪都留不住他！天才少年彭志辉离职后，现状曝光,2025-01-16 09:28,8632,1154,与君説,与君説,在阅读此文之前，麻烦您点击一下“关注”，既方便您进行讨论和分享，又能给您带来不一样的参与感，感谢您的支持文、编辑|小娄你敢相信吗？大厂华为200万年薪的工作，竟然也有人不屑一顾。入职华为两年后，彭志辉毅然决然选择离职。,https://toutiao.com/group/7460439446131884579/,,0,0,False
老铁们对农村土地回收有什么看法，请写在评论区？,2025-02-18 05:23,2672,844,靳七纪实,靳七纪实,,https://toutiao.com/group/7472625286132089371/,,0,0,True
93岁老人犯强奸罪被判15年，看守所拒绝收押？官方回应来了！,2025-02-17 15:59,706,157,琪琪妈,琪琪妈,,https://toutiao.com/group/7472418202992116250/,,0,0,True
中俄演习:解放军教俄军特种兵空手夺刀和夺手枪，俄军惊呆了！,2025-01-28 00:21,10221,613,清清要加油,清清要加油,,https://toutiao.com/group/7464754529892876810/,,0,0,True
太辣眼了！巴黎时装周一丝不挂，我看了一场“国王的新衣”秀！,2025-02-18 02:37,819,298,田园梦想家,田园梦想家,,https://toutiao.com/group/7472582475558945280/,,0,0,True
太可怕了！这混乱的场景让我心惊胆战！,2025-02-06 12:39,5774,3083,【江湖规矩,【江湖规矩,,https://toutiao.com/group/7468284742652166690/,,0,0,True
父母都已不在，男子还未成家，一个人回家过年，鞭炮也不能少。,2025-02-13 10:15,31259,4832,乐天派叶子,乐天派叶子,,https://toutiao.com/group/7470845080074502667/,,0,0,True
巴铁媳妇金子没捞着回巴基斯坦了想带孩子走！你想的真美赶紧走吧,2025-01-26 03:12,9884,3544,彭学成,彭学成,,https://toutiao.com/group/7464042748732080703/,,0,0,True
领导喝醉给姑娘一万，姑娘一年后抱孩子找上门 ，领导慌了,2025-02-12 03:18,3637,159,音乐保管员剧院,音乐保管员剧院,,https://toutiao.com/group/7470366603641782824/,,0,0,True
