title,publish_time,like_count,comment_count,media_name,source,abstract,article_url,tag,is_yaowen,article_sub_type,has_video
时政微观察丨从乡村到城市，总书记都强调了这个关键词,2024-11-07 15:14,2348,1659,央视新闻,央视新闻,在咸宁市嘉鱼县潘家湾镇十里蔬菜长廊，总书记走进田间，察看蔬菜长势，强调“发展现代农业，建设农业强国，必须依靠科技进步，让科技为农业现代化插上腾飞的翅膀”。,https://content-static.cctvnews.cctv.com/snow-book/index.html?item_id=11477535218961801720&source=50006&sub_source=50006_001,,0,0,False
易炼红，有新职务,2024-11-08 08:24,8164,6570,长安街知事,长安街知事,据新华社消息，11月8日，十四届全国人大常委会第十二次会议任命易炼红为全国人大财政经济委员会副主任委员。易炼红是第十九届中央候补委员、第二十届中央委员，他此前为浙江省委书记。10月，浙江省省长王浩已接替他，担任浙江省委书记。,https://rss2.bjd.com.cn/content/s672dc906e4b0e1ace8a818a4.html,,1,0,False
锵锵：马未都聊嫖娼的话题，听起来太有意思了，看完会涨知识的,2024-11-04 10:07,2348,449,乐视综艺咖,乐视综艺咖,,https://toutiao.com/group/7433360748253807144/,,0,0,True
特朗普赢了，对中国是好还是坏？(上),2024-11-07 14:53,25999,1508,静思有我,静思有我,,https://toutiao.com/group/7434550628703011391/,,0,0,True
炸萝卜丸子，放面粉和淀粉就错了，教你正确做法，焦香酥脆不吸油,2024-09-28 10:13,22018,932,家常的味道,家常的味道,,https://toutiao.com/group/7419635124758643227/,,0,0,True
刘德华在台北演唱会唱《中国人》，民进党玻璃心碎了，台独崩溃了,2024-11-04 08:14,34550,2646,邱毅台湾,邱毅台湾,,https://toutiao.com/group/7433334683380744731/,,0,0,True
刀郎刘德华与凤飞飞，他们的歌让台湾人真的想回家了！,2024-11-05 22:05,59485,5509,黎建南台湾,黎建南台湾,,https://toutiao.com/group/7433919847295091210/,,0,0,True
特朗普的新孤立主义启动，泽连斯基、尹锡悦、赖清德都瑟瑟发抖了,2024-11-07 06:48,52013,2410,邱毅台湾,邱毅台湾,,https://toutiao.com/group/7434425551684633100/,,0,0,True
一巴掌的代价，公交车上大妈打晕患癌小伙，断送退休后的幸福生活,2024-10-14 09:53,1872,1142,客观听書,客观听書,公交车上老太太和小伙吵了起来，老太太更是当仁不让直接给了小伙一巴掌。这名小伙直接倒地，老大大根本就不会想到正是因为他的一巴掌，鲜活的生命就这样消失在他的手里。,https://toutiao.com/group/7425563455358468627/,,0,0,False
1米3袖珍美女嫁给1米48男孩，婚后丈夫奇迹长高，两人却不欢而散,2024-09-07 02:55,2997,171,睿之悦,睿之悦,杨萍和葛存苗的婚礼 文|睿之悦 编辑|睿之悦2019年，成都的民政局来了两个“10岁小孩”来登记，工作人员以为是玩闹。两个“小孩”拿出身份证让工作人员看，这才明白，原来是两个再也长不高的成年袖珍人情侣。,https://toutiao.com/group/7411713833267364386/,,0,0,False
爸妈中，谁的基因决定孩子的智商和长相，专家回答很统一，太准了,2024-08-31 12:04,851,235,5分钟快读,5分钟快读,阅读此文前，诚邀您点击一下“关注”按钮，方便以后持续为您推送此类文章，同时也便于您进行讨论与分享，您的支持是我们坚持创作的动力~在生活中，许多人都相信：“男生随妈妈，女生随爸爸”这一说法。长久以来，许多人对这一说法深信不疑。但随着科学的普及，越来越多的人也对此产生了怀疑。,https://toutiao.com/group/7409241548929499660/,,0,0,False
特朗普杀回来了，第二次贸易战要来了，中国要做哪些准备？,2024-11-07 15:49,8127,1539,金灿荣教授,金灿荣教授,,https://toutiao.com/group/7434468272764650020/,,0,0,True
春晚：赵四这演技让赵本山都笑场了，台下也笑的人仰马翻！经典！,2024-11-04 08:35,1083,155,乐视综艺咖,乐视综艺咖,,https://toutiao.com/group/7433340063349015051/,,0,0,True
担心被特朗普清算？哈里斯承诺和平交权，佩洛西在现场一度失态,2024-11-07 10:08,6525,1589,千钧堂,千钧堂,,https://toutiao.com/group/7434477132157288972/,,0,0,True
特朗普战胜哈里斯重新上台，对中国是好是坏？,2024-11-06 08:28,26972,7565,第一军情,第一军情,据央视新闻11月6日最新报道，特朗普成功战胜哈里斯，赢得了2024年美国总统大选，和很多人想象的“战事焦灼”不同，本次美国大选却呈现出一边倒的态势，特朗普兵不血刃，在多个摇摆州成功“翻红”，战胜了民主党候选人哈里斯，再次问鼎美国总统的宝座。那么，既然美国未来四年的“掌门人”已经敲定，对中国又将有什么深远影响，或者用更贴地气的话：对中国是好是坏呢？,https://toutiao.com/group/7434080229624119844/,,0,0,True
特朗普胜选好过哈里斯，“台独”心惊被卖钱？副总统万斯更加激进,2024-11-06 11:26,76821,2311,黎建南台湾,黎建南台湾,,https://toutiao.com/group/7434126202526401024/,,0,0,True
给近三年最好的10部年代剧排个名：《人世间》第6，第1名没有争议,2024-09-06 08:08,11196,3574,皮皮电影,皮皮电影,时尚是个轮回，电视剧也是。在2020年之前的那些年，电视剧市场基本上都被偶像剧、都市剧霸占。曾经撑起国剧品质的《闯关东》《岁月》这类年代好剧，难见踪影。,https://toutiao.com/group/7411390030722712090/,,0,0,False
女子11元拍到40多平海景房，平台联系险些被其老公拒收：以为是诈骗电话,2024-11-08 00:03,260,242,大河报,大河报,11月7日，一女子以 11元的价格，在某平台上拍到一套位于威海的海景房。当平台官方联系该女子时，却被对方老公以“诈骗”为由挂断电话。之后平台再次联系上女子，表示确实是官方平台，活动真实有效，只需11元。,https://toutiao.com/group/7434690805131985420/,,0,0,False
被拐男子认亲一年后，与家人彻底决裂！,2024-11-05 08:45,2043,1258,环球网,环球网,来源：宁波晚报 近日因寻亲走红的郁豹豹与家人决裂的消息引发关注，冲上热搜。据报道，2023年9月，被拐卖34年的郁豹豹寻亲成功。认亲不到半个月，郁豹豹与两个弟弟开始直播带货。不到两个月，三兄弟逐渐走向分崩离析。令他更无法接受的是，他与母亲也渐生隔阂。,https://3w.huanqiu.com/a/14459a/4K8FGmdmzMW?agt=20,,0,0,False
男子在路边被黄鼠狼盯住，咬住他的鞋不松口,2024-10-14 06:46,17996,3651,山西广电文娱,山西广电文娱,,https://toutiao.com/group/7425519012454335003/,,0,0,True
女儿花500块租男友，没想他是身价过亿的总裁，这下好运了,2024-10-18 09:42,7693,1414,乐视娱乐乐透社,乐视娱乐乐透社,,https://toutiao.com/group/7427048858267419190/,,0,0,True
2025年，企业和机关事业退休人员丧葬补助金和抚恤金是一样的吗？,2024-10-29 15:45,705,133,暖心财经说,暖心财经说,2025年开始，我国的职工养老保险制度将会迎来新变化，渐进式延迟退休即将实施，企业职工病残津贴制度也将实施，企业和机关事业单位退休人员的丧葬补助金和抚恤金，会是一样的吗？企业退休人员的丧葬补助金和抚恤金。,https://toutiao.com/group/7431217294867268130/,,0,0,False
今天才知道！电动车“每天充”和“用完再充”，到底哪个更伤电池,2024-08-27 11:19,15042,2338,鲸探所,鲸探所,“今天到底给车充不充电？”估计大多数人每天回家都会想这个问题，看着自己的电动车电量又多又少的，充不充电也是一件非常难以抉择的事情。那么，电动车到底应该怎样充电呢？是每天都充，还是用完之后再充呢？电动车充电不管是在城市还是农村，电动车其实都是人们出门最常见的交通工具。,https://toutiao.com/group/7407773012533117475/,,0,0,False
快消失的12个生活用品！40年前在供销社红极一时，你家还在用吗？,2024-09-29 07:58,4606,340,万物知识局,万物知识局,在这里，可以买到从油盐酱醋到衣物鞋帽，再到农具化肥等各种生活必需品，每一样物品都凝聚着时代的特色，见证了那个年代人们的生活状态，今天我们就来走进那些年能够在供销社里买到的生活用品，看看你们还记得哪些。,https://toutiao.com/group/7419937237548237322/,,0,0,False
3年前，宁夏7岁小女孩一笑走红，后拒百万签约，如今怎么样了？他们后悔了吗？,2024-09-19 07:25,8476,1226,睿之悦,睿之悦,2021年，视频镜头中出现的女孩儿用那一抹甜美的笑容，迅速引起了网友们的广泛关注。有媒体公司看到这一机遇，提出愿意用百万巨资与女孩儿签约，然而，女孩儿的父母却坚决拒绝了这一提议。,https://toutiao.com/group/7416250139544879679/,,0,0,False
他于7日在北京逝世，享年73岁,2024-11-08 04:35,1954,112,大皖新闻,大皖新闻,澎湃新闻记者从中国农业科学院农业信息研究所方面获悉，著名养猪专家、农牧企业家、社会活动家，正大集团农牧企业(中国)副董事长、国家生物饲料工程中心首席战略官、中国猪业高层交流论坛荣誉会长姚民仆，因病医治无效，于2024年11月7日在北京逝世，享年73岁。,http://www.ahwang.cn/toutiao/202411/2770144.html,,0,1,False
51年洪学智妻子寻女无果，到老乡家歇脚老乡惊呼：你要找得就是我,2024-09-22 01:07,12547,839,品古观今,品古观今,前言1951年，阳曲县委大院突然来了7、8位解放军同志，其中一位女同志，就是洪学智的妻子张文。她此番前来，就是为了寻找多年前因战乱而寄养于民间的爱女。可昔日的小村落早已蜕变成另一番景象，这无异于是大海捞针。,https://toutiao.com/group/7417034363226915354/,,0,0,False
被撞劳斯莱斯女车主身份曝光！称：无需货车司机赔偿，我自己去修就行,2024-11-07 14:25,1737,818,潇湘晨报•晨视频,潇湘晨报•晨视频,近日，广州一货车在掉头时撞上一辆粤港两地牌的劳斯莱斯。有目击者称：“货车司机得知被判全责，当时就吓得浑身发抖，劳斯莱斯女车主则拿出手机淡定拍照。”11月5日下午，劳斯莱斯车主回应：“实际上这位司机大哥只买了100万保险。如果定损超出保险金额，由我自己本人承担。,http://api.chenshipin.com/wap/a/672cc9dc842017203a4265b8/90f456b81afce808c1fcfbd3f5761f65/1730989422/3f21abe71cd7dfd3cd245fca529bdf94329e6ff441af044110d1e2e48cafa46c,,0,0,False
国家要“动真格”？催三胎不成，专家出“好主意”，你赞成吗？,2024-10-31 04:51,7971,3889,阿皮历史库,阿皮历史库,,https://toutiao.com/group/7431797819591098934/,,0,0,True
中国国乒又火了！决胜时刻，领军人物疯狂逆转，上演最解气的一幕,2024-11-04 00:00,5501,617,乐播体育,乐播体育,,https://toutiao.com/group/7433056969079915020/,,0,0,True
奶奶的黄金手镯戴了50年，还说是清代几百年前的？鉴宝结果如何,2024-08-16 05:52,26376,9788,小闫打铁镯,小闫打铁镯,奶奶的黄金手镯戴了50年，还说是清代几百年前的？鉴宝结果如何,https://toutiao.com/group/7403611154913690121/,,0,0,True
小伙洗完澡故意秀肌肉，富婆心跳加速被当场拿下，这下好看了,2024-10-26 16:20,6073,257,乐视情感讲堂,乐视情感讲堂,小伙洗完澡故意秀肌肉，富婆心跳加速被当场拿下，这下好看了,https://toutiao.com/group/7430011217881596426/,,0,0,True
原来他才是毁掉刘翔真凶，因贪1200万被公审，让刘翔背负多年骂名,2024-08-29 09:58,13710,420,八号探秘人,八号探秘人,在田径场上创造的成绩，至今无人能够打破，甚至在国际上享有盛名。本该继续夺冠之路，却两次因伤退赛，遭到了全网辱骂。,https://toutiao.com/group/7408489498465616410/,,0,0,False
土豆搭配洋葱，教你一个神仙吃法，一次3斤不够吃，太解馋了,2024-09-26 09:09,31562,1882,家常的味道,家常的味道,土豆搭配洋葱，教你一个神仙吃法，一次3斤不够吃，太解馋了,https://toutiao.com/group/7418876506660667904/,,0,0,True
