title,publish_time,like_count,comment_count,media_name,source,abstract,article_url,tag,is_yaowen,article_sub_type,has_video
习近平向全国广大农民和工作在“三农”战线上的同志们致以节日祝贺和诚挚问候,2024-09-21 09:40,5546,3547,新华社,新华社,习近平向全国广大农民和工作在“三农”战线上的同志们致以节日祝贺和诚挚问候。在第七个“中国农民丰收节”到来之际，中共中央总书记、国家主席、中央军委主席习近平代表党中央，向全国广大农民和工作在“三农”战线上的同志们致以节日祝贺和诚挚问候。,http://mp.weixin.qq.com/s?__biz=MzA4NDI3NjcyNA==&mid=2650074248&idx=1&sn=6a1a77c66084f74c4d25123af2cc4bd5,,0,0,False
姑娘远嫁山东十年未回家，带着孩子偷偷回娘家，到家眼前一幕哭了,2024-09-09 08:25,19870,8625,小乔家里的事,小乔家里的事,,https://toutiao.com/group/7412556561718968870/,,0,0,True
国庆放假最新通知！不仅放假7天，而且还有4个好消息告诉大家,2024-09-21 06:53,2868,216,笑史云烟,笑史云烟,相信不少人已经准备好迎接这难得的七天长假，无论是准备出游看看祖国的大好河山，还是回家与家人团聚，亦或是宅在家里放松休息，大家的心情都充满了期待。,https://toutiao.com/group/7416981278681809423/,,0,0,False
表面是艺人，实际是富家千金的5位女星，无人敢惹更别说潜规则了,2024-08-28 02:06,5741,421,八号探秘人,八号探秘人,在德云班主郭德纲的作品中，有过这么一句话。虽说此言尤为刺耳，但话糙理不糙。当今娱乐圈，很多女星为出人头地，自愿或被迫做出违反道德底线之事。,https://toutiao.com/group/7407984985224872459/,,0,0,False
5座车拉6个人被判超员，车主1句话把交警问懵,2024-08-05 20:20,11075,2657,奇妙钢笔pA8JyP,奇妙钢笔pA8JyP,,https://toutiao.com/group/7399752843772559906/,,0,0,True
上海台风来袭 ，27层楼房在晃 ，吓坏了#记录真实生活 #台风,2024-09-16 08:29,1374,220,兴凯湖莹莹,兴凯湖莹莹,,https://toutiao.com/group/7415155319245898276/,,0,0,True
多少：赵本山装病上黑诊所，这段百看不厌，场面太逗了！,2024-09-21 02:46,1304,232,青涩星球yS,青涩星球yS,,https://toutiao.com/group/7416922331924136463/,,0,0,True
曹德旺说：我不会逃跑，但要给政府提个醒 #曹德旺 #福耀科技大学,2024-06-28 06:51,25546,3488,正直鲸鱼LxhXfoC,正直鲸鱼LxhXfoC,,https://toutiao.com/group/7385443277144588834/,,0,0,True
全球最富揭晓：美国首富造火箭，印度首富搞能源，中国首富在干嘛,2024-08-02 07:38,1921,3208,智史通鉴,智史通鉴,2024年4月3日，新一轮的福布斯排行榜出炉，法国奢侈品品牌LV的总裁荣登榜首。同时，马斯克也凭借第二的名次也又一次为了美国的首富。众所周知，马斯克的特斯拉公司最近几年发展势头极好，spaceX公司造火箭的工作也进行的如火如荼。,https://toutiao.com/group/7398431880397324839/,,0,0,False
为国争光却遭郎平弃用！转身效力土耳其的王一梅，如今咋样了？,2024-08-31 13:19,868,120,豆莱说,豆莱说,光阴似箭，日月如梭，当初的少女早已退役，成为了排球场的幕后人，这么多年她都经历了什么，现在又怎么样了呢?,https://toutiao.com/group/7409287778514567718/,,0,0,False
美联储收割转向，中国买家大撤退，应验两大预言，美国盟友反击,2024-09-20 13:44,2900,137,BWC中文网,BWC中文网,美联储收割转向，中国买家大撤退，应验两大预言，美国盟友反击,https://toutiao.com/group/7416720852752564786/,,0,0,True
2013年，湖南26岁女孩嫁给71岁老头，婚后还生下一子，如今怎样了,2024-07-12 11:59,22593,2242,智史通鉴,智史通鉴,2013年4月17日，长沙宁乡县的民政局迎来了一对特殊的夫妻。一个71岁的老头和一个26岁的女孩，离远了看，甚至像爷爷和孙女。面对工作人员异样的眼光，女孩说：“我和他是真心相爱的！”这让人好奇，这对相差45岁的夫妻，他们之间到底有着怎样的爱情故事？,https://toutiao.com/group/7390696631223534120/,,0,0,False
董卿父亲董善祥：我这辈子最后悔的事，就是让宝贝女儿嫁给密春雷,2024-09-11 06:59,1371,150,稻述,稻述,提起央视主持，现在挑大梁的几乎就是撒贝宁、尼格买提、龙洋等人了，他们也都非常优秀，但常有人怀念起董卿还在的日子。,https://toutiao.com/group/7413267526601228852/,,0,0,False
为什么说从2025年开始，70岁以上的老人，可能面临“两大”问题？,2024-09-01 14:12,2124,269,水大叔,水大叔,据可靠数据了解，我国70岁以上的人口数量已经达到了2.5亿人次，占到全国总人口数量的18%。伴随着人口老龄化的出现，养老问题也成了重中之重，要知道养老不仅仅是家庭的责任，更是社会责任。,https://toutiao.com/group/7409677025897710106/,,0,0,False
无论炒什么肉，不要用盐和料酒腌制，大厨教我绝招，肉片滑嫩不腥,2024-07-11 08:24,76744,3104,家常的味道,家常的味道,无论炒什么肉，不要用盐和料酒腌制，大厨教我绝招，肉片滑嫩不腥,https://toutiao.com/group/7390291377185096204/,,0,0,True
何雷中将三句话，美国人怎么接啊?,2024-09-19 05:19,15416,636,司马南,司马南,"何雷中将向美国撂下重话，中国人民解放军不会永远有耐心，将粉碎任何外国入侵中国主权和领土的行为，包括南海，任何外国势力最好明白这一点。
何雷中将当着美国的面说这种直话，我个人认为，这声音是需要有的，场合时点也都极为合适。说到点上了，患者会主动吃药，只要他是理性的。
#中国军事专家谈台湾问题#",https://toutiao.com/group/7416219457434944037/,,0,0,True
男人和女人的需求差别这么大？,2024-07-12 11:00,27575,1989,周小鹏,周小鹏,男人和女人的需求差别这么大？,https://toutiao.com/group/7388885573953389092/,,0,0,True
她认干爹改国籍，曾叫嚣要击败女国乒，却在巴黎奥运会丢尽了脸,2024-08-26 14:00,470,302,吃瓜崽崽,吃瓜崽崽,她曾是中国国籍，却因认干爹入韩籍。十九岁的她被国人认为是乒坛叛徒，还曾叫嚣女国乒。如今却成为了韩国乒乓一姐。,https://toutiao.com/group/7407375792933044790/,,0,0,False
这是调戏还是搭讪？,2024-08-16 04:36,1820,105,潍坊市广播电视台,潍坊市广播电视台,,https://toutiao.com/group/7403591622725272100/,,0,0,True
全球约一半肝癌在中国，再次提醒：家中的4种食物，尽早撤下餐桌,2024-08-13 08:36,90791,3450,梁医学社梁怡璋医生,梁医学社梁怡璋医生,,https://toutiao.com/group/7402540119712629311/,,0,0,True
以色列这一炸全搞砸了，中东地区迎来去美国化：中国成为最大赢家,2024-09-20 07:56,3144,995,深度工场,深度工场,以色列这一炸全搞砸了。以色列在黎巴嫩这一炸，在战术上来说，确实很成功，杀伤4500多名黎巴嫩真主党成员。,https://toutiao.com/group/7416630160327279158/,,0,0,False
军号一响，全军出击！,2024-09-19 08:01,10004,635,中国军号,中国军号,,https://toutiao.com/group/7416261401477382668/,,0,0,True
中国电视活活把自己玩死了。,2024-09-19 03:17,13976,4982,正大光明奶酪,正大光明奶酪,,https://toutiao.com/group/7416188097492320795/,,0,0,True
