title,publish_time,like_count,comment_count,media_name,source,abstract,article_url,tag,is_yaowen,article_sub_type,has_video
中央经济工作会议在北京举行 习近平发表重要讲话,2024-12-12 13:55,2247,848,央视新闻,央视新闻,中央经济工作会议12月11日至12日在北京举行。中共中央总书记、国家主席、中央军委主席习近平出席会议并发表重要讲话。中共中央政治局常委李强、赵乐际、王沪宁、蔡奇、丁薛祥、李希出席会议。习近平在重要讲话中总结2024年经济工作，分析当前经济形势，部署2025年经济工作。,https://content-static.cctvnews.cctv.com/snow-book/index.html?item_id=16836529039839438598&source=50006&sub_source=50006_001,,0,0,False
台湾又拍大尺度！ 太羞耻了，注定只能网盘见,2024-12-10 09:40,2669,147,禾芷解说,禾芷解说,深度解说台湾电影《亲爱的杀手》,https://toutiao.com/group/7446671812101931572/,,0,0,True
尹锡悦狂称「弹劾或调查，都奉陪到底」。执政党改口：支持弹劾！,2024-12-12 06:53,8683,276,邱毅台湾,邱毅台湾,,https://toutiao.com/group/7447414831532999209/,,0,0,True
广西49岁老汉娶19岁姑娘，结婚21年生下15个孩子，如今有何下场？,2024-10-20 08:32,7060,857,艺述史,艺述史,她19岁出嫁，21年里总共生育了15个孩子，其中4个男孩子11个女孩子，家里热闹的像是开了一所学校一样。,https://toutiao.com/group/7427400319418384948/,,0,0,False
海南富商张晖：花8亿建108米海上观音像，4年后死在水中死因成谜,2024-10-19 04:49,2753,461,八号探秘人,八号探秘人,在阅读此文之前，辛苦您点击一下“关注”，既方便您进行讨论和分享，又能给您带来不一样的参与感，感谢您的支持！编辑丨xk他是中国的一名富商，耗费8亿元完成了自己的梦想。可梦想落地成为现实的时候，他却在4年后莫名其妙的死去。他就是张晖，上个世纪末海南岛旅游业的龙头当家人。,https://toutiao.com/group/7427288913095492134/,,0,0,False
男子举报“邻居家有车有房吃低保” 纪委调查：该家庭三人享低保符合条件，不存在违规,2024-12-12 10:59,959,1166,极目新闻,极目新闻,近期，男子苟某飞在网上发帖，举报称其四川巴中老家一邻居家“有车有房吃低保”，质疑邻居骗取国家低保金，认为应该追回低保金，对相关工作人员进行处理。其举报是否属实？事情真相到底如何？红星新闻记者对此进行了走访调查。,http://jms.ctdsb.net/jmythshare/#/index_share?cId=0&contentType=5&contentId=2327514,,0,0,False
香港九龙寨城老照片：曾是香港最邪恶肮脏之地，图9场景令人作呕,2024-11-21 11:32,2325,431,万物知识局,万物知识局,有这么一个地方，他虽然地处极度繁华的都市香港，但是却脏乱不堪，环境极度的恶劣，各种违法的交易都在这里进行，甚至黄赌毒，也在这里悄然滋生，这就是九龙城寨。,https://toutiao.com/group/7439657140518519296/,,0,0,False
“买它才50，电费花1000”，网红取暖神器最近把南方人背刺疯了,2024-12-12 05:54,880,983,Vista看天下,Vista看天下,《梦幻恋人》中男女主自制了电暖沙发。北方的朋友忙着和鼻子干到有血块的干燥天气做对，加湿器哼哧哼哧开了一晚上，室内湿度仍旧没超过30%。,https://toutiao.com/group/7447397926580437513/,,0,0,False
3年前，宁夏7岁小女孩一笑走红，后拒百万签约，如今怎么样了？他们后悔了吗？,2024-09-19 07:25,15425,2062,睿之悦,睿之悦,2021年，视频镜头中出现的女孩儿用那一抹甜美的笑容，迅速引起了网友们的广泛关注。有媒体公司看到这一机遇，提出愿意用百万巨资与女孩儿签约，然而，女孩儿的父母却坚决拒绝了这一提议。,https://toutiao.com/group/7416250139544879679/,,0,0,False
军号一响，全军出击！,2024-09-19 08:01,33975,2064,中国军号,中国军号,,https://toutiao.com/group/7416261401477382668/,,0,0,True
冬天洗澡多久一次最好？这4个时候，劝你不要洗,2024-12-07 10:01,2190,287,环球网,环球网,来源：健康杭州 最近杭城的气温 一天天走低 忙活了一整天，洗个热乎乎的澡 再钻进暖暖的被窝，再舒服不过！ 然而不少人洗澡时 或多或少会犯些错 结果把本该舒服又养人的“养生澡”硬生生洗成了“伤身澡”冬天多久洗一次澡最好？洗澡频率主要取决于个体的需求和偏好。,https://3w.huanqiu.com/a/106d4f/4KYr5sh4XfC?agt=20,,0,0,False
弟弟光荣退伍，姐姐兴奋去车站接他，怎料一见弟弟瞬间哭了,2024-11-05 06:34,33226,3015,乐视天天剧好看,乐视天天剧好看,,https://toutiao.com/group/7433679820573934091/,,0,0,True
国足原主教练李铁案：法院通知将在12月13日一审宣判,2024-12-12 12:53,806,982,经济观察报,经济观察报,经济观察网 记者 李微敖 备受关注的中国国家男子足球队（下称“中国男足”）原主教练、知名足球运动员李铁案，法院已通知其辩护人，该案将在明日，即北京时间2024年12月13日，由湖北省咸宁市中级人民法院公开开庭宣判。此前法庭的开庭审理中，李铁虽表示“认罪悔罪”，但未做“认罪认罚”。,https://toutiao.com/group/7447507503878865408/,,0,0,False
罕见！100年前，英国游客拍下的清朝乡村，和想象中完全不一样,2024-09-20 02:07,8856,771,万物知识局,万物知识局,泥泞的土路，衣不蔽体的老百姓，即便是达官显贵的家中也十分破败，而这些都是清王朝的历史痕迹，虽说那时候中国摄影技术并不发达，但也有许多外国游客来到这里，拍摄下了许多老照片，为我们留下了珍贵的历史资料，那清朝到底是怎样的面貌呢?,https://toutiao.com/group/7416287738871267855/,,0,0,False
给近三年最好10部年代剧排个名：《人世间》仅第6名，第1名没争议,2024-12-07 12:40,1539,321,皮皮电影,皮皮电影,不久前，《小巷人家》完结，虽然高开低走，但依然在水准之上，正午阳光出品，还是有质量保障的。《小巷人家》的热播，也再次唤起观众对年代剧这一类型的关注。年代剧是国剧中的一个重要分支，几乎每年都会出一两部精品，观众可以在年代剧中，感受到岁月流转。,https://toutiao.com/group/7444021041967415818/,,0,0,False
河南警察3岁女儿被拐，苦寻全国23年无果，结果却发现女儿在对门,2024-11-05 07:43,3847,399,八号探秘人,八号探秘人,寻亲23年无果，丢失的女儿竟住在对门?但它却真实发生在河南洛阳的梁绍波身上。是意外走丢，还是人贩子所为，三岁的女儿怎会离奇失踪?,https://toutiao.com/group/7433697108120142345/,,0,0,False
许家印，突传大消息！,2024-12-12 00:38,1677,734,闽南网,闽南网,12月11日，据媒体消息，恒大清盘人安迈已接管许家印名下持有私人飞机的离岸实体公司，并将飞机挂牌出售。,https://toutiao.com/group/7447318099923091995/,,0,0,False
叙利亚变天，谁赢谁输？(上),2024-12-10 03:05,14098,604,静思有我,静思有我,,https://toutiao.com/group/7446614119396704809/,,0,0,True
男人为什么永远喜欢18岁女孩？终于有懂男人的电影了,2024-12-09 09:58,2007,276,越哥说电影,越哥说电影,,https://toutiao.com/group/7446349314937094695/,,0,0,True
新能源车会淘汰燃油车吗？,2024-12-12 10:09,1810,521,韩秀云讲经济,韩秀云讲经济,,https://toutiao.com/group/7447465366185312820/,,0,0,True
遍地开花的俄罗斯商品馆，打着进口旗号卖国货？加盟总部称80%系进口，火腿列巴等产自东北,2024-12-11 00:32,1749,870,看看新闻,看看新闻,遍地开花的俄罗斯商品馆，打着进口旗号卖国货？加盟总部称80%系进口，火腿列巴等产自东北,http://mediaplay.kksmg.com/2024/12/11/h264_720p_600k_78163-smgnews-20241211065500-9000-960313-600k_mp4.mp4,,0,0,True
爸爸半夜12点喊宝宝起床喝奶，刚出生15天的她“句句有回应”,2024-12-12 00:45,1635,321,闪电新闻,闪电新闻,爸爸半夜12点喊宝宝起床喝奶，刚出生15天的她“句句有回应”,https://toutiao.com/group/7447320142621213219/,,0,0,True
车晓谈前夫李兆会：世上除了我妈他最爱我，但他的爱令我无法承受,2024-09-21 06:26,2517,530,八号探秘人,八号探秘人,200辆迎亲车、500桌流水席，价值20万的黄金项链，没什么作品的她成了娱圈人人羡慕的对象。成龙做媒、嫁身价40亿山西最年轻首富，走上人生巅峰的她不料却迅速跌入谷底。,https://toutiao.com/group/7416978879144788530/,,0,0,False
“两头婚”在国内悄然出现，“两头婚”逐渐增多？你能接受吗？,2024-10-16 09:01,1101,1001,读者,读者,你听说过“两头婚”吗？最近这几年，在年轻人中间流行起了一种新型婚姻形式——两头婚。对于他们而言，这种婚姻形式不仅仅是一种全新尝试，更是除了传统婚姻之外的一种完美选择。那么，这种新型的婚姻模式，真的代表了更理想的婚姻选择吗？,https://toutiao.com/group/7426187021527384615/,,0,0,False
泽连斯基命令俄境内乌军死守，他提出停战方案，普京不同意？,2024-12-08 04:00,17386,278,邱毅台湾,邱毅台湾,,https://toutiao.com/group/7445206239379718708/,,0,0,True
小品：杨帆演小沈阳，撒贝宁演赵本山，台词功底太强了吧,2024-11-23 06:13,5409,101,PP宫斗放映厅,PP宫斗放映厅,,https://toutiao.com/group/7440353912709710386/,,0,0,True
土豆搭配洋葱，教你一个神仙吃法，一次3斤不够吃，太解馋了,2024-09-26 09:09,37822,2235,家常的味道,家常的味道,土豆搭配洋葱，教你一个神仙吃法，一次3斤不够吃，太解馋了,https://toutiao.com/group/7418876506660667904/,,0,0,True
女友怀孕了，男友不装了，带她回豪宅！,2024-11-23 08:01,12878,1012,乐视大综艺咖,乐视大综艺咖,,https://toutiao.com/group/7440353629540483593/,,0,0,True
2025年1月起，退休人员医保返款金额将有新调整？返款有380元吗？,2024-12-12 03:01,834,114,社保当家,社保当家,2025年1月起，退休人员医保返款金额将有新调整？返款能有380元吗？退休人员在今年调整了养老金，其中企退人员人均养老金达到了3300元左右，现在随着2025年即将到来，很多人也关心2025年养老金能否继续上涨。同时，也有人问到医保返款金额会不会有新的调整？每月能达到380元吗？,https://toutiao.com/group/7446322258982781476/,,0,0,False
"凤凰记者连线：尹锡悦拒绝提前下台,此次讲话口吻为何会变得强硬?",2024-12-12 02:54,4400,458,凤凰卫视,凤凰卫视,,https://toutiao.com/group/7447353422221443611/,,0,0,True
郭有才：当迷失方向忘记初心后，曾经飘得多高，如今摔得就多惨,2024-11-11 06:53,1713,796,八号探秘人,八号探秘人,在阅读此文之前，辛苦您点击一下“关注”，既方便您进行讨论和分享，又能给您带来不一样的参与感，感谢您的支持！编辑丨brt因为一首翻唱，他一夜之间成为了拥有千万粉丝的网红。但是“人红是非多”，不久他就因为版权等问题陷入了舆论风波。他的人气一落千丈，从万众瞩目变成了现在的无人问津。,https://toutiao.com/group/7435901170239078948/,,0,0,False
美国霸权是世界乱源，拜登卸任前把天下搞大乱，遍地烽火生民涂炭,2024-12-09 06:01,21172,959,邱毅台湾,邱毅台湾,,https://toutiao.com/group/7446288140483953152/,,0,0,True
数额特别巨大，江西万年县委原书记毛奇涉嫌受贿被提起公诉,2024-12-12 08:37,2264,2467,观察者网,观察者网,微信公众号“江西检察”12月12日消息，日前，江西省上饶市万年县委原书记毛奇涉嫌受贿罪一案，由江西省监察委员会调查终结，移送检察机关审查起诉。,https://www.guancha.cn/politics/2024_12_12_758590.shtml,,0,0,False
