title,publish_time,like_count,comment_count,media_name,source,abstract,article_url,tag,is_yaowen,article_sub_type,has_video
独家视频丨习近平同普京会晤：中俄世代友好的深厚情谊不会变 济世为民的大国担当不会变,2024-10-23 05:14,1056,676,央视新闻,央视新闻,当地时间10月22日下午，国家主席习近平在喀山克里姆林宫同俄罗斯总统普京举行会晤。习近平指出，很高兴应普京总统邀请来到俄罗斯古城喀山。大约400年前，联通两国的“万里茶道”正是从喀山经过，将来自中国武夷山地区的茶叶送至俄罗斯千家万户。,https://content-static.cctvnews.cctv.com/snow-book/index.html?item_id=17094987888970998259&source=50006&sub_source=50006_001,,0,0,False
如果马寅初没有提出人口论，没有实施计划生育，如今我国会怎样？,2024-10-10 00:09,1437,897,品古观今,品古观今,普查结果显示，我国总人口为141178万人，而第六次人口普查的结果显示，我国总人口为133972万人。,https://toutiao.com/group/7423249671805600306/,,0,0,False
轮到美国被“垄断”了！“芯片之父”弃美回国，研发成果堪比核武,2024-09-29 06:45,9904,469,博览历史,博览历史,轮到美国被“垄断”了！“芯片之父”弃美回国，研发成果堪比核武,https://toutiao.com/group/7419952498581963290/,,0,0,True
善恶终有报：疫情时对中国一毛不拔，却大方捐美国6亿，如今咋样,2024-09-29 05:50,820,116,睿之悦,睿之悦,可就是这样一位在中国土生土长起来的富豪，在疫情期间面对同胞的困境却一毛不拔，反而大方的捐助了6亿给美国。,https://toutiao.com/group/7419859345154015798/,,0,0,False
她是央视最惨主持人，男友被判死缓，丈夫诈骗入狱，47岁无人敢娶,2024-08-27 23:30,2260,210,闻书识焉,闻书识焉,她曾是央视的台柱子，和董卿、周涛并称为央视的三朵金花。回顾刘芳菲的前半生，最令人感到惋惜的，便是她的感情生活，47岁至今无人敢娶。,https://toutiao.com/group/7407743113688564258/,,0,0,False
青岛中院悬赏最高990万元，征集西王集团董事长王勇等人财产线索,2024-10-23 00:20,1155,809,澎湃新闻,澎湃新闻,山东省青岛市中级人民法院悬 赏 通 告（2024）鲁02执383号被执行人：西王国际贸易（青岛）有限公司，住所地：山东省青岛市市北区敦化路138号3801室。法定代表人：王伟，董事长兼经理。被执行人：西王集团有限公司，住所地：山东省邹平市西王工业园。法定代表人：王勇，董事长。,https://m.thepaper.cn/newsDetail_forward_29117849?from=toutiao,,0,0,False
写歌30年穷困潦倒，前妻失望选择离婚，谁料51岁靠一首歌一夜成名,2024-08-12 03:37,26143,4330,八号探秘人,八号探秘人,在阅读此文之前，辛苦您点击一下“关注”，既方便您进行讨论和分享，又能给您带来不一样的参与感，感谢您的支持！编辑：LY无数人都想要一个一夜成名的机会，但机会来了也不是每个人都能把握住的。他用了三十年的时间来准备迎接属于自己的机会。为了这个机会他放弃了一切，甚至包括家庭。,https://toutiao.com/group/7402090890367484428/,,0,0,False
军号一响，全军出击！,2024-09-19 08:01,23224,1503,中国军号,中国军号,,https://toutiao.com/group/7416261401477382668/,,0,0,True
华为研发中心3万多名研发人员一年内搬迁！所在乡镇两室一厅租金从2000多元/月涨到4000多元/月,2024-10-23 00:41,608,484,大河报,大河报,10月14日，华为全球最大研发中心正式迎来首批进驻员工，3万多名研发人员将在一年内从浦东分批搬迁到青浦练秋湖。,https://toutiao.com/group/7428763190089105961/,,0,0,False
给近三年最好的10部年代剧排个名：《人世间》第6，第1名没有争议,2024-09-06 08:08,7396,2514,皮皮电影,皮皮电影,时尚是个轮回，电视剧也是。在2020年之前的那些年，电视剧市场基本上都被偶像剧、都市剧霸占。曾经撑起国剧品质的《闯关东》《岁月》这类年代好剧，难见踪影。,https://toutiao.com/group/7411390030722712090/,,0,0,False
东北雨姐又摊上大事了，背后吸血全红婵，涉及金额可能上亿,2024-10-22 10:19,442,169,八号探秘人,八号探秘人,东北雨姐最近的日子可谓是一天比一天难过，前一阵子刚因为红薯粉条事件受到处罚，紧接着就被相关部门盯上并开始对她全面调查。,https://toutiao.com/group/7428425247675679241/,,0,0,False
3年前，宁夏7岁小女孩一笑走红，后拒百万签约，如今怎么样了？他们后悔了吗？,2024-09-19 07:25,4838,802,睿之悦,睿之悦,2021年，视频镜头中出现的女孩儿用那一抹甜美的笑容，迅速引起了网友们的广泛关注。有媒体公司看到这一机遇，提出愿意用百万巨资与女孩儿签约，然而，女孩儿的父母却坚决拒绝了这一提议。,https://toutiao.com/group/7416250139544879679/,,0,0,False
有人冒充我男朋友，算不算诈骗？遇到奇葩事你会怎么办？,2024-09-06 05:52,1719,225,兴凯湖莹莹,兴凯湖莹莹,,https://toutiao.com/group/7411404025502892554/,,0,0,True
"轮到美被""垄断""了！""芯片之父""弃美回国，中国或摆脱美国芯片垄断",2024-09-26 09:43,4442,554,何止电影,何止电影,1997年，芯片科研人员邓中翰，在美国硅谷创建半导体公司，不到三年时间，市场价值超1.5亿美元。在加州大学130多年的历史上，他是第一个在同一时间，获得三个学位的人，并且是在短短4年内，主修完全部课程。,https://toutiao.com/group/7418882995802653203/,,0,0,False
全红婵怎么到哪里都是搞笑女啊，要被这个视频笑死了,2024-10-17 10:29,10194,1156,心不灵手不巧,心不灵手不巧,,https://toutiao.com/group/7426689703346176539/,,0,0,True
"国家要“动真格”?催三胎不成,专家出“好主意”,你赞成吗?",2024-08-04 00:25,32103,6532,科普熊,科普熊,与之相对的则是年轻人生育率的持续下滑，新生儿数量更是屡创新低，这使得我国对于计划生育政策进行频繁调整，二胎、三胎政策更是先后出台。,https://toutiao.com/group/7398948488773517863/,,0,0,False
55岁乒乓奥运冠军乔红近况：邓亚萍队友，50岁结婚，已老到认不出,2024-08-02 10:57,3748,692,豆莱说,豆莱说,写作不易，希望各位观众老爷理解，每天作者写作超过12小时，收益只有50多块，文中加入5秒广告解锁，就是能为了多几块收益，观看后可免费阅读全文。文：豆莱说编辑：豆莱说乒乓是我国之骄傲，而我国优秀的乒乓球员更是数不胜数。,https://toutiao.com/group/7398484272216130087/,,0,0,False
形势又变，如果哈里斯输给特朗普，美国会出现政治暴乱吗？,2024-10-18 09:51,12754,627,金灿荣教授,金灿荣教授,,https://toutiao.com/group/7427050982569148937/,,0,0,True
法国男子在中国待了一天，便破口大骂：中国人是有病吗？再不来了,2024-10-09 06:46,825,113,客观听書,客观听書,如今的我国所开放144小时免签政策已经有一段时间了，不少外国游客都来到我国进行旅游。那么法国旅游博主皮埃尔到底经历了什么?,https://toutiao.com/group/7423660359006945827/,,0,0,False
美商务部拟部分撤销中国光伏电池的反倾销税和反补贴税,2024-10-23 05:40,1137,687,财联社,财联社,【美商务部拟部分撤销中国光伏电池的反倾销税和反补贴税】财联社10月23日电，据美国联邦官方网站消息，美国商务部10月21日起启动变更情况审查(CCR)，考虑部分撤销中国晶体硅光伏电池的反倾销税和反补贴税（AD/CVD），并邀请相关各方发表意见，所涉产品为某些小型、低瓦数、离网晶硅,https://www.cls.cn/depth/1834451,,0,0,False
我国首个 自主可控！华为原生鸿蒙操作系统正式发布,2024-10-22 11:20,14302,12876,央视新闻,央视新闻,10月22日，我国首个国产移动操作系统——华为原生鸿蒙操作系统正式发布，这也是继苹果iOS和安卓系统后，全球第三大移动操作系统。据介绍，此前已经发布过的鸿蒙系统，由于系统底座仍使用了部分AOSP开放源代码，而不得不兼容部分安卓应用软件。,https://content-static.cctvnews.cctv.com/snow-book/index.html?item_id=11466430787627949687&source=50006&sub_source=50006_001,,0,1,False
