title,publish_time,like_count,comment_count,media_name,source,abstract,article_url,tag,is_yaowen,article_sub_type,has_video
一见·这两次与企业家交流，有一些相同的关键词,2025-03-30 23:26,1832,786,人民日报,人民日报,2月17日，在京出席民营企业座谈会；3月28日，在京会见国际工商界代表。春日的北京，习近平总书记这两次与企业家交流，凝聚共识、传递信心，思虑的都是中国式现代化建设全局。,https://www.peopleapp.com/column/30048662053-500006173697?utm_source=tth&promote=true,,0,1,False
女子10米跳水！10分！10分！全红婵最疯狂一跳，不可思议的得分,2025-03-31 23:04,6934,882,昭昭如愿,昭昭如愿,,https://toutiao.com/group/7488113420005425714/,,0,0,True
抹黑没用！这就是中国！外国夫妇天安门看升旗仪式当场感动到哭泣,2025-03-31 20:51,2666,178,平平淡淡,平平淡淡,🇨🇳抹黑没用这就是中国，外国夫妇天安门看升旗仪式当场吓哭,https://toutiao.com/group/7487939910909903395/,,0,0,True
估计以后全世界没人超越她了，她将是中国历史上跳水第一人了！,2025-03-28 11:29,13529,1664,上进小鱼x,上进小鱼x,,https://toutiao.com/group/7486820950320529947/,,0,0,True
全红婵居然炸出2米高大水花！最后竟然逆袭夺冠！ (1),2025-02-06 01:28,1465,191,记录美好生活,记录美好生活,,https://toutiao.com/group/7462217690955088403/,,0,0,True
