title,publish_time,like_count,comment_count,media_name,source,abstract,article_url,tag,is_yaowen,article_sub_type,has_video
个人观点：新能源汽车的内幕，我也不知道说得对不对,2025-02-11 09:59,40180,11832,趣闻微生活,趣闻微生活,,https://toutiao.com/group/7470098975493046811/,,0,0,True
河南南阳:楼上男子扔烟头，楼下炮摊被引爆,2025-02-11 06:27,24245,10281,五月天影视,五月天影视,,https://toutiao.com/group/7470044141720846848/,,0,0,True
大姐戴祖母绿手镯寻找身世之谜，倪萍：你这镯子能买整栋楼,2025-01-21 01:49,6603,331,明星爆料站,明星爆料站,,https://toutiao.com/group/7462179951463137811/,,0,0,True
小姑子30岁不嫁人，天天就喜欢和哥哥腻在一起，嫂子忍无可忍爆发,2025-01-23 02:38,7380,1469,影视随意看,影视随意看,,https://toutiao.com/group/7462934734751007284/,,0,0,True
盘点监控下一幕，美女下楼梯的姿势太逗了！,2025-01-21 10:12,1883,227,悟空爱搞笑,悟空爱搞笑,,https://toutiao.com/group/7462309492445676032/,,0,0,True
大漠苍狼：农村姑娘收留乞丐，下秒乞丐洗干净了，姑娘心里乐开花,2025-01-11 07:55,5688,1150,热剧聚宝盆,热剧聚宝盆,大漠苍狼：农村姑娘收留乞丐，下秒乞丐洗干净了，姑娘心里乐开了花,https://toutiao.com/group/7458563417540919835/,,0,0,True
女子得知前夫现在年薪30万，随后赶回家中要求与前夫复婚,2025-02-11 01:28,698,677,日照日报,日照日报,,https://toutiao.com/group/7469967181837599241/,,0,0,True
倪萍心脏要做搭桥，让儿子给凑100万，儿子：要搭个立交桥,2025-01-22 16:26,13349,269,PP千里江湖剧院,PP千里江湖剧院,,https://toutiao.com/group/7461941091638493723/,,0,0,True
石破茂访美，日本的妥协与美国的“战略布局”,2025-02-09 03:46,19535,156,卢克文工作室,卢克文工作室,,https://toutiao.com/group/7469260650464723510/,,0,0,True
