title,publish_time,like_count,comment_count,media_name,source,abstract,article_url,tag,is_yaowen,article_sub_type,has_video
大金砖合作引领全球南方大团结,2024-10-26 23:50,814,306,新华网,新华网,金秋十月，习近平主席飞赴伏尔加河畔千年古城喀山，出席金砖国家领导人第十六次会晤。多国人士普遍认为此访成果丰硕、亮点纷呈，谱写了金砖国家团结自强新篇章，开辟了全球南方发展繁荣新前景，中国再次发挥了作为金砖合作中坚力量、全球南方核心成员的重要作用。,http://my-h5news.app.xinhuanet.com/h5/article.html?articleId=a569ba79f388ff520d85011cf705a737,,0,0,False
罕见！100年前，英国游客拍下的清朝乡村，和想象中完全不一样,2024-09-20 02:07,3308,430,万物知识局,万物知识局,泥泞的土路，衣不蔽体的老百姓，即便是达官显贵的家中也十分破败，而这些都是清王朝的历史痕迹，虽说那时候中国摄影技术并不发达，但也有许多外国游客来到这里，拍摄下了许多老照片，为我们留下了珍贵的历史资料，那清朝到底是怎样的面貌呢?,https://toutiao.com/group/7416287738871267855/,,0,0,False
养不起了？迫于财政压力：教师、医生、公务员，哪个应该先精简？,2024-10-24 13:46,388,332,陈志华观天下,陈志华观天下,"在这个瞬息万变的时代，曾经被视为""铁饭碗""的公务员、教师和医生这三个职业，也将面临着被裁员的风险。如果真到了财政压力吃紧的那时候，这几个铁饭碗，哪个应该先精简呢？我们来看公务员这一群体，他们是政策的制定者和执行者，是连接政府与民众的纽带，在维护社会稳定、推动政府运作方面不可或缺。",https://toutiao.com/group/7429331593669509659/,,0,0,False
阿斯麦向美国承诺：只要解放军攻台，立刻远程瘫痪台积电光刻机,2024-10-25 14:34,6317,2415,司马南,司马南,偶然看到一则信息，阿斯麦公司向美国作出保证，如果中国人民解放军攻打台湾地区，他们便立刻远程瘫痪台积电的光刻机。,https://toutiao.com/group/7429718340911858195/,,0,0,False
王楚钦，拟聘用公示,2024-10-28 03:49,497,482,潇湘晨报,潇湘晨报,北京市体育局官网10月28日公开信息显示，根据《北京市事业单位公开招聘工作人员实施方案》，通过报名、资格审查、专项能力测试、体检、考察等程序，经学校党委会研究决定，拟聘用以下人员为北京市先农坛体育运动技术学校运动员。其中，奥运冠军王楚钦拟聘用至乒乓球队运动员岗。,http://api.chenshipin.com/wap/a/671f053784201701df007fe6/90f456b81afce808c1fcfbd3f5761f65/1730086454/202449c1d7585195cf93ae29e4778f90ca8df9db2197dc6e0c87d957fc3b982d,,0,0,False
全球唯一8缸摩托车在中国诞生，售价21.88万起，研发投入超10亿,2024-10-27 10:04,3265,1789,封面新闻,封面新闻,量产大排量摩托车价格被打下来了？宝马、本田六缸摩托车型售价30-40万元，而10月26日，长城灵魂首款旅行车S2000，搭载“全球唯一”的水平对置8缸发动机，起售价仅为21.88万元。长城汽车董事长魏建军表示：“长城灵魂首款旅行车研发投入巨大，超过了10亿元。,https://m.thecover.cn/news_details.html?from=web&eid=BKM/%2BUv8qViH90qSdq8Jkw==,,0,0,False
370架战机来势汹汹，27国不许改变台海现状，大陆发出统一最强音,2024-10-28 01:58,1861,1228,全荃,全荃,370架战机来势汹汹，美日举行最大规模联合军演。台海局势持续升级之际，欧洲议会通过涉台决议，不许改变台海现状。,https://toutiao.com/group/7430639907315073570/,,0,0,False
民间上坟传统：“上坟不带 5 果，家中不惹灾祸”，哪“5果”？,2024-08-08 10:30,17499,1709,惠农圈,惠农圈,在中国传统文化中，祭祀祖先一直是一项备受重视的活动，它承载着对先人的缅怀、敬意和感恩之情。在上坟的时候，人们会提前准备好供品，比如肉类、酒水，还有水果。其中关于水果的准备，也有着诸多的讲究和禁忌，比如“上坟不带 5 果，家中不惹灾祸”的说法。,https://toutiao.com/group/7400584207141192207/,,0,0,False
给近三年最好的10部年代剧排个名：《人世间》第6，第1名没有争议,2024-09-06 08:08,8864,2954,皮皮电影,皮皮电影,时尚是个轮回，电视剧也是。在2020年之前的那些年，电视剧市场基本上都被偶像剧、都市剧霸占。曾经撑起国剧品质的《闯关东》《岁月》这类年代好剧，难见踪影。,https://toutiao.com/group/7411390030722712090/,,0,0,False
华盛顿传来消息，第6轮谈判失败，美国提的要求，中方1个都没答应,2024-10-27 02:28,3736,993,吴学兰,吴学兰,中美经济工作组在华盛顿举行第六次会议，最终结果显示谈判失败。这次美方提出的无理要求，中国一个都没有答应。,https://toutiao.com/group/7430276236557713974/,,0,0,False
青岛中院悬赏最高990万元，征集西王集团董事长王勇等人财产线索,2024-10-23 00:20,3777,1971,澎湃新闻,澎湃新闻,山东省青岛市中级人民法院悬 赏 通 告（2024）鲁02执383号被执行人：西王国际贸易（青岛）有限公司，住所地：山东省青岛市市北区敦化路138号3801室。法定代表人：王伟，董事长兼经理。被执行人：西王集团有限公司，住所地：山东省邹平市西王工业园。法定代表人：王勇，董事长。,https://m.thepaper.cn/newsDetail_forward_29117849?from=toutiao,,0,0,False
写歌30年穷困潦倒，前妻失望选择离婚，谁料51岁靠一首歌一夜成名,2024-08-12 03:37,26189,4336,八号探秘人,八号探秘人,在阅读此文之前，辛苦您点击一下“关注”，既方便您进行讨论和分享，又能给您带来不一样的参与感，感谢您的支持！编辑：LY无数人都想要一个一夜成名的机会，但机会来了也不是每个人都能把握住的。他用了三十年的时间来准备迎接属于自己的机会。为了这个机会他放弃了一切，甚至包括家庭。,https://toutiao.com/group/7402090890367484428/,,0,0,False
15年前他在爱妻葬礼上哭到昏厥，发誓永不再娶，如今他做到了吗？,2024-08-24 02:17,17613,561,八号探秘人,八号探秘人,在阅读此文之前，辛苦您点击一下“关注”，既方便您进行讨论和分享，又能给您带来不一样的参与感，感谢您的支持！编辑丨xk纵观鱼龙混杂的娱乐圈，有人背叛，有人痴情。而果靖霖则是公认的好男儿，将一生都奉献给妻子。但妻子却仅仅陪他走了半生，没能战胜病魔，不幸离开人世。,https://toutiao.com/group/7406210316734710283/,,0,0,False
芬兰提议废除中国一票否决权，我们还没说什么，美国率先不同意？,2024-10-25 04:34,5223,4886,军武次位面,军武次位面,前不久，芬兰总统亚历山大·斯图布突然如“中邪”一般，在联合国发表了一通“高论”。第二，由于中国的常任理事国待遇导致中国国际权力过大，建议取消中国的一票否决权。,https://toutiao.com/group/7429564478041162255/,,0,0,False
喝个水也交税？财政部下通知，12月水税全国推广，事关每一个人！,2024-10-28 03:02,617,644,赫薰辞,赫薰辞,就在最近，国家三部门联合发布《水资源税改革试点实施办法》，从12月1日起，要在全国推进水资源税改革。,https://toutiao.com/group/7430640175594471963/,,0,0,False
她是央视最惨主持人，男友被判死缓，丈夫诈骗入狱，47岁无人敢娶,2024-08-27 23:30,2266,210,闻书识焉,闻书识焉,她曾是央视的台柱子，和董卿、周涛并称为央视的三朵金花。回顾刘芳菲的前半生，最令人感到惋惜的，便是她的感情生活，47岁至今无人敢娶。,https://toutiao.com/group/7407743113688564258/,,0,0,False
“已发出最后警告” 朝鲜发布韩无人机渗透事件最终侦察结果,2024-10-27 22:44,6431,5627,央视新闻,央视新闻,10月27日，朝鲜国防省发言人发布了韩国无人机渗透进入平壤事件的最终侦察结果，结果验证了在朝鲜首都圈领域被发现的由韩国放飞的无人机起飞地点、入侵渠道和渗透目的。,https://content-static.cctvnews.cctv.com/snow-book/index.html?item_id=3184307256912356358&source=50006&sub_source=50006_001,,0,1,False
善恶终有报：疫情时对中国一毛不拔，却大方捐美国6亿，如今咋样,2024-09-29 05:50,911,125,睿之悦,睿之悦,可就是这样一位在中国土生土长起来的富豪，在疫情期间面对同胞的困境却一毛不拔，反而大方的捐助了6亿给美国。,https://toutiao.com/group/7419859345154015798/,,0,0,False
美国输定了，人狂必有灾！4个原因“葬身”乌克兰，中国很关键,2024-10-27 23:00,1219,183,国际新时讯,国际新时讯,美国输定了，两场冲突都出现了至关重要的转折点，以色列现在是弹尽粮绝，防空系统近乎瘫痪，虽然美国同意把萨德给以色列，但是四面楚歌七方受敌的内塔尼亚胡，恐怕要是两拳难敌“七手”啊。,https://toutiao.com/group/7429175996165423667/,,0,0,False
广东一周新增2029例，不见面也能传染，没特效药也没疫苗,2024-10-28 02:13,246,123,每日经济新闻,每日经济新闻,据广东疾控最新披露，2024年第42周，全省新增报告2029例登革热病例。截至目前，2024年未报告死亡病例。,http://www.nbd.com.cn/rss/jinri_toutiao/articles/3611120.html,,0,0,False
她是第一位博士级歌唱家，12次荣登春晚，丈夫的身份更是深藏不露,2024-08-10 11:05,15247,447,豆莱说,豆莱说,文：豆莱说编辑：豆莱说支持作者，写作不易，文中会有5s广告，观看后可免费阅读全文在当下华语乐坛中，有很多的出色的歌唱家，雷佳就是其中一位。因为她不仅是我国首个荣获了博士学位的歌唱家，更是出道20年就12次登上了春晚舞台的歌唱家。而且，她丈夫的身份也是不容小觑。,https://toutiao.com/group/7401461240674943542/,,0,0,False
中国手机新三巨头诞生!华为升至第二 第一太稳了,2024-10-28 03:40,453,330,华商网,华商网,10月28日消息，据Counterpoint Research最新研报，2024年Q3中国智能手机销量同比增长2.3%，连续四个季度实现同比正增，市场有望实现五年来首次年增长。这也进一步确认了2024年市场回暖趋势，全年有望实现同比低个位数增长，提升了行业信心。,https://digi.hsw.cn/system/2024/1028/171909.shtml,,0,0,False
3年前，宁夏7岁小女孩一笑走红，后拒百万签约，如今怎么样了？他们后悔了吗？,2024-09-19 07:25,6214,971,睿之悦,睿之悦,2021年，视频镜头中出现的女孩儿用那一抹甜美的笑容，迅速引起了网友们的广泛关注。有媒体公司看到这一机遇，提出愿意用百万巨资与女孩儿签约，然而，女孩儿的父母却坚决拒绝了这一提议。,https://toutiao.com/group/7416250139544879679/,,0,0,False
今天才知道！电动车“每天充”和“用完再充”，到底哪个更伤电池,2024-08-27 11:19,13962,2274,鲸探所,鲸探所,“今天到底给车充不充电？”估计大多数人每天回家都会想这个问题，看着自己的电动车电量又多又少的，充不充电也是一件非常难以抉择的事情。那么，电动车到底应该怎样充电呢？是每天都充，还是用完之后再充呢？电动车充电不管是在城市还是农村，电动车其实都是人们出门最常见的交通工具。,https://toutiao.com/group/7407773012533117475/,,0,0,False
缺人！月薪可达3万元，这个行业爆火，缺口达100万人！网友：现在学还来得及吗？,2024-10-27 04:43,976,473,每日经济新闻,每日经济新闻,近期，多地秋季招聘正式启动，许多毕业生正为找工作奔忙，部分行业也在紧急招人中。这不，随着低空经济的发展，无人机广泛应用于农业、公安、测绘、交通等多个领域，这也让各行各业对无人机操控员的需求量明显增大。,http://www.nbd.com.cn/rss/jinri_toutiao/articles/3609794.html,,0,0,False
