title,publish_time,like_count,comment_count,media_name,source,abstract,article_url,tag,is_yaowen,article_sub_type,has_video
时习之 微视频丨“和”字里的大国外交,2024-11-29 13:15,2300,1088,人民网,人民网,2014年11月28日，习近平在中央外事工作会议上发表重要讲话强调，中国必须有自己特色的大国外交。我们要在总结实践经验的基础上，丰富和发展对外工作理念，使我国对外工作有鲜明的中国特色、中国风格、中国气派。10年间，习近平以大国领袖的襟怀气度，同各方共话友好合作、共商天下大计。,https://toutiao.com/group/7442688916777337371/,,0,0,False
黎智英香港出庭抖内幕，美国介入，蔡英文参与，还有赵少康金小刀,2024-11-27 09:24,33197,2135,邱毅台湾,邱毅台湾,,https://toutiao.com/group/7441887559757595190/,,0,0,True
红房子：这段堪称最精彩，范伟和李小璐演技炸裂，百看不厌！,2024-11-11 02:36,1713,189,南瓜热剧回放,南瓜热剧回放,红房子：这段堪称最精彩，范伟和李小璐演技炸裂，百看不厌！,https://toutiao.com/group/7435845105006674458/,,0,0,True
普京报复来了，比榛树还厉害！关闭发射场领空，乌又能挺多久？,2024-11-29 07:53,3160,178,李艺鹏观点,李艺鹏观点,,https://toutiao.com/group/7442606166846210599/,,0,0,True
体感温度-30度的一天，生活在内蒙牧区的，我们是怎么度过的,2024-11-26 11:28,7375,1109,河南姑娘远嫁在内蒙,河南姑娘远嫁在内蒙,,https://toutiao.com/group/7441548328887648819/,,0,0,True
5位劣迹艺人复出失败，演出被取消，全部遭到抵制，评论区翻车,2024-11-27 08:50,540,242,青衫书生,青衫书生,娱乐圈，表面上看起来很风光，其实私下并没有大家想的这么简单。近年来，“偶像塌房”事件层出不穷，曾经被万千粉丝追捧的明星，因为各种劣迹行为一夜之间跌落神坛。明星们的“翻车”新闻真是千奇百怪，从学术不端到逃税，从道德沦丧到违法乱纪。,https://toutiao.com/group/7441874656878920192/,,0,0,False
河南警察3岁女儿被拐，苦寻全国23年无果，结果却发现女儿在对门,2024-11-05 07:43,1840,158,八号探秘人,八号探秘人,寻亲23年无果，丢失的女儿竟住在对门?但它却真实发生在河南洛阳的梁绍波身上。是意外走丢，还是人贩子所为，三岁的女儿怎会离奇失踪?,https://toutiao.com/group/7433697108120142345/,,0,0,False
警惕“先用后付”小心欠下账单～（央视频号：光华路资讯）,2024-11-27 12:44,14814,4945,央视频,央视频,,https://toutiao.com/group/7441939150552433179/,,0,0,True
【崔哥天天侃11/29】默克尔出书爆料，是她把普京给骗了,2024-11-28 23:08,10588,622,北美崔哥,北美崔哥,,https://toutiao.com/group/7442470886336102946/,,0,0,True
67岁执意生娃，如今却坐轮椅无法自理，5岁的天赐被迫独立学洗衣,2024-11-04 10:32,6767,1575,睿之悦,睿之悦,2019年，已经67岁的田新菊执意生下了自己的第三个孩子小天赐。那么，现如今5年的时间过去了，这“天赐”的礼物到底是福还是祸呢?,https://toutiao.com/group/7433367394946384435/,,0,0,False
母亲瘫痪、父亲疯了，当年那个744分的高考状元，7年后却成了这样,2024-09-08 00:54,12495,1842,八号探秘人,八号探秘人,母亲截肢瘫痪、父亲疯癫痴傻，可对于自己的亲人，他却做出了这样的评价。而今，7年已过，曾经那个让无数人动容的少年，现在如何?,https://toutiao.com/group/7411852147648496162/,,0,0,False
刚从中国返俄，苏-57飞行员传来新消息,2024-11-25 10:15,7689,251,环球时报新媒体,环球时报新媒体,刚从中国返俄，苏-57飞行员传来新消息,https://toutiao.com/group/7441158524530328127/,,0,0,True
弟弟光荣退伍，姐姐兴奋去车站接他，怎料一见弟弟瞬间哭了,2024-11-05 06:34,27774,2810,乐视天天剧好看,乐视天天剧好看,,https://toutiao.com/group/7433679820573934091/,,0,0,True
1米3袖珍美女嫁给1米48男孩，婚后丈夫奇迹长高，两人却不欢而散,2024-09-07 02:55,6539,346,睿之悦,睿之悦,杨萍和葛存苗的婚礼 文|睿之悦 编辑|睿之悦2019年，成都的民政局来了两个“10岁小孩”来登记，工作人员以为是玩闹。两个“小孩”拿出身份证让工作人员看，这才明白，原来是两个再也长不高的成年袖珍人情侣。,https://toutiao.com/group/7411713833267364386/,,0,0,False
郭有才：当迷失方向忘记初心后，曾经飘得多高，如今摔得就多惨,2024-11-11 06:53,1272,623,八号探秘人,八号探秘人,在阅读此文之前，辛苦您点击一下“关注”，既方便您进行讨论和分享，又能给您带来不一样的参与感，感谢您的支持！编辑丨brt因为一首翻唱，他一夜之间成为了拥有千万粉丝的网红。但是“人红是非多”，不久他就因为版权等问题陷入了舆论风波。他的人气一落千丈，从万众瞩目变成了现在的无人问津。,https://toutiao.com/group/7435901170239078948/,,0,0,False
罕见！100年前，英国游客拍下的清朝乡村，和想象中完全不一样,2024-09-20 02:07,7941,723,万物知识局,万物知识局,泥泞的土路，衣不蔽体的老百姓，即便是达官显贵的家中也十分破败，而这些都是清王朝的历史痕迹，虽说那时候中国摄影技术并不发达，但也有许多外国游客来到这里，拍摄下了许多老照片，为我们留下了珍贵的历史资料，那清朝到底是怎样的面貌呢?,https://toutiao.com/group/7416287738871267855/,,0,0,False
除了禁用挡风被，12月起，电动车、三轮车上路迎来“5禁”新规,2024-11-23 01:01,242,121,新能源战略家,新能源战略家,2024年，关于电动车的各项管理政策以及专项整治贯穿全年，临近年底，各地交通管理部门针对电动车、摩托车以及三轮车的管理力度还在不断加强。,https://toutiao.com/group/7440273108730118708/,,0,0,False
1985年，一场误判让中国付出上万亿的代价，一代巨星抱憾而终,2024-09-19 06:30,7555,1281,艾弥儿,艾弥儿,声明：真实人物故事，文末附权威资料来源“自产飞机被叫停，随后更是亏损上万亿。”建国之后，我国各行各业都在飞速发展，包括航空事业。1985年，已经成功研制出运-10客机的马凤山，正满怀期待地等着国家拿出资金，将这种客机进行量产。可随之而来的消息，让他感觉天都塌了——必须停产。,https://toutiao.com/group/7416190075974844965/,,0,0,False
真没想到，把啤酒倒进鸡蛋里面，出锅瞬间变美食，简直太香了,2024-09-08 07:08,2285,129,家常的味道,家常的味道,,https://toutiao.com/group/7412165709003751990/,,0,0,True
马龙访台，台湾人热烈欢迎，台独焦虑不安视为大敌使出妖魔化老招,2024-11-29 09:56,10981,284,邱毅台湾,邱毅台湾,,https://toutiao.com/group/7442637867307762230/,,0,0,True
载人登月真的要来了！央视官宣，用上了美国都没有的技术,2024-11-24 12:20,534,150,兵器展望,兵器展望,这部宣传片中，不仅介绍了中国追求在2030年前实现载人登月的大胆计划，还展示了一些令人兴奋的技术突破和设备进展。,https://toutiao.com/group/7439652758729114112/,,0,0,False
花80元买彩票，爆2.25亿巨奖！深圳男子一夜暴富！网友：做梦都不敢想,2024-11-29 12:10,319,586,潇湘晨报•晨视频,潇湘晨报•晨视频,最新消息，深圳一彩民中40注一等奖，爆2.25亿元巨奖！11月28日晚，中国福利彩票双色球游戏第2024137期开奖。,http://api.chenshipin.com/wap/a/6749ada784201777416e70f1/90f456b81afce808c1fcfbd3f5761f65/1732882111/021247e7cb7ba0adb90bd484072f08cc61eea455fafe886555c9ab4dad229218,,0,0,False
俄乌升级、黎以停战，美国想干啥？拜登为儿子不会对特朗普下狠手,2024-11-28 22:01,4787,124,黎建南台湾,黎建南台湾,,https://toutiao.com/group/7442453599042404879/,,0,0,True
三舰岛平直甲板，中国试验“奇特航母”，或改变未来海战格局,2024-11-29 08:39,4546,211,杜文龙,杜文龙,,https://toutiao.com/group/7442618152862614068/,,0,0,True
中北大学推出巡飞枪，枪身弹药创新设计，后坐力小射击精度更高,2024-11-28 09:54,12111,932,杜文龙,杜文龙,,https://toutiao.com/group/7442266246671761932/,,0,0,True
2元一斤和20元一斤的大米，有什么区别？真的越贵越好？,2024-11-25 08:13,789,223,人民日报,人民日报,不管是红烧肉这样的硬菜，还是清炒时蔬、西红柿鸡蛋这样的小清新，都得搭配上一碗香喷喷的米饭，那才叫完美。,https://www.peopleapp.com/column/30047476348-500005947193?utm_source=头条号&promote=true,,0,1,False
从“抛弃”到“香饽饽”，发展迅猛！我国可持续航空燃料产量潜力大,2024-11-24 07:01,1648,131,国际在线,国际在线,,https://crionline-media.cri.cn/cb5a6d96-d0c4-4fd0-a895-b6135667d84a/video/bffc92277d6b4ff5aff857474a3d4437.mp4,,0,0,True
基本养老金将在2035年耗尽？社保专家回应,2024-11-28 08:17,690,800,大河报,大河报,界面新闻记者 | 苗艺伟界面新闻编辑 | 江怡曼近年来，多家相关机构曾经发布报告，称我国基本养老金将要在2029年或者2035年耗尽累计结余。因此，80、90后很可能成为无养老金可领的一代。然而，上述说法却遭到了社保养老金专家金维刚的坚决否认。,https://toutiao.com/group/7442241302269411879/,,0,0,False
女友怀孕了，男友不装了，带她回豪宅！,2024-11-23 08:01,7431,641,乐视大综艺咖,乐视大综艺咖,,https://toutiao.com/group/7440353629540483593/,,0,0,True
一天内70多起！小米汽车陷自动泊车故障风波 小米客服回应：系系统故障 将承担所有维修费用,2024-11-23 00:02,1823,1320,看看新闻,看看新闻,一天内70多起！小米汽车陷自动泊车故障风波 小米客服回应：系系统故障 将承担所有维修费用,http://mediaplay.kksmg.com/2024/11/23/h264_720p_600k_77165-smgnews-20241123065500-9000-947911-600k_mp4.mp4,,0,0,True
日本品牌优衣库创始人 柳井正明确表示不用新疆棉 中国门店数量甚至超过日本 目前其官方账号已开评论精选,2024-11-29 06:11,966,3686,闪电新闻,闪电新闻,11月29日（发布时间），日本品牌优衣库(UNIQLO)创始人柳井正在接受媒体采访时明确表示，优衣库不使用中国新疆地区的棉花。尽管中国是优衣库的重要市场，门店数量甚至超过了日本。目前，优衣库官方账号已开启评论精选。,https://sdxw.iqilu.com/w/article/YS0yMS0xNjA2NjA4Nw.html,,0,0,False
央视曝光！#制假售假“一条龙”！,2024-11-24 12:16,4441,1773,央视财经,央视财经,,https://toutiao.com/group/7440818726712115762/,,0,0,True
全家人爱吃的懒人早餐，5分钟出锅，比包子好吃，比油条还香,2024-11-13 03:50,3077,390,家味美食,家味美食,,https://toutiao.com/group/7436606239527666212/,,0,0,True
