title,publish_time,like_count,comment_count,media_name,source,abstract,article_url,tag,is_yaowen,article_sub_type,has_video
习语丨给梁家河村集资办的小学没了，为什么总书记说“也是好事”？,2025-03-10 23:37,1945,735,人民日报,人民日报,“当年我给梁家河村里还集资办了小学，挺高兴的。”3月6日下午，习近平总书记在看望参加全国政协十四届三次会议的民盟、民进、教育界委员，并参加联组会时提到了一段往事。,https://www.peopleapp.com/column/30048472758-500006136659?utm_source=tth&promote=true,,0,0,False
14年儿子坐马航失联，多年后父亲收到回信，坚信儿子去了平行世界,2025-02-20 02:38,8882,835,谛听骨语,谛听骨语,MH370失联的第10年，马来西亚政府宣布在2024年12月20日重启寻找马航MH370的项目。如果后续进展顺利的话，马航MH370会在2025年的1月到4月期间重新展开全面地搜寻。凭空消失的客机，有希望被揭露的失踪真相，这一切都是让人充满了期待。,https://toutiao.com/group/7473322554179895817/,,0,0,False
春天，这菜使劲吃！一养肝、二护眼、三排毒、四通便，鲜嫩营养高,2025-02-26 11:49,4467,571,秀厨娘,秀厨娘,春风拂过田野，沉睡一冬的泥土里冒出了星星点点的嫩芽。这种带着淡淡清香的野菜，是春天给我们的第一份健康好食材。,https://toutiao.com/group/7475671861737570816/,,0,0,False
坚持每隔两天炖一次，晚上沾床就睡，早上起来精气神十足,2025-02-27 03:31,3618,465,陈皮美食日志,陈皮美食日志,大家好，这里是陈皮的厨房，关注我持续为你输出美食配方。不管你是主动熬夜还是被动熬夜，都请试试这碗莲子百合猪心汤，安神养心，由内润到外。,https://toutiao.com/group/7475929963872190985/,,0,0,False
今明两年打算买房的老百姓，要牢记7字真言：买旧、买大、不买三,2024-12-12 10:31,6225,565,消费快报,消费快报,然而，市场上的房源种类繁多，质量参差不齐，这给购房者带来了不小的挑战。在这样的背景下，“买旧、买大、不买三”的购房建议逐渐受到人们的重视。,https://toutiao.com/group/7447470862556611108/,,0,0,False
许家印第二！又一个“大佬”跑路，花光几百亿，总部一片狼藉,2025-03-05 12:16,6053,1178,天天历史,天天历史,2023年9月10日，沈晖发了条微博，写到“这周出差去了慕尼黑，然后纽约。好事多磨，静待花开。”就在沈晖出国一个月后，威马汽车正式申请了破产，留下的只有一地鸡毛。,https://toutiao.com/group/7478197991749190159/,,0,0,False
