title,publish_time,like_count,comment_count,media_name,source,abstract,article_url,tag,is_yaowen,article_sub_type,has_video
天塌了！12款零添加酱油翻车，知名品牌检出致癌物，你家有吗？,2025-03-20 04:51,4018,778,巷北楠猫,巷北楠猫,信息源:本文陈述所有内容皆有可靠信息来源赘述在文尾。315的后劲真够大，一夜之间，酱油竟然也集体塌房了。市面上多款“零添加”酱油，却检测出了致癌物质。,https://toutiao.com/group/7483711794049991203/,,0,0,False
美俄密谋俄乌停火，欧洲成美俄交易关键变量，法英能否硬刚美俄？,2025-03-20 08:06,6359,224,邱震海,邱震海,,https://toutiao.com/group/7483800145743561216/,,0,0,True
独家记录刘晓庆超前婚恋观丨日本导演镜头下的“中国第一女演员”,2025-03-20 02:00,3138,473,今日头条,今日头条,为了拍摄国民级演员刘晓庆，日本导演竹内亮导演追去了美国，真实跟拍、记录了她一周的行程，还差点成为她的“绯闻男友”。两性关系、婚恋观、自我认知……日本导演与“中国第一女演员”之间的对话碰撞可谓全程高能，他们都具体聊了些什么：面对热搜舆论如何回应？70岁作为新人入局短剧赛道？敬请观看由今日头条独家出品的女性人物微纪录片《她和她的故事》刘晓庆篇。,https://toutiao.com/group/7483411606697738792/,,0,0,True
报应来了！4000亿瞬间蒸发！#李嘉诚 - 今日头条,2025-03-19 12:37,16175,1830,聪明枫叶Ma,聪明枫叶Ma,,https://toutiao.com/group/7483498684077015562/,,0,0,True
屋里一天来4条大蛇，消防员赶到一看，直呼：比中彩票都难,2025-03-19 01:36,7918,1256,英雄影视汇,英雄影视汇,,https://toutiao.com/group/7483328357116150298/,,0,0,True
