title,publish_time,like_count,comment_count,media_name,source,abstract,article_url,tag,is_yaowen,article_sub_type,has_video
相声：张康贾旭明说《三国》，真是俩相声天才，不输德云社！,2025-01-29 21:08,9505,1741,PP爱情放映厅,PP爱情放映厅,,https://toutiao.com/group/7463035074229977600/,,0,0,True
这就是于北辰大将军手下的“强兵”？,2025-02-06 22:00,9438,8176,爱你中国,爱你中国,,https://toutiao.com/group/7468283423220630031/,,0,0,True
杜特尔特一语惊人：菲律宾应该成为中国的一个省 #杜特尔特,2025-02-07 06:43,16838,1987,张斌论评,张斌论评,,https://toutiao.com/group/7468564094862230043/,,0,0,True
特朗普新任命国务次卿说，美国可同意中国大陆接管台湾做利益交换,2025-02-06 04:32,37080,2072,邱毅台湾,邱毅台湾,,https://toutiao.com/group/7468159107111977507/,,0,0,True
有这样的老婆，你家祖坟都冒青烟了！,2025-02-04 03:11,55236,9551,乐观的冰淇淋I,乐观的冰淇淋I,,https://toutiao.com/group/7467226170908606976/,,0,0,True
生活不易，女子街头卖艺！精彩舞蹈，令路人围观纷纷赞绝！,2025-01-25 04:03,45191,9009,自由的麻酱vt,自由的麻酱vt,,https://toutiao.com/group/7463683969616282131/,,0,0,True
小品：牛群老爷子重出江湖，小品演得发人深思！不愧是老牌演员,2025-01-21 07:34,3460,1061,娱圈万事通,娱圈万事通,,https://toutiao.com/group/7462268650310763027/,,0,0,True
50岁袖珍大爷，娶了一个漂亮媳妇，妻子一登场王为念羡慕了,2025-01-21 08:56,11428,1991,笑哈哈,笑哈哈,,https://toutiao.com/group/7462174126573240841/,,0,0,True
大漠苍狼：农村姑娘收留乞丐，下秒乞丐洗干净了，姑娘心里乐开花,2025-01-11 07:55,4955,1043,热剧聚宝盆,热剧聚宝盆,大漠苍狼：农村姑娘收留乞丐，下秒乞丐洗干净了，姑娘心里乐开了花,https://toutiao.com/group/7458563417540919835/,,0,0,True
