title,publish_time,like_count,comment_count,media_name,source,abstract,article_url,tag,is_yaowen,article_sub_type,has_video
一见·抓作风，总书记为什么从这里破题,2025-03-21 00:40,2699,1450,人民日报,人民日报,“八项规定改变中国”，12多年前的徙木立信之举，抑浊扬清、积微成著，一石激起千层浪。总书记亲自谋划确定主题，从三个维度观察此次学习教育的重大意义:是巩固深化主题教育和党纪学习教育成果、纵深推进全面从严治党的重要举措，是密切党群干群关系、巩固党的执政基础的必然要求，是推进中国式现代化的有力保障。,https://www.peopleapp.com/column/30048571218-500006156217?utm_source=tth&promote=true,,0,1,False
跟着总书记，走进古城老街,2025-03-21 01:33,552,157,人民日报,人民日报,跟着总书记，走进古城老街,https://www.peopleapp.com/column/30048572468-500006156410?utm_source=tth&promote=true,,0,1,False
许家印前妻生活细节：半年多时间花费400万美金，与两名未成年子女同住,2025-03-19 09:15,3772,1215,凤凰网财经,凤凰网财经,3月18日，香港高等法院驳回了许家印前妻丁玉梅的两项申请，包括要求闭门聆讯以保护隐私，以及修订资产冻结令以明确其可自由动用的资产范围。,https://finance.ifeng.com/c/8hqw9jGSFjI,,0,0,False
世界上最好用的手机型号！！deepseek说得一点不错，准备换手机！,2025-03-17 05:30,500,640,攒钱的勇敢牛牛,攒钱的勇敢牛牛,建议优先到线下店体验真机手感与系统交互，重点关注屏幕观感、相机响应速度和系统流畅度。若你愿意分享更多使用场景，我可以进一步帮你缩小选择范围!,https://toutiao.com/group/7482597120579617320/,,0,0,False
杨绛：记住，永远不要对任何人透露你的真实情况，你要学会藏两样东西，一样是本事，一样是心事！,2025-02-22 08:55,2464,174,和政发布,和政发布,我们曾如此期盼外界的认可，到最后才知道，世界是自己的，与他人毫无关系。作家杨绛在《走到人生边上》里写过这样一段话:“在这物欲横流的人间，人生一世实在够苦。,https://toutiao.com/group/7473700416828473907/,,0,0,False
原始社会没人性，女人就如同男人的玩物，毫无文明可言,2025-02-27 16:01,12509,233,群星访谈秀,群星访谈秀,,https://toutiao.com/group/7474798582516761125/,,0,0,True
罪域：中央最大老虎被查，没人敢抓捕，书记：后台再硬我亲自去抓,2025-01-14 06:17,25019,832,谍战影视营,谍战影视营,,https://toutiao.com/group/7459651246346043919/,,0,0,True
