title,publish_time,like_count,comment_count,media_name,source,abstract,article_url,tag,is_yaowen,article_sub_type,has_video
52岁张惠妹演唱会穿皮草体重飙升到不敢认 网友:是得罪造型师了吗,2025-03-08 23:26,2337,2053,快乐驿站,快乐驿站,张惠妹也在演唱会上演唱了众多经典歌曲，让歌迷们一次听了个够。可是没想到，虽然舞台不错，可是张惠妹的状态却引发了大家的热议，因为这次出现在大家视野里张惠妹又又又胖了！而且这次胖的太过分了，简直就是让人觉得辣眼睛！除了身材，服装也让观众无法理解。,https://toutiao.com/group/7479573770824204836/,,0,0,False
林徽因到底有多时髦？1936年在陕西留影，皮衣配牛仔裤，帅气逼人,2025-02-27 06:22,3196,738,万物知识局,万物知识局,有人说林徽因就是真正的“宝藏女”，虽说有许多不好的风评，但是当你真正走进林徽因的生活后会发现，她的人生处处都是精彩，只因活得洒脱前卫才在传统年代留下了一些舆论风波。,https://toutiao.com/group/7475560166001115700/,,0,0,False
打通最后200米？武统全面加速，赖清德突破红线，投降都来不及?,2025-03-14 03:54,17295,681,方清的视角,方清的视角,彻底不装了，赖清德公然将大陆定位为境外反对势力，已经突破了红线，关键时刻，解放军的登陆利器曝光，到时候台湾当局投降都来不及。,https://toutiao.com/group/7481507923127058980/,,0,0,False
发现一个奇怪的现象：凡是让老人独自生活，自己忙事业的子女，大多活成了这样……,2025-03-12 09:00,1843,282,读者,读者,两代人的“围城”:住在一起是孝顺，还是枷锁?很多年轻人为了更好的生活，选择了去城市打拼，买房定居、结婚生子。,https://toutiao.com/group/7480751132806087183/,,0,0,False
胡蝶与戴笠的真实彩色照片，胡蝶一颦一笑妩媚多姿，戴笠不怒自威,2025-02-17 10:26,4786,490,浩舞默画,浩舞默画,只看照片，就连其美的三分之一，也感知不到。胡蝶出生时并不知道她会成为当红的明星，每一个孩子初次来到这个人间时，发出第一个声音，永远是啼哭，似乎来到这个人间并非是一件幸运的事情。,https://toutiao.com/group/7472271893941207563/,,0,0,False
14年儿子坐马航失联，多年后父亲收到回信，坚信儿子去了平行世界,2025-02-20 02:38,10270,1001,谛听骨语,谛听骨语,MH370失联的第10年，马来西亚政府宣布在2024年12月20日重启寻找马航MH370的项目。如果后续进展顺利的话，马航MH370会在2025年的1月到4月期间重新展开全面地搜寻。凭空消失的客机，有希望被揭露的失踪真相，这一切都是让人充满了期待。,https://toutiao.com/group/7473322554179895817/,,0,0,False
"富豪千万悬赏寻子后续: DNA比对成功 , 认亲当天发现 , 儿子混的这么好",2025-03-14 10:30,955,124,星期八的北风,星期八的北风,3月14日下午，“悬赏千万求子”的谢岳，发布视频，他接到有关部门电话，终于找到儿子了!新京报 2025-03-14 悬赏千万寻子的谢岳找到儿子:两次DNA比对成功 儿子在读研。,https://toutiao.com/group/7481595832404574735/,,0,0,False
