title,publish_time,like_count,comment_count,media_name,source,abstract,article_url,tag,is_yaowen,article_sub_type
全球约一半肝癌在中国，再次提醒：家中的4种食物，尽早撤下餐桌,2024-08-13 08:36,85440,3289,梁医学社梁怡璋医生,梁医学社梁怡璋医生,,https://toutiao.com/group/7402540119712629311/,,0,0
露头就打！山东全省行动，多人在街头被抓,2024-09-08 06:53,4356,465,直播日照,直播日照,近期山东全省公安机关组织开展打击整治“飙车炸街”违法犯罪专项行动针对“飙车”“炸街”“烧胎”“翘头”以及非法改装等警方进行重点整治山东交警通报典型案例↓↓济南4日下午，天桥交警联合区市场监督管理局，对一处涉嫌非法改装、销售电动自行车和电动摩托车的窝点进行突击检查。,https://www.rzw.com.cn/shandong/2024-09-08/vKJx70LLNJS4ii6i.html,,0,0
40年前供销社卖过的20个生活用品，见过一半算你厉害，你认识几个,2024-07-23 08:56,5910,817,万物知识局,万物知识局,文/万物知识局本文陈述所有内容皆有可靠信息来源，赘述在文章结尾童年的岁月无论过多久都会因为某件事或某个物品而激发回忆，如今早已长大的我们时常还会想起过往，在看到某个熟悉的老物件时，回忆就如同潮涌般难以抑制，就仿佛再次将我们带回到那个熟悉的午后和熟悉的房间。,https://toutiao.com/group/7394736337166926346/,,0,0
终于曝光！央视公开中国歼-16拦截P-8A，澳飞行员：要看心理医生,2024-09-12 05:10,13559,5315,军武次位面,军武次位面,近日，央视首次公开曝光了2022年中国空军歼-16拦截澳大利亚P-8A巡逻机的画面。视频显示，一架中国空军的歼-16战机不仅释放干扰弹，还精准地横向切过澳大利亚P-8A巡逻机的机头，场面十分惊险，而澳大利亚飞行员的反应更是耐人寻味。,https://toutiao.com/group/7413615476473676322/,,0,0
5座车拉6个人被判超员，车主1句话把交警问懵,2024-08-05 20:20,6866,1612,奇妙钢笔pA8JyP,奇妙钢笔pA8JyP,,https://toutiao.com/group/7399752843772559906/,,0,0
恳请大家看一段毛骨悚然的视频,2024-09-12 06:21,31035,3636,极速风筝8F,极速风筝8F,,https://toutiao.com/group/7413637842141708826/,,0,0
“心系百姓”、“为人民服务”确确切切是件令一国总理最头痛的事,2024-09-04 04:55,264554,29426,舟曲東去西燕飛,舟曲東去西燕飛,,https://toutiao.com/group/7410647010543403554/,,0,0
奥运史上难以打破的7个记录，博尔特仅排第3，中国4人上榜,2024-07-22 08:20,2318,1188,实用电脑手机技巧,实用电脑手机技巧,秉持着“更快、更高、更强”的理念，中国奥运健儿们创造了一个又一个夺金时刻，很多时候所创下的记录更是难以被打破，中国4人在榜，就连强如“飞人”博尔特也望尘莫及?,https://toutiao.com/group/7394359975453966902/,,0,0
姥姥去世大姨没掉一滴泪，葬礼结束后大姨要走，舅舅：账还没算呢,2024-08-24 03:01,15839,1065,董你的天使,董你的天使,姥姥去世大姨没掉一滴泪，葬礼结束后大姨要走，舅舅：账还没算呢姥姥去世的时候，父亲带着我和弟弟来参加葬礼。葬礼上大姨和姨夫一直在忙前忙后，舅舅和舅妈两个人哭得不省人事，但大姨却一滴眼泪都没有掉。,https://toutiao.com/group/7406225716091699747/,,0,0
“蚩尤”究竟为何物？为何黄帝要赶尽杀绝？说出来你可能不信,2024-08-11 06:48,6384,964,健康科普陈医生,健康科普陈医生,我国拥有漫长的历史，长达几千年，既如此，曾涌现出无数英雄豪杰。其实，早在远古时代，华夏大地上就已经是英雄辈出。比如大名鼎鼎的黄帝，就是远古时代影响力最大的大人物之一。起初，他并不是特别强大，只是一些部落的首领。,https://toutiao.com/group/7401769231404057098/,,0,0
《大宅门》再也见不到的8个演员，以为退休享福，其实已悄然离逝,2024-07-09 03:31,6591,221,小阿蔓的梦游记,小阿蔓的梦游记,国家一级演员陈宝国因为它当场怒摔片酬，享誉国际的陈凯歌、姜文这种顶级大导演为了能够在这部片留下些镜头竟然甘愿跑龙套当太监。就连李雪健、于荣光、宁静也都为此甘愿免费跑龙套，央视总导演张艺谋为了能够混上一个露脸的机会24小时随时待命.,https://toutiao.com/group/7389463042259419659/,,0,0
21岁少女为35岁男子捐骨髓，一年后怀孕，患者再登门：堕胎救我,2024-09-12 02:00,443,691,万史浮华,万史浮华,“你打掉孩子以后还可以再生，但要是你不捐骨髓，我的丈夫就要没命了!”2018年，江丽跪在刚刚怀孕100多天的韩娜面前，苦苦哀求她救救自己的丈夫，但韩娜却面露难色。,https://toutiao.com/group/7413309842402542115/,,0,0
樱花校园模拟器：从楼梯上去后，小虾发现了隐藏在公寓里的秘密,2024-06-30 11:05,1780,147,安小虾,安小虾,,https://toutiao.com/group/7386250802806915618/,,0,0
我国历史上共有400多位皇帝，能被称为是千古一帝的，就只有这4位,2024-07-06 06:38,1576,396,兜兜历史迷,兜兜历史迷,我国历史上皇帝众多，虽然说这400多位皇帝中有重大贡献的不少，但能真正配得上“千古一帝”这四个字的，其实只有4位，别人跟他们比起来都多少差了那么一点。,https://toutiao.com/group/7388406323102171700/,,0,0
为啥我国对性交易零容忍？看了德国的现状，就明白隐藏的“黑暗”,2024-08-29 09:46,7726,1044,唐文采飞扬,唐文采飞扬,于是有人就好奇了，为什么别的国家都在陆续将“性交易”合法化，而中国却对“性交易”零容忍，难道合法赚钱、合法纳税不好吗?,https://toutiao.com/group/7408462934541599270/,,0,0
"15年老赖黄淑芬把人撞成植物人, 宁肯坐牢不愿赔偿, 7年买车又买房",2024-09-10 05:30,3235,3059,皮皮娱乐,皮皮娱乐,这是一位肇事者说的话，拒绝赔偿事故中产生的所有费用。不是家里没有钱，而是把全部存款和房产都过户到女儿名下。赵香斌河北邢台人，这是一家让人羡慕的家庭。,https://toutiao.com/group/7412857016328274483/,,0,0
杨玉环陵墓出土，专家打开棺椁后发现，千年前的“传言”或被证实,2024-07-23 08:30,24238,641,司空知史,司空知史,本文内容均引用权威资料结合个人观点进行撰写，文末已标注文献来源，请知悉。在阅读此文之前，麻烦您点击一下“关注”，既方便您进行讨论与分享，又给您带来不一样的参与感，感谢您的支持！前言在历史的长河里，帝王佳丽千万，多数却连名字都被岁月湮没。然而杨贵妃却不同。,https://toutiao.com/group/7394699135515804199/,,0,0
【我的世界】多人1.20原版生存全集 一口气看完！,2024-07-10 03:02,13827,2056,MC小颜8,MC小颜8,,https://toutiao.com/group/7389837185237418522/,,0,0
《凡人歌》结局：看到沈磊报复那隽，才知谢美蓝圆满为何令人破防,2024-09-10 15:04,109,439,UU书影谈,UU书影谈,谢美蓝的结局让所有人破防了。明明她是先变心的那一个人，可是她的结局最圆满。明明是处于最底层的女孩，可是凭借着不服输的韧劲，摆脱了内耗的婚姻，走上了另一条康庄大道。离婚后，谢美蓝火速结婚了，小说中没有点明新郎是谁，但是在国贸大酒店，谢美蓝有了一场盛大的婚礼。,https://toutiao.com/group/7413029854758617640/,,0,0
盘点那些采访爆笑瞬间，一个敢问一个敢答，小姐姐都太豪横了,2024-07-11 08:37,41899,2386,开心呱呱笑,开心呱呱笑,盘点那些采访爆笑瞬间，一个敢问一个敢答，小姐姐都太豪横了,https://toutiao.com/group/7390294511139684879/,,0,0
全4小时，黑神话悟空全主线剧情电影，含隐藏结局,2024-08-25 08:41,4066,418,米安叨叨叨,米安叨叨叨,,https://toutiao.com/group/7406994584456135208/,,0,0
孙颖莎以暴制暴，硬刚美国队长，谁也劝不住打上头的莎莎 #孙颖莎,2024-08-27 08:29,14128,441,体能勇者谈,体能勇者谈,,https://toutiao.com/group/7407733564839559707/,,0,0
贾家被抄家的真实原因，就是贾元春省亲，可惜皇帝的用意他们没懂,2024-07-24 12:35,4464,590,曦言说,曦言说,说出来可能不信，压垮贾府的最后一根稻草，就是元妃省亲，皇帝这招“醉翁之意不在酒”计谋使用得相当到位，可怜贾家上下，还沉浸在荣华富贵的美梦里，压根儿就没懂皇帝的真实用意，那么皇帝到底是怎么想的呢?,https://toutiao.com/group/7395179629855785506/,,0,0
【我的世界】多人原版1.20生存第一期 寻声守卫的压迫感太强了！,2024-06-29 08:15,4217,692,MC小颜8,MC小颜8,,https://toutiao.com/group/7385835893782741567/,,0,0
比45℃高温更惨的是，川渝人连空调都不敢开了,2024-09-12 08:45,6548,1774,顾不上,顾不上,,https://toutiao.com/group/7413657348314497563/,,0,0
美国216吨大飞机：起飞全过程曝光，飞行员驾驶急速升空，真猛,2024-08-22 10:14,69167,13328,录有片,录有片,,https://toutiao.com/group/7405905170619597362/,,0,0
好猫有好报【I AM CAT VR】,2024-08-22 03:04,4848,396,里昂聊游戏,里昂聊游戏,好猫有好报【I AM CAT VR】,https://toutiao.com/group/7405794462259773992/,,0,0
三峡大坝已经运行了20年，当初投入的2500多亿元，如今回本了吗,2024-06-19 03:20,8416,4636,科普10克,科普10克,要是提到我国的水利工程，那么大家第一时间想到的肯定是三峡大坝，距建成投入到如今已经有二十多年的历史了。,https://toutiao.com/group/7382044987539587584/,,0,0
2018年因批评鸿茅药酒，被跨省追捕的医学硕士，如今已经命不久矣,2024-09-11 10:11,1222,1055,吃瓜少女孙答应,吃瓜少女孙答应,然2017年末，一篇《中国神酒“鸿毛药酒”，来自天堂的毒药》横空出世，作者谭秦东，医学硕士，以笔为剑，誓揭真相。,https://toutiao.com/group/7413318984860303898/,,0,0
难怪明知36变更强，孙悟空却不愿学，你看36变的另一名字叫什么！,2024-07-12 11:31,4361,2640,品茗谈史论世事,品茗谈史论世事,声明：本文内容均引用权威资料结合个人观点进行撰写，文末已标注文献来源及截图，请知悉。想必大家都认为孙悟空选择七十二变而非选择三十六，仅是因为其数量变化之多，故而选择了数量更多的七十二变？,https://toutiao.com/group/7390708083195904549/,,0,0
张子强家人下落：遗孀携20亿定居泰国，大儿子已工作，成餐厅厨师,2024-08-08 11:25,1708,374,张守小科普,张守小科普,感谢各位看官点击支持原创，文末已标注文献来源，请知悉。悍匪名叫张子强，《插翅难逃》、《追龙2:追缉大富豪》等影视剧作品的原型，就是以他为首的犯罪团伙。,https://toutiao.com/group/7400723802852573730/,,0,0
这才是动作巅峰对决，李连杰武功高强大战敌人动作片,2024-06-25 07:07,16916,1449,第五影厅,第五影厅,,https://toutiao.com/group/7384329490870043186/,,0,0
美债最大“接盘侠”现身，并不是日本和英国，疯狂买入70%的美债,2024-09-10 08:24,4180,415,爱较真科普,爱较真科普,美债最大“接盘侠”现身，并不是日本和英国，疯狂买入70%的美债,https://toutiao.com/group/7412927505029399075/,,0,0
沙僧只封了金身罗汉，为啥一声不吭？你看如来给了他什么好处,2024-08-07 10:42,4355,1502,来点解读,来点解读,在《西游记》的大结局里，唐僧师徒四人成功取得真经，佛祖如来也是言出必行，对他们之前的种种努力和贡献都一一兑现了承诺。唐僧成功成佛，孙悟空荣升斗战胜佛，就连那爱吃爱睡的猪八戒也摇身一变成了净坛使者，享尽美食。可轮到沙僧这儿，就只封了个金身罗汉。,https://toutiao.com/group/7400345643971183138/,,0,0
这才是武侠片的巅峰之作，你敢相信这是20年前的国产特效？,2024-08-15 17:00,15143,2381,九九哥超燃影视,九九哥超燃影视,,https://toutiao.com/group/7403412000191021607/,,0,0
张学良晚年回忆：之前我从不迷信，但是在杀杨宇霆时，我不得不信,2024-07-17 11:11,9079,936,来点解读,来点解读,奉系军中威名赫赫、功绩卓越的杨宇霆就这样离开了人世，杀他的人正是他看不上眼的“纨绔子弟”张学良。晚年自述时，张学良表示:“原本我这个人并不迷信，但杀杨宇霆时我却不得不信了!”,https://toutiao.com/group/7392560082111857191/,,0,0
1米3袖珍美女：执意嫁1米48袖珍男人，婚后丈夫“长高”抛弃妻子,2024-08-27 13:30,6013,1047,鲨娱崽崽,鲨娱崽崽,新郎和新娘看上去像十几岁的小孩子，众人疑惑不已: 他们到结婚年纪了吗?事实上这对夫妻是袖珍人。新郎29岁，身高1米48;,https://toutiao.com/group/7407720729992643099/,,0,0
二哈死活不愿带娃，当主人把娃强行塞给二哈后，你们都憋住别笑！,2024-07-11 12:04,56281,9174,小黑小黄的幸福狗生,小黑小黄的幸福狗生,马桶说我这一天天的太难了，哈哈哈,https://toutiao.com/group/7390348029905076751/,,0,0
中国体坛只有6人称得上世界巨星，李娜算一个，邓亚萍上不了榜,2024-07-22 11:07,9436,1775,飞鸟科普,飞鸟科普,提起在中国体坛的巨星，你一定能想到很多人，不过真正举世瞩目的世界体坛巨星仅有这六个人，且无人可以撼动。,https://toutiao.com/group/7394394470407569958/,,0,0
这部台湾电影拍的真大胆，中年夫妻间的不堪，没结婚的禁止观看！,2024-08-16 06:44,4144,145,小胡谈事件,小胡谈事件,"电影名：幸福城市
 这部台湾电影拍的真大胆，中年夫妻间的不堪，没结婚的禁止观看！",https://toutiao.com/group/7403624512404587047/,,0,0
武松是都头、林冲是总教头、鲁智深是提辖官，三人官职谁的最高？,2024-07-15 01:03,1792,541,蜀山史道,蜀山史道,因平台改版，增加了广告解锁功能，当广告打开后，静等5秒钟，您在伸出发财的小手，点击右上角的x号关闭，就可以继续阅读我的文章了，这个过程是完全免费的，请您不必担心。文|妍妍编辑|妍妍前言在《水浒传》这部经典小说中，武松、林冲和鲁智深都是深受读者喜爱的英雄好汉。,https://toutiao.com/group/7391657697382335011/,,0,0
如今回头看恒大，许家印是赢了还是输了？！,2024-07-29 11:03,37985,22237,缤纷海燕YrEkWp,缤纷海燕YrEkWp,,https://toutiao.com/group/7397011739571421708/,,0,0
贾冰新剧，爆笑来袭！ #好剧推荐  #一个片段看完了整部电影,2024-09-08 06:47,6540,866,神辞漫剪,神辞漫剪,,https://toutiao.com/group/7412160272280617508/,,0,0
乔治的新朋友 乔治的新朋友 #小猪佩奇 #野猪佩奇,2024-08-11 09:35,7618,369,小豆同学爱看佩奇,小豆同学爱看佩奇,,https://toutiao.com/group/7401813090880193062/,,0,0
刘德华内地36场演唱会的各项数据会惊掉你的下巴,2024-09-11 12:35,2279,356,长江隧道,长江隧道,,https://toutiao.com/group/7413363299137356351/,,0,0
你一定不会信！这就是德国农村真实面貌，其他国家根本看不到！,2024-08-19 02:49,12352,3769,苏小米的vlog,苏小米的vlog,你一定不会信！这就是真实的德国农村面貌，其他国家根本看不到！,https://toutiao.com/group/7404677341529506356/,,0,0
我国首例公开转世人：6岁凭记忆找到前世的家，还找到前世情人,2024-09-12 11:00,843,189,张守小科普,张守小科普,但在1976年，一位3岁小孩却向家人坦言，自己是从儋州投胎转世而来。这个被称为“转世神人”的人名叫唐江山，是我国有记录以来第一个称自己是转世人的人。,https://toutiao.com/group/7413708711867269673/,,0,0
“我就是她取精生子的工具”清华学霸哭诉，撕开了女富豪的遮羞布,2024-08-22 09:10,18679,1752,见识乌托邦,见识乌托邦,当这句话从清华学霸刘光耀口中说出时，所有人都震惊了。那位曾在创业和学术上双双辉煌的年轻才俊，如今在社交媒体上愤怒地撕开了婚姻的真相。,https://toutiao.com/group/7405884441706463778/,,0,0
为何明星都喜欢全红婵？不得不说婵宝简直太厉害了#全红婵,2024-08-22 08:36,2501,148,彤说人物,彤说人物,,https://toutiao.com/group/7405879948571935251/,,0,0
蛋仔派对：疯狂乱斗，兔之巨人归来！#蛋仔神奇艾比,2024-07-21 15:01,2294,272,隐秘的兔仙,隐秘的兔仙,,https://toutiao.com/group/7394104514300609078/,,0,0
王楚钦最疯狂一球！百看不厌，被国际乒联评为最刺激的比赛之一,2024-09-10 01:04,4251,325,乐播体育,乐播体育,,https://toutiao.com/group/7412813945642746418/,,0,0
郭艺：同是全红蝉跳水教练，凭什么说他才是教练中最关键的一个,2024-08-20 14:47,17564,1719,娱乐畅享,娱乐畅享,,https://toutiao.com/group/7405233321812165171/,,0,0
公鸡强行霸占了狗窝，小狗狗回家的第一反应，把主人笑得肚子疼！,2024-07-09 14:51,7105,332,维E爱动物,维E爱动物,公鸡强行霸占了狗窝，小狗狗回家的第一反应，把主人笑得肚子疼！,https://toutiao.com/group/7389648897754268170/,,0,0
我国内蒙古发生了罕见现象！将黄河水引入沙漠后居然发生神奇反应,2024-09-10 01:36,4539,513,小姚说事,小姚说事,,https://toutiao.com/group/7412182756823663144/,,0,0
反转再反转！人民日报也转发了，崂山警方发布通报还原了全部真相,2024-09-13 07:18,352,213,时间线聊生活,时间线聊生活,反转再反转！人民日报也转发了，崂山警方发布通报还原了全部真相,https://toutiao.com/group/7413992687663055398/,,0,0
给“扮演毛主席”的10位演员排座次：古月只排第2，唐国强未进前3,2024-08-26 06:52,5504,1894,香港电影怀旧,香港电影怀旧,国家一级演员王霙去世，享年66岁。从艺40余年，他的一生基本上为一个角色服务，那就是毛主席。关于王霙的过往，我们下面有详细介绍。回看影视作品中的主席形象，很多演员都给出了印象深刻的表演。既有古月、张克瑶等老一辈的神级演绎，也有侯京健、王仁君等年轻演员的传神表现。,https://toutiao.com/group/7407335713588511247/,,0,0
不要被电视剧骗了！真正的清朝，其实是这个样子,2024-07-08 03:49,5380,1309,摄影圣典,摄影圣典,争风吃醋、宫斗不断，这就是清宫剧、古装剧最典型的特点。几百年前的清朝，社会生产力还很落后，人们穿的都是麻布衣服，而不是剧中那种人人都穿丝绸。,https://toutiao.com/group/7389099011841507880/,,0,0
美国“大祸临头”，马斯克预言成真？耶伦紧急喊话中国，帮不帮？,2024-09-13 09:11,2901,576,世观新野,世观新野,,https://toutiao.com/group/7414052945110499851/,,0,0
中美科技战之华为干苹果！华为三折叠炒上9万天价 #华为 #苹果,2024-09-11 08:20,3380,194,章蕾,章蕾,,https://toutiao.com/group/7413297611681858060/,,0,0
美国在华独资医院现状如何,2024-09-13 04:13,4022,965,时间在流,时间在流,,https://toutiao.com/group/7413975919288648230/,,0,0
正播澳门冠军赛，4比2！孙颖莎王者归来，击溃张本美和！莎莎笑了,2024-09-14 13:18,1188,285,体坛AllStar,体坛AllStar,,https://toutiao.com/group/7414487613756670483/,,0,0
武松断臂后，只有一个好汉去看望他，并祭拜了鲁智深，此人是谁？,2024-06-17 21:05,2553,947,方圆讲历史,方圆讲历史,说起梁山好汉，大家总是会和“义”联系在一起，最初他们也正是因为义才走到一起的，不过人总是会变的，这一点武松就很有话语权了。,https://toutiao.com/group/7380600649593782824/,,0,0
当美国人27年，国内捞金22年，37岁的刘亦菲，终于付出了代价,2024-09-11 08:13,830,553,置身事内,置身事内,9月10日，“金鹰奖删除刘亦菲入围资格”的词条，冲上热搜，引起网友热议。原因很简单，刘亦菲是美国人。,https://toutiao.com/group/7413265390882636328/,,0,0
2025年春晚不要办了，把这个再重播一遍就行了,2024-07-21 08:50,70190,8432,小时候就很六,小时候就很六,,https://toutiao.com/group/7394008755664323072/,,0,0
美女问老光棍：什么山不能爬？答对就嫁给他，小伙的回答太逗了,2024-08-27 10:06,8578,1006,何有理毛了,何有理毛了,美女问老光棍：什么山不能爬？答对就嫁给他，小伙的回答太逗了,https://toutiao.com/group/7407758665458909736/,,0,0
全红婵登机前那一句这架飞机包了近似一种奇妙的先兆#全红婵,2024-09-12 03:24,2472,197,抹不去的回忆,抹不去的回忆,,https://toutiao.com/group/7413592434426249779/,,0,0
帮大妈清理荒废40年的祖宅，这房子够阴森的，结果清理出来傻眼了,2024-06-21 08:40,40988,5768,创意花园美艺,创意花园美艺,帮大妈清理套荒废40年的祖宅，看着就挺阴森，结果清理出来傻眼了,https://toutiao.com/group/7382808201818800690/,,0,0
大米生虫，不能暴晒！米虫最怕这3招，米袋里放一点，一年不生虫,2024-08-01 07:39,5321,388,山城旧客,山城旧客,本文内容均引用权威资料结合个人观点进行撰写，参考文献及来源截图已放文章末尾像我这种不做饭不知柴米油盐贵的人，更加不知道大米还会生虫！在得知大米生虫之后，有人说将其放在太阳下暴晒虫就会消失，有的也说用水淘米，虫子会漂浮出来等等一系列的方法。这些方法到底管不管用？又有什么弊端？,https://toutiao.com/group/7398067117604340262/,,0,0
2018年因揭露鸿茅药酒，被跨省逮捕的医生，如今生命即将步入终点,2024-09-11 09:30,2363,1039,纪录冷暖人生,纪录冷暖人生,2017年，一篇题为《中国神酒“鸿茅药酒”，来自天堂的毒药》将作者谭秦东和鸿茅药酒一同送上了风口浪尖。,https://toutiao.com/group/7413314042863632906/,,0,0
《凡人歌》直到搬出800万房子，沈琳才知道，生活越过越差的真相,2024-09-11 11:42,1886,623,梵诗灵,梵诗灵,沈琳在前同事家做月嫂，第一笔订单就以不愉快提前结束。钱没挣到多少，沈琳却累到腰椎间盘突出。显然，月嫂这份工作，也不适合沈琳。沈琳想放弃，可却又找不到别的出路。而这时候，那伟创业也不顺利，表面看似忙忙碌碌，实则挣的钱还不够他跟李晓悦两个人分。,https://toutiao.com/group/7413348154973716992/,,0,0
笑得肚子疼夫妻爆笑对话，一个老婆都搞不定，还想三妻四妾,2024-08-05 10:01,8636,909,陈哥爆笑社,陈哥爆笑社,盘点夫妻搞笑对话，喜欢就多多关注支持,https://toutiao.com/group/7399593433255379475/,,0,0
又出大瓜？73岁“风流妖精”刘晓庆，如今已经走上了另一条道路,2024-08-28 08:52,23033,1804,小怪兽游戏,小怪兽游戏,如今的刘晓庆又炸裂了，七十三岁却又被曝出离婚，这大瓜果然是让人一言难尽，就连罗翔老师都忍不住吐槽起来，而且这件事和另外一位明星有关系。,https://toutiao.com/group/7408098050512437772/,,0,0
又一民营巨头崛起！年入8177亿超越华为成最大民企，她到底啥来头,2024-09-10 11:57,7361,2219,奇观历史君,奇观历史君,说起恒力集团，估计大多数人都没听说过。然而，就是这个大多数人都没听说的企业，却比华为还要“牛”。在世界500强企业排名中，恒力集团排在第81名，要知道，华为才排在第103名。恒力集团究竟是做什么业务的？为什么如此成功的一个企业，知名度却这么低呢？,https://toutiao.com/group/7412945738605117967/,,0,0
“采耳”还是“采花”？穿着养生外衣打擦边，实则“别有洞天”？,2024-09-05 06:08,856,121,历史特别冷,历史特别冷,一时间能让精神世界放松的方式，不止局限于酒吧、KTV等娱乐场所，就连洗浴中心、按摩店、足疗店也卷出了新境界。这不禁让人好奇，小小的耳道，到底是“采耳”还是“采花”呢?,https://toutiao.com/group/7411028853407220235/,,0,0
中国稀土太子爷的奢靡生活：90万一顿饭，父子俩挥霍上百亿资产,2024-09-12 03:55,5046,4737,沐泠泱,沐泠泱,出门随便吃的一顿饭，竟然高达90万人民币，而地下车库的豪车更是不计其数，放眼望去都是清一色的法拉利，保时捷等等。,https://toutiao.com/group/7413596809358803471/,,0,0
浙江清淤工人捞出15年前的轿车，打开门：里面竟然还有两具骸骨！,2024-08-27 09:03,1864,218,青史耀华,青史耀华,«——【·前言·】——»2017年，浙江一位河道清理工作人员照常开展工作，兢兢业业地清理着河流中淤积的泥沙杂物，然而令他意想不到的是！清理河道时竟打捞上一辆轿车，这辆轿车被淤泥覆盖脏污不堪。,https://toutiao.com/group/7407716274261787170/,,0,0
