title,publish_time,like_count,comment_count,media_name,source,abstract,article_url,tag,is_yaowen,article_sub_type
中非合作论坛｜携手前行  共逐现代化之梦,2024-09-07 14:14,2381,1006,新华社,新华社,金秋的北京，迎来中非关系史上又一里程碑时刻。9月5日上午，国家主席习近平出席中非合作论坛北京峰会开幕式并发表主旨讲话，回顾中非关系发展历程，宣布中非关系新定位，提出将实施中非携手推进现代化十大伙伴行动。习主席的重要讲话在各界人士中引发热烈反响。,http://api.xinhua-news.com/newroute/newsdetail/101002024090670000519?dest=AP1C-gsWpfaNpo9cpzLrMHtiuIsPauiQ3aF-Nqwo5B5o,,0,0
全球约一半肝癌在中国，再次提醒：家中的4种食物，尽早撤下餐桌,2024-08-13 08:36,80407,3129,梁医学社梁怡璋医生,梁医学社梁怡璋医生,,https://toutiao.com/group/7402540119712629311/,,0,0
怒怼全班！广西一家长微信群狂怼教师与家长，引爆教育局紧急调解,2024-09-07 12:46,526,1081,一丝不苟西柚,一丝不苟西柚,近日，在广西玉林的东成小学，一场家长群内的风波引起了广泛关注。事情的主人公是刘某，一位学生家长。首先！我们先来看看视频视频来源:九派新闻起初，刘某在家长微信群中针对某些教育相关的问题提出了质疑。或许是出于对孩子教育的关切，他的言辞稍显急切。感谢两位班主任老师的照顾。,https://toutiao.com/group/7411881686370009652/,,0,0
荷兰还是下手了,2024-09-07 07:56,1795,111,牛弹琴,牛弹琴,荷兰还是下手了，但没有提到中国,https://toutiao.com/group/7411807103123554870/,,0,0
央视发了一个天气预报视频，全球都惊呆了！外网纷纷留言…,2024-09-08 12:43,1555,751,极目新闻,极目新闻,今年第11号台风“摩羯”9月6日登陆，此次台风成为史上登陆中国最强秋台风，也是继2014年第9号台风“威马逊”之后，登陆中国的最强台风。为了防范超强台风可能带来的危险，央视频发布了一个视频，提醒市民提前避险。,http://jms.ctdsb.net/jmythshare/#/index_share?cId=0&contentType=5&contentId=2249217,,0,0
【事件升级】妖怪手握重要证据喊话小杨哥，并下最后通牒！,2024-09-07 16:05,8219,1766,铁血战士,铁血战士,,https://toutiao.com/group/7411933092958437922/,,0,0
