title,publish_time,like_count,comment_count,media_name,source,abstract,article_url,tag,is_yaowen,article_sub_type
政府官员入住单间？企业家贵州开会遭吐槽 ？开会被针对？回应来了,2024-09-10 06:56,155,374,实时创作人,实时创作人,据@海量财经报道：把单间给政府官员?企业家吐槽在贵州开会被针对在户外分享之时被警方以检查工作的名义围住当地回应:正在核实9月8日，一场期待中的商业活动，因为突发事件，引起了公众的热议。,https://toutiao.com/group/7412897219738632713/,,0,0
2013年，湖南26岁女孩嫁给71岁老头，婚后还生下一子，如今怎样了,2024-07-12 11:59,18601,2047,智史通鉴,智史通鉴,2013年4月17日，长沙宁乡县的民政局迎来了一对特殊的夫妻。一个71岁的老头和一个26岁的女孩，离远了看，甚至像爷爷和孙女。面对工作人员异样的眼光，女孩说：“我和他是真心相爱的！”这让人好奇，这对相差45岁的夫妻，他们之间到底有着怎样的爱情故事？,https://toutiao.com/group/7390696631223534120/,,0,0
中国足协开出60张罚单，金敬道等终身“禁足”，完整名单公布,2024-09-10 04:17,111,202,极目新闻,极目新闻,北京时间9月10日，国家体育总局、公安部联合召开的足球职业联赛“假赌黑”问题专项整治行动新闻发布会在大连进行。中国足协开出60张罚单，金敬道、孙准浩、郭田雨、顾超等终身禁赛，汪嵩等17人被禁足五年。,http://jms.ctdsb.net/jmythshare/#/index_share?cId=0&contentType=5&contentId=2250916,,0,0
首次世界五百强断崖差距 日本149家，美国151家，中国3家，现在呢,2024-09-06 09:57,2527,663,周律鸣法,周律鸣法,1995年，当《财富》杂志首次以严谨而权威的姿态，揭晓了全球前500家企业的辉煌阵容时，那份榜单映照出了国际竞争力的微妙格局。,https://toutiao.com/group/7411466323206603300/,,0,0
酒店外墙被摩羯吹跑了  有地方海水倒灌  当地人：像世界末日,2024-09-07 00:40,7069,1240,抽屉视频,抽屉视频,酒店外墙被摩羯吹跑了  有地方海水倒灌  当地人：像世界末日,https://toutiao.com/group/7411694650618020406/,,0,0
写歌30年穷困潦倒，前妻失望选择离婚，谁料51岁靠一首歌一夜成名,2024-08-12 03:37,15875,2722,八号探秘人,八号探秘人,在阅读此文之前，辛苦您点击一下“关注”，既方便您进行讨论和分享，又能给您带来不一样的参与感，感谢您的支持！编辑：LY无数人都想要一个一夜成名的机会，但机会来了也不是每个人都能把握住的。他用了三十年的时间来准备迎接属于自己的机会。为了这个机会他放弃了一切，甚至包括家庭。,https://toutiao.com/group/7402090890367484428/,,0,0
韩国足协人士：若中国足协将禁足决定通知FIFA，那在韩国同样适用,2024-09-10 08:10,492,349,直播吧,直播吧,直播吧09月10日讯 中国足协今日公布了对足坛假赌黑涉案人员的行业处罚， 前山东泰山球员孙准浩遭到终身禁足。据韩联社报道，日前，大韩足球协会相关人士表示，若一国足协将一定水平以上的处罚决定通知国际足联（FIFA），相关结果将在国际范围内适用。,https://news.zhibo8.com/zuqiu/2024-09-10/66dffb744ff59native.htm,,0,0
最美赵敏离世，被父侵犯被夫欺辱，自杀十几次，死后3天才被发现,2024-08-27 09:51,5169,1298,男神女神深度八卦,男神女神深度八卦,1先来看一个视频。以下几版赵敏中，你觉得，哪一版最英气，最夺目？你选的是哪版？可能有人选张敏，也可能有人选贾静雯。但你知道吗？在B站看到这个视频时，刷得最多的弹幕是：刘玉璞第一。年轻一点的读者，可能对她比较陌生。,https://toutiao.com/group/7407752811238179380/,,0,0
当时不死也活不了几天，身上都是伤，黏膜也都破坏了,2024-07-27 02:00,1157,347,直播生活,直播生活,,https://toutiao.com/group/7396129535286051354/,,0,0
让外国人都震惊，这是中国高校的军训吗？,2024-09-10 02:21,2053,323,领路先锋,领路先锋,,https://toutiao.com/group/7412833782148891170/,,0,0
牡丹江市第二人民医院党委原书记程刚违规大操大办,2024-09-10 02:19,351,119,黑龙江网,黑龙江网,9月10日，黑龙江省纪委监委通报牡丹江市第二人民医院党委原书记程刚违规大操大办等问题。#黑龙江 #牡丹江 #通报,https://toutiao.com/group/7412833493865988662/,,0,0
世界第一辆“无脚踏板”自行车，速度飞速，起动机就是我们的双腿,2024-09-08 10:09,577,191,七七科普路,七七科普路,,https://toutiao.com/group/7412212429310689844/,,0,0
趁媳妇睡觉时，偷偷把风油精滴媳妇屁股上，媳妇反应太逗了,2024-09-06 03:15,2362,373,小可宣宣,小可宣宣,,https://toutiao.com/group/7411363413034533417/,,0,0
俄军炸出大事，美军把亚太决战导弹搬到乌克兰：我国获得最大收益,2024-09-05 08:13,17061,6227,深度工场,深度工场,俄罗斯伊斯坎尔德弹道导弹四面出击，摧毁乌克兰波尔塔瓦州乌军军事通信学院，220多名乌军通信和电子战军官伤亡。,https://toutiao.com/group/7411066754266432039/,,0,0
激烈交锋，中荷已经谈崩，光刻机管制将升级，中方反砸250亿破局,2024-09-08 10:30,6052,2008,吴学兰,吴学兰,9月6号荷兰宣布将扩大光刻机的管制范围，此举明显是针对中国，在做出决定前，中荷两国曾进行了多层级、高频次的激烈交锋，事实证明最终两国还是谈崩了。,https://toutiao.com/group/7412217134694007307/,,0,0
拍完激动地没睡剪到凌晨三点，十秒视频竟然循环欣赏了一小时多,2024-07-15 21:17,14370,1411,驕鷔,驕鷔,,https://toutiao.com/group/7391974681835733554/,,0,0
路虎女司机身旁的黑衣人是谁？,2024-09-02 03:22,4592,980,凤凰涅盘,凤凰涅盘,,https://toutiao.com/group/7409880950269542912/,,0,0
为国争光却遭郎平弃用！转身效力土耳其的王一梅，如今过得咋样？,2024-09-07 03:42,2235,179,洛风阐史官,洛风阐史官,本文陈述内容皆有可靠信息来源，赘述在文章结尾。提到中国女排，绝对不可以忽视一个人，她就是绰号“大梅”和“女排重炮”的王一梅。然而，这位被称之为“郎平第二人”的主攻手却在巅峰时期被自己偶像郎平彻底抛弃，不得不选择加入了土耳其俱乐部。那么，曾经为国争光的王一梅为什么会被郎平弃用？,https://toutiao.com/group/7411739899121943055/,,0,0
71年杨振宁和岳父母杜聿明、曹秀清合影，站在一旁，显得毕恭毕敬,2024-09-02 05:26,746,444,万物知识局,万物知识局,完美的爱情在世间似乎是鲜少存在的，即便是恩爱的夫妻在相处中也会有磕磕绊绊，待到结局时更是无法用完美来作为结束，而在曾经动荡的年华中，一边要在国家时局中安稳度日，一边还要维系自己的爱情，更是难上加难。,https://toutiao.com/group/7409132056879383080/,,0,0
台风“摩羯”登陆越南后，下龙湾的天塌了！,2024-09-09 04:24,637,144,越蒋越友,越蒋越友,趁着公司发电，还有网的时间，赶紧发个下龙湾台风后的惨不忍睹,https://toutiao.com/group/7412494428343894569/,,0,0
有一种“算计”叫英达和梁欢，结婚27年后，善恶报应终于应验了,2024-08-27 11:28,1968,175,法老不说教,法老不说教,为提升文章可读性，细节可能存在润色，请理智阅读，仅供参考!“要是没有英达，现在的梁欢一定不会两眼无光，沦为英达事业的牺牲品。”,https://toutiao.com/group/7407769963749589554/,,0,0
中国足球为什么不行？这就是原因,2024-09-10 01:26,571,559,文化与帆,文化与帆,,https://toutiao.com/group/7412819758845788706/,,0,0
捡到把生锈的枪，老父亲要我赶紧上交警局，结果破除包浆傻了眼！,2024-09-09 03:04,3557,582,机械鉴赏者RM,机械鉴赏者RM,捡到把生锈的枪，老父亲要我赶紧上交警局，结果破除包浆傻了眼！,https://toutiao.com/group/7412473944068620812/,,0,0
宋江喝下毒酒，才恍然大悟：原来梁山真正的老大，从来都不是自己,2024-07-31 06:24,3559,130,陌闻史谈,陌闻史谈,前言梁山这一百零八条好汉各有各的性格，也各有各的擅长点，但是对于梁山的领头羊、梁山的老大不用说大家也知道是谁。在晁盖死后，整个梁山都是宋江做主，最初宋江也一直都是这样以为的，但直到他临终之际才幡然醒悟这梁山的老大从来都不是自己。,https://toutiao.com/group/7397668220121743907/,,0,0
我拿你当哥们，你却骗我去领证！,2024-09-07 06:57,16527,3693,爆笑小黑仔,爆笑小黑仔,,https://toutiao.com/group/7411791843178611251/,,0,0
给“扮演毛主席”的10位演员排座次：古月只排第2，唐国强未进前3,2024-08-26 06:52,5054,1810,香港电影怀旧,香港电影怀旧,国家一级演员王霙去世，享年66岁。从艺40余年，他的一生基本上为一个角色服务，那就是毛主席。关于王霙的过往，我们下面有详细介绍。回看影视作品中的主席形象，很多演员都给出了印象深刻的表演。既有古月、张克瑶等老一辈的神级演绎，也有侯京健、王仁君等年轻演员的传神表现。,https://toutiao.com/group/7407335713588511247/,,0,0
张学良晚年回忆：之前我从不迷信，但是在杀杨宇霆时，我不得不信,2024-07-17 11:11,8607,864,来点解读,来点解读,奉系军中威名赫赫、功绩卓越的杨宇霆就这样离开了人世，杀他的人正是他看不上眼的“纨绔子弟”张学良。晚年自述时，张学良表示:“原本我这个人并不迷信，但杀杨宇霆时我却不得不信了!”,https://toutiao.com/group/7392560082111857191/,,0,0
华南农业大学2024级新生开学典礼，婵宝的自我介绍：婵宝说她是跳水运动员，没有说她是跳水冠军！多么低调的孩子！#谢思埸#全红婵#陈清晨 ##奥运冠军#华南农业大学#开学典礼,2024-09-04 19:25,5838,623,热心熊猫5mdC8a,热心熊猫5mdC8a,,http://toutiao.com/item/7410871211556602403/,,0,0
72岁大爷独自准备后事，自己穿上寿衣躺进棺材，喝下农药离开人世,2024-08-15 03:17,364,225,肆时说,肆时说,刘大爷身穿寿衣，面容安详的躺在棺材里，棺材旁边早已摆好了遗像，地上还有一个空的农药瓶，旁边木板上歪歪扭扭地写着一句遗言:钱在枕头下。,https://toutiao.com/group/7403190211141829170/,,0,0
为啥丰田还能撑住，本田却直接垮了？内行人一语道破，真相了,2024-09-08 10:55,454,694,锦衣夜行,锦衣夜行,日系车竞争力，每况愈下。数据显示，今年8月，丰田汽车的销量下滑13.5%，日产汽车下降24.2%，本田退步最厉害，大减44.3%。虽说眼看日系“三杰”就要变成“三傻”，但同样在退步，本田掉队的速度实在太快。,https://toutiao.com/group/7412223657517122063/,,0,0
首次世界五百强断崖差距: 日本149家，美国151家，中国3家，现在呢,2024-09-04 11:47,5495,7773,米奇回来了哟,米奇回来了哟,1995年，美国《财富》杂志首次以严谨的态度评估选出全球前500名企业并对其排名，如今这一排名已经成为判断国际竞争力的重要指标，同时也成为了全球各国家经济的权威性代表。,https://toutiao.com/group/7410603353341821474/,,0,0
看到全红婵被陈若琳“警告”，才明白比赛结束后的全妹有多放肆,2024-09-07 10:05,2055,180,娱小爆来了,娱小爆来了,,https://toutiao.com/group/7411840100872487465/,,0,0
1米3袖珍美女：执意嫁1米48袖珍男人，婚后丈夫“长高”抛弃妻子,2024-08-27 13:30,5665,1002,鲨娱崽崽,鲨娱崽崽,新郎和新娘看上去像十几岁的小孩子，众人疑惑不已: 他们到结婚年纪了吗?事实上这对夫妻是袖珍人。新郎29岁，身高1米48;,https://toutiao.com/group/7407720729992643099/,,0,0
被足协处罚终身禁足，球员朱建荣：不会牵连申花，个人行为已承担后果，现转行畜牧业搞养殖养牛,2024-09-10 08:15,137,594,九派新闻,九派新闻,9月10日，中国足协官方发布对有关涉案人员行业处罚情况通报，包括60张罚单，其中金敬道、孙准浩、郭田雨、杨善平、顾超、朱建荣等43人终身禁赛，汪嵩等17人被禁止从事足球相关任何活动5年。,https://toutiao.com/group/7412925004695847461/,,0,0
深圳也开始慌了，工厂关门，无工可打，不是降薪就是放假！,2024-09-09 03:20,1773,485,袋鼠大叔叔,袋鼠大叔叔,深圳，打工,https://toutiao.com/group/7411445705463562761/,,0,0
女婿给外国老丈人拿10000人民币。结果媳妇当场炸毛，给这么多？,2024-09-08 00:00,16396,2364,巴基斯坦媳妇宋铁锤,巴基斯坦媳妇宋铁锤,,https://toutiao.com/group/7411984346711589403/,,0,0
老人下葬后，遗像是烧掉还是保存？切记不能乱放，如何处理才合适,2024-09-04 14:54,7469,428,啰嗦翔子,啰嗦翔子,没想到“丧事”的事后处理还能有这么多玄学！人生在世，生离死别是不可避免的事情，不过在这过程中，也有一些迫不得已去处理的后事....就像是遗体怎么处理、遗物怎么处理、遗像怎么安排，这都是需要在痛苦之后冷静下来所要深思熟虑的事情。,https://toutiao.com/group/7410790046464262656/,,0,0
爱国人设血崩！郑钦文成商业女王，怪不得谷爱凌不合影，妈妈黑脸,2024-09-10 08:10,473,248,百姓人物故事,百姓人物故事,巴黎奥运会上有一个细节，郑钦文决赛的时候，谷爱凌的妈妈也在观众席，一开始喜笑颜开，但是当郑经文夺冠的那一刻，她面无表情。,https://toutiao.com/group/7408822941972840987/,,0,0
我怀疑我家狗是人变的，和我交流沟通毫无障碍，不信你们看,2024-06-16 01:54,22862,22047,大比熊芒果,大比熊芒果,,https://toutiao.com/group/7380913715618513443/,,0,0
黑龙江9名乡镇书记镇长培训期间聚餐饮酒，组织者受党内严重警告处分,2024-09-10 02:19,1202,868,澎湃新闻,澎湃新闻,据黑龙江省纪委监委网站9月10日消息，2024年中秋、国庆将至，为进一步严明纪律规矩、强化警示教育，突出常态长效深化落实中央八项规定精神，营造风清气正的节日氛围，黑龙江省纪委监委现将6起违反中央八项规定精神典型问题予以通报。,https://m.thepaper.cn/newsDetail_forward_28689327?from=toutiao,,0,0
日本人在中国建立这么多学校，到底是谁给他们的权利？答案来了！,2024-08-30 05:23,23822,12261,东说西说,东说西说,,https://toutiao.com/group/7408798754536423971/,,0,0
二哈死活不愿带娃，当主人把娃强行塞给二哈后，你们都憋住别笑！,2024-07-11 12:04,55405,9052,小黑小黄的幸福狗生,小黑小黄的幸福狗生,马桶说我这一天天的太难了，哈哈哈,https://toutiao.com/group/7390348029905076751/,,0,0
美债最大“接盘侠”诞生，疯狂买走70%美债，并非日本、英国,2024-09-06 10:48,4602,235,诺言卿史录,诺言卿史录,作为世界上最大的三个美债持有国，中国、日本和英国在近些年先后对美债进行了抛售。可就在这个时候，美债最大“接盘侠”诞生了，竟然在短时间内，疯狂买走70%美债!,https://toutiao.com/group/7411460329367552550/,,0,0
2005年高秀敏意外猝死，13年后情夫何庆魁揭露：撒谎把命搭进去了,2024-08-29 02:59,804,220,MayHo美好,MayHo美好,在中国春晚的历史上，曾经有三个人的名字那是家喻户晓。13年后何庆魁在节目上揭露:高秀敏撒谎把命搭进去了。,https://toutiao.com/group/7408387191304454682/,,0,0
郑钦文不忍了！炮轰美网3大针对，在中国比赛绝不这样,2024-09-04 09:20,1636,361,小智观体育,小智观体育,,https://toutiao.com/group/7410715009103987212/,,0,0
华为三折叠，价格公布！,2024-09-10 07:11,1012,538,数码飞越,数码飞越,,https://toutiao.com/group/7412908559773630995/,,0,0
院子里跑进一只“狗母蛇”，小孩见到后哇哇大叫，拍给大家看一下,2024-06-29 16:57,57017,6665,乡农小陈,乡农小陈,院子里跑进一只“狗母蛇”，小孩见到后哇哇大叫，拍给大家看一下,https://toutiao.com/group/7385970341836751423/,,0,0
从高考712分，到嫁给农村光棍生育6个娃，她用半生诠释了人生无常,2024-08-28 11:04,8668,1211,书雁飞史,书雁飞史,"1994年，寒门贵子伍继红，以712分的高考成绩，考入中国人民大学。令人意外的是，毕业之后本该享受事业高枕无忧的她，却甘愿嫁给山村“老光棍”，用17年光阴换来6个娃，日子穷到仅能靠低保来维持生活。究竟什么样的人生转折，才让她从意气风发的高材生，沦为苦命的""生育机器""？",https://toutiao.com/group/7408141756992160256/,,0,0
中缅边境通婚严重，为了能在中国定居，缅甸女孩也太拼了,2024-08-22 12:48,13578,1564,柳絮忆史,柳絮忆史,“一旦男方彩礼打过来，就意味着你们是‘夫妻’，就必须开始同居。”婚介所的人这样告诉前来相亲的缅甸女性。在中缅边境的云南地区，娶个缅甸媳妇并不是什么稀奇的事，反而十分普遍，甚至形成了一条婚介产业链。,https://toutiao.com/group/7405853545108357668/,,0,0
老炸裂了！男子留学美国供养女友，女友出轨夜店露奶给三个黑哥看,2024-08-23 10:05,366,209,大嘴说事不含糊,大嘴说事不含糊,可这才过去多久，相同的悲剧再次上演，只能说有过之而无不及。其表姐很是悲愤，在网上找人，希望女孩自己站出来，把男生给她花的6000刀还回来。,https://toutiao.com/group/7406251059406783012/,,0,0
前国足人员张鹭，身价7000万，娇妻是美女主持，却踢假球，养小三,2024-09-09 09:00,221,136,议史迹,议史迹,«——【·前言·】——»被C罗称之为“世界级门将”的国足人员张鹭，身价达7000万元，娇妻伴身，可谓是事业名利爱情应有尽有。却不想他竟然被人曝光踢假球，不仅如此，他放着家中美艳主持人娇妻不要却养小三，还每个月给20万元，一代名将瞬间跌落神坛，他为何要选择这样的道路？如今现状如何？,https://toutiao.com/group/7412558594517893643/,,0,0
你知道吗？天安门城楼上即将悬挂新的伟人画像,2024-09-08 10:24,29541,713,小賀拍摄,小賀拍摄,,https://toutiao.com/group/7412216237268140555/,,0,0
看了郭晶晶，再看陈若琳：才懂什么是“富贵相”，气质根本遮不住,2024-09-06 02:59,3004,656,阿悠爱穿衣,阿悠爱穿衣,一提到郭晶晶，很多人首先想到的是她在跳水领域的辉煌成就，但私下里，她那股不经意间流露出的“富贵气质”更是让人过目难忘，郭晶晶的“富贵”不在于她身上穿戴了多少名牌，而在于那份由内而外散发的从容与自信。,https://toutiao.com/group/7411358446073446949/,,0,0
整个村子就我一家了，干点啥都没人管没人问的，可安静了！,2024-07-31 09:20,48592,16425,小花姑娘,小花姑娘,整个村子就我一家了，干点啥都没人管没人问的，可安静了！,https://toutiao.com/group/7397727320137531956/,,0,0
苹果用户一觉起来愣了，iPhone16这也太...,2024-08-21 03:24,1100,1307,机椰街,机椰街,,https://toutiao.com/group/7405428521470722586/,,0,0
他活埋近5000名红军，却逃到国外安享晚年，如今竟然还有人歌颂他,2024-08-29 14:17,2732,518,历史特别冷,历史特别冷,这是红军最惨烈的一次征途，21800余名战士出征，只有400余人最终存活下来，其中一大部分红军甚至遭到了惨无人道的折磨，5000多名战士被活埋。,https://toutiao.com/group/7408524025946751542/,,0,0
巴黎残奥会完美收官，网友：这奖牌数看着真叫人舒服！,2024-09-08 13:32,2281,762,泼墨江湖事,泼墨江湖事,写在开头2024年巴黎残奥会，可不只是各种体育比赛的聚集之地，更是人类坚韧精神的绝佳展现舞台！五星红旗在赛场上频频升起，《义勇军进行曲》在巴黎的天空中屡屡奏响，中国体育代表团以断层式领先的奖牌数量震惊全球。,https://toutiao.com/group/7412257691202110004/,,0,0
两大保险巨头宣布破产，你的保单怎么办？揭秘背后的保障机制,2024-09-05 15:16,1851,252,爱生活的松鼠PP,爱生活的松鼠PP,两大保险巨头宣布破产，你的保单怎么办？揭秘背后的保障机制,https://toutiao.com/group/7411178205186359849/,,0,0
可爱的全红婵，用最呆萌的方式，做了最励志的采访，让人怎能不爱,2024-08-21 23:10,2558,218,以玉之诚,以玉之诚,奥运表彰大会的采访，让我们真正见识到一位纯真的17岁少女，是如何用最呆萌的方式来展现最励志的采访，这样的可爱正能量，让人如何不爱？,https://toutiao.com/group/7405734114302624308/,,0,0
老话说：“日不晒根，口不吞阳”啥意思？有何深意？,2024-08-26 14:40,16135,4517,国学客厅,国学客厅,老话说：“日不晒根，口不吞阳”啥意思？有何深意？,https://toutiao.com/group/7407458192470311434/,,0,0
台风袭击我国被越南冷嘲热讽，这下轮到你了，还笑的出来不?,2024-09-09 08:49,3128,163,共鸣哈哈哈,共鸣哈哈哈,,https://toutiao.com/group/7412562864408134198/,,0,0
事实证明，58岁定居澳洲生活的田震夫妇，早已走上了另一条大道,2024-09-04 05:39,1396,541,沐泠泱,沐泠泱,提起田震这位“歌坛天后”，相信大家再熟悉不过，90年代的她可谓是红极一时，在歌坛中的地位非同小可。然而当年这位火遍大江南北的歌手，却因“摔话筒事件”风波后，彻底消失在了大众的视野中。,https://toutiao.com/group/7410653485648937513/,,0,0
全红婵怎能社牛到这种程度，凭一己之力干翻娱乐圈让体坛直升巅峰,2024-09-05 10:28,4537,306,影小爆,影小爆,,https://toutiao.com/group/7411104054224355881/,,0,0
10公里的河道已显现，中国的施工队，没给柬埔寨运河留下后悔余地,2024-08-28 01:46,2843,175,海纳百川,海纳百川,10公里的河道已显现，中国的施工队，没给柬埔寨运河留下后悔余地,https://toutiao.com/group/7408000878503789066/,,0,0
联合国中美俄会费断崖：中国32亿，俄3.5亿，美国不仅最多还欠费,2024-08-27 11:40,12122,6333,慧言史说,慧言史说,可反观联合国会费情况，却让人直呼不可思议。我国以32亿位居第二，俄罗斯却仅有3.5亿，美国会费虽位居第一，却一直欠着不交。,https://toutiao.com/group/7407647733751841334/,,0,0
“人口警报”再次拉响，二胎效果不佳三胎没人生，奇葩建议频出！,2024-09-09 10:00,1898,3139,宇宙天文馆,宇宙天文馆,人口，在很长一段时间都是我国值得骄傲的资本，然而，现在我国的新生已经拉响了“警报”，而且还是影响国家发展的“红色警报”。,https://toutiao.com/group/7412579241352561152/,,0,0
要不是德媒报道，都不敢相信，中国已强大到无需再向世界证明什么,2024-09-08 14:42,584,149,靓小妹撩车,靓小妹撩车,不久前，德国《时代周刊》盘点了中国近些年来，在各项领域所取得的成就，例如：中国作为发展中国家，仅用40便实现了8亿人口的全面脱贫，在脱贫速度方面，堪称世界第一。,https://toutiao.com/group/7412281782445359656/,,0,0
几个月没见媳妇，刚回来就拽住媳妇又搂又抱，真是小别胜新婚啊！,2024-07-19 03:27,6919,598,瑞涵妈妈,瑞涵妈妈,,https://toutiao.com/group/7393183385576505890/,,0,0
李小璐母亲：我这辈子最后悔的决定，就是12年前让女儿嫁给贾乃亮,2024-09-05 08:02,337,1242,温辞韫,温辞韫,李小璐和贾乃亮这对曾经的金童玉女，如今再提起他们，不少也会感到有些唏嘘。或许，对于李小璐的母亲来说，她这辈子最后悔的决定，就是在12年前让自己的女儿嫁给了贾乃亮。,https://toutiao.com/group/7411062572536840740/,,0,0
寒门冠军不配得到尊重？全红婵夺冠饱受质疑，海军少将替她撑腰,2024-09-09 10:45,2908,372,大事迹,大事迹,,https://toutiao.com/group/7412592595085460009/,,0,0
