title,publish_time,like_count,comment_count,media_name,source,abstract,article_url,tag,is_yaowen,article_sub_type
时政现场说丨躬耕教坛 为国育才——办好人民满意的教育,2024-09-11 05:17,1102,140,央视新闻,央视新闻,全国教育大会9日至10日在北京召开，习近平代表党中央，向全国广大教师和教育工作者致以节日祝贺和诚挚问候。教育兴则国家兴，教育强则国家强。党的十八大以来，以习近平同志为核心的党中央把教育摆在优先发展的战略位置，引领教育事业取得历史性成就、发生格局性变化，教育大国阔步迈向教育强国。,https://toutiao.com/group/7413248517508727296/,,0,0
山东一女生被同学锥子扎218针，校服全是孔，官方:未达到霸凌标准,2024-09-09 08:04,146,242,爱吐槽的网文大呀,爱吐槽的网文大呀,（图片与信息来自官媒：潇湘晨报）难以想象！！山东一女生被同学锥子扎218针，校服全是孔，母亲痛哭：“那长的针头啊，肌肉都坏死了！”而官方的答复：“未达到霸l的标准！”母亲痛诉：“男生家里有背景！,https://toutiao.com/group/7412539048541880884/,,0,0
运八悲壮坠入南海，十二英雄壮烈牺牲,2024-09-06 01:14,4715,136,静思惜时,静思惜时,,https://toutiao.com/group/7411332385256276521/,,0,0
华为三折叠屏手机公布价格后引起热议，要笑死在网友评论里！,2024-09-10 22:16,116,396,大嘴巴鲸鱼,大嘴巴鲸鱼,近日，我们的国产品牌华为发布了一款高端商务的高科技手机，它有三块屏幕，并且还很薄，在发布会上，展示了这款手机的许多特色功能，现场也是一片叫好，虽然知道价格不会便宜，但当报价出来后，还是全场沉默了……网友们看到这款手机的心态：好消息——手机很牛逼坏消息——两万少一块当看到这里，许多,https://toutiao.com/group/7413141472012141097/,,0,0
反响来了！教师节安徽一女老师被举报收取家长贵重礼品，官方介入,2024-09-11 03:51,237,425,司柠,司柠,昨日，9月10日是我国第40个教师节，这个节日对老师们来说意义非凡，而在这一天，老师们将会受到很多学生和家长，还有社会各界的礼物来表达对教师们奉献和教育工作成果的认可还有感谢。,https://toutiao.com/group/7413214340301554211/,,0,0
2013年，湖南26岁女孩嫁给71岁老头，婚后还生下一子，如今怎样了,2024-07-12 11:59,18794,2059,智史通鉴,智史通鉴,2013年4月17日，长沙宁乡县的民政局迎来了一对特殊的夫妻。一个71岁的老头和一个26岁的女孩，离远了看，甚至像爷爷和孙女。面对工作人员异样的眼光，女孩说：“我和他是真心相爱的！”这让人好奇，这对相差45岁的夫妻，他们之间到底有着怎样的爱情故事？,https://toutiao.com/group/7390696631223534120/,,0,0
首次世界五百强断崖差距 日本149家，美国151家，中国3家，现在呢,2024-09-06 09:57,2626,675,周律鸣法,周律鸣法,1995年，当《财富》杂志首次以严谨而权威的姿态，揭晓了全球前500家企业的辉煌阵容时，那份榜单映照出了国际竞争力的微妙格局。,https://toutiao.com/group/7411466323206603300/,,0,0
71年杨振宁和岳父母杜聿明、曹秀清合影，站在一旁，显得毕恭毕敬,2024-09-02 05:26,783,451,万物知识局,万物知识局,完美的爱情在世间似乎是鲜少存在的，即便是恩爱的夫妻在相处中也会有磕磕绊绊，待到结局时更是无法用完美来作为结束，而在曾经动荡的年华中，一边要在国家时局中安稳度日，一边还要维系自己的爱情，更是难上加难。,https://toutiao.com/group/7409132056879383080/,,0,0
韩国足协人士：若中国足协将禁足决定通知FIFA，那在韩国同样适用,2024-09-10 08:10,1203,732,直播吧,直播吧,直播吧09月10日讯 中国足协今日公布了对足坛假赌黑涉案人员的行业处罚， 前山东泰山球员孙准浩遭到终身禁足。据韩联社报道，日前，大韩足球协会相关人士表示，若一国足协将一定水平以上的处罚决定通知国际足联（FIFA），相关结果将在国际范围内适用。,https://news.zhibo8.com/zuqiu/2024-09-10/66dffb744ff59native.htm,,0,0
领土谈判终有果，不丹决定归还1500平方公里领土，印度不同意,2024-09-10 06:06,2740,192,凉薯不凉,凉薯不凉,,https://toutiao.com/group/7412891854313620006/,,0,0
我拿你当哥们，你却骗我去领证！,2024-09-07 06:57,17042,3792,爆笑小黑仔,爆笑小黑仔,,https://toutiao.com/group/7411791843178611251/,,0,0
二哈死活不愿带娃，当主人把娃强行塞给二哈后，你们都憋住别笑！,2024-07-11 12:04,55490,9072,小黑小黄的幸福狗生,小黑小黄的幸福狗生,马桶说我这一天天的太难了，哈哈哈,https://toutiao.com/group/7390348029905076751/,,0,0
有一种“算计”叫英达和梁欢，结婚27年后，善恶报应终于应验了,2024-08-27 11:28,2018,177,法老不说教,法老不说教,为提升文章可读性，细节可能存在润色，请理智阅读，仅供参考!“要是没有英达，现在的梁欢一定不会两眼无光，沦为英达事业的牺牲品。”,https://toutiao.com/group/7407769963749589554/,,0,0
宋江喝下毒酒，才恍然大悟：原来梁山真正的老大，从来都不是自己,2024-07-31 06:24,3962,148,陌闻史谈,陌闻史谈,前言梁山这一百零八条好汉各有各的性格，也各有各的擅长点，但是对于梁山的领头羊、梁山的老大不用说大家也知道是谁。在晁盖死后，整个梁山都是宋江做主，最初宋江也一直都是这样以为的，但直到他临终之际才幡然醒悟这梁山的老大从来都不是自己。,https://toutiao.com/group/7397668220121743907/,,0,0
“带母上学”研究生杨元元，在宿舍自缢：没人想要被脐带拴一辈子,2024-09-10 10:20,265,174,蕴藏冬夏,蕴藏冬夏,杨元元，本是武汉大学的高材生，还考上了上海海事大学的研究生。最后却选择用两条毛巾在洗手台上结束了自己的生命。,https://toutiao.com/group/7412953585699127860/,,0,0
狗狗偷偷上床跟男主睡，没想到女主突然杀个回马枪！看一遍笑一遍,2024-07-30 13:35,6079,811,小黑小黄的幸福狗生,小黑小黄的幸福狗生,马桶太逗了,https://toutiao.com/group/7397422044303393315/,,0,0
给“扮演毛主席”的10位演员排座次：古月只排第2，唐国强未进前3,2024-08-26 06:52,5151,1834,香港电影怀旧,香港电影怀旧,国家一级演员王霙去世，享年66岁。从艺40余年，他的一生基本上为一个角色服务，那就是毛主席。关于王霙的过往，我们下面有详细介绍。回看影视作品中的主席形象，很多演员都给出了印象深刻的表演。既有古月、张克瑶等老一辈的神级演绎，也有侯京健、王仁君等年轻演员的传神表现。,https://toutiao.com/group/7407335713588511247/,,0,0
海南出现“转世人”：6岁凭记忆找到前世的家，一眼认出前世情人,2024-08-29 10:54,8390,1360,墨影云光,墨影云光,"他是中国首位被公开报道的“转世轮回”案例!他在3岁时恢复了“前世记忆”，6岁时找到了自己的“前世之家”,更令人震惊的是，他只在人群中看了一眼就认出了自己的“前世情人”。为此，当地的村民们都震惊不已，就连记者都争先恐后地前来采访。那么这一切这究竟是怎么回事？这个男孩后来又怎么样了？",https://toutiao.com/group/7408505519243002402/,,0,0
吴姐不听劝，东北花1万多买一套170平房子，维修费3700元,2024-09-10 22:03,644,143,青旋大海,青旋大海,,https://toutiao.com/group/7413138445066830345/,,0,0
看到全红婵被陈若琳“警告”，才明白比赛结束后的全妹有多放肆,2024-09-07 10:05,2121,203,娱小爆来了,娱小爆来了,,https://toutiao.com/group/7411840100872487465/,,0,0
男子乘飞机偶遇空姐前女友，戴着口罩没被认出，摘下口罩对方变脸,2024-08-16 09:39,9573,1940,云上新闻,云上新闻,男子乘飞机偶遇空姐前女友，戴着口罩没被认出，摘下口罩对方变脸,https://toutiao.com/group/7403669641775088154/,,0,0
刘亦菲（美国），被取消金鹰奖入围资格,2024-09-11 00:57,1974,2457,观察者网,观察者网,9月10日晚，#金鹰奖删除刘亦菲入围资格#冲上热搜，引发关注。 据了解，第三十二届中国电视金鹰奖已开始投票，刘亦菲本来凭借主演《去有风的地方》《梦华录》两部作品入围第一轮，但是在第二轮投票开始后，其入围资格就被取消。,https://www.guancha.cn/politics/2024_09_11_748024.shtml,,0,0
哈里斯、特朗普辩论结束，奥巴马发文：她将成为所有美国人的总统,2024-09-11 03:48,1840,2244,界面快讯,界面快讯,当地时间9月10日晚，美国前总统、共和党总统候选人特朗普同美国副总统、民主党总统候选人哈里斯参加由美国广播公司（ABC）在费城举办的电视辩论。辩论结束后，美国前总统奥巴马在社交平台上表示，今晚大家亲眼目睹了谁拥有推动这个国家前进而不是分裂国家的远见和力量。,https://m.jiemian.com/article/11705058_ttkx.html,,0,0
首次世界五百强断崖差距: 日本149家，美国151家，中国3家，现在呢,2024-09-06 03:45,348,764,此间一叙a,此间一叙a,1995年，世界五百强榜单出世，迅速吸引了全球经济界的目光，时至今日，这一数据已经成为评判一个国家经济实力的重要指标。,https://toutiao.com/group/7411368105638658601/,,0,0
我怀疑我家狗是人变的，和我交流沟通毫无障碍，不信你们看,2024-06-16 01:54,22992,22117,大比熊芒果,大比熊芒果,,https://toutiao.com/group/7380913715618513443/,,0,0
小杨哥这一刻是在想沫沫吗#头条双星激励计划,2024-09-10 15:51,384,498,很高興認識你0u3m,很高興認識你0u3m,,https://toutiao.com/group/7413042689412694569/,,0,0
周继红中国奥运跳水第一金，看完你就明白，为什么全红婵百年难遇,2024-09-03 08:49,3151,1872,波波体育,波波体育,,https://toutiao.com/group/7410336254924948020/,,0,0
美债市场迎来巨变，最大接盘侠买走70%美债，不是英国日本,2024-09-11 01:30,1493,271,张璐说一说,张璐说一说,美债市场迎来巨变，最大接盘侠买走70%美债，不是英国日本,https://toutiao.com/group/7413191743111168549/,,0,0
央视给路虎女司机一锤定音了吗？以后千万要按这规矩来,2024-09-05 07:56,33262,3859,霏儿说,霏儿说,,https://toutiao.com/group/7411064768301105716/,,0,0
张学良晚年回忆：之前我从不迷信，但是在杀杨宇霆时，我不得不信,2024-07-17 11:11,8716,880,来点解读,来点解读,奉系军中威名赫赫、功绩卓越的杨宇霆就这样离开了人世，杀他的人正是他看不上眼的“纨绔子弟”张学良。晚年自述时，张学良表示:“原本我这个人并不迷信，但杀杨宇霆时我却不得不信了!”,https://toutiao.com/group/7392560082111857191/,,0,0
院子里跑进一只“狗母蛇”，小孩见到后哇哇大叫，拍给大家看一下,2024-06-29 16:57,57135,6679,乡农小陈,乡农小陈,院子里跑进一只“狗母蛇”，小孩见到后哇哇大叫，拍给大家看一下,https://toutiao.com/group/7385970341836751423/,,0,0
1米3袖珍美女：执意嫁1米48袖珍男人，婚后丈夫“长高”抛弃妻子,2024-08-27 13:30,5737,1006,鲨娱崽崽,鲨娱崽崽,新郎和新娘看上去像十几岁的小孩子，众人疑惑不已: 他们到结婚年纪了吗?事实上这对夫妻是袖珍人。新郎29岁，身高1米48;,https://toutiao.com/group/7407720729992643099/,,0,0
联合国中美俄会费断崖：中国32亿，俄3.5亿，美国不仅最多还欠费,2024-08-27 11:40,12361,6387,慧言史说,慧言史说,可反观联合国会费情况，却让人直呼不可思议。我国以32亿位居第二，俄罗斯却仅有3.5亿，美国会费虽位居第一，却一直欠着不交。,https://toutiao.com/group/7407647733751841334/,,0,0
与袁立分手的徐威，娶到张怡宁后，如今过得怎样,2024-08-06 06:55,8991,1058,陌上史无言,陌上史无言,写作不易，作者每天也是在公司上班写文章，天天加班到晚上12点，每天收益只有50多块，文中加入5秒广告解锁，就是能为了多几块收益，希望不要在骂了，希望观众老爷理解[浮云]哪怕到了今天，乒乓球历史上的“大魔王”依旧没有改变，张怡宁一直是乒乓球历史上无法超越的传奇人物。,https://toutiao.com/group/7399912939865571894/,,0,0
全红婵的奖金高达千万？她大智若愚的爸爸和哥哥，给出同样的回答,2024-08-01 13:14,6939,1297,笑侃娱乐圈,笑侃娱乐圈,全红婵再夺金，奖金千万？7月31日，全红婵和陈芋汐在巴黎奥运会跳水女子双人10米台比赛中，又又又摘金了！举国欢庆的时候，媒体朋友们也没闲着，跑去采访了全红婵一家。结果呢，采访过程，简直就是一场“实在人”现场教学！（视频来源于网络）媒体：“听说全红婵的奖金高达千万？,https://toutiao.com/group/7398137961067430412/,,0,0
美债最大“接盘侠”诞生，疯狂买走70%美债，并非日本、英国,2024-09-06 10:48,5705,296,诺言卿史录,诺言卿史录,作为世界上最大的三个美债持有国，中国、日本和英国在近些年先后对美债进行了抛售。可就在这个时候，美债最大“接盘侠”诞生了，竟然在短时间内，疯狂买走70%美债!,https://toutiao.com/group/7411460329367552550/,,0,0
几个月没见媳妇，刚回来就拽住媳妇又搂又抱，真是小别胜新婚啊！,2024-07-19 03:27,6939,599,瑞涵妈妈,瑞涵妈妈,,https://toutiao.com/group/7393183385576505890/,,0,0
华南农业大学2024级新生开学典礼，婵宝的自我介绍：婵宝说她是跳水运动员，没有说她是跳水冠军！多么低调的孩子！#谢思埸#全红婵#陈清晨 ##奥运冠军#华南农业大学#开学典礼,2024-09-04 19:25,5960,635,热心熊猫5mdC8a,热心熊猫5mdC8a,,http://toutiao.com/item/7410871211556602403/,,0,0
媳妇打麻将到半夜，以为老公出差没回家，进门这波操作老公看懵了,2024-08-19 08:48,16988,2137,涵涵麻麻爸比,涵涵麻麻爸比,媳妇打麻将到半夜，以为老公出差没回家，进门这波操作老公看懵了,https://toutiao.com/group/7404769776171483674/,,0,0
西游记中存在的低级漏洞，专家也未曾发现，却被小学生当众曝光,2024-08-08 22:09,7334,2647,靑云历史,靑云历史,,https://toutiao.com/group/7400708821162656291/,,0,0
终于明白为啥死囚被执行时比鸡还顺从！网友的回复让我大开眼界！,2024-09-01 15:38,292,277,魔法师深州,魔法师深州,文 | 魔法师深州编辑 | 魔法师深州还在犹豫什么？财富和好运，都藏在关注里！赶紧加入我们，一起迎接幸运和财富的到来吧！,https://toutiao.com/group/7409699563881103922/,,0,0
在南宁待了30年，第一次见到那么可怕的水位,2024-09-10 04:55,623,220,青鱼,青鱼,,https://toutiao.com/group/7412873522470453814/,,0,0
人心变了！交警执行任务，被变道车撞成重伤，评论区却是一片嘲讽,2024-09-10 14:01,1669,1371,无敌看天下,无敌看天下,,https://toutiao.com/group/7413014368155075082/,,0,0
郑钦文不忍了！炮轰美网3大针对，在中国比赛绝不这样,2024-09-04 09:20,1659,367,小智观体育,小智观体育,,https://toutiao.com/group/7410715009103987212/,,0,0
11人踢10人，国足还是输了！“退钱哥”：高昂的门票价格，还来了4.8万多名球迷,2024-09-11 00:47,149,623,极目新闻,极目新闻,9月10日晚，2026世界杯预选赛亚洲区18强赛的第二轮比赛中，中国男足在主场早早取得1比0领先且多打一人的“梦幻开局”之下遭沙特阿拉伯2-1逆转。18强赛两连败后，国足以0分排名小组垫底，国足主帅伊万科维奇也陷入信任危机。图源：新华社本场比赛，中国队在第14分钟率先取得进球。,http://jms.ctdsb.net/jmythshare/#/index_share?cId=0&contentType=5&contentId=2251696,,0,0
从高考712分，到嫁给农村光棍生育6个娃，她用半生诠释了人生无常,2024-08-28 11:04,9022,1268,书雁飞史,书雁飞史,"1994年，寒门贵子伍继红，以712分的高考成绩，考入中国人民大学。令人意外的是，毕业之后本该享受事业高枕无忧的她，却甘愿嫁给山村“老光棍”，用17年光阴换来6个娃，日子穷到仅能靠低保来维持生活。究竟什么样的人生转折，才让她从意气风发的高材生，沦为苦命的""生育机器""？",https://toutiao.com/group/7408141756992160256/,,0,0
等到5年后，一套100万的房子能值多少钱？听听内行人怎么说？,2024-09-06 23:00,3608,1088,浩哥自媒体,浩哥自媒体,,https://toutiao.com/group/7411480883015713295/,,0,0
江苏美女道士胡小慧被捕，精通“胡媚术”，九名男徒弟揭露其罪行,2024-08-10 09:01,888,269,此间一叙a,此间一叙a,古有妲己利用“狐媚术”摧毁大商根基，今有胡小慧利用“狐媚术”骗取数百万，更奇葩的是十里八乡的人们对她深信不疑，促使她在当地混的风生水起。令人咂舌的是这个人还是个女道士，直到2019年她被成功逮捕，手下九名男徒这才揭露了真相，原来背后竟是一场精心策划好的骗局。,https://toutiao.com/group/7401412561637245455/,,0,0
老炸裂了！男子留学美国供养女友，女友出轨夜店露奶给三个黑哥看,2024-08-23 10:05,367,210,大嘴说事不含糊,大嘴说事不含糊,可这才过去多久，相同的悲剧再次上演，只能说有过之而无不及。其表姐很是悲愤，在网上找人，希望女孩自己站出来，把男生给她花的6000刀还回来。,https://toutiao.com/group/7406251059406783012/,,0,0
沫沫第一次见小杨嫂,2024-09-06 08:30,3911,1050,旅行家小鱼,旅行家小鱼,,https://toutiao.com/group/7411444708347478538/,,0,0
笑不活了，全红婵最新动态回京就被陈若琳训上了，网友评论区笑死,2024-09-05 16:04,1011,334,小莫爱八卦,小莫爱八卦,近日，刚刚随中国奥运代表团结束访问港澳之行的全红婵的最新动态引发热议，回家就被陈若琳训上了一脸生无可恋…不管是巴黎奥运会还是港澳之行，全红婵都是火了，可以说是以一己之力干翻了内娱。,https://toutiao.com/group/7411119239672742440/,,0,0
三峡大坝已经运行了20年，当初投入的2500多亿元，如今回本了吗,2024-06-19 03:20,8375,4628,科普10克,科普10克,要是提到我国的水利工程，那么大家第一时间想到的肯定是三峡大坝，距建成投入到如今已经有二十多年的历史了。,https://toutiao.com/group/7382044987539587584/,,0,0
路虎女：我倒了三把，他一直往前顶别我车！详细视频对话曝光,2024-09-02 17:00,1729,7561,大料博士,大料博士,先上视频：撰文/李维斯青岛警方发文澄清，逆行打人路虎女目前已经被采取拘留措施，并不像网传那样在家“居留”，这事儿在网上发酵好几天了，有人说要反转了，原因是以上视频。这断视频中，路虎女一直在指责谩骂小伙子，说他太坏，也什么呢？因为她认为小伙子在故意为难她！,https://toutiao.com/group/7410082966158541321/,,0,0
猪肉中“最毒”器官，我国虽明令禁止，但还有人不知情在买来吃,2024-08-23 08:06,6273,448,北纬的咖啡豆,北纬的咖啡豆,肘子猪蹄五花肉，配上小酒舒舒服，在外辛苦工作一天的打工人们，晚上下班之后来一碗香喷喷猪脚饭和炖排骨，再配上一点小啤酒吃饱喝足，疲惫的身体瞬间就能得到满足。,https://toutiao.com/group/7406238335636718091/,,0,0
植物大战僵尸：开局植物五选一，该如何对敌？,2024-06-27 08:27,2138,128,爱吃鱼的小鹿同学,爱吃鱼的小鹿同学,植物大战僵尸：开局植物五选一，该如何对敌？,https://toutiao.com/group/7385096963094250047/,,0,0
天安门往南3公里，北京龙须沟真实现状，不是亲眼看到谁敢相信啊,2024-08-27 22:06,18596,6066,北京旅游等着瞧,北京旅游等着瞧,,https://toutiao.com/group/7407810359739810331/,,0,0
六位世界冠军，争全国冠军大决战，看全红婵如何逆转,2024-09-04 10:48,1293,125,长庚体坛,长庚体坛,,https://toutiao.com/group/7410737961827828262/,,0,0
雪上加霜，越南太难了#越南 #边境线 #越南桥梁坍塌,2024-09-10 08:18,3453,382,越南安安瑶族,越南安安瑶族,,https://toutiao.com/group/7412925953375994402/,,0,0
2005年高秀敏意外猝死，13年后情夫何庆魁揭露：撒谎把命搭进去了,2024-08-29 02:59,1137,314,MayHo美好,MayHo美好,在中国春晚的历史上，曾经有三个人的名字那是家喻户晓。13年后何庆魁在节目上揭露:高秀敏撒谎把命搭进去了。,https://toutiao.com/group/7408387191304454682/,,0,0
他活埋近5000名红军，却逃到国外安享晚年，如今竟然还有人歌颂他,2024-08-29 14:17,2735,518,历史特别冷,历史特别冷,这是红军最惨烈的一次征途，21800余名战士出征，只有400余人最终存活下来，其中一大部分红军甚至遭到了惨无人道的折磨，5000多名战士被活埋。,https://toutiao.com/group/7408524025946751542/,,0,0
自家麦田遭大面积破坏，男子买来无人机一看，幸亏自己没进去！,2024-07-10 09:57,13818,1022,咯嘣脆动物圈,咯嘣脆动物圈,自家麦田遭大面积破坏，男子买来无人机一看，幸亏自己没进去！,https://toutiao.com/group/7389944118878667316/,,0,0
世界第一绝望趴桌！韩国名将疯狂搏杀击败王楚钦，赛后激动到抽筋,2024-09-03 08:50,2334,456,小爬乒乓,小爬乒乓,究竟发生了什么，让对手在赛后激动到双脚抽筋走不动路。又是什么，让世界第一的王楚钦绝望的趴在桌上。这一幕发生在釜山世乒赛。本场比赛是王楚钦对阵韩国选手张禹珍。张禹珍是一位实力很强的队员，曾在韩国公开赛成就三冠王。不过张禹珍六次对阵王楚钦，只赢了一次，完全处于劣势。两人都是顶尖高手，而且球风都很硬朗。,https://toutiao.com/group/7410336619686789644/,,0,0
怎一个“惨”字了得，8月销量不足10台的车型，居然有22款之多,2024-09-10 04:22,517,696,老四说车,老四说车,8月汽车整体销量排行榜最新出炉，8月销量不足10台的车型居然有22款之多，奔驰、日产、丰田均榜上有名。,https://toutiao.com/group/7412847407266693668/,,0,0
太震撼了，很多人一辈子，都见不到这种场面,2024-08-05 11:01,2333,445,一人行走的远方,一人行走的远方,,https://toutiao.com/group/7399610031555117578/,,0,0
台风袭击我国被越南冷嘲热讽，这下轮到你了，还笑的出来不?,2024-09-09 08:49,3604,188,共鸣哈哈哈,共鸣哈哈哈,,https://toutiao.com/group/7412562864408134198/,,0,0
你知道吗？天安门城楼上即将悬挂新的伟人画像,2024-09-08 10:24,31171,741,小賀拍摄,小賀拍摄,,https://toutiao.com/group/7412216237268140555/,,0,0
新型保姆”出圈了，既不用住家也不是钟点工，很受大家的欢迎！,2024-09-09 21:00,1430,346,米娅聊家常,米娅聊家常,新型保姆”出圈了，既不用住家也不是钟点工，很受大家的欢迎！,https://toutiao.com/group/7412589584950755852/,,0,0
李佩霞已经死亡，李父被禁言？官方：全是谣言！网友：该信谁？,2024-09-10 20:27,1011,118,一往无前湖泊tAs,一往无前湖泊tAs,,https://toutiao.com/group/7413113665466925608/,,0,0
梁山上唯一没有朋友的好汉：没人和他玩，就算生病到死都没人问津,2024-06-16 21:04,2253,1243,方圆讲历史,方圆讲历史,但是在宋朝这种重文轻武的大环境影响之下杨志的愿望也是很难实现的，不过杨志本人确实是很争气，在科举考试中拔得头筹，成为了一名武举人。,https://toutiao.com/group/7380305699118514699/,,0,0
中美日军舰数量对比：美国为243艘，日本是114艘，中国是多少呢？,2024-06-14 09:36,14012,674,齐医生言犹在,齐医生言犹在,因为当时的通讯水平比较有限，对于大多数人来说，他们对世界的认知就只有自己周围的一圈，所以也没有必要建设一支强大的海军。,https://toutiao.com/group/7380285798689636879/,,0,0
不要被电视剧骗了！真正的清朝，其实是这个样子,2024-07-08 03:49,5120,1273,摄影圣典,摄影圣典,争风吃醋、宫斗不断，这就是清宫剧、古装剧最典型的特点。几百年前的清朝，社会生产力还很落后，人们穿的都是麻布衣服，而不是剧中那种人人都穿丝绸。,https://toutiao.com/group/7389099011841507880/,,0,0
08年，汶川地震22岁女孩被40岁大叔救下，以身相许，后来幸福吗？,2024-07-03 11:45,19422,1102,青一说,青一说,2008年，一名22岁的河南女孩在汶川旅游途中不幸遇到大地震，危急时刻，一名40岁的大叔将她成功救出。,https://toutiao.com/group/7387359290954154496/,,0,0
18强赛-蒋圣龙造乌龙+红牌 卡迪什双响+绝杀 国足1-2十人沙特吃连败,2024-09-10 14:04,10266,50332,菱镜头,菱镜头,北京时间9月10日，世预赛亚洲区18强赛C组第2轮的较量中，国足迎来首个主场，对阵三档球队沙特队。,https://toutiao.com/group/7412997074788172326/,,0,0
