title,media_name,source,abstract,article_url,comment_count,like_count,publish_time,tag,is_yaowen,article_sub_type
联播观察｜中非共建“一带一路”启新篇,央视网,央视网,联播+中非共建“一带一路”，是造福中非人民的共同繁荣之路。截至9月2日，52个非洲国家以及非洲联盟与中国签署了共建“一带一路”合作谅解备忘录。从“硬联通”到“软联通”，再到“心联通”，通过共建“一带一路”，中非合作硕果累累。“互利合作是符合各国长远和根本利益的阳光大道。,https://toutiao.com/group/7412080714713170442/,135,1032,2024-09-08 09:41,,0,0
泽连斯基成“光杆司令”？乌克兰彻底大乱，再闹下去，或被赶下台,豆包,豆包,文丨豆包编辑丨豆包最近，乌克兰的政坛真是一波未平一波又起，谁也没想到，原本在战场上忙得焦头烂额的泽连斯基，现在还要面对国内官员的“集体辞职潮”。好家伙，这一波操作，直接让大家都看懵了——乌克兰高层的这场“地震”，到底是怎么回事？泽连斯基还能顶得住吗？,https://toutiao.com/group/7412082070626845194/,111,477,2024-09-08 09:44,,0,0
全球约一半肝癌在中国，再次提醒：家中的4种食物，尽早撤下餐桌,梁医学社梁怡璋医生,梁医学社梁怡璋医生,,https://toutiao.com/group/7402540119712629311/,3120,80045,2024-08-13 16:36,,0,0
"中菲南海决死战""刺刀要见红""！美供菲40架F-16战机大对决",黄阿原,黄阿原,,https://toutiao.com/group/7411884820051821091/,107,1400,2024-09-08 11:30,,0,0
9月8号，北京到底冷到什么程度，看看大街上人们穿的衣服吧！,清风快乐游,清风快乐游,,https://toutiao.com/group/7412085505535246899/,351,2305,2024-09-08 09:57,,0,0
中国首例5胞胎现状曝光：父亲过劳去世，如今22年过去，母亲竟然直言后悔……,读者,读者,在我看来，这个故事更为让人动容的地方，是爱和责任。缴宝存殚精竭虑、省吃俭用，只为一家人撑起一片天;王翠英将5个孩子全都带在自己身边，教他们识字，教他们做人，教他们团结友爱。,https://toutiao.com/group/7404674971840086540/,1128,3638,2024-08-19 16:57,,0,0
哈哈有证据了,影视库,影视库,,https://toutiao.com/group/7383547217434378763/,174,811,2024-06-23 12:14,,0,0
"万万没想到,53岁“丁克”半辈子的康辉，一生遗憾竟然是一通电话",峰哥正读,峰哥正读,在阅读此文之前，麻烦您点击一下“关注”，既方便您进行讨论和分享，又能给您带来不一样的参与感，感谢您的支持！文/编辑：蘑菇百善孝为先。但是到底怎么做才算是“孝”，康辉用了半辈子才明白。央视知名主持人康辉，事业顺遂，家庭幸福，在外人看来是一个人生赢家。,https://toutiao.com/group/7405504703687115273/,3177,14185,2024-08-22 06:14,,0,0
又一大佬跑路！卷走62亿跑路，令上千员工、投资者血本无归,笑史云烟,笑史云烟,极目科技总共在全球40多个城市都设立有办事机构，旗下更是拥有上千名员工，且在这上千名员工之中，有800多人都是公司的研发人员。,https://toutiao.com/group/7411400906702389775/,2060,5762,2024-09-06 14:06,,0,0
2011年，20岁的她全裸接受记者采访，并称：你们敢看我吗？,卿羽飞,卿羽飞,这之后，也使得她从学校退学，并且消失在大众眼中数年，尽管之前就已经有一位从事艺术行业的前辈，给予了她不俗的评价。,https://toutiao.com/group/7407384275433095699/,642,5512,2024-08-26 18:08,,0,0
为什么说从2025年开始，70岁以上的老人，可能面临“两大”问题？,水大叔,水大叔,据可靠数据了解，我国70岁以上的人口数量已经达到了2.5亿人次，占到全国总人口数量的18%。伴随着人口老龄化的出现，养老问题也成了重中之重，要知道养老不仅仅是家庭的责任，更是社会责任。,https://toutiao.com/group/7409677025897710106/,240,1859,2024-09-01 22:12,,0,0
曹德旺说：我不会逃跑，但要给政府提个醒 #曹德旺 #福耀科技大学,正直鲸鱼LxhXfoC,正直鲸鱼LxhXfoC,,https://toutiao.com/group/7385443277144588834/,3359,23974,2024-06-28 14:51,,0,0
2013年，湖南26岁女孩嫁给71岁老头，婚后还生下一子，如今怎样了,智史通鉴,智史通鉴,2013年4月17日，长沙宁乡县的民政局迎来了一对特殊的夫妻。一个71岁的老头和一个26岁的女孩，离远了看，甚至像爷爷和孙女。面对工作人员异样的眼光，女孩说：“我和他是真心相爱的！”这让人好奇，这对相差45岁的夫妻，他们之间到底有着怎样的爱情故事？,https://toutiao.com/group/7390696631223534120/,1978,17788,2024-07-12 19:59,,0,0
恭喜中国女篮新领袖终于出现了！百发百中！统治力让对手深深绝望,乐播体育,乐播体育,,https://toutiao.com/group/7384335028576059923/,1168,22742,2024-06-25 15:11,,0,0
开国上将家中去世，死后无一人吊唁，儿子：没想到死后却进了医院,品古观今,品古观今,1980年7月25日，与许世友并称“山东双雄”的开国上将王建安告别了他波澜壮阔的一生，在家中悄然去世。,https://toutiao.com/group/7400697093196628480/,120,14672,2024-08-08 17:29,,0,0
写歌30年穷困潦倒，前妻失望选择离婚，谁料51岁靠一首歌一夜成名,八号探秘人,八号探秘人,在阅读此文之前，辛苦您点击一下“关注”，既方便您进行讨论和分享，又能给您带来不一样的参与感，感谢您的支持！编辑：LY无数人都想要一个一夜成名的机会，但机会来了也不是每个人都能把握住的。他用了三十年的时间来准备迎接属于自己的机会。为了这个机会他放弃了一切，甚至包括家庭。,https://toutiao.com/group/7402090890367484428/,2568,14604,2024-08-12 11:37,,0,0
好物分享｜吃了几十年的红烧肉，很多人还没吃过这样烧，颜色红亮不柴不油腻,最美家常菜刘凯,最美家常菜刘凯,川菜师傅教你梅干菜红烧肉的做法，用花雕酒来烧，肉香不柴也不油腻，放浙江的梅干菜那才叫一个香，一起来看看到底是怎么制作的吧，农业，农村，农民，川菜，美食，梅干菜烧肉,https://toutiao.com/group/7389664009613476352/,107,584,2024-07-11 09:16,,0,0
