title,publish_time,like_count,comment_count,media_name,source,abstract,article_url,tag,is_yaowen,article_sub_type
熊猫一掌把宝宝推开后，忽然想起是自己亲生的，接下来大家别笑,2024-07-29 08:39,3212,131,龙龙在解说,龙龙在解说,熊猫一掌把宝宝推开后，忽然想起是自己亲生的，接下来大家别笑,https://toutiao.com/group/7396974565097734671/,,0,0
华为三折叠手机，遭遇最强竞争对手，八折叠奏折手机！,2024-09-11 03:04,857,348,信天游,信天游,,https://toutiao.com/group/7413215952961012235/,,0,0
陈若琳,2024-08-09 15:55,1919,133,娱乐探秘者,娱乐探秘者,,http://toutiao.com/item/7401169040053371444/,,0,0
一只报复心极强的羊，每天和爷爷斗智斗勇，因为挨揍上了央视！,2024-08-28 11:14,24255,1989,雪姐故事说,雪姐故事说,,https://toutiao.com/group/7408147232861454884/,,0,0
沙僧只封了金身罗汉，为啥一声不吭？你看如来给了他什么好处,2024-08-07 10:42,4295,1490,来点解读,来点解读,在《西游记》的大结局里，唐僧师徒四人成功取得真经，佛祖如来也是言出必行，对他们之前的种种努力和贡献都一一兑现了承诺。唐僧成功成佛，孙悟空荣升斗战胜佛，就连那爱吃爱睡的猪八戒也摇身一变成了净坛使者，享尽美食。可轮到沙僧这儿，就只封了个金身罗汉。,https://toutiao.com/group/7400345643971183138/,,0,0
青城派掌门人出山，擂台教育网红打得他不能还手,2024-07-11 13:29,18088,6559,格斗新势力,格斗新势力,青城派掌门人出山了，擂台教育网红打得他不能还手,https://toutiao.com/group/7390369776318546447/,,0,0
河南28岁女子一夜变老，医院怎么也查不出原因，11年后才知真相,2024-08-28 07:18,5740,325,静枫听史,静枫听史,因为生孩子，妙龄少女在一夜之间变成了七十老妇？当时年仅28岁的胡娟，在生完孩子不久之后，竟一夜变老，皮肤苍老松弛般就如七八十岁的老妇。然而辗转各大医院，却始终查不出病因所在，直到11之后才得知真相。那么到底是什么原因导致了胡娟一夜变老呢，她最后又恢复原本的容貌了吗？,https://toutiao.com/group/7408086014138253833/,,0,0
男子乘飞机偶遇空姐前女友，戴着口罩没被认出，摘下口罩对方变脸,2024-08-16 09:39,9599,1943,云上新闻,云上新闻,男子乘飞机偶遇空姐前女友，戴着口罩没被认出，摘下口罩对方变脸,https://toutiao.com/group/7403669641775088154/,,0,0
帮大妈清理荒废40年的祖宅，这房子够阴森的，结果清理出来傻眼了,2024-06-21 08:40,40522,5678,创意花园美艺,创意花园美艺,帮大妈清理套荒废40年的祖宅，看着就挺阴森，结果清理出来傻眼了,https://toutiao.com/group/7382808201818800690/,,0,0
《黑神话･悟空》高清电影版,2024-09-08 12:18,2495,403,牛牛看世界,牛牛看世界,,https://toutiao.com/group/7412245496745427510/,,0,0
白鲸吓唬人从未失手，却败在一个小女孩手中，气得它拿头撞玻璃！,2024-08-16 08:36,4704,240,小萌动物圈,小萌动物圈,白鲸吓唬人从未失手，却败在一个小女孩手中，气得它拿头撞玻璃！,https://toutiao.com/group/7403653507650748979/,,0,0
我的研究生生活就这样拉开序幕了～😃😃#大学生 #研究生 #开学,2024-09-07 09:43,1704,190,乘风破浪小徐啊,乘风破浪小徐啊,,https://toutiao.com/group/7411834563515417097/,,0,0
诸葛亮为何无法一统三国？毛主席的评价直切要害：他犯了三大失误,2024-07-06 10:58,2216,272,红色先驱,红色先驱,由于平台规则限制，阅读过程中需要看一段视频才能解锁文章的后续内容，望您支持和谅解。公元207年，隆中一对出南阳，时年26岁的诸葛亮即开启了他“鞠躬尽瘁，死而后已”的一生。,https://toutiao.com/group/7388472237756334644/,,0,0
夫妻的一生，有老公和没老公的区别，几张漫画体现得淋漓尽致,2024-09-06 05:07,271,162,哆哆娱乐,哆哆娱乐,“家家有本难念的经”，这话说得一点不假。说到夫妻双方，谁更累，这问题可真是让人头疼。咱们先说说男人，他们在外头打拼，工作压力大，竞争激烈，回到家还得撑起整个家，这压力可想而知。,https://toutiao.com/group/7411390973512630818/,,0,0
神雕后传：杨过有六个儿，大儿阳顶天是郭芙所生，杨逍是程英所生,2024-06-23 13:34,1692,108,醒时诗酒醉,醒时诗酒醉,引言:在那一个动荡的年代，江湖侠士纷纷殒落，南宋王朝日薄西山。小龙女在一次意外中离世，杨过曾一度彷徨失措，几乎葬送了自己的人生。,https://toutiao.com/group/7383691407443919369/,,0,0
小伙将摄像机绑在鱼身上，拍到真实水下世界，让人大开眼界！,2024-06-27 10:39,3659,112,咕噜动物,咕噜动物,,https://toutiao.com/group/7385130752331776552/,,0,0
石榴甜不甜，记住这3点，一挑一个准，老果农的方法太管用了,2024-09-02 11:43,9587,866,乡村梦俊,乡村梦俊,,https://toutiao.com/group/7410009974069264936/,,0,0
这部台湾电影拍的真大胆，中年夫妻间的不堪，没结婚的禁止观看！,2024-08-16 06:44,3897,139,小胡谈事件,小胡谈事件,"电影名：幸福城市
 这部台湾电影拍的真大胆，中年夫妻间的不堪，没结婚的禁止观看！",https://toutiao.com/group/7403624512404587047/,,0,0
猴子一口气将整瓶酒喝光，接下来请憋住别笑，镜头记录搞笑一幕,2024-07-22 09:03,1685,102,小萌动物圈,小萌动物圈,猴子一口气将整瓶酒喝光，接下来请憋住别笑，镜头记录搞笑一幕,https://toutiao.com/group/7394383125863727679/,,0,0
李连杰前妻：黄秋燕！原来功夫这么好！,2024-08-26 11:33,60673,5067,985再剪武林,985再剪武林,,https://toutiao.com/group/7407409936012935731/,,0,0
马路上出现一条大蛇 大爷直接制服 网友：是个狠人啊,2024-08-05 03:07,678,112,北方眼,北方眼,,https://toutiao.com/group/7399486590646485542/,,0,0
妻子追着男人打 都服软了还不知道见好就收 结果惨遭暴打,2024-08-31 16:04,678,119,武强融媒,武强融媒,妻子追着男人打 都服软了还不知道见好就收 结果惨遭暴打,https://toutiao.com/group/7409294021715853834/,,0,0
2005年高秀敏家中猝死，13年后情人揭露真相：撒谎把命搭进去了,2024-08-29 08:57,1028,215,万史浮华,万史浮华,2005年8月18日，著名小品演员高秀敏，在家中意外猝死，年仅46岁，让无数观众痛心疾首。直到13年后，高秀敏的情人何庆魁才终于在一次采访中吐露实情:“她因为撒了一个谎，就把自己的命都给撒没了!”,https://toutiao.com/group/7408465554631164425/,,0,0
小老虎和小狮子打架，被扇到怀疑人生，纹身的果然不好惹,2024-06-16 10:39,3951,274,咕噜动物,咕噜动物,,https://toutiao.com/group/7381048851316081193/,,0,0
原来拆米袋这么简单，教你口诀，一拉就开，解决了家家户户的难题,2024-08-20 09:56,4300,479,悟空神技能儿,悟空神技能儿,原来拆米袋这么简单，教你口诀，一拉就开，解决了家家户户的难题,https://toutiao.com/group/7405158338285011456/,,0,0
母亲虎口救女被咬身亡，8年后女儿仍未得到父亲原谅：谁的责任,2024-08-14 02:37,8165,2395,山河月明史,山河月明史,车上的母亲见状，急忙下车想从老虎口中把女儿救下来，自己却命丧当场。事情发生之后，赵菁的父亲始终不肯原谅女儿，认为是她害死了妻子。,https://toutiao.com/group/7402554839245095460/,,0,0
美国夫妻：中国高铁虚有其表，印度交通世界第一，体验后疯狂打脸,2024-08-15 12:21,2031,195,小邹说事,小邹说事,,https://toutiao.com/group/7403299368939291171/,,0,0
老虎叼着猎物缓慢前进，拉近镜头一看，结局叫人惊讶！,2024-07-30 08:44,4507,190,咕噜动物圈,咕噜动物圈,老虎叼着猎物缓慢前进，拉近镜头一看，结局叫人惊讶！,https://toutiao.com/group/7397347018501030440/,,0,0
高速上的绿色激光束是干什么用的？老司机：这都不懂还跑高速？,2024-08-25 22:03,5424,1343,小蓓聊车,小蓓聊车,,https://toutiao.com/group/7406628594824249894/,,0,0
怎一个“惨”字了得，8月销量不足10台的车型，居然有22款之多,2024-09-10 04:22,555,755,老四说车,老四说车,8月汽车整体销量排行榜最新出炉，8月销量不足10台的车型居然有22款之多，奔驰、日产、丰田均榜上有名。,https://toutiao.com/group/7412847407266693668/,,0,0
美债最大“接盘侠”诞生，疯狂买走70%美债，并非日本、英国,2024-09-06 10:48,5785,300,诺言卿史录,诺言卿史录,作为世界上最大的三个美债持有国，中国、日本和英国在近些年先后对美债进行了抛售。可就在这个时候，美债最大“接盘侠”诞生了，竟然在短时间内，疯狂买走70%美债!,https://toutiao.com/group/7411460329367552550/,,0,0
亚马逊雨林王者-巨型森蚺,2024-06-26 23:00,1665,219,人与自然你与我,人与自然你与我,,https://toutiao.com/group/7384951422523015690/,,0,0
贾旭明最新相声，贾专家谈中国足球,2024-09-06 06:55,10700,1439,搞事情,搞事情,,https://toutiao.com/group/7411420182893036082/,,0,0
变形结束后不愿回村，向富爸爸要钱被拉黑的吴宗宏，后来怎样了？,2024-07-08 03:20,1523,503,维京晋州梦,维京晋州梦,作为一档大热的纪实类节目，《变形计》在当年引起过很大争议。大家都对其中见识过繁华后又回归贫穷的农村孩子感到担忧，但另一方面，这些农村孩子也因自身正向、积极的态度颇受观众们喜爱和关注。然而在这其中，却有一个名叫吴宗宏的农村孩子显得有些另类。,https://toutiao.com/group/7389087141206983218/,,0,0
老炸裂了！男子留学美国供养女友，女友出轨夜店露奶给三个黑哥看,2024-08-23 10:05,368,209,大嘴说事不含糊,大嘴说事不含糊,可这才过去多久，相同的悲剧再次上演，只能说有过之而无不及。其表姐很是悲愤，在网上找人，希望女孩自己站出来，把男生给她花的6000刀还回来。,https://toutiao.com/group/7406251059406783012/,,0,0
博尔特百米速度9秒58，和猎豹比是什么水平？看完直接被秒成了渣,2024-07-13 09:11,4854,982,阿星动物,阿星动物,,https://toutiao.com/group/7391045600491340322/,,0,0
工人换个线圈就修好了机器！说好的1000维修费只给100！结果坏了,2024-08-18 10:40,5468,1219,人力资源小司机,人力资源小司机,,https://toutiao.com/group/7404427510999417371/,,0,0
全红婵妈妈回娘家，邻居赶来欢迎，妈妈进门就给婵宝外婆大红包,2024-09-04 06:51,940,269,一言如玉,一言如玉,最近，有网友发现全红婵的妈妈回了一趟自己的娘家。视频里，全红婵妈妈乘坐了一辆黄色的SUV来到了娘家，车停在婵宝外婆家大院门口的巷子里。,https://toutiao.com/group/7410657332742423075/,,0,0
小主人被大鹅欺负，狗狗一下就火了，接下来乐翻众人！,2024-06-15 09:29,7157,139,小萌动物圈,小萌动物圈,狮子几天不吃不喝，饲养员扔进去两只小奶狗，下一秒笑不活了！,https://toutiao.com/group/7380659761064182308/,,0,0
江苏美女道士胡小慧被捕，精通“胡媚术”，九名男徒弟揭露其罪行,2024-08-10 09:01,888,269,此间一叙a,此间一叙a,古有妲己利用“狐媚术”摧毁大商根基，今有胡小慧利用“狐媚术”骗取数百万，更奇葩的是十里八乡的人们对她深信不疑，促使她在当地混的风生水起。令人咂舌的是这个人还是个女道士，直到2019年她被成功逮捕，手下九名男徒这才揭露了真相，原来背后竟是一场精心策划好的骗局。,https://toutiao.com/group/7401412561637245455/,,0,0
陈梦最不可思议一战，竟直接将对方给打笑了，全场球迷都沸腾了！,2024-07-30 01:57,1015,142,呼呼体坛,呼呼体坛,,https://toutiao.com/group/7397242175714492982/,,0,0
“过气网红”的残酷真相，在刘畊宏夫妇身上表现得淋漓尽致,2024-08-01 03:20,233,112,爆炒娱圈儿,爆炒娱圈儿,"在阅读此文之前，辛苦您点击一下“关注”，既方便您进行讨论和分享，又能给您带来不一样的参与感，感谢您的支持！文 | 娱圈儿编辑 | 娱圈儿光芒万丈的一刻2022年的春天,疫情阴霾笼罩着人们的生活。世界被隔离、被切断,成千上万人被关在家中,只能通过网络维系着与外界的联系。",https://toutiao.com/group/7397987833597657650/,,0,0
实测喝四天枸杞茶尿酸变化！（上）,2024-07-20 10:37,1018,147,痛风大户,痛风大户,,https://toutiao.com/group/7393665373622043171/,,0,0
女运动员“难以启齿”的心酸：赛前要“刮毛”、赛后忍痛扯泳衣,2024-07-13 10:52,9358,514,墨家三少花城,墨家三少花城,“每一份荣耀的背后，都藏着不为人知的艰辛。”先说比赛前刮毛这一细节。对于游泳、跳水等水上项目的运动员来说，这可真不是闹着玩的事儿！您想想，在如今这全球化的体育舞台上，运动员们那可是备受瞩目。他们代表的可不单单是自己，那是整个国家的形象和荣誉啊！,https://toutiao.com/group/7391063877527601679/,,0,0
