title,publish_time,like_count,comment_count,media_name,source,abstract,article_url,tag,is_yaowen,article_sub_type
又一大佬跑路！卷走62亿跑路，令上千员工、投资者血本无归,2024-09-06 06:06,6685,2629,笑史云烟,笑史云烟,极目科技总共在全球40多个城市都设立有办事机构，旗下更是拥有上千名员工，且在这上千名员工之中，有800多人都是公司的研发人员。,https://toutiao.com/group/7411400906702389775/,,0,0
李小璐母亲：我这辈子最后悔的决定，就是12年前让女儿嫁给贾乃亮,2024-09-05 08:02,387,1352,温辞韫,温辞韫,李小璐和贾乃亮这对曾经的金童玉女，如今再提起他们，不少也会感到有些唏嘘。或许，对于李小璐的母亲来说，她这辈子最后悔的决定，就是在12年前让自己的女儿嫁给了贾乃亮。,https://toutiao.com/group/7411062572536840740/,,0,0
我国楼市大局已定，未来全国近50%的家庭，将会面临“6大难题”,2024-09-09 09:00,1827,230,英子健康科普,英子健康科普,声明：本文内容均是根据权威资料结合个人观点撰写的原创内容，在今日头条全网首发72小时，感谢各位看官点击支持原创，文末已标注文献来源及截图，请知悉。,https://toutiao.com/group/7412564145536614950/,,0,0
今天才知道！电动车“每天充”和“用完再充”，到底哪个更伤电池,2024-08-27 11:19,1124,175,鲸探所,鲸探所,“今天到底给车充不充电？”估计大多数人每天回家都会想这个问题，看着自己的电动车电量又多又少的，充不充电也是一件非常难以抉择的事情。那么，电动车到底应该怎样充电呢？是每天都充，还是用完之后再充呢？电动车充电不管是在城市还是农村，电动车其实都是人们出门最常见的交通工具。,https://toutiao.com/group/7407773012533117475/,,0,0
因穷离婚33年后，刀郎的前妻“私奔”回来了，这泼天富贵她接不住,2024-08-24 08:18,988,106,8卦娱,8卦娱,文|8卦娱本文陈述所有内容皆有可靠信息来源，赘述在文章中如果让你忘记曾经深爱的人，你需要多长时间？当那个曾经无情抛弃你的人，却在你踏上巅峰时候“回心转意”，你的心中又作何感想？《2002年的第一场雪》作为当年家喻户晓的一首歌曲，或许因为这首歌你认识了刀郎，但你认识罗林吗？,https://toutiao.com/group/7406616749610762787/,,0,0
秋葵的神仙吃法，比吃补药还补，鲜香滑嫩又多汁，太香了,2024-08-07 08:58,17266,853,家常的味道,家常的味道,,https://toutiao.com/group/7400319304052245003/,,0,0
红旗的发动机是哪国的？拆开一看后国人傻眼了，网友：想都不敢想,2024-08-22 22:28,1570,438,三哥选车,三哥选车,,https://toutiao.com/group/7405980914863309366/,,0,0
秋葵的神仙吃法，比吃补药还补，做法简单，鲜香滑嫩又多汁，真香,2024-07-29 12:39,34757,3003,一画美食,一画美食,,https://toutiao.com/group/7397036492566856244/,,0,0
严惩！脱口秀演员阿潘炸裂发言！歪曲统一大业，取笑红色革命老区,2024-09-06 01:38,693,201,淡定孔雀RG9bB,淡定孔雀RG9bB,,https://toutiao.com/group/7411338529304281641/,,0,0
无论炒什么肉，不要用盐和料酒腌制，大厨教我绝招，肉片滑嫩不腥,2024-07-11 08:24,72109,2840,家常的味道,家常的味道,无论炒什么肉，不要用盐和料酒腌制，大厨教我绝招，肉片滑嫩不腥,https://toutiao.com/group/7390291377185096204/,,0,0
英国公布圆明园被毁前真实照片，简直美如仙境！.mp4,2024-08-24 09:33,2897,401,微笑微风55,微笑微风55,,https://toutiao.com/group/7406636827441889811/,,0,0
“蚩尤”究竟为何物？为何黄帝要赶尽杀绝？说出来你可能不信,2024-08-11 06:48,6257,954,健康科普陈医生,健康科普陈医生,我国拥有漫长的历史，长达几千年，既如此，曾涌现出无数英雄豪杰。其实，早在远古时代，华夏大地上就已经是英雄辈出。比如大名鼎鼎的黄帝，就是远古时代影响力最大的大人物之一。起初，他并不是特别强大，只是一些部落的首领。,https://toutiao.com/group/7401769231404057098/,,0,0
妻子嫌装纱窗门关不上大门，丈夫上手演示瞬间哑火，下秒形成闭环,2024-08-27 05:00,29424,10378,速看,速看,妻子嫌装纱窗门关不上大门，丈夫上手演示瞬间哑火，下秒形成闭环,https://toutiao.com/group/7407679615466766858/,,0,0
海南台风给华为和苹果打了一波广告，华为躺赢苹果躺输,2024-09-10 06:07,7022,793,聪明的苹果6u,聪明的苹果6u,,https://toutiao.com/group/7412892171335893519/,,0,0
13年9岁男孩扶人被讹100万，老太发毒誓“骗人死全家”，结局如何,2024-09-07 10:22,882,500,懵懂述史,懵懂述史,“哎呦，疼死我了，你可不能走，就是你撞得我!”2013年，四川达州街头9岁男孩江小云和同学善意搀扶摔倒老人。,https://toutiao.com/group/7411839547929133608/,,0,0
为什么现在酒店退房都不再查房了？内部员工道出真相，真涨知识了,2024-08-25 09:53,1703,740,水大叔,水大叔,为什么现在酒店退房都不再查房了？内部员工道出真相，真涨知识了当我们出差或者外出旅游时，大多都会将酒店作为我们的临时居住地点，相对比其他地方来讲，酒店能让我们拥有更好的居住体验感。毕竟大部分酒店的设备都很齐全，光是这一点就是其他地方所无法比拟的。,https://toutiao.com/group/7407012341864301067/,,0,0
没人敢说的真相，今天我来说吧，实在是看不下去了~#只讲实话 #,2024-09-08 16:03,6579,282,正大光明画板LIdHV9T,正大光明画板LIdHV9T,,https://toutiao.com/group/7412303553424785958/,,0,0
孙颖莎是当之无愧的世界第一！如果你了解过她，定会深深喜欢上她,2024-08-24 07:19,1364,4173,VK时满,VK时满,孙颖莎是当之无愧的世界第一女单！如果你了解过她，就一定会深深喜欢上她。当所有人都在调侃莎莎带着最稚嫩的脸，打最凶狠的球，松弛感超足的同时，是莎莎内心深处拥有稳定而强大的精神内核。,https://toutiao.com/group/7406596591991144972/,,0,0
澳门冠军赛：日本2大世界冠军出局，伊藤美诚剃光头，张本智和3-1,2024-09-11 06:00,862,103,小智观体育,小智观体育,,https://toutiao.com/group/7413219852720833078/,,0,0
难怪明知36变更强，孙悟空却不愿学，你看36变的另一名字叫什么！,2024-07-12 11:31,4250,2575,品茗谈史论世事,品茗谈史论世事,声明：本文内容均引用权威资料结合个人观点进行撰写，文末已标注文献来源及截图，请知悉。想必大家都认为孙悟空选择七十二变而非选择三十六，仅是因为其数量变化之多，故而选择了数量更多的七十二变？,https://toutiao.com/group/7390708083195904549/,,0,0
为国争光却遭郎平弃用！转身效力土耳其的王一梅，如今过得咋样？,2024-09-07 03:42,2534,212,洛风阐史官,洛风阐史官,本文陈述内容皆有可靠信息来源，赘述在文章结尾。提到中国女排，绝对不可以忽视一个人，她就是绰号“大梅”和“女排重炮”的王一梅。然而，这位被称之为“郎平第二人”的主攻手却在巅峰时期被自己偶像郎平彻底抛弃，不得不选择加入了土耳其俱乐部。那么，曾经为国争光的王一梅为什么会被郎平弃用？,https://toutiao.com/group/7411739899121943055/,,0,0
天地间有六界，为什么玉帝只掌管三界，其他三界是由谁在管理？,2024-08-09 04:02,1281,703,MayHo美好,MayHo美好,在中国古代的道教传说中显示，天地之间一共有六界，而天界的玉帝是掌管其中的三界。这就多少让人感到有些奇怪，玉帝不一向是这个界中的最高神吗?,https://toutiao.com/group/7400982167590797859/,,0,0
航母最高能抗几级台风？结果你可能不信，但是一点都不夸张,2024-06-29 11:10,14438,177,科普足迹,科普足迹,航母最高能抗几级台风？结果你可能不信，但是一点都不夸张,https://toutiao.com/group/7385788439520379430/,,0,0
这歌谁编的。太有才了，越听越上头,2024-09-01 09:12,37205,3051,阿抖-,阿抖-,,https://toutiao.com/group/7409599964278194724/,,0,0
全红婵 出席国航C919首飞活动 网友：第一次带货 带飞机 这个真买不起,2024-09-10 14:10,1016,480,姝瑜丫,姝瑜丫,网友们都说：国航是懂风水的，他们希望C919像全红婵一样。全世界红红火火。更像全红婵的婵一样，像月亮，飞出中国，飞向世界，冲出地球。还有的调侃说：全红婵第一次带货，带飞机[捂脸][捂脸]，这个真的买不起。,https://toutiao.com/group/7412988418373878309/,,0,0
