title,publish_time,like_count,comment_count,media_name,source,abstract,article_url,tag,is_yaowen,article_sub_type
我不管你信不信！这就是法国巴黎农村真实面貌，其他国家看不到,2024-08-13 05:25,3330,1042,苏小米的vlog,苏小米的vlog,我不管你信不信！这就是法国巴黎农村真实面貌，其他国家看不到,https://toutiao.com/group/7402491054601011747/,,0,0
事不简单！贵州活动受阻事件疑点重重 网友抽丝剥茧理智寻真相,2024-09-10 05:07,152,235,侃生活,侃生活,企业家发文诉苦近日，锡恩集团董事长姜汝祥在微博发声，称带 400 名民营企业家到贵州天眼景区开会。虽事前备案，却遭遇单间被要求让给政府官员，户外分享时还被警方围住。姜汝祥自称身为家乡人想助力家乡，却遭此对待，深感难受。网友质疑不断此消息一出，网友们纷纷质疑。,https://toutiao.com/group/7412876614704316962/,,0,0
公鸡明明没有生殖器官，那是如何与母鸡完成交配的？看完涨知识了,2024-08-11 02:32,12122,1802,闪闪大声聊奇事,闪闪大声聊奇事,,https://toutiao.com/group/7401704293973099043/,,0,0
女子怀孕警告邻居听不了噪音，要求全家都别走动，下秒被怼到结巴,2024-09-04 05:58,13688,1696,速看,速看,女子怀孕警告邻居听不了噪音，要求全家都别走动，下秒被怼到结巴,https://toutiao.com/group/7410663197050405376/,,0,0
泰山竟然是地府入口？当地人：所以我们爬泰山时从来不敢乱说话,2024-08-10 02:50,711,157,Talk历史,Talk历史,泰山作为五岳之首一直备受广大游客喜爱，可很多人不知道的是，泰山竟还是传说中的地府入口，当地人爬泰山时都不敢乱说话。,https://toutiao.com/group/7401334751220548132/,,0,0
中国媳妇卡佳：吃中国的饭，砸中国的碗，在外网发布视频抹黑中国,2024-07-24 05:28,760,492,8卦娱,8卦娱,文|8卦娱支持作者，写作不易，文中会有5s广告，观看后可免费阅读全文在短视频日益火爆的今天，不只是中国人想要在此领域有一番作为，甚至很多外国人也想插足其中。尤其现在有很多“洋媳妇”，纷纷开设属于自己的短视频账号，分享自己在中国的日常生活，以嫁给中国人为噱头来吸引流量。,https://toutiao.com/group/7395042033288626699/,,0,0
英国公布圆明园被毁前真实照片，简直美如仙境！.mp4,2024-08-24 09:33,2368,319,微笑微风55,微笑微风55,,https://toutiao.com/group/7406636827441889811/,,0,0
马俊仁：被国家队开除，如今怎么样了,2024-07-03 13:34,4419,270,笑史云烟,笑史云烟,“既是魔鬼，同是功臣！”1993年，王军霞在斯图加特世界田径锦标赛中，一举夺魁，打破了女子10000米世界纪录。而她的教练马俊仁在赛后更是面对媒体扬言道：“想破啥记录就破啥记录，想让谁破，就让谁破！,https://toutiao.com/group/7387377552844767759/,,0,0
房事不坚挺，西地那非还是他达拉非？很多人都选错了，教您来区分,2024-09-01 06:47,3457,651,养生真經,养生真經,国家卫生与健康调查数据显示，我国男性ED总体患病率为40.5%。然而，大部分人对治疗ED的药物却一知半解，很多人只停留在“伟哥=西地那非”的刻板印象中。,https://toutiao.com/group/7409561994711302693/,,0,0
张博宇：张丰毅吕丽萍的亲儿子，今却走上父母老路，成为离婚人士,2024-08-20 06:16,1193,187,稻述,稻述,文 | 招财小羊编辑 | 招财小羊“这是张丰毅的儿子？怎么看起来这么邋遢？”8月19日，李亚鹏的二婚妻子海哈金喜晒出了一条视频。没想到，却偏偏让张博宇成为了最大的话题人物！原来，那天海哈金喜现身北京参加了大学同学的婚礼。而在多个镜头之中，张博宇的身影忽隐忽现。,https://toutiao.com/group/7405097740415304230/,,0,0
秋葵的神仙吃法，比吃补药还补，做法简单，鲜香滑嫩又多汁，真香,2024-07-29 12:39,34613,2988,一画美食,一画美食,,https://toutiao.com/group/7397036492566856244/,,0,0
香港人不喜欢大陆游客？来听香港姑娘怎么说的，感觉相当扎心,2024-08-12 23:51,2609,916,丫丫聊科普,丫丫聊科普,,https://toutiao.com/group/7402404764698280475/,,0,0
苹果“王炸”，史上最大iPhone来了！iPhone16全系配“快门”，静音拨片彻底再见，顶配13999元！关于AI，特别提醒→,2024-09-09 23:34,189,441,每日经济新闻,每日经济新闻,每经记者：王晶 卢祥勇 一年一度的“科技界春晚”又来了。北京时间9月10日凌晨1时，苹果举行主题为“高光时刻”的特别活动，对于“果粉”们来说，这次活动可以说是一年中最重要的发布会。,http://www.nbd.com.cn/rss/jinri_toutiao/articles/3551805.html,,0,0
孩子快要“停止长高”的3个征兆，要是全中，身高或基本定型,2024-08-09 03:36,1172,991,儿科长高琚教授,儿科长高琚教授,前两天看诊了一个孩子，是个14岁的小男孩，从2月到现在都没长个，家长才想起来查一下骨龄，结果当地医生说已经闭合了，长不了了。家长很生气，觉得医生乱评估，平时看我的科普比较多，就大老远的来找我，我一看骨龄片，和当地医生评估的一样，骨龄16岁了，身高基本已经定型了。,https://toutiao.com/group/7400976499446137398/,,0,0
估计颁奖人这一辈子都忘不了给全红婵颁奖的尴尬瞬间#全红婵,2024-08-11 03:25,6254,746,悠闲葡萄tsJ,悠闲葡萄tsJ,,https://toutiao.com/group/7401717760587203083/,,0,0
一只报复心极强的羊，每天和爷爷斗智斗勇，因为挨揍上了央视！,2024-08-28 11:14,24071,1976,雪姐故事说,雪姐故事说,,https://toutiao.com/group/7408147232861454884/,,0,0
一代女皇陈若琳，当众训斥全红婵惹争议，背后默默帮她突破发育关,2024-08-10 06:53,3040,201,大脚哥,大脚哥,,http://toutiao.com/item/7401400383353913890/,,0,0
小老虎和小狮子打架，被扇到怀疑人生，纹身的果然不好惹,2024-06-16 10:39,3943,274,咕噜动物,咕噜动物,,https://toutiao.com/group/7381048851316081193/,,0,0
5座车拉6个人被判超员，车主1句话把交警问懵,2024-08-05 20:20,5130,1185,奇妙钢笔pA8JyP,奇妙钢笔pA8JyP,,https://toutiao.com/group/7399752843772559906/,,0,0
出差让男朋友去家里帮忙喂狗，结果打开监控看见这一幕…,2024-08-02 12:10,4298,271,今视频TV,今视频TV,出差让男朋友去家里帮忙喂狗，结果打开监控看见这一幕…,https://toutiao.com/group/7398475534616756746/,,0,0
地震动画演示,2024-08-16 15:27,3735,1030,趁早启航,趁早启航,地震动画演示,https://toutiao.com/group/7403759352928829979/,,0,0
为什么算命先生不认识你，却知道你家里有几口人，方法这么简单。,2024-06-19 22:16,24251,3810,幻爸短视频,幻爸短视频,,https://toutiao.com/group/7382225519021457970/,,0,0
小品：这小品真是经典中的经典，本山大叔咋说都不对，慌乱的可爱,2024-09-04 07:47,2589,477,把我逗笑了,把我逗笑了,,https://toutiao.com/group/7408254973588275749/,,0,0
见过守株待兔的，没见过蛇守马路逮人的，蛇居然蹦起来想咬人,2024-07-27 02:22,5139,840,昆明广播电视台,昆明广播电视台,,https://toutiao.com/group/7396135269709939200/,,0,0
穿汉服在外国没人管，在中国穿和服在中国就不行，公平吗？,2024-09-08 06:26,960,2641,小璃说事,小璃说事,,https://toutiao.com/group/7412150203530084883/,,0,0
把儿子送乡下姥姥家第7天，舅舅发来一段视频，看完搞笑了！,2024-08-13 08:45,10742,566,萌娃欢乐视频合集大全,萌娃欢乐视频合集大全,,https://toutiao.com/group/7402535943443317287/,,0,0
"全红婵再战陈芋汐，""逆天""一跳惊呆全场观众，结果却出现了这一幕",2024-08-05 07:59,2061,238,呼呼体坛,呼呼体坛,,https://toutiao.com/group/7399562061958611507/,,0,0
刚旅游完保定市和承德市，实话实说，差距太大了,2024-08-18 00:36,822,308,高峰的旅程,高峰的旅程,,https://toutiao.com/group/7404271842287944203/,,0,0
刚旅游完河北石家庄市和山东济南市，实话实说，差距太大了,2024-08-18 22:06,1630,809,高峰的旅程,高峰的旅程,,https://toutiao.com/group/7404474680096064011/,,0,0
放一只假老虎，在狮群的必经之路会怎样？下一秒狮子的反应太逗了,2024-06-29 09:31,5348,507,小贝动物汇,小贝动物汇,,https://toutiao.com/group/7385855549906092585/,,0,0
遇到这样不礼貌的动作，要敢于反击，我支持妹子！,2024-08-09 03:22,690,109,中国八卦城,中国八卦城,,https://toutiao.com/group/7400974928452780596/,,0,0
沙僧只封了金身罗汉，为啥一声不吭？你看如来给了他什么好处,2024-08-07 10:42,4273,1484,来点解读,来点解读,在《西游记》的大结局里，唐僧师徒四人成功取得真经，佛祖如来也是言出必行，对他们之前的种种努力和贡献都一一兑现了承诺。唐僧成功成佛，孙悟空荣升斗战胜佛，就连那爱吃爱睡的猪八戒也摇身一变成了净坛使者，享尽美食。可轮到沙僧这儿，就只封了个金身罗汉。,https://toutiao.com/group/7400345643971183138/,,0,0
陈若琳,2024-08-09 15:55,1906,132,娱乐探秘者,娱乐探秘者,,http://toutiao.com/item/7401169040053371444/,,0,0
菜花蛇VS眼镜王蛇：谁更强,2024-08-23 05:18,1378,307,小唐科普,小唐科普,,https://toutiao.com/group/7406170487975477801/,,0,0
为什么现在酒店退房都不再查房了？内部员工道出真相，真涨知识了,2024-08-25 09:53,1634,714,水大叔,水大叔,为什么现在酒店退房都不再查房了？内部员工道出真相，真涨知识了当我们出差或者外出旅游时，大多都会将酒店作为我们的临时居住地点，相对比其他地方来讲，酒店能让我们拥有更好的居住体验感。毕竟大部分酒店的设备都很齐全，光是这一点就是其他地方所无法比拟的。,https://toutiao.com/group/7407012341864301067/,,0,0
全红婵采访界的搞笑女，奶声奶气，好解压好治愈，听10遍都不腻,2024-08-25 10:11,1925,471,木子工程师,木子工程师,,https://toutiao.com/group/7407017722083476002/,,0,0
岳云鹏当众打趣潘长江，不料潘长江冲上台就是一脚，郭德纲都懵了,2024-07-27 01:31,2212,180,北方眼,北方眼,,https://toutiao.com/group/7396122121326068274/,,0,0
为什么说家里尽量不要安监控，很多人都不明白，看完真涨知识了,2024-08-11 15:12,5714,643,木木爱讲事,木木爱讲事,,https://toutiao.com/group/7401900018526847503/,,0,0
全红婵抱着陈若琳大哭！急着找陈芋汐拥抱，颁奖迫不及待戴金牌,2024-08-07 01:36,3418,230,细雨茶话,细雨茶话,,http://toutiao.com/item/7400205524882424358/,,0,0
房子前面为什么不能种桂花树？房子前面有桂花树的要了解一下,2024-08-17 07:00,4614,982,探秘历史,探秘历史,写作不易，作者每天也是辛苦写稿，只是为了养家糊口，希望各位观众老爷可以多多理解，文中加入5秒广告解锁，观看5秒后便可以免费阅读全文啦，感谢各位观众老爷的理解与支持哦~~~文|魏戈原编辑|t引言很多人都喜欢在门前种上一些观赏植物，其中桂花就是人们比较中意的一种选择。,https://toutiao.com/group/7403658029746422291/,,0,0
厕所门的“长颈鹿”和“大象”，该怎样区分男女？不懂只能尿裤子,2024-07-06 02:01,16031,4563,大羽奇葩说,大羽奇葩说,,https://toutiao.com/group/7388337037297844787/,,0,0
西游记中存在的低级漏洞，专家也未曾发现，却被小学生当众曝光,2024-08-08 22:09,7264,2630,靑云历史,靑云历史,,https://toutiao.com/group/7400708821162656291/,,0,0
上午白露，冻死老牛；下午白露，单衣过冬，今年白露在几点？,2024-09-06 23:32,6812,1394,皓宇读点段儿,皓宇读点段儿,,https://toutiao.com/group/7411349888534839860/,,0,0
刚旅游完山东烟台和河南洛阳，实话实说吧，城建水平不是一个级别,2024-08-23 12:58,753,578,纪实君飞云,纪实君飞云,,https://toutiao.com/group/7406318641274159616/,,0,0
俗话说：钱不借二、酒不喝三、路不走四！古人的忠告有什么道理？,2024-08-15 00:00,8444,829,致远书香,致远书香,有句话说：“有人的地方，就有江湖。”人在江湖，往往身不由己。关于这方面，其实先辈们早就在生活的点滴中总结出了很多经验和智慧，比如有句话就这么说，讲“钱不借二，酒不喝三，路不走四。”这些劝诫背后，就是人情练达。,https://toutiao.com/group/7403030502673744434/,,0,0
帮大妈清理荒废40年的祖宅，这房子够阴森的，结果清理出来傻眼了,2024-06-21 08:40,40436,5667,创意花园美艺,创意花园美艺,帮大妈清理套荒废40年的祖宅，看着就挺阴森，结果清理出来傻眼了,https://toutiao.com/group/7382808201818800690/,,0,0
21岁少女为35岁男子捐骨髓，一年后怀孕，患者再登门：堕胎救我,2024-09-06 12:30,693,2152,梦游仙境,梦游仙境,命运，有时像一张无形的大网，将素不相识的人紧紧缠绕在一起，当善意与求生本能交织，当感恩之心与现实压力碰撞，一场关于生命、道德与人性的戏剧，悄然拉开了帷幕。,https://toutiao.com/group/7411506409340256803/,,0,0
车子堵在仓库门口几天走不了，一直在豪横也没有道歉的态度,2024-08-22 12:50,400,221,加油吧明天,加油吧明天,,https://toutiao.com/group/7405945483979391522/,,0,0
日本女性街头表演，瞬间对日本女性失去兴趣，场面太尴尬了,2024-08-02 08:08,1081,148,@静儿.,@静儿.,,https://toutiao.com/group/7398451033988399657/,,0,0
全红婵最经典比赛 五跳震惊全场 领先第二名将近三十分,2024-07-29 13:11,1726,199,体娱ABC,体娱ABC,,https://toutiao.com/group/7397044871116096011/,,0,0
澳门颁发1600万奥运大奖！陈芋汐第3，全红婵第2，她排第1不意外,2024-09-05 03:35,3229,601,球坛石话,球坛石话,,https://toutiao.com/group/7410997665554039330/,,0,0
小伙将摄像机绑在鱼身上，拍到真实水下世界，让人大开眼界！,2024-06-27 10:39,3657,112,咕噜动物,咕噜动物,,https://toutiao.com/group/7385130752331776552/,,0,0
第三次世界大战爆发，中国到底能同时顶住，多少国家的进攻,2024-08-30 12:39,378,115,强国基建狂,强国基建狂,第三次世界大战爆发，中国到底能同时顶住，多少国家的进攻,https://toutiao.com/group/7408911172453270027/,,0,0
笑不活了，全红婵谈最怕的人还是陈若琳，我却笑死在网友评论区里,2024-08-09 12:02,4828,626,星妈养生课堂,星妈养生课堂,"在一次采访中，全红婵被问及她最害怕的人是谁。在一阵紧张的氛围中，她最终透露，那个人就是她的教练陈若琳。全红婵说：“我怕教练，以前真的挺怕的，也不知道为什么，偷吃零食的时候会躲，特别害怕她……”

这个答案让网友们乐开了花，让我们一起来看看这些充满趣味的评论吧。",https://toutiao.com/group/7401108897798292005/,,0,0
刚旅游完河北承德市和辽宁朝阳市，看看有什么不同,2024-08-12 22:06,321,167,高峰的旅程,高峰的旅程,,https://toutiao.com/group/7402263266224767500/,,0,0
黑曼巴对战眼镜王蛇，谁才是毒王之王。,2024-08-11 10:35,1150,146,小唐科普,小唐科普,,https://toutiao.com/group/7401798173259203123/,,0,0
这才是全红婵湛江的老家，居然还是瓦房，广东人太低调了,2024-08-19 05:17,812,178,画工小张,画工小张,,https://toutiao.com/group/7404715512225890879/,,0,0
你们知道洪水究竟有多恐怖吗？3分钟视频告诉洪水到底有多恐怖,2024-06-18 23:00,19672,773,跟踪自然灾害,跟踪自然灾害,,https://toutiao.com/group/7381835392888078858/,,0,0
刚旅游完东北三省的沈阳市，长春和哈尔滨，实话实说，差距太大了,2024-08-27 00:43,1362,740,高峰的旅程,高峰的旅程,,https://toutiao.com/group/7407613535087231507/,,0,0
太遗憾！全红婵弟弟最终没能进入国家跳水队,2024-09-07 00:39,737,566,木子姐姐聊娱乐,木子姐姐聊娱乐,,https://toutiao.com/group/7411694370086191667/,,0,0
银行问你取钱干什么？这样回答最好，马上就会给你办理,2024-09-06 10:35,1450,371,大山敬友人,大山敬友人,银行问你取钱干什么？这样回答最好，马上就会给你办理,https://toutiao.com/group/7411476803883106857/,,0,0
南海观音能抵挡台风，这是真的吗？还要不要相信科学啊,2024-09-09 02:26,2432,447,颜值精灵,颜值精灵,,https://toutiao.com/group/7412464106365846050/,,0,0
女子高铁上大声秀英语，男乘客忍无可忍也用英语回击，一句话暴击,2024-06-29 06:46,20314,3351,金融新闻,金融新闻,女子高铁上大声秀英语，男乘客忍无可忍也用英语回击，一句话暴击,https://toutiao.com/group/7385812886754427392/,,0,0
这段视频丢失了23年，世贸中心倒塌事件新画面，唯一的高质量镜头,2024-07-27 09:43,30397,7246,青梅云依旧,青梅云依旧,,https://toutiao.com/group/7396248951151657481/,,0,0
2025年春晚不要办了，把这个再重播一遍就行了,2024-07-21 08:50,69363,8331,小时候就很六,小时候就很六,,https://toutiao.com/group/7394008755664323072/,,0,0
为国争光却遭郎平弃用！转身效力土耳其的王一梅，如今咋样了？,2024-08-31 13:19,818,106,豆莱说,豆莱说,光阴似箭，日月如梭，当初的少女早已退役，成为了排球场的幕后人，这么多年她都经历了什么，现在又怎么样了呢?,https://toutiao.com/group/7409287778514567718/,,0,0
老话说“房屋第一凶，最忌穿堂风”，什么是穿堂风？有啥危害？,2024-07-08 08:32,8379,1564,风姿卓越书签k7K,风姿卓越书签k7K,老话说“房屋第一凶，最忌穿堂风”，什么是穿堂风？有啥危害？,https://toutiao.com/group/7389180053642281487/,,0,0
河南28岁女子一夜变老，医院怎么也查不出原因，11年后才知真相,2024-08-28 07:18,5624,315,静枫听史,静枫听史,因为生孩子，妙龄少女在一夜之间变成了七十老妇？当时年仅28岁的胡娟，在生完孩子不久之后，竟一夜变老，皮肤苍老松弛般就如七八十岁的老妇。然而辗转各大医院，却始终查不出病因所在，直到11之后才得知真相。那么到底是什么原因导致了胡娟一夜变老呢，她最后又恢复原本的容貌了吗？,https://toutiao.com/group/7408086014138253833/,,0,0
山东一女生被同学锥子扎218针，校服全是孔，官方：未达霸凌标准,2024-09-09 12:15,389,797,仪正夜,仪正夜,文／编辑：夜呛俗话说，“校园本是净土，奈何霸凌横行”，最近些年，校园霸凌事件频发，手段之残忍，让人难以置信这是出自十几岁孩子之手。sha人、重伤，这些字眼与校园联系在一起，让人感到心痛和愤怒，今天，我要讲述的，就是一起发生在山东济南章丘的校园霸凌事件。,https://toutiao.com/group/7412615806309188148/,,0,0
女孩被欺凌锥子扎218针 满是针孔 官方未达到欺凌标准 知情人爆内幕,2024-09-10 09:09,692,915,随遇而安0993,随遇而安0993,拿着长锥子扎女孩200多次，衣服上满是锥子针孔！真的触目惊心！欺凌者还让女孩给其跪下道歉！女孩哭泣真想死在校园里！教育局调查结果:未达到相关的校园欺凌标准！这都不算欺凌，算故意伤害？那么标准又是什么呢？各位观众朋友们，你们好！,https://toutiao.com/group/7412818822664651279/,,0,0
天燃气阀门要不要天天关？燃气师傅终于说出实话，多亏好心提醒,2024-07-12 15:30,6269,579,小雷帮装修,小雷帮装修,,https://toutiao.com/group/7390672540147909135/,,0,0
赵四与手扶拖拉机遭遇，简直不要太搞笑,2024-09-06 06:18,2401,742,娱乐最前沿阿然,娱乐最前沿阿然,赵四开手扶拖拉机甩飞前认真的学习如何操作。娱乐最前沿,https://toutiao.com/group/7411410526984471103/,,0,0
六位世界冠军，争全国冠军大决战，看全红婵如何逆转,2024-09-04 10:48,1234,120,长庚体坛,长庚体坛,,https://toutiao.com/group/7410737961827828262/,,0,0
这歌谁编的。太有才了，越听越上头,2024-09-01 09:12,35673,2916,阿抖-,阿抖-,,https://toutiao.com/group/7409599964278194724/,,0,0
雄狮不想带娃，做法直接让人笑岔气，简直是父亲的真实写照！,2024-07-18 09:26,8558,552,阿星动物,阿星动物,,https://toutiao.com/group/7392904854894543372/,,0,0
中国跳水队拍合照！周继红突然哈哈大笑，一手搭在全红婵肩膀上,2024-09-04 04:14,5242,779,体育诗人说,体育诗人说,,https://toutiao.com/group/7410636486367773238/,,0,0
对方逆行我们也要让行，看完了你就明白了,2024-08-07 03:23,2944,4501,5G思维,5G思维,,https://toutiao.com/group/7400233004142723599/,,0,0
白鲸吓唬人从未失手，却败在一个小女孩手中，气得它拿头撞玻璃！,2024-08-16 08:36,4674,240,小萌动物圈,小萌动物圈,白鲸吓唬人从未失手，却败在一个小女孩手中，气得它拿头撞玻璃！,https://toutiao.com/group/7403653507650748979/,,0,0
属牛不适合婚配的三大生肖，天生冤家对头，婚后生活可能矛盾不断,2024-09-03 15:25,1214,153,黑莓说故事,黑莓说故事,属牛不适合婚配的三大生肖，天生冤家对头，婚后生活可能矛盾不断,https://toutiao.com/group/7409995149880590885/,,0,0
海里到处都是水，跨海大桥的桥墩是如何修建的？看完长见识了,2024-08-12 16:31,6876,825,乐天派贝里6U3,乐天派贝里6U3,,https://toutiao.com/group/7401930744718688768/,,0,0
女生军训被罚唱歌，本以为随便唱唱，没想到一开口竟是王者！,2024-09-04 11:51,7210,672,番茄音樂秀,番茄音樂秀,,https://toutiao.com/group/7410754210163065407/,,0,0
郭艺：同是全红蝉跳水教练，凭什么说他才是教练中最关键的一个,2024-08-20 14:47,16667,1645,娱乐畅享,娱乐畅享,,https://toutiao.com/group/7405233321812165171/,,0,0
