title,publish_time,like_count,comment_count,media_name,source,abstract,article_url,tag,is_yaowen,article_sub_type
宝宝一再挑衅，猫咪起身，看看周围没人注意，立马开打！,2024-09-10 05:27,2536,491,魔法麻酱atty9,魔法麻酱atty9,,https://toutiao.com/group/7412881948340650496/,,0,0
苹果首款AI手机来了！iPhone16发布：1分钱没涨！但万年128GB...,2024-09-09 23:24,755,1361,什么值得买,什么值得买,一边和微信打得火热，一边被华为三折叠强势撞档，苹果最近属实新闻不断。而今天夜里1点，一年一度的「科技春晚」——苹果秋季发布会，终于来了！先看一波视频，带你1分钟了解发布会虽然在发布会之前，iPhone16的各种配置信息似乎也被网友扒的底裤都不剩了。不过别急！,https://toutiao.com/group/7412787261307175433/,,0,0
蛋仔派对：飞机规则怪谈？如果你误入诡异航班 ，请遵守以下规则,2024-07-04 08:36,3510,158,辉哥游戏解说,辉哥游戏解说,,https://toutiao.com/group/7387696668101050932/,,0,0
为什么现在酒店退房都不再查房了？内部员工道出真相，真涨知识了,2024-08-25 09:53,1720,748,水大叔,水大叔,为什么现在酒店退房都不再查房了？内部员工道出真相，真涨知识了当我们出差或者外出旅游时，大多都会将酒店作为我们的临时居住地点，相对比其他地方来讲，酒店能让我们拥有更好的居住体验感。毕竟大部分酒店的设备都很齐全，光是这一点就是其他地方所无法比拟的。,https://toutiao.com/group/7407012341864301067/,,0,0
第34届中国电视剧“飞天奖”入围作品名单公布！刘亦菲、赵丽颖分别有2部作品获提名,2024-09-11 02:37,166,123,九派新闻,九派新闻,9月11日，第34届中国电视剧“飞天奖”入围作品名单公布，48部作品在列。其中，刘亦菲主演的《去有风的地方》《梦华录》入围；赵丽颖主演的《风吹半夏》《幸福到万家》入围。据悉，第34届“飞天奖”、第28届“星光奖”颁奖典礼新闻发布会于2024年9月11日（周三）10时举行。,https://toutiao.com/group/7413206563420176946/,,0,0
英国公布圆明园被毁前真实照片，简直美如仙境！.mp4,2024-08-24 09:33,3126,438,微笑微风55,微笑微风55,,https://toutiao.com/group/7406636827441889811/,,0,0
宝宝顺产生下后，细心的医生发现不对劲，妈妈：这孩子“废”了,2024-09-10 03:10,1730,586,友爱云朵QNiSe0,友爱云朵QNiSe0,,https://toutiao.com/group/7412846510931214911/,,0,0
比亚迪仰望U9在古德伍德汽车节展示原地掉头，将外国朋友看呆！,2024-09-11 09:17,1299,318,自由自我的小曹,自由自我的小曹,,https://toutiao.com/group/7413312169233613327/,,0,0
为国争光却遭郎平弃用！转身效力土耳其的王一梅，如今过得咋样？,2024-09-07 03:42,2574,218,洛风阐史官,洛风阐史官,本文陈述内容皆有可靠信息来源，赘述在文章结尾。提到中国女排，绝对不可以忽视一个人，她就是绰号“大梅”和“女排重炮”的王一梅。然而，这位被称之为“郎平第二人”的主攻手却在巅峰时期被自己偶像郎平彻底抛弃，不得不选择加入了土耳其俱乐部。那么，曾经为国争光的王一梅为什么会被郎平弃用？,https://toutiao.com/group/7411739899121943055/,,0,0
中国🇨🇳人民的好总理,2024-09-03 15:46,116361,13946,话说,话说,这个老人一生只做一件事，那就是为了人民鞠躬尽瘁，死而后已,https://toutiao.com/group/7410443709928210955/,,0,0
首次世界五百强断崖差距: 日本149家，美国151家，中国3家，现在呢,2024-09-06 03:45,353,769,此间一叙a,此间一叙a,1995年，世界五百强榜单出世，迅速吸引了全球经济界的目光，时至今日，这一数据已经成为评判一个国家经济实力的重要指标。,https://toutiao.com/group/7411368105638658601/,,0,0
猪肉中“最毒”器官，我国虽明令禁止，但还有人不知情在买来吃,2024-08-23 08:06,6421,457,北纬的咖啡豆,北纬的咖啡豆,肘子猪蹄五花肉，配上小酒舒舒服，在外辛苦工作一天的打工人们，晚上下班之后来一碗香喷喷猪脚饭和炖排骨，再配上一点小啤酒吃饱喝足，疲惫的身体瞬间就能得到满足。,https://toutiao.com/group/7406238335636718091/,,0,0
他是建国以来潜逃级别最高的贪官：至今仍未落网，逃跑方式成了谜,2024-08-27 03:17,422,255,小烤娱,小烤娱,这个名字可能对很多人来说很陌生，但他可是建国以来潜逃的级别最高的贪官。让我们一起来扒一扒这个让人唏嘘不已的传奇人物。,https://toutiao.com/group/7407641037365199411/,,0,0
女子刚退休站女性角度劝女儿，要待大城市不选小地方，对比完秒懂,2024-09-09 09:45,19157,13387,速看,速看,女子刚退休站女性角度劝女儿，要待大城市不选小地方，对比完秒懂,https://toutiao.com/group/7412577238710747667/,,0,0
【我的世界】一口气看完，惊变一百天系列全集,2024-06-28 09:56,3112,244,Minecraft阿甲哇,Minecraft阿甲哇,,https://toutiao.com/group/7385210171997291034/,,0,0
英国情侣要四个月游遍整个中国，没想到开始就被中国的导航震惊了,2024-07-25 10:44,2402,321,月上树梢,月上树梢,文案/编辑：微笑星星前言继上次144小时免签旅游上海后说东京和上海相比是弟弟后。英国情侣，乔和米莉亚情侣表示丝毫没有玩够，并立志要四个月游遍整个中国，于是在办理完签证后，这次则是来到了中国的首都北京。,https://toutiao.com/group/7395495760084713999/,,0,0
美联储误判引发轩然大波：万亿资金或将席卷中国，物价狂潮将至？,2024-09-09 02:16,549,128,少有浅话史,少有浅话史,最近逛超市，总感觉荷包越来越瘪了。明明还是买那些东西，怎么花的钱就变多了呢？翻了翻手机备忘录里的购物清单，对比了一下上个月的价格，心里顿时凉了半截：肉价涨了，鸡蛋涨了，连蔬菜都悄悄涨价了。 朋友圈里也在吐槽物价飞涨。,https://toutiao.com/group/7412458813153968679/,,0,0
未订校内餐的学生，被赶到35度太阳地席地吃饭，校长回应惹众怒,2024-09-07 05:28,3459,2576,娱情予理,娱情予理,本文信源来自权威报道【红星新闻】【南方网】【新民网】(详细信源附在文章末尾)。为提升文章可读性，细节可能存在润色，请理智阅读，仅供参考！文|浅浅编辑|浅浅“小女孩可怜兮兮地趴在地上吃饭，把我看哭了！”“饭盒里都是蚂蚁，学校还有心吗？”以前上学吃不起饭，现在上学“滚出去吃饭”。,https://toutiao.com/group/7411745437331325466/,,0,0
"5年前，那个买英国""优质男""精子，生三胞胎的山东美女，如今怎样",2024-09-09 10:48,626,200,末世Talk,末世Talk,2015年在山东青岛的一处小洋楼里，一位母亲对她的女儿说道：“你现在事业发展的很好，妈妈很放心，但妈妈也希望你有一个圆满幸福的家庭。,https://toutiao.com/group/7411442166146302498/,,0,0
