title,publish_time,like_count,comment_count,media_name,source,abstract,article_url,tag,is_yaowen,article_sub_type
第一观察｜总书记这样擘画教育强国建设,2024-09-10 16:15,1201,1120,新华社,新华社,牢牢把握教育的政治属性、人民属性、战略属性，习近平总书记在重要讲话中系统阐释了教育强国的科学内涵和基本路径，首次提出教育强国的六大特质，深刻阐述了教育强国建设要正确处理好的五个重大关系，系统部署了全面推进教育强国建设的五方面战略任务和重大举措，发出“朝着建成教育强国战略目标扎实迈进”的号召。,http://api.xinhua-news.com/newroute/newsdetail/101002024091070003656?dest=AvVoQbOva6ao5fAVOZJSIMo7Te_5VQx6rlr05AYwuM-U,,0,0
公婆捉到儿媳偷人，大声喊：这就是30万彩礼娶到的，还是人民教师,2024-08-21 13:14,490,275,大韦视角,大韦视角,自古杀父之仇，夺妻之恨，这两者最不可原谅。 当今法治社会，杀父之仇不常见了，夺妻之恨却几乎每天都在上演。 江苏省徐州市，某医院门口，就上演了一出公婆捉奸儿媳妇的戏。在江苏徐州的那么个地方，上演了一场比电视剧还曲折离奇的家庭大戏。,https://toutiao.com/group/7405519602397692427/,,0,0
61岁港星内地工地开挖掘机，已被封杀多年，母亲仍住养老院8人间,2024-07-10 11:59,5077,1962,八号探秘人,八号探秘人,本文叙述皆有官方信源，为了给读者更好体验，放在了文章后缀！在阅读此文之前，辛苦您点击一下“关注”，既方便您进行讨论和分享，又能给您带来不一样的参与感，感谢您的支持！编辑：小易演艺圈的更替总是让人唏嘘不已。曾几何时，孙兴凭借《倚天屠龙记》中迷人的“杨逍”一角。,https://toutiao.com/group/7389944309526594082/,,0,0
"万万没想到,53岁“丁克”半辈子的康辉，一生遗憾竟然是一通电话",2024-08-21 22:14,16496,3778,峰哥正读,峰哥正读,在阅读此文之前，麻烦您点击一下“关注”，既方便您进行讨论和分享，又能给您带来不一样的参与感，感谢您的支持！文/编辑：蘑菇百善孝为先。但是到底怎么做才算是“孝”，康辉用了半辈子才明白。央视知名主持人康辉，事业顺遂，家庭幸福，在外人看来是一个人生赢家。,https://toutiao.com/group/7405504703687115273/,,0,0
当你被盗号时，蛋仔的反应？太搞笑了！ #蛋仔派对世纪圆舞会,2024-06-27 08:45,4620,214,魔鬼鱼秀儿,魔鬼鱼秀儿,,https://toutiao.com/group/7385101460146487848/,,0,0
按下按钮就过关？我猜你按不到！ #蛋仔派对逃出惊魂夜,2024-08-02 10:23,4573,600,魔鬼鱼秀儿,魔鬼鱼秀儿,,https://toutiao.com/group/7398485813170733604/,,0,0
