title,publish_time,like_count,comment_count,media_name,source,abstract,article_url,tag,is_yaowen,article_sub_type
淬火丨第二集 向战为战练精兵,2024-09-12 13:01,1195,125,央视新闻,央视新闻,经中央军委批准，由中央军委政治工作部、中央网信办、中央广播电视总台联合出品的思想解读类融媒体片《淬火》，9月11日起，在央视综合频道20点档首播。昨晚，《淬火》播出第一集《军旗下的誓言》。,https://content-static.cctvnews.cctv.com/snow-book/index.html?item_id=16095057789411478645&source=50006&sub_source=50006_001,,0,0
蛋仔派对：评论区随机挑战？用“那咋了”跟秀儿说话，粉丝真狠呀,2024-08-12 09:48,1178,231,游小浪Game,游小浪Game,,https://toutiao.com/group/7402187581716988456/,,0,0
中国跳水队又杀出一匹黑马，同样来自湛江，被誉为“小全红婵”！,2024-09-07 06:39,4266,704,兵锋趣话集,兵锋趣话集,碧海蓝天，十米跳台，水花飞溅，掌声雷动，这是属于跳水运动的舞台，也是中国体育健儿一次次为国争光的荣耀时刻，近年来，中国跳水队人才辈出，不断涌现出像全红婵这样的天才少女，她们用优美的身姿和精湛的技术，一次次征服世界，也让“梦之队”的称号更加响亮湛江，这座位于祖国大陆最南端的海滨城市,https://toutiao.com/group/7411782985714549288/,,0,0
4年骑行结束，1500天终于回到老家，感谢大家一路陪伴有缘江湖见,2024-09-07 03:50,62414,15526,刘伟元的旅行,刘伟元的旅行,4年骑行结束，1500天终于回到老家，感谢大家一路陪伴有缘江湖见！,https://toutiao.com/group/7411715839100977716/,,0,0
国务院：从2030年1月1日起将职工按月领取基本养老金最低缴费年限由十五年逐步提高至二十年 每年提高六个月,2024-09-13 06:38,3083,138,财联社,财联社,【国务院：从2030年1月1日起将职工按月领取基本养老金最低缴费年限由十五年逐步提高至二十年 每年提高六个月】财联社9月13日电，国务院关于渐进式延迟法定退休年龄的办法发布，从2030年1月1日起，将职工按月领取基本养老金最低缴费年限由十五年逐步提高至二十年，每年提高六个月。,https://www.cls.cn/depth/1798592,,0,0
吴谨言、洪尧官宣结婚，于正发文祝福！网友：魏璎珞嫁给了弘昼？,2024-09-13 04:14,523,217,极目新闻,极目新闻,9月13日，演员吴谨言、洪尧在微博上晒出结婚证，配文：“今天领的”“今天结的”。据悉，二人曾合作《延禧攻略》《皓镧传》。于正发文恭喜吴谨言洪尧：“良辰吉日，双喜临门，大吉大利，见者随喜。,http://jms.ctdsb.net/jmythshare/#/index_share?cId=0&contentType=5&contentId=2254108,,0,0
网友晒出公司发的中秋节礼物，没有更寒酸，这就是进体制内的意义,2024-09-13 03:32,195,161,缤纷海风Bt,缤纷海风Bt,中秋节，一年一度的团圆日子，月亮圆了，饼也该甜了，结果不少人被公司发的礼物硬生生给“打脸”了。最近，一位网友吐槽自家公司发的小月饼直接成了中秋节社交平台的“爆款”。什么情况呢？,https://toutiao.com/group/7413963471114584585/,,0,0
恭喜中国女篮新领袖终于出现了！百发百中！统治力让对手深深绝望,2024-06-25 07:11,23501,1224,乐播体育,乐播体育,,https://toutiao.com/group/7384335028576059923/,,0,0
姑娘远嫁山东十年未回家，带着孩子偷偷回娘家，到家眼前一幕哭了,2024-09-09 08:25,7890,4371,小乔家里的事,小乔家里的事,,https://toutiao.com/group/7412556561718968870/,,0,0
中国最大汽车集团疑似“休克式裁员”，下一个会轮到谁？,2024-09-10 03:35,556,342,MotorCar车频,MotorCar车频,8月刚刚过去，很多车企的日子都不好过。国外，全球销量长期霸榜的大众已经公开承认准备关闭德国本土的一家整车工厂以及一家零部件工厂，这在大众成立的87年历史上尚属首次。目前大众正在和当地工会打嘴仗，试图获得关闭工厂的政府许可。,https://toutiao.com/group/7412852962055258665/,,0,0
中国🇨🇳人民的好总理,2024-09-03 15:46,121708,14412,话说,话说,这个老人一生只做一件事，那就是为了人民鞠躬尽瘁，死而后已,https://toutiao.com/group/7410443709928210955/,,0,0
你认为什么时间段出生的人比较好？,2024-09-12 22:00,1660,796,张挺说事儿,张挺说事儿,不论男女，生日在阴历这4天，命中带财，注定是一等命，钱财无忧,https://toutiao.com/group/7413629414308577832/,,0,0
天安门往南3公里，北京龙须沟真实现状，不是亲眼看到谁敢相信啊,2024-08-27 22:06,19117,6197,北京旅游等着瞧,北京旅游等着瞧,,https://toutiao.com/group/7407810359739810331/,,0,0
长城老总魏建军央视直播谈中国足球丑相，导播借换麦终止话题,2024-09-13 08:32,1409,495,西瓜地的果农777,西瓜地的果农777,,https://toutiao.com/group/7414034319418589732/,,0,0
6万人齐唱歌唱祖国，震惊一众外国士兵，听到第三段我已泪流满面,2024-09-12 01:10,15647,1272,梅子meizi1971,梅子meizi1971,,https://toutiao.com/group/7413557684026212873/,,0,0
印度人如此养鱼，怪不得鱼肉出口坐稳全球第一，鱼：日子没法过了,2024-09-08 22:09,1627,479,小红花生活趣事,小红花生活趣事,印度人如此养鱼，怪不得鱼肉出口坐稳全球第一，鱼：日子没法过了,https://toutiao.com/group/7412236624430137892/,,0,0
1979年许世友儿子涉嫌走私，中央找许世友谈话，许世友：直接枪毙,2024-09-08 08:21,2495,370,热心风筝GCoz7j,热心风筝GCoz7j,,https://toutiao.com/group/7412184430620213786/,,0,0
蛋仔派对：可怜的瓜蛋，兔仙意外发现无敌点位#蛋仔电影节,2024-08-19 03:11,2080,340,隐秘的兔仙,隐秘的兔仙,,https://toutiao.com/group/7404682970197393947/,,0,0
史无前例！又一轮户籍改革启动，将改变亿万家庭，连锁反应开始了,2024-09-13 09:17,372,151,糯米评说,糯米评说,,https://toutiao.com/group/7414054310490833448/,,0,0
正播9月13澳门冠军赛，3比11，球迷不敢相信，莎莎竟然出现爆冷了,2024-09-13 12:16,911,212,全时体坛,全时体坛,,https://toutiao.com/group/7414100527262204456/,,0,0
三峡坝区有大量“水老虎”横行，凶猛无比！专家：建议不要干涉,2024-07-29 08:11,25915,6033,答案在这儿,答案在这儿,三峡坝区有大量“水老虎”横行，凶猛无比！为何专家却建议不要干涉？自从长江“十年禁渔”条令颁布以来，长江水域中的鱼类数量就以肉眼可见的速度飙升。2023年夏天，许多人都在三峡坝区，发现……,https://toutiao.com/group/7396966465963819535/,,0,0
这吃豆图太坑了 #蛋仔派对 #蛋仔派对世纪圆舞会 #蛋仔派对创计划,2024-06-17 09:27,2726,229,才才Cary,才才Cary,,https://toutiao.com/group/7381401359255339572/,,0,0
央视曝光“毒玻璃杯”！用其喝水如喝“毒药”，众多家庭仍在使用,2024-09-12 02:55,2942,1819,爱生活的小陈,爱生活的小陈,,https://toutiao.com/group/7413584766437425727/,,0,0
2024年8月29日，在山东202省道行驶时发现天空有一个很大的物体,2024-09-01 00:03,1398,765,骑驴长征,骑驴长征,,https://toutiao.com/group/7409365499311555107/,,0,0
美国在华独资医院现状如何,2024-09-13 04:13,1048,363,时间在流,时间在流,,https://toutiao.com/group/7413975919288648230/,,0,0
我是被毒鸡汤害的第一批女光棍，现在嫁人还来得及吗？,2024-09-10 09:30,8345,4924,微微讲身边事2,微微讲身边事2,,https://toutiao.com/group/7412944417655128591/,,0,0
好可怕！江西抚州天降“火球”？官方：正在调查，评论区沦陷了！,2024-09-13 08:29,2868,172,卿景知体坛,卿景知体坛,好可怕！江西抚州天降“火球”？官方：正在调查，评论区沦陷了！,https://toutiao.com/group/7414042007313580598/,,0,0
老话说：“日不晒根，口不吞阳”啥意思？有何深意？,2024-08-26 14:40,17942,4944,国学客厅,国学客厅,老话说：“日不晒根，口不吞阳”啥意思？有何深意？,https://toutiao.com/group/7407458192470311434/,,0,0
湖南湖北交界的两个村庄 发现一个神奇的自然现象 拍给大家看下,2024-07-07 22:06,12465,1976,湘西鹏娃,湘西鹏娃,,https://toutiao.com/group/7388896152889852468/,,0,0
美女医生幽默爆笑对话：一本正经的胡说八道，看一遍笑一遍,2024-08-28 13:30,32749,4477,牙牙爱爆笑,牙牙爱爆笑,,https://toutiao.com/group/7408077299670581800/,,0,0
MC我的世界：百年难得一遇的怪物？巨型三头凋零王来袭？！,2024-07-28 03:25,946,112,MC方块哥,MC方块哥,,https://toutiao.com/group/7396522737872667186/,,0,0
比亚迪仰望U9在古德伍德汽车节展示原地掉头，将外国朋友看呆！,2024-09-11 09:17,8839,2204,自由自我的小曹,自由自我的小曹,,https://toutiao.com/group/7413312169233613327/,,0,0
为什么算命先生不认识你，却知道你家里有几口人，方法这么简单。,2024-06-19 22:16,31062,5106,幻爸短视频,幻爸短视频,,https://toutiao.com/group/7382225519021457970/,,0,0
没想到啊，全红婵，她竟然买了一部这样的手机,2024-08-23 12:32,748,1055,往后2,往后2,,https://toutiao.com/group/7406311708131590710/,,0,0
