title,publish_time,like_count,comment_count,media_name,source,abstract,article_url,tag,is_yaowen,article_sub_type
笑麻了，华为三折叠手机一台两万块，网友: 华为不坑穷人 评论笑死,2024-09-10 12:38,603,2168,一路向北,一路向北,各位观众朋友们，你们好！这里是充满欢乐和轻松的一路向北频道。恭祝大家工作顺利，蒸蒸日上，家庭美满。[比心][比心]今日，国产手机品牌“华为”在万众期待下进行了黑科技“三折叠手机”的发布会！发布会现场，华为常务董事余承东讲道:“华为正式发布三折叠手机华为MateXT。,https://toutiao.com/group/7410577160051884555/,,0,0
事不简单！贵州活动受阻事件疑点重重 网友抽丝剥茧理智寻真相,2024-09-10 05:07,272,381,侃生活,侃生活,企业家发文诉苦近日，锡恩集团董事长姜汝祥在微博发声，称带 400 名民营企业家到贵州天眼景区开会。虽事前备案，却遭遇单间被要求让给政府官员，户外分享时还被警方围住。姜汝祥自称身为家乡人想助力家乡，却遭此对待，深感难受。网友质疑不断此消息一出，网友们纷纷质疑。,https://toutiao.com/group/7412876614704316962/,,0,0
“最美车模”苏宁回应婚变！证实已经分居，公婆世界游玩不管不顾,2024-09-09 09:24,355,214,娱情予理,娱情予理,本文信源来自权威报道【“苏一宁”社交账号主页】【小沈学长社交账号主页】(详细信源附在文章末尾)。为提升文章可读性，细节可能存在润色，请理智阅读，仅供参考！文|声声说编辑|声声说2021年，车模圈最美女神苏宁下嫁摄影师引让粉丝哀嚎遍地。,https://toutiao.com/group/7412558074441810458/,,0,0
入日籍嫁日本丈夫，击败邓亚萍大喊“吆西”的她，如今过得怎样？,2024-08-08 04:17,5275,578,不似少溓游,不似少溓游,文 | 不似少溓游编辑 | 不似少溓游乒乓球这个诞生于一个多世纪前的英国的球类运动。经过百年的发展历程后，成为了中国的“国球”运动。中国乒乓球的整体水平，长期以来都在世界上保持着近乎断档式的领先。但在这份堪称辉煌的成绩背后，却是国内乒坛激烈到离谱的竞争环境。,https://toutiao.com/group/7400271067921351205/,,0,0
露头就打！山东全省行动，多人在街头被抓,2024-09-08 06:53,3855,439,直播日照,直播日照,近期山东全省公安机关组织开展打击整治“飙车炸街”违法犯罪专项行动针对“飙车”“炸街”“烧胎”“翘头”以及非法改装等警方进行重点整治山东交警通报典型案例↓↓济南4日下午，天桥交警联合区市场监督管理局，对一处涉嫌非法改装、销售电动自行车和电动摩托车的窝点进行突击检查。,https://www.rzw.com.cn/shandong/2024-09-08/vKJx70LLNJS4ii6i.html,,0,0
万万没想到，35岁杨颖兜兜转转干回“老本行”，活成内娱最大笑话,2024-09-09 04:42,538,207,峰哥正读,峰哥正读,同样是站在香港街头，同样是在拍精美写真，只是如今35岁的杨颖再也不能够和十七八年前那样无知无畏，所向披靡了。,https://toutiao.com/group/7412473907350913551/,,0,0
哈里斯“表演”失败，特朗普猛烈进攻！辩论细节体现特朗普的精明,2024-09-11 07:12,7263,1272,评论员李炜,评论员李炜,,https://toutiao.com/group/7413276563187174706/,,0,0
记者怒斥伊万：见过不要脸的，没见过这么不要脸的！,2024-09-10 15:08,870,2788,直播吧,直播吧,回答是否会辞职的问题时，伊万说“最后这个问题不应该是提给我的，上一场是一场大比分失利，我们小组中有三个很强的球队，日本、澳大利亚和沙特。,https://news.zhibo8.com/zuqiu/2024-09-10/66e05f6bc2b0anative.htm,,0,0
“400多艘军舰、9万多士兵”，俄军方：开始！,2024-09-10 13:18,3057,1852,红星新闻,红星新闻,据德新社莫斯科9月10日报道，俄罗斯舰队开始大规模海军演习以展示武力。俄罗斯国防部10日表示，俄罗斯海军在多个水域展开了大规模战略演习，包括潜艇在内的400多艘军舰和9万多名士兵参加了演习。▲9月10日，俄国防部发布的“大洋-2024”海军战略演习视频截图。,https://toutiao.com/group/7413003147129389580/,,0,0
姑娘远嫁山东十年未回家，带着孩子偷偷回娘家，到家眼前一幕哭了,2024-09-09 08:25,5315,3267,小乔家里的事,小乔家里的事,,https://toutiao.com/group/7412556561718968870/,,0,0
5座车拉6个人被判超员，车主1句话把交警问懵,2024-08-05 20:20,5456,1263,奇妙钢笔pA8JyP,奇妙钢笔pA8JyP,,https://toutiao.com/group/7399752843772559906/,,0,0
刘亦菲胖成老嫂子！中年发福大象腿麒麟臂，怎么老成这样了！,2024-09-09 04:24,734,421,自在晚风9,自在晚风9,,https://toutiao.com/group/7412494533554635305/,,0,0
网吧大神太牛了，四天每人挣2000块，有钱了买只大鹅休班炖了,2024-09-11 09:58,1261,196,马小跳生活记,马小跳生活记,,https://toutiao.com/group/7413322867485442612/,,0,0
《凡人歌》大结局，三个女人两个圆满，最后一个太让人遗憾！,2024-09-10 09:08,488,114,听雪说影,听雪说影,《凡人歌》越来越精彩了，在最新的两集里，剧情真实生动地还原了那伟与沈琳，这对中年夫妻所遭遇的生存危机。,https://toutiao.com/group/7412886719168512546/,,0,0
特朗普受不了哈里斯插嘴 发飙：现在是我在讲话,2024-09-11 04:19,2663,1263,中国网资讯,中国网资讯,特朗普受不了哈里斯插嘴 发飙：现在是我在讲话,https://toutiao.com/group/7413235343773663782/,,0,0
演员辛柏青：生活是表演的底色和依托，要做生活的有心人,2024-08-14 07:51,1817,190,今日头条,今日头条,"“要做生活的有心人，认真对待生活，观察生活，从生活当中汲取创作的养分。”
提到辛柏青，大家会想到他在《人世间》《妖猫传》《幸福像花儿一样》等影视剧中奉献的精彩演技。
如此精湛的演技是如何炼成的？辛柏青分享了自己的心得，“要想成为一个好演员，首先是真诚，在演戏的时候要动心；其次是要观察生活，很多细节以及人物的形象都是通过观察得来的，要做生活的有心人。”
聊到这些年的变化，辛柏青觉得自己的性格变化很大。“我二三十岁的时候很杵窝子，在家里不愿意出去，现在的话叫‘社恐’，现在随着年龄的增长已经好很多了。”
作为第18届FIRST电影市场主理人，辛柏青希望能够以个人的力量，为年轻的电影创作者助力，同时也希望汲取他们的朝气、冲劲儿，和无所畏惧的精神。
今日头条联合FIRST青年电影展推出的《影像与绮梦》系列节目之辛柏青篇已正式上线，搜索“头条书声”“影像与绮梦”即可观看。",https://toutiao.com/group/7402899768352965129/,,0,0
我国历史上共有400多位皇帝，能被称为是千古一帝的，就只有这4位,2024-07-06 06:38,1422,371,兜兜历史迷,兜兜历史迷,我国历史上皇帝众多，虽然说这400多位皇帝中有重大贡献的不少，但能真正配得上“千古一帝”这四个字的，其实只有4位，别人跟他们比起来都多少差了那么一点。,https://toutiao.com/group/7388406323102171700/,,0,0
属牛人：生肖牛，千万不要跟这个人有往来，因为这个人天生就克你,2024-07-08 09:50,529,164,乐天派菠萝LftSv,乐天派菠萝LftSv,『有福缘之人留下一句“好运连连” 从此万事如愿，所求皆得。』属牛人：生肖牛，千万不要跟这个人有往来，因为这个人天生就克你大家好，今天呢，我特别想跟属牛的小伙伴们唠唠，关于咱们属牛人在交友方面需要特别注意的一些事儿。,https://toutiao.com/group/7389199393053868583/,,0,0
差距巨大！中日韩上半年外国游客：韩770万，日1777万，我国多少,2024-09-11 03:40,525,270,牧留山,牧留山,本文内容均引用权威资料，结合个人观点进行撰写，文末已标注文献来源及截图，请知悉。亚洲的中日韩三大国，也是众多旅行爱好者的首选之地，今年上半年，三国展开了旅游人数大战。,https://toutiao.com/group/7412926134449160767/,,0,0
姥姥去世大姨没掉一滴泪，葬礼结束后大姨要走，舅舅：账还没算呢,2024-08-24 03:01,14775,986,董你的天使,董你的天使,姥姥去世大姨没掉一滴泪，葬礼结束后大姨要走，舅舅：账还没算呢姥姥去世的时候，父亲带着我和弟弟来参加葬礼。葬礼上大姨和姨夫一直在忙前忙后，舅舅和舅妈两个人哭得不省人事，但大姨却一滴眼泪都没有掉。,https://toutiao.com/group/7406225716091699747/,,0,0
毛主席离世当晚：中央秘密找到徐静求助，她当即提出三点特殊要求,2024-09-01 03:08,12360,147,方圆讲历史,方圆讲历史,当车子进入中南海的时候徐静忽然有一种不祥的预感，当看到毛主席静静地躺在床上后，徐静不由瘫坐在地，泪水也止不住地流下来。,https://toutiao.com/group/7409212261107057164/,,0,0
富士康“赌输”了！郭台铭做梦也没有想到，“制裁”会来的这么快,2024-09-10 09:06,1233,213,谦语谈书风,谦语谈书风,“中国市场离不开我，是我在给赏一口饭给他们吃!”当年，郭台铭口出狂言，嚣张到极点。随后，他更是直接将工厂搬去了印度。,https://toutiao.com/group/7412917891577217572/,,0,0
一场刘德华演唱会，竟暴露了刀郎的“高明”，难怪他实力那么强,2024-09-10 06:34,561,278,铀235放映厅,铀235放映厅,阅读此文前，诚邀您点击一下“关注”按钮，方便以后持续为您推送此类文章，同时也便于您进行讨论与分享，您的支持是我们坚持创作的动力~~~声明：文章中段会有5秒的广告解锁，请读者们支持一下，之后会产出更高质量的内容，感谢大家！,https://toutiao.com/group/7412855942175392283/,,0,0
32国逼中俄断联，人民币交易停滞，人民日报敲钟声，给美国立规矩,2024-09-07 03:53,4822,139,大白话瞰世界,大白话瞰世界,32国逼迫中俄断开联系，制裁导致中俄双方人民币交易停滞，关键时刻，人民日报敲响钟声，给美国立下规矩。中俄人民币交易具体出现了什么状况？人民日报又是如何给美国“立规矩”的？,https://toutiao.com/group/7411744230793544242/,,0,0
中国警告无效，德国2.8万吨大舰队将强闯台海，德战机携核弹飞行,2024-09-10 03:44,1403,133,鉴史人,鉴史人,德国海军太嚣张了，竟然不顾中国警告，打着“航行自由”的幌子，大张旗鼓地穿越台湾海峡!与此同时，德国还大言不惭地表示，此次航行是完全自由并且合乎国际法的，任何国家都没有资格妨碍。,https://toutiao.com/group/7412555327264195106/,,0,0
继韩国、越南后，尼泊尔也贴出中文标语，便于区别对待中国游客？,2024-09-09 09:49,887,770,啰嗦翔子,啰嗦翔子,有些国家求着国人来旅行都求不来，但是有些国家一边想赚中国人的钱，一边却又歧视侮辱中国人，大街小巷满是侮辱性的中文标语...,https://toutiao.com/group/7412569408054231604/,,0,0
俄罗斯亡，中国寒？非也！比西方围堵更可怕的，是我们的妄自菲薄,2024-09-10 04:51,11775,12167,陶陶读历史,陶陶读历史,自俄乌冲突以来，网上就一直有一种论调，中俄之间是“唇亡齿寒”的关系。即如果俄罗斯倒了，下一个就轮到中国了。,https://toutiao.com/group/7412843508064616995/,,0,0
"日子过久了, 为啥很多女的都瞧不上老公? 以为有共鸣 没想评论一边倒",2024-08-06 08:12,1003,912,Jedrek滴胶手作,Jedrek滴胶手作,"刷到一个话题：日子过久了, 为什么很多女的都瞧不上老公?很多时候，日子越过越久，许多人就会忘了初心，当初和自己老公结婚时，我想大部分女人都是权衡利弊过，有些女人找另一半总想着要找条件好的，有能力的，富二代啊等等，可是反过来想想，以你 现有的条件能为对方带来什么呢？",https://toutiao.com/group/7399927118723662355/,,0,0
MC我的世界：奇怪的巨型冰箱？大傻春变冰冻乌龟！？,2024-07-04 09:32,1375,183,MC方块哥,MC方块哥,,https://toutiao.com/group/7387619016967193114/,,0,0
这下好了，再也起不来了。,2024-08-26 23:30,33210,14798,半粒糖小姐,半粒糖小姐,,https://toutiao.com/group/7407505466374226447/,,0,0
可爱的全红婵，用最呆萌的方式，做了最励志的采访，让人怎能不爱,2024-08-21 23:10,2601,220,以玉之诚,以玉之诚,奥运表彰大会的采访，让我们真正见识到一位纯真的17岁少女，是如何用最呆萌的方式来展现最励志的采访，这样的可爱正能量，让人如何不爱？,https://toutiao.com/group/7405734114302624308/,,0,0
并不是迷信，无论房子有多大，开门切记不要正对这“6种”东西,2024-07-24 02:36,25124,1787,老耿来聊事,老耿来聊事,#长文创作激励计划#对于我国群众来说，骨子里有两大爱好，一是存钱，二就是买房了，房子对我们有着重要的意义，这不仅是一种资产的积累方式，也是家的象征。在买了房子之后，我们肯定会按照自己的喜好去进行一番装修，现在装修风格十分的多样化，但其实在这一方面是有诸多讲究的。,https://toutiao.com/group/7395024974186119680/,,0,0
看台风中的全红婵一家人，全红婵的妈妈依然在忙碌,2024-09-07 05:52,4284,291,激扬文字,激扬文字,,https://toutiao.com/group/7411775118893908514/,,0,0
于适混乱私生活遭曝光！同时交往5位富婆，还曾是男大佬们的最爱,2024-09-11 09:28,221,241,叶公子,叶公子,节目中，张雨绮口无遮拦，自曝曾交往过一个弟弟，但对方玩得很花，在和她恋爱期间劈腿，【于是】他们就分手了。,https://toutiao.com/group/7413307168591446580/,,0,0
她是第一位博士级歌唱家，12次荣登春晚，丈夫的身份更是深藏不露,2024-08-10 11:05,6823,241,豆莱说,豆莱说,文：豆莱说编辑：豆莱说支持作者，写作不易，文中会有5s广告，观看后可免费阅读全文在当下华语乐坛中，有很多的出色的歌唱家，雷佳就是其中一位。因为她不仅是我国首个荣获了博士学位的歌唱家，更是出道20年就12次登上了春晚舞台的歌唱家。而且，她丈夫的身份也是不容小觑。,https://toutiao.com/group/7401461240674943542/,,0,0
出差让男朋友去家里帮忙喂狗，结果打开监控看见这一幕…,2024-08-02 12:10,4323,272,今视频TV,今视频TV,出差让男朋友去家里帮忙喂狗，结果打开监控看见这一幕…,https://toutiao.com/group/7398475534616756746/,,0,0
中国造光刻机无望？中科大高层放狠话：中国永远都造不出来,2024-09-10 06:02,2568,1398,青烟小生a,青烟小生a,文|青烟小生a编辑|青烟小生a前言华为企业的原党委书记，我国中科院的副院长兼中科大物理学教授，他的一席话直接冲上热搜，诸多的留言不约而来！他的言语如同一记响亮的耳光，打在其他的中国科技工作者的脸上，也大大的打击了我们国民的“自信心”。,https://toutiao.com/group/7412886134395404819/,,0,0
9月要启动“挨村”行动，这次要做什么？真相来了，村村要准备,2024-09-10 09:36,1314,661,鸿运讲影,鸿运讲影,,https://toutiao.com/group/7412945908817461796/,,0,0
为什么大量日本学校建立在中国，原来国家的用意是咱所体会不到的,2024-08-27 22:00,14177,18612,随风起随风落,随风起随风落,为什么大量日本学校建立在中国，原来国家的用意是咱所体会不到的,https://toutiao.com/group/7407695128791351820/,,0,0
火葬或将成为历史，新的丧葬方式开始试行，为啥很多人无法接受？,2024-08-16 02:08,17534,2335,佳佳聊世界,佳佳聊世界,,https://toutiao.com/group/7403553375112921627/,,0,0
1992年巴塞罗那 据说是奥运历史最完美一跳 你觉得比全红婵如何？,2024-08-16 14:05,6957,1502,楠哥对你说,楠哥对你说,,https://toutiao.com/group/7403738085202067979/,,0,0
俄乌局势9月11日最新消息,2024-09-11 01:13,2573,101,旺兔斯瑞,旺兔斯瑞,俄乌局势9月11日最新消息,https://toutiao.com/group/7413186344890925608/,,0,0
监控下的一幕，女子睡觉不关门，男子蹑手蹑脚走进来，太可怕了！,2024-07-11 03:37,10414,822,大七方,大七方,监控下的一幕，女子睡觉不关门，男子蹑手蹑脚走进来，太可怕了！,https://toutiao.com/group/7390217280497386018/,,0,0
如果不是日媒披露，我都不敢相信，中国已无需再向世界证明什么,2024-09-07 13:34,2212,340,黎明侃车车,黎明侃车车,说实话，如果不是日本媒体的披露，我都不敢相信，原来中国已经强大到如此地步，已经无需再向世界证明什么了！毕竟，现在的中国已经不同于往日，不仅在多个领域领先世界，而且强大的工业体系，造就出全球第二大经济体，甚至还成为了全球经济发展的“引擎”。,https://toutiao.com/group/7411893110399255050/,,0,0
"全红婵再战陈芋汐，""逆天""一跳惊呆全场观众，结果却出现了这一幕",2024-08-05 07:59,2072,239,呼呼体坛,呼呼体坛,,https://toutiao.com/group/7399562061958611507/,,0,0
国家要“动真格”了？催三胎“无效”后，专家提出“好主意”！,2024-09-10 21:40,1590,456,胡胡爱唠嗑,胡胡爱唠嗑,国家要“动真格”了？催三胎“无效”后，专家提出“好主意”！,https://toutiao.com/group/7413008658004443648/,,0,0
潘长江女儿潘阳：嫁10亿富豪结婚12年，却为何一直带儿子住娘家？,2024-08-31 13:17,12979,1075,以茶书,以茶书,潘长江的女儿潘阳，在2012年7月嫁给了石磊，就连潘长江都对这个女婿满意的不得了，生怕人跑了似的，赶紧把女儿嫁出去了。石磊是谁，特别厉害，特别优秀。出生于音乐世家，从小在寸土寸金的香港长大，后来去往美国留学。,https://toutiao.com/group/7408773982087938586/,,0,0
日本人在中国建立这么多学校，到底是谁给他们的权利？答案来了！,2024-08-30 05:23,24271,12481,东说西说,东说西说,,https://toutiao.com/group/7408798754536423971/,,0,0
“门口三不放，放了家运丧”，这3样东西放门口不吉利！,2024-07-22 10:31,14125,1019,八面国学,八面国学,,https://toutiao.com/group/7394405899790221874/,,0,0
和蒋欣相恋多年，他转身娶了小四岁娇妻，如今妻子和他红透半边天,2024-07-11 15:10,15657,2266,图图图酱吖,图图图酱吖,#长文创作激励计划#在阅读此文前，辛苦您点一下“关注”，既方便您进行讨论和分享，又能给您带来不一样的参与感，感谢您的支持！娱乐圈里很多女明星谈恋爱，都会选择圈内人士。因为她们在拍戏过程中，很容易和男演员因戏生情但是他们的分手率也是极高的。,https://toutiao.com/group/7390333273412485667/,,0,0
缅甸反对派警告：绝大部分中国项目已被我们控制，最好过来接触,2024-09-05 02:47,4911,199,温度历史,温度历史,今年年初，NUG发布了对华关系十点声明，其中9点都是遵守其他国家对华交往的一般准则，最为重要的一点是不承认2021年以后军方政府签订的所有合同。,https://toutiao.com/group/7410797512417722931/,,0,0
MC我的世界：发现蜘蛛巢穴，阻止蜘蛛群体大爆发！,2024-06-16 08:30,1733,132,MC杰杰和麦琪,MC杰杰和麦琪,,https://toutiao.com/group/7380736016992174604/,,0,0
母亲去世时堂哥说没空回来，多年后大伯离世，我只随了份子人没去,2024-08-25 06:00,6564,2171,文史君曰,文史君曰,文|可乐本文声明:本文为短篇小说，内容纯属虚构，请理性观看前言“堂哥怎么没来，他难道不该来送送我妈吗？”“你堂哥现在正谈一笔大生意，特别重要，要是错过了，这些损失你来赔？”母亲生病住院期间，堂哥从没有来看望过，甚至在母亲的葬礼上，我也没有发现堂哥的身影。,https://toutiao.com/group/7406641944383783459/,,0,0
寒门冠军不配得到尊重？全红婵夺冠饱受质疑，海军少将替她撑腰,2024-09-09 10:45,3459,441,大事迹,大事迹,,https://toutiao.com/group/7412592595085460009/,,0,0
哈弗H6和大众相撞，车身当场一分为二，网友嘲讽：这就是纸糊车吧,2024-08-08 01:44,3280,1393,说车小官儿,说车小官儿,哈弗H6和大众相撞，车身当场一分为二，网友嘲讽：这就是纸糊车吧,https://toutiao.com/group/7400578658097693225/,,0,0
1974年，陈毅夫人临终前叮嘱三个儿子：妹妹结婚后，你们才能分家,2024-08-22 07:16,7708,293,彗星世界美食,彗星世界美食,做完手术之后，张茜的身体已经非常虚弱了，因此，医生特别关照让她不能劳累，一定要做好保养。1974年，夫人感觉自己快要坚持不住了，在弥留之际，她还在嘱托儿子们必须等妹妹出嫁之后才能分家。,https://toutiao.com/group/7405854164503855653/,,0,0
女子在户外搭帐篷洗澡被吹飞，随后在其他人的注目下飞奔回车内,2024-09-05 06:12,7196,1464,沈视看今天,沈视看今天,,https://toutiao.com/group/7411037922549301779/,,0,0
西方媒体：马来西亚总理发表了爆炸性言论,2024-09-11 06:00,10073,1032,青春大连,青春大连,,https://toutiao.com/group/7413261422169326134/,,0,0
估计颁奖人这一辈子都忘不了给全红婵颁奖的尴尬瞬间#全红婵,2024-08-11 03:25,6259,746,悠闲葡萄tsJ,悠闲葡萄tsJ,,https://toutiao.com/group/7401717760587203083/,,0,0
中缅边境通婚严重，为了能在中国定居，缅甸女孩也太拼了,2024-08-22 12:48,13757,1592,柳絮忆史,柳絮忆史,“一旦男方彩礼打过来，就意味着你们是‘夫妻’，就必须开始同居。”婚介所的人这样告诉前来相亲的缅甸女性。在中缅边境的云南地区，娶个缅甸媳妇并不是什么稀奇的事，反而十分普遍，甚至形成了一条婚介产业链。,https://toutiao.com/group/7405853545108357668/,,0,0
“爬行妈妈”董明英：嫁大22岁光棍，不听劝3年生俩，如今怎样了,2024-07-23 14:38,11821,446,木乔简科,木乔简科,人的一生可能会有很多转折点，而有些转折点，就会改变一个人一生的命运。山东37岁的“爬行妈妈”董明英就是这样的人，因为一个意外改变了自己一生的命运。父母的疏忽，导致她再也站不起来从小，董明英就生活在一个不太富裕的家庭里，加上父母精力有限，兄弟姐妹多，觉得如果有啥问题，等等就行了。,https://toutiao.com/group/7394770134570730021/,,0,0
评论炸锅！全红婵更新视频点赞破百万，回复网友：我干爸也很帅。,2024-09-08 07:58,561,168,鹅崽崽,鹅崽崽,前言在从港澳回来以后，全红婵就更新了一条动态发布了一条视频，然后这条视频就像“开挂”一样速度迅速突破百万赞。全红婵还特意用了黑白开场，开头的画面开起来很慵懒，看着是在休息。接着画风就变成彩色，全红婵和宠物狗的画面，还给了她喜爱的红色豆豆鞋一个特写，还有她谢哥，也在镜头里。,https://toutiao.com/group/7412169039432270387/,,0,0
61岁李修平和好友聚会，素颜圆脸年轻贵气，看坐姿不愧是央视国脸,2024-09-11 05:07,433,153,木乔简科,木乔简科,从第一位主持人赵忠祥，再到后来的罗京、邢质斌、张宏民，再到如今的康辉、李梓萌等等，可以说主持过《新闻联播》的人不下几十位。,https://toutiao.com/group/7413204876576047653/,,0,0
卷走5000亿、坑惨200万中国人传销集团创始人，已引渡回国受审！,2024-09-07 03:20,3958,973,林不新,林不新,这就导致儿子想要联系父亲，压根就联系不上。这一些前来讨债的人，也直接把两个炸弹，给扔进了张誉发亲生儿子所在的房间。,https://toutiao.com/group/7407723176727249427/,,0,0
历史上根本不存在的七个人，却个个家喻户晓，我们竟被骗了几百年,2024-07-17 11:06,3177,2159,史墟,史墟,本文内容均引用权威资料结合个人观点进行撰写，文末已标注文献来源及截图，请知悉。历史是一面镜子，让我们得以窥见过去的真相与谎言。下面这七个人物在历史上根本不存在，却个个家喻户晓。,https://toutiao.com/group/7392558542680523291/,,0,0
台湾女儿来大陆，寻找45年前离家的父亲，才发现父亲是荣氏大家族,2024-07-24 05:50,13135,1532,正义2019,正义2019,中央电视台的《今世缘·等着我》节目，曾经重新连起了许多段因为时间、地理而断绝的人际感情，有人通过这个节目找到了失散多年的亲人，也有人见到了失去联络的战友。,https://toutiao.com/group/7395075701911503379/,,0,0
又一大佬跑路！卷走62亿，拖欠上千员工工资、投资者血本无归,2024-09-06 03:17,14563,1521,霁寒雪,霁寒雪,上千员工的科技公司，上午人还在上班，还有新人办入职，没想到公司下午就解散了。公司投资人的62亿元不知所踪，拖欠800多名员工两个月工资，而老板早就跑路了。,https://toutiao.com/group/7411356880464790057/,,0,0
