title,publish_time,like_count,comment_count,media_name,source,abstract,article_url,tag,is_yaowen,article_sub_type
打不过中国还打不过你？为维护霸权不崩塌，美国决定制裁印度,2024-09-09 07:34,2488,601,迷彩虎说,迷彩虎说,最近，美国为了维护自身的经济霸权，做出了一个非常重要决定:对一个东方大国进行制裁。原本美国人玩金融，是为了用美元冲击其他国家，但是现在由于美国没有商品，所以只能眼睁睁看着人民币开始挑战美元的地位。,https://toutiao.com/group/7412543529181889065/,,0,0
万万没想到，35岁杨颖兜兜转转干回“老本行”，活成内娱最大笑话,2024-09-09 04:42,531,205,峰哥正读,峰哥正读,同样是站在香港街头，同样是在拍精美写真，只是如今35岁的杨颖再也不能够和十七八年前那样无知无畏，所向披靡了。,https://toutiao.com/group/7412473907350913551/,,0,0
德国F-125护卫舰即将横穿台湾海峡，中国警告无效，应如何应对？,2024-09-09 07:51,2967,5586,军武次位面,军武次位面,根据9月7日德国媒体《明镜周刊》透露的相关消息，目前正在太平洋地区执行军事任务的德国海军巴登福腾堡号护卫舰和美茵河畔法兰克福号补给舰，很有可能在本月中旬，从韩国前往印尼的途中，自北向南穿过台湾海峡。,https://toutiao.com/group/7412485848039457295/,,0,0
61岁港星内地工地开挖掘机，已被封杀多年，母亲仍住养老院8人间,2024-07-10 11:59,5015,1944,八号探秘人,八号探秘人,本文叙述皆有官方信源，为了给读者更好体验，放在了文章后缀！在阅读此文之前，辛苦您点击一下“关注”，既方便您进行讨论和分享，又能给您带来不一样的参与感，感谢您的支持！编辑：小易演艺圈的更替总是让人唏嘘不已。曾几何时，孙兴凭借《倚天屠龙记》中迷人的“杨逍”一角。,https://toutiao.com/group/7389944309526594082/,,0,0
"万万没想到,53岁“丁克”半辈子的康辉，一生遗憾竟然是一通电话",2024-08-21 22:14,16241,3713,峰哥正读,峰哥正读,在阅读此文之前，麻烦您点击一下“关注”，既方便您进行讨论和分享，又能给您带来不一样的参与感，感谢您的支持！文/编辑：蘑菇百善孝为先。但是到底怎么做才算是“孝”，康辉用了半辈子才明白。央视知名主持人康辉，事业顺遂，家庭幸福，在外人看来是一个人生赢家。,https://toutiao.com/group/7405504703687115273/,,0,0
预定人数达341万，华为三折叠手机卖疯了！今日下午正式公布价格，黄牛价格已炒到6万,2024-09-10 03:56,179,359,金融界,金融界,金融界9月10 消息，华为商城显示，自9月7日12:08开启预订以来，华为三折叠手机——华为MateXT非凡大师预约人数已达341.1万人。该款手机将于9月10日下午的华为“见非凡品牌盛典及鸿蒙智行新品发布会”上正式发布，届时也将公布最终销售价格。9月20日10:08正式开售。,http://m.jrj.com.cn/toutiao/2024/9/10/43142032.shtml,,0,0
巴布亚旅行偶遇特大洪水，险象环生“命悬一线”,2024-08-23 12:20,14065,627,耀阳环游记,耀阳环游记,,https://toutiao.com/group/7406308858471121443/,,0,0
演员张瑜：离婚后单身30年，再见前夫仍感到心动，66岁没有子女,2024-07-24 10:51,10014,726,八号探秘人,八号探秘人,在阅读此文之前，辛苦您点击一下“关注”，既方便您进行讨论和分享，又能给您带来不一样的参与感，感谢您的支持！写作不易，作者每天辛苦写稿，只是为了养家糊口，希望各位观众老爷可以多多理解。文中加入5秒广告解锁，观看5秒后便可免费阅读全文啦，感谢各位观众老爷的理解与支持！,https://toutiao.com/group/7395130917804720640/,,0,0
谁绊的我？武磊准单刀情况突然栽倒在禁区，身后草皮被踢飞,2024-09-10 12:30,174,797,直播吧,直播吧,直播吧9月10日讯 18强赛第2轮，国足vs沙特。比赛第28分钟，武磊前场跑出良机，但似乎是踩到了草皮上的坑洼，一头栽倒在了沙特队的禁区里。,https://news.zhibo8.com/zuqiu/2024-09-10/66e03b58aeb55native.htm,,0,0
这部台湾电影拍的真大胆，中年夫妻间的不堪，没结婚的禁止观看！,2024-08-16 06:44,3814,136,小胡谈事件,小胡谈事件,"电影名：幸福城市
 这部台湾电影拍的真大胆，中年夫妻间的不堪，没结婚的禁止观看！",https://toutiao.com/group/7403624512404587047/,,0,0
北京市#大案纪实  #刑侦纪实  #真实案件,2024-08-17 15:46,10993,396,晚安猫宝,晚安猫宝,,https://toutiao.com/group/7404135201678295578/,,0,0
笑得肚子疼夫妻爆笑对话，一个老婆都搞不定，还想三妻四妾,2024-08-05 10:01,7550,793,陈哥爆笑社,陈哥爆笑社,盘点夫妻搞笑对话，喜欢就多多关注支持,https://toutiao.com/group/7399593433255379475/,,0,0
#因为一个片段看了整部剧 #西游记续集 #抖音大大求热门,2024-08-06 13:34,1222,181,七年后娶你,七年后娶你,,https://toutiao.com/group/7400019391334580746/,,0,0
海南台风给华为和苹果打了一波广告，华为躺赢苹果躺输,2024-09-10 06:07,1780,195,聪明的苹果6u,聪明的苹果6u,,https://toutiao.com/group/7412892171335893519/,,0,0
首次世界五百强断崖差距: 日本149家，美国151家，中国3家，现在呢,2024-09-06 03:45,337,759,此间一叙a,此间一叙a,1995年，世界五百强榜单出世，迅速吸引了全球经济界的目光，时至今日，这一数据已经成为评判一个国家经济实力的重要指标。,https://toutiao.com/group/7411368105638658601/,,0,0
从创业英雄变成丑恶资本家，人民日报都批评，马云到底犯了什么错,2024-09-10 06:30,1949,365,陌上史无言,陌上史无言,他的所作所为就连官方都看不下去，不单单是口头批评，更是给他开出巨额罚款，马云如今状况全都要怪自己。有人说马云并不是一个聪慧的人，毕竟他小得时候学习成绩很差，就连中考都考了两次，虽然他很努力的在学习，但是成绩就是很不理想，考大学的时候也是考了三次才成功，最后进入了杭州师范学院。,https://toutiao.com/group/7412895234205483556/,,0,0
