title,publish_time,like_count,comment_count,media_name,source,abstract,article_url,tag,is_yaowen,article_sub_type
沙僧只封了金身罗汉，为啥一声不吭？你看如来给了他什么好处,2024-08-07 10:42,4256,1481,来点解读,来点解读,在《西游记》的大结局里，唐僧师徒四人成功取得真经，佛祖如来也是言出必行，对他们之前的种种努力和贡献都一一兑现了承诺。唐僧成功成佛，孙悟空荣升斗战胜佛，就连那爱吃爱睡的猪八戒也摇身一变成了净坛使者，享尽美食。可轮到沙僧这儿，就只封了个金身罗汉。,https://toutiao.com/group/7400345643971183138/,,0,0
事实证明，和马伊琍离婚5年后的文章，早已走上了另一条大道,2024-08-31 03:55,1315,279,沐泠泱,沐泠泱,“谁能火过2009年的小沈阳”这句话，相信很多人都听过，毕竟当年的小沈阳可谓是红透了半边天，凭借小品《不差钱》一夜成名。,https://toutiao.com/group/7409144906821747254/,,0,0
记者现场刁难李娜爱不爱国，李娜霸气回怼，撒贝宁佩服！,2024-07-27 08:19,9937,1292,山西广电文娱,山西广电文娱,,https://toutiao.com/group/7396227420216361535/,,0,0
王楚钦回复全红婵偷拍：不回北京了是吧，这么大胆妹妹！评论笑死,2024-09-03 03:19,2171,779,小莫爱八卦,小莫爱八卦,全红婵又搞新节目了，偷拍完樊振东睡觉，这又偷拍了王楚钦睡觉，而且王楚钦还是张着嘴睡的，睡一觉醒来这两个“难兄难弟”发现天又塌了。,https://toutiao.com/group/7410234712486068751/,,0,0
孩子快要“停止长高”的3个征兆，要是全中，身高或基本定型,2024-08-09 03:36,1145,959,儿科长高琚教授,儿科长高琚教授,前两天看诊了一个孩子，是个14岁的小男孩，从2月到现在都没长个，家长才想起来查一下骨龄，结果当地医生说已经闭合了，长不了了。家长很生气，觉得医生乱评估，平时看我的科普比较多，就大老远的来找我，我一看骨龄片，和当地医生评估的一样，骨龄16岁了，身高基本已经定型了。,https://toutiao.com/group/7400976499446137398/,,0,0
笑不活了，全红婵最新动态回京就被陈若琳训上了，网友评论区笑死,2024-09-05 16:04,1009,331,小莫爱八卦,小莫爱八卦,近日，刚刚随中国奥运代表团结束访问港澳之行的全红婵的最新动态引发热议，回家就被陈若琳训上了一脸生无可恋…不管是巴黎奥运会还是港澳之行，全红婵都是火了，可以说是以一己之力干翻了内娱。,https://toutiao.com/group/7411119239672742440/,,0,0
印度姑娘远嫁中国，回印度探亲被笑话，妹妹：你老公像个坏人,2024-08-16 15:30,10353,1143,听故事的瓜,听故事的瓜,“我讨厌我的家人，我嫁到了中国后，生活得很好，因为我老公是真的很爱我，他的家人爱屋及乌，对我也很好，但是当我回到印度，我的家人却对我老公一点都不好，我真的很生气。”印度姑娘越说越委屈，两眼水汪汪的就要开始掉眼泪。,https://toutiao.com/group/7403753647168930319/,,0,0
秋葵的神仙吃法，比吃补药还补，鲜香滑嫩又多汁，太香了,2024-08-07 08:58,16765,821,家常的味道,家常的味道,,https://toutiao.com/group/7400319304052245003/,,0,0
黑曼巴对战眼镜王蛇，谁才是毒王之王。,2024-08-11 10:35,1131,146,小唐科普,小唐科普,,https://toutiao.com/group/7401798173259203123/,,0,0
女子怀孕警告邻居听不了噪音，要求全家都别走动，下秒被怼到结巴,2024-09-04 05:58,12745,1568,速看,速看,女子怀孕警告邻居听不了噪音，要求全家都别走动，下秒被怼到结巴,https://toutiao.com/group/7410663197050405376/,,0,0
银行问你取钱干什么？这样回答最好，马上就会给你办理,2024-09-06 10:35,1097,279,大山敬友人,大山敬友人,银行问你取钱干什么？这样回答最好，马上就会给你办理,https://toutiao.com/group/7411476803883106857/,,0,0
毛主席离世当晚：中央秘密找到徐静求助，她当即提出三点特殊要求,2024-09-01 03:08,9953,149,方圆讲历史,方圆讲历史,当车子进入中南海的时候徐静忽然有一种不祥的预感，当看到毛主席静静地躺在床上后，徐静不由瘫坐在地，泪水也止不住地流下来。,https://toutiao.com/group/7409212261107057164/,,0,0
1米3袖珍美女：执意嫁1米48袖珍男人，婚后丈夫“长高”抛弃妻子,2024-08-27 13:30,5552,994,鲨娱崽崽,鲨娱崽崽,新郎和新娘看上去像十几岁的小孩子，众人疑惑不已: 他们到结婚年纪了吗?事实上这对夫妻是袖珍人。新郎29岁，身高1米48;,https://toutiao.com/group/7407720729992643099/,,0,0
秋葵的神仙吃法，比吃补药还补，做法简单，鲜香滑嫩又多汁，真香,2024-07-29 12:39,34471,2971,一画美食,一画美食,,https://toutiao.com/group/7397036492566856244/,,0,0
【事态升级】沫沫前老板手握重要证据喊话小杨哥，并下最后通牒！,2024-09-07 16:05,10586,2148,铁血战士,铁血战士,,https://toutiao.com/group/7411933092958437922/,,0,0
一代女皇陈若琳，当众训斥全红婵惹争议，背后默默帮她突破发育关,2024-08-10 06:53,2922,186,大脚哥,大脚哥,,http://toutiao.com/item/7401400383353913890/,,0,0
地震动画演示,2024-08-16 15:27,3567,988,趁早启航,趁早启航,地震动画演示,https://toutiao.com/group/7403759352928829979/,,0,0
我在尼泊尔的小城遇见没有穿裤子的大女孩，她的父亲养了5个孩子,2024-08-30 04:43,4445,539,飞飞全球旅行记尼泊尔,飞飞全球旅行记尼泊尔,我今天独自一人到尼泊尔和印度交界的小城比尔根杰穷游，我以为我是世界上最穷的人了，没想到到了尼泊尔的比尔根杰，我才真正理解什么叫一无所有？什么叫一贫如洗？,https://toutiao.com/group/7408780240510304808/,,0,0
白色轿车是在“找死”，5次弯道超车，就是投胎也没必要那么急。,2024-07-24 11:06,2052,909,喜哥开车,喜哥开车,,https://toutiao.com/group/7395157189330993702/,,0,0
终于封海，中国拖船进场，马科斯开始呼救，30国逼中方在南海让步,2024-09-04 04:50,7132,105,阿皮历史库,阿皮历史库,【编者按：本文为头条原创独家首发，请勿抄袭转载】«——【·前言·】——»南海争端持续到现在，也没有落下帷幕，这背后除了菲律宾政府的频频挑衅之外，还与美西方国家的支持脱不了干系。,https://toutiao.com/group/7410643253369913866/,,0,0
一只最反骨的猫咪，凭借“挨打”涨粉百万，打不过主人就揍她的狗,2024-07-03 10:21,30637,2184,网红宠物君,网红宠物君,一只最反骨的猫咪，凭借“挨打”涨粉百万，打不过主人就揍她的狗,https://toutiao.com/group/7387352445799629346/,,0,0
18级台风登陆越南实况，想躲在后面看热闹，这回看他们笑得出来不,2024-09-08 12:28,3230,282,潇洒奶茶RZsNw,潇洒奶茶RZsNw,,https://toutiao.com/group/7412248231385498138/,,0,0
这歌谁编的。太有才了，越听越上头,2024-09-01 09:12,32951,2675,阿抖-,阿抖-,,https://toutiao.com/group/7409599964278194724/,,0,0
属兔人到了晚年有谁陪？生肖兔再也见不到这5个人了，看看是谁,2024-09-03 08:28,2272,304,小涛说说事,小涛说说事,属兔人到了晚年有谁陪？生肖兔再也见不到这5个人了，看看是谁？,https://toutiao.com/group/7410331010237202954/,,0,0
菜花蛇VS眼镜王蛇：谁更强,2024-08-23 05:18,1330,302,小唐科普,小唐科普,,https://toutiao.com/group/7406170487975477801/,,0,0
揭秘日本311海啸！恐怖现场大曝光，你绝对没见过的壮观景象,2024-06-25 12:45,14268,728,V科技奇趣,V科技奇趣,在2011年3月11日，日本东北部海域，原本平静的海面在那一刻，突然变得狂暴起来。那一刻，大地在颤抖，海洋在咆哮，日本面临着前所未有的挑战。当地时间14时46分，一场里氏9.0级的大地震突然发生。这场地震，被称为‘311日本地震’，也是日本历史上，乃至全球历史上，震级最高的地震之一。,https://toutiao.com/group/7384412130256912946/,,0,0
公鸡明明没有生殖器官，那是如何与母鸡完成交配的？看完涨知识了,2024-08-11 02:32,12050,1796,闪闪大声聊奇事,闪闪大声聊奇事,,https://toutiao.com/group/7401704293973099043/,,0,0
71年杨振宁和岳父母杜聿明、曹秀清合影，站在一旁，显得毕恭毕敬,2024-09-02 05:26,600,390,万物知识局,万物知识局,完美的爱情在世间似乎是鲜少存在的，即便是恩爱的夫妻在相处中也会有磕磕绊绊，待到结局时更是无法用完美来作为结束，而在曾经动荡的年华中，一边要在国家时局中安稳度日，一边还要维系自己的爱情，更是难上加难。,https://toutiao.com/group/7409132056879383080/,,0,0
华南农业大学2024级新生开学典礼，婵宝的自我介绍：婵宝说她是跳水运动员，没有说她是跳水冠军！多么低调的孩子！#谢思埸#全红婵#陈清晨 ##奥运冠军#华南农业大学#开学典礼,2024-09-04 19:25,5428,571,热心熊猫5mdC8a,热心熊猫5mdC8a,,http://toutiao.com/item/7410871211556602403/,,0,0
我拿你当哥们，你却骗我去领证！,2024-09-07 06:57,15416,3484,爆笑小黑仔,爆笑小黑仔,,https://toutiao.com/group/7411791843178611251/,,0,0
公鸡强行霸占了狗窝，小狗狗回家的第一反应，把主人笑得肚子疼！,2024-07-09 14:51,6822,322,维E爱动物,维E爱动物,公鸡强行霸占了狗窝，小狗狗回家的第一反应，把主人笑得肚子疼！,https://toutiao.com/group/7389648897754268170/,,0,0
给“扮演毛主席”的10位演员排座次：古月只排第2，唐国强未进前3,2024-08-26 06:52,4869,1740,香港电影怀旧,香港电影怀旧,国家一级演员王霙去世，享年66岁。从艺40余年，他的一生基本上为一个角色服务，那就是毛主席。关于王霙的过往，我们下面有详细介绍。回看影视作品中的主席形象，很多演员都给出了印象深刻的表演。既有古月、张克瑶等老一辈的神级演绎，也有侯京健、王仁君等年轻演员的传神表现。,https://toutiao.com/group/7407335713588511247/,,0,0
这才是武侠片的巅峰之作，你敢相信这是20年前的国产特效？,2024-08-15 17:00,14299,2305,九九哥超燃影视,九九哥超燃影视,,https://toutiao.com/group/7403412000191021607/,,0,0
全红婵怎能社牛到这种程度，凭一己之力干翻娱乐圈让体坛直升巅峰,2024-09-05 10:28,4243,273,影小爆,影小爆,,https://toutiao.com/group/7411104054224355881/,,0,0
无人机实拍：保利中央海岸，17级台风过后,2024-09-07 03:20,3022,736,查干探世界,查干探世界,,https://toutiao.com/group/7411735850679009804/,,0,0
日本人在中国建立这么多学校，到底是谁给他们的权利？答案来了！,2024-08-30 05:23,23097,11954,东说西说,东说西说,,https://toutiao.com/group/7408798754536423971/,,0,0
诸葛亮为何无法一统三国？毛主席的评价直切要害：他犯了三大失误,2024-07-06 10:58,2078,244,红色先驱,红色先驱,由于平台规则限制，阅读过程中需要看一段视频才能解锁文章的后续内容，望您支持和谅解。公元207年，隆中一对出南阳，时年26岁的诸葛亮即开启了他“鞠躬尽瘁，死而后已”的一生。,https://toutiao.com/group/7388472237756334644/,,0,0
雄狮不想带娃，做法直接让人笑岔气，简直是父亲的真实写照！,2024-07-18 09:26,8523,548,阿星动物,阿星动物,,https://toutiao.com/group/7392904854894543372/,,0,0
大米生虫，不能暴晒！米虫最怕这3招，米袋里放一点，一年不生虫,2024-08-01 07:39,4582,359,山城旧客,山城旧客,本文内容均引用权威资料结合个人观点进行撰写，参考文献及来源截图已放文章末尾像我这种不做饭不知柴米油盐贵的人，更加不知道大米还会生虫！在得知大米生虫之后，有人说将其放在太阳下暴晒虫就会消失，有的也说用水淘米，虫子会漂浮出来等等一系列的方法。这些方法到底管不管用？又有什么弊端？,https://toutiao.com/group/7398067117604340262/,,0,0
变形结束后不愿回村，向富爸爸要钱被拉黑的吴宗宏，后来怎样了？,2024-07-08 03:20,1093,317,维京晋州梦,维京晋州梦,作为一档大热的纪实类节目，《变形计》在当年引起过很大争议。大家都对其中见识过繁华后又回归贫穷的农村孩子感到担忧，但另一方面，这些农村孩子也因自身正向、积极的态度颇受观众们喜爱和关注。然而在这其中，却有一个名叫吴宗宏的农村孩子显得有些另类。,https://toutiao.com/group/7389087141206983218/,,0,0
户口本还在手里的抓紧看！别不当回事，等你吃亏就来不及了！,2024-09-06 04:38,5804,473,一生平安,一生平安,户口本还在手里的抓紧看！别不当回事，等你吃亏就来不及了！,https://toutiao.com/group/7411384960805765682/,,0,0
青城派掌门人出山，擂台教育网红打得他不能还手,2024-07-11 13:29,17976,6544,格斗新势力,格斗新势力,青城派掌门人出山了，擂台教育网红打得他不能还手,https://toutiao.com/group/7390369776318546447/,,0,0
天安门往南3公里，北京龙须沟真实现状，不是亲眼看到谁敢相信啊,2024-08-27 22:06,18342,6002,北京旅游等着瞧,北京旅游等着瞧,,https://toutiao.com/group/7407810359739810331/,,0,0
张学良晚年回忆：之前我从不迷信，但是在杀杨宇霆时，我不得不信,2024-07-17 11:11,8403,844,来点解读,来点解读,奉系军中威名赫赫、功绩卓越的杨宇霆就这样离开了人世，杀他的人正是他看不上眼的“纨绔子弟”张学良。晚年自述时，张学良表示:“原本我这个人并不迷信，但杀杨宇霆时我却不得不信了!”,https://toutiao.com/group/7392560082111857191/,,0,0
母亲虎口救女被咬身亡，8年后女儿仍未得到父亲原谅：谁的责任,2024-08-14 02:37,7840,2286,山河月明史,山河月明史,车上的母亲见状，急忙下车想从老虎口中把女儿救下来，自己却命丧当场。事情发生之后，赵菁的父亲始终不肯原谅女儿，认为是她害死了妻子。,https://toutiao.com/group/7402554839245095460/,,0,0
河南28岁女子一夜变老，医院怎么也查不出原因，11年后才知真相,2024-08-28 07:18,5489,311,静枫听史,静枫听史,因为生孩子，妙龄少女在一夜之间变成了七十老妇？当时年仅28岁的胡娟，在生完孩子不久之后，竟一夜变老，皮肤苍老松弛般就如七八十岁的老妇。然而辗转各大医院，却始终查不出病因所在，直到11之后才得知真相。那么到底是什么原因导致了胡娟一夜变老呢，她最后又恢复原本的容貌了吗？,https://toutiao.com/group/7408086014138253833/,,0,0
夫妻的一生，有老公和没老公的区别，几张漫画体现得淋漓尽致,2024-09-06 05:07,265,161,哆哆娱乐,哆哆娱乐,“家家有本难念的经”，这话说得一点不假。说到夫妻双方，谁更累，这问题可真是让人头疼。咱们先说说男人，他们在外头打拼，工作压力大，竞争激烈，回到家还得撑起整个家，这压力可想而知。,https://toutiao.com/group/7411390973512630818/,,0,0
联合国快破产了？中美不交2024会费，美国没钱中国不交又是为何？,2024-09-04 09:36,2461,284,名城雨,名城雨,众所周知，联合国是全球最大的组织，在世界上有着重要的地位，然而如今却面临着财政困难，美国直接选择不交2024年的会费，就连中国2024年的会费也没交。,https://toutiao.com/group/7410715886975189558/,,0,0
日本祖先真是徐福带去的500童男童女？DNA结果出来了，真相太意外,2024-06-15 07:47,12011,988,如一席话,如一席话,来源：中国知网徐福，这位秦朝时期的网红方士，因一次充满冒险精神的东渡而永载史册。他率领500名童男童女，勇敢地扬帆出海，探寻那神秘莫测的长生不老药，而后便消失在历史的迷雾中。然而，跨越千年的时光，一个引人遐想的问题始终挥之不去：徐福的船队是否真的踏上了日本的土地？,https://toutiao.com/group/7380629877282390555/,,0,0
送走马蓉又遇冯清，倒霉可怜的王宝强，始终还是绕不过“女人坑”,2024-08-27 01:45,980,190,皮皮娱乐,皮皮娱乐,本以为马蓉的背叛已经惊动整个娱乐圈了，谁知冯清又掀起波澜。1982年，王宝强出生在河北的一个小山村，家庭贫困。,https://toutiao.com/group/7407379901889659431/,,0,0
美国毒贩坠机身亡，携带31公斤“白粉”被棕熊吃光，结果熊悲剧了,2024-08-21 07:30,2630,130,沐语纪史,沐语纪史,文|瓜田李的猹编辑|沐语纪史1985年，美国毒品走私犯安德鲁·桑顿迎来了他的末日。作为一个叱咤风云的大毒枭，他怎么也想不到自己死的如此窝囊。他更不知道，自己的死还连累了一头无辜的大棕熊。原来在他死之前，身上携带有大量可卡因，一旦被有心之人捡到就麻烦了。,https://toutiao.com/group/7405483522556772891/,,0,0
如果再次和日本发生战争怎么办？小女孩的回答值得我们深思,2024-07-16 23:04,25945,7757,网络茶馆,网络茶馆,,https://toutiao.com/group/7392373485483328034/,,0,0
中国体坛只有6人称得上世界巨星，李娜算一个，邓亚萍上不了榜,2024-07-22 11:07,9281,1745,飞鸟科普,飞鸟科普,提起在中国体坛的巨星，你一定能想到很多人，不过真正举世瞩目的世界体坛巨星仅有这六个人，且无人可以撼动。,https://toutiao.com/group/7394394470407569958/,,0,0
印度富豪来北京，下飞机后大笑：中国好穷，首都竟然也有烂房子,2024-09-02 20:00,2851,119,苹果,苹果,,https://toutiao.com/group/7410138241342374440/,,0,0
帮大妈清理荒废40年的祖宅，这房子够阴森的，结果清理出来傻眼了,2024-06-21 08:40,40370,5655,创意花园美艺,创意花园美艺,帮大妈清理套荒废40年的祖宅，看着就挺阴森，结果清理出来傻眼了,https://toutiao.com/group/7382808201818800690/,,0,0
海里到处都是水，跨海大桥的桥墩是如何修建的？看完长见识了,2024-08-12 16:31,6663,809,乐天派贝里6U3,乐天派贝里6U3,,https://toutiao.com/group/7401930744718688768/,,0,0
全红婵抱着陈若琳大哭！急着找陈芋汐拥抱，颁奖迫不及待戴金牌,2024-08-07 01:36,3414,230,细雨茶话,细雨茶话,,http://toutiao.com/item/7400205524882424358/,,0,0
探访北京长安街旁的大型四合院，今天看到里面什么样了,2024-07-19 12:41,3179,380,小柴逛北京,小柴逛北京,,https://toutiao.com/group/7393326117647548962/,,0,0
美国为何一直针对中国？英知名学者：因为中国犯了一个“原罪”！,2024-08-21 12:26,11374,1879,霁寒雪,霁寒雪,所有人都知道，近些年，美国几乎是无所不用其极的针对中国。明明世界上容得下中美两个大国，美国为何要揪着中国不放呢?,https://toutiao.com/group/7405536979424199219/,,0,0
难怪宋江必须要死，你看三位梁山寨主的名字连起来是啥,2024-07-03 10:59,11984,374,墨子翟的日记,墨子翟的日记,“宁可朝廷负我，我也忠心不负朝廷，这便是大忠大义。”梁山的108位好汉可谓是个个身怀绝技，大多数也都是经历了被逼才无奈上了梁山。而梁山最重要的还得是寨主。梁山从创建到发展、再到解散，一共经历了三代寨主，分别是王伦、晁盖、宋江。,https://toutiao.com/group/7387352920041341451/,,0,0
终于搞明白了，电动车“每天充”和“用完充”，哪一个更伤电池？,2024-08-05 10:44,11713,978,江话直说,江话直说,"在当下，电动车在不知不觉间,成了中国人首选的代步工具。不论是朝九晚五的上班族，还是穿梭在城市街道间的外卖小哥，电动车都成为了他们工作离不开的伙伴。电动车的普及，与它自身身具备的优点密不可分。其廉价、耐用、环保的三大优势，使得电动车一经面世，就深受中国劳动人民的青睐。",https://toutiao.com/group/7399603913768419879/,,0,0
李小龙打遍天下无敌手？妻子琳达晚年透露：丈夫其实很怕一种对手,2024-07-02 12:16,5487,780,红色先驱,红色先驱,1973年7月20日夜，一代宗师李小龙在睡后突然昏迷不醒，送到医院时，心跳与呼吸即已停止，时年仅33岁。,https://toutiao.com/group/7387009599020483112/,,0,0
中缅边境通婚严重，为了能在中国定居，缅甸女孩也太拼了,2024-08-22 12:48,13309,1545,柳絮忆史,柳絮忆史,“一旦男方彩礼打过来，就意味着你们是‘夫妻’，就必须开始同居。”婚介所的人这样告诉前来相亲的缅甸女性。在中缅边境的云南地区，娶个缅甸媳妇并不是什么稀奇的事，反而十分普遍，甚至形成了一条婚介产业链。,https://toutiao.com/group/7405853545108357668/,,0,0
大清已灭亡106年，而乾隆7世孙仍穿龙袍祭祖，家里金碧辉煌,2024-08-29 02:15,222,248,功标青史,功标青史,声明：本文内容均是根据权威资料结合个人观点撰写的原创内容，在今日头条全网首发72小时，文章中有5秒免费广告可增加创作收益，感谢各位看官点击支持原创，文末已标注文献来源及截图，请知悉。谁也没能想到大清都灭亡一百多年了，到现在竟然还有把自己当皇子皇孙的人。,https://toutiao.com/group/7408376617463988790/,,0,0
联合国秘书长来华，张口就要中国“割肉”，一顶帽子扣在中国头上,2024-09-07 14:50,2638,194,卢忠诚TALK,卢忠诚TALK,按照惯例，中国在前段时间也邀请了联合国秘书长一同参会。然而，峰会的间隙，古特雷斯却突然一顶“大帽子”扣在中国头上。,https://toutiao.com/group/7411913117414638095/,,0,0
他活埋近5000名红军，却逃到国外安享晚年，如今竟然还有人歌颂他,2024-08-29 14:17,2718,518,历史特别冷,历史特别冷,这是红军最惨烈的一次征途，21800余名战士出征，只有400余人最终存活下来，其中一大部分红军甚至遭到了惨无人道的折磨，5000多名战士被活埋。,https://toutiao.com/group/7408524025946751542/,,0,0
放一只假老虎，在狮群的必经之路会怎样？下一秒狮子的反应太逗了,2024-06-29 09:31,5328,499,小贝动物汇,小贝动物汇,,https://toutiao.com/group/7385855549906092585/,,0,0
全网群嘲的“月入3万精致女上厕所”事件，炸出了多少精神穷人！,2024-09-06 12:43,876,2536,梦录的西方史话,梦录的西方史话,科学研究表示，最佳“如厕”时间是清晨和睡觉之前。每次时间控制在2到5分钟最为合适。但是，一位月入3万的精致女突破了时常极限。,https://toutiao.com/group/7411468412922118707/,,0,0
与袁立分手的徐威，娶到张怡宁后，如今过得怎样,2024-08-06 06:55,8764,1051,陌上史无言,陌上史无言,写作不易，作者每天也是在公司上班写文章，天天加班到晚上12点，每天收益只有50多块，文中加入5秒广告解锁，就是能为了多几块收益，希望不要在骂了，希望观众老爷理解[浮云]哪怕到了今天，乒乓球历史上的“大魔王”依旧没有改变，张怡宁一直是乒乓球历史上无法超越的传奇人物。,https://toutiao.com/group/7399912939865571894/,,0,0
卷走5000亿、坑惨200万中国人传销集团创始人，已引渡回国受审！,2024-09-07 03:20,3226,856,林不新,林不新,这就导致儿子想要联系父亲，压根就联系不上。这一些前来讨债的人，也直接把两个炸弹，给扔进了张誉发亲生儿子所在的房间。,https://toutiao.com/group/7407723176727249427/,,0,0
“我就是她取精生子的工具”清华学霸哭诉，撕开了女富豪的遮羞布,2024-08-22 09:10,17007,1433,见识乌托邦,见识乌托邦,当这句话从清华学霸刘光耀口中说出时，所有人都震惊了。那位曾在创业和学术上双双辉煌的年轻才俊，如今在社交媒体上愤怒地撕开了婚姻的真相。,https://toutiao.com/group/7405884441706463778/,,0,0
狗狗偷偷上床跟男主睡，没想到女主突然杀个回马枪！看一遍笑一遍,2024-07-30 13:35,6044,808,小黑小黄的幸福狗生,小黑小黄的幸福狗生,马桶太逗了,https://toutiao.com/group/7397422044303393315/,,0,0
青岛已经冷清到这种地步了吗？这也是很多实体店和打工人的无奈吧,2024-09-05 03:01,13081,6003,冯家俩公子,冯家俩公子,,https://toutiao.com/group/7410988915579945472/,,0,0
夫妻之中，谁的基因决定了孩子的智商和长相？专家的回答很一致,2024-08-05 06:30,4263,660,酒馆茶色,酒馆茶色,俗话说龙生龙，凤生凤，老鼠的儿子会打洞。颜值与智商虽然从出生就决定了，但却在生活中十分重要。因此一位婴儿的诞生，往往最受大家讨论的话题无非是这两点。像父亲还是像母亲，跟谁多一点？两人基因又是谁占据了“主导”地位？,https://toutiao.com/group/7399520507067925044/,,0,0
22年湖北17岁女孩中毒脑死亡，捐献器官前，隔壁医生大喊：我能救,2024-08-29 10:40,3750,776,知言Talk,知言Talk,那一年，对于老肖和女儿肖雨来说，都是刻骨铭心的一年。如今回想起来，老肖人就感慨还好自己不是个守旧的人。,https://toutiao.com/group/7407730290510152242/,,0,0
