title,publish_time,like_count,comment_count,media_name,source,abstract,article_url,tag,is_yaowen,article_sub_type
淬火丨第二集 向战为战练精兵,2024-09-12 13:01,1509,169,央视新闻,央视新闻,经中央军委批准，由中央军委政治工作部、中央网信办、中央广播电视总台联合出品的思想解读类融媒体片《淬火》，9月11日起，在央视综合频道20点档首播。昨晚，《淬火》播出第一集《军旗下的誓言》。,https://content-static.cctvnews.cctv.com/snow-book/index.html?item_id=16095057789411478645&source=50006&sub_source=50006_001,,0,0
蛋仔派对：秀儿耍酒疯，到处撒蛋币？可把我急坏了！,2024-07-07 01:34,1492,174,游小浪Game,游小浪Game,,https://toutiao.com/group/7388701183105303067/,,0,0
男性开始慌了？HPV疫苗为何卖不动了？原因曝光，网友评论炸锅,2024-09-13 07:49,418,480,丸子君,丸子君,“水满则溢，月满则亏”，再热门的东西也有冷却的时候。前几年大家争着抢着去打的HPV疫苗，现在竟然有点“门庭冷落”，这是不是让你有点惊讶？从“一针难求”到如今的“打不出去”，这背后到底发生了什么？打疫苗排队都抢不到还记得几年前吗？,https://toutiao.com/group/7414021335213277705/,,0,0
俄罗斯亡，中国寒？非也！比西方围堵更可怕的，是我们的妄自菲薄,2024-09-10 04:51,16890,16904,陶陶读历史,陶陶读历史,自俄乌冲突以来，网上就一直有一种论调，中俄之间是“唇亡齿寒”的关系。即如果俄罗斯倒了，下一个就轮到中国了。,https://toutiao.com/group/7412843508064616995/,,0,0
中国女篮派出270斤秘密武器，日本疯狂嘲笑，怎料神奇一幕出现了,2024-06-22 03:35,6866,351,乐播体育,乐播体育,,https://toutiao.com/group/7383166264766398988/,,0,0
