title,publish_time,like_count,comment_count,media_name,source,abstract,article_url,tag,is_yaowen,article_sub_type
淬火丨第二集 向战为战练精兵,2024-09-12 13:01,1579,186,央视新闻,央视新闻,经中央军委批准，由中央军委政治工作部、中央网信办、中央广播电视总台联合出品的思想解读类融媒体片《淬火》，9月11日起，在央视综合频道20点档首播。昨晚，《淬火》播出第一集《军旗下的誓言》。,https://content-static.cctvnews.cctv.com/snow-book/index.html?item_id=16095057789411478645&source=50006&sub_source=50006_001,,0,0
链在一起！三个男人被一条铁链锁在一起会发生什么有趣的事呢？,2024-06-24 14:44,7762,343,吊德斯DioDeS,吊德斯DioDeS,"感谢大家观看我的游戏视频
在这里大家可以看到各种有趣的视频！
喜欢我视频的话，别忘了点个赞和关注哟！",https://toutiao.com/group/7384080750326972969/,,0,0
女孩15岁就能接客！性是生活也是工作，捷克为什么成了色情大国？,2024-09-13 09:10,960,113,鲸探所,鲸探所,女孩15岁就到了合法性交年龄?18岁是成年，可15岁，仅仅只是一个初中生。很多人都以为，在韩国日本荷兰这些国家，色情产业应该是最“发达”的，可是捷克的色情产业，也并不是一个省油的灯。,https://toutiao.com/group/7414048497181164068/,,0,0
可恨奔驰小轿车，时速140迈恶意超车，监控拍下害人害己的一幕,2024-08-25 22:11,842,578,幸福星球hoK737,幸福星球hoK737,,https://toutiao.com/group/7407203333091361290/,,0,0
从2030年1月1日起 将职工按月领取基本养老金最低缴费年限由十五年逐步提高至二十年,2024-09-13 06:55,2228,164,央视新闻,央视新闻,《国务院关于渐进式延迟法定退休年龄的办法》发布，从2030年1月1日起，将职工按月领取基本养老金最低缴费年限由十五年逐步提高至二十年，每年提高六个月。职工达到法定退休年龄但不满最低缴费年限的，可以按照规定通过延长缴费或者一次性缴费的办法达到最低缴费年限，按月领取基本养老金。,https://content-static.cctvnews.cctv.com/snow-book/index.html?item_id=2151521155199311737&source=50006&sub_source=50006_001,,0,1
温铁军：形势非常严峻，战争随时可能爆发！〔上〕,2024-09-11 15:44,9394,1318,淡泊的海浪AAm,淡泊的海浪AAm,,https://toutiao.com/group/7413411885322371621/,,0,0
贪官落马后的生活是怎样的？每天吃什么做什么？真实影像为你揭秘,2024-08-16 14:22,3617,2042,乐天派辰星689,乐天派辰星689,,https://toutiao.com/group/7403742654560731658/,,0,0
深度解析俄乌战争,2024-09-12 10:20,18684,6165,看穿秋水,看穿秋水,,https://toutiao.com/group/7413699450700300819/,,0,0
美专家警告：中国地缘政治存在缺点，可能存在灭国的危险,2024-09-09 03:17,1852,148,猫腿说事,猫腿说事,因此，中国有着得天独厚的地缘政治优势，几乎单独占据整个东亚，北面是俄罗斯、蒙古国、南邻南海，西边是印度、尼泊尔、不丹等亚洲国家，在西北面则和中亚几个斯坦相邻。,https://toutiao.com/group/7412476404467614220/,,0,0
延迟退休对在职职工影响不大，对灵活就业影响很大,2024-09-13 11:10,38688,16791,跟随我一路向北,跟随我一路向北,,https://toutiao.com/group/7414083381543043595/,,0,0
卢麒元：如果特朗普18年不打贸易战，今天的局面都不敢想,2024-09-13 08:04,10978,218,麒元,麒元,,https://toutiao.com/group/7414035624279147044/,,0,0
