title,publish_time,like_count,comment_count,media_name,source,abstract,article_url,tag,is_yaowen,article_sub_type
时政微纪录丨总书记眼中的“大先生”,2024-09-10 12:09,1133,169,央视新闻,央视新闻,心中要有国家和民族要有“捧着一颗心来不带半根草去”的奉献精神始终处于学习状态给学生一碗水 教师要有一潭水应该把自己的温暖和情感倾注到每一个学生身上在第40个教师节到来之际，习近平总书记出席全国教育大会并发表重要讲话，代表党中央向全国广大教师和教育工作者致以节日祝贺和诚挚问候。,https://content-static.cctvnews.cctv.com/snow-book/index.html?item_id=10449256732989516478&source=50006&sub_source=50006_001,,0,0
山东一女生被同学锥子扎218针，校服全是孔，官方：未达霸凌标准,2024-09-09 12:15,718,1643,仪正夜,仪正夜,文／编辑：夜呛俗话说，“校园本是净土，奈何霸凌横行”，最近些年，校园霸凌事件频发，手段之残忍，让人难以置信这是出自十几岁孩子之手。sha人、重伤，这些字眼与校园联系在一起，让人感到心痛和愤怒，今天，我要讲述的，就是一起发生在山东济南章丘的校园霸凌事件。,https://toutiao.com/group/7412615806309188148/,,0,0
才知道，原来小时候跳皮筋唱的歌词是当时的国家机密，引起共鸣！,2024-09-09 21:38,940,349,闻所未文,闻所未文,28256、28257、282931、……还记得这首小时候跳绳的童谣吗，以前在没有手机电脑的年代，这首马兰开花二十一可谓是火遍了大江南北，全国各地不知道怎么就突然都会唱了，虽然这些数字组合饶舌，但却很顺，直到现在才知道，原来这首歌里藏着我国原子弹的机密！,https://toutiao.com/group/7412652147457901090/,,0,0
我，00后美国姑娘，遇中国留学生，一见钟情，生儿子后才见到婆婆,2024-07-19 00:06,8768,1647,真实人物采访,真实人物采访,我是Sydney，美国女孩，因为有车，一不小心接到一个中国留学生。他很帅，不到一年我就嫁给了他，还生了一个帅气的儿子。,https://toutiao.com/group/7391659832417190426/,,0,0
北大医学博士张进生，失业近二十年只能回家种地，现在靠低保度日,2024-08-29 03:44,5376,2347,八号探秘人,八号探秘人,在阅读此文之前，辛苦您点击一下“关注”，既方便您进行讨论和分享，又能给您带来不一样的参与感，感谢您的支持！编辑：小易世道变了？这年头，北大医学博士都找不到工作，只能在家啃低保？人们常说，学历是工作的敲门砖。有高学历傍身，就能轻松找到好工作。然而，人无完人，事无绝对。,https://toutiao.com/group/7408401715878887970/,,0,0
蛋仔派对：秀儿耍酒疯，到处撒蛋币？可把我急坏了！,2024-07-07 01:34,1486,172,游小浪Game,游小浪Game,,https://toutiao.com/group/7388701183105303067/,,0,0
国家医保局：决不让群众的“看病钱”“救命钱”变成“唐僧肉”,2024-09-10 04:36,1228,901,上游新闻,上游新闻,9月10日上午，国务院新闻办公室举行“推动高质量发展”系列主题新闻发布会。上游新闻记者在发布会现场了解到，国家医保局持续加大飞行检查力度，截至目前，一共检查了30个省份的432家定点医药机构，预计今年全年检查机构的数量将超过过去5年的总和，扩面相对较多。,https://wap.cqcb.com/shangyou_news/NewsDetail?classId=7641&newsId=5652503,,0,0
央视：查实涉嫌假球、赌球比赛120场，涉案俱乐部球队共41支,2024-09-10 02:40,859,1524,极目新闻,极目新闻,足球职业联赛“假赌黑”问题专项整治行动新闻发布会在大连进行北京时间9月10日，国家体育总局、公安部联合召开的足球职业联赛“假赌黑”问题专项整治行动新闻发布会在大连进行。去年以来，针对足球领域严重假球、赌球、黑哨问题，体育总局、公安部、中国足协联合展开了足球行业的专项治理行动。,http://jms.ctdsb.net/jmythshare/#/index_share?cId=0&contentType=5&contentId=2250837,,0,0
国务院批准！财政部即将发行！时间定了,2024-09-10 00:36,1556,128,闽南网,闽南网,经国务院批准，财政部将于2024年9月23日当周在法国巴黎发行欧元主权债券，规模不超过20亿欧元。具体发行安排将于发行前另行公布。,https://toutiao.com/group/7412806433358299675/,,0,0
要么与俄断联，要么利益受损，32国发威胁，中国数百亿资产被盯上,2024-09-08 06:44,2072,175,大白话瞰世界,大白话瞰世界,没钱帮小弟怎么办？北约集团开始动脑筋，竟然盯上了中国在欧洲的数百亿资产，而中国面临着两个选择，要么让利给北约，要么与俄断联，新的挑战来临，中国如何突围？,https://toutiao.com/group/7412159625815917092/,,0,0
外交部班子迎来新任领导成员，外交部密集人事调整,2024-09-10 03:43,12273,2560,上观新闻,上观新闻,近期，外交部班子迎来新任领导成员，外交部密集人事调整。9月6日，人社部网站发布消息，国务院任免国家工作人员。其中，任命刘彬为外交部部长助理。外交部官网“主要官员”栏目显示，刘彬现任部党委委员、部长助理。公开简历显示，刘彬，男，汉族，1971年11月生，大学毕业，中共党员。,https://export.shobserver.com/toutiao/html/794587.html,,0,1
"中菲仙宾礁又爆大冲突，""雷震撼天""！海警船海战术夹战突击",2024-09-06 22:00,6636,524,黄阿原,黄阿原,,https://toutiao.com/group/7411487502034600487/,,0,0
云南一女子遭大象袭击身亡，入土7天坟墓又被破坏，调查后发现,2024-09-04 11:37,2209,211,聚享传媒老彪,聚享传媒老彪,,https://toutiao.com/group/7410750794523214374/,,0,0
荒唐！浙江一服装店新店开业，城管把门口的花篮气球全部扎破！,2024-09-10 13:20,942,1342,偏爱东风破,偏爱东风破,“人家刚开业有个气球花篮，那不是很正常吗？”“这里的店门口又不是人行道，那还有个台阶呢。”9月10日，浙江嘉兴，一则网友上传的视频引发了广泛关注。视频中显示，几名城管队员在处理一家新开业的服装店时，将门口庆祝开业的花篮气球逐个扎破，举动引起了围观者的议论。,https://toutiao.com/group/7412998320685187635/,,0,0
MC我的世界：遭遇核导弹打击！建立史上最强安全屋！#我的世界,2024-08-08 08:33,801,110,MC杰杰和麦琪,MC杰杰和麦琪,,https://toutiao.com/group/7400684069585715775/,,0,0
国足主帅避谈辞职：继续朝着晋级下一阶段努力,2024-09-10 23:06,596,3032,新京报,新京报,据新华社大连9月10日电（记者公兵、肖世尧）在10日进行的2026美加墨世界杯亚洲区预选赛18强赛C组第二轮比赛中，中国男足主场1:2不敌沙特阿拉伯队。国足主教练伊万科维奇赛后面对是否辞职的问题时表示，球队目标是进入小组前四晋级下一阶段，目前仍在朝着这个目标努力。,https://m.bjnews.com.cn/detail/1726009541129258.html,,0,0
山东淄博街头，无意中听到两个当地人的对话，这是什么心态,2024-09-08 00:00,2901,1084,一人行走的远方,一人行走的远方,,https://toutiao.com/group/7412055304382186034/,,0,0
台湾女儿来大陆，寻找45年前离家的父亲，才发现父亲是荣氏大家族,2024-07-24 05:50,13124,1530,正义2019,正义2019,中央电视台的《今世缘·等着我》节目，曾经重新连起了许多段因为时间、地理而断绝的人际感情，有人通过这个节目找到了失散多年的亲人，也有人见到了失去联络的战友。,https://toutiao.com/group/7395075701911503379/,,0,0
现场记者谈伊万：我从未见过如此厚颜无耻之人！,2024-09-10 15:04,146,736,直播吧,直播吧,对于伊万不辞职的说法，现场记者宋承良怒斥伊万不要脸。宋承良:“我从未见过如此厚颜无耻之人!”,https://news.zhibo8.com/zuqiu/2024-09-10/66e05ed1bd616native.htm,,0,0
2024年湖北晨跑女遇害案，张虎执行死刑，临刑时浑身哆嗦跪地痛哭,2024-08-28 10:45,1155,315,文史烟云,文史烟云,2024年2月19日，作恶多端的张虎即将被执行死刑，曾经天不怕地不怕的罪犯，此刻却是止不住的颤抖，甚至跪地求饶，祈求再给他一次机会。,https://toutiao.com/group/7408139221095842338/,,0,0
这么大的瓜张雨绮就这么水灵灵的说出来了,2024-09-10 13:47,1078,141,鹅鹅快乐屋,鹅鹅快乐屋,,https://toutiao.com/group/7413010571609506344/,,0,0
32国逼中俄断联，人民币交易停滞，人民日报敲钟声，给美国立规矩,2024-09-07 03:53,4711,134,大白话瞰世界,大白话瞰世界,32国逼迫中俄断开联系，制裁导致中俄双方人民币交易停滞，关键时刻，人民日报敲响钟声，给美国立下规矩。中俄人民币交易具体出现了什么状况？人民日报又是如何给美国“立规矩”的？,https://toutiao.com/group/7411744230793544242/,,0,0
怒怼全班！广西一家长微信群狂怼教师与家长，引爆教育局紧急调解,2024-09-07 12:46,640,1232,甘肃庆阳小趴菜,甘肃庆阳小趴菜,近日，在广西玉林的东成小学，一场家长群内的风波引起了广泛关注。事情的主人公是刘某，一位学生家长。首先！我们先来看看视频视频来源:九派新闻起初，刘某在家长微信群中针对某些教育相关的问题提出了质疑。或许是出于对孩子教育的关切，他的言辞稍显急切。感谢两位班主任老师的照顾。,https://toutiao.com/group/7411881686370009652/,,0,0
被全球通缉的黄荷娜：吸毒贩毒组织淫乱派对，因背景太大逍遥法外,2024-09-05 11:03,761,111,大核有料,大核有料,在聚众吸毒的几人里，有一个人的名字十分耀眼，她就是黄荷娜，倒不是她本人有多大的影响力，而是因为她的身后，有一个十分可怕的“靠山”。,https://toutiao.com/group/7411094690500264474/,,0,0
