title,publish_time,like_count,comment_count,media_name,source,abstract,article_url,tag,is_yaowen,article_sub_type
9月11号天气预报，新一轮强降雨降温中心已定，大雨暴雨分布如下,2024-09-10 04:53,3560,241,阿海三农,阿海三农,"亲爱的观众朋友们：大家好！今天是9月10日，既是一个庆祝教师节的特殊日子，也是白露节气来临的第四天。在这个充满敬意的日子里，我们向所有的老师们致以最深的敬意：“老师，您辛苦了！”

随着新学期的开始，今年的高温天气给孩子们的安全与健康带来了不小的挑战。为了应对这一挑战，部分地区采取了弹性开学机制，这一决策得到了广泛家长的支持与认可。这一举措有效地规避了高温天气带来的潜在风险，保障了孩子们的健康成长。

目前，华南和西南地区仍受到台风摩羯残余环流的影响，局部地区出现了强降雨。与此同时，一股来自北方的强冷空气正为我们带来全国范围内的降温和降雨。这沁人心脾的秋雨，预示着炎热的夏日即将过去，凉爽的秋季即将到来。

根据最新的天气预报，9月11日至12日，一股更强的冷空气将影响到我国，带来更为广泛的强降雨。预计9月11日，新疆西部、西藏大部、青海大部等地将迎来小到中雨的天气。",https://toutiao.com/group/7412873200696853044/,,0,0
实拍深圳街头现状，前几天还是好好的，今天怎么变成这样了,2024-08-28 09:16,822,519,贵州小朱记录,贵州小朱记录,,https://toutiao.com/group/7408116643458449971/,,0,0
马路上出现一条大蛇 大爷直接制服 网友：是个狠人啊,2024-07-27 02:48,6471,1516,掌上平阴,掌上平阴,,https://toutiao.com/group/7396142042184679962/,,0,0
1996年，少将姬胜德用赃款给克林顿汇去30万美金，帮对方竞选总统,2024-09-09 11:17,695,115,山腰的西西弗斯,山腰的西西弗斯,一位中国解放军的少将，姬胜德，竟然私下汇走30万美金，这笔钱直接流入了美国总统比尔·克林顿的连任竞选账户。,https://toutiao.com/group/7412600238667498036/,,0,0
又出大瓜？73岁“风流妖精”刘晓庆，如今已经走上了另一条道路,2024-08-28 08:52,20642,1620,小怪兽游戏,小怪兽游戏,如今的刘晓庆又炸裂了，七十三岁却又被曝出离婚，这大瓜果然是让人一言难尽，就连罗翔老师都忍不住吐槽起来，而且这件事和另外一位明星有关系。,https://toutiao.com/group/7408098050512437772/,,0,0
周继红中国奥运跳水第一金，看完你就明白，为什么全红婵百年难遇,2024-09-03 08:49,3030,1822,波波体育,波波体育,,https://toutiao.com/group/7410336254924948020/,,0,0
江苏美女道士胡小慧被捕，精通“胡媚术”，九名男徒弟揭露其罪行,2024-08-10 09:01,888,269,此间一叙a,此间一叙a,古有妲己利用“狐媚术”摧毁大商根基，今有胡小慧利用“狐媚术”骗取数百万，更奇葩的是十里八乡的人们对她深信不疑，促使她在当地混的风生水起。令人咂舌的是这个人还是个女道士，直到2019年她被成功逮捕，手下九名男徒这才揭露了真相，原来背后竟是一场精心策划好的骗局。,https://toutiao.com/group/7401412561637245455/,,0,0
不要被电视剧骗了！真正的清朝，其实是这个样子,2024-07-08 03:49,5051,1260,摄影圣典,摄影圣典,争风吃醋、宫斗不断，这就是清宫剧、古装剧最典型的特点。几百年前的清朝，社会生产力还很落后，人们穿的都是麻布衣服，而不是剧中那种人人都穿丝绸。,https://toutiao.com/group/7389099011841507880/,,0,0
意想不到！被中国用核武器轰炸45次的罗布泊，现在竟然变成了这样,2024-07-23 08:49,1360,354,跳跳虎爱吃跳跳糖,跳跳虎爱吃跳跳糖,位于“死亡之海”的腹地有着这样一座基地，它有着一个非常好听的名字叫作“马兰”，而马兰是一种生命力非常顽强的野草，不论生长的环境如何，它也总是能够在这片土地上散发出独属于自己的“光芒”。虽然说“马兰基地”是一座不为人知的隐秘所在，但也正是它的存在，却是爆发出了一道震惊世界的声音。,https://toutiao.com/group/7394735316202013196/,,0,0
女人有“三块地”最好耕，你不耕别人就帮你耕，特别是人到中年！,2024-08-15 21:20,1061,127,雯雯唠嗑,雯雯唠嗑,女人有“三块地”最好耕，你不耕别人就帮你耕，特别是人到中年！,https://toutiao.com/group/7403324691298910729/,,0,0
看台风中的全红婵一家人，全红婵的妈妈依然在忙碌,2024-09-07 05:52,4265,291,激扬文字,激扬文字,,https://toutiao.com/group/7411775118893908514/,,0,0
我国街头出现这种车辆，引起世界各国注意，老外直言：这怎么可能,2024-09-02 01:07,1361,120,乘风破浪观世界,乘风破浪观世界,我国街头出现这种车辆，引起世界各国注意，老外直言：这怎么可能,https://toutiao.com/group/7409178228239106623/,,0,0
央视：查实涉嫌假球、赌球比赛120场，涉案俱乐部球队共41支,2024-09-10 02:40,697,1354,极目新闻,极目新闻,足球职业联赛“假赌黑”问题专项整治行动新闻发布会在大连进行北京时间9月10日，国家体育总局、公安部联合召开的足球职业联赛“假赌黑”问题专项整治行动新闻发布会在大连进行。去年以来，针对足球领域严重假球、赌球、黑哨问题，体育总局、公安部、中国足协联合展开了足球行业的专项治理行动。,http://jms.ctdsb.net/jmythshare/#/index_share?cId=0&contentType=5&contentId=2250837,,0,0
善恶终有报：疫情时对中国一毛不拔，却大方捐美国6亿，如今咋样,2024-09-04 13:30,987,142,唐文采飞扬,唐文采飞扬,作为一个中国人，在中国遭遇疫情的时候一毛不拔，却拿出来6亿美元捐给美国，她的大方没有给处于困境中的同胞，反而给了陌生的异国人。,https://toutiao.com/group/7410738113879884325/,,0,0
全球第一名曲，播放量超60亿，迷人旋律，百听不厌！,2024-07-31 03:37,28973,4679,Music音乐世界,Music音乐世界,,https://toutiao.com/group/7397638896399417867/,,0,0
中国将全面开放外资医院，背后的原因，看懂的人不多,2024-09-09 09:32,1505,2147,勇敢的海浪et,勇敢的海浪et,,https://toutiao.com/group/7412573017413026315/,,0,0
大山中发现天然溶洞，洞里竟然密密麻麻的建筑，一般人不敢靠近！,2024-08-27 12:26,3658,748,深夜追剧,深夜追剧,,https://toutiao.com/group/7407794721424146998/,,0,0
俄乌战争-深层分析逻辑,2024-09-10 01:26,8326,2093,孤独老枪,孤独老枪,,https://toutiao.com/group/7412819621587190272/,,0,0
两岸战火危机升高，地方官是备战关键！普通民众要如何应战？,2024-09-09 22:04,13747,1145,黎建南台湾,黎建南台湾,,https://toutiao.com/group/7412424041727888690/,,0,0
对华改变称呼后，普京抵达海参崴，提出一个请求，中方送出两句话,2024-09-07 09:54,1359,133,全荃,全荃,对华称呼改变后，普京抵达海参崴出席东方经济论坛，还向中方提出一个请求，中方送出两句话。现身海参崴的俄罗斯总统普京，向中方提出了怎样一个请求?,https://toutiao.com/group/7411837281176207908/,,0,0
突发！63岁刘德华演唱会不慎踩空摔倒，疑似受伤,2024-09-09 23:29,1088,1200,红星新闻,红星新闻,9月9日晚，63岁刘德华在深圳演唱会上一幕让不少歌迷吓出一身冷汗。在清唱《男人哭吧不是罪》时，舞台的地下通道门意外被打开，华仔在表演时不慎踩空摔倒，万幸人没有完全掉下去。但据现场观众说，华仔手部有点轻微擦伤，视频显示有工作人员第一时间递上毛巾。,https://toutiao.com/group/7412789252565582362/,,0,0
媳妇打麻将到半夜，以为老公出差没回家，进门这波操作老公看懵了,2024-08-19 08:48,16845,2120,涵涵麻麻爸比,涵涵麻麻爸比,媳妇打麻将到半夜，以为老公出差没回家，进门这波操作老公看懵了,https://toutiao.com/group/7404769776171483674/,,0,0
终于明白为啥死囚被执行时比鸡还顺从！网友的回复让我大开眼界！,2024-09-01 15:38,277,255,魔法师深州,魔法师深州,文 | 魔法师深州编辑 | 魔法师深州还在犹豫什么？财富和好运，都藏在关注里！赶紧加入我们，一起迎接幸运和财富的到来吧！,https://toutiao.com/group/7409699563881103922/,,0,0
姥姥去世大姨没掉一滴泪，葬礼结束后大姨要走，舅舅：账还没算呢,2024-08-24 03:01,14390,966,董你的天使,董你的天使,姥姥去世大姨没掉一滴泪，葬礼结束后大姨要走，舅舅：账还没算呢姥姥去世的时候，父亲带着我和弟弟来参加葬礼。葬礼上大姨和姨夫一直在忙前忙后，舅舅和舅妈两个人哭得不省人事，但大姨却一滴眼泪都没有掉。,https://toutiao.com/group/7406225716091699747/,,0,0
猪肉中“最毒”器官，我国虽明令禁止，但还有人不知情在买来吃,2024-08-23 08:06,6115,442,北纬的咖啡豆,北纬的咖啡豆,肘子猪蹄五花肉，配上小酒舒舒服，在外辛苦工作一天的打工人们，晚上下班之后来一碗香喷喷猪脚饭和炖排骨，再配上一点小啤酒吃饱喝足，疲惫的身体瞬间就能得到满足。,https://toutiao.com/group/7406238335636718091/,,0,0
看到全红婵戴32万的劳力士，网友为啥“破防”了？,2024-09-08 08:20,9884,2182,鉴人闫闯,鉴人闫闯,,https://toutiao.com/group/7412184363384701492/,,0,0
苹果发布iPhone 16系列新机 售价799美元起,2024-09-09 17:56,147,365,财联社,财联社,【苹果发布iPhone 16系列新机 售价799美元起】财联社9月10日电，苹果发布iPhone 16系列新机，新增相机控制功能按键。作为首款专为Apple Intelligence设计的机型，iPhone 16、16 Plus将搭载全新的A18芯片。,https://www.cls.cn/depth/1793855,,0,0
国足这训练强度回头不得多吃俩海参 太好玩了 堪比课间大游戏,2024-09-09 11:21,2536,4151,旅行家小鱼,旅行家小鱼,,https://toutiao.com/group/7412601875557515802/,,0,0
江苏才女为输球国足写了这样一副对联。横幅更是令人无语,2024-09-08 02:53,3264,423,春草习字,春草习字,,https://toutiao.com/group/7412100011296555559/,,0,0
2024刀郎杀疯了！一首《我的祖国》唱得霸气十足，听得热血沸腾！,2024-09-04 01:09,93015,12737,猫猫经典音乐,猫猫经典音乐,2024刀郎杀疯了！一首《我的祖国》唱得霸气十足，听得热血沸腾！,https://toutiao.com/group/7410588814768341556/,,0,0
女生相亲吐槽男方相貌平平，吃完去前台本以为要结账，下秒无语了,2024-08-08 03:26,13752,4158,金融新闻,金融新闻,女生相亲吐槽男方相貌平平，吃完去前台本以为要结账，下秒无语了,https://toutiao.com/group/7400604905226666507/,,0,0
某集团总工老家，旁边十家也比不过他一家，牛不牛自己看,2024-08-27 22:00,3667,4113,乡村妙妙,乡村妙妙,,https://toutiao.com/group/7407642130664915466/,,0,0
路虎女：我倒了三把，他一直往前顶别我车！详细视频对话曝光,2024-09-02 17:00,1696,7377,大料博士,大料博士,先上视频：撰文/李维斯青岛警方发文澄清，逆行打人路虎女目前已经被采取拘留措施，并不像网传那样在家“居留”，这事儿在网上发酵好几天了，有人说要反转了，原因是以上视频。这断视频中，路虎女一直在指责谩骂小伙子，说他太坏，也什么呢？因为她认为小伙子在故意为难她！,https://toutiao.com/group/7410082966158541321/,,0,0
沫沫第一次见小杨嫂,2024-09-06 08:30,3709,991,旅行家小鱼,旅行家小鱼,,https://toutiao.com/group/7411444708347478538/,,0,0
国足0比7惨败日本队，球迷为其魔改洗脑神曲，唱的太到位了,2024-09-10 08:35,863,135,音乐耳朵听,音乐耳朵听,国足0比7惨败日本队，球迷唱出了自己的心声，实在憋不住就笑出来吧,https://toutiao.com/group/7412930200167514676/,,0,0
女子晒家里给介绍的对象，直言反对无效打算结婚，露脸后网友悟了,2024-08-03 02:56,918,216,湖北教育新闻,湖北教育新闻,,https://toutiao.com/group/7398741567395070479/,,0,0
中美俄卫星定位精度差距太大！美0.1米，俄1.5米，中国北斗是多少,2024-08-15 08:54,24398,4001,巴普罗的独白,巴普罗的独白,而卫星定位精度更是中美俄三大航天强国竞相追逐的目标，这一指标的高低直接决定了卫星技术的实用价值。美国以0.1米的惊人精度遥遥领先，俄罗斯则以1.5米的精度位居第二。,https://toutiao.com/group/7403279432997241407/,,0,0
全红婵火爆外网，国际泳联意外做出决定，这回真是为国争光了！,2024-09-04 23:01,2073,187,小田爱讲事,小田爱讲事,全红婵火爆外网，国际泳联意外做出决定，这回真是为国争光了！,https://toutiao.com/group/7410726072088298022/,,0,0
阿里巴巴达摩院全球数学竞赛决赛成绩，等#开学第一课 #社会百态,2024-09-05 00:02,3020,857,化北,化北,,https://toutiao.com/group/7410942540725092915/,,0,0
怎一个“惨”字了得，8月销量不足10台的车型，居然有22款之多,2024-09-10 04:22,128,212,老四说车,老四说车,8月汽车整体销量排行榜最新出炉，8月销量不足10台的车型居然有22款之多，奔驰、日产、丰田均榜上有名。,https://toutiao.com/group/7412847407266693668/,,0,0
中美俄核电站数量差距断崖：美国93座，俄罗斯37座，中国有多少,2024-08-22 09:34,9704,1326,漫悠芸端,漫悠芸端,作为发电的燃料，煤炭是人类赖以生存的资源，可它的不可再生性，却让人懂得了节制和另寻他法，于是“核能发电”便应运而生。,https://toutiao.com/group/7405889277831250443/,,0,0
国家叫停！超8万中国儿童被美国领养，几乎都是女孩，有啥目的？,2024-09-09 10:17,401,400,青橘罐头,青橘罐头,看上去似乎是给了这些无家可归的孤儿们一个温暖的家，但是是实际上细细统计下来，美国人收养的竟然有88%都是女童。,https://toutiao.com/group/7412560633964773923/,,0,0
岳云鹏过安检这段，至今还无人能超越，太搞笑了！爆笑过安检场面,2024-07-17 01:48,12623,764,宁阳融媒,宁阳融媒,,https://toutiao.com/group/7392415801833161257/,,0,0
杭州睡大马路的男女越来越多，今天看一下他们生活起居是怎么样的,2024-09-07 08:36,5699,2712,最忆杭州2018,最忆杭州2018,,https://toutiao.com/group/7411817254871892531/,,0,0
如果不是日媒披露，我都不敢相信，中国已无需再向世界证明什么,2024-09-07 13:34,1554,222,黎明侃车车,黎明侃车车,说实话，如果不是日本媒体的披露，我都不敢相信，原来中国已经强大到如此地步，已经无需再向世界证明什么了！毕竟，现在的中国已经不同于往日，不仅在多个领域领先世界，而且强大的工业体系，造就出全球第二大经济体，甚至还成为了全球经济发展的“引擎”。,https://toutiao.com/group/7411893110399255050/,,0,0
长！真的很长！这条大蛇目测8米左右，个人感觉说的都有点保守了,2024-08-09 09:00,7691,1325,动物超燃解说,动物超燃解说,长！真的很长！这条大蛇目测8米左右，个人感觉说的都有点保守了,https://toutiao.com/group/7400945220587618870/,,0,0
卫健委一纸回复爆出，你吃的大米白面将发生变化！,2024-09-10 04:59,1405,1092,优选消费者报告,优选消费者报告,卫健委一纸回复爆出，你吃的大米白面将发生变化！,https://toutiao.com/group/7412874621235495450/,,0,0
2024秋老虎结束时间：预计几号结束？答案终于来了,2024-09-07 07:30,3049,272,樱桃说事,樱桃说事,,https://toutiao.com/group/7411740410592100875/,,0,0
主席形象后继有人，侯京健已接班唐国强，和古月比你更喜欢哪一个,2024-07-27 07:24,39326,3909,半历写书,半历写书,一代伟人就此落幕，48年前，全国人民为此落泪，举国悲痛，起因便是毛主席不幸离世!我们祖国13亿人口，其中就有这三位长相极其毛主席相似，他们也都在影视中留下了传奇。,https://toutiao.com/group/7396145236713538084/,,0,0
准备回家！全红婵现身商场，给父母买茅台酒，大包小包回家过中秋,2024-09-08 07:36,3548,526,小韩讲世界,小韩讲世界,准备回家！全红婵现身商场，给父母买茅台酒，大包小包回家过中秋,https://toutiao.com/group/7412172856835965503/,,0,0
毛主席遗体防腐每年花费引质疑，徐静坦言：天价护理费说法是误解,2024-08-17 03:27,1385,113,北方历史,北方历史,有人说每年花费天价，有人说遗体变瘦变矮，这究竟是怎么回事?今天，让我们走进毛主席遗体保护的幕后，揭开这个神秘的面纱。,https://toutiao.com/group/7403944272891757106/,,0,0
有一个疑问？这些视频怎么都被香港卫视捕捉到呢？国内的记者呢？,2024-09-06 08:28,2057,676,速速睇睇,速速睇睇,,https://toutiao.com/group/7411190935305847350/,,0,0
三峡大坝已经运行了20年，当初投入的2500多亿元，如今回本了吗,2024-06-19 03:20,8372,4626,科普10克,科普10克,要是提到我国的水利工程，那么大家第一时间想到的肯定是三峡大坝，距建成投入到如今已经有二十多年的历史了。,https://toutiao.com/group/7382044987539587584/,,0,0
又一大佬跑路！卷走62亿，拖欠上千员工工资、投资者血本无归,2024-09-06 03:17,14141,1548,霁寒雪,霁寒雪,上千员工的科技公司，上午人还在上班，还有新人办入职，没想到公司下午就解散了。公司投资人的62亿元不知所踪，拖欠800多名员工两个月工资，而老板早就跑路了。,https://toutiao.com/group/7411356880464790057/,,0,0
男子冷战5天低头接妻子，不料正撞见她满脸笑意，开口第一句扎心,2024-08-10 07:04,1920,320,大众网菏泽,大众网菏泽,,https://toutiao.com/group/7401403155327484454/,,0,0
又一大佬跑路！卷走62亿跑路，令上千员工、投资者血本无归,2024-09-06 06:06,6567,2536,笑史云烟,笑史云烟,极目科技总共在全球40多个城市都设立有办事机构，旗下更是拥有上千名员工，且在这上千名员工之中，有800多人都是公司的研发人员。,https://toutiao.com/group/7411400906702389775/,,0,0
别被带节奏！人民日报也转发了崂山警方最新通报，还原了全部真相,2024-09-06 09:35,645,2784,高冷小羊聊聊事,高冷小羊聊聊事,别被带节奏！人民日报也转发了崂山警方最新通报，还原了全部真相,https://toutiao.com/group/7411461483710415396/,,0,0
感受一下台风天的原声吧！#狂风暴雨来袭 #台风摩羯,2024-09-05 14:25,4098,610,大叔成长记,大叔成长记,,https://toutiao.com/group/7411165150033478194/,,0,0
终于封海，中国拖船进场，马科斯开始呼救，30国逼中方在南海让步,2024-09-04 04:50,7227,107,阿皮历史库,阿皮历史库,【编者按：本文为头条原创独家首发，请勿抄袭转载】«——【·前言·】——»南海争端持续到现在，也没有落下帷幕，这背后除了菲律宾政府的频频挑衅之外，还与美西方国家的支持脱不了干系。,https://toutiao.com/group/7410643253369913866/,,0,0
潘长江女儿潘阳：嫁10亿富豪结婚12年，却为何一直带儿子住娘家？,2024-08-31 13:17,12616,1044,以茶书,以茶书,潘长江的女儿潘阳，在2012年7月嫁给了石磊，就连潘长江都对这个女婿满意的不得了，生怕人跑了似的，赶紧把女儿嫁出去了。石磊是谁，特别厉害，特别优秀。出生于音乐世家，从小在寸土寸金的香港长大，后来去往美国留学。,https://toutiao.com/group/7408773982087938586/,,0,0
他这是经历了什么，苦命的女人,2024-09-09 23:18,1340,273,勇敢的啾咪,勇敢的啾咪,,https://toutiao.com/group/7412786856007303695/,,0,0
完整名单公布！足协处罚60人：金敬道、郭田雨、孙世林、顾超等43人终身禁赛，汪嵩等17人禁5年,2024-09-10 03:13,2759,4884,九派新闻,九派新闻,9月10日，中国足协官方发布对有关涉案人员行业处罚情况通报，包括60张罚单，其中金敬道、孙准浩、郭田雨，杨善平、顾超等43人终身禁赛，汪嵩等17人禁足5年。,https://toutiao.com/group/7412844271813886464/,,0,0
海南第一高楼被超级台风吹没了？,2024-09-08 00:34,2423,120,我们全村的希望努力,我们全村的希望努力,海南第一高楼被超级台风吹没了？,https://toutiao.com/group/7412064163142304296/,,0,0
有戏！保定骑行事件香港、凤凰两卫视齐发声！大律师力挺姜永亮,2024-09-04 22:42,308,584,爱分享的熊先生,爱分享的熊先生,11岁的小男孩球球，骑车摔倒后被车子碾压，这样的悲剧让人看了心里不是滋味。你想想，一个这么小的孩子，在马路上骑车玩，结果一摔，命就没了。这个事儿不仅让人心疼，背后牵扯的责任归属更是复杂。事情发生在8月11日，球球和几个小伙伴在某条双向公路上骑行。,https://toutiao.com/group/7410918926659355175/,,0,0
全红婵一句“小小巴黎拿捏”，不仅连央视都惊动了，还被写成了歌,2024-08-20 15:20,3869,284,八妹体育,八妹体育,,https://toutiao.com/group/7405241877798060594/,,0,0
霍启刚撒娇：咽不下去！郭晶晶大吼：咽！家庭地位一目了然,2024-07-27 00:45,14840,800,清河区融媒,清河区融媒,,https://toutiao.com/group/7396110444727009828/,,0,0
并不是迷信，无论房子有多大，开门切记不要正对这“6种”东西,2024-07-24 02:36,24919,1773,老耿来聊事,老耿来聊事,#长文创作激励计划#对于我国群众来说，骨子里有两大爱好，一是存钱，二就是买房了，房子对我们有着重要的意义，这不仅是一种资产的积累方式，也是家的象征。在买了房子之后，我们肯定会按照自己的喜好去进行一番装修，现在装修风格十分的多样化，但其实在这一方面是有诸多讲究的。,https://toutiao.com/group/7395024974186119680/,,0,0
“路虎女打人事件”愈演愈烈！官媒下场站队，给网友上了一课,2024-09-06 03:06,617,1311,小胖儿真探,小胖儿真探,信息洪流裹挟着碎片化的认知冲刷着我们的判断，在这个注意力被反复争夺的时代，情绪成了流量的密码，偏见成了流量的佐料，而真相，却常常淹没在喧嚣之中。还记得那辆在青岛崂山风景区横冲直撞的白色路虎吗？还记得那位在长沙火车站对着退役军人嘶吼的“正义”网红吗？,https://toutiao.com/group/7411358010838237759/,,0,0
中国跳水队又杀出一匹黑马，同样来自湛江，被誉为“小全红婵”！,2024-09-07 06:39,3582,601,兵锋趣话集,兵锋趣话集,碧海蓝天，十米跳台，水花飞溅，掌声雷动，这是属于跳水运动的舞台，也是中国体育健儿一次次为国争光的荣耀时刻，近年来，中国跳水队人才辈出，不断涌现出像全红婵这样的天才少女，她们用优美的身姿和精湛的技术，一次次征服世界，也让“梦之队”的称号更加响亮湛江，这座位于祖国大陆最南端的海滨城市,https://toutiao.com/group/7411782985714549288/,,0,0
卷走5000亿、坑惨200万中国人传销集团创始人，已引渡回国受审！,2024-09-07 03:20,3676,934,林不新,林不新,这就导致儿子想要联系父亲，压根就联系不上。这一些前来讨债的人，也直接把两个炸弹，给扔进了张誉发亲生儿子所在的房间。,https://toutiao.com/group/7407723176727249427/,,0,0
台湾女儿来大陆，寻找45年前离家的父亲，才发现父亲是荣氏大家族,2024-07-24 05:50,13116,1529,正义2019,正义2019,中央电视台的《今世缘·等着我》节目，曾经重新连起了许多段因为时间、地理而断绝的人际感情，有人通过这个节目找到了失散多年的亲人，也有人见到了失去联络的战友。,https://toutiao.com/group/7395075701911503379/,,0,0
全红婵回老家说的这句话，这就是人性的本质,2024-08-22 12:55,498,130,珠峰笔客,珠峰笔客,,https://toutiao.com/group/7405946683575501327/,,0,0
国内2大保险巨头宣告破产，你的保单怎么办？揭秘背后的保障机制,2024-09-07 08:03,1556,639,老邹爱唠嗑,老邹爱唠嗑,,https://toutiao.com/group/7411803079240876579/,,0,0
母亲虎口救女被咬身亡，8年后女儿仍未得到父亲原谅：谁的责任,2024-08-14 02:37,8026,2347,山河月明史,山河月明史,车上的母亲见状，急忙下车想从老虎口中把女儿救下来，自己却命丧当场。事情发生之后，赵菁的父亲始终不肯原谅女儿，认为是她害死了妻子。,https://toutiao.com/group/7402554839245095460/,,0,0
中美日军舰数量对比：美国为243艘，日本是114艘，中国是多少呢？,2024-06-14 09:36,13982,661,齐医生言犹在,齐医生言犹在,因为当时的通讯水平比较有限，对于大多数人来说，他们对世界的认知就只有自己周围的一圈，所以也没有必要建设一支强大的海军。,https://toutiao.com/group/7380285798689636879/,,0,0
