title,publish_time,like_count,comment_count,media_name,source,abstract,article_url,tag,is_yaowen,article_sub_type
习近平在全国教育大会上发表重要讲话 代表党中央向全国广大教师和教育工作者致以节日祝贺和诚挚问候,2024-09-10 04:08,962,153,新华社,新华社,9月10日是我国第四十个教师节，习近平代表党中央，向全国广大教师和教育工作者致以节日祝贺和诚挚问候。,https://toutiao.com/group/7412861232446849536/,,0,0
我在尼泊尔的小城遇见没有穿裤子的大女孩，她的父亲养了5个孩子,2024-08-30 04:43,4662,543,飞飞全球旅行记尼泊尔,飞飞全球旅行记尼泊尔,我今天独自一人到尼泊尔和印度交界的小城比尔根杰穷游，我以为我是世界上最穷的人了，没想到到了尼泊尔的比尔根杰，我才真正理解什么叫一无所有？什么叫一贫如洗？,https://toutiao.com/group/7408780240510304808/,,0,0
中国再破世界第一！化学合成粮食即将量产，不用种地粮食自由了！,2024-09-09 08:11,465,3408,羽Sir历史,羽Sir历史,这不由得让我想到了袁隆平生前的两大梦想，一个是禾下乘凉，一个是杂交水稻覆盖全球，这两个梦都有一个共同的目的，就是让普天下所有人都吃上饱饭。,https://toutiao.com/group/7412551016840692262/,,0,0
靳东上台领奖，一看到颁奖的是谁，直接单膝下跪！丨国剧盛典,2024-09-02 09:37,3754,429,机智的喜鹊yO,机智的喜鹊yO,,https://toutiao.com/group/7409977496797610511/,,0,0
<辰龙>苦命人，生于阴历这两个月“命最薄”，是生来还债的！,2024-08-06 10:07,793,189,大海,大海,【财气贴】[您是财星眷顾之人！大财到您家，点赞评论“接财气到我家”，今晚开始您必将财气满家门！福寿双全]一说到生肖龙，大伙儿心里头那可是威风凛凛、腾云驾雾的劲儿。但今儿个咱们得聊聊，那辰龙里头，阴历哪俩月生的，说是“命最薄”，仿佛生来就带着还债的使命。,https://toutiao.com/group/7399965943029350927/,,0,0
怪不得女生喜欢养大型犬，快来看大狗的好处，难怪抵挡不住,2024-09-09 17:23,921,126,拉链视频,拉链视频,,https://toutiao.com/group/7412307461060690443/,,0,0
中国再破世界第一！化学合成粮食即将量产，不用种地粮食自由了,2024-09-09 06:34,1991,1143,灵巧远山pLl,灵巧远山pLl,中国再破世界第一！化学合成粮食即将量产，不用种地粮食自由了,https://toutiao.com/group/7412528119040606739/,,0,0
