title,publish_time,like_count,comment_count,media_name,source,abstract,article_url,tag,is_yaowen,article_sub_type
男子鼓楼拍照时女生误入镜头，一眼心动后全网寻人，本尊在线回应,2024-08-06 14:17,7564,1548,一道Talk,一道Talk,“缘分到了真是挡也挡不住”！要说这两天全网最焦急的人，莫过于那个在鼓楼全网寻人的小哥哥了。而事情的起因，只是因为一次偶然相遇，缘分使然的互动，把两颗心莫名的牵在了一起。8月3日，原本只是普通且平凡的一天，这个小哥哥来到了北京旅游。,https://toutiao.com/group/7399993701898797580/,,0,0
沈阳街头女子脚踹男子并扇脸，男子没还手，警察介入，评论区炸锅,2024-09-05 03:28,498,819,简单柳叶cn1,简单柳叶cn1,▶近日，辽宁沈阳街头一对男女起争执，引发关注。9月5日，从网友拍摄的视频中看到，一穿着红色上衣的女子怒气十足，“啪”的一下给了男子一耳光，打完之后，嘴里质问道：”为什么要走啊，走啊”，说着用踹了男子一下。嘴里一直嚷着：走啊，走。,https://toutiao.com/group/7410987856480436747/,,0,0
退伍小伙女友身穿红色吊带裙接机 两人爱情却不被网友看好为哪般,2024-09-05 05:47,1050,3186,想游泳的小蚂蚱,想游泳的小蚂蚱,#秋日生活打卡季#又是一年退伍军人退役时，不少退役军人的亲人、爱人、恋人纷纷到车站、机场接机，给广大网友狠狠的秀了一波恩爱，但其中一对恋人在成都东站接机视频、照片引发广大网友关注。不少网友留言并不看好这对情侣，评论区出现大量不和谐的声音，具体来看。,https://toutiao.com/group/7411029628812395043/,,0,0
突发！河南省一周接连五只“大老虎”被查 都是手握重权 位高权重！,2024-09-08 07:50,822,178,小西说事199回复,小西说事199回复,突发！河南省一周接连五只“大老虎”被查 都是手握重权 位高权重！《点击观看视频》背景介绍最近河南刮起了一阵反腐风暴，五天之内五名厅级干部相继落马，这事儿搁谁那儿都得感慨一句，这是得多大的决心啊！古人云：“上梁不正下梁歪。,https://toutiao.com/group/7412175179696128563/,,0,0
他活埋近5000名红军，却逃到国外安享晚年，如今竟然还有人歌颂他,2024-09-03 08:16,2827,102,通政司知事,通政司知事,他活埋近5000名红军，却逃到国外安享晚年，如今竟然还有人歌颂他,https://toutiao.com/group/7410327673664176649/,,0,0
乌克兰，这就太不地道了,2024-09-05 07:32,4042,769,牛弹琴,牛弹琴,这样的乌克兰大使，在公然侮辱中韩等亚洲国家,https://toutiao.com/group/7411058554175488548/,,0,0
荷兰还是下手了,2024-09-07 07:56,1922,118,牛弹琴,牛弹琴,荷兰还是下手了，但没有提到中国,https://toutiao.com/group/7411807103123554870/,,0,0
认怂了！青岛警方再发通报，路虎女道歉赔偿，悔不当初，小伙赢了,2024-09-07 11:45,624,210,热心橘子1pLxU,热心橘子1pLxU,,https://toutiao.com/group/7411865957615796746/,,0,0
国足球员刘洋离开国家队,2024-09-08 07:09,163,608,大河报,大河报,9月7日晚，中国男足赴大连市梭鱼湾球场外场进行回国后的第2次室外训练。不过，现年29岁的球队主力左后卫刘洋却没有现身训练场。北京青年报记者获悉，因左脚脚踝旧伤复发，刘洋已于7日离开国足，返回济南接受进一步治疗。这样的话，李磊将大概率取代刘洋在10日中、沙比赛中出任国足主力左后卫。,https://news.dahebao.cn/dahe/appcommunity/2084224?newsId=2084224,,0,0
广西东城小学刘伟民妈妈火了！班级群里见谁怼谁，只是可怜了孩子,2024-09-07 09:37,119,239,第三方观察员,第三方观察员,广西东城小学刘伟民妈妈火了！班级群里见谁怼谁，只是可怜了孩子要说当爸妈的，哪个不心疼自家孩子？可有时候，关心则乱，这事儿在广西玉林市东成小学的家长群里就演了一出“炸锅”戏。说白了，事情并不大，但愣是被家长刘某搞得风风火火，成了一场不小的风波。,https://toutiao.com/group/7411831086952563211/,,0,0
劲爆！前助理曝沫沫被抓细节，晚上被堵在酒店，分手费开价300万,2024-09-07 12:37,243,260,易来时刻,易来时刻,9月7日，【沫沫被抓】事件仍在发酵，不断有知情人跳出来曝光细节，事情的真相也渐渐浮出了水面。前几天，外界一直很同情沫沫，觉得三只羊的资本这么雄厚，却欺负一个单纯的小姑娘，实在不应该。,https://toutiao.com/group/7411875500550930979/,,0,0
